[
    {
        "company": "KK Software Associates",
        "job_title": "Microsoft Dynamics CRM Architect",
        "location": "Houston, TX, USA",
        "full_location": {
            "city": "Houston",
            "state": "TX",
            "country": "USA"
        },
        "job_details": {
            "employment_type": [
                "contract"
            ],
            "job_code": "",
            "experience_required": "8+ years",
            "degree_required": "Bachelor of Engineering",
            "visa_sponsorship": "",
            "notice_period": "",
            "duration": "",
            "rate": ""
        },
        "skills": {
            "core": [
                "Microsoft Dynamics CRM",
                "C#",
                ".NET",
                "Azure",
                "SQL Server",
                "JavaScript",
                "HTML",
                "CSS"
            ],
            "primary": [
                "Microsoft Dynamics CRM",
                "Solution and Design"
            ],
            "secondary": [
                "Agile",
                "BDD",
                "Kimball methodology"
            ],
            "all": [
                "Microsoft Dynamics CRM",
                "C#",
                ".NET",
                "customizing Dynamics CRM",
                "SDK",
                "plugins",
                "workflows",
                "web resources",
                "custom-developed solutions",
                "Cloud technology",
                "Azure",
                "SQL Server",
                "JavaScript",
                "HTML",
                "CSS",
                "Kimball methodology",
                "presentation skills",
                "communication skills",
                "organizational skills",
                "agile project experience",
                "BDD concepts"
            ],
            "with_experience": [
                "Microsoft Dynamics CRM",
                "C#",
                ".NET"
            ]
        },
        "job_type": [
            "onsite"
        ],
        "contact_person": "Sushant Kumar",
        "email": "sushant.s@kksoftwareassociates.com",
        "jd": "Role: Microsoft Dynamics CRM Expertise with Solution and Design\nLocation :: Houston, TX\nContract\nDay 1 Onsite 5 Days/week\nWho are we looking for? 8 + Yrs. Microsoft Dynamics CRM Architect with C#. Net Experience with Solution and Design Experience\nTechnical Skills: Proficiency in Microsoft technologies such as C#, .NET. Experience with customizing Dynamics CRM using SDK, plugins, workflows, web resources, and custom-developed solutions. Experience on Cloud technology like Azure. Familiarity with SQL Server. Should have hands-on experience on JavaScript, HTML, CSS. Good to have knowledge on Kimball methodology. Excellent presentation, communication, and organizational skills. Ability to work in a fast-paced environment. Ability to work both independently and as part of a team. Understand the data needs of the company or client. Collaborate with the stakeholders to design and build the model. Understand the company\u2019s data solution or product needs.\nProcess Skills: Experience with Agile projects. Experience on BDD concepts.",
        "emp_type": [
            "contract"
        ],
        "source": "Email",
        "date_posted": "2024-09-30 12:43:04-05:00",
        "unique_id": "19244076fbcfa316",
        "tag": ".NET Dev"
    }
]