[
    {
        "company": "vySystems",
        "job_title": "Windows System Engineer OR Windows Admin",
        "location": "Atlanta, GA, USA",
        "full_location": {
            "city": "Atlanta",
            "state": "GA",
            "country": "USA"
        },
        "job_details": {
            "employment_type": [
                "hybrid"
            ],
            "job_code": "",
            "experience_required": "12+ years",
            "degree_required": "",
            "visa_sponsorship": "",
            "notice_period": "",
            "duration": "",
            "rate": ""
        },
        "skills": {
            "core": [
                "Azure Virtual Desktop",
                "W365 Cloud PC",
                "Intune"
            ],
            "primary": [
                "Microsoft Azure Virtual Desktop",
                "W365 cloud PC",
                "Azure Network",
                "AZURE AVD host pool & workspaces",
                "AVD session hosts",
                "FSLogix profile management",
                "Azure IaaS",
                "Azure Premium File Share",
                "Azure NetApp files",
                "Azure Monitor",
                "Log Analytics",
                "Diagnostics",
                "PowerShell",
                "ARM Templates",
                "Bicep"
            ],
            "secondary": [
                "Security hardening of VDI infrastructure",
                "ITIL Process",
                "ServiceNow"
            ],
            "all": [
                "Azure Virtual Desktop",
                "W365 Cloud PC",
                "Intune",
                "Microsoft Azure Virtual Desktop",
                "W365 cloud PC",
                "Azure Network",
                "AZURE AVD host pool & workspaces",
                "AVD session hosts",
                "FSLogix profile management",
                "Azure IaaS",
                "Azure Premium File Share",
                "Azure NetApp files",
                "Azure Monitor",
                "Log Analytics",
                "Diagnostics",
                "PowerShell",
                "ARM Templates",
                "Bicep",
                "Security hardening of VDI infrastructure",
                "ITIL Process",
                "ServiceNow"
            ],
            "with_experience": [
                "Azure Virtual Desktop",
                "W365 Cloud PC",
                "Intune",
                "Microsoft Azure Virtual Desktop",
                "W365 cloud PC",
                "Azure Network",
                "AZURE AVD host pool & workspaces",
                "AVD session hosts",
                "FSLogix profile management",
                "Azure IaaS",
                "Azure Premium File Share",
                "Azure NetApp files",
                "Azure Monitor",
                "Log Analytics",
                "Diagnostics",
                "PowerShell",
                "ARM Templates",
                "Bicep",
                "Security hardening of VDI infrastructure",
                "ITIL Process",
                "ServiceNow"
            ]
        },
        "job_type": [
            "hybrid"
        ],
        "contact_person": "Karthick Raja",
        "email": "karthick.raja@vysystems.com",
        "jd": "Top Qualifications: (12+ yrs needed) 1. Azure Virtual Desktop 2. W365 Cloud PC 3. Intune Qualifications: \u2022 At least 12+ years of experience in the field of Microsoft Azure Virtual Desktop and W365 cloud PC \u2022 Experience in Deploying and Managing W365 Cloud PC Azure Virtual Desktops in the Microsoft Azure Production Environment \u2022 Experience in configuring and managing provisioning policies \u2022 Experience is configuring Azure Network connection for W365 cloud PC \u2022 Excellent knowledge of the AZURE AVD host pool & workspaces. \u2022 Experience in configuring and managing AVD session hosts in production. \u2022 Efficient image management and centralized control. \u2022 Security hardening of VDI infrastructure as per regulatory guidelines and industry best practices. \u2022 Experience in configuring Azure Premium File Share and Azure NetApp files. \u2022 Experience in FSLogix profile management for AVD hosts on Azure files and NetApp. \u2022 Experience on Azure IaaS. \u2022 Experience in configuring and managing Autoscale. \u2022 Experience in configuring and managing Azure Monitor, Log Analytics, and Diagnostics settings. \u2022 Good understanding of Azure Vnet, NSG, and firewall. \u2022 Troubleshoot virtual desktops, applications in a multi-cast domain environment. \u2022 Good Understanding of PowerShell, ARM Templates, Bicep, and other IaaC \u2022 Collaborate with operational counterparts to support and provide client opportunities for improvement via automation, etc. \u2022 Knowledge of ITIL Process and Service now & other ticketing tools.",
        "emp_type": [
            "hybrid"
        ],
        "source": "Email",
        "date_posted": "2024-09-30 17:04:24-05:00",
        "unique_id": "19244f62c64637ee",
        "tag": "Azure Data Engineer"
    }
]