[
    {
        "company": "Tanisha Systems",
        "job_title": ".Net Full Stack Developer/Lead .Net Developer",
        "location": "Chandler, AZ, USA",
        "full_location": {
            "city": "Chandler",
            "state": "AZ",
            "country": "USA"
        },
        "job_details": {
            "employment_type": [
                "contract"
            ],
            "job_code": "",
            "experience_required": "10+ years",
            "degree_required": "",
            "visa_sponsorship": "",
            "notice_period": "",
            "duration": "",
            "rate": ""
        },
        "skills": {
            "core": [
                ".Net",
                "Micro Services",
                "Angular",
                "Junit",
                "Selenium"
            ],
            "primary": [
                "C#.NET",
                "Kafka",
                "Data Modeling",
                "microservices development",
                "API enablement",
                "Mongo DB"
            ],
            "secondary": [
                "Java Script",
                "SOAP",
                "MQ Series",
                "Visual Studio",
                "SQL",
                "Apigee",
                "PCF",
                "AES"
            ],
            "all": [
                ".Net",
                "Micro Services",
                "Angular",
                "Junit",
                "Selenium",
                "C#.NET",
                "Kafka",
                "Data Modeling",
                "microservices development",
                "API enablement",
                "Mongo DB",
                "Java Script",
                "SOAP",
                "MQ Series",
                "Visual Studio",
                "SQL",
                "Apigee",
                "PCF",
                "AES"
            ],
            "with_experience": [
                "C#.NET",
                "Kafka",
                "Data Modeling",
                "microservices development",
                "API enablement",
                "Mongo DB"
            ]
        },
        "job_type": [
            "onsite"
        ],
        "contact_person": "Abhishek Yadav",
        "email": "abhishek.yadav@tanishasystems.com",
        "jd": "Hello, This is Abhishek Yadav from Tanisha Systems. I am hiring for below urgent role in Chandler, AZ. Here are the Job Details: - Title: .Net Full Stack Developer Location: Chandler, AZ Type- Contract Exp. 10 + Years Note- Please share only Lead profiles. Job description Responsibilities: Provide engineering guidance to other LOBs, help mentor senior engineers, and keep abreast with industry trends and issues. Collaborate with key partners such as Auto Lending Product Strategy & Delivery, Architecture, Engineering and Platform and application development teams in articulating current and future state of the Auto Lending technology landscape. Need to have working experience in system development methodology. Ability to utilize a thorough understanding of applicable technology, tools and existing designs. Analyzes highly complex business requirements and has the ability to write a complex functional system design to meet business requirements. Leads a team of and provides direction to less experienced analysts and developers on projects. Develop new documentation for departmental procedures, training and user guides. Assures quality, security, business continuation plan and compliance requirements are met and documented for supported area Required Qualifications, US: 7+ years of Engineering experience, or equivalent demonstrated through one or a combination of the following: work experience, training, military experience, education 7+ years of Software Engineering experience with C#.NET, Kafka and other languages 3+ years of Data Modeling experience 3+ years of microservices development experience and API enablement Experience in Mongo DB 5+ years of experience with full Software Development Life Cycle using Agile, Iterative and/or Waterfall methodologies. Must be strong in: .Net, Micro Services, Angular, Junit, Selenium Must be competent in: Java Script, SOAP, MQ Series, Visual Studio, SQL, Apigee, PCF, AES Strong verbal, written, and interpersonal communication skills Ability to multi-task in a fast-paced environment. Excellent analytical, decision-making and troubleshooting skills. Experience creating sizing or work estimates. Strong analytical skills with high attention to detail and accuracy Excellent verbal, written, and interpersonal communication skills Experience with database data modeling Experience in using source control tools Experience in working for Financial Services Companies (nice to have) Desired Qualifications: An industry-standard technology certification in .Net Strong verbal, written, and interpersonal communication skills Ability to multi-task in a fast-paced environment. Excellent analytical, decision-making and troubleshooting skills. Experience creating sizing or work estimates. Strong analytical skills with high attention to detail and accuracy Excellent verbal, written, and interpersonal communication skills Experience with schedulers like Autosys Experience with database data modeling Experience working on Linux Servers Experience in using source control tools Experience in working for Financial Services Companies.",
        "emp_type": [],
        "source": "Email",
        "date_posted": "2024-09-30 08:54:17-05:00",
        "unique_id": "192433584f41d218",
        "tag": ".NET Dev"
    }
]