[
    {
        "company": "Vyze Inc.",
        "job_title": "ETL Informatica IICS Developer",
        "location": "Frisco, TX, USA",
        "full_location": {
            "city": "Frisco",
            "state": "TX",
            "country": "USA"
        },
        "job_details": {
            "employment_type": [
                "full-time",
                "contract"
            ],
            "job_code": "",
            "experience_required": "7 years",
            "degree_required": "Bachelor's Degree in Computer Science, Engineering or in a Technology related field",
            "visa_sponsorship": "No H1B",
            "notice_period": "",
            "duration": "",
            "rate": ""
        },
        "skills": {
            "core": [
                "Informatica Cloud",
                "CDI",
                "Snowflake",
                "SQL",
                "Python",
                "CICD"
            ],
            "primary": [
                "Informatica Cloud (IICS)",
                "Data Engineering"
            ],
            "secondary": [
                "Snowflake",
                "AWS",
                "Dataiku"
            ],
            "all": [
                "Informatica Cloud",
                "CDI",
                "Snowflake",
                "SQL",
                "Python",
                "CICD",
                "Jenkins",
                "AWS cloud technologies",
                "data profiling",
                "data quality",
                "data catalog tools",
                "automated data solutions",
                "agile methodologies",
                "data security",
                "auditing processes"
            ],
            "with_experience": [
                "Informatica Cloud",
                "Data Engineering",
                "CICD",
                "Snowflake"
            ]
        },
        "job_type": [
            "hybrid"
        ],
        "contact_person": "Rajeev",
        "email": "rajeeve@vyzeinc.com",
        "jd": "From: Rajeev, Vyzeinc rajeev@vyzeinc.com Reply to: rajeev@vyzeinc.com Title: ETL Informatica IICS Developer Location: Hybrid (Frisco, TX) Visa: No H1B, CPTBanking and finance exp is must Must have: Informatica Cloud, CDI, Snowflake, SQL, python, CICD and working with internal/external tech teams. Required : Bachelor's Degree from an accredited university in Computer Science, Engineering or in a Technology related field, OR equivalent through a combination of education and/or technology experience, OR 12 years of technology experience 7 years of experience identifying technical solutions for complex business problems, identifying the benefits and risks of the solutions and providing recommendations 7 years of experience in Technology, Data Engineering field in architecting, developing end-to-end scalable data applications and data pipelines; work with product manager and scrum masters and lead the team in assisting the story creations and sprint deliverables 7 years of experience leading and developing automated Informatica data pipelines with at least 4 years Informatica cloud (IICS) and relevant knowledge in data profiling, data quality, catalog tools 7 years of experience working in enterprise data warehouse solutions and platforms, and working knowledge of different databases (e.g., RDBMS, Snowflake), S3 Datalake, CICD, Jenkins and AWS cloud technologies 5 years of experience designing, implementing automated data solutions using Snowflake lakehouse; building workflows, developing, and scheduling ETL processes using programming SQL or Python 5 years of experience mentoring another technologist 5 years of experience implementing data solutions by adopting, recommending and improving CICD, change management, data security, auditing processes 4 years of experience working with software engineering best practices across the development lifecycle, including agile methodologies, coding standards, code reviews, source management, build processes and testing AWS or Informatica or Snowflake certification is preferred Experience with Dataiku is a plus. Regards, Rajeev | Vyze Inc.25179 Methley Plum Place, Aldie, VA 20105 \u2706: \u2706: +1- 7038842727 | Email: rajeev@vyzeinc.com",
        "emp_type": [
            "full-time",
            "contract"
        ],
        "source": "Email",
        "date_posted": "2024-09-30 08:01:25-05:00",
        "unique_id": "19243054a338283c",
        "tag": "AWS Data Engineer"
    }
]