[
    {
        "company": "Vyzeinc",
        "job_title": "EXCEL VBA PYTHON DEVELOPER",
        "location": "Midtown, NY, USA",
        "full_location": {
            "city": "Midtown",
            "state": "NY",
            "country": "USA"
        },
        "job_details": {
            "employment_type": [
                "onsite"
            ],
            "job_code": "",
            "experience_required": "3/4 years",
            "degree_required": "",
            "visa_sponsorship": "",
            "notice_period": "",
            "duration": "6+ Months",
            "rate": ""
        },
        "skills": {
            "core": [
                "Python",
                "VBA",
                "Excel",
                "C#"
            ],
            "primary": [
                "Python",
                "VBA"
            ],
            "secondary": [
                "C#",
                "Excel"
            ],
            "all": [
                "Python",
                "VBA",
                "Excel",
                "C#",
                "SQL",
                "FX products",
                "communication skills"
            ],
            "with_experience": [
                "Python",
                "VBA"
            ]
        },
        "job_type": [
            "onsite"
        ],
        "contact_person": "Aditya Tiwari",
        "email": "aditya.tiwari@vyzeinc.com",
        "jd": "Job Title: EXCEL VBA PYTHON DEVELOPER\nLocation : Onsite 4 days per week NY( Midtown)\nDuration : 6+ Months\nPv Update - Only Local candidates be consider for this role \n1ST ROUND Technical coding test on Python and SQL and then a video/in-person interview\nJob Description \n1. Understanding key business requirements of FX, Rates Vanilla and Exotic Products desks. If person knows FX they are likely to know Rate Vanilla \n2. Taking part in the development of new tools and industrialization/enhancement of the current ones, following commando standards. Using mainly C# or python for the backend and Excel for the front end such as contribution, pricing, risk & pnl spreadsheets..\n3. Supporting trading tools (mainly in Excel/VBA and python \n4. Maintaining a strong working relationship with the trading \n5. Working within team of commandos \n6. 3/4 years of experience as a Front Office developer and working directly with traders SPECIAL ROLE REQUIREMENTS: Good communication skills and able to support Front Office users. Reactivity and autonomy\nAdditional: They must have functional knowledge FX products (forwards/outright, swaps, settlement dates, NDF versus FX forward etc, and knowledge of the G10 and emerging market currencies) They must have functional knowledge of how FX traders do FX trading They must have functional knowledge of How the trade executes.",
        "emp_type": [
            "onsite"
        ],
        "source": "Email",
        "date_posted": "2024-09-30 10:55:38-05:00",
        "unique_id": "19243c4e971a2a39",
        "tag": "Python Dev"
    }
]