[
    {
        "company": "Yochana IT Solutions",
        "job_title": "Sr. AI Engineer",
        "location": "Dallas TX, USA",
        "full_location": {
            "city": "Dallas",
            "state": "TX",
            "country": "USA"
        },
        "job_details": {
            "employment_type": [
                "Contract"
            ],
            "job_code": "",
            "experience_required": "8-10 years",
            "degree_required": "Graduate or Doctorate in information technology, Neuroscience, Business Informatics, Biomedical Engineering, Computer Science, Artificial Intelligence, or a related field",
            "visa_sponsorship": "",
            "notice_period": "",
            "duration": "",
            "rate": ""
        },
        "skills": {
            "core": [
                "Natural Language Processing",
                "Data Science",
                "AI",
                "Machine Learning",
                "Generative AI",
                "Large Language Models"
            ],
            "primary": [
                "Python",
                "Cloud Computing",
                "UNIX/Linux"
            ],
            "secondary": [
                "TensorFlow",
                "PyTorch",
                "Kubernetes",
                "REST API"
            ],
            "all": [
                "Natural Language Processing",
                "Data Science",
                "AI",
                "Machine Learning",
                "Generative AI",
                "Large Language Models",
                "Python",
                "Cloud Computing",
                "UNIX/Linux",
                "TensorFlow",
                "PyTorch",
                "Kubernetes",
                "REST API"
            ],
            "with_experience": [
                "Large Language Models",
                "Application Development with LLMs",
                "Cloud Computing Expertise",
                "Technical Proficiency",
                "Programming and ML Skills",
                "Advanced AI Skills and Testing"
            ]
        },
        "job_type": [
            "remote"
        ],
        "contact_person": "Farook Shaik",
        "email": "farook@yochana.com",
        "jd": "Position:- Sr. AI Engineer Location:- Dallas TX (Remote) Hiring Mode: Contract Roles and Responsibilities: Educational Qualifications: Graduate or Doctorate degree in information technology, Neuroscience, Business Informatics, Biomedical Engineering, Computer Science, Artificial Intelligence, or a related field. Specialization in Natural Language Processing is preferred. Experience Requirements: 8-10 years of experience in developing Data Science, AI, and ML solutions, with a specific focus on generative AI and LLMs in the MedTech/Healthcare/Life Sciences domain. Prior experience in identifying new opportunities to optimize the business through analytics, AI/ML and use case prioritization. The individual should be a thought leader having a well-balanced analytical business acumen, domain, and technical expertise. Large Language Model Expertise: Experience in working with and fine-tuning Large Language Models (LLMs), including the design, optimization of NLP systems, frameworks, and tools. Application Development with LLMs: Experience in building scalable applications using LLMs, utilizing frameworks such as LangChain, LlamaIndex, etc. and productionizing machine learning and AI models. Language Model Development: Utilize off-the-shelf LLM services, such as Azure OpenAI, to integrate LLM capabilities into applications. Cloud Computing Expertise: Proven architect kind of experience in cloud computing, particularly with Azure Cloud Services. Technical Proficiency: Strong skills in UNIX/Linux environments and command-line tools. Programming and ML Skills: Proficiency in Python, with a deep understanding of machine learning algorithms, deep learning, and generative models. Advanced AI Skills and Testing: Familiarity with deep learning frameworks (e.g., TensorFlow, PyTorch), hands-on experience in deploying AI/ML solutions as a service/REST API on Cloud or Kubernetes, and proficiency in testing of developed AI components. Responsibilities also include data analysis/preprocessing for training and fine-tuning language models.",
        "source": "Email",
        "date_posted": "2024-09-30 15:24:43-05:00",
        "unique_id": "192449aeeef228f0",
        "tag": "Python Dev"
    }
]