[
    {
        "company": "ITech US Inc.",
        "job_title": "Scrum Master",
        "location": "Jersey City, NJ, USA",
        "full_location": {
            "city": "Jersey City",
            "state": "NJ",
            "country": "USA"
        },
        "job_details": {
            "employment_type": [
                "contract"
            ],
            "job_code": "",
            "experience_required": "10+ Years",
            "degree_required": "At least a bachelor\u2019s degree (or equivalent experience) in Computer Science, Software/Electronics Engineering, Information Systems, or a closely related field",
            "visa_sponsorship": "H1B",
            "notice_period": "",
            "duration": "12+ months",
            "rate": ""
        },
        "skills": {
            "core": [
                "Scrum Master Certification"
            ],
            "primary": [
                "Agile Way of Working",
                "Scrum Management"
            ],
            "secondary": [
                "TCS MasterCraft DevPlus"
            ],
            "all": [
                "Scrum Master Certification",
                "Agile Way of Working",
                "TCS MasterCraft DevPlus",
                "Scrum Management"
            ],
            "with_experience": []
        },
        "job_type": [
            "onsite"
        ],
        "contact_person": "Bandana Das",
        "email": "bandana.d@itechus.net",
        "jd": "Hi, Greetings, This is Bandana from ITech US Inc. Given below are the details of the position with one of our clients and was wondering if you would be interested or can recommend someone who would be interested in this job. Job Role: Scrum MasterJob Location: Jersey City, NJ (Need local ID Proof)Duration: 12+ months contractYears of experience: 10+ Years Onsite From Day 1Visa: H1B | Need passport number along with the submission Must have: Scrum Master Cirtification Competencies: Agile Way of Working, TCS MasterCraft DevPlus Scrum Management Education: At least a bachelor\u2019s degree (or equivalent experience) in Computer Science, Software/Electronics Engineering, Information Systems, or a closely related field is required for the project Thanks & RegardsBANDANA DAS",
        "emp_type": [
            "contract"
        ],
        "source": "Email",
        "date_posted": "2024-09-30 12:44:41-05:00",
        "unique_id": "19244087f8331c66",
        "tag": "BA/Scrum Master/PM"
    }
]