[
    {
        "company": "Tek Inspirations",
        "job_title": "Business Analyst (Healthcare)",
        "location": "Quincy, MA, USA",
        "full_location": {
            "city": "Quincy",
            "state": "MA",
            "country": "USA"
        },
        "job_details": {
            "employment_type": [
                "contract"
            ],
            "job_code": "",
            "experience_required": "Minimum of (3) three years of extensive experience",
            "degree_required": "Bachelor\u2019s degree in computer science, Information Systems, Business Administration, or a related field",
            "visa_sponsorship": "CITIZEN, GREEN CARD, GC EAD, H4 EAD, OPT EAD",
            "notice_period": "",
            "duration": "6 Months with a possible extension",
            "rate": "60/hr c2c"
        },
        "skills": {
            "core": [
                "knowledge of the principles of software development using the approved SDLC",
                "proficient knowledge of Jira",
                "Long Term Care Population",
                "Complex eligibility systems",
                "Unified processes"
            ],
            "primary": [
                "Proficiency in Microsoft 365",
                "Excel",
                "Word",
                "PowerPoint",
                "Access",
                "Visio"
            ],
            "secondary": [
                "knowledge of methods and techniques of computer systems analysis",
                "design",
                "technical terminology",
                "codes",
                "standard abbreviations"
            ],
            "all": [
                "knowledge of the principles of software development using the approved SDLC",
                "proficient knowledge of Jira",
                "Long Term Care Population",
                "Complex eligibility systems",
                "Unified processes",
                "Proficiency in Microsoft 365",
                "Excel",
                "Word",
                "PowerPoint",
                "Access",
                "Visio",
                "knowledge of methods and techniques of computer systems analysis",
                "design",
                "technical terminology",
                "codes",
                "standard abbreviations",
                "data structures",
                "application programming",
                "database development",
                "relational database theory",
                "ability to prepare flow charts",
                "diagrams",
                "Use Cases",
                "strong organizational skills",
                "problem-solving aptitude",
                "attention to detail",
                "ability to work with multiple vendors",
                "ability to manage multiple projects",
                "strong follow-through skills",
                "capacity to work collaboratively, collegially, and cooperatively"
            ],
            "with_experience": [
                "data structures",
                "application programming",
                "database development",
                "relational database theory"
            ]
        },
        "job_type": [
            "hybrid"
        ],
        "contact_person": "Pallavi Singh",
        "email": "pallavi.singh@tekinspirations.com",
        "jd": "Job Description -Title: Business Analyst (Healthcare)Location: Quincy, MA/HybridDuration: 6 Months with a possible extensionLocal Only from MA, NH or RI and must have recent client experience from these locationsInterview Mode: In-Person Interview(F2F Interview) Rate: 60/hr c2c CITIZEN,GREEN CARD,GC EAD,H4 EAD,OPT EAD2-3 days onsite every week37.5 Hours work week paidMinimum Requirements:Knowledge of the principles of software development using the approved SDLC.Proficient knowledge of Jira, Long Term Care Population, Complex eligibility systems, and Unified processes.Proficiency in Microsoft 365, Excel, Word, PowerPoint, Access, and Visio.Knowledge of methods and techniques of computer systems analysis, design, technical terminology, codes, and standard abbreviations.Experience with one or more of the following: data structures, application programming, database development, or relational database theory and technology.Ability to prepare flow charts, diagrams, and Use Cases.Deliver oral and written instructions in a precise, understandable manner.Prepare required deliverables in accordance with established procedures.Strong organizational skills with the ability to maintain accurate records and status reporting.Ability to understand and apply the policies, procedures, specifications, standards, and guidelines governing assigned unit activities.Knowledge of MA HIX or other State Health Exchange.Ability to work with multiple vendors.Strong organizational skills, problem-solving aptitude, and attention to detail.Ability to work well with others in a fast fast-paced, dynamic environment.Strong initiative and ability to manage multiple projects, as well as strong follow-through skills.Must be able to work collaboratively, collegially, and cooperatively with others in an environment where deliverables are potentially dependent on the output of others. Education and Certifications:Bachelor\u2019s degree in computer science, Information Systems, Business Administration, or a related field.Minimum of (3) three years of extensive experience with project management as a Senior Business Analyst of a large-scale application.Minimum of (3) years of experience in working in all phases of the Software Development Life Cycle (SDLC), including postproduction verification.Prior Government or healthcare experience desired.",
        "source": "Email",
        "date_posted": "2024-09-30 08:57:41-05:00",
        "unique_id": "19243389cfcc696b",
        "tag": "BA/Scrum Master/PM"
    }
]