[
    {
        "company": "Smart Source Technologies",
        "job_title": "OCM Business Analyst",
        "location": "Foster city, CA, USA",
        "full_location": {
            "city": "Foster city",
            "state": "CA",
            "country": "USA"
        },
        "job_details": {
            "employment_type": [
                "C2C"
            ],
            "job_code": "",
            "experience_required": "5+ years",
            "degree_required": "BA or BS",
            "visa_sponsorship": "",
            "notice_period": "",
            "duration": "",
            "rate": "$60/h"
        },
        "skills": {
            "core": [
                "Organizational Change Management",
                "GxP documentation",
                "change management experience",
                "SAP"
            ],
            "primary": [
                "Business Analyst",
                "change management principles",
                "project management"
            ],
            "secondary": [
                "systems deployment",
                "implementation",
                "lifecycle management"
            ],
            "all": [
                "Organizational Change Management",
                "GxP documentation",
                "change management experience",
                "SAP",
                "Business Analyst",
                "change management principles",
                "project management",
                "systems deployment",
                "implementation",
                "lifecycle management",
                "Change Management Certification"
            ],
            "with_experience": [
                "change management role",
                "large-scale organizational change efforts",
                "large scale SAP Implementations"
            ]
        },
        "job_type": [
            "hybrid"
        ],
        "contact_person": "Salil",
        "email": "salil.s@smartsourcetec.com",
        "jd": "Role :- OCM Business Analyst Location :- Foster city, CA \u2013 Hybrid Rate- $60/h on C2C Must Share Passport Number. Must have \u2013 The ideal candidate will have a strong understanding of Organizational Change Management principles and possess GxP documentation skill too. We are seeking a Business Analyst with a background in the pharmaceutical industry to join our dynamic team. Need hands on change management experience with SAP. NEED BELOW 6 YRS PROFILE Requirements: 5+ years of experience in change management role in the life sciences and/healthcare or biopharma, industry preferred Experience with large-scale organizational change efforts Experience with large scale SAP Implementations A solid understanding of how people go through the change process Experience and knowledge of change management principles, methodologies and tools Experience in systems deployment, implementation, and lifecycle management, Change Management Certification is preferred (PROSCI, CCMP) BA or BS required, degree in business management/science/social science/engineering or IT Strong project management or Organizational effectiveness experience Ability to balance multiple priorities in a fast-paced environment while delivering on-time, high quality results.",
        "emp_type": [
            "C2C"
        ],
        "source": "Email",
        "date_posted": "2024-09-30 14:12:51-05:00",
        "unique_id": "192445921934edf1",
        "tag": "BA/Scrum Master/PM"
    }
]