[
    {
        "company": "VBeyond Corp",
        "job_title": "Sr. Oracle PL/SQL Developer",
        "location": "Chicago, IL, USA",
        "full_location": {
            "city": "Chicago",
            "state": "IL",
            "country": "USA"
        },
        "job_details": {
            "employment_type": [
                "contract"
            ],
            "job_code": "",
            "experience_required": "10+ years",
            "degree_required": "",
            "visa_sponsorship": "",
            "notice_period": "",
            "duration": "Long contract",
            "rate": ""
        },
        "skills": {
            "core": [
                "Oracle SQL",
                "PL/SQL",
                "Unix shell scripting",
                "Control-M",
                "cloud technologies",
                "Agile development methodologies"
            ],
            "primary": [
                "PL/SQL",
                "Oracle SQL",
                "Unix shell scripting"
            ],
            "secondary": [
                "Control-M",
                "cloud technologies",
                "Agile development methodologies"
            ],
            "all": [
                "Oracle SQL",
                "PL/SQL",
                "Unix shell scripting",
                "Control-M",
                "cloud technologies",
                "Agile development methodologies",
                "analytical skills",
                "problem-solving skills",
                "performance tuning",
                "database security",
                "optimization techniques",
                "teamwork",
                "communication skills"
            ],
            "with_experience": [
                "Oracle SQL",
                "PL/SQL",
                "Unix shell scripting"
            ]
        },
        "job_type": [
            "onsite"
        ],
        "contact_person": "Vaibhav Kumar",
        "email": "vaibhavk@vbeyond.com",
        "jd": "Hi, Please go through the JD and revert me your interest in the same :-Position:- Sr. Oracle PL/SQL Developer Location:- Chicago, IL (Onsite) Duration:- Long contract Looking for senior local consultant who is local to IL and have around 10+ year of experience and is ok for onsite role and have strong experience in PL/SQL Responsibility:- Total 10+ years of experience in Oracle SQL and PL/SQL development. Proficiency in writing complex queries and stored procedures. Experience in Unix shell scripting. Familiarity with job scheduling tools like Control-M (or similar). Strong analytical and problem-solving skills with a focus on performance tuning. Understanding of database security and optimization techniques. Ability to work independently and within a team environment. Excellent verbal and written communication skills. Experience in cloud technologies. Knowledge of Agile development methodologies.",
        "emp_type": [
            "contract"
        ],
        "source": "Email",
        "date_posted": "2024-09-30 13:38:31-05:00",
        "unique_id": "1924439b204e136c",
        "tag": "Oracle DBA"
    }
]