[
    {
        "company": "Allied Business Consulting",
        "job_title": "Project Coordinator",
        "location": "Los Angeles, CA, USA",
        "full_location": {
            "city": "Los Angeles",
            "state": "CA",
            "country": "USA"
        },
        "job_details": {
            "employment_type": [],
            "job_code": "",
            "experience_required": "",
            "degree_required": "",
            "visa_sponsorship": "",
            "notice_period": "",
            "duration": "",
            "rate": ""
        },
        "skills": {
            "core": [
                "Communication",
                "Documentation",
                "Task management",
                "Budget tracking",
                "Quality assurance",
                "Team support",
                "Problem-solving",
                "Continuous improvement"
            ],
            "primary": [],
            "secondary": [],
            "all": [
                "Communication",
                "Documentation",
                "Task management",
                "Budget tracking",
                "Quality assurance",
                "Team support",
                "Problem-solving",
                "Continuous improvement"
            ],
            "with_experience": []
        },
        "job_type": [],
        "contact_person": "alka",
        "email": "alka@abcinc-us.com",
        "jd": "From: alka, Allied Business Consulting alka@abcinc-us.com Reply to: alka@abcinc-us.com Job Title: Project CoordinatorClient: Los Angeles Unified School District - LAUSDLocation: Los Angeles, CAResponsibilities:\u2022 Communication: Facilitating effective communication between team members, stakeholders, and clients, and providing regular updates on project progress.\u2022 Documentation: Maintaining project documentation, including meeting minutes, project files, and reports, to ensure clear and accurate records.\u2022 Task management: Tracking project tasks, deadlines, and deliverables to ensure they are completed on time and according to requirements.\u2022 Budget tracking: Monitoring project expenses and resources\u2022 Quality assurance: Assisting in ensuring that project deliverables meet quality standards and client expectations.\u2022 Team support: Providing administrative support to the project team, such as scheduling meetings, and coordinating logistics.\u2022 Problem-solving: Assisting in resolving issues and conflicts that arise during the project\u2022 Continuous improvement: Contributing suggestions and ideas to improve project management processes and methodologies.",
        "emp_type": [],
        "source": "Email",
        "date_posted": "2024-09-30 10:49:26-05:00",
        "unique_id": "19243a1b0550589e",
        "tag": "BA/Scrum Master/PM"
    }
]