[
    {
        "company": "WinOrbit",
        "job_title": "Backend Software Engineer",
        "location": "Phoenix, AZ, USA",
        "full_location": {
            "city": "Phoenix",
            "state": "AZ",
            "country": "USA"
        },
        "job_details": {
            "employment_type": [
                "contract",
                "hybrid"
            ],
            "job_code": "",
            "experience_required": "6+ Months",
            "degree_required": "",
            "visa_sponsorship": "USC only",
            "notice_period": "",
            "duration": "6+ Months",
            "rate": ""
        },
        "skills": {
            "core": [
                "Java 17+",
                "Kotlin",
                "Vert.x",
                "Quarkus",
                "Micronaut",
                "Spring Boot",
                "Kafka",
                "PostgreSQL"
            ],
            "primary": [
                "reactive programming",
                "microservices",
                "event driven architecture",
                "asynchronous API design"
            ],
            "secondary": [
                "cloud-based architecture",
                "distributed systems"
            ],
            "all": [
                "Java 17+",
                "Kotlin",
                "Vert.x",
                "Quarkus",
                "Micronaut",
                "Spring Boot",
                "Kafka",
                "PostgreSQL",
                "reactive programming",
                "microservices",
                "event driven architecture",
                "asynchronous API design",
                "cloud-based architecture",
                "distributed systems"
            ],
            "with_experience": [
                "reactive programming",
                "microservices",
                "event driven architecture"
            ]
        },
        "job_type": [
            "hybrid"
        ],
        "contact_person": "Sandeep",
        "email": "sandeep.s@winorbittech.com",
        "jd": "USC only Backend Software Engineer Location: Phoenix, AZ - This is a hybrid role in Phoenix and needs to be on site 3x\u2019s per week. Length: 6+ Months USC only Local Preferred (but not representation, only local DL will be considered) Must required active LinkedIn (150+ connections) & DL in submission. Notes: Experience in backend reactive programming languages: Java 17+ and/or Kotlin. \u2022 Proven record of accomplishment developing lightweight reactive microservices: Vert.x, Quarkus, Micronaut or Spring Boot. \u2022 Experience in backend reactive programming languages: Java 17+ and/or Kotlin. \u2022 Proven record of accomplishment developing lightweight reactive microservices: Vert.x, Quarkus, Micronaut or Spring Boot. \u2022 Experience of working with stakeholders and product owners to refine upcoming Epics. \u2022 Deep understanding of event driven architecture and messaging: Kafka, webhooks, asynchronous API design. \u2022 Experience with PostgreSQL or equivalent relational databases. \u2022 Have experience working as an individual contributor as part of a cross functional agile team. Experience in FinTech is a massive plus. \u2022 Have proven experience in supporting mission critical platforms with elevated levels of availability and service continuity. \u2022 Have solid experience in cloud-based architecture and distributed systems.",
        "emp_type": [
            "contract",
            "hybrid"
        ],
        "source": "Email",
        "date_posted": "2024-09-30 11:59:41-05:00",
        "unique_id": "192440c12b07bf22",
        "tag": "Java Dev"
    }
]