[
    {
        "company": "Nitya software solution",
        "job_title": "Web Architect",
        "location": "Hercules area SFO (Bay Area), USA",
        "full_location": {
            "city": "Hercules",
            "state": "California",
            "country": "USA"
        },
        "job_details": {
            "employment_type": [
                "contract"
            ],
            "job_code": "",
            "experience_required": "",
            "degree_required": "",
            "visa_sponsorship": "",
            "notice_period": "",
            "duration": "6 Months",
            "rate": ""
        },
        "skills": {
            "core": [
                "AWS Cloud Architect",
                "Data heavy application",
                "GitHub Actions"
            ],
            "primary": [
                "web architecture",
                "DevOps",
                " performance",
                "scalability",
                "security"
            ],
            "secondary": [
                "AWS deployments",
                "hosting",
                "Active Directory",
                "database management",
                "NoSQL",
                "RDBMS"
            ],
            "all": [
                "AWS Cloud Architect",
                "Data heavy application",
                "GitHub Actions",
                "web architecture",
                "DevOps",
                "performance",
                "scalability",
                "security",
                "AWS deployments",
                "hosting",
                "Active Directory",
                "database management",
                "NoSQL",
                "RDBMS"
            ],
            "with_experience": [
                "AWS Cloud Architect",
                "GitHub Actions"
            ]
        },
        "job_type": [
            "hybrid"
        ],
        "contact_person": "Nitya",
        "email": "ryan@nityainc.com",
        "jd": "From: Nitya, Nitya software solution ryan@nityainc.com Reply to: ryan@nityainc.com Position TitleWeb Architect Domain EXP (Healthcare Domain)LocationHercules area SFO (Bay Area) - HybridDuration6 MonthsMust Have Strong AWS Cloud Architect, Data heavy application, GitHub ActionsJob DescriptionWe need someone to define and develop a web architecture strategy/solution for a data analysis application. Create a scalable, high-performance web application that consumes and stores large amounts of data and serves large amounts of processed data. This is more of a DevOps/Architecture role that will focus on the performance, scalability, and security of the application in the AWS Cloud environment. Needs advanced working knowledge of GitHub Actions, AWS deployments and hosting, working with Active Directory, and database management (both NoSQL and RDBMS).",
        "emp_type": [
            "contract"
        ],
        "source": "Email",
        "date_posted": "2024-09-30 12:28:33-05:00",
        "unique_id": "19243fb234039398",
        "tag": "AWS Data Engineer"
    }
]