[
    {
        "company": "Talent Group Inc.",
        "job_title": "Infrastructure Project Manager",
        "location": "Colorado, USA",
        "full_location": {
            "city": "Colorado",
            "state": "",
            "country": "USA"
        },
        "job_details": {
            "employment_type": [
                "contract"
            ],
            "job_code": "",
            "experience_required": "",
            "degree_required": "",
            "visa_sponsorship": "",
            "notice_period": "",
            "duration": "Long Term",
            "rate": ""
        },
        "skills": {
            "core": [
                "project management",
                "risk management",
                "quality management",
                "change management",
                "communication"
            ],
            "primary": [
                "security audit",
                "stakeholder management",
                "leadership",
                "collaboration"
            ],
            "secondary": [
                "mentoring",
                "training",
                "coaching"
            ],
            "all": [
                "project management",
                "risk management",
                "quality management",
                "change management",
                "communication",
                "security audit",
                "stakeholder management",
                "leadership",
                "collaboration",
                "mentoring",
                "training",
                "coaching"
            ],
            "with_experience": []
        },
        "job_type": [
            "remote"
        ],
        "contact_person": "Yash Chandewar",
        "email": "yash.c@talentgroups.com",
        "jd": "Need candidates locals to CO Only Greetings,My name is Yash and I represent Talent Group Inc., a staff augmentation firm providing a wide-range of talent on-demand and total workforce solutions. We have excellent domain expertise in all verticals. Repositioning professionals is what we do, and we do it very well.I am reaching out to you today as your profile matches an immediate job opportunity we have with our premier client.Please take a look at the job description below and let me know your interest.Role : Infra Project ManagerLong Term ContractLocation : Colorado (Remote) The Project Manager will be responsible for planning, executing, and finalizing projects within defined timelines and allocated budgets. The Project Manager will also ensure that business and end users are consulted and their input is incorporated into the project. Key responsibilities include:Track and report on security audit findings and remediation progress to stakeholders and project teams.Responsible for assisting agency executive management, division directors, and information technology (IT) staff and leading project tasks, and resources, including State personnel and deliverables. Use appropriate project management tools, reports, templates, mentoring, training, and coaching to IT project teams. Work directly with agency staff, as well as vendors in fulfilling and carrying out the requirements of assigned IT projects. Utilize project management best practices, including risk management, quality management, change management, change control, and communication.Proactively manage changes in project scope, schedule, and cost. Manage by providing leadership, collaboration, supervision, training, guidance, and support to project team members on assigned projects. Lead the effort to ensure agency compliance with the State\u2019s project management policies and standards.Coordinates all related activities for cross-functional teamsCollaborates to develop and appropriately execute a change strategy, including stakeholder analysis, communication plans, and adoption plans.Manages relationships across OIT, customers, and vendors to develop a thorough understanding of core business functions and align projects with overall business objectives. Manages issues and proactively escalates critical issues for immediate resolution, effectively demonstrating decision-making.",
        "emp_type": [
            "contract"
        ],
        "source": "Email",
        "date_posted": "2024-09-30 13:19:43-05:00",
        "unique_id": "19244288157292c6",
        "tag": "BA/Scrum Master/PM"
    }
]