[
    {
        "company": "Nitya Software Solutions Inc.",
        "job_title": "Senior Platform Engineer",
        "location": "USA",
        "full_location": {
            "city": "",
            "state": "",
            "country": "USA"
        },
        "job_details": {
            "employment_type": [],
            "job_code": "",
            "experience_required": "At least 2 years of experience in cloud system administration and service design in AWS, At least 2 years of experience in management, troubleshooting, and support of Email Transport platforms, At least 2 year experience in scripting languages (Python, Powershell, Shell or JavaScript)",
            "degree_required": "High School Diploma, GED, or equivalent certification",
            "visa_sponsorship": "",
            "notice_period": "",
            "duration": "",
            "rate": ""
        },
        "skills": {
            "core": [
                "AWS services",
                "DevOps knowledge",
                "Email Transport platforms",
                "scripting languages"
            ],
            "primary": [
                "AWS",
                "Email Transport platforms"
            ],
            "secondary": [
                "Python",
                "Powershell",
                "Shell",
                "JavaScript"
            ],
            "all": [
                "AWS services",
                "DevOps knowledge",
                "Email Transport platforms",
                "scripting languages",
                "Python",
                "Powershell",
                "Shell",
                "JavaScript"
            ],
            "with_experience": [
                "cloud system administration",
                "service design in AWS",
                "management",
                "troubleshooting",
                "support"
            ]
        },
        "job_type": [],
        "contact_person": "Pallavi",
        "email": "rec1@nityainc.com",
        "jd": "Hi, Role: Senior Platform Engineer Responsibilities: Ownership of AWS services that require DevOps knowledge and production experience Design and support for Email Transport platforms (Rules/Policy Development, APIs, Mail Routing) Support of Cyber Teams and adherence to compliance initiatives Support and management of Corporate DMARC standards Testing of updates to end user email applications Work with business partners to identify technical and functional needs to satisfy internal customer requests Drive the evolution of standards and best practices for messaging services Basic Qualifications: High School Diploma, GED, or equivalent certification At least 2 years of experience in cloud system administration and service design in AWS At least 2 years of experience in management, troubleshooting, and support of Email Transport platforms At least 2 year experience in scripting languages (Python, Powershell, Shell or JavaScript)",
        "source": "Email",
        "date_posted": "2024-09-30 17:23:30-05:00",
        "unique_id": "1924507aaadd39f3",
        "tag": "AWS Data Engineer"
    }
]