[
    {
        "company": "Avance Consulting",
        "job_title": "Oracle DBA",
        "location": "Jacksonville, FL, USA",
        "full_location": {
            "city": "Jacksonville",
            "state": "FL",
            "country": "USA"
        },
        "job_details": {
            "employment_type": [],
            "job_code": "",
            "experience_required": "10+ years of production support experience as Oracle DBA with at least 6 years of strong experience on Exadata platform",
            "degree_required": "",
            "visa_sponsorship": "",
            "notice_period": "",
            "duration": "",
            "rate": ""
        },
        "skills": {
            "core": [
                "Oracle DBA",
                "Exadata",
                "RAC",
                "ASM",
                "Dataguard",
                "Infiniband switch",
                "storage cell",
                "database performance tuning",
                "Backup and recovery",
                "SQL",
                "database scripting",
                "automation technology",
                "shell scripting"
            ],
            "primary": [
                "Exadata specialist",
                "performance tuning",
                "backup and recovery"
            ],
            "secondary": [
                "Clusterware (GRID Infrastructure)",
                "Solaris",
                "Linux",
                "AIX OS"
            ],
            "all": [
                "Oracle DBA",
                "Exadata",
                "RAC",
                "ASM",
                "Dataguard",
                "Infiniband switch",
                "storage cell",
                "database performance tuning",
                "Backup and recovery",
                "SQL",
                "database scripting",
                "automation technology",
                "shell scripting",
                "high-performance database management",
                "production support",
                "database level performance tuning",
                "RMAN",
                "datapump",
                "export/import",
                "Oracle Enterprise Manager Grid Control",
                "24*7 Global support",
                "troubleshooting",
                "diagnostic skills",
                "analytical skills",
                "communication skills",
                "coordination skills",
                "Change/Release Management",
                "ITIL"
            ],
            "with_experience": []
        },
        "job_type": [
            "onsite"
        ],
        "contact_person": "Mudassir",
        "email": "mudassir.uddin@avanceservices.com",
        "jd": "Role \u2013 Oracle DBALocation \u2013 Jacksonville, FL (Onsite from day -1) Top-notch Exadata specialist Experience in RAC, ASM, Dataguard, Infiniband switch, storage cellExperience in Exadata health check, migration, resource management and patching/upgradeExpertise in database performance tuning Expertise in Backup and recovery Basic Requirement10+ years of production support experience as Oracle DBA with at least 6 years of strong experience on Exadata platformDemonstrable experience of managing high-performance, high-capacity databases in a critical production environment.Solid Oracle 11gR1/R2 RAC experience including build, general administration, troubleshooting (Break/Fix) and performance tuning skillsExperience in Clusterware (GRID Infrastructure) - CRS management and configuration Skilled in Oracle ASM and Data Guard administrationExpertise in SQL & Database Level performance tuning skills Expertise in backup and recovery and migration using RMAN, datapump and export/import.Experience in maintenance and management of databases using Oracle Enterprise Manager Grid Control.Experience on Solaris, Linux and AIX OS including strong shell scripting skills. Willingness to work in a 24*7 Global support model.Aid development teams for analyzing issues.Excellent troubleshooting, diagnostic & analytical skills.Excellent communication & coordination skills are required. Strong initiative and sense of ownership.Expert knowledge of database scripting and automation technologyExcellent written and verbal communicationsExperience working with offshore vendors Builds positive working relationships, works collaboratively with other team members, and is a team player.Experience in a large corporate environment Competent in Change/Release Management ( ITIL based \u2013 preferably ITIL Foundation Certified)",
        "emp_type": [],
        "source": "Email",
        "date_posted": "2024-09-30 11:07:48-05:00",
        "unique_id": "19243b2d4074bdc9",
        "tag": "Oracle DBA"
    }
]