[
    {
        "company": "iinfiniti",
        "job_title": "Business Analyst 5",
        "location": "Lansing Mi USA",
        "full_location": {
            "city": "Lansing",
            "state": "Mi",
            "country": "USA"
        },
        "job_details": {
            "employment_type": [],
            "job_code": "",
            "experience_required": "10+ years",
            "degree_required": "Bachelors Degree",
            "visa_sponsorship": "",
            "notice_period": "",
            "duration": "",
            "rate": ""
        },
        "skills": {
            "core": [
                "Communication and Interpersonal skills",
                "Organization and Prioritization skills"
            ],
            "primary": [
                "Microsoft Project",
                "Excel",
                "Remedy/Helix"
            ],
            "secondary": [
                "DevOPs",
                "Clarity",
                "Telecommunications"
            ],
            "all": [
                "Communication and Interpersonal skills",
                "Organization and Prioritization skills",
                "Microsoft Project",
                "Excel",
                "Remedy/Helix",
                "DevOPs",
                "Clarity",
                "Telecommunications",
                "WAN",
                "MLAN",
                "WLAN",
                "Security",
                "Voice",
                "Videoconferencing"
            ],
            "with_experience": [
                "Microsoft Project",
                "Excel",
                "Remedy/Helix",
                "DevOPs"
            ]
        },
        "job_type": [],
        "contact_person": "Heena Khan",
        "email": "heena@iinfiniti-solutions.com",
        "jd": "HiHope all doing great, Business Analyst 5Location Lansing Mi Only Local Dl local mustExperience : 10+ years Short Description: Receive, process, present data, and information regarding our weekly Service Requests (Infrastructure Service Requests). Responsible for gathering business and technical requirements during the client kick off meetings. Consult SMEs (Subject Matter Experts) on tasks required to complete integrated projects for all Telecommunication services, such as, WAN, WLAN, MLAN, Security, Contact/Call Centers, Telephony, and Video. Manage multiple projects based on Agency assignments. Complete Description: Facilitate meetings with clients to gather requirements for all IT solutions and to identify impacted business processes and determine best process and IT solution integration.Ability to obtain and report business and technical requirementsFacilitate review sessions to discuss projectsExcellent customer and communication service skillsWork with multiple network platforms, such as, WAN, MLAN, WLAN, Security, Voice, and VideoconferencingDisseminate information effectively to all technical teams, customers, and technical managersUnderstand a large (enterprise) and complex network environment Skills, Experience and Education: Bachelors Degree, RequiredOrganization and Prioritization skills are MandatoryCommunication and Interpersonal skills are MandatoryPrevious experience working with multiple agencies and/or vendors and/or departments in an enterprise environment are RequiredMinimum 1-3 years experience with Clarity is PreferredMinimum 3-5 years experience with Microsoft Project and Excel is RequiredMinimum 2-3 years experience with DevOPs is PreferredMinimum 3-5 years experience with Remedy/Helix is RequiredMinimum 3-5 years working within a Telecommunications environment is RequiredMinimum 3-5 years experience in a large Enterprise setting is RequiredMinimum 3-5 years work experience with multiple network platforms is RequiredMinimum 3-5 years working with multiple network lines of service is RequiredMinimum 5+ years dealing with customers is Required",
        "emp_type": [],
        "source": "Email",
        "date_posted": "2024-09-30 17:00:50-05:00",
        "unique_id": "19245145f287148e",
        "tag": "BA/Scrum Master/PM"
    }
]