[
    {
        "company": "ZealHire Inc",
        "job_title": "ETL Informatica Developer",
        "location": "Frisco, TX, USA",
        "full_location": {
            "city": "Frisco",
            "state": "TX",
            "country": "USA"
        },
        "job_details": {
            "employment_type": [
                "contract"
            ],
            "job_code": "",
            "experience_required": "11+ Years",
            "degree_required": "Bachelor's Degree from an accredited university in Computer Science, Engineering or in a Technology related field",
            "visa_sponsorship": "Only USC/GC",
            "notice_period": "",
            "duration": "Long-Term",
            "rate": ""
        },
        "skills": {
            "core": [
                "ETL Development",
                "Informatica PowerCenter",
                "IICS",
                "SQL",
                "Python",
                "AWS",
                "Snowflake",
                "CICD",
                "Data Engineering"
            ],
            "primary": [
                "Informatica PowerCenter",
                "SQL",
                "AWS",
                "Snowflake"
            ],
            "secondary": [
                "Dataiku"
            ],
            "all": [
                "ETL Development",
                "Informatica PowerCenter",
                "IICS",
                "SQL",
                "Python",
                "AWS",
                "Snowflake",
                "CICD",
                "Data Engineering",
                "Data Profiling",
                "Data Quality",
                "Catalog Tools"
            ],
            "with_experience": [
                "Informatica",
                "Snowflake",
                "AWS"
            ]
        },
        "job_type": [
            "hybrid"
        ],
        "contact_person": "Avinash Kumar",
        "email": "avinash@zealhire.com",
        "jd": "Position: ETL Informatica Developer with Strong Banking Experience Location: Frisco, TX - Hybrid (Locals to TX Only) Duration: Long-Term Contract Visa Status: Only USC/GC Desired Years of Experience: 11+ Years USC/GC need LinkedIn, VISA DL and skills matrix Resume must be under 5 pages Local to TX Qualification Metrics/Additional Skills (Required Skills) ETL Development Informatica PowerCenter, IICS, S3 Datalake CI/CD Pipeline AWS Snowflake Lakehouse SQL or Python Position Qualifications: Bachelor's Degree from an accredited university in Computer Science, Engineering or in a Technology related field, OR equivalent through a combination of education and/or technology experience, OR 12 years of technology experience 7 years of experience identifying technical solutions for complex business problems, identifying the benefits and risks of the solutions and providing recommendations 7 years of experience in Technology, Data Engineering field in architecting, developing end-to-end scalable data applications and data pipelines; work with product manager and scrum masters and lead the team in assisting the story creations and sprint deliverables 7 years of experience leading and developing automated Informatica data pipelines with at least 4 years of Informatica cloud (IICS) and relevant knowledge in data profiling, data quality, catalog tools 7 years of experience working in enterprise data warehouse solutions and platforms, and working knowledge of different databases (e.g., RDBMS, Snowflake), S3 Datalake, CICD, Jenkins and AWS cloud technologies 5 years of experience designing, implementing automated data solutions using Snowflake lakehouse; building workflows, developing, and scheduling ETL processes using programming SQL or Python 5 years of experience mentoring another technologist 5 years of experience implementing data solutions by adopting, recommending and improving CICD, change management, data security, auditing processes 4 years of experience working with software engineering best practices across the development lifecycle, including agile methodologies, coding standards, code reviews, source management, build processes and testing AWS or Informatica or Snowflake certification is preferred Experience with Dataiku is a plus.",
        "emp_type": [
            "contract"
        ],
        "source": "Email",
        "date_posted": "2024-09-30 09:19:48-05:00",
        "unique_id": "19243667e83b47d9",
        "tag": "AWS Data Engineer"
    }
]