[
    {
        "company": "HCL",
        "job_title": ".NET Developer",
        "location": "Atlanta, GA, USA",
        "full_location": {
            "city": "Atlanta",
            "state": "GA",
            "country": "USA"
        },
        "job_details": {
            "employment_type": [
                "third party"
            ],
            "job_code": "",
            "experience_required": "8+ years",
            "degree_required": "Not specified",
            "visa_sponsorship": "Must have existing work authorization",
            "notice_period": "Not specified",
            "duration": "Not specified",
            "rate": "Not specified"
        },
        "skills": {
            "core": [
                ".NET",
                "MS SQL Server",
                "Agile",
                "Jira",
                "ETL processes"
            ],
            "primary": [
                "multidimensional analysis",
                "data calculation",
                "aggregation techniques",
                "application integrations",
                "Google Docs",
                "Google Sheets",
                "Google Slides",
                "Google scripting"
            ],
            "secondary": [
                "Sales Performance Data",
                "SFDC",
                "WorkDay",
                "Varicent",
                "SPM application implementations",
                "OneStream",
                "Anaplan",
                "Sales Performance Management processes",
                "customer experience",
                "CSAT",
                "First Call Resolution",
                "incident management",
                "problem management",
                "Knowledge base management",
                "training",
                "coaching"
            ],
            "all": [
                ".NET",
                "MS SQL Server",
                "Agile",
                "Jira",
                "ETL processes",
                "multidimensional analysis",
                "data calculation",
                "aggregation techniques",
                "application integrations",
                "Google Docs",
                "Google Sheets",
                "Google Slides",
                "Google scripting",
                "Sales Performance Data",
                "SFDC",
                "WorkDay",
                "Varicent",
                "SPM application implementations",
                "OneStream",
                "Anaplan",
                "Sales Performance Management processes",
                "customer experience",
                "CSAT",
                "First Call Resolution",
                "incident management",
                "problem management",
                "Knowledge base management",
                "training",
                "coaching"
            ]
        },
        "job_type": [
            "onsite"
        ],
        "contact_person": "Kartik Mahajan",
        "email": "kartik.mahajan@gvrinfotek.com",
        "jd": "From: Kartik Mahajan, GVR Infotek kartik.mahajan@gvrinfotek.com Reply to: kartik.mahajan@gvrinfotek.com Job Title :.NET DeveloperLocation : Atlanta GA or Cary NC - Only localsVisa :H4-EAD , GC-EAD, GC & USCClient/IMP :HCL (please check with your candidate if he didn't submit with HCL within last 90 days)). Need passport number for all visas apart from USC.. 8+ years experience .NET 5+ years experience MS SQL Server database design and tuningExperience working with a team utilizing Agile and Jira Strong knowledge of ETL processes, multidimensional analysis, databases, data calculation, and aggregation techniques Strong understanding of application integrations - development, configuration, management (OneStream a plus) Experience with Googledocs, sheets, slides including Google scripting Organization and prioritization skills; ability to multitask in a dynamic environment Good analytic and debugging skills Great communication skills working in a global companyPreferred Job Skills3+ years experience with Sales Performance Data (SFDC, WorkDay, Varicent)3+ years SPM application implementations (OneStream or Anaplan a plus)Functional understanding of Sales Performance Management processes To adhere to quality standards, regulatory requirements and company policiesTo ensure positive customer experience and CSAT through First Call Resolution and minimum rejected resolutions or Reopen Cases To participate or contribute on EN business in creation of proposals to drive Service improvement plans. To independently resolve tickets and esnure that the agreed SLA of ticket volume and time are met for the team. To provide support for on call escalations orL3 level support and doing incident and problem management Work on value adding activities such Knowledge base update and management, Training freshers, coaching analysts and conducting interviewsorparticipation in hiring drives Thanks & Regards, Kartik MahajanIT RecruiterGVR Infotek LLC: 13573 Tabasco Cat Trail, Frisco, TX 75035",
        "source": "Email",
        "date_posted": "2024-10-10 15:43:10-05:00",
        "unique_id": "192784c988ee41a7",
        "emp_type": [
            "third party"
        ],
        "tag": ".net developer"
    }
]