[
    {
        "company": "Intellectt Inc",
        "job_title": "D365 CE BA",
        "location": "BADC, VA, USA",
        "full_location": {
            "city": "BADC",
            "state": "VA",
            "country": "USA"
        },
        "job_details": {
            "employment_type": [
                "third party"
            ],
            "job_code": "",
            "experience_required": "3-5+ years",
            "degree_required": "Not specified",
            "visa_sponsorship": "Not specified",
            "notice_period": "Not specified",
            "duration": "Not specified",
            "rate": "Not specified"
        },
        "skills": {
            "core": [
                "Microsoft Dynamics 365 CE",
                "Agile/Scrum",
                "User Stories",
                "Business Process Diagramming"
            ],
            "primary": [
                "Excellent written and verbal communication skills",
                "Problem solving with root cause analysis",
                "Facilitating end-user requirements and design sessions"
            ],
            "secondary": [
                "Team player",
                "Individually driven"
            ],
            "all": [
                "Microsoft Dynamics 365 CE",
                "Agile/Scrum",
                "User Stories",
                "Business Process Diagramming",
                "Excellent written and verbal communication skills",
                "Problem solving with root cause analysis",
                "Facilitating end-user requirements and design sessions",
                "Team player",
                "Individually driven"
            ]
        },
        "job_type": [
            "remote",
            "onsite"
        ],
        "contact_person": "Nirmala",
        "email": "devi@intellectt.com",
        "jd": "From: Nirmala, Intellectt Inc devi@intellectt.com Reply to: devi@intellectt.com D365 CE BADC, Virginia, Maryland or Chicago/Remote (Locals Only) Key requirements include:Experience implementing Microsoft Dynamics 365 CE (3-5+ years).Comfortable working directly with end-users and developers.Excellent written and verbal communication skills, especially strong listening skills.Experience working with an agile/scrum implementation methodology.Experience writing user stories, scenario-based test cases, and business process diagramming.Problem solving with root cause analysis experience.Experience facilitating end-user requirements and design sessions.Good team player as well as individually driven.Background working with CE in an integrated environment where data is received from, and sent to, Dynamics F&O.",
        "source": "Email",
        "date_posted": "2024-10-10 09:07:48-05:00",
        "unique_id": "19276ea4584b228d",
        "emp_type": [
            "third party"
        ],
        "tag": "Business Analyst"
    }
]