[
    {
        "company": "Fisec",
        "job_title": "Oracle Configurator developer /Java Developer with Oracle EBS Configurator Experience",
        "location": "Atlanta, GA, USA",
        "full_location": {
            "city": "Atlanta",
            "state": "GA",
            "country": "USA"
        },
        "job_details": {
            "employment_type": [
                "contract",
                "third party"
            ],
            "experience_required": "Not specified",
            "degree_required": "Bachelor's Degree in Computer Science, Information Technology, or related fields.",
            "visa_sponsorship": "Not specified",
            "notice_period": "Not specified",
            "duration": "3 Months + extension",
            "rate": "Not specified"
        },
        "skills": {
            "core": [
                "Java",
                "Oracle Configurator",
                "Oracle EBS",
                "SQL",
                "PL/SQL"
            ],
            "primary": [
                "Oracle Configurator Developer (OCD)",
                "Oracle Forms",
                "Oracle Reports",
                "Oracle Application Framework (OAF)",
                "XML",
                "SOAP/REST web services"
            ],
            "secondary": [
                "Problem-solving skills",
                "Strong communication skills"
            ],
            "all": [
                "Java",
                "Oracle Configurator",
                "Oracle EBS",
                "SQL",
                "PL/SQL",
                "Oracle Configurator Developer (OCD)",
                "Oracle Forms",
                "Oracle Reports",
                "Oracle Application Framework (OAF)",
                "XML",
                "SOAP/REST web services",
                "Problem-solving skills",
                "Strong communication skills"
            ]
        },
        "job_type": [
            "remote"
        ],
        "contact_person": "bala",
        "email": "bala@fisecglobal.net",
        "jd": "From: bala, Fisec bala@fisecglobal.net Reply to: bala@fisecglobal.net Oracle Configurator developer /Java Developer with Oracle EBS Configurator ExperienceAtlanta, GA3 Months + extensionRemote Project A developer who worked on Oracle EBS Configurator with Java plays a specialized role combining both Java development skills and Oracle E-Business Suite (EBS) expertise, especially focused on Oracle Configurator. Below is a typical description of the experience and responsibilities for such a role:Job Description for a Developer with Oracle EBS Configurator and Java Job Title: Key Responsibilities:Oracle Configurator Development:Implement and customize Oracle Configurator models.Develop and maintain rules, constraints, and functional requirements for configuring products and services within Oracle EBS.Work with Oracle Configurator Developer (OCD) to define complex models, including component structures, BOMs (Bill of Materials), and pricing strategies.Java-Based Customizations:Develop custom Java applications or extensions for Oracle EBS Configurator.Create and integrate Java-based solutions for product configuration management, pricing, and order fulfillment within the Oracle ecosystem.Work on the integration of Oracle Configurator with external systems using Java.Oracle EBS Integration:Integrate Oracle Configurator with various Oracle EBS modules like Order Management, Inventory, and BOM.Develop and maintain APIs and web services to facilitate communication between Oracle EBS and external systems.Create Java-based interfaces to enhance Oracle Configurator\u2019s capabilities and user experience.Customization and Extension of Oracle Configurator:Write and maintain Java code to customize Configurator\u2019s features, including user interfaces, back-end processes, and complex configuration logic.Extend Configurator\u2019s functionalities to meet specific client or business needs, ensuring smooth functionality across all integrated systems.Technical Support and Troubleshooting:Provide troubleshooting support for Oracle Configurator issues, both in Java-based applications and EBS configurations.Debug issues, perform root cause analysis, and implement fixes for configuration models or Java code.Optimize performance of Oracle Configurator and Java applications to ensure efficient and seamless configuration experiences.Oracle EBS Customization:Customize Oracle EBS forms and reports to support Oracle Configurator processes.Use Oracle Forms, Reports, and OAF (Oracle Application Framework) as needed alongside Java-based solutions.Collaboration with Business Analysts and Functional Teams:Collaborate with cross-functional teams to gather and understand configuration requirements.Translate business rules into Oracle Configurator models and Java solutions.Ensure alignment between technical solutions and business needs.Documentation:Document customization and configuration efforts, including Java code and Oracle Configurator models.Maintain clear technical documentation for future enhancements or troubleshooting.Required Skills:Strong experience with Java, including Java-based enterprise applications and custom integrations.Hands-on experience with Oracle Configurator and Oracle EBS modules, especially Order Management, BOM, Inventory, and Manufacturing.Experience with Oracle Configurator Developer (OCD).Proficiency in SQL, PL/SQL, and Oracle Database.Experience with Oracle Forms/Reports and Oracle Application Framework (OAF) is a plus.Knowledge of XML, SOAP/REST web services, and integrating Oracle EBS with third-party applications.Problem-solving skills with the ability to troubleshoot both Java-based and Oracle EBS-related issues.Strong communication skills to work with both technical and non-technical stakeholders.Educational Requirements:Bachelor's Degree in Computer Science, Information Technology, or related fields.Oracle certifications (Oracle EBS or Configurator-related) are a plus.This role demands expertise in both Java development and Oracle EBS configurator, ensuring smooth product configurations and integrations across various modules and systems.",
        "source": "Email",
        "date_posted": "2024-10-10 12:48:59-05:00",
        "unique_id": "19277ad227442f3d",
        "emp_type": [
            "contract",
            "third party"
        ],
        "tag": "Java developer"
    }
]