[
    {
        "company": "HCL Global",
        "job_title": "Technical Business Analyst",
        "location": "Pennsylvania, USA",
        "full_location": {
            "city": "Pennsylvania",
            "state": "",
            "country": "USA"
        },
        "job_details": {
            "employment_type": [
                "full-time",
                "third party"
            ],
            "experience_required": "5+ years",
            "degree_required": "Not specified",
            "visa_sponsorship": "Not specified",
            "notice_period": "Not specified",
            "duration": "Not specified",
            "rate": "Not specified"
        },
        "skills": {
            "core": [
                "Data Warehouse",
                "SQL",
                "Target Mapping",
                "Gap Analysis",
                "Data Profiling"
            ],
            "primary": [
                "Healthcare Domain Knowledge",
                "BSA Experience in Data Warehouse projects",
                "Good Communication Skills",
                "Good Analytical skills"
            ],
            "secondary": [
                "Prepared Source to Target Mapping",
                "Performed Gap Analysis",
                "Prepared Functional Specifications"
            ],
            "all": [
                "Data Warehouse",
                "SQL",
                "Target Mapping",
                "Gap Analysis",
                "Data Profiling",
                "Healthcare Domain Knowledge",
                "BSA Experience in Data Warehouse projects",
                "Good Communication Skills",
                "Good Analytical skills",
                "Prepared Source to Target Mapping",
                "Performed Gap Analysis",
                "Prepared Functional Specifications"
            ]
        },
        "job_type": [
            "onsite"
        ],
        "contact_person": "Ashok",
        "email": "ashok@hclglobal.com",
        "jd": "From: ashok, hclglobal ashok@hclglobal.com Reply to: ashok@hclglobal.com Technical Business Analyst Pennsylvania (Complete onsite) Mandatory Areas Must Have Skills Skill 1 \u2013 Data Warehouse Yrs of Exp \u2013 5+ Skill 1 - SQL - 5+ years Skill 3 \u2013 Target Mapping \u2013 4+ Skill 4 \u2013 Gap Analysis / Data Profiling \u2013 4+ Responsibilities: \u2022 Perform Data Profiling (Identify all data issues before getting the data to DW) \u2022 Prepare Functional Specification based on the interaction with Business and Technical teams \u2022 Prepare Mapping Document to be used by Dev and QA team (Detailed level required. Provide Joins, Filters and Ranking (if required) to get UNIQUE records) \u2022 Good understanding of RDBMS concepts \u2022 Present the draft version of Data Model \u2022 Perform UAT / Business Checkout using SQL Scripts Requirements \u2022 At least 3 years with Data Warehouse, 5 years with SQL and 8 years on a BSA / Technical role \u2022 Solid Healthcare Domain Knowledge \u2022 BSA Experience in Data Warehouse projects (Preferably in Sourcing or Outbound Extracts) \u2022 Good Communication Skills \u2022 Good Analytical skills \u2022 Prepared Source to Target Mapping \u2022 Performed Gap Analysis / Data Profiling \u2022 Prepared Functional Specifications working with Business \u2022 Strong SQL skills",
        "source": "Email",
        "date_posted": "2024-10-10 10:17:47-05:00",
        "unique_id": "1927764c3b143f79",
        "emp_type": [
            "full-time",
            "third party"
        ],
        "tag": "Business Analyst"
    }
]