[
    {
        "company": "Orbitpeople LLC",
        "job_title": "ReactJS Developer",
        "location": "Plano, TX, USA",
        "full_location": {
            "city": "Plano",
            "state": "TX",
            "country": "USA"
        },
        "job_details": {
            "employment_type": [
                "full-time",
                "contract",
                "third party"
            ],
            "experience_required": "8+ years",
            "degree_required": "Not specified",
            "visa_sponsorship": "Not specified",
            "notice_period": "Not specified",
            "duration": "Not specified",
            "rate": "Not specified"
        },
        "skills": {
            "core": [
                "React JS",
                "Java",
                "Spring boot",
                "Microservices",
                "AWS"
            ],
            "primary": [
                "Core Java",
                "Java Fullstack",
                "Apache Spark",
                "Hadoop",
                "Agile",
                "Communication skills"
            ],
            "secondary": [
                "Kafka",
                "Tiger Graph",
                "Sparkling Water from H2O"
            ],
            "all": [
                "React JS",
                "Java",
                "Spring boot",
                "Microservices",
                "AWS",
                "Core Java",
                "Java Fullstack",
                "Apache Spark",
                "Hadoop",
                "Agile",
                "Communication skills",
                "Kafka",
                "Tiger Graph",
                "Sparkling Water from H2O"
            ]
        },
        "job_type": [
            "hybrid"
        ],
        "contact_person": "Richa Mathur",
        "email": "richa.mathur@orbitpeople.com",
        "jd": "From: Richa Mathur, Orbitpeople LLC richa.mathur@orbitpeople.com Reply to: richa.mathur@orbitpeople.com Hi Kuldiep,How are you doing?The following are the job details:Job title: ReactJS DeveloperLocation: Plano,TXJob type: HybridJob Requirements:\u2022 React Js Experience\u2022 8+ years of Core Java development experience, familiar with Java 8 or higher.\u2022 Java Fullstack engineers with UI, and backend skillsets using Java, JavaScript\u2019s, and React Framework\u2022 Apache Spark developer with Java/Scala (Building reusable framework and toolsets for DQ, Realtime Streaming and Batch data process and data ingestion)\u2022 General support resource with Hadoop and database skills\u2022 Able to deliver end to end project.\u2022 Experience with java development and aware of java patterns.\u2022 Experience in Spring Boot uses for development.\u2022 Experience of development project and developed functionalities using java, j2ee.\u2022 Must have AWS experience.\u2022 AWS services (S3, SQS, SNS,ECS, Lambda, AWS Cloud watch etc.)\u2022 Experience on AWS deployed application.\u2022 Experience on Oracle or Postgres or DynamoDB to perform SQL.\u2022 Agile/scrum development experience.\u2022 Good collaboration and communication skills.\u2022 Ready to learn new technologies and perform POC on it.\u2022 Ability to diagnose prod issues and defects.Skills required (must be showcased on resume): React JS, Java, Spring boot, Microservices , AWSNice to Have: Kafka, Hadoop, Tiger Graph, Sparkling Water from H2O.Are you interested for this job?",
        "source": "Email",
        "date_posted": "2024-10-10 12:26:11-05:00",
        "unique_id": "1927798410471dd8",
        "emp_type": [
            "full-time",
            "contract",
            "third party"
        ],
        "tag": "Java developer"
    }
]