[
    {
        "company": "Predica Inc.",
        "job_title": "Business Analyst",
        "location": "Lansing, MI, USA",
        "full_location": {
            "city": "Lansing",
            "state": "MI",
            "country": "USA"
        },
        "job_details": {
            "employment_type": [
                "third party"
            ],
            "job_code": "",
            "experience_required": "5 years",
            "degree_required": "Not specified",
            "visa_sponsorship": "Not specified",
            "notice_period": "Not specified",
            "duration": "12 Months",
            "rate": "Not specified"
        },
        "skills": {
            "core": [
                "Exposure to Complex IT web Applications",
                "Experience in a professional office environment",
                "Experience in a role as a business analyst supporting a software development project",
                "Ability to lead meetings, conduct training & information sessions",
                "Proficiency with MS Office",
                "Experience working as a liaison between the development team and project manager or business client",
                "Experience with Azure DevOps"
            ],
            "primary": [],
            "secondary": [],
            "all": [
                "Exposure to Complex IT web Applications",
                "Experience in a professional office environment",
                "Experience in a role as a business analyst supporting a software development project",
                "Ability to lead meetings, conduct training & information sessions",
                "Proficiency with MS Office",
                "Experience working as a liaison between the development team and project manager or business client",
                "Experience with Azure DevOps"
            ]
        },
        "job_type": [],
        "contact_person": "Riyaz Shaik",
        "email": "riyaz@predicaz.com",
        "jd": "From: Riyaz, Predicaz riyaz@predicaz.com Reply to: riyaz@predicaz.com Role: Business AnalystLocation: Lansing, MI (Need Locals)Duration: 12 Months Required Skills:1. Exposure to Complex IT web Applications, within the past 5 years2. Experience in a professional office environment Required3. Experience in a role, as a business analyst, supporting a software development project, in the past 5 years 4. Ability to lead meetings, conduct training & information sessions, communicate at a level appropriate to the audience, make oral and written reports and presentations5. Proficiency with MS Office 6. Experience working as a liaison between the development team and project manager or business client in a software development project 7. Experience with Azure DevOps ----Regards,Riyaz ShaikMail ID: riyaz@predicaz.comPredica Inc.| A: 26211 Central Park Boulevard | Suite 502 | Southfield | MI 48076 W: www.predicaz.com",
        "source": "Email",
        "date_posted": "2024-10-10 17:04:09-05:00",
        "unique_id": "192793f0fcf499fb",
        "emp_type": [
            "third party"
        ],
        "tag": "Business Analyst"
    }
]