[
    {
        "company": "Source Infotech Inc",
        "job_title": "IT Program Manager- SAP",
        "location": "USA",
        "full_location": {
            "city": "",
            "state": "",
            "country": "USA"
        },
        "job_details": {
            "employment_type": [
                "contract",
                "third party"
            ],
            "job_code": "",
            "experience_required": "10+ years",
            "degree_required": "Not specified",
            "visa_sponsorship": "No visa sponsorship",
            "notice_period": "Not specified",
            "duration": "6+ months contract",
            "rate": "Not specified"
        },
        "skills": {
            "core": [
                "SAP Knowledge",
                "Project Management Expertise",
                "Business Analysis",
                "Technical Acumen",
                "Risk Management",
                "Financial Acumen",
                "Stakeholder Management",
                "Leadership",
                "Change Management",
                "Analytical Skills"
            ],
            "primary": [],
            "secondary": [
                "LS domain experience"
            ],
            "all": [
                "SAP Knowledge",
                "Project Management Expertise",
                "Business Analysis",
                "Technical Acumen",
                "Risk Management",
                "Financial Acumen",
                "Stakeholder Management",
                "Leadership",
                "Change Management",
                "Analytical Skills",
                "LS domain experience"
            ],
            "with_experience": [
                "SAP Knowledge",
                "Project Management Expertise",
                "Business Analysis",
                "Technical Acumen",
                "Risk Management",
                "Financial Acumen",
                "Stakeholder Management",
                "Leadership",
                "Change Management",
                "Analytical Skills"
            ]
        },
        "job_type": [
            "remote"
        ],
        "contact_person": "Bhavya Chaturvedi",
        "email": "bhavya.c@sourceinfotech.com",
        "jd": "From: Bhavya, Source infotec inc bhavya.c@sourceinfotech.com Reply to: bhavya.c@sourceinfotech.com IT Program Manager- SAP6+ months contract100% Remote (EST)Interview- 2 roundsVisa- No Cpt/Opt/H1b Experience: 10+ yearsJob Summary:Project - SAP S4/Hana migration Discovery Phase 0This will be the PSG IT Program Manager role for the Technical Workstream coordinating the SAP assessment work to determine the transformation project approach for SAP ECC6 to SAP S4/Hana.The PM will work alongside as Business PM and an SAP Vendor Partner PM to complete a 3-month assessment.Experience:10+ yrs. total3-5 yrs. in SAPRequired Skills:1.SAP Knowledge: - Understanding of SAP systems, modules, and implementation best practices. Preferably with ECC6 to S4 Hana experience2. Project Management Expertise: - Proficiency in project management methodologies and tools.3.Business Analysis: - Ability to support the business requirements and conduct gap analysis.4. Technical Acumen: - Knowledge of IT infrastructure, system integration, and data migration.5. Risk Management: - Expertise in identifying and mitigating project risks.6. Financial Acumen: - Skills in cost estimation, budget management, and cost-benefit analysis.7. Stakeholder Management: - Strong interpersonal and communication skills to manage stakeholder expectations.8. Leadership: - Ability to lead and motivate cross-functional teams effectively.9. Change Management: - Experience in developing and implementing change management strategies.10. Analytical Skills: - Strong problem-solving abilities and capability to analyze complex data.Nice to have skills:LS domain experienceRole Scope / Deliverables:1. Project Charter2. Current State Assessment3. Business Requirements Document (BRD)4. Gap Analysis5. High-Level Solution Design6. Implementation Roadmap7. Risk Assessment and Mitigation Plan8. Cost-Benefit Analysis9. Resource Plan10. Change Management Strategy11. Executive Summary and Recommendations12. Decision-Making FrameworkThese deliverables will help ensure a thorough and well-organized assessment, paving the way for a successful SAP implementation.",
        "source": "Email",
        "date_posted": "2024-10-10 12:13:02-05:00",
        "unique_id": "192778c3606e1215",
        "emp_type": [
            "contract",
            "third party"
        ],
        "tag": "Project Manager"
    }
]