[
    {
        "company": "Maintec Technologies",
        "job_title": "Senior Java Full Stack Developer",
        "location": "Omaha, NE, USA",
        "full_location": {
            "city": "Omaha",
            "state": "NE",
            "country": "USA"
        },
        "job_details": {
            "employment_type": [
                "full-time",
                "third party"
            ],
            "experience_required": "11+ years",
            "degree_required": "Not specified",
            "visa_sponsorship": "Visa sponsorship available",
            "notice_period": "Not specified",
            "duration": "Not specified",
            "rate": "Not specified"
        },
        "skills": {
            "core": [
                "Java 8",
                "Angular 8",
                "Spring boot",
                "Mysql",
                "Rest apis",
                "Messaging services (kafka)",
                "Linux basics",
                "Enterprise Java"
            ],
            "primary": [
                "core java/j2ee fundamentals",
                "analytical skills",
                "problem-solving ability",
                "spring",
                "hibernate",
                "jsf",
                "struts frameworks",
                "web services",
                "jmsexcellent communication skills",
                "agile development methodology",
                "project delivery with zero defects"
            ],
            "secondary": [],
            "all": [
                "Java 8",
                "Angular 8",
                "Spring boot",
                "Mysql",
                "Rest apis",
                "Messaging services (kafka)",
                "Linux basics",
                "Enterprise Java",
                "core java/j2ee fundamentals",
                "analytical skills",
                "problem-solving ability",
                "spring",
                "hibernate",
                "jsf",
                "struts frameworks",
                "web services",
                "jmsexcellent communication skills",
                "agile development methodology",
                "project delivery with zero defects"
            ]
        },
        "job_type": [
            "onsite"
        ],
        "contact_person": "Devan Mark",
        "email": "devan@maintec.com",
        "jd": "From: Devan, Maintec Technologies devan@maintec.com Reply to: devan@maintec.com Role: Senior Java Full Stack Developer Location: Omaha NE \u2013 Onsite must have:Java 8Angular 8Spring bootMysqlRest apisMessaging services (kafka)Linux basicsEnterprise JavaDesired profile:very strong in core java/j2ee fundamentalsexcellent analytical skills and problem-solving abilityexpertise in spring, hibernate, jsf, or struts frameworksexperience with web services or jmsexcellent communication skillsknowledge of agile development methodologystrong background in delivering projects with zero defects in productionRequired skills:Java 8Angular 8Spring bootMysqlRest apisMessaging services (kafka)Linux basicsEnterprise Java Email is the best way to reach me . Thanks & Best Regards Devan Mark Sr. US It Recruiter Maintec Technologies Inc. 8801 Fast Park Drive, Ste. 301, Raleigh, NC 27617Phone:+ 19193710850Email:devan@maintec.com|www.maintec.com https://www.linkedin.com/in/devan-m-340b21331/",
        "source": "Email",
        "date_posted": "2024-10-10 07:54:02-05:00",
        "unique_id": "19276b531064fa1d",
        "emp_type": [
            "full-time",
            "third party"
        ],
        "tag": "Java developer"
    }
]