[
    {
        "company": "Scalable Systems",
        "job_title": "Pega Architect",
        "location": "Auburn, MI, USA",
        "full_location": {
            "city": "Auburn",
            "state": "MI",
            "country": "USA"
        },
        "job_details": {
            "employment_type": [
                "third party"
            ],
            "job_code": "",
            "experience_required": "Not specified",
            "degree_required": "Not specified",
            "visa_sponsorship": "Not specified",
            "notice_period": "Not specified",
            "duration": "Not specified",
            "rate": "Not specified"
        },
        "skills": {
            "core": [
                "Pega CSSA Certified",
                "end-to-end Pega development",
                "Pega architecture",
                "testing Pega applications",
                "issue troubleshooting"
            ],
            "primary": [
                "Pega upgrade projects",
                "coordination with clients",
                "business partners",
                "Pega Product Support",
                "working with offshore team"
            ],
            "secondary": [],
            "all": [
                "Pega CSSA Certified",
                "end-to-end Pega development",
                "Pega architecture",
                "testing Pega applications",
                "issue troubleshooting",
                "Pega upgrade projects",
                "coordination with clients",
                "business partners",
                "Pega Product Support",
                "working with offshore team"
            ],
            "with_experience": []
        },
        "job_type": [],
        "contact_person": "Manish Kumar",
        "email": "manish.kumar@scalable-systems.com",
        "jd": "From: Manish Kumar, Scalable Systems manish.kumar@scalable-systems.com Reply to: manish.kumar@scalable-systems.com Position: Pega Architect Location: Auburn, MI Pega CSSA Certified (Pega Senior Developer) -? Experience in end-to-end Pega development and architecture.? Exposure to Pega upgrade projects.? Experience in testing Pega applications and issue troubleshooting.? Experience in coordination with clients, business partners and Pega Product Support? Capable of working with offshore team, coordinate status and daily work. Best Regards Manish Kumar Phone - +17327883626 Email ID: manish.kumar@scalable-systems.com Scalable Systems | Inspiring Innovation Big Data | Analytics | Integration | Intelligence www.scalable-systems.com",
        "source": "Email",
        "date_posted": "2024-10-10 15:47:37-05:00",
        "unique_id": "19278d36de7b6b76",
        "emp_type": [
            "third party"
        ],
        "tag": "PEGA Developer"
    }
]