[
    {
        "company": "Sunray Enterprise, Inc.",
        "job_title": ".NET DEVELOPER",
        "location": "Atlanta, GA, USA",
        "full_location": {
            "city": "Atlanta",
            "state": "GA",
            "country": "USA"
        },
        "job_details": {
            "employment_type": [
                "full-time",
                "third party"
            ],
            "job_code": "",
            "experience_required": "8+ years",
            "degree_required": "Not specified",
            "visa_sponsorship": "Not specified",
            "notice_period": "Not specified",
            "duration": "LONG TERM",
            "rate": "Not specified"
        },
        "skills": {
            "core": [
                ".NET",
                "MS SQL Server",
                "Agile",
                "Jira",
                "ETL processes"
            ],
            "primary": [
                "multidimensional analysis",
                "data calculation",
                "application integrations",
                "Googledocs",
                "Google scripting"
            ],
            "secondary": [
                "Sales Performance Data",
                "SFDC",
                "WorkDay",
                "Varicent",
                "SPM application implementations",
                "OneStream",
                "Anaplan",
                "Sales Performance Management processes",
                "incident and problem management",
                "Knowledge base update"
            ],
            "all": [
                ".NET",
                "MS SQL Server",
                "Agile",
                "Jira",
                "ETL processes",
                "multidimensional analysis",
                "data calculation",
                "application integrations",
                "Googledocs",
                "Google scripting",
                "Sales Performance Data",
                "SFDC",
                "WorkDay",
                "Varicent",
                "SPM application implementations",
                "OneStream",
                "Anaplan",
                "Sales Performance Management processes",
                "incident and problem management",
                "Knowledge base update"
            ],
            "with_experience": [
                ".NET (8+ years)",
                "MS SQL Server (5+ years)",
                "Sales Performance Data (3+ years)",
                "SPM application implementations (3+ years)"
            ]
        },
        "job_type": [
            "onsite"
        ],
        "contact_person": "Manoj Rathee",
        "email": "manoj@sunraycorp.com",
        "jd": "Hi Dear,I hope my mail finds you in good health and doing well!We currently have the JOB POSITION listed below available.Kindly go through the job description and share your latest updated RESUME, visa copy, and photo ID so that I can submit the profile to the client.Job Position :- .NET DEVELOPERLocations :- Atlanta GA or Cary NC - Only localsDuration :- LONG TERMJob Description:-8+ years experience .NET 5+ years experience MS SQL Server database design and tuning Experience working with a team utilizing Agile and Jira Strong knowledge of ETL processes, multidimensional analysis, databases, data calculation, and aggregation techniques Strong understanding of application integrations - development, configuration, management (OneStream a plus) Experience with Googledocs, sheets, slides including Google scripting Organization and prioritization skills; ability to multitask in a dynamic environment Good analytic and debugging skills Great communication skills working in a global companyPreferred Job Skills3+ years experience with Sales Performance Data (SFDC, WorkDay, Varicent)3+ years SPM application implementations (OneStream or Anaplan a plus)Functional understanding of Sales Performance Management processes (1.) To adhere to quality standards, regulatory requirements and company policies (2.) To ensure positive customer experience and CSAT through First Call Resolution and minimum rejected resolutions or Reopen Cases (3.) To participate or contribute on EN business in creation of proposals to drive Service improvement plans. (4.) To independently resolve tickets and esnure that the agreed SLA of ticket volume and time are met for the team. (5.) To provide support for on call escalations orL3 level support and doing incident and problem management (6.) Work on value adding activities such Knowledge base update and management, Training freshers, coaching analysts and conducting interviewsorparticipation in hiring drives.Hope to hear from you soon !!!",
        "source": "Email",
        "date_posted": "2024-10-10 09:42:51-05:00",
        "unique_id": "19277095f2cb8bd4",
        "emp_type": [
            "full-time",
            "third party"
        ],
        "tag": ".net developer"
    }
]