[
    {
        "company": "Techgene Solutions",
        "job_title": "AWS Python Developer",
        "location": "Richmond, VA, USA",
        "full_location": {
            "city": "Richmond",
            "state": "VA",
            "country": "USA"
        },
        "job_details": {
            "employment_type": [
                "contract",
                "third party"
            ],
            "experience_required": "10+ years",
            "degree_required": "Not specified",
            "visa_sponsorship": "Not specified",
            "notice_period": "Not specified",
            "duration": "Contract",
            "rate": "Not specified"
        },
        "skills": {
            "core": [
                "Python",
                "Golang",
                "GitHub"
            ],
            "primary": [
                "Web Development",
                "API development",
                "RESTful services"
            ],
            "secondary": [
                "Debugging",
                "Troubleshooting",
                "Unit testing",
                "Test automation"
            ],
            "all": [
                "Python",
                "Golang",
                "GitHub",
                "Web Development",
                "API development",
                "RESTful services",
                "Debugging",
                "Troubleshooting",
                "Unit testing",
                "Test automation"
            ]
        },
        "job_type": [
            "onsite"
        ],
        "contact_person": "Vinay Kumar Vennu",
        "email": "vinay.v@techgene.com",
        "jd": "From: Vinay Kumar Vennu, Techgene Solutions vinay.v@techgene.com Reply to: vinay.v@techgene.com Role: AWS Python Developer Location: Richmond, VA (day 1 onsite) Duration: Contract experience: 10+ years (mandatory) Client: Capital One Primary Skills: \u2022 Programming Languages: \uf0d8 Proficiency in Python and Golang \uf0d8 Experience with tool development and integration using these languages \u2022 GitHub Integration: \uf0d8 Experience with integrating tools and applications with GitHub \uf0d8 Understanding of GitHub APIs and workflows Secondary Skills: Web Development: \uf0d8 Familiarity with web frameworks and development practices in Python and Golang \uf0d8 Knowledge of API development and RESTful services Testing and Debugging: \uf0d8 Strong debugging and troubleshooting skills \uf0d8 Experience with unit testing and test automation Roles and Responsibilities: 1. Develop and maintain tools and applications using Python and Golang 2. Integrate tools and applications with GitHub for seamless workflows 3. Write clean, efficient, and maintainable code 4. Debug and troubleshoot issues in the developed applications 5. Collaborate with cross-functional teams to deliver high-quality software",
        "source": "Email",
        "date_posted": "2024-10-10 12:33:34-05:00",
        "unique_id": "1927800bbcd95895",
        "emp_type": [
            "contract",
            "third party"
        ],
        "tag": "Python developer"
    }
]