[
    {
        "company": "Predica Inc.",
        "job_title": "Project Manager",
        "location": "Indianapolis, IN, USA",
        "full_location": {
            "city": "Indianapolis",
            "state": "IN",
            "country": "USA"
        },
        "job_details": {
            "employment_type": [
                "third party"
            ],
            "job_code": "",
            "experience_required": "Not specified",
            "degree_required": "Not specified",
            "visa_sponsorship": "Not specified",
            "notice_period": "Not specified",
            "duration": "12 Months",
            "rate": "Not specified"
        },
        "skills": {
            "core": [
                "IT Project Management",
                "Azure DevOps",
                "Waterfall methodology",
                "Agile methodology",
                "SDLC"
            ],
            "primary": [
                "Business intelligence",
                "Communication skills",
                "Presentation skills",
                "PMP Certified"
            ],
            "secondary": [
                "Experience managing projects",
                "Ability to translate technology terms",
                "Ability to work with technical team members"
            ],
            "all": [
                "IT Project Management",
                "Azure DevOps",
                "Waterfall methodology",
                "Agile methodology",
                "SDLC",
                "Business intelligence",
                "Communication skills",
                "Presentation skills",
                "PMP Certified",
                "Experience managing projects",
                "Ability to translate technology terms",
                "Ability to work with technical team members"
            ]
        },
        "job_type": [],
        "contact_person": "Riyaz Shaik",
        "email": "riyaz@predicaz.com",
        "jd": "From: Riyaz, Predicaz riyaz@predicaz.com Reply to: riyaz@predicaz.com Role: Project ManagerLocation: Indianapolis, IN (Need Locals)Duration: 12 Months Required Skills: 1. Experience in IT Project Management2. Prior experience working on State of Indiana large data, business intelligence, or software projects as a Senior IT PM3. Experience managing projects within Azure DevOps4. Strong knowledge of information systems development life cycle, information technology, project tools and approaches to development and implemention5. Experience with Waterfall methodology6. Experience with Agile methodology7. Ability to translate technology terms and explain concepts of SDLC to program/business folks who have little to no exposure to large software projects 8. Ability to work with technical team members, and other IT professionals to flesh out project plans and risk registers and overcome obstacles 9. Strong communication and presentation skills10. PMP Certified----Regards,Riyaz ShaikMail ID: riyaz@predicaz.comPredica Inc.| A: 26211 Central Park Boulevard | Suite 502 | Southfield | MI 48076 W: www.predicaz.com",
        "source": "Email",
        "date_posted": "2024-10-10 17:02:34-05:00",
        "unique_id": "19279400a5833637",
        "emp_type": [
            "third party"
        ],
        "tag": "Project Manager"
    }
]