[
    {
        "company": "GAC Solutions",
        "job_title": "Data Project Manager",
        "location": "Miami Beach, FL, USA",
        "full_location": {
            "city": "Miami Beach",
            "state": "FL",
            "country": "USA"
        },
        "job_details": {
            "employment_type": [
                "contract",
                "third party"
            ],
            "job_code": "",
            "experience_required": "Not specified",
            "degree_required": "Not specified",
            "visa_sponsorship": "Not specified",
            "notice_period": "Not specified",
            "duration": "6-12 months",
            "rate": "Not specified"
        },
        "skills": {
            "core": [
                "Data Management",
                "Data Governance",
                "Program Management",
                "Agile"
            ],
            "primary": [
                "Communication",
                "Coordination",
                "Stakeholder Management",
                "Risk Management"
            ],
            "secondary": [
                "GDPR",
                "Data Privacy",
                "DSR"
            ],
            "all": [
                "Data Management",
                "Data Governance",
                "Program Management",
                "Agile",
                "Communication",
                "Coordination",
                "Stakeholder Management",
                "Risk Management",
                "GDPR",
                "Data Privacy",
                "DSR"
            ]
        },
        "job_type": [
            "hybrid"
        ],
        "contact_person": "Justin Davis",
        "email": "justin@gacsol.com",
        "jd": "From: Justin Davis, GAC Solutions justin@gacsol.com Reply to: justin@gacsol.com Hi, I hope you're doing well!Need only Locals Role: Data Project Manager Work location: MIAMI BEACH, FL \u2013 Hybrid6-12 months JOB DESCRIPTION: A hands-on technical PM with strong communication and co-ordination skills, flexible work style, and have worked in a matrix environment with multiple stakeholder groups and may have managed competing priorities.Basic knowledge of GDPR, Data Governance, DSR and Data Privacy initiatives will be needed. Program Management: Lead cross-functional teams to deliver Data Management & Governance program objectives on time and within budgetDevelop and manage program plans, budgets, and timelines, ensuring alignment with individual projectsTrack program progress and performance metrics, identifying and addressing potential roadblocks. Manage resource allocation and utilization across program projectsEnsure projects meet quality standards and contribute to overall program goalsSupport risk management activities for the program Agile AI Process Facilitation: Support the continuous improvement of development processesEnsure Agile ceremonies such as standup meetings, sprint planning, sprint reviews, and retrospectives are executed effectively",
        "source": "Email",
        "date_posted": "2024-10-10 14:09:02-05:00",
        "unique_id": "19277f668616a03f",
        "emp_type": [
            "contract",
            "third party"
        ],
        "tag": "Project Manager"
    }
]