[
    {
        "company": "Pinakastaffing LLC",
        "job_title": "Full Stack Angular Developer",
        "location": "Gilbert, AZ, USA",
        "full_location": {
            "city": "Gilbert",
            "state": "AZ",
            "country": "USA"
        },
        "job_details": {
            "employment_type": [
                "contract",
                "third party"
            ],
            "job_code": "",
            "experience_required": "8-10 years",
            "degree_required": "Not specified",
            "visa_sponsorship": "No visa sponsorship",
            "notice_period": "Not specified",
            "duration": "6+ month contract (likely to extend a year or more)",
            "rate": "Not specified"
        },
        "skills": {
            "core": [
                "Angular",
                "Java",
                "J2EE",
                "Spring",
                "Hibernate"
            ],
            "primary": [
                "REST-API",
                "Micro Services architecture"
            ],
            "secondary": [],
            "all": [
                "Angular",
                "Java",
                "J2EE",
                "Spring",
                "Hibernate",
                "REST-API",
                "Micro Services architecture"
            ]
        },
        "job_type": [
            "onsite"
        ],
        "contact_person": "Mani",
        "email": "mani@pinakastaffing.com",
        "jd": "From: Mani, Pinakastaffing LLC mani@pinakastaffing.com Reply to: mani@pinakastaffing.com Full Stack Angular Developer (heavy Angular)Terms: 6+ month contract (likely to extend a year or more)C2C Location: Must be local to Gilbert, AZ (close to Phoenix) - will be reporting onsite 3 days a week, every other week.Onsite InterviewRequirements:\u2022 8-10 years' experience working as an Angular Developer\u2022 Proficiency in Java and J2EE in Java Development\u2022 Must be responsible for developing full stack application using Angular and Spring based REST-API.\u2022 Solid understanding of Hibernate.\u2022 Experience with Spring framework, particularly Spring REST if possible.\u2022 Experience with Micro Services architecture.Need candidates ASAP 2 spots opened up",
        "source": "Email",
        "date_posted": "2024-10-10 11:57:01-05:00",
        "unique_id": "192777ec8d4dde38",
        "emp_type": [
            "contract",
            "third party"
        ],
        "tag": "Java developer"
    }
]