[
    {
        "company": "Tekgence",
        "job_title": "Data Specialist",
        "location": "USA",
        "full_location": {
            "city": "",
            "state": "",
            "country": "USA"
        },
        "job_details": {
            "employment_type": [
                "full-time",
                "third party"
            ],
            "job_code": "",
            "experience_required": "Minimum 6 years of experience in IT industry with over 4 years of experience as a data modeller preferably in finance domain",
            "degree_required": "Not specified",
            "visa_sponsorship": "Not specified",
            "notice_period": "Not specified",
            "duration": "Long Term",
            "rate": "Not specified"
        },
        "skills": {
            "core": [
                "Data Modelling",
                "Azure Monitoring",
                "Data Warehousing",
                "SQL",
                "Data Analysis"
            ],
            "primary": [
                "ADLS G2",
                "Blob",
                "Cosmos DB",
                "Data Explorer",
                "Data Factory",
                "Data Modelling Fundamentals",
                "Data bricks",
                "ETL Fundamentals",
                "Event Hub",
                "Logic App",
                "Modern Data Platform Fundamentals",
                "PLSQL",
                "Purview",
                "Python",
                "SQL (Basic + Advanced)",
                "SQL Server",
                "Stream Analytics",
                "Synapse"
            ],
            "secondary": [
                "Data Engineering",
                "ETL/ELT methodologies",
                "Data storage formats",
                "Data integrity",
                "Data quality",
                "Data security",
                "Data governance",
                "Azure SQL Database",
                "parquet",
                "JSON",
                "Delta Formats"
            ],
            "all": [
                "Data Modelling",
                "Azure Monitoring",
                "Data Warehousing",
                "SQL",
                "Data Analysis",
                "ADLS G2",
                "Blob",
                "Cosmos DB",
                "Data Explorer",
                "Data Factory",
                "Data Modelling Fundamentals",
                "Data bricks",
                "ETL Fundamentals",
                "Event Hub",
                "Logic App",
                "Modern Data Platform Fundamentals",
                "PLSQL",
                "Purview",
                "Python",
                "SQL (Basic + Advanced)",
                "SQL Server",
                "Stream Analytics",
                "Synapse",
                "Data Engineering",
                "ETL/ELT methodologies",
                "Data storage formats",
                "Data integrity",
                "Data quality",
                "Data security",
                "Data governance",
                "Azure SQL Database",
                "parquet",
                "JSON",
                "Delta Formats"
            ],
            "with_experience": [
                "Data Modelling",
                "SQL"
            ]
        },
        "job_type": [
            "remote"
        ],
        "contact_person": "Mahith Kumar",
        "email": "mahith@tekgence.com",
        "jd": "Hello,This is Mahith Kumar from Tekgence; I am writing to let you know regarding a job opportunities with one of my client as a Data Specialist Location: Remote Job Title: Data SpecialistLocation: RemoteDuration: Long Term Job Description: Data SpecialistPrimary SkillsAzure Monitoring, ADLS G2, Blob, Cosmos DB, Data Explorer, Data Factory, Data Modelling Fundamentals, Data Warehousing, Data bricks, ETL Fundamentals, Event Hub, Logic App, Modern Data Platform Fundamentals, PLSQL, Purview, Python, SQL, SQL (Basic + Advanced), SQL Server, Stream Analytics, Synapse SpecializationAzure Data Architecture: Data Specialist Job requirementsMinimum 6 years of experience in IT industry with over 4 years of experience as a data modeller preferably in finance domainExpert knowledge of data modelling and conceptsExpert knowledge of data modelling tools like Erwin, ER/Studio, Lucid ChartDesign, develop and manage data models for large scale data warehousing projectsExcellent interpersonal skills to work across the organization departments and boundaries.Ability to collaborate and interact with customers including senior management, data analysts, business analysts and data engineersPreferred understanding of data engineering and ETL/ELT methodologies (candidate with prior ETL/ELT experience will be preferredUnderstanding of different data storage formatsMust have very strong data analysis capability especially in finance domain.Skills in advanced SQL and querying techniquesDesired Knowledge & SkillsDesirable - Strong grasp of data integrity, quality, data security and data governance.Experience with data formats like Azure SQL Database, parquet, JSON and Delta Formats.",
        "source": "Email",
        "date_posted": "2024-10-10 14:29:14-05:00",
        "unique_id": "1927808eb6e873b5",
        "emp_type": [
            "full-time",
            "third party"
        ],
        "tag": "Azure Data Engineer"
    }
]