[
    {
        "company": "NY-Office of Mental Health",
        "job_title": ".NET Developer",
        "location": "Albany, NY, USA",
        "full_location": {
            "city": "Albany",
            "state": "NY",
            "country": "USA"
        },
        "job_details": {
            "employment_type": [
                "contract",
                "third party"
            ],
            "job_code": "",
            "experience_required": "84 months",
            "degree_required": "Not specified",
            "visa_sponsorship": "Visa sponsorship available",
            "notice_period": "Not specified",
            "duration": "24+ Months",
            "rate": "Not specified"
        },
        "skills": {
            "core": [
                "C#",
                "ASP.NET",
                "Web API",
                "HTML",
                "XML",
                "JSON",
                "AJAX",
                "JavaScript",
                "jQuery",
                "Bootstrap",
                "Cascading Style Sheets",
                "Oracle",
                "PL SQL",
                "WCF",
                "SOAP",
                "Restful APIs",
                "Team Foundation Server",
                "GitLab",
                "CI/CD",
                "OKTA",
                "LDAP",
                "RSA",
                "Access Manager"
            ],
            "primary": [
                "Service Oriented Architecture (SOA)",
                "Health Care data",
                "HIPAA Protected Health Information (PHI)",
                "HL7",
                "FHIR"
            ],
            "secondary": [],
            "all": [
                "C#",
                "ASP.NET",
                "Web API",
                "HTML",
                "XML",
                "JSON",
                "AJAX",
                "JavaScript",
                "jQuery",
                "Bootstrap",
                "Cascading Style Sheets",
                "Oracle",
                "PL SQL",
                "WCF",
                "SOAP",
                "Restful APIs",
                "Team Foundation Server",
                "GitLab",
                "CI/CD",
                "OKTA",
                "LDAP",
                "RSA",
                "Access Manager",
                "Service Oriented Architecture (SOA)",
                "Health Care data",
                "HIPAA Protected Health Information (PHI)",
                "HL7",
                "FHIR"
            ]
        },
        "job_type": [
            "hybrid"
        ],
        "contact_person": "Vikrama Rao",
        "email": "vrao@valiantiq.com",
        "jd": "From: Vikrama, Valiantiq vrao@valiantiq.com Reply to: vrao@valiantiq.com Title .NET DeveloperClient: NY-Office of Mental HealthLocation: Albany, NY (Hybrid)Duration: 24+ MonthsVisa: H1-B/GC/USC Need only Healthcare domain candidatesPosition Skill Level Description: 84+ months: Candidate is able to provide guidance to large teams and/or has extensive industry experience and is considered at the top of his/her field. List all the Position REQUESTED Qualifications: 84 months experience using Microsoft Visual Studio to develop/maintain applications in C#, ASP.NET, Web API for n-tier web deployment.84 months experience developing and maintaining web applications that utilize HTML, XML, JSON, AJAX, JavaScript, jQuery, Bootstrap and Cascading Style Sheets.84 months experience with Oracle: Database design, PL SQL coding, stored procedures, packages, indexes, triggers, views, creating tables, etc.,84 Months experience with Service Oriented Architecture (SOA) application integration including development of secure .Net web-services using Windows Communication Foundation (WCF), SOAP/Restful APIs, message and queue processing, dynamic link library through package manager, and/or an Enterprise Service Bus.72 Month experience using Team Foundation Server and GitLab including CI/CD for source code management.72 months experience working with UI/UX team, Business Analysts, Architects, and Project managers to define requirements and timelines.24 Months experience coding and maintaining applications which contain Health Care data that fall under HIPAA Protected Health Information (PHI), HL7 and/or FHIR.24 Months experience with user provisioning, authentication and authorization using OKTA, LDAP, RSA, and Access Manager. Thanks & Regards,Vikrama RaoRecruitment Executive- ValiantIQ Inc.",
        "source": "Email",
        "date_posted": "2024-10-10 10:26:25-05:00",
        "unique_id": "1927736a724736e4",
        "emp_type": [
            "contract",
            "third party"
        ],
        "tag": ".net developer"
    }
]