[
    {
        "company": "Sapphire Software Solutions",
        "job_title": "Java Developer",
        "location": "St. Paul, MN, USA",
        "full_location": {
            "city": "St. Paul",
            "state": "MN",
            "country": "USA"
        },
        "job_details": {
            "employment_type": [
                "contract",
                "third party"
            ],
            "job_code": "",
            "experience_required": "5+ years",
            "degree_required": "Not specified",
            "visa_sponsorship": "No visa sponsorship",
            "notice_period": "Not specified",
            "duration": "Long Term Contract",
            "rate": "Not specified"
        },
        "skills": {
            "core": [
                "Java",
                "Spring",
                "SQL"
            ],
            "primary": [
                "Cloud exposure",
                "AWS"
            ],
            "secondary": [
                "Agile methodologies",
                "Insurance industry experience",
                "Cultural fit",
                "Soft skills",
                "Curiosity"
            ],
            "all": [
                "Java",
                "Spring",
                "SQL",
                "Cloud exposure",
                "AWS",
                "Agile methodologies",
                "Insurance industry experience",
                "Cultural fit",
                "Soft skills",
                "Curiosity"
            ]
        },
        "job_type": [
            "hybrid"
        ],
        "contact_person": "Jatin",
        "email": "jatin@sapphiresoftwaresolutions.com",
        "jd": "From: Jatin, Sapphire Software Solutions jatin@sapphiresoftwaresolutions.com Reply to: jatin@sapphiresoftwaresolutions.com Only local candidates from Minnesota can applyC2C allowed(No H1B, OPT and CPT)Job Title: Java DeveloperLocation: St. Paul, MN (Hybrid)Duration: Long Term Contract Project/Scope:\u201cCare\u201d application \u2013 claims application is a shared solution across the enterprise. This app serves group, individual, and financial services marketsComplex, monolithic application with some legacy business logicThis person won\u2019t be tied to a specific project, but will be tied to the Care application specifically, working on requirements as they come in from other teams Team Breakdown/Methodology:3 Agile teams supporting Care2-4 developers, BA, QA, POTeams are very social, bounce ideas off of each other, cultural fit will be very important Qualifications:5+ years of software development experience Java, Spring, SQLCloud exposure \u2013 flexible on platform, AWS is preferred Their Data Center is AWS hosted with EC2 instancesCultural fit/soft skills/mind set will be very importantCuriosity, someone who is comfortable digging into the code, asking questions to understand the application. Ability to work independently. Open to trying something new, trying different processes, etc. Nice to Have:Previous insurance industry experience",
        "source": "Email",
        "date_posted": "2024-10-10 10:42:38-05:00",
        "unique_id": "192774c652c081c0",
        "emp_type": [
            "contract",
            "third party"
        ],
        "tag": "Java developer"
    }
]