[
    {
        "company": "Capgemini",
        "job_title": "Data Project Manager",
        "location": "Miami Beach, FL, USA",
        "full_location": {
            "city": "Miami Beach",
            "state": "FL",
            "country": "USA"
        },
        "job_details": {
            "employment_type": [
                "full-time",
                "third party"
            ],
            "experience_required": "Not specified",
            "degree_required": "Not specified",
            "visa_sponsorship": "Not specified",
            "notice_period": "Not specified",
            "duration": "Not specified",
            "rate": "Not specified",
            "job_code": "",
            "contact_person": "Santhoshi",
            "email": "santhoshi@hanstaffing.com"
        },
        "skills": {
            "core": [
                "Data Management",
                "Data Governance",
                "Program Management",
                "Agile"
            ],
            "primary": [
                "Communication",
                "Coordination",
                "Risk Management",
                "Stakeholder Management"
            ],
            "secondary": [
                "GDPR",
                "Data Privacy",
                "DSR"
            ],
            "all": [
                "Data Management",
                "Data Governance",
                "Program Management",
                "Agile",
                "Communication",
                "Coordination",
                "Risk Management",
                "Stakeholder Management",
                "GDPR",
                "Data Privacy",
                "DSR"
            ]
        },
        "job_type": [
            "onsite"
        ],
        "jd": "From: Santhoshi, HAN IT Staffing santhoshi@hanstaffing.com Reply to: santhoshi@hanstaffing.com Role : Data Project Manager - Onsite(Need Local)Location: MIAMI BEACH, FLClient : Capgemini JOB DESCRIPTION:A hands-on technical PM with strong communication and co-ordination skills, flexible work style, and have worked in a matrix environment with multiple stakeholder groups and may have managed competing priorities.Basic knowledge of GDPR, Data Governance, DSR and Data Privacy initiatives will be needed.Program Management:\u2022 Lead cross-functional teams to deliver Data Management & Governance program objectives on time and within budget\u2022 Develop and manage program plans, budgets, and timelines, ensuring alignment with individual projects\u2022 Track program progress and performance metrics, identifying and addressing potential roadblocks.\u2022 Manage resource allocation and utilization across program projects\u2022 Ensure projects meet quality standards and contribute to overall program goals\u2022 Support risk management activities for the programAgile AI Process Facilitation:\u2022 Support the continuous improvement of development processes\u2022 Ensure Agile ceremonies such as standup meetings, sprint planning, sprint reviews, and retrospectives are executed effectively\u2022",
        "source": "Email",
        "date_posted": "2024-10-10 13:44:15-05:00",
        "unique_id": "19277dfbb26bae70",
        "emp_type": [
            "full-time",
            "third party"
        ],
        "tag": "Project Manager"
    }
]