[
    {
        "company": "Vy Systems",
        "job_title": "Java backend Developer",
        "location": "Plano, TX, USA",
        "full_location": {
            "city": "Plano",
            "state": "TX",
            "country": "USA"
        },
        "job_details": {
            "employment_type": [
                "third party"
            ],
            "job_code": "",
            "experience_required": "5+ years",
            "degree_required": "Not specified",
            "visa_sponsorship": "Not specified",
            "notice_period": "Not specified",
            "duration": "Not specified",
            "rate": "$75+"
        },
        "skills": {
            "core": [
                "Java",
                "J2EE",
                "Spring Framework",
                "MongoDB"
            ],
            "primary": [
                "REST APIs",
                "Continuous Integration",
                "AWS",
                "Agile"
            ],
            "secondary": [
                "Google Cloud",
                "Oracle",
                "MS SQL Server"
            ],
            "all": [
                "Java",
                "J2EE",
                "Spring Framework",
                "MongoDB",
                "REST APIs",
                "Continuous Integration",
                "AWS",
                "Agile",
                "Google Cloud",
                "Oracle",
                "MS SQL Server"
            ]
        },
        "job_type": [],
        "contact_person": "Bharath",
        "email": "bharath.r@vysystems.com",
        "jd": "From: Bharath, Vy systems bharath.r@vysystems.com Reply to: bharath.r@vysystems.com Hi,Looking for Java backend Developer with MongoDB & AWS (Local Candidate only & 12+ only,Rate more than 75$)\"Dont share non local profiles\"Java backend Developer with MongoDB & AWS ExpLocation: Plano, TX \u2013 Local Candidate onlyJob Description:5+ years of overall experience in software engineering2+ years of experience in Java, J2EE programming, Spring Framework and design techniques and web applications/REST APIsVery strong Mongo DB Exp, there would be coding interview.Hands on with version control practices, Continuous Integration tools e.g. JenkinsKnowledge of cloud technologies \u2013 AWS, GoogleUnderstanding of relational databases e.g. Oracle, MS Sql ServerExposure to Agile based software development Regards,BHARATH- Vy\u200bSystemsEmail ID:bharath.r@vysystems.com",
        "source": "Email",
        "date_posted": "2024-10-10 14:49:57-05:00",
        "unique_id": "192781bdfc44f9be",
        "emp_type": [
            "third party"
        ],
        "tag": "Java developer"
    }
]