[
    {
        "company": "Atlantis",
        "job_title": "Business Analyst",
        "location": "Chicago, IL, USA",
        "full_location": {
            "city": "Chicago",
            "state": "IL",
            "country": "USA"
        },
        "job_details": {
            "employment_type": [
                "full-time",
                "third party"
            ],
            "job_code": "",
            "experience_required": "At least 5 years",
            "degree_required": "Bachelor's Degree in Computer Science, Management Information Systems, Business Administration or equivalent work experience",
            "visa_sponsorship": "Not specified",
            "notice_period": "Not specified",
            "duration": "Not specified",
            "rate": "$53 on C2C"
        },
        "skills": {
            "core": [
                "Word",
                "Excel",
                "PowerPoint",
                "Visio",
                "Jira"
            ],
            "primary": [
                "Agile methodology",
                "data analysis",
                "documentation skills",
                "communication skills",
                "collaboration"
            ],
            "secondary": [
                "claims processing knowledge",
                "large program experience"
            ],
            "all": [
                "Word",
                "Excel",
                "PowerPoint",
                "Visio",
                "Jira",
                "Agile methodology",
                "data analysis",
                "documentation skills",
                "communication skills",
                "collaboration",
                "claims processing knowledge",
                "large program experience"
            ]
        },
        "job_type": [
            "hybrid"
        ],
        "contact_person": "Ram",
        "email": "ram.a@atlantisitgroup.com",
        "jd": "From: Ram, Atlantis ram.a@atlantisitgroup.com Reply to: ram.a@atlantisitgroup.com Title:- Business AnalystLocation:- Chicago, IL (Hybrid 3 days/week)Key responsibilities\u2022 Evaluate current operational procedures, identify inefficiencies, and propose strategies to achieve operational excellence\u2022 Builds relationships and collaborates with business units, development teams, and other stakeholders to gather, analyze and prioritize requests\u2022 Ensures that complex requirements are executable, testable, complete and not ambiguous\u2022 Documents and elicits requirements through user stories, use cases, process flow diagrams, etc.\u2022 Technical skills including Word, Excel, PowerPoint, Viso and Jira (or similar tool)\u2022 Experience on a variety of simple to complex projects\u2022 Bachelor's Degree in Computer Science, Management Information Systems, Business Administration or equivalent work experience\u2022 Proven ability to elicit and document requirements in a clear and concise manner\u2022 Must be able to communicate to all levels in an organization, strong problem-solving skills, adaptable, flexible, proactive and willing to take ownership\u2022 Flexible in adjusting to demands and challenges, with ability to work at a fast pace, in a high-volume environment and meet tight deadlines\u2022 Experience and commitment to identify and drive improvements to existing processes\u2022 Experience with Agile methodologyExperience\u2022 At least 5 years in a business analyst role\u2022 Ability to analyze data within systems and understand workflow\u2022 Familiar with data analysis tools and software\u2022 Strong documentation skills\u2022 Experience working with cross-functional teams including IT\u2022 Functional understanding of technology\u2022 Exceptional communication skills, both written and verbal\u2022 The ability to collaborate effectively with multiple teams and stakeholders at all levels of the organization\u2022 Claims processing knowledge and large program experience a Bonus",
        "source": "Email",
        "date_posted": "2024-10-10 12:57:01-05:00",
        "unique_id": "19277b47dcf5006e",
        "emp_type": [
            "full-time",
            "third party"
        ],
        "tag": "Business Analyst"
    }
]