[
    {
        "company": "Rwaltz",
        "job_title": "Snowflake Database Administrator",
        "location": "Frisco, TX, USA",
        "full_location": {
            "city": "Frisco",
            "state": "TX",
            "country": "USA"
        },
        "job_details": {
            "employment_type": [
                "full-time",
                "third party"
            ],
            "experience_required": "8 years",
            "degree_required": "Bachelor's Degree in computer science, engineering or in a technology related field OR equivalent through a combination of education and/or technology experience OR 12 years of technology experience",
            "visa_sponsorship": "Not specified",
            "notice_period": "Not specified",
            "duration": "Not specified",
            "rate": "Not specified"
        },
        "skills": {
            "core": [
                "Snowflake database setup",
                "Data Engineering",
                "SQL",
                "Data governance",
                "AWS"
            ],
            "primary": [
                "BI Engineering",
                "Data applications",
                "ERWIN modeling",
                "Enterprise data warehouse solutions",
                "Monitoring & alerting unauthorized data access"
            ],
            "secondary": [
                "Informatica",
                "OKTA",
                "SailPoint",
                "CyberArk",
                "CICD",
                "Jenkins",
                "Python programming"
            ],
            "all": [
                "Snowflake database setup",
                "Data Engineering",
                "SQL",
                "Data governance",
                "AWS",
                "BI Engineering",
                "Data applications",
                "ERWIN modeling",
                "Enterprise data warehouse solutions",
                "Monitoring & alerting unauthorized data access",
                "Informatica",
                "OKTA",
                "SailPoint",
                "CyberArk",
                "CICD",
                "Jenkins",
                "Python programming"
            ]
        },
        "job_type": [
            "onsite"
        ],
        "contact_person": "Hannah Rwaltz",
        "email": "hannah@rwaltz.com",
        "jd": "From: Hannah, Rwaltz hannah@rwaltz.com Reply to: hannah@rwaltz.com Snowflake Database AdministratorLocation: Frisco (CST) (at least two days on site per week)Position Qualifications:Bachelor's Degree in computer science, engineering or in a technology related field OR equivalent through a combination of education and/or technology experience OR 12 years of technology experience 8 years of experience in Data Engineering, BI Engineering or related field in architecting and developing end-to-end scalable data applications 8 years of experience Snowflake database setup, administration, ERWIN modeling, designing, implementing enterprise data warehouse solutions with strong SQL query capabilities 8 years of experience implementing data governance, security, PII data handling, monitoring & alerting unauthorized data access, changes 6 years of experience in onboarding new data tools, configuring, integrating Snowflake with Informatica, BI, Analytical tools and with OKTA, SailPoint, CyberArk 8 years of experience managing compute & storage, applying best practices for schema, table, DDL creations, querying, evaluating load operations & performance 6 years of working knowledge of different databases (e.g., SQL & NoSQL), S3 datalake, CICD, Jenkins and AWS cloud technologies; leveraging SQL or Python programming languages 6 years of experience developing strong collaborative relationships with key business, technology and data teams 6 years of experience in working with data engineering best practices across the development lifecycle, including agile methodologies, coding standards, code reviews, source management, build processes and testingLicenses/Certificates:Snowflake SnowPro, Advance Architect Certification is a must Amazon Web Services (AWS) Solution Architect or Certified Data Analytics",
        "source": "Email",
        "date_posted": "2024-10-10 12:05:56-05:00",
        "unique_id": "19277a00de6042b7",
        "emp_type": [
            "full-time",
            "third party"
        ],
        "tag": "AWS Data Engineer"
    }
]