[
    {
        "company": "SMART IT FRAME",
        "job_title": "Sr. Java Full Stack Developer",
        "location": "Fort Worth, TX, USA",
        "full_location": {
            "city": "Fort Worth",
            "state": "TX",
            "country": "USA"
        },
        "job_details": {
            "employment_type": [
                "full-time",
                "third party"
            ],
            "job_code": "",
            "experience_required": "8+ years",
            "degree_required": "Not specified",
            "visa_sponsorship": "Not specified",
            "notice_period": "Not specified",
            "duration": "Long Term",
            "rate": "Not specified"
        },
        "skills": {
            "core": [
                "Java",
                "React",
                "Spring Boot",
                "AWS"
            ],
            "primary": [
                "JavaScript",
                "Apache Spark",
                "Hadoop",
                "Oracle",
                "Postgres",
                "DynamoDB",
                "Agile",
                "Communication Skills"
            ],
            "secondary": [
                "Java 8 or higher",
                "UI Development",
                "Backend Development",
                "Data Ingestion",
                "Collaboration",
                "POC"
            ],
            "all": [
                "Java",
                "React",
                "Spring Boot",
                "AWS",
                "JavaScript",
                "Apache Spark",
                "Hadoop",
                "Oracle",
                "Postgres",
                "DynamoDB",
                "Agile",
                "Communication Skills",
                "Java 8 or higher",
                "UI Development",
                "Backend Development",
                "Data Ingestion",
                "Collaboration",
                "POC"
            ]
        },
        "job_type": [
            "onsite"
        ],
        "contact_person": "Sona Chhabra",
        "email": "sona@smartitframe.com",
        "jd": "Role \u2013 Sr. Java Full Stack Developer\nLocation \u2013 Fort Worth, TX - Onsite\nDuration: Long Term\nNeed only Local for F2F Interview\nJob Description: Responsibilities\nReact Js Experience\n8+ years of Core Java development experience, familiar with Java 8 or higher.\nJava Full stack engineers with UI, and backend skillsets using Java, JavaScript\u2019s, and React Framework\nApache Spark developer with Java/Scala (Building reusable framework and toolsets for DQ, Realtime Streaming and Batch data process and data ingestion)\nGeneral support resource with Hadoop and database skills\nAble to deliver end to end project.\nExperience with java development and aware of java patterns.\nExperience in Spring Boot uses for development.\nExperience of development project and developed functionalities using java, j2ee.\nMust have AWS experience.\nAWS services (S3, SQS, SNS,ECS, Lambda, AWS Cloud watch etc.)\nExperience on AWS deployed application.\nExperience on Oracle or Postgres or DynamoDB to perform SQL.\nAgile/scrum development experience.\nGood collaboration and communication skills.\nReady to learn new technologies and perform POC on it.\nAbility to diagnose prod issues and defects.",
        "source": "Email",
        "date_posted": "2024-10-10 17:08:16-05:00",
        "unique_id": "19278f1f827c116f",
        "emp_type": [
            "full-time",
            "third party"
        ],
        "tag": "Java developer"
    }
]