[
    {
        "company": "Mavinsys",
        "job_title": "Sr. Java Backend Developer",
        "location": "Basking Ridge, NJ, USA",
        "full_location": {
            "city": "Basking Ridge",
            "state": "NJ",
            "country": "USA"
        },
        "job_details": {
            "employment_type": [
                "full-time",
                "contract",
                "third party"
            ],
            "job_code": "",
            "experience_required": "12-15 years",
            "degree_required": "Bachelor's degree in Computer Science or Electronics or Electrical Engineering",
            "visa_sponsorship": "Not specified",
            "notice_period": "Not specified",
            "duration": "Not specified",
            "rate": "Not specified"
        },
        "skills": {
            "core": [
                "Java",
                "Microservices",
                "Cassandra",
                "AWS",
                "DevOps"
            ],
            "primary": [
                "J2EE",
                "Spring",
                "Spring Boot",
                "UNIX",
                "Agile Development"
            ],
            "secondary": [
                "XML",
                "JIRA",
                "Confluence",
                "Git",
                "Stash",
                "Oracle SQL/PL-SQL",
                "Shell Scripts",
                "CRON"
            ],
            "all": [
                "Java",
                "Microservices",
                "Cassandra",
                "AWS",
                "DevOps",
                "J2EE",
                "Spring",
                "Spring Boot",
                "UNIX",
                "Agile Development",
                "XML",
                "JIRA",
                "Confluence",
                "Git",
                "Stash",
                "Oracle SQL/PL-SQL",
                "Shell Scripts",
                "CRON"
            ],
            "with_experience": [
                "Java (12+ years)",
                "Microservices",
                "Cassandra",
                "AWS (preferably certified)"
            ]
        },
        "job_type": [
            "hybrid"
        ],
        "contact_person": "saisekhar",
        "email": "saisekhar.n@mavinsys.com",
        "jd": "From: saisekhar, mavinsys saisekhar.n@mavinsys.com Reply to: saisekhar.n@mavinsys.com Req: Sr. Java Backend developer with AWS Certified and Cassandra and CRON exp; Location: Basking Ridge-NJ( Hybrid - 2x a week in the office)Note: Please source the profiles who have telecom client experience like AT&T Or CISCO etc. Targeted Years of Experience: 12 to 15Yrs resumeResponsible for the design and development of medium to highly complex systems. Skills include system design and analysis as well as business skills. Works with data and project managers to understand systems and consults with customers to understand needs. Developments and implements new systems, corrects software errors in existing systems, and works to improve performance through hardware upgrades. Manages computer systems in a business environment and responsible for resolving technical issues. Knowledgeable in programming, data structures, computer systems, and software engineering. Bachelor's degree in computer science, software engineering, or other related field. Ability to manage multiple assignments. Superior written and oral communication skills. 6-10+ years of experience.As a Senior Java Developer, you will design and implement a highly scalable, highly available application for Verizon Wireless. You will implement next gen platform using open source / open systems, which is cloud enabled and based on Micro services architecture.\u00b7 Design, Architect and create solutions using java, micro service and Cassandra No SQL Database\u00b7 Strong analytical and diagnostic skills\u00b7 Analysis, design for the products and services in the Wireless business to fulfill the needs of strategic initiatives\u00b7 Understand the business needs and make critical design decisions an implement the same with other team members\u00b7 Participate in day to day activities involving design, development, test support, deployment and production monitoring and support for Order Management platform\u00b7 Communicate with external teams including business clients on various issues and resolutions to provide the best customer experience\u00b7 Participate in requirement gathering and create design documents. AWS and Cassandra certification preferredMust Have:Over 12+ years of experience in the Software Development Industry.4 years of Bachelor\u2019s degree in Computer Science or Electronics or Electrical EngineeringStrong with DevOps open source tools and AWS cloud services \u2013 Preferably AWS certifiedExperience developing applications using Java, J2EE and springExperienced with Various J2EE application servers like WebSphere, Tomcat and spring boot.Demonstrates hands-on experience in UNIX environment and related UNIX utilities including shell scripts and CRON.Experience handling complete product releases from development, integration, testing, to productionExperience with agile development and must have knowledge of XML schemas, JIRA, Confluence, Git, and Stash.Hands on experience with Spring BootExperience in implementing critical high-availability applications and experience in MicroservicesExperience with No SQL technology \u2013 CassandraProblem-solving skills to develop quick yet sound solutions to resolve complex issues.Teamwork & collaboration skills to work across organizations and lead cross-functional teams including offshore resourcesGood Communication & stakeholder management skillsProgramming Language(s): Competency in Oracle SQL/PL-SQL, working knowledge of-Java, exposure to CassandraApplication(s): DB tool SQL Developer or Toad, SoapUI, XML Spy.",
        "source": "Email",
        "date_posted": "2024-10-10 09:26:12-05:00",
        "unique_id": "19277281a6647c32",
        "emp_type": [
            "full-time",
            "contract",
            "third party"
        ],
        "tag": "Java developer"
    }
]