[
    {
        "company": "Gacsol",
        "job_title": "AWS-Snowflake Data Engineer for EDW",
        "location": "Orlando, FL, USA",
        "full_location": {
            "city": "Orlando",
            "state": "FL",
            "country": "USA"
        },
        "job_details": {
            "employment_type": [
                "third party"
            ],
            "job_code": "",
            "experience_required": "12+ years",
            "degree_required": "Not specified",
            "visa_sponsorship": "Not specified",
            "notice_period": "Not specified",
            "duration": "Not specified",
            "rate": "Not specified"
        },
        "skills": {
            "core": [
                "AWS",
                "Snowflake",
                "Python",
                "SQL"
            ],
            "primary": [
                "S3",
                "Managed Airflow (MWAA)",
                "Glue",
                "Lambda",
                "Redshift",
                "IAM",
                "data pipeline solution design",
                "data warehousing concepts"
            ],
            "secondary": [
                "Hadoop",
                "Spark",
                "Kafka",
                "data governance",
                "data security",
                "data privacy",
                "communication skills"
            ],
            "all": [
                "AWS",
                "Snowflake",
                "Python",
                "SQL",
                "S3",
                "Managed Airflow (MWAA)",
                "Glue",
                "Lambda",
                "Redshift",
                "IAM",
                "data pipeline solution design",
                "data warehousing concepts",
                "Hadoop",
                "Spark",
                "Kafka",
                "data governance",
                "data security",
                "data privacy",
                "communication skills"
            ]
        },
        "job_type": [
            "remote"
        ],
        "contact_person": "Barla Santosh",
        "email": "sbarla@gacsol.com",
        "jd": "From: Barla Santosh, Gacsol sbarla@gacsol.com Reply to: sbarla@gacsol.com Title: AWS-Snowflake Data Engineer for EDW Location: ORLANDO FL (Remote) JOB DESCRIPTION: 12+ years of experience in AWS data engineering and very strong in data pipeline solution design.Extensive experience with AWS services such as S3, Managed Airflow (MWAA), Glue, Lambda, Redshift and IAM.3+ years of proven experience with Snowflake, including database design, data loading, and query optimization.Strong proficiency in Python for data manipulation, ETL processes, and automation.Proficient in SQL and experience with data warehousing concepts.Knowledge of data governance and best practices in data security and privacy.Provide technical leadership and guidance to the data engineering team.Proven track record of designing and implementing data solutions at scale.Familiarity with big data technologies such as Hadoop, Spark, or Kafka.Strong communication skills, both written and verbal, with the ability to explain technical concepts. Thanks,Barla SantoshTechnical RecruiterE: Sbarla@gacsol.com www.gacsol.com\u2018Experts in Digitalization and Engineering - Enterprise 4.0\u2019",
        "source": "Email",
        "date_posted": "2024-10-25 13:45:48-05:00",
        "unique_id": "192c5955849bb009",
        "emp_type": [
            "third party"
        ],
        "tag": "AWS Data Engineer"
    }
]