[
    {
        "company": "Altitude Technology Solutions",
        "job_title": "QA/BA HCM Tester",
        "location": "San Jose, CA, USA",
        "full_location": {
            "city": "San Jose",
            "state": "CA",
            "country": "USA"
        },
        "job_details": {
            "employment_type": [
                "contract",
                "third party"
            ],
            "experience_required": "Not specified",
            "degree_required": "Not specified",
            "visa_sponsorship": "Not specified",
            "notice_period": "Not specified",
            "duration": "Not specified",
            "rate": "Not specified"
        },
        "skills": {
            "core": [
                "Oracle HCM",
                "Requirement Gathering",
                "Testing",
                "Test Planning",
                "Defect Management"
            ],
            "primary": [
                "Documentation",
                "Test Execution",
                "User Acceptance Testing (UAT)",
                "Compliance",
                "Best Practices"
            ],
            "secondary": [
                "HR Processes",
                "Business Requirement Documents (BRDs)",
                "Process Flow Diagrams",
                "Cross-functional Collaboration",
                "Root Cause Analysis"
            ],
            "all": [
                "Oracle HCM",
                "Requirement Gathering",
                "Testing",
                "Test Planning",
                "Defect Management",
                "Documentation",
                "Test Execution",
                "User Acceptance Testing (UAT)",
                "Compliance",
                "Best Practices",
                "HR Processes",
                "Business Requirement Documents (BRDs)",
                "Process Flow Diagrams",
                "Cross-functional Collaboration",
                "Root Cause Analysis"
            ]
        },
        "job_type": [
            "remote"
        ],
        "contact_person": "Ravinder Sharma",
        "email": "r.sharma@atsitinc.com",
        "jd": "From: Ravinder Sharma, ATS inc r.sharma@atsitinc.com Reply to: r.sharma@atsitinc.com Super Urgent RoleQA/BA HCM TesterSan Jose CA Remote Contract Role We are seeking a skilled and detail-oriented Oracle HCM QA / BA to join our team. The ideal candidate will have experience in requirementgathering / testing Oracle HCM applications, with a strong understanding of HR processes and systems. You will be responsible for ensuringthe quality and functionality of Oracle HCM modules by developing and executing test plans, cases, and scripts.Job Description Requirements Gathering & Documentation:Work with key stakeholders (HR, Payroll, Benefits teams) to understand business needs and challenges.Elicit, analyze, and document functional and technical requirements for HCM systems.Create detailed business requirement documents (BRDs), use cases, and process flow diagrams.Test Planning and Strategy:Develop, document, and maintain comprehensive test plans and test cases based on business requirements, functional specifications, andtechnical designs.Collaborate with cross-functional teams to define test strategy and testing standards for Oracle HCM modules.Test Execution:Execute manual and automated test scripts across Oracle HCM modules, including Core HR, Payroll, Benefits, Talent Management, and Time and Labor.Perform functional, integration, regression, and end-to-end testing to ensure the accuracy, stability, and performance of Oracle HCM applications.Defect Management:Identify, document, and track defects using standard defect management tools.Work closely with developers and business analysts to resolve issues and validate fixes.Conduct root cause analysis for defects and work towards continuous improvement of testing processes.Documentation and Reporting:Document test results, provide detailed bug reports, and create test metrics to track testing progress.Communicate test findings and status to stakeholders through regular reports and meetings.User Acceptance Testing (UAT) Support:Assist in UAT by preparing test environments, data, and guiding end-users through the testing process.Validate that all business requirements are met in the final solution.Compliance and Best Practices:Ensure that testing procedures comply with industry standards and best practices, including SOX, GDPR, and other regulatory requirements. RegardsRavinder SharmaR.sharma@atsitinc.comAltitude Technology Solutions ( ATS)https://www.atsitinc.com/",
        "source": "Email",
        "date_posted": "2024-10-25 08:38:29-05:00",
        "unique_id": "192c406fbfa3d12f",
        "emp_type": [
            "contract",
            "third party"
        ],
        "tag": "Business Analyst"
    }
]