[
    {
        "company": "Pransu Tech Solutions",
        "job_title": "Senior Solutions Architect AWS",
        "location": "Jersey City, NJ, USA",
        "full_location": {
            "city": "Jersey City",
            "state": "NJ",
            "country": "USA"
        },
        "job_details": {
            "employment_type": [
                "contract",
                "third party"
            ],
            "job_code": "",
            "experience_required": "15+ years",
            "degree_required": "Not specified",
            "visa_sponsorship": "No visa sponsorship",
            "notice_period": "Not specified",
            "duration": "Contract to hire",
            "rate": "Not specified"
        },
        "skills": {
            "core": [
                "AWS Professional Certification",
                "Advanced cloud implementation",
                "IaC tools",
                "Terraform",
                "CloudFormation"
            ],
            "primary": [
                "EC2",
                "Unix/Linux",
                "Ansible",
                "Kubernetes",
                "Serverless",
                "Kafka",
                "Networking and Security",
                "Identity and Access Management (IAM)",
                "Python",
                "Docker",
                "SDLC",
                "CI/CD best practices"
            ],
            "secondary": [
                "Azure experience"
            ],
            "all": [
                "AWS Professional Certification",
                "Advanced cloud implementation",
                "IaC tools",
                "Terraform",
                "CloudFormation",
                "EC2",
                "Unix/Linux",
                "Ansible",
                "Kubernetes",
                "Serverless",
                "Kafka",
                "Networking and Security",
                "Identity and Access Management (IAM)",
                "Python",
                "Docker",
                "SDLC",
                "CI/CD best practices",
                "Azure experience"
            ]
        },
        "job_type": [
            "onsite"
        ],
        "contact_person": "Tanupriya Singh",
        "email": "tanupriya@pransutechsolutions.com",
        "jd": "From: Tanupriya, Pransu tech solutions tanupriya@pransutechsolutions.com Reply to: tanupriya@pransutechsolutions.com Senior Solutions Architect AWS Jersey City, NJ - 3 days a week onsiteContract to hireMust Have Domain :- Investment Banking and FinancialLOCAL ONLY Qualifications: \u2022 15+ years of relevant experience \u2022 Must have AWS Professional Certification \u2022 Advanced cloud implementation experience using compute, storage, networking and security services and cloud native best Practices on AWS. \u2022 Proven background working in an Enterprise IT environment. \u2022 Familiar with IaC tools, Terraform, CloudFormation \u2022 Design capabilities aligned with the well-architected framework \u2022 EC2, Unix/Linux, User Data, Ansible \u2022 Kubernetes, Serverless \u2022 Experience with Kafka a plus \u2022 Networking and Security \u2022 Identity and Access Management (IAM) \u2022 Python, Docker \u2022 Experience collaborating with Infrastructure and Application teams \u2022 Self-disciplined, self-starter who can provide leadership and mentor others while resolving complex incident and delivering projects \u2022 Knowledge of SDLC and CI/CD best practices \u2022 Azure experience not required, but nice to have Responsibilities: \u2022 Design, build, and maintain CI/CD pipelines that deploy customers' applications to cloud infrastructure while promoting security and cloud computing best practices. \u2022 Use infrastructure as code tools to automate immutable infrastructure \u2022 Manage, configuration, administration, and maintain AWS services \u2022 Provide guidance to Application and Business teams on infrastructure design decisions \u2022 Collaborate and liaise with various technical teams on escalations, development of cloud and managed services \u2022 Drive DevOps team process improvement wit Enterprise IT cloud management capabilities \u2022 Identify opportunities for threat management and critical upgrades \u2022 Utilize enterprise SaaS products to align with business technology needs \u2022 Continuously learn to keep up with industry trends and best practices \u2022 Manage multiple projects simultaneously and can adapt to changing business needs \u2022 Work well with cross functional global and remote teams.",
        "source": "Email",
        "date_posted": "2024-10-25 10:49:05-05:00",
        "unique_id": "192c47e2562de3eb",
        "emp_type": [
            "contract",
            "third party"
        ],
        "tag": "AWS Data Engineer"
    }
]