[
    {
        "company": "RITWIK Infotech",
        "job_title": "Java Integration Lead",
        "location": "USA",
        "full_location": {
            "city": "",
            "state": "",
            "country": "USA"
        },
        "job_details": {
            "employment_type": [
                "third party"
            ],
            "job_code": "",
            "experience_required": "15+ years",
            "degree_required": "Not specified",
            "visa_sponsorship": "Not specified",
            "notice_period": "Not specified",
            "duration": "6 to 12 Months",
            "rate": "Not specified"
        },
        "skills": {
            "core": [
                "Java v1.8 & Above",
                "Microservices",
                "Spring Boot",
                "GIT"
            ],
            "primary": [
                "JAVA/J2EE technology",
                "Application development using Java/J2EE/Spring Boot on Microservices Architecture",
                "Excellent communication skills",
                "Distributed systems using Microservice architecture",
                "RESTful API design and development",
                "Spring Integration"
            ],
            "secondary": [
                "Google Cloud Platform",
                "Google Kubernetes Engine",
                "Retail Domain knowledge",
                "Agile Methodology",
                "Oracle"
            ],
            "all": [
                "Java v1.8 & Above",
                "Microservices",
                "Spring Boot",
                "GIT",
                "JAVA/J2EE technology",
                "Application development using Java/J2EE/Spring Boot on Microservices Architecture",
                "Excellent communication skills",
                "Distributed systems using Microservice architecture",
                "RESTful API design and development",
                "Spring Integration",
                "Google Cloud Platform",
                "Google Kubernetes Engine",
                "Retail Domain knowledge",
                "Agile Methodology",
                "Oracle"
            ],
            "with_experience": [
                "Java (15+ years)",
                "Microservices",
                "Spring Boot"
            ]
        },
        "job_type": [
            "remote"
        ],
        "contact_person": "Sai Prakash",
        "email": "saiprakash@ritwikinfotech.com",
        "jd": "From: saiprakash, RITWIK Infotech saiprakash@ritwikinfotech.com Reply to: saiprakash@ritwikinfotech.com Job Title: Java Integration LeadLocation \u2013 Remote (Client is in Pittsburgh, PA/EST)Duration: 6 to 12 Months Note from the client - Looking for someone with lead experience in retail (highly preferable) and expertise in Java and Spring Boot to lead a team of 2-5 developers. This individual will be responsible for architecting integrations, performing detailed design, and coding, conducting code reviews, managing deployments using Bamboo, and triaging production issues. The role also involves coordinating with cross-functional teams, including Product, Solution Architecture, and Business teams, to ensure alignment and successful project delivery. Must Have: Please make sure the below skills are highlighted in the resumeJava v1.8 & Above, Microservices, Spring Boot, GIT (version control Tool)15+ years of experience in JAVA/J2EE technology.Proficiency in application development using Java/J2EE/Spring Boot on Microservices Architecture.Excellent communication skill and capable of handling business team discussion to understand the requirement.Experience developing distributed systems using Microservice architecture (event-based), containerization, and cloud platforms Strong knowledge of Microservices, RESTful API design and developmentHands on exp in SpringBoot, Microservices, Spring Integration Good hands-on experience in a code version control tool, preferably GIT Nice to Have: Please make sure the below skills are highlighted in the resume if they have the experience.Google Cloud Platform, Google Kubernetes Engine, Retail Domain knowledge Job Description:15+ years of experience in JAVA/J2EE technology.The Architect will lead any investigations of new software, frameworks or tools as well as any POCs for the same. The Architect will work closely with Agile teams to implement any solutions in this space.Interact with both the Product Management and UX/CX teams as well as the Engineering team to ensure feature requests are turned into actionable tech stories.Proficiency in application development using Java/J2EE/Spring Boot on Microservices Architecture.Excellent communication skill and capable of handling business team discussion to understand the requirement.Experience developing distributed systems using Microservice architecture (event-based), containerization, and cloud platforms Strong knowledge of Microservices, RESTful API design and developmentHands on exp in SpringBoot, Microservices, Spring Integration Backend Database: OracleExtensive working knowledge in Agile Methodology.Good hands-on experience in a code version control tool, preferably GITCapable of performing under minimal supervision, multitasking and meeting deadlines as a team member.Exceptional ability to quickly master new concepts and capable of working in-group as well as individual contributor.Possess strong technical aptitude ThanksSai Prakash RITWIK Infotech - Oracle Certified Gold Partner",
        "source": "Email",
        "date_posted": "2024-10-25 13:08:32-05:00",
        "unique_id": "192c4fdd0ebd547d",
        "emp_type": [
            "third party"
        ],
        "tag": "Java developer"
    }
]