[
    {
        "company": "Vyze Inc.",
        "job_title": "Sr. Cloud Developer",
        "location": "USA",
        "full_location": {
            "city": "",
            "state": "",
            "country": "USA"
        },
        "job_details": {
            "employment_type": [
                "third party"
            ],
            "job_code": "",
            "experience_required": "8-10+ years",
            "degree_required": "Not specified",
            "visa_sponsorship": "No visa sponsorship",
            "notice_period": "Not specified",
            "duration": "Not specified",
            "rate": "Not specified"
        },
        "skills": {
            "core": [
                "Python",
                "AWS",
                "API Gateway",
                "Step Functions"
            ],
            "primary": [
                "SQL",
                "MongoDB",
                "DynamoDB",
                "DocumentDB",
                "Core Java",
                "Microservice",
                "NodeJS"
            ],
            "secondary": [
                "CloudWatch",
                "Cloud Formation",
                "S3",
                "Lambda Development",
                "Terraform",
                "Kafka",
                "ETL Building",
                "Git",
                "Gitlab",
                "Maven",
                "Gradle",
                "Jenkins",
                "Nexus",
                "Docker",
                "logging and monitoring in the cloud"
            ],
            "all": [
                "Python",
                "AWS",
                "API Gateway",
                "Step Functions",
                "SQL",
                "MongoDB",
                "DynamoDB",
                "DocumentDB",
                "Core Java",
                "Microservice",
                "NodeJS",
                "CloudWatch",
                "Cloud Formation",
                "S3",
                "Lambda Development",
                "Terraform",
                "Kafka",
                "ETL Building",
                "Git",
                "Gitlab",
                "Maven",
                "Gradle",
                "Jenkins",
                "Nexus",
                "Docker",
                "logging and monitoring in the cloud"
            ]
        },
        "job_type": [
            "remote"
        ],
        "contact_person": "Rahul Mishra",
        "email": "rmishra@vyzeinc.com",
        "jd": "From: Rahul Mishra, Vyzeinc rmishra@vyzeinc.com Reply to: rmishra@vyzeinc.com Sr. Cloud DeveloperMust have 8-10+ years of U.S.A work experience.Must have great communication skills to interact with leaders Location : Remote \u2022#1-Dallas/Ft. Worth area & TX; #2-CST; #3-EST (Only seeking CST or EST candidates. Will look at PST candidates if rock stars and available during 8 am \u2013 5 pm CST work hours. )Visa : GC & USC Must have 8+ years of recent U.S.-based work experience.Must haves: Python, AWS, API Gateway, Step Functions, and at least work experience with 2 of the following databases: SQL, MongoDB, DynamoDB, DocumentDBThey are converting old to new.This is on the Payments side. So must have experience with Payment applications. Successful candidate:10+ years of experience Heavy back-end focus (service to service integration components) TacticalCan get the work done; full lifecycle development experienceCloud Development skillsExperience in cloud development with a focus on payment applications.Able to write code dailyAble to tackle ongoing production supportCan Educate New-to-AWS Technologists in best practicesCan work with unclear requirementsVery self-sufficient to a high degree, can work on their own Quick learner and problem solver Able to dig in and learn environment quicklyFun, positive attitudeFits team culture and personalityLeadership skills Required Skills: Extensive AWS Cloud development experienceBackend DevelopmentDev skills: Core Java/Microservice, NodeJS, Python (strongest skill Python).Experience in cloud development with a focus on payment applications.Understanding of API specs and design principlesAPI Gateway, State Machine, AWS Step FunctionsCloudWatchCloud FormationS3Lambda Development (Python)TerraformRelational DB, MySQL, Mongo, DynamoDB, DocumentDB, etc.KafkaETL Building (Extract, Transform, and Load) Experience Git or Gitlab Build Tooling- Maven/Gradle, Jenkins, Nexus, DockerHuge plus skill: logging and monitoring in the cloud Best RegardsRahul Mishra US Technical Recruiter |Vyze Inc.E-Mail: rmishra@vyzeinc.com",
        "source": "Email",
        "date_posted": "2024-10-25 20:49:01-05:00",
        "unique_id": "192c6a3610fec10a",
        "emp_type": [
            "third party"
        ],
        "tag": "AWS Data Engineer"
    }
]