[
    {
        "company": "CAGUS",
        "job_title": "Java AWS Developer",
        "location": "New York, NY, USA",
        "full_location": {
            "city": "New York",
            "state": "NY",
            "country": "USA"
        },
        "job_details": {
            "employment_type": [
                "third party"
            ],
            "job_code": "",
            "experience_required": "Not specified",
            "degree_required": "Not specified",
            "visa_sponsorship": "Not specified",
            "notice_period": "Not specified",
            "duration": "Not specified",
            "rate": "Not specified"
        },
        "skills": {
            "core": [
                "Java",
                "Spring",
                "Microservices",
                "AWS"
            ],
            "primary": [
                "Spring boot",
                "Terraform"
            ],
            "secondary": [
                "Agile",
                "J2EE",
                "Webservices",
                "PL/SQL",
                "Object Oriented Analysis",
                "Object Oriented Design",
                "GIT",
                "Jenkins",
                "MVC",
                "Java Design Patterns",
                "JUnit",
                "Oracle",
                "SQL Server",
                "SQL",
                "SOAP",
                "REST",
                "IntelliJ",
                "Maven",
                "Tomcat"
            ],
            "all": [
                "Java",
                "Spring",
                "Microservices",
                "AWS",
                "Spring boot",
                "Terraform",
                "Agile",
                "J2EE",
                "Webservices",
                "PL/SQL",
                "Object Oriented Analysis",
                "Object Oriented Design",
                "GIT",
                "Jenkins",
                "MVC",
                "Java Design Patterns",
                "JUnit",
                "Oracle",
                "SQL Server",
                "SQL",
                "SOAP",
                "REST",
                "IntelliJ",
                "Maven",
                "Tomcat"
            ]
        },
        "job_type": [
            "onsite"
        ],
        "contact_person": "SivaBalan",
        "email": "sivabalan.c@cagus.com",
        "jd": "From: SivaBalan, CAGUS sivabalan.c@cagus.com Reply to: sivabalan.c@cagus.com Position: Java AWS Developer Location: New York, NY, Wilmington, DE, Jersey City, NJ skills: Java, Spring boot, Microservices, AWS, Terraform Job Description:Experience in Agile software development methodology and practices with full development lifecycle from inception through implementation.Required: Java, J2EE, Spring, Microservice, Webservices, PL/SQLWorking knowledge of Object Oriented Analysis/Object Oriented Design methodologies and life cycles.Demonstrated experience with SCM tools such as GIT, JenkinsExperience with application development on Java, J2EE, Spring, and MVC, Java Design Patterns and JUnit.Knowledge of Relational Databases like Oracle/SQL Server, SQLKnowledge of Web service technologies including SOAP/REST.Strong working knowledge of IntelliJ, Maven and Tomcat.Ability to work collaboratively in teams and develop meaningful relationships to achieve common goalsKnowledge of architecture, design and business processesProficiency in modern programming languagesExperience in design and build of complex application systems using the new banking architecture including Java/J2EE/Spring technologies. Proficiency in one or more general purpose programming languages including Java/J2EE/JSP based Web applications/Middleware and Batch systems.Experience in design, analysis, development, coding, unit testing, debug and documentation for Java/J2EE systems including Web applications, business services, batch applications, large/complex projects and utilizing Web Services and Java RMI technologies to improve interface/API and significantly enhance integration capability between front-end and back-end systems",
        "source": "Email",
        "date_posted": "2024-10-25 09:06:13-05:00",
        "unique_id": "192c41ff9d653124",
        "emp_type": [
            "third party"
        ],
        "tag": "Java developer"
    }
]