[
    {
        "company": "Dewsoftech",
        "job_title": "HCM Learning Project Manager",
        "location": "USA",
        "full_location": {
            "city": "",
            "state": "",
            "country": "USA"
        },
        "job_details": {
            "employment_type": [
                "third party"
            ],
            "job_code": "",
            "experience_required": "Not specified",
            "degree_required": "Not specified",
            "visa_sponsorship": "Not specified",
            "notice_period": "Not specified",
            "duration": "12+ months",
            "rate": "Not specified"
        },
        "skills": {
            "core": [
                "Workday Project Manager",
                "HCM project management",
                "Workday Learning",
                "HR processes",
                "Stakeholder Management"
            ],
            "primary": [
                "Project timelines",
                "Data & content conversion",
                "Training sessions scheduling",
                "Design decisions",
                "Communication with stakeholders"
            ],
            "secondary": [
                "Attention to detail",
                "Self-motivated",
                "Proactive",
                "Minimal supervision"
            ],
            "all": [
                "Workday Project Manager",
                "HCM project management",
                "Workday Learning",
                "HR processes",
                "Stakeholder Management",
                "Project timelines",
                "Data & content conversion",
                "Training sessions scheduling",
                "Design decisions",
                "Communication with stakeholders",
                "Attention to detail",
                "Self-motivated",
                "Proactive",
                "Minimal supervision"
            ]
        },
        "job_type": [
            "remote"
        ],
        "contact_person": "Mike Henry",
        "email": "Mike@dewsoftech.com",
        "jd": "From: Mike, Dewsoftech mike@dewsoftech.com Reply to: mike@dewsoftech.com Position: HCM Learning Project ManagerLocation: Remote but must live in EST or CSTDuration: 12+ monthsInterview: Video We have an immediate opening for a HCM Learning Project Manager. This position can be available to those working remotely in the US. What you\u2019ll do: Overall responsible to drive AP deliverable and deadlines on project plan aligning and working closely with PWC project manager Drive AP project timelines and deliverables with AP WSLsStakeholder Management and EngagementManage the data & content conversion activities and resolving issues and risk Responsible for scheduling training sessions internallyWorks closely with the process owner and provides expert guidance on design decisionsActively participates in design sessionsActively communicates with the AP WSL including OCM with them on daily basisProvides input ensuring that design decisions are consistent with the governance model and policiesResponsible for making sure Workstream Lead are aligned on the operating model, roles & responsibilitiesUpdate existing support model with input from key stakeholders, Workday, Integration and transition to business as usual \u2018BAU\u2019 Supports the team with Works Council requirements around reporting and data collectionResponsible for building translations strategy and supporting the team by closely working with the translation's vendor What we\u2019re looking for: Workday Project Manager and / or other HCM project management experience, preferably Workday LearningExperience executing global and complex projects Understanding of HR processes and data High attention to detail, ability to communicate effectively across a variety of audiences including senior management Self-motivated, proactive, and able to work under minimal supervision at detailed levels Thanks & Regards Mike HenrySenior IT RecruiterPh No: (302) 318-9135 (Direct)Email: Mike@dewsoftech.com",
        "source": "Email",
        "date_posted": "2024-10-25 09:36:13-05:00",
        "unique_id": "192c43d48bae0179",
        "emp_type": [
            "third party"
        ],
        "tag": "Project Manager"
    }
]