[
    {
        "company": "SoniTalent Corporation",
        "job_title": "Business Analyst",
        "location": "Deerfield Beach, FL, USA",
        "full_location": {
            "city": "Deerfield Beach",
            "state": "FL",
            "country": "USA"
        },
        "job_details": {
            "employment_type": [
                "contract",
                "third party"
            ],
            "job_code": "",
            "experience_required": "Mid-level, 5+ years",
            "degree_required": "Not specified",
            "visa_sponsorship": "No visa sponsorship",
            "notice_period": "Not specified",
            "duration": "6+ months",
            "rate": "Not specified"
        },
        "skills": {
            "core": [
                "Back End Application Support",
                "Integrations",
                "APIs",
                "Communication",
                "Accountability"
            ],
            "primary": [
                "Azure ADO Environment",
                "PowerApps",
                "Monitoring within Azure",
                "Synthetic transactions for QA and Performance",
                "ServiceNow"
            ],
            "secondary": [],
            "all": [
                "Back End Application Support",
                "Integrations",
                "APIs",
                "Communication",
                "Accountability",
                "Azure ADO Environment",
                "PowerApps",
                "Monitoring within Azure",
                "Synthetic transactions for QA and Performance",
                "ServiceNow"
            ]
        },
        "job_type": [
            "onsite"
        ],
        "contact_person": "Bhuwan Tiwari",
        "email": "bhuwan.tiwari@sonitalentcorp.com",
        "jd": "From: bhuwan tiwari, Sonitalentcorp bhuwan.tiwari@sonitalentcorp.com Reply to: bhuwan.tiwari@sonitalentcorp.com Job Title: Business Analyst Location: Deerfield Beach, FL ( Local to Deerfield Beach, FL ) or near by locations consultantsDuration: 6+ monthsInterview: Phone/ Skype-2Rounds Visa: USC and GCLinkedin Must haveJob Description:Application Back End SupportREQUIREMENTS:\u00b7 Local to South Florida.\u00b7 Must work in the office a minimum of 3 days per week.\u00b7 Mid-level Business Analyst (5+ years)\u00b7 Back End Application Support (Integrations, APIs, etc) (NOT tech, network, operational, or computer support)o knowledge of integrations and APIs are a must. Any platform is good (eg Informatica, ADF, DataStage, etc)\u00b7 Interaction with Business and IT Teams is essential.\u00b7 Communication of business needs in support for application back end (eg integrations, apis) to technical teams.\u00b7 Accountability (ability to take ownership and execute)o In resume this could be identified by having led a team or having been a scrum master (which shows accountability and ability to guide)\u00b7 Good communication and writing skills (Typical BA skills)PLUS (but not required):\u00b7 Azure ADO Environment (Epic, Stories, etc) \u00b7 Knowledge of PowerApps in Azure\u00b7 Monitoring within Azure\u00b7 Synthetic transactions for QA and Performance (and understanding the reasons for it) \u00b7 ServiceNowOTHER:\u00b7 Client eventually wants to hire this person after 12 months (as per our agreement with JM&A)\u00b7 Make sure that the resume/CV is only 1-2 pages and speaks to the requirements. Thanks, Bhuwan TiwariSr.Technical Recruiter SoniTalent Corporation I5404 Merribrook Lan--e, Prospect, KY, USA bhuwan.tiwari@sonitalentcorp.com",
        "source": "Email",
        "date_posted": "2024-10-25 14:56:09-05:00",
        "unique_id": "192c560552c2c258",
        "emp_type": [
            "contract",
            "third party"
        ],
        "tag": "Business Analyst"
    }
]