[
    {
        "company": "Siri Info",
        "job_title": "Oracle HCM Business Analyst",
        "location": "USA",
        "full_location": {
            "city": "",
            "state": "",
            "country": "USA"
        },
        "job_details": {
            "employment_type": [
                "contract",
                "third party"
            ],
            "job_code": "",
            "experience_required": "Not specified",
            "degree_required": "Not specified",
            "visa_sponsorship": "Not specified",
            "notice_period": "Not specified",
            "duration": "6 months",
            "rate": "Not specified"
        },
        "skills": {
            "core": [
                "Oracle HCM modules",
                "Requirements Gathering",
                "Analytical skills",
                "Problem-solving skills",
                "Communication skills"
            ],
            "primary": [
                "Process mapping",
                "Documentation",
                "Project management methodologies"
            ],
            "secondary": [
                "Certification in Oracle HCM modules",
                "Experience with Oracle Cloud HCM",
                "Experience in a consulting or implementation environment"
            ],
            "all": [
                "Oracle HCM modules",
                "Requirements Gathering",
                "Analytical skills",
                "Problem-solving skills",
                "Communication skills",
                "Process mapping",
                "Documentation",
                "Project management methodologies",
                "Certification in Oracle HCM modules",
                "Experience with Oracle Cloud HCM",
                "Experience in a consulting or implementation environment"
            ]
        },
        "job_type": [
            "remote"
        ],
        "contact_person": "Rupesh Mourya",
        "email": "rupesh@siriinfo.com",
        "jd": "From: Rupesh, Siri Info rupesh@siriinfo.com Reply to: rupesh@siriinfo.com Oracle HCM Business Analyst 6 months contract Job Description: Oracle HCM Business Analyst Job Summary: Client is seeking a skilled Oracle HCM Business Analyst to join our team. The ideal candidate will have a strong understanding of Oracle HCM modules and be able to effectively gather, analyze, and document business requirements. This role will play a crucial part in ensuring successful implementations and ongoing support of Oracle HCM solutions. Responsibilities: Requirements Gathering: Gather, build, and document detailed process requirements (global and regional) for various Oracle HCM modules, including Hire, Onboard, Benefits, Rewards, Transfers, and Offboard. Design Workshops: Prepare for design workshops by gathering necessary documentation, data, and scheduling meetings. Take detailed notes during workshops. Testing and Launch Readiness: Support user and agent testing, ensuring that the system meets business requirements and is ready for launch. Assist in developing cutover plans. Reporting and Analytics: Define reporting and analytics requirements for processes within Oracle HCM. Communication and Enablement: Build communications, training materials, knowledge bases, and enablement resources for delivery teams. Content Creation: Design and update employee-facing articles, help text, notifications, and other communication materials. Qualifications: Proven experience as an Oracle HCM Business Analyst Strong understanding of Oracle HCM modules, including Hire, Onboard, Benefits, Rewards, Transfers, and Offboard Excellent analytical and problem-solving skills Strong communication and interpersonal skills Ability to work independently and as part of a team Experience with process mapping and documentation Knowledge of project management methodologies Preferred Qualifications: Certification in Oracle HCM modules Experience with Oracle Cloud HCM Experience in a consulting or implementation environment If you are a highly motivated and skilled Oracle HCM Business Analyst looking for a challenging and rewarding opportunity, we encourage you to apply. Thanks & Regards, Rupesh Mourya Email: Rupesh@siriinfo.com",
        "source": "Email",
        "date_posted": "2024-10-25 16:03:02-05:00",
        "unique_id": "192c64706539b5cd",
        "emp_type": [
            "contract",
            "third party"
        ],
        "tag": "Business Analyst"
    }
]