[
    {
        "company": "iTech US Inc",
        "job_title": ".Net Developer",
        "location": "Tampa, FL, USA",
        "full_location": {
            "city": "Tampa",
            "state": "FL",
            "country": "USA"
        },
        "job_details": {
            "employment_type": [
                "contract",
                "third party"
            ],
            "job_code": "",
            "experience_required": "10+ years",
            "degree_required": "Not specified",
            "visa_sponsorship": "No visa sponsorship",
            "notice_period": "Not specified",
            "duration": "12+ months contract",
            "rate": "$52/hr on C2C"
        },
        "skills": {
            "core": [
                "ASP .NET",
                "C#",
                "SQL"
            ],
            "primary": [
                "Reactor Angular",
                "Mongo DB",
                "Digital : ReactJS",
                "Digital : Angular 2",
                "PL/SQL",
                "ASP.NET 4.5"
            ],
            "secondary": [
                "Mentoring",
                "Project planning",
                "Risk management"
            ],
            "all": [
                "ASP .NET",
                "C#",
                "SQL",
                "Reactor Angular",
                "Mongo DB",
                "Digital : ReactJS",
                "Digital : Angular 2",
                "PL/SQL",
                "ASP.NET 4.5",
                "Mentoring",
                "Project planning",
                "Risk management"
            ]
        },
        "job_type": [
            "onsite"
        ],
        "contact_person": "Manasa Salla",
        "email": "manasa.s@itechus.net",
        "jd": "Hi..........Greetings, This is Manasa from ITech US Inc. Given below are the details of the position with one of our clients and was wondering if you would be interested or can recommend someone who would be interested in this job. Job Role: .Net DeveloperJob Location: Tampa, FloridaDuration: 12+ months contractWe are looking for H1 B candidates from Third-party VendorsLooking only local to Florida Consultant Rate : $52/hr on C2C with TCS without any VMS Charges Role Description: Must Have Technical/Functional Skills \u2022 10+ years experience, ASP .NET, Reactor Angular(preferred), SQL, Mongo DB\u2022 Leading and managing a team of .NET developers, assigning tasks and providing guidance and support.\u2022 Collaborating with stakeholders to gather and analyze requirements, and translating them into technical specifications.\u2022 Designing and architecting scalable and robust software solutions using the .NET framework.\u2022 Developing and coding software applications using C#, ASP.NET, and other .NET technologies.\u2022 Conducting code reviews and ensuring adherence to coding standards and best practices.\u2022 Troubleshooting and debugging complex software issues, and implementing effective solutions.\u2022 Collaborating with cross-functional teams, such as quality assurance, to ensure software quality and performance.\u2022 Keeping up-to-date with the latest .NET technologies, trends, and best practices, and recommending their adoption where applicable.\u2022 Mentoring and coaching junior developers, providing technical guidance and fostering their professional growth.\u2022 Assisting in project planning, estimation, and risk management activities.Competencies: Digital : ReactJS, Digital : Angular 2, PL/SQL, ASP.NET 4.5Experience (Years): 10 & Above Thanks & RegardsManasa SallaSr Technical RecruiteriTech US, Incmanasa.s@itechus.net",
        "source": "Email",
        "date_posted": "2024-10-25 13:18:44-05:00",
        "unique_id": "192c50727596a835",
        "emp_type": [
            "contract",
            "third party"
        ],
        "tag": ".net developer"
    }
]