[
    {
        "company": "GUNJAN, PINAKA STAFFING",
        "job_title": "Senior Project Manager",
        "location": "USA",
        "full_location": {
            "city": "",
            "state": "",
            "country": "USA"
        },
        "job_details": {
            "employment_type": [
                "third party",
                "contract"
            ],
            "job_code": "",
            "experience_required": "5+ Years",
            "degree_required": "University (Degree) Preferred",
            "visa_sponsorship": "Not specified",
            "notice_period": "Not specified",
            "duration": "Not specified",
            "rate": "Not specified"
        },
        "skills": {
            "core": [
                "Excellent organizational and time management skills",
                "Excellent communication and presentation skills",
                "Demonstrated project management experiences"
            ],
            "primary": [],
            "secondary": [
                "Financial services background",
                "Retail banking background",
                "Commercial banking background"
            ],
            "all": [
                "Excellent organizational and time management skills",
                "Excellent communication and presentation skills",
                "Demonstrated project management experiences",
                "Financial services background",
                "Retail banking background",
                "Commercial banking background"
            ],
            "with_experience": [
                "Project management (5+ years)"
            ]
        },
        "job_type": [
            "remote"
        ],
        "contact_person": "",
        "email": "gunjan@pinakastaffing.com",
        "jd": "From: GUNJAN, PINAKA STAFFING gunjan@pinakastaffing.com Reply to: gunjan@pinakastaffing.com Banking domain: EverBankSee job details:TIL 10/2025WC, USC, GC, G CEADRemote- Ideally located in Charlotte, Jacksonville or IrvineTop 3 Must-Haves (Hard and/or Soft Skills):1. Excellent organizational and time management skills2. Excellent communication and presentation skills3. Demonstrated project management experiencesTop 3 Nice-To-Haves (Hard and/or Soft Skills)1. Financial services background2. Retail banking background3. Commercial banking backgroundSenior Project ManagerThe Project Manager manages medium sized projects for a single business line or support program and portfolio managers in the PMO managing larger enterprise initiatives. The project manager develops project plans and manages the project execution through to completion.Key Responsibilities and Duties\u2022 Develops overall project strategy, in partnership with the portfolio lead and other impacted stakeholders\u2022 Develops holistic project plans including tasks and milestones across all business lines as well as technology and vendors, identifying and managing key dependencies and driving key project/program decisions.\u2022 Organizes project teams by assigning individual responsibilities, and determining resource requirements necessary to ensure project is successful.\u2022 Develops project budgets and works with finance and the business to determine and report actuals\u2022 Monitors and reports on the status of all assigned projects/program including clear and accurate issue and risk reporting.\u2022 Compiles and provides communication at various levels of the organization including development and delivery of executive level materials including steering committees where applicable.\u2022 Oversees and directs any project management vendor resources assigned to the projects and is accountable for their work product.\u2022 Serves as a liaison and builds bridges among cross-functional leadership teams.\u2022 Adheres to and promotes all EPMO policies and procedures within the project teamEducational Requirements\u2022 University (Degree) PreferredPMP certification requiredWork Experience\u2022 5+ Years Required; 7+ Years PreferredPhysical Requirements\u2022 Physical Requirements: Sedentary Work",
        "source": "Email",
        "date_posted": "2024-10-25 10:03:21-05:00",
        "unique_id": "192c455104f7497f",
        "emp_type": [
            "third party",
            "contract"
        ],
        "tag": "Project Manager"
    }
]