[
    {
        "company": "Talentgroups",
        "job_title": "Oracle PL/SQL Developer",
        "location": "Pittsburgh, PA, USA",
        "full_location": {
            "city": "Pittsburgh",
            "state": "PA",
            "country": "USA"
        },
        "job_details": {
            "employment_type": [
                "contract",
                "third party"
            ],
            "job_code": "",
            "experience_required": "Minimum 6 to 12 years",
            "degree_required": "Not specified",
            "visa_sponsorship": "Not specified",
            "notice_period": "Not specified",
            "duration": "Not specified",
            "rate": "$50/hr on c2c"
        },
        "skills": {
            "core": [
                "Oracle PL/SQL",
                "SQL",
                "PL/SQL programming",
                "Performance tuning"
            ],
            "primary": [
                "Requirement Gathering",
                "Analysis",
                "Design",
                "Development",
                "Unit Testing",
                "Production Deployment",
                "Support",
                "Creating PL/SQL Packages",
                "Procedures",
                "Functions",
                "Triggers",
                "Types",
                "Views"
            ],
            "secondary": [
                "Knowledge of manufacturing processes",
                "Knowledge on Steel/Aluminum industry process",
                "Knowledge of ISA 95",
                "Integration between MES, L2, ERP systems",
                "Understanding and Collecting requirements from Business user side",
                "Willingness to relocate",
                "Willingness to travel"
            ],
            "all": [
                "Oracle PL/SQL",
                "SQL",
                "PL/SQL programming",
                "Performance tuning",
                "Requirement Gathering",
                "Analysis",
                "Design",
                "Development",
                "Unit Testing",
                "Production Deployment",
                "Support",
                "Creating PL/SQL Packages",
                "Procedures",
                "Functions",
                "Triggers",
                "Types",
                "Views",
                "Knowledge of manufacturing processes",
                "Knowledge on Steel/Aluminum industry process",
                "Knowledge of ISA 95",
                "Integration between MES, L2, ERP systems",
                "Understanding and Collecting requirements from Business user side",
                "Willingness to relocate",
                "Willingness to travel"
            ]
        },
        "job_type": [
            "onsite"
        ],
        "contact_person": "Shiva Manish",
        "email": "shivamanish.b@talentgroups.com",
        "jd": "This is Shiva Manish I have an excellent job opportunity with one of our premier clients. Since it is an urgent business requirement your prompt response is appreciated.Job Title: Oracle PL/SQL Developer Location: Pittsburgh, PA (Onsite)Pay rate:$50/hr on c2c Minimum 6 to 12 years\u2019 Experience in product development Having good IT experience as an ORACLE PL/SQL Developer, involved in Requirement Gathering, analysis, Design, Development, Unit Testing, Production Deployment and Support.At least 4 years of experience in SQL and PL/SQL programming, developing complex code units.Solid Experience of creating PL/SQL Packages, Procedures, Functions, Triggers, Types, Views in Oracle.Knowledge of manufacturing processes. Knowledge on Steel/Aluminum industry process would be preferred.knowledge of ISA 95.knowledge of integration between MES , L2, ERP systems.Understanding and Collecting requirements from Business user side or Business Analyst and try to convert that requirement to PL SQL.Responsible for performance tuning activities in the project.Willing to relocate to Pittsburgh. Willing to work 50% of the time from office, sometimes flexible based on local teams decisions. Willing to travel to client location on important occasions like deployment, factory test etc.",
        "source": "Email",
        "date_posted": "2024-10-25 10:26:52-05:00",
        "unique_id": "192c490a3c8a9da5",
        "emp_type": [
            "contract",
            "third party"
        ],
        "tag": "Oracle DBA"
    }
]