[
    {
        "company": "Core Alliance Group Inc",
        "job_title": "GCP Infra Architect",
        "location": "USA",
        "full_location": {
            "city": "",
            "state": "",
            "country": "USA"
        },
        "job_details": {
            "employment_type": [
                "third party"
            ],
            "job_code": "",
            "experience_required": "Not specified",
            "degree_required": "Not specified",
            "visa_sponsorship": "Not specified",
            "notice_period": "Not specified",
            "duration": "Not specified",
            "rate": "Not specified"
        },
        "skills": {
            "core": [
                "GCP infra background",
                "Infrastructure as code development",
                "Cloud provisioning for multi-tenant environments",
                "Agile processes"
            ],
            "primary": [],
            "secondary": [],
            "all": [
                "GCP infra background",
                "Infrastructure as code development",
                "Cloud provisioning for multi-tenant environments",
                "Agile processes"
            ],
            "with_experience": []
        },
        "job_type": [
            "remote"
        ],
        "contact_person": "Abhijeet Karika",
        "email": "abhijeet.k@cagus.com",
        "jd": "From: Abhijeet, CAGUS abhijeet.k@cagus.com Reply to: abhijeet.k@cagus.com Position: GCP Infra ArchitectLocation: Remote ResponsibilitiesSkill Set Requirements: Must have: GCP infra background.Must have: Contribute to design, architecture, infrastructure as code development.Must have: Experience with repeatable cloud provisioning for multi-tenant environments.Experience with Agile processes. Experience leading projects, preferably Foundations projects. Thank You, Abhijeet KarikaSenior Technical Recruiter T: 732-313-0710 Extn 407M: 732-250-0702E: abhijeet.k@cagus.comW: www.cagus.comCore Alliance Group Inc | 370 Richard Mine Road | Wharton, NJ 07885 This email message from Core Alliance Group Inc is for the sole use of the intended recipient(s) and may contain confidential and privileged information. Any unauthorized review, use, disclosure or distribution is prohibited. If you are not the intended recipient, please contact the sender by reply email and destroy all copies of the original message. Opinions, conclusions and other information in this message that do not relate to the official business of Core Alliance Group Inc shall be understood as neither given nor endorsed by it. The company accepts no liability for any damage caused by any virus transmitted by this email.",
        "source": "Email",
        "date_posted": "2024-10-25 14:55:46-05:00",
        "unique_id": "192c5eb8e2f4909c",
        "emp_type": [
            "third party"
        ],
        "tag": "GCP Data Engineer"
    }
]