[
    {
        "company": "Vyze",
        "job_title": "AWS Developer",
        "location": "Trenton, NJ, USA",
        "full_location": {
            "city": "Trenton",
            "state": "NJ",
            "country": "USA"
        },
        "job_details": {
            "employment_type": [
                "full-time",
                "third party"
            ],
            "experience_required": "7 years",
            "degree_required": "Not specified",
            "visa_sponsorship": "Not specified",
            "notice_period": "Not specified",
            "duration": "Long Term",
            "rate": "Not specified"
        },
        "skills": {
            "core": [
                "Cloud Application Development",
                "Serverless Computing (AWS Lambda, etc.)",
                "Microservices Architecture",
                "API Development (RESTful)",
                "AWS SDKs and CLI",
                "AWS Services (S3, DynamoDB, API Gateway, File Transfer etc.)",
                "Automation and Scripting",
                "Security Best Practices",
                "Problem-Solving",
                "Testing (Unit, Integration)"
            ],
            "primary": [
                "Programming (Python, Java)",
                "AWS Solution Architect Certification",
                "AWS Sysops Admin Certification"
            ],
            "secondary": [],
            "all": [
                "Cloud Application Development",
                "Serverless Computing (AWS Lambda, etc.)",
                "Microservices Architecture",
                "API Development (RESTful)",
                "AWS SDKs and CLI",
                "AWS Services (S3, DynamoDB, API Gateway, File Transfer etc.)",
                "Automation and Scripting",
                "Security Best Practices",
                "Problem-Solving",
                "Testing (Unit, Integration)",
                "Programming (Python, Java)",
                "AWS Solution Architect Certification",
                "AWS Sysops Admin Certification"
            ]
        },
        "job_type": [
            "onsite"
        ],
        "contact_person": "hanshika",
        "email": "hanshika@vyzeinc.com",
        "jd": "From: hanshika, vyze hanshika@vyzeinc.com Reply to: hanshika@vyzeinc.com Job Description -Job Title - AWS Developer Job Location -Trenton , NJ ( 5 days per week on-site)MOI - Skype Duration - Long Term Note : - Need Local Folks along with LinkedIn New Update - if you can find another AWS Developer with cloud python and java, I can get them in, make sure they have maybe 9 years of experience not just 7, Cloud Application Development Required 7 YearsServerless Computing (AWS Lambda, etc.) Required 7 YearsMicroservices Architecture Required 5 YearsProgramming (Python, Java) Desired 5 YearsAPI Development (RESTful) Required 7 YearsAWS SDKs and CLI Required 7 YearsAWS Services (S3, DynamoDB, API Gateway, File Transfer etc.) Required 7 YearsAutomation and Scripting Required 7 YearsSecurity Best Practices Required 7 YearsProblem-Solving Required 7 YearsTesting (Unit, Integration) Required 7 YearsAWS Solution Architect Certification Highly desiredAWS Sysops Admin Certification Highly desired Job SummaryThe AWS Developer will need experience designing, developing, & deploying cloud-native applications on AWS.We are seeking an experienced AWS Developer to join our IT team.What You'll DoDesign and develop cloud-native applications using AWS services such as AWS Transfer Family, Glue, Lambda, VPC, DynamoDB, API Gateway, and S3Implement serverless architectures and microservices using AWS best practicesWrite clean, maintainable, and efficient code using programming languages such as Python, Node.js, or JavaDevelop and integrate RESTful APIs to support application functionalityCollaborate with architects, engineers, and product managers to understand requirements and translate them into technical solutionsUtilize AWS SDKs and tools to integrate with various AWS services and automate workflowsEnsure applications are secure, scalable, and optimized for performanceMonitor and troubleshoot application performance and resolve issues as they ariseWrite unit and integration tests to ensure application quality and reliabilityStay updated on AWS services and emerging cloud technologies to incorporate them into projectsRequiredWhat You'll NeedExperience with Cloud Application DevelopmentServerless Computing (AWS Lambda, etc.)Microservices ArchitectureAPI Development (RESTful)AWS SDKs and CLIAWS Services (S3, DynamoDB, API Gateway, File Transfer etc.)Automation and ScriptingSecurity Best PracticesProblem-SolvingTesting (Unit, Integration)DesiredAWS Solution Architect CertificationProgramming (Python, Java)AWS Sysops Admin CertificationPhysical DemandsAbility to safely and successfully perform the essential job functions consistent with the ADA and other federal, state, and local standardsSedentary work that involves sitting or remaining stationary most of the time with occasional need to move around the office to attend meetings, etc.Ability to conduct repetitive tasks on a computer, utilizing a mouse, keyboard, and monitor",
        "source": "Email",
        "date_posted": "2024-10-25 15:18:01-05:00",
        "unique_id": "192c5de30e66c435",
        "emp_type": [
            "full-time",
            "third party"
        ],
        "tag": "AWS Data Engineer"
    }
]