[
    {
        "company": "kk associates LLC",
        "job_title": "Pega Business Analyst Lead",
        "location": "Groton, CT, USA",
        "full_location": {
            "city": "Groton",
            "state": "CT",
            "country": "USA"
        },
        "job_details": {
            "employment_type": [
                "contract",
                "third party"
            ],
            "experience_required": "5+ years",
            "degree_required": "Degree or equivalent in Business, Information Systems, or Computer Science",
            "visa_sponsorship": "Not specified",
            "notice_period": "Not specified",
            "duration": "Not specified",
            "rate": "Not specified"
        },
        "skills": {
            "core": [
                "Pega",
                "Business Analysis",
                "Agile",
                "Scrum",
                "Digital"
            ],
            "primary": [
                "Pega Decision Management",
                "Excellent written and verbal communication skills",
                "Solid problem solving and analytical skills",
                "Ability to understand business processes and translate into technical specifications"
            ],
            "secondary": [
                "Client\u2010focused approach with outstanding interpersonal skills",
                "Working knowledge of system development life cycle concepts",
                "Mentor and oversee work of junior team members"
            ],
            "all": [
                "Pega",
                "Business Analysis",
                "Agile",
                "Scrum",
                "Digital",
                "Pega Decision Management",
                "Excellent written and verbal communication skills",
                "Solid problem solving and analytical skills",
                "Ability to understand business processes and translate into technical specifications",
                "Client\u2010focused approach with outstanding interpersonal skills",
                "Working knowledge of system development life cycle concepts",
                "Mentor and oversee work of junior team members"
            ]
        },
        "job_type": [
            "onsite"
        ],
        "contact_person": "HariPrasath Asokan",
        "email": "hari.ak@kksoftwareassociates.com",
        "jd": "From: HariPrasath Asokan, kk associates LLC hari.ak@kksoftwareassociates.com Reply to: hari.ak@kksoftwareassociates.com Hi, This is Hari from kk associates, Below Position is Immediate Position from the Client Kindly share Suitable resumes to hari.ak@kksoftwareassociates.com.Pega Business AnalystLeadLocation:Groton, CTHire Type: Contract Job Description:Pega Business AnalystLead the business team in gathering requirements and choosing the best way to implement requirements leveraging the Pega system software.Design and configure rules and flows and assist with the draft user interface and draft process flow development.Function as an Information Technology Business Analyst by understanding business requirements and transforming those requirements into data mapping specs.Possesses and applies a comprehensive knowledge across key tasks and high impact assignments.Evaluates performance results and recommends major changes affecting short term project growth and success.Participates in the development of functional business requirements and helps users assess relative priorities for both business process and technology solutions.Understands business processes and priorities. Evaluates alternative business process and technology solutions, and participates in making technology recommendations to enhance business operations.Communicate with the internal customer to analyze information and business workflow to deliver functional requirements, use cases, and user interface designs.Effectively communicate with internal teams and clients to deliver UI requirements such as Graphical User Interfaces, Screen, and Interface mock-ups.Experience supporting Pega development or implementation.Conducts system testing and facilitates user acceptance testing.Works collaboratively with peers to coordinate the overall delivery of technology solutions to business groups.Mentor and oversee work of junior team members.Develops working knowledge of the client\u2019s industry and uses this information to support continuous improvement initiatives.Business Analysis, Digital : Pega Decision Management8-10Certified Pega Business Architect5+ years of business analysis experienceDegree or equivalent in Business, Information Systems, or Computer ScienceExtensive experience with Agile/Scrum requiredExcellent written and verbal communication skillsAbility to understand business processes and translate into technical specificationsSolid problem solving and analytical skillsAbility to work effectively with people at all levels of the organizationClient\u2010focused approach with outstanding interpersonal skillsWorking knowledge of system development life cycle concepts",
        "source": "Email",
        "date_posted": "2024-10-25 15:49:01-05:00",
        "unique_id": "192c590bb6f9b891",
        "emp_type": [
            "contract",
            "third party"
        ],
        "tag": "PEGA Developer"
    }
]