[
    {
        "company": "Anveta, Inc.",
        "job_title": ".NET with Power BI Developer",
        "location": "Mississippi, USA",
        "full_location": {
            "city": "Mississippi",
            "state": "",
            "country": "USA"
        },
        "job_details": {
            "employment_type": [
                "onsite",
                "third party"
            ],
            "experience_required": "6+ years",
            "degree_required": "Not specified",
            "visa_sponsorship": "Not specified",
            "notice_period": "Not specified",
            "duration": "Not specified",
            "rate": "Not specified"
        },
        "skills": {
            "core": [
                "C#",
                "Power BI",
                "SQL",
                ".NET Framework",
                ".NET Web API"
            ],
            "primary": [
                "Azure",
                "ADO.Net",
                "JQuery",
                "Bootstrap",
                "Entity Framework",
                "HTML5",
                "CSS3",
                "SCRUM",
                "Visual Studio",
                "IIS",
                "Windows Client",
                "Windows Server"
            ],
            "secondary": [],
            "all": [
                "C#",
                "Power BI",
                "SQL",
                ".NET Framework",
                ".NET Web API",
                "Azure",
                "ADO.Net",
                "JQuery",
                "Bootstrap",
                "Entity Framework",
                "HTML5",
                "CSS3",
                "SCRUM",
                "Visual Studio",
                "IIS",
                "Windows Client",
                "Windows Server"
            ]
        },
        "job_type": [
            "onsite"
        ],
        "contact_person": "Charan",
        "email": "charan@anveta.com",
        "jd": "From: Charan, Anveta charan@anveta.com Reply to: charan@anveta.com Role: .NET with Power BI Developer Location: 3771 Eastwood Dr, Mississippi -39211 -- (Onsite)Note: Locals preferred Job Description* Advanced technical expertise in6+ years of C#2+ years of Power BI dashboard development8+ years of database design and implementation.NET Framework (4.0 or later)NET Web API (2 or later)SQL 2008 (or later)AzureADO.NetJQueryBootstrapEntity Framework8 or more years\u2019 practical experience inHTML5 and CSS3Advanced knowledge ofSCRUM/Sprint methodologiesVisual Studio (2012 or later)IIS (7 or later)Windows Client (7 or later)Windows Server (2008 R2 or later) Thanks & RegardsCharanAnveta, Inc.1333 Corporate Drive, Suite #108Irving, TX 75038charan@anveta.comhttps://www.linkedin.com/in/charan-reddy-ba6450236/",
        "source": "Email",
        "date_posted": "2024-10-25 09:39:39-05:00",
        "unique_id": "192c44080727a984",
        "emp_type": [
            "onsite",
            "third party"
        ],
        "tag": ".net developer"
    }
]