[
    {
        "company": "GVR Infotek",
        "job_title": "Lead .Net Developer",
        "location": "Tallahassee, FL, USA",
        "full_location": {
            "city": "Tallahassee",
            "state": "FL",
            "country": "USA"
        },
        "job_details": {
            "employment_type": [
                "contract",
                "third party"
            ],
            "job_code": "",
            "experience_required": "5+ years",
            "degree_required": "Not specified",
            "visa_sponsorship": "No visa sponsorship",
            "notice_period": "Not specified",
            "duration": "6+ Months",
            "rate": "Not specified"
        },
        "skills": {
            "core": [
                "Microsoft .NET (C#)",
                "ASP.NET/MVC",
                "Azure",
                "JavaScript frameworks (Angular/React/NodeJS)",
                "WCF/WebAPI (REST, SOAP, XML)"
            ],
            "primary": [
                "DB2",
                "COBOL",
                "CA-GEN",
                "FOCUS",
                "Web focus"
            ],
            "secondary": [],
            "all": [
                "Microsoft .NET (C#)",
                "ASP.NET/MVC",
                "Azure",
                "JavaScript frameworks (Angular/React/NodeJS)",
                "WCF/WebAPI (REST, SOAP, XML)",
                "DB2",
                "COBOL",
                "CA-GEN",
                "FOCUS",
                "Web focus"
            ]
        },
        "job_type": [
            "remote"
        ],
        "contact_person": "Vikash Kumar",
        "email": "vikash.kumar@gvrinfotek.com",
        "jd": "From: vikash kumar, gvr infotek vikash.kumar@gvrinfotek.com Reply to: vikash.kumar@gvrinfotek.com Lead .Net DeveloperDuration: 6+ MonthsLocation:( remote) in Tallahassee, FLVisa: EAD/GC/USCMOI: SkypeMust have LinkedIn Page with photo and current location and dl visa(SSN,DOB) in submission. If you represent your candidate location so I need local proof in submission. For this position we consider candidates registered and currently located in EST/CST time zone states (please don\u2019t send candidates from other locations, they won\u2019t be considered). Relocation is not acceptableMUST HAVE: 2+ y as a lead exp; 5+ y of exp with Microsoft .NET (C#), ASP.NET/MVC; Azure; JavaScript frameworks (Angular/ React/NodeJS); WCF/WebAPI (REST, SOAP, XML); DB2/ COBOL/ CA-GEN/ FOCUS/ Web focus Regards, Vikash KumarIT RecruiterGVR Info Tek: 13573 Tabasco Cat Trail, Frisco, TX 75035Email: vikash.kumar@gvrinfotek.com",
        "source": "Email",
        "date_posted": "2024-10-04 08:44:00-05:00",
        "unique_id": "19257c5e4aa32d5c",
        "emp_type": [
            "contract",
            "third party"
        ],
        "tag": ".net developer"
    }
]