[
    {
        "company": "RCI",
        "job_title": "Full Stack .NET Engineer",
        "location": "USA",
        "full_location": {
            "city": "",
            "state": "",
            "country": "USA"
        },
        "job_details": {
            "employment_type": [
                "contract",
                "third party"
            ],
            "job_code": "",
            "experience_required": "5+ years",
            "degree_required": "Not specified",
            "visa_sponsorship": "Not specified",
            "notice_period": "Not specified",
            "duration": "5 months",
            "rate": "$45/hr C2C (MAX)"
        },
        "skills": {
            "core": [
                "C#",
                ".NET",
                "React"
            ],
            "primary": [
                "Agile development methodologies",
                "Problem-solving",
                "Analytical skills",
                "Communication",
                "Leadership"
            ],
            "secondary": [
                "Azure Cloud services",
                "DevOps practices",
                "AI",
                "Machine learning",
                "Data migration"
            ],
            "all": [
                "C#",
                ".NET",
                "React",
                "Agile development methodologies",
                "Problem-solving",
                "Analytical skills",
                "Communication",
                "Leadership",
                "Azure Cloud services",
                "DevOps practices",
                "AI",
                "Machine learning",
                "Data migration"
            ]
        },
        "job_type": [
            "remote"
        ],
        "contact_person": "Anamika",
        "email": "aanamika@rconsultinginc.com",
        "jd": "From: Anamika, RCI aanamika@rconsultinginc.com Reply to: aanamika@rconsultinginc.com Role: Full Stack .NET Engineer Location: 100% Remote Duration: 5 months Visa - ALL Rate: $45/hr C2C (MAX) See what you can find this is a straight contract role. We are seeking a hands-on Full Stack Engineer to join our team. The ideal candidate will have experience in .NET, C#, and React. Responsibilities:\u00b7We need someone with full stack dev exp. React/C#.\u00b7Personality will be important. Need someone driven, needs to rollup their sleeves and learn.\u00b7Type of Projects: POCs, new features of an existing platform. Will be a part of requirements gathering with the business, Learning what system does, how it's designed and build of something new.\u00b7Why TMS: Fully remote. Great home work integration. you'll be working on POCs and other new ideas to take to their customer.\u00b7For submission- Candidates must be able to give examples of what they did. Should be able to speak to the business purpose of the project they were on, not just talk about the technologies they used.\u00b7Design, develop, and maintain scalable, high-performance applications using .NET, C#, and React\u00b7Design and implementation of new features and products\u00b7Collaborate with cross-functional teams to define and implement new features.\u00b7Stay current with emerging technologies and industry trends\u00b7Plan and execute data migration projects, ensuring data integrity and minimal downtime Requirements:\u00b7 5+ years of experience in software development\u00b7 Proficiency in .NET framework and C# programming\u00b7 Experience with React and modern front-end development practices\u00b7 Familiarity with Agile development methodologies\u00b7 Excellent problem-solving and analytical skills\u00b7 Strong communication and leadership abilities Preferred Skills:\u00b7 Experience with Azure Cloud services and DevOps practices\u00b7 Knowledge of AI and machine learning concepts and their practical applications in business\u00b7 Proven experience in planning and executing complex data migration projects",
        "source": "Email",
        "date_posted": "2024-10-04 16:13:20-05:00",
        "unique_id": "19259c06ec6d08bf",
        "emp_type": [
            "contract",
            "third party"
        ],
        "tag": ".net developer"
    }
]