[
    {
        "company": "Vyze Inc",
        "job_title": "AWS Cloud DBA",
        "location": "Jersey City, NJ, USA",
        "full_location": {
            "city": "Jersey City",
            "state": "NJ",
            "country": "USA"
        },
        "job_details": {
            "employment_type": [
                "contract",
                "third party"
            ],
            "experience_required": "2-3 years",
            "degree_required": "Not specified",
            "visa_sponsorship": "Not specified",
            "notice_period": "Not specified",
            "duration": "6+ months",
            "rate": "Not specified"
        },
        "skills": {
            "core": [
                "AWS Databases",
                "RDS",
                "AWS Console",
                "AWS CLI",
                "S3",
                "DMS",
                "Postgres",
                "MySQL",
                "Aurora Postgres",
                "NoSQL",
                "MongoDB",
                "AWS SDK",
                "RedShift",
                "Snowflake",
                "Redis",
                "High Availability",
                "disaster recovery",
                "AWS IAM",
                "ETL Tools",
                "AWS Glue",
                "EKS",
                "ECR"
            ],
            "primary": [
                "DevOps",
                "Cloud Database",
                "Automation",
                "CI/CD",
                "Python",
                "Terraform",
                "Cloud Formation",
                "Lambda"
            ],
            "secondary": [
                "Investment Banking",
                "Market Data environment experience",
                "Service Resiliency",
                "HADR designs/solutions",
                "replication across AZs and Regions",
                "Load balancing",
                "Non-relational AWS databases",
                "DynamoDB",
                "Document DB",
                "Neptune",
                "OpenSearch",
                "Automation and monitoring within AWS",
                "Enterprise level Application Integration experience on AWS"
            ],
            "all": [
                "AWS Databases",
                "RDS",
                "AWS Console",
                "AWS CLI",
                "S3",
                "DMS",
                "Postgres",
                "MySQL",
                "Aurora Postgres",
                "NoSQL",
                "MongoDB",
                "AWS SDK",
                "RedShift",
                "Snowflake",
                "Redis",
                "High Availability",
                "disaster recovery",
                "AWS IAM",
                "ETL Tools",
                "AWS Glue",
                "EKS",
                "ECR",
                "DevOps",
                "Cloud Database",
                "Automation",
                "CI/CD",
                "Python",
                "Terraform",
                "Cloud Formation",
                "Lambda",
                "Investment Banking",
                "Market Data environment experience",
                "Service Resiliency",
                "HADR designs/solutions",
                "replication across AZs and Regions",
                "Load balancing",
                "Non-relational AWS databases",
                "DynamoDB",
                "Document DB",
                "Neptune",
                "OpenSearch",
                "Automation and monitoring within AWS",
                "Enterprise level Application Integration experience on AWS"
            ]
        },
        "job_type": [
            "hybrid"
        ],
        "contact_person": "Ravina",
        "email": "ravina@vyzeinc.com",
        "jd": "From: Ravina, Vyze Inc ravina@vyzeinc.com Reply to: ravina@vyzeinc.com Job Description -AWS Cloud DBALocation: Jersey City, NJ- 3 days on site- Hybrid RoleDuration: 6+ months MOI : Video interview but the client can ask for in - person meeting after the final round. we experienced this with the client in past. Need Sr. candidate Local to NJ /NY *** MUST Have Investment Banking and Market Data environment experience***Team is currently looking for a AWS Cloud DBA with experience doing DevOps.Cloud Database RDS2-3 years of experience with AWS Databases \u2022 Experience in migrating data from on-prem to RDS and 53 Exceptional knowledge of AWS Console, AWS CLI S3, DMS ? RDS: Postgres, MYSOL, Aurora Postgres and NoSQL (MongoDB) Cloud Watch \u2022 Good knowledge of ? AWS SDK e RedShift ? Snowflake O Redis ? High Availability and disaster recovery ?MSKIStreaming/Messaging Architectures AWS IAM and integration with AW'S Identity Center ? Service Resiliency - HADR designs/solutions tied to business tiering - replication across AZs and Regions e ETL Tools/MWAA AirfiowlAWS Glue EKS/ECR \u2022 Knowledge of ? Non-relational AWS databases: DynamoDB, Document DB, Neptune, OpenSearch ? Load balancing \u2022 Nice to have Experience in migrating data from on-prem into Snowflake, RedShiftAutomation/DevOps Experience\u2022 Exceptional knowledge of: ? Python, Terraform, Cloud Formation Lambda Enterprise level Application Integration experience on AWS Experience with ? Automation and monitoring within AWS ? Continuous integration and continuous deployment (CI/CD) \u2022 Ability to automate migration of data to RDS, $3, Snowflake, Redshift",
        "source": "Email",
        "date_posted": "2024-10-04 16:32:43-05:00",
        "unique_id": "19259b370d87687d",
        "emp_type": [
            "contract",
            "third party"
        ],
        "tag": "AWS Data Engineer"
    }
]