[
    {
        "company": "Tek Inspirations LLC",
        "job_title": "AWS Cloud DBA",
        "location": "Jersey City, NJ, USA",
        "full_location": {
            "city": "Jersey City",
            "state": "NJ",
            "country": "USA"
        },
        "job_details": {
            "employment_type": [
                "contract",
                "third party"
            ],
            "experience_required": "2-3 years",
            "degree_required": "Not specified",
            "visa_sponsorship": "Not specified",
            "notice_period": "Not specified",
            "duration": "12+ Months",
            "rate": "Not specified"
        },
        "skills": {
            "core": [
                "AWS Databases",
                "DevOps",
                "RDS",
                "AWS Console",
                "AWS CLI",
                "S3",
                "DMS",
                "Postgres",
                "MySQL",
                "Aurora Postgres",
                "NoSQL",
                "MongoDB",
                "Cloud Watch",
                "AWS SDK",
                "RedShift",
                "Snowflake",
                "Redis",
                "High Availability",
                "Disaster Recovery",
                "AWS IAM",
                "ETL Tools",
                "Airflow",
                "AWS Glue",
                "EKS",
                "ECR",
                "DynamoDB",
                "Document DB",
                "Neptune",
                "OpenSearch"
            ],
            "primary": [
                "Automation",
                "Python",
                "Terraform",
                "Cloud Formation",
                "Lambda",
                "Enterprise level Application Integration",
                "Continuous Integration",
                "Continuous Deployment"
            ],
            "secondary": [
                "Experience in migrating data from on-prem to Snowflake",
                "Experience in migrating data from on-prem to RedShift",
                "Exceptional knowledge of Service Resiliency",
                "HADR designs/solutions",
                "Replication across AZs and Regions",
                "Load balancing"
            ],
            "all": [
                "AWS Databases",
                "DevOps",
                "RDS",
                "AWS Console",
                "AWS CLI",
                "S3",
                "DMS",
                "Postgres",
                "MySQL",
                "Aurora Postgres",
                "NoSQL",
                "MongoDB",
                "Cloud Watch",
                "AWS SDK",
                "RedShift",
                "Snowflake",
                "Redis",
                "High Availability",
                "Disaster Recovery",
                "AWS IAM",
                "ETL Tools",
                "Airflow",
                "AWS Glue",
                "EKS",
                "ECR",
                "DynamoDB",
                "Document DB",
                "Neptune",
                "OpenSearch",
                "Automation",
                "Python",
                "Terraform",
                "Cloud Formation",
                "Lambda",
                "Enterprise level Application Integration",
                "Continuous Integration",
                "Continuous Deployment",
                "Experience in migrating data from on-prem to Snowflake",
                "Experience in migrating data from on-prem to RedShift",
                "Exceptional knowledge of Service Resiliency",
                "HADR designs/solutions",
                "Replication across AZs and Regions",
                "Load balancing"
            ]
        },
        "job_type": [
            "hybrid"
        ],
        "contact_person": "Akanksha Yadav",
        "email": "akanksha.yadav@tekinspirations.com",
        "jd": "Job Description - Title: AWS Cloud DBA Location: Jersey City, NJ (Hybrid) Duration: 12+ Months Moi; Skype Note: *** MUST Have Investment Banking and Market Data environment experience*** Must have LinkedIn and Visa dl Need local consultant only NY or NJ Near by Jersy city Team is currently looking for a AWS Cloud DBA with experience doing DevOps.Cloud Database RDS 2-3 years of experience with AWS Databases \u2022 Experience in migrating data from on-prem to RDS and 53 Exceptional knowledge of AWS Console, AWS CLI S3, DMS ? RDS: Postgres, MYSOL, Aurora Postgres and NoSQL (MongoDB) Cloud Watch \u2022 Good knowiedge of ? AWS SDK e RedShift ? Snowflake O Redis ? High Availability and disaster recovery ?MSKIStreaming/Messaging Architectures AWS IAM and integration with AW'S Identity Center ? Service Resiliency - HADR designs/solutions tied to business tiering - replication across AZs and Regions e ETL Tools/MWAA AirfiowlAWS Glue EKS/ECR \u2022 Knowledge of ? Non-relational AWS databases: DynamoDB, Document DB, Neptune, OpenSearch ? Load balancing \u2022 Nice to have Experience in migrating data from on-prem into Snowflake, RedShift Automation/DevOps Experience \u2022 Exceptional knowledge of: ? Python, Terraform, Cloud Formation Lambda Enterprise level Application Integration experience on AWS Experience with ? Automation and monitoring within AWS ? Continuous integration and continuous deployment (CI/CD) \u2022 Ability to automate migration of data to RDS, $3, Snowflake, Redshift",
        "source": "Email",
        "date_posted": "2024-10-04 11:40:53-05:00",
        "unique_id": "1925867d34629c78",
        "emp_type": [
            "contract",
            "third party"
        ],
        "tag": "AWS Data Engineer"
    }
]