[
    {
        "company": "Spar Info Sys",
        "job_title": "BSA with Datawarehouse with SQL",
        "location": "Philadelphia, PA, USA",
        "full_location": {
            "city": "Philadelphia",
            "state": "PA",
            "country": "USA"
        },
        "job_details": {
            "employment_type": [
                "third party",
                "contract"
            ],
            "job_code": "",
            "experience_required": "8 years",
            "degree_required": "Not specified",
            "visa_sponsorship": "Not specified",
            "notice_period": "Not specified",
            "duration": "6-12+ months",
            "rate": "Not specified"
        },
        "skills": {
            "core": [
                "Data Warehouse",
                "SQL",
                "Target Mapping",
                "Gap Analysis",
                "Data Profiling"
            ],
            "primary": [
                "Healthcare Domain Knowledge",
                "BSA Experience in Data Warehouse projects",
                "Good Communication Skills",
                "Good Analytical skills"
            ],
            "secondary": [],
            "all": [
                "Data Warehouse",
                "SQL",
                "Target Mapping",
                "Gap Analysis",
                "Data Profiling",
                "Healthcare Domain Knowledge",
                "BSA Experience in Data Warehouse projects",
                "Good Communication Skills",
                "Good Analytical skills"
            ]
        },
        "job_type": [
            "onsite"
        ],
        "contact_person": "Ben",
        "email": "benclark@sparinfosys.com",
        "jd": "From: Ben, Spar Info Sys benclark@sparinfosys.com Reply to: benclark@sparinfosys.com Job Title: BSA with Datawarehouse with SQLLocation is Philadelphia, PA - locals onlyDuration: 6-12+ monthsOpen to C2C/W2 JD:Responsibilities:\u2022 Perform Data Profiling (Identify all data issues before getting the data to DW)\u2022 Prepare Functional Specification based on the interaction with Business and Technical teams\u2022 Prepare Mapping Document to be used by Dev and QA team (Detailed level required. Provide Joins, Filters and Ranking (if required) to get UNIQUE records)\u2022 Good understanding of RDBMS concepts \u2022 Present the draft version of Data Model \u2022 Perform UAT / Business Checkout using SQL Scripts Requirements\u2022At least 3 years with Data Warehouse, 5 years with SQL and 8 years on a BSA / Technical role\u2022 Solid Healthcare Domain Knowledge\u2022 BSA Experience in Data Warehouse projects (Preferably in Sourcing or Outbound Extracts)\u2022 Good Communication Skills\u2022 Good Analytical skills\u2022 Prepared Source to Target Mapping\u2022 Performed Gap Analysis / Data Profiling\u2022 Prepared Functional Specifications working with Business\u2022 Strong SQL skillsDay one Onsite at Pennsylvania (Work from office)Mandatory AreasMust Have SkillsSkill 1 \u2013 Data Warehouse Yrs of Exp \u2013 5+SKill 1 - SQL - 5+ yearsSkill 3 \u2013 Target Mapping \u2013 4+Skill 4 \u2013 Gap Analysis / Data Profiling \u2013 4+",
        "source": "Email",
        "date_posted": "2024-10-04 10:05:14-05:00",
        "unique_id": "19258113dd95eab4",
        "emp_type": [
            "third party",
            "contract"
        ],
        "tag": "Business Analyst"
    }
]