[
    {
        "company": "Mavinsys",
        "job_title": "Java Developer",
        "location": "Boston, MA, USA",
        "full_location": {
            "city": "Boston",
            "state": "MA",
            "country": "USA"
        },
        "job_details": {
            "employment_type": [
                "contract",
                "third party"
            ],
            "job_code": "",
            "experience_required": "7-10 years",
            "degree_required": "Not specified",
            "visa_sponsorship": "Not specified",
            "notice_period": "Not specified",
            "duration": "6-12 months",
            "rate": "Not specified"
        },
        "skills": {
            "core": [
                "Java",
                "Microservices",
                "AWS",
                "Kubernetes",
                "SQL"
            ],
            "primary": [
                "JMS",
                "Angular",
                "Java/J2EE",
                "REST API",
                "Ant"
            ],
            "secondary": [
                "Javascript",
                "Portfolio Management System",
                "Trading System",
                "Research System",
                "Asset Management Industry Experience"
            ],
            "all": [
                "Java",
                "Microservices",
                "AWS",
                "Kubernetes",
                "SQL",
                "JMS",
                "Angular",
                "Java/J2EE",
                "REST API",
                "Ant",
                "Javascript",
                "Portfolio Management System",
                "Trading System",
                "Research System",
                "Asset Management Industry Experience"
            ]
        },
        "job_type": [
            "onsite"
        ],
        "contact_person": "Harika Vaka",
        "email": "harika.v@mavinsys.com",
        "jd": "From: Harika Vaka, Mavinsys harika.v@mavinsys.com Reply to: harika.v@mavinsys.com Java DeveloperLocation: Boston, MA (Needed only Locals- Mode of interview F2F only)Job Description:Onsite for 2 days/week in Boston is preferred Duration: 6-12 months (there is definitely more work than 6 months so if they do well, we can keep them on longer)Must be involved with all the investment applications such as portfolio management system, trading system, research system, across equity, fixed income and multi asset.Relevant experience of 7-10 years in senior level core Java, microservices, AWS, Kubernetes (EKS), SQL and looking for someone to be focused on execution \u2013 have 3 Architects who handle the design work.Understanding of Javascript/ Angular 8+ (this will be pretty much all backend/server-side dev though)Asset management industry experience. Primary skills: JMS Angular Java/J2EE side (Swings, Applets, EJB) REST API/REST Services Ant (Build tool)",
        "source": "Email",
        "date_posted": "2024-10-04 16:06:36-05:00",
        "unique_id": "192595b160a0fccb",
        "emp_type": [
            "contract",
            "third party"
        ],
        "tag": "Java developer"
    }
]