[
    {
        "company": "Abidi Solutions",
        "job_title": "Full Stack Developer",
        "location": "Fort Worth, TX, USA",
        "full_location": {
            "city": "Fort Worth",
            "state": "TX",
            "country": "USA"
        },
        "job_details": {
            "employment_type": [
                "full-time",
                "third party"
            ],
            "job_code": "",
            "experience_required": "5-7 years",
            "degree_required": "Bachelor's degree in Computer Science, Computer Engineering, Technology, Information Systems (CIS/MIS), Engineering or related technical discipline, or equivalent experience/training",
            "visa_sponsorship": "Not specified",
            "notice_period": "Not specified",
            "duration": "12+ months",
            "rate": "Not specified"
        },
        "skills": {
            "core": [
                "Java-17 or above",
                "Springboot",
                "Microservices",
                "Angular",
                "MongoDB",
                "Postgres",
                "Kubernetes",
                "Docker"
            ],
            "primary": [
                "GitHub Actions",
                "CSS",
                "Bootstrap",
                "DevOps"
            ],
            "secondary": [
                "Node JS",
                "Oracle",
                "Object/Relational Mapping",
                "Query performance tuning",
                "Azure",
                "REST/SOAP (JSON/WSDL/XML)",
                "Spring Framework",
                "Ext JS",
                "jQuery",
                "AJAX",
                "IntelliJ",
                "Selenium",
                "Terraform scripting",
                "Linux/Unix shell Scripting",
                "JavaScript",
                "IBM MQ/Rabbit MQ",
                "SQL Developer",
                "IDE",
                "Microsoft Office Tools (Project, Excel, Word, PowerPoint, etc.)",
                "Agile methodologies",
                "Continuous Integration",
                "Continuous Deployment"
            ],
            "all": [
                "Java-17 or above",
                "Springboot",
                "Microservices",
                "Angular",
                "MongoDB",
                "Postgres",
                "Kubernetes",
                "Docker",
                "GitHub Actions",
                "CSS",
                "Bootstrap",
                "DevOps",
                "Node JS",
                "Oracle",
                "Object/Relational Mapping",
                "Query performance tuning",
                "Azure",
                "REST/SOAP (JSON/WSDL/XML)",
                "Spring Framework",
                "Ext JS",
                "jQuery",
                "AJAX",
                "IntelliJ",
                "Selenium",
                "Terraform scripting",
                "Linux/Unix shell Scripting",
                "JavaScript",
                "IBM MQ/Rabbit MQ",
                "SQL Developer",
                "IDE",
                "Microsoft Office Tools (Project, Excel, Word, PowerPoint, etc.)",
                "Agile methodologies",
                "Continuous Integration",
                "Continuous Deployment"
            ],
            "with_experience": [
                "Java-17 or above",
                "Springboot",
                "Microservices",
                "Angular"
            ]
        },
        "job_type": [
            "hybrid"
        ],
        "contact_person": "Shaik Mohammed",
        "email": "smohammed@abidisolutions.com",
        "jd": "From: shaik mohammed, www.abidisolutions.com smohammed@abidisolutions.com Reply to: smohammed@abidisolutions.com Title: Full Stack DeveloperLocation: Fort Worth, TX- hybrid (2nd round F2F Interview)Visa: all visa is workable except OPT, and CPTDuration: 12+ monthsNeed local to TX with DL proof(No OPT, and CPT)F2F InterviewManager notes:3 days/week onsite. Interviews will be 2 rounds - first virtual, second in person and the candidate will be expected to write pseudo code for some questions. Must have 5-7 years of hands on experience on following technologies: Java-17 or above, Springboot, Microservices Angular, bootstrap, CSS Mongo/Postgres Kubernetes and Docker DevOps: Primarily GitHub ActionsDescription:Candidates MUST have a solid understanding of Java and Angular.Description:Developer working on maintenance product applications. Collaborates with leaders, business analysts, project managers, IT architects, technical leads and other developers, along with internal customers, to understand requirements and develop needs according to business requirements Maintains and enhances existing enterprise services, applications, and platforms using domain driven design and test-driven development Troubleshoots and debugs complex issues; identifies and implements solutions Creates detailed project specifications, requirements, and estimates Researches and implements new technologies to enhance current processes, security, and performance Supports the development of coding standards and adheres to best practices and security guidelines Works closely with software architects and technical leads to ensure decisions meet long-term enterprise growth needsAll you'll need for success Minimum Qualifications- Education & Prior Job Experience Bachelor's degree in Computer Science, Computer Engineering, Technology, Information Systems (CIS/MIS), Engineering or related technical discipline, or equivalent experience/training 4+ years of full Software Development Life Cycle (SDLC) experience designing, developing, and implementing largescale applications in hosted production environments on prem and in the cloud 4+ years of professional design and open-source experiencePreferred Qualifications- Education & Prior Job Experience6 years of full Software Development Life Cycle (SDLC) experienceAirline Industry experience would be helpful Skills, Licenses & CertificationsProficiency and demonstrated experience in the following technologies:Angular JS, Java or Node JS programmingDatabase and persistence frameworks: MongoDB, Postgres, Oracle, Object/Relational Mapping, Queryperformance tuningCloud-based development: AzureWeb Services: REST/SOAP (JSON/WSDL/XML)Frameworks: Spring Framework, Spring BootFront-end: Angular JS, Ext JS, CSS, jQuery, AJAXBuild/deployment tools: IntelliJOther Dev Ops Toolchain: Selenium, GitHub, Terraform scriptingOther: Linux/Unix shell Scripting, JavaScript, IBM MQ/Rabbit MQ, SQL Developer, IDEProficiency in object-oriented design techniques and principlesProficiency in Microsoft Office Tools (Project, Excel, Word, PowerPoint, etc.)Experience in Agile methodologiesExperience in DevOps Toolchain methodologies, including Continuous Integration and Continuous Deployment",
        "source": "Email",
        "date_posted": "2024-10-04 14:21:09-05:00",
        "unique_id": "19258fa8fa2e0d42",
        "emp_type": [
            "full-time",
            "third party"
        ],
        "tag": "Java developer"
    }
]