[
    {
        "company": "tekpyramid",
        "job_title": "Database Developer",
        "location": "Weehawken, NJ, USA",
        "full_location": {
            "city": "Weehawken",
            "state": "NJ",
            "country": "USA"
        },
        "job_details": {
            "employment_type": [
                "full-time",
                "third party"
            ],
            "experience_required": "Not specified",
            "degree_required": "BS in computer science or engineering degree or a related field or equivalent work experience required.",
            "visa_sponsorship": "No visa sponsorship",
            "notice_period": "Not specified",
            "duration": "12+ Months",
            "rate": "Not specified"
        },
        "skills": {
            "core": [
                "TSQL programming",
                "Perl",
                "Python",
                "Shell scripting",
                "ETL processes"
            ],
            "primary": [
                "Requirement Analysis",
                "Strategic Analysis",
                "Software Development Fundamentals",
                "Design",
                "Development",
                "Maintenance",
                "Testing",
                "Implementation",
                "performance tuning",
                "query optimization"
            ],
            "secondary": [
                "relation transactional databases",
                "Sybase",
                "MSSQL",
                "Java"
            ],
            "all": [
                "TSQL programming",
                "Perl",
                "Python",
                "Shell scripting",
                "ETL processes",
                "Requirement Analysis",
                "Strategic Analysis",
                "Software Development Fundamentals",
                "Design",
                "Development",
                "Maintenance",
                "Testing",
                "Implementation",
                "performance tuning",
                "query optimization",
                "relation transactional databases",
                "Sybase",
                "MSSQL",
                "Java"
            ]
        },
        "job_type": [
            "onsite"
        ],
        "contact_person": "Sanjoo Singh",
        "email": "sanjoo@tekpyramids.com",
        "jd": "From: sanjoo singh, tekpyramid sanjoo@tekpyramids.com Reply to: sanjoo@tekpyramids.com Onsite role Weehawken NJ need local Database DeveloperWeehawken, NJ12+ MonthsPhone/Skype Hire US Citizen Only ! Requirements : \uf0fc BS in computer science or engineering degree or a related field or equivalent work experience required.\uf0fc Experience in Requirement Analysis, Strategic Analysis, Software Development Fundamentals, Design, Development, Maintenance, Testing and Implementation of efficient data flow and batch processes in applications.\uf0fc Experience in TSQL programming, Perl or Python and Shell scripting.\uf0fc Good understanding of relation transactional databases like Sybase and MSSQL is a MUST;.\uf0fc Strong knowledge of Extraction Transformation and Loading (ETL) processes using TSQL with Java/Perl scripting.\uf0fc Experience in TSQL code development, performance tuning, query optimization and batch or ETL creation experience Best Regards ,Sanjoo SinghTechincal Recruiter Contact :- 248-707-1996 Ext.310Email : sanjoo@tekpyramids.com Fax : 248-856-9456 100, E. Big Beaver Rd, Suite # 845, Troy, MI \u2013 48083 Click here to view our latest jobsThis electronic mail (including any attachments) may contain information that is privileged, confidential, and/or otherwise protected from disclosure to anyone other than its intended recipient(s). Any dissemination or use of this electronic mail or its contents (including any attachments) by persons other than the intended recipient(s) is strictly prohibited. If you have received this message in error, please notify us immediately by reply e-mail so that we may correct our internal records. Please then delete the original message (including any attachments) in its entirety. Thank you.",
        "source": "Email",
        "date_posted": "2024-10-04 10:09:31-05:00",
        "unique_id": "192581516d00624f",
        "emp_type": [
            "full-time",
            "third party"
        ],
        "tag": "DB Admin"
    }
]