[
    {
        "company": "Source Infotech",
        "job_title": "Senior/Principal Python Developer",
        "location": "Boston, MA, USA",
        "full_location": {
            "city": "Boston",
            "state": "MA",
            "country": "USA"
        },
        "job_details": {
            "employment_type": [
                "contract",
                "third party"
            ],
            "job_code": "",
            "experience_required": "8+ years",
            "degree_required": "Not specified",
            "visa_sponsorship": "Not specified",
            "notice_period": "Not specified",
            "duration": "8-12+ months (can extend longer)",
            "rate": "Not specified"
        },
        "skills": {
            "core": [
                "Python",
                "AWS",
                "Django",
                "Flask",
                "JavaScript",
                "HTML",
                "CSS"
            ],
            "primary": [
                "Financial services",
                "Pre-Trading platform experience",
                "SQL",
                "NoSQL",
                "Git",
                "RESTful APIs",
                "CI/CD",
                "DevOps"
            ],
            "secondary": [
                "Pandas",
                "Numpy",
                "Code quality assurance",
                "Technical documentation",
                "Performance optimization",
                "Mentorship",
                "Problem-solving",
                "Analytical skills",
                "Communication",
                "Teamwork",
                "Attention to detail",
                "Leadership"
            ],
            "all": [
                "Python",
                "AWS",
                "Django",
                "Flask",
                "JavaScript",
                "HTML",
                "CSS",
                "Financial services",
                "Pre-Trading platform experience",
                "SQL",
                "NoSQL",
                "Git",
                "RESTful APIs",
                "CI/CD",
                "DevOps",
                "Pandas",
                "Numpy",
                "Code quality assurance",
                "Technical documentation",
                "Performance optimization",
                "Mentorship",
                "Problem-solving",
                "Analytical skills",
                "Communication",
                "Teamwork",
                "Attention to detail",
                "Leadership"
            ]
        },
        "job_type": [
            "hybrid"
        ],
        "contact_person": "Khushank Chauhan",
        "email": "khushank@sourceinfotech.com",
        "jd": "From: KhushankChauhan, Source Infotech khushank@sourceinfotech.com Reply to: khushank@sourceinfotech.com Senior/Principal Python DeveloperLocation : Boston, MA Hybrid (2 days onsite per week) Must be local with DLDuration : 8-12+ months (can extend longer)MUST BE ONSITE FROM DAY 1 \u2013 2X PER WEEKMust haveSenior/principal level python developmentFinancial services specifically pre-Trading platform experience awsThis resource can either sit in Boston or San Fran and must be local to either of there offices there. They will be required to come onsite 2x per week. Important Skills\u2022 Technical \u2013 AWS, financial services, deploying code in AWS, Pre-Trading platform experienceMust Have:1. 8+ years of experience working hands on as a Python Developer.2. Extensive financial services experience, specifically working on Pre-Trading Platforms3. 5+ years\u2019 experience deploying code on AWSResponsibilities:\u2022 Design and Development: Create and maintain applications using Python, JavaScript, HTML, and CSS.\u2022 Back-End Development: Develop and maintain back-end services and APIs using Python frameworks such as Django or Flask.\u2022 Front-End Integration: Integrate front-end components into applications, ensuring seamless user experiences.\u2022 Database Management: Develop and maintain databases and data storage solutions.\u2022 Code Quality Assurance: Conduct code reviews, ensure code quality, and adhere to best practices.\u2022 Mentorship: Provide technical leadership and mentorship to junior developers.\u2022 Collaboration: Work collaboratively with team members and other stakeholders to define project requirements and specifications.\u2022 Documentation: Prepare technical documentation to ensure transparency and accessibility of the development process.\u2022 Performance Optimization: Optimize software for performance and scalability.Requirements:\u2022 Experience: Proven experience as a Senior Python Developer with a strong portfolio of building applications for pre-trading systems in Financial Service\u2022 Technical Skills: o Proficiency in Python, Python libraries and Python frameworks (e.g., Django, Flask, Pandas, Numpy).o Strong knowledge of front-end technologies (e.g., JavaScript, HTML, CSS).o Experience with databases (e.g., SQL, NoSQL) and data storage solutions.o Experience with version control systems (e.g., Git).o Understanding of RESTful APIs and web services.o Experience in using AWS services like SNS, SQS, CloudFormation, lambdao Experience in deploying code on AWS platformo Knowledge of CI/CD pipelines and DevOps practices.o \u2022 o Soft Skills:o Excellent problem-solving and analytical skills.o Strong communication and teamwork abilities.o Attention to detail and a commitment to delivering high-quality software.o Leadership skills and the ability to mentor junior team members.",
        "source": "Email",
        "date_posted": "2024-10-04 11:08:16-05:00",
        "unique_id": "192588299d4d7ef3",
        "emp_type": [
            "contract",
            "third party"
        ],
        "tag": "Python developer"
    }
]