[
    {
        "company": "Exaways",
        "job_title": ".Net full stack developer with Oracle",
        "location": "Indianapolis, IN, USA",
        "full_location": {
            "city": "Indianapolis",
            "state": "IN",
            "country": "USA"
        },
        "job_details": {
            "employment_type": [
                "contract",
                "third party"
            ],
            "job_code": "",
            "experience_required": "13+ years",
            "degree_required": "Bachelor\u2019s degree in Computer Science or related field",
            "visa_sponsorship": "Not specified",
            "notice_period": "Not specified",
            "duration": "Contract",
            "rate": "Not specified"
        },
        "skills": {
            "core": [
                ".NET",
                "C#",
                "ASP.NET",
                "MVC",
                "Web API",
                "Oracle",
                "PL/SQL"
            ],
            "primary": [
                "JavaScript",
                "HTML5",
                "CSS3",
                "Angular",
                "React",
                "Cloud platforms (Azure, AWS)"
            ],
            "secondary": [
                "Debugging",
                "Problem-solving",
                "Communication",
                "Collaboration"
            ],
            "all": [
                ".NET",
                "C#",
                "ASP.NET",
                "MVC",
                "Web API",
                "Oracle",
                "PL/SQL",
                "JavaScript",
                "HTML5",
                "CSS3",
                "Angular",
                "React",
                "Cloud platforms (Azure, AWS)",
                "Debugging",
                "Problem-solving",
                "Communication",
                "Collaboration"
            ]
        },
        "job_type": [
            "onsite"
        ],
        "contact_person": "Vigneshwar Jayakumar",
        "email": "vigneshwar.jayakumar@exaways.com",
        "jd": "From: vigneshwar, exaways vigneshwar.jayakumar@exaways.com Reply to: vigneshwar.jayakumar@exaways.com Role: .Net full stack developer with Oracle ( Version like 11g , 19c, 13c) Location: Indianapolis, IN || But candidate should be Onsite from day 1Duration: Contract Job description:(Note : Please share a profile above 13+ Years of experiece )\u00b7 Bachelor\u2019s degree in Computer Science or related field.\u00b7 5 years of full-stack development experience with .NET technologies (C#, ASP.NET, MVC, Web API).\u00b7 Strong hands-on experience with Oracle databases, including PL/SQL and performance tuning.\u00b7 Proficiency in front-end development with JavaScript, HTML5, CSS3, and one or more JS frameworks (e.g., Angular, React).\u00b7 Familiarity with cloud platforms (e.g., Azure, AWS) is a plus.\u00b7 Excellent debugging and problem-solving skills.\u00b7 Strong communication and collaboration skills.",
        "source": "Email",
        "date_posted": "2024-10-04 11:00:37-05:00",
        "unique_id": "1925842f778fb2ab",
        "emp_type": [
            "contract",
            "third party"
        ],
        "tag": ".net developer"
    }
]