[
    {
        "company": "Avance Consulting",
        "job_title": "Business Analyst",
        "location": "San Antonio, TX, USA",
        "full_location": {
            "city": "San Antonio",
            "state": "TX",
            "country": "USA"
        },
        "job_details": {
            "employment_type": [
                "full-time",
                "third party"
            ],
            "experience_required": "Not specified",
            "degree_required": "Not specified",
            "visa_sponsorship": "Not specified",
            "notice_period": "Not specified",
            "duration": "12+ Months",
            "rate": "Not specified"
        },
        "skills": {
            "core": [
                "Banking Domain Experience",
                "SQL",
                "Great communication skills"
            ],
            "primary": [
                "Oracle PL/SQL",
                "MySQL",
                "JIRA",
                "Confluence"
            ],
            "secondary": [
                "Business Requirement Documents (BRD)",
                "Data analysis",
                "Project management"
            ],
            "all": [
                "Banking Domain Experience",
                "SQL",
                "Great communication skills",
                "Oracle PL/SQL",
                "MySQL",
                "JIRA",
                "Confluence",
                "Business Requirement Documents (BRD)",
                "Data analysis",
                "Project management"
            ],
            "with_experience": [
                "SQL"
            ]
        },
        "job_type": [
            "onsite"
        ],
        "contact_person": "Sudhir Teja",
        "email": "sudhir.teja@avanceservices.com",
        "jd": "From: Sudhir Teja, Avance Consulting sudhir.teja@avanceservices.com Reply to: sudhir.teja@avanceservices.com Title:Business AnalystLocation : San Antonio,TX & Plano,TX OnsiteDuration: 12+ Months Must Have : Banking Domain ExperienceJob Responsibilities: Helps train team of Business Analysts and analyze business processes/systems, identify inefficiencies and required controls, document procedures, track KPIsDefines high-level application, relationships, flows, implementation of business (processes, activities, functions, information), applications, and creates business and system use cases or functional specificationsCollaborates with internal and external customers to elicit business concerns and develop workable solutionsParticipates in planning initiatives, feasibility studies, cost/benefit analyses, and new systems designCreates business requirement documents (BRD) that sets out project requirement including costs, objectives, milestones, and timelinesCreates, extracts, and modifies ad-hoc and standardized reports based on financial and operational data as neededPossesses a thorough understanding of data, sources of data, and relationships of data in order to generate meaningful information for managementAnalyzes and suggests areas for cost control and reduction and develops business process flowsWorks independently and collaborates with junior and senior stakeholdersKnowledge of scripting and database languages such as Oracle PL/SQL, MySQL etc.Strong working knowledge of project management tools such as JIRA/ConfluenceExperience supporting business requirements for large scale applications in the concerned domainKnowledge of Defects tracking and release managementList the top three skills in order of importance and number of years of experience for each skill:Great communication skillsExperience working with users and convert business requirements to technical requirementsExperience working with product owners to build backlog.Experience working with IT Engineers and developersExperience in SQLBrief description of the daily duties using the technology tools above?Convert business requirements to technical requirementsWork with product owners to build backlog.Work with IT Engineers and developers to provide data movement requirementsExperience in SQL to perform data analysis",
        "source": "Email",
        "date_posted": "2024-10-04 12:22:19-05:00",
        "unique_id": "192588dc28160212",
        "emp_type": [
            "full-time",
            "third party"
        ],
        "tag": "Business Analyst"
    }
]