[
    {
        "company": "Ark Infotech Spectrum",
        "job_title": "Sr IT Project Manager \u2013 Financial Integration",
        "location": "USA",
        "full_location": {
            "city": "",
            "state": "",
            "country": "USA"
        },
        "job_details": {
            "employment_type": [
                "third party"
            ],
            "job_code": "",
            "experience_required": "10+ years",
            "degree_required": "Bachelor\u2019s degree in business, computer science, Information Technology or 10 years\u2019 experience in Information Technology projects.",
            "visa_sponsorship": "Not specified",
            "notice_period": "Not specified",
            "duration": "6 - 12+ Months",
            "rate": "Not specified"
        },
        "skills": {
            "core": [
                "IT project management",
                "Financial integrations",
                "GxP validation process",
                "Agile methodologies",
                "Waterfall methodologies"
            ],
            "primary": [
                "Stakeholder Management",
                "PM Framework",
                "Planview",
                "JIRA",
                "Communication skills"
            ],
            "secondary": [
                "Leadership",
                "Interpersonal skills",
                "Conflict management",
                "Process improvements",
                "Training and usage of PPM tools"
            ],
            "all": [
                "IT project management",
                "Financial integrations",
                "GxP validation process",
                "Agile methodologies",
                "Waterfall methodologies",
                "Stakeholder Management",
                "PM Framework",
                "Planview",
                "JIRA",
                "Communication skills",
                "Leadership",
                "Interpersonal skills",
                "Conflict management",
                "Process improvements",
                "Training and usage of PPM tools"
            ],
            "with_experience": [
                "IT project management (10+ years)",
                "Financial integrations (3+ years)",
                "Pharma/Medical devices (5+ years)"
            ]
        },
        "job_type": [
            "remote"
        ],
        "contact_person": "Syed Moulali",
        "email": "moulali@arkinfotechspectrum.com",
        "jd": "From: Moulali, ARK INFOTECH SPECTRUM moulali@arkinfotechspectrum.com Reply to: moulali@arkinfotechspectrum.com Hi,This is Syed Moulali from Ark Infotech Spectrum and please find the job description below which suits your profile and let us know your interest for this positionPP Number & LinkedIN Mandatory For Submission Job Title: Sr IT Project Manager \u2013 Financial IntegrationClient: Implementation: Duration: 6 - 12+ MonthsLocation: REMOTE Experience: 10+ Job Description: Job Summary: Our Project Management practice group is currently seeking a Sr. IT Project Manager who has strong experience with Financial Implementations, to support one of our global Healthcare devices/Life Science clients, based out of Mahwah, NJ. (Remote with 20% travel onsite)In this role, the IT Senior Project Manager will be responsible for initiation and managing \u201cfinance\u201d projects that require Financial integrations for a global business in a dynamic environment. A successful candidate would leverage effective project management practices working collaboratively with various divisions and cross functional teams globally while delivering cost-effective implementation exceeding stakeholder expectations.Responsibilities and Duties: Define project charter, project scope, assess impact, determine implementation approach determine schedule, budget, resource needs working with various global stakeholders.Experience working on Financial Project implementationGxP validation processActively collaborate with the stakeholders in a consultative role eliciting business and technical requirements and help prioritize implementation aligning to IT strategies.Align to business and IT priorities by effectively leveraging waterfall, iterative and Agile methodologies, while coaching and mentoring team members.Effectively utilize the PM Framework, leveraging the tools like Planview, JIRA and other collaboration tools for increased productivity.Effective communicator, who is flexible and adaptable to work with global teams in adjusting to different time zones and cultures, in a dynamic and evolving environment.Build and execute operational and technical project plans, facilitate all project gate reviews, and effectively escalate issues to meet the project milestones/goals.Actively manage scope and change aligning to business priorities, identify risks and issues, prioritize conflicting needs, handle matters expeditiously and proactively, follow-through on projects to successful completion with minimal guidance, often with deadline pressures.Provide regular status update to the Leadership and Management team with constant drive to make improvements to the outcomes.Demonstrate high adaptability and flexibility to take responsibility to support new projects that has priority and as communicated. Basic QualificationsMinimum 10 years of experience as IT project manager with minimum 3 years\u2019 experience in Financial Integrations Minimum of 5 years in Pharma/Medical devicesBachelor\u2019s degree in business, computer science, Information Technology or 10 years\u2019 experience in Information Technology projects.Certified in PMP a plus Preferred Experience and Skills: Experience working on Financial Project implementations, feature enhancements, upgrades, release, and life cycle management supporting business transformation.Stakeholder ManagementGxP Validation experienceStrong communicator with effective presentation skills delivering formal presentations to various levels of management articulating project status, risk mitigations, benefits & financial realizations.Self-motivated and independent critical thinker who can visualize and guide team during conflicting situations to stay focused on business goals & prioritiesHas strong experience in PM Framework, following estimation guidelines, resource management, gate reviews, Quality audits, process improvements, provide training and usage of PPM tools & dashboard.Effective conflict management in a fast-paced environment, take higher responsibilities working with cross functional team who are working on multiple prioritiesExcellent leadership and interpersonal skills with ability to influence stakeholders and team members with variety of personal styles to focus on right priorities under pressure and tight deadlines.Excellent written and verbal communication skills is a must. Thanks & Regards.,Syed MoulaliUS IT / Non IT Recruiter ARK Infotech SpectrumUS Number: India Number: 8919599293 ( Only Message )Email: moulali@arkinfotechspectrum.comLinkedin: linkedin.com/in/syed-moulali-a57285254 ( Primary ) Linkedin: linkedin.com/in/moulali-syed-048766207 ( Secondary ) https://arkinfotechspectrum.com/",
        "source": "Email",
        "date_posted": "2024-10-04 12:02:20-05:00",
        "unique_id": "192587b7b9b731ee",
        "emp_type": [
            "third party"
        ],
        "tag": "Project Manager"
    }
]