[
    {
        "company": "VKore Solutions",
        "job_title": "Senior Business Systems Analyst - Supply Chain Management",
        "location": "Fremont, CA, USA",
        "full_location": {
            "city": "Fremont",
            "state": "CA",
            "country": "USA"
        },
        "job_details": {
            "employment_type": [
                "full-time",
                "third party"
            ],
            "experience_required": "10+ years",
            "degree_required": "Not specified",
            "visa_sponsorship": "Not specified",
            "notice_period": "Not specified",
            "duration": "Not specified",
            "rate": "Not specified"
        },
        "skills": {
            "core": [
                "SAP",
                "ECC",
                "S4",
                "Supply Chain Management",
                "Procure to Pay"
            ],
            "primary": [
                "Material Requirement Planning",
                "RFQ",
                "PO Management",
                "Supplier Collaboration",
                "Capacity planning"
            ],
            "secondary": [
                "Agile methodologies",
                "Waterfall methodologies",
                "End user support",
                "Project management",
                "Cross functional workstream impact analysis"
            ],
            "all": [
                "SAP",
                "ECC",
                "S4",
                "Supply Chain Management",
                "Procure to Pay",
                "Material Requirement Planning",
                "RFQ",
                "PO Management",
                "Supplier Collaboration",
                "Capacity planning",
                "Agile methodologies",
                "Waterfall methodologies",
                "End user support",
                "Project management",
                "Cross functional workstream impact analysis",
                "Master data",
                "Inventory strategies",
                "Sub-contracting",
                "Purchase order management",
                "Business requirements",
                "Functional specifications",
                "Requirements traceability matrix",
                "Solution/Technical Architects",
                "Functionality issues",
                "Application issues",
                "Risks",
                "Scope creep",
                "Integration testing",
                "User acceptance testing",
                "Training",
                "Documentation",
                "Cutover",
                "Go Live",
                "Post-mortem",
                "Hypercare"
            ],
            "with_experience": [
                "SAP (10+ years)",
                "ECC (5+ years)",
                "S/4 (5+ years)"
            ]
        },
        "job_type": [
            "onsite"
        ],
        "contact_person": "Clark Adam",
        "email": "clark@vkoresolutions.com",
        "jd": "From: Clark Adam, VKore Solutions clark@vkoresolutions.com Reply to: clark@vkoresolutions.com Hi,Urgent Roles of SAP Consultant with BA.Location - Fremont ,CA ( Onsite)(Role-1)Senior Business Systems Analyst - Supply Chain ManagementJob Requirement:Business Systems Analyst (BSA) with strong experience in Source to Settle processes in ECC and S4 environment and associated tools for successful implementation of a Business/Digital Transformation Project.Job Responsibilities:\u2022 Solid hands-on experience in Source to Settle (S2S) processes, e.g., Material Requirement Planning, RFQ, forecasting, PO Management, Consignment, Sub-contracting and Supplier Collaboration, Capacity planning and Constraints, Inbound logistics, Costing and Supplier invoicing\u2022 Strong experience in S4 Supply Chain Execution capabilities and SAP ECC MM/PP and RICEFWs with cross functional workstream impact analysis\u2022 Solid hands-on experience in end to end Procure to Pay processes, e.g., master data, RFQ, forecasting, source determination, MRP, Inventory strategies (safety stock, consignment, replenishment, rebalancing, etc.), Sub-contracting, Purchase order (PO) management\u2022 Ability to connect multiple operations domains (Planning, Fulfillment, Manufacturing, Logistics, Spares Operations) and their interdependencies with Procurement\u2022 Partners closely with business partners, systems analysts, development, architecture and project teams to facilitate optimal solution design and delivery\u2022 Translate the business requirements to functional specifications document, develop and own requirements traceability matrix\u2022 Assist the Solution/Technical Architects in identifying and managing functionality and Application issues, risks, and scope creep\u2022 Experience with both waterfall and agile project management methodologies, and ability to deliver on responsibilities during various project phases including:o Requirements (Validation and Alignment)o Design (Blueprint and Spec)o Develop (Technical Spec, Prototyping, Configuration, and Unit testing)o Test (Integration testing and User acceptance testing)o Training/Documentationo Deploy (Cutover, Go Live)o Run (Post-mortem, Hypercare)\u2022 Able to manage multiple projects with competing priorities.\u2022 Provide end user support during hyper care\u2022 Must be able to demonstrate the skills and ability to build effective and productive relationships within and outside the immediate team and developersMinimum Qualifications: \u2022 10+ years overall SAP experience with 5+ years of experience in ECC & S/4 (MM, PP)\u2022 Demonstrated expertise across multiple enterprise systems include SAP and No code platforms\u2022 Have worked in multiple end-to-end implementation projects, that inAdditional Qualifications: Please share to Clark@vkoresolutions.com",
        "source": "Email",
        "date_posted": "2024-10-04 12:40:36-05:00",
        "unique_id": "192589e7f47113c8",
        "emp_type": [
            "full-time",
            "third party"
        ],
        "tag": "Business Analyst"
    }
]