[
    {
        "company": "Yochana IT",
        "job_title": "AWD Integration Developer",
        "location": "USA",
        "full_location": {
            "city": "",
            "state": "",
            "country": "USA"
        },
        "job_details": {
            "employment_type": [
                "third party"
            ],
            "experience_required": "15-20 years",
            "degree_required": "Not specified",
            "visa_sponsorship": "Not specified",
            "notice_period": "Not specified",
            "duration": "Not specified",
            "rate": "Not specified"
        },
        "skills": {
            "core": [
                "JAVA",
                ".NET"
            ],
            "primary": [
                "VB6",
                "HTML",
                "SQL",
                "XML",
                "REST",
                "SOAP"
            ],
            "secondary": [
                "Insurance domain knowledge",
                "API Updates",
                "Incident ticket resolution",
                "Audit support",
                "Patching",
                "Coding changes",
                "Windows",
                "Linux",
                "Microsoft updates"
            ],
            "all": [
                "JAVA",
                ".NET",
                "VB6",
                "HTML",
                "SQL",
                "XML",
                "REST",
                "SOAP",
                "Insurance domain knowledge",
                "API Updates",
                "Incident ticket resolution",
                "Audit support",
                "Patching",
                "Coding changes",
                "Windows",
                "Linux",
                "Microsoft updates"
            ]
        },
        "job_type": [
            "remote"
        ],
        "contact_person": "Pavan Kumar",
        "email": "pavank@yochana.com",
        "jd": "From: Pavan Kumar, Yochana IT pavank@yochana.com Reply to: pavank@yochana.com Remote roleAWD integration developer Need JAVA AWD - Java dot net, 15-20 yrs experience, Need strong .Net or Java skills that are prerequisites for this position15+ year of IT experience with Insurance domain knowledge* Works off of the AWD Admin requirements, to perform unit testing, supports business UAT and deploy / implements BAU projects.* Configures and codes API Updates for the AWD ToolKit, AWD Custom Code, NSImport and NetServer. This could include VB6, JAVA, .NET, HTML, SQL, XML, REST and SOAP services, as well as integration with other peripheral TA applications.* Provides post implementation and production support for the AWD Admin for Incident ticket resolution as needed.* Monitors and supports AWD Custom Email, NSImport / NetServer, AWD custom code, and other peripheral AWD Applications on a daily basis.* Provides audit support for internal TA project audits and regulatory compliance requests.* Supports patching and coding changes for AWD related servers and infrastructure (Windows, Linux, JAVA, Microsoft updates, etc.)",
        "source": "Email",
        "date_posted": "2024-10-04 09:37:26-05:00",
        "unique_id": "19257f6cf5ab9f58",
        "emp_type": [
            "third party"
        ],
        "tag": "Java developer"
    }
]