[
    {
        "company": "Vyze1 inc",
        "job_title": "Full Stack Architect",
        "location": "Greenville, SC, USA",
        "full_location": {
            "city": "Greenville",
            "state": "SC",
            "country": "USA"
        },
        "job_details": {
            "employment_type": [
                "full-time",
                "third party"
            ],
            "experience_required": "5+ years",
            "degree_required": "BS in Computer Science / Information Systems / related field or equivalent experience",
            "visa_sponsorship": "Not specified",
            "notice_period": "Not specified",
            "duration": "6+ Months",
            "rate": "$120K to $160K per year"
        },
        "skills": {
            "core": [
                "Java",
                "Spring Boot",
                "REST APIs",
                "Microservices"
            ],
            "primary": [
                "Lean & Agile",
                "Communication",
                "Collaboration",
                "Problem-solving",
                "Database and data modeling",
                "Integration middleware",
                "Kubernetes",
                "Apache Kafka"
            ],
            "secondary": [],
            "all": [
                "Java",
                "Spring Boot",
                "REST APIs",
                "Microservices",
                "Lean & Agile",
                "Communication",
                "Collaboration",
                "Problem-solving",
                "Database and data modeling",
                "Integration middleware",
                "Kubernetes",
                "Apache Kafka"
            ]
        },
        "job_type": [
            "hybrid"
        ],
        "contact_person": "Sam",
        "email": "slenka@vyzeinc.com",
        "jd": "From: Sam, Vyze1 inc slenka@vyzeinc.com Reply to: slenka@vyzeinc.com Job Description -Need Two Profiles (Please don't submit those profile who is not able to do Java Coding , Earlier I submitted some candidates but they are not able to do Java coding . they got 0% in Java Section)Job Title: Full Stack Architect Location: Greenville, SC Hybrid (2 days on-site preferred) - Full remote work considered for exceptional candidates, with travel to Greenville at least one week every two monthsDuration: 6+MonthsVisa: US and GC MOI: SkypeCompensation: $120K to $160K per year plus benefits and bonuses upon contract completion.Must Have:Here's another way to look at it. 1. BS in Computer Science / Information Systems /related field or equivalent experience with a minimum of 5+ years of experience as a Full-Stack Architect, maybe Team Lead with design or architect experience, or similar senior technical role.I expect this person is going to have probably at least 10+ years of IT experience overall.2. Proven experience in designing, developing, and deploying enterprise-grade applications using in-depth knowledge of Java, Spring Boot, REST APls, and microservices principles required. 3. Demonstrated Lean & Agile experience. The right candidate will have worked in a team that values cooperation, transparency, courage, and humility to drive progress using excellent communication, collaboration, and problem-solving skills.\"3 Must haves for the position:1. BS in Computer Science / Information Systems /related field or equivalent experience with a minimum of 5+ years of experience as a Full-Stack Architect or similar senior technical role.2. Proven experience in designing, developing, and deploying enterprise-grade applications using in-depth knowledge of Java Spring Boot, REST APls, and microservices principles required.3. Demonstrated Lean & Agile values of cooperation, transparency, courage, and humility to drive progress at Michelin using excellent communication, collaboration, and problem-solving skills.Requirement Overview:Client is seeking an experienced Full Stack Architect who is passionate about architecture and building innovative solutions that drive business value. Join our Order to Cash development team and take on a pivotal role in shaping the software architecture across Order to Cash business processes in both B2B and B2B2C contexts. This position involves guiding the team in designing, building, and maintaining applications that align with our business goals in the most efficient way possible.Responsibilities:Lead architecture initiatives within a Lean and Agile team to maximize business value and ensure continuity by adhering to industry best practices and applying appropriate integration and architectural patterns.Architect, design, and evaluate business requirements, security measures, and legal requirements to create or enhance solutions, providing guidance to Software Engineers.Ensure the operability, availability, performance, and security of applications by delivering high-quality solutions and providing support as needed.Align business objectives with existing and future systems.Conduct feasibility studies to validate proposed solutions against expected requirements, costs, and timelines, and offer risk mitigation ideas.Use an incremental approach during design and development to manage lead times and deliver incremental functionalities quickly.Participate in a global network of architects to share ideas and collaborate.Internal/External Customers:B2B and B2B2C business stakeholdersExternal customersTeam Size:5-15 membersMust-Haves:BS in Computer Science, Information Systems, or a related field, or equivalent experience with a minimum of 5+ years as a Full-Stack Architect or similar senior technical role.Proven experience in designing, developing, and deploying enterprise-grade applications using Java Spring Boot, REST APIs, and microservices principles.Demonstrated Lean & Agile values of cooperation, transparency, courage, and humility, with excellent communication, collaboration, and problem-solving skills.Experience:Strong interpersonal skills and high team engagement.Ability to set and achieve goals with minimal supervision.Collaboration, interpersonal, and planning skills.Experience with databases and data modeling.Exposure to integration middleware (e.g., FTP, OBJEX, MQ, DataStage).Experience with container orchestration platforms like Kubernetes.Experience with Apache Kafka for message queuing. Remote Work Option:Hybrid role with 2 days on-site preferred.Full remote work considered for exceptional candidates with agreed travel to Greenville at least one week every two months.Awards and Recognitions:#1 Best Large Employer by Forbes in the automotive industry (2023)Newsweek Greatest Workplaces for Diversity (2023)Forbes Best Large Employer for Diversity (2022)Forbes Best Employers for Veterans (2022)Top Companies by Women in Transportation (2022)Equal Opportunity, Minority Engineer Magazine, Women Engineer Magazine, STEM Workforce Diversity Magazine Top 50 Diversity Employer of Choice List and Top 50 List (2023)Ranked Top Employer in Professional Women's Magazine, Hispanic Network Magazine, and Black EOE Journal (2023)Ranked Top Veteran-Friendly Companies in US Veterans Magazine (2023)Core Values:We act with respect: We share and uphold a strong set of deeply rooted values that form the backbone of our organization. These values have been consistent since day one and guide us in all our actions.",
        "source": "Email",
        "date_posted": "2024-10-04 09:45:12-05:00",
        "unique_id": "19257fdec6b3e9a1",
        "emp_type": [
            "full-time",
            "third party"
        ],
        "tag": "Java developer"
    }
]