[
    {
        "company": "Nitya software solution",
        "job_title": "Technical Business Analyst",
        "location": "Baltimore, MD, USA",
        "full_location": {
            "city": "Baltimore",
            "state": "MD",
            "country": "USA"
        },
        "job_details": {
            "employment_type": [
                "contract",
                "third party"
            ],
            "job_code": "",
            "experience_required": "Mid to Sr. (8-10 years+ of experience)",
            "degree_required": "Not specified",
            "visa_sponsorship": "No visa sponsorship",
            "notice_period": "Not specified",
            "duration": "6 months extendable",
            "rate": "Not specified"
        },
        "skills": {
            "core": [
                "FactSet",
                "Bloomberg Terminal",
                "data mapping technologies",
                "fixed income domain data providers"
            ],
            "primary": [
                "Technology Business Analyst",
                "Fixed Income",
                "Finance",
                "Wealth management",
                "Investment management"
            ],
            "secondary": [],
            "all": [
                "FactSet",
                "Bloomberg Terminal",
                "data mapping technologies",
                "fixed income domain data providers",
                "Technology Business Analyst",
                "Fixed Income",
                "Finance",
                "Wealth management",
                "Investment management"
            ]
        },
        "job_type": [
            "hybrid"
        ],
        "contact_person": "Nitya",
        "email": "ryan@nityainc.com",
        "jd": "From: Nitya, Nitya software solution ryan@nityainc.com Reply to: ryan@nityainc.com Title: Technical Business AnalystLocation: Baltimore, MDDuration: 6 months extendableMode: Hybrid (Must be in office 3 days) and must take care of the expenses on their ownOnly H4ead ,USC and GCNote: Need VISA Independent consultants.About the role:Level of experience: Mid to Sr. (8-10 years+ of experience)Industry experience: Fixed Income, Finance, Wealth management, Investment managementRole experience: Technology Business AnalystFunctional Tools/Technologies: FactSet, Bloomberg Terminal, data mapping technologies, fixed income domain data providersRequested Start Date: ASAPDuration: 6 months to begin; open to ongoing engagement beyond that based on individual fit/project availabilityLocationBaltimore MD onsite 3 days a week; hybrid WFH 2 days a week*No T&L reimbursement for living out of area and commuting in*Description/SummaryMigrate reference data providers from FactSet to Bloomberg for the Fixed Income business unit.The effort is to analyze, identify and document the existing business processes, technology tools, internal and external connections, and data values leveraged by a Brown Advisory business unit (Fixed Income) of a specific reference data providers (FactSet) data sets. The analysis and documentation will be then used to define a new set of business processes, potentially technology toolset, and relevant data values using another reference data providers (Bloomberg) data sets.High-Level TasksMap and document current processes/fields/reports in FactSetPerform mapping exercise to BloombergCapture requirements, screenshots, voice of end user, to determine all key dependencies and needs for the migrationDocumentationEscalation of issues and risks, collaboration with key stakeholders for resolution and recurrence preventionMonitoring, analysis, and SLA management related to audit replies/responsesProviding status updates, supporting creation of presentation slidesOther efforts, as assigned",
        "source": "Email",
        "date_posted": "2024-10-04 11:04:35-05:00",
        "unique_id": "1925846e007c2668",
        "emp_type": [
            "contract",
            "third party"
        ],
        "tag": "Business Analyst"
    }
]