[
    {
        "company": "Cohesive Technologies",
        "job_title": "Technical Project Manager",
        "location": "Lexington, MA, USA",
        "full_location": {
            "city": "Lexington",
            "state": "MA",
            "country": "USA"
        },
        "job_details": {
            "employment_type": [
                "contract",
                "third party"
            ],
            "job_code": "",
            "experience_required": "5 years",
            "degree_required": "Not specified",
            "visa_sponsorship": "Not specified",
            "notice_period": "Not specified",
            "duration": "12+ Months",
            "rate": "$60/Hr. on C2C"
        },
        "skills": {
            "core": [
                "Java Backend Services",
                "Microservices architecture",
                "Project Management",
                "Agile",
                "Scrum"
            ],
            "primary": [
                "MS Azure",
                "Java Restful Services",
                "SQL",
                "NOSQL Databases",
                "Kubernetes",
                "Terraform",
                "System integrations",
                "FHIR",
                "HIPAA",
                "FDA",
                "EUMDR"
            ],
            "secondary": [
                "Excellent communication skills",
                "Team handling experience",
                "Stakeholder management"
            ],
            "all": [
                "Java Backend Services",
                "Microservices architecture",
                "Project Management",
                "Agile",
                "Scrum",
                "MS Azure",
                "Java Restful Services",
                "SQL",
                "NOSQL Databases",
                "Kubernetes",
                "Terraform",
                "System integrations",
                "FHIR",
                "HIPAA",
                "FDA",
                "EUMDR",
                "Excellent communication skills",
                "Team handling experience",
                "Stakeholder management"
            ],
            "with_experience": [
                "Java Backend Services",
                "Microservices architecture",
                "Project Management"
            ]
        },
        "job_type": [
            "onsite",
            "hybrid"
        ],
        "contact_person": "Satin Harper",
        "email": "satinh@cohetech.com",
        "jd": "Cohesive Technologies is a global IT Services & Solutions company providing IT Staffing Services and Application Development Services necessary for technology leaders to deliver business value. We help our people and clients succeed by leveraging our expertise, deep industry and market knowledge, proprietary assessment tools and techniques, and project delivery methodologies. Through relationships with thousands of specialized professionals, we bring an unparalleled ability to match talent with opportunities by assessing, recruiting, developing and engaging the best and brightest people for our clients. We combine broad geographic presence, world-class solutions and a tailored, consultative approach to help our people and clients achieve higher performance and outstanding results.\n\nPosition: Technical Project Manager\nLocation: Lexington - Boston, MA (Onsite - Hybrid (3 Days in Office)\nDuration: 12+ Months\nRate: $60/Hr. on C2C\n\nNOTE : Please share resume with PMP certification, MedTech and Healthcare projects and Java Backend Services with Microservices architecture\n\nJob Description:\nStrong Technical background with MS Azure and Java Restful Services.\nStrong Experience in Java Backend Services with Microservices architecture.\nHandson experience in working with SQL and NOSQL Databases.\nHandson experience with Kubernetes orchestration and terraform as preferred skill.\nMust have good understanding of system integrations with Devices and Web.\nGood Experience to manage MedTech and Healthcare projects.\nShall understand FHIR.\nMUST understand HIPAA, FDA and EUMDR.\nStrong Project management experience with expertise in Agile and Scrum,\nMust have played a scrum master role in the past.\nExcellent communication skills.\nStrong team handling experience.\nMust have strong experience in working with multiple stakeholders.\n5 years of experience in Project Management.",
        "source": "Email",
        "date_posted": "2024-10-04 15:20:32-05:00",
        "unique_id": "1925930ebaa780d4",
        "emp_type": [
            "contract",
            "third party"
        ],
        "tag": "Project Manager"
    }
]