[
    {
        "company": "Adventa tech",
        "job_title": "AWS Cloud DBA",
        "location": "Jersey City, NJ, USA",
        "full_location": {
            "city": "Jersey City",
            "state": "NJ",
            "country": "USA"
        },
        "job_details": {
            "employment_type": [
                "contract",
                "third party"
            ],
            "job_code": "",
            "experience_required": "2-3 years",
            "degree_required": "Not specified",
            "visa_sponsorship": "No visa sponsorship",
            "notice_period": "Not specified",
            "duration": "6 MONTHS+",
            "rate": "Not specified"
        },
        "skills": {
            "core": [
                "AWS Cloud DBA",
                "AWS Databases",
                "Investment Banking",
                "Market Data",
                "DevOps"
            ],
            "primary": [
                "RDS",
                "Postgres",
                "MySQL",
                "Aurora Postgres",
                "NoSQL",
                "MongoDB",
                "AWS Console",
                "AWS CLI",
                "S3",
                "DMS",
                "Cloud Watch",
                "AWS SDK",
                "RedShift",
                "Snowflake",
                "Redis",
                "High Availability",
                "Disaster Recovery",
                "AWS IAM",
                "Service Resiliency",
                "ETL Tools",
                "MWAA",
                "AWS Glue",
                "EKS",
                "ECR",
                "DynamoDB",
                "Document DB",
                "Neptune",
                "OpenSearch",
                "Load Balancing"
            ],
            "secondary": [
                "Python",
                "Terraform",
                "Cloud Formation",
                "Lambda",
                "Enterprise level Application Integration",
                "Automation",
                "Monitoring within AWS",
                "Continuous Integration",
                "Continuous Deployment",
                "CI/CD"
            ],
            "all": [
                "AWS Cloud DBA",
                "AWS Databases",
                "Investment Banking",
                "Market Data",
                "DevOps",
                "RDS",
                "Postgres",
                "MySQL",
                "Aurora Postgres",
                "NoSQL",
                "MongoDB",
                "AWS Console",
                "AWS CLI",
                "S3",
                "DMS",
                "Cloud Watch",
                "AWS SDK",
                "RedShift",
                "Snowflake",
                "Redis",
                "High Availability",
                "Disaster Recovery",
                "AWS IAM",
                "Service Resiliency",
                "ETL Tools",
                "MWAA",
                "AWS Glue",
                "EKS",
                "ECR",
                "DynamoDB",
                "Document DB",
                "Neptune",
                "OpenSearch",
                "Load Balancing",
                "Python",
                "Terraform",
                "Cloud Formation",
                "Lambda",
                "Enterprise level Application Integration",
                "Automation",
                "Monitoring within AWS",
                "Continuous Integration",
                "Continuous Deployment",
                "CI/CD"
            ]
        },
        "job_type": [
            "hybrid"
        ],
        "contact_person": "Sradha Suman Nayak",
        "email": "sradha@adventatech.com",
        "jd": "From: Sradha Suman Nayak, Adventa tech sradha@adventatech.com Reply to: sradha@adventatech.com Job Title: AWS Cloud DBA GC/ Citizen Location: Jersey City, NJ 3 days on site- Hybrid Role (NEED LOCAL) MOI: Video Visa: USC / GC ONLY DURATION: 6 MONTHS+ NOTE: Please Send Candidate LinkedIn, DL (Need Sr. candidate) Send me candidate from trusted third party. Job Description: *MUST Have Investment Banking and Market Data environment experience* Team is currently looking for a AWS Cloud DBA with experience doing DevOps. Cloud Database RDS 2-3 years of experience with AWS Databases \u2022 Experience in migrating data from on-prem to RDS and 53 Exceptional knowledge of AWS Console, AWS CLI S3, DMS ? RDS: Postgres, MYSOL, Aurora Postgres and NoSQL (MongoDB) Cloud Watch \u2022 Good knowledge of ? AWS SDK e RedShift ? Snowflake O Redis ? High Availability and disaster recovery ? MSKI Streaming/Messaging Architectures AWS IAM and integration with AW'S Identity Center ? Service Resiliency - HADR designs/solutions tied to business tiering - replication across AZs and Regions e ETL Tools/MWAA Airfiowl AWS Glue EKS/ECR \u2022 Knowledge of ? Non-relational AWS databases: DynamoDB, Document DB, Neptune, OpenSearch ? Load balancing \u2022 Nice to have Experience in migrating data from on-prem into Snowflake, RedShift Automation/DevOps Experience \u2022 Exceptional knowledge of: ? Python, Terraform, Cloud Formation Lambda Enterprise level Application Integration experience on AWS Experience with ? Automation and monitoring within AWS ? Continuous integration and continuous deployment (CI/CD) \u2022 Ability to automate migration of data to RDS, $3, Snowflake, Redshift",
        "source": "Email",
        "date_posted": "2024-10-04 13:26:47-05:00",
        "unique_id": "19258c8c9c457668",
        "emp_type": [
            "contract",
            "third party"
        ],
        "tag": "AWS Data Engineer"
    }
]