[
    {
        "company": "Arkaya Infotech Inc.",
        "job_title": "AWS Cloud DBA",
        "location": "Jersey City, NJ, USA",
        "full_location": {
            "city": "Jersey City",
            "state": "NJ",
            "country": "USA"
        },
        "job_details": {
            "employment_type": [
                "full-time",
                "third party"
            ],
            "job_code": "",
            "experience_required": "2-3 years",
            "degree_required": "Not specified",
            "visa_sponsorship": "Visa sponsorship available",
            "notice_period": "Not specified",
            "duration": "Not specified",
            "rate": "Not specified"
        },
        "skills": {
            "core": [
                "AWS Databases",
                "DevOps",
                "RDS",
                "AWS Console",
                "AWS CLI",
                "S3",
                "DMS",
                "Postgres",
                "MySQL",
                "Aurora Postgres",
                "NoSQL",
                "MongoDB",
                "AWS SDK",
                "RedShift",
                "Snowflake",
                "Redis",
                "High Availability",
                "Disaster Recovery",
                "AWS IAM",
                "ETL Tools",
                "AWS Glue",
                "EKS",
                "ECR",
                "DynamoDB",
                "Document DB",
                "Neptune",
                "OpenSearch"
            ],
            "primary": [
                "Automation",
                "Python",
                "Terraform",
                "Cloud Formation",
                "Lambda",
                "Continuous Integration",
                "Continuous Deployment"
            ],
            "secondary": [
                "Investment Banking",
                "Market Data Environment Experience",
                "Interpersonal Skills",
                "Problem Solving",
                "Strong Verbal Communication",
                "Strong Written Communication",
                "Self-Learner",
                "Self-Motivated",
                "Team Player",
                "Weekend Support"
            ],
            "all": [
                "AWS Databases",
                "DevOps",
                "RDS",
                "AWS Console",
                "AWS CLI",
                "S3",
                "DMS",
                "Postgres",
                "MySQL",
                "Aurora Postgres",
                "NoSQL",
                "MongoDB",
                "AWS SDK",
                "RedShift",
                "Snowflake",
                "Redis",
                "High Availability",
                "Disaster Recovery",
                "AWS IAM",
                "ETL Tools",
                "AWS Glue",
                "EKS",
                "ECR",
                "DynamoDB",
                "Document DB",
                "Neptune",
                "OpenSearch",
                "Automation",
                "Python",
                "Terraform",
                "Cloud Formation",
                "Lambda",
                "Continuous Integration",
                "Continuous Deployment",
                "Investment Banking",
                "Market Data Environment Experience",
                "Interpersonal Skills",
                "Problem Solving",
                "Strong Verbal Communication",
                "Strong Written Communication",
                "Self-Learner",
                "Self-Motivated",
                "Team Player",
                "Weekend Support"
            ]
        },
        "job_type": [
            "hybrid"
        ],
        "contact_person": "Gaurav Tomar",
        "email": "gaurav@arkayainfotech.com",
        "jd": "From: Gaurav Tomar, Arkaya Infotech Inc. gaurav@arkayainfotech.com Reply to: gaurav@arkayainfotech.com Role : AWS Cloud DBA Location : Jersey City, NJ Hybrid Locals Visa : GC or USC MOI : Virtual LinkedIn*** MUST Have Investment Banking and Market Data environment experience*** Team is currently looking for a AWS Cloud DBA with experience doing DevOps. Cloud Database RDS 2-3 years of experience with AWS Databases \u2022 Experience in migrating data from on-prem to RDS and S3 Exceptional knowledge of AWS Console, AWS CLI S3, DMS \u25e6 RDS: Postgres, MySQL, Aurora Postgres and NoSQL (MongoDB) Cloud Watch \u2022 Good knowledge of \u25e6 AWS SDK e RedShift \u25e6 Snowflake O Redis \u25cb High Availability and disaster recovery \u25e6 MSKI Streaming/Messaging Architectures AWS IAM and integration with AWS Identity Center \u25cb Service Resiliency - HADR designs/solutions tied to business tiering - replication across AZs and Regions e ETL Tools/MWAA Airflow AWS Glue EKS/ECR \u2022 Knowledge of \u25e6 Non-relational AWS databases: DynamoDB, Document DB, Neptune, OpenSearch \u25e6 Load balancing \u2022 Nice to have Experience in migrating data from on-prem into Snowflake, RedShift Automation/DevOps Experience \u2022 Exceptional knowledge of: \u25cb Python, Terraform, Cloud Formation Lambda Enterprise level Application Integration experience on AWS Experience with \u25e6 Automation and monitoring within AWS \u25cb Continuous integration and continuous deployment (CI/CD) \u2022 Ability to automate migration of data to RDS, S3, Snowflake, Redshift Interpersonal Required Skills Ability to think about a problem identify what we have and implement: solutions to solve the problem independently Strong verbal and written communication skills Ability to think in and out of the box. Self-learner. Self-motivated, conscientious dedicated individual who works equally well independently or as a member of a team \u2022 Must be willing to take responsibility and ownership instead of waiting to be assigned work. Must be willing to participate in follow the sun support The candidate must be willing to provide weekend support, The support is rotated among DBAs in US, London, and India Regards, Gaurav Tomar Lead IT Recruiter Arkaya Infotech Inc. Email: gaurav@arkayainfotech.com",
        "source": "Email",
        "date_posted": "2024-10-04 10:01:49-05:00",
        "unique_id": "192580d8d760de56",
        "emp_type": [
            "full-time",
            "third party"
        ],
        "tag": "AWS Data Engineer"
    }
]