[
    {
        "company": "SIPTEK Group",
        "job_title": "AWS Solutions Lead Software Engineer Devops",
        "location": "Columbus, OH, USA",
        "full_location": {
            "city": "Columbus",
            "state": "OH",
            "country": "USA"
        },
        "job_details": {
            "employment_type": [
                "contract",
                "third party"
            ],
            "experience_required": "5+ years",
            "degree_required": "Not specified",
            "visa_sponsorship": "Not specified",
            "notice_period": "Not specified",
            "duration": "Not specified",
            "rate": "Not specified"
        },
        "skills": {
            "core": [
                "AWS EC2",
                "AWS S3",
                "AWS RDS",
                "AWS CloudFront",
                "AWS EFS",
                "CloudWatch",
                "EKS",
                "Java",
                "Python",
                "SQL",
                "Node",
                "Go",
                "Scala",
                "Docker",
                "Kubernetes"
            ],
            "primary": [
                "Ansible",
                "Artifactory",
                "GitHub",
                "Jenkins",
                "Maven",
                "Sonar Qube",
                "CloudFormation",
                "Terraform",
                "CloudWatch",
                "Prometheus",
                "Datadog",
                "Splunk"
            ],
            "secondary": [
                "GCP",
                "Azure",
                "NFS",
                "HDFS",
                "S3",
                "Agile",
                "Kanban"
            ],
            "all": [
                "AWS EC2",
                "AWS S3",
                "AWS RDS",
                "AWS CloudFront",
                "AWS EFS",
                "CloudWatch",
                "EKS",
                "Java",
                "Python",
                "SQL",
                "Node",
                "Go",
                "Scala",
                "Docker",
                "Kubernetes",
                "Ansible",
                "Artifactory",
                "GitHub",
                "Jenkins",
                "Maven",
                "Sonar Qube",
                "CloudFormation",
                "Terraform",
                "CloudWatch",
                "Prometheus",
                "Datadog",
                "Splunk",
                "GCP",
                "Azure",
                "NFS",
                "HDFS",
                "S3",
                "Agile",
                "Kanban"
            ]
        },
        "job_type": [
            "onsite"
        ],
        "contact_person": "Mounikanth Kara",
        "email": "mounikanth.kara@siptekgroup.com",
        "jd": "From: Mounikanth, siptek mounikanth.kara@siptekgroup.com Reply to: mounikanth.kara@siptekgroup.com Hi Team, Roal : AWS Solutions Lead Software Engineer Devops Location : Polaris Pkwy, Columbus, OH, Washington Blvd, Jersey City, NJ, USContract C2C Job responsibilitiesDrive, support, and deliver on a strategy to build broad use of Amazon's utility computing web services (e.g., AWS EC2, AWS S3, AWS RDS, AWS CloudFront, AWS EFS, CloudWatch, EKS)Design resilient, secure, and high performing platforms in Public Cloud using JPMC best practicesImprove reliability, quality, and time-to-market of our suite of software solutions moving to public cloudMeasure and optimize system performance, with an eye toward pushing our capabilities forward, getting ahead of customer needs, and innovating to continually improveProvide primary operational support and engineering for the public cloud platform and debug and optimize systems and automate routine tasksCollaborate with a cross-functional team to develop real-world solutions and positive user experiences at every interaction.Drive work streams to ensure Applications meet strict non-functional requirements for Public Cloud On-boarding Drive Cost management through the effective design and optimization of public cloud platforms and technologiesOrganize and run game days, resiliency tests and chaos engineering exercisesUtilize programming languages like Java, Python, SQL, Node, Go, and Scala, Open Source RDBMS and NoSQL databases, Container Orchestration services including Docker and Kubernetes, and a variety of AWS tools and services Required qualifications, capabilities, and skillsFormal training or certification on software engineering concepts and 5+ years applied experience8+ years in a technical development or lead roleCandidates must be certified with AWS Solutions Architect Associate / ProfessionalA strong understanding of business technology drivers and their impact on architecture design, performance and monitoring, best practicesDesign and building web environments on AWS, which includes working with services like EC2, ELB, RDS, and S3Experience using DevOps tools in a cloud environment, such as Ansible, Artifactory, Docker, GitHub, Jenkins, Kubernetes, Maven, and Sonar QubeExperience using monitoring solutions like CloudWatch, Prometheus, Datadog, SplunkKnowledge of writing Infrastructure-as-Code (IaC), using tools like CloudFormation or TerraformExperience with high volume, mission critical applications and their interdependencies with other applications and databases Experience with high volume, mission critical applications, and building upon messaging and or event-driven architectures. Keen understanding of financial and budget management, control and optimization of Public Cloud expenses Preferred qualifications, capabilities, and skillsExperience with one or more public cloud platforms like AWS, GCP, Azure Experience with distributed storage technologies like NFS, HDFS, S3A proactive approach to spotting problems, areas for improvement, and performance bottlenecksSRE mindset Culture/Approaches: To run better production systems by creating engineering solutions to operational problemsExperience of Agile delivery and tools including Kanban framework Warm Regards,Mounikanth Kara | Lead Recruiter Mobile:Email: Mounikanth.kara@siptekgroup.comLinkedIn: https://www.linkedin.com/in/mounikanth-kara-709123148/ 7775 Walton Pkwy, New Albany, OH \u2013 43054.Web: www.siptekgroup.com LinkedIn Page. A MINORITY OWNED ENTERPRISE SIPTEK Group is an Equal Opportunity Employer. Qualified applicants will receive consideration for employment without regard to race, color, religion, gender, age, disability, military status, national origin or any other characteristic protected under federal, state, or applicable local law.Disclaimer: The content of this email is confidential and intended for the recipient specified in message only. It is strictly forbidden to share any part of this message with any third party, without a written consent of the sender. If you received this message by mistake, please reply to this message and follow with its deletion, so that we can ensure such a mistake does not occur in the future.",
        "source": "Email",
        "date_posted": "2024-10-04 08:55:29-05:00",
        "unique_id": "19257d068831d539",
        "emp_type": [
            "contract",
            "third party"
        ],
        "tag": "AWS Data Engineer"
    }
]