[
    {
        "company": "VySystems",
        "job_title": "Java with Kafka and MongoDB",
        "location": "Dallas, TX, USA",
        "full_location": {
            "city": "Dallas",
            "state": "TX",
            "country": "USA"
        },
        "job_details": {
            "employment_type": [
                "third party"
            ],
            "job_code": "",
            "experience_required": "5+ years",
            "degree_required": "Not specified",
            "visa_sponsorship": "Not specified",
            "notice_period": "Not specified",
            "duration": "Not specified",
            "rate": "Not specified"
        },
        "skills": {
            "core": [
                "Java",
                "Kafka",
                "MongoDB",
                "Spring Framework",
                "REST APIs"
            ],
            "primary": [
                "Software Engineering",
                "Continuous Integration",
                "AWS",
                "Google Cloud",
                "Oracle",
                "MS SQL Server",
                "Agile Development"
            ],
            "secondary": [
                "Cassandra",
                "Hadoop",
                "Marklogic"
            ],
            "all": [
                "Java",
                "Kafka",
                "MongoDB",
                "Spring Framework",
                "REST APIs",
                "Software Engineering",
                "Continuous Integration",
                "AWS",
                "Google Cloud",
                "Oracle",
                "MS SQL Server",
                "Agile Development",
                "Cassandra",
                "Hadoop",
                "Marklogic"
            ]
        },
        "job_type": [],
        "contact_person": "Mano",
        "email": "mano@vysystems.com",
        "jd": "From: Mano, Vysystems mano@vysystems.com Reply to: mano@vysystems.com Hi All,This is MANO from VySystems regarding a Java with Kafka and MongoDB \u200bwith our client.PFB the job details and respond ASAP with the following details along with your updated resume and Required details mentioned below.\u00b7 Are you comfortable with this job/role?\u00b7 Your current location:\u00b7 Work authorization status:\u00b7 Expected hourly rate:\u00b7 Availability to start:Role : Java with Kafka and MongoDBLocation: Dallas, TX Job Description:5+ years of overall experience in software engineering2+ years of experience in Java, J2EE programming, Kafka, Spring Framework and design techniques and web applications/REST APIsHands on with version control practices, Continuous Integration tools e.g. JenkinsKnowledge of cloud technologies \u2013 AWS, GoogleUnderstanding of relational databases e.g. Oracle, MS Sql ServerExposure to Agile based software development\u2022 Following MongoDB specific capabilities:Designing and customizing MongoDB applicationsImplementing database updates and migrationDebugging and troubleshooting when issues ariseAnalyzing databases and advising on optimizing performanceUnderstanding of back-up and disaster recovery plansGood to have knowledge of big data platforms e.g. Cassandra, Hadoop, Marklogic etc.",
        "source": "Email",
        "date_posted": "2024-10-04 15:01:38-05:00",
        "unique_id": "192591f9fc15dea3",
        "emp_type": [
            "third party"
        ],
        "tag": "Java developer"
    }
]