[
    {
        "company": "Veridian Tech Solutions, Inc.",
        "job_title": "Python Developer",
        "location": "Hercules, CA, USA",
        "full_location": {
            "city": "Hercules",
            "state": "CA",
            "country": "USA"
        },
        "job_details": {
            "employment_type": [
                "full-time",
                "third party"
            ],
            "experience_required": "Not specified",
            "degree_required": "Not specified",
            "visa_sponsorship": "Not specified",
            "notice_period": "Not specified",
            "duration": "Not specified",
            "rate": "Not specified"
        },
        "skills": {
            "core": [
                "Python",
                "Django",
                "Flask",
                "RESTful API",
                "NoSQL",
                "AWS"
            ],
            "primary": [
                "HTML",
                "CSS",
                "JavaScript"
            ],
            "secondary": [
                "FastAPI",
                "Database Design"
            ],
            "all": [
                "Python",
                "Django",
                "Flask",
                "RESTful API",
                "NoSQL",
                "AWS",
                "HTML",
                "CSS",
                "JavaScript",
                "FastAPI",
                "Database Design"
            ]
        },
        "job_type": [
            "hybrid"
        ],
        "contact_person": "Sanyogita Dwivedi",
        "email": "sanyogita@veridiants.com",
        "jd": "From: Sanyogita Dwivedi, Veridian Tech Solutions, Inc. sanyogita@veridiants.com Reply to: sanyogita@veridiants.com Position: Python DeveloperDomain Exp: HealthcareLocation: Hercules area SFO (Bay Area) - HybridMust Have: Strong Python, Django, Flask, RESTful API, NoSQL, AwsNeed local candidates only.Job description: Python developers, implement business logic into our backend python server code. Strong python development skills, and best practices in web application development with RESTful API's. Familiarity with web frameworks such as Django, Flask, and FastAPI. Some proficiency in HTML, CSS, and JavaScript (or at least how it will relate to the server side data). Experience with database design (NoSQL and relational).",
        "source": "Email",
        "date_posted": "2024-10-04 11:23:06-05:00",
        "unique_id": "19258578bbc28316",
        "emp_type": [
            "full-time",
            "third party"
        ],
        "tag": "Python developer"
    }
]