[
    {
        "company": "Source InfoTech Inc",
        "job_title": "AWS Cloud DBA",
        "location": "Jersey City, NJ, USA",
        "full_location": {
            "city": "Jersey City",
            "state": "NJ",
            "country": "USA"
        },
        "job_details": {
            "employment_type": [
                "contract",
                "third party"
            ],
            "job_code": "",
            "experience_required": "2-3 years",
            "degree_required": "Not specified",
            "visa_sponsorship": "Must have existing work authorization",
            "notice_period": "Not specified",
            "duration": "6 months",
            "rate": "Not specified"
        },
        "skills": {
            "core": [
                "AWS Databases",
                "DevOps",
                "RDS",
                "AWS Console",
                "AWS CLI"
            ],
            "primary": [
                "Postgres",
                "MySQL",
                "Aurora Postgres",
                "NoSQL",
                "MongoDB",
                "AWS IAM",
                "ETL Tools",
                "AWS Glue",
                "EKS",
                "ECR"
            ],
            "secondary": [
                "Snowflake",
                "RedShift",
                "Python",
                "Terraform",
                "Cloud Formation",
                "Lambda",
                "Continuous integration",
                "Continuous deployment",
                "HADR designs",
                "Service Resiliency"
            ],
            "all": [
                "AWS Databases",
                "DevOps",
                "RDS",
                "AWS Console",
                "AWS CLI",
                "Postgres",
                "MySQL",
                "Aurora Postgres",
                "NoSQL",
                "MongoDB",
                "AWS IAM",
                "ETL Tools",
                "AWS Glue",
                "EKS",
                "ECR",
                "Snowflake",
                "RedShift",
                "Python",
                "Terraform",
                "Cloud Formation",
                "Lambda",
                "Continuous integration",
                "Continuous deployment",
                "HADR designs",
                "Service Resiliency"
            ]
        },
        "job_type": [
            "hybrid"
        ],
        "contact_person": "Sweety",
        "email": "sweety@sourceinfotech.com",
        "jd": "From: sweety, Source InfoTech Inc sweety@sourceinfotech.com Reply to: sweety@sourceinfotech.com Hi,Hope you all are doing well,Please find the job description below,Title: AWS Cloud DBALocation: Jersey City, NJ (Hybrid Onsite)(Local to NJ/NY only with local ID)Duration: 6 months C2HIV: Phone and VideoVisa: GC and USC *** MUST Have Investment Banking and Market Data environment experience***Team is currently looking for a AWS Cloud DBA with experience doing DevOps.Cloud Database RDS2-3 years of experience with AWS Databases \u2022 Experience in migrating data from on-prem to RDS and 53 Exceptional knowledge of AWS Console, AWS CLI S3, DMS \u25e6 RDS: Postgres, MYSOL, Aurora Postgres and NoSQL (MongoDB) Cloud Watch \u2022 Good knowiedge of \u25e6 AWS SDK e RedShift \u25e6 Snowflake O Redis \u25cb High Availability and disaster recovery \u25e6 MSKIStreaming/Messaging Architectures AWS IAM and integration with AW'S Identity Center \u25cb Service Resiliency - HADR designs/solutions tied to business tiering - replication across AZs and Regions e ETL Tools/MWAA AirfiowlAWS Glue EKS/ECR \u2022 Knowledge of \u25e6 Non-relational AWS databases: DynamoDB, Document DB, Neptune, OpenSearch \u25e6 Load balancing \u2022 Nice to have Experience in migrating data from on-prem into Snowflake, RedShift Automation/DevOps Experience\u2022 Exceptional knowledge of: \u25cb Python, Terraform, Cloud Formation Lambda Enterprise level Application Integration experience on AWS Experience with \u25e6 Automation and monitoring within AWS \u25cb Continuous integration and continuous deployment (CI/CD) \u2022 Ability to automate migration of data to RDS, $3, Snowflake, Redshift Thanks,SweetyIT RecruiterSource InfoTech Inc.,Voice: (609) 934-3545 Ext - 135Email: sweety@sourceinfotech.com Disclaimer: If you are not interested in receiving our e-mails then please reply with a \"REMOVE\" in the subject line at remove@sourceinfotech.com for automatic removal. And mention all the e-mail addresses to be removed with any e-mail addresses, which might be diverting the e-mails to you. We are sorry for the inconvenience",
        "source": "Email",
        "date_posted": "2024-10-04 11:02:21-05:00",
        "unique_id": "1925844b0a8d0454",
        "emp_type": [
            "contract",
            "third party"
        ],
        "tag": "AWS Data Engineer"
    }
]