[
    {
        "company": "KPG99",
        "job_title": "AWS Cloud DBA",
        "location": "Jersey City, NJ, USA",
        "full_location": {
            "city": "Jersey City",
            "state": "NJ",
            "country": "USA"
        },
        "job_details": {
            "employment_type": [
                "contract",
                "third party"
            ],
            "job_code": "",
            "experience_required": "2-3 years",
            "degree_required": "Educated in the US is a MUST",
            "visa_sponsorship": "Not specified",
            "notice_period": "Not specified",
            "duration": "6+ months",
            "rate": "Not specified"
        },
        "skills": {
            "core": [
                "AWS Databases",
                "RDS",
                "AWS Console",
                "AWS CLI",
                "S3",
                "DMS",
                "Postgres",
                "MYSOL",
                "Aurora Postgres",
                "NoSQL",
                "MongoDB",
                "Cloud Watch",
                "AWS SDK",
                "RedShift",
                "Snowflake",
                "Redis",
                "High Availability",
                "disaster recovery",
                "AWS IAM",
                "ETL Tools",
                "AWS Glue",
                "EKS",
                "ECR",
                "DynamoDB",
                "DocumentDB",
                "Neptune",
                "OpenSearch"
            ],
            "primary": [
                "Investment Banking experience",
                "Market Data environment experience",
                "DevOps",
                "Automation",
                "Python",
                "Terraform",
                "Cloud Formation",
                "Lambda",
                "Continuous integration",
                "continuous deployment (CI/CD)"
            ],
            "secondary": [
                "Experience in migrating data from on-prem to RDS",
                "Experience in migrating data from on-prem into Snowflake",
                "Experience in migrating data from on-prem into RedShift",
                "Service Resiliency",
                "HADR designs/solutions",
                "replication across AZs and Regions",
                "Load balancing",
                "Enterprise level Application Integration experience on AWS",
                "Automation and monitoring within AWS"
            ],
            "all": [
                "AWS Databases",
                "RDS",
                "AWS Console",
                "AWS CLI",
                "S3",
                "DMS",
                "Postgres",
                "MYSOL",
                "Aurora Postgres",
                "NoSQL",
                "MongoDB",
                "Cloud Watch",
                "AWS SDK",
                "RedShift",
                "Snowflake",
                "Redis",
                "High Availability",
                "disaster recovery",
                "AWS IAM",
                "ETL Tools",
                "AWS Glue",
                "EKS",
                "ECR",
                "DynamoDB",
                "DocumentDB",
                "Neptune",
                "OpenSearch",
                "Investment Banking experience",
                "Market Data environment experience",
                "DevOps",
                "Automation",
                "Python",
                "Terraform",
                "Cloud Formation",
                "Lambda",
                "Continuous integration",
                "continuous deployment (CI/CD)",
                "Experience in migrating data from on-prem to RDS",
                "Experience in migrating data from on-prem into Snowflake",
                "Experience in migrating data from on-prem into RedShift",
                "Service Resiliency",
                "HADR designs/solutions",
                "replication across AZs and Regions",
                "Load balancing",
                "Enterprise level Application Integration experience on AWS",
                "Automation and monitoring within AWS"
            ]
        },
        "job_type": [
            "hybrid"
        ],
        "contact_person": "SUSHMITA",
        "email": "kumaris@kpgtech.com",
        "jd": "From: SUSHMITA, KPG99 kumaris@kpgtech.com Reply to: kumaris@kpgtech.com Title: AWS Cloud DBAHybrid: Jersey City, NJ (Local to NJ/NY or within commutable distance i.e. 100mi. 3 days on site- Hybrid RoleDuration: 6 + months Educated in the US is a MUSTNeed Sr. candidate and at least 2.*** MUST Have Investment Banking and Market Data environment experience***Team is currently looking for an AWS Cloud DBA with experience doing DevOps.Cloud Database RDS2-3 years of experience with AWS Databases \u2022 Experience in migrating data from on-prem to RDS and 53 Exceptional knowledge of AWS Console, AWS CLI S3, DMS \u25e6 RDS: Postgres, MYSOL, Aurora Postgres and NoSQL (MongoDB) Cloud Watch \u2022 Good knowledge of \u25e6 AWS SDK e RedShift \u25e6 Snowflake O Redis \u25cb High Availability and disaster recovery \u25e6MSKIStreaming/Messaging Architectures AWS IAM and integration with AW'S Identity Center \u25cb Service Resiliency - HADR designs/solutions tied to business tiering - replication across AZs and Regions e ETL Tools/MWAA AirfiowlAWS Glue EKS/ECR \u2022 Knowledge of \u25e6 Non-relational AWS databases: DynamoDB, DocumentDB, Neptune, OpenSearch \u25e6 Load balancing \u2022 Nice to have Experience in migrating data from on-prem into Snowflake, RedShift.Automation/DevOps Experience\u2022 Exceptional knowledge of: \u25cb Python, Terraform, Cloud Formation Lambda Enterprise level Application Integration experience on AWS Experience with \u25e6 Automation and monitoring within AWS \u25cb Continuous integration and continuous deployment (CI/CD) \u2022 Ability to automate migration of data to RDS, $3, Snowflake, Redshift",
        "source": "Email",
        "date_posted": "2024-10-04 12:30:10-05:00",
        "unique_id": "1925894f324dde49",
        "emp_type": [
            "contract",
            "third party"
        ],
        "tag": "AWS Data Engineer"
    }
]