[
    {
        "company": "Absolute IT",
        "job_title": "Project Manager with HRIS",
        "location": "Wauwatosa, WI, USA",
        "full_location": {
            "city": "Wauwatosa",
            "state": "WI",
            "country": "USA"
        },
        "job_details": {
            "employment_type": [
                "full-time",
                "third party"
            ],
            "experience_required": "Not specified",
            "degree_required": "Not specified",
            "visa_sponsorship": "No visa sponsorship",
            "notice_period": "Not specified",
            "duration": "12+ months",
            "rate": "Not specified"
        },
        "skills": {
            "core": [
                "Project Management",
                "HR Project Management",
                "Change Management",
                "HRIS",
                "Excellent communication skills"
            ],
            "primary": [
                "Sense of Urgency",
                "Problem Solving"
            ],
            "secondary": [
                "Budgets"
            ],
            "all": [
                "Project Management",
                "HR Project Management",
                "Change Management",
                "HRIS",
                "Excellent communication skills",
                "Sense of Urgency",
                "Problem Solving",
                "Budgets"
            ],
            "with_experience": []
        },
        "job_type": [
            "onsite",
            "hybrid"
        ],
        "contact_person": "Devyani Kumari",
        "email": "devyani@absoluting.com",
        "jd": "From: Devyani Kumari, Absolute IT devyani@absoluting.com Reply to: devyani@absoluting.com Position: Project Manager with HRISLength: 12+ monthsLocation: Wauwatosa, WI - Onsite/ HybridShift: Onsite/HybridLocals and Semi-locals are always preferred first (nearby states, neighboring states, nearby cities). They must be willing to relocate if Nonlocal.Onsite/Hybrid Day 1.Candidate must have an active and an updated LinkedIn ID (REQUIRED!!)Work Authorization:Only USC, GC candidates acceptableJob Description:This HRIS Project Manager will lead the planning, implementation, and execution of HR projects, ensuring alignment with business goals and optimal system performance. They will manage project teams, timelines, budgets, and vendor relationships, while mitigating risks and ensuring successful project outcomes. They will also collaborate with HR and business stakeholders to gather requirements, provide regular updates, and ensure effective change management.Skills:Strong Project Management skillsRequired Skills: HR Project ManagementChange ManagementHRISExcellent communication skillsSense of UrgencyProblem SolvingAdditional Skills:Budgets",
        "source": "Email",
        "date_posted": "2024-10-04 10:26:52-05:00",
        "unique_id": "19258241003cd78b",
        "emp_type": [
            "full-time",
            "third party"
        ],
        "tag": "Project Manager"
    }
]