[
    {
        "company": "Arkaya Infotech Inc",
        "job_title": "AWS Cloud DBA",
        "location": "Jersey City, NJ, USA",
        "full_location": {
            "city": "Jersey City",
            "state": "NJ",
            "country": "USA"
        },
        "job_details": {
            "employment_type": [
                "full-time",
                "third party"
            ],
            "job_code": "",
            "experience_required": "2-3 years",
            "degree_required": "Not specified",
            "visa_sponsorship": "Not specified",
            "notice_period": "Not specified",
            "duration": "Not specified",
            "rate": "Not specified"
        },
        "skills": {
            "core": [
                "AWS Databases",
                "DevOps",
                "RDS",
                "AWS Console",
                "AWS CLI",
                "S3",
                "DMS",
                "Postgres",
                "MySQL",
                "Aurora Postgres",
                "NoSQL",
                "MongoDB",
                "AWS SDK",
                "RedShift",
                "Snowflake",
                "Redis",
                "High Availability",
                "Disaster Recovery",
                "AWS IAM",
                "ETL Tools",
                "AWS Glue",
                "EKS",
                "ECR",
                "DynamoDB",
                "Document DB",
                "Neptune",
                "OpenSearch"
            ],
            "primary": [
                "Automation",
                "Python",
                "Terraform",
                "Cloud Formation",
                "Lambda",
                "Continuous Integration",
                "Continuous Deployment"
            ],
            "secondary": [
                "Investment Banking",
                "Market Data Environment Experience",
                "Exceptional Knowledge of AWS",
                "Service Resiliency",
                "HADR Designs",
                "Solutions Tied to Business Tiering",
                "Replication Across AZs and Regions",
                "Load Balancing",
                "Enterprise Level Application Integration Experience",
                "Automation and Monitoring within AWS"
            ],
            "all": [
                "AWS Databases",
                "DevOps",
                "RDS",
                "AWS Console",
                "AWS CLI",
                "S3",
                "DMS",
                "Postgres",
                "MySQL",
                "Aurora Postgres",
                "NoSQL",
                "MongoDB",
                "AWS SDK",
                "RedShift",
                "Snowflake",
                "Redis",
                "High Availability",
                "Disaster Recovery",
                "AWS IAM",
                "ETL Tools",
                "AWS Glue",
                "EKS",
                "ECR",
                "DynamoDB",
                "Document DB",
                "Neptune",
                "OpenSearch",
                "Automation",
                "Python",
                "Terraform",
                "Cloud Formation",
                "Lambda",
                "Continuous Integration",
                "Continuous Deployment",
                "Investment Banking",
                "Market Data Environment Experience",
                "Exceptional Knowledge of AWS",
                "Service Resiliency",
                "HADR Designs",
                "Solutions Tied to Business Tiering",
                "Replication Across AZs and Regions",
                "Load Balancing",
                "Enterprise Level Application Integration Experience",
                "Automation and Monitoring within AWS"
            ]
        },
        "job_type": [
            "hybrid"
        ],
        "contact_person": "Sanjeev Sharma",
        "email": "sanjeev@arkayainfotech.com",
        "jd": "From: Sanjeev Sharma, Arkaya Infotech Inc sanjeev@arkayainfotech.com Reply to: sanjeev@arkayainfotech.com Role : AWS Cloud DBA\nLocation : Jersey City, NJ Hybrid Locals MOI : Virtual LinkedIn *** MUST Have Investment Banking and Market Data environment experience*** Team is currently looking for a AWS Cloud DBA with experience doing DevOps.Cloud Database RDS2-3 years of experience with AWS Databases \u2022 Experience in migrating data from on-prem to RDS and 53 Exceptional knowledge of AWS Console, AWS CLI S3, DMS \u25e6 RDS: Postgres, MYSOL, Aurora Postgres and NoSQL (MongoDB) Cloud Watch \u2022 Good knowiedge of \u25e6 AWS SDK e RedShift \u25e6 Snowflake O Redis \u25cb High Availability and disaster recovery \u25e6MSKI Streaming/Messaging Architectures AWS IAM and integration with AW'S Identity Center \u25cb Service Resiliency - HADR designs/solutions tied to business tiering - replication across AZs and Regions e ETL Tools/MWAA Airfiowl AWS Glue EKS/ECR \u2022 Knowledge of \u25e6 Non-relational AWS databases: DynamoDB, Document DB, Neptune, OpenSearch \u25e6 Load balancing \u2022 Nice to have Experience in migrating data from on-prem into Snowflake, RedShiftAutomation/DevOps Experience\u2022 Exceptional knowledge of: \u25cb Python, Terraform, Cloud Formation Lambda Enterprise level Application Integration experience on AWS Experience with \u25e6 Automation and monitoring within AWS \u25cb Continuous integration and continuous deployment (CI/CD) \u2022 Ability to automate migration of data to RDS, $3, Snowflake, Redshift Interpersonal Required SkillsAbility to think about a problem identify what we have and implement: solutions to solve the problem independently Strong verbal and written communication skills Ability to think in and out of the box. Self-learner. Self-motivated, conscientious dedicated individual who works equally well independently or as a member of a team \u2022 Must be willing to take responsibility and ownership instead of waiting to be assigned work. Must be willing to participate in follow the sun support The candidate must be willing to provide weekend support, The support is rotated among DBAs in US, London. and India",
        "source": "Email",
        "date_posted": "2024-10-04 09:27:27-05:00",
        "unique_id": "19257edaa938e297",
        "emp_type": [
            "full-time",
            "third party"
        ],
        "tag": "Oracle DBA"
    }
]