[
    {
        "company": "Appian Infotech",
        "job_title": "Microsoft Dynamics 365 CE/F&SCM Business Analyst",
        "location": "New York, NY, USA",
        "full_location": {
            "city": "New York",
            "state": "NY",
            "country": "USA"
        },
        "job_details": {
            "employment_type": [
                "contract",
                "third party"
            ],
            "job_code": "",
            "experience_required": "6-8 years",
            "degree_required": "Master\u2019s Degree in business, or computer science related field or Bachelor\u2019s Degree in business, or computer science related field",
            "visa_sponsorship": "Not specified",
            "notice_period": "Not specified",
            "duration": "Long Term Contract",
            "rate": "Not specified"
        },
        "skills": {
            "core": [
                "Microsoft Dynamics 365",
                "CRM processes",
                "data migration",
                "system integrations",
                "project management"
            ],
            "primary": [
                "business analysis",
                "communication",
                "custom development",
                "testing",
                "client interaction"
            ],
            "secondary": [
                "Microsoft Project",
                "Excel",
                "Word",
                "Visio",
                "Fiduciary function"
            ],
            "all": [
                "Microsoft Dynamics 365",
                "CRM processes",
                "data migration",
                "system integrations",
                "project management",
                "business analysis",
                "communication",
                "custom development",
                "testing",
                "client interaction",
                "Microsoft Project",
                "Excel",
                "Word",
                "Visio",
                "Fiduciary function"
            ]
        },
        "job_type": [
            "onsite"
        ],
        "contact_person": "Abhishek Choudhary",
        "email": "abhishek.c@appianinfotech.com",
        "jd": "From: Abhishek Choudhary, Appian Infotech abhishek.c@appianinfotech.com Reply to: abhishek.c@appianinfotech.com Note: please do not send generic BAs, this is a very specific D365 BA. Candidates with Financial Services/Capital Markets/Asset Management/Wealth Management domain with knowledge of Fiduciary function are preferred. Job Title: Microsoft Dynamics 365 CE/F&SCM Business AnalystLocation: NYC, NYDuration: Long Term Contract Roles and Responsibilities\u00b7Lead and manage mid-sized to enterprise projects independently\u00b7Participate in design and architecture sessions with clients\u00b7Gather and document business processes (some current state, mostly future state)\u00b7Advise customers on best practices for CRM processes, user interface, and architecture\u00b7Assist technical consultants with architecting CRM or xRM system, related customizations, and reports to model the client\u2019s organizational processes\u00b7Assist in developing project budget, and ensure work is completed on-track and within budget\u00b7Write specifications for customizations, data migration, and system integrations\u00b7Facilitate team resources in the implementation of data migration and translation, data integration, training and custom development, and reports\u00b7Configure and customize the CRM system based on design specifications\u00b7Coordinate with overseas team on custom development, complex customizations and portals\u00b7Develop test plans and scripts\u00b7Conduct system and end-to-end testing of the application\u00b7Training super users\u00b7Schedule work to be done and follows up to ensure completion within the project schedule\u00b7Guide the project along through daily communications with the customer\u00b7Conduct at least a weekly status meetings (may be more) and sends weekly status updates\u00b7Conduct design review sessions with the customer to demonstrate completed work and gather adjustments and changesQualifications and Skillsets\u00b7Master\u2019s Degree in business, or computer science related field or Bachelor\u2019s Degree in business, or computer science related field and 6-8 years experience\u00b7Up-to-date understanding of business processes, issues, and technology especially related to the operation of a sales, marketing, and customer service departments within an organization\u00b7Excellent verbal and written communication\u00b7Professional demeanor\u00b7Feels comfortable talking with clients at all levels of within an organization. \u00b7Advanced use of Microsoft Project, Excel, Word, and Visio",
        "source": "Email",
        "date_posted": "2024-10-04 12:33:34-05:00",
        "unique_id": "19258980fe385f8b",
        "emp_type": [
            "contract",
            "third party"
        ],
        "tag": "Business Analyst"
    }
]