[
    {
        "company": "Digital Dhara",
        "job_title": "Big Data Engineer",
        "location": "Phoenix, AZ, USA",
        "full_location": {
            "city": "Phoenix",
            "state": "AZ",
            "country": "USA"
        },
        "job_details": {
            "employment_type": [
                "third party"
            ],
            "job_code": "",
            "experience_required": "Not specified",
            "degree_required": "Not specified",
            "visa_sponsorship": "Visa sponsorship available",
            "notice_period": "Not specified",
            "duration": "Not specified",
            "rate": "Not specified"
        },
        "skills": {
            "core": [
                "GCP",
                "AWS",
                "GKE",
                "SQL",
                "Hadoop",
                "Spark",
                "Pyspark",
                "HDFS",
                "MapReduce",
                "Hive",
                "HBase",
                "Kafka",
                "Java"
            ],
            "primary": [],
            "secondary": [],
            "all": [
                "GCP",
                "AWS",
                "GKE",
                "SQL",
                "Hadoop",
                "Spark",
                "Pyspark",
                "HDFS",
                "MapReduce",
                "Hive",
                "HBase",
                "Kafka",
                "Java"
            ]
        },
        "job_type": [
            "onsite"
        ],
        "contact_person": "Anurag Mule",
        "email": "anurag@digitaldhara.com",
        "jd": "From: Anurag, Anurag Digital dhara anurag@digitaldhara.com Reply to: anurag@digitaldhara.com Big Data EngineerPhoenix, AZNeed GCP OR AWS And GKE Exp.We are looking for energetic, high-performing and highly skilled Engineers to help shape our technology and product roadmap. You will be part of the fast-paced, entrepreneurial Enterprise Personalization portfolio focused on delivering the next generation global marketing capabilities. This team is responsible for Global campaign tracking of new accounts acquisition and bounty payments and leverages transformational technologies, such as SQL, Hadoop, Spark, Pyspark, HDFS, MapReduce, Hive, HBase, Kafka & Java.Thanks & Regards,Anurag MuleAnurag@digitaldhara.comPh: 609-701-2160 EXT 107www.digitaldhara.com",
        "source": "Email",
        "date_posted": "2024-10-04 08:00:22-05:00",
        "unique_id": "192579df59bc8394",
        "emp_type": [
            "third party"
        ],
        "tag": "GCP Data Engineer"
    }
]