[
    {
        "company": "Analytics Solutions",
        "job_title": "Sr. Python Developer with Strong Excel Experience",
        "location": "Washington, DC, USA",
        "full_location": {
            "city": "Washington",
            "state": "DC",
            "country": "USA"
        },
        "job_details": {
            "employment_type": [
                "full-time",
                "third party"
            ],
            "job_code": "",
            "experience_required": "10+ years",
            "degree_required": "Not specified",
            "visa_sponsorship": "Not specified",
            "notice_period": "Not specified",
            "duration": "Long Term",
            "rate": "Not specified"
        },
        "skills": {
            "core": [
                "Python",
                "Excel"
            ],
            "primary": [
                "Code Conversion",
                "Optimization",
                "Error Handling",
                "Documentation",
                "Testing",
                "Validation"
            ],
            "secondary": [
                "Best Practices",
                "Version Control"
            ],
            "all": [
                "Python",
                "Excel",
                "Code Conversion",
                "Optimization",
                "Error Handling",
                "Documentation",
                "Testing",
                "Validation",
                "Best Practices",
                "Version Control"
            ],
            "with_experience": [
                "Python (10+ years)",
                "Excel (10+ years)"
            ]
        },
        "job_type": [
            "hybrid"
        ],
        "contact_person": "Suresh M",
        "email": "sureshm@analyticssol.com",
        "jd": "From: Suresh, Analytics Solutions sureshm@analyticssol.com Reply to: sureshm@analyticssol.com Role: Sr. Python Developer with Strong Excel ExperienceLocation: Washington, DC , hybrid Role Duration: Long TermExperience: 10+ Years Hybrid Onsite: 4 Days onsite per week from Day1 The Python Developer will be responsible for the following tasks:Review and understand the existing Excel-based calculations. Code Conversion: Convert the Excel-based calculations to Python code, ensuring accuracy and consistency. Optimize the Python code for performance and scalability. Implement error handling and validation to ensure robustness.Documentation: Document the existing Excel-based calculations, including formulas, macros, and data flows. Create comprehensive documentation for the Python code, including code comments, user guides, and technical specifications. Testing and Validation: Develop and execute test cases to validate the accuracy and performance of the Python code. Compare the results of the Python code with the original Excel calculations to ensure consistency. Address any discrepancies and refine the code as needed.Optimization and Best Practices: Identify and implement the most efficient methods for migrating calculations from Excel to Python. Follow best practices for coding, documentation, and version control. Provide recommendations for further improvements and optimizations.",
        "source": "Email",
        "date_posted": "2024-10-04 09:56:30-05:00",
        "unique_id": "19258a4f2235c716",
        "emp_type": [
            "full-time",
            "third party"
        ],
        "tag": "Python developer"
    }
]