[
    {
        "company": "United Software Group, Inc.",
        "job_title": "Java Backend Developer",
        "location": "Pittsburgh, PA, USA",
        "full_location": {
            "city": "Pittsburgh",
            "state": "PA",
            "country": "USA"
        },
        "job_details": {
            "employment_type": [
                "contract",
                "third party"
            ],
            "experience_required": "Not specified",
            "degree_required": "Not specified",
            "visa_sponsorship": "Not specified",
            "notice_period": "Not specified",
            "duration": "Not specified",
            "rate": "Not specified"
        },
        "skills": {
            "core": [
                "Java",
                "JavaEE",
                "RESTful Web Services",
                "Spring Framework",
                "Hibernate"
            ],
            "primary": [
                "Git",
                "Eclipse",
                "Maven",
                "Oracle",
                "MySQL",
                "MongoDB",
                "Agile"
            ],
            "secondary": [
                "JSP",
                "JSTL",
                "Thymeleaf",
                "SDLC",
                "Version control tools",
                "Coding best practices",
                "Communication skills",
                "Interpersonal skills"
            ],
            "all": [
                "Java",
                "JavaEE",
                "RESTful Web Services",
                "Spring Framework",
                "Hibernate",
                "Git",
                "Eclipse",
                "Maven",
                "Oracle",
                "MySQL",
                "MongoDB",
                "Agile",
                "JSP",
                "JSTL",
                "Thymeleaf",
                "SDLC",
                "Version control tools",
                "Coding best practices",
                "Communication skills",
                "Interpersonal skills"
            ]
        },
        "job_type": [
            "onsite"
        ],
        "contact_person": "Deepak Kumar",
        "email": "deepakv@usgrpinc.com",
        "jd": "From: Deepak kumar, USG deepakv@usgrpinc.com Reply to: deepakv@usgrpinc.com Hi,I'm Deepak Kumar, part of the United Software Group, Inc. We have a job opening with one of our clients, and we're checking if you're available for a job or if you know someone who might be interested. If you're interested, please send your resume to Deepakv@usgrpinc.com as soon as possible.Job Title: Java Backend DeveloperWork location : Locals only Pittsburgh, PA (On-site interview)Job Type: ContractResponsibilities:Proven Experience as a backend developer.Expertise with RESTful Web ServicesExpertise with Git version controlAbility to solve the day-to-day coding challenge and understand the best coding practices.Strong hands-on experience in coding on technologies like Java, JavaEE, JSP/JSTL/Thymeleaf, Spring Framework Hibernate or any similar frameworks.Good understanding of estimation techniques, SDLC, Development methodologies (Agile is an advantage), and industry standard processes.Should have experience in tools like Eclipse, Maven, Version control tools (GIT) etc.Very good understanding of databases core concepts and hands on with Oracle, MySQL, MongoDBIdentify problems and make recommendations on how to overcome any issue.Develop standardized procedures for common conversion routines to increase efficiencies.Should have good communication skills and interpersonal skills.Job Responsibilities:Responsible for the design, development and support of User Interfaces for IT application and data systems.Develop new user-facing features.Build reusable code and libraries for future use.Ensure the technical feasibility of designs.Optimize application for maximum speed and scalability.Assure that all user input is validated before submitting to back-end.Participate in prototyping of potential solutions.Plan and conduct unit and integration tests to meet IT's unit test coverage goals, monitors test results.Implement coding assignments within estimates.Collaborate effectively with members of development team who are located onsite, offsite, and offshore. Thanks & Regards,Deepak Kumar",
        "source": "Email",
        "date_posted": "2024-10-04 12:29:24-05:00",
        "unique_id": "19258eda0a19407f",
        "emp_type": [
            "contract",
            "third party"
        ],
        "tag": "Java developer"
    }
]