[
    {
        "company": "USC Group",
        "job_title": "Senior Project Manager (Network engineer experience)",
        "location": "USA",
        "full_location": {
            "city": "",
            "state": "",
            "country": "USA"
        },
        "job_details": {
            "employment_type": [],
            "job_code": "",
            "experience_required": "15+ years",
            "degree_required": "Not specified",
            "visa_sponsorship": "Visa sponsorship available",
            "notice_period": "Not specified",
            "duration": "Not specified",
            "rate": "Not specified"
        },
        "skills": {
            "core": [
                "Networking",
                "Security",
                "Middleware",
                "Server",
                "Storage",
                "End-User Computing",
                "Cloud",
                "Databases"
            ],
            "primary": [
                "Project frameworks experience",
                "End to end project management"
            ],
            "secondary": [
                "Firewalls",
                "VLANs",
                "VIPs",
                "DNS",
                "DHCP",
                "Zscaler",
                "email security",
                "DLP",
                "Java Platforms",
                "Microservices",
                "ETL",
                "Messaging",
                "Windows",
                "Linux",
                "Commvault",
                "Microsoft",
                "Azure",
                "SQL",
                "Oracle"
            ],
            "all": [
                "Networking",
                "Security",
                "Middleware",
                "Server",
                "Storage",
                "End-User Computing",
                "Cloud",
                "Databases",
                "Project frameworks experience",
                "End to end project management",
                "Firewalls",
                "VLANs",
                "VIPs",
                "DNS",
                "DHCP",
                "Zscaler",
                "email security",
                "DLP",
                "Java Platforms",
                "Microservices",
                "ETL",
                "Messaging",
                "Windows",
                "Linux",
                "Commvault",
                "Microsoft",
                "Azure",
                "SQL",
                "Oracle"
            ]
        },
        "job_type": [
            "remote"
        ],
        "contact_person": "Shubham",
        "email": "shubham@theuscgroup.com",
        "jd": "From: Shubham, USC Group shubham@theuscgroup.com Reply to: shubham@theuscgroup.com Position: Senior Project Manager (Network engineer experience)Location: RemoteVisa: Only USC, GC, H4-EAD, TN Visa, L2-EAD (Passport number required for third party candidates)Requirements:- Need network experience- ideally a network engineer in beginning of career- Good understanding of the following technologies:o Networking (Firewalls, VLANs, VIPs, DNS, DHCP)o Security (Zscaler, email security, DLP, etc)o Middleware (Java Platforms, Microservices, ETL, Messaging)o Server (Windows/Linux)o Storage (Commvault)o End-User Computing (Microsoft)o Cloud (Azure)o Databases (SQL, Oracle)- Project frameworks experience- End to end project management- Ideally 15+ years of experience",
        "source": "Email",
        "date_posted": "2024-10-01 08:47:07-05:00",
        "unique_id": "19248552dc6639d2",
        "emp_type": [],
        "tag": "BA/Scrum Master/PM"
    }
]