[
    {
        "company": "Vyze Inc",
        "job_title": "Technical Program Manager (Hybrid)",
        "location": "Hoboken, NJ, USA",
        "full_location": {
            "city": "Hoboken",
            "state": "NJ",
            "country": "USA"
        },
        "job_details": {
            "employment_type": [
                "contract"
            ],
            "experience_required": "Not specified",
            "degree_required": "Not specified",
            "visa_sponsorship": "Not specified",
            "notice_period": "Not specified",
            "duration": "12+ month contract",
            "rate": "Not specified"
        },
        "skills": {
            "core": [
                "Cloud Computing",
                "Communication Skills",
                "Organization Skills"
            ],
            "primary": [
                "Linux",
                "Scripting",
                "JIRA",
                "Confluence",
                "Virtualization Technologies"
            ],
            "secondary": [
                "Azure",
                "GCP"
            ],
            "all": [
                "Cloud Computing",
                "Communication Skills",
                "Organization Skills",
                "Linux",
                "Scripting",
                "JIRA",
                "Confluence",
                "Virtualization Technologies",
                "Azure",
                "GCP"
            ]
        },
        "job_type": [
            "hybrid"
        ],
        "contact_person": "Shrasti Singh",
        "email": "shrasti@vyzeinc.com",
        "jd": "From: shrasti singh, vyzeinc shrasti@vyzeinc.com Reply to: shrasti@vyzeinc.com Job Title-Technical Program Manager (Hybrid)Location- Hoboken, NJ | Seattle, WA | Sunnyvale, CA | Bentonville, AR ( Candidate from these states only )Duration- 12+ month ContractInterview process:Interview-2 interviews (virtual)JOB DESCRIPTION-Your Role\u2022 Support Program Management at a global organization in delivering both private and public cloud platform to the newest levels of infrastructure.o Main role will be to communicate and organize the migration off of older cloud hardware soon to be decommissioned. Helping reduce the technology risk with respect to End of Life technologiesWhat qualifies you for the job?\u2022 Self-motivated/ self-starting\u2022 Ability to work remotely\u2022 Great organization skills\u2022 Great communication Skillso Communication will span from Software Engineering level up to Leadership\u2022 Some technical expertise is desired but not required\u2022 Desire to understand Cloud computing specifically involving on premises and off premises infrastructure (Azure, GCP)What makes you extra special?\u2022 Experience with Linux\u2022 Ability to write scripts to increase productivity\u2022 Background in JIRA\u2022 Background in Confluence or some other type of Wiki\u2022 Background in Cloud Computing\u2022 Background in virtualization technologies.What is in it for you?\u2022 Work for a fortune 100 company (The Fortune #1)\u2022 Learn about cloud computing\u2022 Experience with Microsoft Azure\u2022 Experience with GCP\u2022 Experience with on premises cloud environments",
        "source": "Email",
        "date_posted": "2024-10-01 10:23:16-05:00",
        "unique_id": "19248b16a4b7d5a2",
        "emp_type": [
            "contract"
        ],
        "tag": "BA/Scrum Master/PM"
    }
]