[
    {
        "company": "Tekgence Inc",
        "job_title": "Operational Management Specialist",
        "location": "USA",
        "full_location": {
            "city": "",
            "state": "",
            "country": "USA"
        },
        "job_details": {
            "employment_type": [
                "third party"
            ],
            "job_code": "",
            "experience_required": "10+ years",
            "degree_required": "Bachelor's degree in Business Administration, Operations Management, Project Management, or a related field.",
            "visa_sponsorship": "Not specified",
            "notice_period": "Not specified",
            "duration": "Not specified",
            "rate": "Not specified"
        },
        "skills": {
            "core": [
                "Budget Management",
                "Financial tracking",
                "Vendor Management",
                "Agile",
                "Scrum",
                "Lean",
                "Confluence",
                "SharePoint"
            ],
            "primary": [
                "Project Management",
                "Operational Management",
                "Documentation tools",
                "Organizational skills",
                "Communication skills",
                "Problem-solving skills"
            ],
            "secondary": [
                "Technical writing",
                "Data analysis",
                "Reporting tools",
                "Power BI",
                "Tableau",
                "Cloud technologies",
                "IT system architecture documentation"
            ],
            "all": [
                "Budget Management",
                "Financial tracking",
                "Vendor Management",
                "Agile",
                "Scrum",
                "Lean",
                "Confluence",
                "SharePoint",
                "Project Management",
                "Operational Management",
                "Documentation tools",
                "Organizational skills",
                "Communication skills",
                "Problem-solving skills",
                "Technical writing",
                "Data analysis",
                "Reporting tools",
                "Power BI",
                "Tableau",
                "Cloud technologies",
                "IT system architecture documentation"
            ]
        },
        "job_type": [
            "remote"
        ],
        "contact_person": "Pranith",
        "email": "pranith.t@tekgence.com",
        "jd": "From: Pranith, Tekgence Inc pranith.t@tekgence.com Reply to: pranith.t@tekgence.com Role: Operational Management Specialist\nYears of Experience: 10+ years\nLocation: Remote (CST Time Zone) Main Skills: Budget Management, Financial tracking, and Vendor Management\nE.g.- Agile, Scrum, Lean E.g.- Confluence, SharePoint\nJob Description:\nBachelor's degree in Business Administration, Operations Management, Project Management, or a related field.\n3+ years of experience in operational management, project management, or a similar role.\nExperience in budget management, financial tracking, and vendor management.\nStrong knowledge of project management tools and methodologies (e.g., Agile, Scrum, Lean).\nProven track record of developing operational metrics and reporting systems.\nExcellent organizational, communication, and problem-solving skills.\nAbility to manage multiple projects and initiatives simultaneously.\nProficiency with documentation tools (e.g., Confluence, SharePoint, or similar).\nPreferred Skills:\nExperience in the technology or software development industry.\nStrong technical writing experience.\nStrong data analysis skills and familiarity with reporting tools (e.g., Power BI, Tableau, etc.).\nFamiliarity with cloud technologies and IT system architecture documentation.",
        "source": "Email",
        "date_posted": "2024-10-01 10:59:07-05:00",
        "unique_id": "19249067becf97a7",
        "emp_type": [
            "third party"
        ],
        "tag": "Project Manager"
    }
]