[
    {
        "company": "SUS Infotek",
        "job_title": "SAP Business Analyst",
        "location": "San Antonio, TX, USA",
        "full_location": {
            "city": "San Antonio",
            "state": "TX",
            "country": "USA"
        },
        "job_details": {
            "employment_type": [
                "full-time"
            ],
            "job_code": "",
            "experience_required": "10 years",
            "degree_required": "Not specified",
            "visa_sponsorship": "Not specified",
            "notice_period": "Not specified",
            "duration": "Long Term",
            "rate": "Not specified"
        },
        "skills": {
            "core": [
                "SAP",
                "Employee Central",
                "Learning Management System",
                "Service Center",
                "WorkZone"
            ],
            "primary": [
                "BenefitFocus",
                "UAT",
                "Activate methodology"
            ],
            "secondary": [],
            "all": [
                "SAP",
                "Employee Central",
                "Learning Management System",
                "Service Center",
                "WorkZone",
                "BenefitFocus",
                "UAT",
                "Activate methodology"
            ]
        },
        "job_type": [
            "hybrid"
        ],
        "contact_person": "Amit Panthri",
        "email": "ap@susinfotek.com",
        "jd": "From: AMIT, SUS ap@susinfotek.com Reply to: ap@susinfotek.com Position: SAP Business Analyst Location: San Antonio, TX-Hybrid Duration: Long Term Phone and Skype USC Business Analyst: understand success factors Modules: \uf0a7 1. Employee Central \uf0a7 2. Learning Management System \uf0a7 3. Service Center \uf0a7 4. WorkZone Also any experience with a 3rd party integration software called BenefitFocus understand UAT \u2013 they will be heavily involved in running/gathering requirements for testing (not actually testing \u2013 but need solid knowledge) 10 years they\u2019ve done this type of SAP projects before preferred: experience with Activate methodology Regards, Amit Panthri Sr. Technical Recruiter E: ap@susinfotek.com",
        "source": "Email",
        "date_posted": "2024-10-01 08:35:09-05:00",
        "unique_id": "192484a3974dc930",
        "emp_type": [
            "full-time"
        ],
        "tag": "BA/Scrum Master/PM"
    }
]