[
    {
        "company": "Xforia Inc",
        "job_title": "Sr. Technical Business Analyst",
        "location": "Berkeley Heights, NJ, USA",
        "full_location": {
            "city": "Berkeley Heights",
            "state": "NJ",
            "country": "USA"
        },
        "job_details": {
            "employment_type": [
                "contract"
            ],
            "experience_required": "Not specified",
            "degree_required": "Not specified",
            "visa_sponsorship": "Not specified",
            "notice_period": "Not specified",
            "duration": "12+ Months",
            "rate": "Not specified"
        },
        "skills": {
            "core": [
                "Microservice development",
                "API use cases",
                "Metadata",
                "Agile Development lifecycle"
            ],
            "primary": [
                "Cards Dispute & Frauds domain",
                "User Stories creation",
                "Collaboration",
                "Communication skills"
            ],
            "secondary": [],
            "all": [
                "Microservice development",
                "API use cases",
                "Metadata",
                "Agile Development lifecycle",
                "Cards Dispute & Frauds domain",
                "User Stories creation",
                "Collaboration",
                "Communication skills"
            ]
        },
        "job_type": [
            "onsite"
        ],
        "contact_person": "Deepak M.V",
        "email": "deepak@xforia.com",
        "jd": "From: Deepak, Xforia Inc deepak@xforia.com Reply to: deepak@xforia.com Title: Sr. Technical Business AnalystLocation: Berkeley Heights, NJ | Coral Springs, FL | Day 1 OnsiteDuration: 12+ Months Contract Job Description:Techno-functional BAs who can write use cases for APIs, Metadata, and similar tech architecture components.Experience in Microservice development\u200eExperience in Cards Dispute & Frauds domainExperience in User Stories creation for the Functional EpicsExperience in Agile Development lifecycle methodologyWork closely with the software architects, development team members and product ownersAbility to work in large, collaborate teams to achieve organizational goalsExcellent written and verbal communication skill. www.xforia.com Deepak M.VRecruitment Manager9300 Wade Boulevard, Suite 220, Frisco TX 75035, USA.",
        "source": "Email",
        "date_posted": "2024-10-01 08:58:56-05:00",
        "unique_id": "192485fffc52dcb0",
        "emp_type": [
            "contract"
        ],
        "tag": "BA/Scrum Master/PM"
    }
]