[
    {
        "company": "Tek Inspirations LLC",
        "job_title": "Systems Analyst/Business Analyst",
        "location": "Denver, CO, USA",
        "full_location": {
            "city": "Denver",
            "state": "CO",
            "country": "USA"
        },
        "job_details": {
            "employment_type": [
                "contract"
            ],
            "job_code": "",
            "experience_required": "7+ years",
            "degree_required": "High school diploma required",
            "visa_sponsorship": "Not specified",
            "notice_period": "Not specified",
            "duration": "6-12 months of contract with extension",
            "rate": "Not specified"
        },
        "skills": {
            "core": [
                "SCADA",
                "Construction project background",
                "ICCP",
                "Utilities",
                "NERC CIP",
                "Schneider Electric",
                "Auto CAD"
            ],
            "primary": [],
            "secondary": [],
            "all": [
                "SCADA",
                "Construction project background",
                "ICCP",
                "Utilities",
                "NERC CIP",
                "Schneider Electric",
                "Auto CAD"
            ],
            "with_experience": [
                "SCADA (7+ years)",
                "Construction project background",
                "ICCP",
                "Utilities",
                "NERC CIP",
                "Schneider Electric",
                "Auto CAD"
            ]
        },
        "job_type": [
            "onsite"
        ],
        "contact_person": "Payal Shrivastava",
        "email": "payal.shrivastava@tekinspirations.com",
        "jd": "From: Payal Shrivastava, Tek Inspirations LLC payal.shrivastava@tekinspirations.com Reply to: payal.shrivastava@tekinspirations.com Title:Systems Analyst/Business AnalystLocation:- Denver, CO / Golden Valley, Minneapolis, or Amarillo, TX- If local - They should have local DL copy or local project exp.Duration:- 6-12 months of contract with extensionInterview Mode :- Skype Systems Analyst/Business Analyst - Example of a project: They are going to replace an old RTU with a new RTU, that gets assigned to this resource - this person has to make sure they are following all of the guidelines, we have a checklist and then they meet with the field engineers, and it is signed off. If additional help is needed they work with an internal teamMust Have:\u2022 Experience in display building in SCADA - this is the main thing\u2022 Construction project background\u2022 Client product: XA 21 - dynamic team management system - https://www.gevernova.com/gridsolutions/products/brochures/uos/xa21_ems.pdf\u2022 ICCP - Inter-Control Center Communications Protocol - real time exchange system that allows 2 data centers to send data. \u2022 Utilities, real time planning, PowerGrid, etc.\u2022 Prior compliance experience - NERC CIP\u2022 Schneider Electric\u2022 Auto CAD\u2022 Years of experience: 7+ years\u2022 Team: there are 2 other contractors, all of the construction projects get assigned to these contractors. \u2022 Previous companies: LCRA - they have a similar system to Xcel, Schneider, Client, any energy companies...\u2022 Education: high school diploma required. For Bachelors - electrical engineering or computer science (but this isn't required)Regards, Payal ShrivastavaIT RecruiterTEK Inspirations LLC : 13573 Tabasco Cat Trail, Frisco, TX 75035Email: payal.shrivastava@tekinspirations.com",
        "source": "Email",
        "date_posted": "2024-10-01 10:50:24-05:00",
        "unique_id": "19248cb291e5f393",
        "emp_type": [
            "contract"
        ],
        "tag": "BA/Scrum Master/PM"
    }
]