[
    {
        "company": "Source Infotech Inc",
        "job_title": "AGILE SCRUM MASTER",
        "location": "Plano, TX, USA",
        "full_location": {
            "city": "Plano",
            "state": "TX",
            "country": "USA"
        },
        "job_details": {
            "employment_type": [
                "contract",
                "third party"
            ],
            "job_code": "",
            "experience_required": "10+ years",
            "degree_required": "Not specified",
            "visa_sponsorship": "No visa sponsorship",
            "notice_period": "Not specified",
            "duration": "12 months",
            "rate": "Not specified"
        },
        "skills": {
            "core": [
                "Agile methodologies",
                "Scrum Master role",
                "Project Management",
                "Planning",
                "Execution"
            ],
            "primary": [
                "Kanban",
                "TDD",
                "Atlassian suite",
                "JIRA",
                "First level Scrum Master Certification",
                "SAFe Scrum Master Certification",
                "Agile Certified Practitioner",
                "PSM Certification"
            ],
            "secondary": [
                "Big Data",
                "Modelling",
                "Web Services",
                "Python",
                "ETL",
                "Strong negotiation skills",
                "Strong communication skills",
                "Release management activities",
                "PMP Certification",
                "Banking domain experience"
            ],
            "all": [
                "Agile methodologies",
                "Scrum Master role",
                "Project Management",
                "Planning",
                "Execution",
                "Kanban",
                "TDD",
                "Atlassian suite",
                "JIRA",
                "First level Scrum Master Certification",
                "SAFe Scrum Master Certification",
                "Agile Certified Practitioner",
                "PSM Certification",
                "Big Data",
                "Modelling",
                "Web Services",
                "Python",
                "ETL",
                "Strong negotiation skills",
                "Strong communication skills",
                "Release management activities",
                "PMP Certification",
                "Banking domain experience"
            ]
        },
        "job_type": [
            "hybrid"
        ],
        "contact_person": "Bhavya Chaturvedi",
        "email": "bhavya.c@sourceinfotech.com",
        "jd": "From: Bhavya, Source infotec inc bhavya.c@sourceinfotech.com Reply to: bhavya.c@sourceinfotech.com AGILE SCRUM MASTER12 MONTHS CONTRACTPLANO, TX / JERSEY CITY, NJHYBRID (2-3 DAYS/WEEK)VISA- NO CPT/H1B W2 Position Summary-Facilitate Scrum/Kanban level ceremonies.Facilitate Program level events and processes and assist the teams in delivering value.Influences leaders, teams, and Stake holders in Lean-Agile practices and mindsetsDrives epic-level prioritization and sequencing decisions with key stakeholders through value vs estimation process.Assess the agility level of the Program and help them improve.Facilitate Agile processes and execution.Provide the support needed by the Agile Delivery Teams, Product Teams, and Programs to be self-organizing and self-managing.Escalate and track impediments, manage risk and dependencies, help ensure value delivery, and help drive relentless improvement.Support Business, IT, and Product Management alignment on vision, roadmap, and priorities of the ProgramEngage and optimize the flow of value through the Project using various tools and other information radiators.Establish a cadence and support cross-Project planning centered around value streams.Work with Product Management, Solutions Management, and other stakeholders to help ensure strategy and execution alignment.Facilitate periodic synchronization meetings within and across Projects.Assist tracking the execution of features within the Project.Provide input on resourcing to address critical bottlenecks.Support release management activities.Provide the delivery metrics to leadership team.Good understanding in Big Data, Modelling, Web Services, Python and ETL. Required Skills:Min 10+ years of experience in Project Management and Scrum Master role for a software development teamGood experience with Agile methodologies (Kanban, TDD, etc.) and toolsets (Atlassian suite, JIRA etc.)First level Scrum Master Certification (CSM) or SAFe Scrum Master Certification or Agile Certified Practitioner (ACP) or PSM Certification(s)Ability to understand the architectural concepts.Strong expertise in planning, execution and reporting.Proven track record of ownership and driving projects.Strong negotiation and communication skillsGood experience in release management activities.PMP Certification.Banking domain experience.THANKS & REGARDS Bhavya Chaturvedi Source Infotech IncP.O Box 577, EDISON, NJ 08818-0577EMAIL: bhavya.c@sourceinfotech.comPhone: 6097335170 | | Hangout:bhavyachaturvedi389",
        "source": "Email",
        "date_posted": "2024-10-16 13:18:01-05:00",
        "unique_id": "19296cf2ef7aa576",
        "emp_type": [
            "contract",
            "third party"
        ],
        "tag": "Scrum Master"
    }
]