[
    {
        "company": "Panzer Solutions LLC",
        "job_title": "Lead Java Developer with Mulesoft",
        "location": "Austin, TX, USA",
        "full_location": {
            "city": "Austin",
            "state": "TX",
            "country": "USA"
        },
        "job_details": {
            "employment_type": [
                "contract",
                "third party"
            ],
            "job_code": "",
            "experience_required": "12 years",
            "degree_required": "Not specified",
            "visa_sponsorship": "Not specified",
            "notice_period": "Not specified",
            "duration": "12 Months",
            "rate": "Not specified"
        },
        "skills": {
            "core": [
                "Java",
                "Spring",
                "Angular",
                "Tomcat",
                "Mulesoft",
                "Hibernate"
            ],
            "primary": [
                "Ag-GRID",
                "IBM Process Automation Manager",
                "Maven",
                "Azure DevOps"
            ],
            "secondary": [
                "Selenium",
                "Performance Management"
            ],
            "all": [
                "Java",
                "Spring",
                "Angular",
                "Tomcat",
                "Mulesoft",
                "Hibernate",
                "Ag-GRID",
                "IBM Process Automation Manager",
                "Maven",
                "Azure DevOps",
                "Selenium",
                "Performance Management"
            ]
        },
        "job_type": [
            "hybrid"
        ],
        "contact_person": "Zaid Khan",
        "email": "zaid.khan@panzersolutions.com",
        "jd": "From: zaid, Panzer zaid.khan@panzersolutions.com Reply to: zaid.khan@panzersolutions.com Hi,How are you doing well!My name is Zaid Khan, and I am a certified LinkedIn Recruiter currently working as a Talent Acquisition Specialist at Panzer Solutions LLC. We specialize in both IT and non-IT recruitment services across the U.S. I wanted to inform you about an exciting opportunity we have with one of your preferred clients. If you're available and interested, please let me know. You can also send me your updated resume and the best contact number for a quick follow-upPS: ONLY CANDIDATE Willing to Move to AUSTIN, TX will be considered. Candidates with Lead Java Developer with Mulesoft Experience will be considered for this positionCandidates willing to attend Face-TO-Face Interview will be considered for this positionTitle: Lead Java Developer with MulesoftLocation: Austin, TXLength: 12 MonthsHybrid: (Austin TX-Hybrid)Note : Previous State Project Expereince is Not Mandatory - But a Plus Point Only Active LinkedIn ID is Must Description:The Software Developer at this level is responsible for knowing numerous development languages and platforms. Those include Java, Spring, Angular, Tomcat, and Hibernate. This resource is also expected to have a strong working knowledge of integration patterns and the use of Mulesoft, along with numerous code libraries that include Ag-GRID, IBM Process Automation Manager, Maven repositories, and the use of Azure DevOps code management principles.Minimum Yrs of Experience, Skills, and Qualifications12 Yrs experience in Java, Spring, Angular, Tomcat, Mulesoft and Hibernate10 Years Researching, designing, implementing, and managing software programs10 Yrs Testing and evaluating programs6+ Yrs Working closely with other developers, UX designers, business and systems analystsPreferred Skills and Qualifications6+ Performance Management for custom developed applications1+ Designed and developed automation processes using tools such as Selenium.",
        "source": "Email",
        "date_posted": "2024-10-16 19:14:00-05:00",
        "unique_id": "1929812c27388fae",
        "emp_type": [
            "contract",
            "third party"
        ],
        "tag": "Java developer"
    }
]