[
    {
        "company": "GTECH LLC",
        "job_title": "Sr. AWS ML Ops Engineer with strong Databricks Experience",
        "location": "O'Fallon, MO, USA",
        "full_location": {
            "city": "O'Fallon",
            "state": "MO",
            "country": "USA"
        },
        "job_details": {
            "employment_type": [
                "contract",
                "third party"
            ],
            "experience_required": "10+ years",
            "degree_required": "Bachelor\u2019s or Master\u2019s degree in Computer Science, Data Science, Engineering, or a related field",
            "visa_sponsorship": "Not specified",
            "notice_period": "Not specified",
            "duration": "Not specified",
            "rate": "Not specified"
        },
        "skills": {
            "core": [
                "AWS services",
                "Databricks",
                "Python",
                "machine learning operations",
                "cloud infrastructure management"
            ],
            "primary": [
                "SageMaker",
                "Lambda",
                "EC2",
                "ECS",
                "EKS",
                "CloudFormation",
                "TensorFlow",
                "PyTorch",
                "Scikit-learn",
                "CI/CD tools",
                "Jenkins",
                "GitLab CI",
                "AWS CodePipeline",
                "CloudWatch",
                "Grafana",
                "Prometheus",
                "AWS security best practices",
                "IAM policies",
                "VPC configurations",
                "encryption techniques"
            ],
            "secondary": [
                "analytical skills",
                "problem-solving skills",
                "communication skills",
                "team player"
            ],
            "all": [
                "AWS services",
                "Databricks",
                "Python",
                "machine learning operations",
                "cloud infrastructure management",
                "SageMaker",
                "Lambda",
                "EC2",
                "ECS",
                "EKS",
                "CloudFormation",
                "TensorFlow",
                "PyTorch",
                "Scikit-learn",
                "CI/CD tools",
                "Jenkins",
                "GitLab CI",
                "AWS CodePipeline",
                "CloudWatch",
                "Grafana",
                "Prometheus",
                "AWS security best practices",
                "IAM policies",
                "VPC configurations",
                "encryption techniques",
                "analytical skills",
                "problem-solving skills",
                "communication skills",
                "team player"
            ]
        },
        "job_type": [
            "onsite"
        ],
        "contact_person": "Mohammad Asif",
        "email": "masif@greattechglobal.com",
        "jd": "From: Mohammad Asif, GTECH LLC masif@greattechglobal.com Reply to: masif@greattechglobal.com Job Title: Sr. AWS ML Ops Engineer with strong Databricks ExperienceLocation: O FALLON, MO (Day 1 Onsite)Job Type: Contract Job Description: AWS ML Ops Engineer strong Databricks Experience\u2022 Educational Background: Bachelor\u2019s or Master\u2019s degree in Computer Science, Data Science, Engineering, or a related field.\u2022 Experience: 10+ years of experience in machine learning operations, cloud infrastructure management, and automation.\u2022 Technical Skills: Proficiency in AWS services such as SageMaker, Lambda, EC2, ECS, EKS, and CloudFormation.\u2022 Programming Skills: Strong coding skills in Python, along with experience in using ML libraries such as TensorFlow, PyTorch, or Scikit-learn.\u2022 Automation Tools: Familiarity with CI/CD tools and frameworks such as Jenkins, GitLab CI, or AWS CodePipeline.\u2022 Monitoring Tools: Experience with monitoring and logging tools like CloudWatch, Grafana, or Prometheus.\u2022 Security Best Practices: Knowledge of AWS security best practices, including IAM policies, VPC configurations, and encryption techniques.\u2022 Problem-Solving: Strong analytical and problem-solving skills with the ability to troubleshoot complex issues.\u2022 Communication: Excellent verbal and written communication skills, with the ability to convey technical concepts to non-technical stakeholders.\u2022 Team Player: Ability to work effectively in a collaborative team environment and contribute to multiple projects simultaneously.",
        "source": "Email",
        "date_posted": "2024-10-16 11:34:53-05:00",
        "unique_id": "192964fa5ba1ee4c",
        "emp_type": [
            "contract",
            "third party"
        ],
        "tag": "AWS Data Engineer"
    }
]