[
    {
        "company": "Brain Bolt Consulting",
        "job_title": "Java lead and Architect",
        "location": "Berkley Heights, NJ, USA",
        "full_location": {
            "city": "Berkley Heights",
            "state": "NJ",
            "country": "USA"
        },
        "job_details": {
            "employment_type": [
                "full-time",
                "third party"
            ],
            "job_code": "",
            "experience_required": "Not specified",
            "degree_required": "Not specified",
            "visa_sponsorship": "Not specified",
            "notice_period": "Not specified",
            "duration": "Not specified",
            "rate": "Not specified"
        },
        "skills": {
            "core": [
                "Java",
                "J2EE",
                "Webservices",
                "API",
                "Spring Boot"
            ],
            "primary": [
                "Database",
                "SQL",
                "JDBC",
                "Java Script",
                "HTML",
                "Angular JS"
            ],
            "secondary": [
                "Problem solving",
                "Debugging",
                "Full stack development"
            ],
            "all": [
                "Java",
                "J2EE",
                "Webservices",
                "API",
                "Spring Boot",
                "Database",
                "SQL",
                "JDBC",
                "Java Script",
                "HTML",
                "Angular JS",
                "Problem solving",
                "Debugging",
                "Full stack development"
            ]
        },
        "job_type": [
            "hybrid"
        ],
        "contact_person": "Arjun Kumar",
        "email": "arjun@brainboltconsulting.com",
        "jd": "From: Arjun, Brain Bolt Consulting arjun@brainboltconsulting.com Reply to: arjun@brainboltconsulting.com Java lead or Architect (Local to NJ only) US(Berkley Heights, NJ)Engineering Lead1Tech Lead1 \u00b7 Engineering Leadership end to end (solution design, architecture and getting it implemented). This is typical hybrid role not only focused on Tech solutioning but ensuring the 11 vendor team is committed and productive.\u00b7 Tech lead/senior tech developers Java /J2EE, Webservices, API, Spring Boot, Solid understanding of Database, SQL, JDBC, Java Script, HTML and Angular JS. Full stack developer. Problem solving and debugging is key here.Best Regards Arjun KumarSr. IT Recruiter | Brain Bolt Consulting\u200bE - Mail I'D : arjun@brainboltconsulting.com",
        "source": "Email",
        "date_posted": "2024-10-16 17:22:33-05:00",
        "unique_id": "1929791330f7424a",
        "emp_type": [
            "full-time",
            "third party"
        ],
        "tag": "Java developer"
    }
]