[
    {
        "company": "Tanisha Systems Inc",
        "job_title": "Advanced Project Manager - Windows/Linux",
        "location": "Columbus, OH, USA",
        "full_location": {
            "city": "Columbus",
            "state": "OH",
            "country": "USA"
        },
        "job_details": {
            "employment_type": [
                "contract",
                "third party"
            ],
            "experience_required": "9+ years",
            "degree_required": "Not specified",
            "visa_sponsorship": "Not specified",
            "notice_period": "Not specified",
            "duration": "Not specified",
            "rate": "Not specified"
        },
        "skills": {
            "core": [
                "Windows",
                "Linux"
            ],
            "primary": [
                "PowerShell",
                "Shell Scripting",
                "Project management knowledge",
                "Knowledge of software scanning",
                "Reading/interpreting of vulnerability reports"
            ],
            "secondary": [
                "Splunk",
                "Log reading knowledge"
            ],
            "all": [
                "Windows",
                "Linux",
                "PowerShell",
                "Shell Scripting",
                "Project management knowledge",
                "Knowledge of software scanning",
                "Reading/interpreting of vulnerability reports",
                "Splunk",
                "Log reading knowledge"
            ]
        },
        "job_type": [
            "onsite"
        ],
        "contact_person": "Akshat Kumar",
        "email": "akshat@tanishasystems.com",
        "jd": "Greetings..!! My name is Akshat, and I am a Technical Recruiter at Tanisha Systems Inc. Tanisha Systems Inc is a global contingency staffing firm servicing. We have an excellent job opportunity with one of our clients. Role: Advanced Project Manager - Windows/LinuxLocation: Columbus, OH \u2013 Only Local \u20133 Day onsite per weekExperience: 9+YearsType: Contract JOB SUMMARY: Primary Skills \u2013 Windows/Linux Secondary Skills \u2013 PowerShell/Shell ScriptingProject management knowledgeKnowledge of software scanning and reading/interpreting of vulnerability reportsSplunk or other reporting tool log reading knowledge RegardsAkshat KumarAkshat@tanishasystems.comwww.tanishasystems.comlinkedin.com/in/akshat-kumar-7245821a299 Wood Ave South, Suite # 308, Iselin, New Jersey, NJ 08830, USA",
        "source": "Email",
        "date_posted": "2024-10-16 14:55:41-05:00",
        "unique_id": "192970709f331398",
        "emp_type": [
            "contract",
            "third party"
        ],
        "tag": "Project Manager"
    }
]