[
    {
        "company": "Scalable Systems",
        "job_title": "Lead Data Engineer with Airflow Exp.",
        "location": "Atlanta, GA, USA",
        "full_location": {
            "city": "Atlanta",
            "state": "GA",
            "country": "USA"
        },
        "job_details": {
            "employment_type": [
                "third party"
            ],
            "job_code": "",
            "experience_required": "Not specified",
            "degree_required": "Not specified",
            "visa_sponsorship": "Not specified",
            "notice_period": "Not specified",
            "duration": "Not specified",
            "rate": "Not specified"
        },
        "skills": {
            "core": [
                "Airflow",
                "Java",
                "Python",
                "Springboot",
                "Software Engineering Principles"
            ],
            "primary": [
                "Data Modeling",
                "Data Interface Protocols",
                "Caching/Performance Improvements",
                "Software Design Patterns",
                "Integration Patterns"
            ],
            "secondary": [
                "Microservices",
                "Technical Solution Translation",
                "Client Requirement Analysis"
            ],
            "all": [
                "Airflow",
                "Java",
                "Python",
                "Springboot",
                "Software Engineering Principles",
                "Data Modeling",
                "Data Interface Protocols",
                "Caching/Performance Improvements",
                "Software Design Patterns",
                "Integration Patterns",
                "Microservices",
                "Technical Solution Translation",
                "Client Requirement Analysis"
            ]
        },
        "job_type": [
            "onsite"
        ],
        "contact_person": "Manish Kumar",
        "email": "manish.kumar@scalable-systems.com",
        "jd": "From: Manish Kumar, Scalable Systems manish.kumar@scalable-systems.com Reply to: manish.kumar@scalable-systems.com Position: Lead Data Engineer with Airflow Exp.Location: Atlanta, GAStrategically architect, Design, develop industry-specific solutions in support of core enterprise functions based on client requirement and manage and upgrade existing applications.2) Articulate, Design, develop and Java Springboot microservices based on business requirements including integrations with internal and external systems.3) Ability to translate client\u2019s business requirements into technical solution, based on java and Python platform\u2019s and market best practices.4) Strong understanding of software engineering principles, databases and data modeling/design techniques; data interface protocols; caching/performance improvements; software design patterns and integration patterns.5) Provide inputs and direction to senior developers on the team for design and implementation.6) Define implementation processes, quality gates and standards. Best Regards Manish Kumar Phone - +17327883626 Email ID: manish.kumar@scalable-systems.com Scalable Systems | Inspiring Innovation Big Data | Analytics | Integration | Intelligence www.scalable-systems.com",
        "source": "Email",
        "date_posted": "2024-10-16 17:43:26-05:00",
        "unique_id": "19297a09dff37aea",
        "emp_type": [
            "third party"
        ],
        "tag": "AWS Data Engineer"
    }
]