[
    {
        "company": "Techgene Solutions",
        "job_title": "AWS Python Developer",
        "location": "Plano, TX, USA",
        "full_location": {
            "city": "Plano",
            "state": "TX",
            "country": "USA"
        },
        "job_details": {
            "employment_type": [
                "full-time",
                "third party"
            ],
            "experience_required": "Not specified",
            "degree_required": "Not specified",
            "visa_sponsorship": "Not specified",
            "notice_period": "Not specified",
            "duration": "Not specified",
            "rate": "Not specified"
        },
        "skills": {
            "core": [
                "Python",
                "Java",
                "GitHub"
            ],
            "primary": [
                "Golang",
                "API development",
                "RESTful services"
            ],
            "secondary": [
                "Web Development",
                "Testing",
                "Debugging",
                "Troubleshooting",
                "Unit testing",
                "Test automation"
            ],
            "all": [
                "Python",
                "Java",
                "GitHub",
                "Golang",
                "API development",
                "RESTful services",
                "Web Development",
                "Testing",
                "Debugging",
                "Troubleshooting",
                "Unit testing",
                "Test automation"
            ]
        },
        "job_type": [
            "onsite"
        ],
        "contact_person": "Rahaman Mohammed",
        "email": "mohammed.r@techgene.com",
        "jd": "From: Rahaman Mohammed, Techgene Solutions mohammed.r@techgene.com Reply to: mohammed.r@techgene.com Role : AWS Python DeveloperLocation : Plano, Tx and Chicago IL(Onsite ) - f2f required Primary Skills:\u2022 Programming Languages:Proficiency in Python Developing and Java.Experience with tool development and integration using these languages\u2022 GitHub Integration:Experience with integrating tools and applications with GitHubUnderstanding of GitHub APIs and workflows Secondary Skills:\u2022 Web Development:Familiarity with web frameworks and development practices in Python and GolangKnowledge of API development and RESTful services\u2022 Testing and Debugging:Strong debugging and troubleshooting skillsExperience with unit testing and test automation Roles and Responsibilities:Develop and maintain tools and applications using Python and GolangIntegrate tools and applications with GitHub for seamless workflowsWrite clean, efficient, and maintainable codeDebug and troubleshoot issues in the developed applicationsCollaborate with cross-functional teams to deliver high-quality software",
        "source": "Email",
        "date_posted": "2024-10-16 12:36:33-05:00",
        "unique_id": "19296f5eb8f4e61c",
        "emp_type": [
            "full-time",
            "third party"
        ],
        "tag": "Python developer"
    }
]