[
    {
        "company": "3K Technologies, LLC",
        "job_title": "Senior Scrum Master",
        "location": "USA",
        "full_location": {
            "city": "",
            "state": "",
            "country": "USA"
        },
        "job_details": {
            "employment_type": [
                "third party"
            ],
            "job_code": "",
            "experience_required": "15+ years",
            "degree_required": "Not specified",
            "visa_sponsorship": "Not specified",
            "notice_period": "Not specified",
            "duration": "Not specified",
            "rate": "Not specified"
        },
        "skills": {
            "core": [
                "Agile"
            ],
            "primary": [
                "Rally",
                "JIRA"
            ],
            "secondary": [
                "Excellent communication",
                "Team player",
                "Domain knowledge in banking",
                "Risk management",
                "Scrum master certification"
            ],
            "all": [
                "Agile",
                "Rally",
                "JIRA",
                "Excellent communication",
                "Team player",
                "Domain knowledge in banking",
                "Risk management",
                "Scrum master certification"
            ]
        },
        "job_type": [
            "remote"
        ],
        "contact_person": "Ganji Vamshi",
        "email": "vamshi.g@3ktechnologies.com",
        "jd": "From: g vamshi, 3ktechnologies vamshi.g@3ktechnologies.com Reply to: vamshi.g@3ktechnologies.com Role : Scrum MasterLocation :: Remote Job Title/RoleSenior Scrum MasterExperience level required (Years)15+ yearsMandatory required skillsAgilePreferred/Desired skills Please share the Detailed Job Description15+ years of IT experience and 8+ years of Scrum master experienceStrong agile knowledge and agile tools like Rally, JIRA etcManage project scrip and timeline. Coaching team members in Agile frameworkCo-ordinate different agile ceremonies and multiple cross functional teamsResolve conflicts and enable on time delivery with qualityExcellent communication and team playerDomain knowledge in banking and risk management is a plusScrum master certification is a plus Thanks & RegardsGanji VamshiBench sale / Technical Recruiter1114 Cadillac Ct, Milpitas, CA 950353K Technologies, LLCwww.3ktechnologies.com vamshi.g@3ktechnologies.comAnalytics | BI | Big Data | Cloud |Software Engg.",
        "source": "Email",
        "date_posted": "2024-10-16 08:48:14-05:00",
        "unique_id": "19295d8b79fd1641",
        "emp_type": [
            "third party"
        ],
        "tag": "Scrum Master"
    }
]