[
    {
        "company": "Tek Inspirations LLC",
        "job_title": "Business Analyst/Tester",
        "location": "Harrisburg, PA, USA",
        "full_location": {
            "city": "Harrisburg",
            "state": "PA",
            "country": "USA"
        },
        "job_details": {
            "employment_type": [
                "contract",
                "third party"
            ],
            "job_code": "",
            "experience_required": "3-5 years",
            "degree_required": "Bachelor\u2019s Degree in Information Systems, Computer Science, Business Analysis, or related field",
            "visa_sponsorship": "Not specified",
            "notice_period": "Not specified",
            "duration": "6 Months",
            "rate": "Not specified"
        },
        "skills": {
            "core": [
                "Business Analysis",
                "Software Testing",
                "UAT test case creation",
                "JIRA",
                "Test management tools"
            ],
            "primary": [
                "Test case writing",
                "Test execution",
                "Defect reporting",
                "Regression test case identification"
            ],
            "secondary": [
                "Attention to detail",
                "Problem-solving skills"
            ],
            "all": [
                "Business Analysis",
                "Software Testing",
                "UAT test case creation",
                "JIRA",
                "Test management tools",
                "Test case writing",
                "Test execution",
                "Defect reporting",
                "Regression test case identification",
                "Attention to detail",
                "Problem-solving skills"
            ]
        },
        "job_type": [
            "hybrid"
        ],
        "contact_person": "Payal Shrivastava",
        "email": "payal.shrivastava@tekinspirations.com",
        "jd": "From: Payal Shrivastava, Tek Inspirations LLC payal.shrivastava@tekinspirations.com Reply to: payal.shrivastava@tekinspirations.com Title : Business Analyst/Tester Duration: 6 Months Location: HYBRID. Harrisburg, PA ( Candidates MUST be able to report onsite 2 days/week in Harrisburg, Pa ) Business Analyst/Tester Support hands-on test case writing and test execution. Identify and create UAT test cases. Execute UAT test cases, including developing and reporting defects, and retesting. Collaborate with the Lottery PMO and SMEs to document UAT test cases and identify regression test cases for future automation. Qualifications Bachelor\u2019s Degree in Information Systems, Computer Science, Business Analysis, or related field. Minimum of 3-5 years of combined experience in business analysis and software testing. Minimum of 1-2 years of JIRA experience Experience with UAT test case creation and execution. Strong understanding of test management tools. Excellent attention to detail and problem-solving skills. Regards, Payal Shrivastava IT Recruiter TEK Inspirations LLC : 13573 Tabasco Cat Trail, Frisco, TX 75035 Email: payal.shrivastava@tekinspirations.com",
        "source": "Email",
        "date_posted": "2024-10-16 11:38:26-05:00",
        "unique_id": "1929652c3f90de3f",
        "emp_type": [
            "contract",
            "third party"
        ],
        "tag": "Business Analyst"
    }
]