[
    {
        "company": "Avance",
        "job_title": "Java/ AWS Solution Architect",
        "location": "San Antonio, TX, USA",
        "full_location": {
            "city": "San Antonio",
            "state": "TX",
            "country": "USA"
        },
        "job_details": {
            "employment_type": [
                "full-time",
                "third party"
            ],
            "experience_required": "17+ years",
            "degree_required": "Not specified",
            "visa_sponsorship": "Not specified",
            "notice_period": "Not specified",
            "duration": "Not specified",
            "rate": "Not specified"
        },
        "skills": {
            "core": [
                "Java",
                "AWS",
                "Banking Finance",
                "Architect"
            ],
            "primary": [
                "Terraform",
                "Openshift",
                "Docker",
                "Kafka",
                "Gitlab-CI",
                "Gradle",
                "Kibana",
                "Grafana",
                "Datadog",
                "Postman",
                "React",
                "Redux",
                "NodeJS",
                "ECMAScript (ES6)",
                "Mocha",
                "Chai",
                "Pi-Test",
                "Jest",
                "CSS3",
                "HTML5",
                "Wicket",
                "JSP/Servlets",
                "Struts",
                "REST micro services (JAX-RS)",
                "SOAP Webservices (JAX-WS, JAX-RPC)",
                "Spring Boot",
                "EJB",
                "JPA",
                "JDBC",
                "XML",
                "JEE Design Patterns",
                "Java Batch",
                "IBM-DB2",
                "Oracle",
                "Websphere",
                "Tomcat"
            ],
            "secondary": [],
            "all": [
                "Java",
                "AWS",
                "Banking Finance",
                "Architect",
                "Terraform",
                "Openshift",
                "Docker",
                "Kafka",
                "Gitlab-CI",
                "Gradle",
                "Kibana",
                "Grafana",
                "Datadog",
                "Postman",
                "React",
                "Redux",
                "NodeJS",
                "ECMAScript (ES6)",
                "Mocha",
                "Chai",
                "Pi-Test",
                "Jest",
                "CSS3",
                "HTML5",
                "Wicket",
                "JSP/Servlets",
                "Struts",
                "REST micro services (JAX-RS)",
                "SOAP Webservices (JAX-WS, JAX-RPC)",
                "Spring Boot",
                "EJB",
                "JPA",
                "JDBC",
                "XML",
                "JEE Design Patterns",
                "Java Batch",
                "IBM-DB2",
                "Oracle",
                "Websphere",
                "Tomcat"
            ]
        },
        "job_type": [
            "onsite"
        ],
        "contact_person": "Bhavya Rapelli",
        "email": "bhavya.r@avanceservices.com",
        "jd": "From: Bhavya Rapelli, Avance bhavya.r@avanceservices.com Reply to: bhavya.r@avanceservices.com Role/ Title: Java/ AWS Solution Architect (Min 17+years experience) Location -San Antonio TX onsiteMust haves in experience: (Need to have experience or profile will be rejected)Banking FinanceExperience:Architect with Java / AWS skillsGather new requirements for different components, prepare an implementable design, drawing out a plan for releases of the solutionInvolve in all new RFP proposals and provide innovative solutions, design and estimatesBe updated with the latest AWS services and have hands-on expertise on required AWS servicesParticipate in PI Planning sessions to define Features to be developed in each PI and SprintReview all technical deliverables from the teams and ensure its adhering to the client\u2019s standards and processesDesign, develop, test and deploy critical application components. Coordinate with offshore team to develop and integrate all code componentsCreate and maintain standardized documentation for the solutions implementedCoordinate with the testing teams to improve automation testing in different environmentsInteracting with onsite and offshore teams in resolving the impedimentsCloud Tools & Technologies:AWS \u2013 Lambda, EKS, SQS, S3, RDS, DynamoDB, API-Gateway. TerraformOpenshift, Docker, Kafka, helm, Gitlab-CI, Gradle, Kibana, Grafana, Datadog, PostmanFront End Technologies:React, Redux, NodeJS, ECMAscript (ES6), Mocha, Chai, Pi-Test, Jest, CSS3, HTML5, Wicket, JSP/Servlets, StrutsJEE Tools & Technologies:REST micro services (JAX-RS), SOAP Webservices (JAX-WS, JAX-RPC), Spring Boot, EJB, JPA, JDBC, XML, JEE Design Patterns, Java BatchDatabases & Servers: IBM-DB2, Oracle, Websphere, Tomcat",
        "source": "Email",
        "date_posted": "2024-10-16 16:40:38-05:00",
        "unique_id": "19297c26b7997739",
        "emp_type": [
            "full-time",
            "third party"
        ],
        "tag": "Java developer"
    }
]