[
    {
        "company": "Virginia Department of Transportation",
        "job_title": "VDOT Business Analyst",
        "location": "Richmond, VA, USA",
        "full_location": {
            "city": "Richmond",
            "state": "VA",
            "country": "USA"
        },
        "job_details": {
            "employment_type": [
                "contract",
                "third party"
            ],
            "job_code": "748993",
            "experience_required": "10+ years",
            "degree_required": "Not specified",
            "visa_sponsorship": "Not specified",
            "notice_period": "Not specified",
            "duration": "Not specified",
            "rate": "Not specified"
        },
        "skills": {
            "core": [
                "Business Analysis",
                "Agile",
                "Scrum",
                "Microsoft Office",
                "Application Lifecycle Management"
            ],
            "primary": [
                "Requirements Gathering",
                "User Stories",
                "Acceptance Criteria",
                "Quality Analyst Functions",
                "User Acceptance Testing"
            ],
            "secondary": [
                "CBAP Certification",
                "CSPO Certification",
                "Team Foundation Server",
                "Automated Testing Tools"
            ],
            "all": [
                "Business Analysis",
                "Agile",
                "Scrum",
                "Microsoft Office",
                "Application Lifecycle Management",
                "Requirements Gathering",
                "User Stories",
                "Acceptance Criteria",
                "Quality Analyst Functions",
                "User Acceptance Testing",
                "CBAP Certification",
                "CSPO Certification",
                "Team Foundation Server",
                "Automated Testing Tools"
            ],
            "with_experience": [
                "Business Analysis (10+ years)",
                "Agile Business Analyst (5+ years)"
            ]
        },
        "job_type": [
            "hybrid"
        ],
        "contact_person": "Hitesh",
        "email": "hitesh@cyber-resource.com",
        "jd": "From: Hitesh, cyber-resource hitesh@cyber-resource.com Reply to: hitesh@cyber-resource.com Role: VDOT Business Analyst (748993)Job Id : 748993Positions : 1Location: Richmond, VAWork mode: HybridInterview: Both Web Cam and In Person InterviewDUE : 10/22Experience : 10+Client : -VDOT (Virginia Department of Transportation)Client State: VirginiaRate Range : *Local candidates only please*Candidate must also be able to work onsite 2-3 days/week.*Contractor will be responsible for purchasing parking through VDOT\u2019s Parking Management Office or procuring their own parkingThe Virginia Department of Transportation (VDOT) Information Technology Division (ITD) is seeking a Business Analyst to work as a key member of Business Analytics and Testing Support Team for IT projects. This analyst will support teams working in Agile (Sprint) as well as traditional Waterfall methodologies for Software Development Lifecycle (SDLC).Responsibilities include analyzing problems; documenting business processes; developing requirements, user stories and acceptance criteria; and managing requirements traceability and testing. VDOT is a fast-paced organization with very high standards for work quality and efficiency. This position is expected to handle multiple projects, and remain flexible and productive, despite changing priorities and processes. Ongoing improvement and efficiency is a part of our culture and each team member is expected to proactively contribute to process improvements.Responsibilities:\u2022 Work with the Project team members and business stakeholders to understand business processes and pain points\u2022 Develop expertise in the customers\u2019 business applications\u2022 Conduct Root Cause Analysis to identify system gaps and deficiencies that require a business, technical or blended approach for resolution\u2022 Diagram current processes and proposed modifications using process flows, context diagrams and data flow diagrams\u2022 Discover and document requirements and user stories with a focus on improving both business and technical processing\u2022 Decompose requirements into Epics and Features and create clear and concise user stories that are easy to understand and implement by technical staff\u2022 Utilize progressive elaboration; map stories to technical design specifications to be used by internal staff to develop the system modifications\u2022 Identify and group related user stories into Themes, document the dependencies and associated business processes\u2022 Assist Product Owner in maintaining the product backlog\u2022 Create conceptual prototypes and mock-ups\u2022 Propose alternative solutions that balance cost and benefit, and adequately test a solution\u2019s feasibility for business and technical compatibility\u2022 Collaborate with staff, vendors, consultants, and contractors as they are engaged on tasks to formulate, detail and test potential and implemented solutions.\u2022 Perform Quality Analyst functions such as defining test objectives, test plans and test cases, and executing test cases (including regression testing)\u2022 Coordinate and Facilitate User Acceptance Testing with Business and ensure Project Managers/Scrum Masters are informed of the progressQualificationsRequired:\u2022 The candidate must have a minimum of 10 years of experience delivering business and systems analysis artifacts.\u2022 5+ years of experience as an Agile Business Analyst; strong understanding of Scrum concepts and methodology\u2022 Experience organizing and maintaining Product and Sprint backlogs\u2022 Experience translating client and product strategy requirements into application requirements and user stories\u2022 Proficient with defining acceptance criteria and managing acceptance process with development\u2022 Experience with large, multi-module systems\u2022 Expertise with Microsoft Office products (Word, Excel, Access, Outlook, Visio, PowerPoint, Project Server)\u2022 Experience with Application Lifecycle management (ALM)\u2022 The candidate must have exceptional written and oral communications skills and have the proven ability to work well with a diverse set of peers and customersPreferred:\u2022 CBAP and/or CSPO Certification\u2022 Experience using Team Foundation Server for agile software development and work item tracking\u2022 Experience with automated testing tools such as TestComplete",
        "source": "Email",
        "date_posted": "2024-10-16 07:48:23-05:00",
        "unique_id": "192957fd91f1d489",
        "emp_type": [
            "contract",
            "third party"
        ],
        "tag": "Business Analyst"
    }
]