[
    {
        "company": "Brillius",
        "job_title": "Infrastructure Manager",
        "location": "USA",
        "full_location": {
            "city": "",
            "state": "",
            "country": "USA"
        },
        "job_details": {
            "employment_type": [
                "contract",
                "third party"
            ],
            "job_code": "",
            "experience_required": "Not specified",
            "degree_required": "Not specified",
            "visa_sponsorship": "Not specified",
            "notice_period": "Not specified",
            "duration": "Long Term",
            "rate": "$65/hour"
        },
        "skills": {
            "core": [
                "Networking",
                "System Admin",
                "End Point Security",
                "Project Implementation"
            ],
            "primary": [
                "Azure Cloud",
                "SharePoint Administration",
                "Office Suite",
                "Cloud Computing",
                "Jira",
                "TFS",
                "Time Management",
                "Release Management"
            ],
            "secondary": [
                "Communication Skills",
                "IT Infrastructure Best Practices"
            ],
            "all": [
                "Networking",
                "System Admin",
                "End Point Security",
                "Project Implementation",
                "Azure Cloud",
                "SharePoint Administration",
                "Office Suite",
                "Cloud Computing",
                "Jira",
                "TFS",
                "Time Management",
                "Release Management",
                "Communication Skills",
                "IT Infrastructure Best Practices"
            ]
        },
        "job_type": [
            "remote"
        ],
        "contact_person": "Jay Brillius",
        "email": "jay.s@brillius.com",
        "jd": "From: Jay, Brillius jay.s@brillius.com Reply to: jay.s@brillius.com : Infrastructure Manager Must Have PMPREMOTELong TERMWe are seeking a skilled Infrastructure Manager with Networking, System Admin and End Point Security Experience .. Azure Cloud experience PreferredRemote Duties:- Lead project implementation related to IT infrastructure, ensuring timely completion and adherence to quality standards.- Manage SharePoint platform to facilitate collaboration and document management within the organization.- Communicate effectively with team members and stakeholders to ensure alignment on infrastructure projects and goals.- Utilize Office suite and Cloud computing technologies to enhance operational efficiency.- Proficient in tools like Jira, TFS for project tracking and management.- Oversee IT infrastructure, including hardware, software, networks, servers, and security systems.- Demonstrate strong time management skills to prioritize tasks and meet deadlines efficiently.- Implement release management processes to ensure smooth deployment of software updates.Skills:- Proven experience in project implementation within an IT environment.- Proficiency in SharePoint administration for effective content management.- Excellent communication skills to interact with diverse teams and convey technical information clearly.- Familiarity with Office suite applications and Cloud computing services.- Knowledge of Jira and TFS for project tracking and collaboration.- Strong understanding of IT infrastructure components and best practices.- Effective time management abilities to handle multiple projects simultaneously.- Experience in release management processes for software deployment.",
        "source": "Email",
        "date_posted": "2024-10-16 12:49:51-05:00",
        "unique_id": "19296eb04f179041",
        "emp_type": [
            "contract",
            "third party"
        ],
        "tag": "Project Manager"
    }
]