[
    {
        "company": "Techgene solutions",
        "job_title": "DBA Services Lead - Operations Or Projects",
        "location": "USA",
        "full_location": {
            "city": "",
            "state": "",
            "country": "USA"
        },
        "job_details": {
            "employment_type": [
                "third party"
            ],
            "job_code": "",
            "experience_required": "10+ years",
            "degree_required": "Bachelor's degree in Computer Science, Information Systems, or related field",
            "visa_sponsorship": "Not specified",
            "notice_period": "Not specified",
            "duration": "Not specified",
            "rate": "Not specified"
        },
        "skills": {
            "core": [
                "DB2 LUW",
                "Database Administration",
                "Leadership",
                "Client Management",
                "Database Security"
            ],
            "primary": [
                "Database Architecture",
                "Database Operations",
                "Cloud-based Database Solutions",
                "Agile Principles",
                "Scrum Practices"
            ],
            "secondary": [
                "Oracle",
                "SQL Server",
                "PostgreSQL",
                "NoSQL databases",
                "AWS RDS",
                "Azure SQL",
                "Google Cloud SQL"
            ],
            "all": [
                "DB2 LUW",
                "Database Administration",
                "Leadership",
                "Client Management",
                "Database Security",
                "Database Architecture",
                "Database Operations",
                "Cloud-based Database Solutions",
                "Agile Principles",
                "Scrum Practices",
                "Oracle",
                "SQL Server",
                "PostgreSQL",
                "NoSQL databases",
                "AWS RDS",
                "Azure SQL",
                "Google Cloud SQL"
            ]
        },
        "job_type": [
            "remote"
        ],
        "contact_person": "pooja",
        "email": "pooja.b@techgene.com",
        "jd": "From: pooja, Techgene solutions pooja.b@techgene.com Reply to: pooja.b@techgene.com Lead multiple teams of international Database Administrators for many clients and industries serviced by DXC. Management centralizes around production and project support. Act as technical DMBS project manager on large infrastructure projects including data center migrations and infrastructure refreshes. Provide priorities and technical requirements to DXC Global Bionix team to automate DBMS project delivery tasks and increase efficiency to our clients.DBA Services Lead - Operations/ProjectsRemote Position. Muat have sail point certificationAbout the RoleWe are a leading provider of comprehensive Database Administration (DBA) services, offering end-to-end solutions for our clients across various industries. Our services span from Database Architecture & Design to Database Operations & Maintenance. We are seeking an experienced Database Services Leader to oversee Operations and Projects. The ideal candidate will have broad expertise across multiple database management systems, with DB2 LUW experience being essential. This role combines strategic leadership with deep technical knowledge, focusing on delivering exceptional database services to our diverse client base. Key ResponsibilitiesLead and manage either an Operations team (handling day-to-day database management) or a Projects team (overseeing migrations, upgrades, and major implementations)Develop and implement strategies to enhance service delivery, client satisfaction, and operational efficiencyServe as the escalation point for complex technical issues and strategic client engagementsManage client relationshipsEnsure compliance with SLAs, regulatory requirements, and industry standards across all client engagementsDrive innovation in our service delivery methods, incorporating new technologies and best practicesManage resource allocation, capacity planning, and team development to meet client needs Required QualificationsBachelor's degree in Computer Science, Information Systems, or related field;10+ years of experience in database administration and management, with at least 3 years in a leadership roleExtensive knowledge of multiple database management systems, with strong DB2 LUW expertiseProven experience in managing large-scale database operations or projectsTrack record of successfully leading and growing teamsStrong understanding of database security, compliance, and governance principlesExcellent communication, interpersonal, and client management skillsPreferred QualificationsExperience with a wide range of database technologies (e.g., Oracle, SQL Server, PostgreSQL, NoSQL databases)Significant experience with cloud-based database solutions (AWS RDS, Azure SQL, Google Cloud SQL)Background in IT service management, Agile principles and methodologies, Scrum practices",
        "source": "Email",
        "date_posted": "2024-10-16 14:49:28-05:00",
        "unique_id": "1929701570a628fa",
        "emp_type": [
            "third party"
        ],
        "tag": "DB Admin"
    }
]