[
    {
        "company": "Deltaclass Technology Solutions",
        "job_title": "Dotnet with Specflow Automation Engineer",
        "location": "Chandler, AZ, USA",
        "full_location": {
            "city": "Chandler",
            "state": "AZ",
            "country": "USA"
        },
        "job_details": {
            "employment_type": [
                "full-time",
                "third party"
            ],
            "experience_required": "8+ years",
            "degree_required": "Not specified",
            "visa_sponsorship": "Not specified",
            "notice_period": "Not specified",
            "duration": "Long term",
            "rate": "Not specified"
        },
        "skills": {
            "core": [
                ".Net",
                "Selenium Web Driver",
                "C# Programming",
                "REST Sharp API",
                "BDD framework",
                "Specflow"
            ],
            "primary": [
                "CICD DevOps pipelines",
                "Git",
                "Postman",
                "SOAP UI",
                "Jenkins",
                "microservice architecture",
                "API driven test frameworks",
                "automated test suites"
            ],
            "secondary": [
                "Agile/Scrum development",
                "automation methodologies",
                "test automation related improvements",
                "customer/client interaction"
            ],
            "all": [
                ".Net",
                "Selenium Web Driver",
                "C# Programming",
                "REST Sharp API",
                "BDD framework",
                "Specflow",
                "CICD DevOps pipelines",
                "Git",
                "Postman",
                "SOAP UI",
                "Jenkins",
                "microservice architecture",
                "API driven test frameworks",
                "automated test suites",
                "Agile/Scrum development",
                "automation methodologies",
                "test automation related improvements",
                "customer/client interaction"
            ]
        },
        "job_type": [
            "onsite"
        ],
        "contact_person": "Kevin",
        "email": "kevin@deltaclasstech.com",
        "jd": "From: Kevin, Deltaclass Technology Solutions kevin@deltaclasstech.com Reply to: kevin@deltaclasstech.com Position: Dotnet with Specflow Automation EngineerLocation: Chandler ArizonaDuration: Long termExp 8+ Years and USC and H1B Job Description:Must Have .Net Programmers with Expert in Selenium Web Driver and C# Programming, Specflow is good to have..Net (Strong .Net coding experience) with good understanding of object-oriented programmingREST Sharp API automation experience.Net programming experience with Selenium Web DriverExperience in BDD framework for .Net - SpecflowExperience in development of automation frameworks.Knowledge on CICD DevOps pipelines and Git as source controlHands on experience on Postman, SOAP UI, Jenkins.Experience with microservice architecture.Proven experience in building, and maintaining API driven test frameworks and automated test suitesMinimum 8+ years of experience in building automated solutions to cover UI frontend, middle tier, and backend interfaces and servicesDeliver a robust automation framework built upon established and proven open source or commercial tools (Selenium Web driver + Specflow with .Net) to support Agile/Scrum development, DevOps and CI/CDDesign and architect modular and reusable automated testing solutions that satisfy client requirementsProvides automation expertise, training and coaching to team membersKeep current with advances in automation methodologies and toolsExperience with Jenkins, GitHub, UCD or other continuous integration softwareAdvocate the use of the automation infrastructure with development teamsIdentifying and selecting the automation test cases. Creating, enhancing, debugging, and running the test casesAbility to assess functional and technical gaps in designsSupport continuous improvement processes, analyzing problems and recommending actions for effective resolutionAbility to adapt to a fast paced continually changing business and work environment while managing multiple prioritiesIdentifies and directs the implementation of test automation related improvements that positively impact software delivery across the enterpriseInteracting with customers/clients to solve the various issues they face and updating on the situation.",
        "source": "Email",
        "date_posted": "2024-10-16 12:43:47-05:00",
        "unique_id": "19296ee6a5eae631",
        "emp_type": [
            "full-time",
            "third party"
        ],
        "tag": ".net developer"
    }
]