[
    {
        "company": "Largeton INC",
        "job_title": "Sr Python Developer",
        "location": "Irving, TX, USA",
        "full_location": {
            "city": "Irving",
            "state": "TX",
            "country": "USA"
        },
        "job_details": {
            "employment_type": [
                "contract",
                "third party"
            ],
            "job_code": "",
            "experience_required": "5-6 years",
            "degree_required": "Not specified",
            "visa_sponsorship": "No visa sponsorship",
            "notice_period": "Not specified",
            "duration": "Long Term Contract",
            "rate": "Not specified"
        },
        "skills": {
            "core": [
                "Python"
            ],
            "primary": [
                "Strong communication skills",
                "Maintaining complex applications",
                "APIs"
            ],
            "secondary": [],
            "all": [
                "Python",
                "Strong communication skills",
                "Maintaining complex applications",
                "APIs"
            ]
        },
        "job_type": [
            "hybrid"
        ],
        "contact_person": "Gaurav Kumar",
        "email": "gaurav.kumar@largeton.us",
        "jd": "From: Gaurav Kumar, Largeton INC gaurav.kumar@largeton.us Reply to: gaurav.kumar@largeton.us Title: Sr Python Developer Location: Irving, TX Hybrid role in Irving, TX (Onsite- Tuesday, Wednesday, Thursday)Need local with DLDuration: Long Term Contract Visa: No H1B/OPT/CPTMOI: Video or In Person immediate Sr Python DeveloperPosition: Sr Python DeveloperLocation: Hybrid (Onsite \u2013 Tuesday, Wednesday, Thursday)Location: Irving, TXKey Skills:Strong communication skillsIn-depth knowledge of maintaining complex applications and APIsAt least 5-6 years of experience with PythonMust pass code report testin Thanks and Regards,Gaurav KumarTechnical RecruiterLargeton.incPh no: +1 (571)-463-9097 Ext. 345Email: gaurav.kumar@largeton.us",
        "source": "Email",
        "date_posted": "2024-10-16 12:54:35-05:00",
        "unique_id": "19296982ca168cb0",
        "emp_type": [
            "contract",
            "third party"
        ],
        "tag": "Python developer"
    }
]