[
    {
        "company": "iTech US Inc",
        "job_title": "Java Developer",
        "location": "Minneapolis, MN, USA",
        "full_location": {
            "city": "Minneapolis",
            "state": "MN",
            "country": "USA"
        },
        "job_details": {
            "employment_type": [
                "contract",
                "third party"
            ],
            "job_code": "",
            "experience_required": "Not specified",
            "degree_required": "Bachelor's or equivalent experience in Computer Science, Software/Electronics Engineering, Information Systems, or a closely related field",
            "visa_sponsorship": "No visa sponsorship",
            "notice_period": "Not specified",
            "duration": "12+ months contract",
            "rate": "Not specified"
        },
        "skills": {
            "core": [
                "Core Java",
                "Spring boot",
                "Camel",
                "Microservices",
                "CI/CD",
                "Jenkins",
                "GitHub",
                "Kafka",
                "Kubernetes",
                "AWS"
            ],
            "primary": [],
            "secondary": [],
            "all": [
                "Core Java",
                "Spring boot",
                "Camel",
                "Microservices",
                "CI/CD",
                "Jenkins",
                "GitHub",
                "Kafka",
                "Kubernetes",
                "AWS"
            ]
        },
        "job_type": [
            "onsite"
        ],
        "contact_person": "Manasa Salla",
        "email": "manasa.s@itechus.net",
        "jd": "From: Manasa S, iTech US INC manasa.s@itechus.net Reply to: manasa.s@itechus.net Hi..........Greetings, This is Manasa from ITech US Inc. Given below are the details of the position with one of our clients and was wondering if you would be interested or can recommend someone who would be interested in this job. Position: Java DeveloperLocation: Minneapolis Downtown, MN and Minneapolis, MN(Need local ID proof)Duration: 12+ months contractOnsite from Day 1Visa: H1B | Need passport number along with submissionLooking Local to MN ,WI,SD,ND,IA Conusltants only Must have: Core Java, Spring boot, Camel, Microservices, CI/CD, Jenkins, GitHub, Kafka, Kubernetes, AWS Education: At least a bachelor\u2019s degree (or equivalent experience) in Computer Science, Software/Electronics Engineering, Information Systems, or a closely related field is required for the project Thanks & RegardsManasa SallaSr Technical RecruiteriTech US, Incmanasa.s@itechus.netLinkedIn: https://www.linkedin.com/in/manasa-salla-0836711a8",
        "source": "Email",
        "date_posted": "2024-10-16 12:48:09-05:00",
        "unique_id": "192969246f114437",
        "emp_type": [
            "contract",
            "third party"
        ],
        "tag": "Java developer"
    }
]