[
    {
        "company": "GVR Infotek",
        "job_title": "Full Stack Senior ERP Developer/Programmer with .Net Applications",
        "location": "Richmond, VA, USA",
        "full_location": {
            "city": "Richmond",
            "state": "VA",
            "country": "USA"
        },
        "job_details": {
            "employment_type": [
                "contract",
                "third party"
            ],
            "job_code": "",
            "experience_required": "14 years",
            "degree_required": "Not specified",
            "visa_sponsorship": "No visa sponsorship",
            "notice_period": "Not specified",
            "duration": "12 months",
            "rate": "Not specified"
        },
        "skills": {
            "core": [
                "C#",
                ".NET",
                "SQL Server",
                "Angular",
                "Blazor"
            ],
            "primary": [
                "Web API",
                "CSS3",
                "HTML5",
                "Automated Builds",
                "Agile SDLC"
            ],
            "secondary": [
                "Troubleshooting",
                "Source Control",
                "JQuery"
            ],
            "all": [
                "C#",
                ".NET",
                "SQL Server",
                "Angular",
                "Blazor",
                "Web API",
                "CSS3",
                "HTML5",
                "Automated Builds",
                "Agile SDLC",
                "Troubleshooting",
                "Source Control",
                "JQuery"
            ]
        },
        "job_type": [
            "hybrid"
        ],
        "contact_person": "Kartik Mahajan",
        "email": "kartik.mahajan@gvrinfotek.com",
        "jd": "From: Kartik Mahajan, GVR Infotek kartik.mahajan@gvrinfotek.com Reply to: kartik.mahajan@gvrinfotek.com Title: Full Stack Senior ERP Developer/Programmer with .Net ApplicationsClient: VA Dept of TransportationWork schedule is HYBRID (3 days onsite a week)Interview is ONSITE/IN-PERSONLength of contract is 12 monthsCITIZEN,GC EAD,GREEN CARD ONLY Our client CAI/VDOT is looking for an ERP Developer for a HYBRID position based out of Richmond, VA. Requirements:14 Years \u2013 C# .NET development experience.Strong database development experience using SQL Server.Excellent troubleshooting skills.Experience with Source Control using TFS.Angular or Blazor experience.Experience with Web API.Experience with CSS3 and HTML5.Experience with Automated Builds using Microsoft Team Foundation.Experience with Agile SDLC best practices. Responsibilities:VDOT-AMD is seeking a Developer with 14 yrs or more .Net Web application development. Experience and fluency with C#, Angular or Blazor, SQL Server, JQuery, CSS3 and HTML5 experience.VDOT is seeking a Full Stack Senior ERP Developer/Programmer with .Net Applications Development experience who will be responsible for managing, programming, testing, debugging and analyzing complex software requirements to design and develop high quality components using the .NET Core framework.The ERP Developer will be programming the current budget and spend plan tool that is used agency wide for financial and budget management for the Maintenance Program. The Senior Developer is expected to program using best practices, prioritize programming work effectively and write system documentation as required.The successful candidate should have strong programming and communication skills to be effective in both technical and business requirement discussions.Ability to develop, program and code in .NET Core environment applications and backend services using C#, Web API, Java Script, JQuery, Angular or Blazor and CSS. Design, develop and program using appropriate software design patterns to attain high reusability and maintainability. Write effective unit tests and integration tests to ensure high quality software delivery. In-depth knowledge and skills in programming, system design patterns, tiered architecture, and testing practices. Understanding of key business processes and competitive strategies related to the IT function. Work with project architect, project manager, business owner and system analysts to clarify the requirements and then implement them.Participate in Agile SDLC.",
        "source": "Email",
        "date_posted": "2024-10-16 10:06:06-05:00",
        "unique_id": "19295ffd8b2608e8",
        "emp_type": [
            "contract",
            "third party"
        ],
        "tag": ".net developer"
    }
]