[
    {
        "company": "HMG America LLC",
        "job_title": "Database Administrator",
        "location": "Austin, TX, USA",
        "full_location": {
            "city": "Austin",
            "state": "TX",
            "country": "USA"
        },
        "job_details": {
            "employment_type": [
                "full-time",
                "third party"
            ],
            "job_code": "529501191",
            "experience_required": "8 years",
            "degree_required": "Not specified",
            "visa_sponsorship": "Not specified",
            "notice_period": "Not specified",
            "duration": "11/25/2024 - 08/31/2025",
            "rate": "Not specified"
        },
        "skills": {
            "core": [
                "Oracle Database 12c or higher",
                "Oracle RAC",
                "Golden Gate",
                "Advanced SQL",
                "Shell scripting",
                "Supporting multi-terabyte database",
                "Advanced performance tuning"
            ],
            "primary": [
                "Microsoft O365 applications (Word, Excel, PowerPoint, Visio)",
                "MS Team and Channel communication",
                "Experience working with a public sector organization (Federal, State, or Local Government)"
            ],
            "secondary": [
                "SharePoint",
                "Jira",
                "Scrum framework"
            ],
            "all": [
                "Oracle Database 12c or higher",
                "Oracle RAC",
                "Golden Gate",
                "Advanced SQL",
                "Shell scripting",
                "Supporting multi-terabyte database",
                "Advanced performance tuning",
                "Microsoft O365 applications (Word, Excel, PowerPoint, Visio)",
                "MS Team and Channel communication",
                "Experience working with a public sector organization (Federal, State, or Local Government)",
                "SharePoint",
                "Jira",
                "Scrum framework"
            ]
        },
        "job_type": [
            "hybrid"
        ],
        "contact_person": "Anubhav Jain",
        "email": "anubhav@hmgamerica.com",
        "jd": "From: Anubhav, HMG America anubhav@hmgamerica.com Reply to: anubhav@hmgamerica.com Title: Database Administrator (529501191)Location: Austin, TX 78751.Duration: 11/25/2024 - 08/31/2025. Client: State of Texas Work Hours : Monday through Friday from 8:00 AM to 5:00 PM,Interview mode : Either Web Cam or In Person InterviewClient requires the services of Database Administrator , hereafter referred to as Candidate(s), who meets the general qualifications of Database Administrator , Data/Database Administration and the specifications outlined in this document for the clientRequired Skills :Oracle Database 12c or higher Required 8 yearsOracle RAC Required 8 yearsGolden Gate Required 8 yearsAdvanced SQL Required 8 yearsShell scripting Required 8 yearsSupporting multi-terabyte database Required 8 yearsAdvanced performance tuning Required 8 years(at least 4) Experience with Microsoft O365 applications (Word, Excel, PowerPoint, Visio) Required 8 years(at least 2) Experience with MS Team and Channel communication with a large team Required 8 yearsExperience working with a public sector organization (Federal, State, or Local Government) Preferred 4 yearsExperience with SharePoint Preferred 2 yearsExperience with Jira Preferred 1 yearsExperience working with the Scrum framework Preferred 1 yearsDuration : 11/25/2024 - 08/31/2025Location : Austin, Texas 78751 Monday through Friday from 8:00 AM to 5:00 PMInterview mode : Either Web Cam or In Person Interview Thanks & Regards,Anubhav Jain IT RecruiterHMG America LLCanubhav@hmgamerica.comhttp://www.hmgamerica.com",
        "source": "Email",
        "date_posted": "2024-10-16 08:54:31-05:00",
        "unique_id": "19295be39695bc2d",
        "emp_type": [
            "full-time",
            "third party"
        ],
        "tag": "Oracle DBA"
    }
]