[
    {
        "company": "Unifysolutions",
        "job_title": "Java Full Stack Developer with Angular",
        "location": "Phoenix, AZ, USA",
        "full_location": {
            "city": "Phoenix",
            "state": "AZ",
            "country": "USA"
        },
        "job_details": {
            "employment_type": [
                "full-time",
                "third party"
            ],
            "job_code": "",
            "experience_required": "7 years",
            "degree_required": "Bachelor\u2019s Degree or an Advanced Degree (e.g. Masters, MBA, JD, MD, or PhD) or equivalent experience",
            "visa_sponsorship": "Not specified",
            "notice_period": "Not specified",
            "duration": "Not specified",
            "rate": "Not specified"
        },
        "skills": {
            "core": [
                "Java",
                "Angular",
                "JavaScript",
                "SQL",
                "REST APIs"
            ],
            "primary": [
                "HTML5",
                "CSS4",
                "Ajax",
                "Redux",
                "Riot.js",
                "React.js"
            ],
            "secondary": [
                "JSON",
                "relational database management systems",
                "technical direction"
            ],
            "all": [
                "Java",
                "Angular",
                "JavaScript",
                "SQL",
                "REST APIs",
                "HTML5",
                "CSS4",
                "Ajax",
                "Redux",
                "Riot.js",
                "React.js",
                "JSON",
                "relational database management systems",
                "technical direction"
            ]
        },
        "job_type": [
            "onsite"
        ],
        "contact_person": "lakshmi",
        "email": "lakshmi@unifysolutions.com",
        "jd": "From: lakshmi, Unifysolutions lakshmi@unifysolutions.com Reply to: lakshmi@unifysolutions.com Role: Java Full Stack Developer with Angular (strong coding)Location: Phoenix, AZ Basic Qualifications:\u2022 7 years of work experience with a Bachelor\u2019s Degree or an Advanced Degree (e.g. Masters, MBA, JD, MD, or PhD) or equivalent experience.\u2022 You have full-stack engineer experienced with strong Angular and other technologies like JavaScript, Ajax, HTML5, SQL, CSS4, Redux, Riot.js and/or React.js\u2022 Expertise in relational database management systems including MS SQL and/or SQL Server.\u2022 Working on a small team, you must be able to work independently and quickly ramp up.\u2022 Extensive experience in Java, REST APIs, and JSON.\u2022 Able to clearly communicate and offer technical direction and recommendations to the team",
        "source": "Email",
        "date_posted": "2024-10-16 14:15:22-05:00",
        "unique_id": "19296e21e875f9cd",
        "emp_type": [
            "full-time",
            "third party"
        ],
        "tag": "Java developer"
    }
]