[
    {
        "company": "Sligo Soft",
        "job_title": "Data Architect",
        "location": "Tallahassee, FL, USA",
        "full_location": {
            "city": "Tallahassee",
            "state": "FL",
            "country": "USA"
        },
        "job_details": {
            "employment_type": [
                "onsite",
                "third party"
            ],
            "experience_required": "4+ years",
            "degree_required": "Not specified",
            "visa_sponsorship": "Not specified",
            "notice_period": "Not specified",
            "duration": "Not specified",
            "rate": "Not specified"
        },
        "skills": {
            "core": [
                "Synapse Analytics",
                "Dedicated SQL Pools",
                "Azure SQL Database",
                "Azure Managed Instance",
                "DDL",
                "DML",
                "T-SQL",
                "data architecture design principles",
                "data governance principles",
                "cloud computing concepts",
                "Python",
                "Scala"
            ],
            "primary": [
                "advanced stored procedure writing",
                "data integration",
                "data pipeline management",
                "Salesforce",
                "Message MQ",
                "MuleSoft"
            ],
            "secondary": [
                "analytical skills",
                "problem-solving skills",
                "customer support",
                "quality of work"
            ],
            "all": [
                "Synapse Analytics",
                "Dedicated SQL Pools",
                "Azure SQL Database",
                "Azure Managed Instance",
                "DDL",
                "DML",
                "T-SQL",
                "data architecture design principles",
                "data governance principles",
                "cloud computing concepts",
                "Python",
                "Scala",
                "advanced stored procedure writing",
                "data integration",
                "data pipeline management",
                "Salesforce",
                "Message MQ",
                "MuleSoft",
                "analytical skills",
                "problem-solving skills",
                "customer support",
                "quality of work"
            ]
        },
        "job_type": [
            "onsite"
        ],
        "contact_person": "Praveen Pasumarthi",
        "email": "praveen.pasumarthi@sligosoft.com",
        "jd": "From: Praveen Pasumarthi, Sligo Soft praveen.pasumarthi@sligosoft.com Reply to: praveen.pasumarthi@sligosoft.com Title: Data Architect Type: OnsiteLocation: Tallahassee , FL.Good to have state expLocal candidate preferredMinimum Required KSAs:\u2022 4+ years of experience in Synapse Analytics, Dedicated SQL Pools, Azure SQL Database,and Azure Managed Instance.\u2022 5+ years of experience in DDL, DML T-SQL skills, advanced stored procedure writingskills, tables, primary keys, foreign keys, constraints, indexes, transactions, processlogging, and error handling.\u2022 4+ years of experience in data architecture design principles, methodologies, and bestpractices.\u2022 3+ years of experience in data governance principles and compliance requirementsrelated to data security and privacy.\u2022 3+ years of experience in integrating data from various sources and managing largedata pipelines.\u2022 2+ years of experience in cloud computing concepts, particularly in Microsoft Azure,including storage solutions and compute capabilities.\u2022 1+ years of Experience with programming languages such as Python or Scala.\u2022 1+ years of experience in Salesforce, Message MQ, and MuleSoft\u2022 Strong analytical and problem-solving skills to address complex data challenges.\u2022 Ability to design and implement robust, scalable, and efficient data architectures.\u2022 Ability to provide excellent customer support; meticulous quality of work and workproduct.",
        "source": "Email",
        "date_posted": "2024-10-16 09:57:18-05:00",
        "unique_id": "19295f966fee6b7a",
        "emp_type": [
            "onsite",
            "third party"
        ],
        "tag": "Azure Data Engineer"
    }
]