[
    {
        "company": "INNOZA TECH LLC",
        "job_title": "Project Manager",
        "location": "Denver, CO, USA",
        "full_location": {
            "city": "Denver",
            "state": "CO",
            "country": "USA"
        },
        "job_details": {
            "employment_type": [],
            "job_code": "7820339B",
            "experience_required": "10+ years",
            "degree_required": "",
            "visa_sponsorship": "",
            "notice_period": "",
            "duration": "12 Months",
            "rate": ""
        },
        "skills": {
            "core": [
                "customer relationship management",
                "project management",
                "infrastructure",
                "network security",
                "network services",
                "voice services"
            ],
            "primary": [
                "project management"
            ],
            "secondary": [
                "risk management",
                "quality management",
                "change management",
                "communication"
            ],
            "all": [
                "customer relationship management",
                "project management",
                "infrastructure",
                "network security",
                "network services",
                "voice services",
                "risk management",
                "quality management",
                "change management",
                "communication"
            ],
            "with_experience": []
        },
        "job_type": [],
        "contact_person": "Nagajyoti",
        "email": "njyoti@innozatech.com",
        "jd": "From: Nagajyoti, INNOZA TECH LLC. njyoti@innozatech.com Reply to: njyoti@innozatech.com Position: Project Manager-7820339B Location: Denver, CO Duration: 12 Months Client: OIT Only local candidates Need 10+ years candidate The ideal candidate will have a strong background in customer relationship management, project management, and experience with infrastructure, network security, and network and voice services. The Technical Project Manager will be responsible for planning, executing, and finalizing projects within defined timelines and allocated budgets. The Project Manager will also ensure that business and end users are consulted and their input is incorporated into the project. Key responsibilities include: Track and report on security audit findings and remediation progress to stakeholders and project teams. Responsible for assisting agency executive management, division directors, and information technology (IT) staff and leading project tasks, and resources, including State personnel and deliverables. Use appropriate project management tools, reports, templates, mentoring, training, and coaching to IT project teams. Work directly with agency staff, as well as vendors in fulfilling and carrying out the requirements of assigned IT projects. Utilize project management best practices, including risk management, quality management, change management, change control, and communication. Proactively manage changes in project scope, schedule, and cost. Manage by providing leadership, collaboration, supervision, training, guidance, and support to project team members on assigned projects. Lead the effort to ensure agency compliance with the State\u2019s project management policies and standards. Coordinates all related activities for cross-functional teams Collaborates to develop and appropriately execute a change strategy, including stakeholder analysis, communication plans, and adoption plans. Manages relationships across OIT, customers, and vendors to develop a thorough understanding of core business functions and align projects with overall business objectives. Manages issues and proactively escalates critical issues for immediate resolution, effectively demonstrating decision-making capabilities.",
        "source": "Email",
        "date_posted": "2024-09-30 13:20:39-05:00",
        "unique_id": "1924429586299f35",
        "tag": "BA/Scrum Master/PM"
    }
]