[
    {
        "company": "Involgix",
        "job_title": "Technical Program Manager",
        "location": "Dallas, TX, USA",
        "full_location": {
            "city": "Dallas",
            "state": "TX",
            "country": "USA"
        },
        "job_details": {
            "employment_type": [
                "Contract"
            ],
            "job_code": "",
            "experience_required": "5+ years",
            "degree_required": "",
            "visa_sponsorship": "",
            "notice_period": "",
            "duration": "",
            "rate": ""
        },
        "skills": {
            "core": [
                "Project Management",
                "Agile",
                "Scrum",
                "Kanban",
                "Interpersonal Skills"
            ],
            "primary": [
                "Jira",
                "C++",
                "Linux"
            ],
            "secondary": [
                "iOS",
                "Android",
                "OS Systems",
                "Media",
                "System Architecture"
            ],
            "all": [
                "Project Management",
                "Agile",
                "Scrum",
                "Kanban",
                "Jira",
                "C++",
                "Linux",
                "iOS",
                "Android",
                "OS Systems",
                "Media",
                "System Architecture",
                "Interpersonal Skills"
            ],
            "with_experience": [
                "Project Management",
                "Agile",
                "Scrum"
            ]
        },
        "job_type": [
            "onsite"
        ],
        "contact_person": "Ron Miller",
        "email": "ron@involgix.com",
        "jd": "From: Ron Miller, Involgix ron@involgix.com Reply to: ron@involgix.com Position: Technical Project Manager/ Technical Program Manager Location: Dallas, TX (Day One Onsite) Hiring Type: Contract Responsibilities: Demonstrated understanding of Project Management processes, strategies, and methods Micro coding or bios level developer who has experience using jira Familiarity of SDL C++ and Linux experience Solid understanding of Agile, Scrum, and Kanban development methodologies. Good understanding of OS systems, media, and system architecture Understanding of iOS and Android platform Excellent time management and organizational skills Experience working in a high-level collaborative environment and promoting a teamwork mentality Strong interpersonal skills and the ability to work with many different personality types Experience in project management models including Agile, Waterfall, and Scrum 5+ years demonstrate ability in engineering development and project management are required Thanks and Regards Ron Miller Sr. US IT Recruiter 700 Market St, Suite 203, Cedar Park, TX 78613 Email: ron@involgix.com",
        "emp_type": [
            "Contract"
        ],
        "source": "Email",
        "date_posted": "2024-09-30 09:57:51-05:00",
        "unique_id": "19243703f18367a1",
        "tag": "BA/Scrum Master/PM"
    }
]