[
    {
        "company": "Spar Information Systems",
        "job_title": "Sr SQL Database Developer",
        "location": "Rancho Cordova, CA, USA",
        "full_location": {
            "city": "Rancho Cordova",
            "state": "CA",
            "country": "USA"
        },
        "job_details": {
            "employment_type": [
                "onsite"
            ],
            "job_code": "",
            "experience_required": "12 + years",
            "degree_required": "",
            "visa_sponsorship": "",
            "notice_period": "",
            "duration": "6-12 Months",
            "rate": ""
        },
        "skills": {
            "core": [
                "MS SQL Server",
                "My SQL",
                "SQL",
                "T-SQL",
                "SSIS",
                "SSRS"
            ],
            "primary": [
                "Database design",
                "Data structures",
                "Indexing strategies",
                "Database environments management"
            ],
            "secondary": [
                "Performance data extraction",
                "Stored procedures",
                "Database tuning",
                "Optimization strategies"
            ],
            "all": [
                "MS SQL Server",
                "My SQL",
                "SQL",
                "T-SQL",
                "SSIS",
                "SSRS",
                "Database design",
                "Data structures",
                "Indexing strategies",
                "Database environments management",
                "Performance data extraction",
                "Stored procedures",
                "Database tuning",
                "Optimization strategies"
            ],
            "with_experience": [
                "MS SQL Server",
                "My SQL",
                "T-SQL",
                "SSIS",
                "SSRS"
            ]
        },
        "job_type": [
            "onsite"
        ],
        "contact_person": "Durga Prasad",
        "email": "durgaprasad@sparinfosys.com",
        "jd": "Role: Sr SQL Database Developer- SSIS,SSRS\nLocation: Rancho Cordova, CA-Onsite from Day 1\nDuration: 6-12 Months\nMust have 12 + years of experience\nJob description:\n\u2022 Database design experience with MS SQL Server / My SQL\n\u2022 Design data structures and indexing strategies\n\u2022 Manage and administer database environments\n\u2022 Write SQL or scripts to pull out performance data from the DB that we did not already have\n\u2022 Experience with stored procedures / T-SQL\n\u2022 Provide advice and coaching on database tuning and optimization strategies\n\u2022 Experience with SSIS\n\u2022 Experience with SSRS\n\u2022 Provide alternative diagnostic methods to resolve both in house and internal customer reported problems\n\u2022 Articulate technical information clearly\n\u2022 Maintaining and communicating timelines and status relative to business objectives",
        "emp_type": [
            "onsite"
        ],
        "source": "Email",
        "date_posted": "2024-09-30 11:52:29-05:00",
        "unique_id": "19243d98c8c11ba4",
        "tag": "DB Admin"
    }
]