[
    {
        "company": "KK Software Associates",
        "job_title": "Microsoft Dynamics CRM Architect",
        "location": "Houston, TX, USA",
        "full_location": {
            "city": "Houston",
            "state": "TX",
            "country": "USA"
        },
        "job_details": {
            "employment_type": [
                "contract"
            ],
            "job_code": "",
            "experience_required": "8+ Yrs.",
            "degree_required": "Bachelor of Engineering (Computer background preferred)",
            "visa_sponsorship": "",
            "notice_period": "",
            "duration": "",
            "rate": ""
        },
        "skills": {
            "core": [
                "Microsoft Dynamics CRM",
                "C#",
                ".NET",
                "Azure",
                "SQL Server"
            ],
            "primary": [
                "Dynamics CRM customization",
                "SDK",
                "plugins",
                "workflows",
                "web resources",
                "JavaScript",
                "HTML",
                "CSS"
            ],
            "secondary": [
                "Kimball methodology",
                "Agile projects",
                "BDD concepts"
            ],
            "all": [
                "Microsoft Dynamics CRM",
                "C#",
                ".NET",
                "Azure",
                "SQL Server",
                "JavaScript",
                "HTML",
                "CSS",
                "Kimball methodology",
                "Agile projects",
                "BDD concepts"
            ],
            "with_experience": [
                "Microsoft Dynamics CRM",
                ".NET"
            ]
        },
        "job_type": [
            "onsite"
        ],
        "contact_person": "Sushant kumar",
        "email": "sushant.s@kksoftwareassociates.com",
        "jd": "Role: Microsoft Dynamics CRM Expertise with Solution and Design\nLocation: Houston, TX\nContract\nDay 1 Onsite 5 Days/week\nWho are we looking for?\n8 + Yrs. Microsoft Dynamics CRM Architect with C#. Net Experience with Solution and Design Experience\nTechnical Skills: Proficiency in Microsoft technologies such as C#, .NET. Experience with customizing Dynamics CRM using SDK, plugins, workflows, web resources, and custom-developed solutions. Experience on Cloud technology like Azure. Familiarity with SQL Server. Should have hands on experience on JavaScript, HTML, CSS. Good to have knowledge on Kimball methodology. Excellent presentation, communication, and organizational skills. Ability to work in a fast-paced environment. Ability to work both independently and as part of a team. Understand the data needs of the company or client. Collaborate with the stakeholders to design and build the model. Understand the company\u2019s data solution or product needs. Process Skills: Experience with Agile projects Experience on BDD concepts.",
        "emp_type": [
            "contract"
        ],
        "source": "Email",
        "date_posted": "2024-09-30 15:57:01-05:00",
        "unique_id": "19244b87f0732adb",
        "tag": ".NET Dev"
    }
]