[
    {
        "company": "Hanker Systems Inc",
        "job_title": "Full Stack Java Developer",
        "location": "Richmond, VA, USA",
        "full_location": {
            "city": "Richmond",
            "state": "VA",
            "country": "USA"
        },
        "job_details": {
            "employment_type": [
                "contract"
            ],
            "job_code": "",
            "experience_required": "",
            "degree_required": "",
            "visa_sponsorship": "",
            "notice_period": "",
            "duration": "6+ Months",
            "rate": ""
        },
        "skills": {
            "core": [
                "Java/J2EE",
                "HTML/CSS",
                "JavaScript",
                "SQL",
                "REST",
                "SOAP",
                "Spring",
                "JDBC",
                "JPA/Hibernate",
                "AWS",
                "UNIX",
                "PL/SQL",
                "UML"
            ],
            "primary": [
                "Java development",
                "DocuSign API integration",
                "AWS Serverless (Lambda, SQS/SNS, API Gateway)",
                "IBM WebSphere Application Server",
                "Oracle RDBMS",
                "Spring Batch",
                "Spring Boot"
            ],
            "secondary": [
                "Technical requirements specification",
                "Troubleshooting",
                "Effective communication",
                "Team collaboration",
                "OKTA integration",
                "UNIX Shell Scripting",
                "Large-scale data migration",
                "Microsoft Office Suite",
                "Agile environment"
            ],
            "all": [
                "Java/J2EE",
                "HTML/CSS",
                "JavaScript",
                "SQL",
                "REST",
                "SOAP",
                "Spring",
                "JDBC",
                "JPA/Hibernate",
                "AWS",
                "UNIX",
                "PL/SQL",
                "UML",
                "DocuSign API integration",
                "AWS Serverless (Lambda, SQS/SNS, API Gateway)",
                "IBM WebSphere Application Server",
                "Oracle RDBMS",
                "Spring Batch",
                "Spring Boot",
                "Technical requirements specification",
                "Troubleshooting",
                "Effective communication",
                "Team collaboration",
                "OKTA integration",
                "UNIX Shell Scripting",
                "Large-scale data migration",
                "Microsoft Office Suite",
                "Agile environment"
            ],
            "with_experience": []
        },
        "job_type": [
            "onsite"
        ],
        "contact_person": "Naveen Chinnabathini",
        "email": "naveenc@hankersystems.com",
        "jd": "From: Naveen Chinnabathini, Hanker Systems Inc naveenc@hankersystems.com Reply to: naveenc@hankersystems.com Job Title: Full Stack Java DeveloperLocation: Richmond, VADuration: 6+ Months In Person Interview OnsiteJob Description:Java development experience with complex, large scale applications using the following technologies is required: Java/J2EE, HTML/CSS,JavaScript, SQL.Java/J2EE development experience DocuSign API integration using WebHooksAWS leveraging Serverless Lambda, SQS/SNS and API Gateway, AWS WAF, AWS Secrets Manager, IAM and DynamoDBSOAP & REST Web Services, Spring, JDBC, JPA/Hibernate, and JMS.Relational/Object Oriented ModellingTechnical requirements specification and design documentationExperience with problem troubleshooting and providing support for complex multitiered applicationsThe ability to successfully interact in a team environmentEffective oral and written communication skillsExperience with OKTA integrationExperience with UNIXOS, UNIX Shell Scripting, PL/SQL, and UMLExperience with IBM WebSphere Application Server, IBM WebSphere Liberty, and Oracle RDBMSExperience with Spring Batch and Spring BootExperience with large-scale data migrationExperience with Microsoft Office Suite of productsExperience working in an agile environment (scrum, kanban, or scrumban)",
        "emp_type": [
            "contract"
        ],
        "source": "Email",
        "date_posted": "2024-09-30 11:45:27-05:00",
        "unique_id": "19243d41b16cf600",
        "tag": "Java Dev"
    }
]