[
    {
        "company": "Tek Inspirations",
        "job_title": "Experienced Scrum Master: Digital Risk & Compliance",
        "location": "Bridgewater, NJ, USA",
        "full_location": {
            "city": "Bridgewater",
            "state": "NJ",
            "country": "USA"
        },
        "job_details": {
            "employment_type": [
                "contract"
            ],
            "job_code": "",
            "experience_required": "5+ years",
            "degree_required": "",
            "visa_sponsorship": "",
            "notice_period": "",
            "duration": "6 months (with probability of extension)",
            "rate": ""
        },
        "skills": {
            "core": [
                "Scrum Master certification",
                "Agile coaching",
                "Digital/IT risk management",
                "Product backlog management"
            ],
            "primary": [
                "Scrum",
                "Scaled Scrum"
            ],
            "secondary": [
                "Life Science project experience",
                "Agile delivery approach"
            ],
            "all": [
                "Scrum Master certification",
                "Agile coaching",
                "Digital/IT risk management",
                "Product backlog management",
                "Scrum",
                "Scaled Scrum",
                "Life Science project experience",
                "Agile delivery approach"
            ],
            "with_experience": [
                "Scrum Master",
                "Agile coaching"
            ]
        },
        "job_type": [
            "hybrid"
        ],
        "contact_person": "Mahima Raj",
        "email": "mahima@tekinspirations.com",
        "jd": "From: Mahima Raj, Tek Inspirations mahima@tekinspirations.com Reply to: mahima@tekinspirations.com Role Title: Experienced Scrum Master: Digital Risk & Compliance Duration: 6 months (with probability of extension) Location: Bridgewater, NJ (hybrid 50% minimum onsite) MUST BE LOCAL TO NJ and New York Life Science project experience mandatory Context The Digital Risk & Compliance (DRC) function is currently in the middle of a change program to transform from a largely Quality Control focused approach to managing risk and compliance topics in Digital/IT to one that is based on empowering Digital/IT teams to be accountable for the risk management and compliance of their solutions through a combination of advisory capabilities, process changes, automation & self-service offerings. Mid-July we have released an MVP and are now refining our roadmap to deliver further iterations and increments in an Agile, Product-oriented approach. To do this successfully, we will need to build and mature an Agile approach that fits this type of complex organizational change effort. Required Experience & Skills Advanced Scrum Master certification with 5+ years supporting scrum and scaled scrum teams to deliver complex products Ideally Agile coaching experience Experience beyond Software Agile projects, but including change initiatives like our Transformation program, combining operating model, process and tool/software components Life Science project experience essential Scope of the Role As part of the Strategy & Governance team in DRC, work closely with the Head of the team, a junior Scrum Master and an Agile Coach to define the Agile delivery approach and required tooling. Serve as the Scrum Master across several product delivery teams (Scrum teams) to support the development of the next increments while maturing the approach and establishing the required ceremonies. Work closely with the Product Owner and component owners to build a robust product backlog and appropriate practices to manage it across the different teams, including assisting the Product Owner to effectively collect customer feedback. Support the upskilling of the internal, junior Scrum Master by working alongside her and coaching her.",
        "emp_type": [
            "contract"
        ],
        "source": "Email",
        "date_posted": "2024-09-30 11:39:09-05:00",
        "unique_id": "19243cec8ad55730",
        "tag": "BA/Scrum Master/PM"
    }
]