[
    {
        "company": "kk soft tech",
        "job_title": "Java Technical Lead",
        "location": "Berkeley Heights, NJ, USA",
        "full_location": {
            "city": "Berkeley Heights",
            "state": "NJ",
            "country": "USA"
        },
        "job_details": {
            "employment_type": [],
            "job_code": "",
            "experience_required": "12+ years",
            "degree_required": "",
            "visa_sponsorship": "",
            "notice_period": "",
            "duration": "",
            "rate": ""
        },
        "skills": {
            "core": [
                "Java",
                "API development",
                "Microservices",
                "Cloud",
                "Kubernetes",
                "Docker",
                "OpenShift",
                "Spring framework",
                "Angular",
                "React",
                "GIT",
                "Kafka",
                "Splunk",
                "Dynatrace",
                "Agile Development",
                "Problem solving",
                "Analytical skills"
            ],
            "primary": [
                "Java",
                "API development",
                "Microservices",
                "Cloud",
                "Kubernetes",
                "Docker",
                "OpenShift"
            ],
            "secondary": [
                "Spring framework",
                "Angular",
                "React",
                "GIT (Manual Commands)",
                "Kafka",
                "Splunk",
                "Dynatrace",
                "Agile Development"
            ],
            "all": [
                "Java",
                "API development",
                "Microservices",
                "Cloud",
                "Kubernetes",
                "Docker",
                "OpenShift",
                "Spring framework",
                "Angular",
                "React",
                "GIT (Manual Commands)",
                "Kafka",
                "Splunk",
                "Dynatrace",
                "Agile Development",
                "Problem solving",
                "Analytical skills"
            ],
            "with_experience": [
                "Java",
                "API development",
                "Microservices",
                "Cloud",
                "Kubernetes",
                "Docker",
                "OpenShift",
                "Spring framework",
                "GIT (Manual Commands)",
                "Agile Development"
            ]
        },
        "job_type": [],
        "contact_person": "sushant kumar",
        "email": "sushant.s@kksoftwareassociates.com",
        "jd": "We are looking for an experienced Java Technical Lead resource who also has good experience in microservices and API development along with Cloud, Kubernetes, Dockers and OpenShift. \u2022 Candidate should have strong lead and development experience in Java along with API development, Docker and Kubernetes who can be ready to write source code from the scratch. \u2022 Experience on writing manual GIT commands is Mandatory. \u2022 Strong Java development and Lead experience (40 % into Development and 60% into Managing the team) \u2022 Expertise in Cloud, Kubernetes, Docker and Open Shift \u2022 Previous work experience with Spring framework \u2022 Front End Technologies \u2013 Angular or React \u2022 Strong technical development experience on effectively writing code, code reviews, best practices code refactoring.\u2022 A delivery focused approach to work and the ability to work without direction. \u2022 Experience with various source control tools like GIT (Manual Commands) \u2022 Good to have hands-on experience on Kafka or any Streaming Technology\u2022 Good to have experience in Splunk, Dynatrace tools. \u2022 Experience in Agile Development lifecycle methodology \u2022 Strong problem solving and analytical skills.\u2022 Advanced knowledge of architecture and design across all system \u2022 Configuring and managing software and optimizing processes through automation \u2022 Knowledge of industry-wide technology trends and best practices \u2022 Ability to multitask and prioritize with urgency. \u2022 Ability to work in large, collaborate teams to achieve organizational goals.",
        "emp_type": [],
        "source": "Email",
        "date_posted": "2024-09-30 08:48:56-05:00",
        "unique_id": "19243309bed9c29f",
        "tag": "Java Dev"
    }
]