[
    {
        "company": "Scalable Systems",
        "job_title": "Data Engineer",
        "location": "Burlington, MA, USA",
        "full_location": {
            "city": "Burlington",
            "state": "MA",
            "country": "USA"
        },
        "job_details": {
            "employment_type": [],
            "job_code": "",
            "experience_required": "3+ years",
            "degree_required": "Degree in Information Technology, Computer Science, or equivalent",
            "visa_sponsorship": "",
            "notice_period": "",
            "duration": "",
            "rate": ""
        },
        "skills": {
            "core": [
                "Azure AI/ML",
                "Cloud Technologies",
                "Data & Scripting",
                "Infrastructure & Architecture",
                "Collaboration & Communication",
                "Process & Automation",
                "Problem Solving & Ownership",
                "Customer Focus"
            ],
            "primary": [
                "Python",
                "Terraform",
                "Azure AI Services",
                "Cognitive Services",
                "Cloud Infrastructure"
            ],
            "secondary": [
                "PowerShell",
                "Ansible",
                "ITIL concepts"
            ],
            "all": [
                "Azure AI/ML",
                "Cloud Technologies",
                "Data & Scripting",
                "Infrastructure & Architecture",
                "Collaboration & Communication",
                "Process & Automation",
                "Problem Solving & Ownership",
                "Customer Focus",
                "Python",
                "Terraform",
                "Azure AI Services",
                "Cognitive Services",
                "Cloud Infrastructure",
                "PowerShell",
                "Ansible",
                "ITIL concepts"
            ],
            "with_experience": [
                "Azure AI Services",
                "Cognitive Services",
                "Terraform",
                "Ansible",
                "Python"
            ]
        },
        "job_type": [],
        "contact_person": "Ayush Yadav",
        "email": "ayush.yadav@scalable-systems.com",
        "jd": "Data Engineer - Azure AI/ML (Capital Markets Experience a Plus) We are seeking a highly motivated and skilled Data Engineer with a passion for Azure AI and Machine Learning to join our growing team! Important Skills and Keywords: Azure AI/ML: Deep expertise in Azure AI Services (Cognitive Services portfolio, Azure OpenAI), including experience with product and solution briefings, creating demos, and proof-of-concept work. Cloud Technologies: Proven experience deploying and maintaining Azure resources, PowerShell, Terraform, and other cloud technologies. Data & Scripting: Strong Python scripting skills and a solid understanding of networking, databases, software, and server implementation in the cloud. Infrastructure & Architecture: Experience designing architecture to integrate core infrastructure technologies with enterprise applications, performing risk assessments, and implementing security solutions. Collaboration & Communication: Ability to collaborate effectively with application development, network/security, and infrastructure teams. Excellent written and verbal communication skills are essential. Process & Automation: Experience establishing standards, tools, and processes for your team, and utilizing automation tools like Terraform or Ansible. Problem Solving & Ownership: Proven ability to troubleshoot operational issues, recommend solutions, and ensure timely resolution. Customer Focus: A strong sense of customer service, attention to detail, and a desire to be a trusted advisor for clients. Understanding of ITIL concepts is a plus. Job Responsibilities: Provide in-depth AI expertise to support Azure customers. Deploy and maintain Azure resources and cloud technologies. Design architecture for cloud infrastructure and applications. Perform risk assessments and implement security solutions. Monitor cloud and on-premise resources for integrity and availability. Troubleshoot operational issues and offer solutions. Collaborate with internal teams to ensure seamless integration. Establish standards, tools, and processes for the team. Develop, document, and understand internal IT processes. Utilize automation tools like Terraform or Ansible. Recommend integration strategies and cloud infrastructure for Azure AI solutions. Partner with the Azure Cloud Administrator to design, implement, and support Data Lake infrastructure. Be a trusted advisor to customers, helping them understand and incorporate Azure AI accelerators into their cloud strategy. Demonstrate the power of Azure AI through POCs, model performance optimization, and benchmarking. Build reusable assets for other customers and internal teams. Influence Azure AI strategy by leveraging Cognitive Services and Azure OpenAI. Qualifications: Degree in Information Technology, Computer Science, or equivalent. 3+ years of experience selling AI (Machine Learning, Intelligent Apps/Agents, Search) solutions in the enterprise public cloud space. Technical expertise in AI/Cognitive Services. Capital Markets experience a plus.",
        "emp_type": [],
        "source": "Email",
        "date_posted": "2024-09-30 12:45:15-05:00",
        "unique_id": "1924408fad66065d",
        "tag": "Azure Data Engineer"
    }
]