[
    {
        "company": "Adventa tech inc",
        "job_title": "Senior/Principal Python Developer",
        "location": "Boston, Massachusetts, USA",
        "full_location": {
            "city": "Boston",
            "state": "Massachusetts",
            "country": "USA"
        },
        "job_details": {
            "employment_type": [],
            "job_code": "",
            "experience_required": "9+ years",
            "degree_required": "",
            "visa_sponsorship": "CITIZEN,GREEN CARD,GC EAD,H4 EAD,OPT EAD",
            "notice_period": "",
            "duration": "18 Month",
            "rate": ""
        },
        "skills": {
            "core": [
                "Python",
                "Python libraries",
                "Python frameworks",
                "Django",
                "Flask",
                "Pandas",
                "Numpy",
                "JavaScript",
                "HTML",
                "CSS",
                "databases",
                "SQL",
                "NoSQL",
                "version control systems",
                "Git",
                "RESTful APIs",
                "web services",
                "AWS services",
                "SNS",
                "SQS",
                "CloudFormation",
                "lambda",
                "CI/CD pipelines",
                "DevOps practices"
            ],
            "primary": [
                "Python",
                "AWS"
            ],
            "secondary": [],
            "all": [
                "Python",
                "Python libraries",
                "Python frameworks",
                "Django",
                "Flask",
                "Pandas",
                "Numpy",
                "JavaScript",
                "HTML",
                "CSS",
                "databases",
                "SQL",
                "NoSQL",
                "version control systems",
                "Git",
                "RESTful APIs",
                "web services",
                "AWS services",
                "SNS",
                "SQS",
                "CloudFormation",
                "lambda",
                "CI/CD pipelines",
                "DevOps practices"
            ],
            "with_experience": [
                "Python",
                "AWS"
            ]
        },
        "job_type": [],
        "contact_person": "Banani Banojini Das",
        "email": "banani@adventatech.com",
        "jd": "Job Description -Need only 1 candidateMust have9+ years of experience working hands on as a Python Developer.Extensive financial services experience, specifically working on Pre-Trading Platforms5+ years\u2019 experience deploying code on AWS Requirements:Technical Skills:Proficiency in Python, Python libraries and Python frameworks (e.g., Django, Flask, Pandas, Numpy).Strong knowledge of front-end technologies (e.g., JavaScript, HTML, CSS).Experience with databases (e.g., SQL, NoSQL) and data storage solutions.Experience with version control systems (e.g., Git).Understanding of RESTful APIs and web services.Experience in using AWS services like SNS, SQS, CloudFormation, lambdaExperience in deploying code on AWS platformKnowledge of CI/CD pipelines and DevOps practices.Excellent problem-solving and analytical skills.Strong communication and teamwork abilities.Attention to detail and a commitment to delivering high-quality software. Experience: Proven experience as a Senior Python Developer with a strong portfolio of building applications for pre-trading systems in Financial ServiceSoft Skills: Leadership skills and the ability to mentor junior team members",
        "emp_type": [],
        "source": "Email",
        "date_posted": "2024-09-30 12:52:51-05:00",
        "unique_id": "192440fe7ba56bf3",
        "tag": "Python Dev"
    }
]