[
    {
        "company": "Siri Info Solutions Inc.",
        "job_title": "Azure Architect",
        "location": "New Jersey, NJ, USA",
        "full_location": {
            "city": "Edison",
            "state": "NJ",
            "country": "USA"
        },
        "job_details": {
            "employment_type": [],
            "job_code": "",
            "experience_required": "",
            "degree_required": "",
            "visa_sponsorship": "",
            "notice_period": "",
            "duration": "",
            "rate": ""
        },
        "skills": {
            "core": [
                "Microsoft Azure"
            ],
            "primary": [],
            "secondary": [],
            "all": [
                "Microsoft Azure"
            ],
            "with_experience": []
        },
        "job_type": [
            "onsite"
        ],
        "contact_person": "Phani M",
        "email": "phani.sr@siriinfo.com",
        "jd": "Hi!This is Phani M from Siri Info Solutions Inc..We have a urgent requirement for Azure Architect role for the location New Jersey, NJ (Onsite). Please find the below job description and share me your consultant updated resume ASAP. Role: Azure Architect Location: New Jersey, NJ (Onsite) Competencies: Microsoft Azure Applicant Details Full Legal Name Mobile and Home Phone No Email ID Skype ID US Work Authorization and Validity Current Location Willing to Relocate (Yes/No) Best Time for Evaluation Availability for Project Expertise & Skill Set Total relevant experience LinkedIn Educational Details Passport number (mandatory only for H1B's) Prior work experience with TCS(Yes/No)If Yes provide previous BA ID Thank You & Regard, Phani MSenior IT Recruiter Email ID: phani.sr@siriinfo.com Ph. No: +1 (732) 408-6788 Siri Info Solutions Inc. 3 Ethel Road, Suite#302 Edison, NJ - 08817 USA To unsubscribe from this mailing, please reply to this email with the word UNSUBSCRIBE in the subject line. Qualified applicants will receive consideration for employment without regard to race, colour, religion, gender, age, disability, military status, national origin or any other characteristic protected under federal, state, or applicable local law.",
        "emp_type": [],
        "source": "Email",
        "date_posted": "2024-09-30 07:46:38-05:00",
        "unique_id": "19242f7952f28697",
        "tag": "Azure Data Engineer"
    }
]