[
    {
        "company": "Siri InfoSolutions",
        "job_title": "C# ASP.Net Developer with React JS",
        "location": "Princeton, NJ, USA",
        "full_location": {
            "city": "Princeton",
            "state": "NJ",
            "country": "USA"
        },
        "job_details": {
            "employment_type": [
                "onsite"
            ],
            "job_code": "",
            "experience_required": "8 to 10 years",
            "degree_required": "",
            "visa_sponsorship": "Looking for h1b consultants",
            "notice_period": "",
            "duration": "6+ Months",
            "rate": ""
        },
        "skills": {
            "core": [
                "C#",
                ".net",
                "SQL",
                "REACTJS",
                "OOPS Concept"
            ],
            "primary": [
                "C#",
                "REACTJS"
            ],
            "secondary": [
                ".net",
                "SQL"
            ],
            "all": [
                "C#",
                ".net",
                "SQL",
                "REACTJS",
                "advanced concepts",
                "solid principles",
                "dependency injection",
                "OOPS Concept",
                "good communication skill"
            ],
            "with_experience": [
                "C#",
                "REACTJS",
                "advanced concepts",
                "solid principles",
                "dependency injection",
                "OOPS Concept"
            ]
        },
        "job_type": [
            "onsite"
        ],
        "contact_person": "Prabhjith Singh",
        "email": "prabhjith.singh@siriinfo.com",
        "jd": "HelloGreetings from Siri InfoSolutions\u2026We have an immediate position, please find the below details\u2026 Role: C# ASP.Net Developer with React JS Location: Princeton ,NJ (onsite)Duration: 6+MonthsClient : TCS Required Skills:- C#, .net, SQL and REACTJS ( Need only locals) Note : Looking for h1b consultants who can share pp number Job Description:Overall 8+ years\u2019 experience is required. -- Need 8 to 10 years of experience in Software development-- Able to work in C# language.-- Able to work in ReactJS-- Need good experience in advanced concepts like solid principles, dependency injection.-- Good knowledge in OOPS Concept.-- Good communication skill Thanks & Have a Blessed Day,Prabhjith Singh Siri InfoSolutions Inc, 3 Ethel Rd, Suite # 302, Edison NJ 08817.Disclaimer: We respect your online privacy. If you would like to be removed from our mailing list please reply with \"",
        "emp_type": [
            "onsite"
        ],
        "source": "Email",
        "date_posted": "2024-09-30 16:49:18-05:00",
        "unique_id": "19244e85c0a0036a",
        "tag": ".NET Dev"
    }
]