[
    {
        "company": "GVR INFO TEK",
        "job_title": "Angular with UI Developer",
        "location": "McLean VA, USA",
        "full_location": {
            "city": "McLean",
            "state": "VA",
            "country": "USA"
        },
        "job_details": {
            "employment_type": [
                "contract",
                "full-time"
            ],
            "job_code": "",
            "experience_required": "5+ years",
            "degree_required": "",
            "visa_sponsorship": "NO H1B / No CPT ( GC EAD with Back Copy)",
            "notice_period": "",
            "duration": "6+ Months",
            "rate": ""
        },
        "skills": {
            "core": [
                "Angular",
                "JavaScript",
                "Typescript",
                "HTML",
                "JSON",
                "CSS",
                "Node.js"
            ],
            "primary": [
                "Angular",
                "JavaScript",
                "Typescript"
            ],
            "secondary": [
                "HTML",
                "JSON",
                "CSS",
                "Node.js"
            ],
            "all": [
                "Angular",
                "JavaScript",
                "Typescript",
                "HTML",
                "JSON",
                "CSS",
                "Node.js",
                "Java",
                "Karma",
                "Jasmine"
            ],
            "with_experience": [
                "Angular",
                "JavaScript",
                "Typescript"
            ]
        },
        "job_type": [
            "hybrid"
        ],
        "contact_person": "Tarun Kumar",
        "email": "tarun.kumar@gvrinfotek.com",
        "jd": "Title :- Angular with UI Developer (Hybrid) Location :- McLean VA. Visa :- NO H1B / No CPT ( GC EAD with Back Copy) Duration :- 6+ Months MOI :- Skype Need :- Visa/DL Copies / LinkedIn / RTR--- Through GVR PLEASE Need :- Passport number Job Description : Be a Team Player \u2014 work in a collaborative team-oriented environment, share information, value diverse ideas, partner with cross functional and remote Be Curious & Innovative \u2014 continuously update yourself with next generation technology, development tools, and contribute to process development prak Be an Agile Person \u2014 with strong sense of urgency and a desire to work in a fast-paced dynamic environment to deliver solutions against strict timelines Be an Effective Communicator \u2014 articulate complex technical issues, and share ideas, participate in peer-reviews, and exhibit strong listening skills Take Ownership \u2014 responsible for performance, reliability and implement changes for improving efficiency of a technical component 5+ years' experience with Angular or above building Single Page Applications \u2014 must have experience of working on Angular 3 or above 5+ years' experience with JavaScript/Typescript, HTML, JSON, and CSS 2+ years' experience with Node.js building RESTful web services Should have good experience of Java development Experience with unit testing tools like Karma or Jasmine",
        "emp_type": [
            "contract",
            "full-time"
        ],
        "source": "Email",
        "date_posted": "2024-09-30 10:01:35-05:00",
        "unique_id": "1924373b65cd3ef8",
        "tag": "Java Dev"
    }
]