[
    {
        "company": "Testingxperts",
        "job_title": "AWS Architect",
        "location": "Remote, USA",
        "full_location": {
            "city": "",
            "state": "",
            "country": "USA"
        },
        "job_details": {
            "employment_type": [],
            "job_code": "",
            "experience_required": "12+ years",
            "degree_required": "",
            "visa_sponsorship": "",
            "notice_period": "",
            "duration": "",
            "rate": ""
        },
        "skills": {
            "core": [
                "AWS services",
                "Cloud architecture design",
                "Security and compliance",
                "Networking expertise",
                "Automation and scripting",
                "Monitoring and logging",
                "Migration and hybrid cloud",
                "Containerization and serverless",
                "Problem-solving and troubleshooting",
                "Continuous learning"
            ],
            "primary": [
                "AWS services",
                "Cloud architecture design",
                "Security and compliance"
            ],
            "secondary": [
                "Networking expertise",
                "Automation and scripting",
                "Monitoring and logging",
                "Migration and hybrid cloud",
                "Containerization and serverless",
                "Problem-solving and troubleshooting",
                "Continuous learning"
            ],
            "all": [
                "AWS services",
                "Cloud architecture design",
                "Security and compliance",
                "Networking expertise",
                "Automation and scripting",
                "Terraform",
                "Monitoring and logging",
                "Migration and hybrid cloud",
                "Containerization and serverless",
                "Problem-solving and troubleshooting",
                "Continuous learning",
                "AWS Certified Solutions Architect - Associate",
                "AWS Certified Solutions Architect - Professional"
            ],
            "with_experience": [
                "AWS services",
                "Cloud architecture design",
                "Security and compliance",
                "Networking expertise",
                "Automation and scripting",
                "Monitoring and logging",
                "Migration and hybrid cloud",
                "Containerization and serverless",
                "Problem-solving and troubleshooting"
            ]
        },
        "job_type": [
            "remote"
        ],
        "contact_person": "Khushi Malhotra",
        "email": "khushi.malhotra@testingxperts.com",
        "jd": "Role: AWS Architect\nLocation: Remote\nAs an AWS Solutions Architect, you need a diverse set of skills to design, implement, and maintain robust and scalable cloud solutions on the AWS platform. Here are some of the top skills required for an AWS Solutions Architect role: 1. Solid understanding of AWS services: You should have an in-depth knowledge of various AWS services such as EC2, VPC, IAM, and their use cases, configurations, and best practices. 2. Cloud architecture design: You should be able to design highly available, fault-tolerant, and scalable cloud architectures that align with business requirements and follow AWS best practices. 3. Security and compliance: Understanding AWS security services like IAM, VPC, Security Groups, and compliance requirements is essential. 4. Networking expertise: Knowledge of networking concepts like VPCs, subnets, routing tables, gateways, cloudWAN is crucial for designing secure and efficient network architectures. 5. Automation and scripting: Proficiency in using infrastructure as code tools like Terraform for automating infrastructure provisioning and management. Terraform enterprise and harness as nice to have. 6. Monitoring and logging: Familiarity with AWS monitoring and logging services like CloudWatch, CloudTrail, and AWS Config for monitoring resources, analyzing logs, and maintaining compliance. 7. Migration and hybrid cloud: Experience in migrating private cloud workloads to AWS and designing cloud architectures. 8. Containerization and serverless: Knowledge of containerization technologies like Docker and AWS ECS/EKS, as well as serverless architectures using AWS Lambda and AWS Step Functions. 9. Problem-solving and troubleshooting: Strong analytical and problem-solving skills to troubleshoot and resolve complex issues in a cloud environment. 10. Continuous learning: Ability to stay updated with the latest AWS services, features, and best practices through continuous learning and professional development. Additionally, AWS certifications like AWS Certified Solutions Architect - Associate and AWS Certified Solutions Architect - Professional can validate your skills and knowledge in the AWS ecosystem.",
        "emp_type": [],
        "source": "Email",
        "date_posted": "2024-09-30 12:01:42-05:00",
        "unique_id": "19243e142de51981",
        "tag": "AWS Data Engineer"
    }
]