[
    {
        "company": "Adbakx LLC",
        "job_title": "Sr. Data Engineer",
        "location": "Sunnyvale, CA, USA",
        "full_location": {
            "city": "Sunnyvale",
            "state": "CA",
            "country": "USA"
        },
        "job_details": {
            "employment_type": [
                "contract"
            ],
            "job_code": "",
            "experience_required": "15+ Years",
            "degree_required": "",
            "visa_sponsorship": "",
            "notice_period": "",
            "duration": "12 Months",
            "rate": ""
        },
        "skills": {
            "core": [
                "Data Engineering",
                "SQL",
                "Data Modelling",
                "Data Mining",
                "ETL"
            ],
            "primary": [
                "Supply Chain Management"
            ],
            "secondary": [
                "Business Analysis",
                "Problem Solving"
            ],
            "all": [
                "Data Engineering",
                "SQL",
                "Data Modelling",
                "Data Mining",
                "ETL",
                "Supply Chain Management",
                "Inventory Management",
                "Manufacturing",
                "Logistics Operations",
                "Business Analysis",
                "Problem Solving"
            ],
            "with_experience": [
                "SQL",
                "Data Mining",
                "Supply Chain Management"
            ]
        },
        "job_type": [
            "onsite"
        ],
        "contact_person": "Ravi Prakash",
        "email": "ravi@adbakx.com",
        "jd": "Role: Sr. Data Engineer With Supply Chain Management Exp\nLocation: Sunnyvale, CA - Day One Onsite\nDuration: 12 Months Contract\nNote: Candidates should have Data Engineer With Supply Chain, Data Modelling, SQL, Data Mining, ETL experience. Please share me the profiles who has experience on supply chain Management Experience\nJob Description: 15+ Years of Experience Supply Chain Management: Inventory Management/Manufacturing/Logistics Operations Data Engineering skills with design of data model for supply chain management Experience Expert in SQL Query and Data Mining Independent thinkers and lead of Projects Business Analysis skills and strong problem solving skills.",
        "emp_type": [
            "contract"
        ],
        "source": "Email",
        "date_posted": "2024-09-30 12:42:18-05:00",
        "unique_id": "19244069037877e0",
        "tag": "AWS Data Engineer"
    }
]