[
    {
        "company": "Softcomsystems",
        "job_title": "Java Backend Developer",
        "location": "Pasadena, CA, USA",
        "full_location": {
            "city": "Pasadena",
            "state": "CA",
            "country": "USA"
        },
        "job_details": {
            "employment_type": [
                "contract",
                "third party"
            ],
            "experience_required": "14+ years",
            "degree_required": "Not specified",
            "visa_sponsorship": "Not specified",
            "notice_period": "Not specified",
            "duration": "Long Term",
            "rate": "Not specified"
        },
        "skills": {
            "core": [
                "Java",
                "Relational Databases",
                "Microservices",
                "API",
                "AWS",
                "Spring Boot"
            ],
            "primary": [
                "Kafka",
                "MongoDB",
                "Spring Framework",
                "Hibernate",
                "WebSphere",
                "Tomcat",
                "RESTful",
                "Unit Testing",
                "TDD",
                "Continuous Integration",
                "Delivery",
                "Automated Testing",
                "JUnit",
                "Agile",
                "Scrum"
            ],
            "secondary": [
                "Problem-solving",
                "Creative thinking"
            ],
            "all": [
                "Java",
                "Relational Databases",
                "Microservices",
                "API",
                "AWS",
                "Spring Boot",
                "Kafka",
                "MongoDB",
                "Spring Framework",
                "Hibernate",
                "WebSphere",
                "Tomcat",
                "RESTful",
                "Unit Testing",
                "TDD",
                "Continuous Integration",
                "Delivery",
                "Automated Testing",
                "JUnit",
                "Agile",
                "Scrum",
                "Problem-solving",
                "Creative thinking"
            ]
        },
        "job_type": [
            "onsite"
        ],
        "contact_person": "Karthik",
        "email": "karthik@softcomsystems.com",
        "jd": "From: Karthik, Softcomsystems karthik@softcomsystems.com Reply to: karthik@softcomsystems.com Role: Java Backend DeveloperLocation: Pasadena, CaliforniaContract Long TermExp: 14 + years exp strong technical and coding experienceInterview: Screening call + Coding Testjava, Kafka, mongo Responsibilities:Responsible for building services and coming up with appropriate solutions to business problems.Research, Design, Develop, and/or modify enterprise-wide systems/applications.Prototyping solutions and recommending the adoption of new technologies and continually improve our client experience.Support Development and Deployment of application software releases to production and Non-Production environmentsSelf-reliant, hands-on position on the team to lead and drive code quality, maintain application stability in an agile environment.Collaborate with architectural peers, product owners, UX/UI, Internal/External stakeholders and globally distributed teams to understand requirements and develop application in compliance to client needs.Assist in the development of overall project plans and timetables, analysis and identification of intermediate deliverables.Define engineering best practices and mentor teams to write elegant code using effective automated unit tests & Test-Driven Development methodologies.Develop specifications for new products/services, applications and service offerings.Meet deadlines and manage multiple, dynamic priorities. Qualifications:Core skills - 8+ years with Java, Relational Databases, Microservices, API, AWS and Spring Boot.Enterprise Web Applications: Extensive experience in large-scale SaaS applications development, Spring Framework, Hibernate, WebSphere or TomcatAPI-Driven Development - Solid experience in RESTful and micro services developmentUnit Testing / TDD - Experience with Continuous Integration & Delivery, Automated Testing, and tools such as JUnit.Agile Development Methodology - Knowledge of Agile / Scrum / iterative development methodologiesOutstanding problem-solving skills with creative thinking",
        "source": "Email",
        "date_posted": "2024-10-23 14:39:27-05:00",
        "unique_id": "192bb3744999d06a",
        "emp_type": [
            "contract",
            "third party"
        ],
        "tag": "Java developer"
    }
]