[
    {
        "company": "Msysinc",
        "job_title": "Business Analyst - Hybrid",
        "location": "Richmond, VA, USA",
        "full_location": {
            "city": "Richmond",
            "state": "VA",
            "country": "USA"
        },
        "job_details": {
            "employment_type": [
                "full-time",
                "third party"
            ],
            "job_code": "",
            "experience_required": "10+ years",
            "degree_required": "Not specified",
            "visa_sponsorship": "Not specified",
            "notice_period": "Not specified",
            "duration": "Long term",
            "rate": "Not specified"
        },
        "skills": {
            "core": [
                "Business Analysis",
                "Agile Methodologies",
                "Stakeholder Management",
                "SQL",
                "Data Analysis"
            ],
            "primary": [
                "Scrum",
                "Azure DevOps",
                "Jira",
                "User Acceptance Testing (UAT)",
                "Process Flow Diagrams"
            ],
            "secondary": [
                "Certified Business Analysis Professional (CBAP)",
                "PMI Professional in Business Analysis (PMI PBA)",
                "PMI Agile Certified Practitioner (PMI ACP)",
                "TestComplete",
                "Cucumber",
                "Selenium",
                "Microsoft Office"
            ],
            "all": [
                "Business Analysis",
                "Agile Methodologies",
                "Stakeholder Management",
                "SQL",
                "Data Analysis",
                "Scrum",
                "Azure DevOps",
                "Jira",
                "User Acceptance Testing (UAT)",
                "Process Flow Diagrams",
                "Certified Business Analysis Professional (CBAP)",
                "PMI Professional in Business Analysis (PMI PBA)",
                "PMI Agile Certified Practitioner (PMI ACP)",
                "TestComplete",
                "Cucumber",
                "Selenium",
                "Microsoft Office"
            ]
        },
        "job_type": [
            "hybrid"
        ],
        "contact_person": "Ravi Kiran",
        "email": "ravikiran@msysinc.com",
        "jd": "From: Ravi Kiran, Msysinc resume@msysinc.com Reply to: resume@msysinc.com Title: Business Analyst - HybridLocation: Richmond, VA, United StatesLength: Long termRestriction: W2 or C2CSend resume to: ravikiran@msysinc.com Description:*** Both Web Cam and InPerson Interview *** *** Long term *** *** Hybrid *** Onsite 3 days a weekhighly experienced Business Analyst to join our Business Analytics and Testing Support Team. This role requires strong stakeholder management skills and the ability to take initiative with minimal supervision. The Business Analyst will serve as the voice of the customer, ensuring that business needs are clearly understood, articulated, and documented. The Business Analyst will work in both Agile (Sprint) and traditional Waterfall methodologies for the Software Development Lifecycle (SDLC), contributing to ensuring that customers requirements are met through the development and delivery of requested enhancements.Key Responsibilities:Act as the voice of the customer, working with project team members and business stakeholders to fully understand business processes, pain points, and customer needs.Develop expertise in customers business applications and organizational data management concepts, advocating for the customer throughout the SDLC.Conduct Root Cause Analysis to identify system gaps and deficiencies that impact the customer and require a business, technical, or blended approach for resolution.Diagram current processes and propose modifications using process flows, context diagrams, and data flow diagrams to ensure clarity for both technical and non technical stakeholders.Discover and document customer centric requirements, user stories, and acceptance criteria with a focus on improving business and technical processes.Decompose requirements into Epics and Features create clear and concise user stories that are aligned with customer goals and are easy to implement by technical teams.Map user stories to technical designs for system modifications, ensuring that solutions meet customer expectations.Identify and group related user stories into Themes document dependencies, ensuring alignment with customer priorities and business processes.Assist the Product Owner in maintaining the product backlog with a customer first mindset.Perform Quality Analyst functions, defining test objectives, test plans, and test cases, while executing tests (including regression testing) to ensure customer satisfaction.Coordinate and facilitate User Acceptance Testing (UAT) with business stakeholders, ensuring that the customer is at the center of the testing process and keeping Project Managers/Scrum Masters informed of progress.Qualifications:Minimum of 10 years of experience delivering business and data analysis artifacts with a customer focused approach.5+ years of experience as an Agile Business Analyst with a strong understanding of Scrum concepts and methodology, including representing the customer during sprint reviews.Experience organizing and maintaining Product and Sprint backlogs, ensuring prioritization based on customer needs.Proficiency in translating client and product strategy requirements into Epics, Features, and User Stories, ensuring alignment with customer goals.Strong data analysis background, organizational data management concepts, and SQL/database experience, particularly in supporting customer driven solutions.Proficient in defining acceptance criteria and managing the acceptance process with the customer in mind.Experience with software development applications such as Azure DevOps and/or Jira.Expertise with Microsoft Office products (Word, Excel, Access, Outlook, Visio, PowerPoint, Project Server).Experience with reporting systems, operational data stores, data warehouses, data lakes, and data marts.Exceptional written and oral communication skills with a proven ability to advocate for customers while working with a diverse set of peers and stakeholders.Preferred:Certified Business Analysis Professional (CBAP)PMI Professional in Business Analysis (PMI PBA)PMI Agile Certified Practitioner (PMI ACP)Experience using Azure DevOps or Jira for agile software development and work item tracking.Experience with automated testing tools such as TestComplete, Cucumber, or Selenium.Required Skills:Experience delivering business and systems analysis artifacts 8 YearsExperience as an Agile Business Analyst with a strong understanding of Scrum concepts and methodology. 5 YearsProven experience in organizing and maintaining Product and Sprint backlogs. 5 YearsProficiency in translating client and product strategy requirements into application requirements and user stories. 8 YearsDefining acceptance criteria and managing the acceptance process with development teams. 5 YearsExceptional written and oral communication skills, with a proven ability to work well with a diverse set of peers and customers 8 Years",
        "source": "Email",
        "date_posted": "2024-10-24 13:26:27-05:00",
        "unique_id": "192c02f25d440ad1",
        "emp_type": [
            "full-time",
            "third party"
        ],
        "tag": "Business Analyst"
    }
]