[
    {
        "company": "Virginia Department of Transportation",
        "job_title": "VDOT - Business Analyst",
        "location": "Richmond, VA, USA",
        "full_location": {
            "city": "Richmond",
            "state": "VA",
            "country": "USA"
        },
        "job_details": {
            "employment_type": [
                "contract",
                "third party"
            ],
            "job_code": "749601",
            "experience_required": "8+ years",
            "degree_required": "Not specified",
            "visa_sponsorship": "Not specified",
            "notice_period": "Not specified",
            "duration": "Not specified",
            "rate": "$55 - $65 Per Hr C2C or 1099"
        },
        "skills": {
            "core": [
                "Business Analysis",
                "Agile Methodologies",
                "SQL",
                "Stakeholder Management",
                "Data Analysis"
            ],
            "primary": [
                "Scrum",
                "User Acceptance Testing (UAT)",
                "Azure DevOps",
                "Jira",
                "Process Flow Diagrams"
            ],
            "secondary": [
                "Certified Business Analysis Professional (CBAP)",
                "PMI - Professional in Business Analysis (PMI-PBA)",
                "PMI - Agile Certified Practitioner (PMI-ACP)",
                "TestComplete",
                "Cucumber",
                "Selenium",
                "Microsoft Office Suite"
            ],
            "all": [
                "Business Analysis",
                "Agile Methodologies",
                "SQL",
                "Stakeholder Management",
                "Data Analysis",
                "Scrum",
                "User Acceptance Testing (UAT)",
                "Azure DevOps",
                "Jira",
                "Process Flow Diagrams",
                "Certified Business Analysis Professional (CBAP)",
                "PMI - Professional in Business Analysis (PMI-PBA)",
                "PMI - Agile Certified Practitioner (PMI-ACP)",
                "TestComplete",
                "Cucumber",
                "Selenium",
                "Microsoft Office Suite"
            ]
        },
        "job_type": [
            "hybrid"
        ],
        "contact_person": "Hitesh",
        "email": "hitesh@cyber-resource.com",
        "jd": "From: Hitesh, cyber-resource hitesh@cyber-resource.com Reply to: hitesh@cyber-resource.com Role: VDOT - Business Analyst - Hybrid (749601)Job Id : 749601Positions : 1Location: Richmond, VAWork mode: HybridInterview: Both Web Cam and In Person InterviewDUE : 10/28Experience : 8+Client : -VDOT (Virginia Department of Transportation)Client State: VirginiaRate Range : $55 - $65 Per Hr C2C or 1099 (for the Right candidate We will go for little bit Higher)The Virginia Department of Transportation (VDOT) Business Integrated Solutions Division (BISD) is seeking a highly experienced Business Analyst to join our Business Analytics and Testing Support Team. This role requires strong stakeholder management skills and the ability to take initiative with minimal supervision. The Business Analyst will serve as the voice of the customer, ensuring that business needs are clearly understood, articulated, and documented. The Business Analyst will work in both Agile (Sprint) and traditional Waterfall methodologies for the Software Development Lifecycle (SDLC), contributing to ensuring that customers' requirements are met through the development and delivery of requested enhancements.Key Responsibilities:Act as the voice of the customer, working with project team members and business stakeholders to fully understand business processes, pain points, and customer needs.Develop expertise in customers\u2019 business applications and organizational data management concepts, advocating for the customer throughout the SDLC.Conduct Root Cause Analysis to identify system gaps and deficiencies that impact the customer and require a business, technical, or blended approach for resolution.Diagram current processes and propose modifications using process flows, context diagrams, and data flow diagrams to ensure clarity for both technical and non-technical stakeholders.Discover and document customer-centric requirements, user stories, and acceptance criteria with a focus on improving business and technical processes.Decompose requirements into Epics and Features; create clear and concise user stories that are aligned with customer goals and are easy to implement by technical teams.Map user stories to technical designs for system modifications, ensuring that solutions meet customer expectations.Identify and group related user stories into Themes; document dependencies, ensuring alignment with customer priorities and business processes.Assist the Product Owner in maintaining the product backlog with a customer-first mindset.Perform Quality Analyst functions, defining test objectives, test plans, and test cases, while executing tests (including regression testing) to ensure customer satisfaction.Coordinate and facilitate User Acceptance Testing (UAT) with business stakeholders, ensuring that the customer is at the center of the testing process and keeping Project Managers/Scrum Masters informed of progress.Qualifications:Minimum of 10 years of experience delivering business and data analysis artifacts with a customer-focused approach.5+ years of experience as an Agile Business Analyst with a strong understanding of Scrum concepts and methodology, including representing the customer during sprint reviews.Experience organizing and maintaining Product and Sprint backlogs, ensuring prioritization based on customer needs.Proficiency in translating client and product strategy requirements into Epics, Features, and User Stories, ensuring alignment with customer goals.Strong data analysis background, organizational data management concepts, and SQL/database experience, particularly in supporting customer-driven solutions.Proficient in defining acceptance criteria and managing the acceptance process with the customer in mind.Experience with software development applications such as Azure DevOps and/or Jira.Expertise with Microsoft Office products (Word, Excel, Access, Outlook, Visio, PowerPoint, Project Server).Experience with reporting systems, operational data stores, data warehouses, data lakes, and data marts.Exceptional written and oral communication skills with a proven ability to advocate for customers while working with a diverse set of peers and stakeholders.Preferred:Certified Business Analysis Professional (CBAP)PMI - Professional in Business Analysis (PMI-PBA)PMI - Agile Certified Practitioner (PMI-ACP)Experience using Azure DevOps or Jira for agile software development and work item tracking.Experience with automated testing tools such as TestComplete, Cucumber, or Selenium.",
        "source": "Email",
        "date_posted": "2024-10-23 09:22:10-05:00",
        "unique_id": "192b9ff0305711e4",
        "emp_type": [
            "contract",
            "third party"
        ],
        "tag": "Business Analyst"
    }
]