[
    {
        "company": "Genuineitllc",
        "job_title": "Oracle Apps Program Manager",
        "location": "St. Louis, MO, USA",
        "full_location": {
            "city": "St. Louis",
            "state": "MO",
            "country": "USA"
        },
        "job_details": {
            "employment_type": [
                "contract",
                "third party"
            ],
            "experience_required": "At least 10 years",
            "degree_required": "Bachelor's degree in Information technology, computer science, engineering, business or related courses",
            "visa_sponsorship": "Not specified",
            "notice_period": "Not specified",
            "duration": "Up to 12 months",
            "rate": "Not specified"
        },
        "skills": {
            "core": [
                "Project/Program Management",
                "Oracle Fusion"
            ],
            "primary": [
                "manufacturing",
                "supply chain",
                "finance",
                "PMI-PMP",
                "PMI-PgMP",
                "PRINCE2",
                "Organizational Change Management",
                "Prosci",
                "CCMP"
            ],
            "secondary": [
                "agile",
                "waterfall",
                "communication skills"
            ],
            "all": [
                "Project/Program Management",
                "Oracle Fusion",
                "manufacturing",
                "supply chain",
                "finance",
                "PMI-PMP",
                "PMI-PgMP",
                "PRINCE2",
                "Organizational Change Management",
                "Prosci",
                "CCMP",
                "agile",
                "waterfall",
                "communication skills"
            ]
        },
        "job_type": [
            "onsite",
            "remote"
        ],
        "contact_person": "Ben",
        "email": "ben@genuineitllc.com",
        "jd": "From: Ben, Genuineitllc ben@genuineitllc.com Reply to: ben@genuineitllc.com Job Title: Oracle Apps Program Manager Job Type: Contract Location: St. Louis, MO (Need Local) Required Skills: Project/Program Management experience, Oracle Fusion is required: manufacturing, supply chain, and finance are preferred areas of knowledge. This position will be required to be on-site at the client in Missouri up to 50% of the time for up to 12 months. After that period the role may transition to primarily remote, with occasional travel for major project milestones. Qualifications: Bachelor's degree in Information technology, computer science, engineering, business or related courses At least 10 years of direct experience in Project Management and Program Leadership with proven record of success PMI-PMP, PMI-PgMP, or PRINCE2 certification Previous experience with Organizational Change Managementing, including Prosci, CCMP, or similar qualification a plus Previous project experience with Oracle Fusion is required: manufacturing, supply chain, and finance are preferred areas of knowledge. Able to collaborate with internal and client stakeholders, including business analysts, business users, architects, client relations, project managers and sponsors Skilled in project progress and metrics reporting for project teams through executives Able to use various project management methodologies, including agile and waterfall Experienced in balancing critical issue resolution and competing priorities Skilled in identifying client training requirements and customizing training content as needed Excellent communication skills across multiple timezones, countries and cultures required",
        "source": "Email",
        "date_posted": "2024-10-24 08:40:31-05:00",
        "unique_id": "192bee5af977d8eb",
        "emp_type": [
            "contract",
            "third party"
        ],
        "tag": "Project Manager"
    }
]