[
    {
        "company": "iinfiniti",
        "job_title": "Technical Writer",
        "location": "Lansing, MI, USA",
        "full_location": {
            "city": "Lansing",
            "state": "MI",
            "country": "USA"
        },
        "job_details": {
            "employment_type": [
                "full-time",
                "third party"
            ],
            "experience_required": "Not specified",
            "degree_required": "Not specified",
            "visa_sponsorship": "Not specified",
            "notice_period": "Not specified",
            "duration": "Not specified",
            "rate": "Not specified"
        },
        "skills": {
            "core": [
                "Java",
                "J2EE",
                "WebSphere",
                "ASP.Net",
                ".Net 6.0",
                "Angular",
                "React",
                "Java MVC frameworks",
                "Hibernate",
                "Java Script",
                "Web Services",
                "EJB",
                "Microsoft SQL Server",
                "SQL",
                "stored procedures",
                "Corticon Rules Engine",
                "WebSphere Liberty",
                "Git"
            ],
            "primary": [
                "technical specifications",
                "Swagger",
                "design patterns",
                "organizing algorithms",
                "requirements gathering",
                "Object Oriented Analysis",
                "application and database development",
                "systems development methodology"
            ],
            "secondary": [],
            "all": [
                "Java",
                "J2EE",
                "WebSphere",
                "ASP.Net",
                ".Net 6.0",
                "Angular",
                "React",
                "Java MVC frameworks",
                "Hibernate",
                "Java Script",
                "Web Services",
                "EJB",
                "Microsoft SQL Server",
                "SQL",
                "stored procedures",
                "Corticon Rules Engine",
                "WebSphere Liberty",
                "Git",
                "technical specifications",
                "Swagger",
                "design patterns",
                "organizing algorithms",
                "requirements gathering",
                "Object Oriented Analysis",
                "application and database development",
                "systems development methodology"
            ]
        },
        "job_type": [
            "hybrid"
        ],
        "contact_person": "Heena Khan",
        "email": "heena@iinfiniti-solutions.com",
        "jd": "From: Heena Khan, iinfiniti heena@iinfiniti-solutions.com Reply to: heena@iinfiniti-solutions.com System Analyst 6 Technical Writer Location: Lansing, MI Hybrid Systems Analyst: The Systems (Technical) Analyst will work with the ORS Development and Operations Teams to analyze the current system architecture and research emerging technologies, system changes, prepare for specifications, configuration of software, program code evaluation and testing. Lead and manage the design, implementation and delivery of system and software architecture designs, strategies and quality assurance plans. Design, prototype, develop and implement to achieve business results for the client. Experienced expert able to lead and deliver the technical documentation of solutions using object-oriented, service-oriented architecture, and n-tier architectures. Documents both the State and industry best practices for software engineering. Leads in the development and documentation of long-term technology strategy and planning for the entire organization leveraging existing and acquiring new resources. Leads and actively participates on project teams business by documenting technical requirements in alignment with business needs and requirements, performing analysis, design, development, integration, and maintenance of the ORS technical ecosystem. This position supports the ORS Clarety application, the Employer Self Service (ESS) application, the miAccount application and the Microsoft Dynamics 365 Customer Relationship Management system. Required Senior Java developer skill set required (will be required to read/write code as part of the System Analyst role) Ability to write quality technical specifications (Familiarity with Swagger) Considerable knowledge of Java, J2EE, WebSphere development technologies. ASP.Net, .Net 6.0 or latest version. Flexibility to work with other technologies (i.e., Angular, React, etc.) Experience with design patterns and organizing algorithms Experienced in designing and implementing Java MVC frameworks (Struts MVC) and ORM tool (Hibernate) and Java Script, Web Services and EJB. Experience in developing systems with Microsoft SQL Server (SQL 2016 or higher) Experience writing Structured Query Language (SQL) and stored procedures. Experience performing analysis and requirements gathering with customers. Experience with both web-based and client server based systems architecture. Experience with Object Oriented Analysis, design and programming experience. Experience with application and database development and access methods. Experience with systems development methodology utilized in the development of new systems and enhancements. Experience with Corticon Rules Engine technology Experience with WebSphere Liberty Experience with Git",
        "source": "Email",
        "date_posted": "2024-10-23 09:57:38-05:00",
        "unique_id": "192ba552777cba1e",
        "emp_type": [
            "full-time",
            "third party"
        ],
        "tag": "Java developer"
    }
]