[
    {
        "company": "Tek inspirations LLC",
        "job_title": "Service Designer",
        "location": "New York, NY, USA",
        "full_location": {
            "city": "New York",
            "state": "NY",
            "country": "USA"
        },
        "job_details": {
            "employment_type": [
                "contract",
                "third party"
            ],
            "job_code": "",
            "experience_required": "5+ years",
            "degree_required": "Not specified",
            "visa_sponsorship": "Not specified",
            "notice_period": "Not specified",
            "duration": "6 months",
            "rate": "Not specified"
        },
        "skills": {
            "core": [
                "user-centered design",
                "design research methods",
                "business strategy"
            ],
            "primary": [
                "ethnography",
                "co-creation",
                "usability testing",
                "client presentations",
                "market validation",
                "problem-solving"
            ],
            "secondary": [
                "collaborative",
                "proactive",
                "business development",
                "digital transformations"
            ],
            "all": [
                "user-centered design",
                "design research methods",
                "business strategy",
                "ethnography",
                "co-creation",
                "usability testing",
                "client presentations",
                "market validation",
                "problem-solving",
                "collaborative",
                "proactive",
                "business development",
                "digital transformations"
            ]
        },
        "job_type": [
            "hybrid"
        ],
        "contact_person": "Abhishek Kumar",
        "email": "abhishek.kumar@tekinspirations.com",
        "jd": "From: Abhishek Kumar, Tek inspirations LLC abhishek.kumar@tekinspirations.com Reply to: abhishek.kumar@tekinspirations.com Job Description :Service DesignerLocation: New York, New York/ HybridDuration: 6months \u00b7 Have 5+ years of experience as a researcher, moderator, and strategist, specifically in user-centered design and business strategy.\u00b7 Are skilled in design research methods such as ethnography, co-creation, and usability testing, and can connect customer insights with business strategies.\u00b7 Can communicate complex ideas clearly to clients and stakeholders, and are experienced in leading client presentations and proposals.\u00b7 Have a strategic mindset, with experience in envisioning new solutions, market validation, and problem-solving through both top-down and bottom-up analysis.\u00b7 Are comfortable working directly with clients, understanding their business needs, and offering consultative insights.\u00b7 Are collaborative and proactive, able to handle multiple projects in a fast-paced environment, while continuously improving processes.\u00b7 Have experience in business development and are capable of helping companies with digital transformations aligned with customer needs.",
        "source": "Email",
        "date_posted": "2024-10-23 10:59:29-05:00",
        "unique_id": "192ba3d986eccce0",
        "emp_type": [
            "contract",
            "third party"
        ],
        "tag": "Business Analyst"
    }
]