[
    {
        "company": "Altitude Technology Solutions",
        "job_title": "Lead Java Developer",
        "location": "San Diego, CA, USA",
        "full_location": {
            "city": "San Diego",
            "state": "CA",
            "country": "USA"
        },
        "job_details": {
            "employment_type": [
                "full-time",
                "third party"
            ],
            "experience_required": "12+ years",
            "degree_required": "Not specified",
            "visa_sponsorship": "Not specified",
            "notice_period": "Not specified",
            "duration": "Not specified",
            "rate": "Not specified"
        },
        "skills": {
            "core": [
                "Java",
                "Spring Boot",
                "RESTful Microservices",
                "Agile",
                "Scrum"
            ],
            "primary": [
                "Automated Testing",
                "JUnit",
                "Oracle",
                "MS SQL",
                "Postgres",
                "Jira",
                "GitLab",
                "Swagger",
                "Postman",
                "SOAP UI",
                "Kibana",
                "ELK",
                "Dynatrace",
                "Data Structures",
                "Design patterns",
                "Asynchronous programming"
            ],
            "secondary": [
                "Mono",
                "Flux",
                "ORM frameworks",
                "Entity",
                "Hibernate",
                "Dapper",
                "API authentication",
                "Authorization using oath",
                "Kafka",
                "Docker",
                "GIT",
                "SonarQube",
                "CI/CD",
                "BIAN framework"
            ],
            "all": [
                "Java",
                "Spring Boot",
                "RESTful Microservices",
                "Agile",
                "Scrum",
                "Automated Testing",
                "JUnit",
                "Oracle",
                "MS SQL",
                "Postgres",
                "Jira",
                "GitLab",
                "Swagger",
                "Postman",
                "SOAP UI",
                "Kibana",
                "ELK",
                "Dynatrace",
                "Data Structures",
                "Design patterns",
                "Asynchronous programming",
                "Mono",
                "Flux",
                "ORM frameworks",
                "Entity",
                "Hibernate",
                "Dapper",
                "API authentication",
                "Authorization using oath",
                "Kafka",
                "Docker",
                "GIT",
                "SonarQube",
                "CI/CD",
                "BIAN framework"
            ]
        },
        "job_type": [
            "onsite"
        ],
        "contact_person": "Vicky Kumar",
        "email": "v.kumar@atsitinc.com",
        "jd": "From: Vicky Kumar, Altitude Technology Solutions v.kumar@atsitinc.com Reply to: v.kumar@atsitinc.com What will you do? Partner with business and marketing to Implement detailed customer applicationsBuild microservice applications using best practicesWrite high-quality, scalable, reusable, fault-tolerant codeWrite automated unit tests and perform API validationsDebug errors, troubleshoot issues, and perform routine performance optimizationsCollaborate with Solution Architects and define API schemasCollaborate with front-end developers to integrate UI components with back-end systemsCollaborate with Product Owners and Solutions Architect to gather business requirements and groom user storiesSet development standards within the team and make sure we maintain high quality technical documentation.Manage a team to deliver new solutions that solve user and business problems for our websiteIdentify and communicate development best practices to the team, enhancing efficiency and performance across the department.Perform technical assessment of the requirements to ensure the possibility of their implementation within a reasonable time.Serve as a mentor, technical leader, and thought leader for a talented team by challenging them and helping them grow.Actively participate in scrum/agile ceremoniesGather and document requirements for development and deliveryContribute code to improve and implement new and existing featuresPerform code reviews and mentor developersCommunicate with business and various other departments. What are we looking for? Strong communication skills and collaboration skills to communicate to different audiences (technology leadership, business leadership, team members, etc.) appropriatelyAbility to understand and translate business/functional requirements to High / Low-Level DesignsExperience working in Agile / Scrum / Iterative development methodologiesSolid programming experience in Java Spring Boot and RESTful Microservices developmentExperience in working with one of the concurrency frameworks like Mono, FluxStrong relational database experience in either Oracle, MS SQL, or PostgresExperience with Automated Testing and tools such as JUnitExperience in using tools like Jira, GitLab, Swagger, Postman, SOAP UIExperience using Logging framework and understanding of monitoring tools like Kibana, ELK, DynatraceStrong understanding of Data Structures, Design patterns and asynchronous programmingStrong problem solving and debugging skills12+ years of software development experience.Knowledge of Agile / Scrum / Iterative development methodologiesBackground and relevant experience in Financial Domain/SectorExperience working in ORM frameworks like Entity, Hibernate, DapperExperience in API authentication and Authorization using oath.Knowledge of queuing or streaming engines like KafkaKnowledge of Docker, GIT, SonarQube and other deployment tools for CI/CDAwareness & Experience in implementing BIAN framework.",
        "source": "Email",
        "date_posted": "2024-10-24 18:28:53-05:00",
        "unique_id": "192c0fcc7776999f",
        "emp_type": [
            "full-time",
            "third party"
        ],
        "tag": "Java developer"
    }
]