[
    {
        "company": "Tekinspirations",
        "job_title": "Business Systems Analyst (ServiceNOW)",
        "location": "USA",
        "full_location": {
            "city": "",
            "state": "CA",
            "country": "USA"
        },
        "job_details": {
            "employment_type": [
                "contract",
                "third party"
            ],
            "job_code": "",
            "experience_required": "5+ years",
            "degree_required": "Not specified",
            "visa_sponsorship": "Must have existing work authorization",
            "notice_period": "Not specified",
            "duration": "6-month contract",
            "rate": "Not specified"
        },
        "skills": {
            "core": [
                "ServiceNOW",
                "Asset Management",
                "Data Cleanup",
                "Agile",
                "Waterfall"
            ],
            "primary": [
                "AWS tags",
                "Rapid7",
                "Process Analysis",
                "Systems Analysis",
                "Technical Documentation"
            ],
            "secondary": [
                "Interpersonal Skills",
                "Problem Solving",
                "Use Case Modeling",
                "User Story Creation",
                "Communication Skills"
            ],
            "all": [
                "ServiceNOW",
                "Asset Management",
                "Data Cleanup",
                "Agile",
                "Waterfall",
                "AWS tags",
                "Rapid7",
                "Process Analysis",
                "Systems Analysis",
                "Technical Documentation",
                "Interpersonal Skills",
                "Problem Solving",
                "Use Case Modeling",
                "User Story Creation",
                "Communication Skills"
            ]
        },
        "job_type": [
            "remote"
        ],
        "contact_person": "Akash Sharma",
        "email": "akash.s@tekinspirations.com",
        "jd": "From: Akash Sharma, Tekinspirations akash.s@tekinspirations.com Reply to: akash.s@tekinspirations.com Title: Business Systems Analyst (ServiceNOW) 100% remote (MUST LIVE IN CALIFORNIA (NORHTERN CALI IS PREFERRED( Please make sure candidate have ALL the MUST HAVE\u2019s) Must Have\u2019s:5 years Strong Asset Management background Experience and skills managing data cleanups, tagging (AWS tags, in ServiceNow) and begin mapping servers to applications. Experience defining the data cleanup process, etc. Must have ServiceNOW, with Inventory/Asset Management, preferably in ServiceNOW. Rapid 7 experience as well Must come from higher education background having worked at a University or any College in the past 5+ years experience working in Agile, Agile SCRUM, and traditional Waterfall environments POSITION SUMMARYPOSITION SUMMARYOur current SN/Rapid7 Integration project (Phase 1) is going well. We\u2019re now looking for an additional resource, a Business Systems Analyst that can help us on the current SN Asset Inventory / Rapid7 integration project as well as the upcoming Asset Management project (Phase 2). We are looking for an experienced Business Systems Analyst with experience in Asset Management and not a developer. This is a six-month contract with potential consideration position for a staff position if the candidate is in CA and has a green card or is a US citizen. ResponsibilitiesPerforms complex analysis of business and user needs - Evaluate business and user needs to translate into system and process requirements - Considers implications of applying technology and process changes - Investigate system and process defects to understand root causeLead cross-functional teams to analyze issues or evaluate changes - Complete risk analysis for requested system and process changes and enhancements - Facilitate mitigation of risks and remediationDocumentation: - Document business and user requirements - Create technical system and process specifications - Generate process flow diagrams of system and business processes - Document defects, issues, and risks for systems and processes - Complete necessary documentation for change management processDesign and Change: - Develop process changes to meet business and user requirements - Create integration plans for changes and enhancements - Generate acceptance testing plans and scenariosCreate or modify procedures to support business and system processes - Implement system changes to applications and processes - Adhere to change management proceduresSoliciting Information and Communication: - Interview business partners for requirements, challenges, and requests - Interact with vendors to manage integrations, changes, and issues - Facilitate meetings with other UCOP departments to gather requirements, troubleshoot issues, and implement changes - Participate in strategy sessions to alter or create policies, processes, and procedures Required Qualifications5+ years of advanced knowledge/experience of business and process analysis functions.Experience and skills managing data cleanups, tagging (AWS tags, potentially in ServiceNow) and begin mapping servers to applications. Experience defining the data cleanup process, etc. While we use/prefer SNOW, the process can be tool agnostic. This contactor should have familiarity with Inventory/Asset Management, preferably in SN. Demonstrated effective communication and interpersonal skills.Demonstrated ability to communicate technical information to technical and non-technical personnel at various levels in the organization.Interpersonal and communications skills to work with both technical and non-technical personnel at various levels in the organization.Self-motivated and works independently and as part of a team. Able to learn effectively and meet deadlines. Demonstrates problem solving skills.Demonstrated experience with process analysis, systems analysis, process architectures and systems analysis methodologies.Understanding and skill in complex process and systems requirement documentation standards, such as Use Case modeling, User Story creations, and narrative description.Experience interviewing people to gain information for systems and processes. Demonstrated ability to work with others from diverse backgroundsAdvanced skills and methodologies associated with process and software design, modification, and implementation.Experience in the Higher Education sector is preferred. Experience working in Agile, Agile SCRUM, and traditional Waterfall environments.",
        "source": "Email",
        "date_posted": "2024-10-23 17:32:56-05:00",
        "unique_id": "192bba33bae87005",
        "emp_type": [
            "contract",
            "third party"
        ],
        "tag": "Business Analyst"
    }
]