[
    {
        "company": "Sonitalentcorp",
        "job_title": "SQL server DBA",
        "location": "New York, NY, USA",
        "full_location": {
            "city": "New York",
            "state": "NY",
            "country": "USA"
        },
        "job_details": {
            "employment_type": [
                "contract",
                "third party"
            ],
            "job_code": "",
            "experience_required": "Not specified",
            "degree_required": "Not specified",
            "visa_sponsorship": "Must have existing work authorization",
            "notice_period": "Not specified",
            "duration": "6 months",
            "rate": "Not specified"
        },
        "skills": {
            "core": [
                "SQL",
                "AWS",
                "SQL Server migration"
            ],
            "primary": [
                "Database administrator certifications from Microsoft",
                "Hands on System engineer",
                "Ability to troubleshoot sql server issues",
                "Experience in handling SQL server migration"
            ],
            "secondary": [
                "Expert in DAG setup and troubleshooting of DAG related issues"
            ],
            "all": [
                "SQL",
                "AWS",
                "SQL Server migration",
                "Database administrator certifications from Microsoft",
                "Hands on System engineer",
                "Ability to troubleshoot sql server issues",
                "Experience in handling SQL server migration",
                "Expert in DAG setup and troubleshooting of DAG related issues"
            ]
        },
        "job_type": [
            "hybrid",
            "remote"
        ],
        "contact_person": "Uttam Barman",
        "email": "uttam.barman@sonitalentcorp.com",
        "jd": "From: UTTAM BARMAN, SONITALENTCORP uttam.barman@sonitalentcorp.com Reply to: uttam.barman@sonitalentcorp.com Title - SQL server DBALocation: New York, NY :: Hybrid or 100% Remote Zip Code 10104Domain: Consulting ServicesStart Date: ImmediatelyType: CTH 6 monthsVisa Status: USC/GC for this role Required Technologies and Skills:Primary Skills: SQL, AWS, SQL Server migrationSQL server DBA who has experience of handling sql server on AWSDatabase administrator certifications from Microsoft or a reputed organizationHands on System engineer who can manage extra-large databases with high availability, real time replication from OLTP and OLAP using distributed databaseAbility to troubleshoot sql server issues not limited but covering system locks, fragmentation, index reorganization and rebuild, system logs issues, replication delays, ghost recordsExperience in handling SWL server migration from on Prem to AWS and from old SQL server version to new SQL server version. Expert in DAG setup and troubleshooting of DAG related issues LinkedIn: https://www.linkedin.com/in/uttam-barman-b494b1254/Email: uttam.barman@sonitalentcorp.comContact: 8599464061",
        "source": "Email",
        "date_posted": "2024-10-23 11:30:25-05:00",
        "unique_id": "192ba594a687195a",
        "emp_type": [
            "contract",
            "third party"
        ],
        "tag": "DB Admin"
    }
]