[
    {
        "company": "Northite",
        "job_title": "Business Systems Analyst (BSA)",
        "location": "Minnesota, MN, USA",
        "full_location": {
            "city": "Minnesota",
            "state": "MN",
            "country": "USA"
        },
        "job_details": {
            "employment_type": [
                "onsite",
                "third party"
            ],
            "experience_required": "5+ years",
            "degree_required": "Bachelor's degree in Computer Science, Information Systems, Business Administration, or related field (or equivalent work experience)",
            "visa_sponsorship": "Not specified",
            "notice_period": "Not specified",
            "duration": "Not specified",
            "rate": "Not specified"
        },
        "skills": {
            "core": [
                "JD Edwards EnterpriseOne 9.2",
                "Business Analysis",
                "SQL",
                "Reporting Tools"
            ],
            "primary": [
                "Financials",
                "Procurement",
                "Manufacturing",
                "Sales Order Management",
                "Inventory Management"
            ],
            "secondary": [
                "Problem-solving",
                "Communication",
                "Project Management"
            ],
            "all": [
                "JD Edwards EnterpriseOne 9.2",
                "Business Analysis",
                "SQL",
                "Reporting Tools",
                "Financials",
                "Procurement",
                "Manufacturing",
                "Sales Order Management",
                "Inventory Management",
                "Problem-solving",
                "Communication",
                "Project Management"
            ]
        },
        "job_type": [
            "onsite"
        ],
        "contact_person": "sirisha",
        "email": "sirisha@northite.com",
        "jd": "From: sirisha, northite sirisha@northite.com Reply to: sirisha@northite.com Role : Business Systems Analyst (BSA)Location : Minnesota, MNSkills : BSA with JDE 9.2 versionC2C Onsite.Job Description:Key Responsibilities:Analyze, design, and implement JD Edwards (JDE) EnterpriseOne 9.2 solutions to meet business requirements across various functional areas such as finance, supply chain, manufacturing, and distribution.Gather and document business requirements from stakeholders and translate them into functional specifications for system improvements or new implementations.Collaborate with developers, system architects, and other team members to deliver enhancements and new functionalities in JDE 9.2.Support JD Edwards 9.2 modules including Financials, Procurement, Inventory Management, Sales Order Management, and other key functions.Perform gap analysis between current system capabilities and business needs, recommending best practices and JDE functionality where appropriate.Participate in JDE 9.2 system upgrades, patches, and testing processes, ensuring smooth transitions with minimal disruption to business operations.Develop and execute test plans, scripts, and cases to ensure that the solutions meet business and functional requirements.Troubleshoot and resolve technical issues related to JD Edwards 9.2, providing timely support to end-users.Conduct training sessions and create user documentation to ensure the effective adoption of system functionalities by business users.Work closely with IT teams and other stakeholders to integrate JDE 9.2 with other systems and platforms.Ensure compliance with organizational and industry standards and participate in change management processes.Required Qualifications:Bachelor's degree in Computer Science, Information Systems, Business Administration, or related field (or equivalent work experience).5+ years of experience as a Business Systems Analyst with a focus on JD Edwards EnterpriseOne 9.2.Strong understanding of JDE 9.2 modules such as Financials, Procurement, Manufacturing, Sales Order Management, and Inventory Management.Proven ability to gather, document, and translate business requirements into technical specifications.Hands-on experience with JDE 9.2 upgrades, implementations, and customizations.Knowledge of JD Edwards Toolset and Oracle database management systems.Experience with SQL and reporting tools (such as BI Publisher, One View Reporting, etc.).Strong problem-solving skills with the ability to troubleshoot complex issues in JDE 9.2.Excellent communication skills\u2014both written and verbal\u2014able to work effectively with both technical and non-technical stakeholders.Project management experience, with the ability to manage multiple tasks and priorities in a fast-paced environment",
        "source": "Email",
        "date_posted": "2024-10-23 10:46:55-05:00",
        "unique_id": "192ba326cd6ac69d",
        "emp_type": [
            "onsite",
            "third party"
        ],
        "tag": "Business Analyst"
    }
]