[
    {
        "company": "Global IT Family",
        "job_title": "Application Developer",
        "location": "Hartford, CT, USA",
        "full_location": {
            "city": "Hartford",
            "state": "CT",
            "country": "USA"
        },
        "job_details": {
            "employment_type": [
                "full-time",
                "third party"
            ],
            "job_code": "DSSAppDev1 - 63507",
            "experience_required": "Not specified",
            "degree_required": "Not specified",
            "visa_sponsorship": "Not specified",
            "notice_period": "Not specified",
            "duration": "11/01/2024 - 06/30/2025",
            "rate": "Not specified"
        },
        "skills": {
            "core": [
                "Microsoft .NET Certification",
                "Power Platform Development Certification",
                "API Integration",
                "SDLC Proficiency",
                "VB.NET",
                "Java/J2EE"
            ],
            "primary": [
                "Microsoft Power Platform",
                "Data Model Design",
                "Development Standards",
                "SQL Queries"
            ],
            "secondary": [
                "Legacy System Conversion",
                "Legacy Application Support",
                "Best Practices & Operational Knowledge",
                "Communication & Leadership",
                "Operating Systems",
                "Databases",
                "Application Servers",
                "Network Protocols"
            ],
            "all": [
                "Microsoft .NET Certification",
                "Power Platform Development Certification",
                "API Integration",
                "SDLC Proficiency",
                "VB.NET",
                "Java/J2EE",
                "Microsoft Power Platform",
                "Data Model Design",
                "Development Standards",
                "SQL Queries",
                "Legacy System Conversion",
                "Legacy Application Support",
                "Best Practices & Operational Knowledge",
                "Communication & Leadership",
                "Operating Systems",
                "Databases",
                "Application Servers",
                "Network Protocols"
            ]
        },
        "job_type": [
            "hybrid"
        ],
        "contact_person": "Sameer Kumar",
        "email": "sameer@globalitfamily.com",
        "jd": "From: SAM, Global IT Family sameer@globalitfamily.com Reply to: sameer@globalitfamily.com Requisition ID: DSSAppDev1 - 63507Estimated Duration: 11/01/2024 - 06/30/2025Requisition Name: Application DeveloperCustomer: CT DSS55 Farmington Ave Hartford, Connecticut 06105Hybrid Local Candidate only DescriptionMicrosoft .NET Certification: Candidates must possess a valid certification in Microsoft .NET development, demonstrating expertise in building, deploying, and maintaining applications using the .NET framework. This certification ensures proficiency in various .NET technologies and best practices for software development.Power Platform Development Certification: A certification in Microsoft Power Platform development is required, verifying the candidate's ability to create custom business solutions using Power Apps, Power Automate, Power BI, and Power Virtual Agents. This certification reflects the ability to develop and integrate low-code/no-code solutions that enhance organizational workflows.Legacy System Conversion: Assist in converting legacy .NET applications to the Microsoft Power Platform, ensuring smooth integration with Power Apps, Power Pages, and portals while maintaining full functionality and performance.Legacy Application Support: Provide ongoing maintenance and support for existing .NET legacy applications, addressing technical issues, performing updates, and ensuring continued operation and performance.API Integration: Develop and implement robust API integration solutions to connect external applications and systems, ensuring secure and efficient data exchange across platforms.Data Model Design: Collaborate with database administrators (DBAs) to design efficient data models, optimize queries, and maintain data integrity across both legacy systems and new Power Platform applications.SDLC Proficiency: Exhibit expertise in the Software Development Life Cycle (SDLC), with experience in both waterfall and agile methodologies, ensuring timely project delivery and alignment with project goals.Development Standards: Follow established development practices, proactively identifying opportunities for process improvements to enhance overall development quality and efficiency. Technical Expertise:Proficiency in programming languages such as VB.NET, Java/J2EE, and API development.Strong experience with Microsoft Power Platform (Power Apps, Power Pages, Portals).Hands-on experience in setting up Integrated Development Environments (IDEs) and writing unit and feature tests.Ability to run and optimize SQL queries, contributing to both development and testing efforts.Best Practices & Operational Knowledge: Demonstrated knowledge of best practices in systems deployment, testing, operations, administration, and disaster recovery. Communication & Leadership: Strong verbal and written communication skills, with the ability to manage tasks proactively and work independently.Additional Qualifications: Experience in operating systems, databases, application servers, programming languages, and network protocols is a plus. Relevant technical certifications or additional training in these areas is highly desirable. Thanks & Regards,Sameer KumarGlobal IT FamilyEmail: sameer@globalitfamily.com www.globalitfamily.comSkype: sameer@globalitfamily.comLinkedIn : https://www.linkedin.com/in/sameer-satapathy-10ab0318/ (Open to connect in Linkedin)Connect with us!",
        "source": "Email",
        "date_posted": "2024-10-24 07:58:58-05:00",
        "unique_id": "192bed146e6570cc",
        "emp_type": [
            "full-time",
            "third party"
        ],
        "tag": ".net developer"
    }
]