[
    {
        "company": "SMART IT FRAME",
        "job_title": "Java Full Stack Developer",
        "location": "Phoenix, AZ, USA",
        "full_location": {
            "city": "Phoenix",
            "state": "AZ",
            "country": "USA"
        },
        "job_details": {
            "employment_type": [
                "full-time",
                "third party"
            ],
            "job_code": "",
            "experience_required": "Not specified",
            "degree_required": "Not specified",
            "visa_sponsorship": "Not specified",
            "notice_period": "Not specified",
            "duration": "12+ Months",
            "rate": "Not specified"
        },
        "skills": {
            "core": [
                "Java",
                "Spring",
                "Hibernate"
            ],
            "primary": [
                "HTML",
                "CSS",
                "JavaScript",
                "Angular",
                "React",
                "Vue",
                "SQL",
                "NoSQL",
                "Git",
                "Maven",
                "Gradle"
            ],
            "secondary": [
                "OOPs",
                "Java programming patterns",
                "modern Java frameworks",
                "Linux",
                "shell scripting",
                "collaboration",
                "communication",
                "CI tools",
                "GitHub Actions",
                "Jenkins",
                "GitOps"
            ],
            "all": [
                "Java",
                "Spring",
                "Hibernate",
                "HTML",
                "CSS",
                "JavaScript",
                "Angular",
                "React",
                "Vue",
                "SQL",
                "NoSQL",
                "Git",
                "Maven",
                "Gradle",
                "OOPs",
                "Java programming patterns",
                "modern Java frameworks",
                "Linux",
                "shell scripting",
                "collaboration",
                "communication",
                "CI tools",
                "GitHub Actions",
                "Jenkins",
                "GitOps"
            ]
        },
        "job_type": [
            "onsite"
        ],
        "contact_person": "Sona Chhabra",
        "email": "sona@smartitframe.com",
        "jd": "From: Sona Chhabra, SMART IT FRAME sona@smartitframe.com Reply to: sona@smartitframe.com Job Title- Java Full Stack Developer Location - Phoenix, AZ Duration- 12+ Months F2F Interview Job Description: Proven experience as a Full Stack Developer with a strong focus on Java (Spring, Hibernate). Proficiency in front-end technologies (HTML, CSS, JavaScript, Angular/React/Vue). Experience with database technologies (SQL, NoSQL). Familiarity with version control systems (e.g., Git). Strong Java programming and debugging skills Build using Maven/ Gradle Collaborate with UI/UX designers to implement modern front-end designs and enhance user experience. Develop RESTful APIs and integrate with various third-party services. Perform code reviews and maintain code quality through best practices and testing. Troubleshoot and debug applications to optimize performance. Stay updated with emerging technologies and industry trends to enhance development processes. OOPs, Java programming patterns and modern Java frameworks Linux and shell scripting Good collaboration and communication skills CI tools like GitHub Actions and Jenkins; GitOps",
        "source": "Email",
        "date_posted": "2024-10-24 15:25:49-05:00",
        "unique_id": "192c0554ddf8a6f8",
        "emp_type": [
            "full-time",
            "third party"
        ],
        "tag": "Java developer"
    }
]