[
    {
        "company": "Adventa",
        "job_title": "Business Analyst",
        "location": "Minneapolis, MN, USA",
        "full_location": {
            "city": "Minneapolis",
            "state": "MN",
            "country": "USA"
        },
        "job_details": {
            "employment_type": [
                "full-time",
                "third party"
            ],
            "job_code": "",
            "experience_required": "3+ years",
            "degree_required": "Bachelor\u2019s Degree from a four-year college or university is required, practical experience in lieu of education is acceptable.",
            "visa_sponsorship": "Not specified",
            "notice_period": "Not specified",
            "duration": "Not specified",
            "rate": "Not specified"
        },
        "skills": {
            "core": [
                "Business Analysis",
                "Data Mapping",
                "SQL",
                "Integration Experience"
            ],
            "primary": [
                "ETL",
                "API",
                "ERP",
                "CRM",
                "Agile Methodologies",
                "Scrum"
            ],
            "secondary": [
                "Project Management",
                "MS Operating Systems",
                "Interpersonal Skills",
                "Analytical Skills"
            ],
            "all": [
                "Business Analysis",
                "Data Mapping",
                "SQL",
                "Integration Experience",
                "ETL",
                "API",
                "ERP",
                "CRM",
                "Agile Methodologies",
                "Scrum",
                "Project Management",
                "MS Operating Systems",
                "Interpersonal Skills",
                "Analytical Skills"
            ]
        },
        "job_type": [
            "onsite"
        ],
        "contact_person": "Pankaj Upadhyay",
        "email": "pankaj.upadhyay@adventatech.com",
        "jd": "From: pankaj Upadhyay, adventa pankaj.upadhyay@adventatech.com Reply to: pankaj.upadhyay@adventatech.com Mode of interview : In personBusiness AnalystLocation : Minneapolis, MN ( Must be local )USC/ GCThe industry for this role is manufacturingMode of interview : In person We have an identical instead of being ERP heavy, they need someone with strong integration experience (integrating processes or integrating systems). It\u2019s a data BA role where they need skills in data mapping and writing data queries. Having SQL/ETL/API experience is a strong bonus. ERP skills are also a bonus. Job Summary: The Business Analyst will focus on understanding, organizing, prioritizing, and assessing work for the development team based on the needs of the company. This role is responsible for the analysis, requirements gathering, design, end user interaction, acceptance criteria definition, facilitating, and product releases on 3rd party vendor solutions, integrations, and existing applications. The Business Analyst will also serve as liaison between business stakeholders, IT staff, and offshore IT contractors supporting and improving our systems and applications. The Business Analyst will be facilitating and participating in cross functional teams, both onshore and offshore, in all phases of the development lifecycle, addressing software applications, workflows, data flows, mockups, and systems. We have an identical instead of being ERP heavy, they need someone with strong integration experience (integrating processes or integrating systems). It\u2019s a data BA role where they need skills in data mapping and writing data queries. Having SQL/ETL/API experience is a strong bonus. ERP skills are also a bonus. Skills/Experience RequiredBachelor\u2019s Degree from a four-year college or university is required, practical experience in lieu of education is acceptable. 3+ years of business systems analysis experience.Strong communication, interpersonal and analytical skills.ERP and CRM application systems experience. Previous Scrum Experience preferred.Prior experience with Agile methodologies preferred. Ability to understand and build basic SQL statements.Project Management skills nice to have.Prior experience with software integration initiatives nice to have.Working knowledge of MS operating systems and applications.Ability to work in dynamic environment.Travel may be required up to 10% for training or conferences. Responsibility. Ability to communicate with and document 3rd party application requirements.Drive and facilitate the 3rd party application partner, product development team, with the proven ability to provide high level requirement documentation, functional requirements, workflow diagrams, user stories, and data mappings.Responsible for meeting with internal stakeholders to gain thorough understanding of current business process and define problem statements to effectively provide business context to the development team.Define, develop, and ensure functional requirements and acceptance criteria are ready for development to start work.Responsible for validating requirement functionality meets the acceptance criteria and definition of done.Ability to drive a variety of project types including but not limited to 3rd party software implementation, integrations, and hardware/software solutions.Ability to query and track transactional data through integrated systems.Assist in gaining buy-in from stakeholders on decisions regarding product functionality and process.Responsible for creating, maintaining, and prioritizing the list of backlog items, based on the overall strategy and business objectives. Work with business stakeholders and 3rd party application partner to ensure the product backlog has visibility, transparency, and clear understanding of functionality and timing.Ensures close collaboration with the development team, when applicable.Facilitate in daily standups, sprint meetings and retrospectives.Being a member of the team, you\u2019ll help drive the projects\u2019 success by completing it on time, within budget, meeting team members\u2019 expectations and meeting the projects\u2019 goals.",
        "source": "Email",
        "date_posted": "2024-10-23 13:40:03-05:00",
        "unique_id": "192bace05b75f07e",
        "emp_type": [
            "full-time",
            "third party"
        ],
        "tag": "Business Analyst"
    }
]