[
    {
        "company": "Adventa Tech",
        "job_title": "Software/.NET (Mobile) Engineer",
        "location": "Roseville, MN, USA",
        "full_location": {
            "city": "Roseville",
            "state": "MN",
            "country": "USA"
        },
        "job_details": {
            "employment_type": [
                "full-time",
                "third party"
            ],
            "job_code": "",
            "experience_required": "10 plus years",
            "degree_required": "Bachelor\u2019s degree in Computer Engineering, Computer Science, Software Engineering, or a related field",
            "visa_sponsorship": "Not specified",
            "notice_period": "Not specified",
            "duration": "12+Months",
            "rate": "Not specified"
        },
        "skills": {
            "core": [
                "Csharp",
                "Kotlin",
                "Java",
                "Xamarin"
            ],
            "primary": [
                "cloud platforms (e.g. AWS)",
                "mobile backend services",
                "software development tools",
                "version control systems",
                "Bluetooth wireless communication"
            ],
            "secondary": [
                "strong communication",
                "collaboration",
                "teamwork",
                "leadership"
            ],
            "all": [
                "Csharp",
                "Kotlin",
                "Java",
                "Xamarin",
                "cloud platforms (e.g. AWS)",
                "mobile backend services",
                "software development tools",
                "version control systems",
                "Bluetooth wireless communication",
                "strong communication",
                "collaboration",
                "teamwork",
                "leadership"
            ]
        },
        "job_type": [
            "onsite"
        ],
        "contact_person": "Subhra Mallick",
        "email": "subhra@adventatech.com",
        "jd": "From: Subhra Mallick, Adventa Tech subhra@adventatech.com Reply to: subhra@adventatech.com Title : Software/.NET (Mobile) Engineer Duration : 12+Months Location : Roseville, MN Job Type : Onsite Visa : GC / USCMOI : SKYPE Linkedin is must. MUST HAVE: Technical lead for team of multiple software engineers Architect, develop, verify, and maintain scalable, efficient software solutions Work closely with systems, hardware, and firmware engineers to define software requirements Define and own processes for development, implementation, and test of software Conduct code reviews to ensure deliverables meet quality standards Potentially, lead and organize collaboration with external development contractors / companies Bachelor\u2019s degree in Computer Engineering, Computer Science, Software Engineering, or a related field 10 plus years of experience in software development Experience developing mobile applications and with mobile development tools/frameworks (e.g. Xamarin) Proficiency in programming languages such as Csharp, Kotlin, and Java Knowledge of cloud platforms (e.g. AWS) and mobile backend services Strong understanding of software development tools and version control systems Ability to organize work and lead other engineers Strong communication, collaboration, and teamwork skills Experience with Bluetooth wireless communication",
        "source": "Email",
        "date_posted": "2024-10-24 13:03:21-05:00",
        "unique_id": "192bfd2f2c7b6966",
        "emp_type": [
            "full-time",
            "third party"
        ],
        "tag": ".net developer"
    }
]