[
    {
        "company": "KK Software Associates",
        "job_title": "CIAM framework Business Architect",
        "location": "Chicago, IL, USA",
        "full_location": {
            "city": "Chicago",
            "state": "IL",
            "country": "USA"
        },
        "job_details": {
            "employment_type": [
                "third party"
            ],
            "experience_required": "10+ years",
            "degree_required": "Bachelor's or Master's degree in Computer Science, Information Systems, or a related field",
            "visa_sponsorship": "No visa sponsorship",
            "notice_period": "Not specified",
            "duration": "Not specified",
            "rate": "Not specified"
        },
        "skills": {
            "core": [
                "CIAM framework",
                "OAuth",
                "OpenID Connect",
                "SAML",
                "security principles",
                "authentication",
                "encryption"
            ],
            "primary": [
                "CIAM technologies",
                "Okta",
                "Ping Identity",
                "regulatory requirements",
                "GDPR",
                "CCPA",
                "translating business requirements",
                "collaborating with IT teams"
            ],
            "secondary": [
                "analytical skills",
                "problem-solving skills",
                "communication skills"
            ],
            "all": [
                "CIAM framework",
                "OAuth",
                "OpenID Connect",
                "SAML",
                "security principles",
                "authentication",
                "encryption",
                "CIAM technologies",
                "Okta",
                "Ping Identity",
                "regulatory requirements",
                "GDPR",
                "CCPA",
                "translating business requirements",
                "collaborating with IT teams",
                "analytical skills",
                "problem-solving skills",
                "communication skills"
            ]
        },
        "job_type": [],
        "contact_person": "Venkat",
        "email": "venkat@kksoftwareassociates.com",
        "jd": "From: Venkat, KK Software Associates venkat@kksoftwareassociates.com Reply to: venkat@kksoftwareassociates.com We are hiring CIAM framework Business Architect for one of my Client in Location: Chicago(Naperville), IL interesting candidates please send resumes to venkat@kksoftwareassociates.com (614) 335-4419 Position: CIAM framework Business ArchitectLocation: Chicago(Naperville), ILVisa status: : Strictly Don\u2019t share F1, OPT, OPT EAD, L2 EAD and H4 EAD work permit Bachelors or Master\u2019s degree in Computer Science, Information Systems, or a related field.10+ years of related experience as a Business Architect or similar role, with a focus on CIAM framework (such as OAuth, OpenID Connect & SAML)Strong knowledge of security principles, including authentication, authentication and encryption.Experience with CIAM technologies, such as Okta or Ping Identity.Familiarity with regulatory requirements, such as GDPR and CCPA, and their impact on CIAMProficiency in translating business requirements into technical solutions and collaborating with IT teams for implementation.Excellent analytical, problem-solving, and communication skills",
        "source": "Email",
        "date_posted": "2024-10-24 15:49:21-05:00",
        "unique_id": "192c0a4c745b159f",
        "emp_type": [
            "third party"
        ],
        "tag": "Business Analyst"
    }
]