[
    {
        "company": "Teamware Solutions",
        "job_title": "Sybase DBA",
        "location": "Plano, TX, USA",
        "full_location": {
            "city": "Plano",
            "state": "TX",
            "country": "USA"
        },
        "job_details": {
            "employment_type": [
                "full-time",
                "third party"
            ],
            "experience_required": "Not specified",
            "degree_required": "Not specified",
            "visa_sponsorship": "Not specified",
            "notice_period": "Not specified",
            "duration": "Not specified",
            "rate": "Not specified"
        },
        "skills": {
            "core": [
                "Sybase ASE",
                "Sybase IQ",
                "Production Support",
                "UNIX",
                "Linux Shell Scripting"
            ],
            "primary": [
                "High Availability",
                "Disaster Recovery",
                "Database Design",
                "SQL Performance Tuning",
                "Database Management"
            ],
            "secondary": [
                "Oracle",
                "MS SQL Server",
                "Monitoring",
                "Alerting",
                "Cluster Setup"
            ],
            "all": [
                "Sybase ASE",
                "Sybase IQ",
                "Production Support",
                "UNIX",
                "Linux Shell Scripting",
                "High Availability",
                "Disaster Recovery",
                "Database Design",
                "SQL Performance Tuning",
                "Database Management",
                "Oracle",
                "MS SQL Server",
                "Monitoring",
                "Alerting",
                "Cluster Setup"
            ]
        },
        "job_type": [
            "onsite"
        ],
        "contact_person": "Ajaz sharieff",
        "email": "ajaz.t@twsol.com",
        "jd": "From: Ajaz sharieff, Teamware Solutions ajaz.t@twsol.com Reply to: ajaz.t@twsol.com Role: Sybase DBA Location: Plano TX- (5 Days onsite & 24x7 Rotational)Shift:- Rotational (Shift 1 (8 AM \u2013 5 PM), Shift 2 (4 PM \u2013 1 AM), Shift 3 (12 AM \u2013 9 AM))Skills Needed: Production Support Exp., Sybase ASE, Sybase IQ Summary:The Level L1/2 Sybase Administrator is a senior-level position responsible for the design, implementation, and management of databases. This role involves overseeing the database infrastructure, ensuring high availability, performance, and security. The Level 3 DBA provides technical expertise, leads database projects, and collaborates with other IT teams to deliver robust and scalable database services.DBA working experience with Sybase open source and good understanding of other RDBMS such as Sybase, Oracle and MS SQL server.Experience in Production Support with monitoringExperienced in setting up Sybase clusters and supporting HA/DR solutionsStrong skills in UNIX / Linux Shell ScriptingInstall, monitor and maintain software, implement monitoring and alerting.Experience in building high-scalable clusters, failover and hot standby solutions based on Maximum available architectureExperience in architecting, configuring, setting up Enterprise Fail over manager or similar technology for High availability solution.Experience in leading efforts related to system and SQL performance tuning and assisting business process integration with various data sources.Ability to work well with development and infrastructure teams in doing database design, changes and enhancement to new and existing applicationsProven ability to provide High Availability and Disaster Recovery solutions",
        "source": "Email",
        "date_posted": "2024-10-24 09:10:27-05:00",
        "unique_id": "192beff676261e93",
        "emp_type": [
            "full-time",
            "third party"
        ],
        "tag": "DB Admin"
    }
]