[
    {
        "company": "HAN IT Staffing",
        "job_title": "Project Manager with Payments",
        "location": "Tampa, FL, USA",
        "full_location": {
            "city": "Tampa",
            "state": "FL",
            "country": "USA"
        },
        "job_details": {
            "employment_type": [
                "contract",
                "third party"
            ],
            "job_code": "",
            "experience_required": "Not specified",
            "degree_required": "Not specified",
            "visa_sponsorship": "Not specified",
            "notice_period": "Not specified",
            "duration": "Long-Term Contract",
            "rate": "Not specified"
        },
        "skills": {
            "core": [
                "Project Management",
                "Leadership",
                "Team Management",
                "Analytical Skills",
                "Problem-Solving"
            ],
            "primary": [
                "Project Management Software",
                "Agile",
                "Waterfall",
                "Communication",
                "Stakeholder Management"
            ],
            "secondary": [
                "MS Project",
                "Asana",
                "Jira",
                "Banking",
                "Payments"
            ],
            "all": [
                "Project Management",
                "Leadership",
                "Team Management",
                "Analytical Skills",
                "Problem-Solving",
                "Project Management Software",
                "Agile",
                "Waterfall",
                "Communication",
                "Stakeholder Management",
                "MS Project",
                "Asana",
                "Jira",
                "Banking",
                "Payments"
            ]
        },
        "job_type": [
            "onsite"
        ],
        "contact_person": "Rohith Reddy",
        "email": "rohithr@hanstaffing.com",
        "jd": "From: Rohith, HAN IT Staffing rohithr@hanstaffing.com Reply to: rohithr@hanstaffing.com Hi,I'd like you to take a look at a great new position we now have available! Your opinion would be valued with regards to this opening. I really appreciate sending an updated resume & the best number with the best time to reach you. Role: Project Manager with PaymentsLocation: Tampa, FL (Only Locals)Duration: Long-Term Contract Job DescriptionStrong leadership and team management abilities.Coordination skill/ facilitation role across multiple groups is idealProficiency in project management software and tools (e.g., MS Project, Asana, Jira).Solid understanding of project management methodologies (e.g., Agile, Waterfall).Strong analytical and problem-solving skills.Track / follow-up and take things to closureHaving good communication.Ability to work with senior stakeholders with guidance from existing teamExperience in banking / payments (preferred)Coordinating and facilitating role across multiple groups is idealAct as the primary point of contact for stakeholders, including clients, team members, and senior management. Communicate project progress, address concerns, and manage expectations.Ensure project deliverables meet quality standards and requirements --Best regards, Rohith ReddySr. Technical RecruiterHAN IT Staffing rohithr@hanstaffing.comwww.hanstaffing.com100,Wood Ave,S,Suite 103,Iselin Nj,08330https://www.linkedin.com/in/rohith-reddy-lion-1594705b/",
        "source": "Email",
        "date_posted": "2024-10-23 16:35:34-05:00",
        "unique_id": "192bba68419d7cfd",
        "emp_type": [
            "contract",
            "third party"
        ],
        "tag": "Project Manager"
    }
]