[
    {
        "company": "RCI",
        "job_title": "Technical Program Manager",
        "location": "Baton Rouge, LA, USA",
        "full_location": {
            "city": "Baton Rouge",
            "state": "LA",
            "country": "USA"
        },
        "job_details": {
            "employment_type": [
                "contract",
                "third party"
            ],
            "experience_required": "Not specified",
            "degree_required": "Not specified",
            "visa_sponsorship": "No visa sponsorship",
            "notice_period": "Not specified",
            "duration": "1 year contract",
            "rate": "Not specified"
        },
        "skills": {
            "core": [
                "Strong project management skills",
                "Strong proficiency in Microsoft Office Suite",
                "Experience with collecting, analyzing, and reporting key data",
                "Experience in program evaluation",
                "Experience navigating Louisiana\u2019s governmental, business, and community landscape"
            ],
            "primary": [
                "Budgeting",
                "Scheduling",
                "Communication"
            ],
            "secondary": [
                "Industry expertise in clean energy resilient hubs",
                "Experience in working with federal programs",
                "Experience in representing state government officials",
                "Experience in the energy sector",
                "Experience in developing and implementing large-scale public initiatives",
                "Experience in working across state government agencies",
                "Working knowledge of regulatory and statutory compliance requirements",
                "Experience communicating on behalf of appointed government officials",
                "Comprehensive knowledge of state level grant program administration",
                "Experience in partnership development with community groups"
            ],
            "all": [
                "Strong project management skills",
                "Strong proficiency in Microsoft Office Suite",
                "Experience with collecting, analyzing, and reporting key data",
                "Experience in program evaluation",
                "Experience navigating Louisiana\u2019s governmental, business, and community landscape",
                "Budgeting",
                "Scheduling",
                "Communication",
                "Industry expertise in clean energy resilient hubs",
                "Experience in working with federal programs",
                "Experience in representing state government officials",
                "Experience in the energy sector",
                "Experience in developing and implementing large-scale public initiatives",
                "Experience in working across state government agencies",
                "Working knowledge of regulatory and statutory compliance requirements",
                "Experience communicating on behalf of appointed government officials",
                "Comprehensive knowledge of state level grant program administration",
                "Experience in partnership development with community groups"
            ]
        },
        "job_type": [
            "remote"
        ],
        "contact_person": "nitu",
        "email": "nitu@rconsultinginc.com",
        "jd": "From: nitu, RCI nitu@rconsultinginc.com Reply to: nitu@rconsultinginc.com No H1B, OPT, CPT Candidate must provide references for the recent 3 projects cited in their resume Job Title: Technical Program Manager Location: 100% Remote (Baton Rouge, LA 70802)Duration: 1 year contract Visa: No H1B, OPT, CPT Required Skills: Strong project management skills, including budgeting, scheduling, and communicationStrong proficiency in Microsoft Office Suite, including ExcelExperience with collecting, analyzing, and reporting key dataExperience in program evaluation including evidence-based practices and outcome measurementExperience navigating Louisiana\u2019s governmental, business, and community landscape and various audiences/stakeholdersAvailable to work from Baton Rouge, LA on a regular basis Nice to have Skills, not mandatory:Industry expertise in clean energy resilient hubs, utility-owned electric grid systems, and reduced-carbon energy resilienceExperience in working with federal programs at the federal, state, local level, and/or private sectorExperience in representing state government officials in public settingsExperience in and knowledge of the energy sector and its diverse stakeholdersExperience in developing and implementing large-scale public initiatives and projectsExperience in working across state government agencies to align and implement strategic priorities Working knowledge of regulatory and statutory compliance requirements for federal programsExperience communicating on behalf of appointed government officials and civil servantsComprehensive knowledge of state level grant program administration Experience in partnership development with community groups, non-profit partners, and/or government agencies Role & Responsibilities:Develop understanding of the business environment and use that understanding to make informed decisions and drive results Define program goals and objectives, and align them with the organization's strategy Develop project plans and schedules, including resource allocation, timelines, and budgets Lead cross-functional teams to deliver programs and projects on time and within budget Manage risks and issues, and implement mitigation strategies as needed Communicate project status and progress to stakeholders, including senior management Collaborate with stakeholders and teams to ensure program and project goals are met Ensure compliance with program management processes and standards; Provide day-to-day support for on-going processes; Provide on-going evaluation and improvements for processes; work in needed areas to provide technical support for agency\u2019s work demands.",
        "source": "Email",
        "date_posted": "2024-10-24 14:42:51-05:00",
        "unique_id": "192c03315d915ad6",
        "emp_type": [
            "contract",
            "third party"
        ],
        "tag": "Project Manager"
    }
]