[
    {
        "company": "Virginia Department of Transportation",
        "job_title": "VDOT - Business (Data) Analyst - Hybrid (749537)",
        "location": "Richmond, VA, USA",
        "full_location": {
            "city": "Richmond",
            "state": "VA",
            "country": "USA"
        },
        "job_details": {
            "employment_type": [
                "contract",
                "third party"
            ],
            "experience_required": "12+ years",
            "degree_required": "Not specified",
            "visa_sponsorship": "Not specified",
            "notice_period": "Not specified",
            "duration": "12 Months Contract",
            "rate": "Not specified"
        },
        "skills": {
            "core": [
                "IBM Knowledge Catalog",
                "Snowflake",
                "SafeFME",
                "ArcGIS Enterprise",
                "Agile Business Analyst",
                "enterprise data management"
            ],
            "primary": [
                "business and systems analysis artifacts",
                "Scrum concepts and methodology",
                "organizing and maintaining Product and Sprint backlogs",
                "translating client and product strategy requirements",
                "defining acceptance criteria",
                "exceptional written and oral communication skills"
            ],
            "secondary": [
                "Microsoft Office products",
                "Application Lifecycle Management (ALM)",
                "Certified Business Analysis Professional (CBAP)",
                "PMI \u2013 Professional in Business Analysis (PMI-PBA)",
                "PMI \u2013 Agile Certified Practitioner (PMI-ACP)",
                "Azure DevOps",
                "Jira",
                "automated testing tools"
            ],
            "all": [
                "IBM Knowledge Catalog",
                "Snowflake",
                "SafeFME",
                "ArcGIS Enterprise",
                "Agile Business Analyst",
                "enterprise data management",
                "business and systems analysis artifacts",
                "Scrum concepts and methodology",
                "organizing and maintaining Product and Sprint backlogs",
                "translating client and product strategy requirements",
                "defining acceptance criteria",
                "exceptional written and oral communication skills",
                "Microsoft Office products",
                "Application Lifecycle Management (ALM)",
                "Certified Business Analysis Professional (CBAP)",
                "PMI \u2013 Professional in Business Analysis (PMI-PBA)",
                "PMI \u2013 Agile Certified Practitioner (PMI-ACP)",
                "Azure DevOps",
                "Jira",
                "automated testing tools"
            ]
        },
        "job_type": [
            "hybrid"
        ],
        "contact_person": "Zara Khan",
        "email": "info@techbrandstaffing.com",
        "jd": "Greetings, Must have 12+ years of experience, Must have IBM Knowledge Catalog, Snowflake, SafeFME, and ArcGIS Enterprise. Hope you're doing great, This is Zara Khan from Tech Brand Staffing LLC. I've been retained by a top employer to help them recruit for a new VDOT - Business (Data) Analyst - Hybrid (749537) position. Please review the below job description and reply back with your updated resume and desired rate. Title: VDOT - Business (Data) Analyst - Hybrid (749537) Duration: 12 Months Contract Location: Richmond, VA Please fill this box Skill Required years req Years Used Last Used Advanced understanding of enterprise data management concepts and tools. Required 8 Experience delivering business and systems analysis artifacts Required 8 Experience as an Agile Business Analyst with a strong understanding of Scrum concepts and methodology. Required 5 Proven experience in organizing and maintaining Product and Sprint backlogs. Required 5 Proficiency in translating client and product strategy requirements into application requirements and user stories. Required 8 Defining acceptance criteria and managing the acceptance process with development teams. Required 5 Exceptional written and oral communication skills, with a proven ability to work well with a diverse set of peers and customers Required 8 Job description The Virginia Department of Transportation (VDOT) is seeking a highly experienced Business (Data) Analyst to join our dynamic Business Analytics and Testing Support team. In this role, you will be crucial in supporting the implementation of Enterprise Data Management tools. Your responsibilities will include documenting use cases, validating success criteria through testing, and supporting end users with tools such as Collibra, Informatica, IBM Knowledge Catalog, Snowflake, SafeFME, and ArcGIS Enterprise. VDOT is a fast-paced organization that upholds the highest standards for work quality and efficiency. We are committed to continuous improvement, and every team member is expected to contribute proactively to our success. If you are a problem-solver with a passion for data governance and a drive to make a significant impact, we would love to have you on our team. Key Responsibilities: Partner with project team members and business stakeholders to deeply understand business processes, identify pain points, and develop expertise in the customers\u2019 business applications. Conduct thorough root cause analysis to uncover system gaps and deficiencies, proposing effective business, technical, or blended solutions. Develop process flows, context diagrams, and data flow diagrams to document current processes and propose modifications. Discover and meticulously document requirements and user stories with a focus on improving both business and technical processes. Decompose requirements into Epics and Features, creating clear and actionable user stories that can be easily understood and implemented by technical teams. Use progressive elaboration to map stories to technical design specifications. Support the Product Owner in maintaining the product backlog, grouping related user stories into Themes, and documenting dependencies. Create conceptual prototypes and mock-ups to visualize proposed solutions and enhance stakeholder understanding. Propose cost-effective solutions, rigorously testing their feasibility for both business and technical compatibility. Define test objectives, create test plans and cases, execute tests (including regression testing), and facilitate User Acceptance Testing (UAT) with the business. Keep Project Managers and Scrum Masters informed of the progress of testing activities. Qualifications: Required: Advanced understanding of enterprise data management concepts and tools. Minimum of 10 years of experience delivering business and systems analysis artifacts. 5+ years of experience as an Agile Business Analyst with a strong understanding of Scrum concepts and methodology. Proven experience in organizing and maintaining Product and Sprint backlogs. Proficiency in translating client and product strategy requirements into application requirements and user stories. Expertise in defining acceptance criteria and managing the acceptance process with development teams. Experience with large, multi-module enterprise systems. Proficiency with Microsoft Office products (Word, Excel, Access, Outlook, Visio, PowerPoint, Project Server). Experience with Application Lifecycle Management (ALM). Exceptional written and oral communication skills, with a proven ability to work well with a diverse set of peers and customers. Preferred: Certified Business Analysis Professional (CBAP) PMI \u2013 Professional in Business Analysis (PMI-PBA) PMI \u2013 Agile Certified Practitioner (PMI-ACP) Experience using Azure DevOps or Jira for agile software development and work item tracking. Experience with automated testing tools such as TestComplete, Cucumber, or Selenium.",
        "source": "Email",
        "date_posted": "2024-10-23 11:08:22-05:00",
        "unique_id": "192ba5fba0cbb4dd",
        "emp_type": [
            "contract",
            "third party"
        ],
        "tag": "Business Analyst"
    }
]