[
    {
        "company": "TEK Inspirations LLC",
        "job_title": "Java Developer",
        "location": "Lansing, MI, USA",
        "full_location": {
            "city": "Lansing",
            "state": "MI",
            "country": "USA"
        },
        "job_details": {
            "employment_type": [
                "contract",
                "third party"
            ],
            "job_code": "",
            "experience_required": "12+ years",
            "degree_required": "Not specified",
            "visa_sponsorship": "No visa sponsorship",
            "notice_period": "Not specified",
            "duration": "Long Term",
            "rate": "Not specified"
        },
        "skills": {
            "core": [
                "Java",
                "SQL",
                "Java JEE",
                "Spring/SpringBoot Framework",
                "Angular",
                "React JS"
            ],
            "primary": [
                "Eclipse",
                "STS",
                "PL/SQL",
                "JavaScript",
                "AWS",
                "Databricks",
                "Elastic search"
            ],
            "secondary": [],
            "all": [
                "Java",
                "SQL",
                "Java JEE",
                "Spring/SpringBoot Framework",
                "Angular",
                "React JS",
                "Eclipse",
                "STS",
                "PL/SQL",
                "JavaScript",
                "AWS",
                "Databricks",
                "Elastic search"
            ],
            "with_experience": [
                "Java (12+ years)",
                "SQL (12+ years)",
                "Java JEE (8+ years)",
                "Angular/React JS (5+ years)",
                "AWS (5+ years)"
            ]
        },
        "job_type": [
            "onsite"
        ],
        "contact_person": "Anshika Shukla",
        "email": "anshika.shukla@tekinspirations.com",
        "jd": "From: Anshika Shukla, TEK Inspirations LLC anshika.shukla@tekinspirations.com Reply to: anshika.shukla@tekinspirations.com Job Description -MUST HAVE PRIOR STATE EXPERIENCE IT IS MANADOTRY Job Title: Java DeveloperLocation: Lansing, MichiganLong Term Contract PositionMUST HAVE PRIOR STATE EXPERIENCE AN DWILLING TO RELOCATE TO MICHIGAN visa: NO OPT AND CPTMOI;SKYPEOpen RateTop Skills & Years of Experience:\u2022 12+ years developing complex computer systems using Java.\u2022 12+ years developing complex computer systems using java IDEs such as Eclipse, STS\u2022 12+ years programming in SQL and/or PL/SQL.\u2022 8+ years programming using Java JEE Struts and JEE Spring/SpringBoot Framework 3.0.\u2022 5+ years in project development using Angular/React JS, JavaScript framework.\u2022 5+ years' experience with AWS, Databricks, and Elastic search. MUST HAVE PRIOR STATE EXPERIENCE AN DWILLING TO RELOCATE TO MICHIGAN Anshika ShuklaTechnical RecruiterTEK Inspirations LLC | 13573 Tabasco Cat Trail, Frisco, TX 75035E: anshika.shukla@tekinspirations.com",
        "source": "Email",
        "date_posted": "2024-10-23 16:05:32-05:00",
        "unique_id": "192bb8ef5e2fcb02",
        "emp_type": [
            "contract",
            "third party"
        ],
        "tag": "Java developer"
    }
]