[
    {
        "company": "ThothIT LLC",
        "job_title": "Solution Java Architect",
        "location": "Los Angeles, CA, USA",
        "full_location": {
            "city": "Los Angeles",
            "state": "CA",
            "country": "USA"
        },
        "job_details": {
            "employment_type": [
                "third party"
            ],
            "job_code": "",
            "experience_required": "Proven experience as a Architect (Java Fullstack)",
            "degree_required": "Not specified",
            "visa_sponsorship": "No visa sponsorship",
            "notice_period": "Not specified",
            "duration": "Not specified",
            "rate": "Not specified"
        },
        "skills": {
            "core": [
                "Java",
                "Spring Boot",
                "HTML",
                "CSS",
                "JavaScript",
                "SQL"
            ],
            "primary": [
                "Mybatis Framework",
                "jQuery"
            ],
            "secondary": [
                "Technical leadership",
                "Coaching",
                "Mentorship",
                "Code reviews",
                "Industry trends"
            ],
            "all": [
                "Java",
                "Spring Boot",
                "HTML",
                "CSS",
                "JavaScript",
                "SQL",
                "Mybatis Framework",
                "jQuery",
                "Technical leadership",
                "Coaching",
                "Mentorship",
                "Code reviews",
                "Industry trends"
            ]
        },
        "job_type": [],
        "contact_person": "Deepak Kumar",
        "email": "deepak@thothit.net",
        "jd": "From: kumar, ThothIT deepak@thothit.net Reply to: deepak@thothit.net Job Role : Solution Java Architect Location : Los Angeles CA (Need Local Candidate)Visa: Citizens Only who can obtain Public trustPOSTINGINTERVIEW PLANAPPROVAL\u2022 Proven experience as a Architect (Java Fullstack) and implement end-to- end solutions using different technologies.Ability to develop front end website architecture and back end website applicationsExperience in front-end languages and libraries (e.g. HTML/CSS, JavaScript, XML, jQuery)Experience in back-end languages (e.g. Java, Spring boot and any JavaScript frameworks)Familiarity with SQL, Mybatis Framework\u2022 Provide technical leadership to teammates through coaching and mentorshipMaintain high standards of software quality within the team byestablishing good practices and habits\u2022 Conduct code reviews and ensure adherence to coding standards. Identify and resolve technical issues and bottlenecks.Stay updated with the latest industry trends and technologies.. Collaborate with stakeholders to define project scope, objectives, anddeliverables.\u2022Ensure the successful delivery of projects within the defined timelines and budget. Unfeigned Regards Deepak KumarThothIT LLCEmail: deepak@thothit.net",
        "source": "Email",
        "date_posted": "2024-10-24 15:48:01-05:00",
        "unique_id": "192c06d7f68459ac",
        "emp_type": [
            "third party"
        ],
        "tag": "Java developer"
    }
]