[
    {
        "company": "GVR Infotek",
        "job_title": ".Net Developer with Apriso and Nuget",
        "location": "New York, NY, USA",
        "full_location": {
            "city": "New York",
            "state": "NY",
            "country": "USA"
        },
        "job_details": {
            "employment_type": [
                "full-time",
                "third party"
            ],
            "job_code": "",
            "experience_required": "8+ years",
            "degree_required": "Not specified",
            "visa_sponsorship": "Must have existing work authorization",
            "notice_period": "Not specified",
            "duration": "6+ months",
            "rate": "Not specified"
        },
        "skills": {
            "core": [
                "Apriso",
                "NuGet",
                ".NET",
                "C#",
                "Oracle DB"
            ],
            "primary": [
                ".NET MVC",
                "WebAPI",
                "AngularJS2",
                "MS SQL",
                "query optimization",
                "data analysis"
            ],
            "secondary": [],
            "all": [
                "Apriso",
                "NuGet",
                ".NET",
                "C#",
                "Oracle DB",
                ".NET MVC",
                "WebAPI",
                "AngularJS2",
                "MS SQL",
                "query optimization",
                "data analysis"
            ]
        },
        "job_type": [
            "onsite"
        ],
        "contact_person": "Vikash Kumar",
        "email": "vikash.kumar@gvrinfotek.com",
        "jd": "From: vikash kumar, gvr infotek vikash.kumar@gvrinfotek.com Reply to: vikash.kumar@gvrinfotek.com .Net Developer with Apriso and NugetClient Banking DomainLocation: New York ( Onsite )Duration: 6 + MonthInterview: VirtualVisa: GC, USC, H4EADMust Have:Must have DL/VISA COPYNeed candidate local to New York Job title : .Net Developer with Apriso and Nuget Mandatory skill : Apriso and Nuget Required Skills: 8 + years of experience in software development/engineering projects with implementation experience across full lifecycle.Use the GUI-based or NuGet Package Manager console to add, update, remove, or restore packages to your project.5 years if exerience with .Net MVC, Oracle DB, and Apriso.5 years of solid experience with the .NET platform, Enterprise application development5 years of solid programming experience with one or more of the following (C#,.Net, WebAPI, AngularJS2)Experience in MS SQL, Oracle DB is required and good knowledge in query optimization and data analysis is required Regards,Vikash KumarIT Recruiter\u2709\ufe0f Email: vikash.kumar@gvrinfotek.com\ud83c\udfe0 Address: 13573 Tabasco Cat Trail, Frisco, TX 75035",
        "source": "Email",
        "date_posted": "2024-10-23 13:39:44-05:00",
        "unique_id": "192bacdbc80f8a5f",
        "emp_type": [
            "full-time",
            "third party"
        ],
        "tag": ".net developer"
    }
]