[
    {
        "company": "GVR Infotek",
        "job_title": "Scrum Master",
        "location": "Irving, TX, USA",
        "full_location": {
            "city": "Irving",
            "state": "TX",
            "country": "USA"
        },
        "job_details": {
            "employment_type": [
                "full-time",
                "third party"
            ],
            "experience_required": "5-8+ years",
            "degree_required": "Not specified",
            "visa_sponsorship": "Not specified",
            "notice_period": "Not specified",
            "duration": "Not specified",
            "rate": "Not specified"
        },
        "skills": {
            "core": [
                "Scrum Master",
                "Project Management",
                "SAFe Agile",
                "Agile principles",
                "Scrum tools"
            ],
            "primary": [
                "Data marts",
                "Data warehouse",
                "IT project delivery",
                "Microsoft Project",
                "Microsoft 365"
            ],
            "secondary": [
                "Release Backlog",
                "Sprint Backlog",
                "Burndown",
                "Velocity",
                "User Stories",
                "Complexity",
                "Estimating",
                "Story Boarding/Mapping",
                "Definition of Done",
                "SAFe Release Train Engineer (RTE) certification",
                "Certified Scrum Practitioner (CSP)",
                "Certified Scrum Coach (CSC)"
            ],
            "all": [
                "Scrum Master",
                "Project Management",
                "SAFe Agile",
                "Agile principles",
                "Scrum tools",
                "Data marts",
                "Data warehouse",
                "IT project delivery",
                "Microsoft Project",
                "Microsoft 365",
                "Release Backlog",
                "Sprint Backlog",
                "Burndown",
                "Velocity",
                "User Stories",
                "Complexity",
                "Estimating",
                "Story Boarding/Mapping",
                "Definition of Done",
                "SAFe Release Train Engineer (RTE) certification",
                "Certified Scrum Practitioner (CSP)",
                "Certified Scrum Coach (CSC)"
            ]
        },
        "job_type": [
            "hybrid"
        ],
        "contact_person": "Kartik Mahajan",
        "email": "kartik.mahajan@gvrinfotek.com",
        "jd": "From: Kartik Mahajan, GVR Infotek kartik.mahajan@gvrinfotek.com Reply to: kartik.mahajan@gvrinfotek.com Role: Scrum MasterLocation: Irving, TX Need Local Candidates only within 50 milesDay 1 Hybrid Onsite LinkedIn id is must (Should not been created recently, at least 6 Years old in case of senior candidates) Job Summary: Responsibilities:The ideal candidate for this position will have at least 5-8+ years of Scrum Master experience and 5 years Project Management experience in Software DevelopmentSAFe Agile Experience, Oversee one or more ART\u2019s (and the SAFe framework) associated with the initiatives to ensure that its functioning and delivering on track.Strong understanding of Agile principles and methodologies (Scrum/Lean/Kanban).Strong understanding of Scrum tools and concepts (Release Backlog, Sprint Backlog, Burndown, Velocity, User Stories, Complexity, Estimating, Story Boarding/Mapping, Definition of Done, etc.)Experience with Data marts and Data warehouseExperience leading IT project delivery with experience and knowledge of IT infrastructure, resource management, database design, and other systems support and development.Deep skills using project management tools, including Microsoft Project, Access, Word, Excel, Visio, and Microsoft 365SAFe Release Train Engineer (RTE) certification or equivalent experience is desired.Certified Scrum Practitioner (CSP) or Certified Scrum Coach (CSC) preferred Thanks & Regards, Kartik MahajanIT RecruiterGVR Infotek LLC: 13573 Tabasco Cat Trail, Frisco, TX 75035",
        "source": "Email",
        "date_posted": "2024-10-23 17:00:38-05:00",
        "unique_id": "192bbcc469f9ee22",
        "emp_type": [
            "full-time",
            "third party"
        ],
        "tag": "Scrum Master"
    }
]