[
    {
        "company": "Stellar IT Solutions",
        "job_title": "NCDOT - Technical Specialist- Junior - 749799",
        "location": "North Carolina, USA",
        "full_location": {
            "city": "",
            "state": "North Carolina",
            "country": "USA"
        },
        "job_details": {
            "employment_type": [
                "full-time",
                "third party"
            ],
            "job_code": "749799",
            "experience_required": "Not specified",
            "degree_required": "Not specified",
            "visa_sponsorship": "Not specified",
            "notice_period": "Not specified",
            "duration": "Long Term",
            "rate": "Not specified"
        },
        "skills": {
            "core": [
                "Databricks",
                "data engineering",
                "data warehouses",
                "data lakes",
                "Delta Lake architecture"
            ],
            "primary": [
                "Spark",
                "Databricks SQL",
                "PySpark",
                "Azure Databricks",
                "AWS",
                "Google Cloud",
                "Azure",
                "OLTP",
                "OLAP",
                "Apache Spark",
                "streaming products",
                "Azure Service Bus",
                "Databricks Delta Live Tables",
                "C#",
                "Java",
                "Python"
            ],
            "secondary": [],
            "all": [
                "Databricks",
                "data engineering",
                "data warehouses",
                "data lakes",
                "Delta Lake architecture",
                "Spark",
                "Databricks SQL",
                "PySpark",
                "Azure Databricks",
                "AWS",
                "Google Cloud",
                "Azure",
                "OLTP",
                "OLAP",
                "Apache Spark",
                "streaming products",
                "Azure Service Bus",
                "Databricks Delta Live Tables",
                "C#",
                "Java",
                "Python"
            ]
        },
        "job_type": [
            "onsite"
        ],
        "contact_person": "Pratheep Jayakumar",
        "email": "pratheepj@stellarit.com",
        "jd": "From: Pratheep Jayakumar, Stellar IT Solutions pratheepj@stellarit.com Reply to: pratheepj@stellarit.com Hi I represent Stellar IT Solutions a Global IT Solution provider headquartered in Rockville, MD with operations in the US and India. Stellar IT Solutions has over 15 years of IT and consulting experience to give cost effective solutions to many Fortune 500 companiesI saw your resume online and wanted to check your availability for a new project assignment that we have. Given below are a few details about the same.Position Title: NCDOT - Technical Specialist- Junior - 749799 Duration: Long TermLocation: North CarolinaJob Description:Excellent interpersonal skills as well as written and communication skills.Able to write clean, easy-to-follow Databricks notebook codeDeep knowledge of data engineering best practices, data warehouses, data lakes, and the Delta Lake architectureGood knowledge of Spark and Databricks SQL/PySparkTechnical experience with Azure Databricks and cloud providers like AWS, Google Cloud, or AzureIn-depth knowledge of OLTP and OLAP systems, Apache Spark, and streaming products like Azure Service BusGood practical experience with Databricks Delta Live TablesKnowledge of object-oriented languages like C#, Java, or Python Thanks & Regards,Pratheep JayakumarTechnical RecruiterEmail: pratheepj@stellarit.comRockville, MD | McLean, VA | Palo Alto, CAStellarIT.com | StellariDeaLabs.com",
        "source": "Email",
        "date_posted": "2024-10-23 13:42:23-05:00",
        "unique_id": "192bad0269505d80",
        "emp_type": [
            "full-time",
            "third party"
        ],
        "tag": "Azure Data Engineer"
    }
]