[
    {
        "company": "Orchid Solutions Inc",
        "job_title": "Project Manager",
        "location": "Richmond, VA, USA",
        "full_location": {
            "city": "Richmond",
            "state": "VA",
            "country": "USA"
        },
        "job_details": {
            "employment_type": [
                "third party"
            ],
            "job_code": "",
            "experience_required": "10 years",
            "degree_required": "Bachelor's degree",
            "visa_sponsorship": "Not specified",
            "notice_period": "Not specified",
            "duration": "Not specified",
            "rate": "Not specified"
        },
        "skills": {
            "core": [
                "PMP certification",
                "Agile project management",
                "Waterfall project management",
                "SaaS implementation",
                "Microsoft Project"
            ],
            "primary": [
                "Project management tools",
                "Interpersonal skills",
                "Analytical skills",
                "Organizational skills",
                "Decision-making skills"
            ],
            "secondary": [
                "Visio",
                "Office",
                "Process engineering",
                "Communication skills",
                "Team building"
            ],
            "all": [
                "PMP certification",
                "Agile project management",
                "Waterfall project management",
                "SaaS implementation",
                "Microsoft Project",
                "Project management tools",
                "Interpersonal skills",
                "Analytical skills",
                "Organizational skills",
                "Decision-making skills",
                "Visio",
                "Office",
                "Process engineering",
                "Communication skills",
                "Team building"
            ]
        },
        "job_type": [
            "onsite"
        ],
        "contact_person": "Krishna",
        "email": "krishna@os-inc.com",
        "jd": "From: Krishna, Orchid Solutions Inc krishna@os-inc.com Reply to: krishna@os-inc.com TITLE: Project ManagerLocation: Richmond, VA (Only local candidates)JOB DESCRIPTION*Local Richmond, VA candidates only please*Candidate MUST possess PMP certification through PMI. No other certifications qualify.*Candidate must also be able to work onsite 2-3day/week The Senior Project Manager will be responsible for successfully planning, organizing, and motivating diverse project teams throughout all phases of Waterfall, Agile, and Hybrid projects, and for delivering projects that provide exceptional value to the Commonwealth's internal and external stakeholders.RESPONSIBILITIES:\u2022 Coordinate vendors and consultants, and VDOT IT and business staff as assigned, in the execution of IT projects and related procurements.\u2022 Coordinate and oversee the development of proposals, statement of work, statement of requirements and RFP responses.\u2022 Assist in team development while holding teams accountable for their commitments and removing roadblocks to their work.\u2022 Facilitate multi-disciplinary teams in the development of plans, goals, objectives, policies, and procedures for completion of a project.\u2022 Oversee and manage execution and/or coordination of day-to-day project activities as required.\u2022 Manage working relationships with key stakeholders, including executive management, business management, vendors, project sponsors, suppliers, and technology management.\u2022 Set project goals that are consistent with technical objectives and the agency\u2019s overall technology strategy.\u2022 Track and communicate a project's progress from a schedule, cost, and risk perspective to the project team, customers, and project stakeholders.\u2022 Collaborate with technology leads and solution architects to incorporate agency best practices into project plans.\u2022 Drive consistent project delivery through the entire project lifecycle, including, execution of procurements, definition of project plans, resource allocation, management of project risks, scope, and schedule, delivery of value, and well-ordered transitions to operations.\u2022 Monitor progress by third-party vendors and define and measure their progress with metrics.\u2022 Develop and maintain project budget, plans, task lists, schedules, risks, and status, to include resource allocation and schedules.\u2022 Adhere to VDOT and VITA project management practices and governance requirements.\u2022 Exhibit significant emotional quotient (EQ) in handling project challenges and maintain a positive project culture in line with VDOT\u2019s mission and shared values.\u2022 Additional responsibilities as assigned.KNOWLEDGE, SKILLS, AND ABILITIES:\u2022 Strong experience in developing, executing, and managing cloud hosted SaaS implementation projects.\u2022 Strong experience leading the business and IT resources through the discovery and documentation of business and technical requirements in request for proposal and statement of requirement formats.\u2022 Strong analytical, organizational, and decision-making skills.\u2022 Exceptional interpersonal skills for collaborating and team building.\u2022 Exceptional verbal and written communication skills with the demonstrated ability to simplify and briefly, succinctly communicate complex issues to multiple audiences.\u2022 Ability to lead others to implement new approaches, systems, structures, and methods.\u2022 Ability to define and balance the competing demands for quality, scope, schedule, and cost.\u2022 Communicate timelines and expectations to technical and business staff.\u2022 Ability to analyze and document system processes.\u2022 Solid understanding of software development lifecycle models.\u2022 Exceptional knowledge of both Agile and Waterfall project management principles and practices. In addition, the ability to blend them together in the right proportions to fit a particular project and business environment.\u2022 Knowledge of process engineering and re-engineering techniques and practices.QUALIFICATIONS\u2022 The candidate must have a minimum of 10 years of experience managing large projects and a bachelor's degree.\u2022 Fluency in Project Management tools such as Microsoft Project, Visio, and Office required.\u2022 PMP Certification through PMI\u2022 Experience with VITA\u2019s Commonwealth Technology Portfolio (CTP) system and ECOS process is strongly preferred.\u2022 Experience with Project Management Office methodologies and practices is strongly preferred.\u2022 Experience with the core Commonwealth IT procurement processes (RFP, VITA Statewide Contract, and CAI SOW) is preferred.",
        "source": "Email",
        "date_posted": "2024-10-24 17:49:13-05:00",
        "unique_id": "192c17edbca71cb5",
        "emp_type": [
            "third party"
        ],
        "tag": "Project Manager"
    }
]