[
    {
        "company": "Paramount Software Solutions",
        "job_title": "Oracle Fusion HCM/Payroll Project Manager",
        "location": "Atlanta, GA, USA",
        "full_location": {
            "city": "Atlanta",
            "state": "GA",
            "country": "USA"
        },
        "job_details": {
            "employment_type": [
                "full-time",
                "third party"
            ],
            "experience_required": "10 to 15 years",
            "degree_required": "Not specified",
            "visa_sponsorship": "Not specified",
            "notice_period": "Not specified",
            "duration": "12 Months",
            "rate": "Not specified"
        },
        "skills": {
            "core": [
                "Project Management",
                "Oracle ERP",
                "Oracle Fusion",
                "HR Processes",
                "Communication Skills"
            ],
            "primary": [
                "Agile",
                "Waterfall",
                "Payroll",
                "Benefits Management",
                "Data Migration"
            ],
            "secondary": [
                "Microsoft Project",
                "Asana",
                "Jira",
                "Oracle Cloud Fusion Documentation",
                "Training Resources"
            ],
            "all": [
                "Project Management",
                "Oracle ERP",
                "Oracle Fusion",
                "HR Processes",
                "Communication Skills",
                "Agile",
                "Waterfall",
                "Payroll",
                "Benefits Management",
                "Data Migration",
                "Microsoft Project",
                "Asana",
                "Jira",
                "Oracle Cloud Fusion Documentation",
                "Training Resources"
            ]
        },
        "job_type": [
            "hybrid"
        ],
        "contact_person": "Zakir",
        "email": "zakir@paramountsoft.net",
        "jd": "From: Zakir, Paramount Software Solutions zakir@paramountsoft.net Reply to: zakir@paramountsoft.net Hi,Good day to you,One of my clients is looking for the below skillset, please share your profiles at the earliestJob Title: Oracle Fusion HCM/Payroll Project ManagerLocation: Hybrid- 130 Trinity Ave SW 5th Floor Atlanta, Georgia Duration: 12 MonthsJob Overview Summary: As a Project Manager for the Oracle Cloud Fusion HR (Human Resources) module, your role is crucial in overseeing the implementation and management of this module to ensure it meets the HR needs of your organization effectively. Oracle Cloud Fusion HR offers a comprehensive suite of tools designed to handle various aspects of human capital management, including recruitment, onboarding, performance management, and payroll.Responsibilities\u2022 Oversees the coordination of a large-scale program or multiple complex delivery projects.\u2022 Responsible for leading and direction of major projects, initiatives, functional groups or large project teams.\u2022 Lead for defined scope such as Business Case, Operating Model, and cost model.\u2022 Coordinate with various stakeholders including HR teams, IT departments, and external consultants to ensure alignment and collaboration.\u2022 Develops comprehensive program and project plans, including resources, deliverables and timing.\u2022 Accountable for delivering the initiative plan from conception to implementation.\u00b7 Shapes and leads programs that translate results from business diagnosis and planning into transformation programs / system integration projects, based on client priorities, and outcomes of the business case\u2022 Guides teams to address the right problems as efficiently and effectively as possible, applying insights from diverse projects, functional/industry, and prior system implementations, etc.\u2022 Develops and articulates points of view and thought leadership with client executives \u2022 Identifies and prioritizes value creation opportunities based on assessment activities and an understanding of client high level visions, performance gaps, and needsKey Responsibilities1.Requirements Gathering and Analysiso Engage with HR stakeholders to gather and document requirements, understanding their needs for managing workforce processes.o Analyze current HR workflows and determine how they can be optimized or restructured within the Oracle Cloud Fusion HR module.2.Customization and Configurationo Oversee the customization and configuration of the HR module to align with organizational needs, such as benefits management, talent acquisition, and performance tracking.o Ensure integration with other systems like payroll, finance, and recruitment tools as needed.3.Testing and Quality Assuranceo Develop test plans and manage the testing process to ensure the HR module functions as expected and meets organizational requirements.o Address and resolve any issues discovered during testing to ensure a smooth transition.4.Training and Change Managemento Organize and oversee training programs for HR staff and end-users to ensure they are proficient in using the new system.o Manage change management processes to support the transition to the new HR system, including communicating changes and benefits to employees.5.Data Migration and Integrationo Plan and execute the migration of existing HR data into the new system, ensuring data integrity and accuracy.o Manage the integration of the HR module with other Oracle Cloud modules or third-party applications.6.Ongoing Support and Optimizationo Provide ongoing support to users post-implementation, addressing any issues or challenges they encounter.o Continuously monitor system performance and make recommendations for improvements or optimizations.7.Compliance and Reportingo Ensure that the HR module complies with relevant legal and regulatory requirements.o Generate and analyze reports related to HR metrics, such as employee turnover, recruitment effectiveness, and compliance.Skills and Qualifications\u00b7Project Management Expertise: Proficiency in project management methodologies (e.g., Agile, Waterfall) to effectively lead and manage the implementation process.\u00b7ERP Expertise: 10 to 15 years of Oracle ERP with at least 5 years of Oracle Fusion implementation experience in Human Capital Management (HCM), Payroll and Benefits.\u00b7HR Knowledge: Understanding of HR processes and best practices, including talent management, payroll, and employee relations.\u00b7Technical Acumen: Familiarity with Oracle Cloud Fusion HR functionalities and integration capabilities.\u00b7Communication Skills: Strong ability to communicate with stakeholders across different departments, ensuring that their needs and concerns are addressed.\u00b7Problem-Solving Abilities: Capability to identify and resolve issues that arise during implementation and operation of the HR module.Tools and Resources\u00b7Oracle Cloud Fusion Documentation: Use Oracle\u2019s official documentation and support resources for guidance on system capabilities and best practices.\u00b7Project Management Tools: Utilize tools such as Microsoft Project, Asana, or Jira to manage tasks, track progress, and ensure timely delivery.\u00b7Training Resources: Access Oracle\u2019s training materials and resources to stay updated on system features and enhancements.",
        "source": "Email",
        "date_posted": "2024-10-24 09:49:11-05:00",
        "unique_id": "192bf24e5a76f246",
        "emp_type": [
            "full-time",
            "third party"
        ],
        "tag": "Project Manager"
    }
]