[
    {
        "company": "gstachyon",
        "job_title": "Java Full Stack Developer",
        "location": "Austin, TX, USA",
        "full_location": {
            "city": "Austin",
            "state": "TX",
            "country": "USA"
        },
        "job_details": {
            "employment_type": [
                "remote",
                "third party"
            ],
            "experience_required": "15+ years",
            "degree_required": "Degree in Computer Science, Statistics or relevant field",
            "visa_sponsorship": "Not specified",
            "notice_period": "Not specified",
            "duration": "Not specified",
            "rate": "Not specified"
        },
        "skills": {
            "core": [
                "Java",
                "React.js",
                "HTML",
                "CSS",
                "JavaScript"
            ],
            "primary": [
                "Oracle",
                "SQL Server",
                "MySQL",
                "Snowflake",
                "DevOps",
                "AWS Amplify",
                "AWS Lambda",
                "Amazon API Gateway"
            ],
            "secondary": [
                "Excellent communication",
                "Teamwork skills"
            ],
            "all": [
                "Java",
                "React.js",
                "HTML",
                "CSS",
                "JavaScript",
                "Oracle",
                "SQL Server",
                "MySQL",
                "Snowflake",
                "DevOps",
                "AWS Amplify",
                "AWS Lambda",
                "Amazon API Gateway",
                "Excellent communication",
                "Teamwork skills"
            ]
        },
        "job_type": [
            "remote"
        ],
        "contact_person": "Narsimha",
        "email": "narsimha@gstachyon.com",
        "jd": "From: Narsimha, gstachyon narsimha@gstachyon.com Reply to: narsimha@gstachyon.com Role:Java Full Stack DeveloperLocation:Austin Texas(Need Local)Position:RemoteExperience:15+ years Note : Candidates Must Previously Worked with Any of below State of Texas Agencies - At least 3-4 Years - No Other State Project Experience is Workable SKILLS:React.js, Oracle/SQL Server/MySQL, Snowflake, DevOps, AWS Amplify/Lambda, Amazon API Gateway experience JD :Proven experience as a Full Stack DeveloperCloud experience STRONGLY preferred.Proven front-end development experience STRONGLY preferred using HTML/CSS, Javascript, and React JS.Proven back-end development experience using Java STRONGLY preferred.Proven database development experience STRONGLY preferred using one or more relational databases such as Oracle, SQL Server, My SQL, Snowflake or similar.Dev Ops experience.Proven cloud web application development experience STRONGLY preferred, using AWS technologies such as AWS Amplify, AWS Lambda, Amazon API GatewayExcellent communication and teamwork skillsDegree in Computer Science, Statistics or relevant field.",
        "source": "Email",
        "date_posted": "2024-10-23 12:05:55-05:00",
        "unique_id": "192ba77d89a47e2d",
        "emp_type": [
            "remote",
            "third party"
        ],
        "tag": "Java developer"
    }
]