[
    {
        "company": "Siriinfo",
        "job_title": "Oracle HCM Business Analyst",
        "location": "USA",
        "full_location": {
            "city": "",
            "state": "",
            "country": "USA"
        },
        "job_details": {
            "employment_type": [
                "contract",
                "third party"
            ],
            "job_code": "",
            "experience_required": "Not specified",
            "degree_required": "Not specified",
            "visa_sponsorship": "Not specified",
            "notice_period": "Not specified",
            "duration": "Not specified",
            "rate": "Not specified"
        },
        "skills": {
            "core": [
                "Oracle HCM modules",
                "Requirements Gathering",
                "Analytical skills",
                "Communication skills",
                "Process mapping"
            ],
            "primary": [
                "Oracle Cloud HCM",
                "Problem-solving skills",
                "Interpersonal skills",
                "Documentation"
            ],
            "secondary": [
                "Certification in Oracle HCM modules",
                "Experience in a consulting or implementation environment"
            ],
            "all": [
                "Oracle HCM modules",
                "Requirements Gathering",
                "Analytical skills",
                "Communication skills",
                "Process mapping",
                "Oracle Cloud HCM",
                "Problem-solving skills",
                "Interpersonal skills",
                "Documentation",
                "Certification in Oracle HCM modules",
                "Experience in a consulting or implementation environment"
            ],
            "with_experience": [
                "Oracle HCM modules",
                "Oracle Cloud HCM"
            ]
        },
        "job_type": [
            "remote"
        ],
        "contact_person": "Anandan Akshay Kumar",
        "email": "akshay.kumar@siriinfo.com",
        "jd": "From: Anandan Akshay Kumar, Siriinfo akshay.kumar@siriinfo.com Reply to: akshay.kumar@siriinfo.com Oracle HCM Business AnalystRemoteContract Mandatory Experience - Certification in Oracle HCM modulesExperience with Oracle Cloud HCMOracle HCM modules, including Hire, Onboard, Benefits, Rewards, Transfers, and Offboard Job Summary:Client is seeking a skilled Oracle HCM Business Analyst to join our team. The ideal candidate will have a strong understanding of Oracle HCM modules and be able to effectively gather, analyze, and document business requirements. This role will play a crucial part in ensuring successful implementations and ongoing support of Oracle HCM solutions.Responsibilities:Requirements Gathering: Gather, build, and document detailed process requirements (global and regional) for various Oracle HCM modules, including Hire, Onboard, Benefits, Rewards, Transfers, and Offboard.Design Workshops: Prepare for design workshops by gathering necessary documentation, data, and scheduling meetings. Take detailed notes during workshops.Testing and Launch Readiness: Support user and agent testing, ensuring that the system meets business requirements and is ready for launch. Assist in developing cutover plans.Reporting and Analytics: Define reporting and analytics requirements for processes within Oracle HCM.Communication and Enablement: Build communications, training materials, knowledge bases, and enablement resources for delivery teams.Content Creation: Design and update employee-facing articles, help text, notifications, and other communication materials.Qualifications:Proven experience as an Oracle HCM Business AnalystStrong understanding of Oracle HCM modules, including Hire, Onboard, Benefits, Rewards, Transfers, and OffboardExcellent analytical and problem-solving skillsStrong communication and interpersonal skillsAbility to work independently and as part of a team Experience with process mapping and documentationKnowledge of project management methodologiesPreferred Qualifications:Certification in Oracle HCM modulesExperience with Oracle Cloud HCMExperience in a consulting or implementation environmentIf you are a highly motivated and skilled Oracle HCM Business Analyst looking for a challenging and rewarding opportunity, we encourage you to apply. Regards---------------------------------Anandan Akshay KumarTechnical Recruiter \u2013 US Recruitment akshay.kumar@siriinfo.com",
        "source": "Email",
        "date_posted": "2024-10-23 17:27:38-05:00",
        "unique_id": "192bbe76cd9a2d91",
        "emp_type": [
            "contract",
            "third party"
        ],
        "tag": "Business Analyst"
    }
]