[
    {
        "company": "Stellent IT",
        "job_title": "Workday Business System Analyst",
        "location": "USA",
        "full_location": {
            "city": "",
            "state": "",
            "country": "USA"
        },
        "job_details": {
            "employment_type": [
                "contract",
                "third party"
            ],
            "job_code": "",
            "experience_required": "3+ years",
            "degree_required": "BS or MS in Information Systems, Computer Science, Business Management or equivalent",
            "visa_sponsorship": "Not specified",
            "notice_period": "Not specified",
            "duration": "15 months",
            "rate": "Not specified"
        },
        "skills": {
            "core": [
                "Workday Implementation",
                "Integration experience",
                "Excellent verbal and written English skills"
            ],
            "primary": [
                "Business Systems Analyst",
                "3+ years experience",
                "Proficient in Excel",
                "Ability to multi-task",
                "Data governance",
                "Master data management"
            ],
            "secondary": [
                "Soft skills",
                "Communication with business leaders",
                "Documenting requirements"
            ],
            "all": [
                "Workday Implementation",
                "Integration experience",
                "Excellent verbal and written English skills",
                "Business Systems Analyst",
                "3+ years experience",
                "Proficient in Excel",
                "Ability to multi-task",
                "Data governance",
                "Master data management",
                "Soft skills",
                "Communication with business leaders",
                "Documenting requirements"
            ]
        },
        "job_type": [
            "remote"
        ],
        "contact_person": "Shubham Singh",
        "email": "shubham@stellentit.com",
        "jd": "From: Shubham Singh, Stellentit shubham@stellentit.com Reply to: shubham@stellentit.com USC/GC OnlyEST Timezone Preferred DescriptionIMPLEMENTED WORKDAY FROM START TO FINISH AT LEAST TWICE (full cycle ERP/HCM implementation experience)COMMUNICATION IS A MUST. HAS COMMUNICATED WITH BUSINESS LEADERS IN HR, BUSINESS, AND TECHNOLOGY JOB DetailsJob TitleBSAC/CTH/Perm + DurationContract 15 monthsStart date & Location Remote .east coast preferredInterview Process3 roundsPosition Notes BSAWorkday Implementation experienceAt least a couple of implementationsDone integrationsAbility to talk to the business, solicit requirements and document them wellHow do these requirements impact this process and that processWill sit in Digital and report to her for nowDoesn't have to be super technical, more functional and business process orientedHR is not an easy organization to support-- have very high expectations and they don't know the possibilitiesSoft skills:Need to be able to tell someone the way things can be done and why to switch things upNeed to have excellent soft skills Requirements: Experience3+ years as a Business Systems Analyst5 + years in ITWorkday experience a plusIntegration experiences a mustExcellent verbal and written English skillsEducationBS or MS in Information Systems, Computer Science, Business Management or equivalentAdditional RequirementsProficient in ExcelAbility to multi-task and manage concurrent tasksExperience with data governance, master data management and data integrations a plus Shubham Singh- Sr. Technical RecruiterEmail- shubham@stellentit.com STELLENT IT \u2013 A Nationally Recognized Minority Certified Enterprise\"Happiness can be found, even in the darkest of times, if one only remembers to turn on the light.\" - JK Rowling",
        "source": "Email",
        "date_posted": "2024-10-24 09:10:56-05:00",
        "unique_id": "192beffdb3bf61ce",
        "emp_type": [
            "contract",
            "third party"
        ],
        "tag": "Business Analyst"
    }
]