[
    {
        "company": "Siri InfoSolutions",
        "job_title": "Business Analyst (Banking Domain)",
        "location": "Raleigh, NC, USA",
        "full_location": {
            "city": "Raleigh",
            "state": "NC",
            "country": "USA"
        },
        "job_details": {
            "employment_type": [
                "contract",
                "third party"
            ],
            "experience_required": "8+ years",
            "degree_required": "Not specified",
            "visa_sponsorship": "No visa sponsorship",
            "notice_period": "Not specified",
            "duration": "6+ months",
            "rate": "Not specified"
        },
        "skills": {
            "core": [
                "banking BA",
                "agile concepts",
                "testing",
                "story writing in JIRA",
                "web application experience"
            ],
            "primary": [
                "strong communication skills",
                "inter-personal skills",
                "agile ceremonies"
            ],
            "secondary": [],
            "all": [
                "banking BA",
                "agile concepts",
                "testing",
                "story writing in JIRA",
                "web application experience",
                "strong communication skills",
                "inter-personal skills",
                "agile ceremonies"
            ]
        },
        "job_type": [
            "onsite"
        ],
        "contact_person": "Naveen Miyyadi",
        "email": "naveen.m@siriinfo.com",
        "jd": "HelloGreetings from Siri InfoSolutions\u2026We have an immediate position, please find the below details\u2026 Role: Business Analyst (Banking Domain)Location: Raleigh, NC (ONLY LOCALS)Duration: 6+ months ContractNo H4EAD/GC/OPT/CPTExperience: 8+ years Job Description:\u2022 4+ yrs experience as banking BA with exposure to DB, agile concepts, testing1Long term\u2022 Banking + digital (web application experience)\u2022 Strong background with agile ceremonies \u2013 US Dev, Testing, Delivery\u2022 Strong communication and inter-personal skills\u2022 Well versed with story writing in JIRA or Rally or similar systems Thanks & Regards,Naveen Miyyadi | Team Lead | Email: naveen.m@siriinfo.com | Phone : 732-797-9367Siri InfoSolutions Inc, 3 Ethel Rd, Suite # 302, Edison NJ 08817. CPUC CertifiedDisclaimer: We respect your online privacy. If you would like to be removed from our mailing list please reply with ",
        "source": "Email",
        "date_posted": "2024-10-23 11:43:06-05:00",
        "unique_id": "192ba643cf6a6ccd",
        "emp_type": [
            "contract",
            "third party"
        ],
        "tag": "Business Analyst"
    }
]