[
    {
        "company": "Parin Technologies",
        "job_title": "SCRUM MASTER",
        "location": "Richmond, VA, USA",
        "full_location": {
            "city": "Richmond",
            "state": "VA",
            "country": "USA"
        },
        "job_details": {
            "employment_type": [
                "contract",
                "third party"
            ],
            "job_code": "",
            "experience_required": "Not specified",
            "degree_required": "Not specified",
            "visa_sponsorship": "Not specified",
            "notice_period": "Not specified",
            "duration": "7 Months",
            "rate": "Not specified"
        },
        "skills": {
            "core": [
                "Agile project management",
                "Scrum",
                "Kanban",
                "Project Management tools",
                "Agile collaboration tools"
            ],
            "primary": [
                "Software development life cycle",
                "Interpersonal skills",
                "Analytical skills",
                "Organizational skills",
                "Decision-making skills"
            ],
            "secondary": [
                "Mentoring",
                "Coaching",
                "Team building",
                "Business process analysis",
                "PMP Certification",
                "CSM Certification",
                "SAFe framework",
                "SAFe Certification"
            ],
            "all": [
                "Agile project management",
                "Scrum",
                "Kanban",
                "Project Management tools",
                "Agile collaboration tools",
                "Software development life cycle",
                "Interpersonal skills",
                "Analytical skills",
                "Organizational skills",
                "Decision-making skills",
                "Mentoring",
                "Coaching",
                "Team building",
                "Business process analysis",
                "PMP Certification",
                "CSM Certification",
                "SAFe framework",
                "SAFe Certification"
            ]
        },
        "job_type": [
            "hybrid"
        ],
        "contact_person": "Niki",
        "email": "niki@parintec.com",
        "jd": "From: Niki, Parin Technologies niki@parintec.com Reply to: niki@parintec.com Title: SCRUM MASTERLocation: Richmond, VAHybrid - 3 days ONSITE every weekDuration: 7 MonthsInterview: Both Webcam and In PersonJob Description:\u2022Drives consistent project delivery through the entire project lifecycle, including project plans, release plans, resource allocation, and management of project risks, scope, schedule, and delivery of value.\u2022Coordinates Agile Ceremonies such as Sprint Planning, Daily Standups, Retrospectives, Sprint Demos, Story Refinement, and Release Planning.\u2022Tracks and communicates project\u2019s progress from a schedule, cost, and risk perspective to the project team, stakeholders, and management.\u2022Establishes an environment where the teams can be effective and helps removing obstacles.\u2022Protects the team from outside interruptions and distractions.\u2022Ensures a good relationship between the team and product owner as well as others outside the team.\u2022Tracks and reports team velocity and other project metrics.\u2022Promotes continuous improvement and helps teams to increase productivity.\u2022Helps Product Owner and team with Product backlog management.\u2022Ensures the teams are practicing core Agile principles.\u2022Adheres to project management practices as defined.\u2022Additional responsibilities as assigned.Knowledge, Skills, and Abilities:\u2022Solid understanding of software development life cycle models as well as expert knowledge of Agile project management principles and practices.\u2022Ability to work with customers, understand their business practices and manage their expectations.\u2022Ability to set clear performance standards and hold team members accountable, while keeping team engaged and on track.\u2022Ability to help Product Owners to create and prioritize Product Backlog.\u2022Strong interpersonal skills including mentoring, coaching, collaborating, and team building.\u2022Strong analytical, organizational and decision-making skills.\u2022Ability to analyze and document business and system processes.\u2022Ability to balance the competing demands for quality, scope, schedule, and cost.\u2022Well-versed with Scrum and Kanban Agile methodologies.\u2022Expertise with Project Management tools such as Microsoft Project, Visio, and MS Office.\u2022Experience with Agile collaboration tools such as Team Foundation Server, JIRA, Version One, etc.\u2022PMP and CSM Certifications required.\u2022Experience with the SAFe framework required.\u2022SAFe Certification preferred.",
        "source": "Email",
        "date_posted": "2024-10-23 09:33:26-05:00",
        "unique_id": "192ba29a86be46df",
        "emp_type": [
            "contract",
            "third party"
        ],
        "tag": "Scrum Master"
    }
]