[
    {
        "company": "WISE EQUATION SOLUTION INC",
        "job_title": "Senior Java Backend Developer",
        "location": "USA",
        "full_location": {
            "city": "",
            "state": "",
            "country": "USA"
        },
        "job_details": {
            "employment_type": [
                "third party"
            ],
            "job_code": "",
            "experience_required": "Seven (7) years",
            "degree_required": "Not specified",
            "visa_sponsorship": "Not specified",
            "notice_period": "Not specified",
            "duration": "Not specified",
            "rate": "Not specified"
        },
        "skills": {
            "core": [
                "Java",
                "Spring Boot",
                "Microservices Architecture",
                "RESTful APIs",
                "SQL"
            ],
            "primary": [
                "Node.js",
                "JUnit",
                "GitHub",
                "AWS",
                "JSP",
                "OAuth2.0",
                "JWT",
                "Key Cloak"
            ],
            "secondary": [
                "ServiceNow",
                "Splunk",
                "Dynatrace",
                "Spring MVC",
                "Spring Data",
                "Spring Security",
                "Spring Batch",
                "Database Management",
                "Hibernate",
                "SOAP",
                "File I/O",
                "Maven",
                "NPM",
                "GitHub Actions",
                "HTML",
                "CSS",
                "JavaScript",
                "Angular",
                "IntelliJ",
                "Eclipse",
                "Bash",
                "PowerShell",
                "Python",
                "Teradata Retail Data Model"
            ],
            "all": [
                "Java",
                "Spring Boot",
                "Microservices Architecture",
                "RESTful APIs",
                "SQL",
                "Node.js",
                "JUnit",
                "GitHub",
                "AWS",
                "JSP",
                "OAuth2.0",
                "JWT",
                "Key Cloak",
                "ServiceNow",
                "Splunk",
                "Dynatrace",
                "Spring MVC",
                "Spring Data",
                "Spring Security",
                "Spring Batch",
                "Database Management",
                "Hibernate",
                "SOAP",
                "File I/O",
                "Maven",
                "NPM",
                "GitHub Actions",
                "HTML",
                "CSS",
                "JavaScript",
                "Angular",
                "IntelliJ",
                "Eclipse",
                "Bash",
                "PowerShell",
                "Python",
                "Teradata Retail Data Model"
            ],
            "with_experience": [
                "Java (7+ years)",
                "Spring Boot",
                "Microservices Architecture",
                "RESTful APIs"
            ]
        },
        "job_type": [
            "remote"
        ],
        "contact_person": "Himanshu Pandey",
        "email": "himanshu@wiseq.net",
        "jd": "From: Himanshu Pandey, WISE EQUATION SOLUTION INC himanshu@wiseq.net Reply to: himanshu@wiseq.net Job Title: Senior Java Backend Developer with Node jsWorksite Address: RemoteJob Description:Develop and maintain Java-based applications using core Java and advanced Java (Java 17).\u00b7Design and implement microservices using Spring Boot and other relevant frameworks.\u00b7Build and consume RESTful APIs and web services.\u00b7Integrate with databases, ensuring performance optimization (e.g., SQL databases like PostgreSQL, Oracle).\u00b7Write unit and integration tests using JUnit, TestNG, Mockito, or other testing frameworks.\u00b7Develop SQL queries and analyze data to support application development and production issues.\u00b7Implement object-oriented design principles and patterns for scalable and maintainable codebases.\u00b7Ensure adherence to clean code principles and write reusable, modular code.\u00b7Troubleshoot and debug Java applications, ensuring optimal performance and security.\u00b7Participate in code reviews and provide constructive feedback to peers.\u00b7Follow Agile methodologies (Scrum) and participate in sprints, daily stand-ups.\u00b7Use version control systems like GitHub for source code management.\u00b7Implement and manage CI/CD pipelines using GitHub Actions.\u00b7Collaborate with DevOps teams for cloud deployment and infrastructure management (AWS).\u00b7Design, configure, and implement Spring Batch jobs for processing large datasets and scheduling tasks.\u00b7Implement dynamic web pages and views using JSP (Java Server Pages).\u00b7Design and implement authentication and authorization mechanisms using Key Cloak for identity and access management, ensuring secure communication through OAuth2.0 and JWT tokens.\u00b7Leverage SAML/SSO integration for single sign-on and authentication. Experience and Technical Skills Required\u00b7Seven (7) years of experience in Java and modern technologies.\u00b7Previous experience using-Java (Java 17+) features such as records, sealed classes, switch expressions, pattern matching, and enhanced performance improvements-Node 16+-ServiceNow, Splunk, Dynatrace-Spring Framework (Spring Boot, Spring MVC, Spring Data, Spring Security, Spring Batch)-Microservices Architecture (Designing, developing, and deploying microservices)-Java Server Pages (creating dynamic web pages and integrating with back-end logic)-Database Management (PostgreSQL, Oracle and experience with ORM tools like Hibernate)-RESTful Web Services (API development, consumption, and integration)-Thorough understanding of REST, SOAP, Web services and API Communication protocols S/FTP/S, HTTP/S, File I/O etc.-Testing: JUnit, TestNG, Mockito-Version Control: GitHub-Build Tools: Maven, NPM-CI/CD: GitHub Actions-Cloud Platforms: Amazon Web Services-Frontend Integration: Understanding of HTML, CSS, JavaScript, and Angular 17+-IDE: IntelliJ, Eclipse etc.-Security & Identity Management: Experience with OAuth2.0, JWT tokens, and SAML/SSO integration for authentication and authorization-Key Cloak Integration: Integrate Key Cloak with Java-based applications and services for API authentication-Scripting Languages: Proficiency in one or more scripting languages, such as Bash, or PowerShell, PythonTeradata Retail Data Model (RDM): RDM systems experience is a plus",
        "source": "Email",
        "date_posted": "2024-10-24 16:19:53-05:00",
        "unique_id": "192c0877c2452865",
        "emp_type": [
            "third party"
        ],
        "tag": "Java developer"
    }
]