[
    {
        "company": "Nitya software solution",
        "job_title": ".Net Core Developer API Developer -Need only USC -Local to GA",
        "location": "Atlanta, GA, USA",
        "full_location": {
            "city": "Atlanta",
            "state": "GA",
            "country": "USA"
        },
        "job_details": {
            "employment_type": [
                "contract",
                "third party"
            ],
            "experience_required": "7+ years",
            "degree_required": "Not specified",
            "visa_sponsorship": "Not specified",
            "notice_period": "Not specified",
            "duration": "4-month Right to hire C2H",
            "rate": "Not specified"
        },
        "skills": {
            "core": [
                "C#",
                ".Net Core",
                "Microservices Architecture",
                "ASP.Net WebAPI",
                "SQL"
            ],
            "primary": [
                "ReactJS",
                "Responsive design",
                "Strong understanding of design patterns",
                "Dependency injection"
            ],
            "secondary": [
                "Banking/financial background",
                "Experience with DevOps",
                "Team Lead experience"
            ],
            "all": [
                "C#",
                ".Net Core",
                "Microservices Architecture",
                "ASP.Net WebAPI",
                "SQL",
                "ReactJS",
                "Responsive design",
                "Strong understanding of design patterns",
                "Dependency injection",
                "Banking/financial background",
                "Experience with DevOps",
                "Team Lead experience"
            ],
            "with_experience": [
                "C# (7+ years)",
                ".Net Core",
                "Microservices Architecture",
                "ASP.Net WebAPI"
            ]
        },
        "job_type": [
            "hybrid"
        ],
        "contact_person": "Nitya",
        "email": "ryan@nityainc.com",
        "jd": "From: Nitya, Nitya software solution ryan@nityainc.com Reply to: ryan@nityainc.com Job Title: .Net Core Developer API Developer -Need only USC -Local to GALocation: RemoteWork Authentication: USCEmployment type: ContractJob Description:.Net Core Developer API DeveloperLocation : Hybrid (Atlanta, Birmingham)4-month Right to hire C2HJob Description:Our client is in the Financial/ Banking sector, and they are looking for a C# .Net Core Developer. This is for a crucial Banking and Finance project with the marketing and product team. They will be creating new features and enhancing old features for the web application. They are looking for a developer with at least 7+ years' experience and would love someone with familiarity with designing secure interfaces with either banking, financial service, or health care background.Required Skills:7+ years' experience as a Full Stack C# Net .Core DeveloperMust have experience in Microservices Architecture (RESTful and event-based)ASP.Net WebAPI experienceStrong understanding of design patterns (MVVM, etc), dependency injectionReactJS and Responsive design experienceSQL troubleshooting skillsBonus SkillsBanking/financial backgroundExperience with DevOps is a BIG bonus.Team Lead experience",
        "source": "Email",
        "date_posted": "2024-10-24 16:34:35-05:00",
        "unique_id": "192c0ee775a1fb6b",
        "emp_type": [
            "contract",
            "third party"
        ],
        "tag": ".net developer"
    }
]