[
    {
        "company": "LiveMindz",
        "job_title": "BA (Post Trade Processing)",
        "location": "Irvine, CA, USA",
        "full_location": {
            "city": "Irvine",
            "state": "CA",
            "country": "USA"
        },
        "job_details": {
            "employment_type": [
                "third party",
                "contract"
            ],
            "job_code": "",
            "experience_required": "5+ years",
            "degree_required": "Not specified",
            "visa_sponsorship": "Not specified",
            "notice_period": "Not specified",
            "duration": "Not specified",
            "rate": "Not specified"
        },
        "skills": {
            "core": [
                "IT Business Analyst",
                "Capital Markets",
                "Trade Life Cycle",
                "SDLC",
                "SQL"
            ],
            "primary": [
                "Business Requirements Gathering",
                "Functional Specification Writing",
                "Testing Approaches",
                "Data Mapping",
                "Gap Analysis"
            ],
            "secondary": [
                "UNIX",
                "XML",
                "SWIFT Standards",
                "Communication Skills",
                "Troubleshooting Skills"
            ],
            "all": [
                "IT Business Analyst",
                "Capital Markets",
                "Trade Life Cycle",
                "SDLC",
                "SQL",
                "Business Requirements Gathering",
                "Functional Specification Writing",
                "Testing Approaches",
                "Data Mapping",
                "Gap Analysis",
                "UNIX",
                "XML",
                "SWIFT Standards",
                "Communication Skills",
                "Troubleshooting Skills"
            ],
            "with_experience": [
                "IT Business Analyst (5+ years)",
                "SQL (Advanced)"
            ]
        },
        "job_type": [
            "hybrid"
        ],
        "contact_person": "Darshana Sakroo",
        "email": "darshanas@livemindz.com",
        "jd": "From: Darshana Sakroo, LiveMindz darshanas@livemindz.com Reply to: darshanas@livemindz.com BA (Post Trade Processing) hybrid for Irvine, CA C2C Job Description Technical Business Analyst to support the Trade Processing Systems Team in our Irvine, CA office. The candidate will work on enhancements for the DNS (Delivery Notification System) application for our monthly software releases and new applications for various clients. Responsibilities will include gathering business requirements, analyzing the requirements, writing specifications for developers, creation of test plans and system integration testing according to State Street\u2019s published Development Process Framework. This job will also require production support, monitoring of our systems during peak business volumes and quickly reacting to business needs while coordinating with technical staff to resolve technical issues. Finally, we seek someone with an aptitude for learning new things. Must Haves:\u2022 Minimum 5+ years of experience as IT Business analyst\u2022 Prior experience working in Capital Markets with Asset Management / Investment Banking organization knowledge preferred\u2022 Complete understanding of trade life cycle\u2022 Experience with all phases of the SDLC\u2022 Advanced knowledge of SQL: Sybase preferred\u2022 Demonstrated ability to work well with different business users and stakeholders groups\u2022 Gathering business requirements and writing functional specification documents \u2022 Experience with multiple testing approaches functional, regressions, integration and user testing\u2022 Ability to coordinate with onshore/offshore developers\u2022 Data mapping skills\u2022 Gap/Comparative analysis\u2022 Report analysis Nice to have skills\u2022 Basic knowledge of UNIX is a plus\u2022 Basic understanding of XML is a plus\u2022 Basic knowledge of SWIFT standards Communication skills & commitment\u2022 Excellent communication skills\u2022 Self-starter\u2022 Ability to work independently and on multiple tasks simultaneously\u2022 Strong troubleshooting skills Secondary Skills:Nice to have skills\u2022 Basic knowledge of UNIX is a plus\u2022 Basic understanding of XML is a plus\u2022 Basic knowledge of SWIFT standards",
        "source": "Email",
        "date_posted": "2024-10-23 15:35:32-05:00",
        "unique_id": "192bb3802ca60aaf",
        "emp_type": [
            "third party",
            "contract"
        ],
        "tag": "Business Analyst"
    }
]