[
    {
        "company": "SIRIINFO SOLUTIONS",
        "job_title": "Mortgage Business Analyst",
        "location": "McLean, VA, USA",
        "full_location": {
            "city": "McLean",
            "state": "VA",
            "country": "USA"
        },
        "job_details": {
            "employment_type": [
                "contract",
                "third party"
            ],
            "experience_required": "Not specified",
            "degree_required": "Not specified",
            "visa_sponsorship": "Not specified",
            "notice_period": "Not specified",
            "duration": "Not specified",
            "rate": "Not specified"
        },
        "skills": {
            "core": [
                "Mortgage experience",
                "Business analysis",
                "Requirement gathering",
                "Process/data flow design",
                "Technical spec design"
            ],
            "primary": [
                "Webservices/API",
                "Feasibility analysis",
                "UAT strategies/plans",
                "User acceptance testing",
                "Communication skills",
                "Analytical skills"
            ],
            "secondary": [
                "Manual testing",
                "Automation testing",
                "Customer-centric mindset",
                "Modern Delivery practices"
            ],
            "all": [
                "Mortgage experience",
                "Business analysis",
                "Requirement gathering",
                "Process/data flow design",
                "Technical spec design",
                "Webservices/API",
                "Feasibility analysis",
                "UAT strategies/plans",
                "User acceptance testing",
                "Communication skills",
                "Analytical skills",
                "Manual testing",
                "Automation testing",
                "Customer-centric mindset",
                "Modern Delivery practices"
            ]
        },
        "job_type": [
            "onsite"
        ],
        "contact_person": "Amit Singh",
        "email": "amit.singh@siriinfo.com",
        "jd": "From: Amit Singh, SIRIINFO SOLUTIONS amit.singh@siriinfo.com Reply to: amit.singh@siriinfo.com Job Title: Mortgage Business AnalystJob Type: ContractLocation: McLean, VA Should have strong Mortgage experience (preferably with Freddie or Fannie work exp)\u2022 Can interface between business and technical teams\u2022 Understands the end-to-end software development life cycle (SDLC)\u2022 Experience in:-Requirement gathering-Process/data flow design-Technical spec design (Webservices/API)-Business analysis-Translating business requirements to technical requirements-Defining project objectives-Feasibility analysis-Supporting development, systems integration testing and user acceptance testing-Creating and documenting UAT strategies/plans and test cases/scripts\u2022 Knowledge of manual and automation testing\u2022 Excellent communication and analytical skills\u2022 Experience in mortgage industry\u2022 Writes user stories based on business-driven functionality as well as technical capabilities\u2022 Provides constructive support to both Product Owner and IT team in product-related decisions\u2022 Encourages customer-centric mindset for entire Modern Delivery team, consistently focusing on advancing Freddie Mac\u2019s mission\u2022 Supports team in development process, defining technical requirements based on in-depth and breath of product/business knowledge\u2022 Partners with Team Development Lead to create project/process specifications\u2022 Writes user stories based on business-driven functionality as well as technical capabilities \u2022 Understands and proactively utilizes Modern Delivery practices Thanks & RegardsAmit Singhamit.singh@siriinfo.comSIRIINFO SOLUTIONS Phone \u2013 Direct 848-800-0166",
        "source": "Email",
        "date_posted": "2024-10-23 10:55:12-05:00",
        "unique_id": "192ba6de4431f9fb",
        "emp_type": [
            "contract",
            "third party"
        ],
        "tag": "Business Analyst"
    }
]