[
    {
        "company": "TEK INSPIRATIONS LLC",
        "job_title": "SR SOFTWARE DEVELOPER (CORILLIAN/CYBER VULNERABILITIES)",
        "location": "USA",
        "full_location": {
            "city": "",
            "state": "",
            "country": "USA"
        },
        "job_details": {
            "employment_type": [
                "contract",
                "third party"
            ],
            "job_code": "",
            "experience_required": "6+ years",
            "degree_required": "Not specified",
            "visa_sponsorship": "Not specified",
            "notice_period": "Not specified",
            "duration": "3 - 5 months",
            "rate": "Not specified"
        },
        "skills": {
            "core": [
                ".NET",
                "C#",
                "JavaScript (jQuery)",
                "Cybersecurity Vulnerability Remediation"
            ],
            "primary": [
                "SAST Tools like Checkmarx",
                "Cross-Functional Team Collaboration",
                "Knowledge of Cybersecurity Regulations"
            ],
            "secondary": [],
            "all": [
                ".NET",
                "C#",
                "JavaScript (jQuery)",
                "Cybersecurity Vulnerability Remediation",
                "SAST Tools like Checkmarx",
                "Cross-Functional Team Collaboration",
                "Knowledge of Cybersecurity Regulations"
            ],
            "with_experience": [
                ".NET",
                "C#",
                "JavaScript (jQuery)",
                "Cybersecurity Vulnerability Remediation"
            ]
        },
        "job_type": [
            "remote"
        ],
        "contact_person": "Subodh Kumar",
        "email": "subodh.kumar@tekinspirations.com",
        "jd": "From: Subodh Kumar, TEK INSPIRATIONS LLC subodh.kumar@tekinspirations.com Reply to: subodh.kumar@tekinspirations.com SR SOFTWARE DEVELOPER (CORILLIAN/CYBER VULNERABILITIES) \u2013 URGENT HIRECONTRACT: 3 - 5 MONTHSRemote \u2013 PST (PST time zone will be highly prefer) Need Active LinkedIn profile!Must have worked with companies in the USA for at least five years or more.JOB DESCRIPTION:SEEKING SR SOFTWARE DEVELOPER TO ASSIST IN REMEDIATION OF CYBERSECURITY VULNERABILITIES WITHIN THE CORILLIAN ONLINE BANKING PLATFORM.DEVELOPERS WILL WORK CLOSELY WITH CYBERSECURITY TEAM TO ENSURE VULNERABILITIES ARE ADDRESSED AND SECURE CODING PRACTICES ARE FOLLOWED.RESPONSIBILITIES:REMEDIATE CYBERSECURITY VULNERABILITIES IDENTIFIED IN CORILLIAN PLATFORM.WORK WITH CYBERSECURITY TEAM TO PRIORITIZE AND RESOLVE A PORTION OF 91 OPEN VULNERABILITIES.ENSURE COMPATIBILITY BETWEEN PLATFORM UPDATES (E.G., JQUERY) AND CORILLIAN DLLS BY COORDINATING WITH FISERV DEVELOPMENT TEAM.APPLY SECURE CODING PRACTICES TO REMEDIATION EFFORTS, ENSURING COMPLIANCE WITH SECURITY STANDARDS.DELIVER VULNERABILITY FIXES ON TIME, MAINTAINING PROJECT SCHEDULES AND SECURITY REQUIREMENTS.PARTICIPATE IN SECURITY DISCUSSIONS TO CONTRIBUTE RECOMMENDATIONS FOR SYSTEM ARCHITECTURE AND CODE IMPROVEMENTS.REQUIRED SKILLS:6+ YEARS OF SOFTWARE DEVELOPMENT EXPERIENCE, FOCUSED ON THE CORILLIAN ONLINE BANKING PLATFORM.HANDS-ON EXPERIENCE WITH CYBERSECURITY VULNERABILITY REMEDIATION IN FINANCIAL OR BANKING SYSTEMS.PROFICIENCY IN .NET, C#, AND JAVASCRIPT (JQUERY) FOR SECURE DEVELOPMENT.SAST TOOLS LIKE CHECKMARX FOR DETECTING AND RESOLVING VULNERABILITIES.EXPERIENCE WORKING WITH CROSS-FUNCTIONAL TEAMS, INCLUDING CYBERSECURITY AND FISERV DEVELOPERS.WORK WITH FISERV ON SIMILAR BANKING PLATFORM ENVIRONMENTS.KNOWLEDGE OF CYBERSECURITY REGULATIONS AND BEST PRACTICES IN FINANCIAL INSTITUTIONS.",
        "source": "Email",
        "date_posted": "2024-10-24 12:20:16-05:00",
        "unique_id": "192bfab4d91f431b",
        "emp_type": [
            "contract",
            "third party"
        ],
        "tag": ".net developer"
    }
]