[
    {
        "company": "Morgan Stanley Wealth Management",
        "job_title": "Scrum Master/Program Manager",
        "location": "New York, NY, USA",
        "full_location": {
            "city": "New York",
            "state": "NY",
            "country": "USA"
        },
        "job_details": {
            "employment_type": [
                "full-time",
                "third party"
            ],
            "job_code": "",
            "experience_required": "Not specified",
            "degree_required": "Not specified",
            "visa_sponsorship": "No visa sponsorship",
            "notice_period": "Not specified",
            "duration": "12 + Months",
            "rate": "Not specified"
        },
        "skills": {
            "core": [
                "Project / program management",
                "Agile experience",
                "Strong communications skills",
                "Financial management and forecasting",
                "Risk management"
            ],
            "primary": [
                "Problem solving",
                "Attention to detail"
            ],
            "secondary": [
                "Ability to liaise with diverse groups (tech, ops, business, etc)"
            ],
            "all": [
                "Project / program management",
                "Agile experience",
                "Strong communications skills",
                "Financial management and forecasting",
                "Risk management",
                "Problem solving",
                "Attention to detail",
                "Ability to liaise with diverse groups (tech, ops, business, etc)"
            ],
            "with_experience": [
                "Agile experience"
            ]
        },
        "job_type": [
            "onsite"
        ],
        "contact_person": "Samir Priya Darshan",
        "email": "samir.p@netonicsinc.com",
        "jd": "From: Samir Priya Darshan, Netonics Inc samir.p@netonicsinc.com Reply to: samir.p@netonicsinc.com Job Title: Scrum Master/Program ManagerDuration: 12 + MonthsLocation: 1 New York Plaza New York NY 10004 \u2013 Local only Only USC/GC with Local IDC2H role MS Wealth Management (MSWM) Technology Morgan Stanley Wealth Management (MSWM) Technology is the global technology department responsible for the design, development, delivery and support of the technical solutions behind the products and services used by the Morgan Stanley Wealth Management (MSWM) business.The department is comprised of 10 organizations: Sales, Banking & Corporate-Client Technology, Investment Products & Markets Technology, Client Reporting, Core Processing, Private and International Wealth Management Technology, Technology Integration Office, Enterprise Infrastructure & Production Management, Capital Markets Application & Data Services, Deployment Planning & Release Management, and the Chief Operating Office.Morgan Stanley Wealth Management (MSWM) Technology works with large scale databases such as DB2 and SQL Server, proprietary and non-proprietary messaging software, a broad variety of vendor products, numerous financial exchanges and regulatory entities, and programming languages ranging from .Net and Java to Cobol and VB.Net.Job Description The AIDT Technology Project Manager/Scrum Master will be responsible for managing various projects related to Data Technologies. The role will potentially progress from a Project Manager to a Scrum Master so Agile experience is required.Key duties include: Manage complex programs that cut across multiple technology teams and applications. This includes management of schedule, budgets, risk, etc. * Solutions - bring together subject matter experts and other stakeholders to bring about solutions, and advise business partners * Status reporting to business partners and senior management * Work with central PMO, DPRM, Business Management to meet firm tracking requirements for initiativesQualifications * Project / program management * Strong communications skills * Ability to liaise with diverse groups (tech, ops, business, etc) * Financial management and forecasting* Risk management * Problem solving * Attention to detail",
        "source": "Email",
        "date_posted": "2024-10-03 11:47:27-05:00",
        "unique_id": "192534cfd8152c93",
        "emp_type": [
            "full-time",
            "third party"
        ],
        "tag": "Scrum Master"
    }
]