[
    {
        "company": "Vyze Inc.",
        "job_title": "Lead Scrum Master F2F",
        "location": "Dallas, TX, USA",
        "full_location": {
            "city": "Dallas",
            "state": "TX",
            "country": "USA"
        },
        "job_details": {
            "employment_type": [
                "full-time",
                "third party"
            ],
            "job_code": "",
            "experience_required": "3 years",
            "degree_required": "Bachelor's degree in Computer Science, Computer Engineering, Technology, Information Systems (CIS/MIS), Engineering or related technical discipline, or equivalent experience/training",
            "visa_sponsorship": "Not specified",
            "notice_period": "Not specified",
            "duration": "12+ months",
            "rate": "Not specified"
        },
        "skills": {
            "core": [
                "Agile methodologies",
                "Scrum",
                "Project management",
                "Team leadership",
                "Business analysis"
            ],
            "primary": [
                "Certified ScrumMaster",
                "PMP",
                "Continuous Integration",
                "Continuous Deployment",
                "Microsoft Office Tools"
            ],
            "secondary": [
                "DevOps toolchain methodologies",
                "Team Foundation/Server (TFS)",
                "Rally",
                "Planview",
                "VersionOne"
            ],
            "all": [
                "Agile methodologies",
                "Scrum",
                "Project management",
                "Team leadership",
                "Business analysis",
                "Certified ScrumMaster",
                "PMP",
                "Continuous Integration",
                "Continuous Deployment",
                "Microsoft Office Tools",
                "DevOps toolchain methodologies",
                "Team Foundation/Server (TFS)",
                "Rally",
                "Planview",
                "VersionOne"
            ]
        },
        "job_type": [
            "hybrid"
        ],
        "contact_person": "Abhishek Singh",
        "email": "abhishek.s@vyzeinc.com",
        "jd": "Job Description -Job Title: Lead Scrum Master F2FLocation: Dallas, TX HybridDuration: 12+ months MOI: Skype+ F2F Job Description:Responsible for planning, directing, and coordinating activities for multiple projects utilizing Agile/Scrum methodologies.What you'll do\u2022 Manages/oversees all aspects of multiple simultaneous fast-paced assigned projects with distributed teams\u2022 Designs and maintains project vision, project working standards, and agreements\u2022 Develops project roadmap, release plan, resource allocation, funding request, communication plan, risks and issues management plan, test plan, and defect management plan\u2022 Manages project scope, budget, project burn charts, presentations to IT/Business, daily standup, agile ceremonies, backlog grooming, and retrospective sessions\u2022 Implements Agile methodology using Rally and Planview tools\u2022 Facilitates project meetings (all Agile meetings \u2013 Discovery Sessions, Iteration 0, Iteration Planning, Demo & Retrospective, Daily Stand-up, Backlog Grooming); completes project tracking/analysis reports\u2022 Tracks, updates, and communicates project status in a proactive manner as it relates to project progress, budget/cost, resource utilization, change requests, issues, risks, and risk mitigation plans\u2022 Interfaces with project stakeholders at all levels of management to ensure project priorities are aligned with business needs and expectations\u2022 Ensures that appropriate project documentation and deliverables are clearly defined and delivered\u2022 Mentors and Coaches Agile teams to ensure their adoption and successful use of Agile American practices\u2022 Acts as a liaison between business units and 3rd party vendors\u2022 Uses business analysis techniques for gathering and documenting complex requirements, scoping, interviewing, facilitation, system component design, testing, and implementationAll you'll need for successMinimum Qualifications- Education & Prior Job Experience\u2022 Bachelor's degree in Computer Science, Computer Engineering, Technology, Information Systems (CIS/MIS), Engineering or related technical discipline, or equivalent experience/training\u2022 3 years of progressive broad-based information systems and business experience\u2022 3 years of experience managing and delivering mission-critical, high-availability large and small IT development projects using structured project management and system development methodologiesPreferred Qualifications- Education & Prior Job Experience\u2022 3 years of experience in Agile methods and mindset as an approach to software development\u2022 5 years of progressive broad-based information systems and business experience\u2022 5 years of experience managing and delivering mission-critical, high-availability large and small IT development projects using structured project management and system development methodologies, such as Agile/Scrum\u2022 Airline Industry experienceSkills, Licenses & Certifications\u2022 Certified ScrumMaster or PMP (Project Management Professional) is a plus\u2022 Experience leading, coaching, and mentoring teams while leveraging Agile methodologies, with strong focus on continuous improvement and developing self-organizing teams\u2022 Experience in a variety of computing platforms, such as mainframe, client/server, web, cloud, and social media\u2022 Experience in Team Foundation/Server (TFS), Rally, Planview, VersionOne, or similar Agile life cycle management tools\u2022 Experience in DevOps toolchain methodologies, including Continuous Integration and Continuous Deployment\u2022 Proficiency in Microsoft Office Tools (Project, Excel, Word, and PowerPoint)\u2022 Skills in leadership; team-focused with high energy and a positive attitude\u2022 Skills in analytics, estimating, and problem solving\u2022 Ability to think strategically and develop tactical methods to achieve objectives and goals\u2022 Ability to build and maintain effective relationships with team members, customers, and external groups, as well as working in a collaborative environment with geographically dispersed resources",
        "source": "Email",
        "date_posted": "2024-10-03 10:43:44-05:00",
        "unique_id": "1925314a145fae66",
        "emp_type": [
            "full-time",
            "third party"
        ],
        "tag": "Scrum Master"
    }
]