[
    {
        "company": "Blue Ocean Ventures",
        "job_title": "Business Analyst with Athena EMR",
        "location": "USA",
        "full_location": {
            "city": "",
            "state": "",
            "country": "USA"
        },
        "job_details": {
            "employment_type": [
                "third party"
            ],
            "job_code": "",
            "experience_required": "8+ Years",
            "degree_required": "Engineering Degree \u2013 BE/ME/BTech/MTech/BSc/MSc.",
            "visa_sponsorship": "Not specified",
            "notice_period": "Not specified",
            "duration": "Not specified",
            "rate": "Not specified"
        },
        "skills": {
            "core": [
                "Athena EMR",
                "US healthcare domain",
                "process automation",
                "RPA",
                "API"
            ],
            "primary": [
                "communication skills",
                "problem solving",
                "collaboration",
                "data quality",
                "report writing"
            ],
            "secondary": [
                "SDLC",
                "process improvement",
                "vendor relationships",
                "documentation",
                "troubleshooting"
            ],
            "all": [
                "Athena EMR",
                "US healthcare domain",
                "process automation",
                "RPA",
                "API",
                "communication skills",
                "problem solving",
                "collaboration",
                "data quality",
                "report writing",
                "SDLC",
                "process improvement",
                "vendor relationships",
                "documentation",
                "troubleshooting"
            ]
        },
        "job_type": [
            "remote"
        ],
        "contact_person": "Abhilash SH",
        "email": "abhilash.sh@blue-oceanventures.com",
        "jd": "From: Abhilash s h, Blue ocean ventures abhilash.sh@blue-oceanventures.com Reply to: abhilash.sh@blue-oceanventures.com Role: Business Analyst with Athena EMRLocation: RemoteJob Description Business Analyst with Athena EMR What is in it for you? We are seeking an experienced Business Analyst with expertise in the US healthcare domain to join our offshore team. The ideal candidate will have a deep understanding of healthcare processes, regulations, and automation potentials. This role involves close collaboration with clients, architects, tech leads, and development teams to ensure the successful delivery of healthcare automation projects. Athena EHR Functional/ Analyst Job Responsibilities : - Participation in build, configuration and testing of the athenahealth application features and functions. Assist in onboarding new practices to the Athenahealth application. Provide electronic health record support. This includes, but not limited to, resolving issues, making changes, working on enhancements to the system and writing documentation. Provide recommendations on how to improve EMR/EHR documentation and workflows Troubleshoot all aspects of Athenahealth Data Confidentiality/Security-Maintain confidentiality of sensitive information at all times. Application Upgrades and Implementations Responsible for activities related to application upgrades and implementations: review and validation of functionality and reporting of issues; identify new functionality and hardware requirements as assigned; ability to create test plans. Maintain data quality at all times. Report Writing/Analysis-Ability to write, analyze and make basic modifications to reports. Second and Third Level Support (Including Maintenance Activities)-Ability to triage support issues and escalate accordingly. Partner with team members to trouble shoot support issues. Vendor Relationships-Interact with vendors (technical issues, project initiatives) under the direction of more experienced team members, as necessary. SDLC (System Development Life Cycle)-Have a fundamental knowledge of the system/application development life cycle. Process Improvement-Review and validate existing processes. Documentation-Complete documentation/flow charting of system builds and maintain team's existing documentation. Contribute to project tasks and milestones typically under the direction of project manager/more experienced team members. Update all project management and time tracking tools accordingly. Interactions with Others-Successfully completes projects, tasks, and initiatives by embracing a team-first approach. Works in collaboration with team and offers feedback, where appropriate, to complete individual and group efforts. Shows the ability to adjust and be flexible to change by adapting approach when necessary. Mandatory Skills (Must have) : -5-10 years of Athena EMR Technical skills3-4 years of Specific knowledge of Athena EMR APIUnderstanding of Provider use cases, patient scheduling, patient test results, patient communication Worked in provider environments.Experience: Proven experience as a Business Analyst in the US healthcare domain, with a focus on process automation and RPA. Domain Knowledge: Strong understanding of US healthcare processes, regulations, and standards. Technical Skills: Ability to produce detailed process documentation and identify automation potentials within healthcare processes.Communication Skills: Excellent communication skills, with the ability to present complex healthcare information to clients in a clear and concise mannerProblem Solving: Strong analytical skills, with the ability to identify potential issues and propose effective solutions within the healthcare context. Collaboration: Ability to work closely with development teams to ensure accurate translation of healthcare requirements into technical specifications. Experience: -8+ Years Location: -Remote Educational Qualifications: -Engineering Degree \u2013 BE/ME/BTech/MTech/BSc/MSc. Regards, Abhilash SHhttps://www.linkedin.com/in/abhilash-s-h-ab07a5231/Blue Ocean Ventures5555 Glenridge Connector Suite 200 Atlanta, GA 30342Email:Abhilash.sh@blue-oceanventures.comWill To Serve Will To Win Will To Lead",
        "source": "Email",
        "date_posted": "2024-10-03 14:10:36-05:00",
        "unique_id": "19253dfa4613e138",
        "emp_type": [
            "third party"
        ],
        "tag": "Business Analyst"
    }
]