[
    {
        "company": "Baxter",
        "job_title": "PC Desktop Application Developer",
        "location": "Milwaukee, WI, USA",
        "full_location": {
            "city": "Milwaukee",
            "state": "WI",
            "country": "USA"
        },
        "job_details": {
            "employment_type": [
                "third party"
            ],
            "job_code": "",
            "experience_required": "5+ years",
            "degree_required": "Bachelor\u2019s Degree in Computer Science & Engineering discipline or equivalent",
            "visa_sponsorship": "Not specified",
            "notice_period": "Not specified",
            "duration": "Not specified",
            "rate": "Not specified"
        },
        "skills": {
            "core": [
                "C#",
                ".NET",
                "PC desktop application development"
            ],
            "primary": [
                "C++",
                "SQL Database",
                "Visual Studio",
                "Eclipse",
                "SVN",
                "Git",
                "Jenkins",
                "BitBucket",
                "Jira"
            ],
            "secondary": [
                "Object-Oriented development",
                "Design Patterns",
                "Windows OS",
                "Healthcare domain knowledge",
                "Medical software development process"
            ],
            "all": [
                "C#",
                ".NET",
                "PC desktop application development",
                "C++",
                "SQL Database",
                "Visual Studio",
                "Eclipse",
                "SVN",
                "Git",
                "Jenkins",
                "BitBucket",
                "Jira",
                "Object-Oriented development",
                "Design Patterns",
                "Windows OS",
                "Healthcare domain knowledge",
                "Medical software development process"
            ]
        },
        "job_type": [],
        "contact_person": "Yogesh Sharma",
        "email": "yogesh@stellentit.com",
        "jd": "From: Yogesh Sharma, StellentIT yogesh@stellentit.com Reply to: yogesh@stellentit.com PC Desktop Application DeveloperMilwaukee, WIPhone + Skype Job description: Top 3: C#, .NET, Experience with PC desktop application development and communication protocols A Principal Engineer for software will be responsible for development of products and providing creative solutions associated with the design, development, and sustaining engineering for our new and existing software product portfolio. The successful candidate will possess solid \u201chands-on\u201d technical abilities, an excitement and energy for product development, and a passion for their work and the impact it has on meeting the needs of patients.Essential Duties and Responsibilities:\u2022 Responsible for the architecture and design of a module/project, makes architecture and design choices for new product development, maintenance activities, field issue resolution etc.\u2022 Responsible for technically leading maintenance activities, field issue resolution working with the local and globally distributed teams and with hands-on approach for solving issues\u2022 Reviews and approves the design and code of a module/project/defect fixes\u2022 Demonstrates customer focus by ensuring quality of software releases and timely resolution of field reported issues\u2022 Responsible for analyzing and understanding the requirements.\u2022 Identifies key module/product level technical risks and assists project manager in developing mitigation and recovery plan\u2022 Review work products and ensure the quality of deliverables\u2022 Provides input to the test strategies at a product level\u2022 Provides guidance to development and test teams with respect to overall design and development.\u2022 Leads and coaches the team members.\u2022 Drives the application of principles of SDLC and methodologies like Lean/Agile/XP, CI, Software and Product Security, Scalability, Documentation Practices, refactoring and testing techniques.\u2022 Owns and drives continuous improvement activities by identifying and appropriately escalating process and product quality gaps.Qualifications / Experience and/or Background\u00a7 Bachelor\u2019s Degree in Computer Science & Engineering discipline or equivalent is required.\u00a7 5+ years\u2019 experience in a software engineering role, with experience in PC based applications\u00a7 Excellent software architecture, design and implementation skills\u00a7 Expertise in development and maintenance of Software for PC Based/Embedded systems\u00a7 Strong Object-Oriented development and design knowledge and experience\u00a7 Deep understanding of technology & software development principles:\u00a7 Analysis and Design: Object oriented architecture, Design Patterns\u00a7 Programming: C++, C#, .NET application development\u00a7 Knowledge on SQL Data Base, Working knowledge on SQL Server Express or pgSQL relational database.\u00a7 Development and Continuous Integration: Visual Studio/Eclipse, SVN, Git, Gerrit, Jenkins, BitBucket, Jira etc.\u00a7 OS: Windows,\u00a7 Experience in technically leading project teams involving SW architects and SW design engineers.\u00a7 Demonstrated success in delivering results on technical challenges.\u00a7 Good understanding of Healthcare domain (regulations and standards) and Medical software development process.Personal Characteristics\u00a7 Excellent communication, inter-personal and leadership skills\u00a7 Firm decision maker and shall possess good influencing skills\u00a7 Openness to collaborate in interest of project/organization.\u00a7 Proactive and self-driven, possesses due sense of urgency\u00a7 Shall possess systems mindset and good problem-solving abilities.\u00a7 Working with multisite teams, Quality conscious and Process & customer Oriented\u00a7 Coaching capabilities.A Career That MattersBaxter\u2019s employees are united in a mission to save and sustain lives. We are passionate about applying scientific innovation to meet the needs of the millions of people worldwide who depend on our medically necessary therapies and technologies. We focus on increasing access to healthcare, innovating in crucial areas of unmet need, and pursuing creative collaborations that bring our mission to life for patients every day.",
        "source": "Email",
        "date_posted": "2024-10-03 17:02:49-05:00",
        "unique_id": "19254676b0634d1d",
        "emp_type": [
            "third party"
        ],
        "tag": ".net developer"
    }
]