[
    {
        "company": "Cigna",
        "job_title": "Business Analyst",
        "location": "Boston, MA, USA",
        "full_location": {
            "city": "Boston",
            "state": "MA",
            "country": "USA"
        },
        "job_details": {
            "employment_type": [
                "contract",
                "third party"
            ],
            "job_code": "",
            "experience_required": "5+ years",
            "degree_required": "Bachelor\u2019s degree in computer science, Information Systems, Business Administration, or a related field",
            "visa_sponsorship": "No visa sponsorship",
            "notice_period": "Not specified",
            "duration": "12+ Months",
            "rate": "Not specified"
        },
        "skills": {
            "core": [
                "BA experience",
                "SDLC experience",
                "Use Cases experience",
                "Healthcare Industry experience"
            ],
            "primary": [
                "Jira",
                "Microsoft 365",
                "Excel",
                "Word",
                "PowerPoint",
                "Access",
                "Visio"
            ],
            "secondary": [
                "data structures",
                "application programming",
                "database development",
                "relational database theory",
                "flow charts",
                "diagrams",
                "strong organizational skills",
                "problem-solving aptitude",
                "attention to detail",
                "collaborative work"
            ],
            "all": [
                "BA experience",
                "SDLC experience",
                "Use Cases experience",
                "Healthcare Industry experience",
                "Jira",
                "Microsoft 365",
                "Excel",
                "Word",
                "PowerPoint",
                "Access",
                "Visio",
                "data structures",
                "application programming",
                "database development",
                "relational database theory",
                "flow charts",
                "diagrams",
                "strong organizational skills",
                "problem-solving aptitude",
                "attention to detail",
                "collaborative work"
            ]
        },
        "job_type": [
            "hybrid"
        ],
        "contact_person": "Pritam Singh",
        "email": "pritam@kpgtech.com",
        "jd": "From: pritam Singh, kpg99 pritam@kpgtech.com Reply to: pritam@kpgtech.com POSITION: Business Analyst LOCATION: Boston, MA (Hybrid 2 days onsite) DURATION: 12+ Months Contract Client: Cigna (Video then in-person interview) Visa: USC Only Job Description Must have: \u00b7 5+ yr BA exp \u00b7 SDLC exp \u00b7 Use Cases exp \u00b7 Healthcare Industry exp Preferred Qualifications: Knowledge of the principles of software development using the approved SDLC. Proficient knowledge of Jira, Long Term Care Population, Complex eligibility systems, and Unified processes. Proficiency in Microsoft 365, Excel, Word, PowerPoint, Access, and Visio. Knowledge of methods and techniques of computer systems analysis, design, technical terminology, codes, and standard abbreviations. Experience with one or more of the following: data structures, application programming, database development, or relational database theory and technology. Ability to prepare flow charts, diagrams, and Use Cases. Deliver oral and written instructions in a precise, understandable manner. Prepare required deliverables in accordance with established procedures. Strong organizational skills with the ability to maintain accurate records and status reporting. Ability to understand and apply the policies, procedures, specifications, standards, and guidelines governing assigned unit activities. Knowledge of MA HIX or other State Health Exchange. Ability to work with multiple vendors. Strong organizational skills, problem-solving aptitude, and attention to detail. Ability to work well with others in a fast fast-paced, dynamic environment. Strong initiative and ability to manage multiple projects, as well as strong follow-through skills. Must be able to work collaboratively, collegially, and cooperatively with others in an environment where deliverables are potentially dependent on the output of others. Education and Certifications: Bachelor\u2019s degree in computer science, Information Systems, Business Administration, or a related field. Minimum of (3) three years of extensive experience with project management as a Senior Business Analyst of a large-scale application. Minimum of (3) years of experience in working in all phases of the Software Development Life Cycle (SDLC), including postproduction verification. Prior healthcare experience desired.",
        "source": "Email",
        "date_posted": "2024-10-03 10:22:36-05:00",
        "unique_id": "19253032f4a53112",
        "emp_type": [
            "contract",
            "third party"
        ],
        "tag": "Business Analyst"
    }
]