[
    {
        "company": "Propelsys",
        "job_title": "Business Analyst (Healthcare)",
        "location": "Quincy, MA, USA",
        "full_location": {
            "city": "Quincy",
            "state": "MA",
            "country": "USA"
        },
        "job_details": {
            "employment_type": [
                "full-time",
                "third party"
            ],
            "job_code": "",
            "experience_required": "Not specified",
            "degree_required": "Not specified",
            "visa_sponsorship": "Not specified",
            "notice_period": "Not specified",
            "duration": "Not specified",
            "rate": "Not specified"
        },
        "skills": {
            "core": [
                "Jira",
                "Long Term Care Population",
                "Complex eligibility systems",
                "Unified processes",
                "Microsoft 365",
                "Excel",
                "Word",
                "PowerPoint",
                "Access",
                "Visio"
            ],
            "primary": [
                "data structures",
                "application programming",
                "database development",
                "relational database theory",
                "computer systems analysis",
                "design",
                "technical terminology",
                "codes",
                "standard abbreviations"
            ],
            "secondary": [
                "flow charts",
                "diagrams",
                "Use Cases",
                "organizational skills",
                "problem-solving aptitude",
                "attention to detail",
                "collaborative work",
                "fast-paced environment",
                "project management"
            ],
            "all": [
                "Jira",
                "Long Term Care Population",
                "Complex eligibility systems",
                "Unified processes",
                "Microsoft 365",
                "Excel",
                "Word",
                "PowerPoint",
                "Access",
                "Visio",
                "data structures",
                "application programming",
                "database development",
                "relational database theory",
                "computer systems analysis",
                "design",
                "technical terminology",
                "codes",
                "standard abbreviations",
                "flow charts",
                "diagrams",
                "Use Cases",
                "organizational skills",
                "problem-solving aptitude",
                "attention to detail",
                "collaborative work",
                "fast-paced environment",
                "project management"
            ]
        },
        "job_type": [
            "hybrid"
        ],
        "contact_person": "Asha Jyothi",
        "email": "asha@propelsys.com",
        "jd": "From: Asha Jyothi, Propelsys asha@propelsys.com Reply to: asha@propelsys.com Title: Business Analyst (Healthcare)Location: Quincy, MA(Hybrid)Local Only from MA, NH or RI and must have recent client experience from these locationsIn-Person InterviewMinimum Requirements:Knowledge of the principles of software development using the approved SDLC.Proficient knowledge of Jira, Long Term Care Population, Complex eligibility systems, and Unified processes.Proficiency in Microsoft 365, Excel, Word, PowerPoint, Access, and Visio.Knowledge of methods and techniques of computer systems analysis, design, technical terminology, codes, and standard abbreviations.Experience with one or more of the following: data structures, application programming, database development, or relational database theory and technology.Ability to prepare flow charts, diagrams, and Use Cases.Deliver oral and written instructions in a precise, understandable manner.Prepare required deliverables in accordance with established procedures.Strong organizational skills with the ability to maintain accurate records and status reporting.Ability to understand and apply the policies, procedures, specifications, standards, and guidelines governing assigned unit activities.Knowledge of MA HIX or other State Health Exchange.Ability to work with multiple vendors.Strong organizational skills, problem-solving aptitude, and attention to detail.Ability to work well with others in a fast fast-paced, dynamic environment.Strong initiative and ability to manage multiple projects, as well as strong follow-through skills.Must be able to work collaboratively, collegially, and cooperatively with others in an environment where deliverables are potentially dependent on the output of others",
        "source": "Email",
        "date_posted": "2024-10-03 10:52:42-05:00",
        "unique_id": "1925319e842cadd7",
        "emp_type": [
            "full-time",
            "third party"
        ],
        "tag": "Business Analyst"
    }
]