[
    {
        "company": "Cigna",
        "job_title": "Business Analyst",
        "location": "Boston, MA, USA",
        "full_location": {
            "city": "Boston",
            "state": "MA",
            "country": "USA"
        },
        "job_details": {
            "employment_type": [
                "full-time",
                "third party"
            ],
            "experience_required": "5+ years",
            "degree_required": "Bachelor\u2019s degree in computer science, Information Systems, Business Administration, or a related field",
            "visa_sponsorship": "Not specified",
            "notice_period": "Not specified",
            "duration": "Not specified",
            "rate": "Not specified"
        },
        "skills": {
            "core": [
                "Business Analysis",
                "SDLC",
                "Use Cases",
                "Healthcare Industry"
            ],
            "primary": [
                "Jira",
                "Microsoft 365",
                "Excel",
                "Word",
                "PowerPoint",
                "Access",
                "Visio",
                "Data Structures",
                "Application Programming",
                "Database Development",
                "Relational Database Theory"
            ],
            "secondary": [
                "Flow Charts",
                "Diagrams",
                "Technical Terminology",
                "Computer Systems Analysis",
                "Problem-Solving",
                "Organizational Skills"
            ],
            "all": [
                "Business Analysis",
                "SDLC",
                "Use Cases",
                "Healthcare Industry",
                "Jira",
                "Microsoft 365",
                "Excel",
                "Word",
                "PowerPoint",
                "Access",
                "Visio",
                "Data Structures",
                "Application Programming",
                "Database Development",
                "Relational Database Theory",
                "Flow Charts",
                "Diagrams",
                "Technical Terminology",
                "Computer Systems Analysis",
                "Problem-Solving",
                "Organizational Skills"
            ]
        },
        "job_type": [
            "hybrid"
        ],
        "contact_person": "Vyzeinc Santosh",
        "email": "sharma@vyzeinc.com",
        "jd": "From: Santosh, Vyzeinc ssharma@vyzeinc.com Reply to: ssharma@vyzeinc.com Job Description -Title: Business AnalystLocation: Boston, MA (Hybrid 2 days onsite)MOI : Skype +f2fClient: Cigna (Vide then in-person interview) Must have:5+ yr BA expSDLC expUse Cases expHealthcare Industry expEducation and Certifications:Bachelor\u2019s degree in computer science, Information Systems, Business Administration, or a related field.Minimum of (3) three years of extensive experience with project management as a Senior Business Analyst of a large-scale application.Minimum of (3) years of experience in working in all phases of the Software Development Life Cycle (SDLC), including postproduction verification.Prior healthcare experience desired Preferred Qualifications:Knowledge of the principles of software development using the approved SDLC.Proficient knowledge of Jira, Long Term Care Population, Complex eligibility systems, and Unified processes.Proficiency in Microsoft 365, Excel, Word, PowerPoint, Access, and Visio.Knowledge of methods and techniques of computer systems analysis, design, technical terminology, codes, and standard abbreviations.Experience with one or more of the following: data structures, application programming, database development, or relational database theory and technology.Ability to prepare flow charts, diagrams, and Use Cases.Deliver oral and written instructions in a precise, understandable manner.Prepare required deliverables in accordance with established procedures.Strong organizational skills with the ability to maintain accurate records and status reporting.Ability to understand and apply the policies, procedures, specifications, standards, and guidelines governing assigned unit activities.Knowledge of MA HIX or other State Health Exchange.Ability to work with multiple vendors.Strong organizational skills, problem-solving aptitude, and attention to detail.Ability to work well with others in a fast fast-paced, dynamic environment.Strong initiative and ability to manage multiple projects, as well as strong follow-through skills.Must be able to work collaboratively, collegially, and cooperatively with others in an environment where deliverables are potentially dependent on the output of others.",
        "source": "Email",
        "date_posted": "2024-10-03 16:24:39-05:00",
        "unique_id": "19254447af1b7a0b",
        "emp_type": [
            "full-time",
            "third party"
        ],
        "tag": "Business Analyst"
    }
]