[
    {
        "company": "Vyzeinc",
        "job_title": "Java Developer (Technology Upgrade)",
        "location": "New York, NY, USA",
        "full_location": {
            "city": "New York",
            "state": "NY",
            "country": "USA"
        },
        "job_details": {
            "employment_type": [
                "full-time",
                "third party"
            ],
            "experience_required": "Minimum 10+ years required",
            "degree_required": "Not specified",
            "visa_sponsorship": "Must have existing work authorization",
            "notice_period": "Not specified",
            "duration": "Not specified",
            "rate": "Not specified"
        },
        "skills": {
            "core": [
                "Java",
                "Spring",
                "Struts",
                "SQL",
                "Angular"
            ],
            "primary": [
                "Microservices",
                "APIs",
                "JavaScript",
                "JSP",
                "Spring Hibernate",
                "JPA",
                "web services",
                "Docker",
                "Kubernetes",
                "DevOps"
            ],
            "secondary": [
                "UI development",
                "data analysis",
                "application design",
                "programming",
                "testing",
                "implementation",
                "complex SQL queries",
                "stored procedures/functions",
                "WebLogic 14C",
                "Apache Tomcat",
                "CI/CD pipelines",
                "BI Publisher reports",
                "design and technical documents",
                "self-motivated",
                "enthusiastic",
                "planning process",
                "meeting deadlines",
                "performing well under pressure"
            ],
            "all": [
                "Java",
                "Spring",
                "Struts",
                "SQL",
                "Angular",
                "Microservices",
                "APIs",
                "JavaScript",
                "JSP",
                "Spring Hibernate",
                "JPA",
                "web services",
                "Docker",
                "Kubernetes",
                "DevOps",
                "UI development",
                "data analysis",
                "application design",
                "programming",
                "testing",
                "implementation",
                "complex SQL queries",
                "stored procedures/functions",
                "WebLogic 14C",
                "Apache Tomcat",
                "CI/CD pipelines",
                "BI Publisher reports",
                "design and technical documents",
                "self-motivated",
                "enthusiastic",
                "planning process",
                "meeting deadlines",
                "performing well under pressure"
            ]
        },
        "job_type": [
            "hybrid"
        ],
        "contact_person": "Roshan",
        "email": "roshan@vyzeinc.com",
        "jd": "From: Roshan, Vyzeinc roshan@vyzeinc.com Reply to: roshan@vyzeinc.com Title: Java Developer (Technology Upgrade)Location: New York, NY (Hybrid)visa: CITIZEN,GREEN CARD onlyExperience: Minimum 10+ years requiredLinkedIn Profile: Must be providedScope of Work:The selected developer will be responsible for the following tasks, including but not limited to:Remediate static and dynamic cybersecurity vulnerabilities identified by the Veracode tool scan.Upgrade multiple Spring framework-based Java applications to the latest version of Spring.Address pending enhancement requests from end users.Upgrade multiple Struts framework-based Java applications to the latest version of Struts.Ensure ADA compliance for applications.Perform unit testing, quality assurance testing, and UAT remediation.Work onsite at 150 Williams, downtown NYC, at least 3 days per week.Note:The vendor will provide a Java Developer with a minimum of five years of Java development experience with Spring and Struts frameworks.ACS will interview and approve the candidate for this position.ACS reserves the right to replace the developer if they do not meet the qualifications or fail to demonstrate proficiency while onsite.Vendor Qualifications:The Java Developer must have the following skills and experience:5+ years of experience in Java application development using Spring and Struts frameworks, including data analysis, application design, programming, testing, and implementation.Expertise in UI development and web technologies including Angular, Microservices, APIs, JavaScript, JSP, SQL, Spring Hibernate, JPA, and web services.Proficiency with development tools such as JDeveloper, Eclipse, and Visual Studio Code.Minimum of 5 years\u2019 experience in the design, development, and implementation of IT applications utilizing Java and relational databases.Minimum of 3 years\u2019 backend experience writing complex SQL queries, stored procedures/functions.Minimum of 3 years\u2019 experience working with WebLogic 14C or Apache Tomcat.Experience with Docker and Kubernetes (AKS) is a plus.Proficiency with DevOps, including setting up CI/CD pipelines.Knowledge of integrating BI Publisher reports with Spring-based applications is preferred.Strong experience in creating design and technical documents.Ability to work independently, self-motivated, and enthusiastic.Comfortable with contributing estimates to the planning process and adhering to defined project plans.Capable of meeting deadlines and performing well under pressure.",
        "source": "Email",
        "date_posted": "2024-10-02 23:49:57-05:00",
        "unique_id": "19250b5e379a7b55",
        "emp_type": [
            "full-time",
            "third party"
        ],
        "tag": "Java developer"
    }
]