[
    {
        "company": "Department of General Services",
        "job_title": "PeopleSoft Business Analyst",
        "location": "Richmond, VA, USA",
        "full_location": {
            "city": "Richmond",
            "state": "VA",
            "country": "USA"
        },
        "job_details": {
            "employment_type": [
                "contract",
                "third party"
            ],
            "experience_required": "3-4 years",
            "degree_required": "Not specified",
            "visa_sponsorship": "Not specified",
            "notice_period": "Not specified",
            "duration": "Initial contract period is 12 months, with possibility to extend",
            "rate": "$60/hour"
        },
        "skills": {
            "core": [
                "PeopleSoft Financials",
                "Business Analysis",
                "Documentation",
                "Testing",
                "Process Improvement"
            ],
            "primary": [
                "Quality Assurance Validation",
                "User Acceptance Testing",
                "Regression Testing",
                "Training Material Development",
                "Interpersonal Skills",
                "Communication Skills"
            ],
            "secondary": [
                "General Ledger",
                "Accounts Payable",
                "Purchasing",
                "Accounts Receivable",
                "Billing",
                "Asset Management",
                "Project Experience with COV Projects"
            ],
            "all": [
                "PeopleSoft Financials",
                "Business Analysis",
                "Documentation",
                "Testing",
                "Process Improvement",
                "Quality Assurance Validation",
                "User Acceptance Testing",
                "Regression Testing",
                "Training Material Development",
                "Interpersonal Skills",
                "Communication Skills",
                "General Ledger",
                "Accounts Payable",
                "Purchasing",
                "Accounts Receivable",
                "Billing",
                "Asset Management",
                "Project Experience with COV Projects"
            ]
        },
        "job_type": [
            "hybrid"
        ],
        "contact_person": "Pallavi Singh",
        "email": "pallavi.singh@tekinspirations.com",
        "jd": "Job Description -We have a need for an PeopleSoft Business Analyst in Richmond, VA. The details and job description are below. Please send only 1 resume of your best available and interested consultant. Resumes must only be 4 pages max, or they won\u2019t be considered by the client. Many thanks in advance. RATE: 60/HR C2CVisa: CITIZEN,GC EAD,GREEN CARD,OPT EAD Job description - Please see belowEnd-client \u2013 Department of General ServicesDuration of contract \u2013 Initial contract period is 12 months, with possibility to extendRemote/onsite/hybrid \u2013 HYBRID - ON SITE REQUIRED: 3-4 days /weekLocal candidates onlyVirtual and In-person interviewsSend proof of residence with resume - driver\u2019s license, state-issued ID or copy of rental agreement/deed are strongly preferred (one page) Deadline to submit resumes \u2013 October 4, 2024 at 11amAgain, please do not send resumes longer than 4 pages. Let me know if you have any questions. Emails only please. No calls. Thank you again for your time and consideration.JOB DESCRIPTION:The client is looking for a Business Analyst with documentation and testing experience in support of PeopleSoft Financials systems.This position is primarily responsible for business analysis, functional/technical documentation and test planning of the company's PeopleSoft Financials system. This person will work closely with a small team of technical analysts and financial officers as the company works to streamline both the security and the operations of its PeopleSoft Financials system. The selected candidate in this position will work closely with stakeholders, Fiscal Subject Matter Experts (SMEs), and development teams. The Business Analyst will report to the Project manager. This position should expect to work 40 hours per week.Required Experience, Knowledge, Skills, and Abilities:-Experience in system design and development, with a focus on process improvement and business and technical requirements gathering-Experience with PeopleSoft Financials-Experience documenting workflow processes-Experience developing test plans, use cases, and performing quality assurance validation, user acceptance testing, and regression testing-Experience in the development of training materials and conducting user training-Strong interpersonal and communication skills \u2013The successful candidate should be a self-starter with the ability to drive work to completion.Preferred Experience:-Specific experience with General Ledger, Accounts Payable, Purchasing (functionality limited to storing POs and Receipts for matching), Accounts Receivable, Billing and Asset Management for Lease Administration.-Project experience with COV projects.Specific Tasks may include:-Documenting changes to PeopleSoft processes-Documenting PeopleSoft configurations-Documenting business workflows related to PeopleSoft-Preparing user and technical documentation-Developing test plans-Working with customer SMEs and project team to develop business requirements in response to requests for systems enhancements, modifications, and newly identified business initiatives.-Working with ISS technical team and vendors to ensure requirements are incorporated into systems design and testing.-Developing business requirements documentation and flow diagrams \u2013 this work may expand into technical requirements gathering, design, and systems documentation.-Actively participating in functional and systems integration unit testing; creating use case scenarios, test plans, and testing results.-Assisting with testing and track testing results-Developing and presenting training to Fiscal Services and agency users-Meeting regularly with customer and project teams and regularly demonstrating quality work output.-Keeping the Business Owner and ISS technical team informed of key issues that may impact project implementation.-Please note we are looking for a self-motivated and proactive Business Analyst who is detail oriented.",
        "source": "Email",
        "date_posted": "2024-10-03 08:35:01-05:00",
        "unique_id": "19252969a202868c",
        "emp_type": [
            "contract",
            "third party"
        ],
        "tag": "Business Analyst"
    }
]