[
    {
        "company": "SIRI INFO SOLUTIONS INC",
        "job_title": "Lead Java Integration JMS Developer",
        "location": "Houston, TX, USA",
        "full_location": {
            "city": "Houston",
            "state": "TX",
            "country": "USA"
        },
        "job_details": {
            "employment_type": [
                "contract",
                "third party"
            ],
            "job_code": "",
            "experience_required": "10+ years",
            "degree_required": "Not specified",
            "visa_sponsorship": "Not specified",
            "notice_period": "Not specified",
            "duration": "Long term contract",
            "rate": "Not specified"
        },
        "skills": {
            "core": [
                "Java Integration",
                "Java Messaging Services (JMS)",
                "Active MQ",
                "Microservices Design Patterns",
                "Apache Ignite"
            ],
            "primary": [
                "Integration design patterns",
                "Data modelling and design capabilities",
                "Service-oriented architecture",
                "Transaction management systems"
            ],
            "secondary": [
                "End-to-end understanding on designing integration components",
                "Extensive codebase design and development",
                "Large multi-tiered applications",
                "Grid computing technologies"
            ],
            "all": [
                "Java Integration",
                "Java Messaging Services (JMS)",
                "Active MQ",
                "Microservices Design Patterns",
                "Apache Ignite",
                "Integration design patterns",
                "Data modelling and design capabilities",
                "Service-oriented architecture",
                "Transaction management systems",
                "End-to-end understanding on designing integration components",
                "Extensive codebase design and development",
                "Large multi-tiered applications",
                "Grid computing technologies"
            ]
        },
        "job_type": [
            "onsite"
        ],
        "contact_person": "Dhiraj Kumar",
        "email": "dhiraj@siriinfo.com",
        "jd": "From: Dhiraj Kumar, SIRI INFO SOLUTIONS INC dhiraj@siriinfo.com Reply to: dhiraj@siriinfo.com Title: Lead Java Integration JMS Developer Location: Houston, TX \u2013 Day 1 Onsite Duration: Long term contract Must Have: Java Integration Java Messaging Services (JMS) Active MQ Microservices Design Patterns Apache Ignite / Similar tool (Purpose: Grid / Distributed computing technologies.) Description: 10+ years Expertise in design and development of Java / J2EE microservices Hands-on experience on Integration design patterns and have end-to-end understanding on designing integration components Detailed experience as a Java Data Integration developer using message-oriented architectures Experience with ActiveMQ and other messaging patterns Data modelling and design capabilities. Strong experience in service-oriented architecture & transaction management systems Extensive codebase design and development of large multi-tiered applications or systems Strong experience of grid and/or distributed computing technologies (Apache Ignite) Thank You, have a great day ahead!",
        "source": "Email",
        "date_posted": "2024-10-03 13:03:19-05:00",
        "unique_id": "1925391883eae33b",
        "emp_type": [
            "contract",
            "third party"
        ],
        "tag": "Java developer"
    }
]