[
    {
        "company": "Tek Pyramids",
        "job_title": ".NET Architect",
        "location": "San Ramon, CA, USA",
        "full_location": {
            "city": "San Ramon",
            "state": "CA",
            "country": "USA"
        },
        "job_details": {
            "employment_type": [
                "contract",
                "third party"
            ],
            "job_code": "",
            "experience_required": "8+ years",
            "degree_required": "Bachelor's Degree or higher",
            "visa_sponsorship": "Not specified",
            "notice_period": "Not specified",
            "duration": "12 months",
            "rate": "Not specified"
        },
        "skills": {
            "core": [
                "UI-based applications",
                "React",
                "Angular",
                "Winforms",
                "WCF",
                "Azure Cloud"
            ],
            "primary": [
                "Asset Wealth Management",
                "Financial Services",
                "Strong communication skills"
            ],
            "secondary": [
                "Azure certifications"
            ],
            "all": [
                "UI-based applications",
                "React",
                "Angular",
                "Winforms",
                "WCF",
                "Azure Cloud",
                "Asset Wealth Management",
                "Financial Services",
                "Strong communication skills",
                "Azure certifications"
            ]
        },
        "job_type": [
            "onsite"
        ],
        "contact_person": "Anurag Choudhary",
        "email": "anurag@tekpyramids.com",
        "jd": "From: Anurag Choudhary, Tek Pyramids anurag@tekpyramids.com Reply to: anurag@tekpyramids.com Title:.NET Architect San Ramon, CA \u2013 Onsite \u2013 Need Locals onlyVideo InterviewLong Term contractSubmittal Process:* Resumes must be under 5 pages and include all contact info ( no more than 10-15 bullets per role)* Candidates need to have LinkedIn profile with profile picture or a photo ID in the submittalSkills | Must-Haves:* 8+ years of professional experience* Experience in building UI-based applications (React/Angular), Winforms/WCF on Azure Cloud* AWM (Asset Wealth Management)/Financial Services experience* Strong communication skillsNice to Have Skills:* Azure certifications* Bachelor's Degree or higher",
        "source": "Email",
        "date_posted": "2024-10-03 13:13:08-05:00",
        "unique_id": "19253ad897e1b862",
        "emp_type": [
            "contract",
            "third party"
        ],
        "tag": ".net developer"
    }
]