[
    {
        "company": "Insoursys",
        "job_title": "Data Engineer - Python-Developer with Pyspark + (AWS GLUE)",
        "location": "Charlotte, NC, USA",
        "full_location": {
            "city": "Charlotte",
            "state": "NC",
            "country": "USA"
        },
        "job_details": {
            "employment_type": [
                "contract",
                "third party"
            ],
            "job_code": "",
            "experience_required": "Mid-level",
            "degree_required": "Not specified",
            "visa_sponsorship": "Not specified",
            "notice_period": "Not specified",
            "duration": "Contract",
            "rate": "Not specified"
        },
        "skills": {
            "core": [
                "Python",
                "PySpark",
                "AWS(Glue)"
            ],
            "primary": [
                "OOPS"
            ],
            "secondary": [
                "Airflow",
                "Cloudformation",
                "Jenkins"
            ],
            "all": [
                "Python",
                "PySpark",
                "AWS(Glue)",
                "OOPS",
                "Airflow",
                "Cloudformation",
                "Jenkins"
            ]
        },
        "job_type": [
            "onsite"
        ],
        "contact_person": "Tejaswi Athili",
        "email": "tejaswi_athili@insoursysinc.com",
        "jd": "From: Teja, insoursysinc tejaswi_athili@insoursysinc.com Reply to: tejaswi_athili@insoursysinc.com Locals are Preffered and Relocation Only from Nearby states with H1B and PP. No Must.Please share your Resumes to tejaswiinsoursysinc gmail.com Title : Python-Pyspark + (AWS GLUE) // Data EngineerLocation : Charlotte, NC OnsiteDuration : ContractTechnical Skills & Knowledge: Primary Skills: Python, PySpark, OOPS, AWS(Glue)Responsibilities:Python - Pyspark experience \u2013 PrimaryAWS (GLUE)Mid-level Python developerPython - Pyspark experience \u2013 PrimaryAWS (GLUE) \u2013 SecondaryNice to have \u2013 Airflow, Cloudformation, Jenkins etc.Should have worked on Agile projects.Candidate should have strong technical kills.Be individual contributor. Thanks & RegardsTejaswi AthiliPh: 972-440-0065Insoursys1908 Thomes Ave, Cheyenne, WY 82001Email : tejaswi_athili@insoursysinc.com Website: www.insoursys.comLinkedIN ID: https://www.linkedin.com/in/teja-attili-35709a1a6/",
        "source": "Email",
        "date_posted": "2024-10-03 14:16:35-05:00",
        "unique_id": "192542681a9430c0",
        "emp_type": [
            "contract",
            "third party"
        ],
        "tag": "AWS Data Engineer"
    }
]