[
    {
        "company": "WISEEQUATION SOLUTION INC",
        "job_title": "Software Architect Senior",
        "location": "Indianapolis, IN, USA",
        "full_location": {
            "city": "Indianapolis",
            "state": "IN",
            "country": "USA"
        },
        "job_details": {
            "employment_type": [
                "full-time",
                "third party"
            ],
            "job_code": "IN-DOR - Software Architect Senior (748505)",
            "experience_required": "12 - 15 years",
            "degree_required": "4 year applicable degree",
            "visa_sponsorship": "Not specified",
            "notice_period": "Not specified",
            "duration": "Project-based, approximately 6 months",
            "rate": "Not specified"
        },
        "skills": {
            "core": [
                "Core Java",
                "Java EE",
                "Spring MVC Framework",
                "Spring Core",
                "Spring Security",
                "Spring Data Persistence",
                "REST/SOAP API Clients",
                "Web Services"
            ],
            "primary": [
                "XML Documents",
                "XML Schemas",
                "JSON documents",
                "Design Patterns",
                "Data Structures and Algorithms",
                "JDBC",
                "Vue.js",
                "React",
                "Angular JavaScript framework",
                "jQuery",
                "CSS Frameworks like Bootstrap",
                "Maven build tools",
                "Selenium automation"
            ],
            "secondary": [
                "Migration of applications to AWS",
                "IDEs like Eclipse/IDEA/Netbeans",
                "Weblogic or similar App/web server administration",
                "Containerization platform using Docker/Kubernetes",
                "Working knowledge of Cloud Services like AWS/Azure",
                "Oracle PL/SQL",
                "Delivery using Agile Scrum Development framework",
                "Linux server configuration and management",
                "Linux scripting",
                "Web Application server-side Configuration and Deployment"
            ],
            "all": [
                "Core Java",
                "Java EE",
                "Spring MVC Framework",
                "Spring Core",
                "Spring Security",
                "Spring Data Persistence",
                "XML Documents",
                "XML Schemas",
                "JSON documents",
                "Design Patterns",
                "Data Structures and Algorithms",
                "JDBC",
                "Vue.js",
                "React",
                "Angular JavaScript framework",
                "jQuery",
                "CSS Frameworks like Bootstrap",
                "REST/SOAP API Clients",
                "Web Services",
                "Migration of applications to AWS",
                "IDEs like Eclipse/IDEA/Netbeans",
                "Weblogic or similar App/web server administration",
                "Containerization platform using Docker/Kubernetes",
                "Working knowledge of Cloud Services like AWS/Azure",
                "Oracle PL/SQL",
                "Delivery using Agile Scrum Development framework",
                "Maven build tools",
                "Selenium automation",
                "Linux server configuration and management",
                "Linux scripting",
                "Web Application server-side Configuration and Deployment"
            ]
        },
        "job_type": [
            "hybrid"
        ],
        "contact_person": "Shivani Rawat",
        "email": "shivani.r@wiseq.net",
        "jd": "From: Shivani Rawat, WISEEQUATION SOLUTION INC shivani.r@wiseq.net Reply to: shivani.r@wiseq.net State of IndianaJob Title/Req No- IN-DOR - Software Architect Senior (748505)/Sr. Java lead (12 - 15 years of experience required)Start Date - 11/04/2024End Date - 05/04/2025 Client location - 7811 Milhouse Rd. Indianapolis, IN 46241Interview Type - In person onlyWork Arrangement - Hybrid Short Description-Architect, design & develop scalable architecture systems for Java-based applications. Build and maintain highly complex, high-volume, scalable, maintainable and extensible software on a Java/J2EE application stack using full software development. Full Job Description -Architect, design & develop scalable architecture systems for Java-based applications. Build and maintain highly complex, high-volume, scalable, maintainable and extensible software on a Java/J2EE application stack using full software development. POSITION AND EXPERIENCE DESCRIPTIONProvides architectural and big picture oversight for development of new or enhanced software products. Responsible for ensuring quality and consistency of the software architecture across the system and providing day-to-day technical guidance to the development teams. Defines the system, technical, and application architectures for major areas of development and recommends courses of action to maintain cost effectiveness and competitiveness. Stays up to date on business initiatives and objectives, particularly as these relate to infrastructure and development architecture issues. Researches and implements best practices frameworks/capability models that will control costs, provide higher quality, and/or increase predictability of service delivery. Researches new technology and development tools to remain abreast of current and emerging technology.4 year applicable degree,10+ years of experience with designing, developing implementing, and maintaining Java-based software and applications, contributing to all stages of the software development lifecycle. Skills Matrix -Skill Required / Desired Amount of ExperienceStrong record of successful architecture, design and delivery across large scale software systems with a successful track record of delivery. Required 5 YearsCore Java and Java EE including but not limited to usage of Collections, Lambdas, Streams, and Concurrency best practices Required 10 YearsSpring MVC Framework, Spring Core, Spring Security, Sprint Data Persistence Required 5 YearsMigration of applications to AWS, improving scalability and performance Required 2 YearsIDEs like Eclipse/IDEA/Netbeans Required 10 YearsXML Documents, XML Schemas, JSON documents Required 5 YearsDesign Patterns, Data Structures and Algorithms, JDBC Required 10 YearsVue.js/React/Angular JavaScript framework, jQuery, Java script Required 5 YearsCSS Frameworks like Bootstrap, Angular or similar Required 4 YearsREST/SOAP API Clients and Web Services Required 5 YearsWeblogic or similar App/web server administration Required 2 YearsContainerization platform using Docker/Kubernetes Required 2 YearsWorking knowledge of Cloud Services like AWS/Azure Required 2 YearsOracle PL/SQL and ability to develop and use stored procedures Required 2 YearsDelivery using Agile Scrum Development framework Required 5 YearsMaven build tools Required 2 YearsSelenium automation Highly desired 2 YearsLinux server configuration and management, Linux scripting Highly desired 2 YearsWeb Application server-side Configuration and Deployment Highly desired 2 Years RegardsShivani RawatSr. Business Development Manager WISE EQUATION SOLUTION INC(Service-Disabled Veteran-Owned Company) Address: 3000 Polar lane Suite 903Cedar Park TX 78613Office : (512) 980-6296, Ext: 141Direct: 8178244882Fax: (615) 468-0898",
        "source": "Email",
        "date_posted": "2024-10-03 16:38:15-05:00",
        "unique_id": "1925450eddf2c31c",
        "emp_type": [
            "full-time",
            "third party"
        ],
        "tag": "Java developer"
    }
]