[
    {
        "company": "Capgemini",
        "job_title": "QA Consolidation Python BDD (Data Consistency)",
        "location": "New York, NY, USA",
        "full_location": {
            "city": "New York",
            "state": "NY",
            "country": "USA"
        },
        "job_details": {
            "employment_type": [
                "onsite",
                "third party"
            ],
            "experience_required": "5-8 years",
            "degree_required": "Not specified",
            "visa_sponsorship": "Not specified",
            "notice_period": "Not specified",
            "duration": "Not specified",
            "rate": "Not specified"
        },
        "skills": {
            "core": [
                "Python",
                "BDD",
                "Data Consistency",
                "Data Quality Automation",
                "Pytest"
            ],
            "primary": [
                "SQL",
                "Automation Frameworks",
                "Agile Development",
                "CI/CD",
                "TeamCity",
                "Jenkins"
            ],
            "secondary": [
                "Analytical Skills",
                "Problem-Solving Skills",
                "Leadership",
                "Communication Skills",
                "Stakeholders Management"
            ],
            "all": [
                "Python",
                "BDD",
                "Data Consistency",
                "Data Quality Automation",
                "Pytest",
                "SQL",
                "Automation Frameworks",
                "Agile Development",
                "CI/CD",
                "TeamCity",
                "Jenkins",
                "Analytical Skills",
                "Problem-Solving Skills",
                "Leadership",
                "Communication Skills",
                "Stakeholders Management"
            ]
        },
        "job_type": [
            "onsite"
        ],
        "contact_person": "Santhoshi",
        "email": "santhoshi@hanstaffing.com",
        "jd": "From: Santhoshi, HAN IT Staffing santhoshi@hanstaffing.com Reply to: santhoshi@hanstaffing.com Role : QA Consolidation Python BDD (Data Consistency) - OnsiteLocation: FIFTH AVE ,NYC Client : Capgemini JOB DESCRIPTION:\"C1 - Python BDD (Data Consistency)Detailed Job Description : 5-8 years of experience in Python AutomationHands on experience in Data Consistency and Data Quality Automation testingShould have deep hand on experience in Pytest BDD frameworkShould have hands on experice on any SQL languageStrong experience in development, execution , maintenance and analyzing automated testingStrong Knowledge of building automation frameworks from scratchMust have experience in implementing automation solutions within an Agile development lifecycle.Experience working in CI/CD environments using tools like TeamCity/JenkinsMust have strong analytical and creative problem-solving skillsMust be able work independently for any given taskExcellent leadership and communication skillsGood to have Stakeholders management and Leading Team\"",
        "source": "Email",
        "date_posted": "2024-10-03 17:21:29-05:00",
        "unique_id": "192547882a8eab6b",
        "emp_type": [
            "onsite",
            "third party"
        ],
        "tag": "Python developer"
    }
]