[
    {
        "company": "Sibitalent Corp.",
        "job_title": "Senior Java Engineer",
        "location": "Arlington, VA, USA",
        "full_location": {
            "city": "Arlington",
            "state": "VA",
            "country": "USA"
        },
        "job_details": {
            "employment_type": [
                "contract",
                "third party"
            ],
            "job_code": "",
            "experience_required": "10 years",
            "degree_required": "Not specified",
            "visa_sponsorship": "Must have existing work authorization",
            "notice_period": "Not specified",
            "duration": "Long Term",
            "rate": "$60/hr. C2C Non negotiable"
        },
        "skills": {
            "core": [
                "Java",
                "Springboot",
                "Microservices",
                "Kafka",
                "CI/CD",
                "Security (OWASP etc)",
                "Cloud"
            ],
            "primary": [
                "HTML",
                "CSS",
                "JavaScript",
                "Typescript",
                "React",
                "Angular",
                "Vue",
                "RESTful APIs",
                "JSON",
                "Git",
                "Agile development methodologies"
            ],
            "secondary": [
                "UI testing frameworks and tools"
            ],
            "all": [
                "Java",
                "Springboot",
                "Microservices",
                "Kafka",
                "CI/CD",
                "Security (OWASP etc)",
                "Cloud",
                "HTML",
                "CSS",
                "JavaScript",
                "Typescript",
                "React",
                "Angular",
                "Vue",
                "RESTful APIs",
                "JSON",
                "Git",
                "Agile development methodologies",
                "UI testing frameworks and tools"
            ]
        },
        "job_type": [
            "hybrid"
        ],
        "contact_person": "Sagar Kumar",
        "email": "sagar.kumar@sibitalent.com",
        "jd": "From: Sagar, Sibitalent sagar.kumar@sibitalent.com Reply to: sagar.kumar@sibitalent.com Only H1B/ H4 and L2 EAD workable with Passport no. Role- Senior Java EngineerLocations: Arlington, VA \u2013 Hybrid Duration: Long TermRate: $60/hr. C2C Non negotiable Must Have: 10 Years experience Minimum Java (OOPS/12 Factor/SOLID), Springboot, Microservices, Kafka, CI/CD, Security (OWASP etc), Cloud Responsibilities: Build responsive, user-friendly UIs. Integrate UIs with Java/Spring Boot backend. Debug and resolve UI and backend integration issues. Work with cross-functional teams to deliver end-to-end solutions. Requirements: Strong front-end skills (HTML, CSS, JavaScript, Typescript, React/Angular/Vue). Familiarity with RESTful APIs, JSON, and integrating front-end with back-end services. Moderate Java/Spring Boot experience. Experience with version control (Git) and agile development methodologies. Familiarity with UI testing frameworks and tools. Sagar Kumar Sibitalent Corp. E-Mail: sagar.kumar@sibitalent.comWebsite:www.sibitalent.com /www.exarcainc.com Office \u2013 101, E, Park Blvd.-Suite 600, Plano, TX 75074",
        "source": "Email",
        "date_posted": "2024-10-03 16:29:26-05:00",
        "unique_id": "1925448db4e243e3",
        "emp_type": [
            "contract",
            "third party"
        ],
        "tag": "Java developer"
    }
]