[
    {
        "company": "Vyze Inc",
        "job_title": "Facets Developer",
        "location": "USA",
        "full_location": {
            "city": "",
            "state": "",
            "country": "USA"
        },
        "job_details": {
            "employment_type": [
                "third party"
            ],
            "job_code": "",
            "experience_required": "Not specified",
            "degree_required": "Not specified",
            "visa_sponsorship": "Not specified",
            "notice_period": "Not specified",
            "duration": "Not specified",
            "rate": "Not specified"
        },
        "skills": {
            "core": [
                "C#",
                "SQL",
                "PL/SQL",
                "Facets",
                "SQL Server"
            ],
            "primary": [
                "Healthcare Terminology",
                "Agile Development",
                "Code Review",
                "Unit Testing",
                "Release Management",
                "Systems Optimization",
                "Environmental Validation",
                "Issue Resolution"
            ],
            "secondary": [
                "Facets Data Model",
                "Facets Batch Jobs",
                "EDI Transactions (835 and 837)",
                "Technical Design Document",
                "Defect Remediation",
                "QA"
            ],
            "all": [
                "C#",
                "SQL",
                "PL/SQL",
                "Facets",
                "SQL Server",
                "Healthcare Terminology",
                "Agile Development",
                "Code Review",
                "Unit Testing",
                "Release Management",
                "Systems Optimization",
                "Environmental Validation",
                "Issue Resolution",
                "Facets Data Model",
                "Facets Batch Jobs",
                "EDI Transactions (835 and 837)",
                "Technical Design Document",
                "Defect Remediation",
                "QA"
            ]
        },
        "job_type": [
            "remote"
        ],
        "contact_person": "Vishal Kumar",
        "email": "vishal@vyzeinc.com",
        "jd": "From: Vishal kumar, Vyze Inc vishal@vyzeinc.com Reply to: vishal@vyzeinc.com Job Description -Title: Facets DeveloperRemoteManager notes: We\u2019re looking on finding someone with health insurance (payer) implementation experience.Description: \u2022 Facets Developer \u2013 C# and SQL for agile development for a Facets implementation role. This Developer position will participate in a team environment for the delivery and code for a Facets testing and implementation. Responsible for programming, debugging and testing of applications in a development environment. Generally responsible for database design and system testing. ROLE & RESPONSIBILITIES \u2022 Strong healthcare domain knowledge (Healthcare Terminology). \u2022 Work experience in design develop solutions for inbound and outbound interfaces using PL/SQL and C#.NET. \u2022 Code review and unit testing \u2022 Release management best practices systems optimization environmental validation and issue resolution. \u2022 Good understanding of the Facets Data Model and work experience in building Facets extension \u2022 Familiar with the Core Facets batch jobs and EDI transactions (835 and 837). \u2022 Understand functional specs and create a detailed technical design (technical Design document). \u2022 Hands-on knowledge with SQL Server, Facets,\u2022 Support defect remediation, QA and release management procedures Experience with: \u2022 Facets customization development, working with extensions, integrations and / or data conversions. \u2022 Good understanding of Facets data model and Facets batch \u2022 .Net, C#, and SQL Server",
        "source": "Email",
        "date_posted": "2024-10-03 08:20:53-05:00",
        "unique_id": "192529f9b49ba18b",
        "emp_type": [
            "third party"
        ],
        "tag": ".net developer"
    }
]