[
    {
        "company": "IBM/PayPal",
        "job_title": "MDM Business System Analyst (BSA)",
        "location": "USA",
        "full_location": {
            "city": "",
            "state": "",
            "country": "USA"
        },
        "job_details": {
            "employment_type": [
                "third party"
            ],
            "job_code": "",
            "experience_required": "At least 8 years",
            "degree_required": "Not specified",
            "visa_sponsorship": "Not specified",
            "notice_period": "Not specified",
            "duration": "Not specified",
            "rate": "Not specified"
        },
        "skills": {
            "core": [
                "Master Data Management",
                "Informatica MDM",
                "SAP MDG",
                "customer service",
                "business requirements documentation"
            ],
            "primary": [
                "written communication",
                "verbal communication",
                "system development",
                "application architecture design",
                "testing methodologies",
                "multi-tasking",
                "data quality",
                "project management",
                "MS PowerPoint",
                "MS Excel"
            ],
            "secondary": [
                "adaptability to new technologies",
                "end user perspective",
                "managing small to medium projects"
            ],
            "all": [
                "Master Data Management",
                "Informatica MDM",
                "SAP MDG",
                "customer service",
                "business requirements documentation",
                "written communication",
                "verbal communication",
                "system development",
                "application architecture design",
                "testing methodologies",
                "multi-tasking",
                "data quality",
                "project management",
                "MS PowerPoint",
                "MS Excel",
                "adaptability to new technologies",
                "end user perspective",
                "managing small to medium projects"
            ],
            "with_experience": [
                "Informatica MDM",
                "SAP MDG",
                "Master Data Management"
            ]
        },
        "job_type": [
            "remote"
        ],
        "contact_person": "Kishore",
        "email": "kishore@calabitek.com",
        "jd": "From: kishore, Calabitek kishore@calabitek.com Reply to: kishore@calabitek.com Client:- IBM/PayPalPosition:MDM Business System Analyst (BSA)Location: Anywhere in US Job DescriptionThe MDM Business System Analyst (BSA) position requires a strong understanding of Master Data Management concepts, industry data standards, and data governance that support Finance operations. The BSA collaborates with Product managers, Operational Managers, and external vendors to ensure consistent data management and accurate information flow to support core product functions, such as Payments, as well as corporate functions such as Accounting, FP&A, Treasury, and Regulatory reporting. Basic Qualifications:At least 8 years past professional Business Analyst or consulting experiencePreferred Technical Capabilities: (experience that will help this person be successful)Experience with Informatica MDM and SAP MDG.Strong customer service skills, ability to elicit and clearly document complex business requirements and reconcile differences between multiple business/technical stakeholdersExcellent written and verbal communication skillsStrong understanding and experience of system and software development, technical application architecture design and testing methodologiesAbility to multi-task and work quickly, managing their own progress on multiple projects/work streams at onceExperience with master data and data quality in relation to product /data considerations is a big plusExperience in managing small to medium projects is a big plus.Adapt learning new technologies and an end user perspectiveProficient with MS PowerPoint and MS ExcelProject management experience organizing tasks and tracking deliverables. Send resume to Kishore@calabitek.com",
        "source": "Email",
        "date_posted": "2024-10-03 12:29:07-05:00",
        "unique_id": "19253733d3206701",
        "emp_type": [
            "third party"
        ],
        "tag": "Business Analyst"
    }
]