[
    {
        "company": "Source Infotech",
        "job_title": "Lead Azure Integration Developer",
        "location": "Cleveland, OH, USA",
        "full_location": {
            "city": "Cleveland",
            "state": "OH",
            "country": "USA"
        },
        "job_details": {
            "employment_type": [
                "contract",
                "third party"
            ],
            "job_code": "",
            "experience_required": "5-15 years",
            "degree_required": "Not specified",
            "visa_sponsorship": "No visa sponsorship",
            "notice_period": "Not specified",
            "duration": "6 months",
            "rate": "Not specified"
        },
        "skills": {
            "core": [
                "Azure Cloud",
                "Azure Integration Design Patterns",
                "Deployment Technologies",
                "Development",
                "Leadership skills"
            ],
            "primary": [
                "Cloud Technologies & Platforms",
                "CI/CD processes",
                "Understanding of integrations tools",
                "Web Services",
                "APIs",
                "Microservices",
                "SOA"
            ],
            "secondary": [
                "Software Development Lifecycle Methodologies",
                "Event Driven Architecture",
                "Devops",
                "Analytical skills",
                "Problem-solving skills",
                "Emerging Technologies",
                "Automation Tools",
                "Change Management"
            ],
            "all": [
                "Azure Cloud",
                "Azure Integration Design Patterns",
                "Deployment Technologies",
                "Development",
                "Leadership skills",
                "Cloud Technologies & Platforms",
                "CI/CD processes",
                "Understanding of integrations tools",
                "Web Services",
                "APIs",
                "Microservices",
                "SOA",
                "Software Development Lifecycle Methodologies",
                "Event Driven Architecture",
                "Devops",
                "Analytical skills",
                "Problem-solving skills",
                "Emerging Technologies",
                "Automation Tools",
                "Change Management"
            ]
        },
        "job_type": [
            "hybrid"
        ],
        "contact_person": "Khushank Chauhan",
        "email": "khushank@sourceinfotech.com",
        "jd": "From: KhushankChauhan, Source Infotech khushank@sourceinfotech.com Reply to: khushank@sourceinfotech.com Lead Azure Integration DeveloperLocation: Cleveland, OH (Hybrid Onsite)Duration: 6 months C2HIV: Phone and VideoVisa: No H1b/CPT Here\u2019s 5 focused skills the Integration Developer needs to have.1. Azure Cloud2. Azure Integration Design Patterns 3. Deployment Technologies4. Development 5. Leadership skills Job Description \u2013 Integration Developer and DesignerThe Integration Developer role is responsible for integrating leading technologies in the design of complex technology solutions across domains, while considering business goals, technical feasibility, and long-term scalability. This person will work with the integration and architecture teams, as well as application teams in and out of their own org reporting structure, as integrations span to those. In addition, they will foster collaboration among stakeholders to understand business needs and implement the best solutions to meet their needs, and support solutions 24x7 to cover systems needs.Responsibilities\u2022 Design and build integration solutions that are aligned to the organization\u2019s business goals (e.g., speed, reliability, scalability)\u2022 Leverage expertise in domain-driven design principals to improve upon conceptual and logical models and advocate for their organization-wide adoption in adherence to architectural principles, policies, standards, and frameworks\u00b7 Foster collaboration among various stakeholders across customer teams and lead discussion to drive understanding of integration value\u00b7 Drive definition of work needed for application teams by facilitating discussion and creation of work cards, maintain work progress with team norms for agile tracking of the same\u00b7 Provide technical expertise and training opportunities to empower technical teams in support of the implementation of integration design\u2022 Drive strategic communication regarding technical considerations and impacts to stakeholders helping them understand implications in detailKnowledge & Experience\u2022 5-15 years of experience in building integrations and designing solutions, including synchronous and asynchronous data, transactional, and service-oriented patterns\u2022 Proven track record in designing and architecting complex systems at the functional or enterprise level\u2022 Expertise in technology integration and the design of interfaces between systems\u2022 Expertise in Software Development Lifecycle Methodologies (Agile, Waterfall, etc.)\u2022 Experience with EDA (Event Driven Architecture) and platforms such as Kafka, Azure Integration Services, Confluent, Solace etc.\u2022 Experience with Devops and CI/CD methodologies \u2022 Background and familiarity with cloud and infrastructure platforms to support HA and resiliency \u2022 Analytical and problem-solving skillsTechnical Skills\u2022 Cloud Technologies & Platforms including infrastructure automation using Terraform, Puppet, or Ansible\u2022 CI/CD processes, GitHub Actions, Jenkins, or Azure DevOps\u2022 Understanding of integrations tools like Talend/Informatica, Boomi, Azure Logic Apps, Azure Data Factory/Synapse\u2022 Web Services, APIs, Microservices, and SOA\u2022 Application and Data Architecture as related to Integration\u2022 Software Development Lifecycle (SDLC) Methodology\u2022 Emerging Technologies and Automation Tools\u2022 Change Management",
        "source": "Email",
        "date_posted": "2024-10-03 11:05:45-05:00",
        "unique_id": "192532a0071eecfa",
        "emp_type": [
            "contract",
            "third party"
        ],
        "tag": "Azure Data Engineer"
    }
]