[
    {
        "company": "NorthITe",
        "job_title": "Senior .NET Full Stack Developer",
        "location": "Water Street, NY, USA",
        "full_location": {
            "city": "Water Street",
            "state": "NY",
            "country": "USA"
        },
        "job_details": {
            "employment_type": [
                "full-time",
                "third party"
            ],
            "experience_required": "12+ years",
            "degree_required": "BS or MS degree in Computer Science or Information Technology",
            "visa_sponsorship": "Not specified",
            "notice_period": "Not specified",
            "duration": "Not specified",
            "rate": "Not specified"
        },
        "skills": {
            "core": [
                ".NET",
                ".NET Core",
                "Angular",
                "Cloud-based technologies",
                "RDBMS"
            ],
            "primary": [
                "Docker",
                "Kubernetes",
                "Continuous integration",
                "ADO",
                "GIT",
                "Jenkins",
                "JSON Libraries",
                "XML libraries",
                "SoapUI",
                "NUnit",
                "jasmine",
                "karma",
                "Postman"
            ],
            "secondary": [
                "Software/enterprise integration design principles",
                "Serverless frameworks",
                "Performance testing",
                "Load testing",
                "Microsoft Office Automation",
                "REST/OData",
                "AWS",
                "IIS",
                "SQL",
                "Oracle"
            ],
            "all": [
                ".NET",
                ".NET Core",
                "Angular",
                "Cloud-based technologies",
                "RDBMS",
                "Docker",
                "Kubernetes",
                "Continuous integration",
                "ADO",
                "GIT",
                "Jenkins",
                "JSON Libraries",
                "XML libraries",
                "SoapUI",
                "NUnit",
                "jasmine",
                "karma",
                "Postman",
                "Software/enterprise integration design principles",
                "Serverless frameworks",
                "Performance testing",
                "Load testing",
                "Microsoft Office Automation",
                "REST/OData",
                "AWS",
                "IIS",
                "SQL",
                "Oracle"
            ]
        },
        "job_type": [
            "hybrid"
        ],
        "contact_person": "Criz Salvin",
        "email": "criz@northite.com",
        "jd": "From: Criz Salvin, NorthITe criz@northite.com Reply to: criz@northite.com Senior .NET Full Stack Developer (Angular)Location: Water Street, NY or Princeton, NJ (Hybrid) 3 days onsiteThe Team:In partnership with Product Management and Quality Assurance, your team shares a common mission to create products that satisfy our users. Your team will enable product engineering teams, promise engineering excellence and deliver high-quality end products.Business impact:\u2022 The client team is having strong presence in the organization, they design and develop services for Rating enterprise systems, specializing in data distribution, management, integration and publishing technologies.\u2022 We are looking for a Senior Product Engineer to lead a global staff of software developers for our D&C product line comprising a large suite of interrelated tools, services, business-critical capabilities and applications. You will be responsible for helping to build our agile organization and align to a culture of continuous improvement, partnership, trust and sharing. You will lead a global staff of software engineers and partner with your Product Management and Quality peers to support a large, global group of agile scrum teams.\u2022 Fundamental to this position is a demonstrable ability to combine your strong agile leadership and problem-solving skills with deep technical and delivery know-how. You have exceptional collaboration and communication skills, are highly motivated, creative and engaged. As a servant leader, you will enable experienced engineers and the teams they support to drive business value while your organization focuses on planning, building, improving, innovating and contributing to the product vision.Responsibilities:\u2022 Hands on senior programmer with strong analytical, development and debugging skills\u2022 Team member with empathy and compassion. Focus on building a team culture that is based on trust.\u2022 Demonstrate a strong sense of ownership and responsibility with assignments. This includes understanding requirements, technical specifications, design, implementation, unit testing, builds/deployments, and code management.\u2022 Ensure compliance through the adoption of enterprise standards and promotion of best practice / guiding principles aligned with organization standards.\u2022 Should execute complex technical requirements.\u2022 Be in tune with emerging trends in Cloud\u2022 Interface with quality assurance testers and other teams as needed.\u2022 Excellent written and oration skills.Experience & Qualifications:\u2022 5+ years full stack development experience in modern web development technologies with .NET/.NET Core\u2022 software/enterprise integration design principles\u2022 Strong experience and understanding in cloud-based technologies, design patterns and best practices.\u2022 Good understanding and knowledge of RDBMS\u2022 Good Analytical skills to solve problems.\u2022 Knowledge in building applications using serverless frameworks and containers using Dockers and Kubernetes\u2022 Experience with Continuous integration and deployment tools like ADO, GIT, Jenkins.\u2022 Good understanding and usage of JSON Libraries and XML libraries\u2022 Experience with tools such as SoapUI, NUnit, jasmine, karma, Postman and be able to create unit test cases, performance testing, load testing\u2022 Ability to organize and manage tasks and work to critical project timelines in a fast-paced environment.Preferred qualifications:\u2022 BS or MS degree in Computer Science or Information Technology\u2022 Full stack development experience in modern web development technologies, .NET/.NET Core, Web API\u2019s, Microsoft Office Automation, REST/OData, AWS, Angular, IIS, SQL, Oracle\u2022 proven software/enterprise integration and full-stack knowledge including modern distributed front end and back-end technology stacks\u2022 Quality first mindset with a strong background and experience with developing products for a global audience at scale\u2022 Excellent analytical thinking, interpersonal, oral, and written communication skills with strong ability to influence both IT and business partners.",
        "source": "Email",
        "date_posted": "2024-10-03 10:48:35-05:00",
        "unique_id": "1925316917f0bfcf",
        "emp_type": [
            "full-time",
            "third party"
        ],
        "tag": ".net developer"
    }
]