[
    {
        "company": "Capital One",
        "job_title": "Python Engineer",
        "location": "McLean, VA, USA",
        "full_location": {
            "city": "McLean",
            "state": "VA",
            "country": "USA"
        },
        "job_details": {
            "employment_type": [
                "contract",
                "third party"
            ],
            "experience_required": "5+ years",
            "degree_required": "Not specified",
            "visa_sponsorship": "Not specified",
            "notice_period": "Not specified",
            "duration": "Not specified",
            "rate": "Not specified"
        },
        "skills": {
            "core": [
                "Python",
                "AWS",
                "RESTful APIs",
                "microservices architecture"
            ],
            "primary": [
                "Pytest",
                "Unitest",
                "FastAPI"
            ],
            "secondary": [
                "Automation Testing",
                "Monkey patch",
                "pytest-mockito"
            ],
            "all": [
                "Python",
                "AWS",
                "RESTful APIs",
                "microservices architecture",
                "Pytest",
                "Unitest",
                "FastAPI",
                "Automation Testing",
                "Monkey patch",
                "pytest-mockito"
            ]
        },
        "job_type": [
            "onsite",
            "hybrid"
        ],
        "contact_person": "Gangadar Reddy",
        "email": "edula.gangadar@centraprise.com",
        "jd": "From: Gangadar Reddy, Centraprise edula.gangadar@centraprise.com Reply to: edula.gangadar@centraprise.com Role: Python Engineer Location: McLean or Richmond, VAHire type: ContractJob description:Top 3 Must Haves:1. Python: Senior Python Developers who are comfortable in writing production software in Python. Superficial scripting knowledge is not sufficient.2. AWS: Proficiency in AWS is a must. AWS knowledge of Lambdas & Step functions is a huge plus.3. RESTful APIs and microservices architecture : Experience with RESTful APIs and microservices architecture, and an understanding of how to design and implement them effectivelyRequired skills:\u2022 Python, Pytest, Unitest are all mandatory\u2022 Strong Proficiency in Python programming language, including experience with frameworks such as FastAPI\u2022 AWS Lambdas & AWS Stepfunctions is a huge plus.\u2022 5+ years of experience in Python & AWS.\u2022 8+ years of total experienceRole/Responsibilities:\u2022 The position is focused on python development of components for a software application platform\u2022 The candidate will develop and support the middle layer of the application to build, test, and deploy RESTful micro services, create shared services components\u2022 Engineer capable of designing solutions, writing code, testing code, automating test and deployment\u2022 Automation Testing: Pytest, Unitest, Monkey patch, pytest-mockito etc RegardsSiva Gangadar reddyUS IT RecruiterCentraprise Corp33 Wood Avenue South, Suite 600, Iselin NJ 08830 Desk: 469-639-0369Email: edula.gangadar@centraprise.com We respect your online privacy. If you would like to be removed from our mailing list please reply with ",
        "source": "Email",
        "date_posted": "2024-10-03 14:35:47-05:00",
        "unique_id": "19253e0d2b044e74",
        "emp_type": [
            "contract",
            "third party"
        ],
        "tag": "Python developer"
    }
]