[
    {
        "company": "Maintec Technologies",
        "job_title": "Lead Tech Product Analyst",
        "location": "Charlotte, NC, USA",
        "full_location": {
            "city": "Charlotte",
            "state": "NC",
            "country": "USA"
        },
        "job_details": {
            "employment_type": [
                "contract",
                "third party"
            ],
            "experience_required": "8+ years",
            "degree_required": "Bachelor\u2019s Degree or Equivalent Degree",
            "visa_sponsorship": "Not specified",
            "notice_period": "Not specified",
            "duration": "Long Term",
            "rate": "Not specified"
        },
        "skills": {
            "core": [
                "business analysis",
                "Agile methodologies",
                "process improvement",
                "user requirements",
                "communication"
            ],
            "primary": [
                "banking domain knowledge",
                "Jira",
                "user stories",
                "stakeholder management",
                "problem-solving"
            ],
            "secondary": [
                "SAFE agile",
                "program increment process",
                "visualization",
                "collaboration",
                "leadership"
            ],
            "all": [
                "business analysis",
                "Agile methodologies",
                "process improvement",
                "user requirements",
                "communication",
                "banking domain knowledge",
                "Jira",
                "user stories",
                "stakeholder management",
                "problem-solving",
                "SAFE agile",
                "program increment process",
                "visualization",
                "collaboration",
                "leadership"
            ]
        },
        "job_type": [
            "onsite"
        ],
        "contact_person": "Ajit Mehta",
        "email": "ajit@maintec.com",
        "jd": "Hi, My name is Ajit and I am a Staffing Specialist at Maintec Technologies. I am reaching out to you on an exciting job opportunity with one of our clients. Role - Lead Tech Product Analyst Location - Charlotte, NC Experience - 8+ Years Duration: Long Term On contract The Product Analyst will work in partnership with key business partners and the technical team to translate business needs into clearly and easily understood agile user stories. The main focus will be on banking domain capabilities and ensuring the acceptance criteria is delivered successfully. Responsibilities: Understand user needs and translate them into detailed requirements for the team using Jira Build use cases, user stories, visualization, and process flows Understand, refine, and validate the \u2018Voice of Customers\u2019 (VOC) - business challenges, opportunities, and risks with stakeholders; challenge stakeholders on their assumptions, understand \u201cwhy\u201d, and distinguish needs from wants Be the requirements subject matter expert representing stakeholders; ensure details of processes are documented, understood, and vetted with stakeholders and project teams Proactively communicate and collaborate with stakeholders and delivery teams to prioritize requirements, define and evaluate potential solutions, and propose quick fixes when appropriate In partnership with product owners, maintain a deep understanding of strategic business goals to ensure that the backlog priorities are aligned with business needs Apply compliance requirements within scope of responsibility, provide documentation and participate in compliance activities as required Support UAT testing and ensure capabilities are deployed successfully Support post-deployment launch activities (bug and enhancement backlog stories) Qualifications: Demonstrate knowledge of business analysis skills, including process and data-driven analysis experience using common industry frameworks Direct experience as a business analyst in multiple cross-functional process improvement initiatives Proven experience driving consensus across multiple stakeholders from different business functions Excellent verbal and written communication skills to work effectively with business stakeholders, team members, and management Ability to understand technical jargon and communicate it in layman\u2019s terms Experience with Agile methodologies, documenting user requirements/user stories for development of software Demonstrates ability to challenge the status quo and continuously innovate through experimentation (test & learn) Strong problem-solving skills with the ability of accurately analyzing situations and reaching productive decisions based on informed judgment Leadership, collaboration, communication and analytical skills are required Required: Bachelor\u2019s Degree or Equivalent Degree Minimum of 5 years business analyst work experience within Banking Domain Knowledge in SAFE agile, program increment process",
        "source": "Email",
        "date_posted": "2024-10-03 14:21:25-05:00",
        "unique_id": "19253d3aa81714d2",
        "emp_type": [
            "contract",
            "third party"
        ],
        "tag": "Business Analyst"
    }
]