[
    {
        "company": "Arthur Grand Technologies",
        "job_title": "Java AWS Developer",
        "location": "Columbus, OH, USA",
        "full_location": {
            "city": "Columbus",
            "state": "OH",
            "country": "USA"
        },
        "job_details": {
            "employment_type": [
                "contract",
                "third party"
            ],
            "experience_required": "Not specified",
            "degree_required": "Not specified",
            "visa_sponsorship": "Not specified",
            "notice_period": "Not specified",
            "duration": "Long term",
            "rate": "Not specified"
        },
        "skills": {
            "core": [
                "Java",
                "Spring",
                "Microservices",
                "AWS"
            ],
            "primary": [
                "J2EE",
                "Webservices",
                "PL/SQL",
                "Object-Oriented Analysis",
                "Object Oriented Design",
                "GIT",
                "Jenkins",
                "MVC",
                "Java Design Patterns",
                "JUnit",
                "Oracle",
                "SQL Server",
                "SQL",
                "SOAP",
                "REST",
                "IntelliJ",
                "Maven",
                "Tomcat"
            ],
            "secondary": [
                "Agile software development",
                "SDLC",
                "business analysis",
                "development",
                "maintenance",
                "software improvement"
            ],
            "all": [
                "Java",
                "Spring",
                "Microservices",
                "AWS",
                "J2EE",
                "Webservices",
                "PL/SQL",
                "Object-Oriented Analysis",
                "Object Oriented Design",
                "GIT",
                "Jenkins",
                "MVC",
                "Java Design Patterns",
                "JUnit",
                "Oracle",
                "SQL Server",
                "SQL",
                "SOAP",
                "REST",
                "IntelliJ",
                "Maven",
                "Tomcat",
                "Agile software development",
                "SDLC",
                "business analysis",
                "development",
                "maintenance",
                "software improvement"
            ]
        },
        "job_type": [
            "onsite"
        ],
        "contact_person": "Ramdas",
        "email": "teamrichard@arthurgrand.com",
        "jd": "From: Team Richard, Arthur Grand Technologies teamrichard@arthurgrand.com Reply to: teamrichard@arthurgrand.com Arthur Grand Technologies is currently seeking a highly motivated and skilled Java AWS Developer for one of our clients. Role: Java AWS DeveloperLocation: Columbus Ohio & Wilmington, DE (On-site) Duration: Long term Contract Mandate skills: Java, Spring boot, Microservices, AWS Job Description:Experience in Agile software development methodology and practices with full development lifecycle from inception through implementation.Required: Java, J2EE, Spring, Microservice, Webservices, PL/SQLWorking knowledge of Object-Oriented Analysis/Object Oriented Design methodologies and life cycles.Demonstrated experience with SCM tools such as GIT, JenkinsExperience with application development on Java, J2EE, Spring, and MVC, Java Design Patterns and JUnit.Knowledge of Relational Databases like Oracle/SQL Server, SQLKnowledge of Web service technologies including SOAP/REST.Strong working knowledge of IntelliJ, Maven and Tomcat.Ability to work collaboratively in teams and develop meaningful relationships to achieve common goalsKnowledge of architecture, design and business processesProficiency in modern programming languagesExperience in design and build of complex application systems using the new banking architecture including Java/J2EE/Spring technologies. Proficiency in one or more general purpose programming languages including Java/J2EE/JSP based Web applications/Middleware and Batch systems.Experience in design, analysis, development, coding, unit testing, debug and documentation for Java/J2EE systems including Web applications, business services, batch applications, large/complex projects and utilizing Web Services and Java RMI technologies to improve interface/API and significantly enhance integration capability between front-end and back-end systemsA fundamental understanding of software skills and the different components of SDLC such as business analysis, development, and maintenance and software improvement is essential About Arthur Grand Technologies:Arthur Grand Technologies is a leading provider of staffing and technology consulting services. Our company is managed by a team of professionals who have worked for big 5 consulting firms for 20+ years. We are a minority-owned staff augmentation and technology consulting company.At Arthur Grand Technologies, we value our employees & contractors and strive to provide them with challenging, interesting work, market-relevant benefits, and opportunities for professional growth. If you have the necessary qualifications, and are excited to join a dynamic team, please send your resume to teamrichard@arthurgrand.com for immediate consideration.Thank you for considering Arthur Grand Technologies. We look forward to hearing from you soon. Best regards,RamdasArthur Grand Technologies Incwww.arthurgrand.comArthur Grand Technologies is an Equal Opportunity Employer (including disability/vets)",
        "source": "Email",
        "date_posted": "2024-10-03 13:02:31-05:00",
        "unique_id": "19253b7acfe2db2e",
        "emp_type": [
            "contract",
            "third party"
        ],
        "tag": "Java developer"
    }
]