[
    {
        "company": "Stellar IT Solutions",
        "job_title": "WebSphere/Portal Java Developer",
        "location": "USA",
        "full_location": {
            "city": "",
            "state": "",
            "country": "USA"
        },
        "job_details": {
            "employment_type": [
                "third party"
            ],
            "job_code": "",
            "experience_required": "7+ years",
            "degree_required": "Not specified",
            "visa_sponsorship": "Not specified",
            "notice_period": "Not specified",
            "duration": "Not specified",
            "rate": "Not specified"
        },
        "skills": {
            "core": [
                "WebSphere Portal",
                "HCL Portal",
                "Java",
                "J2EE",
                "Hibernate",
                "Spring Framework"
            ],
            "primary": [
                "JSF",
                "MyFaces",
                "Struts",
                "WebSphere Application Server",
                "HTML",
                "CSS",
                "JavaScript",
                "RESTful services"
            ],
            "secondary": [
                "Dojo",
                "JQuery",
                "SQL",
                "Oracle database"
            ],
            "all": [
                "WebSphere Portal",
                "HCL Portal",
                "Java",
                "J2EE",
                "Hibernate",
                "Spring Framework",
                "JSF",
                "MyFaces",
                "Struts",
                "WebSphere Application Server",
                "HTML",
                "CSS",
                "JavaScript",
                "RESTful services",
                "Dojo",
                "JQuery",
                "SQL",
                "Oracle database"
            ]
        },
        "job_type": [
            "remote"
        ],
        "contact_person": "Arpitha S",
        "email": "arpithas@stellarit.com",
        "jd": "From: Arpitha S, Stellar IT Solutions arpithas@stellarit.com Reply to: arpithas@stellarit.com WebSphere/Portal Java Developer- Only Citizens, ability to get US Public Trust ClearancePosition: WebSphere/Portal Java DeveloperLocation: RemoteJob Description:Skills/Qualification:\u00b77+ years of experience in enterprise software development\u00b7 Technical design, development, programming, and problem-solving skills\u00b7 Experience working with HCL portal Themes and Skins\u00b7 Proven experience in Portal Development with a focus on Portlets, Themes and Skins\u00b7 Experience in designing and developing web applications using JSF, MyFaces, and Struts\u00b7 Experience in Web applications migration of Struts, JSF, and Portlets to the latest version\u00b7 Working knowledge of WebSphere Portal Server, WebSphere Content Management (WCM), and Portlets JSR168 & JSR286\u00b7 Design and developing web applications using HCL Portal Server 9.5/ IBM WebSphere Application Server 9.x\u00b7 Working knowledge of Hibernate and Spring Framework\u00b7 Knowledge of Java and J2EE development using IBM Rational Application Developer for WebSphere (RAD)\u00b7 Knowledge of JavaScript and JavaScript frameworks such as Dojo and JQuery\u00b7 Experience in HTML, CSS, Ajax, including developing or working with services (RESTful or otherwise)\u00b7 SQL development (exposure to Oracle database development a plus)\u00b7 Ability to communicate clearly and effectively with peers, and management\u00b7 Strong commitment to high quality work and timely deliverables\u00b7 US Citizenship, ability to get US Public Trust Clearance Regards, Arpitha STechnical Recruiter Email: arpithas@stellarit.comRockville, MD | McLean, VA | Palo Alto, CAStellarIT.com | StellariDeaLabs.com",
        "source": "Email",
        "date_posted": "2024-10-03 14:00:14-05:00",
        "unique_id": "19253c04aaef763a",
        "emp_type": [
            "third party"
        ],
        "tag": "Java developer"
    }
]