[
    {
        "company": "Millennium Infotech",
        "job_title": "Java Developer with Kubernetes Experience",
        "location": "Princeton, NJ, USA",
        "full_location": {
            "city": "Princeton",
            "state": "NJ",
            "country": "USA"
        },
        "job_details": {
            "employment_type": [
                "full-time",
                "third party"
            ],
            "experience_required": "Over 12 years of experience working in the IT industry developing solutions in J2EE technologies and at least 5 years as a senior Java/ J2EE Developer",
            "degree_required": "Not specified",
            "visa_sponsorship": "Not specified",
            "notice_period": "Not specified",
            "duration": "Not specified",
            "rate": "Not specified"
        },
        "skills": {
            "core": [
                "Core Java",
                "Rest APIs",
                "Kubernetes",
                "Docker",
                "J2EE"
            ],
            "primary": [
                "Tomcat",
                "Spring",
                "Web Services",
                "ORM frameworks",
                "JMS",
                "AJAX/JavaScript",
                "HTML5",
                "CSS",
                "JDBC",
                "RDBMS databases"
            ],
            "secondary": [
                "Mobile application development",
                "SQL development",
                "Performance tuning",
                "Agile development",
                "OOADD"
            ],
            "all": [
                "Core Java",
                "Rest APIs",
                "Kubernetes",
                "Docker",
                "J2EE",
                "Tomcat",
                "Spring",
                "Web Services",
                "ORM frameworks",
                "JMS",
                "AJAX/JavaScript",
                "HTML5",
                "CSS",
                "JDBC",
                "RDBMS databases",
                "Mobile application development",
                "SQL development",
                "Performance tuning",
                "Agile development",
                "OOADD"
            ]
        },
        "job_type": [
            "onsite"
        ],
        "contact_person": "bala",
        "email": "bala@mitiweb.com",
        "jd": "It is an Onsite role, looking for Candidates on W2 only. The ideal candidate must be strong in Core Java, Rest APIs, Kubernetes and Docker and display excellent written and oral skills with demonstrated interpersonal and organization abilities as well as, must be able to work in a varied, fast paced environment. Responsibilities: Work with architect and lead developer on design and development of web services for web/mobile applications. Will be responsible for architecting, developing, implementing, maintaining, and supporting Java based components and interfaces. Should have a broad understanding of various coding methodologies, testing practice, and tools and know when to apply each method to achieve the desired outcomes. Understand existing applications and troubleshoot critical issues. Provide application maintenance & support, work on enhancements and new projects. Responsible for code asset management for applications, support & promoting asset reuse. Performs unit/integrated completed system testing according to detailed functional specification. Supports the implementation of systems into production. Utilizes accepted methodologies and tools in a disciplined manner. Works independently and efficiently to meet deadlines. Must display excellent written and oral skills with demonstrated interpersonal and organization abilities and must be able to work in a varied, fast paced environment. Skills / Qualifications: Over 12 years of experience working in the IT industry developing solutions in J2EE technologies and at least 5 years as a senior Java/ J2EE Developer. 3+ years of architecture experience on large scale enterprise applications. Expertise in Tomcat/J2EE application server, Spring, Web Services, ORM frameworks, JMS, AJAX/JavaScript, HTML5, CSS, JDBC, any RDBMS databases. Experience in designing and developing web services and REST APIs. Experience in RDMS (Oracle, SQLServer, MySQL). Experience in mobile application development is a plus. Solid Knowledge of SQL development and performance tuning. Thorough understanding of OOADD. Experience in Dockers and Kubernetes a must. Experience in agile development. Ability to complete all phases of software development life cycle including analysis, design, functionality, testing and support. Ability to develop web/database applications that handle high volume transactions. Ability to work on multiple projects with multiple deadlines. Ability to communicate clearly with business users and project manager.",
        "source": "Email",
        "date_posted": "2024-10-03 09:53:40-05:00",
        "unique_id": "19252e7ba7013e12",
        "emp_type": [
            "full-time",
            "third party"
        ],
        "tag": "Java developer"
    }
]