[
    {
        "company": "Stellent IT",
        "job_title": "Business Analyst with Healthcare Industry Exp.",
        "location": "Boston, MA, USA",
        "full_location": {
            "city": "Boston",
            "state": "MA",
            "country": "USA"
        },
        "job_details": {
            "employment_type": [
                "contract",
                "third party"
            ],
            "job_code": "",
            "experience_required": "5+ years",
            "degree_required": "Bachelor\u2019s degree in computer science, Information Systems, Business Administration, or a related field.",
            "visa_sponsorship": "Not specified",
            "notice_period": "Not specified",
            "duration": "12mth+ contract",
            "rate": "Not specified"
        },
        "skills": {
            "core": [
                "5+ yr BA exp",
                "SDLC exp",
                "Use Cases exp",
                "Healthcare Industry exp"
            ],
            "primary": [
                "Knowledge of the principles of software development using the approved SDLC",
                "Proficient knowledge of Jira",
                "Long Term Care Population",
                "Complex eligibility systems",
                "Unified processes",
                "Proficiency in Microsoft 365",
                "Excel",
                "Word",
                "PowerPoint",
                "Access",
                "Visio",
                "Knowledge of methods and techniques of computer systems analysis",
                "design",
                "technical terminology",
                "codes",
                "standard abbreviations",
                "Experience with data structures",
                "application programming",
                "database development",
                "relational database theory and technology",
                "Ability to prepare flow charts",
                "diagrams",
                "Use Cases",
                "Deliver oral and written instructions in a precise, understandable manner",
                "Prepare required deliverables in accordance with established procedures",
                "Strong organizational skills",
                "Ability to maintain accurate records and status reporting",
                "Ability to understand and apply the policies",
                "procedures",
                "specifications",
                "standards",
                "guidelines governing assigned unit activities",
                "Knowledge of MA HIX or other State Health Exchange",
                "Ability to work with multiple vendors",
                "Strong organizational skills",
                "problem-solving aptitude",
                "attention to detail",
                "Ability to work well with others in a fast-paced, dynamic environment",
                "Strong initiative",
                "ability to manage multiple projects",
                "strong follow-through skills",
                "Ability to work collaboratively",
                "collegially",
                "cooperatively with others"
            ],
            "secondary": [],
            "all": [
                "5+ yr BA exp",
                "SDLC exp",
                "Use Cases exp",
                "Healthcare Industry exp",
                "Knowledge of the principles of software development using the approved SDLC",
                "Proficient knowledge of Jira",
                "Long Term Care Population",
                "Complex eligibility systems",
                "Unified processes",
                "Proficiency in Microsoft 365",
                "Excel",
                "Word",
                "PowerPoint",
                "Access",
                "Visio",
                "Knowledge of methods and techniques of computer systems analysis",
                "design",
                "technical terminology",
                "codes",
                "standard abbreviations",
                "Experience with data structures",
                "application programming",
                "database development",
                "relational database theory and technology",
                "Ability to prepare flow charts",
                "diagrams",
                "Use Cases",
                "Deliver oral and written instructions in a precise, understandable manner",
                "Prepare required deliverables in accordance with established procedures",
                "Strong organizational skills",
                "Ability to maintain accurate records and status reporting",
                "Ability to understand and apply the policies",
                "procedures",
                "specifications",
                "standards",
                "guidelines governing assigned unit activities",
                "Knowledge of MA HIX or other State Health Exchange",
                "Ability to work with multiple vendors",
                "Strong organizational skills",
                "problem-solving aptitude",
                "attention to detail",
                "Ability to work well with others in a fast-paced, dynamic environment",
                "Strong initiative",
                "ability to manage multiple projects",
                "strong follow-through skills",
                "Ability to work collaboratively",
                "collegially",
                "cooperatively with others"
            ]
        },
        "job_type": [
            "hybrid"
        ],
        "contact_person": "Priyanka",
        "email": "priyanka@stellentit.com",
        "jd": "From: priyanka, Stellent IT priyanka@stellentit.com Reply to: priyanka@stellentit.com Business Analyst with Healthcare Industry Exp.\u2013 CitizenLocation Boston, MA (Hybrid 2 days onsite/ONLY LOCAL WITH DL)Duration 12mth+ contractVIDEO THEN INPERSON INTERVIEW Must have:\u00b7 5+ yr BA exp\u00b7 SDLC exp\u00b7 Use Cases exp\u00b7 Healthcare Industry exp Preferred Qualifications: \u00b7Knowledge of the principles of software development using the approved SDLC.\u00b7Proficient knowledge of Jira, Long Term Care Population, Complex eligibility systems, and Unified processes.\u00b7Proficiency in Microsoft 365, Excel, Word, PowerPoint, Access, and Visio.\u00b7Knowledge of methods and techniques of computer systems analysis, design, technical terminology, codes, and standard abbreviations.\u00b7Experience with one or more of the following: data structures, application programming, database development, or relational database theory and technology.\u00b7Ability to prepare flow charts, diagrams, and Use Cases.\u00b7Deliver oral and written instructions in a precise, understandable manner.\u00b7Prepare required deliverables in accordance with established procedures.\u00b7Strong organizational skills with the ability to maintain accurate records and status reporting.\u00b7Ability to understand and apply the policies, procedures, specifications, standards, and guidelines governing assigned unit activities.\u00b7Knowledge of MA HIX or other State Health Exchange.\u00b7Ability to work with multiple vendors.\u00b7Strong organizational skills, problem-solving aptitude, and attention to detail.\u00b7Ability to work well with others in a fast fast-paced, dynamic environment.\u00b7Strong initiative and ability to manage multiple projects, as well as strong follow-through skills.\u00b7Must be able to work collaboratively, collegially, and cooperatively with others in an environment where deliverables are potentially dependent on the output of others.Education and Certifications: \u00b7Bachelor\u2019s degree in computer science, Information Systems, Business Administration, or a related field.\u00b7Minimum of (3) three years of extensive experience with project management as a Senior Business Analyst of a large-scale application.\u00b7Minimum of (3) years of experience in working in all phases of the Software Development Life Cycle (SDLC), including postproduction verification.\u00b7Prior healthcare experience desired.",
        "source": "Email",
        "date_posted": "2024-10-03 10:16:20-05:00",
        "unique_id": "19252fe070e5f5ee",
        "emp_type": [
            "contract",
            "third party"
        ],
        "tag": "Business Analyst"
    }
]