[
    {
        "company": "Technocraft Solutions LLC",
        "job_title": "Business System Analyst with Blue Prism",
        "location": "Schaumburg, IL, USA",
        "full_location": {
            "city": "Schaumburg",
            "state": "IL",
            "country": "USA"
        },
        "job_details": {
            "employment_type": [
                "full-time",
                "third party"
            ],
            "experience_required": "Not specified",
            "degree_required": "Not specified",
            "visa_sponsorship": "Not specified",
            "notice_period": "Not specified",
            "duration": "Not specified",
            "rate": "Not specified"
        },
        "skills": {
            "core": [
                "Blue Prism",
                "Insurance domain experience",
                "Analytical skills",
                "Communication skills",
                "Documentation skills"
            ],
            "primary": [
                "Agile environment",
                "Cloud-based solutions",
                "Microservices",
                "Event-driven architecture",
                "Data-driven product decisions"
            ],
            "secondary": [
                "Serverless technologies",
                "Event streaming",
                "Pub/sub messaging model",
                "Web applications",
                "Mobile applications"
            ],
            "all": [
                "Blue Prism",
                "Insurance domain experience",
                "Analytical skills",
                "Communication skills",
                "Documentation skills",
                "Agile environment",
                "Cloud-based solutions",
                "Microservices",
                "Event-driven architecture",
                "Data-driven product decisions",
                "Serverless technologies",
                "Event streaming",
                "Pub/sub messaging model",
                "Web applications",
                "Mobile applications"
            ]
        },
        "job_type": [
            "hybrid"
        ],
        "contact_person": "Anubhav Verma",
        "email": "anubhav.verma@technocraftsol.com",
        "jd": "From: Anubhav Verma, Technocraft solution anubhav.verma@technocraftsol.com Reply to: anubhav.verma@technocraftsol.com Business System Analyst with Blue PrismSchaumburg IL (Hybrid 3/2) Must Have Insurance domain Experience We need to prioritize in getting onsite BSA with Insurance background and Blueprism automation Project descriptionWe're seeking a strong and creative Business Analysts eager to solve challenging problems of scale and work on cutting edge technologies. In this project, you will have the opportunity to write code that will impact thousands of users every month. You'll implement your critical thinking and technical skills to develop cutting edge software, and you'll have the opportunity to interact with teams across disciplines.In Luxoft, our culture is one that strives on solving difficult problems focusing on product engineering based on hypothesis testing to empower people to come up with ideas.In this new adventure, you will have the opportunity to collaborate with a world-class team in the field of Insurance by building a holistic solution, interacting with multidisciplinary teams. ResponsibilitiesCollaborate with the creative process by providing inputs based on your experience.Work with Product Owners and Business stakeholders in the requirements development.Drive the development team towards the goal by integrating skills and experiences.Design, develop, test, deploy, maintain, and improve the software.Work with QA, product management, and operations in an Agile environment.Develop and support data-driven product decisions in a high energy high-impact team.Develop features that will drive our business through real-time feedback loops.Participate in the resolution of production issues and lead efforts toward solutions.Design and implementation of cloud-based solutions to integrate different data sources.Work on event-driven architecture styleAutomate workflows and repetitive tasks on the cloud using serverless technologies.Develop small, independent, and loosely coupled microservicesWork with event streaming and pub/sub messaging modelWork with Web and mobile applications Skills Must haveExperience in International Policy writing area with good analytical, communication and documentation skillsFamiliarity with Blue Prism automation tool to help on transforming their international policy system by automating the processes wherever possible Thanks and Regards, Anubhav vermaTalent AcquisitionTechnocraft Solutions LLCEmail: Anubhav.verma@Technocraftsol.comwww.technocraftsol.com | Technocraft Solutions LLC3974 Brown Park Drive, Suite F Hilliard, Ohio-43026",
        "source": "Email",
        "date_posted": "2024-10-03 09:57:00-05:00",
        "unique_id": "1925304b59bcd78f",
        "emp_type": [
            "full-time",
            "third party"
        ],
        "tag": "Business Analyst"
    }
]