[
    {
        "company": "Simplify Software Experts",
        "job_title": "Business Systems Analyst (Order Management & Execution)",
        "location": "Fremont, CA, USA",
        "full_location": {
            "city": "Fremont",
            "state": "CA",
            "country": "USA"
        },
        "job_details": {
            "employment_type": [
                "full-time",
                "third party"
            ],
            "experience_required": "7+ years",
            "degree_required": "Not specified",
            "visa_sponsorship": "Not specified",
            "notice_period": "Not specified",
            "duration": "Not specified",
            "rate": "Not specified"
        },
        "skills": {
            "core": [
                "SAP ECC",
                "SAP S/4",
                "object-oriented design",
                "system architecture standards",
                "agile project management"
            ],
            "primary": [
                "waterfall project management",
                "business use cases",
                "test specifications",
                "cross functional dependencies",
                "relationship building"
            ],
            "secondary": [
                "Planning",
                "Fulfillment",
                "Supply Chain",
                "Manufacturing",
                "Logistics",
                "BI/Dashboards",
                "SAP IBP",
                "Kinaxis"
            ],
            "all": [
                "SAP ECC",
                "SAP S/4",
                "object-oriented design",
                "system architecture standards",
                "agile project management",
                "waterfall project management",
                "business use cases",
                "test specifications",
                "cross functional dependencies",
                "relationship building",
                "Planning",
                "Fulfillment",
                "Supply Chain",
                "Manufacturing",
                "Logistics",
                "BI/Dashboards",
                "SAP IBP",
                "Kinaxis"
            ]
        },
        "job_type": [
            "onsite",
            "hybrid"
        ],
        "contact_person": "Atikur Rehman Khan",
        "email": "atikurk@simplifysoftwareexperts.com",
        "jd": "From: Atikur, Simplify software experts atikurk@simplifysoftwareexperts.com Reply to: atikurk@simplifysoftwareexperts.com Business Systems Analyst (Order Management & Execution)Fremont, CA Hybrid 3 days onsite Job Responsibilities: Collaborates with LAM Global Information Systems (GIS) teams to understand and support their operational requirements, developing and integrating interface solutions from SAP ECC to SAP S/4.Ability to connect multiple operations domains (Planning, Fulfillment, Supply Chain, Manufacturing, Logistics) and their interdependencies in solution design, build & test phasesCollaborate with the BU & GIS in leveraging various Operations Planning & Execution systems (SAP ECC, Custom applications in SAP ECC, SAP IBP, Kinaxis, BI/Dashboards, etc.) to enable the organization's future-state business capabilities.Tracking and driving tasks to closure and escalate as required. Skills Required:Demonstrated experience writing software requirements and test specifications.Ability to understand business functionality and translate into business use cases.Strong understanding of basic system engineering, object-oriented design, information risk and security guidelines, and system architecture standardsExperience with both waterfall and agile project management methodologies, and ability to deliver on responsibilities during various project phases including:Planning (Blueprint and Spec)Designing (Writing Specs and prototyping)Test Plans (Unit Test\u00edng and User acceptance testing)Training/Documentation (Roll-out)Cut-over Project Closure (Post -Mortem)Able to manage multiple tasks with competing prioritiesDemonstrated cross functional dependencies expertiseMust be able to demonstrate the skills and ability to build effective and productive relationships within and outside the immediate team Minimum Qualifications:7+ years overall SAP experience with 3+ years of experience with MM, PP, SD (VC)Plans and executes unit, integration and acceptance testing to deploy capabilities.System Engineering, object -oriented design, information risk and security guidelines and system architecture standards.Experience with both waterfall and agile project management methodologies, and ability to deliver on responsibilities during various project phases including:Planning (Blueprint and Spec)Designing (Writing Specs and prototyping)Test Plans (Unit Testing and User acceptance testing)Training/Documentation (Roll-out)Cut-over Project Closure (Post-Mortem)Able to manage multiple tasks with competing prioritiesDemonstrated cross functional dependencies expertiseMust be able to demonstrate the skills and ability to build effective and productive relationships within and outside the immediate teamAtikur Rehman KhanTechnical RecruiterE: atikurk@simplifysoftwareexperts.com",
        "source": "Email",
        "date_posted": "2024-10-03 09:58:24-05:00",
        "unique_id": "1925303460347844",
        "emp_type": [
            "full-time",
            "third party"
        ],
        "tag": "Business Analyst"
    }
]