[
    {
        "company": "Mobcoder IT Solutions LLC",
        "job_title": "Principal Software Engineer (.NET Background)",
        "location": "Austin, TX, USA",
        "full_location": {
            "city": "Austin",
            "state": "TX",
            "country": "USA"
        },
        "job_details": {
            "employment_type": [
                "contract",
                "third party"
            ],
            "experience_required": "13+ years",
            "degree_required": "Bachelor\u2019s or master\u2019s degree in computer science or related field",
            "visa_sponsorship": "Not specified",
            "notice_period": "Not specified",
            "duration": "Long-Term",
            "rate": "Not specified"
        },
        "skills": {
            "core": [
                ".NET",
                "Python",
                "MicroServices",
                "Angular",
                "SQL"
            ],
            "primary": [
                "Docker",
                "Kubernetes",
                "Kafka",
                "Azure DevOps",
                "WebAPIs",
                "FastAPI",
                "SQL Server database",
                "Stored Procedures",
                "Performance tuning"
            ],
            "secondary": [
                "AI/ML",
                "Large Language Models",
                "Machine Learning",
                "Deep Learning",
                "Generative AI",
                "Supervised learning",
                "data science",
                "data engineering",
                "JavaScript",
                "Typescript",
                "CSS",
                "HTML",
                "Multithreading",
                "Caching technology like Redis",
                "NoSQL database",
                "test-driven development",
                "JUnit",
                "cloud platforms like Azure / AWS",
                "Microservices Architecture",
                "Micro Frontend",
                "DevOps"
            ],
            "all": [
                ".NET",
                "Python",
                "MicroServices",
                "Angular",
                "SQL",
                "Docker",
                "Kubernetes",
                "Kafka",
                "Azure DevOps",
                "WebAPIs",
                "FastAPI",
                "SQL Server database",
                "Stored Procedures",
                "Performance tuning",
                "AI/ML",
                "Large Language Models",
                "Machine Learning",
                "Deep Learning",
                "Generative AI",
                "Supervised learning",
                "data science",
                "data engineering",
                "JavaScript",
                "Typescript",
                "CSS",
                "HTML",
                "Multithreading",
                "Caching technology like Redis",
                "NoSQL database",
                "test-driven development",
                "JUnit",
                "cloud platforms like Azure / AWS",
                "Microservices Architecture",
                "Micro Frontend",
                "DevOps"
            ]
        },
        "job_type": [
            "hybrid"
        ],
        "contact_person": "Sushil Kaushik",
        "email": "sushil.k@mobcoderstaffing.com",
        "jd": "Hi Please share the resume on sushil.k@mobcoderstaffing.comPosition: Principal Software Engineer (.NET Background) (Min 13+ year exp required)Location: Austin, TX (Hybrid Model)Duration: Long-Term ContractNote: Don\u2019t go with complete job description, client is looking for candidates from .NET background must have Python (hands-on), Angular, MicroServices, Docker, Kubernetes (K8S) and SQL.Nice to have: AI/ML Interview Process:L1 codingL1 technical discussion with VirtusaFinal discussion with End clientMandatory skills:Python WebAPIs (especially FastAPI \u2013 not mandatory),.NETMicroServicesAngular UI (strong in angular),Azure DevOps, Docker, Kubernetes,SQL Server database, Stored Procedures and Performance tuning.Azure functions, Microservices.Kafka Job Description: Senior Principal Software Engineer Join us as a Senior Principal Software Engineer on our Software Engineering, AI Products team in Round Rock, Texas to do the best work of your career and make a profound social impact.What you\u2019ll achieveAs a Senior Principal Software Engineer, you'll have the chance to architect cutting-edge AI tools alongside API and web design solutions, propelling the advancement of AI throughout its lifecycle. Your role involves spearheading solution development and ensuring release readiness while collecting insights into best practices across various AI product portfolios and business sectors. Furthermore, you'll collaborate closely with your team, providing mentorship and guidance in the design and development of AI products.You will:Ensure successful deployment of AI-based tools and systems that significantly improve operational efficiency or customer experience.Develop innovative algorithms or models that advance the state-of-the-art in AI technology.Integrate AI solutions into existing workflows or platforms, enabling automation and data-driven decision-making.Lead teams through the entire lifecycle of AI projects, from conception to deployment and maintenance.Contribute to open-source AI initiatives or communities, fostering collaboration and knowledge sharing within the industry.Design and lead the effort on automation, CI/CD processes and tools to make our services simpler and more robust.Mentor team members in design collaboration, code reviews, development tools and processes.Take part in the full software development life cycle including development, test, continuous delivery and support.Be an active member of an agile team, collaboratively realizing features through development, test and delivery.Essential Requirements13+ years of software development experience.Excellent knowledge and application of engineering concepts along with effective problem-solving ability.Solid understanding of Large Language Models, Machine Learning, Deep Learning, Generative AI, Supervised learning, data science, and data engineering.Proficiency in .NET and Python, which are crucial for developing robust and scalable AI solutions.Extensive knowledge and hands-on experience Kafka, & Angular / React, JavaScript, Typescript, CSS, HTML.Strong proficiency in Multithreading, Caching technology like Redis, experience in SQL /NoSQL database.Experience implementing test-driven development and hands-on with JUnit cases.Ability to code/debug using design specifications.Experience with cloud platforms like Azure / AWS. Extensive knowledge of Microservices Architecture, Micro Frontend and DevOps.Ability to manage, motivate, and direct a cross-functional workgroup; and drive successful negotiations.Solid interpersonal and presentation skills in Artificial Intelligence.Desirable RequirementsBachelor\u2019s or master\u2019s degree in computer science or related field.Proficiency in container technologies like Docker and Kubernetes (K8S).",
        "source": "Email",
        "date_posted": "2024-10-03 19:57:28-05:00",
        "unique_id": "19255147618592ad",
        "emp_type": [
            "contract",
            "third party"
        ],
        "tag": ".net developer"
    }
]