[
    {
        "company": "OEC",
        "job_title": "Azure Full Stack .NET Developer",
        "location": "USA",
        "full_location": {
            "city": "",
            "state": "",
            "country": "USA"
        },
        "job_details": {
            "employment_type": [
                "full-time",
                "third party"
            ],
            "job_code": "",
            "experience_required": "Not specified",
            "degree_required": "Not specified",
            "visa_sponsorship": "Not specified",
            "notice_period": "Not specified",
            "duration": "Not specified",
            "rate": "Not specified"
        },
        "skills": {
            "core": [
                ".NET",
                "JavaScript",
                "TypeScript",
                "Azure"
            ],
            "primary": [
                "Azure architecture",
                "Application Development",
                "Web Applications",
                "Code Reviews",
                "Problem-solving"
            ],
            "secondary": [
                "Agile development",
                "DevOps",
                "CI/CD",
                "SQL Server",
                "Azure SQL",
                "Front-end frameworks",
                "Angular",
                "React"
            ],
            "all": [
                ".NET",
                "JavaScript",
                "TypeScript",
                "Azure",
                "Azure architecture",
                "Application Development",
                "Web Applications",
                "Code Reviews",
                "Problem-solving",
                "Agile development",
                "DevOps",
                "CI/CD",
                "SQL Server",
                "Azure SQL",
                "Front-end frameworks",
                "Angular",
                "React"
            ]
        },
        "job_type": [
            "hybrid"
        ],
        "contact_person": "Kris",
        "email": "kris@gsksolutions.com",
        "jd": "Job Description:\nOEC is seeking a skilled Application Developer with a strong background in .NET and Azure to join our team. The ideal candidate will have experience in developing applications using JavaScript and TypeScript, and a solid understanding of Azure architecture and deployment strategies.\n\nKey Responsibilities:\n- Design, develop, and maintain scalable web applications using .NET, JavaScript, and TypeScript.\n- Implement Azure services and solutions for application deployment and architecture.\n- Collaborate with cross-functional teams to define, design, and ship new features.\n- Troubleshoot and debug applications, ensuring high performance and responsiveness.\n- Participate in code reviews and contribute to team knowledge sharing.\n- Communicate effectively with stakeholders to gather requirements and provide project updates.\n\nQualifications:\n- Proven experience as an Application Developer with a focus on .NET technologies.\n- Strong proficiency in JavaScript and TypeScript.\n- Demonstrated experience with Azure architecture and deployment processes.\n- Familiarity with front-end frameworks and libraries (e.g., Angular, React) is a plus.\n- Excellent problem-solving skills and attention to detail.\n- Strong communication skills, with the ability to articulate technical concepts to non-technical stakeholders.\n\nPreferred Skills:\n- Experience with Agile development methodologies.\n- Knowledge of DevOps practices and CI/CD pipelines.\n- Familiarity with database technologies such as SQL Server or Azure SQL.\n\nWorking Conditions:\n- Hybrid work model requiring in-office presence one day a week.\n- Collaborative team environment.",
        "source": "Email",
        "date_posted": "2024-10-30 11:25:47-05:00",
        "unique_id": "192deabe33b77d71",
        "emp_type": [
            "full-time",
            "third party"
        ],
        "tag": ".net developer"
    }
]