[
    {
        "company": "Delta System & Software, Inc.",
        "job_title": "Java Full Stack Developer",
        "location": "Phoenix, AZ, USA",
        "full_location": {
            "city": "Phoenix",
            "state": "AZ",
            "country": "USA"
        },
        "job_details": {
            "employment_type": [
                "contract",
                "third party"
            ],
            "job_code": "",
            "experience_required": "8 - 10 years",
            "degree_required": "Not specified",
            "visa_sponsorship": "Not specified",
            "notice_period": "Not specified",
            "duration": "12 Months",
            "rate": "Not specified"
        },
        "skills": {
            "core": [
                "Java",
                "Spring",
                "Spring Boot",
                "React",
                "microservices",
                "Oracle",
                "PL/SQL",
                "AWS"
            ],
            "primary": [
                "JMS",
                "ActiveMQ",
                "Tomcat",
                "Maven",
                "GitHub",
                "Jenkins",
                "Linux/Unix",
                "AWS EC2",
                "S3",
                "API Gateway",
                "Lambda",
                "Route53",
                "Secrets Manager",
                "CloudWatch"
            ],
            "secondary": [
                "Experience with rewriting legacy Java applications using Spring Boot & React",
                "Building serverless applications",
                "Ocean Shipping domain knowledge",
                "AWS CodePipeline"
            ],
            "all": [
                "Java",
                "Spring",
                "Spring Boot",
                "React",
                "microservices",
                "JMS",
                "ActiveMQ",
                "Tomcat",
                "Maven",
                "GitHub",
                "Jenkins",
                "Linux/Unix",
                "Oracle",
                "PL/SQL",
                "AWS",
                "AWS EC2",
                "S3",
                "API Gateway",
                "Lambda",
                "Route53",
                "Secrets Manager",
                "CloudWatch",
                "Experience with rewriting legacy Java applications using Spring Boot & React",
                "Building serverless applications",
                "Ocean Shipping domain knowledge",
                "AWS CodePipeline"
            ]
        },
        "job_type": [
            "onsite",
            "hybrid"
        ],
        "contact_person": "Ajay Kumar",
        "email": "ajay.kumar@delta-ssi.net",
        "jd": "From: Ajay Kumar, Delta System & Software, Inc. ajay.kumar@delta-ssi.net Reply to: ajay.kumar@delta-ssi.net Hi ,We have urgent requirements for following contract opportunities with our Client. Please send a resume of suitable candidates, with best bill rates and availability and contact information. Position- Java Full Stack Developer\nLocation- Phoenix, AZ onsite Hybrid\nDuaration- 12 Months\nExperience: 8 - 10 years\nRequired Skills: Java, Spring, Spring Boot, React, microservices, JMS, ActiveMQ, Tomcat, Maven, GitHub, Jenkins, Linux/Unix, Oracle and PL/SQL, AWS EC2, S3, API Gateway, Lambda, Route53, Secrets Manager, CloudWatch\nNice to have skills:Experience with rewriting legacy Java applications using Spring Boot & React\nBuilding serverless applications\nOcean Shipping domain knowledge\nAWS CodePipeline\nResponsibilities:\nDevelop and implement front-end and back-end solutions using Java, Spring, Spring Boot, React, microservices, Oracle and PL/SQL and AWS services.\nExperience working with business users in defining processes and translating those to technical specifications.\nDesign and develop user-friendly interfaces and ensure seamless integration between front-end and back-end components.\nWrite efficient code following best practices and coding standards.\nPerform thorough testing and debugging of applications to ensure high-quality deliverables.\nOptimize application performance and scalability through performance tuning and code optimization techniques.\nIntegrate third-party APIs and services to enhance application functionality.\nBuild serverless applications\nDeploy applications in AWS environment\nPerform Code Reviews.\nPick up production support engineer role when needed\nExcellent grasp of application security concerns and remediation techniques.\nWell-rounded technical background in current web and micro-service technologies.\nResponsible for being an expert resource for architects in the development of target architectures to ensure that they can be properly designed and implemented through best practices.\nShould be able to work in a fast paced environment.\nStay updated with the latest industry trends and emerging technologies to continuously improve skills and knowledge.",
        "source": "Email",
        "date_posted": "2024-10-30 09:51:38-05:00",
        "unique_id": "192de2d988a210ba",
        "emp_type": [
            "contract",
            "third party"
        ],
        "tag": "Java developer"
    }
]