[
    {
        "company": "Vyzeinc",
        "job_title": "Senior Oracle PL SQL Developer",
        "location": "Houston, TX, USA",
        "full_location": {
            "city": "Houston",
            "state": "TX",
            "country": "USA"
        },
        "job_details": {
            "employment_type": [
                "full-time",
                "third party"
            ],
            "experience_required": "12+ years",
            "degree_required": "Bachelor's degree in computer science, software engineering or relevant business discipline from an accredited four-year college or university.",
            "visa_sponsorship": "Not specified",
            "notice_period": "Not specified",
            "duration": "6 months+",
            "rate": "Not specified"
        },
        "skills": {
            "core": [
                "Oracle PL/SQL",
                "Analytical functions",
                "Merge statements",
                "WITH clause",
                "Oracle partitioning",
                "Job logging",
                "Exception handling",
                "Performance tuning"
            ],
            "primary": [
                "Data Warehouse environment",
                "Strong Analytical skills",
                "Troubleshooting skills",
                "Strong Team Player"
            ],
            "secondary": [
                "Flexibility",
                "Dedication",
                "Consistency",
                "Integrity",
                "Enthusiasm"
            ],
            "all": [
                "Oracle PL/SQL",
                "Analytical functions",
                "Merge statements",
                "WITH clause",
                "Oracle partitioning",
                "Job logging",
                "Exception handling",
                "Performance tuning",
                "Data Warehouse environment",
                "Strong Analytical skills",
                "Troubleshooting skills",
                "Strong Team Player",
                "Flexibility",
                "Dedication",
                "Consistency",
                "Integrity",
                "Enthusiasm"
            ]
        },
        "job_type": [
            "onsite"
        ],
        "contact_person": "Anand Prajapati",
        "email": "aprajapati@vyzeinc.com",
        "jd": "Job Description -Need local or nearby candidates with LinkedIn with actual genuine visa\n\nSenior Oracle PL/SQL Developer 6 months+\n\nLocations: - : 3 days onsite a week- Houston, TX\n\nSkype\n\nMust be local to Houston or TX and be willing to come into the downtown office Monday, Tuesday, and Thursday of every week\n\n***Design, develop, test, maintain, and support batch applications using Oracle PL/SQL for Retail Commissions and Amortization.\n\nEducation:\nBachelor's degree in computer science, software engineering or relevant business discipline from an accredited four-year college or university.\n\nExperience:\n12+ years of strong development experience using Oracle PL/SQL including experience using features like Analytical functions, merge statements, WITH clause, oracle partitioning, job logging, exception handling, performance tuning\n10+ years of experience in Oracle 12c or 19c\n5+ years of experience in a Data Warehouse environment\nStrong Analytical skills\nTroubleshooting skills\nStrong Team Player\n\nAdditional skills:\nFlexibility, Dedication, Consistency, Integrity, and Enthusiasm a must.",
        "source": "Email",
        "date_posted": "2024-10-30 08:17:04-05:00",
        "unique_id": "192ddb28e43e1edd",
        "emp_type": [
            "full-time",
            "third party"
        ],
        "tag": "Oracle DBA"
    }
]