[
    {
        "company": "IT & EBusiness Consulting Services Inc",
        "job_title": "Big data Engineer",
        "location": "Sunrise, FL, USA",
        "full_location": {
            "city": "Sunrise",
            "state": "FL",
            "country": "USA"
        },
        "job_details": {
            "employment_type": [
                "contract",
                "third party"
            ],
            "job_code": "",
            "experience_required": "Not specified",
            "degree_required": "Not specified",
            "visa_sponsorship": "Not specified",
            "notice_period": "Not specified",
            "duration": "Long-Term Contract",
            "rate": "Not specified"
        },
        "skills": {
            "core": [
                "Big data",
                "Hadoop",
                "Spark",
                "SQL",
                "PySpark",
                "Hive",
                "BigQuery",
                "GCP"
            ],
            "primary": [],
            "secondary": [],
            "all": [
                "Big data",
                "Hadoop",
                "Spark",
                "SQL",
                "PySpark",
                "Hive",
                "BigQuery",
                "GCP"
            ]
        },
        "job_type": [
            "onsite"
        ],
        "contact_person": "Prashant Yadav",
        "email": "prashant@itecsus.com",
        "jd": "Title: Big data Engineer\nLocation: Sunrise, FL / Phoenix, AZ / NYC, NY (so that they can attend in person interviews in any of these 3 locations)\nNeed local resources to attend F2F interview\nDuration: Long-Term Contract\nRequired Experience:\nBig data\nHadoop\nSpark\nSQL\nPySpark\nHive\nBigQuery\nGCP\nE-Mail Is The Best Way To Reach Me \u2026\u2026\u2026.Thanks N' Regards,\nPrashant Yadav\nIT & EBusiness Consulting Services Inc\nFax: 866 977 7575\nPrashant@ItecsUS.com\nhttps://itecsus.com/\nhttps://www.linkedin.com/in/yadav-itecs-b9551822b/\nNote: HEADPHONES, AIRPODS, EARPODS etc., will not be allowed during interview, kindly attend the interview using Laptop's microphone only.",
        "source": "Email",
        "date_posted": "2024-10-30 09:02:08-05:00",
        "unique_id": "192ddf9de57b8820",
        "emp_type": [
            "contract",
            "third party"
        ],
        "tag": "GCP Data Engineer"
    }
]