[
    {
        "company": "Vyze Inc",
        "job_title": "Java Angular Developer",
        "location": "Richmond, VA, USA",
        "full_location": {
            "city": "Richmond",
            "state": "VA",
            "country": "USA"
        },
        "job_details": {
            "employment_type": [
                "full-time",
                "third party"
            ],
            "job_code": "",
            "experience_required": "8 years",
            "degree_required": "Not specified",
            "visa_sponsorship": "Not specified",
            "notice_period": "Not specified",
            "duration": "Not specified",
            "rate": "Not specified"
        },
        "skills": {
            "core": [
                "Java",
                "J2EE architecture",
                "JSP",
                "Servlets",
                "JDBC",
                "PL/SQL",
                "MSSQL",
                "Angular",
                "Typescript"
            ],
            "primary": [
                "XML",
                "JSON",
                "XSL",
                "SQL",
                "CSS",
                "HTML",
                "AJAX",
                "Eclipse",
                "Tomcat",
                "JavaScript",
                "Agile SDLC",
                "Azure DevOps"
            ],
            "secondary": [
                "C#",
                ".NET"
            ],
            "all": [
                "Java",
                "J2EE architecture",
                "JSP",
                "Servlets",
                "XML",
                "JSON",
                "XSL",
                "SQL",
                "PL/SQL",
                "JDBC",
                "CSS",
                "HTML",
                "AJAX",
                "Eclipse",
                "Tomcat",
                "JavaScript",
                "Angular",
                "Typescript",
                "Agile SDLC",
                "Azure DevOps",
                "C#",
                ".NET"
            ]
        },
        "job_type": [
            "onsite"
        ],
        "contact_person": "Vivek",
        "email": "vkumar@vyzeinc.com",
        "jd": "Job Description - Java/Angular Developer (linkedin)\nOnsite- Richmond, VA. (Must be local)(F2F) interview\n\nKnowledge, Skills and Abilities:\nExperience with Java, J2EE architecture, JSP, Servlets, XML, JSON, XSL, SQL, PL/SQL, JDBC, OO Design, CSS, HTML, AJAX, eclipse, Tomcat, JavaScript and knowledgeable with the Windows platform.\nAbility to design and code using modern day frameworks such as Angular, Typescript and other web-related technologies.\nExperience with relational database design and development with Oracle and MSSQL\nExperience in software design, development, and testing of web-based software applications\nStrong conceptual, analytical, and problem-solving abilities\nStrong interpersonal and written/verbal communication skills\n\nRequired Skills:\n8 Years - Experience with Java, J2EE Architecture, JSP, Servlets, JDBC\n6 Years - Experience with PL/SQL, MSSQL Programming\n4 Years - Experience with front end technologies using Angular\n6 Years - Experience with Eclipse, Tomcat\n6 Years - Experience with Agile SDLC best practices\n6 Years - Experience with Azure DevOps or similar for code management and CI/CD pipeline\n\nDesired Skills:\n3 Years - Experience with C#/.NET",
        "source": "Email",
        "date_posted": "2024-10-30 08:48:46-05:00",
        "unique_id": "192ddcf9564d0a09",
        "emp_type": [
            "full-time",
            "third party"
        ],
        "tag": "Java developer"
    }
]