[
    {
        "company": "Deloitte",
        "job_title": "Sr .Net Developer",
        "location": "USA",
        "full_location": {
            "city": "",
            "state": "",
            "country": "USA"
        },
        "job_details": {
            "employment_type": [
                "third party",
                "contract"
            ],
            "job_code": "",
            "experience_required": "Not specified",
            "degree_required": "Not specified",
            "visa_sponsorship": "Not specified",
            "notice_period": "Not specified",
            "duration": "Not specified",
            "rate": "$55/hr on C2C"
        },
        "skills": {
            "core": [
                "Kafka",
                ".NET",
                "React.js",
                "microservices architecture"
            ],
            "primary": [
                "cloud platforms (Azure)",
                "CI/CD"
            ],
            "secondary": [
                "troubleshooting",
                "debugging",
                "code reviews",
                "software design",
                "security",
                "testing"
            ],
            "all": [
                "Kafka",
                ".NET",
                "React.js",
                "microservices architecture",
                "cloud platforms (Azure)",
                "CI/CD",
                "troubleshooting",
                "debugging",
                "code reviews",
                "software design",
                "security",
                "testing"
            ]
        },
        "job_type": [
            "remote"
        ],
        "contact_person": "Manikanta",
        "email": "manikanta@jupitertechnologies.net",
        "jd": "Role: Sr .Net Developer\nClient: Deloitte\nRate: $55/hr on C2C\nLocation: Remote (Travel once in a month if client req)\n\nFull-Stack Developer with expertise in Kafka, React.js, .NET, and microservices architecture. This role involves designing and building end-to-end software solutions. You will work with cross-functional teams to deliver seamless, integrated solutions that align with business requirements.\n\nResponsibilities include:\n- Design, develop, and maintain scalable microservices using .NET and other related technologies.\n- Build engaging and dynamic front-end interfaces using React.js, ensuring high-quality user experiences.\n- Develop and integrate real-time data pipelines using Kafka for streaming and messaging services.\n- Write and maintain efficient, reusable, and reliable code, following best practices in software design, security, and testing.\n- Participate in code reviews, troubleshooting, and debugging to optimize application performance.\n- Deploy and manage applications on cloud platforms (Azure) and contribute to CI/CD pipelines.",
        "source": "Email",
        "date_posted": "2024-10-30 09:59:20-05:00",
        "unique_id": "192de102e287a5fd",
        "emp_type": [
            "third party",
            "contract"
        ],
        "tag": ".net developer"
    }
]