[
    {
        "company": "TEK Inspirations LLC",
        "job_title": "Oracle Cloud Financial Analyst",
        "location": "USA",
        "full_location": {
            "city": "",
            "state": "",
            "country": "USA"
        },
        "job_details": {
            "employment_type": [
                "contract",
                "third party"
            ],
            "job_code": "",
            "experience_required": "3-5 years",
            "degree_required": "Bachelor\u2019s degree in Information Systems, Engineering, or Mathematics",
            "visa_sponsorship": "Not specified",
            "notice_period": "Not specified",
            "duration": "18 Months + Extensions",
            "rate": "Not specified"
        },
        "skills": {
            "core": [
                "Oracle Fusion Skills",
                "Oracle Cloud Exp",
                "Basic understanding of finance disciplines",
                "Practical experience in business process modeling",
                "Outstanding analytical skills"
            ],
            "primary": [
                "Lead business requirements gathering sessions",
                "Working knowledge of financial management systems",
                "Advanced knowledge of SQL",
                "Microsoft Office (Excel, Word, Teams, PowerPoint)",
                "Experience working in an Agile/Scrum environment"
            ],
            "secondary": [
                "Oracle Certification(s) in financial management modules of Oracle Fusion ERP",
                "General knowledge using tools or systems such as Oracle Fusion, Workday, Concur, Jira, Tableau, Power BI, and Visio",
                "Some experience with programming languages"
            ],
            "all": [
                "Oracle Fusion Skills",
                "Oracle Cloud Exp",
                "Basic understanding of finance disciplines",
                "Practical experience in business process modeling",
                "Outstanding analytical skills",
                "Lead business requirements gathering sessions",
                "Working knowledge of financial management systems",
                "Advanced knowledge of SQL",
                "Microsoft Office (Excel, Word, Teams, PowerPoint)",
                "Experience working in an Agile/Scrum environment",
                "Oracle Certification(s) in financial management modules of Oracle Fusion ERP",
                "General knowledge using tools or systems such as Oracle Fusion, Workday, Concur, Jira, Tableau, Power BI, and Visio",
                "Some experience with programming languages"
            ]
        },
        "job_type": [
            "remote"
        ],
        "contact_person": "Karan Chaudhary",
        "email": "ckaran.chaudhary@tekinspirations.com",
        "jd": "Job Description - Oracle Cloud Financial Analyst\nDuration: 18 Months + Extensions (Long-term contract w/ no end date)\nStart Date: ASAP\n\nTop Skills Required:\n\u2022 Basic understanding of finance disciplines, i.e., Accounts Payable, Accounting, Fixed Assets, Forecasting & Budgeting\n\u2022 Practical experience in business process modeling, user journeys, and data flows\n\u2022 Lead business requirements gathering sessions\n\u2022 Oracle Fusion Skills\n\u2022 Oracle Cloud Exp.\n\nJob Description:\nBusiness Analyst for Oracle Cloud: The business analyst will analyze business needs, document requirements, and translate them into system specifications that IT teams can implement. This role is critical to ensuring technology initiatives align with business strategies and add value by enhancing performance and productivity. Responsible for cross-team collaboration. A strong work ethic, adaptability, great communication, and attention to detail will be essential for this role to be successful.\n\nRequirements:\n\u2022 Working knowledge of financial management systems as a part of ERP, including accounts payable, accounts receivable, general ledger, and cash management.\n\u2022 Outstanding analytical skills in identifying, documenting, and analyzing business solutions.\n\u2022 Serve as the liaison between the business and technical team members.\n\u2022 Advanced knowledge of SQL and Microsoft Office (Excel, Word, Teams, PowerPoint).\n\u2022 Experience working in an Agile/Scrum environment.\n\u2022 Bachelor\u2019s degree in Information Systems, Engineering, or Mathematics with 3 \u2013 5 years in business or technical analysis.\n\u2022 Oracle Certification(s) in financial management modules of Oracle Fusion ERP.\n\u2022 General knowledge using tools or systems such as Oracle Fusion, Workday, Concur, Jira, Tableau, Power BI, and Visio would be a plus.\n\u2022 Some experience with programming languages would be advantageous.",
        "source": "Email",
        "date_posted": "2024-10-30 12:51:25-05:00",
        "unique_id": "192decb01eccb4da",
        "emp_type": [
            "contract",
            "third party"
        ],
        "tag": "Business Analyst"
    }
]