[
    {
        "company": "Avance",
        "job_title": "SQL DBA with MarkLogic",
        "location": "Branchville, NJ, USA",
        "full_location": {
            "city": "Branchville",
            "state": "NJ",
            "country": "USA"
        },
        "job_details": {
            "employment_type": [
                "full-time",
                "third party"
            ],
            "experience_required": "Not specified",
            "degree_required": "Not specified",
            "visa_sponsorship": "Not specified",
            "notice_period": "Not specified",
            "duration": "Not specified",
            "rate": "Not specified",
            "job_code": "",
            "contact_person": "Akanksha",
            "email": "akanksha.e@avanceservices.com"
        },
        "skills": {
            "core": [
                "SQL",
                "MarkLogic",
                "Netezza"
            ],
            "primary": [
                "Database Design",
                "Performance Tuning",
                "Troubleshooting",
                "Data Integrity",
                "Backup and Recovery",
                "Automation",
                "Collaboration",
                "Query Optimization",
                "Data Management",
                "System Administration",
                "Data Load Management"
            ],
            "secondary": [
                "Security",
                "User Roles",
                "Permissions",
                "Encryption"
            ],
            "all": [
                "SQL",
                "MarkLogic",
                "Netezza",
                "Database Design",
                "Performance Tuning",
                "Troubleshooting",
                "Data Integrity",
                "Backup and Recovery",
                "Automation",
                "Collaboration",
                "Query Optimization",
                "Data Management",
                "System Administration",
                "Data Load Management",
                "Security",
                "User Roles",
                "Permissions",
                "Encryption"
            ]
        },
        "job_type": [
            "hybrid"
        ],
        "jd": "Title: SQL DBA with MarkLogic\nLocation: Branchville, NJ (Hybrid) (Local preferred)\n\nAn L3 role typically involves advanced-level responsibilities, including resolving complex issues, overseeing system stability, and providing expert guidance. Here's a breakdown based on specifications for SQL (70%), MarkLogic (20%),\n\n1. SQL\n   - Database Design and Optimization: Designing efficient database schemas, indexing strategies, and query optimization to improve performance.\n   - Performance Tuning: Monitoring and optimizing the performance of SQL queries, stored procedures, and overall database health.\n   - Troubleshooting: Handling escalated issues from L2 support, including complex SQL errors, deadlocks, and data inconsistencies.\n   - Data Integrity and Security: Implementing security measures, such as access controls and encryption, ensuring data integrity and compliance with standards.\n   - Backup and Recovery: Managing and maintaining database backups, ensuring disaster recovery processes are in place.\n   - Automation: Creating and maintaining scripts for database tasks, including backups, monitoring, and alerts.\n   - Collaboration: Working with development teams to optimize database interactions and provide guidance on best practices.\n\n2. MarkLogic\n   - Database Administration: Managing the MarkLogic NoSQL database, including installation, configuration, and upgrading.\n   - Query Optimization: Optimizing XQuery and search performance in MarkLogic, ensuring efficient data retrieval.\n   - Data Management: Managing document-based data structures, indexing, and retrieval, ensuring the system handles large-scale data efficiently.\n   - Troubleshooting and Maintenance: Handling escalated MarkLogic-specific issues, including performance bottlenecks and system failures.\n   - Security: Managing security features like user roles, permissions, and encryption in MarkLogic.\n\n3. Netezza\n   - System Administration: Administering the Netezza appliance, including system health checks, upgrades, and maintenance.\n   - Performance Tuning: Optimizing Netezza-specific SQL queries, particularly those involving large datasets.\n   - Troubleshooting: Handling escalated issues specific to the Netezza environment, such as performance lags or database errors.\n   - Data Load Management: Overseeing data load processes to ensure efficient ETL operations.",
        "source": "Email",
        "date_posted": "2024-10-30 10:48:33-05:00",
        "unique_id": "192de3d3da64887d",
        "emp_type": [
            "full-time",
            "third party"
        ],
        "tag": "DB Admin"
    }
]