[
    {
        "company": "Tekinsiprations LLC",
        "job_title": ".Net Architect",
        "location": "Columbus, OH, USA",
        "full_location": {
            "city": "Columbus",
            "state": "OH",
            "country": "USA"
        },
        "job_details": {
            "employment_type": [
                "full-time",
                "third party"
            ],
            "experience_required": "12+ years",
            "degree_required": "Not specified",
            "visa_sponsorship": "No visa sponsorship",
            "notice_period": "Not specified",
            "duration": "Not specified",
            "rate": "Not specified"
        },
        "skills": {
            "core": [
                ".NET Framework (4.7.2 and higher)",
                ".net core 2.2 and higher",
                "Visual Studio (2022/2019)",
                "SQL Server 2016",
                "Asp.net MVC 5",
                "MVC Core",
                "Entity Framework 6.2 including LINQ to SQL",
                "Entity framework core",
                "Kendo UI Controls for ASP.NET MVC",
                "Java Script",
                "jQuery",
                "CSS 3.0",
                "C# 7.0 and higher",
                "WCF/Web API",
                "Visual Studio Unit Testing",
                "Azure DevOps",
                "Build and release using DevOps pipelines",
                "Git source code repository",
                "Azure App Service",
                "Azure blob storage"
            ],
            "primary": [],
            "secondary": [],
            "all": [
                ".NET Framework (4.7.2 and higher)",
                ".net core 2.2 and higher",
                "Visual Studio (2022/2019)",
                "SQL Server 2016",
                "Asp.net MVC 5",
                "MVC Core",
                "Entity Framework 6.2 including LINQ to SQL",
                "Entity framework core",
                "Kendo UI Controls for ASP.NET MVC",
                "Java Script",
                "jQuery",
                "CSS 3.0",
                "C# 7.0 and higher",
                "WCF/Web API",
                "Visual Studio Unit Testing",
                "Azure DevOps",
                "Build and release using DevOps pipelines",
                "Git source code repository",
                "Azure App Service",
                "Azure blob storage"
            ]
        },
        "job_type": [
            "hybrid"
        ],
        "contact_person": "Shivansh Tiwari",
        "email": "shivansh.tiwari@tekinspirations.com",
        "jd": "Job Description -Role: .Net Architect\nLocation: Columbus, OH (hybrid)\nVisa- NO opt/cpt/h1b\nNeed LinkedIn\nNeed at least 12+ Years of profile\n\nPrimary work objectives: MHAS is looking for a skilled IT Consultant to refactor an existing custom .net/C# Human Resources software suite hosted on Azure to meet the needs of our Agency and constituents. In addition to the attached technical proficiencies the selected candidate will demonstrate the ability to work directly with our Human Resource professionals, understand the basic terminology and business functions of HR, and have the ability to communicate verbally and in writing to the project sponsors. Prior experience with HR applications or processes is not mandatory but preferred. Having worked on an interface with Ohio\u2019s ERP (OAKS) is also advantageous.\n\nMandatory skills: .NET Framework (4.7.2 and higher), .net core 2.2 and higher Visual Studio (2022/2019) SQL Server 2016 Asp.net MVC 5, MVC Core Entity Framework 6.2 including LINQ to SQL, Entity framework core Kendo UI Controls for ASP.NET MVC Java Script, jQuery and CSS 3.0 C# 7.0 and higher WCF/Web API Visual Studio Unit Testing Azure DevOps Build and release using DevOps pipelines Git source code repository ( 2 +) Azure App Service (2 years) Azure blob storage (< 1year)\n\nVisual Studio (2022/2019) Required 5 Years\nSQL Server 2015 Required 5 Year\nAsp.net MVC 5, MVC Core Required 5 Years\nEntity Framework 6.2 including LINQ to SQL, Entity framework core Required 5 Years\nKendo UI Controls for ASP.NET MVC Required 5 Years\nJava Script, jQuery and CSS 3.0 Required 5 Years\nC# 7.0 and higher Required 5 Years\nWCF/Web API Required 5 Years\nVisual Studio Unit Testing Required 5 Years\nAzure DevOps Required 5 Years\nBuild and release using DevOps pipeline Required 5 Years\nAzure App Service Required 5 Years\nAzure blob storage Required 5 Years",
        "source": "Email",
        "date_posted": "2024-10-30 11:00:02-05:00",
        "unique_id": "192de47c05d31578",
        "emp_type": [
            "full-time",
            "third party"
        ],
        "tag": ".net developer"
    }
]