[
    {
        "company": "Xforia",
        "job_title": "Pega Lead Business Architect",
        "location": "New York City, NY, USA",
        "full_location": {
            "city": "New York City",
            "state": "NY",
            "country": "USA"
        },
        "job_details": {
            "employment_type": [
                "contract",
                "third party"
            ],
            "experience_required": "Not specified",
            "degree_required": "Not specified",
            "visa_sponsorship": "Visa sponsorship available",
            "notice_period": "Not specified",
            "duration": "Long Term Contract",
            "rate": "Not specified"
        },
        "skills": {
            "core": [
                "Pega",
                "Customer Service Module",
                "Pega App Studio",
                "Pega Dev Studio",
                "Business/Systems Architect"
            ],
            "primary": [
                "Pega 8.x",
                "Pega Infinity '23",
                "DCO sessions",
                "User Stories",
                "Pega design principles",
                "Pega intents",
                "Pega next best action",
                "Pega analytics",
                "Jira"
            ],
            "secondary": [
                "SAFE",
                "Agile methodology",
                "Pega best practices",
                "Pega PRPC",
                "Documentation"
            ],
            "all": [
                "Pega",
                "Customer Service Module",
                "Pega App Studio",
                "Pega Dev Studio",
                "Business/Systems Architect",
                "Pega 8.x",
                "Pega Infinity '23",
                "DCO sessions",
                "User Stories",
                "Pega design principles",
                "Pega intents",
                "Pega next best action",
                "Pega analytics",
                "Jira",
                "SAFE",
                "Agile methodology",
                "Pega best practices",
                "Pega PRPC",
                "Documentation"
            ]
        },
        "job_type": [
            "onsite"
        ],
        "contact_person": "kathiravan",
        "email": "kathiravan.r@xforia.com",
        "jd": "From: kathiravan, Xforia kathiravan.r@xforia.com Reply to: kathiravan.r@xforia.com Job DetailsPega Lead Business ArchitectLong Term ContractNew York City, NYJob Description:Should have hands-on experience in Pega and specifically Customer Service Module in PegaExperience or knowledge in Pega 8.x is required and knowledge of Pega Infinity \u201923 preferredShould be able to lead DCO sessions with business and technical teams in gathering business requirements and translating them to User Stories and processesShould have expert knowledge of Pega App Studio and working knowledge of Pega Dev StudioStrong background as a Business/Systems ArchitecHas a thorough understanding of Pega and specifically Customer Service Module in PegaUnderstanding of Pega best practices and guardrail complianceExperience or knowledge in Pega 8.x is required and knowledge of Pega Infinity '23 preferredShould have demonstrated successful application of BA skill in a large Pega platform implementation projectLead business team and development team in gathering business requirements and translating them to Pega system requirements which Pega developers can implementShould understand Pega design principles, Pega intents and Workflows, Pega next best action and Pega analyticsShould have a good understanding of Pega design studio, Pega product features, frameworks, and functional designPerform basic testing and validate functionalityGood understanding of Pega PRPC and its featuresExperience in SAFE/Agile methodology processes and best practice knowledgeShould have experience in writing user stories in Jira and documentation",
        "source": "Email",
        "date_posted": "2024-10-29 15:44:29-05:00",
        "unique_id": "192da25db84315d0",
        "emp_type": [
            "contract",
            "third party"
        ],
        "tag": "PEGA Developer"
    }
]