[
    {
        "company": "Maintec Technologies",
        "job_title": "Java Fullstack Developer",
        "location": "Omaha, NE, USA",
        "full_location": {
            "city": "Omaha",
            "state": "NE",
            "country": "USA"
        },
        "job_details": {
            "employment_type": [
                "third party"
            ],
            "job_code": "",
            "experience_required": "8+ years",
            "degree_required": "Not specified",
            "visa_sponsorship": "Not specified",
            "notice_period": "Not specified",
            "duration": "Not specified",
            "rate": "Not specified"
        },
        "skills": {
            "core": [
                "Java",
                "Spring",
                "AWS"
            ],
            "primary": [
                "Spring boot",
                "REST API",
                "MySQL",
                "Multithreading"
            ],
            "secondary": [
                "Agile",
                "SQS"
            ],
            "all": [
                "Java",
                "Spring",
                "AWS",
                "Spring boot",
                "REST API",
                "MySQL",
                "Multithreading",
                "Agile",
                "SQS"
            ]
        },
        "job_type": [],
        "contact_person": "Devan Mark",
        "email": "devan@maintec.com",
        "jd": "From: Devan, Maintec Technologies devan@maintec.com Reply to: devan@maintec.com Role: Sr Java Developer Location: Omaha NE Description:Requires programming skills, involved in the development of software applications. Knowledge of programming languages to develop necessary specifications for the software by following the technical designs. In specific cases, knowledgeable on Agile/iterative development methodologies will be required (and called out).Desired Skills:Java, Spring, AWS Technologies. Skill NameJava, Spring boot REST API AWS Technology (SQS) MySQL Multithreading Email is the best way to reach me . Thanks & Best Regards Devan Mark Sr. US It Recruiter Maintec Technologies Inc. 8801 Fast Park Drive, Ste. 301, Raleigh, NC 27617Phone:+ 19193710850Email:devan@maintec.com|www.maintec.com https://www.linkedin.com/in/devan-m-340b21331/",
        "source": "Email",
        "date_posted": "2024-10-29 17:18:03-05:00",
        "unique_id": "192da7b85bc26593",
        "emp_type": [
            "third party"
        ],
        "tag": "Java developer"
    }
]