[
    {
        "company": "Resource Logistics",
        "job_title": "Product Data Analyst",
        "location": "USA",
        "full_location": {
            "city": "",
            "state": "",
            "country": "USA"
        },
        "job_details": {
            "employment_type": [
                "contract",
                "third party"
            ],
            "job_code": "",
            "experience_required": "5+ years",
            "degree_required": "Bachelor\u2019s or Master\u2019s degree in Data Science, Business Analytics, Statistics, Computer Science, or a related field.",
            "visa_sponsorship": "Not specified",
            "notice_period": "Not specified",
            "duration": "Not specified",
            "rate": "Not specified"
        },
        "skills": {
            "core": [
                "Amplitude",
                "MongoDB",
                "Tableau",
                "Looker",
                "Python",
                "R"
            ],
            "primary": [
                "data analysis",
                "data visualization",
                "A/B testing",
                "data automation",
                "statistical analysis"
            ],
            "secondary": [
                "healthcare data analytics",
                "data storytelling",
                "data infrastructure improvement",
                "dashboarding tools",
                "product analytics tools"
            ],
            "all": [
                "Amplitude",
                "MongoDB",
                "Tableau",
                "Looker",
                "Python",
                "R",
                "data analysis",
                "data visualization",
                "A/B testing",
                "data automation",
                "statistical analysis",
                "healthcare data analytics",
                "data storytelling",
                "data infrastructure improvement",
                "dashboarding tools",
                "product analytics tools"
            ],
            "with_experience": [
                "Amplitude",
                "MongoDB",
                "Tableau",
                "Looker",
                "data analysis",
                "data visualization",
                "A/B testing",
                "data automation",
                "statistical analysis"
            ]
        },
        "job_type": [
            "remote"
        ],
        "contact_person": "Shayista Sultan",
        "email": "shayista@resource-logistics.com",
        "jd": "From: shayista sultan, resource logistics shayista@resource-logistics.com Reply to: shayista@resource-logistics.com Job: Product Data AnalystLocation: RemoteContractJD-We are looking for an experienced Senior Product Data Analyst to support our product development team. If you have a passion for using data to shape the future of software products and thrive in a fast-paced, data-driven environment, this position is a great fit.Key Responsibilities:\u2022 Partner with Product Managers and Engineering leaders to define product goals and KPIs, and provide data-driven insights to support decision-making.\u2022 Use Amplitude and other analytics tools to track user behavior, product performance, and feature usage.\u2022 Extract and analyze datasets from MongoDB to identify patterns, trends, and areas of opportunity.\u2022 Automate data collection and reporting processes to streamline analysis and ensure accuracy.\u2022 Develop and maintain advanced dashboards using Tableau and Looker to visualize product performance and communicate key insights to stakeholders.\u2022 Lead in-depth analysis of product data, identifying user behaviors and trends that impact feature adoption and product outcomes.\u2022 Analyze A/B tests to measure the effectiveness of product changes and optimize performance.\u2022 Provide recommendations on product enhancements based on data-driven insights and monitor the ROI of product initiatives.\u2022 Collaborate with the engineering team to improve data infrastructure and ensure data accuracy and completeness.\u2022 Lead the automation of recurring reports and deep-dive analyses to provide ongoing visibility into product metrics.Qualifications:\u2022 Bachelor\u2019s or Master\u2019s degree in Data Science, Business Analytics, Statistics, Computer Science, or a related field.\u2022 5+ years of experience in a data analysis role, with a strong focus on software products or technology.\u2022 Proficiency with Amplitude and other product analytics tools.\u2022 Experience with MongoDB or other NoSQL databases for querying and manipulating large datasets.\u2022 Strong experience with Tableau and/or Looker for building and maintaining high-quality data visualizations and dashboards.\u2022 Proven ability to analyze complex datasets, identify trends, and deliver actionable recommendations.\u2022 Experience automating data collection, reporting, and dashboard generation.\u2022 Experience with A/B testing methodologies and statistical analysis to measure product performance.\u2022 Excellent communication and storytelling skills to present data findings to both technical and non-technical stakeholders.\u2022 Experience with Python or R for data analysis and automation is a plus.Ideal Candidate:\u2022 Someone who is looking to move into a lead role and shape the data analytics function from the ground up.\u2022 Comfortable working in a new position with minimal legacy processes, and able to establish best practices.\u2022 Able to partner effectively with product management and engineering teams to identify opportunities and drive data-informed decision-making.\u2022 Familiar with dashboarding tools like Tableau or Looker and able to use them to create insightful visualizations.\u2022 Experience with product analytics tools, preferably Amplitude, but familiarity with similar tools like Pendo is also valuable.\u2022 Strong grounding in data analysis and automation, with the ability to use Python or R for advanced data processing.Additional Note:Senior/Lead level Product Data Analyst role. Relatively greenfield environment where the candidate can shape future direction. Ideal for someone looking for growth opportunityExperience 5-9 YearsSkill (Primary): Domain Competencies (APPS)-Bus. Process-Healthcare-HealthCare Data Analytics",
        "source": "Email",
        "date_posted": "2024-10-29 16:29:16-05:00",
        "unique_id": "192da731d580a354",
        "emp_type": [
            "contract",
            "third party"
        ],
        "tag": "Business Analyst"
    }
]