[
    {
        "company": "Sibitalent",
        "job_title": "Full Stack Java Developer - Senior",
        "location": "Boston, MA, USA",
        "full_location": {
            "city": "Boston",
            "state": "MA",
            "country": "USA"
        },
        "job_details": {
            "employment_type": [
                "contract",
                "third party"
            ],
            "job_code": "",
            "experience_required": "8+ years",
            "degree_required": "Not specified",
            "visa_sponsorship": "No visa sponsorship",
            "notice_period": "Not specified",
            "duration": "6+ Months",
            "rate": "Not specified"
        },
        "skills": {
            "core": [
                "Java",
                "Spring",
                "Spring MVC",
                "RESTful web services",
                "JavaScript",
                "JSP",
                "CSS",
                "HTML",
                "jQuery",
                "multi-threading",
                "SQL"
            ],
            "primary": [
                "myBatis",
                "Hibernate",
                "XML",
                "JSON",
                "AJAX"
            ],
            "secondary": [
                "JBoss",
                "Apache",
                "Tomcat",
                "Angular",
                "React",
                "Node.js",
                "XSLT",
                "jUnit",
                "Selenium",
                "stored procedures",
                "AWS",
                "CI/CD Pipelines"
            ],
            "all": [
                "Java",
                "Spring",
                "Spring MVC",
                "RESTful web services",
                "JavaScript",
                "JSP",
                "CSS",
                "HTML",
                "jQuery",
                "multi-threading",
                "SQL",
                "myBatis",
                "Hibernate",
                "XML",
                "JSON",
                "AJAX",
                "JBoss",
                "Apache",
                "Tomcat",
                "Angular",
                "React",
                "Node.js",
                "XSLT",
                "jUnit",
                "Selenium",
                "stored procedures",
                "AWS",
                "CI/CD Pipelines"
            ],
            "with_experience": [
                "Java (8+ years)",
                "Spring",
                "Spring MVC",
                "RESTful web services",
                "JavaScript",
                "multi-threading",
                "SQL"
            ]
        },
        "job_type": [
            "onsite"
        ],
        "contact_person": "Harsh Timori",
        "email": "h.timori@sibitalent.com",
        "jd": "From: Harsh Timori, Sibitalent h.timori@sibitalent.com Reply to: h.timori@sibitalent.com Note: Only need local candidate Onsite Interview :: Boston, MAJob Title \u2013 Full Stack Java Developer - SeniorJob Location \u2013Local to Boston (Only) Onsite InterviewDuration \u2013 6+ MonthsVisa \u2013 No CPT, H1BMode of Interview \u2013 F2F Job description - Looking for:-8+ years of experience developing web-based applications and development experience in Java/J2EE technologiesThe successful candidate must have, in order of importance:-Experience with Spring, Spring MVC, an ORM framework (myBatis or Hibernate preferred)-Experience using and implementing RESTful web services-Experience with Java, JavaScript, JSP, CSS, HTML, jQuery-Experience with multi-threading using core Java libraries particularly the Executor framework.-Knowledge of XML, JSON, and AJAX techniques-Strong understanding of SQL database design-Ability to effectively prioritize and execute tasks in a high-pressure environment.The below skills are nice to have in addition to the required skills in order of preference:-Experience with JBoss, Apache, Tomcat-Experience with Angular, React, Node.js and XSLT-Experience with unit testing frameworks such as jUnit or Selenium-Strong understanding of stored procedures -Experience with Cloud technologies focused on AWS-Experience with CI/CD Pipelines Best from,Harsh Timori || Sibitalent",
        "source": "Email",
        "date_posted": "2024-10-29 10:42:19-05:00",
        "unique_id": "192d9113b79a8d4b",
        "emp_type": [
            "contract",
            "third party"
        ],
        "tag": "Java developer"
    }
]