[
    {
        "company": "Virginia Department of Transportation",
        "job_title": "VDOT Java/Angular Developer",
        "location": "Richmond, VA, USA",
        "full_location": {
            "city": "Richmond",
            "state": "VA",
            "country": "USA"
        },
        "job_details": {
            "employment_type": [
                "contract",
                "third party"
            ],
            "job_code": "749891",
            "experience_required": "8+ years",
            "degree_required": "Not specified",
            "visa_sponsorship": "Not specified",
            "notice_period": "Not specified",
            "duration": "Not specified",
            "rate": "$60 - $80 Per Hr C2C or 1099"
        },
        "skills": {
            "core": [
                "Java",
                "Angular",
                "J2EE",
                "JSP",
                "Servlets",
                "XML",
                "JSON",
                "SQL",
                "PL/SQL",
                "JDBC",
                "CSS",
                "HTML",
                "AJAX",
                "JavaScript"
            ],
            "primary": [
                "Typescript",
                "Eclipse",
                "Tomcat",
                "Relational database design",
                "Oracle",
                "MSSQL"
            ],
            "secondary": [
                ".Net",
                "C#",
                "Software design",
                "Software development",
                "Software testing",
                "Problem-solving",
                "Interpersonal skills",
                "Written communication",
                "Verbal communication"
            ],
            "all": [
                "Java",
                "Angular",
                "J2EE",
                "JSP",
                "Servlets",
                "XML",
                "JSON",
                "SQL",
                "PL/SQL",
                "JDBC",
                "CSS",
                "HTML",
                "AJAX",
                "JavaScript",
                "Typescript",
                "Eclipse",
                "Tomcat",
                "Relational database design",
                "Oracle",
                "MSSQL",
                ".Net",
                "C#",
                "Software design",
                "Software development",
                "Software testing",
                "Problem-solving",
                "Interpersonal skills",
                "Written communication",
                "Verbal communication"
            ]
        },
        "job_type": [
            "hybrid"
        ],
        "contact_person": "Hitesh",
        "email": "hitesh@cyber-resource.com",
        "jd": "From: Hitesh, cyber-resource hitesh@cyber-resource.com Reply to: hitesh@cyber-resource.com Role: VDOT Java/Angular Developer (749891)Job Id : 749891Positions : 1Location: Richmond, VAWork mode: HybridInterview: Both Phone and In PersonDUE : 11/06Experience : 8+Client : -VDOT (Virginia Department of Transportation)Client State: VirginiaRate Range : $60 - $80 Per Hr C2C or 1099 This position requires that the resource works onsite 2 -3 days a week or as needed.VDOT is looking for experienced Java/angular developer with 8 + years experience in IT. \u2022Experience with Java, J2EE architecture, JSP, Servlets, XML, JSON, XSL , SQL, PL/SQL, JDBC, OO Design, CSS, HTML, AJAX, eclipse, Tomcat, JavaScript and knowledgeable with the Windows platform.\u2022 Ability to design and code using modern day frameworks such as Angular, Typescript and other web-related technologies.\u2022Experience with .Net and C# is a huge plus.\u2022Experience with relational database design and development with Oracle and MSSQL\u2022Experience in software design, development, and testing of web-based software applications\u2022Strong conceptual, analytical, and problem-solving abilities\u2022Strong interpersonal and written/verbal communication skills",
        "source": "Email",
        "date_posted": "2024-10-29 14:24:13-05:00",
        "unique_id": "192d9dc5c4dffccf",
        "emp_type": [
            "contract",
            "third party"
        ],
        "tag": "Java developer"
    }
]