[
    {
        "company": "Vyze Inc.",
        "job_title": "Python developer",
        "location": "Midtown Manhattan, NY, USA",
        "full_location": {
            "city": "Midtown Manhattan",
            "state": "NY",
            "country": "USA"
        },
        "job_details": {
            "employment_type": [
                "third party"
            ],
            "job_code": "",
            "experience_required": "3-4 years",
            "degree_required": "Not specified",
            "visa_sponsorship": "No visa sponsorship",
            "notice_period": "Not specified",
            "duration": "6+ Month",
            "rate": "Not specified"
        },
        "skills": {
            "core": [
                "Python",
                "C#",
                "Excel",
                "VBA"
            ],
            "primary": [
                "Investment Banking Experience",
                "Front Office Development",
                "Communication Skills"
            ],
            "secondary": [
                "Reactivity",
                "Autonomy"
            ],
            "all": [
                "Python",
                "C#",
                "Excel",
                "VBA",
                "Investment Banking Experience",
                "Front Office Development",
                "Communication Skills",
                "Reactivity",
                "Autonomy"
            ]
        },
        "job_type": [
            "onsite"
        ],
        "contact_person": "Rajeev",
        "email": "rajeev@vyzeinc.com",
        "jd": "From: Rajeev, Vyzeinc rajeev@vyzeinc.com Reply to: rajeev@vyzeinc.com Job Title: Python developer Duraation:6+ Month Location: Midtown Manhattan City, NYMode of Interview: 1 round is video ,1 to round onsite Need DL copy and Linkedin Id Python developer with investment banking experience, will require onsite interview and tech test.1.Understanding key business requirements2. Taking part in the development of new tools and industrialization/enhancement of the current ones, following commando standards. Using mainly C# or python for the backend and Excel for the front end such as contribution, pricing, risk & pnl spreadsheets.. 3. Supporting trading tools (mainly in Excel/VBA and python 4. Maintaining a strong working relationship with the trading 5. Working within team of commandos 6. 3/4 years of experience as a Front Office developer and working directly with traders SPECIAL ROLE REQUIREMENTS: Good communication skills and able to support Front Office users. Reactivity and autonomy Regards, Rajeev | Vyze Inc.25179 Methley Plum Place, Aldie, VA 20105 Email: rajeev@vyzeinc.com",
        "source": "Email",
        "date_posted": "2024-10-29 13:24:35-05:00",
        "unique_id": "192d9a5c5356c145",
        "emp_type": [
            "third party"
        ],
        "tag": "Python developer"
    }
]