[
    {
        "company": "fluxteksol.com",
        "job_title": "Oracle DBA w/TS",
        "location": "USA",
        "full_location": {
            "city": "",
            "state": "",
            "country": "USA"
        },
        "job_details": {
            "employment_type": [
                "third party"
            ],
            "job_code": "",
            "experience_required": "5+ years",
            "degree_required": "Bachelor\u2019s degree or 6 yrs. or more years of work experience.",
            "visa_sponsorship": "Not specified",
            "notice_period": "Not specified",
            "duration": "+ 12 Months",
            "rate": "Not specified"
        },
        "skills": {
            "core": [
                "RAC",
                "Goldengate",
                "Standby Database creation",
                "Performance Tuning",
                "Goldengate Replication/GG Replication",
                "Data Guard"
            ],
            "primary": [
                "Oracle 19c",
                "Oracle 12c",
                "Oracle 11g",
                "PostgreSQL",
                "Oracle Exadata",
                "ZFS Storage Appliances",
                "UNIX",
                "Linux",
                "shell scripting"
            ],
            "secondary": [
                "High Availability (HA) Setup",
                "Grid infrastructure (GI)",
                "Automatic Storage Management (ASM)",
                "Patching",
                "Oracle multitenant architecture",
                "Container database",
                "PDB hot clones",
                "PDB refresh",
                "PDB level failover capability",
                "Data Guard Broker",
                "Performance analysis",
                "SQL Tuning advisor",
                "AWR",
                "ADDM",
                "ASH",
                "Oracle Enterprise manager",
                "RMAN",
                "Partitioning",
                "Advanced Security",
                "OEM 13c",
                "Extreme Flash Storage"
            ],
            "all": [
                "RAC",
                "Goldengate",
                "Standby Database creation",
                "Performance Tuning",
                "Goldengate Replication/GG Replication",
                "Data Guard",
                "Oracle 19c",
                "Oracle 12c",
                "Oracle 11g",
                "PostgreSQL",
                "Oracle Exadata",
                "ZFS Storage Appliances",
                "UNIX",
                "Linux",
                "shell scripting",
                "High Availability (HA) Setup",
                "Grid infrastructure (GI)",
                "Automatic Storage Management (ASM)",
                "Patching",
                "Oracle multitenant architecture",
                "Container database",
                "PDB hot clones",
                "PDB refresh",
                "PDB level failover capability",
                "Data Guard Broker",
                "Performance analysis",
                "SQL Tuning advisor",
                "AWR",
                "ADDM",
                "ASH",
                "Oracle Enterprise manager",
                "RMAN",
                "Partitioning",
                "Advanced Security",
                "OEM 13c",
                "Extreme Flash Storage"
            ]
        },
        "job_type": [
            "remote"
        ],
        "contact_person": "Arjun",
        "email": "arjuna@fluxteksol.com",
        "jd": "From: Arjun, fluxteksol.com arjuna@fluxteksol.com Reply to: arjuna@fluxteksol.com Role Description:Job Title: Oracle DBA w/TSJob Location: (Remote)Job Duration: + 12 MonthsExperience: 5+Visa Status: USC --- TOP SECURITY clearance CERITIFICATE active We really need someone who is hands on on:1) RAC2) Goldengate3) Standby Database creation4) Performance Tuning5) Goldengate Replication/GG ReplicationData Guard Job Description:\u2022 Bachelor\u2019s degree or 6 yrs. or more years of work experience.\u2022 Experience administering Oracle 19c/12c/11g RAC databases and PostgreSQL\u2022 Solid working experience on Oracle Exadata and ZFS Storage Appliances.\u2022 Experience on UNIX/Linux and shell scriptingEven better if you have:\u2022 Experience with planning, building, implementing, administering, and maintaining on High Availability (HA) Setup of Oracle Real Application Clustering (RAC) database on Oracle 11g/12c/19c RDBMS, Grid infrastructure (GI), Automatic Storage Management (ASM), Data Guard and applying patches of GI and Oracle 11g/12c/19c RDBMS software binaries on Unix/Linux environments.\u2022 Experience in Oracle multitenant architecture, Container database, PDB hot clones, PDB refresh, relocation, plug/unplug and PDB level failover capability with Data Guard Broker.\u2022 Strong Working knowledge in performance analysis, tuning, ensures optimal database performance through exhaustive pre-service testing and ongoing real-time monitoring using Oracle Enterprise manager, SQL Tuning advisor, AWR, ADDM, ASH and other tools & techniques.\u2022 Experience with Performance Tuning & Troubleshooting and find a quicker resolution.\u2022 Experience with Software Products: Oracle 12c/19c, RMAN, Oracle Data Guard (Physical and Active), Golden Gate, Partitioning, Advanced Security, OEM 13c, Exadata with Extreme Flash Storage including patching/upgrade/Provisioning/monitoring.",
        "source": "Email",
        "date_posted": "2024-10-29 13:20:36-05:00",
        "unique_id": "192d9a21f6d38b5e",
        "emp_type": [
            "third party"
        ],
        "tag": "Oracle DBA"
    }
]