[
    {
        "company": "Triwave Solutions Inc",
        "job_title": "Business Analyst",
        "location": "USA",
        "full_location": {
            "city": "",
            "state": "",
            "country": "USA"
        },
        "job_details": {
            "employment_type": [
                "third party"
            ],
            "job_code": "",
            "experience_required": "3 years",
            "degree_required": "Not specified",
            "visa_sponsorship": "Not specified",
            "notice_period": "Not specified",
            "duration": "Not specified",
            "rate": "Not specified"
        },
        "skills": {
            "core": [
                "Business Analytics",
                "Requirements Gathering",
                "Project Management",
                "Business Process Reengineering"
            ],
            "primary": [
                "Agile Methodologies",
                "User Stories",
                "Jira",
                "Jama",
                "Zephyr",
                "PMI-PBA",
                "CBAP",
                "Communication Skills"
            ],
            "secondary": [
                "Waterfall",
                "DevOps",
                "Extreme Programming",
                "Rapid Application Development",
                "Oil Spill Response",
                "Natural Resource Damage Assessment",
                "Restoration Project Tracking"
            ],
            "all": [
                "Business Analytics",
                "Requirements Gathering",
                "Project Management",
                "Business Process Reengineering",
                "Agile Methodologies",
                "User Stories",
                "Jira",
                "Jama",
                "Zephyr",
                "PMI-PBA",
                "CBAP",
                "Communication Skills",
                "Waterfall",
                "DevOps",
                "Extreme Programming",
                "Rapid Application Development",
                "Oil Spill Response",
                "Natural Resource Damage Assessment",
                "Restoration Project Tracking"
            ]
        },
        "job_type": [],
        "contact_person": "Priyanka Verma",
        "email": "priyanka@triwavesolutions.com",
        "jd": "From: priyanka verma, Triwave Solutions Inc priyanka@triwavesolutions.com Reply to: priyanka@triwavesolutions.com JOB TITLE: Business AnalystThe scope of the proposed services will include the following:\u2022 Define and document business functions and processes;\u2022 Analyze the integration of business functions with technology;\u2022 Maintain a working knowledge of accounting, procurement, finance or contract management\u2022 Assist with business case development and business process reengineering;\u2022 Consult with management and personnel to identify, define and document business needs and objectives, current operational procedures, problems, input and output requirements;\u2022 Recommend new processes that yield operational efficiencies;\u2022 Conduct cost-benefit analysis;\u2022 Develop or assist with project work plans, project timelines;\u2022 Develop or assist with ITBs, RFIs, RFRs, RFPs and contracts. The Business Analyst should be familiar with State of Louisiana procurement laws and procedures, and also have experience in developing technical specifications and negotiating with vendors to acquire IT assets. Expertise and/or relevant experience in the following areas are mandatory:\u2022 Three (3) years of experience with Business Analytics processes including creating requirements and design documents and facilitating project related meetings with business partners.Expertise and/or relevant experience in the following areas are desirable but not mandatory:\u2022 Minimum (one) 1-year experience working as a Business Analyst in an Agile Environment (Scrum, Kanban, etc.)\u2022 Minimum (one) 1-year experience writing complete User Stories, including descriptions and acceptance criteria based on requirements gathering\u2022 Familiarity with Business Process Re-Engineering (BPR)\u2022 Familiarity with Jira\u2022 Familiarity with Jama and/or Zephyr testing systems\u2022 PMI-PBA or CBAP certification\u2022 Excellent written and verbal communication skills\u2022 Experience managing Projects utilizing Software Development methodologies such as but not limited to: Waterfall, DevOps, Extreme Programming, Rapid Application Development, Agile Development, etc.\u2022 Experience with Oil Spill Response, Natural Resource Damage Assessment, and Restoration Project tracking systems and programs.",
        "source": "Email",
        "date_posted": "2024-10-29 07:40:34-05:00",
        "unique_id": "192d878fdca0c006",
        "emp_type": [
            "third party"
        ],
        "tag": "Business Analyst"
    }
]