[
    {
        "company": "CAGUS",
        "job_title": "AWS Cloud Architect/ Developer",
        "location": "Plano, TX, USA",
        "full_location": {
            "city": "Plano",
            "state": "TX",
            "country": "USA"
        },
        "job_details": {
            "employment_type": [
                "contract",
                "third party"
            ],
            "job_code": "",
            "experience_required": "12+ years",
            "degree_required": "Not specified",
            "visa_sponsorship": "Not specified",
            "notice_period": "Not specified",
            "duration": "Contract",
            "rate": "Not specified"
        },
        "skills": {
            "core": [
                "AWS",
                "Cloud Services",
                "ECS",
                "EKS",
                "EC2",
                "MongoDB",
                "Aurora"
            ],
            "primary": [
                "Service Mesh",
                "Design and Implement Gateways",
                "Debugging on AWS Services",
                "Blue Green Deployment",
                "AWS Solution Architect Certification",
                "Kubernetes",
                "Terraform"
            ],
            "secondary": [],
            "all": [
                "AWS",
                "Cloud Services",
                "ECS",
                "EKS",
                "EC2",
                "MongoDB",
                "Aurora",
                "Service Mesh",
                "Design and Implement Gateways",
                "Debugging on AWS Services",
                "Blue Green Deployment",
                "AWS Solution Architect Certification",
                "Kubernetes",
                "Terraform"
            ]
        },
        "job_type": [
            "onsite"
        ],
        "contact_person": "Fizal",
        "email": "fizal.a@cagus.com",
        "jd": "From: Fizal, CAGUS fizal.a@cagus.com Reply to: fizal.a@cagus.com Position: AWS Cloud Architect/ Developer (12+ years Only)Location: Plano, TX (Day 1 Onsite)Duration: Contract We are looking for Sr Principle(AWS) Engineer with strong Cloud Services knowledge such as ECS EKS and EC2 and Data MongoDB Aurora who knows service mesh how to design and implement Gateways and debugging on AWS servicesAble to design in most of AWS cloud ServicesExperience in Blue Green Deployment to run current and new application version in identical environments.Better certification in AWS Solution architect, Kubernetes, Terraform",
        "source": "Email",
        "date_posted": "2024-10-29 07:45:42-05:00",
        "unique_id": "192d86f859b4224b",
        "emp_type": [
            "contract",
            "third party"
        ],
        "tag": "AWS Data Engineer"
    }
]