[
    {
        "company": "Bank/Financial Services",
        "job_title": "Sr. Data Engineer",
        "location": "Troy, MI, USA",
        "full_location": {
            "city": "Troy",
            "state": "MI",
            "country": "USA"
        },
        "job_details": {
            "employment_type": [
                "full-time",
                "third party"
            ],
            "experience_required": "10 years",
            "degree_required": "Bachelor's in Computer Science, Mathematics or related field + 7 years of development experience preferred, or 10 years comparable work experience required.",
            "visa_sponsorship": "Not specified",
            "notice_period": "Not specified",
            "duration": "Not specified",
            "rate": "Not specified"
        },
        "skills": {
            "core": [
                "ELT/ETL",
                "data integration",
                "data analytics",
                "Snowflake",
                "Oracle"
            ],
            "primary": [
                "Business Intelligence tools",
                "IBM Cognos",
                "Power BI",
                "Alteryx",
                "API\u2019s",
                "data as a service",
                "data marketplace",
                "data mesh",
                "Software Development Life Cycle",
                "Agile",
                "SCRUM",
                "Waterfall",
                "data pipelines",
                "ETL jobs",
                "IBM DataStage",
                "Informatica",
                "Matillion",
                "FiveTran",
                "Talend",
                "Dbt",
                "AWS cloud services",
                "data modelling",
                "Data Science",
                "AI/ML Engineering",
                "AWS Sagemaker",
                "cloud data lake",
                "data warehouses",
                "data Mart",
                "Relational Database Management System",
                "SQL development",
                "flat file formats",
                "XML",
                "PL/SQL",
                "ETL best practices"
            ],
            "secondary": [
                "strong teamwork",
                "interpersonal skills",
                "project budget management",
                "agile practices",
                "oral and written communication skills",
                "analytical skills",
                "problem-solving skills",
                "organizational skills",
                "time-management skills",
                "Strategic Thinking",
                "Solutioning",
                "self-starter",
                "root cause analysis"
            ],
            "all": [
                "ELT/ETL",
                "data integration",
                "data analytics",
                "Snowflake",
                "Oracle",
                "Business Intelligence tools",
                "IBM Cognos",
                "Power BI",
                "Alteryx",
                "API\u2019s",
                "data as a service",
                "data marketplace",
                "data mesh",
                "Software Development Life Cycle",
                "Agile",
                "SCRUM",
                "Waterfall",
                "data pipelines",
                "ETL jobs",
                "IBM DataStage",
                "Informatica",
                "Matillion",
                "FiveTran",
                "Talend",
                "Dbt",
                "AWS cloud services",
                "data modelling",
                "Data Science",
                "AI/ML Engineering",
                "AWS Sagemaker",
                "cloud data lake",
                "data warehouses",
                "data Mart",
                "Relational Database Management System",
                "SQL development",
                "flat file formats",
                "XML",
                "PL/SQL",
                "ETL best practices",
                "strong teamwork",
                "interpersonal skills",
                "project budget management",
                "agile practices",
                "oral and written communication skills",
                "analytical skills",
                "problem-solving skills",
                "organizational skills",
                "time-management skills",
                "Strategic Thinking",
                "Solutioning",
                "self-starter",
                "root cause analysis"
            ]
        },
        "job_type": [
            "hybrid"
        ],
        "contact_person": "Aditi",
        "email": "aditi@3bstaffing.com",
        "jd": "From: Aditi, 3B Staffing LLC aditi@3bstaffing.com Reply to: aditi@3bstaffing.com Role : Sr. Data Engineer Location: Troy, MI. Hybrid role Client: Bank/Financial ServicesExperience Level: 10 years Job Summary: \u2022 The Sr. Data Engineer is responsible in understanding and supporting the businesses through the design, development, and execution of Extract, Transform, and Load (ELT/ETL), data integration, and data analytics processes across the enterprise. \u2022 Will stay on top of tech trends, experiment with and learn new technologies, contribute to the growth of data organization, participate in internal & external technology communities, and mentor other members of the team. \u2022 Provide technical leadership at every stage of the data engineering lifecycle, from designing data platforms, data pipelines, data stores, and gathering, importing, wrangling, querying, and analyzing data. \u2022 The Sr data engineer will work closely with various customers including their immediate project teams, business domain experts and other technical staff members. \u2022 Work daily within a project team environment, taking direction from project management and technical leaders. \u2022 Responsible for design, development, administration, support, and maintenance of the Snowflake Platform and Oracle Platform. \u2022 Participates in the full systems life cycle and cloud data lake/data warehouse design and build including recommendation of code development, integration with data marketplace or reuse and buy versus build solutions. Job Responsibilities: \u2022 Technical Leadership \u2013 Lead data integration across the enterprise thru design, build and implementation of large scale, high-volume, high-performance data pipelines for both on-prem and cloud data lake and data warehouses. Lead the development and documentation of technical best practices for ELT/ETL activities. Also, oversee a program inception to build a new product if needed. \u2022 Solution Design \u2013 Lead the design of technical solution including code, scripts, data pipelines, processes/procedures for integration of data lake and data warehouse solutions in an operative IT environment. \u2022 Code Development \u2013 Ensures data engineering activities are aligned with scope, schedule, priority and business objectives. Oversees code development, unit and performance testing activities. Responsible to code and lead the team to implement the solution. \u2022 Testing \u2013 Leads validation efforts by verifying the data at various middle stages that are being used between source and destination and assisting others in validating the solution performs as expected. Meets or exceeds all operational readiness requirements (e.g., operations engineering, performance, and risk management). \u2022 Ensure compliance with applicable federal, state and local laws and regulations. Complete all required compliance training. Maintain knowledge of and adhere to Client's internal compliance policies and procedures. Take responsibility to keep up to date with changing regulations and policies. Job Requirements: \u2022 Bachelor's in Computer Science, Mathematics or related field + 7 years of development experience preferred, or 10 years comparable work experience required. \u2022 10 years of experience designing, developing, testing, and implementing Extract, Transform and Load (ELT/ETL) solutions using enterprise ELT/ETL \u2022 10 years of experience developing and implementing data integration, data lake and data warehouse solutions in an on-premise and cloud environment. \u2022 5 years of experience working with Business Intelligence tools (IBM Cognos is preferred), Power BI and Alteryx. \u2022 7 years of experience working with API\u2019s, data as a service, data marketplace and data mesh. \u2022 10 years of experience with various Software Development Life Cycle methods such as Agile, SCRUM, Waterfall, etc. \u2022 3+ years\u2019 experience in 100+ TB data environment. \u2022 Proven experience developing and maintaining data pipelines and ETL jobs using IBM DataStage, Informatica, Matillion, FiveTran, Talend or Dbt \u2022 Knowledge of AWS cloud services such as S3, EMR, Lambda, Glue, Sage Maker, Redshift & Athena and/or Snowflake. \u2022 Experienced in data modelling for self-service business intelligence, advanced analytics, and user application. \u2022 Experience with Data Science including AI/ML Engineering, ML framework/pipeline build and predictive/prescriptive analytics on AWS Sagemaker. \u2022 Experience with migrating, architecting, designing, building and implementing cloud data lake, data warehouses (cloud/on-prem), data mesh, data as a service, and cloud data marketplace. \u2022 Demonstrated ability to work with key stakeholders outside the project to understand requirements/resolve issues. \u2022 Experience with data model design, writing complex SQL queries, etc., and should have a good understanding of BI/DWH principles. \u2022 Expertise in Relational Database Management System, Data Mart and Data Warehouse design. \u2022 Expert-level SQL development skills in a multi-tier environment. \u2022 Expertise in flat file formats, XML within PL/SQL, and file format conversion. \u2022 Strong understanding of SDLC and Agile Methodologies. \u2022 Strong understanding of model driven development. \u2022 Strong understanding of ETL best practices. \u2022 Ability to communicate complex technical concepts by adjusting messaging to the audience: business partners, IT peers, external stakeholders, etc. \u2022 Proven ability to design and build technical solutions using applicable technologies; ability to demonstrate exceptional data engineering skills. \u2022 Ability to prioritize work by dividing time, attention and effort between current project workload and on-going day to day activities. \u2022 Demonstrates strength in adapting to change in processes, procedures and priorities. \u2022 Proven ability to establish a high level of trust and confidence in both the business and IT communities. \u2022 Strong teamwork and interpersonal skills at all management levels. \u2022 Proven ability to manage to a project budget. \u2022 Experience applying agile practices to solution delivery. \u2022 Must be team-oriented and have excellent oral and written communication skills. \u2022 Strong analytic and problem-solving skills. \u2022 Good organizational and time-management skills. \u2022 Experience in Strategic Thinking and Solutioning. \u2022 Must be a self-starter to understand existing bottlenecks and come up with innovative solution. \u2022 Proven strength in interpreting customer business needs and translating them into application and operational requirements. \u2022 Strong problem-solving skills and analytic skills with proven strength in applying root cause analysis.",
        "source": "Email",
        "date_posted": "2024-10-29 11:05:25-05:00",
        "unique_id": "192d95274acfabe0",
        "emp_type": [
            "full-time",
            "third party"
        ],
        "tag": "AWS Data Engineer"
    }
]