[
    {
        "company": "Siriinfo",
        "job_title": "Business Analyst",
        "location": "Iselin, NJ, USA",
        "full_location": {
            "city": "Iselin",
            "state": "NJ",
            "country": "USA"
        },
        "job_details": {
            "employment_type": [
                "third party"
            ],
            "job_code": "",
            "experience_required": "6-8 years",
            "degree_required": "Not specified",
            "visa_sponsorship": "Not specified",
            "notice_period": "Not specified",
            "duration": "Not specified",
            "rate": "Not specified"
        },
        "skills": {
            "core": [
                "Oracle FLEXCUBE",
                "SQL",
                "MS Excel",
                "Data Analysis",
                "Python",
                "Agile"
            ],
            "primary": [
                "Corporate Banking",
                "Trade Finance",
                "Treasury",
                "Lending"
            ],
            "secondary": [],
            "all": [
                "Oracle FLEXCUBE",
                "SQL",
                "MS Excel",
                "Data Analysis",
                "Python",
                "Agile",
                "Corporate Banking",
                "Trade Finance",
                "Treasury",
                "Lending"
            ],
            "with_experience": [
                "Oracle FLEXCUBE",
                "SQL",
                "MS Excel",
                "Data Analysis",
                "Python",
                "Agile"
            ]
        },
        "job_type": [],
        "contact_person": "Dushyanth",
        "email": "dushyanth@siriinfo.com",
        "jd": "From: Dushyanth, Siriinfo dushyanth@siriinfo.com Reply to: dushyanth@siriinfo.com Hi Hiring for Business Analyst at Iselin, NJ(South)Role name: Business AnalystRole Description: Hands on exp on Oracle FLEXCUBEStrong in SQL, MS Excel and Data AnalysisGood Python experience.Good Functional knowledge on corporate bankingGood knowledge of Trade Finance, Treasury and Lending.Exp as Business AnalystMust have Agile experience.Competencies: Digital : EAS : Oracle Cloud Infrastructure, PL/SQL, Microsoft ExcelExperience (Years): 6-8Essential Skills: Hands on exp on Oracle FLEXCUBEStrong in SQL, MS Excel and Data AnalysisGood Python experience.Good Functional knowledge on corporate bankingGood knowledge of Trade Finance, Treasury and Lending.Exp as Business AnalystMust have Agile experience. Thanks & regardsDushyanth | Sr. IT Recruiter| Email: dushyanth@siriinfo.com",
        "source": "Email",
        "date_posted": "2024-10-29 17:54:29-05:00",
        "unique_id": "192dab18c0098a4c",
        "emp_type": [
            "third party"
        ],
        "tag": "Business Analyst"
    }
]