[
    {
        "company": "Pull Skill Technologies Inc.",
        "job_title": "Architect with Asset & Wealth Management exp",
        "location": "San Ramon, CA, USA",
        "full_location": {
            "city": "San Ramon",
            "state": "CA",
            "country": "USA"
        },
        "job_details": {
            "employment_type": [
                "contract",
                "third party"
            ],
            "job_code": "",
            "experience_required": "Not specified",
            "degree_required": "Not specified",
            "visa_sponsorship": "Not specified",
            "notice_period": "Not specified",
            "duration": "3 month contract, possibility of extension",
            "rate": "Not specified"
        },
        "skills": {
            "core": [
                "Asset Management",
                ".NET",
                "React",
                "Angular",
                "Azure Cloud"
            ],
            "primary": [
                "UI-based applications",
                "Winforms",
                "WCF",
                "Tech Leadership"
            ],
            "secondary": [
                "Financial Services background",
                "Delivery management",
                "Communication"
            ],
            "all": [
                "Asset Management",
                ".NET",
                "React",
                "Angular",
                "Azure Cloud",
                "UI-based applications",
                "Winforms",
                "WCF",
                "Tech Leadership",
                "Financial Services background",
                "Delivery management",
                "Communication"
            ]
        },
        "job_type": [
            "onsite"
        ],
        "contact_person": "Aazam",
        "email": "aazam@pullskill.com",
        "jd": "From: Aazam, Pull Skill Technologies Inc., aazam@pullskill.com Reply to: aazam@pullskill.com Local candidates based out in CA, with Asset & Wealth Management Experience Role: .Net Architect with Asset & Wealth Management ExpLocation: San Ramon, CA - 3 days onsite per weekEnd Date: start as a 3 month contract, possibility of extension and also looking for those interested in conversionInterview process: 2 internal, possible client Notes: Need Asset Management experience - Some recent rejections were due to not having Asset Management experience. They should also have experience architecting any system or having helped architect it, as well as done delivery mgmt or provided Tech leadership. Updated Requirements: Recent .NET Architect experience and .NET expertise Experience building UI-based applications (React/Angular), Winforms/WCF on Azure Cloud. Asset/Wealth Management experience is a mustFinancial Services backgroundResponsibilities: Target Architecture of the applicationTech Leadership across Client TeamsBuild a tech roadmap for the productProvide Tech Leadership to the implementation team for migration of D&C\u2019s on-prem EWS application to cloud We need a solid .NET Architect with experience in building UI-based applications (React/Angular), Winforms/WCF on Azure Cloud.Must have played a role of Sr. ArchitectMust have a solid communication to collaboratively drive buildingTarget Architecture of the applicationTech Leadership across Client TeamsBuild a tech roadmap for the productProvide Tech Leadership to the implementation team for migration of D&C\u2019s on-prem EWS application to cloudAWM experience required (asset and wealth management)",
        "source": "Email",
        "date_posted": "2024-10-29 12:51:11-05:00",
        "unique_id": "192d987332d71ae2",
        "emp_type": [
            "contract",
            "third party"
        ],
        "tag": ".net developer"
    }
]