[
    {
        "company": "HMG America LLC",
        "job_title": "Release Train Engineer",
        "location": "Raritan, NJ, USA",
        "full_location": {
            "city": "Raritan",
            "state": "NJ",
            "country": "USA"
        },
        "job_details": {
            "employment_type": [
                "contract",
                "third party"
            ],
            "job_code": "",
            "experience_required": "5 years",
            "degree_required": "Not specified",
            "visa_sponsorship": "Not specified",
            "notice_period": "Not specified",
            "duration": "6 months",
            "rate": "Not specified"
        },
        "skills": {
            "core": [
                "Release Train Engineer",
                "Agile methodologies",
                "Scrum master",
                "Project management",
                "SAP environments"
            ],
            "primary": [
                "Agile Release Trains (ARTs)",
                "Program Increments (PIs)",
                "People management",
                "Agile Product Development",
                "Communication skills"
            ],
            "secondary": [
                "Risk management",
                "Continuous improvement",
                "Complex environments",
                "Fast-paced environment"
            ],
            "all": [
                "Release Train Engineer",
                "Agile methodologies",
                "Scrum master",
                "Project management",
                "SAP environments",
                "Agile Release Trains (ARTs)",
                "Program Increments (PIs)",
                "People management",
                "Agile Product Development",
                "Communication skills",
                "Risk management",
                "Continuous improvement",
                "Complex environments",
                "Fast-paced environment"
            ]
        },
        "job_type": [
            "hybrid"
        ],
        "contact_person": "Suman Bala",
        "email": "sbala@hmgamerica.com",
        "jd": "HMG America LLC is the best Business Solutions focused Information Technology Company with IT consulting and services, software and web development, staff augmentation and other professional services. One of our direct clients is looking for Release Train Engineer in Raritan, NJ. Below is the detailed job description.\n\nTitle: Release Train Engineer\nLocation: Raritan, NJ(Onsite-Hybrid) (Only from NY,NJ area)\n\nResponsibilities:\n\u2022 Individual will ensure end-to-end planning and coordinated communication between all scrum teams and shared teams throughout the project lifecycle.\n\u2022 RTE will ensure project commitments are consistently planned, coordinated, and met across Product Managers, scrum masters, and shared teams.\n\u2022 Individual is responsible for impediments handling in timely manner, cross-scrum and shared teams.\n\u2022 RTE will drive the process, cadence, and ceremonies across scrum and shared teams, not individual scrum teams including PI planning and release planning.\n\u2022 RTE will maintain release tracker for technical objects and sets guidelines for DSU\u2019s and scrum team performance.\n\u2022 You will support risk management and mitigations\n\nQualifications:\n\u2022 Individual should have least 5 years of experience as a release train engineer/agile management.\n\u2022 Proven experience as a Scrum master, RTE, project management, Agile methodologies, and SAP environments is crucial.\n\u2022 Experience with Agile Release Trains (ARTs) and Program Increments (PIs).\n\u2022 Demonstrated Release Train Engineer experience in big program implementations involving multiple applications.\n\u2022 Understanding of SAP and S/4 Hana systems and how they integrate with Agile practices.\n\u2022 Ability to lead and coach Agile teams, facilitate ART events, and foster continuous improvement.\n\u2022 Experience with complex environments and multiple phases of project running in parallel.\n\u2022 Extensive experience in Agile Product Development with a strong focus on delivery.\n\u2022 People management experience and effectively lead the team through change.\n\u2022 Very strong communication skills and ability to work in a fast-paced environment.",
        "source": "Email",
        "date_posted": "2024-10-29 12:46:24-05:00",
        "unique_id": "192d982d087047b7",
        "emp_type": [
            "contract",
            "third party"
        ],
        "tag": "Scrum Master"
    }
]