[
    {
        "company": "Cognizant",
        "job_title": "Azure Data Engineer",
        "location": "USA",
        "full_location": {
            "city": "",
            "state": "",
            "country": "USA"
        },
        "job_details": {
            "employment_type": [
                "contract",
                "third party"
            ],
            "job_code": "",
            "experience_required": "10+ years",
            "degree_required": "Not specified",
            "visa_sponsorship": "Not specified",
            "notice_period": "Not specified",
            "duration": "12-24 Months",
            "rate": "Not specified"
        },
        "skills": {
            "core": [
                "Azure",
                "SQL",
                "data engineering",
                "data warehousing",
                "data lakes"
            ],
            "primary": [
                "ETL",
                "ELT",
                "ADF",
                "Informatica",
                "Talend",
                "Azure Synapse",
                "Azure SQL",
                "Amazon Redshift",
                "Snowflake",
                "Google Big Query",
                "Databricks",
                "Spark",
                "PySpark",
                "Spark SQL"
            ],
            "secondary": [
                "Event Hub",
                "IOT Hub",
                "Azure Stream Analytics",
                "Azure Analysis Service",
                "Cosmo DB",
                "SAP ECC",
                "S/4",
                "Hana",
                "Power BI",
                "Azure DevOps",
                "CI/CD",
                "cloud migration methodologies"
            ],
            "all": [
                "Azure",
                "SQL",
                "data engineering",
                "data warehousing",
                "data lakes",
                "ETL",
                "ELT",
                "ADF",
                "Informatica",
                "Talend",
                "Azure Synapse",
                "Azure SQL",
                "Amazon Redshift",
                "Snowflake",
                "Google Big Query",
                "Databricks",
                "Spark",
                "PySpark",
                "Spark SQL",
                "Event Hub",
                "IOT Hub",
                "Azure Stream Analytics",
                "Azure Analysis Service",
                "Cosmo DB",
                "SAP ECC",
                "S/4",
                "Hana",
                "Power BI",
                "Azure DevOps",
                "CI/CD",
                "cloud migration methodologies"
            ]
        },
        "job_type": [
            "remote"
        ],
        "contact_person": "Venki R",
        "email": "venki@nam-it.com",
        "jd": "From: Venki, NAM INFO INC venki@nam-it.com Reply to: venki@nam-it.com Hi Greetings from NAM Info Inc!!! Please find the below immediate requirements from my client. Please revert me back with updated copy of resume, Visa status and contact details Note: Send resumes to Venki@nam-it.com for quick submittals. Job Role- Azure Data EngineerLocation- RemoteDuration- 12-24 Months Contract Must have Skills :Min 5 years of experience in modern data engineering/data warehousing/data lakes technologies on cloud platforms like Azure, AWS, GCP, Data Bricks etc. Azure experience is preferred over other cloud platforms.10 + years of proven experience with SQL, schema design and dimensional data modellingSolid knowledge of data warehouse best practices, development standards and methodologiesExperience with ETL/ELT tools like ADF, Informatica , Talend etc., and data warehousing technologies like Azure Synapse, Azure SQL, Amazon redshift , Snowflake , Google Big Query etc..Strong experience with big data tools(Databricks , Spark etc..) and programming skills in PySpark and Spark SQL.Be an independent self-learner with \u201clet\u2019s get this done\u201d approach and ability to work in Fast paced and Dynamic environment.Excellent communication and teamwork abilities. Nice-to-Have Skills:Event Hub, IOT Hub, Azure Stream Analytics, Azure Analysis Service, Cosmo DB knowledge.SAP ECC /S/4 and Hana knowledge.Intermediate knowledge on Power BIAzure DevOps and CI/CD deployments, Cloud migration methodologies and processes Thanks & Regards...Venki RLead (Staffing)Nam Info Inc Email : Venki@nam-it.comWebsite - www.nam-it.com2525 US Highway 130, Building D, Suite 2-Cranbury, NJ-08512 \u201cThe harder you work, the luckier you get\u201d Follow us on: USA | CANADA | INDIA MBE Certified Company , E Verify Company Note: This is not an unsolicited mail. Under Bill 1618 Title III passed by the 105th USA Congress this email cannot be considered as spam as long as we include our contact information and an option to be removed from our emailing list. If you have received this message in error or, are not interested in receiving our emails, please accept our apologies. To be removed from our mailing list, please reply with the subject line \"REMOVE\". All removal requests will be honored ASAP. We sincerely apologize for any inconvenience caused to you",
        "source": "Email",
        "date_posted": "2024-10-29 08:28:42-05:00",
        "unique_id": "192d8b147bfe69ca",
        "emp_type": [
            "contract",
            "third party"
        ],
        "tag": "Azure Data Engineer"
    }
]