[
    {
        "company": "Wiseq",
        "job_title": "Senior .NET Architect",
        "location": "Albany, NY, USA",
        "full_location": {
            "city": "Albany",
            "state": "NY",
            "country": "USA"
        },
        "job_details": {
            "employment_type": [
                "contract",
                "third party"
            ],
            "job_code": "",
            "experience_required": "84 Months",
            "degree_required": "Not specified",
            "visa_sponsorship": "Not specified",
            "notice_period": "Not specified",
            "duration": "30 months",
            "rate": "$75/hr on C2C"
        },
        "skills": {
            "core": [
                "ASP.Net",
                "C#",
                "PL/SQL",
                "Microsoft Visual Studio"
            ],
            "primary": [
                "n-tier web deployment",
                "systems architecture",
                "engineering",
                "administration",
                "configuration",
                "troubleshooting",
                "performance tuning",
                "preventative maintenance",
                "security procedures"
            ],
            "secondary": [],
            "all": [
                "ASP.Net",
                "C#",
                "PL/SQL",
                "Microsoft Visual Studio",
                "n-tier web deployment",
                "systems architecture",
                "engineering",
                "administration",
                "configuration",
                "troubleshooting",
                "performance tuning",
                "preventative maintenance",
                "security procedures"
            ],
            "with_experience": [
                "ASP.Net (84 Months)",
                "C# (84 Months)",
                "PL/SQL (84 Months)"
            ]
        },
        "job_type": [
            "onsite"
        ],
        "contact_person": "Austin Wiseq",
        "email": "austin@wiseq.net",
        "jd": "From: Austin, Wiseq austin@wiseq.net Reply to: austin@wiseq.net Day 1 onsite in Albany, NY Senior .NET Architect Pay rate - $75/hr on C2C Please find the below JD Job Title: Senior .NET Architect with Healthcare Experience Duration: 30 monthsLocation: Albany, NY(Day 1 onsite) Requested Qualification84 Months Experience as lead technical architect on technical projects performing systems architecture, engineering, administration, configuration, troubleshooting, performance tuning, preventative maintenance and security procedures. 84 Months Experience using Microsoft Visual Studio to develop complex n-tier web browser-based applications in ASP.Net/MVC and/or C# for n-tier web deployment. 84 Months Experience using PL/SQL to develop Oracle packages, triggers, stored procedures, functions, scripts and cursors.",
        "source": "Email",
        "date_posted": "2024-10-29 10:07:43-05:00",
        "unique_id": "192d8f18943e06e2",
        "emp_type": [
            "contract",
            "third party"
        ],
        "tag": ".net developer"
    }
]