[
    {
        "company": "Orchid Solutions Inc",
        "job_title": "Java/Angular Developer",
        "location": "Richmond, VA, USA",
        "full_location": {
            "city": "Richmond",
            "state": "VA",
            "country": "USA"
        },
        "job_details": {
            "employment_type": [
                "full-time",
                "third party"
            ],
            "experience_required": "8+ years",
            "degree_required": "Not specified",
            "visa_sponsorship": "Not specified",
            "notice_period": "Not specified",
            "duration": "Not specified",
            "rate": "Not specified"
        },
        "skills": {
            "core": [
                "Java",
                "Angular",
                "J2EE",
                "JSP",
                "Servlets",
                "XML",
                "JSON",
                "XSL",
                "SQL",
                "PL/SQL",
                "JDBC",
                "OO Design",
                "CSS",
                "HTML",
                "AJAX",
                "JavaScript"
            ],
            "primary": [
                "Typescript",
                "Eclipse",
                "Tomcat"
            ],
            "secondary": [
                ".Net",
                "C#"
            ],
            "all": [
                "Java",
                "Angular",
                "J2EE",
                "JSP",
                "Servlets",
                "XML",
                "JSON",
                "XSL",
                "SQL",
                "PL/SQL",
                "JDBC",
                "OO Design",
                "CSS",
                "HTML",
                "AJAX",
                "JavaScript",
                "Typescript",
                "Eclipse",
                "Tomcat",
                ".Net",
                "C#"
            ],
            "with_experience": [
                "Java (8+ years)",
                "Angular (8+ years)"
            ]
        },
        "job_type": [
            "onsite"
        ],
        "contact_person": "Krishna",
        "email": "krishna@os-inc.com",
        "jd": "From: Krishna, Orchid Solutions Inc krishna@os-inc.com Reply to: krishna@os-inc.com TITLE: Java/Angular DeveloperLocation: Richmond, VA JOB DESCRIPTIONThis position requires that the resource works onsite 2 -3 days a week or as needed.VDOT is looking for experienced Java/angular developer with 8 + years experience in IT. \u2022Experience with Java, J2EE architecture, JSP, Servlets, XML, JSON, XSL , SQL, PL/SQL, JDBC, OO Design, CSS, HTML, AJAX, eclipse, Tomcat, JavaScript and knowledgeable with the Windows platform.\u2022 Ability to design and code using modern day frameworks such as Angular, Typescript and other web-related technologies.\u2022Experience with .Net and C# is a huge plus.\u2022Experience with relational database design and development with Oracle and MSSQL\u2022Experience in software design, development, and testing of web-based software applications\u2022Strong conceptual, analytical, and problem-solving abilities\u2022Strong interpersonal and written/verbal communication skills",
        "source": "Email",
        "date_posted": "2024-10-29 17:28:44-05:00",
        "unique_id": "192db382409e6b79",
        "emp_type": [
            "full-time",
            "third party"
        ],
        "tag": "Java developer"
    }
]