[
    {
        "company": "NRG Energy",
        "job_title": "Senior Oracle PL SQL Developer",
        "location": "Houston, TX, USA",
        "full_location": {
            "city": "Houston",
            "state": "TX",
            "country": "USA"
        },
        "job_details": {
            "employment_type": [
                "full-time",
                "third party"
            ],
            "job_code": "",
            "experience_required": "15+ years",
            "degree_required": "Bachelor's degree in computer science, software engineering or relevant business discipline from an accredited four-year college or university.",
            "visa_sponsorship": "Not specified",
            "notice_period": "Not specified",
            "duration": "6 months+",
            "rate": "Not specified"
        },
        "skills": {
            "core": [
                "Oracle PL/SQL",
                "Analytical functions",
                "Merge statements",
                "WITH clause",
                "Oracle partitioning",
                "Job logging",
                "Exception handling",
                "Performance tuning",
                "Data Warehouse"
            ],
            "primary": [
                "Software development",
                "Troubleshooting skills",
                "Strong Analytical skills",
                "Strong Team Player"
            ],
            "secondary": [
                "Flexibility",
                "Dedication",
                "Consistency",
                "Integrity",
                "Enthusiasm"
            ],
            "all": [
                "Oracle PL/SQL",
                "Analytical functions",
                "Merge statements",
                "WITH clause",
                "Oracle partitioning",
                "Job logging",
                "Exception handling",
                "Performance tuning",
                "Data Warehouse",
                "Software development",
                "Troubleshooting skills",
                "Strong Analytical skills",
                "Strong Team Player",
                "Flexibility",
                "Dedication",
                "Consistency",
                "Integrity",
                "Enthusiasm"
            ]
        },
        "job_type": [
            "hybrid"
        ],
        "contact_person": "Anand Prajapati",
        "email": "aprajapati@vyzeinc.com",
        "jd": "Job Description -\u00adNeed local or nearby candidates with LinkedIn with actual genuine visa Senior Oracle PL/SQL DeveloperClient \u2013 NRG Energy6 months+Locations: - : 3 days onsite a week- Houston, TXSkype***Must be local to Houston or TX and be willing to come into the downtown office Monday, Tuesday, and Thursday of every week***Design, develop, test, maintain, and support batch applications using Oracle PL/SQL for Retail Commissions and Amortization.Education:Bachelor's degree in computer science, software engineering or relevant business discipline from an accredited four-year college or university.Experience:15+ years of experience in Software development12+ years of strong development experience using Oracle PL/SQL including experience using features like Analytical functions, merge statements, WITH clause, oracle partitioning, job logging, exception handling, performance tuning12+ years of experience in Oracle 12c or 19c5+ years of experience in a Data Warehouse environmentStrong Analytical skillsTroubleshooting skillsStrong Team Player Additional skills:Flexibility, Dedication, Consistency, Integrity, and Enthusiasm a must.",
        "source": "Email",
        "date_posted": "2024-10-29 15:47:57-05:00",
        "unique_id": "192da97eb434b3ec",
        "emp_type": [
            "full-time",
            "third party"
        ],
        "tag": "Oracle DBA"
    }
]