[
    {
        "company": "Techkonnect",
        "job_title": "ServiceNow Business Analyst (HR Module)",
        "location": "USA",
        "full_location": {
            "city": "",
            "state": "",
            "country": "USA"
        },
        "job_details": {
            "employment_type": [
                "third party"
            ],
            "job_code": "",
            "experience_required": "8 years",
            "degree_required": "Not specified",
            "visa_sponsorship": "Not specified",
            "notice_period": "Not specified",
            "duration": "Not specified",
            "rate": "Not specified"
        },
        "skills": {
            "core": [
                "ServiceNow",
                "HR module",
                "Business Analysis",
                "Requirements Gathering",
                "User Stories"
            ],
            "primary": [
                "Communication Skills",
                "ServiceNow Integrations",
                "Analytical Skills",
                "Problem-Solving Skills"
            ],
            "secondary": [
                "CSA",
                "CIS - HR",
                "Agile Methodologies",
                "HR Processes",
                "ITIL v3"
            ],
            "all": [
                "ServiceNow",
                "HR module",
                "Business Analysis",
                "Requirements Gathering",
                "User Stories",
                "Communication Skills",
                "ServiceNow Integrations",
                "Analytical Skills",
                "Problem-Solving Skills",
                "CSA",
                "CIS - HR",
                "Agile Methodologies",
                "HR Processes",
                "ITIL v3"
            ],
            "with_experience": [
                "ServiceNow (8 years)",
                "HR module"
            ]
        },
        "job_type": [
            "remote"
        ],
        "contact_person": "Mani",
        "email": "mani@techkonnectllc.com",
        "jd": "From: Mani, Techkonnect mani@techkonnectllc.com Reply to: mani@techkonnectllc.com Position: ServiceNow Business Analyst (HR Module)Location: US ( remote / NJ/NY) For the respective role we are looking for a skilled ServiceNow Business Analyst specializing in the HR module. This role will bridge the gap between requesters and developers, ensuring accurate capture and translation of HR-related requirements into actionable stories. A strong understanding of the ServiceNow platform and HR processes is essential.Key Responsibilities:Gather, analyze, and document HR-related requirements within ServiceNow.Translate business needs into clear user stories and acceptance criteria.Conduct workshops and interviews to identify improvement opportunities.Advise stakeholders on best practices for ServiceNow HR processes.Facilitate communication between requesters and technical teams.Support testing efforts to ensure solutions meet business requirements.Monitor changes in HR processes and provide training as needed.Qualifications:8 years of experience as a Business Analyst in the ServiceNow platform specifically HR.Strong knowledge of the ServiceNow HR module.Proven ability to gather requirements and create user stories.Excellent communication skills for articulating technical concepts to non-technical stakeholders.Familiarity with ServiceNow integrations and Integrations like Human Resource Information Systems, Payroll, LMS etc.Strong analytical and problem-solving skills.Preferred Skills:CSA and CIS - HR is a plus.Experience with agile methodologies.Knowledge of HR processes and practices.ITIL v3 C",
        "source": "Email",
        "date_posted": "2024-10-29 14:40:42-05:00",
        "unique_id": "192da46fc0300123",
        "emp_type": [
            "third party"
        ],
        "tag": "Business Analyst"
    }
]