[
    {
        "company": "Virginia Department of Transportation (VDOT)",
        "job_title": "Business Analyst",
        "location": "Richmond, VA, USA",
        "full_location": {
            "city": "Richmond",
            "state": "VA",
            "country": "USA"
        },
        "job_details": {
            "employment_type": [
                "contract",
                "third party"
            ],
            "experience_required": "12+ years",
            "degree_required": "Not specified",
            "visa_sponsorship": "Not specified",
            "notice_period": "Not specified",
            "duration": "7 Months",
            "rate": "Not specified"
        },
        "skills": {
            "core": [
                "Agile Business Analyst",
                "Scrum",
                "ArcGIS",
                "Snowflake",
                "Informatica"
            ],
            "primary": [
                "SafeFME",
                "PM",
                "UAT",
                "SQL",
                "Data Analysis"
            ],
            "secondary": [
                "Azure DevOps",
                "Jira",
                "TestComplete",
                "Cucumber",
                "Selenium",
                "Microsoft Office"
            ],
            "all": [
                "Agile Business Analyst",
                "Scrum",
                "ArcGIS",
                "Snowflake",
                "Informatica",
                "SafeFME",
                "PM",
                "UAT",
                "SQL",
                "Data Analysis",
                "Azure DevOps",
                "Jira",
                "TestComplete",
                "Cucumber",
                "Selenium",
                "Microsoft Office"
            ]
        },
        "job_type": [
            "hybrid"
        ],
        "contact_person": "Abdul Mannan",
        "email": "info@techbrandstaffing.com",
        "jd": "Must have a 12+ years of BA with Agile and ARCGIS.Hybrid/Local Govt Agile BA with Scrum, Snowflake, SafeFME, ArcGIS, Informatica, PM and UAT ExperienceLocation: Richmond, VA (VDOT)Duration: 7 Months SkillRequiredyears reqExperience delivering business and systems analysis artifactsRequired8Experience as an Agile Business Analyst with a strong understanding of Scrum concepts and methodology.Required5Proven experience in organizing and maintaining Product and Sprint backlogs.Required5Proficiency in translating client and product strategy requirements into application requirements and user stories.Required8Defining acceptance criteria and managing the acceptance process with development teams.Required5Exceptional written and oral communication skills, with a proven ability to work well with a diverse set of peers and customersRequired8 Description:Hybrid Schedule \u2013 Candidate should be able to work on-site 3 days a week.The Virginia Department of Transportation (VDOT) Business Integrated Solutions Division (BISD) is seeking a highly experienced Business Analyst to join our Business Analytics and Testing Support Team. This role requires strong stakeholder management skills and the ability to take initiative with minimal supervision. The Business Analyst will serve as the voice of the customer, ensuring that business needs are clearly understood, articulated, and documented. The Business Analyst will work in both Agile (Sprint) and traditional Waterfall methodologies for the Software Development Lifecycle (SDLC), contributing to ensuring that customers\u2019 requirements are met through the development and delivery of requested enhancements.Key Responsibilities:Act as the voice of the customer, working with project team members and business stakeholders to fully understand business processes, pain points, and customer needs.Develop expertise in customers\u2019 business applications and organizational data management concepts, advocating for the customer throughout the SDLC.Conduct Root Cause Analysis to identify system gaps and deficiencies that impact the customer and require a business, technical, or blended approach for resolution.Diagram current processes and propose modifications using process flows, context diagrams, and data flow diagrams to ensure clarity for both technical and non-technical stakeholders.Discover and document customer-centric requirements, user stories, and acceptance criteria with a focus on improving business and technical processes.Decompose requirements into Epics and Features; create clear and concise user stories that are aligned with customer goals and are easy to implement by technical teams.Map user stories to technical designs for system modifications, ensuring that solutions meet customer expectations.Identify and group related user stories into Themes; document dependencies, ensuring alignment with customer priorities and business processes.Assist the Product Owner in maintaining the product backlog with a customer-first mindset.Perform Quality Analyst functions, defining test objectives, test plans, and test cases, while executing tests (including regression testing) to ensure customer satisfaction.Coordinate and facilitate User Acceptance Testing (UAT) with business stakeholders, ensuring that the customer is at the center of the testing process and keeping Project Managers/Scrum Masters informed of progress.Qualifications:Minimum of 10 years of experience delivering business and data analysis artifacts with a customer-focused approach.5+ years of experience as an Agile Business Analyst with a strong understanding of Scrum concepts and methodology, including representing the customer during sprint reviews.Experience organizing and maintaining Product and Sprint backlogs, ensuring prioritization based on customer needs.Proficiency in translating client and product strategy requirements into Epics, Features, and User Stories, ensuring alignment with customer goals.Strong data analysis background, organizational data management concepts, and SQL/database experience, particularly in supporting customer-driven solutions.Proficient in defining acceptance criteria and managing the acceptance process with the customer in mind.Experience with software development applications such as Azure DevOps and/or Jira.Expertise with Microsoft Office products (Word, Excel, Access, Outlook, Visio, PowerPoint, Project Server).Experience with reporting systems, operational data stores, data warehouses, data lakes, and data marts.Exceptional written and oral communication skills with a proven ability to advocate for customers while working with a diverse set of peers and stakeholders.Preferred:Certified Business Analysis Professional (CBAP)PMI \u2013 Professional in Business Analysis (PMI-PBA)PMI \u2013 Agile Certified Practitioner (PMI-ACP)Experience using Azure DevOps or Jira for agile software development and work item tracking.Experience with automated testing tools such as TestComplete, Cucumber, or Selenium.",
        "source": "Email",
        "date_posted": "2024-10-22 08:54:09-05:00",
        "unique_id": "192b4a74b7b6c06d",
        "emp_type": [
            "contract",
            "third party"
        ],
        "tag": "Business Analyst"
    }
]