[
    {
        "company": "Insoursys",
        "job_title": "Java FullStack Lead (React)",
        "location": "New York, NY, USA",
        "full_location": {
            "city": "New York",
            "state": "NY",
            "country": "USA"
        },
        "job_details": {
            "employment_type": [
                "full-time",
                "third party"
            ],
            "experience_required": "12+ years",
            "degree_required": "Not specified",
            "visa_sponsorship": "Not specified",
            "notice_period": "Not specified",
            "duration": "Not specified",
            "rate": "Not specified"
        },
        "skills": {
            "core": [
                "Java",
                "J2EE",
                "Spring Core",
                "Spring MVC",
                "Spring Cloud",
                "Spring Boot",
                "Hibernate",
                "Restful services",
                "Spring JDBC",
                "Microservices",
                "REST API",
                "JPA",
                "HTML",
                "CSS",
                "JavaScript",
                "React.js",
                "Webpack",
                "Redux",
                "Flux",
                "Oracle PL/SQL",
                "SQL"
            ],
            "primary": [
                "Mocha",
                "Jest",
                "Oracle Web logic",
                "Tomcat",
                "AWS",
                "Google",
                "Git",
                "Jenkins",
                "CI/CD"
            ],
            "secondary": [
                "Test-Driven Development",
                "Automation",
                "Unit Testing",
                "Analytical Skills",
                "System observability",
                "Monitoring",
                "Alerting",
                "Agile",
                "Financial industry experience"
            ],
            "all": [
                "Java",
                "J2EE",
                "Spring Core",
                "Spring MVC",
                "Spring Cloud",
                "Spring Boot",
                "Hibernate",
                "Restful services",
                "Spring JDBC",
                "Microservices",
                "REST API",
                "JPA",
                "HTML",
                "CSS",
                "JavaScript",
                "React.js",
                "Webpack",
                "Redux",
                "Flux",
                "Mocha",
                "Jest",
                "Oracle PL/SQL",
                "SQL",
                "Oracle Web logic",
                "Tomcat",
                "AWS",
                "Google",
                "Git",
                "Jenkins",
                "CI/CD",
                "Test-Driven Development",
                "Automation",
                "Unit Testing",
                "Analytical Skills",
                "System observability",
                "Monitoring",
                "Alerting",
                "Agile",
                "Financial industry experience"
            ]
        },
        "job_type": [
            "hybrid"
        ],
        "contact_person": "Hari Krishna",
        "email": "hari_krishna@insoursysinc.com",
        "jd": "From: Harikrishna, Insoursys hari_krishna@insoursysinc.com Reply to: hari_krishna@insoursysinc.com Java FullStack Lead (React)55 Water Street, NY / Princeton, NJ (Hybrid day 1)Nedd Locals to NJ or NY with at least 12+ years of experienceCore Skills:9+ years in Java J2EE building web applications, spring technologies/frameworks (Spring Core, Spring MVC, Spring Cloud, Spring Boot) and tools.Java, JEE & spring technologies/frameworks (Spring Core, Spring MVC, Spring Cloud, Spring Boot) and tools.5+ years of experience with related frameworks and technologies (Hibernate, Restful services Spring JDBC, MVC etc.)Strong experience with Microservices, Spring Boot / Spring framework, Rest API, JPA.8+ years of experience in web development using HTML, CSS and JavaScript including ES2016+ Minimum 2 years of experience of REACT tools including React.js, Webpack, Redux and Flux Experience with user interface design Knowledge of unit testing frameworks like Mocha and Jest Experience with browser based debugging and excellent troubleshooting skills Knowledge on system architecture (N-Tire, Microservices, Cloud-native).Strong knowledge of system design principles for scalable, high-performance, and extensible solutions for enterprise grade distributed and services systems. Significant knowledge of Oracle PL/SQL and SQL.Experience with Oracle Web logic, Tomcat to include installation, configuration, troubleshooting.Working experience of Spring Boot application configuration, deployment and troubleshooting on server platforms Oracle Web logic/Tomcat/Cloud.Experience with API management and Cloud-based platforms and services (AWS, Google).Working knowledge of Dev-Ops: Git, Jenkins, CI/CD pipelines, etc.Understanding of Test-Driven Development practices as well as Automation and Unit Testing.Strong Analytical Skills.Working knowledge on system observability/monitoring and alerting.Experience Architecting and developing large scale Enterprise applications.Proficient with software development lifecycle (SDLC) methodologies like Agile, Test- driven development. Any experience in building applications for financial industry is a plusRegardsHari KrishnaInsoursys | Ph: 9724400090 | hari_krishna@insoursysinc.com",
        "source": "Email",
        "date_posted": "2024-10-22 08:56:02-05:00",
        "unique_id": "192b4a9d08fafe11",
        "emp_type": [
            "full-time",
            "third party"
        ],
        "tag": "Java developer"
    }
]