[
    {
        "company": "Intellectt Inc.",
        "job_title": "Business Analyst",
        "location": "New York, NY, USA",
        "full_location": {
            "city": "New York",
            "state": "NY",
            "country": "USA"
        },
        "job_details": {
            "employment_type": [
                "contract",
                "third party"
            ],
            "job_code": "",
            "experience_required": "5+ years",
            "degree_required": "Not specified",
            "visa_sponsorship": "Not specified",
            "notice_period": "Not specified",
            "duration": "6+ Month Contract",
            "rate": "$50/HR"
        },
        "skills": {
            "core": [
                "Requirement Gathering",
                "Capital market",
                "Financial Domain"
            ],
            "primary": [
                "Engaging in customer discussion",
                "Process/User Journey design thinking",
                "Managing User stories",
                "Functional product backlog management"
            ],
            "secondary": [
                "Compliance",
                "Reporting",
                "Knowledge transfer"
            ],
            "all": [
                "Requirement Gathering",
                "Capital market",
                "Financial Domain",
                "Engaging in customer discussion",
                "Process/User Journey design thinking",
                "Managing User stories",
                "Functional product backlog management",
                "Compliance",
                "Reporting",
                "Knowledge transfer"
            ]
        },
        "job_type": [
            "onsite"
        ],
        "contact_person": "Prashant Raj",
        "email": "prashant@intellectt.com",
        "jd": "Hi,My name is Prashant Raj and I am a Staffing Specialist at Intellectt Inc. I am reaching out to you on an exciting job opportunity with one of our clients.Business Analyst (Capital market / Financial Domain experience)6+ Month Contract RoleOnsite RoleNew York, NY RATE IS $50/HR ON C2C Please share only profiles that have not been submitted to HCL in the past 4 monthsSkill SetOverall 10+ Experience5+ years of experience in Requirement Gathering and Elaboration session with the Financial CustomersHands on Experience in Engaging in customer discussion to understand the business requirementsExperience in Capital market domain- especially trading, listing of securities, regulatory aspects of capital market - like compliance and reporting can be added to the listActivitiesParticipate in requirement gathering and Process/User Journey design thinking workshops.Forecast and suggest the Future Roadmap and Functional scalability for RequirementManage functional product backlog and supports in maintaining functional designs.Creating, Managing User stories and validating development & test scenarios.Organize Show and tell sessions to business,Knowledge transfer to development and testing team.",
        "source": "Email",
        "date_posted": "2024-10-22 09:13:53-05:00",
        "unique_id": "192b4b8d35b080f2",
        "emp_type": [
            "contract",
            "third party"
        ],
        "tag": "Business Analyst"
    }
]