[
    {
        "company": "Source Infotech Inc",
        "job_title": "Senior Program Manager",
        "location": "New York, NY, USA",
        "full_location": {
            "city": "New York",
            "state": "NY",
            "country": "USA"
        },
        "job_details": {
            "employment_type": [
                "contract",
                "third party"
            ],
            "experience_required": "10+ years",
            "degree_required": "Bachelor\u2019s degree in a technical field or equivalent professional experience",
            "visa_sponsorship": "No visa sponsorship",
            "notice_period": "Not specified",
            "duration": "Not specified",
            "rate": "Not specified"
        },
        "skills": {
            "core": [
                "Program Management",
                "eCommerce",
                "Shopping Cart enhancement",
                "Agile Methodologies",
                "SCRUM"
            ],
            "primary": [
                "Problem-solving",
                "Software Development Life Cycle",
                "Communication",
                "Analytical Skills",
                "Team Leadership"
            ],
            "secondary": [
                "Mentoring",
                "Coaching",
                "Collaboration",
                "Team Building",
                "Stakeholder Management"
            ],
            "all": [
                "Program Management",
                "eCommerce",
                "Shopping Cart enhancement",
                "Agile Methodologies",
                "SCRUM",
                "Problem-solving",
                "Software Development Life Cycle",
                "Communication",
                "Analytical Skills",
                "Team Leadership",
                "Mentoring",
                "Coaching",
                "Collaboration",
                "Team Building",
                "Stakeholder Management"
            ]
        },
        "job_type": [
            "hybrid"
        ],
        "contact_person": "Bhavya Chaturvedi",
        "email": "bhavya.c@sourceinfotech.com",
        "jd": "From: Bhavya, Source infotec inc bhavya.c@sourceinfotech.com Reply to: bhavya.c@sourceinfotech.com Senior Program ManagerExperience leading Enterprise Retail/e-commerce \u2013 Online shopping experience projects. Candidates need to be coming out of Large Retail Enterprises and have experience with Online Shopping Cart experience (Think Amazon) and improving the customers experience including Loyalty rewards and Fast Check Out. **Candidates must have Long Projects/Good Tenure, Excellent communication skills and a State issued ID (Not Bills) showing they are Local. **** CANDIDATES MUST HAVE RETAIL/ECOMMERCE EXPERIENCE WITH SHOPPING CARTS. Required Location: Hybrid/Midtown New York City Once a Quarter. Candidates can be within a 2 hour commute.Contract status: C-C preferred Candidate Visa\u2019s Accepted: No Opt CPT H1BExp 10+Candidates must be LOCAL to the NEW YORK or NEW JERSEY area and COMMUTE into the office Once a Quarter. NO RELOCATION CONSIDERED. *** Please send candidates even if they are over the target rate. The Client is flexible.*** PLEASE Only send me candidates in the NY/NJ area Open to hybrid Once a Quarter.*** Candidate Must Have\u2019s on a resume and for submittal:1. How many years working with: Program Manager2. How many years working with: eCommerce/ Retail3. How many years working with: Shopping Cart enhancement4. How many years working with:5. How many years working with:Job Description:Key Responsibilities:Promote empowerment of the team, ensure that each team member is fully engaged and making a meaningful contribution, and encourage a sustainable pace with high-levels of quality for the teamManage risks and issues; correct deviations from plans; and perform delivery planning for assigned initiativesSupport the Product Owner in managing customer expectations for project deliverables, managing stakeholder communications, and helping to implement an effective system of governanceEstablish cadence and facilitate team ceremoniesAssist in team development while holding teams accountable for their commitments and removing roadblocks to their workLeveraging organizational resources to improve capacity for initiativesMentoring and developing team membersBe a voice of reason and authority, while enabling the team to self-organize and innovateActively participates in product planning sessions, risk management processes and change management/communicationTrack and report on team and project KPIs - Velocity, Burndown, Cycle time, Lead time, capacity, SPI, EV, rate of change requests, errors etc.Partners with shared service teams such as EDS, EIDEnsure that all representatives have an environment conducive to openly and honestly sharing information for Team successCommunicate clearly, professionally, and regularly with clients, partners and vendorsNeeded Skills:Problem-solving approach with the ability to focus on details while maintaining the \u201cbig picture\u201d viewSolid understanding of software development life cycle models as well as expert knowledge of both Agile and traditional project management principlesPrior experience with SCRUM/Agile methodologies with enterprise-level application development initiativesExperience managing and delivering large, complex initiatives in a high-tech development environment with multi-function teamsExperience overseeing multi-function project teams with at least 10-15 team membersAbility to lead software development initiatives and ensure objectives, goals, and commitments are metStrong analytical, planning, and organizational skills with an ability to manage competing demandsEffective communication skillsSufficient level of technical background to provide highly-credible leadership to development teamsEnergetic, enthusiastic and a proven ability to work and lead in a team based environmentBe able to accurately and objectively evaluate complex project risks and issuesEffective interpersonal skills including mentoring, coaching, collaborating, and team buildingQualifications:Experience with Agile MethodologiesCSM, SSM or PSM certification requiredSASM, CSP, SPS or other advanced certification preferredBachelor\u2019s degree in a technical field or equivalent professional experiencePrior experience in software development as an analyst, tester, developer, or project managerKEY WORDS: ECOMMERCE, RETAIL, SHOPPING CART, CUSTOMER EXPERIENCE, ONLINE SALES \u2013 I NEED CANDIDATES WHO HAVE BEEN MANAGING PROJECTS AROUND ONLINE SHOPPONG AND CUSTOMER EXPERIENCE ENHANCEMENT.THANKS & REGARDS Bhavya Chaturvedi Source Infotech IncP.O Box 577, EDISON, NJ 08818-0577EMAIL: bhavya.c@sourceinfotech.comPhone: 6097335170 | | Hangout:bhavyachaturvedi389",
        "source": "Email",
        "date_posted": "2024-10-22 08:23:01-05:00",
        "unique_id": "192b48579546ed39",
        "emp_type": [
            "contract",
            "third party"
        ],
        "tag": "Project Manager"
    }
]