[
    {
        "company": "IBM/Paypal",
        "job_title": "Informatica MDM and SAP MDG Business System Analyst",
        "location": "USA",
        "full_location": {
            "city": "",
            "state": "",
            "country": "USA"
        },
        "job_details": {
            "employment_type": [
                "third party"
            ],
            "job_code": "",
            "experience_required": "At least 8 years past professional Business Analyst or consulting experience",
            "degree_required": "Not specified",
            "visa_sponsorship": "Any visa",
            "notice_period": "Not specified",
            "duration": "Not specified",
            "rate": "Not specified"
        },
        "skills": {
            "core": [
                "Informatica MDM",
                "SAP MDG",
                "Business Analyst",
                "Data Governance",
                "Master Data Management"
            ],
            "primary": [
                "Customer Service Skills",
                "Written and Verbal Communication Skills",
                "System and Software Development",
                "Technical Application Architecture Design",
                "Testing Methodologies"
            ],
            "secondary": [
                "Multi-tasking",
                "MS PowerPoint",
                "MS Excel",
                "Project Management",
                "Data Quality"
            ],
            "all": [
                "Informatica MDM",
                "SAP MDG",
                "Business Analyst",
                "Data Governance",
                "Master Data Management",
                "Customer Service Skills",
                "Written and Verbal Communication Skills",
                "System and Software Development",
                "Technical Application Architecture Design",
                "Testing Methodologies",
                "Multi-tasking",
                "MS PowerPoint",
                "MS Excel",
                "Project Management",
                "Data Quality"
            ],
            "with_experience": [
                "Informatica MDM",
                "SAP MDG"
            ]
        },
        "job_type": [
            "remote"
        ],
        "contact_person": "SAPNA",
        "email": "sapna@itecsus.com",
        "jd": "Urgent need. IBM/Paypal. Any visa. Phone + Video interview. . 100% Remote. \n\nPosition: Informatica MDM and SAP MDG Business System Analyst \nLocation: Anywhere in US. 100% Remote \n\nJob Description\nThe MDM Business System Analyst (BSA) position requires a strong understanding of Master Data Management concepts, industry data standards, and data governance that support Finance operations. The BSA collaborates with Product managers, Operational Managers, and external vendors to ensure consistent data management and accurate information flow to support core product functions, such as Payments, as well as corporate functions such as Accounting, FP&A, Treasury, and Regulatory reporting. \n\nBasic Qualifications:\nAt least 8 years past professional Business Analyst or consulting experience\n\nPreferred Technical Capabilities: (experience that will help this person be successful)\nExperience with Informatica MDM and SAP MDG.\nStrong customer service skills, ability to elicit and clearly document complex business requirements and reconcile differences between multiple business/technical stakeholders\nExcellent written and verbal communication skills\nStrong understanding and experience of system and software development, technical application architecture design and testing methodologies\nAbility to multi-task and work quickly, managing their own progress on multiple projects/work streams at once\nExperience with master data and data quality in relation to product /data considerations is a big plus\nExperience in managing small to medium projects is a big plus.\nAdapt learning new technologies and an end user perspective\nProficient with MS PowerPoint and MS Excel\nProject management experience organizing tasks and tracking deliverables.",
        "source": "Email",
        "date_posted": "2024-10-01 11:24:37-05:00",
        "unique_id": "19248eabff46c3da",
        "emp_type": [
            "third party"
        ],
        "tag": "Business Analyst"
    }
]