[
    {
        "company": "Arthur Grand Technologies",
        "job_title": "Java AWS Developer",
        "location": "Plano, TX, USA",
        "full_location": {
            "city": "Plano",
            "state": "TX",
            "country": "USA"
        },
        "job_details": {
            "employment_type": [
                "contract",
                "third party"
            ],
            "experience_required": "Not specified",
            "degree_required": "Not specified",
            "visa_sponsorship": "Not specified",
            "notice_period": "Not specified",
            "duration": "6+ Months",
            "rate": "Not specified"
        },
        "skills": {
            "core": [
                "Java",
                "Spring",
                "Microservices",
                "AWS"
            ],
            "primary": [
                "J2EE",
                "Webservices",
                "PL/SQL",
                "Agile",
                "GIT",
                "Jenkins",
                "IntelliJ",
                "Maven",
                "Tomcat"
            ],
            "secondary": [
                "Object Oriented Analysis",
                "Object Oriented Design",
                "Java Design Patterns",
                "JUnit",
                "Relational Databases",
                "SQL",
                "SOAP",
                "REST"
            ],
            "all": [
                "Java",
                "Spring",
                "Microservices",
                "AWS",
                "J2EE",
                "Webservices",
                "PL/SQL",
                "Agile",
                "GIT",
                "Jenkins",
                "IntelliJ",
                "Maven",
                "Tomcat",
                "Object Oriented Analysis",
                "Object Oriented Design",
                "Java Design Patterns",
                "JUnit",
                "Relational Databases",
                "SQL",
                "SOAP",
                "REST"
            ]
        },
        "job_type": [
            "onsite"
        ],
        "contact_person": "Afrah Faiza",
        "email": "teamafrah@arthurgrand.com",
        "jd": "From: Afrah, Arthur Grand Techologies teamafrah@arthurgrand.com Reply to: teamafrah@arthurgrand.com Arthur Grand Technologies is currently seeking a highly motivated and Skilled Java AWS Developer for one of our clients Role: Java AWS DeveloperLocation: Plano, TX & Wilmington, DE & New York City, NY,Columbus,OH ( Onsite)Duration: 6+ Months Mandate skills: Java, Spring boot, Microservices, AWS Job Description:Experience in Agile software development methodology and practices with full development lifecycle from inception through implementation.Required: Java, J2EE, Spring, Microservice, Webservices, PL/SQLWorking knowledge of Object Oriented Analysis/Object Oriented Design methodologies and life cycles.Demonstrated experience with SCM tools such as GIT, JenkinsExperience with application development on Java, J2EE, Spring, and MVC, Java Design Patterns and JUnit.Knowledge of Relational Databases like Oracle/SQL Server, SQLKnowledge of Web service technologies including SOAP/REST.Strong working knowledge of IntelliJ, Maven and Tomcat.Ability to work collaboratively in teams and develop meaningful relationships to achieve common goalsKnowledge of architecture, design and business processesProficiency in modern programming languagesExperience in design and build of complex application systems using the new banking architecture including Java/J2EE/Spring technologies. Proficiency in one or more general purpose programming languages including Java/J2EE/JSP based Web applications/Middleware and Batch systems.Experience in design, analysis, development, coding, unit testing, debug and documentation for Java/J2EE systems including Web applications, business services, batch applications, large/complex projects and utilizing Web Services and Java RMI technologies to improve interface/API and significantly enhance integration capability between front-end and back-end systemsA fundamental understanding of software skills and the different components of SDLC such as business analysis, development, and maintenance and software improvement is essentialThanks,Afrah FaizaArthur Grand Technologies IncArthur Grand Technologies is an Equal Opportunity Employer (including disability/vets)",
        "source": "Email",
        "date_posted": "2024-10-01 11:35:27-05:00",
        "unique_id": "19248f2e1a6429d3",
        "emp_type": [
            "contract",
            "third party"
        ],
        "tag": "Java developer"
    }
]