[
    {
        "company": "Procorp Systems",
        "job_title": "Senior Oracle DBA with Golden Gate",
        "location": "Columbus, OH, USA",
        "full_location": {
            "city": "Columbus",
            "state": "OH",
            "country": "USA"
        },
        "job_details": {
            "employment_type": [
                "contract"
            ],
            "job_code": "",
            "experience_required": "10+ years",
            "degree_required": "Not specified",
            "visa_sponsorship": "Not specified",
            "notice_period": "Not specified",
            "duration": "Long term",
            "rate": "$45 to 50/hr"
        },
        "skills": {
            "core": [
                "Oracle Database Administration",
                "Golden Gate",
                "Real Application Testing (RAT)",
                "Oracle versions 11gR1/2, 12c, 19C",
                "Linux"
            ],
            "primary": [
                "Zero Data Loss Recovery Appliance",
                "Oracle Database Performance Diagnostic",
                "Oracle Real Application Clusters (RAC)",
                "CDB/PDB",
                "Automatic Storage Management (ASM)",
                "Active Data Guard",
                "Oracle Enterprise Manager (OEM)",
                "Backup and Recovery using Oracle Recovery Manager (RMAN)"
            ],
            "secondary": [
                "Python",
                "Javascript",
                ".NET",
                "Perl",
                "PL/SQL",
                "UNIX Shell Scripting",
                "Microservices",
                "Agile development methodology"
            ],
            "all": [
                "Oracle Database Administration",
                "Golden Gate",
                "Real Application Testing (RAT)",
                "Oracle versions 11gR1/2, 12c, 19C",
                "Linux",
                "Zero Data Loss Recovery Appliance",
                "Oracle Database Performance Diagnostic",
                "Oracle Real Application Clusters (RAC)",
                "CDB/PDB",
                "Automatic Storage Management (ASM)",
                "Active Data Guard",
                "Oracle Enterprise Manager (OEM)",
                "Backup and Recovery using Oracle Recovery Manager (RMAN)",
                "Python",
                "Javascript",
                ".NET",
                "Perl",
                "PL/SQL",
                "UNIX Shell Scripting",
                "Microservices",
                "Agile development methodology"
            ]
        },
        "job_type": [
            "onsite",
            "remote"
        ],
        "contact_person": "Frank",
        "email": "frank@procorpsystems.com",
        "jd": "HelloHope you\u2019re doing well Title: Senior Oracle DBA with Golden Gate Location: Columbus/Dallas/Jersey CityDuration: Long term Rate: $45 to 50/hr JD:A candidate with 10+ years of relevant experience in Oracle Database Administration. Knowledge of Goldengate and Real Application Testing (RAT) highly preferred.Technical Skills: Strong experience administering various multi-Terabyte, 24x7 uptime Oracle databases as a Systems/Infrastructure Database Administrator required Solid experience working with Oracle versions 11gR1/2, 12c, 19C in a Linux environmentExperience with Zero Data Loss Recovery Appliance is a plusStrong, proven Oracle Database Performance Diagnostic skills (at both the SQL and system levels) Experience with features such as Oracle Real Application Clusters (RAC), CDB/PDB, Automatic Storage Management (ASM), Active Data Guard, Oracle Enterprise Manager (OEM), Golden Gate replication an Real Application Testing (RAT).Experience with Backup and Recovery using Oracle Recovery Manager (RMAN) Proficiency in installing and configuring complex database management system environments, creating and maintaining databases as well as backup and recovery Process Skills: Demonstrated ability to implement automated process to improve database system reliabilitySkill at troubleshooting complex problemsBackground in IT infrastructure, including systems or network administrationProficient development skills in a dynamic programming language such as Python, Javascript, .NET, Perl, PL/SQL, UNIX Shell Scripting. Also experience with Microservices is desirableUnderstanding of the software development lifecycle, including Agile development methodologyAbility to collaborate with high-performing teams and individuals throughout the firm to accomplish common goalsDynamic team player with excellent communication, interpersonal and problem-solving skills Understand the client requirements, analyze and translate them into a feasible solution Demonstrate and articulate performance enhancement solutions to the clients and prospects Execute the Proof of Concept from initial installation through to client acceptance Ability to work in APAC, EMEA and NA hours",
        "source": "Email",
        "date_posted": "2024-10-01 09:05:11-05:00",
        "unique_id": "19248679e1d03faa",
        "emp_type": [
            "contract"
        ],
        "tag": "Oracle DBA"
    }
]