[
    {
        "company": "KK Associates LLC",
        "job_title": "GCP admin",
        "location": "Tennessee, TN, USA",
        "full_location": {
            "city": "Tennessee",
            "state": "TN",
            "country": "USA"
        },
        "job_details": {
            "employment_type": [
                "contract",
                "third party"
            ],
            "job_code": "",
            "experience_required": "Not specified",
            "degree_required": "Not specified",
            "visa_sponsorship": "Not specified",
            "notice_period": "Not specified",
            "duration": "Not specified",
            "rate": "Not specified"
        },
        "skills": {
            "core": [
                "GCP",
                "Backup",
                "Archive",
                "Recovery planning",
                "Security",
                "WAF rules",
                "Load balancing"
            ],
            "primary": [
                "GCP Certified Associate",
                "Multi-cloud environments"
            ],
            "secondary": [],
            "all": [
                "GCP",
                "Backup",
                "Archive",
                "Recovery planning",
                "Security",
                "WAF rules",
                "Load balancing",
                "GCP Certified Associate",
                "Multi-cloud environments"
            ]
        },
        "job_type": [
            "onsite"
        ],
        "contact_person": "Dinesh",
        "email": "dinesh@kksoftwareassociates.com",
        "jd": "Hi ..This is Dinesh from kkassociates, Below Position is Immediate Position from the Client Kindly share Suitable resumes to dinesh@kksoftwareassociates.com.GCP adminlocation: Tennessee, TNHire Type: ContractJD;Manage and support 24x7 GCP environments Need to have good knowledge in Backup, Archive and Recovery planning and execution.Need to have good knowledge in Security, WAF rules and load balancing.Hands on experience with GCP and strong understanding of GCP capabilities and limitationsGCP Certified AssociateExperience on multi-cloud environments will be preferred Thanks and Regards Dinesh || Technical Recruiter KK Associates LLC. Direct:61437901838751 Collin McKinney Pkwy, # 1302, McKinney, TX 75070 555 Metro Place North, Suite# 100, Dublin, OH- 43017Email: dinesh@kksoftwareassociates.com Web: www.kksoftwareassociates.com",
        "source": "Email",
        "date_posted": "2024-09-30 12:11:17-05:00",
        "unique_id": "19243eb6d8c19202",
        "emp_type": [
            "contract",
            "third party"
        ],
        "tag": "GCP Data Engineer"
    }
]