[
    {
        "company": "Urbench",
        "job_title": "Tech PM with banking experience",
        "location": "Phoenix, AZ, USA",
        "full_location": {
            "city": "Phoenix",
            "state": "AZ",
            "country": "USA"
        },
        "job_details": {
            "employment_type": [
                "onsite",
                "third party"
            ],
            "experience_required": "8 Years",
            "degree_required": "Not specified",
            "visa_sponsorship": "Not specified",
            "notice_period": "Not specified",
            "duration": "Not specified",
            "rate": "$57/hr MAX PP Number Required",
            "job_code": "",
            "contact_person": "Sameer Khan",
            "email": "sameer@urbench.com"
        },
        "skills": {
            "core": [
                "project management",
                "system architecture",
                "banking experience",
                "agile methodologies"
            ],
            "primary": [
                "scrum ceremonies",
                "project management tools",
                "Rally",
                "Jira"
            ],
            "secondary": [],
            "all": [
                "project management",
                "system architecture",
                "banking experience",
                "agile methodologies",
                "scrum ceremonies",
                "project management tools",
                "Rally",
                "Jira"
            ]
        },
        "job_type": [
            "onsite"
        ],
        "jd": "From: Sameer Khan, Urbench sameer@urbench.com Reply to: sameer@urbench.com Hello, Role: Tech PM with banking experience**Onsite at Phoenix, AZ**Visa: USC/GC/H4-EADRate: $57/hr MAX PP Number RequiredEXP: 8 Years Required skills:Solid project management experience (5-6 years) handling wide range of programs working with multiple vendors and stakeholders across verticalsTechnical background and savvy of understanding and elucidating system architecture flowsBanking or Financial domain experience is a mustExperience in scrum ceremonies, working with agile champions and managing end to end programKnowledge experience in project management tools like Rally, Jira",
        "source": "Email",
        "date_posted": "2024-09-30 10:48:23-05:00",
        "unique_id": "19243cc80817c547",
        "emp_type": [
            "onsite",
            "third party"
        ],
        "tag": "Project Manager"
    }
]