[
    {
        "company": "State Government: CO OIT",
        "job_title": "Technical Project Manager",
        "location": "Denver, CO, USA",
        "full_location": {
            "city": "Denver",
            "state": "CO",
            "country": "USA"
        },
        "job_details": {
            "employment_type": [
                "full-time",
                "third party"
            ],
            "experience_required": "Not specified",
            "degree_required": "Not specified",
            "visa_sponsorship": "Visa sponsorship available",
            "notice_period": "Not specified",
            "duration": "10/14/24 - 6/30/25 (possible extension)",
            "rate": "Not specified"
        },
        "skills": {
            "core": [
                "customer relationship management",
                "project management",
                "infrastructure",
                "network security",
                "network services",
                "voice services"
            ],
            "primary": [
                "risk management",
                "quality management",
                "change management",
                "communication"
            ],
            "secondary": [
                "leadership",
                "collaboration",
                "supervision",
                "training",
                "guidance",
                "support"
            ],
            "all": [
                "customer relationship management",
                "project management",
                "infrastructure",
                "network security",
                "network services",
                "voice services",
                "risk management",
                "quality management",
                "change management",
                "communication",
                "leadership",
                "collaboration",
                "supervision",
                "training",
                "guidance",
                "support"
            ]
        },
        "job_type": [
            "remote"
        ],
        "contact_person": "Pramod Nayak",
        "email": "pramod@tekinspirations.com",
        "jd": "From: Pramod Nayak, tekinspirations pramod@tekinspirations.com Reply to: pramod@tekinspirations.com Role- Technical Project Manager Location- Remote- Denver, Colorado- ( must be local )Visa type : Any type as long as its in date and always renewableclient : State Government : CO OITStart/End : 10/14/24 - 6/30/25 (possible extension) Need 3-4 page resume and Linkedin IDThis Position is fully remote, However candidate must be local.The ideal candidate will have a strong background in customer relationship management, project management, and experience with infrastructure, network security, and network and voice services.The Technical Project Manager will be responsible for planning, executing, and finalizing projects within defined timelines and allocated budgets. The Project Manager will also ensure that business and end users are consulted and their input is incorporated into the project. Key responsibilities include:Track and report on security audit findings and remediation progress to stakeholders and project teams.Responsible for assisting agency executive management, division directors, and information technology (IT) staff and leading project tasks, and resources, including State personnel and deliverables. Use appropriate project management tools, reports, templates, mentoring, training, and coaching to IT project teams. Work directly with agency staff, as well as vendors in fulfilling and carrying out the requirements of assigned IT projects. Utilize project management best practices, including risk management, quality management, change management, change control, and communication.Proactively manage changes in project scope, schedule, and cost. Manage by providing leadership, collaboration, supervision, training, guidance, and support to project team members on assigned projects. Lead the effort to ensure agency compliance with the State\u2019s project management policies and standards.Coordinates all related activities for cross-functional teamsCollaborates to develop and appropriately execute a change strategy, including stakeholder analysis, communication plans, and adoption plans.Manages relationships across OIT, customers, and vendors to develop a thorough understanding of core business functions and align projects with overall business objectives. Manages issues and proactively escalates critical issues for immediate resolution, effectively demonstrating decision-ma Thanks & Regards,Pramod Nayak || TekinspirationsEmail: pramod@tekinspirations.com Phone: 571-463-1211",
        "source": "Email",
        "date_posted": "2024-09-30 13:27:02-05:00",
        "unique_id": "192442f312f55cf5",
        "emp_type": [
            "full-time",
            "third party"
        ],
        "tag": "Project Manager"
    }
]