[
    {
        "company": "RCI",
        "job_title": "Senior Project Manager",
        "location": "Des Moines, IA, USA",
        "full_location": {
            "city": "Des Moines",
            "state": "IA",
            "country": "USA"
        },
        "job_details": {
            "employment_type": [
                "full-time",
                "third party"
            ],
            "job_code": "",
            "experience_required": "8 years",
            "degree_required": "Not specified",
            "visa_sponsorship": "Visa sponsorship available",
            "notice_period": "Not specified",
            "duration": "12+ months",
            "rate": "Not specified"
        },
        "skills": {
            "core": [
                "Direct management of system integration and/or technology projects",
                "Experience managing stakeholder expectations and priorities",
                "Experience working within a project governance structure",
                "Extensive experience with planning, managing and tracking multiple major impact projects",
                "Strong process development skills",
                "Strong process and gap analysis skills",
                "Excellent project management skills",
                "Demonstrated experience with working with business users to gather and document business requirements"
            ],
            "primary": [
                "Demonstrate ability to prioritize and manage multiple projects and project activities simultaneously",
                "Working experience with Agile Projects",
                "Demonstrated experience with managing client expectations and implementing change management initiatives"
            ],
            "secondary": [],
            "all": [
                "Direct management of system integration and/or technology projects",
                "Experience managing stakeholder expectations and priorities",
                "Experience working within a project governance structure",
                "Extensive experience with planning, managing and tracking multiple major impact projects",
                "Strong process development skills",
                "Strong process and gap analysis skills",
                "Excellent project management skills",
                "Demonstrated experience with working with business users to gather and document business requirements",
                "Demonstrate ability to prioritize and manage multiple projects and project activities simultaneously",
                "Working experience with Agile Projects",
                "Demonstrated experience with managing client expectations and implementing change management initiatives"
            ]
        },
        "job_type": [
            "hybrid"
        ],
        "contact_person": "Nitu",
        "email": "nitu@rconsultinginc.com",
        "jd": "From: nitu, RCI nitu@rconsultinginc.com Reply to: nitu@rconsultinginc.com Role: Senior Project Manager\nDuration: 12+ months\nLocation: Des Moines, IA 50309 \u2013 Hybrid\nVisa: Any Local candidates only Must be available for interview on October 4TH, 7TH, 8TH\nRequired / Desired Skills\nSkillRequired / DesiredAmountof Experience\nDirect management of system integration and/or technology projectsRequired8Years\nExperience managing stakeholder expectations and prioritiesRequired8Years\nExperience working within a project governance structure (methodology, required templates and reporting)Required8Years\nExtensive experience with planning, managing and tracking multiple major impact projects.Required8Years\nStrong process development skills, w/ the ability to learn and understand concepts to interpret, document and formalize proceduresRequired8Years\nStrong process and gap analysis skillsRequired8Years\nExcellent project management skills, w/ the ability to multitask and manage multiple tasks with changing priorities in a cross-functional environmentRequired8Years\nDemonstrated experience with working with business users to gather and document business requirementsRequired6Years\nDemonstrate ability to prioritize and manage multiple projects and project activities simultaneously while meeting established deadlinesRequired6Years\nWorking experience with Agile ProjectsRequired3Years\nDemonstrated experience with managing client expectations and implementing change management initiativesRequired3Years\nDescription:\nThe project manager will be responsible for adhering to project management governance on multiple current and future projects. Additionally, the PM will be accountable for generating project schedules, identifying/staffing needs, resourcing, completing the procurement of vendor products / implementation services, and submitting funding requests as required. The PM will manage the delivery efforts and report status of each to the Project Sponsors and the PMO Director. The PM will work with multiple business and platform areas including Information Technology and potentially including upper-level state government committees. The Project Manager will conduct project meetings and is responsible for project tracking and analysis, ensuring adherence to quality standards and project deliverables. The PM will be part of a PMO team responsible for all aspects of IT project governance, assessment, management and control. The ability to gather and define requirements; build a project plan; identifying resource needs; and transparent, clear communications across all levels of stakeholders. Essential is the ability to multitask on continually changing and morphing priorities as prescribed by leadership in response to department and legislative direction.\nPOSITION RESPONSIBILITIES AND ESSENTIAL FUNCTIONS\nAbility to work within a project governance structure (methodology, required templates and reporting)\nAbility to interact with, educate, learn from, and drive business and IT teams.\nAbility to work effectively under very broad direction with general supervision\nAbility to motivate team and meet deadlines in a fast-paced and challenging environment.\nAbility to gather and organize multiple simultaneous complex business process scenarios\nAbility to break down complex tasks into actionable work items, sequenced appropriately\nAbility to manage scope creep with a focus on delivering a minimum viable product\nExcellent organizational, presentation, interpersonal and team building skills\nExcellent time management and project planning/strategizing skills\nStrong verbal and written communication skills\nDemonstrated experience with managing client expectations, implementing service improvement initiatives\nDemonstrated experience managing multiple parallel work efforts\nTrack project progress, monitor and modify project schedules and provide status updates to project team. Escalate issues to management and/or appropriate leadership as appropriate.\nProvide insight and knowledge into improving processes related to portfolio, project and program management\nOther duties or tasks as assigned by management.",
        "source": "Email",
        "date_posted": "2024-09-30 10:00:03-05:00",
        "unique_id": "1924371e33b9ba23",
        "emp_type": [
            "full-time",
            "third party"
        ],
        "tag": "Project Manager"
    }
]