[
    {
        "company": "Involgix",
        "job_title": "Technical Program Manager",
        "location": "Dallas, TX, USA",
        "full_location": {
            "city": "Dallas",
            "state": "TX",
            "country": "USA"
        },
        "job_details": {
            "employment_type": [
                "contract",
                "third party"
            ],
            "job_code": "",
            "experience_required": "5+ years",
            "degree_required": "Not specified",
            "visa_sponsorship": "Not specified",
            "notice_period": "Not specified",
            "duration": "Not specified",
            "rate": "Not specified"
        },
        "skills": {
            "core": [
                "Project Management",
                "Agile",
                "Scrum",
                "Kanban",
                "C++",
                "Linux"
            ],
            "primary": [
                "Jira",
                "OS systems",
                "media",
                "system architecture",
                "iOS",
                "Android"
            ],
            "secondary": [
                "Micro coding",
                "Time management",
                "Organizational skills",
                "Collaborative environment",
                "Interpersonal skills",
                "Teamwork mentality",
                "Waterfall"
            ],
            "all": [
                "Project Management",
                "Agile",
                "Scrum",
                "Kanban",
                "C++",
                "Linux",
                "Jira",
                "OS systems",
                "media",
                "system architecture",
                "iOS",
                "Android",
                "Micro coding",
                "Time management",
                "Organizational skills",
                "Collaborative environment",
                "Interpersonal skills",
                "Teamwork mentality",
                "Waterfall"
            ],
            "with_experience": [
                "Project Management",
                "Agile",
                "Scrum",
                "C++",
                "Linux"
            ]
        },
        "job_type": [
            "onsite"
        ],
        "contact_person": "Ron Miller",
        "email": "ron@involgix.com",
        "jd": "From: Ron Miller, Involgix ron@involgix.com Reply to: ron@involgix.com Position: Technical Project Manager/ Technical Program ManagerLocation: Dallas, TX (Day One Onsite)Hiring Type: Contract Responsibilities: Demonstrated understanding of Project Management processes, strategies, and methodsMicro coding or bios level developer who has experience using jiraFamiliarity of SDLCC++ and Linux experienceSolid understanding of Agile, Scrum, and Kanban development methodologies.Good understanding of OS systems, media, and system architectureUnderstanding of iOS and Android platformExcellent time management and organizational skillsExperience working in a high-level collaborative environment and promoting a teamwork mentalityStrong interpersonal skills and the ability to work with many different personality typesExperience in project management models including Agile, Waterfall, and Scrum5+ years demonstrate ability in engineering development and project management are required Thanks and RegardsRon MillerSr. US IT Recruiter700 Market St, Suite 203, Cedar Park, TX 78613Email: ron@involgix.com",
        "source": "Email",
        "date_posted": "2024-09-30 09:57:51-05:00",
        "unique_id": "19243703f18367a1",
        "emp_type": [
            "contract",
            "third party"
        ],
        "tag": "Project Manager"
    }
]