[
    {
        "company": "3mkllc",
        "job_title": "Java Springboot Developer with Cloud API Development Exp",
        "location": "Toronto, ON, Canada",
        "full_location": {
            "city": "Toronto",
            "state": "ON",
            "country": "Canada"
        },
        "job_details": {
            "employment_type": [
                "contract",
                "third party"
            ],
            "job_code": "",
            "experience_required": "7+ years",
            "degree_required": "Not specified",
            "visa_sponsorship": "Not specified",
            "notice_period": "Not specified",
            "duration": "6 months",
            "rate": "Open / hr ( CAD )"
        },
        "skills": {
            "core": [
                "Java",
                "Spring Framework",
                "Cloud platforms",
                "Application security",
                "Middleware technologies"
            ],
            "primary": [
                "REST",
                "JDBC",
                "SOAP",
                "JMS",
                "XML",
                "JSON",
                "HTTP",
                "SQL",
                "Linux",
                "Windows",
                "DevOps",
                "Agile"
            ],
            "secondary": [
                "Kafka",
                "NiFi",
                "Groovy",
                "Python",
                "Maven",
                "Elastic stack",
                "PingFed",
                "Active Directory",
                "Jenkins",
                "Nexus",
                "IBM Urban Code Deployment"
            ],
            "all": [
                "Java",
                "Spring Framework",
                "Cloud platforms",
                "Application security",
                "Middleware technologies",
                "REST",
                "JDBC",
                "SOAP",
                "JMS",
                "XML",
                "JSON",
                "HTTP",
                "SQL",
                "Linux",
                "Windows",
                "DevOps",
                "Agile",
                "Kafka",
                "NiFi",
                "Groovy",
                "Python",
                "Maven",
                "Elastic stack",
                "PingFed",
                "Active Directory",
                "Jenkins",
                "Nexus",
                "IBM Urban Code Deployment"
            ]
        },
        "job_type": [
            "hybrid"
        ],
        "contact_person": "Steve",
        "email": "steve@3mkllc.com",
        "jd": "Must-have\n\u2022 7+ years of experience in an application development role with a proven track record of delivering maintainable, quality solutions\n\u2022 Experience with modern Java development with the Spring framework\n\u2022 Experience with Cloud platforms - PCF, OpenShift\n\u2022 Experience with middleware technologies - MQSeries, WebSphere Message Broker (WMB) / IBM Integration Bus (IIB), IBM Operational Decision Manager (ODM)\n\u2022 Experience with application security involving TLS/2waySSL, HTTPS, certificates\n\u2022 Knowledge of correlated technologies such as REST, JDBC, SOAP, JMS, XML, JSON, HTTP, SQL and others.\n\u2022 Knowledge of server operating systems (Linux, Windows) and networking\n\u2022 Experience/Understanding of DevOps, automated Build/Deploy processes, and Agile\nNice-to-have\n\u2022 Knowledge of other correlated technologies such as Kafka, NiFi, Groovy, Python, Maven, Elastic stack (Logstash/Kibana/ElasticSearch)\n\u2022 Knowledge of federated authentication (PingFed), Active Directory\n\u2022 Knowledge of deployment platforms such as Jenkins, Nexus, and IBM Urban Code Deployment (UCD)",
        "source": "Email",
        "date_posted": "2024-09-30 10:49:45-05:00",
        "unique_id": "19243a1ee0bd7237",
        "emp_type": [
            "contract",
            "third party"
        ],
        "tag": "Java developer"
    }
]