[
    {
        "company": "Gensigma",
        "job_title": "Business Analyst",
        "location": "Lansing, MI, USA",
        "full_location": {
            "city": "Lansing",
            "state": "MI",
            "country": "USA"
        },
        "job_details": {
            "employment_type": [
                "full-time",
                "third party"
            ],
            "job_code": "",
            "experience_required": "1-3 years",
            "degree_required": "Bachelor's Degree",
            "visa_sponsorship": "Not specified",
            "notice_period": "Not specified",
            "duration": "Not specified",
            "rate": "Not specified"
        },
        "skills": {
            "core": [
                "Networking",
                "Organization and Prioritization skills",
                "Communication and Interpersonal skills"
            ],
            "primary": [
                "Microsoft Project",
                "Excel",
                "Remedy/Helix",
                "Telecommunications environment",
                "multiple network platforms",
                "multiple network lines of service"
            ],
            "secondary": [
                "Clarity",
                "DevOPs",
                "customer service"
            ],
            "all": [
                "Networking",
                "Organization and Prioritization skills",
                "Communication and Interpersonal skills",
                "Clarity",
                "Microsoft Project",
                "Excel",
                "DevOPs",
                "Remedy/Helix",
                "Telecommunications environment",
                "multiple network platforms",
                "multiple network lines of service",
                "customer service"
            ]
        },
        "job_type": [
            "onsite",
            "remote"
        ],
        "contact_person": "Rishabh",
        "email": "rishabc@gensigma.com",
        "jd": "From: Rishabh, Gensigma rishabc@gensigma.com Reply to: rishabc@gensigma.com Job Title- Business Analyst Location: Lansing Michigan ( 3 days onsite 2 days remote) look for nearby Candidates ( Only W2 required) Skills, Experience and Education: Need someone with Networking experience Bachelors Degree, Required Organization and Prioritization skills are Mandatory Communication and Interpersonal skills are Mandatory Previous experience working with multiple agencies and/or vendors and/or departments in an enterprise environment are Required Minimum 1-3 years experience with Clarity is Preferred Minimum 3-5 years experience with Microsoft Project and Excel is Required Minimum 2-3 years experience with DevOPs is Preferred Minimum 3-5 years experience with Remedy/Helix is Required Minimum 3-5 years working within a Telecommunications environment is Required Minimum 3-5 years experience in a large Enterprise setting is Required Minimum 3-5 years work experience with multiple network platforms is Required Minimum 3-5 years working with multiple network lines of service is Required Minimum 5+ years dealing with customers is Required",
        "source": "Email",
        "date_posted": "2024-10-01 13:35:33-05:00",
        "unique_id": "192495d390a8cb9d",
        "emp_type": [
            "full-time",
            "third party"
        ],
        "tag": "Business Analyst"
    }
]