[
    {
        "company": "Beckman Coulter",
        "job_title": "Salesforce Business System Analyst",
        "location": "USA",
        "full_location": {
            "city": "",
            "state": "",
            "country": "USA"
        },
        "job_details": {
            "employment_type": [
                "contract",
                "third party"
            ],
            "job_code": "",
            "experience_required": "Not specified",
            "degree_required": "Not specified",
            "visa_sponsorship": "Must have existing work authorization",
            "notice_period": "Not specified",
            "duration": "12+ Months",
            "rate": "$60/hr."
        },
        "skills": {
            "core": [
                "Salesforce",
                "MuleSoft",
                "Business Analysis",
                "Integrations",
                "Salesforce Administrator certification"
            ],
            "primary": [
                "Salesforce integration methodologies",
                "Data mapping",
                "Communication skills",
                "Stakeholder management",
                "Detail-oriented"
            ],
            "secondary": [
                "UCI Ascend",
                "API management",
                "Integration best practices"
            ],
            "all": [
                "Salesforce",
                "MuleSoft",
                "Business Analysis",
                "Integrations",
                "Salesforce Administrator certification",
                "Salesforce integration methodologies",
                "Data mapping",
                "Communication skills",
                "Stakeholder management",
                "Detail-oriented",
                "UCI Ascend",
                "API management",
                "Integration best practices"
            ],
            "with_experience": [
                "Salesforce (Proven experience)",
                "MuleSoft (Hands-on experience)"
            ]
        },
        "job_type": [
            "remote"
        ],
        "contact_person": "Vikrama Rao",
        "email": "vrao@valiantiq.com",
        "jd": "From: Vikrama, Valiantiq vrao@valiantiq.com Reply to: vrao@valiantiq.com Job Role: Salesforce Business System AnalystClient: Beckman CoulterDuration: 12+ MonthsRate: $60/hr. on C2CVisa: GC USC ONLYLocation: 100 % Remote Key Responsibilities: Collaborate with Subject Matter Experts SME\u2019s, Business Partners, and developers to gather, document, and write business requirements via interviews or recorded sessions for MuleSoft integrations with UCI Ascend (which is their Alumni portal, which is built on Salesforce Experience Cloud \u2013 UCI Ascend has integration pathways called Interims built on Salesforce Service Cloud).Analyze, define, and create detailed test cases and acceptance criteria for integration projects. (some integrations are already built, some are not, some have no requirements even yet)Work closely with development teams, MuleSoft developers, and Salesforce admins to ensure seamless integration.Perform gap analysis between current Salesforce functionality and desired business needs.Support user testing, troubleshooting, and issue resolution related to integrations. Required Qualifications:Proven experience with Salesforce, particularly in business analysis and integrations.Salesforce Administrator certification (Salesforce Admin Certified).Hands-on experience working with MuleSoft or other integration platforms.Strong understanding of Salesforce integration methodologies and data mapping.Excellent communication skills for stakeholder management and team collaboration.Detail-oriented with the ability to build clear and thorough acceptance criteria. Preferred Skills:Experience with UCI Ascend / Interims or similar applications.Knowledge of API management and integration best practices. Thanks & Regards,Vikrama RaoRecruitment Executive- ValiantIQ Inc.",
        "source": "Email",
        "date_posted": "2024-09-30 12:49:50-05:00",
        "unique_id": "192440d25b0bb9e3",
        "emp_type": [
            "contract",
            "third party"
        ],
        "tag": "Business Analyst"
    }
]