[
    {
        "company": "Flexon Technologies",
        "job_title": "Java Lead Developer",
        "location": "Austin, TX, USA",
        "full_location": {
            "city": "Austin",
            "state": "TX",
            "country": "USA"
        },
        "job_details": {
            "employment_type": [
                "third party"
            ],
            "job_code": "",
            "experience_required": "10+ years",
            "degree_required": "Not specified",
            "visa_sponsorship": "Not specified",
            "notice_period": "Not specified",
            "duration": "Not specified",
            "rate": "Not specified"
        },
        "skills": {
            "core": [
                "Java",
                "J2EE",
                "Spring Boot",
                "Microservices",
                "Object Oriented Programming"
            ],
            "primary": [
                "GIT",
                "GitHub",
                "Relational Database Management Systems",
                "No SQL database",
                "Design Patterns",
                "Analytical Skills",
                "Problem-solving Skills",
                "Team Leadership"
            ],
            "secondary": [
                "Creative Solutions",
                "Communication",
                "Continuous Improvement"
            ],
            "all": [
                "Java",
                "J2EE",
                "Spring Boot",
                "Microservices",
                "Object Oriented Programming",
                "GIT",
                "GitHub",
                "Relational Database Management Systems",
                "No SQL database",
                "Design Patterns",
                "Analytical Skills",
                "Problem-solving Skills",
                "Team Leadership",
                "Creative Solutions",
                "Communication",
                "Continuous Improvement"
            ]
        },
        "job_type": [],
        "contact_person": "Shakthi Satkuri",
        "email": "shakthi@flexontechnologies.com",
        "jd": "From: Shakthi Satkuri, Flexon Technologies shakthi@flexontechnologies.com Reply to: shakthi@flexontechnologies.com Java Lead Developer Austin, TX~Sunnyvale, CA 10+ years of Java, J2EE & Spring Boot development experience Should have 2+ years of experience as a Technical Lead Proficient experience with building Java Micro Services using Java 8/11, Spring & Spring boot Experienced in GIT, GitHub or other distributed version control system Deep understanding & experience in Java (Collections & Threads), design concepts, patterns and coding standards Proficient in Object Oriented programming and design patterns Back End Development including Relational Database Management Systems Experience with No SQL database like Mongo Independent thinker that can identify problems and provide creative solutions Strong analytical and problem-solving skills Good communicator and team player Experience and ability to lead the team by providing design and technical guidance and also proactively any remove blockers to help them progress efficiently Embody passion for new technology and open source and a believer in continuous improvement of skills",
        "source": "Email",
        "date_posted": "2024-09-30 13:00:32-05:00",
        "unique_id": "1924416ed9522102",
        "emp_type": [
            "third party"
        ],
        "tag": "Java developer"
    }
]