[
    {
        "company": "Blue Ocean Ventures",
        "job_title": ".Net Developer with GCP",
        "location": "Denver, CO, USA",
        "full_location": {
            "city": "Denver",
            "state": "CO",
            "country": "USA"
        },
        "job_details": {
            "employment_type": [
                "third party"
            ],
            "job_code": "",
            "experience_required": "9+ Years",
            "degree_required": "Engineering Degree \u2013 BE/ME/BTech/MTech/BSc/MSc",
            "visa_sponsorship": "Not specified",
            "notice_period": "Not specified",
            "duration": "Not specified",
            "rate": "Not specified"
        },
        "skills": {
            "core": [
                "ASP.NET core",
                "Entity Framework Core",
                "C#",
                "ASP.NET",
                "ASP.NET MVC",
                "SQL Server 2012",
                "Google Cloud Platform (GCP)"
            ],
            "primary": [
                "Terraform",
                "Kubernetes",
                "Automated unit testing",
                "Agile",
                "ReactJS"
            ],
            "secondary": [
                "CI/CD Pipelines using GitLab",
                "Software development methodologies (SDLC, Agile)",
                "Oracle"
            ],
            "all": [
                "ASP.NET core",
                "Entity Framework Core",
                "C#",
                "ASP.NET",
                "ASP.NET MVC",
                "SQL Server 2012",
                "Google Cloud Platform (GCP)",
                "Terraform",
                "Kubernetes",
                "Automated unit testing",
                "Agile",
                "ReactJS",
                "CI/CD Pipelines using GitLab",
                "Software development methodologies (SDLC, Agile)",
                "Oracle"
            ]
        },
        "job_type": [],
        "contact_person": "Rakesh",
        "email": "rakesh.d@blue-oceanventures.com",
        "jd": "From: Rakesh, Blue Ocean Ventures rakesh.d@blue-oceanventures.com Reply to: rakesh.d@blue-oceanventures.com As a Lead .Net Developer with GCP, you will be a part of an Agile team to build healthcare applications and implement new features while adhering to the best coding development standards. Responsibilities: -Profiles requested with mandatory experience on .Net, GCP, and GCP Services is good to have.Candidate should be familiar with GCP services, API Wrapper, Model setup with GCP Hands on experience with Terraform and Kubernetes is good to have.Strong Object- Oriented Programming SkillsProficiency writing automated unit testing codeGood hands-on experience in ASP.NET core, Entity Framework Core, C#, ASP.NET, ASP.NET MVC and SQL Server 2012Ability to debug and resolve issue independently on server side (C#)Should be well versed with writing SQL Queries, Store Procs with very good understanding of T-SQL best practicesShould have very good understanding of C# and ASP.NET coding best practicesShould have experience of working in Agile /Scrum teamShould have experience in demonstrating the user stories to client during Sprint ReviewGood hands-on experience in C#, ASP.NET, ASP.NET MVC, ReactJS and SQL Server 2012Design, implement, manage and maintain cloud-based systemsSupport the design and migration of existing applications to GCP Plan, provision, deploy and maintain a Cloud solution environmentProactively monitor security, performance, and costs while responding to alerts, working with development and service delivery teams to resolveSupport Cloud deployments, monitoring the health of environments, providing maximum system performance to users and sustaining system uptime standards.Ensures the security of cloud resources by implementing access controls, encryption, and monitoringCollaborates with cross-functional teams to support application and infrastructure requirementsTroubleshoot incidents, identify root causes, fix, and document problems, and implement preventive measuresApply an understanding of emerging technologies, industry best practices, and system requirements to recommend and document specific elements of architecture including compute and storage components, networking and related appliances, and third-party software and programsSupport opportunities for process improvement, re-imagining, and automation in cloud, and employ practices intended to improve customer satisfaction and reduce costsPrioritize and complete assigned duties expeditiously and within approved windowsDeploys, implements and configures cloud environments in accordance with best practices and security guidelines by applying knowledge of programming languages.Stay abreast of latest GCP offerings and make recommendations to leadership.Understanding of and experience with the six pillars of a well-architected frameworkExperience with or conceptual understanding of the analysis, deployment, integration, optimization, troubleshooting, and consultation of the following disciplines or technologies is required: GCP, GKE, Cloud Storage, Cloud SQL, Cloud DNS, Load Balancing, Cloud Functions, Spanner, BQ, PubSub, Cloud Run, Anthos, Compute Engine, GKE, GCP storage optionsAbility to inspire and instill confidence in peers and colleagues by fulfilling service demand with a high degree of quality and intentionalityAbility to convey information and ideas clearly, concisely, and persuasively using terminology and jargon appropriate for the intended audience Experience: -\u00b7 9+ Years Location: -\u00b7 Denver, CO Educational Qualifications: -Engineering Degree \u2013 BE/ME/BTech/MTech/BSc/MSc.Technical certification in multiple technologies is desirable. Skills: - Mandatory skillsASP.NET core, Entity Framework Core, C#, ASP.NET, ASP.NET MVC and SQL Server 2012Experience in Google Cloud Platform (GCP) Good to have skills: -Experience in working on CI/CD Pipelines using GitLabStrong knowledge of applying software development methodologies (SDLC, Agile)Proficiencies in relational databases such as Oracle, SQL Server",
        "source": "Email",
        "date_posted": "2024-09-30 14:25:11-05:00",
        "unique_id": "19244646dff880dd",
        "emp_type": [
            "third party"
        ],
        "tag": ".net developer"
    }
]