[
    {
        "company": "Texans IT Services Inc",
        "job_title": "SAP HCM Project Manager",
        "location": "Omaha, NE, USA",
        "full_location": {
            "city": "Omaha",
            "state": "NE",
            "country": "USA"
        },
        "job_details": {
            "employment_type": [
                "contract",
                "third party"
            ],
            "job_code": "",
            "experience_required": "5+ years",
            "degree_required": "Not specified",
            "visa_sponsorship": "No visa sponsorship",
            "notice_period": "Not specified",
            "duration": "12+ Months",
            "rate": "Not specified"
        },
        "skills": {
            "core": [
                "SAP Project Management Skills",
                "Experience With SAP Modules Like HCM",
                "Effective Planning Skills",
                "Strong Communication Skills"
            ],
            "primary": [
                "Project Management Tracking Tools",
                "Implementations",
                "Awareness Of Customer And Product Adoption"
            ],
            "secondary": [],
            "all": [
                "SAP Project Management Skills",
                "Experience With SAP Modules Like HCM",
                "Effective Planning Skills",
                "Strong Communication Skills",
                "Project Management Tracking Tools",
                "Implementations",
                "Awareness Of Customer And Product Adoption"
            ]
        },
        "job_type": [
            "onsite"
        ],
        "contact_person": "Sudhir",
        "email": "sudhir@texansitservices.com",
        "jd": "From: Sudhir, Texans IT Services Inc sudhir@texansitservices.com Reply to: sudhir@texansitservices.com Hi,We have an urgent requirement for SAP HCM Project Manager in Omaha, NE (DAYONE ONSITE). Below is the mentioned job description. Kindly forward me your contact details for further process at sudhir@texansitservices.com.Position: SAP HCM Project ManagerLocation: Omaha, NE (DAYONE ONSITE)Duration: 12+ MonthsNO OPTNEED PP NUMBER or RECENT i94JOB DESCRIPTIONSTANDARD SKILLSET ROLE: Project Manager For Technical ImplementationEXPERIENCE LEVEL: 5+ YEARS OF PM WORKING EXPERIENCEMUST HAVE: SAP Project Management Skills, Experience With SAP Moudles Like HCM Or Transportation Or Any Another, Highly Structured, Coordinated, Effective Planning Skills, Strong Communication Skills, Develop Comprehensive Project Plan ,Working Dependencies, Conduct Effective Meetings With Project Plans, Develop Weekly Reports Catered Towards Project Team, Executives And Steering Committee Meetings. GOOD TO HAVE: Various Project Management Tracking Tools, Implementations, Awareness Of Customer And Product Adoption.",
        "source": "Email",
        "date_posted": "2024-10-01 13:12:15-05:00",
        "unique_id": "1924947e6c77da21",
        "emp_type": [
            "contract",
            "third party"
        ],
        "tag": "Project Manager"
    }
]