[
    {
        "company": "Xforia Inc",
        "job_title": "Sr. Java AWS Developer",
        "location": "Wilmington, DE, USA",
        "full_location": {
            "city": "Wilmington",
            "state": "DE",
            "country": "USA"
        },
        "job_details": {
            "employment_type": [
                "contract",
                "third party"
            ],
            "experience_required": "Not specified",
            "degree_required": "Not specified",
            "visa_sponsorship": "Not specified",
            "notice_period": "Not specified",
            "duration": "12+ Months",
            "rate": "Not specified"
        },
        "skills": {
            "core": [
                "Java",
                "Spring",
                "Microservices",
                "AWS"
            ],
            "primary": [
                "J2EE",
                "Webservices",
                "PL/SQL",
                "Agile",
                "GIT",
                "Jenkins",
                "IntelliJ",
                "Maven",
                "Tomcat"
            ],
            "secondary": [
                "Object-Oriented Analysis",
                "Object Oriented Design",
                "Java Design Patterns",
                "JUnit",
                "Relational Databases",
                "SOAP",
                "REST"
            ],
            "all": [
                "Java",
                "Spring",
                "Microservices",
                "AWS",
                "J2EE",
                "Webservices",
                "PL/SQL",
                "Agile",
                "GIT",
                "Jenkins",
                "IntelliJ",
                "Maven",
                "Tomcat",
                "Object-Oriented Analysis",
                "Object Oriented Design",
                "Java Design Patterns",
                "JUnit",
                "Relational Databases",
                "SOAP",
                "REST"
            ]
        },
        "job_type": [
            "onsite"
        ],
        "contact_person": "Deepak M.V",
        "email": "deepak@xforia.com",
        "jd": "From: Deepak, Xforia Inc deepak@xforia.com Reply to: deepak@xforia.com Title: Sr. Java AWS DeveloperLocation: Wilmington, DE | New York City, NY | Day 1 OnsiteDuration: 12+ Months Contract Job Description:Mandate skills: Java, Spring boot, Microservices, AWSExperience in Agile software development methodology and practices with full development lifecycle from inception through implementation.Required: Java, J2EE, Spring, Microservice, Webservices, PL/SQLWorking knowledge of Object-Oriented Analysis/Object Oriented Design methodologies and life cycles.Demonstrated experience with SCM tools such as GIT, JenkinsExperience with application development on Java, J2EE, Spring, and MVC, Java Design Patterns and JUnit.Knowledge of Relational Databases like Oracle/SQL Server, SQLKnowledge of Web service technologies including SOAP/REST.Strong working knowledge of IntelliJ, Maven and Tomcat.Ability to work collaboratively in teams and develop meaningful relationships to achieve common goalsKnowledge of architecture, design and business processesProficiency in modern programming languagesExperience in design and build of complex application systems using the new banking architecture including Java/J2EE/Spring technologies. Proficiency in one or more general purpose programming languages including Java/J2EE/JSP based Web applications/Middleware and Batch systems.Experience in design, analysis, development, coding, unit testing, debug and documentation for Java/J2EE systems including Web applications, business services, batch applications, large/complex projects and utilizing Web Services and Java RMI technologies to improve interface/API and significantly enhance integration capability between front-end and back-end systemsA fundamental understanding of software skills and the different components of SDLC such as business analysis, development, and maintenance and software improvement is essential www.xforia.com Deepak M.VRecruitment Manager9300 Wade Boulevard, Suite 220, Frisco TX 75035, USA.",
        "source": "Email",
        "date_posted": "2024-10-01 13:08:47-05:00",
        "unique_id": "1924944bb4c9e79a",
        "emp_type": [
            "contract",
            "third party"
        ],
        "tag": "Java developer"
    }
]