[
    {
        "company": "Techgene",
        "job_title": "API Tech Lead",
        "location": "USA",
        "full_location": {
            "city": "Dallas",
            "state": "TX",
            "country": "USA"
        },
        "job_details": {
            "employment_type": [
                "third party"
            ],
            "job_code": "",
            "experience_required": "Not specified",
            "degree_required": "Not specified",
            "visa_sponsorship": "Not specified",
            "notice_period": "Not specified",
            "duration": "Not specified",
            "rate": "Not specified"
        },
        "skills": {
            "core": [
                "Java",
                "Spring Framework",
                "Microservices Architecture",
                "API Design",
                "REST",
                "SOAP"
            ],
            "primary": [
                "Node.js",
                "Express.js",
                "Swagger",
                "OpenAPI",
                "ReadyAPI",
                "SOAPUI",
                "Postman",
                "JMeter",
                "Python",
                "API Management Tools",
                "OAuth",
                "JWT",
                "AWS",
                "Azure",
                "Google Cloud"
            ],
            "secondary": [],
            "all": [
                "Java",
                "Spring Framework",
                "Microservices Architecture",
                "API Design",
                "REST",
                "SOAP",
                "Node.js",
                "Express.js",
                "Swagger",
                "OpenAPI",
                "ReadyAPI",
                "SOAPUI",
                "Postman",
                "JMeter",
                "Python",
                "API Management Tools",
                "OAuth",
                "JWT",
                "AWS",
                "Azure",
                "Google Cloud"
            ],
            "with_experience": []
        },
        "job_type": [
            "remote"
        ],
        "contact_person": "Manvith",
        "email": "manvith.c@techgene.com",
        "jd": "API Tech Lead - Location- Dallas, TX(Remote Role) Experienced in designing, developing, integrating, and deploying web services (with REST/SOAP/JSON/XML) using micro services architecture Expert level of Java development experience, including newer versions Expert knowledge of Spring frameworks, including Spring Boot Experience with node.js and express.js Experience designing and documenting APIs with tools such as Swagger, OpenAPI Experience with Java and web services testing tools (ReadyAPI, SOAPUI, Postman, JMeter, etc.) Proficiency in programming languages such as Java, Python, Node.js, or similar. Experience with API management tools (e.g., Apigee, Postman, Swagger). Strong understanding of authentication and authorization mechanisms (e.g., OAuth, JWT). Familiarity with cloud platforms (e.g., AWS, Azure, Google Cloud) and microservices architecture.",
        "source": "Email",
        "date_posted": "2024-10-01 14:39:08-05:00",
        "unique_id": "19249987c3f6a5c1",
        "emp_type": [
            "third party"
        ],
        "tag": "Java developer"
    }
]