[
    {
        "company": "Tek Inspirations LLC",
        "job_title": "Experienced Scrum Master: Digital Risk & Compliance",
        "location": "Bridgewater, NJ, USA",
        "full_location": {
            "city": "Bridgewater",
            "state": "NJ",
            "country": "USA"
        },
        "job_details": {
            "employment_type": [
                "contract",
                "third party"
            ],
            "job_code": "",
            "experience_required": "5+ years",
            "degree_required": "Not specified",
            "visa_sponsorship": "Not specified",
            "notice_period": "Not specified",
            "duration": "6 months (with probability of extension)",
            "rate": "Not specified"
        },
        "skills": {
            "core": [
                "Advanced Scrum Master certification",
                "Agile coaching",
                "Life Science project experience"
            ],
            "primary": [
                "Supporting scrum teams",
                "Scaled scrum teams",
                "Agile delivery approach",
                "Product backlog management"
            ],
            "secondary": [
                "Change initiatives",
                "Process changes",
                "Automation",
                "Self-service offerings"
            ],
            "all": [
                "Advanced Scrum Master certification",
                "Agile coaching",
                "Life Science project experience",
                "Supporting scrum teams",
                "Scaled scrum teams",
                "Agile delivery approach",
                "Product backlog management",
                "Change initiatives",
                "Process changes",
                "Automation",
                "Self-service offerings"
            ]
        },
        "job_type": [
            "hybrid"
        ],
        "contact_person": "Anju Pathak",
        "email": "anju.pathak@tekinspirations.com",
        "jd": "From: Anju Pathak, Tek Inspirations LLC anju.pathak@tekinspirations.com Reply to: anju.pathak@tekinspirations.com Job Description -Must have LinkedinRole Title: Experienced Scrum Master: Digital Risk & ComplianceDuration: 6 months (with probability of extension)Location: Bridgewater, NJ (hybrid 50% minimum onsite)MUST BE LOCAL TO NJ and New YorkLife Science project experience mandatoryContextThe Digital Risk & Compliance (DRC) function is currently in the middle of a change program to transform from a largely Quality Control focused approach to managing risk and compliance topics in Digital/IT to one that is based on empowering Digital/IT teams to be accountable for the risk management and compliance of their solutions through a combination of advisory capabilities, process changes, automation & self-service offerings.Mid-July we have released an MVP and are now refining our roadmap to deliver further iterations and increments in an Agile, Product-oriented approach. To do this successfully, we will need to build and mature an Agile approach that fits this type of complex organizational change effort.Required Experience & SkillsAdvanced Scrum Master certification with 5+ years supporting scrum and scaled scrum teams to deliver complex productsIdeally Agile coaching experienceExperience beyond Software Agile projects, but including change initiatives like our Transformation program, combining operating model, process and tool/software componentsLife Science project experience essentialScope of the RoleAs part of the Strategy & Governance team in DRC, work closely with the Head of the team, a junior Scrum Master and an Agile Coach to define the Agile delivery approach and required tooling.Serve as the Scrum Master across several product delivery teams (Scrum teams) to support the development of the next increments while maturing the approach and establishing the required ceremonies.Work closely with the Product Owner and component owners to build a robust product backlog and appropriate practices to manage it across the different teams, including assisting the Product Owner to effectively collect customer feedback.Support the upskilling of the internal, junior Scrum Master by working alongside her and coaching her.",
        "source": "Email",
        "date_posted": "2024-09-30 14:47:20-05:00",
        "unique_id": "1924478b36d3e892",
        "emp_type": [
            "contract",
            "third party"
        ],
        "tag": "Scrum Master"
    }
]