[
    {
        "company": "VSP",
        "job_title": "Senior full stack java developer",
        "location": "Richmond, VA, USA",
        "full_location": {
            "city": "Richmond",
            "state": "VA",
            "country": "USA"
        },
        "job_details": {
            "employment_type": [
                "contract",
                "third party"
            ],
            "job_code": "VA-748127",
            "experience_required": "5 years",
            "degree_required": "Not specified",
            "visa_sponsorship": "Not specified",
            "notice_period": "Not specified",
            "duration": "12 Months",
            "rate": "Not specified"
        },
        "skills": {
            "core": [
                "Java/J2EE",
                "HTML/CSS",
                "JavaScript",
                "SQL",
                "SOAP & REST Web Services",
                "Spring",
                "JDBC",
                "JPA/Hibernate",
                "JMS",
                "DocuSign API integration using Webhooks",
                "AWS leveraging Serverless Lambda",
                "SQS/SNS and API Gateway",
                "AWS WAF",
                "AWS Secrets Manager",
                "IAM",
                "DynamoDB",
                "Relational/Object Oriented Modelling",
                "Technical requirements specification and design documentation",
                "Problem troubleshooting and providing support for complex multitiered applications",
                "Effective oral and written communication skills"
            ],
            "primary": [
                "Experience with OKTA integration",
                "Experience with UNIXOS",
                "UNIX Shell Scripting",
                "PL/SQL",
                "UML",
                "IBM WebSphere Application Server",
                "IBM WebSphere Liberty",
                "Oracle RDBMS",
                "Spring Batch",
                "Spring Boot"
            ],
            "secondary": [
                "Experience with large-scale data migration",
                "Experience with Microsoft Office Suite of products",
                "Experience working in an agile environment (scrum, kanban, or scrum ban)"
            ],
            "all": [
                "Java/J2EE",
                "HTML/CSS",
                "JavaScript",
                "SQL",
                "SOAP & REST Web Services",
                "Spring",
                "JDBC",
                "JPA/Hibernate",
                "JMS",
                "DocuSign API integration using Webhooks",
                "AWS leveraging Serverless Lambda",
                "SQS/SNS and API Gateway",
                "AWS WAF",
                "AWS Secrets Manager",
                "IAM",
                "DynamoDB",
                "Relational/Object Oriented Modelling",
                "Technical requirements specification and design documentation",
                "Problem troubleshooting and providing support for complex multitiered applications",
                "Effective oral and written communication skills",
                "Experience with OKTA integration",
                "Experience with UNIXOS",
                "UNIX Shell Scripting",
                "PL/SQL",
                "UML",
                "IBM WebSphere Application Server",
                "IBM WebSphere Liberty",
                "Oracle RDBMS",
                "Spring Batch",
                "Spring Boot",
                "Experience with large-scale data migration",
                "Experience with Microsoft Office Suite of products",
                "Experience working in an agile environment (scrum, kanban, or scrum ban)"
            ]
        },
        "job_type": [
            "onsite"
        ],
        "contact_person": "Harsh Tiwari",
        "email": "harsh.tiwari@technocraftsol.com",
        "jd": "From: Harsh Tiwari, Technocraft solutions harsh.tiwari@technocraftsol.com Reply to: harsh.tiwari@technocraftsol.com Job Title: Senior full stack java developer \u2013(Only Local)Job ID: VA-748127 (Onsite)Location: Richmond, VA (VSP)Duration: 12 Months Note*****IN PERSON Interviews ONLY (no Exceptions)*Candidate MUST be comfortable interviewing and working onsite 100% from Day 1 Skills:Java development experience with complex, large scale applications using the following technologies is required: Java/J2EE, HTML/CSS, JavaScript, SQL. Required 5 YearsJava/J2EE development experience DocuSign API integration using Webhooks Required 3 YearsAWS leveraging Serverless Lambda, SQS/SNS and API Gateway, AWS WAF, AWS Secrets Manager, IAM and DynamoDB Required 3 YearsSOAP & REST Web Services, Spring, JDBC, JPA/Hibernate, and JMS. Required 3 YearsRelational/Object Oriented Modelling Required 2 YearsTechnical requirements specification and design documentation Required 3 YearsExperience with problem troubleshooting and providing support for complex multitiered applications Not Required 3 YearsThe ability to successfully interact in a team environment Required 3 YearsEffective oral and written communication skills Required 3 YearsExperience with OKTA integration Highly desired 2 YearsExperience with UNIXOS, UNIX Shell Scripting, PL/SQL, and UML Highly desired 2 YearsExperience with IBM WebSphere Application Server, IBM WebSphere Liberty, and Oracle RDBMS Highly desired 2 YearsExperience with Spring Batch and Spring Boot Highly desired 2 YearsExperience with large-scale data migration Desired 2 YearsExperience with Microsoft Office Suite of products Desired 2 YearsExperience working in an agile environment (scrum, kanban, or scrum ban) Desired 2 Years Description:ABOUT THE ROLEVSP is looking for a Sr Full Stack Java consultant to assist with the design, development and support of DocuSign workflows integrated with complex Java/JEE programs. \u2013 A minimum of 3 years of experience on DocuSign API integration using Webhooks\u2013 A minimum of 3 years of experience on AWS leveraging Serverless Lambda, SQS/SNS and API Gateway, AWS WAF, AWS Secrets Manager, IAM and DynamoDB\u2013 A minimum of 5 years of Java development experience with complex, large-scale applications using the following technologies is required: Java/J2EE, HTML/CSS, JavaScript, SQL.\u2013 A minimum of 3 years\u2019 experience with the following technologies: SOAP & REST Web Services, Spring, JDBC, JPA/Hibernate, and JMS.\u2013 Experience with relational and object-oriented modeling is required.\u2013 Experience with technical requirements specification and design documentation is required.\u2013 Experience with problem troubleshooting and providing support for complex multitiered applications is required.\u2013 The ability to successfully interact in a team environment is required.\u2013 Effective oral and written communication skills are required.\u2013 Experience with OKTA integration strongly preferred.\u2013 Experience with UNIXOS, UNIX Shell Scripting, PL/SQL, and UML is strongly preferred.\u2013 Experience with IBM WebSphere Application Server, IBM WebSphere Liberty, and Oracle RDBMS is strongly preferred.\u2013 Experience with Spring Batch and Spring Boot is strongly preferred.\u2013 Experience with large-scale data migration is preferred.\u2013 Experience with Microsoft Office Suite of products is preferred.\u2013 Experience working in an agile environment (scrum, kanban, or scrum ban) is preferred.",
        "source": "Email",
        "date_posted": "2024-09-30 10:33:12-05:00",
        "unique_id": "192439011111556f",
        "emp_type": [
            "contract",
            "third party"
        ],
        "tag": "Java developer"
    }
]