[
    {
        "company": "Adventa tech inc",
        "job_title": "Senior/Principal Python Developer",
        "location": "Boston, MA, USA",
        "full_location": {
            "city": "Boston",
            "state": "MA",
            "country": "USA"
        },
        "job_details": {
            "employment_type": [
                "third party"
            ],
            "experience_required": "9+ years",
            "degree_required": "Not specified",
            "visa_sponsorship": "Not specified",
            "notice_period": "Not specified",
            "duration": "18 Month",
            "rate": "Not specified"
        },
        "skills": {
            "core": [
                "Python",
                "Django",
                "Flask",
                "Pandas",
                "Numpy"
            ],
            "primary": [
                "JavaScript",
                "HTML",
                "CSS",
                "SQL",
                "NoSQL",
                "Git",
                "RESTful APIs",
                "AWS",
                "CI/CD"
            ],
            "secondary": [
                "Leadership skills",
                "Mentoring",
                "Problem-solving",
                "Analytical skills",
                "Communication",
                "Teamwork",
                "Attention to detail"
            ],
            "all": [
                "Python",
                "Django",
                "Flask",
                "Pandas",
                "Numpy",
                "JavaScript",
                "HTML",
                "CSS",
                "SQL",
                "NoSQL",
                "Git",
                "RESTful APIs",
                "AWS",
                "CI/CD",
                "Leadership skills",
                "Mentoring",
                "Problem-solving",
                "Analytical skills",
                "Communication",
                "Teamwork",
                "Attention to detail"
            ],
            "with_experience": [
                "Python (9+ years)",
                "AWS"
            ]
        },
        "job_type": [],
        "contact_person": "banani banojini das",
        "email": "banani@adventatech.com",
        "jd": "From: banani banojini das, Adventa tech inc banani@adventatech.com Reply to: banani@adventatech.com Title: Senior/Principal Python Developer Duration: 18 Month Location: Boston, Massachusetts Visa: CITIZEN,GREEN CARD,GC EAD,H4 EAD,OPT EAD Moi: Skype Job Description - Need only 1 candidate Must have 9+ years of experience working hands on as a Python Developer. Extensive financial services experience, specifically working on Pre-Trading Platforms 5+ years\u2019 experience deploying code on AWS Requirements: Technical Skills: Proficiency in Python, Python libraries and Python frameworks (e.g., Django, Flask, Pandas, Numpy). Strong knowledge of front-end technologies (e.g., JavaScript, HTML, CSS). Experience with databases (e.g., SQL, NoSQL) and data storage solutions. Experience with version control systems (e.g., Git). Understanding of RESTful APIs and web services. Experience in using AWS services like SNS, SQS, CloudFormation, lambda Experience in deploying code on AWS platform Knowledge of CI/CD pipelines and DevOps practices. Excellent problem-solving and analytical skills. Strong communication and teamwork abilities. Attention to detail and a commitment to delivering high-quality software. Experience: Proven experience as a Senior Python Developer with a strong portfolio of building applications for pre-trading systems in Financial Services Soft Skills: Leadership skills and the ability to mentor junior team members",
        "source": "Email",
        "date_posted": "2024-09-30 12:52:51-05:00",
        "unique_id": "192440fe7ba56bf3",
        "emp_type": [
            "third party"
        ],
        "tag": "Python developer"
    }
]