[
    {
        "company": "Xforia inc",
        "job_title": "Senior Java AWS Developer",
        "location": "Wilmington, DE, USA",
        "full_location": {
            "city": "Wilmington",
            "state": "DE",
            "country": "USA"
        },
        "job_details": {
            "employment_type": [
                "full-time",
                "third party"
            ],
            "experience_required": "Not specified",
            "degree_required": "Not specified",
            "visa_sponsorship": "Not specified",
            "notice_period": "Not specified",
            "duration": "Not specified",
            "rate": "Not specified"
        },
        "skills": {
            "core": [
                "Java",
                "J2EE",
                "Spring",
                "Microservice",
                "Webservices",
                "PL/SQL"
            ],
            "primary": [
                "Object-Oriented Analysis",
                "Object Oriented Design",
                "SCM tools",
                "GIT",
                "Jenkins",
                "Java Design Patterns",
                "JUnit",
                "Relational Databases",
                "Oracle",
                "SQL Server",
                "SQL",
                "SOAP",
                "REST",
                "IntelliJ",
                "Maven",
                "Tomcat"
            ],
            "secondary": [
                "Agile software development",
                "collaborative teamwork",
                "architecture",
                "design",
                "business processes",
                "programming languages",
                "design and build of complex application systems",
                "Web applications",
                "Middleware",
                "Batch systems",
                "unit testing",
                "debug",
                "documentation",
                "Web Services",
                "Java RMI"
            ],
            "all": [
                "Java",
                "J2EE",
                "Spring",
                "Microservice",
                "Webservices",
                "PL/SQL",
                "Object-Oriented Analysis",
                "Object Oriented Design",
                "SCM tools",
                "GIT",
                "Jenkins",
                "Java Design Patterns",
                "JUnit",
                "Relational Databases",
                "Oracle",
                "SQL Server",
                "SQL",
                "SOAP",
                "REST",
                "IntelliJ",
                "Maven",
                "Tomcat",
                "Agile software development",
                "collaborative teamwork",
                "architecture",
                "design",
                "business processes",
                "programming languages",
                "design and build of complex application systems",
                "Web applications",
                "Middleware",
                "Batch systems",
                "unit testing",
                "debug",
                "documentation",
                "Web Services",
                "Java RMI"
            ]
        },
        "job_type": [
            "onsite",
            "hybrid"
        ],
        "contact_person": "Sai Kirubha",
        "email": "sai.k@xforia.com",
        "jd": "From: Sai kirubha, Xforia inc sai.k@xforia.com Reply to: sai.k@xforia.com Job Description : Experience in Agile software development methodology and practices with full development lifecycle from inception through implementation.Required: Java, J2EE, Spring, Microservice, Webservices, PL/SQLWorking knowledge of Object-Oriented Analysis/Object Oriented Design methodologies and life cycles.Demonstrated experience with SCM tools such as GIT, JenkinsExperience with application development on Java, J2EE, Spring, and MVC, Java Design Patterns and JUnit.Knowledge of Relational Databases like Oracle/SQL Server, SQLKnowledge of Web service technologies including SOAP/REST.Strong working knowledge of IntelliJ, Maven and Tomcat.Ability to work collaboratively in teams and develop meaningful relationships to achieve common goalsKnowledge of architecture, design and business processesProficiency in modern programming languagesExperience in design and build of complex application systems using the new banking architecture including Java/J2EE/Spring technologies. Proficiency in one or more general purpose programming languages including Java/J2EE/JSP based Web applications/Middleware and Batch systems.Experience in design, analysis, development, coding, unit testing, debug and documentation for Java/J2EE systems including Web applications, business services, batch applications, large/complex projects and utilizing Web Services and Java RMI technologies to improve interface/API and significantly enhance integration capability between front-end and back-end systemsA fundamental understanding of software skills and the different components of SDLC such as business analysis, development, and maintenance and software improvement is essential Thanks & Regards, Sai KirubhaTechnical Recruiter99300 Wade Boulevard, Suite 220, Frisco TX 75035 sai.k@xforia.com | www.xforia.com",
        "source": "Email",
        "date_posted": "2024-09-30 10:47:11-05:00",
        "unique_id": "192439fb40f0a6f9",
        "emp_type": [
            "full-time",
            "third party"
        ],
        "tag": "Java developer"
    }
]