[
    {
        "company": "RCI",
        "job_title": "Business Analyst (Healthcare)",
        "location": "Quincy, MA, USA",
        "full_location": {
            "city": "Quincy",
            "state": "MA",
            "country": "USA"
        },
        "job_details": {
            "employment_type": [
                "contract",
                "third party"
            ],
            "job_code": "",
            "experience_required": "3 years",
            "degree_required": "Bachelor\u2019s degree in computer science, Information Systems, Business Administration, or a related field",
            "visa_sponsorship": "No visa sponsorship",
            "notice_period": "Not specified",
            "duration": "6 months with a possible extension",
            "rate": "$50/hr C2C"
        },
        "skills": {
            "core": [
                "Jira",
                "Long Term Care Population",
                "Complex eligibility systems",
                "Unified processes",
                "Microsoft 365",
                "Excel",
                "Word",
                "PowerPoint",
                "Access",
                "Visio"
            ],
            "primary": [
                "data structures",
                "application programming",
                "database development",
                "relational database theory and technology",
                "flow charts",
                "diagrams",
                "Use Cases"
            ],
            "secondary": [
                "strong organizational skills",
                "problem-solving aptitude",
                "attention to detail",
                "collaborative work",
                "project management"
            ],
            "all": [
                "Jira",
                "Long Term Care Population",
                "Complex eligibility systems",
                "Unified processes",
                "Microsoft 365",
                "Excel",
                "Word",
                "PowerPoint",
                "Access",
                "Visio",
                "data structures",
                "application programming",
                "database development",
                "relational database theory and technology",
                "flow charts",
                "diagrams",
                "Use Cases",
                "strong organizational skills",
                "problem-solving aptitude",
                "attention to detail",
                "collaborative work",
                "project management"
            ],
            "with_experience": [
                "Jira",
                "Long Term Care Population",
                "Complex eligibility systems",
                "Unified processes",
                "data structures",
                "application programming",
                "database development",
                "relational database theory and technology"
            ]
        },
        "job_type": [
            "hybrid"
        ],
        "contact_person": "Anamika",
        "email": "aanamika@rconsultinginc.com",
        "jd": "From: Anamika, RCI aanamika@rconsultinginc.com Reply to: aanamika@rconsultinginc.com ** Must have the local DL of Massachusetts or Rhode Island or New Hampshire only ** Role: Business Analyst (Healthcare) Location: Quincy, MA [Hybrid] [Local Only from MA, NH or RI and must have recent client experience from these locations only]Duration: 6 months with a possible extension Visa - No H1B Rate: $50/hr C2CInterview Mode: In-person 2-3 days onsite every week37.5 Hours work week paidMinimum Requirements:Knowledge of the principles of software development using the approved SDLC.Proficient knowledge of Jira, Long Term Care Population, Complex eligibility systems, and Unified processes.Proficiency in Microsoft 365, Excel, Word, PowerPoint, Access, and Visio.Knowledge of methods and techniques of computer systems analysis, design, technical terminology, codes, and standard abbreviations.Experience with one or more of the following: data structures, application programming, database development, or relational database theory and technology.Ability to prepare flow charts, diagrams, and Use Cases.Deliver oral and written instructions in a precise, understandable manner.Prepare required deliverables in accordance with established procedures.Strong organizational skills with the ability to maintain accurate records and status reporting.Ability to understand and apply the policies, procedures, specifications, standards, and guidelines governing assigned unit activities.Knowledge of MA HIX or other State Health Exchange.Ability to work with multiple vendors.Strong organizational skills, problem-solving aptitude, and attention to detail.Ability to work well with others in a fast fast-paced, dynamic environment.Strong initiative and ability to manage multiple projects, as well as strong follow-through skills.Must be able to work collaboratively, collegially, and cooperatively with others in an environment where deliverables are potentially dependent on the output of others. Education and Certifications:Bachelor\u2019s degree in computer science, Information Systems, Business Administration, or a related field.Minimum of (3) three years of extensive experience with project management as a Senior Business Analyst of a large-scale application.Minimum of (3) years of experience in working in all phases of the Software Development Life Cycle (SDLC), including postproduction verification.Prior Government or healthcare experience desired.",
        "source": "Email",
        "date_posted": "2024-09-30 14:54:51-05:00",
        "unique_id": "192447f97a6e23af",
        "emp_type": [
            "contract",
            "third party"
        ],
        "tag": "Business Analyst"
    }
]