[
    {
        "company": "THEMESOFT INC",
        "job_title": "Business Analyst (Healthcare Domain)",
        "location": "Alameda, CA, USA",
        "full_location": {
            "city": "Alameda",
            "state": "CA",
            "country": "USA"
        },
        "job_details": {
            "employment_type": [
                "full-time",
                "third party"
            ],
            "job_code": "",
            "experience_required": "Not specified",
            "degree_required": "Not specified",
            "visa_sponsorship": "Not specified",
            "notice_period": "Not specified",
            "duration": "Not specified",
            "rate": "Not specified"
        },
        "skills": {
            "core": [
                "Healthcare Provider environment",
                "Revenue Cycle Management",
                "Billing",
                "Claims",
                "Medical coding"
            ],
            "primary": [
                "Interoperability",
                "Workflow management",
                "Clinical workflows",
                "Documentation",
                "Configuration testing"
            ],
            "secondary": [
                "Leadership",
                "User focus groups",
                "Vendor training",
                "Demonstrations"
            ],
            "all": [
                "Healthcare Provider environment",
                "Revenue Cycle Management",
                "Billing",
                "Claims",
                "Medical coding",
                "Interoperability",
                "Workflow management",
                "Clinical workflows",
                "Documentation",
                "Configuration testing",
                "Leadership",
                "User focus groups",
                "Vendor training",
                "Demonstrations"
            ],
            "with_experience": [
                "Healthcare Provider environment",
                "Revenue Cycle Management"
            ]
        },
        "job_type": [
            "onsite"
        ],
        "contact_person": "Ashish Kumar",
        "email": "ashish@themesoft.com",
        "jd": "From: Ashish Kumar, THEMESOFT INC ashish@themesoft.com Reply to: ashish@themesoft.com Job Title: Business Analyst (Healthcare Domain)Location: Alameda, CA - Onsite - Locals highly preferredThe Senior Business Systems Analyst possesses extensive experience with Healthcare Provider environment with specific focus on Revenue Cycle Management, interoperability and applications and has leadership experience in driving program delivery, standards, policies, strategy, and best practices.Key Accountabilities:Extensive experience with Healthcare provider landscape, Revenue Cycle Management, Physician and Nurses workflow management and improvement to drive experience and engagementExperience with Billing, claims, collections, scheduling, registration, medical coding.The candidate will be instrumental in optimizing clinical and non-clinical workflows forefront middle and back-office functions, and directly supporting exceptional patient careCollaborating closely with clinical staff to understand their specific needs and workflows for order entry and result reviewTranslating these requirements into tailored configurations for the customer environmentAlerts and notifications for critical results based on customer's guidelinesDeveloping and maintaining comprehensive documentation for the configurations implemented at the customer siteTesting configurations thoroughly to ensure functionality and adherence to end user needsTroubleshooting and resolving configuration issues related to orders and results specific to customer's setupParticipate in user focus groups and requirements workshops, vendor training and demonstrations.",
        "source": "Email",
        "date_posted": "2024-09-30 10:16:13-05:00",
        "unique_id": "1924380aff3f2326",
        "emp_type": [
            "full-time",
            "third party"
        ],
        "tag": "Business Analyst"
    }
]