[
    {
        "company": "Global IT Family",
        "job_title": "Senior AWS with Redshift Expert",
        "location": "St. Louis, MO, USA",
        "full_location": {
            "city": "St. Louis",
            "state": "MO",
            "country": "USA"
        },
        "job_details": {
            "employment_type": [
                "contract"
            ],
            "job_code": "",
            "experience_required": "8+ years",
            "degree_required": "Not specified",
            "visa_sponsorship": "Not specified",
            "notice_period": "Not specified",
            "duration": "12+ Months",
            "rate": "Not specified"
        },
        "skills": {
            "core": [
                "AWS Redshift",
                "SQL",
                "Data Analysis"
            ],
            "primary": [
                "PL/SQL",
                "Python",
                "Unix",
                "JIRA",
                "Project Planning"
            ],
            "secondary": [
                "Excellent communication skill",
                "Team management",
                "Resource planning",
                "Knowledge on Documentations like (S2T, NDR document, RM, DM etc.)"
            ],
            "all": [
                "AWS Redshift",
                "SQL",
                "Data Analysis",
                "PL/SQL",
                "Python",
                "Unix",
                "JIRA",
                "Project Planning",
                "Excellent communication skill",
                "Team management",
                "Resource planning",
                "Knowledge on Documentations like (S2T, NDR document, RM, DM etc.)"
            ]
        },
        "job_type": [
            "hybrid"
        ],
        "contact_person": "Naresh",
        "email": "naresh@globalitfamily.com",
        "jd": "From: Naresh, GITF naresh@globalitfamily.com Reply to: naresh@globalitfamily.com Title: Senior AWS with Redshift ExpertLocation: St. Louis MODuration: 12+ MonthsHybridJob Description8+ years of experience in with Database application Development using programming language.Strong knowledge of AWS RedshiftVery Strong in SQL and Data Analysis, performance tuning and code reviews.Strong knowledge of stored procedures, macros and functionsBusiness knowledge in the Telecom domain.AWS CloudsAWS RedshiftPL/SQLPythonSkill Set Required:RedshiftUnixJIRAProject PlanningExcellent communication skillTeam managementResource planningKnowledge on Documentations like (S2T, NDR document, RM, DM etc.)Thanks & Regards,NareshGlobal IT FamilyEmail: naresh@globalitfamily.comhttp://globalitfamily.com/",
        "source": "Email",
        "date_posted": "2024-10-01 08:58:50-05:00",
        "unique_id": "192485fe9c8e0e5e",
        "emp_type": [
            "contract"
        ],
        "tag": "AWS Data Engineer"
    }
]