[
    {
        "company": "IndusAilabs",
        "job_title": "Developer Standard III - Python Developer",
        "location": "Washington, DC, USA",
        "full_location": {
            "city": "Washington",
            "state": "DC",
            "country": "USA"
        },
        "job_details": {
            "employment_type": [
                "contract",
                "third party"
            ],
            "job_code": "",
            "experience_required": "Not specified",
            "degree_required": "Not specified",
            "visa_sponsorship": "Not specified",
            "notice_period": "Not specified",
            "duration": "8 Months \u2013 Long Term",
            "rate": "Not specified"
        },
        "skills": {
            "core": [
                "Python"
            ],
            "primary": [
                "Excel",
                "Requirement Analysis",
                "Code Conversion",
                "Documentation",
                "Testing and Validation",
                "Optimization"
            ],
            "secondary": [
                "Error Handling",
                "Performance Optimization",
                "Version Control"
            ],
            "all": [
                "Python",
                "Excel",
                "Requirement Analysis",
                "Code Conversion",
                "Documentation",
                "Testing and Validation",
                "Optimization",
                "Error Handling",
                "Performance Optimization",
                "Version Control"
            ]
        },
        "job_type": [
            "hybrid"
        ],
        "contact_person": "Mercy Ramya",
        "email": "Mercy@indusailabs.com",
        "jd": "From: Mercy Ramya, IndusAilabs mercyindusailabs.com@indusailabs.com Reply to: mercyindusailabs.com@indusailabs.com Title: Developer Standard III - Python Developer\nDuration: 8 Months \u2013 Long Term\nLocation: Washington, DC 20433 Hybrid Onsite: 4 Days per week onsite from Day1.\n\nThe Python Developer will be responsible for the following tasks:\n\nRequirement Analysis:\n\u00b7 Review and understand the existing Excel-based calculations.\n\u00b7 Identify the key functionalities and logic implemented in the Excel sheets.\n\u00b7 Collaborate with stakeholders to gather additional requirements and clarify any ambiguities.\n\nCode Conversion:\n\u00b7 Convert the Excel-based calculations to Python code, ensuring accuracy and consistency.\n\u00b7 Optimize the Python code for performance and scalability.\n\u00b7 Implement error handling and validation to ensure robustness.\n\nDocumentation:\n\u00b7 Document the existing Excel-based calculations, including formulas, macros, and data flows.\n\u00b7 Create comprehensive documentation for the Python code, including code comments, user guides, and technical specifications.\n\u00b7 Maintain an organized repository of all project documentation.\n\nTesting and Validation:\n\u00b7 Develop and execute test cases to validate the accuracy and performance of the Python code.\n\u00b7 Compare the results of the Python code with the original Excel calculations to ensure consistency.\n\u00b7 Address any discrepancies and refine the code as needed.\n\nOptimization and Best Practices:\n\u00b7 Identify and implement the most efficient methods for migrating calculations from Excel to Python.\n\u00b7 Follow best practices for coding, documentation, and version control.\n\u00b7 Provide recommendations for further improvements and optimizations.\n\nplease share strong Resumes to Mercy@indusailabs.com",
        "source": "Email",
        "date_posted": "2024-09-30 12:07:09-05:00",
        "unique_id": "19243e7cda8c5632",
        "emp_type": [
            "contract",
            "third party"
        ],
        "tag": "Python developer"
    }
]