[
    {
        "company": "United Software Group, Inc.",
        "job_title": "Senior Liferay Architect",
        "location": "USA",
        "full_location": {
            "city": "",
            "state": "",
            "country": "USA"
        },
        "job_details": {
            "employment_type": [
                "contract",
                "third party"
            ],
            "job_code": "",
            "experience_required": "5-8 years",
            "degree_required": "Not specified",
            "visa_sponsorship": "Not specified",
            "notice_period": "Not specified",
            "duration": "Not specified",
            "rate": "Not specified"
        },
        "skills": {
            "core": [
                "Liferay version 7.4",
                "AWS",
                "React",
                "Java"
            ],
            "primary": [
                "Java 8+",
                "Java EE 7/8",
                "Spring",
                "Spring Boot",
                "Hibernate"
            ],
            "secondary": [
                "HTML5",
                "CSS",
                "JavaScript",
                "jQuery",
                "Agile",
                "Scrum",
                "DevOps"
            ],
            "all": [
                "Liferay version 7.4",
                "AWS",
                "React",
                "Java",
                "Java 8+",
                "Java EE 7/8",
                "Spring",
                "Spring Boot",
                "Hibernate",
                "HTML5",
                "CSS",
                "JavaScript",
                "jQuery",
                "Agile",
                "Scrum",
                "DevOps"
            ],
            "with_experience": [
                "Java (5-8 years)",
                "Liferay Portal"
            ]
        },
        "job_type": [
            "remote"
        ],
        "contact_person": "Deepak Kumar",
        "email": "deepakv@usgrpinc.com",
        "jd": "From: Deepak kumar, USG deepakv@usgrpinc.com Reply to: deepakv@usgrpinc.com Hi,I'm Deepak Kumar, part of the United Software Group, Inc. We have a job opening with one of our clients, and we're checking if you're available for a job or if you know someone who might be interested. If you're interested, please send your resume to Deepakv@usgrpinc.com as soon as possible. Job Title: Senior Liferay ArchitectLocation: Remote Job Type: Contract Responsibilities:The following is essential:\u2022 Liferay version 7.4\u2022 AWS \u2022 React \u2022 JavaJob descriptionArchitect that have both back end and front end Liferay experienceDevelop and implement end-to-end solutions using Liferay PortalCollaborate with cross-functional teams to gather requirements and design efficient solutionsCreate and maintain Liferay themes, portlets, extensions, and other customizationsEnsure the performance, scalability, and security of Liferay applicationsTroubleshoot and resolve issues related to Liferay deploymentFollow Agile and Scrum methodologies for project executionConduct unit testing and provide support for integration and system testingCandidate Qualifications:Minimum 5-8 years of significant IT experience in Java/JavaEE technologiesStrong understanding of Liferay Portal and web portal technologyExcellent knowledge of Java 8+, Java EE 7/8, and related conceptsExperience with frameworks like Spring, Spring Boot, and HibernateFamiliarity with web development technologies such as HTML5, CSS, JavaScript, and jQueryWorking experience with Agile, Scrum, and DevOps processesStrong communication and problem-solving skills",
        "source": "Email",
        "date_posted": "2024-10-01 13:55:16-05:00",
        "unique_id": "19249e73bfd5e335",
        "emp_type": [
            "contract",
            "third party"
        ],
        "tag": "Java developer"
    }
]