[
    {
        "company": "Tek Inspirations LLC",
        "job_title": "Business System Analyst",
        "location": "Richardson, TX, USA",
        "full_location": {
            "city": "Richardson",
            "state": "TX",
            "country": "USA"
        },
        "job_details": {
            "employment_type": [
                "full-time",
                "contract",
                "third party"
            ],
            "job_code": "",
            "experience_required": "8 years",
            "degree_required": "Bachelor Degree",
            "visa_sponsorship": "Not specified",
            "notice_period": "Not specified",
            "duration": "Not specified",
            "rate": "Not specified"
        },
        "skills": {
            "core": [
                "Hive",
                "SQL",
                "Azure",
                "Hadoop",
                "Data Mapping",
                "Data Bricks",
                "Control M",
                "Jira",
                "Jenkins",
                "GIT"
            ],
            "primary": [
                "Systems Analysis",
                "Requirements analysis",
                "SDLC Methodology",
                "Optimized Waterfall",
                "Agile",
                "Scrum",
                "Iterative Development"
            ],
            "secondary": [
                "Problem solving",
                "Analytical thinking",
                "Oral communication",
                "Written communication",
                "Application Development",
                "Claims processing",
                "Mentoring"
            ],
            "all": [
                "Hive",
                "SQL",
                "Azure",
                "Hadoop",
                "Data Mapping",
                "Data Bricks",
                "Control M",
                "Jira",
                "Jenkins",
                "GIT",
                "Systems Analysis",
                "Requirements analysis",
                "SDLC Methodology",
                "Optimized Waterfall",
                "Agile",
                "Scrum",
                "Iterative Development",
                "Problem solving",
                "Analytical thinking",
                "Oral communication",
                "Written communication",
                "Application Development",
                "Claims processing",
                "Mentoring"
            ]
        },
        "job_type": [
            "hybrid"
        ],
        "contact_person": "Anju Pathak",
        "email": "anju.pathak@tekinspirations.com",
        "jd": "From: Anju Pathak, Tek Inspirations LLC anju.pathak@tekinspirations.com Reply to: anju.pathak@tekinspirations.com Job Description -These candidates must be local to Richardson TX or Chicago IL and able to work on site EX- BCBS/HCSC will be highly prefer!Need LinkedIn profile & Photo ID with submittal!Need only preferred third party consultants!Need Strong healthcare background Business System Analyst 6+ monthsHybrid - Richardson TX or Chicago IL Resource need Hive, SQL, Azure, Hadoop, Data Mapping skillset and Data Bricks, Control M, Jira, Jenkins, GITJob Purpose: This position is responsible supporting enhancements and new capabilities to an existing, critical based business application within BDS Finance applications space. As a systems analyst, it is required you bring strong experience of performing Systems Analysis for various projects and build a backlog of systems requirements that can be assigned to various developers. You are for also responsible for ensuring reviews of the requirements, designs, code and help plan SIT and UAT testing as well as releases. You will be working closely with the business team comprising of business analysts, business owners, QA team as well as IT team members like Applications Architects, Developers, product and project managers and other team members.Required Job QualificationsBachelor Degree 8 years Information Technology experience.Knowledge of code deployments and SIT / UAT across Test, Cycle and Production environmentsInter-testing with various applicationsExposure to integration with various applicationsRequirements analysis, Systems Analysis and Developing Logical & Physical designsSDLC Methodology/ Optimized Waterfall. Exposure to Agile / Scrum / Iterative DevelopmentProblem solving and analytical thinkingStrong oral/written communication skillsDeep Application Development experience on mainframe sideKnowledge of Claims processing, Claims Applications and ComponentsAbility to work in fast paced environment with concurrent projectsMentor and guide developers and ensure delivery with high quality for all the projects you are assigned to?",
        "source": "Email",
        "date_posted": "2024-10-01 14:29:18-05:00",
        "unique_id": "192498e8f3b55493",
        "emp_type": [
            "full-time",
            "contract",
            "third party"
        ],
        "tag": "Business Analyst"
    }
]