[
    {
        "company": "Rwaltz",
        "job_title": "Technical Project Manager \u2013 Data Engineering",
        "location": "Beverly Hills, CA, USA",
        "full_location": {
            "city": "Beverly Hills",
            "state": "CA",
            "country": "USA"
        },
        "job_details": {
            "employment_type": [
                "contract",
                "third party"
            ],
            "job_code": "",
            "experience_required": "10-17 years",
            "degree_required": "Not specified",
            "visa_sponsorship": "Not specified",
            "notice_period": "Not specified",
            "duration": "Long-Term",
            "rate": "Not specified"
        },
        "skills": {
            "core": [
                "Data Engineering",
                "Project Management",
                "AWS",
                "Scrum"
            ],
            "primary": [
                "Data Warehousing",
                "Redshift",
                "Glue",
                "Databricks",
                "dbt"
            ],
            "secondary": [
                "Retail",
                "E-commerce",
                "Analytics",
                "Stakeholder Management",
                "Communication"
            ],
            "all": [
                "Data Engineering",
                "Project Management",
                "AWS",
                "Scrum",
                "Data Warehousing",
                "Redshift",
                "Glue",
                "Databricks",
                "dbt",
                "Retail",
                "E-commerce",
                "Analytics",
                "Stakeholder Management",
                "Communication"
            ]
        },
        "job_type": [
            "onsite",
            "hybrid"
        ],
        "contact_person": "Hannah Rwaltz",
        "email": "hannah@rwaltz.com",
        "jd": "From: Hannah, Rwaltz hannah@rwaltz.com Reply to: hannah@rwaltz.com Job Title: Technical Project Manager \u2013 Data Engineering Location: Beverly Hills, CA (Onsite 4 days per week, Hybrid Model) Job Type: Long-Term Contract Total Experience Range- 10 to 17 years max (with recent 4 years experience in Data Engineering) Key Expectations: We are seeking an experienced Data Engineering Project Manager with a strong background in retail e-commerce, data engineering, and analytics. The ideal candidate will be a Certified Scrum Master and proficient in data warehousing concepts, data engineering tools, and technologies on the AWS platform (e.g., Redshift, Glue), as well as having experience with dbt and Databricks. Key Responsibilities: \u2022 Manage and lead end-to-end data engineering projects with a focus on AWS technologies (Redshift, Glue) and Databricks. \u2022 Collaborate with stakeholders to understand data requirements, prioritize the roadmap, and make trade-off decisions. \u2022 Drive the delivery of data engineering solutions, ensuring efficient execution and high-quality output. \u2022 Facilitate Scrum processes and coach team members on development and implementation skills. \u2022 Foster a collaborative environment across multiple stakeholder groups, including product management and business teams. Key Qualifications: \u2022 4+ years of Data Project Management experience focused on data engineering and analytics. \u2022 Expertise in AWS data and analytics services (including but not limited to Redshift, Glue, S3), Databricks, and experience with dbt for transformation projects. \u2022 Strong knowledge of retail and e-commerce environments. \u2022 Certified Scrum Master preferred. \u2022 Proven track record in stakeholder management and successful project delivery. \u2022 Excellent communication skills, both written and verbal.",
        "source": "Email",
        "date_posted": "2024-10-01 07:53:10-05:00",
        "unique_id": "1924823c8eae1bf6",
        "emp_type": [
            "contract",
            "third party"
        ],
        "tag": "Project Manager"
    }
]