[
    {
        "company": "KK Software Associates",
        "job_title": "Informatica CDI Cloud Data Integration PLSQL",
        "location": "Phoenix, AZ, USA",
        "full_location": {
            "city": "Phoenix",
            "state": "AZ",
            "country": "USA"
        },
        "job_details": {
            "employment_type": [
                "third party"
            ],
            "job_code": "",
            "experience_required": "10 & Above",
            "degree_required": "Not specified",
            "visa_sponsorship": "Not specified",
            "notice_period": "Not specified",
            "duration": "Not specified",
            "rate": "Not specified"
        },
        "skills": {
            "core": [
                "Oracle PL/SQL",
                "Informatica Cloud (IICS)",
                "Data Warehouse",
                "Data Marts",
                "Star Schema"
            ],
            "primary": [
                "ETL",
                "Batch Script",
                "Shell Script",
                "Python"
            ],
            "secondary": [
                "Agile",
                "Scrum",
                "Jira",
                "Git",
                "SVN",
                "Liquibase"
            ],
            "all": [
                "Oracle PL/SQL",
                "Informatica Cloud (IICS)",
                "Data Warehouse",
                "Data Marts",
                "Star Schema",
                "ETL",
                "Batch Script",
                "Shell Script",
                "Python",
                "Agile",
                "Scrum",
                "Jira",
                "Git",
                "SVN",
                "Liquibase"
            ],
            "with_experience": [
                "Oracle PL/SQL (10+ years)",
                "Informatica Cloud (IICS)"
            ]
        },
        "job_type": [],
        "contact_person": "B. Vijaya Lakshmi",
        "email": "vvijayalakshmi.b@kksoftwareassociates.com",
        "jd": "From: Vijaya, KK Software vvijayalakshmi.b@kksoftwareassociates.com Reply to: vvijayalakshmi.b@kksoftwareassociates.com Role name:Informatica CDI Cloud Data Integration PLSQLRole Description:In this role you will serve as a senior dedicated technical resource responsible for Oracle PL/SQL development for our Data Warehouse running on a Linux basedOracle 11g RAC 2 node cluster. The Data Warehouse is currently under development and you will be an integral part of its design and implementation.You will support key strategic initiatives, including the integration of new lines of business, design and implementation of data marts and subject areas,and key decisions around the future of the data warehouse. You will also be involved with the implementation of new reporting tools, new ETL routines and other projectsthat are core to developing and enhancing the data warehouse environment. Essential Job Functions:1. Utilize excellent hands-on PL/SQL skills to design and implement data warehouse subject areas.2. Develop high performing extraction, transformation and loading (ETL) routines for loading data from our production database into the data warehouse.3. Create PL/SQL that performs well with large data sets, is written to scale for future growth and adheres to business rules.4. Effectively integrate new lines of business into the DW requiring the addition of new data sources into existing tables and data marts.5. Share knowledge and PL/SQL expertise and mentor team members in the design of efficient reporting queries.6. Team with engineering, IT and business stakeholders to support projects of varying complexity; gather reporting and data warehousing requirements, evaluate best approach and propose solutions.Competencies:Informatica CDI (Cloud Data Integration), PL/SQLExperience (Years):10 & AboveEssential Skills:\u2022 Primary Skills:o Oracle PL/SQL (ETL) - Musto Informatica Cloud (IICS)o Scripting Languages: Batch Script, Shell Script, Pythono Strong Datawarehouse, Datamarts,o Knowledge in Star Schema\u2022 Additional Skills:o Agile, Scrum, Jira, Git, SVN, LiquibaseDesirable Skills:\u2022 Primary Skills:o Oracle PL/SQL (ETL) - Musto Informatica Cloud (IICS)o Scripting Languages: Batch Script, Shell Script, Pythono Strong Datawarehouse, Datamarts,o Knowledge in Star Schema\u2022 Additional Skills:o Agile, Scrum, Jira, Git, SVN, LiquibaseCountry:United StatesBranch | City | Location:TCS - Phoenix,AZMaricopaMaricopa, AZ Regards,B. Vijaya LakshmiSr. IT RecruiterDesk Number: 46934349968751 Collin-McKinney Pkwy, #1302, McKinney,TX 75070555 Metro Place North, Suite#100 ,Dublin, OH-43017Email Id: vijayalakshmi.b@kksoftwareassociates.comURL: www.kksoftwareassociates.com",
        "source": "Email",
        "date_posted": "2024-10-01 16:00:29-05:00",
        "unique_id": "19249e1e61f4b914",
        "emp_type": [
            "third party"
        ],
        "tag": "Oracle DBA"
    }
]