[
    {
        "company": "Prospect Infosystem",
        "job_title": "SQL Server Administrator",
        "location": "Raleigh, NC, USA",
        "full_location": {
            "city": "Raleigh",
            "state": "NC",
            "country": "USA"
        },
        "job_details": {
            "employment_type": [
                "full-time",
                "third party"
            ],
            "job_code": "748082",
            "experience_required": "8+ years",
            "degree_required": "Not specified",
            "visa_sponsorship": "Not specified",
            "notice_period": "Not specified",
            "duration": "Not specified",
            "rate": "Not specified"
        },
        "skills": {
            "core": [
                "SQL Server administration",
                "SQL database monitoring",
                "performance tuning",
                "troubleshooting",
                "Backups restores",
                "High Availability",
                "Installation and configuration of SQL 2014, 2016 and 2019",
                "Configuration of SSIS and SSRS",
                "SQL tuning",
                "Data conversion",
                "Database maintenance",
                "Database backup and recovery",
                "Database Mirroring",
                "log shipping",
                "SQL transactional Replication",
                "Supporting MS SQL databases in Microsoft clustered environments"
            ],
            "primary": [
                "Export/Import Replication",
                "Creating Linked Server Objects",
                "Database upgrade",
                "Patching & Refresh",
                "Setup and improve maintenance processes",
                "Actively monitor database environment",
                "Production On-Call Support"
            ],
            "secondary": [
                "Windows administration",
                "PowerShell",
                "Visual Studio (SQL Server Data Tools)",
                "Experience in Spotlight",
                "SQL 2016 Availability groups"
            ],
            "all": [
                "SQL Server administration",
                "SQL database monitoring",
                "performance tuning",
                "troubleshooting",
                "Backups restores",
                "High Availability",
                "Installation and configuration of SQL 2014, 2016 and 2019",
                "Configuration of SSIS and SSRS",
                "SQL tuning",
                "Data conversion",
                "Database maintenance",
                "Database backup and recovery",
                "Database Mirroring",
                "log shipping",
                "SQL transactional Replication",
                "Supporting MS SQL databases in Microsoft clustered environments",
                "Export/Import Replication",
                "Creating Linked Server Objects",
                "Database upgrade",
                "Patching & Refresh",
                "Setup and improve maintenance processes",
                "Actively monitor database environment",
                "Production On-Call Support",
                "Windows administration",
                "PowerShell",
                "Visual Studio (SQL Server Data Tools)",
                "Experience in Spotlight",
                "SQL 2016 Availability groups"
            ]
        },
        "job_type": [
            "hybrid"
        ],
        "contact_person": "Abhishek",
        "email": "abhishek@prospectinfosystem.com",
        "jd": "Hello Greetings,Myself Abhishek from Prospect InfosystemsPlease review the requirement below and send an updated resume to my attention as soon as possible so that we can support your candidacy for the role.I sincerely appreciate you forwarding this requirement to anyone you know who might be interested in the event of your absence SQL Server Administrator (748082)Raleigh,NC (Hybrid)This role requires 8+ years' demonstrated experience working as a SQL Server administrator; Strong understanding of SQL database monitoring and performance tuning; Experience in troubleshooting and resolving database problems;Experience with following:o Backups restores and High Availability (Always on),o Installation and configuration of SQL 2014, 2016 and 2019 Standard and Enterpriseo Configuration of SSIS and SSRS,o Work experience on SSIS and SSRS to create and deploys packages and Reportso Database upgrade, Patching & Refresho SQL tuning, Data conversion / Migration, Supporting Enterprise Systemso Database maintenance, Database backup and recoveryo Setup and constantly improve maintenance, operational and monitoring processeso Export/Import Replication, maintaining back up jobs, Creating Linked Server Objectso Experience in Database Mirroring, log shipping and DR procedureso Experience in SQL transactional Replicationo Supporting MS SQL databases in Microsoft clustered environmentso SQL 2016 Availability groups is a pluso Experience in Spotlight is pluso Windows administration, PowerShell, Visual Studio (SQL Server Data Tools) is a plusJob duties:o SQL Server performance analysis, tuning, capacity planning/forecast, security, and designo Collaborate with DBAs and Developers in troubleshooting database and application errorso Actively monitor the database environment to ensure optimal performance and to prevent production issues.o Open and Follow-up on Service Request tickets to quickly resolve problems.o Perform Production On-Call Support on rotational basis - including Off-Hours and Weekend SkillRequired / DesiredAmount of ExperienceDemonstrated experience working as a SQL Server administratorRequired Strong understanding of SQL database monitoring and performance tuningRequired Experience in troubleshooting and resolving database problemsRequired Experience with Backups restores and High Availability (Always on),Required Experience with Installation and configuration of SQL 2014, 2016 and 2019 Standard and EnterpriseRequired Configuration of and work experience on SSIS and SSRS to create and deploys packages and ReportsRequired SQL tuning, Data conversion / Migration, Supporting Enterprise SystemsRequired Supporting MS SQL databases in Microsoft clustered environmentsRequired Experience in SQL transactional ReplicationRequired Windows administration, PowerShell, Visual Studio (SQL Server Data Tools) is a plusDesired Experience in Spotlight is plusDesired SQL 2016 Availability groups is a plusDesired",
        "source": "Email",
        "date_posted": "2024-09-30 15:40:21-05:00",
        "unique_id": "19244d5d99da6772",
        "emp_type": [
            "full-time",
            "third party"
        ],
        "tag": "DB Admin"
    }
]