[
    {
        "company": "Cohesive Technologies",
        "job_title": "Java Fullstack Developer with AWS Cloud",
        "location": "Seattle, WA, USA",
        "full_location": {
            "city": "Seattle",
            "state": "WA",
            "country": "USA"
        },
        "job_details": {
            "employment_type": [
                "full-time",
                "third party"
            ],
            "job_code": "",
            "experience_required": "10+ years",
            "degree_required": "Bachelor's degree in Computer Science, Software Engineering, or a related field.",
            "visa_sponsorship": "No visa sponsorship",
            "notice_period": "Not specified",
            "duration": "6 Months+",
            "rate": "Not specified"
        },
        "skills": {
            "core": [
                "Java",
                "AWS",
                "Spring",
                "JavaScript"
            ],
            "primary": [
                "EC2",
                "S3",
                "RDS",
                "Lambda",
                "ECS far gate",
                "DDB",
                "API Gateway",
                "Data structure",
                "Algorithms"
            ],
            "secondary": [
                "Problem solving",
                "Good Data & Database skills"
            ],
            "all": [
                "Java",
                "AWS",
                "Spring",
                "JavaScript",
                "EC2",
                "S3",
                "RDS",
                "Lambda",
                "ECS far gate",
                "DDB",
                "API Gateway",
                "Data structure",
                "Algorithms",
                "Problem solving",
                "Good Data & Database skills"
            ]
        },
        "job_type": [
            "onsite"
        ],
        "contact_person": "Satin Harper",
        "email": "satinh@cohetech.com",
        "jd": "From: Satin, Cohesive Technologies satinh@cohetech.com Reply to: satinh@cohetech.com Cohesive Technologies is a global IT Services & Solutions company providing IT Staffing Services and Application Development Services necessary for technology leaders to deliver business value. We help our people and clients succeed by leveraging our expertise, deep industry and market knowledge, proprietary assessment tools and techniques, and project delivery methodologies. Through relationships with thousands of specialized professionals, we bring an unparalleled ability to match talent with opportunities by assessing, recruiting, developing and engaging the best and brightest people for our clients. We combine broad geographic presence, world-class solutions and a tailored, consultative approach to help our people and clients achieve higher performance and outstanding results. Position: Java Fullstack Developer with AWS Cloud Location: Seattle, WA (all 5 days a week onsite is must) Duration: 6 Months+ Exp : 13+ Years Note : NO GC Visa's or USC on C2C Updated JD from Client : Qualifications: Bachelor's degree in Computer Science, Software Engineering, or a related field. 10+ years of experience developing web applications using AWS technologies (EC2, S3, RDS, Lambda, etc.). Strong coding skills AWS cloud \u2013 ECS far gate, S3, DDB, API Gateway Good Data & Database skills. Java, J2EE, Spring, Java script Problem solving \u2013 Data structure, Algorithms Cohesive Technologies is an equal access/equal opportunity employer and does not discriminate on the basis of age, color, disability, marital status, national origin, race, religion, sex, sexual orientation, veteran status or any other classification prescribed by applicable law. Thanks, Satin Harper Alpharetta, GA 30022 Phone: (470) 668- 2233 Email : satinh@cohetech.com www.cohetech.com",
        "source": "Email",
        "date_posted": "2024-09-30 12:14:28-05:00",
        "unique_id": "192445bb2bc05676",
        "emp_type": [
            "full-time",
            "third party"
        ],
        "tag": "Java developer"
    }
]