[
    {
        "company": "Smart Source Technologies",
        "job_title": "OCM Business Analyst",
        "location": "Foster City, CA, USA",
        "full_location": {
            "city": "Foster City",
            "state": "CA",
            "country": "USA"
        },
        "job_details": {
            "employment_type": [
                "contract",
                "third party"
            ],
            "job_code": "",
            "experience_required": "5+ years",
            "degree_required": "BA or BS required, degree in business management/science/social science/engineering or IT",
            "visa_sponsorship": "Not specified",
            "notice_period": "Not specified",
            "duration": "Not specified",
            "rate": "$60/hour"
        },
        "skills": {
            "core": [
                "Organizational Change Management",
                "GxP documentation",
                "SAP",
                "Change Management Certification"
            ],
            "primary": [
                "Change management role in life sciences",
                "Large-scale organizational change efforts",
                "Large scale SAP Implementations",
                "Change management principles",
                "Systems deployment",
                "Project management"
            ],
            "secondary": [
                "Ability to balance multiple priorities",
                "Fast-paced environment",
                "High quality results"
            ],
            "all": [
                "Organizational Change Management",
                "GxP documentation",
                "SAP",
                "Change Management Certification",
                "Change management role in life sciences",
                "Large-scale organizational change efforts",
                "Large scale SAP Implementations",
                "Change management principles",
                "Systems deployment",
                "Project management",
                "Ability to balance multiple priorities",
                "Fast-paced environment",
                "High quality results"
            ]
        },
        "job_type": [
            "hybrid"
        ],
        "contact_person": "Salil",
        "email": "salil.s@smartsourcetec.com",
        "jd": "From: Salil, Smart Source Technologies salil.s@smartsourcetec.com Reply to: salil.s@smartsourcetec.com Role :- OCM Business Analyst Location :- Foster city, CA \u2013 Hybrid Rate- $60/h on C2C Must Share Passport Number. Must have \u2013 The ideal candidate will have a strong understanding of Organizational Change Management principles and possess GxP documentation skill too. We are seeking a Business Analyst with a background in the pharmaceutical industry to join our dynamic team. Need hands on change management experience with SAP. NEED BELOW 6 YRS PROFILE Requirements: 5+ years of experience in change management role in the life sciences and/healthcare or biopharma, industry preferred Experience with large-scale organizational change efforts Experience with large scale SAP Implementations A solid understanding of how people go through the change process Experience and knowledge of change management principles, methodologies and tools Experience in systems deployment, implementation, and lifecycle management, Change Management Certification is preferred (PROSCI, CCMP) BA or BS required, degree in business management/science/social science/engineering or IT Strong project management or Organizational effectiveness experience Ability to balance multiple priorities in a fast-paced environment while delivering on-time, high quality results",
        "source": "Email",
        "date_posted": "2024-10-01 09:14:54-05:00",
        "unique_id": "1924870c164687e5",
        "emp_type": [
            "contract",
            "third party"
        ],
        "tag": "Business Analyst"
    }
]