[
    {
        "company": "SIRI INFO SOLUTIONS INC",
        "job_title": "Google Visualization API with Grafana Developer",
        "location": "Charlotte, NC, USA",
        "full_location": {
            "city": "Charlotte",
            "state": "NC",
            "country": "USA"
        },
        "job_details": {
            "employment_type": [
                "full-time",
                "third party"
            ],
            "job_code": "",
            "experience_required": "10+ years",
            "degree_required": "Not specified",
            "visa_sponsorship": "Not specified",
            "notice_period": "Not specified",
            "duration": "Not specified",
            "rate": "Not specified"
        },
        "skills": {
            "core": [
                "Google Monitoring Metrics collection",
                "PromQL",
                "Grafana",
                "HTML"
            ],
            "primary": [],
            "secondary": [],
            "all": [
                "Google Monitoring Metrics collection",
                "PromQL",
                "Grafana",
                "HTML"
            ],
            "with_experience": [
                "Google Monitoring Metrics collection",
                "PromQL",
                "Grafana",
                "HTML"
            ]
        },
        "job_type": [
            "onsite"
        ],
        "contact_person": "Dhiraj Kumar",
        "email": "dhiraj@siriinfo.com",
        "jd": "From: Dhiraj Kumar, SIRI INFO SOLUTIONS INC dhiraj@siriinfo.com Reply to: dhiraj@siriinfo.com Job title: Google Visualization API with Grafana Developer Work Location: Charlotte, NC 28202 (Onsite) Minimum years of experience: overall 10+ Years candidate needed. Must Have: Experience with Google Monitoring Metrics collection. Experience with PromQL (Prometheus Query Language) Experience with Grafana Experience with HTML to leverage visualization in Grafana Candidate should have good communication skills. Kind Regards, Dhiraj Kumar | Lead Recruiter SIRI INFO SOLUTIONS INC Email id : dhiraj@siriinfo.com",
        "source": "Email",
        "date_posted": "2024-10-01 09:35:36-05:00",
        "unique_id": "19248829ed0f1ec6",
        "emp_type": [
            "full-time",
            "third party"
        ],
        "tag": "GCP Data Engineer"
    }
]