[
    {
        "company": "INNOZA TECH LLC",
        "job_title": "Business Analyst- Expert",
        "location": "USA",
        "full_location": {
            "city": "",
            "state": "",
            "country": "USA"
        },
        "job_details": {
            "employment_type": [
                "contract",
                "third party"
            ],
            "job_code": "742218",
            "experience_required": "10+ years",
            "degree_required": "Not specified",
            "visa_sponsorship": "Not specified",
            "notice_period": "Not specified",
            "duration": "12 Months",
            "rate": "Not specified"
        },
        "skills": {
            "core": [
                "business system techniques",
                "business process design",
                "software development lifecycle",
                "Agile",
                "Waterfall",
                "Microsoft Office",
                "SharePoint",
                "Visio"
            ],
            "primary": [
                "requirements gathering",
                "user acceptance testing",
                "test plans",
                "test scenarios",
                "test cases",
                "facilitating meetings",
                "analytical skills",
                "communication skills"
            ],
            "secondary": [
                "Jira",
                "OpenText Application Lifecycle Management (ALM)",
                "Quality Center (QC)",
                "procurement documents",
                "vendor evaluation",
                "Child Support programs",
                "creative thinking",
                "problem-solving"
            ],
            "all": [
                "business system techniques",
                "business process design",
                "software development lifecycle",
                "Agile",
                "Waterfall",
                "Microsoft Office",
                "SharePoint",
                "Visio",
                "requirements gathering",
                "user acceptance testing",
                "test plans",
                "test scenarios",
                "test cases",
                "facilitating meetings",
                "analytical skills",
                "communication skills",
                "Jira",
                "OpenText Application Lifecycle Management (ALM)",
                "Quality Center (QC)",
                "procurement documents",
                "vendor evaluation",
                "Child Support programs",
                "creative thinking",
                "problem-solving"
            ]
        },
        "job_type": [
            "remote"
        ],
        "contact_person": "Nagajyoti",
        "email": "njyoti@innozatech.com",
        "jd": "From: Nagajyoti, INNOZA TECH LLC. njyoti@innozatech.com Reply to: njyoti@innozatech.com Position: Business Analyst- Expert (742218)Location: REMOTE Duration: 12 MonthsClient: NC-DHHSNeed 10+ years candidatePrimary tasks include:\u2022 Identify and document stakeholders, data flows, and current and future state process flows.\u2022 Gather, document, validate, and maintain business, functional, and technical/non-functional solution requirements needed as input to market analysis, software procurement, and solution development processes.\u2022 Translate client's system requirements into agile themes, product backlogs, epics, user stories or detailed business requirement documents and use cases depending on development approach.\u2022 Work with Product Owner and business subject matter experts to groom user stories and define acceptance criteria to ensure that stories meet the team-defined definition of ready.\u2022 Work with vendor or internal developers and testers to confirm the functionality meets the story's acceptance criteria.\u2022 Participate in gap analysis and detailed requirement development efforts.\u2022 Assist the Business/Product Owner in planning, preparing for and conducting user acceptance testing, including developing test scenarios and test cases.\u2022 Perform requirements traceability throughout the project lifecycle to support user acceptance testing and production rollout.\u2022 Assist in the development procurement documents such as Requests for Proposals, Requests for Quotes, and Requests for Information.\u2022 Support vendor proposal evaluation efforts and assist in documenting evaluation results.\u2022 Support process improvement initiatives\u2022 Assist market research for proposed automation projects.\u2022 Facilitate options analysis and support business case development for proposed automation projects.\u2022 Document meeting agendas and notes.\u2022 Facilitate meetings, especially those related to requirements gathering and UAT.\u2022 Support project manager in maintaining project artifacts and developing status reports.\u2022 Support the development of surveys, assessment tools, project methodologies, policies and procedures\u2022 Maintain SharePoint site for each assigned project\u2022 Perform other analysis and project support tasks as assigned.SkillExtensive knowledge of business system techniques and testing methodologies for software developmentProven experience with business process design, definition and/or re-design.Solid understanding of software development lifecycle and Agile, Waterfall and Hybrid development frameworks, including BA roleHigh proficiency in Microsoft Office products (MS Word, Excel, PowerPoint), SharePoint and VisioKnowledge creating context, workflow, data flow, and functional decomposition diagramsExperience in planning & coordinating user acceptance testing including developing and executing test plans, scenarios, and test casesExperience facilitating small to large meetingsExperience with Child Support programsDemonstrable analytical skills and attention to detailExcellent verbal and written communication skillsExcellent creative thinking and problem-solving skillsWorking knowledge of Jira and OpenText Application Lifecycle Management (ALM) and Quality Center (QC)Experience in development of procurement related documents including RFP, evaluation criteria as well as vendor evaluationExperience working for County, State, and/or Federal government",
        "source": "Email",
        "date_posted": "2024-09-30 09:15:18-05:00",
        "unique_id": "1924348bc4b2346f",
        "emp_type": [
            "contract",
            "third party"
        ],
        "tag": "Business Analyst"
    }
]