[
    {
        "company": "Paypal",
        "job_title": "Software Engineer(Java and C++)",
        "location": "San Jose, CA, USA",
        "full_location": {
            "city": "San Jose",
            "state": "CA",
            "country": "USA"
        },
        "job_details": {
            "employment_type": [
                "full-time",
                "third party"
            ],
            "job_code": "",
            "experience_required": "2-4 years",
            "degree_required": "Not specified",
            "visa_sponsorship": "No visa sponsorship",
            "notice_period": "Not specified",
            "duration": "Long Term",
            "rate": "Not specified"
        },
        "skills": {
            "core": [
                "Java",
                "C++",
                "RDBMS",
                "SQL"
            ],
            "primary": [
                "Cassandra",
                "OOAD",
                "architectural patterns",
                "design patterns",
                "UNIX",
                "Shell scripting",
                "Perl",
                "Python",
                "Agile",
                "Scrum"
            ],
            "secondary": [
                "Web Technologies",
                "GIT",
                "Github",
                "strong verbal communication",
                "strong written communication"
            ],
            "all": [
                "Java",
                "C++",
                "RDBMS",
                "SQL",
                "Cassandra",
                "OOAD",
                "architectural patterns",
                "design patterns",
                "UNIX",
                "Shell scripting",
                "Perl",
                "Python",
                "Agile",
                "Scrum",
                "Web Technologies",
                "GIT",
                "Github",
                "strong verbal communication",
                "strong written communication"
            ]
        },
        "job_type": [
            "hybrid"
        ],
        "contact_person": "Amit Panthri",
        "email": "ap@susinfotek.com",
        "jd": "From: AMIT, SUS ap@susinfotek.com Reply to: ap@susinfotek.com Position: Software Engineer(Java and C++)Location: Hybrid San jose, CADuration: Long TermClient: Paypal Phone and Skype No h1b We are looking for Diverse candidates with 2-4 years of experience. Previous PayPal experience is a big plus. SkillsExperience in Java and C++.Experience in RDBMS and SQL. Experience in Cassandra is an added advantage.Excellent knowledge in practicing OOAD, architectural and design patterns.Excellent in UNIX, Shell scripting, knowledge of Perl/Python is an added advantage.Strong verbal and written communication skills.Knowledge of Web Technologies.Familiarity with version control tools like GIT/Github.Should have participated in, and be familiar with, Agile (Scrum) project methodology and practices Regards,Amit PanthriSr. Technical RecruiterE: ap@susinfotek.com",
        "source": "Email",
        "date_posted": "2024-09-30 16:07:42-05:00",
        "unique_id": "19244ebf15ab144c",
        "emp_type": [
            "full-time",
            "third party"
        ],
        "tag": "Java developer"
    }
]