[
    {
        "company": "TECH BRAND STAFFING",
        "job_title": "Business Analyst 4 (PSoft)",
        "location": "Richmond, VA, USA",
        "full_location": {
            "city": "Richmond",
            "state": "VA",
            "country": "USA"
        },
        "job_details": {
            "employment_type": [
                "contract",
                "third party"
            ],
            "job_code": "JPC - 693",
            "experience_required": "5 years",
            "degree_required": "Not specified",
            "visa_sponsorship": "Not specified",
            "notice_period": "Not specified",
            "duration": "12 Months",
            "rate": "Not specified"
        },
        "skills": {
            "core": [
                "PeopleSoft Financials",
                "system design",
                "business requirements gathering",
                "test plans",
                "user acceptance testing"
            ],
            "primary": [
                "process improvement",
                "quality assurance validation",
                "regression testing",
                "workflow documentation",
                "training materials development"
            ],
            "secondary": [
                "General Ledger",
                "Accounts Payable",
                "Purchasing",
                "Accounts Receivable",
                "Billing",
                "Asset Management",
                "Lease Administration",
                "COV projects"
            ],
            "all": [
                "PeopleSoft Financials",
                "system design",
                "business requirements gathering",
                "test plans",
                "user acceptance testing",
                "process improvement",
                "quality assurance validation",
                "regression testing",
                "workflow documentation",
                "training materials development",
                "General Ledger",
                "Accounts Payable",
                "Purchasing",
                "Accounts Receivable",
                "Billing",
                "Asset Management",
                "Lease Administration",
                "COV projects"
            ]
        },
        "job_type": [
            "hybrid"
        ],
        "contact_person": "Shaik Mannan",
        "email": "info@techbrandstaffing.com",
        "jd": "From: TECH BRAND STAFFING, Shaik Mannan info@techbrandstaffing.com Reply to: info@techbrandstaffing.com Must have a \"PeopleSoft Financials\" Business Analyst Job CodeJPC - 693Job TitleBusiness Analyst 4 (PSoft) (747183)Client Job IDN/ALocationN/A, N/ADurationN/APriorityHighPrimary Skillstest,business and technical# Of Positions1Job DescriptionHybrid/Local PeopleSoft Financials BA with BPR, UAT/regression testing, training, G, AP, Purchasing, AR, Billing, Asset Management, Lease Administration experienceLocation: Richmond, VA Duration: 12 Months Skills:Experience in system design and development, with a focus on process improvement and business and technical requirements gathering Required 5 YearsExperience developing test plans, use cases, and performing quality assurance validation, user acceptance testing, and regression testing Required 5 YearsExperience with PeopleSoft Financials Required 2 YearsExperience documenting workflow processes Required 2 YearsExperience in the development of training materials and conducting user training Required 5 YearsSpecific experience with General Ledger, Accounts Payable, Purchasing (functionality limited to storing POs and Receipts for matching), Accounts Rec Highly desired 2 YearsProject experience with COV projects. Highly desired 1 YearsDescription:Mgr reserves the option to ask for follow up IN PERSON IV is they deem necessaryABOUT THE ROLEThe Virginia Dept. of General Services (DGS), Information Systems & Services (ISS) is looking for a Business Analyst with documentation and testing experience in support of PeopleSoft Financials systems.This position is primarily responsible for business analysis, functional/technical documentation and test planning of DGS\u2019 PeopleSoft Financials system utilized by DGS Fiscal Services. This person will work closely with a small team of technical analysts and financial officers as DGS works to streamline both the security and the operations of its PeopleSoft Financials system. The selected candidate in this position will work closely with stakeholders, Fiscal Subject Matter Experts (SMEs), and DGS, Information Systems and Services (ISS) development teams. The Business Analyst will report to the ISS Project manager. This position should expect to work 40 hours per week.Required Experience, Knowledge, Skills, and Abilities:-Experience in system design and development, with a focus on process improvement and business and technical requirements gathering-Experience with PeopleSoft Financials-Experience documenting workflow processes-Experience developing test plans, use cases, and performing quality assurance validation, user acceptance testing, and regression testing-Experience in the development of training materials and conducting user training-Strong interpersonal and communication skills \u2013The successful candidate should be a self-starter with the ability to drive work to completion.Preferred Experience:-Specific experience with General Ledger, Accounts Payable, Purchasing (functionality limited to storing POs and Receipts for matching), Accounts Receivable, Billing and Asset Management for Lease Administration.-Project experience with COV projects.Specific Tasks may include:-Documenting changes to PeopleSoft processes-Documenting PeopleSoft configurations-Documenting business workflows related to PeopleSoft-Preparing user and technical documentation-Developing test plans-Working with customer SMEs and project teams to develop business requirements in response to requests for systems enhancements, modifications, and newly identified business initiatives.-Working with ISS technical team and vendors to ensure requirements are incorporated into systems design and testing.-Developing business requirements documentation and flow diagrams \u2013 this work may expand into technical requirements gathering, design, and systems documentation.-Actively participating in functional and systems integration unit testing; creating use case scenarios, test plans, and testing results.-Assisting with testing and track testing results-Developing and presenting training to Fiscal Services and agency users-Meeting regularly with customer and project teams and regularly demonstrating quality work output.-Keeping the Business Owner and ISS technical team informed of key issues that may impact project implementation.Please note we are looking for a self-motivated and proactiveBusiness Analyst who is detail oriented. SkillRequiredyears reqYears UsedExperience in system design and development, with a focus on process improvement and business and technical requirements gatheringRequired5 Experience developing test plans, use cases, and performing quality assurance validation, user acceptance testing, and regression testingRequired5 Experience with PeopleSoft FinancialsRequired2 Experience documenting workflow processesRequired2 Experience in the development of training materials and conducting user trainingRequired5 Specific experience with General Ledger, Accounts Payable, Purchasing (functionality limited to storing POs and Receipts for matching), Accounts RecHighly desired2 Project experience with COV projects.Highly desired1 Thanks,",
        "source": "Email",
        "date_posted": "2024-10-01 15:04:00-05:00",
        "unique_id": "19249af1aa1c7630",
        "emp_type": [
            "contract",
            "third party"
        ],
        "tag": "Business Analyst"
    }
]