[
    {
        "company": "Visionsoft International Inc",
        "job_title": "SQL Server Administrator",
        "location": "USA",
        "full_location": {
            "city": "",
            "state": "",
            "country": "USA"
        },
        "job_details": {
            "employment_type": [
                "full-time",
                "third party"
            ],
            "job_code": "",
            "experience_required": "7 years",
            "degree_required": "Not specified",
            "visa_sponsorship": "Not specified",
            "notice_period": "Not specified",
            "duration": "Not specified",
            "rate": "Not specified"
        },
        "skills": {
            "core": [
                "SQL Server administration",
                "SQL database monitoring",
                "performance tuning",
                "troubleshooting",
                "backups",
                "high availability",
                "installation",
                "configuration",
                "SSIS",
                "SSRS",
                "SQL tuning",
                "data conversion",
                "migration",
                "supporting enterprise systems",
                "SQL transactional replication"
            ],
            "primary": [
                "Windows administration",
                "PowerShell",
                "Visual Studio (SQL Server Data Tools)"
            ],
            "secondary": [
                "Spotlight",
                "SQL 2016 Availability groups"
            ],
            "all": [
                "SQL Server administration",
                "SQL database monitoring",
                "performance tuning",
                "troubleshooting",
                "backups",
                "high availability",
                "installation",
                "configuration",
                "SSIS",
                "SSRS",
                "SQL tuning",
                "data conversion",
                "migration",
                "supporting enterprise systems",
                "SQL transactional replication",
                "Windows administration",
                "PowerShell",
                "Visual Studio (SQL Server Data Tools)",
                "Spotlight",
                "SQL 2016 Availability groups"
            ]
        },
        "job_type": [
            "hybrid"
        ],
        "contact_person": "Anu",
        "email": "anu@vsiiusa.com",
        "jd": "From: Anu, Visionsoft International Inc anu@vsiiusa.com Reply to: anu@vsiiusa.com Hi AllNeed Profiles forSQL Server Administrator Webcam Interview OnlyHybridSkillRequired / DesiredAmountof ExperienceDemonstrated experience working as a SQL Server administratorRequired7Years Strong understanding of SQL database monitoring and performance tuningRequired7YearsExperience in troubleshooting and resolving database problemsRequired7Years Experience with Backups restores and High Availability (Always on),Required7YearsExperience with Installation and configuration of SQL 2014, 2016 and 2019 Standard and EnterpriseRequired7Years Configuration of and work experience on SSIS and SSRS to create and deploys packages and ReportsRequired7YearsSQL tuning, Data conversion / Migration, Supporting Enterprise SystemsRequired7Years Supporting MS SQL databases in Microsoft clustered environmentsRequired7YearsExperience in SQL transactional ReplicationRequired7Years Windows administration, PowerShell, Visual Studio (SQL Server Data Tools) is a plusDesired Experience in Spotlight is plusDesired SQL 2016 Availability groups is a plusDesired Job duties:o SQL Server performance analysis, tuning, capacity planning/forecast, security, and designo Collaborate with DBAs and Developers in troubleshooting database and application errorso Actively monitor the database environment to ensure optimal performance and to prevent production issues.o Open and Follow-up on Service Request tickets to quickly resolve problems.o Perform Production On-Call Support on rotational basis - including Off-Hours and Weekend",
        "source": "Email",
        "date_posted": "2024-10-01 09:20:32-05:00",
        "unique_id": "1924891e36b2d6d6",
        "emp_type": [
            "full-time",
            "third party"
        ],
        "tag": "DB Admin"
    }
]