[
    {
        "company": "Predica Inc",
        "job_title": "Business Analyst 5",
        "location": "Lansing, MI, USA",
        "full_location": {
            "city": "Lansing",
            "state": "MI",
            "country": "USA"
        },
        "job_details": {
            "employment_type": [
                "full-time",
                "third party"
            ],
            "job_code": "135502",
            "experience_required": "3-5 years",
            "degree_required": "Bachelor's Degree",
            "visa_sponsorship": "Not specified",
            "notice_period": "Not specified",
            "duration": "Not specified",
            "rate": "Not specified"
        },
        "skills": {
            "core": [
                "Organization and Prioritization skills",
                "Communication and Interpersonal skills",
                "Microsoft Project",
                "Excel",
                "DevOPs",
                "Remedy/Helix",
                "Telecommunications"
            ],
            "primary": [
                "Clarity",
                "Customer service skills",
                "Network platforms",
                "Enterprise environment"
            ],
            "secondary": [
                "WAN",
                "MLAN",
                "WLAN",
                "Security",
                "Voice",
                "Videoconferencing"
            ],
            "all": [
                "Organization and Prioritization skills",
                "Communication and Interpersonal skills",
                "Microsoft Project",
                "Excel",
                "DevOPs",
                "Remedy/Helix",
                "Telecommunications",
                "Clarity",
                "Customer service skills",
                "Network platforms",
                "Enterprise environment",
                "WAN",
                "MLAN",
                "WLAN",
                "Security",
                "Voice",
                "Videoconferencing"
            ]
        },
        "job_type": [
            "hybrid"
        ],
        "contact_person": "Bhargav",
        "email": "bhargav@predicaz.com",
        "jd": "From: Bhargav, Predica Inc bhargav@predicaz.com Reply to: bhargav@predicaz.com 135502 Job Description Position Title: Business Analyst 5Position Location: Lansing, MI. Resource will be working a hybrid schedule. NO REMOTE ONLY OPTION. Will need to be onsite from day 1, two days a week. Short Description: Receive, process, present data, and information regarding our weekly Service Requests (Infrastructure Service Requests). Responsible for gathering business and technical requirements during the client kick off meetings. Consult SMEs (Subject Matter Experts) on tasks required to complete integrated projects for all Telecommunication services, such as, WAN, WLAN, MLAN, Security, Contact/Call Centers, Telephony, and Video. Manage multiple projects based on Agency assignments. Complete Description: Facilitate meetings with clients to gather requirements for all IT solutions and to identify impacted business processes and determine best process and IT solution integration.Ability to obtain and report business and technical requirementsFacilitate review sessions to discuss projectsExcellent customer and communication service skillsWork with multiple network platforms, such as, WAN, MLAN, WLAN, Security, Voice, and VideoconferencingDisseminate information effectively to all technical teams, customers, and technical managersUnderstand a large (enterprise) and complex network environment Skills, Experience and Education: Bachelors Degree, RequiredOrganization and Prioritization skills are MandatoryCommunication and Interpersonal skills are MandatoryPrevious experience working with multiple agencies and/or vendors and/or departments in an enterprise environment are RequiredMinimum 1-3 years experience with Clarity is PreferredMinimum 3-5 years experience with Microsoft Project and Excel is RequiredMinimum 2-3 years experience with DevOPs is PreferredMinimum 3-5 years experience with Remedy/Helix is RequiredMinimum 3-5 years working within a Telecommunications environment is RequiredMinimum 3-5 years experience in a large Enterprise setting is RequiredMinimum 3-5 years work experience with multiple network platforms is RequiredMinimum 3-5 years working with multiple network lines of service is RequiredMinimum 5+ years dealing with customers is Required BhargavSr. IT RecruiterEmail: bhargav@predicaz.comPredica Inc.",
        "source": "Email",
        "date_posted": "2024-10-01 08:20:36-05:00",
        "unique_id": "192488f8c605455e",
        "emp_type": [
            "full-time",
            "third party"
        ],
        "tag": "Business Analyst"
    }
]