[
    {
        "company": "Comerica Bank",
        "job_title": "ETL Developer",
        "location": "Plano, TX, USA",
        "full_location": {
            "city": "Plano",
            "state": "TX",
            "country": "USA"
        },
        "job_details": {
            "employment_type": [
                "contract",
                "third party"
            ],
            "experience_required": "7 years",
            "degree_required": "Bachelor's Degree from an accredited university in Computer Science, Engineering or in a Technology related field, OR equivalent through a combination of education and/or technology experience, OR 12 years of technology experience",
            "visa_sponsorship": "No visa sponsorship",
            "notice_period": "Not specified",
            "duration": "5 months contract",
            "rate": "Not specified"
        },
        "skills": {
            "core": [
                "Informatica",
                "Data Engineering",
                "SQL",
                "Python",
                "Snowflake"
            ],
            "primary": [
                "AWS",
                "CICD",
                "Jenkins",
                "Dataiku",
                "Data Quality"
            ],
            "secondary": [
                "Communication Skills",
                "Agile Methodologies",
                "Data Profiling",
                "Data Security",
                "Auditing Processes"
            ],
            "all": [
                "Informatica",
                "Data Engineering",
                "SQL",
                "Python",
                "Snowflake",
                "AWS",
                "CICD",
                "Jenkins",
                "Dataiku",
                "Data Quality",
                "Communication Skills",
                "Agile Methodologies",
                "Data Profiling",
                "Data Security",
                "Auditing Processes"
            ],
            "with_experience": [
                "Informatica (4 years)",
                "Data Engineering (7 years)",
                "Snowflake (5 years)",
                "CICD (5 years)",
                "Agile Methodologies (4 years)"
            ]
        },
        "job_type": [
            "onsite"
        ],
        "contact_person": "Vijay Tyagi",
        "email": "vijaykant.tyagi@largeton.us",
        "jd": "From: Vijaykant Tyagi, Largeton Inc. vijaykant.tyagi@largeton.us Reply to: vijaykant.tyagi@largeton.us Job Title - ETL DeveloperLocation - Plano Texas 48326 (Onsite)-Need local candidates onlyDuration \u2013 5 months contractComerica BankNo H1B,CPT,OPTLinkedIn - YesPrior Banking ExperiencePrepaid or postpaid Contact no. and personal email Note: Make sure candidate is good in communication skills along with technical skills. Position Qualifications:Bachelor's Degree from an accredited university in Computer Science, Engineering or in a Technology related field, OR equivalent through a combination of education and/or technology experience, OR 12 years of technology experience 7 years of experience identifying technical solutions for complex business problems, identifying the benefits and risks of the solutions and providing recommendations 7 years of experience in Technology, Data Engineering field in architecting, developing end-to-end scalable data applications and data pipelines; work with product manager and scrum masters and lead the team in assisting the story creations and sprint deliverables 7 years of experience leading and developing automated Informatica data pipelines with at least 4 years Informatica cloud (IICS) and relevant knowledge in data profiling, data quality, catalog tools 7 years of experience working in enterprise data warehouse solutions and platforms, and working knowledge of different databases (e.g., RDBMS, Snowflake), S3 Datalake, CICD, Jenkins and AWS cloud technologies 5 years of experience designing, implementing automated data solutions using Snowflake lakehouse; building workflows, developing, and scheduling ETL processes using programming SQL or Python 5 years of experience mentoring another technologist 5 years of experience implementing data solutions by adopting, recommending and improving CICD, change management, data security, auditing processes 4 years of experience working with software engineering best practices across the development lifecycle, including agile methodologies, coding standards, code reviews, source management, build processes and testing AWS or Informatica or Snowflake certification is preferred Experience with Dataiku is a plus. Have a nice day!ThankyouVijay Tyagi Senior Talent Acquisition Specialist || vijaykant.tyagi@largeton.usLinkedIn: www.linkedin.com/in/vijay-tyagi-389849240 LARGETON INC | 13800Coppermine Rd, Herndon, VA 20171 Disclaimer:Largeton is an equal opportunity employer. There is no discrimination based on race, color, religion, sex, national origin, age, disability, or any other protected status.If you believe you have been treated unfairly, please contact our HR department.",
        "source": "Email",
        "date_posted": "2024-10-01 14:33:20-05:00",
        "unique_id": "1924992ab600f9fe",
        "emp_type": [
            "contract",
            "third party"
        ],
        "tag": "AWS Data Engineer"
    }
]