[
    {
        "company": "Xforia Inc",
        "job_title": "Sr. Technical Business Analyst",
        "location": "Berkeley Heights, NJ, USA",
        "full_location": {
            "city": "Berkeley Heights",
            "state": "NJ",
            "country": "USA"
        },
        "job_details": {
            "employment_type": [
                "contract",
                "third party"
            ],
            "job_code": "",
            "experience_required": "Not specified",
            "degree_required": "Not specified",
            "visa_sponsorship": "Not specified",
            "notice_period": "Not specified",
            "duration": "12+ Months",
            "rate": "Not specified"
        },
        "skills": {
            "core": [
                "Microservice development",
                "API use cases",
                "Metadata",
                "Agile Development lifecycle"
            ],
            "primary": [
                "Cards Dispute & Frauds domain",
                "User Stories creation",
                "Techno-functional analysis"
            ],
            "secondary": [
                "Excellent written and verbal communication",
                "Collaboration in large teams"
            ],
            "all": [
                "Microservice development",
                "API use cases",
                "Metadata",
                "Agile Development lifecycle",
                "Cards Dispute & Frauds domain",
                "User Stories creation",
                "Techno-functional analysis",
                "Excellent written and verbal communication",
                "Collaboration in large teams"
            ]
        },
        "job_type": [
            "onsite"
        ],
        "contact_person": "Deepak M.V",
        "email": "deepak@xforia.com",
        "jd": "From: Deepak, Xforia Inc deepak@xforia.com Reply to: deepak@xforia.com Title: Sr. Technical Business Analyst\nLocation: Berkeley Heights, NJ | Coral Springs, FL | Day 1 Onsite\nDuration: 12+ Months Contract\nJob Description:\nTechno-functional BAs who can write use cases for APIs, Metadata, and similar tech architecture components.\nExperience in Microservice development\nExperience in Cards Dispute & Frauds domain\nExperience in User Stories creation for the Functional Epics\nExperience in Agile Development lifecycle methodology\nWork closely with the software architects, development team members and product owners\nAbility to work in large, collaborate teams to achieve organizational goals\nExcellent written and verbal communication skill.\nwww.xforia.com\nDeepak M.V\nRecruitment Manager\n9300 Wade Boulevard, Suite 220, Frisco TX 75035, USA.",
        "source": "Email",
        "date_posted": "2024-10-01 08:58:56-05:00",
        "unique_id": "192485fffc52dcb0",
        "emp_type": [
            "contract",
            "third party"
        ],
        "tag": "Business Analyst"
    }
]