[
    {
        "company": "Convex Tech Inc.",
        "job_title": "Pega Admin",
        "location": "USA",
        "full_location": {
            "city": "",
            "state": "",
            "country": "USA"
        },
        "job_details": {
            "employment_type": [
                "contract",
                "third party"
            ],
            "job_code": "",
            "experience_required": "4 years",
            "degree_required": "Not specified",
            "visa_sponsorship": "No visa sponsorship",
            "notice_period": "Not specified",
            "duration": "6-12 Months",
            "rate": "Not specified"
        },
        "skills": {
            "core": [
                "Pega Administration",
                "Devops",
                "Application Servers",
                "Linux Operating System",
                "Database activities"
            ],
            "primary": [
                "Red Hat Openshift Container",
                "Pega installations",
                "Pega Upgradation activities",
                "Pega Frameworks",
                "Pega AES installations",
                "Pega configurations"
            ],
            "secondary": [
                "Troubleshooting"
            ],
            "all": [
                "Pega Administration",
                "Devops",
                "Application Servers",
                "Linux Operating System",
                "Database activities",
                "Red Hat Openshift Container",
                "Pega installations",
                "Pega Upgradation activities",
                "Pega Frameworks",
                "Pega AES installations",
                "Pega configurations",
                "Troubleshooting"
            ]
        },
        "job_type": [
            "remote"
        ],
        "contact_person": "Sanjay Sunar",
        "email": "sanjay@convextech.com",
        "jd": "From: Sanjay Sunar, convextech sanjay@convextech.com Reply to: sanjay@convextech.com Position: Pega Admin Location: Remote Duration: 6-12 Months Visa: NO H1B/CPT Interview: Phone/Skype/Teams Job Description: \u2022 Minimum 4 years of experience as a Pega Admin \u2022 Minimum 8 years of total IT professional experience \u2022 Experience in Pega Administration, Devops, Application Servers, Linux Operating System and Database activities \u2022 Experience in Red Hat Openshift Container \u2022 Establishing Pega Production and Non-Production environments based on the Infrastructure Design Document \u2022 Experience in Pega installations & Upgradation activities \u2022 Experience in Pega Frameworks & Pega AES installations and configurations \u2022 Working with Pega application developers to troubleshooting the issues in all Environment Thanks and Regards Sanjay Sunar US IT Recruiter | Convex Tech Inc. Email: sanjay@convextech.com LinkedIn: https://www.linkedin.com/in/santosh-kumar-sunar-419601178/",
        "source": "Email",
        "date_posted": "2024-09-30 11:37:36-05:00",
        "unique_id": "1924424f58013ef1",
        "emp_type": [
            "contract",
            "third party"
        ],
        "tag": "PEGA Developer"
    }
]