[
    {
        "company": "Global IT Family",
        "job_title": "AWS with Redshift Expert",
        "location": "St. Louis, MO, USA",
        "full_location": {
            "city": "St. Louis",
            "state": "MO",
            "country": "USA"
        },
        "job_details": {
            "employment_type": [
                "contract",
                "third party"
            ],
            "job_code": "",
            "experience_required": "8+ years",
            "degree_required": "Not specified",
            "visa_sponsorship": "Not specified",
            "notice_period": "Not specified",
            "duration": "6+ Months",
            "rate": "Not specified"
        },
        "skills": {
            "core": [
                "AWS Redshift",
                "SQL",
                "Data Analysis"
            ],
            "primary": [
                "PL/SQL",
                "Python",
                "Unix",
                "JIRA",
                "Project Planning"
            ],
            "secondary": [
                "Excellent communication skill",
                "Team management",
                "Resource planning",
                "Knowledge on Documentations like (S2T, NDR document, RM, DM etc.)"
            ],
            "all": [
                "AWS Redshift",
                "SQL",
                "Data Analysis",
                "PL/SQL",
                "Python",
                "Unix",
                "JIRA",
                "Project Planning",
                "Excellent communication skill",
                "Team management",
                "Resource planning",
                "Knowledge on Documentations like (S2T, NDR document, RM, DM etc.)"
            ]
        },
        "job_type": [
            "onsite"
        ],
        "contact_person": "Sameer Kumar",
        "email": "sameer@globalitfamily.com",
        "jd": "From: SAM, Global IT Family sameer@globalitfamily.com Reply to: sameer@globalitfamily.com Role: AWS with Redshift ExpertLocation: St. Louis MODuration: 6+ Months Job Description8+ years of experience in with Database application Development using programming language.Strong knowledge of AWS RedshiftVery Strong in SQL and Data Analysis, performance tuning and code reviews.Strong knowledge of stored procedures, macros and functionsBusiness knowledge in the Telecom domain.AWS CloudsAWS RedshiftPL/SQLPythonSkill Set Required:RedshiftUnixJIRAProject PlanningExcellent communication skillTeam managementResource planningKnowledge on Documentations like (S2T, NDR document, RM, DM etc.) Thanks & Regards,Sameer KumarGlobal IT FamilyEmail: sameer@globalitfamily.com www.globalitfamily.comSkype: sameer.satapathyLinkedIn : https://www.linkedin.com/in/sameer-satapathy-10ab0318/ (Open to connect in Linkedin)Connect with us!",
        "source": "Email",
        "date_posted": "2024-09-30 07:47:15-05:00",
        "unique_id": "19242f8243d03169",
        "emp_type": [
            "contract",
            "third party"
        ],
        "tag": "AWS Data Engineer"
    }
]