[
    {
        "company": "ERP MARK",
        "job_title": "Lead II - Enterprise Solutions - .NET/Node Full Stack Technical Lead",
        "location": "Atlanta, GA, USA",
        "full_location": {
            "city": "Atlanta",
            "state": "GA",
            "country": "USA"
        },
        "job_details": {
            "employment_type": [
                "contract",
                "third party"
            ],
            "experience_required": "7+ years",
            "degree_required": "Not specified",
            "visa_sponsorship": "Not specified",
            "notice_period": "Not specified",
            "duration": "Not specified",
            "rate": "Not specified"
        },
        "skills": {
            "core": [
                ".NET (C#)",
                "Node.js",
                "Azure",
                "AWS",
                "Microservices architecture"
            ],
            "primary": [
                "Angular",
                "React",
                "Vue.js",
                "RESTful APIs",
                "Serverless computing",
                "Azure App Service",
                "Azure Functions",
                "Azure Kubernetes Service (AKS)",
                "Azure DevOps",
                "CI/CD",
                "Jenkins",
                "GitHub Actions"
            ],
            "secondary": [
                "SQL Server",
                "MongoDB",
                "Certification in Azure",
                "Docker",
                "Kubernetes",
                "Agile development methodologies"
            ],
            "all": [
                ".NET (C#)",
                "Node.js",
                "Azure",
                "AWS",
                "Microservices architecture",
                "Angular",
                "React",
                "Vue.js",
                "RESTful APIs",
                "Serverless computing",
                "Azure App Service",
                "Azure Functions",
                "Azure Kubernetes Service (AKS)",
                "Azure DevOps",
                "CI/CD",
                "Jenkins",
                "GitHub Actions",
                "SQL Server",
                "MongoDB",
                "Certification in Azure",
                "Docker",
                "Kubernetes",
                "Agile development methodologies"
            ]
        },
        "job_type": [
            "onsite"
        ],
        "contact_person": "Asha",
        "email": "asha@erpmark.com",
        "jd": "From: Asha, ERP MARK asha@erpmark.com Reply to: asha@erpmark.com Job Title: Lead II - Enterprise Solutions - .NET/Node Full Stack Technical LeadLocation: Atlanta, GA - OnsiteDuration: Contract Job Description:.NET/Node Full Stack Technical Lead with Experience in App Migration from AWS to Azure\u2022 Position Title: .NET/Node Full Stack Technical Lead\u2022 Experience Level: 7+ years of relevant experienceTechnical Skills:\u2022 Strong proficiency in .NET (C#) and Node.js development.\u2022 Experience with front-end frameworks such as Angular, React, or Vue.js.\u2022 In-depth knowledge of cloud platforms, particularly Azure.\u2022 Proven experience in migrating applications from AWS to Azure.\u2022 Familiarity with microservices architecture, RESTful APIs, and serverless computing.\u2022 Experience with Azure services like Azure App Service, Azure Functions, Azure Kubernetes Service (AKS), and Azure DevOps.\u2022 Knowledge of CI/CD pipelines and tools like Jenkins, GitHub Actions, or Azure DevOps Pipelines.\u2022 Strong understanding of database technologies, including SQL Server, MongoDB.Preferred Qualifications:\u2022 Certification in Azure (e.g., Microsoft Certified: Azure Solutions Architect Expert) is a plus.\u2022 Experience with Docker and container orchestration platforms like Kubernetes.\u2022 Familiarity with Agile development methodologies.",
        "source": "Email",
        "date_posted": "2024-09-30 12:05:59-05:00",
        "unique_id": "19244063f04efe1c",
        "emp_type": [
            "contract",
            "third party"
        ],
        "tag": ".net developer"
    }
]