[
    {
        "company": "Vyzeinc",
        "job_title": "Actimize/Java Developer",
        "location": "New York, NY, USA",
        "full_location": {
            "city": "New York",
            "state": "NY",
            "country": "USA"
        },
        "job_details": {
            "employment_type": [],
            "job_code": "",
            "experience_required": "7+ years",
            "degree_required": "Not specified",
            "visa_sponsorship": "Only GC and USC",
            "notice_period": "Not specified",
            "duration": "6+ Months",
            "rate": "Not specified"
        },
        "skills": {
            "core": [
                "Actimize Suite (RCM Customization, Alert Types, Views, DART, Workflows, Administration)",
                "RCM Plugin Development & Actimize Scheduler",
                "Core Java",
                "SQL",
                "OO and Functional Development"
            ],
            "primary": [
                "Windows infrastructure",
                "Linux infrastructure",
                "Communication skills",
                "Interpersonal skills"
            ],
            "secondary": [
                "Web Services (XML, REST, SOAP, JSON)",
                "Perl",
                "UML diagrams (read/create)",
                "Linux and Shell scripting"
            ],
            "all": [
                "Actimize Suite (RCM Customization, Alert Types, Views, DART, Workflows, Administration)",
                "RCM Plugin Development & Actimize Scheduler",
                "Core Java",
                "SQL",
                "OO and Functional Development",
                "Windows infrastructure",
                "Linux infrastructure",
                "Communication skills",
                "Interpersonal skills",
                "Web Services (XML, REST, SOAP, JSON)",
                "Perl",
                "UML diagrams (read/create)",
                "Linux and Shell scripting"
            ]
        },
        "job_type": [
            "hybrid"
        ],
        "contact_person": "Vyzeinc",
        "email": "roshan@vyzeinc.com",
        "jd": "From: Roshan, Vyzeinc roshan@vyzeinc.com Reply to: roshan@vyzeinc.com Job Title: Actimize/Java Developer\nLocation: New York, NY (Hybrid, Local Only)\nDuration: 6+ Months\nVisa: Only GC and USC\nInterview: Skype + F2F\nRequirements:\nLinkedIn with photo\nBanking/Financial experience on recent projects\n3-page resume\nMust-Have Skills:\n7+ years of relevant technical experience\nActimize Suite (RCM Customization, Alert Types, Views, DART, Workflows, Administration)\nRCM Plugin Development & Actimize Scheduler\nStrong understanding of Windows & Linux infrastructure\n5+ years of hands-on Core Java experience\nStrong SQL and database skills (procedures, query tuning)\nProficiency in OO and Functional Development\nExcellent communication and interpersonal skills\nFamiliarity with financial market data\nDesired Skills:\nWeb Services (XML, REST, SOAP, JSON)\nPerl\nUML diagrams (read/create)\nLinux and Shell scripting",
        "source": "Email",
        "date_posted": "2024-09-30 20:33:23-05:00",
        "unique_id": "19245b57fcef91e8",
        "emp_type": [],
        "tag": "Java Dev"
    }
]