[
    {
        "company": "Sapphire Software Solutions",
        "job_title": "Full Stack Java/Angular Developer",
        "location": "Austin, TX, USA",
        "full_location": {
            "city": "Austin",
            "state": "TX",
            "country": "USA"
        },
        "job_details": {
            "employment_type": [
                "contract",
                "third party"
            ],
            "job_code": "",
            "experience_required": "7 years",
            "degree_required": "Not specified",
            "visa_sponsorship": "No visa sponsorship",
            "notice_period": "Not specified",
            "duration": "12+ months contract",
            "rate": "Not specified"
        },
        "skills": {
            "core": [
                "Java",
                "Angular 13+",
                "SQL",
                "Spring Boot"
            ],
            "primary": [
                "Microservices",
                "RESTful APIs",
                "Postgres",
                "Cloud platforms",
                "Kubernetes",
                "Docker",
                "HPC platforms",
                "Agile"
            ],
            "secondary": [
                "Multi-threaded development",
                "Software development best practices",
                "UI Design",
                "Code reviews"
            ],
            "all": [
                "Java",
                "Angular 13+",
                "SQL",
                "Spring Boot",
                "Microservices",
                "RESTful APIs",
                "Postgres",
                "Cloud platforms",
                "Kubernetes",
                "Docker",
                "HPC platforms",
                "Agile",
                "Multi-threaded development",
                "Software development best practices",
                "UI Design",
                "Code reviews"
            ]
        },
        "job_type": [
            "onsite",
            "remote"
        ],
        "contact_person": "Jatin",
        "email": "jatin@sapphiresoftwaresolutions.com",
        "jd": "From: Jatin, Sapphire Software Solutions jatin@sapphiresoftwaresolutions.com Reply to: jatin@sapphiresoftwaresolutions.com C2C allowed (Only USC, GC, GCEAD, H4EAD, TN not H1B)Job Title: Full Stack Java/Angular DeveloperLocation: Austin, TX OR Warren, MI Duration: 12+ months contract Job DescriptionThe Senior Full-Stack Software Developer (Java/Spring Boot) will design, develop, and maintain high-performance, scalable applications. This role involves working across the entire tech stack, focusing on back-end services using Java, Spring Boot and Postgres, while also contributing to front-end development using Angular framework. Responsibilities include collaborating with cross-functional teams to deliver robust solutions, driving the architecture and design of new features, optimizing performance, and ensuring code quality through best practices like testing and code reviews. The ideal candidate has extensive experience with full-stack development, microservices, RESTful APIs, and database technologies.\ufeffMinimum Experience \u00b7 Minimum 7 years of professional software development experience \u00b7 Excellent technical (hands-on) knowledge of Java, Angular 13+, SQL\u00b7 Proficient in multi-threaded development \u00b7 Experience with Spring Boot\u00b7 Experience with cloud platforms, Kubernetes, Docker and HPC platforms\u00b7 Good understanding of software development best practices \u00b7 Experience working in an agile environment \u00b7 Extensive UI Design experience \u00b7 Comfortable dealing with ambiguity",
        "source": "Email",
        "date_posted": "2024-09-30 12:00:13-05:00",
        "unique_id": "192440b0e869a70d",
        "emp_type": [
            "contract",
            "third party"
        ],
        "tag": "Java developer"
    }
]