[
    {
        "company": "TechRooted",
        "job_title": "Junior SSIS/.Net Developer",
        "location": "Hermitage, PA, USA",
        "full_location": {
            "city": "Hermitage",
            "state": "PA",
            "country": "USA"
        },
        "job_details": {
            "employment_type": [
                "contract",
                "third party"
            ],
            "job_code": "JPC - 662",
            "experience_required": "3 years",
            "degree_required": "Not specified",
            "visa_sponsorship": "No visa sponsorship",
            "notice_period": "Not specified",
            "duration": "6 months contract",
            "rate": "$35-$49/hr"
        },
        "skills": {
            "core": [
                "ASP.Net",
                "C#",
                "SSIS",
                "SQL Server 2022",
                "REST",
                "SOAP"
            ],
            "primary": [
                "JavaScript",
                "Postman",
                "SoapUI",
                "Git",
                "Azure DevOps",
                "Jira"
            ],
            "secondary": [
                "Core banking systems",
                "Data warehousing solutions",
                "Power BI",
                "Excellent organizational skills",
                "Analytical skills",
                "Interpersonal skills",
                "Detail-oriented",
                "Excellent communication skills"
            ],
            "all": [
                "ASP.Net",
                "C#",
                "SSIS",
                "SQL Server 2022",
                "REST",
                "SOAP",
                "JavaScript",
                "Postman",
                "SoapUI",
                "Git",
                "Azure DevOps",
                "Jira",
                "Core banking systems",
                "Data warehousing solutions",
                "Power BI",
                "Excellent organizational skills",
                "Analytical skills",
                "Interpersonal skills",
                "Detail-oriented",
                "Excellent communication skills"
            ]
        },
        "job_type": [
            "hybrid"
        ],
        "contact_person": "Mukul Shukla",
        "email": "mukul@techrooted.com",
        "jd": "Junior Role, having max $35-$49/hr on C2c/1099No USC, GC or OPT. LOCAL CANDIDATES ONLY.\n\nJob Code JPC - 662\nJob Title Junior SSIS/.Net Developer\nLocation Hermitage, Pennsylvania\n\nJob Description Hybrid (3 days onsite/2 days remote) - Pittsburgh or Hermitage, PA \u2013 local candidates ONLY\n\nOur major banking client in Pittsburgh, PA is seeking a Junior SSIS/.Net Developer to join their team on a 6 month contract (with open extensions). No USC, GC or OPT. LOCAL CANDIDATES ONLY.\n\nMinimum 3 years of strong experience with ASP.net/c# or SSIS\nMinimum 1 years of experience with other (so if they have 3 years with .net then 1 year with SSIS)\nExperience building and supporting systems with experience with ASP.Net, JavaScript, REST/SOAP\nHands on experience with SQL Server 2022 (2016 or above will also do)\nHands on experience with testing with Postman and SoapUI\nExperience with source controls with Git (or similar)\nFamiliarity with agile tools \u2013Azure DevOps or Jira\nKnowledge of core banking systems, data warehousing solutions and Power BI will be a big plus.\n\nSoft Skills needed for this job:\nExcellent organizational, analytical, and interpersonal skills\nDetail-oriented\nExcellent communication skills, both written and verbal",
        "source": "Email",
        "date_posted": "2024-09-30 10:38:18-05:00",
        "unique_id": "19243d4dc0b144f7",
        "emp_type": [
            "contract",
            "third party"
        ],
        "tag": ".net developer"
    }
]