[
    {
        "company": "synkriom",
        "job_title": "Java AWS Developer",
        "location": "Columbus, OH, USA",
        "full_location": {
            "city": "Columbus",
            "state": "OH",
            "country": "USA"
        },
        "job_details": {
            "employment_type": [],
            "job_code": "",
            "experience_required": "10+ years",
            "degree_required": "Not specified",
            "visa_sponsorship": "Not specified",
            "notice_period": "Not specified",
            "duration": "Not specified",
            "rate": "Not specified"
        },
        "skills": {
            "core": [
                "Java",
                "Spring",
                "Microservices",
                "AWS",
                "Terraform"
            ],
            "primary": [
                "J2EE",
                "Webservices",
                "PL/SQL",
                "Object Oriented Analysis",
                "Object Oriented Design",
                "GIT",
                "Jenkins",
                "MVC",
                "Java Design Patterns",
                "JUnit",
                "Oracle",
                "SQL Server",
                "SQL",
                "SOAP",
                "REST",
                "IntelliJ",
                "Maven",
                "Tomcat"
            ],
            "secondary": [
                "Agile software development methodology",
                "SCM tools",
                "Collaborative teamwork",
                "Architecture",
                "Design",
                "Business processes",
                "Software skills",
                "SDLC"
            ],
            "all": [
                "Java",
                "Spring",
                "Microservices",
                "AWS",
                "Terraform",
                "J2EE",
                "Webservices",
                "PL/SQL",
                "Object Oriented Analysis",
                "Object Oriented Design",
                "GIT",
                "Jenkins",
                "MVC",
                "Java Design Patterns",
                "JUnit",
                "Oracle",
                "SQL Server",
                "SQL",
                "SOAP",
                "REST",
                "IntelliJ",
                "Maven",
                "Tomcat",
                "Agile software development methodology",
                "SCM tools",
                "Collaborative teamwork",
                "Architecture",
                "Design",
                "Business processes",
                "Software skills",
                "SDLC"
            ]
        },
        "job_type": [],
        "contact_person": "shubham",
        "email": "shubham.kumar@synkriom.com",
        "jd": "From: shubham, synkriom shubham.kumar@synkriom.com Reply to: shubham.kumar@synkriom.com Experience:10+Job Description :Need only local CandidateMandate skills: Java, Spring boot, Microservices, AWS, TerraformJob Description:Experience in Agile software development methodology and practices with full development lifecycle from inception through implementation.Required: Java, J2EE, Spring, Microservice, Webservices, PL/SQLWorking knowledge of Object Oriented Analysis/Object Oriented Design methodologies and life cycles.Demonstrated experience with SCM tools such as GIT, JenkinsExperience with application development on Java, J2EE, Spring, and MVC, Java Design Patterns and JUnit.Knowledge of Relational Databases like Oracle/SQL Server, SQLKnowledge of Web service technologies including SOAP/REST.Strong working knowledge of IntelliJ, Maven and Tomcat.Ability to work collaboratively in teams and develop meaningful relationships to achieve common goalsKnowledge of architecture, design and business processesProficiency in modern programming languagesExperience in design and build of complex application systems using the new banking architecture including Java/J2EE/Spring technologies. Proficiency in one or more general purpose programming languages including Java/J2EE/JSP based Web applications/Middleware and Batch systems.Experience in design, analysis, development, coding, unit testing, debug and documentation for Java/J2EE systems including Web applications, business services, batch applications, large/complex projects and utilizing Web Services and Java RMI technologies to improve interface/API and significantly enhance integration capability between front-end and back-end systemsA fundamental understanding of software skills and the different components of SDLC such as business analysis, development, and maintenance and software improvement is essential",
        "source": "Email",
        "date_posted": "2024-10-01 10:59:19-05:00",
        "unique_id": "19248d3a684ae8a8",
        "emp_type": [],
        "tag": "Java Dev"
    }
]