[
    {
        "company": "Inteletech Global Inc",
        "job_title": "Workday Business Analyst - (Project, Grants, Billing)",
        "location": "Atlanta, GA, USA",
        "full_location": {
            "city": "Atlanta",
            "state": "GA",
            "country": "USA"
        },
        "job_details": {
            "employment_type": [
                "contract",
                "third party"
            ],
            "job_code": "",
            "experience_required": "4 years",
            "degree_required": "Not specified",
            "visa_sponsorship": "Not specified",
            "notice_period": "Not specified",
            "duration": "12+ months",
            "rate": "Not specified"
        },
        "skills": {
            "core": [
                "Workday Project module"
            ],
            "primary": [
                "functional consultant",
                "business requirements"
            ],
            "secondary": [],
            "all": [
                "Workday Project module",
                "functional consultant",
                "business requirements"
            ]
        },
        "job_type": [
            "hybrid"
        ],
        "contact_person": "Ravi",
        "email": "ravi@inteletechglobal.com",
        "jd": "From: Ravi, Inteletech Global Inc ravi@inteletechglobal.com Reply to: ravi@inteletechglobal.com Title: Workday Business Analyst - (Project, Grants, Billing)Location: Atlanta, GA (Hybrid)Duration: 12+ monthsOne of our premier clients is looking for a Finance (Workday )Business Analyst in Atlanta, GA (HYBRID) for a contract position. If interested, please submit your resume ASAP indicating(1) current location(2) desired hourly rate, W2 or 1099 or C2C(3) Your email address.RESPONSIBILITIES:Implements Project, Grants & Billing modules.Analyzes information to determine nature and extent of customer requirements and concerns.Develops and/or executes change management plans for transition to new systems.Consults with implementation partner and technical staff to ensure that functionality of automated system is consistent with adherence to laws, regulations, and best practice standards by users.Tests or coordinates testing of new installations or upgrades.Participates in evaluation of new technologies, enhancements or solutions to improve service and efficiency of systems.Researches and analyses system/user problems by applying a variety of analytical and research techniques.Participates in the establishment of standards and procedures to be used in the development of systems.REQUIRED SKILLS:Required 4 years of experinece in Acted as functional consultant implementing Workday Project moduleRequired 2 years of experience in Writes and interprets functional and business requirements as an input to application design.",
        "source": "Email",
        "date_posted": "2024-10-01 11:10:16-05:00",
        "unique_id": "19248f7864bb70f6",
        "emp_type": [
            "contract",
            "third party"
        ],
        "tag": "Business Analyst"
    }
]