[
    {
        "company": "TTDATA",
        "job_title": "GCP Architect",
        "location": "USA",
        "full_location": {
            "city": "",
            "state": "",
            "country": "USA"
        },
        "job_details": {
            "employment_type": [
                "contract",
                "third party"
            ],
            "job_code": "",
            "experience_required": "Not specified",
            "degree_required": "Not specified",
            "visa_sponsorship": "Not specified",
            "notice_period": "Not specified",
            "duration": "Contract",
            "rate": "Not specified"
        },
        "skills": {
            "core": [
                "Google Cloud",
                "Google BigQuery",
                "Data Architecture",
                "Data Warehousing",
                "Data Lakes"
            ],
            "primary": [
                "Data Management Technologies",
                "Data Integrity",
                "Data Quality",
                "Data Governance",
                "Data Modeling",
                "Data Engineering"
            ],
            "secondary": [
                "Database Management Systems",
                "Big Data Technologies",
                "Solution Design",
                "Technical Skills",
                "Communication"
            ],
            "all": [
                "Google Cloud",
                "Google BigQuery",
                "Data Architecture",
                "Data Warehousing",
                "Data Lakes",
                "Data Management Technologies",
                "Data Integrity",
                "Data Quality",
                "Data Governance",
                "Data Modeling",
                "Data Engineering",
                "Database Management Systems",
                "Big Data Technologies",
                "Solution Design",
                "Technical Skills",
                "Communication"
            ]
        },
        "job_type": [
            "remote"
        ],
        "contact_person": "Balaji",
        "email": "balaji@ttdatas.com",
        "jd": "From: Balaji, TTDATA balaji@ttdatas.com Reply to: balaji@ttdatas.com Hi Professional,I hope you doing well. I do have job opening for GCP Architect client based out at RemotePlease find the below requirement if you\u2019re comfortable share me your updated profile with below details asap.Position : GCP ArchitectLocation : RemoteDuration : Contract Google Data Architect Job Description : Strong experience with Google cloud-based data solutions Hands on experience in Google Big queryDesign scalable data architectures, data warehouses, and data lakes.Evaluate and implement data management technologies to ensure effective data storage, retrieval, and security.Collaborate with cross-functional teams to understand data requirements and integrate data solutions effectively.Ensure data integrity, quality, and consistency across all data systems.Develop & enforce data governance policies and procedures.Provide support and guidance to tech lead & data engineers.Optimize data processing workflows to enhance performance and efficiency.Strong knowledge of database management systems & experience with big data technologiesExperience in Data Modeling & design \uf020Deep understanding of data engineering concepts, database designs, associated tools, system components, internal processes, and architecture.Experience working as a solution designer in a customer-focused teamVery good technical skills and should also be able to help onshore/offshore team (with good/effective communication)Thanks& Regards Balaji V",
        "source": "Email",
        "date_posted": "2024-10-01 11:27:55-05:00",
        "unique_id": "19249480cf3c48af",
        "emp_type": [
            "contract",
            "third party"
        ],
        "tag": "GCP Data Engineer"
    }
]