[
    {
        "company": "Dewsoftech",
        "job_title": "HCM Learning Project Manager",
        "location": "USA",
        "full_location": {
            "city": "",
            "state": "",
            "country": "USA"
        },
        "job_details": {
            "employment_type": [
                "contract"
            ],
            "job_code": "",
            "experience_required": "12+ years",
            "degree_required": "Not specified",
            "visa_sponsorship": "Not specified",
            "notice_period": "Not specified",
            "duration": "12+ months",
            "rate": "Not specified"
        },
        "skills": {
            "core": [
                "Workday Project Manager",
                "HCM project management",
                "Workday Learning"
            ],
            "primary": [
                "Stakeholder Management",
                "Data & content conversion",
                "Training session scheduling",
                "Design decision guidance",
                "HR processes understanding"
            ],
            "secondary": [
                "High attention to detail",
                "Effective communication",
                "Self-motivated",
                "Proactive"
            ],
            "all": [
                "Workday Project Manager",
                "HCM project management",
                "Workday Learning",
                "Stakeholder Management",
                "Data & content conversion",
                "Training session scheduling",
                "Design decision guidance",
                "HR processes understanding",
                "High attention to detail",
                "Effective communication",
                "Self-motivated",
                "Proactive"
            ]
        },
        "job_type": [
            "remote"
        ],
        "contact_person": "Jenifer Lewis",
        "email": "jenifer@dewsoftech.com",
        "jd": "From: jenifer, Dewsoftech jenifer@dewsoftech.com Reply to: jenifer@dewsoftech.com HCM Learning Project Manager\nLocation: Remote but must live in EST or CST\nContract Duration: 12+ months\nWe have an immediate opening for a HCM Learning Project Manager. This position can be available to those working remotely in the US.\nWhat you\u2019ll do:\nOverall responsible to drive AP deliverable and deadlines on project plan aligning and working closely with PWC project manager\nDrive AP project timelines and deliverables with AP WSLs\nStakeholder Management and Engagement\nManage the data & content conversion activities and resolving issues and risk\nResponsible for scheduling training sessions internally\nWorks closely with the process owner and provides expert guidance on design decisions\nActively participates in design sessions\nActively communicates with the AP WSL including OCM with them on daily basis\nProvides input ensuring that design decisions are consistent with the governance model and policies\nResponsible for making sure Workstream Lead are aligned on the operating model, roles & responsibilities\nUpdate existing support model with input from key stakeholders, Workday, Integration, and transition to business as usual \u2018BAU\u2019\nSupports the team with Works Council requirements around reporting and data collection\nResponsible for building translations strategy and supporting the team by closely working with the translation's vendor\nWhat we\u2019re looking for:\nWorkday Project Manager and / or other HCM project management experience, preferably Workday Learning\nExperience executing global and complex projects\nUnderstanding of HR processes and data\nHigh attention to detail, ability to communicate effectively across a variety of audiences including senior management\nSelf-motivated, proactive, and able to work under minimal supervision at detailed levels\nThanks & Regards\nJenifer Lewis\nSenior IT Recruiter\nPh. No: (302) 318-9134 (Direct)\nEmail: jenifer@dewsoftech.com",
        "source": "Email",
        "date_posted": "2024-10-01 09:13:26-05:00",
        "unique_id": "1924888770dfbeea",
        "emp_type": [
            "contract"
        ],
        "tag": "BA/Scrum Master/PM"
    }
]