[
    {
        "company": "Scalable Systems",
        "job_title": "Azure Architect with ADLS Gen2, GCP Exp.",
        "location": "Grand rapids, MI, USA",
        "full_location": {
            "city": "Grand rapids",
            "state": "MI",
            "country": "USA"
        },
        "job_details": {
            "employment_type": [
                "third party"
            ],
            "job_code": "",
            "experience_required": "Not specified",
            "degree_required": "Not specified",
            "visa_sponsorship": "Not specified",
            "notice_period": "Not specified",
            "duration": "Not specified",
            "rate": "Not specified"
        },
        "skills": {
            "core": [
                "Azure - Data Factory",
                "Log Analytics",
                "Databricks",
                "Synapse",
                "Power BI",
                "ADLS Gen2",
                "GCP Cloud storage",
                "Big Query"
            ],
            "primary": [
                "Retail Media Data Movement experience",
                "Google Marketing platform",
                "Salesforce MCI",
                "The Trade Desk",
                "ADvendio",
                "Data Modeling",
                "Data Classification and zones",
                "data movement",
                "Data architecture",
                "reporting",
                "Python",
                "API architecture in Azure"
            ],
            "secondary": [],
            "all": [
                "Azure - Data Factory",
                "Log Analytics",
                "Databricks",
                "Synapse",
                "Power BI",
                "ADLS Gen2",
                "GCP Cloud storage",
                "Big Query",
                "Retail Media Data Movement experience",
                "Google Marketing platform",
                "Salesforce MCI",
                "The Trade Desk",
                "ADvendio",
                "Data Modeling",
                "Data Classification and zones",
                "data movement",
                "Data architecture",
                "reporting",
                "Python",
                "API architecture in Azure"
            ],
            "with_experience": []
        },
        "job_type": [],
        "contact_person": "Manish Kumar",
        "email": "manish.kumar@scalable-systems.com",
        "jd": "From: Manish Kumar, Scalable Systems manish.kumar@scalable-systems.com Reply to: manish.kumar@scalable-systems.com Position: Azure Architect with ADLS Gen2, GCP Exp.Location: Grand rapids, MIEssential Skills: 1. Azure - Data Factory, Log Analytics, Databricks, Synapse, Power BI, ADLS Gen2,2. GCP Cloud storage and Big Query3. Retail Media Data Movement experience4. Google Marketing platform, Salesforce MCI, The Trade Desk, ADvendio5. Power BI, Data Modeling, Data Classification and zones, data movement, Data architecture and reporting6. Python and API architecture in Azure Best Regards Manish Kumar Phone - +17327883626 Email ID: manish.kumar@scalable-systems.com Scalable Systems | Inspiring Innovation Big Data | Analytics | Integration | Intelligence www.scalable-systems.com",
        "source": "Email",
        "date_posted": "2024-10-19 02:26:42-05:00",
        "unique_id": "192a3cc4c076dda1",
        "emp_type": [
            "third party"
        ],
        "tag": "Azure Data Engineer"
    }
]