[
    {
        "company": "MSys Inc",
        "job_title": "Infrastructure/Database PM-Hybrid",
        "location": "Baton Rouge, LA, USA",
        "full_location": {
            "city": "Baton Rouge",
            "state": "LA",
            "country": "USA"
        },
        "job_details": {
            "employment_type": [
                "full-time",
                "third party"
            ],
            "job_code": "",
            "experience_required": "3+ years",
            "degree_required": "Not specified",
            "visa_sponsorship": "Not specified",
            "notice_period": "Not specified",
            "duration": "Long term",
            "rate": "Not specified"
        },
        "skills": {
            "core": [
                "project management",
                "database migration",
                "data structure"
            ],
            "primary": [
                "documentation",
                "risk analysis",
                "cost benefit analysis"
            ],
            "secondary": [
                "process monitoring",
                "resource planning",
                "ongoing evaluation"
            ],
            "all": [
                "project management",
                "database migration",
                "data structure",
                "documentation",
                "risk analysis",
                "cost benefit analysis",
                "process monitoring",
                "resource planning",
                "ongoing evaluation"
            ]
        },
        "job_type": [
            "hybrid"
        ],
        "contact_person": "Raghu",
        "email": "raghu@msysinc.com",
        "jd": "From: Raghu, MSys Inc resume@msysinc.com Reply to: resume@msysinc.com Title: Infrastructure/Database PM-HybridLocation: Baton Rouge, LA, USALength: Long termRestriction: W2 or C2CSend resume to: raghu@msysinc.com Description:Interview Type: Skype *** Very long term project initial PO for 3 years, expect to go for 6+ years *** ***Hybrid*** need 3 referencesThe scope of the proposed services will include the following:Provide day-to-day project management supportCreation of project documentation: daily, weekly, semi-monthly and monthly status reports project schedules and plans, meeting minutes, risks and issues, other documentation as neededActivity and resource planningAnalyzing project risks and issues, help identify ways to mitigate risksProcess monitoringMonitor project deliverablesConduct cost benefit analysisDocumentation of specifications and requirements trackingProvide day-to-day support for on-going processesProvide on-going evaluation and improvements for processes work in needed areas to provide support services for agencys workload demands.Expertise and or relevant experience in the following areas are mandatory:3+ years of experience in database migration and upgrades3+ years of experience in understanding data structure and organization",
        "source": "Email",
        "date_posted": "2024-10-19 09:31:24-05:00",
        "unique_id": "192a5511c6e679e0",
        "emp_type": [
            "full-time",
            "third party"
        ],
        "tag": "Project Manager"
    }
]