[
    {
        "company": "Google",
        "job_title": "MDM Business System Analyst",
        "location": "Austin, TX, USA",
        "full_location": {
            "city": "Austin",
            "state": "TX",
            "country": "USA"
        },
        "job_details": {
            "employment_type": [
                "third party"
            ],
            "experience_required": "Not specified",
            "degree_required": "Not specified",
            "visa_sponsorship": "Not specified",
            "notice_period": "Not specified",
            "duration": "Not specified",
            "rate": "Not specified"
        },
        "skills": {
            "core": [
                "enterprise data projects",
                "analytical skills",
                "problem solving skills",
                "programming",
                "SQL",
                "data modeling"
            ],
            "primary": [
                "master data management",
                "communication skills",
                "partnering with engineering",
                "partnering with business",
                "partnering with operations"
            ],
            "secondary": [
                "Reltio",
                "SAP MDG",
                "Informatica MDM",
                "Tableau",
                "Power BI",
                "Looker"
            ],
            "all": [
                "enterprise data projects",
                "analytical skills",
                "problem solving skills",
                "programming",
                "SQL",
                "data modeling",
                "master data management",
                "communication skills",
                "partnering with engineering",
                "partnering with business",
                "partnering with operations",
                "Reltio",
                "SAP MDG",
                "Informatica MDM",
                "Tableau",
                "Power BI",
                "Looker"
            ],
            "with_experience": []
        },
        "job_type": [
            "onsite"
        ],
        "contact_person": "Nandini",
        "email": "nandini.s@avanceservices.com",
        "jd": "From: Nandini, Avance nandini.s@avanceservices.com Reply to: nandini.s@avanceservices.com Title: MDM Business System AnalystLocation: Austin,TX/San Jose,CA/NYC,NYJob Description:Responsibilities :Partner with the teams to design, develop and deliver data, analytics and master data management systems supporting various Google business processes (finance, legal, marketing, sales etc)Document Business/Functional requirementsParticipate in implementation projects (e.g., requirements documentation, use case development, functional design, test documentation/execution, UAT support, and production support).Partner with technical teams to develop, deliver and test the systemsParticipate and provide updates in project status meeting, scrum and planning meetingsMinimum skills:Experience working on enterprise data projects (data warehouses/master data management, others)Strong analytical and problem solving skillsExperience in programming and SQLHands on experience on data modeling (Conceptual, logical and physical)Excellent communication skills with a demonstrated track record of effectively partnering with engineering , business, and operations teamsPreferred skill:Deep knowledge of master data management conceptsImplementation experience with tools like Reltio, SAP MDG or Informatica MDMVisualization expertise in tools like Tableau, Power BI, Looker etcAbility to operate in a complex environment of multiple projects and stakeholders and to participate in several projects simultaneously.",
        "source": "Email",
        "date_posted": "2024-10-02 14:17:25-05:00",
        "unique_id": "1924ea9c6f5fc383",
        "emp_type": [
            "third party"
        ],
        "tag": "Business Analyst"
    }
]