[
    {
        "company": "Pennsylvania Department of Transportation",
        "job_title": ".Net Architect",
        "location": "Harrisburg, PA, USA",
        "full_location": {
            "city": "Harrisburg",
            "state": "PA",
            "country": "USA"
        },
        "job_details": {
            "employment_type": [
                "full-time",
                "third party"
            ],
            "experience_required": "10+ years",
            "degree_required": "Not specified",
            "visa_sponsorship": "No visa sponsorship",
            "notice_period": "Not specified",
            "duration": "6+ Month",
            "rate": "Not specified"
        },
        "skills": {
            "core": [
                ".NET",
                "Microsoft SQL",
                "Azure Cloud",
                "DevSecOps",
                "C#",
                "JavaScript",
                "T-SQL"
            ],
            "primary": [
                "Agile practices",
                "Unit testing",
                "Accessibility standards",
                "Software development lifecycle (SDLC)",
                "Mentoring"
            ],
            "secondary": [
                "Cross-platform solutions",
                "Technical documentation",
                "Project management",
                "Performance KPIs",
                "Configuration management tools"
            ],
            "all": [
                ".NET",
                "Microsoft SQL",
                "Azure Cloud",
                "DevSecOps",
                "C#",
                "JavaScript",
                "T-SQL",
                "Agile practices",
                "Unit testing",
                "Accessibility standards",
                "Software development lifecycle (SDLC)",
                "Mentoring",
                "Cross-platform solutions",
                "Technical documentation",
                "Project management",
                "Performance KPIs",
                "Configuration management tools"
            ]
        },
        "job_type": [
            "remote"
        ],
        "contact_person": "Shreya Singh",
        "email": "shreya@rconsultinginc.com",
        "jd": "From: shreya singh, RCI shreya@rconsultinginc.com Reply to: shreya@rconsultinginc.com Title : .Net ArchitectLocation : Harrisburg, PA , Remote \u2013 But candidates need to reside within an hour of HarrisburgDuration : 6+ Month Client \u2013 Pennsylvania Department of Transportation ***The method of interview is Round 1 virtual via Teams, then Round 2 in-person at The Keystone Building.***This is a position as a Functional Application Architect for Azure Cloud, .NET and Microsoft SQL supporting Transportation lines of business, specifically Public Transit problem domains. ***This position will be full-time telework with the caveat that there will be occasions that on-site meetings, JAD sessions and other collaboration needs could be mandatory. With that in mind all candidates must be roughly within an hour of central PA, specifically Harrisburg, PA 17120).*** Position Description:This is a position as a Functional Architect supporting Transportation lines of business, specifically Public Transit problem domains. The selected candidate will work with the agency\u2019s development team to engineer applications hosted on a standardized platform of Azure Cloud implementing .NET, front end frameworks, SQL Server, and SSRS. The ideal candidate would have experience in DevSecOps practices with a focus on reduced total cost of ownership and future ease of maintenance. Key deliverables will be cross-platform solutions that meet customer requirements for security, accessibility, and functionality.This position will oversee all phases of application development including design, coding/configuration, testing, implementation, and documentation. Activities to support this work include analyzing and documenting requirements, producing solution prototypes, and participating in technology selection. This position is responsible for tracking and communicating project constraints including, risks, time, resources, and scope.This team lead position is responsible for mentoring all levels of applications developers in the design, development, assembly, testing, and deployment of highly complex software systems used to support enterprise products and services.Specific Duties:\u00b7Design, develop, test, implement and document software solutions to meet business requirements\u00b7Review and recommend technical frameworks, technologies, and implementation patterns\u00b7Develop and participate in creating detailed project documentation, including plans, design specifications, roadmaps, models, and technical interfaces\u00b7Research and consume enterprise services for areas such as identity and access management, content management, and GIS\u00b7Collaborate with other technical teams to deliver services and solutions\u00b7Participate in development and implementation of holistic user management methodology for Public Transit business area\u00b7Implement unit testing methodologies such as NUnit or MSTest\u00b7Develop and implement data migration plans\u00b7Develop performance KPIs for solutions and implement tuning to support application and business needs\u00b7Analyze and write .NET C#, JavaScript, T-SQL, and other full-stack technologies that are recommended to implement the project deliverables\u00b7Utilize configuration management tools, design tools, debugging tools, and any other environment specific tools necessary to create, test, and implement an application\u00b7Build digital products with accessibility in mind\u00b7Incorporate accessibility features into digital content and resources\u00b7Partner with colleagues and team members to prioritize accessibility in digital content and resources\u00b7Develop capacity plans to implement technical solutions for project deliverables\u00b7Advise and participate in selection criteria development and candidate interviews for proposed team buildouts\u00b7Manages and directs application team tasking to complete project deliverables\u00b7Implement and participate in code review practices for application team\u2019s project solutions\u00b7Research and provide mentoring resources to project team on technologies to meet project needs\u00b7Provide regular status reports on assigned work to COPA teamSkills and Experience:A qualified candidate will have:\u00b710+ years of experience full-stack programming using .NET technologies\u00b710+ years of experience developing and supporting Microsoft SQL technologies\u00b75+ years of experience using DevSecOps/Agile practices\u00b75+ years of experience developing & designing solutions hosted in Azure Cloud\u00b75+ years of experience architecting, developing, & designing complex enterprise systems to meet business requirements\u00b75+ years of experience mentoring & leading technical teams\u00b7Strong oral and written communication skillsIdeal candidate qualifications include:\u00b75+ years of experience with unit test development, testing, and implementation in SDLC\u00b72+ years of experience building digital products where compliance with accessibility standards is part of \u201cdefinition of done\u201d Thanks and Regards_______________________________Shreya SinghResource Consultings Services Inc.Parsippany, NJ Email:shreya@rconsultinginc.com www.rconsultinginc.com",
        "source": "Email",
        "date_posted": "2024-10-02 16:41:31-05:00",
        "unique_id": "1924f2db191177a0",
        "emp_type": [
            "full-time",
            "third party"
        ],
        "tag": ".net developer"
    }
]