[
    {
        "company": "TEK INSPIRATIONS",
        "job_title": "Actimize Java Developer",
        "location": "New York, NY, USA",
        "full_location": {
            "city": "New York",
            "state": "NY",
            "country": "USA"
        },
        "job_details": {
            "employment_type": [
                "full-time",
                "third party"
            ],
            "job_code": "",
            "experience_required": "7+ years",
            "degree_required": "Not specified",
            "visa_sponsorship": "Not specified",
            "notice_period": "Not specified",
            "duration": "6+ months",
            "rate": "Not specified"
        },
        "skills": {
            "core": [
                "Actimize Suite",
                "RCM Customization",
                "RCM Development",
                "Core Java",
                "SQL"
            ],
            "primary": [
                "RCM Plugin Development",
                "Actimize scheduler",
                "Windows infrastructure",
                "Linux infrastructure",
                "Service Design Concepts"
            ],
            "secondary": [
                "Web Services",
                "XML",
                "REST",
                "SOAP",
                "JSON",
                "Perl",
                "UML diagrams",
                "Linux",
                "Shell Scripts"
            ],
            "all": [
                "Actimize Suite",
                "RCM Customization",
                "RCM Development",
                "Core Java",
                "SQL",
                "RCM Plugin Development",
                "Actimize scheduler",
                "Windows infrastructure",
                "Linux infrastructure",
                "Service Design Concepts",
                "Web Services",
                "XML",
                "REST",
                "SOAP",
                "JSON",
                "Perl",
                "UML diagrams",
                "Linux",
                "Shell Scripts"
            ],
            "with_experience": [
                "Actimize Suite",
                "RCM Customization",
                "RCM Development",
                "Core Java",
                "SQL"
            ]
        },
        "job_type": [
            "onsite"
        ],
        "contact_person": "SUBHAM DUBEY",
        "email": "subham.dubey@tekinspirations.com",
        "jd": "From: SUBHAM DUBEY, TEK INSPIRATIONS subham.dubey@tekinspirations.com Reply to: subham.dubey@tekinspirations.com Actimize/Java Developer\nLocation: New York, NY (onsite 3 days a week)\nDuration: 6+ months\nIn-person interviews - Local Candidates only\nBanking Domain\nMust Skills Required- 7+ years of appropriate technical experience- 4-5 + years Actimize Suite (RCM Customization)- Knowledge of RCM suite and customization- Proficiency in RCM Development \u2013 Alert Types, Views, DART, Workflows, Administration- Proficiency with RCM Plugin Development & Actimize scheduler- Strong understanding of Windows & Linux infrastructure- 5+ years of hands on experience working on Core Java- Strong Database skills including SQL, procedures and query tuning- Service Design Concepts, OO and Functional Development concepts- Strong oral and written communication skills- Excellent interpersonal skills and professional approach- Analytical & Self-Starter- Familiarity with financial market data\nSkills Desired- Web Services, XML, REST, SOAP, JSON, Perl- Read and create UML diagrams- Linux and Shell Scripts\nRemarks: hands-on Developer with Actimize & Java experience who can interface with Business teams in NY. Should have very strong communication and interpersonal skills.",
        "source": "Email",
        "date_posted": "2024-10-02 20:10:30-05:00",
        "unique_id": "1924fed02d867b81",
        "emp_type": [
            "full-time",
            "third party"
        ],
        "tag": "Java developer"
    }
]