[
    {
        "company": "Source Infotech Inc",
        "job_title": "Project Manager",
        "location": "USA",
        "full_location": {
            "city": "",
            "state": "",
            "country": "USA"
        },
        "job_details": {
            "employment_type": [
                "contract",
                "third party"
            ],
            "job_code": "",
            "experience_required": "5 years",
            "degree_required": "Any combination of education or experience equivalent to a bachelor\u2019s degree",
            "visa_sponsorship": "No visa sponsorship",
            "notice_period": "Not specified",
            "duration": "6+ months contract",
            "rate": "Not specified"
        },
        "skills": {
            "core": [
                "PM methodology",
                "SDLC methodologies",
                "Project management"
            ],
            "primary": [
                "Experience within state government",
                "Experience working with multiple teams"
            ],
            "secondary": [
                "Technical project management tools",
                "Analytical and problem-solving skills",
                "Advanced PC skills (Excel, Power Point, Word)",
                "Negotiation skills",
                "Communication skills"
            ],
            "all": [
                "PM methodology",
                "SDLC methodologies",
                "Project management",
                "Experience within state government",
                "Experience working with multiple teams",
                "Technical project management tools",
                "Analytical and problem-solving skills",
                "Advanced PC skills (Excel, Power Point, Word)",
                "Negotiation skills",
                "Communication skills"
            ],
            "with_experience": [
                "PM methodology",
                "SDLC methodologies",
                "Project management"
            ]
        },
        "job_type": [
            "remote"
        ],
        "contact_person": "Abhisek Kumar",
        "email": "abhisek.k@sourceinfotech.com",
        "jd": "From: abhisek, source infotech inc abhisek.k@sourceinfotech.com Reply to: abhisek.k@sourceinfotech.com Title: Project ManagerLocation: 100% RemoteDuration: 6+ months contractIV: Phone and VideoVisa: No H1b/CPT This is a very standard PM role, but it is fairly senior, so I need some who is confident and can communicate well. Top 3 Skills: Skill 1 - In depth knowledge/understanding of the PM methodology and a broad understanding/awareness of SDLC methodologiesSkill 2 - Experience within state governmentSkill 3 - Experience working with multiple teamsRequired Skill Set/Skill Level/Experience Any combination of education or experience equivalent to a bachelor\u2019s degree with five years of project management experience.In depth knowledge/understanding of the PM methodology and a broad understanding/awareness of SDLC methodologies.Strong understanding of government organization is preferred.Strong ability to work effectively in a business and technical environment.Effectively uses technical project management tools.Strong initiative and ability to set stretch goals.Strong ability to negotiate effectively with business and IT partners on business requirements and timeframes on mid-size initiatives.Strong ability to rally support among peers and work effectively within challenging situations.Strong analytical and problem-solving skills and the ability to balance the need to gather detail with the need to solve the problem.Strong ability to identify and apply different communication mediums based on a content and audience at all levels (both internal and external toMaine gov) to achieve intended goal. Advanced PC skills required (Excel, Power Point, Word, etc.) Preference given individuals that have experience with managing Vendors Thanks & RegardsAbhisek kumarSource Infotech IncP.O Box 577, EDISON, NJ 08818-0577Email: abhisek.k@sourceinfotech.comPhone: 609-934-3412 | | Hangout: abhishekchoudhary0948",
        "source": "Email",
        "date_posted": "2024-10-02 18:48:13-05:00",
        "unique_id": "1924feead56f3898",
        "emp_type": [
            "contract",
            "third party"
        ],
        "tag": "Project Manager"
    }
]