[
    {
        "company": "KKSA",
        "job_title": "Microsoft Dynamics CRM Architect",
        "location": "Houston, TX, USA",
        "full_location": {
            "city": "Houston",
            "state": "TX",
            "country": "USA"
        },
        "job_details": {
            "employment_type": [
                "contract",
                "third party"
            ],
            "job_code": "",
            "experience_required": "8+ years",
            "degree_required": "Bachelor of Engineering (Computer background preferred)",
            "visa_sponsorship": "Not specified",
            "notice_period": "Not specified",
            "duration": "Not specified",
            "rate": "Not specified"
        },
        "skills": {
            "core": [
                "Microsoft Dynamics CRM",
                "C#",
                ".NET"
            ],
            "primary": [
                "customizing Dynamics CRM",
                "SDK",
                "plugins",
                "workflows",
                "web resources",
                "Azure",
                "SQL Server",
                "JavaScript",
                "HTML",
                "CSS"
            ],
            "secondary": [
                "Kimball methodology",
                "Agile projects",
                "BDD concepts",
                "presentation skills",
                "communication skills",
                "organizational skills"
            ],
            "all": [
                "Microsoft Dynamics CRM",
                "C#",
                ".NET",
                "customizing Dynamics CRM",
                "SDK",
                "plugins",
                "workflows",
                "web resources",
                "Azure",
                "SQL Server",
                "JavaScript",
                "HTML",
                "CSS",
                "Kimball methodology",
                "Agile projects",
                "BDD concepts",
                "presentation skills",
                "communication skills",
                "organizational skills"
            ]
        },
        "job_type": [
            "onsite"
        ],
        "contact_person": "Sushant Kumar",
        "email": "sushant.s@kksoftwareassociates.com",
        "jd": "From: Sushant kumar, KKSA sushant.s@kksoftwareassociates.com Reply to: sushant.s@kksoftwareassociates.com Role: Microsoft Dynamics CRM Expertise with Solution and DesignLocation :: Houston, TXContractDay 1 Onsite 5 Days /week Who are we looking for?8 + Yrs. Microsoft Dynamics CRM Architect with C#. Net Experience with Solution and Design Experience Technical Skills: Proficiency in Microsoft technologies such as C#, .NET.Experience with customizing Dynamics CRM using SDK, plugins, workflows, web resources, and custom-developed solutions.Experience on Cloud technology like Azure.Familiarity with SQL ServerShould have hands on experience on JavaScript, HTML, CSSGood to have knowledge on Kimball methodology.Excellent presentation, communication, and organizational skillsAbility to work in a fast-paced environment.Ability to work both independently and as part of a team.Understand the data needs of the company or client.Collaborate with the stakeholders to design and build the model.Understand the company\u2019s data solution or product needs.Process Skills:Experience with Agile projectsExperience on BDD conceptsQualification:Bachelor of Engineering (Computer background preferred)",
        "source": "Email",
        "date_posted": "2024-10-02 07:40:38-05:00",
        "unique_id": "1924d3e8a92d1213",
        "emp_type": [
            "contract",
            "third party"
        ],
        "tag": ".net developer"
    }
]