[
    {
        "company": "iTech US Inc.",
        "job_title": "Java Developer with React",
        "location": "Quincy, MA, USA",
        "full_location": {
            "city": "Quincy",
            "state": "MA",
            "country": "USA"
        },
        "job_details": {
            "employment_type": [
                "contract",
                "third party"
            ],
            "experience_required": "10+ years",
            "degree_required": "Bachelor\u2019s degree in Computer Science, Engineering, or a related field.",
            "visa_sponsorship": "Visa sponsorship available",
            "notice_period": "Not specified",
            "duration": "Contract",
            "rate": "Not specified"
        },
        "skills": {
            "core": [
                "Java",
                "React.js",
                "Spring",
                "Spring Boot",
                "RESTful APIs"
            ],
            "primary": [
                "HTML5",
                "CSS3",
                "JavaScript (ES6+)",
                "SQL",
                "MySQL",
                "MongoDB",
                "Git",
                "Agile development methodologies"
            ],
            "secondary": [
                "Object-oriented programming (OOP)",
                "Design patterns",
                "JSON",
                "Web services",
                "Problem-solving",
                "Attention to detail",
                "Communication",
                "Teamwork"
            ],
            "all": [
                "Java",
                "React.js",
                "Spring",
                "Spring Boot",
                "RESTful APIs",
                "HTML5",
                "CSS3",
                "JavaScript (ES6+)",
                "SQL",
                "MySQL",
                "MongoDB",
                "Git",
                "Agile development methodologies",
                "Object-oriented programming (OOP)",
                "Design patterns",
                "JSON",
                "Web services",
                "Problem-solving",
                "Attention to detail",
                "Communication",
                "Teamwork"
            ]
        },
        "job_type": [
            "onsite"
        ],
        "contact_person": "Naveen Kumar",
        "email": "naveen.t@itechus.net",
        "jd": "From: Naveen Kumar, iTechUS naveen.t@itechus.net Reply to: naveen.t@itechus.net Hi,My name is Naveen Kumar, and I represent iTech US Inc. iTech is a global staff augmentation firm providing a wide-range of talent on-demand and total workforce solutions. We have job opening for the below role. Role: Java Developer with ReactLocation: Quincy, MA (Strictly Locals only)Duration: ContractExperience: 10+ yearsNote: F2F interview mandateVisa: H1B for C2C, other visa on W2 Role Description:Design, develop, and maintain Java-based applications.Build and optimize user interfaces using React.js.Collaborate with the product and design teams to translate requirements into technical specifications.Write efficient, reusable, and maintainable code following best practices.Integrate front-end elements with server-side logic.Develop APIs and backend services using Java frameworks such as Spring or Spring Boot.Conduct unit testing, debugging, and performance tuning to ensure code quality.Stay up to date with the latest Java and React.js technologies and frameworks.Collaborate in Agile development teams, contributing to project planning, code reviews, and sprints.Troubleshoot and resolve software defects in a timely manner.Qualifications:Bachelor\u2019s degree in Computer Science, Engineering, or a related field.3+ years of experience in Java development, preferably with Spring or Spring Boot.2+ years of experience in front-end development using React.js.Strong understanding of object-oriented programming (OOP) principles and design patterns.Experience with RESTful APIs, JSON, and web services.Proficient in HTML5, CSS3, and JavaScript (ES6+).Familiarity with database technologies (e.g., SQL, MySQL, MongoDB).Experience with version control systems such as Git.Strong problem-solving skills and attention to detail.Familiarity with Agile development methodologies.Excellent communication and teamwork skills. Thanks & RegardsNaveen KumariTechUS, Inc",
        "source": "Email",
        "date_posted": "2024-10-02 10:39:15-05:00",
        "unique_id": "1924de6ebd0d6c2f",
        "emp_type": [
            "contract",
            "third party"
        ],
        "tag": "Java developer"
    }
]