[
    {
        "company": "Crea services.LLC",
        "job_title": "Java Developer with Payment Domain Experience",
        "location": "Berkeley Heights, NJ, USA",
        "full_location": {
            "city": "Berkeley Heights",
            "state": "NJ",
            "country": "USA"
        },
        "job_details": {
            "employment_type": [
                "full-time",
                "third party"
            ],
            "experience_required": "7+ years",
            "degree_required": "Not specified",
            "visa_sponsorship": "Not specified",
            "notice_period": "Not specified",
            "duration": "Not specified",
            "rate": "Not specified"
        },
        "skills": {
            "core": [
                "Java",
                "GIT",
                "JIRA",
                "Maven",
                "Spring framework",
                "Spring Boot"
            ],
            "primary": [
                "React",
                "Node",
                "HTML",
                "CSS",
                "Agile methodology",
                "API",
                "Micro-Services"
            ],
            "secondary": [
                "PCF",
                "Spring Cloud",
                "Spring Data",
                "Spring Transactional",
                "Spring Batch",
                "Sonar",
                "Fortify",
                "Web Inspect",
                "Postman",
                "JMeter",
                "Apigee",
                "AWS",
                "GCP",
                "Kafka"
            ],
            "all": [
                "Java",
                "GIT",
                "JIRA",
                "Maven",
                "Spring framework",
                "Spring Boot",
                "React",
                "Node",
                "HTML",
                "CSS",
                "Agile methodology",
                "API",
                "Micro-Services",
                "PCF",
                "Spring Cloud",
                "Spring Data",
                "Spring Transactional",
                "Spring Batch",
                "Sonar",
                "Fortify",
                "Web Inspect",
                "Postman",
                "JMeter",
                "Apigee",
                "AWS",
                "GCP",
                "Kafka"
            ],
            "with_experience": [
                "Java (7+ years)",
                "Spring framework (Core, MVC, AOP, Java NIO)",
                "Full stack development (React, Node, HTML, CSS)",
                "Minimum 3 years of experience in Spring Boot",
                "Experience with payment services"
            ]
        },
        "job_type": [
            "remote",
            "onsite"
        ],
        "contact_person": "Mukesh",
        "email": "mkumar@creaservices.net",
        "jd": "From: Mukesh, Crea services.LLC mkumar@creaservices.net Reply to: mkumar@creaservices.net Role: Java Developer with Payment Domain ExperienceLocation: Berkeley Heights NJ OR Alpharetta GAInitial 2 months remote than 5 Days OnsiteWe need strong Payment Domain experience.Responsibilities:\u2022 Analyze complex processes and technological heterogenic applications.\u2022 Design software solutions in real-time, payment area.\u2022 Design/develop microservices for highly efficient protocol translation and enrichment with reactive design patterns.\u2022 Deliver end to end solutions for Payment APIs.\u2022 Develop high throughput and high-volume transaction APIs that can be consumed by omni channel platforms.\u2022 Enhance API solutions to consume APIs for payment customers.\u2022 Develop roadmap and strategies for documenting and presenting API specifications in consumable format.\u2022 Develop roadmap and strategies to provide Client Libraries and SDKs for API products. Required skills:\u2022 7+ years\u2019 experience in Java, GIT, JIRA, Maven, Confluence, Spring framework (Core, MVC, AOP, Java NIO).\u2022 Previous experience with full stack development (React, Node, HTML, CSS).\u2022 Minimum 3 years of experience in Spring Boot.\u2022 Spring framework experience; webflux experience; agile methodology.\u2022 Expertise implementing complex full stack solutions including digital and mobile systems, API, and Micro-Services in large Enterprise organizations.\u2022 Experience with payment services (digital wallet, online digital payments, or subscription services) in the Financial Industry. Preferred skills:\u2022 Experience in PCF or related cloud platform (API management).\u2022 Hands-on experience with Spring Cloud, Spring Data, Spring Transactional and Spring Batch.\u2022 Experience in implementing high volume transactions processing applications.\u2022 Experience with quality and security scan tools such as Sonar, Fortify and Web Inspect.\u2022 Experience in Integration Testing APIs with Postman, JMeter etc.\u2022 Apigee in AWS and GCP.\u2022 Kafka for streaming, persistence, and reporting.",
        "source": "Email",
        "date_posted": "2024-10-02 16:31:07-05:00",
        "unique_id": "1924f72767118da6",
        "emp_type": [
            "full-time",
            "third party"
        ],
        "tag": "Java developer"
    }
]