[
    {
        "company": "Appian Infotech",
        "job_title": "Release Train Engineer (RTE)",
        "location": "Fountain Valley, CA, USA",
        "full_location": {
            "city": "Fountain Valley",
            "state": "CA",
            "country": "USA"
        },
        "job_details": {
            "employment_type": [
                "contract",
                "third party"
            ],
            "experience_required": "Not specified",
            "degree_required": "Not specified",
            "visa_sponsorship": "Not specified",
            "notice_period": "Not specified",
            "duration": "Long Term Contract",
            "rate": "Not specified"
        },
        "skills": {
            "core": [
                "Agile Framework Expertise",
                "Release Train Orchestration",
                "Facilitation and Communication",
                "Problem Solving",
                "Metrics and Reporting",
                "Continuous Improvement",
                "Servant Leadership"
            ],
            "primary": [
                "Leadership Skills",
                "Problem-Solving and Critical Thinking",
                "Communication Skills",
                "Technical Knowledge",
                "Organizational Change Management",
                "Conflict Resolution",
                "SAFe Certification"
            ],
            "secondary": [],
            "all": [
                "Agile Framework Expertise",
                "Release Train Orchestration",
                "Facilitation and Communication",
                "Problem Solving",
                "Metrics and Reporting",
                "Continuous Improvement",
                "Servant Leadership",
                "Leadership Skills",
                "Problem-Solving and Critical Thinking",
                "Communication Skills",
                "Technical Knowledge",
                "Organizational Change Management",
                "Conflict Resolution",
                "SAFe Certification"
            ],
            "with_experience": []
        },
        "job_type": [
            "onsite"
        ],
        "contact_person": "Abhishek Choudhary",
        "email": "abhishek.c@appianinfotech.com",
        "jd": "From: Abhishek Choudhary, Appian Infotech abhishek.c@appianinfotech.com Reply to: abhishek.c@appianinfotech.com Job Title: Release Train Engineer (RTE)Location: Fountain Valley CaliforniaDuration: Long Term Contract Job Description Agile Framework Expertise: The RTE must be well-versed in Agile principles, frameworks, and processes. They frequently deal with the Scaled Agile Framework (SAFe), so a thorough understanding of SAFe principles is essential. Understanding Lean-Agile practices and principles, as well as the SAFe Big Picture, is part of this. 2. Release Train Orchestration: The RTE is primarily responsible for orchestrating and facilitating the Agile Release Train (ART). Ensure alignment, prioritization, and value delivery across different Agile teams. They are in charge of program increment (PI) planning, coordination, and execution. 3. Facilitation and Communication: Strong facilitation and communication abilities are required. The RTE facilitates important rituals like PI planning, inspect and adapt workshops, and Scrum of Scrums. They make certain that teams are aligned and focused on common goals. 4. Problem Solving: The RTE frequently encounters difficult problems and constraints that might hinder work flow. They must detect and solve concerns as soon as possible, collaborating with teams to discover solutions and maintain progress. 5. Metrics and Reporting: RTEs are in charge of tracking and reporting on the ART s progress. This contains data for crew performance, program progress, and the train s overall health. Decisions must be based on data. Should have used ADO for PI Planning. 6. Continuous Improvement: The RTE is accountable for building a culture of continuous improvement as an Agile champion. They support retrospectives and assist teams in identifying opportunities for improvement in both procedures and practices. 7. Servant Leadership: The RTE serves as a servant leader, supporting and guiding teams, Scrum Masters, and Product Owners. They seek to remove barriers and empower teams to effectively self-organize. Skills of a Release Train Engineer 1. Leadership Skills: A strong leader with the capacity to motivate and influence teams is required for an effective RTE. They provide a good example and embody the concepts of Agile and Lean thinking. 2. Problem-Solving and Critical Thinking: An RTE must be able to assess complicated challenges, identify root causes, and provide effective solutions. They should be knowledgeable about root cause analysis approaches. 3. Communication Skills: Communication must be clear, straightforward, and compassionate. The RTE must effectively communicate with teams, stakeholders, and leadership to ensure alignment and understanding. 4. Technical Knowledge: While not necessarily required, having technical knowledge or experience in software development can be beneficial in understanding the ART s work and effectively conducting technical talks. 5. Organizational Change Management: The RTE is frequently used to guide firms through Agile transitions. Understanding the principles and techniques of change management is advantageous. 6. Conflict Resolution: Conflicts can occur inside teams as well as at the program level. To maintain a harmonious and productive atmosphere, the RTE must be skilled in dispute resolution and negotiation. 7. SAFe Certification.",
        "source": "Email",
        "date_posted": "2024-10-02 15:21:37-05:00",
        "unique_id": "1924ee48daf47a47",
        "emp_type": [
            "contract",
            "third party"
        ],
        "tag": "Scrum Master"
    }
]