[
    {
        "company": "Tanisha Systems",
        "job_title": "Lead .Net Full Stack Developer",
        "location": "Chandler, AZ, USA",
        "full_location": {
            "city": "Chandler",
            "state": "AZ",
            "country": "USA"
        },
        "job_details": {
            "employment_type": [
                "contract",
                "third party"
            ],
            "experience_required": "10+ years",
            "degree_required": "Not specified",
            "visa_sponsorship": "Not specified",
            "notice_period": "Not specified",
            "duration": "Not specified",
            "rate": "Not specified"
        },
        "skills": {
            "core": [
                ".Net",
                "Micro Services",
                "Angular",
                "Junit",
                "Selenium"
            ],
            "primary": [
                "C#.NET",
                "Kafka",
                "Data Modeling",
                "microservices development",
                "API enablement",
                "Mongo DB",
                "Agile",
                "Iterative",
                "Waterfall"
            ],
            "secondary": [
                "Java Script",
                "SOAP",
                "MQ Series",
                "Visual Studio",
                "SQL",
                "Apigee",
                "PCF",
                "AES",
                "schedulers like Autosys",
                "Linux Servers",
                "source control tools",
                "Financial Services Companies"
            ],
            "all": [
                ".Net",
                "Micro Services",
                "Angular",
                "Junit",
                "Selenium",
                "C#.NET",
                "Kafka",
                "Data Modeling",
                "microservices development",
                "API enablement",
                "Mongo DB",
                "Agile",
                "Iterative",
                "Waterfall",
                "Java Script",
                "SOAP",
                "MQ Series",
                "Visual Studio",
                "SQL",
                "Apigee",
                "PCF",
                "AES",
                "schedulers like Autosys",
                "Linux Servers",
                "source control tools",
                "Financial Services Companies"
            ]
        },
        "job_type": [
            "onsite"
        ],
        "contact_person": "Abhishek Yadav",
        "email": "abhishek.yadav@tanishasystems.com",
        "jd": "Hello ,This is Abhishek Yadav from Tanisha Systems . I am hiring for below urgent role in Chandler, AZ.Here are the Job Details:- Title : Lead .Net Full Stack DeveloperLocation : Chandler, AZType- ContractExp. 10 + YearsNote- Please share only Lead profiles. Job description Responsibilities:Provide engineering guidance to other LOBs, help mentor senior engineers, and keep abreast with industry trends and issues. Collaborate with key partners such as Auto Lending Product Strategy & Delivery, Architecture, Engineering and Platform and application development teams in articulating current and future state of the Auto Lending technology landscape.Need to have working experience in system development methodology. Ability to utilize a thorough understanding of applicable technology, tools and existing designs. Analyzes highly complex business requirements and has the ability to write a complex functional system design to meet business requirements. Leads a team of and provides direction to less experienced analysts and developers on projects. Develop new documentation for departmental procedures, training and user guides. Assures quality, security, business continuation plan and compliance requirements are met and documented for supported area Required Qualifications, US:7+ years of Engineering experience, or equivalent demonstrated through one or a combination of the following: work experience, training, military experience, education7+ years of Software Engineering experience with C#.NET, Kafka and other languages3+ years of Data Modeling experience3+ years of microservices development experience and API enablementExperience in Mongo DB5+ years of experience with full Software Development Life Cycle using Agile, Iterative and/or Waterfall methodologies.Must be strong in: .Net, Micro Services, Angular, Junit, Selenium Must be competent in: Java Script, SOAP, MQ Series, Visual Studio, SQL, Apigee, PCF, AES Strong verbal, written, and interpersonal communication skillsAbility to multi-task in a fast-paced environment.Excellent analytical, decision-making and troubleshooting skills. Experience creating sizing or work estimates.Strong analytical skills with high attention to detail and accuracyExcellent verbal, written, and interpersonal communication skillsExperience with database data modelingExperience in using source control tools Experience in working for Financial Services Companies (nice to have)Desired Qualifications:An industry-standard technology certification in .NetStrong verbal, written, and interpersonal communication skillsAbility to multi-task in a fast-paced environment.Excellent analytical, decision-making and troubleshooting skills. Experience creating sizing or work estimates.Strong analytical skills with high attention to detail and accuracyExcellent verbal, written, and interpersonal communication skillsExperience with schedulers like AutosysExperience with database data modelingExperience working on Linux ServersExperience in using source control toolsExperience in working for Financial Services Companies",
        "source": "Email",
        "date_posted": "2024-10-02 14:27:00-05:00",
        "unique_id": "1924f527e4694ba4",
        "emp_type": [
            "contract",
            "third party"
        ],
        "tag": ".net developer"
    }
]