[
    {
        "company": "BLACKAPPLE SOLUTIONS",
        "job_title": "Java-Microservices Developer",
        "location": "Charlotte, NC, USA",
        "full_location": {
            "city": "Charlotte",
            "state": "NC",
            "country": "USA"
        },
        "job_details": {
            "employment_type": [
                "third party"
            ],
            "job_code": "",
            "experience_required": "Not specified",
            "degree_required": "Not specified",
            "visa_sponsorship": "Not specified",
            "notice_period": "Not specified",
            "duration": "Not specified",
            "rate": "Not specified"
        },
        "skills": {
            "core": [
                "Java 8",
                "Java 11",
                "microservices",
                "spring boot",
                "Rest API's",
                "Kubernetes",
                "JPA",
                "Hibernate"
            ],
            "primary": [
                "NodeJS",
                "ExpressJS",
                "Django",
                "MySQL",
                "SQL SERVER",
                "PostgreSQL",
                "MongoDB",
                "Oracle Database",
                "AWS",
                "EC2",
                "EKS",
                "S3 Bucket",
                "IAM",
                "Agile Scrum",
                "Kafka",
                "Terraform",
                "Docker"
            ],
            "secondary": [
                "Devops CI/CD",
                "Jenkins",
                "ORM Tools",
                "AWS certification",
                "Module lead experience",
                "Software development best practices",
                "Version control",
                "Web Hosting Platforms",
                "Distributed Systems",
                "Data Lake",
                "Data Mesh"
            ],
            "all": [
                "Java 8",
                "Java 11",
                "microservices",
                "spring boot",
                "Rest API's",
                "Kubernetes",
                "JPA",
                "Hibernate",
                "NodeJS",
                "ExpressJS",
                "Django",
                "MySQL",
                "SQL SERVER",
                "PostgreSQL",
                "MongoDB",
                "Oracle Database",
                "AWS",
                "EC2",
                "EKS",
                "S3 Bucket",
                "IAM",
                "Agile Scrum",
                "Kafka",
                "Terraform",
                "Docker",
                "Devops CI/CD",
                "Jenkins",
                "ORM Tools",
                "AWS certification",
                "Module lead experience",
                "Software development best practices",
                "Version control",
                "Web Hosting Platforms",
                "Distributed Systems",
                "Data Lake",
                "Data Mesh"
            ]
        },
        "job_type": [],
        "contact_person": "Amy Jones",
        "email": "amyj@blackapple-solutions.com",
        "jd": "From: Amy Jones, BLACKAPPLE SOLUTIONS amyj@blackapple-solutions.com Reply to: amyj@blackapple-solutions.com Role : Java-Microservices developerTechnical Skills:Java developer requires skills -\u200e\u200e Backend Technologies (Java 8, Java 11, microservices, spring boot, Rest API's) \u2013 Must have All .\u200e Frameworks (NodeJS or ExpressJS, Django) - Must haves one of them.\u200e Database Management Systems (MySQL, SQL SERVER and PostgreSQL, MongoDB, and Oracle Database).\u200e Version Control, and Web Hosting Platforms (Kubernetes), - M ust have Kunbernates.\u200e Devops CI/CD, Jenkins, Terraform, Docker. - Optional\u200e ORM Tools(JPA, Hibernate) - must have.\u200e AWS, Cloud Services (EC2, EKS, S3 Bucket, IAM) \u2013 Must have AWS, Optional AWS certification\u200e Agile Scrum exposure \u2013 M ust have.\u200e Module lead experience preferred (not mandatory)\u2013 must be in a position to work independently.\u200e Is well versed with software development best practices.\u200e\u200e Must have skillsets- Kafka, Terraform, OAuth, Oracle, AWS, Terraform, Aurora PostgresSQL, Kafka, MSK, SQS, Distributed Systems.\u200e\u200e Application Technology - Java, Rest, Spring, Kafka, Data Lake, Data Mesh, AWS, Terraform.\u200e\u200e Candidate should have Good Appetite to learn & Communication should be good.\u200e At least 50% needs to have hands-on experience with AWS environments.Process Skills: Design, Development, Testing, ImplementationBehavioral Skills :Experience working with offshore / onshore modelStrong communication skills and able to work effectively in a team environment.Must have strong knowledge in Object oriented development, version control, release management, change management",
        "source": "Email",
        "date_posted": "2024-10-02 10:59:57-05:00",
        "unique_id": "1924e130b1872bc5",
        "emp_type": [
            "third party"
        ],
        "tag": "Java developer"
    }
]