[
    {
        "company": "CareFirst",
        "job_title": "Lead Cloud Engineer",
        "location": "USA",
        "full_location": {
            "city": "",
            "state": "",
            "country": "USA"
        },
        "job_details": {
            "employment_type": [
                "contract",
                "third party"
            ],
            "job_code": "",
            "experience_required": "14+ years",
            "degree_required": "Bachelor's",
            "visa_sponsorship": "Not specified",
            "notice_period": "Not specified",
            "duration": "Long-Term",
            "rate": "Not specified"
        },
        "skills": {
            "core": [
                "Azure VM experience",
                "multi-cloud platforms",
                "automation",
                "scripting"
            ],
            "primary": [
                "Azure Cloud services",
                "Linux Operating Systems",
                "Windows Operating Systems",
                "server configurations",
                "networking",
                "storage",
                "security principals"
            ],
            "secondary": [
                "Azure Active Directory",
                "Landing Zone",
                "Microsoft Entra ID",
                "Azure Architect certification",
                "Active Azure Administrator certification",
                "Azure Cloud Fundamentals certification",
                "prior healthcare payer experience",
                "PowerShell scripting"
            ],
            "all": [
                "Azure VM experience",
                "multi-cloud platforms",
                "automation",
                "scripting",
                "Azure Cloud services",
                "Linux Operating Systems",
                "Windows Operating Systems",
                "server configurations",
                "networking",
                "storage",
                "security principals",
                "Azure Active Directory",
                "Landing Zone",
                "Microsoft Entra ID",
                "Azure Architect certification",
                "Active Azure Administrator certification",
                "Azure Cloud Fundamentals certification",
                "prior healthcare payer experience",
                "PowerShell scripting"
            ],
            "with_experience": [
                "Azure VM experience",
                "multi-cloud platforms",
                "automation",
                "scripting"
            ]
        },
        "job_type": [
            "remote"
        ],
        "contact_person": "Avinash Kumar",
        "email": "avinash@zealhire.com",
        "jd": "From: Avinash Kumar, ZealHire Inc avinash@zealhire.com Reply to: avinash@zealhire.com Position: Lead Cloud EngineerLocation: RemoteDuration: Long-Term ContractVisa Status: Only USC/GC Desired Years of experience:- 14+ Years Job Description: USC/GCneed LinkedIn, VISA DL2 references Primarily remote, local candidates are required to report to OM, Canton or Owings Mills at least once per quarter CareFirst is looking for a Lead Cloud Engineer to support the implementation, 24x7 operational support, automation, availability, and performance management of CareFirst\u2019s public cloud platforms. (80% Azure /10% AWS/10% Oracle Cloud). This infrastructure supports critical applications including Claims Processing, Enrollment, Financial and Portal Websites.Responsible for leading the evaluation of application and infrastructure cloud readiness, and work on the cloud migration plan to support on-premise migration to a cloud service Required-\u2022 15+ years of overall IT architecture, infrastructure and/or administration experience \u2022 4+ years of hands-on experience in multi-cloud platforms (Storage, Network, Backup, Database Support) \u2013 Azure VM experience required \u2022 Broad foundational IT skillset including supporting Azure Cloud services, Linux/Windows Operating Systems, server configurations (including networking, storage and security principals) \u2022 Hands-on automation and scripting experience Nice to have-\u2022 Azure Active Directory, Landing Zone, Microsoft Entra ID \u2022 Azure Architect certification, Active Azure Administrator certification or Azure Cloud Fundamentals certification \u2022 Prior healthcare payer experience \u2022 PowerShell scripting experience Education- Bachelor's",
        "source": "Email",
        "date_posted": "2024-10-02 08:44:11-05:00",
        "unique_id": "1924d90b62e6ff06",
        "emp_type": [
            "contract",
            "third party"
        ],
        "tag": "Azure Data Engineer"
    }
]