[
    {
        "company": "SUS Infotek",
        "job_title": "Database Admin",
        "location": "Plano, TX, USA",
        "full_location": {
            "city": "Plano",
            "state": "TX",
            "country": "USA"
        },
        "job_details": {
            "employment_type": [
                "contract",
                "third party"
            ],
            "job_code": "",
            "experience_required": "12 years",
            "degree_required": "Bachelor\u2019s degree in computer science, Information Technology, or a related field.",
            "visa_sponsorship": "Not specified",
            "notice_period": "Not specified",
            "duration": "12 month C2H",
            "rate": "Not specified"
        },
        "skills": {
            "core": [
                "Database Administration",
                "Oracle",
                "SQL Server",
                "SQL",
                "Database Backup and Recovery"
            ],
            "primary": [
                "Query Optimization",
                "Data Security",
                "Compliance Standards"
            ],
            "secondary": [
                "Cloud Database Services",
                "Azure SQL Database",
                "Snowflake",
                "NoSQL Databases",
                "MongoDB",
                "DynamoDB",
                "Database Automation",
                "Monitoring Tools"
            ],
            "all": [
                "Database Administration",
                "Oracle",
                "SQL Server",
                "SQL",
                "Database Backup and Recovery",
                "Query Optimization",
                "Data Security",
                "Compliance Standards",
                "Cloud Database Services",
                "Azure SQL Database",
                "Snowflake",
                "NoSQL Databases",
                "MongoDB",
                "DynamoDB",
                "Database Automation",
                "Monitoring Tools"
            ]
        },
        "job_type": [
            "hybrid"
        ],
        "contact_person": "Amit Panthri",
        "email": "ap@susinfotek.com",
        "jd": "From: AMIT, SUS ap@susinfotek.com Reply to: ap@susinfotek.com Position: Database Admin\nLocation: Hybrid in Plano, TX\nDuration: 12 month C2H\nPhone and Skype USC\nQualifications:\nBachelor\u2019s degree in computer science, Information Technology, or a related field.\nAt least 12 years of experience as a Database Administrator or in a similar role.\nProficiency in database management systems such as Oracle, or SQL Server.\nStrong knowledge of SQL and experience with query optimization.\nFamiliarity with database backup and recovery tools and techniques.\nUnderstanding of data security and compliance standards (e.g., GDPR).\nExcellent problem-solving skills and attention to detail.\nStrong communication and collaboration abilities.\nPreferred Qualifications:\nExperience with cloud database services (e.g., Azure SQL Database, Snowflake).\nFamiliarity with NoSQL databases (e.g., MongoDB, DynamoDB).\nKnowledge of database automation and monitoring tools.\nRegards,\nAmit Panthri\nSr. Technical Recruiter\nE: ap@susinfotek.com",
        "source": "Email",
        "date_posted": "2024-10-02 10:51:48-05:00",
        "unique_id": "1924e1c32a9f0fef",
        "emp_type": [
            "contract",
            "third party"
        ],
        "tag": "DB Admin"
    }
]