[
    {
        "company": "Tek Inspirations LLC",
        "job_title": "Business Analyst",
        "location": "Richmond, VA, USA",
        "full_location": {
            "city": "Richmond",
            "state": "VA",
            "country": "USA"
        },
        "job_details": {
            "employment_type": [
                "contract",
                "third party"
            ],
            "job_code": "",
            "experience_required": "5 years",
            "degree_required": "Not specified",
            "visa_sponsorship": "Not specified",
            "notice_period": "Not specified",
            "duration": "6+ months",
            "rate": "Not specified"
        },
        "skills": {
            "core": [
                "system design",
                "business requirements gathering",
                "test plans",
                "PeopleSoft Financials",
                "workflow documentation"
            ],
            "primary": [
                "quality assurance validation",
                "user acceptance testing",
                "regression testing",
                "training materials development",
                "General Ledger",
                "Accounts Payable",
                "Purchasing",
                "Receivable",
                "Billing",
                "Asset Management"
            ],
            "secondary": [
                "interpersonal skills",
                "communication skills",
                "self-starter",
                "detail oriented",
                "project experience with COV projects"
            ],
            "all": [
                "system design",
                "business requirements gathering",
                "test plans",
                "PeopleSoft Financials",
                "workflow documentation",
                "quality assurance validation",
                "user acceptance testing",
                "regression testing",
                "training materials development",
                "General Ledger",
                "Accounts Payable",
                "Purchasing",
                "Receivable",
                "Billing",
                "Asset Management",
                "interpersonal skills",
                "communication skills",
                "self-starter",
                "detail oriented",
                "project experience with COV projects"
            ]
        },
        "job_type": [
            "hybrid"
        ],
        "contact_person": "Payal Shrivastava",
        "email": "payal.shrivastava@tekinspirations.com",
        "jd": "From: Payal Shrivastava, Tek Inspirations LLC payal.shrivastava@tekinspirations.com Reply to: payal.shrivastava@tekinspirations.com Title: Business Analyst Hybrid- 3-4 days per week will be onsiteLocation: Richmond, VA- Looking for LOCAL Candidates ONLY from Richmond, VA with any address proofDuration: 6+ months Interview Process: Both Web Cam and In Person InterviewOur client is looking for a Business Analyst with documentation and testing experience in support of PeopleSoft Financials systems.Responsibilities:Responsible for business analysis, functional/technical documentation and test planning of PeopleSoft Financials system utilized by Fiscal Services.This person will work closely with a small team of technical analysts and financial officers as they work to streamline both the security and the operations of its PeopleSoft Financials system.Will work closely with stakeholders, Fiscal Subject Matter Experts (SMEs), and DGS, Information Systems and Services (ISS) development teams.Report to the ISS Project manager.Documenting changes to PeopleSoft processesDocumenting PeopleSoft configurationsDocumenting business workflows related to PeopleSoftPreparing user and technical documentationDeveloping test plansWorking with customer SMEs and project team to develop business requirements in response to requests for systems enhancements, modifications, and newly identified business initiatives.Working with ISS technical team and vendors to ensure requirements are incorporated into systems design and testing.Developing business requirements documentation and flow diagrams \u2013 this work may expand into technical requirements gathering, design, and systems documentation.Actively participating in functional and systems integration unit testing; creating use case scenarios, test plans, and testing results.Assisting with testing and track testing resultsDeveloping and presenting training to Fiscal Services and agency usersMeeting regularly with customer and project teams and regularly demonstrating quality work output.Keeping the Business Owner and ISS technical team informed of key issues that may impact project implementation.Strong interpersonal and communication skillsThe successful candidate should be a self-starter with the ability to drive work to completion.Please note we are looking for a self-motivated and proactive Business Analyst who is detail oriented.Must Have Required Skills:5 Years - Experience in system design and development, with a focus on process improvement and business and technical requirements gathering5 Years - Experience developing test plans, use cases, and performing quality assurance validation, user acceptance testing, and regression testing2 Years - Experience with PeopleSoft Financials2 Years - Experience documenting workflow processes5 Years - Experience in the development of training materials and conducting user training2 Years - Specific experience with General Ledger, Accounts Payable, Purchasing (functionality limited to storing POs and Receipts for matching), Receivable, Billing and Asset Management for Lease Administration.1 Years - Project experience with COV projects.",
        "source": "Email",
        "date_posted": "2024-10-02 08:36:50-05:00",
        "unique_id": "1924d71fe3c895cd",
        "emp_type": [
            "contract",
            "third party"
        ],
        "tag": "Business Analyst"
    }
]