[
    {
        "company": "RohaTech",
        "job_title": "Java Developer",
        "location": "New York, NY, USA",
        "full_location": {
            "city": "New York",
            "state": "NY",
            "country": "USA"
        },
        "job_details": {
            "employment_type": [
                "full-time",
                "third party"
            ],
            "experience_required": "6+ years",
            "degree_required": "Not specified",
            "visa_sponsorship": "No visa sponsorship",
            "notice_period": "Not specified",
            "duration": "Not specified",
            "rate": "$53-$55/hour"
        },
        "skills": {
            "core": [
                "Java 8",
                "Java 11",
                "Spring Boot",
                "Microservices",
                "REST APIs"
            ],
            "primary": [
                "AWS",
                "CI/CD",
                "Agile"
            ],
            "secondary": [],
            "all": [
                "Java 8",
                "Java 11",
                "Spring Boot",
                "Microservices",
                "REST APIs",
                "AWS",
                "CI/CD",
                "Agile"
            ]
        },
        "job_type": [
            "onsite"
        ],
        "contact_person": "Ravikanth Naraharisetty",
        "email": "ravi@rohatech.com",
        "jd": "From: Ravikanth, Roha Technologies LLC ravi@rohatech.com Reply to: ravi@rohatech.com I hope this email finds you well.My name is Ravikanth , and I am reaching out to share an exciting job opportunity at RohaTech. We are currently looking for a skilled Java Developer to join our team in Phoenix AZ OR New York .If you or someone you know possesses the required skills and is interested in this opportunity, please feel free to reach out to me at ravi@rohatech.com for further details.About Us:Rohatech LLC is a leading Recruitment company specializing in Technical and Functional Roles . We are at the forefront of innovation, constantly striving to improve our technology stack and provide exceptional solutions to our clients. POSITION : Java Developer - American Express (Day 1 Onsite, New York)\ud83d\ude80 Exciting Opportunity! Java Developer Wanted \ud83d\ude80\ud83d\udd39 Client: American Express Through Intraedge \ud83d\udd39 Location: New York, NY (Day 1 Onsite) AND Phoenix, AZ \ud83d\udd39 Experience: 6+ years\ud83d\udd39 Skills: Java 8/11, Spring Boot, Microservices, REST APIs, AWS, CI/CD, Agile\ud83d\udd39 Employment Type: Full-time, Day 1 Onsite (Max PayRate : 53-55$)Only Hl visas accepeted or Dependent visas NO GC or GC EAD We're seeking an experienced Java Developer to join the American Express team in New York! If you have strong experience in Java, Spring Boot, and Microservices, and are excited about building scalable solutions in a dynamic environment, this could be the perfect fit for you.What You\u2019ll Do:Design and develop high-quality applicationsCollaborate with cross-functional teamsImplement cloud-based solutionsEnsure code quality with unit tests and TDD/BDD practicesWhy Join Us?Be part of a world-class team at AmexEngage in exciting projects in a fast-paced environmentCompetitive salary and benefitsPlease ensure to attach the following documents with the submission:VisaDriver's LicensePassport ProofsIn order to screen your consultant, we must have all the details listed below. Kindly ensure all information is accurate Screening DetailsFull Name:- Phone Number:- Email:- Linkedin:-Current Location:- Open to Relocation:-Passport Number:- Visa Status:-DOB(Including Year):- Total Experience:-US Experience:-Relevant Experience:-Complete Education:-Availability to Join:-H1 Employer DetailsName:Email:Contact : Thank you for your cooperation, and we look forward to receiving the necessary details.Best regards, Ravikanth Naraharisetty RohaTech.Reach ME at Below +91-7036012291 WhatsApp Me Ravi@rohatech.comhttps://www.linkedin.com/in/raviroha/ \ud83d\udce7 Apply today by sharing your updated resume at Ravi@rohatech.com Reach ME at Below +91-7036012291 WhatsApp Me Let's build something amazing together!",
        "source": "Email",
        "date_posted": "2024-10-02 13:36:01-05:00",
        "unique_id": "1924e83e3d788bc9",
        "emp_type": [
            "full-time",
            "third party"
        ],
        "tag": "Java developer"
    }
]