[
    {
        "company": "IT Strategies Inc",
        "job_title": "MS .Net",
        "location": "Columbus, OH, USA",
        "full_location": {
            "city": "Columbus",
            "state": "OH",
            "country": "USA"
        },
        "job_details": {
            "employment_type": [
                "full-time",
                "third party"
            ],
            "job_code": "JOB ID-748164",
            "experience_required": "15+ years",
            "degree_required": "Under grad",
            "visa_sponsorship": "Not specified",
            "notice_period": "Not specified",
            "duration": "10/28/24 to 06/30/25",
            "rate": "Not specified"
        },
        "skills": {
            "core": [
                ".NET",
                "C#",
                "MVC",
                "SOA"
            ],
            "primary": [
                "PL/SQL",
                "stored procedures",
                "JQuery",
                "KnockoutJS",
                "Bootstrap",
                "Angular",
                "SSRS",
                "SSIS"
            ],
            "secondary": [],
            "all": [
                ".NET",
                "C#",
                "MVC",
                "SOA",
                "PL/SQL",
                "stored procedures",
                "JQuery",
                "KnockoutJS",
                "Bootstrap",
                "Angular",
                "SSRS",
                "SSIS"
            ]
        },
        "job_type": [
            "hybrid"
        ],
        "contact_person": "Merugu Mahesh",
        "email": "mahesh.b@itstrategiesinc.com",
        "jd": "Hi this is Mahesh working with IT Strategies, we have the following requirement with one of our clients. Please find the below job details and kindly respond me back with your updated \u201cMS WORD\u201d version resume cover letter along with rate/salary and contact detailsNEED ONLY LOCALS- NEED 15 YEARS EXPERIENCE Client is State of OhioAgency is INS (Insurance)Role : MS .Net (Please read \"Mandatory Skills\")(JOB ID-748164)Work location : Columbus HYBRID, 2 days a week for nowInterview: Video or InPersonStart and end Date : 10/28/24 to 06/30/25 Short Description Senior .Net ProgrammerHybrid 2days in office, 3 days remote. Please note this is Subject to change Complete Description Years of Relevant Experience:15+ years of .Net programming experiencePreferred Education:Under gradJob Description:Modify existing on-prem .net 4.5 enterprise application for enhancements.Need good understanding of Service Oriented architecture, Knockout JS, J-QueryLead technical and end-user resources to execute detailed tests and analyze testing results.Document and communicate issues, solutions, and timelines to appropriate stakeholders Mandatory skills Experience in developing using Microsoft .NET, C#, MVC, SOAExperience with PL/SQL and stored procedures in OracleExperience in JQuery, KnockoutJS ,Bootstrap , Angular Experience with SSRS, SSIS",
        "source": "Email",
        "date_posted": "2024-10-02 09:49:25-05:00",
        "unique_id": "1924db5aff1b085a",
        "emp_type": [
            "full-time",
            "third party"
        ],
        "tag": ".net developer"
    }
]