[
    {
        "company": "Cognizant",
        "job_title": "Python Developer",
        "location": "Plano, TX, USA",
        "full_location": {
            "city": "Plano",
            "state": "TX",
            "country": "USA"
        },
        "job_details": {
            "employment_type": [
                "contract",
                "third party"
            ],
            "experience_required": "Not specified",
            "degree_required": "Not specified",
            "visa_sponsorship": "Not specified",
            "notice_period": "Not specified",
            "duration": "Not specified",
            "rate": "Not specified"
        },
        "skills": {
            "core": [
                "Python"
            ],
            "primary": [],
            "secondary": [],
            "all": [
                "Python"
            ]
        },
        "job_type": [
            "onsite"
        ],
        "contact_person": "Isaac",
        "email": "isaac@centraprise.com",
        "jd": "From: Isaac, Centraprise isaac@centraprise.com Reply to: isaac@centraprise.com Hi Professional, I am writing to let you know regarding a job opportunity as \u201cPython Developer\u201d with \u201cCognizant\u201d. Mentioned is the job description for your review. Job Title: Python Developer Location: Plano TX (Day One Onsite) Need Ex JPMC OR Ex CognizantJob Type: Contract Job Description: Python Developer If interested, please fill the below details and revert with your updated resume. Candidate Full Name Current Location Phone Email ID Skype ID Linked in ID Passport number Total Years of Experience Education Visa Status Willing to relocate Rate Last 4 Digits of SSN#: Availability to start on the project Previously worked with Cognizant (Y/N) If Yes \u2013 Provide the CTS Emp ID Interview Availability with the time Zone Thanks & RegardsIsaacIsaac@centraprise.comDirect: 469-923-8111Centraprise",
        "source": "Email",
        "date_posted": "2024-10-02 11:42:02-05:00",
        "unique_id": "1924e21ac6d4076d",
        "emp_type": [
            "contract",
            "third party"
        ],
        "tag": "Python developer"
    }
]