[
    {
        "company": "Vyze Inc",
        "job_title": "Sr. Design Program Manager",
        "location": "Bellevue, WA, USA",
        "full_location": {
            "city": "Bellevue",
            "state": "WA",
            "country": "USA"
        },
        "job_details": {
            "employment_type": [
                "third party"
            ],
            "job_code": "",
            "experience_required": "7-10+ years",
            "degree_required": "Bachelor's degree",
            "visa_sponsorship": "No visa sponsorship",
            "notice_period": "Not specified",
            "duration": "Not specified",
            "rate": "Not specified"
        },
        "skills": {
            "core": [
                "design project management",
                "program management",
                "resource management",
                "Agile",
                "communication"
            ],
            "primary": [
                "eComm",
                "Apps",
                "Web",
                "Design language systems",
                "Asana",
                "Workfront",
                "Jira",
                "Sketch",
                "Figma",
                "Slack"
            ],
            "secondary": [
                "capacity tracking",
                "resource planning",
                "written communication",
                "oral communication",
                "stakeholder presentation",
                "project management",
                "scrum team management"
            ],
            "all": [
                "design project management",
                "program management",
                "resource management",
                "Agile",
                "communication",
                "eComm",
                "Apps",
                "Web",
                "Design language systems",
                "Asana",
                "Workfront",
                "Jira",
                "Sketch",
                "Figma",
                "Slack",
                "capacity tracking",
                "resource planning",
                "written communication",
                "oral communication",
                "stakeholder presentation",
                "project management",
                "scrum team management"
            ]
        },
        "job_type": [],
        "contact_person": "Uttkarsh Rai",
        "email": "uttkarsh@vyzeinc.com",
        "jd": "From: Uttkarsh Rai, Vyze Inc uttkarsh@vyzeinc.com Reply to: uttkarsh@vyzeinc.com Job Description -JOB TITLE : Sr. Design Program Manager Bellevue, WA Please try to submit local candidates! Qualifications Bachelor s degree 7-10+ years of experience design project or program management experience across digital ecosystems, including but not limited to eComm, Apps, Web and Design language systems. A proven track record of partnering across a wide array of internal business groups, external marketing agencies, executive stakeholders and execution partners. Ability to delegate tasks across multiple projects and workstreams (resource management, capacity tracking, resource planning, etc.) Experience with communication, workflow and creative asset management systems such as Asana, Workfront, Jira, Sketch, Figma, Slack and similar tools. Strong written and oral communication skills. Confidence developing and presenting materials to stakeholders - including Director and VP-level senior leadership. Experience managing project and scrum teams in Agile environments. - Will Support Frontline tools Technology Requirements (I.E Programs, systems, etc) What does a typical day look like? (daily tasks) Support UX design team with agile delivery",
        "source": "Email",
        "date_posted": "2024-10-02 18:16:04-05:00",
        "unique_id": "1924f843e49440b6",
        "emp_type": [
            "third party"
        ],
        "tag": "Project Manager"
    }
]