[
    {
        "company": "Siri Info",
        "job_title": "Java with ODM Developer",
        "location": "St. Louis, MO, USA",
        "full_location": {
            "city": "St. Louis",
            "state": "MO",
            "country": "USA"
        },
        "job_details": {
            "employment_type": [
                "third party"
            ],
            "experience_required": "8-10 years",
            "degree_required": "Not specified",
            "visa_sponsorship": "Not specified",
            "notice_period": "Not specified",
            "duration": "Not specified",
            "rate": "Not specified"
        },
        "skills": {
            "core": [
                "Java",
                "ODM",
                "J2EE",
                "Web Services",
                "XML",
                "DB",
                "Unix/Linux"
            ],
            "primary": [
                "Agile",
                "SCRUM",
                "Decision Validation services",
                "Test driven development",
                "Continuous integration"
            ],
            "secondary": [
                "Strong communications skills",
                "Familiarity with object models and APIs",
                "Experience working with business users",
                "Experience working with ODM and Websphere"
            ],
            "all": [
                "Java",
                "ODM",
                "J2EE",
                "Web Services",
                "XML",
                "DB",
                "Unix/Linux",
                "Agile",
                "SCRUM",
                "Decision Validation services",
                "Test driven development",
                "Continuous integration",
                "Strong communications skills",
                "Familiarity with object models and APIs",
                "Experience working with business users",
                "Experience working with ODM and Websphere"
            ],
            "with_experience": [
                "Java (8-10 years)",
                "ODM",
                "Websphere"
            ]
        },
        "job_type": [],
        "contact_person": "Chandra N",
        "email": "chandra.n@siriinfo.com",
        "jd": "From: Chandra N, Siri Info chandra.n@siriinfo.com Reply to: chandra.n@siriinfo.com Role name:DeveloperRole Description:ava/ODM developers responsibilities include designing, developing, testing, and debugging decision automation solutions using IBM ODM. They also integrate decision services into business applications. ResponsibilitiesDesignDesign and develop rules applications using Agile and SCRUM MethodologyDevelopmentDevelop decision automation solutions using IBM ODMTestingTest and simulate rules in Decision Validation servicesDebuggingDebug rules projectsDeploymentDeploy decision servicesIntegrationIntegrate decision services into business applicationsRule extractionHarvest and extract rules from existing legacy systemsSome skills and experience that are useful for a Java/ODM developer include: Knowledge of Java, J2EE, Web Services, XML, DB, and Unix/Linux Experience working with ODM and WebsphereCompetencies:Core Java, Digital : IBM CloudExperience (Years):8-10Essential Skills:Java/ODM developers responsibilities include designing, developing, testing, and debugging decision automation solutions using IBM ODM. They also integrate decision services into business applications. ResponsibilitiesDesignDesign and develop rules applications using Agile and SCRUM MethodologyDevelopmentDevelop decision automation solutions using IBM ODMTestingTest and simulate rules in Decision Validation servicesDebuggingDebug rules projectsDeploymentDeploy decision servicesIntegrationIntegrate decision services into business applicationsRule extractionHarvest and extract rules from existing legacy systemsSome skills and experience that are useful for a Java/ODM developer include: Knowledge of Java, J2EE, Web Services, XML, DB, and Unix/Linux Experience working with ODM and Websphere Experience working with business users Experience with test driven development Experience in a continuous integration environment Strong communications skills Familiarity with object models and APIsDesirable Skills:ava/ODM developers responsibilities include designing, developing, testing, and debugging decision automation solutions using IBM ODM. They also integrate decision services into business applications. ResponsibilitiesDesignDesign and develop rules applications using Agile and SCRUM MethodologyDevelopmentDevelop decision automation solutions using IBM ODMTestingTest and simulate rules in Decision Validation servicesDebuggingDebug rules projectsDeploymentDeploy decision servicesIntegrationIntegrate decision services into business applicationsRule extractionHarvest and extract rules from existing legacy systemsSome skills and experience that are useful for a Java/ODM developer include: Knowledge of Java, J2EE, Web Services, XML, DB, and Unix/Linux Experience working with ODM and Websphere Experience working with business users Experience with test driven development Experience in a continuous integration environment Strong communications skills Familiarity with object models and APIsCountry:United StatesBranch | City | Location:TCS - ST Louis, MOSt.LouisSt.Louis,MO",
        "source": "Email",
        "date_posted": "2024-10-02 06:58:03-05:00",
        "unique_id": "1924d178e0c1d194",
        "emp_type": [
            "third party"
        ],
        "tag": "Java developer"
    }
]