[
    {
        "company": "Technocraft solutions",
        "job_title": "Business analyst 5",
        "location": "Lansing, MI, USA",
        "full_location": {
            "city": "Lansing",
            "state": "MI",
            "country": "USA"
        },
        "job_details": {
            "employment_type": [
                "contract",
                "third party"
            ],
            "job_code": "MI-135503",
            "experience_required": "1-3 years",
            "degree_required": "Bachelor\u2019s Degree",
            "visa_sponsorship": "Not specified",
            "notice_period": "Not specified",
            "duration": "12+ Months",
            "rate": "Not specified"
        },
        "skills": {
            "core": [
                "PBI",
                "R",
                "IBM SPSS",
                "Tableau",
                "Microsoft Project",
                "Excel",
                "Devops",
                "Remedy",
                "Helix"
            ],
            "primary": [
                "Organization and Prioritization skills",
                "Understanding CRISP-DM process model",
                "Data understanding",
                "Data preparation",
                "Modeling",
                "Evaluation",
                "Deployment",
                "Communication and Interpersonal skills"
            ],
            "secondary": [
                "Telecommunications environment",
                "Large Enterprise setting",
                "Multiple network platforms",
                "Multiple network lines of service",
                "Customer interaction"
            ],
            "all": [
                "PBI",
                "R",
                "IBM SPSS",
                "Tableau",
                "Microsoft Project",
                "Excel",
                "Devops",
                "Remedy",
                "Helix",
                "Organization and Prioritization skills",
                "Understanding CRISP-DM process model",
                "Data understanding",
                "Data preparation",
                "Modeling",
                "Evaluation",
                "Deployment",
                "Communication and Interpersonal skills",
                "Telecommunications environment",
                "Large Enterprise setting",
                "Multiple network platforms",
                "Multiple network lines of service",
                "Customer interaction"
            ]
        },
        "job_type": [
            "hybrid"
        ],
        "contact_person": "Harsh Tiwari",
        "email": "harsh.tiwari@technocraftsol.com",
        "jd": "From: Harsh Tiwari, Technocraft solutions harsh.tiwari@technocraftsol.com Reply to: harsh.tiwari@technocraftsol.com Job Title: Business analyst 5, (Locals Only)Job ID: MI-135503 (Hybrid)Location: Lansing, MI (DTMB)Duration : 12+ Months Complete Description:Extrapolate datasets from Service Desk Support Team and prepare using appropriate algorithm toolsAbility to obtain and report data analysis of datasetsFacilitate meetings to discuss data analysis of workloads and projectsExcellent interpersonal skills Skills, Experience and Education:Bachelor\u2019s Degree, RequiredOrganization and Prioritization skills are MandatoryUnderstanding CRISP-DM process modelAbility to follow the steps for a data mining projectBusiness UnderstandingData understandingData preparationModelingEvaluationDeployment Communication and Interpersonal skills are MandatoryPrevious experience working with multiple agencies and/or vendors and/or departments in an enterprise environment are Required:Minimum 1-3 years\u2019 experience with PBI, R, IBM SPSS, and/or TableauMinimum 3-5 years\u2019 experience with Microsoft Project and Excel is RequiredMinimum 2-3 years\u2019 experience with Devops is PreferredMinimum 3-5 years\u2019 experience with Remedy/Helix is RequiredMinimum 3-5 years working within a Telecommunications environment is PreferredMinimum 3-5 years\u2019 experience in a large Enterprise setting is RequiredMinimum 3-5 years\u2019 work experience with multiple network platforms is PreferredMinimum 3-5 years working with multiple network lines of service is RequiredMinimum 5+ years dealing with customers is Required. Justification: Provide presentations, reports, statistics, metrics, and analysis of services provided by Network Services Short Description: Receive, process, present data, and information from our weekly Helix datasets which are provided from another I&O division.",
        "source": "Email",
        "date_posted": "2024-10-02 12:14:15-05:00",
        "unique_id": "1924e9d7afc1bd04",
        "emp_type": [
            "contract",
            "third party"
        ],
        "tag": "Business Analyst"
    }
]