[
    {
        "company": "Cognizant",
        "job_title": "Sr Gen AI Developer",
        "location": "Houston, TX, USA",
        "full_location": {
            "city": "Houston",
            "state": "TX",
            "country": "USA"
        },
        "job_details": {
            "employment_type": [
                "contract",
                "third party"
            ],
            "experience_required": "12 to 14 years",
            "degree_required": "Not specified",
            "visa_sponsorship": "Not specified",
            "notice_period": "Not specified",
            "duration": "Not specified",
            "rate": "Not specified"
        },
        "skills": {
            "core": [
                "Python",
                "Generative AI",
                "Azure",
                "GCP",
                "PySpark"
            ],
            "primary": [],
            "secondary": [
                "C#"
            ],
            "all": [
                "Python",
                "Generative AI",
                "Azure",
                "GCP",
                "PySpark",
                "C#"
            ]
        },
        "job_type": [
            "onsite"
        ],
        "contact_person": "Isaac",
        "email": "isaac@centraprise.com",
        "jd": "From: Isaac, Centraprise isaac@centraprise.com Reply to: isaac@centraprise.com Hi Professional, I am writing to let you know regarding a job opportunity as \u201cSr Gen AI Developer\u201d with \u201cCognizant\u201d. Mentioned is the job description for your review. Job Title: Sr Gen AI DeveloperLocation: Houston TX (Day One Onsite) Job Type: Contract Job Description: Experience: 12 to 14Yrs Mandate Skills: Python, Azure, PySpark, Generative AI, Open AI, GCP We are seeking a highly experienced Sr Gen AI Developer with 12 to 14 years of experience to join our dynamic team.The ideal candidate will have a strong background in Open AI, GCP, Azure, Generative AI, PySpark, and Python.This role involves analyzing business needs, developing strategies, and implementing solutions that leverage advanced AI technologies to drive business growth and efficiency. Responsibilities Lead the design and implementation of scalable and efficient architectures using Python, Generative AI, Azure, and GCPOversee the development and deployment of big data solutions on Google Cloud PlatformProvide technical guidance and mentorship to team members, ensuring best practices are followedCommunicate effectively with stakeholders, providing regular updates on project progress and challenges Qualifications Possess strong expertise in Python and Generative AI, with a proven track record of successful projectsDemonstrate proficiency in Azure and GCP, with hands-on experience in deploying and managing cloud-based solutionsHave extensive knowledge of PySpark and its application in big data processingShow experience with Google Cloud - Big Data and Google CloudServices, leveraging these technologies to build robust solutionsExhibit excellent problem-solving skills, with the ability to troubleshoot and resolve complex technical issuesDisplay strong communication and collaboration skills, working effectively with cross-functional teamsFull software development lifecycle experienceStrong object oriented analysis and design skillsStrong Python programming expertiseC# nice to haveProven practical expertise in Azure If interested, please fill the below details and revert with your updated resume. Candidate Full Name Current Location Phone Email ID Skype ID Linked in ID Passport number Total Years of Experience Education Visa Status Willing to relocate Rate Last 4 Digits of SSN#: Availability to start on the project Previously worked with Cognizant (Y/N) If Yes \u2013 Provide the CTS Emp ID Interview Availability with the time Zone Thanks & RegardsIsaacIsaac@centraprise.comDirect: 469-923-8111Centraprise",
        "source": "Email",
        "date_posted": "2024-10-02 14:46:07-05:00",
        "unique_id": "1924f390390c4d0d",
        "emp_type": [
            "contract",
            "third party"
        ],
        "tag": "AWS Data Engineer"
    }
]