[
    {
        "company": "KPG99 INC",
        "job_title": "Technical Analyst \u2013 Revenue Cycle",
        "location": "USA",
        "full_location": {
            "city": "",
            "state": "",
            "country": "USA"
        },
        "job_details": {
            "employment_type": [
                "third party"
            ],
            "job_code": "",
            "experience_required": "4-7 years",
            "degree_required": "Bachelor\u2019s degree or equivalent knowledge and skills obtained through a combination of education, training, and experience in a Healthcare environment.",
            "visa_sponsorship": "Not specified",
            "notice_period": "Not specified",
            "duration": "6+ months",
            "rate": "Not specified"
        },
        "skills": {
            "core": [
                "Experience with 837 and 835",
                "Understanding of Revenue Cycle"
            ],
            "primary": [
                "Application Systems Analyst",
                "Technical Analyst",
                "Business Analyst"
            ],
            "secondary": [],
            "all": [
                "Experience with 837 and 835",
                "Understanding of Revenue Cycle",
                "Application Systems Analyst",
                "Technical Analyst",
                "Business Analyst"
            ],
            "with_experience": [
                "Experience with 837 and 835",
                "Understanding of Revenue Cycle"
            ]
        },
        "job_type": [
            "remote"
        ],
        "contact_person": "Jyoti Mittal",
        "email": "jyotim@kpgtech.com",
        "jd": "From: Jyoti Mittal, KPG99 Inc jyotim@kpgtech.com Reply to: jyotim@kpgtech.com Hi,My name is Jyoti and I represent KPG99 INC. We work with clients across the USA. I have a very urgent role. If interested then please share with me your updated resume along with below information. NEED INDEPENDENT OR W2 CANDIDATERole: Technical Analyst \u2013 Revenue CycleDuration: 6+ monthsLocation: RemoteVisa: USCMust Have: Experience with 837 and 835 (Related to Healthcare Claims), Understanding of Revenue Cycle \u2013 how claims come in and go back Technical Analyst:Required Education and Experience Bachelor\u2019s degree or equivalent knowledge and skills obtained through a combination of education, training, and experience in a Healthcare environment.4-7 years\u2019 experience working in IT as an Application Systems Analyst or Technical Analyst / Business Analyst role Thanks & Regards,Jyoti Mittal| Technical Recruiter | KPG99,INC jyotim@kpgtech.com | http://www.kpg99.com/3240 E State St EXT, Hamilton, NJ 08619An E- Verified Company Certified Minority Owned BusinessNote: KPG99 does not endorse undesired email. If you do not want to receive our mails, please reply with",
        "source": "Email",
        "date_posted": "2024-10-02 15:53:28-05:00",
        "unique_id": "1924f01b37ffaf89",
        "emp_type": [
            "third party"
        ],
        "tag": "Business Analyst"
    }
]