[
    {
        "company": "Adventa",
        "job_title": "Business Analyst",
        "location": "FT Myers, FL, USA",
        "full_location": {
            "city": "FT Myers",
            "state": "FL",
            "country": "USA"
        },
        "job_details": {
            "employment_type": [
                "full-time",
                "third party"
            ],
            "experience_required": "Not specified",
            "degree_required": "Not specified",
            "visa_sponsorship": "Not specified",
            "notice_period": "Not specified",
            "duration": "Not specified",
            "rate": "Not specified",
            "job_code": "",
            "contact_person": "sangya kumari nahak",
            "email": "sangya@adventatech.com"
        },
        "skills": {
            "core": [
                "CRM",
                "SaaS",
                "business analyst skills"
            ],
            "primary": [
                "customer service skills",
                "testing experience",
                "data migration"
            ],
            "secondary": [],
            "all": [
                "CRM",
                "SaaS",
                "business analyst skills",
                "customer service skills",
                "testing experience",
                "data migration"
            ]
        },
        "job_type": [
            "onsite"
        ],
        "jd": "From: sangya kumari nahak, adventa sangya@adventatech.com Reply to: sangya@adventatech.com Role: Business Analyst Location: FT Myers ,Florida (onsite) Need local candidateDuration: Full time roleVisa- USC/GCMOI: SkypeNeed LinkedInNeed strong exp with CRM and SAAS --any CRM EXPERIENCE --experience with Saas [ any ]--experience in business services industry --strong customer service skills --testing experience --strong business analyst skills --support and manage data migration Resumes MUST be submitted with all infoHow many yrs CRM exp?SaaS exp? Which one?Business services industry exp? Where and how many yrs?",
        "source": "Email",
        "date_posted": "2024-10-02 18:51:26-05:00",
        "unique_id": "1924fef95470568a",
        "emp_type": [
            "full-time",
            "third party"
        ],
        "tag": "Business Analyst"
    }
]