[
    {
        "company": "Sonitalentcorp",
        "job_title": "IT Business Analyst",
        "location": "Piscataway, NJ, USA",
        "full_location": {
            "city": "Piscataway",
            "state": "NJ",
            "country": "USA"
        },
        "job_details": {
            "employment_type": [
                "contract",
                "third party"
            ],
            "job_code": "",
            "experience_required": "8+ years",
            "degree_required": "Bachelor's degree in related field or equivalent experience",
            "visa_sponsorship": "Any visa (Except H1B and CPT)",
            "notice_period": "Not specified",
            "duration": "6 months+",
            "rate": "Not specified"
        },
        "skills": {
            "core": [
                "business analysis",
                "project management",
                "requirements gathering",
                "business process analysis",
                "Enterprise Architecture"
            ],
            "primary": [
                "Java",
                "Java Script",
                "AWS",
                "Power BI",
                "Software Development Life Cycle"
            ],
            "secondary": [
                "AI related initiatives",
                "analytical skills",
                "communication skills",
                "documentation skills"
            ],
            "all": [
                "business analysis",
                "project management",
                "requirements gathering",
                "business process analysis",
                "Enterprise Architecture",
                "Java",
                "Java Script",
                "AWS",
                "Power BI",
                "Software Development Life Cycle",
                "AI related initiatives",
                "analytical skills",
                "communication skills",
                "documentation skills"
            ]
        },
        "job_type": [
            "onsite"
        ],
        "contact_person": "Uttam Barman",
        "email": "uttam.barman@sonitalentcorp.com",
        "jd": "From: UTTAM BARMAN, SONITALENTCORP uttam.barman@sonitalentcorp.com Reply to: uttam.barman@sonitalentcorp.com Job Title IT Business AnalystLocation Piscataway, NJ (3 Day onsite) (Local)Duration of project 6 months+Required visa Any visa (Except H1B and CPT)Mode of Interview Video then onsite Need local consultant (Who can work fully onsite in the starting month) Required Qualifications:Strong business analysis, and project management skills ( Ideally 8 + years of BA experience )Strong experience in gathering and defining requirements, analyzing/mapping business processes, supporting the design, development, implementation, and maintenance of solutions, services, products, and applications. Good understanding of Enterprise Architecture ( There may be multiple applications, but the software application tech stack will typically include Java, Java Script, AWS, Power BI for data visualization, and there may be some AI related initiatives as well. ) Good knowledge of business information technology best practices and a strong understanding of the Software Development Life CycleStrong analytical skills and proven track record of utilizing team-based approach to quickly and accurately resolve system/solution issues.Strong understanding of system development, IT and business process and their inter-relationship.Capability to motivate others within a non-direct reporting structure to execute changeStrong communication and writing skills on a business and technical level.Strong skills in documentation for business and technology user audiences. Qualifications:PMI Professional in Business Analysis (PMI-PBA) Education & Certifications:Bachelor's degree in related field or equivalent experience. LinkedIn: https://www.linkedin.com/in/uttam-barman-b494b1254/Email: uttam.barman@sonitalentcorp.comContact: 8599464061",
        "source": "Email",
        "date_posted": "2024-10-02 12:15:57-05:00",
        "unique_id": "1924e3c976457bf9",
        "emp_type": [
            "contract",
            "third party"
        ],
        "tag": "Business Analyst"
    }
]