[
    {
        "company": "Net GRCT",
        "job_title": "Technical Project Manager",
        "location": "Phoenix, AZ, USA",
        "full_location": {
            "city": "Phoenix",
            "state": "AZ",
            "country": "USA"
        },
        "job_details": {
            "employment_type": [
                "onsite",
                "third party"
            ],
            "experience_required": "10+ years",
            "degree_required": "Not specified",
            "visa_sponsorship": "Not specified",
            "notice_period": "Not specified",
            "duration": "Not specified",
            "rate": "Not specified"
        },
        "skills": {
            "core": [
                ".NET",
                "TPM",
                "Regression & Performance Testing",
                "Project Management",
                "Product Management",
                "MS SQL"
            ],
            "primary": [
                ".NET",
                "TPM",
                "Regression & Performance Testing",
                "Project Management",
                "Product Management",
                "MS SQL"
            ],
            "secondary": [],
            "all": [
                ".NET",
                "TPM",
                "Regression & Performance Testing",
                "Project Management",
                "Product Management",
                "MS SQL"
            ]
        },
        "job_type": [
            "onsite"
        ],
        "contact_person": "Naveen",
        "email": "naveen.p@3ktechnologies.com",
        "jd": "From: Naveen, 3ktechnologies naveen.p@3ktechnologies.com Reply to: naveen.p@3ktechnologies.com Role: Technical Project Manager. Net GRCTLocation: Arizona, Phoenix, USA/ONSITEYears of Exp.: 10+ years of experienceJob Family: DevelopmentSkill (Primary): Technical Skills (APPS)-Enterprise Dev and Integration - .NETPrimary Skill: .NET,TPM, Regression & Performance Testing, Project Management, Product Management, MS SQLJob Description:updated Job description for the Technical PMO with . Net experience \u2013 USA.Looking for an experienced technical project manager that can hit the ground running as part of the Global Sanctions Risk and Compliance team in GRCT. The candidate must be experience of managing the distributed applications especially .NET/API's and be a team contribute candidate will be expected to complete document and co-ordinate with multiple technology teams, product, business and ensure the delivery schedule. They will be part of an end-to-end team and may have to participate in RFC's, tracking application deployment, and tracking proc issues with the components they deliver. Candidate should be an excellent communicator and willing to speak up to contribute and participial meetings and Agile ceremonies.",
        "source": "Email",
        "date_posted": "2024-10-02 09:29:19-05:00",
        "unique_id": "1924da20a91fc58c",
        "emp_type": [
            "onsite",
            "third party"
        ],
        "tag": "Project Manager"
    }
]