[
    {
        "company": "Source Mantra",
        "job_title": "GCP Data Engineer",
        "location": "Atlanta, GA, USA",
        "full_location": {
            "city": "Atlanta",
            "state": "GA",
            "country": "USA"
        },
        "job_details": {
            "employment_type": [
                "contract",
                "third party"
            ],
            "experience_required": "12 years",
            "degree_required": "Not specified",
            "visa_sponsorship": "Not specified",
            "notice_period": "Not specified",
            "duration": "Long term",
            "rate": "Not specified"
        },
        "skills": {
            "core": [
                "MongoDB",
                "Java",
                "Python",
                "Google Cloud Platform",
                "Big Query",
                "Dataflow"
            ],
            "primary": [
                "Google Cloud SDK",
                "API Scripting",
                "Onsite-Offshore coordination",
                "Test Driven Development",
                "Agile processes",
                "DevOps methodologies",
                "Google Cloud Professional Data Engineer Certification"
            ],
            "secondary": [
                "CI/CD",
                "GitHub",
                "Jenkins",
                "NoSQL Databases",
                "Retail domain"
            ],
            "all": [
                "MongoDB",
                "Java",
                "Python",
                "Google Cloud Platform",
                "Big Query",
                "Dataflow",
                "Google Cloud SDK",
                "API Scripting",
                "Onsite-Offshore coordination",
                "Test Driven Development",
                "Agile processes",
                "DevOps methodologies",
                "Google Cloud Professional Data Engineer Certification",
                "CI/CD",
                "GitHub",
                "Jenkins",
                "NoSQL Databases",
                "Retail domain"
            ],
            "with_experience": [
                "MongoDB",
                "Java (12+ years)",
                "Python (12+ years)",
                "Google Cloud Platform (12+ years)",
                "Big Query (12+ years)",
                "Dataflow (12+ years)"
            ]
        },
        "job_type": [
            "hybrid"
        ],
        "contact_person": "Venkat",
        "email": "venkat@sourcemantra.com",
        "jd": "GCP Data Engineer\nAtlanta, GA (Hybrid 3days onsite) \u2013 Only Locals in GA\nLong term Contract\nNeed 12 Years and above resumes with Linkedin id and PP# \nJob Description:\nMust have Strong experience with MongoDB.\nMust have an experience in data setup work to support front end application.\nStrong Programming experience in Java or Python\nExperience in Google Cloud platform (especially Big Query & Dataflow)\nExperience with Google Cloud SDK & API Scripting\nExperience in Onsite-Offshore coordination\nExperience in Test Driven Development\nExperience in Agile processes and DevOps methodologies.\nGoogle Cloud Professional Data Engineer Certification is an advantage.\nGoogle Cloud \u2013 Big Query, Pub/ Sub, Dataflow, Composer DAGs, Cloud storage\nCI/CD \u2013 GitHub, Jenkins\nExperience in NoSQL Databases is an added advantage.\nExperience of Retail domain will be an added advantage.",
        "source": "Email",
        "date_posted": "2024-10-11 07:34:41-05:00",
        "unique_id": "1927bb3b58a5420b",
        "emp_type": [
            "contract",
            "third party"
        ],
        "tag": "GCP Data Engineer"
    }
]