[
    {
        "company": "Mavinsys",
        "job_title": "Java Full Stack Developer",
        "location": "Mclean, VA, USA",
        "full_location": {
            "city": "Mclean",
            "state": "VA",
            "country": "USA"
        },
        "job_details": {
            "employment_type": [
                "third party"
            ],
            "job_code": "",
            "experience_required": "7+ years",
            "degree_required": "Degree in Computer Science, Engineering or equivalent",
            "visa_sponsorship": "Not specified",
            "notice_period": "Not specified",
            "duration": "Not specified",
            "rate": "Not specified"
        },
        "skills": {
            "core": [
                "Java 8+",
                "Spring",
                "Spring Boot",
                "RESTful Services",
                "Microservices",
                "AWS Services",
                "JPA",
                "Hibernate"
            ],
            "primary": [
                "MongoDB",
                "Docker",
                "Kubernetes",
                "Angular",
                "ReactJS",
                "PostgreSQL",
                "Jenkins",
                "Artifactory",
                "Maven",
                "Gradle",
                "GIT",
                "BitBucket"
            ],
            "secondary": [
                "OAuth implementation using Ping Identity",
                "API Management (Apigee)",
                "Service Mesh (Istio)",
                "Elasticsearch",
                "Logstash",
                "Kibana",
                "Queue based implementations",
                "NoSQL",
                "Unix",
                "Python"
            ],
            "all": [
                "Java 8+",
                "Spring",
                "Spring Boot",
                "RESTful Services",
                "Microservices",
                "AWS Services",
                "JPA",
                "Hibernate",
                "MongoDB",
                "Docker",
                "Kubernetes",
                "Angular",
                "ReactJS",
                "PostgreSQL",
                "Jenkins",
                "Artifactory",
                "Maven",
                "Gradle",
                "GIT",
                "BitBucket",
                "OAuth implementation using Ping Identity",
                "API Management (Apigee)",
                "Service Mesh (Istio)",
                "Elasticsearch",
                "Logstash",
                "Kibana",
                "Queue based implementations",
                "NoSQL",
                "Unix",
                "Python"
            ]
        },
        "job_type": [
            "onsite"
        ],
        "contact_person": "Harika Vaka",
        "email": "harika.v@mavinsys.com",
        "jd": "From: Harika Vaka, Mavinsys harika.v@mavinsys.com Reply to: harika.v@mavinsys.com Role - Java Full Stack DeveloperLocation - Mclean, VA (Local candidates or Near by States)Interview Mode \u2013 First round virtual, 2nd Round F2F (Address will be shared)Key Skills: Java8, Spring boot, Mongo DB , AWS Services , Kafka , Microservices , CI/CD.JD - Mandatory:\u2022 7+ years of experience in Design and Development of applications using Java 8+/J2EE, Spring, Spring-Boot, RESTful Services and UI Framework\u2022 2+ years of experience in design and development of Microservice using Spring-Boot and REST API\u2022 Strong knowledge/experience in ORM Framework - JPA / Hibernate\u2022 Good knowledge and experience in Docker and Kubernetes\u2022 2+ years of experience in any one of the UI Framework - Angular / ReactJS\u2022 1+ years of experience in designing and Implementing cloud-based solutions in various AWS Services (EC2, IAM, S3, Lambda, etc)\u2022 Good knowledge and experience in any RDBMS/PostgreSQL\u2022 Strong experience in DevOps tool chain (Jenkins, Artifactory, Maven/Gradle, GIT/BitBucket)\u2022 Good knowledge in technical concepts \u2013 Security, Transaction, Monitoring, PerformanceNice to have:\u2022 Experience with OAuth implementation using Ping Identity\u2022 Familiarity with API Management (Apigee) and Service Mesh (Istio)\u2022 Experience with Elasticsearch, Logstash & Kibana\u2022 Good knowledge and experience in any Queue based implementations\u2022 Good knowledge and experience in NoSQL (MongoDB)\u2022 Experience with scripting languages using Unix, PythonSoft Skills\u2022 Fast learner of new technologies and tools.\u2022 Work independently contributing to the success of assigned project(s).\u2022 Participate in discussions with project teams to understand the application design, build process and help deploy applications in target environments.\u2022 Degree in Computer Science, Engineering or equivalent\u2022 Preferably certified in AWS",
        "source": "Email",
        "date_posted": "2024-10-11 09:58:21-05:00",
        "unique_id": "1927c5ed76527d6f",
        "emp_type": [
            "third party"
        ],
        "tag": "Java developer"
    }
]