[
    {
        "company": "NC-DHHS",
        "job_title": "Project Manager (746899)",
        "location": "USA",
        "full_location": {
            "city": "Durham",
            "state": "NC",
            "country": "USA"
        },
        "job_details": {
            "employment_type": [
                "third party"
            ],
            "job_code": "746899",
            "experience_required": "15+ years",
            "degree_required": "Not specified",
            "visa_sponsorship": "Not specified",
            "notice_period": "Not specified",
            "duration": "12 Months",
            "rate": "Not specified"
        },
        "skills": {
            "core": [
                "Project Management",
                "Leadership",
                "Negotiation",
                "Time Management",
                "Organizational Skills"
            ],
            "primary": [
                "Agile Methodologies",
                "Microsoft Project",
                "Cloud technologies",
                "SaaS applications",
                "Communication Skills"
            ],
            "secondary": [
                "PgMP Certification",
                "PMI-ACP Certification",
                "Application modernization",
                "Cross-functional team collaboration",
                "Social services knowledge"
            ],
            "all": [
                "Project Management",
                "Leadership",
                "Negotiation",
                "Time Management",
                "Organizational Skills",
                "Agile Methodologies",
                "Microsoft Project",
                "Cloud technologies",
                "SaaS applications",
                "Communication Skills",
                "PgMP Certification",
                "PMI-ACP Certification",
                "Application modernization",
                "Cross-functional team collaboration",
                "Social services knowledge"
            ]
        },
        "job_type": [
            "remote"
        ],
        "contact_person": "Nagajyoti",
        "email": "njyoti@innozatech.com",
        "jd": "From: Nagajyoti, INNOZA TECH LLC. njyoti@innozatech.com Reply to: njyoti@innozatech.com Position: Project Manager (746899)-RemoteLocation: RTP Durham NCDuration: 12 MonthsClient: NC-DHHSNeed 15+ years candidateNeed state client experienceThe NC Department of Health and Human Services (DHHS) is seeking an experienced Project Manager. This management role will work with multiple internal and external stakeholders, project teams, divisions, departments, and vendors to strategize, implement, and maintain the various modernization initiative for social services and Medicaid programs. This position will interact with all levels of staff in DHHS including executive staff.Responsibilities include but are not limited to:\u2022 Review project proposals or plans to determine a time frame, funding limitations, procedures for accomplishing projects, staffing requirements and the assignment of available departmental resources to various project phases.\u2022 Identify and schedule project deliverables, milestones, and required activities and tasks.\u2022 Provide leadership and motivation to project team members throughout the project life cycle and confer with project staff to outline a work plan.\u2022 Establish a work plan and staffing for project activities, iterations, or phases, and arrange for recruitment or assignment of project personnel.\u2022 Ensure that project goals are in line with business objectives.\u2022 Ensure that project goals are achieved.\u2022 Assign duties and responsibilities to project personnel and define the scope of their authority.\u2022 Direct and coordinate the activities of project personnel to ensure projects progress on schedule and within budget.\u2022 Review status reports prepared by project personnel and modify schedules or plans as required.\u2022 Work with business and cross-functional teams to develop Business Case and Cost Benefit analysis for prioritized initiatives within the program.\u2022 Manage multiple Vendor onboarding and identify key requirements needed from cross-functional teams and Vendors.\u2022 Work with other program managers to identify risks and opportunities across multiple projects within the department.\u2022 Manage budget across various workstreams and funding channels for maximum productivity.\u2022 Manage resource allocations and expectations for program.\u2022 Collaborate with the State DIT to ensure program compliance with the State IT Roadmap and all State Privacy and security requirements.Skills:\u2022 The selected candidate must be a results-oriented individual with a strong work ethic and must be able to demonstrate excellent leadership, negotiation, time management, facilitation, and organizational skills.\u2022 Experience in communicating in a fashion tailored to the audience and their needs.\u2022 Excellent written communication and presentation skills\u2022 Demonstrates experience in working effectively with all levels of staff, clients, and other IT personnel.\u2022 Experience in the responsibility for acquiring and utilizing the necessary resources and skills, within agreed parameters of cost, timeframes, and quality for a program.\u2022 Ability to identify and plan systematic corrective action to reduce errors and improve the quality of the systems and services, by examination of the root causes of problems.\u2022 Ability to build, influence, lead and motivate effective teams towards end results.Management prefers applicants with the following:- Candidate with PgMP Certification- Candidate with Agile (PMI-ACP) Certification- Experience managing or supervising programs involving Application modernization and modularization projects.- Experience collaborating with State and Local Government- Experience in complex, cross-functional team environments- Knowledge of social services and medicaid programs or similarly complex case management systemsSkillProgram Management experience managing multiple large complex projectsExperience creating roadmaps for the portfolioProven track record of delivering IT projects within budget, scope and scheduleObjective decision-making ability based on strategic objectives priority, business performance analysis and resource availabilityHands on experience managing project risk, cost, schedule, quality, testing, and communicationsStrong supervision, organizational, interpersonal and time management skillsDemonstrated presentation, training skills, oral and written communication skills.Solid work experience with project management tools (e.g. Microsoft Project)Experience with MS Office(Word, Excel and Power point)Strong organization and analytical thinking skills with experience preparing Project plan for complex business needs.Ability to communicate effectively at all job levels, use excellent evaluation skills, and ability to relay information in legible reports as requiredExperience with Agile Methodologies.PMI certification Project Management Professional (PMP)Experience with Cloud technologies & SaaS applications running on CloudExperience collaborating with Federal, State and Local GovernmentExperience managing implementation of a statewide IT projectExperience in establishing and/or implementing governance models for IT modernization effortsExperience with projects related to Application transformation and Modernization",
        "source": "Email",
        "date_posted": "2024-10-11 13:28:46-05:00",
        "unique_id": "1927d3fa2d9a5333",
        "emp_type": [
            "third party"
        ],
        "tag": "Project Manager"
    }
]