[
    {
        "company": "kk soft tech",
        "job_title": "Java Developer",
        "location": "Princeton, NJ, USA",
        "full_location": {
            "city": "Princeton",
            "state": "NJ",
            "country": "USA"
        },
        "job_details": {
            "employment_type": [
                "onsite",
                "third party"
            ],
            "experience_required": "8 to 10 years",
            "degree_required": "Not specified",
            "visa_sponsorship": "Not specified",
            "notice_period": "Not specified",
            "duration": "Not specified",
            "rate": "Not specified"
        },
        "skills": {
            "core": [
                "Java",
                "Microservices",
                "Spring Framework"
            ],
            "primary": [
                "Azure",
                "Cloud",
                "Kubernetes",
                "Docker",
                "Open Shift",
                "GIT",
                "Kafka",
                "Streaming Technology",
                "Splunk",
                "Dynatrace",
                "Agile Development"
            ],
            "secondary": [
                "Problem Solving",
                "Analytical Skills",
                "Architecture",
                "Design",
                "Automation",
                "Multitasking",
                "Collaboration",
                "Leadership"
            ],
            "all": [
                "Java",
                "Microservices",
                "Spring Framework",
                "Azure",
                "Cloud",
                "Kubernetes",
                "Docker",
                "Open Shift",
                "GIT",
                "Kafka",
                "Streaming Technology",
                "Splunk",
                "Dynatrace",
                "Agile Development",
                "Problem Solving",
                "Analytical Skills",
                "Architecture",
                "Design",
                "Automation",
                "Multitasking",
                "Collaboration",
                "Leadership"
            ]
        },
        "job_type": [
            "onsite"
        ],
        "contact_person": "sushant kumar",
        "email": "sushant.s@kksoftwareassociates.com",
        "jd": "From: sushant kumar, kk soft tech sushant.s@kksoftwareassociates.com Reply to: sushant.s@kksoftwareassociates.com Title: Java Developer Location: Princeton, NJ (5 Days Onsite) Experience: 8 to 10 years Job Description: Strong Java and Micro services development experience Expertise in Azure, Cloud or Kubernetes, Docker and Open Shift Previous work experience with Spring framework Strong technical development experience on effectively writing code, code reviews, best practices code refactoring A delivery focused approach to work and the ability to work without direction Experience with various source control tools like GIT Good to have hands-on experience on Kafka or any Streaming Technology Good to have experience in Splunk, Dynatrace tools Experience in Agile Development lifecycle methodology Strong problem solving and analytical skills Advanced knowledge of architecture and design across all system Configuring and managing software and optimizing processes through automation Knowledge of industry-wide technology trends and best practices Ability to multitask and prioritize with urgency Ability to work in large, collaborate teams to achieve organizational goals Process Skills: Should have worked in Agile Project Able to lead & guide 2 team members",
        "source": "Email",
        "date_posted": "2024-10-11 09:05:05-05:00",
        "unique_id": "1927c29b4b8d4b43",
        "emp_type": [
            "onsite",
            "third party"
        ],
        "tag": "Java developer"
    }
]