[
    {
        "company": "Sibitalent",
        "job_title": "Project Manager/Business Analyst ( Health Insurance )",
        "location": "Jackson, MS, USA",
        "full_location": {
            "city": "Jackson",
            "state": "MS",
            "country": "USA"
        },
        "job_details": {
            "employment_type": [
                "contract",
                "third party"
            ],
            "job_code": "",
            "experience_required": "Minimum 3 years of experience leading and managing IT-related projects, 5-7 years of experience in application systems using SDLC methodology",
            "degree_required": "Bachelor\u2019s degree",
            "visa_sponsorship": "No visa sponsorship",
            "notice_period": "Not specified",
            "duration": "6-9 month contract to hire",
            "rate": "Not specified"
        },
        "skills": {
            "core": [
                "Business Analysis",
                "Project Task Management",
                "Resource Allocation",
                "Communication between stakeholders and IT"
            ],
            "primary": [
                "PMP Certification",
                "Project Management",
                "Knowledge of PMI methodologies",
                "Managing timelines and budgets",
                "Proficiency in MS Project"
            ],
            "secondary": [
                "Preferred experience in COBOL",
                "JCL",
                "CICS",
                "MVS",
                "DB2",
                "SDLC methodology"
            ],
            "all": [
                "Business Analysis",
                "Project Task Management",
                "Resource Allocation",
                "Communication between stakeholders and IT",
                "PMP Certification",
                "Project Management",
                "Knowledge of PMI methodologies",
                "Managing timelines and budgets",
                "Proficiency in MS Project",
                "Preferred experience in COBOL",
                "JCL",
                "CICS",
                "MVS",
                "DB2",
                "SDLC methodology"
            ],
            "with_experience": [
                "Business Analysis",
                "Project Task Management",
                "Resource Allocation"
            ]
        },
        "job_type": [
            "onsite"
        ],
        "contact_person": "Arun Kushwaha",
        "email": "arun.kushwaha@sibitalent.com",
        "jd": "Hello, My name is Arun Kushwaha and I am a Staffing Specialist at Sibitalent. I am reaching out to you on an exciting job opportunity with one of our clients. Job Title: Project Manager/Business Analyst ( Health Insurance )Location: 3545 Lakeland Dr, Jackson, Mississippi, 39232-8839, United States ( Onsite )Duration: 6-9 month contract to hireVisa : Any ( No H1, CPT, OPT )Must have LinkedIn and 2 Manager ReferencesJob Description:Seeking a skilled Project Manager/Business Analyst with health insurance experience. This role involves working onsite five days a week from day one, ensuring seamless project execution and stakeholder communication. The successful candidate will gather and document requirements, manage project tasks, allocate resources, and coordinate with stakeholders and IT teams.Top Skills Required:Business Analysis:Gathering and documenting requirementsCommunicating between stakeholders and ITProject Task Management for Java Application ProjectsResource AllocationSecondary Skills - Nice to Haves:PMP CertificationProject ManagementKnowledge of PMI methodologiesManaging timelines and budgetsProficiency in MS ProjectResponsibilities:Gather and document requirements from business stakeholdersCommunicate effectively between stakeholders and ITManage project tasks and timelines for Java application projectsAllocate resources efficientlyCoordinate with stakeholders and IT to deliver status updates to executivesTrain stakeholders on the Agile/Scrum frameworkFacilitate Scrum meetings and coordinate testing and release eventsWork closely with Applications management to align project plans with business objectivesTrack and report project status to managementFacilitate the implementation of Inter-Plan software releases with the Blue Cross and Blue Shield AssociationJob-Specific Requirements:Bachelor\u2019s degreeMinimum 3 years of experience leading and managing IT-related projects5-7 years of experience in application systems using SDLC methodologyKnowledge of systems analysis and design, programming processes, and testingProficiency in Microsoft Project, Access, Word, Excel, Visio, and PowerPointStrong project leadership, interpersonal, communication, facilitation, and negotiation skillsExcellent group facilitation and teambuilding skills in technical and business troubleshootingPreferred experience in COBOL, JCL, CICS, MVS, DB2, and SDLC methodologyPMI Project Management Professional Certification is preferredSuccess Factors:Full ownership of the project management processOutgoing, positive personalityAbility to resolve conflicts, work in a team, problem-solve, and make decisions effectivelyDetail-oriented with strong business consulting skillsStrong motivational and leadership skills",
        "source": "Email",
        "date_posted": "2024-10-11 10:43:03-05:00",
        "unique_id": "1927c602647cdcf0",
        "emp_type": [
            "contract",
            "third party"
        ],
        "tag": "Project Manager"
    }
]