[
    {
        "company": "GVR Infotek",
        "job_title": ".NET Lead Developer",
        "location": "Minneapolis, MN, USA",
        "full_location": {
            "city": "Minneapolis",
            "state": "MN",
            "country": "USA"
        },
        "job_details": {
            "employment_type": [
                "full-time",
                "third party"
            ],
            "job_code": "",
            "experience_required": "10-12+ years",
            "degree_required": "Bachelor\u2019s degree in Computer Science or equivalent work experience",
            "visa_sponsorship": "Not specified",
            "notice_period": "Not specified",
            "duration": "Not specified",
            "rate": "Not specified"
        },
        "skills": {
            "core": [
                ".Net Development",
                "C#",
                ".Net Core/.Net 5/6",
                "SQL",
                "Entity Framework",
                "LINQ",
                "Microservice architecture",
                "Containerized application design",
                "Test-Driven Development",
                "Token-based security solution design",
                "CICD pipeline",
                "Git",
                "Docker",
                "Kubernetes"
            ],
            "primary": [
                "React",
                "Angular",
                "Typescript",
                "JavaScript",
                "Jenkins",
                "Azure",
                "AWS"
            ],
            "secondary": [
                "Excellent communication skills",
                "Experience with CDO market"
            ],
            "all": [
                ".Net Development",
                "C#",
                ".Net Core/.Net 5/6",
                "SQL",
                "Entity Framework",
                "LINQ",
                "Microservice architecture",
                "Containerized application design",
                "Test-Driven Development",
                "Token-based security solution design",
                "CICD pipeline",
                "Git",
                "Docker",
                "Kubernetes",
                "React",
                "Angular",
                "Typescript",
                "JavaScript",
                "Jenkins",
                "Azure",
                "AWS",
                "Excellent communication skills",
                "Experience with CDO market"
            ]
        },
        "job_type": [
            "hybrid"
        ],
        "contact_person": "Vikash Kumar",
        "email": "vikash.kumar@gvrinfotek.com",
        "jd": "From: vikash kumar, gvr infotek vikash.kumar@gvrinfotek.com Reply to: vikash.kumar@gvrinfotek.com This is implementation partner requirement. Please submit only Genuine candidatesLinkedIn id is must (Should not been created recently, at least 6 Years old in case of senior candidates)Role: .NET Lead DeveloperLocation: Minneapolis, Minnesota or Chicago, IL Need Locals onlyDay 1 Hybrid Onsite LinkedIn id is must (Should not been created recently, at least 6 Years old in case of senior candidates)CITIZEN,Asylum,GC EAD,GREEN CARD,H4 EAD,J2 EAD,L2 EAD,TN Permit Requirements:10-12+ years of .Net Development experience Bachelor\u2019s degree in Computer Science or equivalent work experienceExperience with micro service architecture and containerized application design (5+ years)Hands-on experience with project setup, schema creation, development of queries, documents and dashboardExperience with .NET API for backend API development (5+ years)Excellent skills in C#, .Net Core/.Net 5/6, SQL and database Performance turning, Entity Framework, LINQ (5+ years)Experience with Test-Driven Development in writing integration, acceptance, and unit tests (5+ years)Experience with token-based security solution design and implementation (3+ years)Experience with CICD pipeline, Jenkins is preferredExperience with front-ed web frameworks and toolkits such as React and Angular, Typescript or JavaScript (3+ years)Experience with Git is required (5+ years)Experience with Docker container and Kubernetes is required (1+ year)Excellent communication skillExperience with CDO market is desirable but not requiredExperience with Azure and AWS is preferred but not requiredJob Description:Provides detail solution for web application development using .Net 6 or above, React/Typescript, SQL Server etc.Participate in establishing processes and best practices around development standards, version control, quality control, deployment, maintenance and change managementBe able to work directly, efficiently, and professionally in an Agile environment with other developers and team members including senior developers, systems administrators, and business usersProvides detail technical design to developersAble to assist developers to solve technical problemsProvide solutions for application improvements and enhancementsWorks with product owners to understand requirement and transform into technical solutionAble to work independently to solve complex problemsStrong problem-solving skills. Must be able to invent creative solutions for complex problemsPerform code review and mentor other developers.",
        "source": "Email",
        "date_posted": "2024-10-11 11:18:11-05:00",
        "unique_id": "1927c805235ceb9e",
        "emp_type": [
            "full-time",
            "third party"
        ],
        "tag": ".net developer"
    }
]