[
    {
        "company": "InfoTech Spectrum Inc",
        "job_title": "Business Analyst",
        "location": "Jersey City, NJ, USA",
        "full_location": {
            "city": "Jersey City",
            "state": "NJ",
            "country": "USA"
        },
        "job_details": {
            "employment_type": [
                "full-time",
                "third party"
            ],
            "experience_required": "7-9 years",
            "degree_required": "Bachelor\u2019s Degree preferred",
            "visa_sponsorship": "Must have existing work authorization",
            "notice_period": "Not specified",
            "duration": "6 months",
            "rate": "Not specified"
        },
        "skills": {
            "core": [
                "Servicenow",
                "Azure",
                "UAT"
            ],
            "primary": [
                "Microsoft SharePoint",
                "UI/design specs/wireframes",
                "Microsoft Office products (Visio, Excel, Word, PowerPoint)",
                "Azure DevOps",
                "JIRA"
            ],
            "secondary": [
                "Insurance industry experience",
                "Strong customer service orientation",
                "Excellent writing",
                "communication",
                "problem solving",
                "analytical skills",
                "Experience writing business requirements",
                "functional specifications",
                "Experience performing gap analyses",
                "Strong attention to detail",
                "Ability to juggle multiple deadlines"
            ],
            "all": [
                "Servicenow",
                "Azure",
                "UAT",
                "Microsoft SharePoint",
                "UI/design specs/wireframes",
                "Microsoft Office products (Visio, Excel, Word, PowerPoint)",
                "Azure DevOps",
                "JIRA",
                "Insurance industry experience",
                "Strong customer service orientation",
                "Excellent writing",
                "communication",
                "problem solving",
                "analytical skills",
                "Experience writing business requirements",
                "functional specifications",
                "Experience performing gap analyses",
                "Strong attention to detail",
                "Ability to juggle multiple deadlines"
            ]
        },
        "job_type": [
            "hybrid"
        ],
        "contact_person": "Muskan Sharma",
        "email": "muskan.sharma@infotechspectrum.com",
        "jd": "From: Muskan, infotech muskan.sharma@infotechspectrum.com Reply to: muskan.sharma@infotechspectrum.com HI,HiJob TitleBusiness AnalystLocation Work Location: Jersey City, New Jersey and Philadelphia, Pennsylvania, It\u2019s a hybrid role. Work from office 2-3 days in a week.- Local Only with local DL CopyDuration6 monthsPriorityN/APrimary SkillsServicenow,Azure,UATVisaUSC H4EAD Prefer GCEAD GC Work but only genuine visa copyJob DescriptionBusiness Analyst.Work Location: Jersey City, New Jersey and Philadelphia, Pennsylvania, It\u2019s a hybrid role. Work from office 2-3 days in a week.- Local It would be great if you also had:Experience in the financial services industry. Job Summary:Formulates and defines systems scope and objectives based on both user needs and a good understanding of business systems and industry requirements. Devises or modifies procedures to solve problems while considering technical feasibility and desired results. Essential Job Functions:Responsible for eliciting, analyzing, and documenting business and functional requirements.Responsible for identifying, evaluating, and recommending potential solution options.Responsible for analyzing the feasibility and cost benefit of potential solution options.Responsible for managing communications between IT and business for assigned work.Assists in formulating and designing system scope and objectives based on user needs and thorough understanding of IT and business processes.Participates in the technical design, prototyping, test planning, developing, testing, and implementation of new or enhanced applications.Provides support to development, testing, and/or business teams during application deployment.Works with internal business and IT groups on process improvement projects designed to improve output and/or efficiency.Provides technical guidance concerning business implications of application development projects.Assists in training users on new or enhanced applications.Supports the planning and execution of User Acceptance Testing (UAT).Other Functions:Perform special projects and other duties as may be assigned.Complies with proper internal controls as necessary to conduct job functions and/or carry out responsibilities and/or administrative activities at the Company.Establishes and builds strong working relations and partnerships with Business Units and Senior Management.Qualifications:Bachelor\u2019s Degree preferred7-9 years\u2019 experience as an IT business analyst preferredExcellent writing, communication, problem solving, and analytical skillsExperience writing business requirements and functional specificationsExperience performing gap analyses, and comparing and documenting current and future statesStrong customer service orientation and interpersonal relationship building skills: able to work with a variety of people and groups in a constructive and collaborative mannerSuperior attention to detailExperience as a business analyst during system design and/or configuration and implementationInsurance industry experience is very helpful, but not requiredExperience with Microsoft SharePoint is very helpful, but not requiredExperience with UI/design specs/wireframesKnowledge of Microsoft Office products (Visio, Excel, Word, and PowerPoint)Experience creating and editing user stories in Azure DevOps and/or JIRAExperience with ServiceNowKnowledge of activities, tasks, practices and deliverables associated with eliciting and clearly defining and documenting required business functionality as well as non-functional requirementsDemonstrated knowledge of SDLC, as well as other formal methodologies for planning and executing application development, enhancement, or supportStrong analytical ability with the capability to determine the root cause of problems and issues and provide solutionsAbility to juggle multiple, competing, frequently changing time-sensitive deadlines and priorities.",
        "source": "Email",
        "date_posted": "2024-10-11 14:32:03-05:00",
        "unique_id": "1927d4d3c6b9d4c4",
        "emp_type": [
            "full-time",
            "third party"
        ],
        "tag": "Business Analyst"
    }
]