[
    {
        "company": "Gacsol",
        "job_title": "Data Project Manager",
        "location": "Miami Beach, FL, USA",
        "full_location": {
            "city": "Miami Beach",
            "state": "FL",
            "country": "USA"
        },
        "job_details": {
            "employment_type": [
                "full-time",
                "third party"
            ],
            "experience_required": "Not specified",
            "degree_required": "Not specified",
            "visa_sponsorship": "Not specified",
            "notice_period": "Not specified",
            "duration": "Not specified",
            "rate": "Not specified"
        },
        "skills": {
            "core": [
                "Program Management",
                "Data Governance",
                "Data Privacy",
                "Agile"
            ],
            "primary": [
                "Communication",
                "Coordination",
                "Stakeholder Management"
            ],
            "secondary": [
                "GDPR",
                "Data Management",
                "Risk Management"
            ],
            "all": [
                "Program Management",
                "Data Governance",
                "Data Privacy",
                "Agile",
                "Communication",
                "Coordination",
                "Stakeholder Management",
                "GDPR",
                "Data Management",
                "Risk Management"
            ]
        },
        "job_type": [
            "hybrid"
        ],
        "contact_person": "Barla Santosh",
        "email": "sbarla@gacsol.com",
        "jd": "From: Barla Santosh, Gacsol sbarla@gacsol.com Reply to: sbarla@gacsol.com Title: Data Project Manager Work location: MIAMI BEACH , FL(Hybrid) JOB DESCRIPTION: A hands-on technical PM with strong communication and co-ordination skills, flexible work style, and have worked in a matrix environment with multiple stakeholder groups and may have managed competing priorities.Basic knowledge of GDPR, Data Governance, DSR and Data Privacy initiatives will be needed. Program Management: Lead cross-functional teams to deliver Data Management & Governance program objectives on time and within budgetDevelop and manage program plans, budgets, and timelines, ensuring alignment with individual projectsTrack program progress and performance metrics, identifying and addressing potential roadblocks. Manage resource allocation and utilization across program projectsEnsure projects meet quality standards and contribute to overall program goalsSupport risk management activities for the program Agile AI Process Facilitation: Support the continuous improvement of development processesEnsure Agile ceremonies such as standup meetings, sprint planning, sprint reviews, and retrospectives are executed effectively",
        "source": "Email",
        "date_posted": "2024-10-11 10:38:22-05:00",
        "unique_id": "1927c5bdc6fc5b55",
        "emp_type": [
            "full-time",
            "third party"
        ],
        "tag": "Project Manager"
    }
]