[
    {
        "company": "Softcom Systems, Inc",
        "job_title": ".NET Senior Developer/Lead",
        "location": "Newark, NJ, USA",
        "full_location": {
            "city": "Newark",
            "state": "NJ",
            "country": "USA"
        },
        "job_details": {
            "employment_type": [
                "contract",
                "third party"
            ],
            "job_code": "",
            "experience_required": "12+ years",
            "degree_required": "BS degree in Computer Science, a related technical field, or equivalent practical experience required",
            "visa_sponsorship": "Not specified",
            "notice_period": "Not specified",
            "duration": "6 months+ (could go longer)",
            "rate": "Not specified"
        },
        "skills": {
            "core": [
                "C#",
                ".NET Core",
                "SQL",
                "Oracle",
                "SQL Server"
            ],
            "primary": [
                "PL/SQL",
                "stored procedures",
                "Microsoft Fabric",
                "Agile methodologies",
                "Test Driven Development",
                "Entity Framework",
                "MVC",
                "CICD",
                "API management software"
            ],
            "secondary": [
                "analytical skills",
                "verbal communication",
                "written communication",
                "internal/external working relationships",
                "Application Lifecycle Management",
                "investments or securities",
                "TFS/Bit bucket source control tool",
                "Autosys job management",
                "JIRA",
                "Jenkins"
            ],
            "all": [
                "C#",
                ".NET Core",
                "SQL",
                "Oracle",
                "SQL Server",
                "PL/SQL",
                "stored procedures",
                "Microsoft Fabric",
                "Agile methodologies",
                "Test Driven Development",
                "Entity Framework",
                "MVC",
                "CICD",
                "API management software",
                "analytical skills",
                "verbal communication",
                "written communication",
                "internal/external working relationships",
                "Application Lifecycle Management",
                "investments or securities",
                "TFS/Bit bucket source control tool",
                "Autosys job management",
                "JIRA",
                "Jenkins"
            ]
        },
        "job_type": [
            "hybrid"
        ],
        "contact_person": "Bharathi",
        "email": "bharathi@softcomsystems.com",
        "jd": "From: Bharathi, Softcom Systems. Inc bharathi@softcomsystems.com Reply to: bharathi@softcomsystems.com Role : .NET Senior Developer/LeadLocation : Newark, NJ Hybrid (3 days onsite)Duration : 6 months+ (could go longer)Interview Process:Initial Phone/Video interviews followed by an in person interview. SO LOCAL CANDIDATES ONLY.JD: QualificationsBS degree in Computer Science, a related technical field, or equivalent practical experience required12+ years of current experience in Software DevelopmentExperience with one or more object-oriented programming language, e.g. C#, .NET Core, SQL, etc.Knowledge of database systems including Oracle and SQL ServerStrong PL\\SQL or stored procedure experienceStrong analytical skills, including a thorough understanding of how to interpret business needs and translate them into application requirementsExcellent verbal and written communication skills to effectively and confidently communicate with users, team members, and managementAbility to develop effective internal/external working relationships with both business units and vendors Familiarity with Microsoft Fabric Experience with the following would be a plus:Microsoft Fabric experience is plusApplication Lifecycle Management techniques and conceptsExperience with investments or securitiesAbility to work with Agile methodologies in a fast paced environmentExperience with one or more object-oriented programming language C#Test Driven Development, Entity Framework, MVCTFS/Bit bucket source control toolAutosys job management experienceJIRA experience for Agile ProjectsContinuous Integration Continuous Delivery (CICD) tools such as Jenkins and automated processesAPI management software like Apigee or equivalent",
        "source": "Email",
        "date_posted": "2024-10-11 14:42:57-05:00",
        "unique_id": "1927d3bc8246a662",
        "emp_type": [
            "contract",
            "third party"
        ],
        "tag": ".net developer"
    }
]