[
    {
        "company": "Intellectt Inc",
        "job_title": "AWS with API Technical Lead",
        "location": "Alameda, CA, USA",
        "full_location": {
            "city": "Alameda",
            "state": "CA",
            "country": "USA"
        },
        "job_details": {
            "employment_type": [
                "third party"
            ],
            "job_code": "",
            "experience_required": "5 Years",
            "degree_required": "Not specified",
            "visa_sponsorship": "Not specified",
            "notice_period": "Not specified",
            "duration": "Not specified",
            "rate": "Not specified"
        },
        "skills": {
            "core": [
                "AWS Cloud Experience",
                "AWS API Gateway",
                "AWS Lambda",
                "Python"
            ],
            "primary": [
                "API Design and Development",
                "Architectural Guidance",
                "Performance and Scalability",
                "Security and Compliance",
                "Continuous Improvement"
            ],
            "secondary": [
                "Okta",
                "CSRF",
                "Access tokens",
                "AWS well architected framework pillars"
            ],
            "all": [
                "AWS Cloud Experience",
                "AWS API Gateway",
                "AWS Lambda",
                "Python",
                "API Design and Development",
                "Architectural Guidance",
                "Performance and Scalability",
                "Security and Compliance",
                "Continuous Improvement",
                "Okta",
                "CSRF",
                "Access tokens",
                "AWS well architected framework pillars"
            ]
        },
        "job_type": [],
        "contact_person": "Nirmala",
        "email": "devi@intellectt.com",
        "jd": "From: Nirmala, Intellectt Inc devi@intellectt.com Reply to: devi@intellectt.com AWS with API Technical LeadAlameda, CA Job Description:As an API / Solutions Architect, you will be responsible for designing, developing, and maintaining complex API solutions that meet the requirements as well as adhere to established architectural principles, standards, and patterns.He / She will collaborate closely with cloud engineering platform team to work on API and Devops tools. He / she will collaborate with software developers, system architects, product managers, and stakeholders, to ensure APIs are robust, scalable, and secure. Mandatory Skills:\u2022 Total IT 13+ Years\u2022 Minimum: 5 Years AWS Cloud Experience\u2022 AWS API Gateway\u2022 AWS Lambda\u2022 Able to write Lambda functions using Python Primary (Must have skills) *Key Responsibilities:API Design and Development:Lead the design and development of APIs that enable integration between various AWS componentsDefine API standards, best practices, and guidelines to ensure consistency across APIs.Architectural Guidance:Provide reviews on present AWS architecture implementation andProvide technical leadership and guidance on API architecture, design decisions, and implementation strategies.Collaborate with solution architects and development teams to integrate API solutions into larger systems or platforms.Technologies and Frameworks:Use of Okta for authentication make use of CSRF and Access tokensKnowledge of aws well architected framework pillarsPerformance and Scalability:Design APIs with a focus on performance, scalability, reliability, and security.Conduct performance tuning and optimization of APIs to handle high traffic and large volumes of data.Security and Compliance:Implement security measures such as authentication, authorization, encryption, and data protection mechanisms in APIs.Understand AWS SSO API working and cross role working across accountsContinuous Improvement:Stay updated on emerging technologies, industry trends, and best practices related to APIs and integration.Drive initiatives for continuous improvement of API development processes, tools, and methodologies.",
        "source": "Email",
        "date_posted": "2024-10-11 09:29:37-05:00",
        "unique_id": "1927c1e23354a662",
        "emp_type": [
            "third party"
        ],
        "tag": "AWS Data Engineer"
    }
]