[
    {
        "company": "Kriscon",
        "job_title": "Sr. Pega Developers",
        "location": "Austin, TX, USA",
        "full_location": {
            "city": "Austin",
            "state": "TX",
            "country": "USA"
        },
        "job_details": {
            "employment_type": [
                "third party"
            ],
            "job_code": "",
            "experience_required": "Not specified",
            "degree_required": "Not specified",
            "visa_sponsorship": "Not specified",
            "notice_period": "Not specified",
            "duration": "Not specified",
            "rate": "Not specified"
        },
        "skills": {
            "core": [
                "Pega PRPC 5.x/6.x/7.x",
                "Agile development",
                "application design",
                "software development",
                "testing"
            ],
            "primary": [
                "object-oriented analysis",
                "data models",
                "business databases",
                "legacy systems",
                "web services",
                "troubleshooting",
                "coding bugs",
                "project management"
            ],
            "secondary": [
                "J2EE",
                "XML",
                "Java",
                "JSP",
                "EJB",
                "Scrum",
                "Angular JS",
                "jQuery",
                "JavaScript",
                "CSS",
                "HTML5"
            ],
            "all": [
                "Pega PRPC 5.x/6.x/7.x",
                "Agile development",
                "application design",
                "software development",
                "testing",
                "object-oriented analysis",
                "data models",
                "business databases",
                "legacy systems",
                "web services",
                "troubleshooting",
                "coding bugs",
                "project management",
                "J2EE",
                "XML",
                "Java",
                "JSP",
                "EJB",
                "Scrum",
                "Angular JS",
                "jQuery",
                "JavaScript",
                "CSS",
                "HTML5"
            ]
        },
        "job_type": [],
        "contact_person": "Kriscon Surya",
        "email": "suryap@krisconit.com",
        "jd": "From: Surya, Kriscon suryap@krisconit.com Reply to: suryap@krisconit.com Sr. Pega Developers Location Pref : Austin, TX (1st choice) the client can also consider Morris Plains, NJ or STL, MO or Memphis, TNNote : Certified LSA\u2019s are desired.Job Description: Demonstrated experience in Agile development, application design, software development, and testingDesigning class structures, application frameworks, and data modelsExpertise in object-oriented analysis and design across a variety of platformsExperience and thorough understanding of Pega RULES Process Commander System or other Business Process Management (BPM) systemIntegrating business databases, legacy systems, and web services.Troubleshooting application issues, coding bugs, and bottlenecks.Maintaining the security of all system applications.Coordinating with the project team to ensure the business architecture matches the needs of the customer.Performing solution architecture within the Pega PRPC environment.Ability to effectively communicate to internal and external business partners on solution designPega Developer Requirements:Proven work experience as a Pega developer.Advanced knowledge of Pega PRPC 5.x/6.x/7.x.Familiarity with J2EE, XML, Java, JSP, and EJB.Familiarity with Scrum and Agile methodology.Knowledge of coding languages including Angular JS, Java, and jQuery.Knowledge of web technologies including JavaScript, CSS, HTML5, and XML.Excellent project management skills.Ability to troubleshoot complex software issues",
        "source": "Email",
        "date_posted": "2024-10-11 08:04:48-05:00",
        "unique_id": "1927be5b57378a68",
        "emp_type": [
            "third party"
        ],
        "tag": "PEGA Developer"
    }
]