[
    {
        "company": "Infinity Quest",
        "job_title": "Java React Developer with Redux Experience",
        "location": "St. Louis, MO, USA",
        "full_location": {
            "city": "St. Louis",
            "state": "MO",
            "country": "USA"
        },
        "job_details": {
            "employment_type": [
                "full-time",
                "third party"
            ],
            "experience_required": "6-9 years",
            "degree_required": "Not specified",
            "visa_sponsorship": "Not specified",
            "notice_period": "Not specified",
            "duration": "Not specified",
            "rate": "Not specified"
        },
        "skills": {
            "core": [
                "React",
                "Java",
                "JavaScript",
                "HTML",
                "CSS"
            ],
            "primary": [
                "Redux",
                "TypeScript",
                "jQuery",
                "NodeJS",
                "Git",
                "Jest"
            ],
            "secondary": [
                "Asynchronous Programming",
                "SCSS Preprocessor"
            ],
            "all": [
                "React",
                "Java",
                "JavaScript",
                "HTML",
                "CSS",
                "Redux",
                "TypeScript",
                "jQuery",
                "NodeJS",
                "Git",
                "Jest",
                "Asynchronous Programming",
                "SCSS Preprocessor"
            ]
        },
        "job_type": [
            "hybrid"
        ],
        "contact_person": "santhosh",
        "email": "santhosh.a@i-q.co",
        "jd": "From: santhosh, Infinity Quest santhosh.a@i-q.co Reply to: santhosh.a@i-q.co Java React Developer with Redux ExperienceSt.Louis, MOHybrid (Day One Onsite Must)Job Description: Experience: 6 to 9 years in software development.Core React Proficiency: Strong understanding of the core React language and related libraries.Asynchronous Programming: Knowledge of asynchronous programming techniques.React Technologies: Familiarity with ReactJS, TypeScript, jQuery, Redux, and NodeJS.Version Control: Experience using version control systems such as Git.Web Technologies: Strong experience with JavaScript, HTML, and CSS.Testing: Familiarity with Jest for unit testing and SCSS preprocessor.Java: Proficient in Java development. Skill Matrix SkillsYears of ExperienceRatingLast UsedReact Development Web React Natice Scripts Javascript SCSS Preprocessor AngularJs Redux Git",
        "source": "Email",
        "date_posted": "2024-10-11 09:16:46-05:00",
        "unique_id": "1927c112bd11d32f",
        "emp_type": [
            "full-time",
            "third party"
        ],
        "tag": "Java developer"
    }
]