[
    {
        "company": "KK Software LLC",
        "job_title": "Business Process Modeler (BPM) Business Analyst",
        "location": "Jersey City, NJ, USA",
        "full_location": {
            "city": "Jersey City",
            "state": "NJ",
            "country": "USA"
        },
        "job_details": {
            "employment_type": [
                "full-time",
                "contract",
                "third party"
            ],
            "experience_required": "5+ years",
            "degree_required": "Not specified",
            "visa_sponsorship": "Not specified",
            "notice_period": "Not specified",
            "duration": "Long Term",
            "rate": "Not specified"
        },
        "skills": {
            "core": [
                "Business Process Modeling",
                "Analytical Skills",
                "Problem Solving",
                "Interpersonal Skills",
                "Communication Skills"
            ],
            "primary": [
                "BPM tools",
                "BPM notation",
                "MS Office",
                "Excel",
                "Visio",
                "MS Project",
                "Agile",
                "Waterfall",
                "JIRA",
                "Confluence"
            ],
            "secondary": [
                "Financial services",
                "PMO processes",
                "Project management",
                "End to end SDLC",
                "Business change management"
            ],
            "all": [
                "Business Process Modeling",
                "Analytical Skills",
                "Problem Solving",
                "Interpersonal Skills",
                "Communication Skills",
                "BPM tools",
                "BPM notation",
                "MS Office",
                "Excel",
                "Visio",
                "MS Project",
                "Agile",
                "Waterfall",
                "JIRA",
                "Confluence",
                "Financial services",
                "PMO processes",
                "Project management",
                "End to end SDLC",
                "Business change management"
            ]
        },
        "job_type": [
            "onsite"
        ],
        "contact_person": "Sushant Kumar",
        "email": "sushant.s@kksoftwareassociates.com",
        "jd": "From: Sushant kumar, KK Software LLC sushant.s@kksoftwareassociates.com Reply to: sushant.s@kksoftwareassociates.com Business Process Modeler (BPM) Business Analyst)Location: Jersey City, NJ \u2013 Local Candidate onlyLong Term Project FTE/Contract Job Description:The goal of the Business Process Modeler is to document the development of Target Operating Model processes via understanding of business requirements, technical architecture, and high-level design via the use of business process modeling tools and techniques.This role will also support efforts aimed at building and maintaining an effective process architecture asset which can be leveraged / reused in support of initiatives and technology strategy development.This role will collaborate with all areas and levels of the business and technology organization for the purposes of providing a modular view of the organization\u2019s business capabilities and processes and their relationships. This role will leverage broad technology knowledge to support the evolution of process models to technical implementation and guide the development of process modeling assets that effectively integrate with any existing information models, service models, and business rules. Role will be to assess current state and model a target state business process model to drive and achieve defined requirements and design.This role will have multiple competing deadlines so ability to prioritize and communicate effectively at different levels is a key skill to have.Serves as a fully seasoned/proficient technical and business resource; provides business process knowledge and capabilities as team member / individual contributor or lead a team. Role expectations:Experience of driving to the desired result in time and achieve sign offs from different stakeholders like Product Owners, Technology heads, Risk & Compliance LOB heads and senior leadership team Partner with various SMEs to scope projects in-scope business processes based on divisional reference modelWork closely with business architecture and development team to ensure process requirements and functional designs are translated accurately into working technical designs.Develop current and/or future state business and technical process models based on modeling standards and reference models.Translate business process models and rules into functional, technical requirements, and business rules.Provide process team program and project management coordination and updatesEnsure process modeling deliverables are adhering to divisional standards and are peer reviewed.Develop and/or enhance current business process modeling standards.Strong communication skills with the ability to communicate effectively across varied areas including technology, business units and senior leadershipPrior experience summarizing and presenting complex issues to a non-technical audienceAbility to influence tactical / strategic decisions with key business partnersTaking ownership of problems and seeing them through to resolutionInfluencing and relationship building / management skills Creation and maintenance of assigned business / technical process models and business rulesInfluencing functional and non-functional requirements and supporting various teams for effective process design/modelingEnsuring accurate translation of requirements into process model and ensuring process design elements are incorporated into technical design and associated test suites Skills / experience for the role:Financial services in Corporate / Regulatory tech / Market Surveillance Understanding of PMO processes and project management (Prince 2) principles is preferredDemonstrated experience of strong analytical, problem solving and interpersonal skillsStrong working knowledge of process modeling and BPMMin 5+ years modeling and designing business processesPreferred experience of using BPM tools and BPM notationStrong MS Office skills including Excel, Visio, and MS ProjectExperience working with business operations team and understanding of technology languages and environments will be preferredIndustry standard delivery methodologies (Waterfall, Agile) and use of relevant tools (JIRA , Confluence etc.)End to end SDLC cycle and business change management cycle Exposure to skills from multiple subject areas such as Operating Model, Process Design, Digital and TechnologySupport the Product Owners, Design Leads / Operations Teams, Cross functional areas and leadership team",
        "source": "Email",
        "date_posted": "2024-10-11 11:05:07-05:00",
        "unique_id": "1927c745ce43346f",
        "emp_type": [
            "full-time",
            "contract",
            "third party"
        ],
        "tag": "Business Analyst"
    }
]