[
    {
        "company": "GVR INFO TEK",
        "job_title": "Java Full Stack Developer (heavy Angular)",
        "location": "Gilbert, AZ, USA",
        "full_location": {
            "city": "Gilbert",
            "state": "AZ",
            "country": "USA"
        },
        "job_details": {
            "employment_type": [
                "contract",
                "third party"
            ],
            "job_code": "",
            "experience_required": "5-8 years",
            "degree_required": "Not specified",
            "visa_sponsorship": "Not specified",
            "notice_period": "Not specified",
            "duration": "6+ month contract (likely to extend a year or more)",
            "rate": "$54.00 MAX"
        },
        "skills": {
            "core": [
                "Angular",
                "Java",
                "J2EE",
                "Spring",
                "Hibernate"
            ],
            "primary": [
                "REST-API",
                "Micro Services architecture"
            ],
            "secondary": [],
            "all": [
                "Angular",
                "Java",
                "J2EE",
                "Spring",
                "Hibernate",
                "REST-API",
                "Micro Services architecture"
            ]
        },
        "job_type": [
            "onsite"
        ],
        "contact_person": "Tarun Kumar",
        "email": "tarun.kumar@gvrinfotek.com",
        "jd": "From: Tarun Kumar, GVR INFO TEK tarun.kumar@gvrinfotek.com Reply to: tarun.kumar@gvrinfotek.com Java Full Stack Developer (heavy Angular)(Looking for Front end dev or angular not full stack )Terms: 6+ month contract (likely to extend a year or more)C2C Pay Rate: $54.00 MAXLocation: Must be local to Gilbert, AZ (close to Phoenix) - will be reporting onsite 3 days a week, every other week.Onsite InterviewNote : Looking for Front end dev or angular not full stack Note : Need local candidates, kindly submit dl,visa and linkedin.Additional Info:\u2022 This person will be supporting the State of Oregon Project\u2022 3-4 positions open for this role!!!\u2022 Fully qualifiedItems needed before present:\u2022 DOB\u2022 Solid LinkedIn profile\u2022 Visa\u2022 Visa expiration date\u2022 Employer corporation name\u2022 Bill to Prove ResidencyRequirements:\u2022 5-8 years' experience working as an Angular Developer\u2022 Proficiency in Java and J2EE in Java Development\u2022 Must be responsible for developing full stack application using Angular and Spring based REST-API.\u2022 Solid understanding of Hibernate.\u2022 Experience with Spring framework, particularly Spring REST if possible.\u2022 Experience with Micro Services architecture.",
        "source": "Email",
        "date_posted": "2024-10-11 09:25:54-05:00",
        "unique_id": "1927c1a1be11ee6a",
        "emp_type": [
            "contract",
            "third party"
        ],
        "tag": "Java developer"
    }
]