[
    {
        "company": "Adventa",
        "job_title": "Database Administrator",
        "location": "USA",
        "full_location": {
            "city": "",
            "state": "",
            "country": "USA"
        },
        "job_details": {
            "employment_type": [
                "contract",
                "third party"
            ],
            "job_code": "",
            "experience_required": "Not specified",
            "degree_required": "Bachelor's degree in Computer Science, Information Technology, or a related field.",
            "visa_sponsorship": "Not specified",
            "notice_period": "Not specified",
            "duration": "12 Month",
            "rate": "Not specified"
        },
        "skills": {
            "core": [
                "Database Administration",
                "AWS",
                "Google Cloud Platform",
                "Microsoft Azure",
                "Database Management"
            ],
            "primary": [
                "Cloud Migration",
                "Optimization",
                "Cloud-native Database Solutions",
                "Migration Tools",
                "Problem-solving",
                "Communication"
            ],
            "secondary": [
                "Certifications in AWS, GCP, or Azure database management",
                "Experience in a multi-cloud environment",
                "Understanding of application modernization practices"
            ],
            "all": [
                "Database Administration",
                "AWS",
                "Google Cloud Platform",
                "Microsoft Azure",
                "Database Management",
                "Cloud Migration",
                "Optimization",
                "Cloud-native Database Solutions",
                "Migration Tools",
                "Problem-solving",
                "Communication",
                "Certifications in AWS, GCP, or Azure database management",
                "Experience in a multi-cloud environment",
                "Understanding of application modernization practices"
            ]
        },
        "job_type": [
            "remote"
        ],
        "contact_person": "sangya kumari nahak",
        "email": "sangya@adventatech.com",
        "jd": "From: sangya kumari nahak, adventa sangya@adventatech.com Reply to: sangya@adventatech.com Job Title: Database AdministratorMode Of Work : RemoteDuration: 12 MonthWork Auth. : CITIZEN,GC EAD,GREEN CARD,H4 EADMode OF Interview : Skype Please send DL copy with 5 SSN no. and with full educational detailsProject descriptionWe are seeking a skilled Database Administrator to join our cloud migration initiative focused on modernizing applications across multiple cloud platforms, including AWS, Google Cloud Platform (GCP), and Microsoft Azure. The ideal candidate will play a critical role in ensuring the seamless migration, optimization, and management of databases as part of our modernization strategy.ResponsibilitiesThe ideal candidate will play a critical role in ensuring the seamless migration, optimization, and management of databases as part of our modernization strategy.Skills Must haveBachelor's degree in Computer Science, Information Technology, or a related field.Proven experience as a Database Administrator with cloud platforms (AWS, GCP, Azure).Strong knowledge of database management, optimization, and administration on cloud environments.Experience with cloud-native database solutions and services.Familiarity with migration tools and techniques for cloud environments.Excellent problem-solving skills and attention to detail.Strong communication skills, with the ability to work effectively in a team setting.Nice to haveCertifications in AWS, GCP, or Azure database management.Experience in a multi-cloud environment.Understanding of application modernization practices and principles.",
        "source": "Email",
        "date_posted": "2024-10-11 11:02:24-05:00",
        "unique_id": "1927c9a180e9f8b4",
        "emp_type": [
            "contract",
            "third party"
        ],
        "tag": "DB Admin"
    }
]