[
    {
        "company": "Infotech Spectrum",
        "job_title": "Java Developer",
        "location": "Cary, NC, USA",
        "full_location": {
            "city": "Cary",
            "state": "NC",
            "country": "USA"
        },
        "job_details": {
            "employment_type": [
                "full-time",
                "third party"
            ],
            "experience_required": "6+ years",
            "degree_required": "Not specified",
            "visa_sponsorship": "No visa sponsorship",
            "notice_period": "Not specified",
            "duration": "Not specified",
            "rate": "Not specified"
        },
        "skills": {
            "core": [
                "Core Java/J2EE",
                "Angular",
                "Micro-services",
                "Web Application Development",
                "Spring",
                "JPA"
            ],
            "primary": [
                "React",
                "SOAP",
                "REST",
                "Web services",
                "Spring Cloud",
                "Spring Boot",
                "Redis NoSQL database",
                "Spring Security",
                "Hibernate",
                "Spring Data"
            ],
            "secondary": [
                "Jira",
                "Confluence",
                "HTML5",
                "CSS",
                "JSON",
                "Build tools such as Ant",
                "Maven",
                "SCM Tools"
            ],
            "all": [
                "Core Java/J2EE",
                "Angular",
                "Micro-services",
                "Web Application Development",
                "Spring",
                "JPA",
                "React",
                "SOAP",
                "REST",
                "Web services",
                "Spring Cloud",
                "Spring Boot",
                "Redis NoSQL database",
                "Spring Security",
                "Hibernate",
                "Spring Data",
                "Jira",
                "Confluence",
                "HTML5",
                "CSS",
                "JSON",
                "Build tools such as Ant",
                "Maven",
                "SCM Tools"
            ],
            "with_experience": [
                "Core Java/J2EE",
                "Angular",
                "Micro-services",
                "Web Application Development",
                "Spring",
                "JPA"
            ]
        },
        "job_type": [
            "onsite"
        ],
        "contact_person": "Jaya",
        "email": "jaya@infotechspectrum.com",
        "jd": "Hello,I am looking for the candidates regarding the following position:: Java Developer w/ AngularHybrid - Cary, NCOnly USC, GC with local DL from NCJob Description:MUST HAVE SKILLS:Core Java/J2EE - 5+ yearsAngular is mustMicro-services - 3+ yearsWeb Application Development - 5+Spring - 5+JPA - 3+DESIRED SKILLS:React - 2+years Need Hands on Java Developer with 6+ years of progressive experience designing and developing applications and/or systems using Core java/J2EE, Angular Microservices framework, SOAP, REST, Web services. JOB DUTIES:Develop, create and modify general computer applications software or specialized utility programs.Analyze user needs and develop software solutions.Design software or customize software for client use with the aim of optimizing operational efficiency.May analyze and design databases within an application area.Assisting Lead developer and developers.Assisting the project management and testers in creation of the test plan and test scenarios whose scope includes new code or changes in the existing code.Providing input to technical lead and architect on development solutions; Monitoring and supporting high volume batch file and web service integrations.Creating wireframes, graphical templates and other graphical elements for various web based projectsEnsure site design integrity and quality control consistency throughout a project life cycleDesigning graphic or related fieldWorking on cutting-edge websites and web based applications,Managing time effectively, and work on multiple project timelines simultaneously in a demanding deadline driven environment.Use project management tools such Jira, confluence to create and track project tasks, defects.Working on web application development, design, unit testing and implementation. Proficiency in core java/j2ee and microservices.Implementing java microservices based applicationWorking on React JAVA, J2EE, microservices, build tools such as ant, maven, SCM Tools, Enterprise class web application.Working Spring Cloud, Microsevices, spring boot, redis NoSQL database, spring security, REST Web services, Netflix Eureka, Zuul API gateway, Hibernate, Spring Data, JPA. React technologies.Experience working on system integrationsWorking on Front-end (React, HTMLS, CSS, JSON) or backend (core Java) development skills (ideally, experience in both).Develop business logic using tools such as Spring framework, JPA implement restful web services, micro services.",
        "source": "Email",
        "date_posted": "2024-10-11 14:04:49-05:00",
        "unique_id": "1927d69be7636e14",
        "emp_type": [
            "full-time",
            "third party"
        ],
        "tag": "Java developer"
    }
]