[
    {
        "company": "INNOZA TECH LLC",
        "job_title": ".Net Technical Architecture Specialist - A4 SC2 (748974)",
        "location": "Harrisburg, PA, USA",
        "full_location": {
            "city": "Harrisburg",
            "state": "PA",
            "country": "USA"
        },
        "job_details": {
            "employment_type": [
                "full-time",
                "third party"
            ],
            "experience_required": "10+ years",
            "degree_required": "Not specified",
            "visa_sponsorship": "Not specified",
            "notice_period": "Not specified",
            "duration": "9 Months PLUS",
            "rate": "Not specified"
        },
        "skills": {
            "core": [
                "ASP.Net",
                ".Net core",
                "VB.net",
                "C#",
                "ASP.net Webforms",
                "MVC",
                "Razor Pages / Views",
                "DevOps Sprints",
                "TFS",
                "Git",
                "API development",
                "WebAPIs",
                "WebServices",
                "SQL Server",
                "SQL writing scripts",
                "Stored Procedures",
                "SSRS reports",
                "UI development using HTML",
                "Jquery",
                "Bootstrap"
            ],
            "primary": [
                "Azure Knowledge",
                "SSIS Knowledge",
                "Angular 8 and above",
                "Entity Framework",
                "ADO.net",
                "Experience with unit testing",
                "HTML5",
                "CSS"
            ],
            "secondary": [
                "Good communication skills",
                "Strong documentation skills",
                "Willingness to learn new technologies and processes/procedures",
                "Ability to transfer knowledge to others",
                "Team player"
            ],
            "all": [
                "ASP.Net",
                ".Net core",
                "VB.net",
                "C#",
                "ASP.net Webforms",
                "MVC",
                "Razor Pages / Views",
                "DevOps Sprints",
                "TFS",
                "Git",
                "API development",
                "WebAPIs",
                "WebServices",
                "SQL Server",
                "SQL writing scripts",
                "Stored Procedures",
                "SSRS reports",
                "UI development using HTML",
                "Jquery",
                "Bootstrap",
                "Azure Knowledge",
                "SSIS Knowledge",
                "Angular 8 and above",
                "Entity Framework",
                "ADO.net",
                "Experience with unit testing",
                "HTML5",
                "CSS",
                "Good communication skills",
                "Strong documentation skills",
                "Willingness to learn new technologies and processes/procedures",
                "Ability to transfer knowledge to others",
                "Team player"
            ]
        },
        "job_type": [
            "remote"
        ],
        "contact_person": "Nagajyoti",
        "email": "njyoti@innozatech.com",
        "jd": "From: Nagajyoti, INNOZA TECH LLC. njyoti@innozatech.com Reply to: njyoti@innozatech.com Position: .Net Technical Architecture Specialist - A4 SC2 (748974)-Remote-Need LocalLocation: Harrisburg PADuration: 9 Months PLUSClient: OA/ESONeed 10+ years CandidateRemote position but Need local CandidateOA Enterprise Solutions Office is looking for Full Stack developers.*Remote, 40 hour per week position**Candidates must be PA residents or live within a 3-hour drive to Harrisburg area*This position will be supporting the Enterprise eGrants service as full stack developers. They are expected to assist in the planned maintenance (enhancements) and emergency maintained (bug fixes) of existing public-facing applications and existing internal-facing applications within the suite of Enterprise eGrants applications. This position is also expected to assist in the creation of new applications, both public-facing and internal, to support new Commonwealth agency onboarding efforts.Required Technical SkillsASP.Net.Net coreVB.netC#ASP.net Webforms, MVCRazor Pages / ViewsDevOps SprintsTFS and GitStrong understanding of API development \u2013 WebAPIsWebServicesSQL ServerSQL writing scripts, Stored ProceduresSSRS reportsUI development using HTML, Jquery, BootstrapAdditional Technical SkillsAzure KnowledgeSSIS KnowledgeAngular 8 and aboveEntity Framework, ADO.netExperience with unit testingHTML5, Jquery, CSSNon-Technical SkillsGood communication skillsStrong documentation skillsWillingness to learn new technologies and processes/proceduresAbility to transfer knowledge to others and have knowledge transferred to themselvesTeam playerSkillFull stack development experienceASP.NET.NET CoreVB.NET and C#ASP.NET Webforms, MVCRazor Pages / ViewsDevOps SprintsTFS and GitStrong understanding of API developmentSQL ServerSQL writing scripts, stored proceduresSSRS reportsUI Development using HTML, jQuery, Bootstrap",
        "source": "Email",
        "date_posted": "2024-10-11 12:26:13-05:00",
        "unique_id": "1927cbe9a8b6a25a",
        "emp_type": [
            "full-time",
            "third party"
        ],
        "tag": ".net developer"
    }
]