[
    {
        "company": "iTech US, Inc.",
        "job_title": "Sr Java Full Stack Developer",
        "location": "Princeton, NJ, USA",
        "full_location": {
            "city": "Princeton",
            "state": "NJ",
            "country": "USA"
        },
        "job_details": {
            "employment_type": [
                "contract",
                "third party"
            ],
            "experience_required": "12+ years",
            "degree_required": "Not specified",
            "visa_sponsorship": "Not specified",
            "notice_period": "Not specified",
            "duration": "Contract Role",
            "rate": "Not specified"
        },
        "skills": {
            "core": [
                "Java",
                "ReactJS",
                "Angular",
                "Spring Framework",
                "AWS"
            ],
            "primary": [
                "Core Java 11",
                "NodeJS",
                "CSS",
                "JavaScript",
                "Kubernetes",
                "Helm",
                "MongoDB",
                "Microservices"
            ],
            "secondary": [
                "Azure Cloud",
                "RDBMS practices",
                "Financial Services experience",
                "CI/CD",
                "API Gateway",
                "CloudFormation",
                "CloudWatch",
                "ECS",
                "EKS",
                "Fargate",
                "IAM",
                "KMS",
                "CloudTrail",
                "X-Ray"
            ],
            "all": [
                "Java",
                "ReactJS",
                "Angular",
                "Spring Framework",
                "AWS",
                "Core Java 11",
                "NodeJS",
                "CSS",
                "JavaScript",
                "Kubernetes",
                "Helm",
                "MongoDB",
                "Microservices",
                "Azure Cloud",
                "RDBMS practices",
                "Financial Services experience",
                "CI/CD",
                "API Gateway",
                "CloudFormation",
                "CloudWatch",
                "ECS",
                "EKS",
                "Fargate",
                "IAM",
                "KMS",
                "CloudTrail",
                "X-Ray"
            ]
        },
        "job_type": [
            "onsite"
        ],
        "contact_person": "Sowmyasri Sistla",
        "email": "sowmya.s@itechus.net",
        "jd": "From: Sowmyasri, ITECH sowmya.s@itechus.net Reply to: sowmya.s@itechus.net Hi,Greetings from iTech US, We are constantly on the lookout for professionals to fulfil the staffing needs of our clients, and we currently have a job opening that may interest you.Position : 1Role:: Java Full Stack DeveloperLocation:: Princeton, NJ :: Onsite Role ::Duration:: Contract RoleMust: Java with ReactJS 10+ yearsRole Description: Candidate should have strong experience in Java Full Stack using Angular as frontend framework.Should have experience in Core java 11 or later version.Good experience in backend implementation using various spring frameworks like Spring core, Spring REST , Spring MVC , Spring AOP, etc.,Experience in integrating backed application with UI technologies like ReactJS, NodeJS, CSS, JavaScript ,etc.Excellent communication and teamwork skills.Should have experience in working with Azure Cloud and deploying the applications using Kubernetes or Helm frameworks.Understanding of good RDBMS practices.? Financial Services experience is a plus? Ability to multi-task and to take the initiative when needed. Position : 2Role: Java DeveloperLocation : McLean, VA (onsite)Contract Must : 12+ years Role Description:Should be very good in AWS services - EC2, S3, EMR, Lambda, Cloud watch and more.Java with Microservice ,Mongo DB experience.Design, develop, and deploy web applications using AWS services such as EC2, S3, Lambda, and DynamoDBDevelop and maintain serverless architectures using AWS services such as API Gateway, CloudFormation, and CloudWatchCreate and maintain automated deployment pipelines using AWS Code Pipeline and CodeBuildDesign and develop RESTful APIs using AWS API Gateway and Lambda? Develop and maintain automated testing frameworks using AWS services such as CodeBuild and Code DeployDesign and develop cloud-native applications using AWS services such as ECS, EKS, and FargateDevelop and maintain cloud infrastructure using AWS services such as CloudFormation and CloudWatchMonitor and troubleshoot application performance using AWS services such as CloudWatch and X-RayDevelop and maintain security best practices for AWS services such as IAM, KMS, and CloudTrailDevelop and maintain CI/CD pipelines using AWS services such as Code Pipeline and CodeBuildDesign and develop serverless applications using AWS services such as Lambda and Step FunctionsDevelop and maintain automated backup and disaster recovery solutions using AWS services such as EBS and S3Advanced Java Concepts, Core JavaPlease share your updated resume along with current location details: Thanks,Sowmyasri SistlaEmail : sowmya.s@itechus.netiTech US, Inc. https://www.linkedin.com/in/sri-s-8795a9168/",
        "source": "Email",
        "date_posted": "2024-10-11 12:20:36-05:00",
        "unique_id": "1927cb9760162314",
        "emp_type": [
            "contract",
            "third party"
        ],
        "tag": "Java developer"
    }
]