[
    {
        "company": "Innovyt",
        "job_title": "Business Analyst",
        "location": "Lansing, MI, USA",
        "full_location": {
            "city": "Lansing",
            "state": "MI",
            "country": "USA"
        },
        "job_details": {
            "employment_type": [
                "contract",
                "third party"
            ],
            "job_code": "",
            "experience_required": "5 years",
            "degree_required": "Not specified",
            "visa_sponsorship": "Not specified",
            "notice_period": "Not specified",
            "duration": "12+ months",
            "rate": "Not specified"
        },
        "skills": {
            "core": [
                "Exposure to Complex IT web Applications",
                "Business Analyst experience",
                "Proficiency with MS Office",
                "Experience with Azure DevOps"
            ],
            "primary": [
                "Lead meetings",
                "Conduct training & information sessions",
                "Communicate at a level appropriate to the audience",
                "Make oral and written reports and presentations",
                "Liaison between development team and project manager or business client"
            ],
            "secondary": [],
            "all": [
                "Exposure to Complex IT web Applications",
                "Business Analyst experience",
                "Proficiency with MS Office",
                "Experience with Azure DevOps",
                "Lead meetings",
                "Conduct training & information sessions",
                "Communicate at a level appropriate to the audience",
                "Make oral and written reports and presentations",
                "Liaison between development team and project manager or business client"
            ]
        },
        "job_type": [
            "hybrid"
        ],
        "contact_person": "Priya",
        "email": "priya.gupta@innovyt.com",
        "jd": "From: Priya, Innovyt priya.gupta@innovyt.com Reply to: priya.gupta@innovyt.com Job Title \u2013 Business Analyst Location \u2013 Lansing, MI 48933 (Hybrid - 2 days onsite) - Local Candidate OnlyDuration \u2013 12+ months JD: Top Skills & Years of Experience Required: Exposure to Complex IT web Applications, within the past 5 years Required 5 Years Experience in a professional office environment Required 5 YearsExperience in a role, as a business analyst, supporting a software development project, in the past 5 years Required 3 YearsAbility to lead meetings, conduct training & information sessions, communicate at a level appropriate to the audience, make oral and written reports and presentations Required 3 YearsProficiency with MS Office Required 3 YearsExperience working as a liaison between the development team and project manager or business client in a software development project Required 2 Years Experience with Azure DevOps Required 6 Months",
        "source": "Email",
        "date_posted": "2024-10-11 14:40:45-05:00",
        "unique_id": "1927d39c417beec4",
        "emp_type": [
            "contract",
            "third party"
        ],
        "tag": "Business Analyst"
    }
]