[
    {
        "company": "Google",
        "job_title": "Data Works- MDM BSA",
        "location": "San Jose, CA, USA",
        "full_location": {
            "city": "San Jose",
            "state": "CA",
            "country": "USA"
        },
        "job_details": {
            "employment_type": [
                "third party"
            ],
            "job_code": "",
            "experience_required": "Not specified",
            "degree_required": "Not specified",
            "visa_sponsorship": "Not specified",
            "notice_period": "Not specified",
            "duration": "Not specified",
            "rate": "Not specified"
        },
        "skills": {
            "core": [
                "Experience working on enterprise data projects",
                "Strong analytical and problem solving skills",
                "Experience in programming and SQL",
                "Hands on experience on data modeling"
            ],
            "primary": [
                "Excellent communication skills",
                "Deep knowledge of master data management concepts",
                "Implementation experience with tools like Reltio, SAP MDG or Informatica MDM",
                "Visualization expertise in tools like Tableau, Power BI, Looker"
            ],
            "secondary": [
                "Ability to operate in a complex environment of multiple projects and stakeholders"
            ],
            "all": [
                "Experience working on enterprise data projects",
                "Strong analytical and problem solving skills",
                "Experience in programming and SQL",
                "Hands on experience on data modeling",
                "Excellent communication skills",
                "Deep knowledge of master data management concepts",
                "Implementation experience with tools like Reltio, SAP MDG or Informatica MDM",
                "Visualization expertise in tools like Tableau, Power BI, Looker",
                "Ability to operate in a complex environment of multiple projects and stakeholders"
            ]
        },
        "job_type": [],
        "contact_person": "Akhil",
        "email": "tejaswini@quanterian.com",
        "jd": "From: AKHIL, Quanterian technologies tejaswini@quanterian.com Reply to: tejaswini@quanterian.com Role: Data Works- MDM BSA Location: San Jose, CA / Austin, TX / NYC, NY Client: Google Responsibilities Partner with the teams to design, develop and deliver data, analytics and master data management systems supporting various Google business processes (finance, legal, marketing, sales etc) Document Business/Functional requirements Participate in implementation projects (e.g., requirements documentation, use case development, functional design, test documentation/execution, UAT support, and production support). Partner with technical teams to develop, deliver and test the systems Participate and provide updates in project status meeting, scrum and planning meetings Minimum skills: Experience working on enterprise data projects (data warehouses/master data management, others) Strong analytical and problem solving skills Experience in programming and SQL Hands on experience on data modeling (Conceptual, logical and physical) Excellent communication skills with a demonstrated track record of effectively partnering with engineering , business, and operations teams Preferred skill Deep knowledge of master data management concepts Implementation experience with tools like Reltio, SAP MDG or Informatica MDM Visualization expertise in tools like Tableau, Power BI, Looker etc Ability to operate in a complex environment of multiple projects and stakeholders and to participate in several projects simultaneously. Thanks & Regards, Akhil SR IT Recruiter Quanterian technologies Email id: tejaswini@quanterian.com Contact No: 919-642-2220",
        "source": "Email",
        "date_posted": "2024-10-25 13:58:03-05:00",
        "unique_id": "192c971388ef592d",
        "emp_type": [
            "third party"
        ],
        "tag": "Business Analyst"
    }
]