[
    {
        "company": "Vyze Inc.",
        "job_title": "Oracle Developer",
        "location": "USA",
        "full_location": {
            "city": "",
            "state": "",
            "country": "USA"
        },
        "job_details": {
            "employment_type": [
                "third party"
            ],
            "job_code": "",
            "experience_required": "Not specified",
            "degree_required": "Not specified",
            "visa_sponsorship": "No visa sponsorship",
            "notice_period": "Not specified",
            "duration": "6+ Months",
            "rate": "Not specified"
        },
        "skills": {
            "core": [
                "Oracle",
                "PL/SQL",
                "Data Analytical skills",
                "Oracle SQL"
            ],
            "primary": [
                "Data management concepts",
                "Database structure",
                "Data warehouse",
                "Data modeling tools",
                "Business Intelligence",
                "Data architecture",
                "Entity relationship planning",
                "Dimensional modeling",
                "ETL",
                "OLAP",
                "Analytical reporting"
            ],
            "secondary": [
                "ERWIN",
                "Sybase Power Designer"
            ],
            "all": [
                "Oracle",
                "PL/SQL",
                "Data Analytical skills",
                "Oracle SQL",
                "Data management concepts",
                "Database structure",
                "Data warehouse",
                "Data modeling tools",
                "Business Intelligence",
                "Data architecture",
                "Entity relationship planning",
                "Dimensional modeling",
                "ETL",
                "OLAP",
                "Analytical reporting",
                "ERWIN",
                "Sybase Power Designer"
            ]
        },
        "job_type": [
            "remote"
        ],
        "contact_person": "Rahul Mishra",
        "email": "rmishra@vyzeinc.com",
        "jd": "From: Rahul Mishra, Vyzeinc rmishra@vyzeinc.com Reply to: rmishra@vyzeinc.com Oracle DeveloperLocation \u2013 RemoteDuration: 6+ MonthsVisa: NO H1BJD: Hands on development , designing experience working with Oracle , PL/SQL with strong Data Analytical skills (for data stored in Oracle / SQL Server).Strong knowledge of data management concepts, including database structure, and proficiency with Oracle SQL and other standard database query tools.Strong experience in building/setting up a new Data warehouseMust have good data modeling tool knowledge: i.e. ERWIN, Sybase Power Designer and others.Work experience with Business Intelligence (data architecture, entity relationship planning, dimensional modeling, ETL, OLAP, analytical reporting) preferredSr. Oracle Developer to design and implement NFFR, ADS and SOR related work .Experience in the IT field with experience as Data Modeler and Data Analysts for large and complex systemsBest RegardsRahul Mishra US Technical Recruiter |Vyze Inc.E-Mail: rmishra@vyzeinc.com",
        "source": "Email",
        "date_posted": "2024-10-18 16:48:21-05:00",
        "unique_id": "192a21bf047825eb",
        "emp_type": [
            "third party"
        ],
        "tag": "Oracle DBA"
    }
]