[
    {
        "company": "Absolute IT",
        "job_title": "Java Developer",
        "location": "Lansing, MI, USA",
        "full_location": {
            "city": "Lansing",
            "state": "MI",
            "country": "USA"
        },
        "job_details": {
            "employment_type": [
                "full-time",
                "third party"
            ],
            "experience_required": "Not specified",
            "degree_required": "Not specified",
            "visa_sponsorship": "No visa sponsorship",
            "notice_period": "Not specified",
            "duration": "Not specified",
            "rate": "Not specified"
        },
        "skills": {
            "core": [
                "Java",
                "SQL",
                "Java JEE",
                "Spring/SpringBoot",
                "Hibernate/JPA"
            ],
            "primary": [
                "AWS",
                "Databricks",
                "Elastic search",
                "Angular",
                "React JS",
                "JavaScript",
                "JBOSS",
                "CMM/CMMI Level 3",
                "Agile development",
                "CI/CD pipelines"
            ],
            "secondary": [
                "Eclipse",
                "STS",
                "RESTful Web Services",
                "Apache Struts",
                "Object Oriented programming",
                "Design patterns",
                "SDLC",
                "Database design",
                "GIT",
                "Maven",
                "Apache Tomcat",
                "Web Sphere",
                "Openshift Container",
                "Business Objects",
                "Oracle Discoverer",
                "HL7 solutions",
                "EDI X12 healthcare claims processing",
                "SIGMA payment processing"
            ],
            "all": [
                "Java",
                "SQL",
                "Java JEE",
                "Spring/SpringBoot",
                "Hibernate/JPA",
                "AWS",
                "Databricks",
                "Elastic search",
                "Angular",
                "React JS",
                "JavaScript",
                "JBOSS",
                "CMM/CMMI Level 3",
                "Agile development",
                "CI/CD pipelines",
                "Eclipse",
                "STS",
                "RESTful Web Services",
                "Apache Struts",
                "Object Oriented programming",
                "Design patterns",
                "SDLC",
                "Database design",
                "GIT",
                "Maven",
                "Apache Tomcat",
                "Web Sphere",
                "Openshift Container",
                "Business Objects",
                "Oracle Discoverer",
                "HL7 solutions",
                "EDI X12 healthcare claims processing",
                "SIGMA payment processing"
            ]
        },
        "job_type": [
            "onsite"
        ],
        "contact_person": "Devyani Kumari",
        "email": "devyani@absoluting.com",
        "jd": "Java Developer Needed - Candidate must be Within 2 hours of Lansing , Michigan Candidate must have an updated LinkedIn ID with a picrure and current location updated (REQUIRED!!)ONISTE INTERVIEW REQUIRED!!Based on the responsibilities the idea Java Developer would have experience in healthcare domains.Skills Required:+ years developing complex computer systems using Java.+ years developing complex computer systems using java IDEs such as Eclipse, STS+ years programming in SQL and/or PL/SQL.+ years programming using Java JEE Struts Framework+ years programming using Java JEE Spring/SpringBoot Framework 3.0.+ years of development using Hibernate/JPA framework.+ years experience with AWS, Databricks, and Elastic search.+ years in projects development using Angular/React JS, JavaScript framework.+ years programming in the JBOSS Enterprise SOA environment including JBOSS Workflow .+ years using CMM/CMMI Level 3 methods and practices.+ years implemented agile development processes including test driven development.+ years Experience or Knowledge on creating CI/CD pipelinesSummary of Responsibilities:\u2022 Write well-designed, testable code using spring MVC, Hibernate framework for entity object mapping, JQuery/HTML5, JavaScript, HTML, XML, Angular\u2022 Develop business application components using Object Oriented java/JEE technologies, design principles .\u2022 Design and develop RESTful Web Services using Spring Web MVC framework.\u2022 Design, Develop and maintain applications using Apache Struts framework.\u2022 Ability to implement design patterns like Intercepting Filter, Front Controller, Session Fa\u00e7ade, DAO, Singleton, and Service Locator\u2022 Execute full software development life cycle (SDLC) including experience in gathering requirements and writing functional/technical specifications for complex projects.\u2022 Excellent knowledge in designing both logical and physical database model\u2022 Develop database objects including stored procedures, functions,\u2022 Troubleshoots issues using SQL, PL/SQL scripts\u2022 Experience tuning SQL queries and scripts\u2022 Hands on experience Integrating software components into a fully functional software system\u2022 Extensive knowledge on source control tools such as GIT\u2022 Experience on Build Frameworks like Maven, maintain source code using source control, and baseline software versions and build war files for deployments\u2022 Experience developing with application servers Apache Tomcat, JBOSS, Web Sphere,Openshift Container\u2022 Develop software design documents and work with stakeholders for review and approval.\u2022 Experience developing, prototypes, mockup for users review and approval.\u2022 Exposure to flowcharts, screen layouts and documentation to ensure logical flow of the system requirements\u2022 Experience working on large agile projects.\u2022 Experience with Java 8, SOAP Web-Services and Java Messaging Service (JMS) API.\u2022 Experience with Spring Boot Projects, Spring Data, Spring Batch, Spring Security frameworks.\u2022 Good to have knowledge of Apache Kafka, Apache Spark and ActiveMQ broker.\u2022 Experience in Database Design in Oracle and SQL server.\u2022 Experience or Knowledge on creating CI/CD pipelines\u2022 Design, develop and maintain BI reporting solutions using Business Objects and Oracle Discoverer.\u2022 Extensive experience in Oracle database logical and physical design.\u2022 Develop PL/SQL Procedures, Functions, Packages and Job Scheduling.\u2022 Experience in Electronic Health Records(EHR) HL7 solutions.\u2022 Experience in 5010 EDI X12 healthcare claims processing solutions.\u2022 Experience in SIGMA payment processing type solutions.",
        "source": "Email",
        "date_posted": "2024-10-18 07:42:08-05:00",
        "unique_id": "1929fc6c23e780c8",
        "emp_type": [
            "full-time",
            "third party"
        ],
        "tag": "Java developer"
    }
]