[
    {
        "company": "TEK Inspirations LLC",
        "job_title": "Senior Java Programmer",
        "location": "Richmond, VA, USA",
        "full_location": {
            "city": "Richmond",
            "state": "VA",
            "country": "USA"
        },
        "job_details": {
            "employment_type": [
                "contract",
                "third party"
            ],
            "job_code": "",
            "experience_required": "15+ years",
            "degree_required": "Not specified",
            "visa_sponsorship": "Visa sponsorship available",
            "notice_period": "Not specified",
            "duration": "12 Months",
            "rate": "Not specified"
        },
        "skills": {
            "core": [
                "Java EE",
                "Core Java",
                "OOP Design",
                "Multi-Threading",
                "Generics",
                "Exception Handling",
                "Collections",
                "Java Reflection",
                "Annotation",
                "Oracle"
            ],
            "primary": [
                "Git Workflows",
                "CI/CD pipelines",
                "Azure DevOps",
                "Selenium",
                "Cucumber",
                "Playwright",
                "JUnit",
                "IBM SOA products",
                "Node.js",
                "Angular"
            ],
            "secondary": [
                "Test Left approach"
            ],
            "all": [
                "Java EE",
                "Core Java",
                "OOP Design",
                "Multi-Threading",
                "Generics",
                "Exception Handling",
                "Collections",
                "Java Reflection",
                "Annotation",
                "Oracle",
                "Git Workflows",
                "CI/CD pipelines",
                "Azure DevOps",
                "Selenium",
                "Cucumber",
                "Playwright",
                "JUnit",
                "IBM SOA products",
                "Node.js",
                "Angular",
                "Test Left approach"
            ]
        },
        "job_type": [
            "onsite"
        ],
        "contact_person": "Anshika Shukla",
        "email": "anshika.shukla@tekinspirations.com",
        "jd": "Job Description -Job Title: Senior Java Programmer Location: Richmond, VA 23219Contract: 12 Months Visa : CITIZEN,GREEN CARD,GC EAD,H4 EAD,H1B EXP 15 yrComplete Description: Before submitting: Only IN PERSON Interviews!! Team will only conduct in person interviews. No web-based interviews will be accepted. No Exceptions.Please submit Local to Virginia and Senior candidates at least 15+ years of experience About The RoleThis position will serve as a senior BACK-END application developer for the Information Management Division in the design, development, and maintenance of Java/ JEE based applications.Extensive practical experience in building enterprise applications using Java EE technologies.Expertise in Core Java concepts, such as OOP Design, Multi-Threading, Generics, Exception Handling, Collections, Java Reflection, Annotation.Understanding of relational database concepts with experience in Oracle.Experience developing with Git Workflows.Experience developing CI/CD pipelines and automation.Experience using Azure DevOps.Experience with Testing Frameworks such as Selenium, Cucumber, Playwright, JUnit and an understanding of Test Left approach to development.Experience with IBM SOA products like IIB/ACE, ODM, WAS, MQ, and ITXExperience with Front End Development using Node.js and Angular Skill Required / Desired Amount of ExperienceExtensive practical experience in building enterprise applications using Java EE technologies Required 5 YearsExpertise in Core Java concepts, such as OOP Design, Multi-Threading, Generics, Exception Handling, Collections, Java Reflection, Annotation, Required 5 YearsUnderstanding of relational database concepts with experience in Oracle Required 5 YearsExperience developing with Git Workflows Required 5 YearsExperience developing CI/CD pipelines and automation Required 3 YearsExperience using Azure DevOps Highly desired 2 YearsExperience with Testing Frameworks such as Selenium, Cucumber, Playwright, JUnit, and an understanding of Test Left approach to development Highly desired 2 YearsExperience with IBM SOA products like IIB/ACE, ODM, WAS, MQ, and ITX Highly desired 2 YearsExperience with Front End Development using Node.js and Angular Nice to have 1 Year",
        "source": "Email",
        "date_posted": "2024-10-18 08:25:01-05:00",
        "unique_id": "1929fee4b7a48fe3",
        "emp_type": [
            "contract",
            "third party"
        ],
        "tag": "Java developer"
    }
]