[
    {
        "company": "Vyzeinc",
        "job_title": "Technical Business Analyst",
        "location": "Tampa, FL, USA",
        "full_location": {
            "city": "Tampa",
            "state": "FL",
            "country": "USA"
        },
        "job_details": {
            "employment_type": [
                "contract",
                "third party"
            ],
            "job_code": "",
            "experience_required": "12 years",
            "degree_required": "Not specified",
            "visa_sponsorship": "Not specified",
            "notice_period": "Not specified",
            "duration": "12 + Months",
            "rate": "Not specified"
        },
        "skills": {
            "core": [
                "Technical Business Analyst",
                "Agile methodologies",
                "JIRA",
                "Confluence",
                "SWIFT",
                "ISO20022"
            ],
            "primary": [
                "payment software",
                "online banking",
                "banking services",
                "communication skills"
            ],
            "secondary": [],
            "all": [
                "Technical Business Analyst",
                "Agile methodologies",
                "JIRA",
                "Confluence",
                "SWIFT",
                "ISO20022",
                "payment software",
                "online banking",
                "banking services",
                "communication skills"
            ]
        },
        "job_type": [
            "hybrid"
        ],
        "contact_person": "sujata",
        "email": "sujata@vyzeinc.com",
        "jd": "From: sujata, Vyzeinc sujata@vyzeinc.com Reply to: sujata@vyzeinc.com Technical Business AnalystClient: Banking DomainDuration: 12 + MonthsLocation: Tampa, FL \u2013 hybrid Visa: GC/USCMOI: SkypeLinkedin is must: NEED FRONT & BACK COPY FOR VISA.MUST HAVE:Required Skillsets:Must have at least 12 years of professional experience using the below skills:At least 12 years of experience working as a Technical Business AnalystExcellent in Agile methodologies and practicesExcellent in JIRA/ConfluenceExperience with SWIFT or ISO20022 (at least 3 to 4 years)Strong Experience working with a payment/online banking related software project/applicationStrong experience working at the banking services companyGreat communication skills",
        "source": "Email",
        "date_posted": "2024-10-18 11:35:11-05:00",
        "unique_id": "192a09c21ab04b0e",
        "emp_type": [
            "contract",
            "third party"
        ],
        "tag": "Business Analyst"
    }
]