[
    {
        "company": "Tek Inspiration",
        "job_title": "Java programmer",
        "location": "Richmond, VA, USA",
        "full_location": {
            "city": "Richmond",
            "state": "VA",
            "country": "USA"
        },
        "job_details": {
            "employment_type": [
                "contract",
                "third party"
            ],
            "job_code": "",
            "experience_required": "Not specified",
            "degree_required": "Not specified",
            "visa_sponsorship": "Visa sponsorship available",
            "notice_period": "Not specified",
            "duration": "6 months",
            "rate": "Not specified"
        },
        "skills": {
            "core": [
                "Java",
                "Java EE",
                "OOP Design",
                "Multi-Threading",
                "Generics",
                "Exception Handling",
                "Collections",
                "Java Reflection",
                "Annotation",
                "Oracle"
            ],
            "primary": [
                "Git Workflows",
                "CI/CD pipelines",
                "Azure DevOps",
                "Selenium",
                "Cucumber",
                "Playwright",
                "JUnit",
                "Node.js",
                "Angular"
            ],
            "secondary": [
                "IBM SOA products",
                "IIB",
                "ACE",
                "ODM",
                "WAS",
                "MQ",
                "ITX"
            ],
            "all": [
                "Java",
                "Java EE",
                "OOP Design",
                "Multi-Threading",
                "Generics",
                "Exception Handling",
                "Collections",
                "Java Reflection",
                "Annotation",
                "Oracle",
                "Git Workflows",
                "CI/CD pipelines",
                "Azure DevOps",
                "Selenium",
                "Cucumber",
                "Playwright",
                "JUnit",
                "Node.js",
                "Angular",
                "IBM SOA products",
                "IIB",
                "ACE",
                "ODM",
                "WAS",
                "MQ",
                "ITX"
            ]
        },
        "job_type": [
            "hybrid"
        ],
        "contact_person": "Ambar Shukla",
        "email": "ambar.shukla@tekinspirations.com",
        "jd": "Job Description -Title:- Java programmerLocation:- Richmond, VA hybridDuration:- 6monthsVisa:- Only GC, , USC, GCEADMOI:- In personF2f interview Need DL and linkedin Responsibilities:This position will serve as a senior BACK-END application developer for the DMAS Information Management Division in the design, development, and maintenance of Java/ JEE based applications.Extensive practical experience in building enterprise applications using Java EE technologies.Expertise in Core Java concepts, such as OOP Design, Multi-Threading, Generics, Exception Handling, Collections, Java Reflection, Annotation.Understanding of relational database concepts with experience in Oracle.Experience developing with Git Workflows.Experience developing CI/CD pipelines and automation.Experience using Azure DevOps.Experience with Testing Frameworks such as Selenium, Cucumber, Playwright, JUnit and an understanding of Test Left approach to development.Experience with IBM SOA products like IIB/ACE, ODM, WAS, MQ, and ITX.Experience with Front End Development using Node.js and Angular.Requirements:Extensive practical experience in building enterprise applications using Java EE technologies.Expertise in Core Java concepts, such as OOP Design, Multi-Threading, Generics, Exception Handling, Collections, Java Reflection, Annotation.Understanding of relational database concepts with experience in Oracle.Experience developing with Git Workflows.Experience developing CI/CD pipelines and automation.",
        "source": "Email",
        "date_posted": "2024-10-18 12:29:22-05:00",
        "unique_id": "192a0cdb65aa5caa",
        "emp_type": [
            "contract",
            "third party"
        ],
        "tag": "Java developer"
    }
]