[
    {
        "company": "Tekgence Inc",
        "job_title": "Java FSD with AWS",
        "location": "New York, NY, USA",
        "full_location": {
            "city": "New York",
            "state": "NY",
            "country": "USA"
        },
        "job_details": {
            "employment_type": [
                "third party"
            ],
            "job_code": "",
            "experience_required": "10+ years",
            "degree_required": "Not specified",
            "visa_sponsorship": "Not specified",
            "notice_period": "Not specified",
            "duration": "Not specified",
            "rate": "Not specified"
        },
        "skills": {
            "core": [
                "Core Java",
                "J2EE",
                "Rest APIs",
                "Microservices",
                "Angular",
                "React"
            ],
            "primary": [
                "CI/CD",
                "Jenkins",
                "Junit",
                "Mockito",
                "SQL",
                "No-SQL",
                "Agile",
                "Jira",
                "Git",
                "Kafka",
                "Kubernetes",
                "Cloud AWS",
                "EKS",
                "Amazon Aurora PostgreSQL",
                "Dynamo DB",
                "S3",
                "IAM",
                "Route 53",
                "ELB",
                "SNS",
                "SQS",
                "Managed Streaming for Apache Kafka (MSK)",
                "Cloud Watch"
            ],
            "secondary": [],
            "all": [
                "Core Java",
                "J2EE",
                "Rest APIs",
                "Microservices",
                "Angular",
                "React",
                "CI/CD",
                "Jenkins",
                "Junit",
                "Mockito",
                "SQL",
                "No-SQL",
                "Agile",
                "Jira",
                "Git",
                "Kafka",
                "Kubernetes",
                "Cloud AWS",
                "EKS",
                "Amazon Aurora PostgreSQL",
                "Dynamo DB",
                "S3",
                "IAM",
                "Route 53",
                "ELB",
                "SNS",
                "SQS",
                "Managed Streaming for Apache Kafka (MSK)",
                "Cloud Watch"
            ]
        },
        "job_type": [],
        "contact_person": "Pranith",
        "email": "pranith.t@tekgence.com",
        "jd": "From: Pranith, Tekgence Inc pranith.t@tekgence.com Reply to: pranith.t@tekgence.com Role: Java FSD with AWSLocation: New YorkExp: 10+years Job Description:An FSD/FSPE has an \u201cend to end product\u201d mindset - design, implementation, testing and deployment, and adds an additional skill (s) on top of traditional front/back-end developer roleDesign and developer application using Core JavaDesign and developer application using J2EE. Experience in J2EE design patternsCreate/consume Rest APIs & MicroservicesExperience with Angular/ReactExperience with CI/CD, JenkinsExperience with Junit/MockitoExperience with database (SQL/No-SQL_)Experience with Agile, Jira, GitExperience with Kafka/KubernetesExperience with Cloud AWS \u2013 EKS, Amazon Aurora PostgreSQL, Dynamo DB, S3, IAM, Route 53, ELB, SNS, SQS, Managed Streaming for Apache Kafka (MSK), Cloud Watch",
        "source": "Email",
        "date_posted": "2024-10-18 10:44:37-05:00",
        "unique_id": "192a08907e5946a8",
        "emp_type": [
            "third party"
        ],
        "tag": "Java developer"
    }
]