[
    {
        "company": "KK Software LLC",
        "job_title": "Java Developer with AWS and Typescript",
        "location": "Atlanta, GA, USA",
        "full_location": {
            "city": "Atlanta",
            "state": "GA",
            "country": "USA"
        },
        "job_details": {
            "employment_type": [
                "full-time",
                "third party"
            ],
            "experience_required": "2+ years",
            "degree_required": "Bachelor's Degree in Computer Science, Information Systems, with 4+ years of relevant technical experience or Master\u2019s degree in Computer Science, Information Systems with 2+ years of technical experience.",
            "visa_sponsorship": "Not specified",
            "notice_period": "Not specified",
            "duration": "Not specified",
            "rate": "Not specified"
        },
        "skills": {
            "core": [
                "Java",
                "AWS",
                "Typescript"
            ],
            "primary": [
                "CI/CD",
                "Scripting",
                "GitHub",
                "GitLab",
                "SonarQube",
                "JUnit",
                "Spring Boot"
            ],
            "secondary": [
                "Python",
                "Wire Mock",
                "Mockito",
                "Postman",
                "REST Assured",
                "Cypress",
                "Ready API",
                "Jenkins",
                "Circle CI",
                "ECS",
                "EKS",
                "S3",
                "Lambda",
                "SQS/SNS",
                "PostgreSQL",
                "Dynamo",
                "Sagemaker",
                "Athena",
                "VersionOne",
                "Agility",
                "OpenShift",
                "MQ"
            ],
            "all": [
                "Java",
                "AWS",
                "Typescript",
                "CI/CD",
                "Scripting",
                "GitHub",
                "GitLab",
                "SonarQube",
                "JUnit",
                "Spring Boot",
                "Python",
                "Wire Mock",
                "Mockito",
                "Postman",
                "REST Assured",
                "Cypress",
                "Ready API",
                "Jenkins",
                "Circle CI",
                "ECS",
                "EKS",
                "S3",
                "Lambda",
                "SQS/SNS",
                "PostgreSQL",
                "Dynamo",
                "Sagemaker",
                "Athena",
                "VersionOne",
                "Agility",
                "OpenShift",
                "MQ"
            ]
        },
        "job_type": [
            "hybrid"
        ],
        "contact_person": "Sushant kumar",
        "email": "sushant.s@kksoftwareassociates.com",
        "jd": "From: Sushant kumar, KK Software LLC sushant.s@kksoftwareassociates.com Reply to: sushant.s@kksoftwareassociates.com Only Local with Highlighted skills passport mandatory Role : Java Developer with AWS Typescript ( CI/CD ) , CI/CD will do through Scripting via Typescript Location : Atlanta/GA - Day 1: Onsite - Hybrid ( 3/Days per week ) Required Resource : Immediate Key Skill : Java FS, AWS, Typescript \u2022 Java (Backend and Automation Testing), AWS, Scripting languages such as Python High School Diploma, GED, or High School Equivalency \u2022 2+ years\u2019 experience in Java, Full-stack development experience is required \u2022 Experience working with GitHub and/or GitLab, SonarQube, JUnit, Spring Boot \u2022 Skilled in writing, designing unit test cases using TDD and BDD methodologies \u2022 Hands on experience of virtualizing services for test automation using tools such as Wire Mock, Mockito etc. \u2022 Automation-minded: Hands on experience of designing and writing automated tests for backend applications and data flow, using tools such as Postman, REST Assured, Cypress, Ready API etc. \u2022 Hands on experience of working with continuous integration tools such Jenkins, Circle CI. \u2022 Broad hands on experience in AWS Cloud serverless components and ability to build and maintain cloud data processing systems (i.e. ECS, EKS, S3, Lambda, SQS/SNS, PostgreSQL, Dynamo, Sagemaker, Athena, etc.) \u2022 Experience using relational and object databases and web service development standards and practices, including RESTful APIs, micro-services, and services \u2022 Experience working in an agile development environment using workload management tools like VersionOne/Agility \u2022 Expert troubleshooting and deployment experience with strong understanding of transforming business and functional requirements into efficient technical solutions \u2022 Experience with system integrations, optimizing performance and data integrity \u2022 Strong technical and non-technical communication skills. Assures smooth flowing, timely transmission of critical information. \u2022 Excellent judgment and problem-solving skills; individual should be able to resolve urgent problems in a calm and quick manner and display a high degree of initiative and drive \u2022 Ability to be effective in a high stress environment \u2022 Be flexible and embrace challenges that are outside of your comfort zone (PREFERRED QUALIFICATIONS) \u2022 Bachelor's Degree in Computer Science, Information Systems, with 4+ years of relevant technical experience or Master\u2019s degree in Computer Science, Information Systems with 2+ years of technical experience. \u2022 Hands on experience of creating test reports from automation test run using tools such as cucumber report, Extent report etc.\u2022 Experience with OpenShift \u2022 Working knowledge of MQ",
        "source": "Email",
        "date_posted": "2024-10-18 16:32:44-05:00",
        "unique_id": "192a1ac854d93b6e",
        "emp_type": [
            "full-time",
            "third party"
        ],
        "tag": "Java developer"
    }
]