[
    {
        "company": "STM Consulting, Inc.",
        "job_title": ".Net Developer",
        "location": "Lakewood, CO, USA",
        "full_location": {
            "city": "Lakewood",
            "state": "CO",
            "country": "USA"
        },
        "job_details": {
            "employment_type": [
                "contract",
                "third party"
            ],
            "job_code": "",
            "experience_required": "Not specified",
            "degree_required": "Not specified",
            "visa_sponsorship": "No visa sponsorship",
            "notice_period": "Not specified",
            "duration": "12 Months - Contract to Hire",
            "rate": "Not specified"
        },
        "skills": {
            "core": [
                "C#",
                ".NET",
                "SQL Server",
                "VB.NET"
            ],
            "primary": [
                "Software Debugging",
                "Application Development",
                "Scripting",
                "Source Control",
                "Change Requests"
            ],
            "secondary": [
                "Public Safety Applications",
                "Law Enforcement",
                "Records"
            ],
            "all": [
                "C#",
                ".NET",
                "SQL Server",
                "VB.NET",
                "Software Debugging",
                "Application Development",
                "Scripting",
                "Source Control",
                "Change Requests",
                "Public Safety Applications",
                "Law Enforcement",
                "Records"
            ]
        },
        "job_type": [
            "hybrid"
        ],
        "contact_person": "Abhay Yadav",
        "email": "abhay.yadav@consultstm.com",
        "jd": "From: Abhay, STM Consulting, Inc. abhay.yadav@consultstm.com Reply to: abhay.yadav@consultstm.com Position: .Net DeveloperLocation: Lakewood, CO 80215 (Hybrid -Able to commute to the Denver Metro area)Duration: 12 Months - Contract to Hire. DUTIES AND RESPONSIBILITIES: Design, code, and test computer software in a .NET framework. Perform application development for software debugging, scripting, source control, and change requests. Utilize SQL server on a VB.NET platform. Support and maintain configurations to in-house applications.Additional appropriate experience will substitute for the required education on a year-for-year basis.Additional appropriate education will substitute for the required experience on a year-for-year basis.Training or certification related to the work assigned to the position will be considered as a substitution for the required experience and/or education.Preferred Qualifications:Experience supporting any of the following disciplinesPublic Safety ApplicationsLaw EnforcementRecords",
        "source": "Email",
        "date_posted": "2024-10-18 11:11:12-05:00",
        "unique_id": "192a08628a36b784",
        "emp_type": [
            "contract",
            "third party"
        ],
        "tag": ".net developer"
    }
]