[
    {
        "company": "GVR Info Tek",
        "job_title": "Senior Java Programmer ( Back End )",
        "location": "Richmond, VA, USA",
        "full_location": {
            "city": "Richmond",
            "state": "VA",
            "country": "USA"
        },
        "job_details": {
            "employment_type": [
                "contract",
                "third party"
            ],
            "job_code": "",
            "experience_required": "15+ years",
            "degree_required": "Not specified",
            "visa_sponsorship": "Not specified",
            "notice_period": "Not specified",
            "duration": "6 months (C2H)",
            "rate": "Not specified"
        },
        "skills": {
            "core": [
                "Java EE",
                "Core Java",
                "OOP Design",
                "Multi-Threading",
                "Generics",
                "Exception Handling",
                "Collections",
                "Java Reflection",
                "Annotation",
                "Oracle"
            ],
            "primary": [
                "Git Workflows",
                "CI/CD pipelines",
                "Azure DevOps",
                "Selenium",
                "Cucumber",
                "Playwright",
                "JUnit",
                "IBM SOA products",
                "Node.js",
                "Angular"
            ],
            "secondary": [
                "Test Left approach"
            ],
            "all": [
                "Java EE",
                "Core Java",
                "OOP Design",
                "Multi-Threading",
                "Generics",
                "Exception Handling",
                "Collections",
                "Java Reflection",
                "Annotation",
                "Oracle",
                "Git Workflows",
                "CI/CD pipelines",
                "Azure DevOps",
                "Selenium",
                "Cucumber",
                "Playwright",
                "JUnit",
                "IBM SOA products",
                "Node.js",
                "Angular",
                "Test Left approach"
            ]
        },
        "job_type": [
            "hybrid"
        ],
        "contact_person": "Tarun Kumar",
        "email": "tarun.kumar@gvrinfotek.com",
        "jd": "From: Tarun Kumar, GVR INFO TEK tarun.kumar@gvrinfotek.com Reply to: tarun.kumar@gvrinfotek.com Submit candidates with their DL, Visa Copy, LinkedIn. RTR in the favor of GVR Infotek Senior Java Programmer ( Back End ) - Hybrid Location: Richmond, VA \u2013 Hybrid Duration: 6 months (C2H ) Visa \u2013 USC , GC MOI: In Person Interview Candidate must also be able to work onsite 2-3 days/week. Need local to Virginia candidates with address proof Must Have - Senior candidates at least 15+ years of experience About The Role This position will serve as a senior BACK-END application developer for the Information Management Division in the design, development, and maintenance of Java/ JEE based applications. Extensive practical experience in building enterprise applications using Java EE technologies. Expertise in Core Java concepts, such as OOP Design, Multi-Threading, Generics, Exception Handling, Collections, Java Reflection, Annotation. Understanding of relational database concepts with experience in Oracle. Experience developing with Git Workflows. Experience developing CI/CD pipelines and automation. Experience using Azure DevOps. Experience with Testing Frameworks such as Selenium, Cucumber, Playwright, JUnit and an understanding of Test Left approach to development. Experience with IBM SOA products like IIB/ACE, ODM, WAS, MQ, and ITX Experience with Front End Development using Node.js and Angular Skill Required / Desired Amount of Experience Extensive practical experience in building enterprise applications using Java EE technologies Required 5 Years Expertise in Core Java concepts, such as OOP Design, Multi-Threading, Generics, Exception Handling, Collections, Java Reflection, Annotation, Required 5 Years Understanding of relational database concepts with experience in Oracle Required 5 Years Experience developing with Git Workflows Required 5 Years Experience developing CI/CD pipelines and automation Required 3 Years Experience using Azure DevOps Highly desired 2 Years Experience with Testing Frameworks such as Selenium, Cucumber, Playwright, JUnit, and an understanding of Test Left approach to development Highly desired 2 Years Experience with IBM SOA products like IIB/ACE, ODM, WAS, MQ, and ITX Highly desired 2 Years Experience with Front End Development using Node.js and Angular Nice to have 1 Years Regards, Tarun Kumar IT Recruiter GVR Info Tek: 13573 Tabasco Cat Trail, Frisco, TX 75035 Email: tarun.kumar@gvrinfotek.com",
        "source": "Email",
        "date_posted": "2024-10-18 10:32:59-05:00",
        "unique_id": "192a095241f90d11",
        "emp_type": [
            "contract",
            "third party"
        ],
        "tag": "Java developer"
    }
]