[
    {
        "company": "Northern Trust",
        "job_title": "Program Manager - Operational Risk",
        "location": "Chicago, IL, USA",
        "full_location": {
            "city": "Chicago",
            "state": "IL",
            "country": "USA"
        },
        "job_details": {
            "employment_type": [
                "third party"
            ],
            "job_code": "",
            "experience_required": "5 years",
            "degree_required": "A College or University degree",
            "visa_sponsorship": "No visa sponsorship",
            "notice_period": "Not specified",
            "duration": "Not specified",
            "rate": "Not specified"
        },
        "skills": {
            "core": [
                "project management",
                "portfolio management",
                "change management",
                "financial risk",
                "non-financial risk"
            ],
            "primary": [
                "Microsoft Office 365",
                "advanced Excel",
                "communication skills",
                "analytical skills",
                "problem-solving skills"
            ],
            "secondary": [
                "team building",
                "coaching",
                "conflict resolution",
                "self-motivated",
                "flexibility"
            ],
            "all": [
                "project management",
                "portfolio management",
                "change management",
                "financial risk",
                "non-financial risk",
                "Microsoft Office 365",
                "advanced Excel",
                "communication skills",
                "analytical skills",
                "problem-solving skills",
                "team building",
                "coaching",
                "conflict resolution",
                "self-motivated",
                "flexibility"
            ]
        },
        "job_type": [
            "hybrid"
        ],
        "contact_person": "Princy Jain",
        "email": "princy@maintec.com",
        "jd": "From: Princy Jain, Maintec princy@maintec.com Reply to: princy@maintec.com Notes: This role is similar to the prior role\u2014just more senior Internal Position Notes:CONVERSION SALARY should not exceed $190,000 per year. Client: Northern TrustJob Title: Program Manager - Operational RiskWork Location: 333 S Wabash Chicago, ILWork Model: HybridAnchor Days: Tuesday - Thursday [flex]Hours: 8:30am \u2013 5pm CSTInterview Process: 2 Rounds [1st screening, 2nd technical] 30 minutes eachAdditionally, this is not an IT role Key Roles and Responsibilities:\u00b7 Ability to manage delivery through effective delegation, oversight and stakeholder engagement across a portfolio of programs\u00b7 Ability to provide high-level assessments of program progress, risks, issues and to facilitate rapid resolution with senior-level stakeholders\u00b7 Ability to communicate effectively to ensure a clear and concise understanding of expectations.\u00b7 Ability to manage and maintain progress across a portfolio of work, and to continuously manage program risks, issues and escalations as needed.\u00b7 Effectively liaise between cross-functional stakeholders to align around common objectives.\u00b7 Continuously improve and optimize projects towards efficiency, productivity and quality standards.\u00b7 Review and maintain program objectives; risks; issues and overall status within approved program structure/technologies\u00b7 Manage the portfolio with a forward-looking mindset, i.e., proactively anticipate any potential issues, prevent them and/or define pragmatic contingency plans.\u00b7 Develop and hold accountable a team of program managers to proactively manage dependencies, \u2018reusable assets\u2019 (components of the solution that have been already built elsewhere), roadblocks and learning points (i.e., milestones defined to resolve any uncertainty that the team might be dealing with).\u00b7 Timely escalate and relentlessly pursue resolution of any roadblocks with a clear, end-to-end ownership mindset.\u00b7 Develop and control deadlines, budgets and activities pertaining to the supported projects.\u00b7 Engage, supervise and coordinate third party support, including oversight of forecast and budget variance\u00b7 Demonstrates flexibility and agility to pivot to new and/or changing program priorities\u00b7 Maintains confidentiality of correspondence records, presentations and reports in a central repository system\u00b7 Prioritizes and handles multiple projects with accuracy\u00b7 Lead and motivate team members, providing development opportunities, feedback and supervision appropriate to professional expertise The ideal candidate should have a fair amount of the following:\u00b7 A College or University degree and deep understanding of project management and portfolio management tools, techniques and methods (i.e., what good looks like), change management principles and how to build high-performing teams\u00b7 Relevant industry knowledge is required (financial risk, non-financial risk, regulatory and/or compliance)\u00b7 Technical skills: Outlook, Teams, Microsoft Office 365 suite required (advanced with Excel, Word, SharePoint, PowerPoint, MS Project).\u00b7 Excellent oral and written communication skills are required\u00b7 Self-motivated, highly flexible and adaptable to change\u00b7 Analytical and problem-solving skills are required\u00b7 Results oriented\u00b7 Knowledge of and experience supporting programs with enterprise risk management, financial or non-financial risk\u00b7 Great skills across communication, facilitation, interpersonal, conflict resolution, team building, coaching members on practices, framework, ability to teach/train etc.\u00b7 Ability to establish trust-based relationships with stakeholders across enterprise, lead them towards common objectives and managing upwards and downwards (e.g., experience with acting as a constructive conduit between business and non-business teams)\u00b7 Strong problem-solving skills, organizational skills and time management skills.\u00b7 Openness to self-learning, improvement and experimentation\u00b7 A minimum of 5 years serving as a Portfolio or Program Manager or a relevant role Summary:\u00b7 The Global Regulatory Affairs Office (GRAO) is responsible for overseeing the enhancement of our risk management and controls, remediation of regulatory and audit findings and the administration of regulatory affairs, including establishing a centralized and sustainable connection point for global regulatory communications, ensuring preparedness for examinations.\u00b7 This Operational Risk and Resiliency Portfolio Manager role reports to the Head of Global Regulatory Program Management and is responsible for management of a team of program and project managers in support of large scale, enterprise-wide Programs with multiple projects and work streams.\u00b7 These projects involve delivery of critical strategic enterprise capabilities or regulatory changes that impact multiple business units or disciplines that execute the GRAO strategy. Responsibilities:\u00b7 The role holder will need the ability to manage multiple priorities in a fast-paced environment and exercise good judgment in a variety of situations.\u00b7 The Portfolio Manager will ensure a coordinated response across Operational Risk and Resilience and must be able to work under pressure at times to handle a wide variety of activities and confidential matters with discretion and attention to detail.\u00b7 The ideal candidate will have a track record of supporting complex change programs, working with diverse, cross-functional teams and facilitating needs from stakeholders across the organization.",
        "source": "Email",
        "date_posted": "2024-10-18 11:39:42-05:00",
        "unique_id": "192a0a0415040740",
        "emp_type": [
            "third party"
        ],
        "tag": "Project Manager"
    }
]