[
    {
        "company": "Source Infotech Inc",
        "job_title": "SDET",
        "location": "USA",
        "full_location": {
            "city": "",
            "state": "",
            "country": "USA"
        },
        "job_details": {
            "employment_type": [
                "third party"
            ],
            "job_code": "",
            "experience_required": "10+ years",
            "degree_required": "Not specified",
            "visa_sponsorship": "No visa sponsorship",
            "notice_period": "Not specified",
            "duration": "6+ months",
            "rate": "Not specified"
        },
        "skills": {
            "core": [
                "CORE JAVA",
                "SELENIUM",
                "API Testing",
                "REST ASSURED",
                "SQL"
            ],
            "primary": [
                "Cucumber",
                "JSON validation",
                "CockroachDB",
                "MongoDB",
                "Jenkins",
                "DevOps"
            ],
            "secondary": [
                "Brokerage Domain experience",
                "Trading securities experience"
            ],
            "all": [
                "CORE JAVA",
                "SELENIUM",
                "API Testing",
                "REST ASSURED",
                "SQL",
                "Cucumber",
                "JSON validation",
                "CockroachDB",
                "MongoDB",
                "Jenkins",
                "DevOps",
                "Brokerage Domain experience",
                "Trading securities experience"
            ]
        },
        "job_type": [
            "onsite"
        ],
        "contact_person": "Abhisek Kumar",
        "email": "abhisek.k@sourceinfotech.com",
        "jd": "From: abhisek, source infotech inc abhisek.k@sourceinfotech.com Reply to: abhisek.k@sourceinfotech.com Position: SDET LOCATION: TX, MA, RI, UT, or NH, with the ability to work onsite two weeks per monthDURATION-6+Visa: No OPT/CPT/H1BEXP- 10+SDET with a strong background in CORE JAVA development, SELENIUM, and API testing using POSTMAN and REST ASSURED.Applicants must have a LinkedIn profile and provide manager references with LinkedIn profiles prior to client submission. Proof of visa status is requiredRequirements:Very good experience in core Java SDET development - MUSTAPI Testing with RESTASSURED & Cucumber experience \u2013 MUSTExperience in handling validations on JSON data type using Java \u2013 MUSTExperience in writing SQL queries using any DB\u2019s - MUST Using CockroachDB and MongoDB - OptionalJava Selenium - OptionalBuilding Pipeline using Jenkins/ Devops experience \u2013 optionalBrokerage Domain experience/experience in trading securities \u2013 Optional\u00b7 MUST PROVIDE MANAGER REFERENCES WITH MANAGER LINKED IN PROFILES BEFORE SUBMISSION Thanks & RegardsAbhisek kumarSource Infotech IncP.O Box 577, EDISON, NJ 08818-0577Email: abhisek.k@sourceinfotech.comPhone: 609-934-3412 | | Hangout: abhishekchoudhary0948",
        "source": "Email",
        "date_posted": "2024-10-18 14:42:10-05:00",
        "unique_id": "192a1474b9c8a1c4",
        "emp_type": [
            "third party"
        ],
        "tag": "Java developer"
    }
]