[
    {
        "company": "Sibitalent",
        "job_title": "Business Systems Analyst(ServiceNow & Asset Management)",
        "location": "Oakland, CA, USA",
        "full_location": {
            "city": "Oakland",
            "state": "CA",
            "country": "USA"
        },
        "job_details": {
            "employment_type": [
                "contract",
                "third party"
            ],
            "job_code": "",
            "experience_required": "8+ years",
            "degree_required": "Not specified",
            "visa_sponsorship": "No visa sponsorship",
            "notice_period": "Not specified",
            "duration": "Long Term Contract",
            "rate": "Not specified"
        },
        "skills": {
            "core": [
                "business analysis",
                "process analysis",
                "systems analysis",
                "documentation",
                "data cleanup"
            ],
            "primary": [
                "ServiceNow",
                "Asset Management",
                "AWS tags",
                "communication skills",
                "Agile",
                "Waterfall"
            ],
            "secondary": [
                "interpersonal skills",
                "problem solving",
                "Use Case modeling",
                "User Story creation",
                "Higher Education sector experience"
            ],
            "all": [
                "business analysis",
                "process analysis",
                "systems analysis",
                "documentation",
                "data cleanup",
                "ServiceNow",
                "Asset Management",
                "AWS tags",
                "communication skills",
                "Agile",
                "Waterfall",
                "interpersonal skills",
                "problem solving",
                "Use Case modeling",
                "User Story creation",
                "Higher Education sector experience"
            ]
        },
        "job_type": [
            "remote"
        ],
        "contact_person": "Harshit Gupta",
        "email": "hgupta@sibitalent.com",
        "jd": "From: harshit gupta, Sibitalent hgupta@sibitalent.com Reply to: hgupta@sibitalent.com Job Title: Business Systems Analyst(ServiceNow & Asset Management)Duration: Long Term ContractVisa: No H1B/OPT/EADLocation: Oakland, CA(Remote)-Must be local Manager prefers 1-2 hours from the Bay Job & DescriptionResponsibilitiesPerforms complex analysis of business and user needs - Evaluate business and user needs to translate into system and process requirements - Considers implications of applying technology and process changes - Investigate system and process defects to understand root causeLead cross-functional teams to analyze issues or evaluate changes - Complete risk analysis for requested system and process changes and enhancements - Facilitate mitigation of risks and remediationDocumentation: - Document business and user requirements - Create technical system and process specifications - Generate process flow diagrams of system and business processes - Document defects, issues, and risks for systems and processes - Complete necessary documentation for change management processDesign and Change: - Develop process changes to meet business and user requirements - Create integration plans for changes and enhancements - Generate acceptance testing plans and scenariosCreate or modify procedures to support business and system processes - Implement system changes to applications and processes - Adhere to change management proceduresSoliciting Information and Communication: - Interview business partners for requirements, challenges, and requests - Interact with vendors to manage integrations, changes, and issues - Facilitate meetings with other UCOP departments to gather requirements, troubleshoot issues, and implement changes - Participate in strategy sessions to alter or create policies, processes, and procedures Required Qualifications8+ years of advanced knowledge/experience of business and process analysis functions.Experience and skills managing data cleanups, tagging (AWS tags, potentially in ServiceNow) and begin mapping servers to applications.Experience defining the data cleanup process, etc.While we use/prefer SNOW, the process can be tool agnostic. This contactor should have familiarity with Inventory/Asset Management, preferably in SN.Demonstrated effective communication and interpersonal skills.Demonstrated ability to communicate technical information to technical and non-technical personnel at various levels in the organization.Interpersonal and communications skills to work with both technical and non-technical personnel at various levels in the organization.Self-motivated and works independently and as part of a team. Able to learn effectively and meet deadlines. Demonstrates problem solving skills.Demonstrated experience with process analysis, systems analysis, process architectures and systems analysis methodologies.Understanding and skill in complex process and systems requirement documentation standards, such as Use Case modeling, User Story creations, and narrative description.Experience interviewing people to gain information for systems and processes. Demonstrated ability to work with others from diverse backgroundsAdvanced skills and methodologies associated with process and software design, modification, and implementation.Experience in the Higher Education sector is preferred.Experience working in Agile, Agile SCRUM, and traditional Waterfall environments.",
        "source": "Email",
        "date_posted": "2024-10-18 09:43:07-05:00",
        "unique_id": "192a0376d1f5b446",
        "emp_type": [
            "contract",
            "third party"
        ],
        "tag": "Business Analyst"
    }
]