[
    {
        "company": "Vyze",
        "job_title": "Lead Terraform -GCP",
        "location": "Dallas, TX, USA",
        "full_location": {
            "city": "Dallas",
            "state": "TX",
            "country": "USA"
        },
        "job_details": {
            "employment_type": [
                "contract",
                "third party"
            ],
            "job_code": "",
            "experience_required": "5+ years",
            "degree_required": "Not specified",
            "visa_sponsorship": "Not specified",
            "notice_period": "Not specified",
            "duration": "Contract",
            "rate": "Not specified"
        },
        "skills": {
            "core": [
                "Google Cloud Platform (GCP)",
                "Terraform",
                "Infrastructure as Code (IaC)",
                "Software Engineering",
                "Networking services"
            ],
            "primary": [
                "GitHub",
                "Cloud service offerings",
                "Big Query",
                "Composer",
                "Vertex AI",
                "Document AI",
                "Agent Builder",
                "DataProc",
                "Data Catalog",
                "Notebook"
            ],
            "secondary": [
                "Cloud certification on GCP",
                "Agile",
                "CI/CD",
                "DevOps",
                "Site Reliability Engineer (SRE)",
                "Scripting (Shell, Python)",
                "Networking concepts",
                "Database exposure",
                "Cloud security",
                "Authentication methods",
                "RBAC"
            ],
            "all": [
                "Google Cloud Platform (GCP)",
                "Terraform",
                "Infrastructure as Code (IaC)",
                "Software Engineering",
                "Networking services",
                "GitHub",
                "Cloud service offerings",
                "Big Query",
                "Composer",
                "Vertex AI",
                "Document AI",
                "Agent Builder",
                "DataProc",
                "Data Catalog",
                "Notebook",
                "Cloud certification on GCP",
                "Agile",
                "CI/CD",
                "DevOps",
                "Site Reliability Engineer (SRE)",
                "Scripting (Shell, Python)",
                "Networking concepts",
                "Database exposure",
                "Cloud security",
                "Authentication methods",
                "RBAC"
            ]
        },
        "job_type": [
            "onsite"
        ],
        "contact_person": "hanshika",
        "email": "hanshika@vyzeinc.com",
        "jd": "From: hanshika, vyze hanshika@vyzeinc.com Reply to: hanshika@vyzeinc.com Job Description -Role: Lead Terraform -GCPLocation: Dallas, TX (Need Local Candidate with LinkedIn)Duration: ContractNeed Guanine candidate. Job Description: Lead complex technology Cloud initiatives, including those that are companywide, with broad impact\u00b7 Act as a key contributor in automating the provisioning of Cloud Infrastructure using Infrastructure as Code (IaC)\u00b7 Make decisions in developing standards and best practices for engineering and large-scale technology solutions\u00b7 Design, optimize, and document the engineering aspects of the Cloud platform\u00b7 Lead and share understanding of industry best practices and how new technologies influence the Cloud technology team to meet deliverables and drive new initiatives\u00b7 Review and analyze complex, large-scale technology solutions in Cloud for strategic business objectives and solving technical challenges that require in-depth evaluation of multiple parameters, including intangibles or unprecedented technical factors\u00b7 Collaborate and consult with key technical experts, senior technology team, and external industry groups to resolve complex technical issues and achieve goals\u00b7 Build and enable Cloud infrastructure, automate the orchestration for GCP for Wells Fargo Enterprise\u00b7 Work in a globally distributed team and provide innovative and robust Cloud centric solutions\u00b7 Closely work with Product Team and vendors to develop and deploy Cloud services to meet customer expectations\u00b7 Collaborate with architects, developers, and operations teams to ensure seamless integration and delivery of cloud-based systems\u00b7 Gather and analyze data to diagnose the root cause of Cloud issues, recommend and implement solutions to resolve issues in timely manner Required Qualifications:\u00b7 5+ years of Software Engineering experience, or equivalent demonstrated through one or a combination of the following: work experience, training, military experience, education\u00b7 3+ years working with Google Cloud Platform (GCP) and a proven track record of building complex infrastructure programmatically with Infrastructure as Code (IaC) tools\u00b7 2+ years of hands-on experience with IaC tools Terraform and GitHub\u00b7 Strong understanding of GCP networking services, such as Virtual Private Cloud (VPC), Cloud Virtual Private Network (VPN), Cloud Interconnect, Virtual Network (Vnet) and Cloud Load Balancing\u00b7 Knowledge and understanding of Cloud service offerings such as Data, Analytics, AI/ML on GCP\u00b7 Demonstrated experience on at least three of the following key services: Big Query, Composer, Vertex AI, Document AI, Agent Builder, DataProc, Data Catalog, Notebook\u00b7 In-depth knowledge of network protocols, security, and compliance standards\u00b7 Experience with scripting and automation tools for network provisioning and configuration\u00b7 Knowledge and understanding of Cloud service offerings on Security, Data Protection and Security policy implementations\u00b7 Basic understanding of Cloud computing concepts like landing zone and Blueprints Desired Qualifications:\u00b7 Cloud certification on GCP\u00b7 Exposure to Cloud governance and logging/monitoring tools\u00b7 Experience with Agile, CI/CD, DevOps concepts and Site Reliability Engineer (SRE) principles\u00b7 Proficient on container-based solution services, have handled 2-3 large scale Kubernetes based infrastructure build out, provisioning of services in Azure or GCP\u00b7 Experience in scripting (Shell, Python)\u00b7 Good understanding of networking, firewalls, load balancing concepts (IP, DNS, Guardrails, Vnets) and exposure to database, cloud security, AD, authentication methods, RBAC\u00b7 Excellent verbal, written, and interpersonal communication skills\u00b7 Ability to articulate technical solutions to both technical and business audiences\u00b7 Ability to deliver & engage with partners effectively in a multi-cultural environment by demonstrating co-ownership & accountability in a m",
        "source": "Email",
        "date_posted": "2024-10-18 11:01:37-05:00",
        "unique_id": "192a07d60efaeb6d",
        "emp_type": [
            "contract",
            "third party"
        ],
        "tag": "GCP Data Engineer"
    }
]