[
    {
        "company": "Tanisha Systems Inc",
        "job_title": "Pega Developer",
        "location": "Tampa, FL, USA",
        "full_location": {
            "city": "Tampa",
            "state": "FL",
            "country": "USA"
        },
        "job_details": {
            "employment_type": [
                "contract",
                "third party"
            ],
            "experience_required": "9+ years",
            "degree_required": "Not specified",
            "visa_sponsorship": "Not specified",
            "notice_period": "Not specified",
            "duration": "Not specified",
            "rate": "Not specified"
        },
        "skills": {
            "core": [
                "Pega 8.x design",
                "development",
                "integration",
                "Dev Studio",
                "Smart Investigate framework"
            ],
            "primary": [
                "UI",
                "Business Rules",
                "Routing",
                "Security",
                "Integrations",
                "Pega AI/ML",
                "GenAI",
                "NLP capabilities",
                "Pega application deployment options",
                "dev-ops",
                "Message Queues",
                "REST/SOAP calls",
                "Payments",
                "Payment investigations"
            ],
            "secondary": [
                "cloud",
                "performance troubleshooting",
                "deployment architecture",
                "process improvement",
                "process optimization",
                "ISO 20022 MX",
                "MT messages"
            ],
            "all": [
                "Pega 8.x design",
                "development",
                "integration",
                "Dev Studio",
                "Smart Investigate framework",
                "UI",
                "Business Rules",
                "Routing",
                "Security",
                "Integrations",
                "Pega AI/ML",
                "GenAI",
                "NLP capabilities",
                "Pega application deployment options",
                "dev-ops",
                "Message Queues",
                "REST/SOAP calls",
                "Payments",
                "Payment investigations",
                "cloud",
                "performance troubleshooting",
                "deployment architecture",
                "process improvement",
                "process optimization",
                "ISO 20022 MX",
                "MT messages"
            ]
        },
        "job_type": [
            "onsite"
        ],
        "contact_person": "Akshat Kumar",
        "email": "akshat@tanishasystems.com",
        "jd": "Greetings..!! My name is Akshat, and I am a Technical Recruiter at Tanisha Systems Inc. Tanisha Systems Inc is a global contingency staffing firm servicing. We have an excellent job opportunity with one of our clients. Role: Pega DeveloperLocation: Tampa, FL \u2013 Only Local \u20133 Day onsite per weekExperience: 9+YearsType: ContractJob Description:Must Have:Pega 8.x design, development and integration experienceHands on experience with Dev Studio for Workflows, UI , Business Rules, Routing, Security and IntegrationsSmart Investigate framework experience or financial services framework experienceGood understanding of Pega AI/ML , GenAI , NLP capabilities for automation and straight through processing implementationsAbility to create multiple design options with pros and cons for implementation roadmapUnderstanding of Pega application deployment options, dev-ops, ecosystem integration with Message Queues and REST/SOAP callsDomain understanding on Payments, Payment investigations, financial servicesAbility to lead team, review code and design with good grip on project timelines and estimates to support PM / Scrum mastersTeam player with good client facing skills Good To Have:Good understanding of cloud, performance troubleshooting , deployment architectureProcess improvement and process optimization experienceFunctional depth in ISO 20022 MX and MT messages",
        "source": "Email",
        "date_posted": "2024-10-18 14:33:33-05:00",
        "unique_id": "192a13f69807aec5",
        "emp_type": [
            "contract",
            "third party"
        ],
        "tag": "PEGA Developer"
    }
]