[
    {
        "company": "INNOZA TECH LLC",
        "job_title": "Senior Business Analyst (748998)",
        "location": "Raleigh, NC, USA",
        "full_location": {
            "city": "Raleigh",
            "state": "NC",
            "country": "USA"
        },
        "job_details": {
            "employment_type": [
                "full-time",
                "third party"
            ],
            "job_code": "748998",
            "experience_required": "Not specified",
            "degree_required": "Not specified",
            "visa_sponsorship": "Not specified",
            "notice_period": "Not specified",
            "duration": "12 Months",
            "rate": "Not specified"
        },
        "skills": {
            "core": [
                "Business Analysis",
                "Requirements Gathering",
                "Documentation",
                "Agile Methodology",
                "LIMS"
            ],
            "primary": [
                "Communication Skills",
                "Collaboration",
                "Problem Solving",
                "SDLC",
                "IT Service Management",
                "Microsoft Office Suite",
                "SharePoint"
            ],
            "secondary": [
                "Negotiation Skills",
                "Analytical Skills",
                "Creative Thinking",
                "Leadership",
                "Team Building",
                "Healthcare Experience"
            ],
            "all": [
                "Business Analysis",
                "Requirements Gathering",
                "Documentation",
                "Agile Methodology",
                "LIMS",
                "Communication Skills",
                "Collaboration",
                "Problem Solving",
                "SDLC",
                "IT Service Management",
                "Microsoft Office Suite",
                "SharePoint",
                "Negotiation Skills",
                "Analytical Skills",
                "Creative Thinking",
                "Leadership",
                "Team Building",
                "Healthcare Experience"
            ]
        },
        "job_type": [
            "onsite"
        ],
        "contact_person": "Nagajyoti",
        "email": "njyoti@innozatech.com",
        "jd": "From: Nagajyoti, INNOZA TECH LLC. njyoti@innozatech.com Reply to: njyoti@innozatech.com Position: Senior Business Analyst (748998)Location: Raleigh NC 27609Duration: 12 MonthsClient: NC-DHHSONLY LOCAL CANDIDATESThe NC Department of Health and Human Services (DHHS) is seeking a senior Business Analyst to support the business process and requirements analysis and implementation of a statewide IT project for North Carolina State Laboratory of Public Health (NC SLPH).DESCRIPTION OF WORK:The NC SLPH is seeking to procure, validate, and implement an upgraded version of the existing Laboratory Information Management System (LIMS) that provides reliable, accurate, and timely reporting of data generated and stored (consistent with retention policies) in the NCSLPH Clinical and Environmental Programs and requires the services of a senior Business Analyst role to work with the business and other stakeholders to support the business process analysis.This senior Business Analyst role will work with multiple internal and external stakeholders to capture requirements, business process workflows and develop other BA artifacts using North Carolina Department of Information Technology Business Analysis Team tools and templates. The DHHS\u2019 preference is to use the agile methodology for the project.RESPONSIBILITIES\u2022 Develop a strong understanding of the functions, uses and requirements for the Lab Information Management System (LIMS)\u2022 Identifying and documenting current and future state process workflows\u2022 Developing documents such as: Business objects inventory list Reports, email notifications and Forms List, Email Notifications/Letters Inventory List, User Stories, Permission Matrix, Wireframes\u2022 Additional development of documents may include but is not limited to entity relationship diagrams, data dictionaries, system context diagrams\u2022 Assisting in performing functional and integrated testing\u2022 Preparing and maintaining project documentation and artifacts including analysis, reports and user documentation\u2022 Working with project manager, developers, and end-users to ensure LIMS designs meet business requirements\u2022 Providing UAT support, including developing test scenarios and cases using DHHS methodology\u2022 Supporting required system go-live activities\u2022 Documenting gap analysis\u2022 Track delivery and review/approval progress of each deliverable in accordance with approved Project Work Plan and RACI\u2022 Attending PMO meetingsEmployee will perform other related work as requiredMay require traveling in the local Raleigh area to attend meetings KNOWLEDGE, SKILLS AND ABILITIES / COMPETENCIES:\u2022 Demonstrated experience participating in the documentation of functional requirements and technical specifications for existing and new applications\u2022 Strong writing and communication skills\u2022 Collaboration and relationship-building with their team members and clients\u2022 Results-oriented individual with a very strong work ethic and must be able to demonstrate excellent negotiation, communication and problem-solving skills\u2022 Ability to work with customers as a member of cross-divisional work groups and maintain positive and productive relationships with customers, peers, and superiors\u2022 Ability to act independently with sound business judgment and thrive in environment with diverse communication styles\u2022 Ability to prepare and present oral and written documents clearly and concisely\u2022 Ability to manage complex assignments with multiple work streams and aggressive (and sometimes competing) timelines\u2022 Understanding of Software Development Lifecycle (SDLC) concepts and process\u2022 Knowledge of and experience with IT Service Management best practices and principles\u2022 Experience with Microsoft Office Suite (MS Word, EXCEL, PowerPoint, Visio) and Microsoft Project\u2022 Extensive understanding of SharePoint end user experience, sites, libraries, lists and groups\u2022 Lab Information Management System (LIMS) or other health systems experience is desired\u2022 Must have familiarity with agile methodology, tools and frameworks, i.e. scrum, kanbanSkillExtensive knowledge of business system analysis techniques and testing methodologiesDemonstrated experience in gathering business requirements and development of business rules and process flow.Proven experience with business process design, definition and/or re-design.Experience with Business Analysis methodologies and problem solvingAbility to utilize Microsoft Office Suite (MS Word, EXCEL, PowerPoint, Visio) Microsoft ProjectExcellent communication skills (both verbal and written)Experience in development of procurement related documents including RFP and evaluation criteria.Demonstrable analytical skills and an attention to detail.Excellent creative thinking and problem solving skills Proactive, quality oriented, with demonstrated leadership and team building skills.Experience working for State governmentHealthcare related experienceKnowledge Creating Context Diagram and Functional decompositionExperience with DPH public health lab system and programs",
        "source": "Email",
        "date_posted": "2024-10-18 16:17:47-05:00",
        "unique_id": "192a22c66b704a00",
        "emp_type": [
            "full-time",
            "third party"
        ],
        "tag": "Business Analyst"
    }
]