[
    {
        "company": "North Carolina Department of Health and Human Services",
        "job_title": "Senior Project Manager",
        "location": "Raleigh, NC, USA",
        "full_location": {
            "city": "Raleigh",
            "state": "NC",
            "country": "USA"
        },
        "job_details": {
            "employment_type": [
                "full-time",
                "third party"
            ],
            "experience_required": "8 years",
            "degree_required": "Not specified",
            "visa_sponsorship": "No visa sponsorship",
            "notice_period": "Not specified",
            "duration": "6+ Months",
            "rate": "Not specified"
        },
        "skills": {
            "core": [
                "Project Management",
                "Agile",
                "Scrum",
                "RFP/RFQ",
                "Cloud-based implementation"
            ],
            "primary": [
                "PMP Certification",
                "Negotiation",
                "Communication",
                "Problem-solving",
                "Strategic Planning"
            ],
            "secondary": [
                "Flexibility",
                "Adaptability",
                "Analytical skills",
                "Written communication",
                "Oral communication"
            ],
            "all": [
                "Project Management",
                "Agile",
                "Scrum",
                "RFP/RFQ",
                "Cloud-based implementation",
                "PMP Certification",
                "Negotiation",
                "Communication",
                "Problem-solving",
                "Strategic Planning",
                "Flexibility",
                "Adaptability",
                "Analytical skills",
                "Written communication",
                "Oral communication"
            ]
        },
        "job_type": [
            "hybrid"
        ],
        "contact_person": "Sangya Kumari Nahak",
        "email": "sangya@adventatech.com",
        "jd": "From: sangya kumari nahak, adventa sangya@adventatech.com Reply to: sangya@adventatech.com Position: Senior Project ManagerLocation: Raleigh, NC (Hybrid) (Local required)Duration: 6+ MonthsVisa: No H1BMOI: VIdeo State of North Carolina in need of a Senior Project Manager with a minimum of 8 years PM experience for a HYBRID role in Raleigh, NC. CCandidates will need experience with RFP/RFQs and system implementations . The NC Department of Health and Human Services (DHHS) is seeking a senior project manager to manage the planning and implementation of a statewide IT project for North Carolina State Laboratory of Public Health (NC SLPH). Management prefers applicants with the following: \u2022 Candidate with PMP Certification. Agile/Scrum Master certification is a plus\u2022 Experience managing or supervising legacy system upgrade and/or replacement projects\u2022 Experience collaborating with State and Local Government\u2022 Experience with public health lab system and programs\u2022 Experience planning and managing data conversion activities\u2022 Experience building rollout plans The NC SLPH is seeking to procure, validate, and implement an upgraded version of the existing Laboratory Information Management System (LIMS) that provides reliable, accurate, and timely reporting of data generated and stored (consistent with retention policies) in the NCSLPH Clinical and Environmental Programs. This lead project management role will work with multiple internal and external stakeholders and selected vendor(s) to analyze, plan, and implement the new version of the LIMS. This position will be responsible for working with senior-level business executives, IT personnel, business program resources and Vendor staff to execute project requirements and manage stakeholder expectations. This position will manage the day-to-day activities for the project and complete all input to the State Project Management (Touchdown) system as needed.Responsibilities include but are not limited to:\u2022 Working with the NC SLPH to obtain a thorough knowledge of the needs of a lab information management system\u2022 Working with personnel within the State Lab teams and the Information Technology team that are responsible for the LIMS to develop necessary project management, change management, risk management, rollout, and training plans. To the extent possible, integrate this project into the existing governance processes for the LIMS to ensure alignment of priorities and minimal disruption to ongoing operations and other required deliverables\u2022 Developing and maintaining detailed project schedule, budget and monitoring expenditures\u2022 Developing and maintaining all required project management artifacts following State, DHHS and PMBOK guidelines\u2022 Managing scope, resources, timelines, costs/budget, quality, communication, and procurements to meet the goals of the State\u2022 Leading and performing hands-on analysis of the business and technical environments, and writing procurement documents\u2022 Working with vendors to manage contract deliverables, oversee all vendor activities to ensure that all the milestones are met\u2022 Ensuring that project plans and schedules are established and maintained, ensuring that deliverables are completed timely and accurately\u2022 Establishing project governance, conducting formal presentations, coordinating with all project stakeholders and ensure that appropriate project controls are instituted\u2022 Serving as an IT project liaison to the business client\u2022 Working with business stakeholders to develop necessary project management, change management, risk management, rollout, and training plans\u2022 Working with the technical team to ensure technical readiness during implementation and supervising implementation activities\u2022 Developing and maintaining all required State CIO project documentation Required skills include: The selected candidate must be a results-oriented individual with a very strong work ethic and must be able to demonstrate excellent IT Project Management, negotiation, communication and problem-solving skills. \u2022 Capable of leading effective project meetings that are tailored to the audience\u2022 Ability to create simple to complex project plans, timelines and work breakdown structures using project management tools\u2022 Must have proficiency in project management, agile, scrum, and kanban software tools\u2022 Must have strategic planning skills with good understanding of roadmap development.\u2022 Ability to write and present effective project materials, including presentations and status reports\u2022 Ability to work effectively with all levels of staff, clients and other IT personnel\u2022 Proven experience with working collaboratively with business/program partners \u2022 Ability to effectively identify and resolve system or business process/project issues\u2022 Ability to build, influence, lead and motivate effective teams towards end results\u2022 Flexibility, adaptability, and ability to work in a high-demand dynamic environment\u2022 Strong analytical skills\u2022 Strong written and oral communication skills, including development of project\u2022 Must have experience writing Procurement documents (RFP/RFQ) and technical artifacts\u2022 Experience as a Project Manager on a cloud-based implementation project is a plus",
        "source": "Email",
        "date_posted": "2024-10-18 10:59:06-05:00",
        "unique_id": "192a07b129230320",
        "emp_type": [
            "full-time",
            "third party"
        ],
        "tag": "Project Manager"
    }
]