[
    {
        "company": "kk associates LLC",
        "job_title": "Data Engineer(AWS)",
        "location": "San Francisco, CA, USA",
        "full_location": {
            "city": "San Francisco",
            "state": "CA",
            "country": "USA"
        },
        "job_details": {
            "employment_type": [
                "contract",
                "third party"
            ],
            "experience_required": "8-10 years",
            "degree_required": "Bachelor's degree in Computer Science, Engineering, or related fields",
            "visa_sponsorship": "Not specified",
            "notice_period": "Not specified",
            "duration": "Not specified",
            "rate": "Not specified"
        },
        "skills": {
            "core": [
                "AWS Glue",
                "EMR",
                "Athena",
                "Redshift",
                "Lake Formation",
                "Apache Spark",
                "Apache Hive",
                "Apache Airflow",
                "S3FS",
                "Apache Hudi",
                "Trino",
                "AngularJS",
                "Python",
                "RESTful APIs",
                "SQL",
                "NoSQL"
            ],
            "primary": [
                "Data catalog",
                "Data lineage",
                "Data quality",
                "Data profiling",
                "Data discovery",
                "Metadata management",
                "HTML",
                "CSS",
                "JavaScript",
                "BI tools",
                "Tableau",
                "AWS QuickSight",
                "Git"
            ],
            "secondary": [
                "Docker",
                "Kubernetes",
                "React",
                "Vue.js",
                "DevOps",
                "CI/CD",
                "Terraform",
                "API development",
                "API security",
                "SSO integration",
                "Microsoft Azure AD",
                "oAuth",
                "OIDC",
                "SAML",
                "AWS Cognito"
            ],
            "all": [
                "AWS Glue",
                "EMR",
                "Athena",
                "Redshift",
                "Lake Formation",
                "Apache Spark",
                "Apache Hive",
                "Apache Airflow",
                "S3FS",
                "Apache Hudi",
                "Trino",
                "AngularJS",
                "Python",
                "RESTful APIs",
                "SQL",
                "NoSQL",
                "Data catalog",
                "Data lineage",
                "Data quality",
                "Data profiling",
                "Data discovery",
                "Metadata management",
                "HTML",
                "CSS",
                "JavaScript",
                "BI tools",
                "Tableau",
                "AWS QuickSight",
                "Git",
                "Docker",
                "Kubernetes",
                "React",
                "Vue.js",
                "DevOps",
                "CI/CD",
                "Terraform",
                "API development",
                "API security",
                "SSO integration",
                "Microsoft Azure AD",
                "oAuth",
                "OIDC",
                "SAML",
                "AWS Cognito"
            ]
        },
        "job_type": [
            "onsite"
        ],
        "contact_person": "HariPrasath Asokan",
        "email": "hari.ak@kksoftwareassociates.com",
        "jd": "Hi, This is Hari from kk associates, Below Position is Immediate Position from the Client Kindly share Suitable resumes to hari.ak@kksoftwareassociates.com.Data Engineer(AWS)Location:San Francisco, CAHire Type: Contract Job Description:Role Description: Design, build, and maintain scalable and efficient data platform using data engineering technologies such as Glue, EMR, Athena, Redshift, Lake Formation, Apache Spark, Hive, HDFS and Trino. \u2022 Build/manage data pipelines, and common data related cross cutting concerns like data catalog, data lineage, data quality, data profiling, data discovery, metadata management \u2022 Develop and maintain web applications using AngularJS and Python. \u2022 Build/manage BI/Analytical dashboard reducing time to insight for the business stakeholders. \u2022 Implement CI/CD pipelines using Terraform, Jenkins, Github actions, Gitflow. \u2022 Collaborate with cross-functional teams to develop and implement new features. \u2022 Write clean, reusable, and efficient code. \u2022 Participate in code reviews and ensure code quality. \u2022 Develop and maintain APIs using Python and ensure API security and best practices are implemented. \u2022 Implement SSO integration with Microsoft Azure AD using oAuth, OIDC, and SAML. \u2022 Implement integration with AWS Cognito for user authentication and authorization. \u2022 Ensure the application is optimized for maximum speed and scalability. \u2022 Troubleshoot and debug issues as they arise. \u2022 Implement DevOps best practices to ensure efficient application deployment and management. \u2022 Collaborate with data scientists and analysts to integrate data analytics solutions with web applications. \u2022 Stay up to date with emerging trends and technologies.Competencies: Digital : Amazon Web Service(AWS) Cloud ComputingExperience (Years): 8-10Essential Skills: Hands on Experience with data engineering technologies such as AWS Glue, EMR, Athena, Redshift, Lake Formation, Apache Spark, Apache Hive, Apache Airflow, S3FS, Apache Hudi and Trino. \u2022 Extensive experience of building data pipelines using orchestration tool like Apache Airflow. Hands on experience on building cross cutting concerns like data catalog, data lineage, data quality, data profiling, data discovery, metadata management \u2022 Proven experience as a Full Stack Developer with AngularJS and Python. \u2022 Strong understanding of web development technologies including HTML, CSS, and JavaScript. \u2022 Experience working with RESTful APIs and JSON. Familiarity with microservices architecture. \u2022 Experience with core AWS technologies such as EC2, ELB, Auto Scaling, S3, EFS, Lambda, API Gateway, Step Functions, Cloudwatch, VPC, Route 53, ACM \u2022 Hands on experience with SQL and NoSQL databases. \u2022 Hands experience with BI tools like Tableau, AWS QuickSight \u2022 Experience with Git or other version control systems. \u2022 Understanding of agile development methodologies. \u2022 Strong problem-solving skills. \u2022 Excellent written and verbal communication skills. \u2022 Ability to work independently and collaboratively in a team environment. \u2022 Experience with cloud platforms such as AWS. \u2022 Bachelors degree in Computer Science, Engineering, or related fieldsDesirable Skills: Knowledge of containerization technologies like Docker or Kubernetes. \u2022 Experience with front-end frameworks like React or Vue.js. \u2022 Experience with DevOps and CI/CD best practices. \u2022 Experience with Terraform and the AWS provider. \u2022 Experience with API development, security, and best practices. \u2022 Experience with SSO integration with Microsoft Azure AD using oAuth, OIDC, and SAML. \u2022 Experience with integration with AWS Cognito for user authentication and authorization.",
        "source": "Email",
        "date_posted": "2024-10-18 12:44:20-05:00",
        "unique_id": "192a0db6af7610f4",
        "emp_type": [
            "contract",
            "third party"
        ],
        "tag": "AWS Data Engineer"
    }
]