[
    {
        "company": "Ozin Technologies",
        "job_title": "Full Stack .Net Technical Product Manager",
        "location": "Seattle, WA, USA",
        "full_location": {
            "city": "Seattle",
            "state": "WA",
            "country": "USA"
        },
        "job_details": {
            "employment_type": [
                "contract",
                "third party"
            ],
            "job_code": "",
            "experience_required": "5 years",
            "degree_required": "Bachelor's Degree",
            "visa_sponsorship": "Not specified",
            "notice_period": "Not specified",
            "duration": "9 months contract",
            "rate": "Not specified"
        },
        "skills": {
            "core": [
                "Full Stack .Net",
                "Microsoft Power Business Intelligence (BI)",
                "Project Management Office (PMO)",
                "Supply Chain Management (SCM)"
            ],
            "primary": [],
            "secondary": [],
            "all": [
                "Full Stack .Net",
                "Microsoft Power Business Intelligence (BI)",
                "Project Management Office (PMO)",
                "Supply Chain Management (SCM)"
            ],
            "with_experience": [
                "Full Stack .Net (5 years)"
            ]
        },
        "job_type": [
            "hybrid"
        ],
        "contact_person": "Aakash",
        "email": "aakash.sharma@ozin.ai",
        "jd": "From: Aakash, Ozin Technologies aakash.sharma@ozin.ai Reply to: aakash.sharma@ozin.ai Position: Full Stack .Net Technical Product ManagerLocation: Seattle, WA 98191 - HybridLength: 9 months contractInterview: Video (They can ask you to come on-site for In-person interview, that is possibility as well)Visa Status: Any Visa (No H1 & OPT/CPT) Must Haves:Bachelor's Degree and 5 years experience as a Full Stack .Net Product managerMicrosoft Power Business Intelligence (BI) (P3 - Advanced)Project Management Office (PMO) (P3 - Advanced)Supply Chain Management (SCM) (P3 - Advanced) Overview:Lead the effort to design, build and configure applications, acting as the primary point of contact. Responsibilities:Developing a business process definition repository and implementing Business Activity Monitoring (BAM) for Supply Chain (SC) business operations.Utilizing process mining for process optimization and providing a real-time transactional view across systems for Critical Service Operations (CSOs).Improving monitoring capabilities, including Quality of Service (QoS) and BAM. ??Creating structure through system definition and information architecture to support product usability.Crafting terminology, product and feature naming, and conducting research to optimize product experience and interface ??Influencing design to ensure the finished product meets user requirements and needs.Collaborating to develop system guidelines and design features.Developing and implementing communication",
        "source": "Email",
        "date_posted": "2024-10-18 09:39:18-05:00",
        "unique_id": "192a05c107c4c101",
        "emp_type": [
            "contract",
            "third party"
        ],
        "tag": "Project Manager"
    }
]