[
    {
        "company": "Texas Health and Human Services Commission",
        "job_title": "Oracle Database Admin",
        "location": "Texas, USA",
        "full_location": {
            "city": "",
            "state": "Texas",
            "country": "USA"
        },
        "job_details": {
            "employment_type": [
                "contract",
                "third party"
            ],
            "job_code": "",
            "experience_required": "6 years",
            "degree_required": "Not specified",
            "visa_sponsorship": "No visa sponsorship",
            "notice_period": "Not specified",
            "duration": "Not specified",
            "rate": "Not specified"
        },
        "skills": {
            "core": [
                "Oracle database design",
                "performance tuning",
                "Oracle database structures",
                "data analysis",
                "designing enterprise applications",
                "creating technical and functional design documentation",
                "Agile methodology",
                "multi-tier system/application development"
            ],
            "primary": [
                "Jira",
                "Oracle Certification",
                "data warehouse applications",
                "database reporting features"
            ],
            "secondary": [],
            "all": [
                "Oracle database design",
                "performance tuning",
                "Oracle database structures",
                "data analysis",
                "designing enterprise applications",
                "creating technical and functional design documentation",
                "Agile methodology",
                "multi-tier system/application development",
                "Jira",
                "Oracle Certification",
                "data warehouse applications",
                "database reporting features"
            ]
        },
        "job_type": [
            "remote"
        ],
        "contact_person": "Vinita Singh",
        "email": "vinita.singh@tekinspirations.com",
        "jd": "From: Vinita Singh, Tek Inspirations vinita.singh@tekinspirations.com Reply to: vinita.singh@tekinspirations.com job Description -Role: Oracle Database AdminLocation : TEXAS ,Must have linkedin.Client - Texas Health and Human Services Commission.Must local to TXVisa :: CITIZEN,GREEN CARD Only Must have state client experience Job DescriptionThis Database Administrator contractor position is part of the Administrative Applications Production Data Services team and will be working on the development and implementation of modifications and enhancements to the Financial Data Warehouse. This position will perform the duties of database development will perform advanced database development tasks for databases used by an application with complex data models, workflows, and reports.May be required to create new logical and physical data models.The role will involve working with Oracle databases.The candidate will optimize database performance during and after migration, identify and resolve performance bottlenecks, and implement monitoring solutions to track database health and performance metrics. This position will develop new views, tables and PL/SQL code to be used by the customer of the Financial Data Warehouse application. Will work on activities including, but not limited to the design, development, and testing of new tables, views, PL/SQL stored procedures and functions, and necessary loaders to support the project news. Will develop and test Linux shell scripts to invoke database calls. Will develop and test scheduled jobs and shell scripts. May perform performance tuning of new and existing tables, views, PL/SQL code. The role will involve working closely with the team to create and maintain logical and physical data models, with a primary focus on Oracle. This role will require knowledge of Oracle Stored Procedures and Functions. ** Must have Texas State Agency Experience ** II. CANDIDATE SKILLS AND QUALIFICATIONS Minimum Requirements:Candidates that do not meet or exceed the minimum stated requirements (skills/experience) will be displayed to customers but may not be chosen for this opportunity.YearsRequired/PreferredExperience6RequiredExperience in Oracle database design, analysis, and performance tuning6RequiredExperience in Oracle database structures and data analysis6RequiredExperience designing enterprise applications and/or services6RequiredExperience creating technical and functional design documentation6RequiredExperience within software development lifecycle using Agile methodology \u2013 (Scrum, for example)6RequiredExperience with multi-tier system/application development \u2013 (SOA, Microservices, 3-Tier applications, for example)2RequiredJira experience2RequiredOracle Certification2RequiredExperience with data warehouse applications and/or database reporting features E: vinita.singh@tekinspirations.com Contact No-+ 469-205-(6817)",
        "source": "Email",
        "date_posted": "2024-10-18 12:54:26-05:00",
        "unique_id": "192a0e4a955b93cf",
        "emp_type": [
            "contract",
            "third party"
        ],
        "tag": "Oracle DBA"
    }
]