[
    {
        "company": "Siri InfoSolutions",
        "job_title": "GCP Lead \u2013 Looker",
        "location": "Piscataway, NJ, USA",
        "full_location": {
            "city": "Piscataway",
            "state": "NJ",
            "country": "USA"
        },
        "job_details": {
            "employment_type": [
                "third party"
            ],
            "job_code": "",
            "experience_required": "7+ years",
            "degree_required": "Not specified",
            "visa_sponsorship": "Not specified",
            "notice_period": "Not specified",
            "duration": "6+ months",
            "rate": "Not specified"
        },
        "skills": {
            "core": [
                "GCP Looker",
                "BigQuery",
                "Python",
                "SQL"
            ],
            "primary": [
                "Google Cloud Platform",
                "Data Engineering",
                "Data Analytics",
                "Agile Development"
            ],
            "secondary": [
                "DataProc",
                "DataFlows",
                "Java",
                "JavaScript",
                "R",
                "UNIX Shell",
                "PHP",
                "Ruby",
                "Cloud Storage",
                "Cloud Dataflow",
                "Data Mapping",
                "Data Modeling",
                "Data Mining",
                "AWS Cloud",
                "Hadoop",
                "HDFS",
                "MapR",
                "Spark"
            ],
            "all": [
                "GCP Looker",
                "BigQuery",
                "Python",
                "SQL",
                "Google Cloud Platform",
                "Data Engineering",
                "Data Analytics",
                "Agile Development",
                "DataProc",
                "DataFlows",
                "Java",
                "JavaScript",
                "R",
                "UNIX Shell",
                "PHP",
                "Ruby",
                "Cloud Storage",
                "Cloud Dataflow",
                "Data Mapping",
                "Data Modeling",
                "Data Mining",
                "AWS Cloud",
                "Hadoop",
                "HDFS",
                "MapR",
                "Spark"
            ]
        },
        "job_type": [],
        "contact_person": "Naveen Miyyadi",
        "email": "naveen.m@siriinfo.com",
        "jd": "HelloGreetings from Siri InfoSolutions\u2026We have an immediate position, please find the below details\u2026 Job Title: GCP Lead \u2013 Looker Location: Piscataway, NJDuration: 6+ months Key words to search in resume GCP Lead \u2013 LookerTechnical/Functional Skills \u2013MUST HAVE SKILLS Job Description: Senior application developer with 7+ years of experience to support application development of Time & Pay Data Analytics in Google Cloud Platform. Expect to perform the following:-Conducts systems and requirements analyses to identify project action items.Creates task lists and time estimates to support project plan development.Performs assigned functions and tasks to meet project plan and quality review requirementsSystem analysis, design, code, test, correct & document moderate to highly complex program.Support data analysis, data migrationWrite scripts required for data cleansing, format & transformationSkill/Experience/Education Primary: GCP Looker ( Google Reporting tool)Secondary: BigQueryExperience working in GCP environment.Experience in data modellingAbility to write complex BQ queries.Ability to create Dashboards and reportsDevelopment Experience in Google Cloud platform/development tools. Experience with Agile Development, data analytics, SQL programming Reporting and Dashboarding experience such as Google Looker or Google Data Studio* Strong Python Development Experience is mandatory* 6-8 years of Data Engineering experience working with both distributed architectures, ETL, EDW and Big Data technologies* Demonstrable knowledge & Experience using Google Cloud Big Query is mandatory* Experience with DataProc & DataFlows with Java on Google Cloud Platform is highly desired* Experience with serverless data warehousing concepts on Google Cloud is highly desired* Experience with DWBI modelling framework is highly regarded* Extensive experience working with SQL across a variety of databases* Experience working with both structured and unstructured data sources using cloud analytics (Cloudera , Hadoopo etc.)* Experience with Data Mapping and Modelling* Experience with Data Analytics tools* Proven ability in one or more of the following programming or scripting languages- Python, JavaScript, Java, R, UNIX Shell, php, ruby.* Experience with Google Cloud Services such as Streaming + Batch, Cloud Storage, Cloud Dataflow, Data Proc , DFunc, Big Query & Big Table* knowledge and proven use of contemporary data mining, cloud computing and data management tools including but not limited to Microsoft Azure, AWS Cloud, Google Cloud, hadoop, HDFS, mapr and spark.Roles & Responsibilities Looker Developer:1. Datamodeling2. Dashboards and report development3. Bigquery development4. Finetuning BigQuery",
        "source": "Email",
        "date_posted": "2024-10-18 12:53:15-05:00",
        "unique_id": "192a0e394c63a6aa",
        "emp_type": [
            "third party"
        ],
        "tag": "GCP Data Engineer"
    }
]