[
    {
        "company": "Virginia Retirement System (VRS)",
        "job_title": "Business analyst(Only Locals)",
        "location": "Richmond, VA, USA",
        "full_location": {
            "city": "Richmond",
            "state": "VA",
            "country": "USA"
        },
        "job_details": {
            "employment_type": [
                "contract",
                "third party"
            ],
            "job_code": "749676",
            "experience_required": "5 years",
            "degree_required": "Bachelor's degree in computer science or closely related field",
            "visa_sponsorship": "Not specified",
            "notice_period": "Not specified",
            "duration": "6 Months",
            "rate": "Not specified"
        },
        "skills": {
            "core": [
                "Software Development Life Cycle",
                "Business Systems Analysis and Design Techniques",
                "Procurement processes",
                "Analytical techniques",
                "M365 apps"
            ],
            "primary": [
                "Documenting user requirements",
                "Testing system functionality",
                "Problem-solving",
                "Communication skills",
                "Team collaboration"
            ],
            "secondary": [
                "Entity Relationship Diagrams",
                "Process Decomposition Diagrams",
                "Workflows",
                "Wireframes",
                "General IT security standards"
            ],
            "all": [
                "Software Development Life Cycle",
                "Business Systems Analysis and Design Techniques",
                "Procurement processes",
                "Analytical techniques",
                "M365 apps",
                "Documenting user requirements",
                "Testing system functionality",
                "Problem-solving",
                "Communication skills",
                "Team collaboration",
                "Entity Relationship Diagrams",
                "Process Decomposition Diagrams",
                "Workflows",
                "Wireframes",
                "General IT security standards"
            ]
        },
        "job_type": [
            "hybrid"
        ],
        "contact_person": "Harsh Tiwari",
        "email": "harsh.tiwari@technocraftsol.com",
        "jd": "From: Harsh Tiwari, Technocraft solutions harsh.tiwari@technocraftsol.com Reply to: harsh.tiwari@technocraftsol.com Job Title: Business analyst(Only Locals)Job ID: 749676Location: Richmond, VA (VRS)Duration: 6 Months Note*****ON SITE REQUIRED: 2 days in (Tuesday and Wednesday in office each week required) with another 3 days remote. *Parking is not provided for contractors Skills:Expert knowledge and experience in the software development cycle. Required 5 YearsExpert knowledge and experience in business systems analysis and design techniques. Required 5 YearsGeneral understanding of procurement processes, systems and best practices. Required 5 YearsWork effectively and independently in a fast-paced team environment where priorities can rapidly change. Required 5 YearsPrioritize task with minimal guidance and coaching. Required 5 YearsSolve complex problems through discovery and analysis with minimal guidance. Required 5 YearsCommunicate effectively orally and in writing with users at all levels within VRS. Required 5 YearsAnalyze complex processes and understand intricate materials and documentation. Required 5 YearsResearch and gather data, compile results and solve problems. Required 5 YearsDefine user requirements and document user stories. Required 5 YearsUse of various analytical techniques including process flows and use cases. Required 5 YearsPrepare complex documents, including general and detail design specifications. Required 5 YearsSuccessfully interact in a team environment. Required 5 YearsWeb-based systems and business support tools such as procure-to- pay systems and contract management systems. Required 5 YearsM365 apps \u2013 Word, Excel, PowerPoint, SharePoint. Required 5 YearsGeneral IT security standards and practices. Required 5 Years Description:ABOUT THE ROLEThe Virginia Retirement System (VRS) is seeking an experienced business analyst to assist with documenting current and future state requirements, developing test cases, testing the system, documenting users guides and standard operating procedures for a procurement and contract management system. As a Business Analyst, the ideal candidate brings proven leadership experience in the procurement and contract management domain and thrives in a highly collaborative, fast-paced work environment. This position is hybrid, requiring onsite presence on Tuesdays, Wednesdays and other days as required. Essential Duties and Responsibilities include the following (other duties may be assigned as needed):Analysis\u00b7 Independently and proactively lead/facilitate efforts to identify opportunities to leverage technology to enable business success and alignment with strategic vision.\u00b7 Collaborate with all stakeholders to gather, evaluate, and document requirements for new systems or system enhancements based on business user input, technical requirements and constraints.\u00b7 Document requirements using Structured Analysis Techniques such as Use Cases, Entity Relationship Diagrams, Process Decomposition Diagrams, Workflows and Wireframes.\u00b7 Analyze proposed system and process changes to identify strategies for meeting business objectives and impacts, including assessing costs and implementation efforts.\u00b7 Develop innovative strategies to meet business requirements by leveraging the capabilities of existing technology tools or acquiring/developing new ones.\u00b7 Present strategies and findings in meetings and presentations with key users and agency executives.\u00b7 Serve as a liaison between business partners and technical staff.\u00b7 Coordinate with business users and technical staff to develop test data and test procedures to verify application functionality and oversee testing within projects. Technical Expertise and Guidance\u00b7 Apply a broad range of expertise of technology principles, best practices and procedures to complex assignments across multiple functional areas.\u00b7 Ensure security best practices in accordance with VRS Security policies.\u00b7 Utilize comprehensive technical knowledge of software solutions analysis and design to oversee significant assignments, escalating only the most complex technology issues to higher levels.\u00b7 Develop and document technology processes and methodologies.\u00b7 Promote and adhere to the Systems Development Life Cycle (SDLC) methodology and recommend changes when appropriate. Collaborate with both business partners and technical staff to ensure adherence to the SDLC methodology, ensuring high-quality project deliverables. Skills and AbilitiesDemonstrated ability to:\u2013 Work effectively and independently in a fast-paced team environment where priorities can rapidly change.\u2013 Prioritize task with minimal guidance and coaching.\u2013 Solve complex problems through discovery and analysis with minimal guidance.\u2013 Communicate effectively orally and in writing with users at all levels within VRS. Expert knowledge and experience in the following:\u2013 The Software Development Life Cycle\u2013 Business Systems Analysis and Design Techniques\u2013 General understanding of procurement processes, systems and best practices Demonstrated ability to:\u2013 Analyze complex processes and understand intricate materials and documentation.\u2013 Research and gather data, compile results and solve problems.\u2013 Define user requirements and document user stories.\u2013 Use of various analytical techniques including process flows and use cases.\u2013 Prepare complex documents, including general and detail design specifications.\u2013 Successfully interact in a team environment. Demonstrated working knowledge of the following tools/technologies:\u2013 Web-based systems and business support tools such as procure-to- pay systems and contract management systems.\u2013 M365 apps \u2013 Word, Excel, PowerPoint, SharePoint.\u2013 General IT security standards and practices. Education and ExperienceCandidates must possess a bachelor\u2019s degree in computer science or closely related field from a four-year college or university, with 5 or more years of relevant experience. Preferred qualifications include at least 3 years as an analyst in the implementation of procurement workflows and contract management systems, as well as 2 years of experience organizing and coordinating multiple work assignments and priorities. This position will be on a contract basis for a period of up to 6 months. For optimal effectiveness, the selected candidate should be available to start within the next month. VRS desires to interview proposed individuals before final approval. VRS feels the individual needs to be onsite the majority of the time to work closely with the teams to be successful.",
        "source": "Email",
        "date_posted": "2024-10-18 10:20:23-05:00",
        "unique_id": "192a057a0637462b",
        "emp_type": [
            "contract",
            "third party"
        ],
        "tag": "Business Analyst"
    }
]