[
    {
        "company": "University of California Office of the President",
        "job_title": "Business Systems Analyst (Asset Management)",
        "location": "Oakland, CA, USA",
        "full_location": {
            "city": "Oakland",
            "state": "CA",
            "country": "USA"
        },
        "job_details": {
            "employment_type": [
                "contract",
                "third party"
            ],
            "job_code": "",
            "experience_required": "8+ years",
            "degree_required": "Not specified",
            "visa_sponsorship": "Must have existing work authorization",
            "notice_period": "Not specified",
            "duration": "Not specified",
            "rate": "Not specified"
        },
        "skills": {
            "core": [
                "business analysis",
                "process analysis",
                "data cleanup",
                "Inventory/Asset Management",
                "Agile"
            ],
            "primary": [
                "AWS tags",
                "ServiceNow",
                "Agile SCRUM",
                "Waterfall"
            ],
            "secondary": [
                "Higher Education sector",
                "tool agnostic"
            ],
            "all": [
                "business analysis",
                "process analysis",
                "data cleanup",
                "Inventory/Asset Management",
                "Agile",
                "AWS tags",
                "ServiceNow",
                "Agile SCRUM",
                "Waterfall",
                "Higher Education sector",
                "tool agnostic"
            ]
        },
        "job_type": [
            "remote"
        ],
        "contact_person": "Pankaj Upadhyay",
        "email": "pankaj.upadhyay@adventatech.com",
        "jd": "From: pankaj Upadhyay, adventa pankaj.upadhyay@adventatech.com Reply to: pankaj.upadhyay@adventatech.com Job Description -UCOP (University of California Office of the President)Business Systems Analyst (Asset Management) Location: Oakland, CA (100% Remote) Must Live In CA / Manager prefers 1-2 hours from the BayMust have GC or USC or H4 or H1 or TN Visas ONLY (No OPT/EAD)Please include a summary with the must haves about their projects ?? Resumes should not exceed 4 pages. Required Qualifications\u2022 8+ years of advanced knowledge/experience of business and process analysis functions.\u2022 Experience and skills managing data cleanups, tagging (AWS tags, potentially in ServiceNow) and begin mapping servers to applications.\u2022 Experience defining the data cleanup process, etc. \u2022 While we use/prefer SNOW, the process can be tool agnostic. This contactor should have familiarity with Inventory/Asset Management, preferably in SN.\u2022 Experience in the Higher Education sector is preferred.\u2022 Experience working in Agile, Agile SCRUM, and traditional Waterfall environments.",
        "source": "Email",
        "date_posted": "2024-10-18 09:31:08-05:00",
        "unique_id": "192a063dc719596c",
        "emp_type": [
            "contract",
            "third party"
        ],
        "tag": "Business Analyst"
    }
]