[
    {
        "company": "SANROSE Information Services, Inc",
        "job_title": "Power Automate Developer",
        "location": "Tallahassee, FL, USA",
        "full_location": {
            "city": "Tallahassee",
            "state": "FL",
            "country": "USA"
        },
        "job_details": {
            "employment_type": [
                "onsite",
                "third party"
            ],
            "experience_required": "Not specified",
            "degree_required": "Not specified",
            "visa_sponsorship": "No visa sponsorship",
            "notice_period": "Not specified",
            "duration": "Not specified",
            "rate": "Not specified"
        },
        "skills": {
            "core": [
                "Power Automate",
                "C#",
                "ASP.NET",
                ".NET Frameworks",
                "SQL"
            ],
            "primary": [
                "XML",
                "JavaScript",
                "HTML5",
                "CSS",
                "jQuery",
                "SQL Server",
                "Web Services"
            ],
            "secondary": [
                "SharePoint",
                "Middleware technologies",
                "Database technologies",
                "Systems analysis",
                "Troubleshooting",
                "Documentation",
                "Coaching",
                "Data processing principles"
            ],
            "all": [
                "Power Automate",
                "C#",
                "ASP.NET",
                ".NET Frameworks",
                "SQL",
                "XML",
                "JavaScript",
                "HTML5",
                "CSS",
                "jQuery",
                "SQL Server",
                "Web Services",
                "SharePoint",
                "Middleware technologies",
                "Database technologies",
                "Systems analysis",
                "Troubleshooting",
                "Documentation",
                "Coaching",
                "Data processing principles"
            ],
            "with_experience": [
                "Power Automate",
                "C#",
                "ASP.NET",
                ".NET Frameworks"
            ]
        },
        "job_type": [
            "onsite"
        ],
        "contact_person": "Diwakar",
        "email": "recruiter1@sanrose.com",
        "jd": "From: Diwakar, SANROSE Information Services, Inc recruiter1@sanrose.com Reply to: recruiter1@sanrose.com Role: Power Automate DeveloperOn-site at Tallahassee FLNo OPT, CPT, H1 TransferNeed PP Number for Submission Certification: Power Automate developer certificationRequired Experience:Programming/systems analysis experience with emphasis in applications and systems architectural design and development, database, and middleware technologiesExperience working on projects of moderate to high complexity within one or more development environments.Experience working on multiple programs/systems as a project team member.Experience developing and maintaining documentation for Power Automate processes and workflows.Experience Developing custom workflows using the Microsoft Power ,Automate platform.Experience Designing, creating, and maintaining flows, actions, and triggers.Experience creating and maintaining documentation to support the development of automated solutions.Experience troubleshooting and resolving workflow issues. Experience identifying opportunities to improve processes and automate manual tasks.Experience working with stakeholders to understand their needs and identify solutions.Experience developing and executing tests to ensure the accuracy and reliability of automated solutions.Experience collaborating with developers, system administrators, and other stakeholders to ensure successful delivery of automated solutions.Experience designing and developing automated processes, workflows, and APIs using Microsoft Power Automate.Experience integrate existing systems with Power Automate to automate processes and workflows.Experience analyzing user requirements and develop solutions that meet those needs.Experience troubleshooting and debugging automated processes and workflows.Experience monitoring and maintaining the performance of automated processes and workflows.Experience researching and recommending new technologies to improve the efficiency and effectiveness of automated processes and workflows.Experience collaborating with other teams to ensure compatibility and interoperability of automated processes and workflows.Experience configuring the company SharePoint systems to specified requirements.Experience developing new web components using XML, .NET, SQL, and C#.Experience designing, coding, and implementing scalable applications.Experience extending SharePoint functionality with forms, web parts, and application technologies.Experience with testing and debugging code.Experience reviewing website interface and software stability.Experience troubleshooting software issues.Experience maintaining and updating SharePoint applications.Experience providing systems training to staff and customers.Preferred Abilities and Knowledge:Experience coaching more junior technical staff.Ability to exercise independent judgment.Knowledge of Lottery Systems Preferred.Working knowledge of data processing principles and terminology.Ability to organize and prioritize tasks.Ability to keep immediate supervisor informed of pertinent information relating to job responsibilities.Previous experience as a SharePoint developer.Extensive knowledge of C#, ASP.NET, and .NET Frameworks.Familiarity with JavaScript, HTML5, CSS, XML, jQuery, SQL Server, and Web Services.High-level coding skills.Ability to solve complex software issues.Detail orientated",
        "source": "Email",
        "date_posted": "2024-10-18 07:28:39-05:00",
        "unique_id": "1929ffe40dbcfe37",
        "emp_type": [
            "onsite",
            "third party"
        ],
        "tag": ".net developer"
    }
]