[
    {
        "company": "Netonics INC",
        "job_title": "Application Developer \u2013 JAVA",
        "location": "New York, NY, USA",
        "full_location": {
            "city": "New York",
            "state": "NY",
            "country": "USA"
        },
        "job_details": {
            "employment_type": [
                "full-time",
                "third party"
            ],
            "job_code": "",
            "experience_required": "Level 4",
            "degree_required": "Bachelor\u2019s Degree in Computer Science, Computer/ Software Engineering or similar.",
            "visa_sponsorship": "Not specified",
            "notice_period": "Not specified",
            "duration": "12 + Months",
            "rate": "Not specified"
        },
        "skills": {
            "core": [
                "Java",
                "Python",
                "SQL",
                "Mongo DB",
                "Spring Framework"
            ],
            "primary": [
                "Apache/Tomcat",
                "CXF services",
                "HTML 5",
                "AngularJS",
                "Extjs",
                "Chrome Extensions",
                "JavaScript",
                "C++",
                "Perl",
                "Kdb/q"
            ],
            "secondary": [
                "Agile Methodologies",
                "Devops practices",
                "Kafka",
                "Elasticsearch"
            ],
            "all": [
                "Java",
                "Python",
                "SQL",
                "Mongo DB",
                "Spring Framework",
                "Apache/Tomcat",
                "CXF services",
                "HTML 5",
                "AngularJS",
                "Extjs",
                "Chrome Extensions",
                "JavaScript",
                "C++",
                "Perl",
                "Kdb/q",
                "Agile Methodologies",
                "Devops practices",
                "Kafka",
                "Elasticsearch"
            ]
        },
        "job_type": [
            "onsite"
        ],
        "contact_person": "Samir Priya Darshan",
        "email": "samir.p@netonicsinc.com",
        "jd": "From: Samir Priya Darshan, Netonics INC samir.p@netonicsinc.com Reply to: samir.p@netonicsinc.com Job Title: Application Developer \u2013 JAVA - development and maintenance of a Bond bidding application for the Fixed Income sales force and its clients Duration: 12 + Months Location: 750 Seventh Ave. New York NY 10019 \u2013 5 days a week in office Experience Level: Level 4 Responsible for the development and maintenance of a Bond bidding application for the Fixed Income sales force and its clients. Technologies: - Apache/Tomcat, CXF services - Spring Framework - HTML 5, AngularJS, Extjs, Chrome Extensions - Scripts Languages: - Java - JavaScript - C++ - Perl - Python - Kdb/q Databases: - Sybase Python (Programming Language) and Technical Leadership \u00b7 Designing highly scalable core and web applications using best practices. \u00b7 Developing high performance middle tier systems \u00b7 Developing REST services \u00b7 Interact with Business to understand complex business requirements. \u00b7 Translate complex business requirements into robust technical implementation \u00b7 Developing application codes and unit tests \u00b7 Ensuring high performance of applications and providing support. Skills \u00b7 Bachelor\u2019s Degree in Computer Science, Computer/ Software Engineering or similar. \u00b7 Highly experienced in Python \u00b7 Experience in Java preferred. \u00b7 Highly experienced in database technologies: SQL, Mongo DB. \u00b7 Knowledge of Agile Methodologies and Devops practices Knowledge of Kafka, Elasticsearch, KDB/Q preferred.",
        "source": "Email",
        "date_posted": "2024-10-18 13:34:18-05:00",
        "unique_id": "192a10928f5eb0cb",
        "emp_type": [
            "full-time",
            "third party"
        ],
        "tag": "Java developer"
    }
]