[
    {
        "company": "Vyze Inc.",
        "job_title": ".NET Developer",
        "location": "USA",
        "full_location": {
            "city": "",
            "state": "",
            "country": "USA"
        },
        "job_details": {
            "employment_type": [
                "third party"
            ],
            "job_code": "",
            "experience_required": "8 years",
            "degree_required": "Not specified",
            "visa_sponsorship": "Not specified",
            "notice_period": "Not specified",
            "duration": "Not specified",
            "rate": "Not specified"
        },
        "skills": {
            "core": [
                ".NET",
                "C#",
                "VB",
                "SQL",
                "Object-Oriented Development"
            ],
            "primary": [
                "Java",
                "JavaScript",
                "Angular",
                "React",
                "Agile Programming",
                "SOAP",
                "REST",
                "Web Server Configuration"
            ],
            "secondary": [
                "Informix",
                "Unix/Linux",
                "Windows",
                "GDPicture",
                "DevExpress",
                "iText#",
                "Fiddler",
                "PostMan",
                "SoapUI"
            ],
            "all": [
                ".NET",
                "C#",
                "VB",
                "SQL",
                "Object-Oriented Development",
                "Java",
                "JavaScript",
                "Angular",
                "React",
                "Agile Programming",
                "SOAP",
                "REST",
                "Web Server Configuration",
                "Informix",
                "Unix/Linux",
                "Windows",
                "GDPicture",
                "DevExpress",
                "iText#",
                "Fiddler",
                "PostMan",
                "SoapUI"
            ]
        },
        "job_type": [
            "remote"
        ],
        "contact_person": "Rahul Mishra",
        "email": "rmishra@vyzeinc.com",
        "jd": "From: Rahul Mishra, Vyzeinc rmishra@vyzeinc.com Reply to: rmishra@vyzeinc.com Details on the .NET Developer role below: GC, USC, \u00b7 Minimum 8 years of proficiency with Object-Oriented development methodologies using MS .NET VB (primarily) and C# in a work environment\u00b7 Database Experience using SQL in a mission-critical relational database application.\u00b7 Ability to work independently with minimal supervision Excellent communication skills and ability to interact with other developers and second level support engineers\u00b7 Informix experience storing images in blobspaces.\u00b7 Operating System Experience: Unix/Linux (RHEL), Windows\u00b7 Experience with additional programming languages: Java, JavaScript Front-End Frameworks (Angular/React).\u00b7 Candidates who have experience with Imaging toolkits such as GDPicture, DevExpress, iText# will receive priority consideration\u00b7 Experience with Agile programming methodology having multiple software iterations. Writing and debugging DDL/DML.\u00b7 Experience with Web Server (Apache/IIS) configuration and support, SOAP/REST Webservice Development and Consumption\u00b7 Strong troubleshooting experience using tools like Fiddler, PostMan, SoapUI Best RegardsRahul Mishra US Technical Recruiter |Vyze Inc.E-Mail: rmishra@vyzeinc.com",
        "source": "Email",
        "date_posted": "2024-10-18 11:23:13-05:00",
        "unique_id": "192a0912931d35f3",
        "emp_type": [
            "third party"
        ],
        "tag": ".net developer"
    }
]