[
    {
        "company": "TTDATA LLC",
        "job_title": "CDP Architect",
        "location": "USA",
        "full_location": {
            "city": "",
            "state": "",
            "country": "USA"
        },
        "job_details": {
            "employment_type": [
                "contract",
                "third party"
            ],
            "job_code": "",
            "experience_required": "12+ years, with at least 5+ years in customer-centric datasets",
            "degree_required": "Not specified",
            "visa_sponsorship": "Not specified",
            "notice_period": "Not specified",
            "duration": "Contract",
            "rate": "Not specified"
        },
        "skills": {
            "core": [
                "CDP implementation",
                "customer profile segmentation",
                "ETL",
                "Data quality / Cleansing",
                "Identity resolution",
                "SQL",
                "Data modeling",
                "Data warehouse"
            ],
            "primary": [
                "Adobe Experience Platform",
                "Segment",
                "Tealium",
                "Redpoint",
                "Treasure Data",
                "digital marketing",
                "digital analytics",
                "customer360",
                "MarTech"
            ],
            "secondary": [
                "Product Owner Role",
                "Business Analyst",
                "KPI creation",
                "User Acceptance Testing",
                "stakeholder communication"
            ],
            "all": [
                "CDP implementation",
                "customer profile segmentation",
                "ETL",
                "Data quality / Cleansing",
                "Identity resolution",
                "SQL",
                "Data modeling",
                "Data warehouse",
                "Adobe Experience Platform",
                "Segment",
                "Tealium",
                "Redpoint",
                "Treasure Data",
                "digital marketing",
                "digital analytics",
                "customer360",
                "MarTech",
                "Product Owner Role",
                "Business Analyst",
                "KPI creation",
                "User Acceptance Testing",
                "stakeholder communication"
            ],
            "with_experience": [
                "CDP implementation (1-2 implementations)",
                "customer-centric datasets (5+ years)"
            ]
        },
        "job_type": [
            "remote"
        ],
        "contact_person": "S Vetriya",
        "email": "vetriya@ttdatas.com",
        "jd": "From: Vetriya S, TTDATA vetriya@ttdatas.com Reply to: vetriya@ttdatas.com Hi Professionals, Position : CDP ArchitectLocation :RemoteDuration :Contract Responsibilities \u2013 Build the overarching strategy and high level plan for CDP implementation, ingestion from data sources, customer profile synthetization into traits and audiences, journey orchestration and integration with downstream systemsShould be able to design and build integration with external systems/data sources leveraging the CDP integration featuresUnderstand dependencies amongst data sources and destinations and provide inputs to building architecture and design documentsBring best practices for CDP and Journey orchestration to the engagement. Work with internal and CDP vendor professional services to execute Omni channel use cases Desired skills \u2013 At least 1-2 implementations of CDP platforms like Adobe Experience Platform, Segment, Tealium, Redpoint, Treasure Data etc.Overall 12+ years of experience, with at least 5+ years of crafting customer-centric datasets (i.e. CRM, Call Center, Marketing, Offline, Point of Sale, etc.)Should have strong understanding of customer profile segmentation and experience in 360 degree view of customers in CDP for further analytical processing and decision makingStrong understanding of ETL, Data quality / Cleansing and Identity resolutionStrong and hands-on knowledge of SQL, Data modeling, and Data warehouseKnowledge of digital marketing, digital analytics, customer360, MarTech space is a big plus - Expert in handling Product Owner Role for a Data Management Program specifically Customer Data Platform- Expert in articulating business vision and use cases for Customer Data Platform- Should have worked as a Business Analyst or Product owner for a Customer Data Platform (Microsoft CI, Tealium, Treasure Data, Redpoint etc.)- Should be able to articulate Epics & User Stories to formulate roadmap for Customer Data Platform Program- Should be able to create KPIs to measure success- Should be able to translate the business requirements of Customer Data Platform to Technical teams- Should be able to liaison between Implementation and the Customer Business Team- Should be able to support User Acceptance Testing with the business user for Customer Data Platform- Manage stakeholder communication, gather feedback, and address concerns- Drive successful deployment and adoption of data products Thanks& Regards S VetriyaTTDATA LLCSr.Technical Recruitervetriya@ttdatas.com",
        "source": "Email",
        "date_posted": "2024-10-18 09:54:10-05:00",
        "unique_id": "192a04115c4dc7d9",
        "emp_type": [
            "contract",
            "third party"
        ],
        "tag": "Business Analyst"
    }
]