[
    {
        "company": "iTech US Inc",
        "job_title": "Business Analyst (Digital Banking)",
        "location": "Raleigh, NC, USA",
        "full_location": {
            "city": "Raleigh",
            "state": "NC",
            "country": "USA"
        },
        "job_details": {
            "employment_type": [
                "full-time",
                "third party"
            ],
            "experience_required": "8+ years",
            "degree_required": "Bachelor's Degree",
            "visa_sponsorship": "Not specified",
            "notice_period": "Not specified",
            "duration": "6+ Months",
            "rate": "Not specified"
        },
        "skills": {
            "core": [
                "Business Analyst",
                "Digital Banking",
                "Agile",
                "JIRA",
                "Testing"
            ],
            "primary": [
                "Web Application Experience",
                "Agile Ceremonies",
                "Strong Communication",
                "Inter-personal Skills"
            ],
            "secondary": [
                "Story Writing",
                "Rally"
            ],
            "all": [
                "Business Analyst",
                "Digital Banking",
                "Agile",
                "JIRA",
                "Testing",
                "Web Application Experience",
                "Agile Ceremonies",
                "Strong Communication",
                "Inter-personal Skills",
                "Story Writing",
                "Rally"
            ]
        },
        "job_type": [
            "onsite"
        ],
        "contact_person": "Venkat Gayam",
        "email": "venkat.g@itechus.net",
        "jd": "Greetings from iTech US Inc.! We have an urgent requirement for you and the details are as follows\u2026 Job Title: Business Analyst (Digital Banking) Location: Raleigh NC (Day1 onsite) Duration: 6+ Months (Implementation/Prime Vendor Partner: TCS) Job Details: Need Strong profile on Business Analyst (Digital Banking) with 8+yrs IT exp. Job Description: 4+ yrs experience as banking BA with exposure to DB, agile concepts, testing Banking + digital (web application experience) Strong background with agile ceremonies \u2013 US Dev, Testing, Delivery Strong communication and inter-personal skills Well versed with story writing in JIRA or Rally or similar systems Kindly fill the below details as it is required while submitting it to the client: Full Name (Legal): Contact No: Alternate Contact No: E-mail ID: Work Authorization: Current Location: Former Employee of TCS (Yes/NO): Relocation (Y/N): LinkedIn URL: Education Details (Specialization/University/Passed out year) Bachelor's Degree: Master's Degree:",
        "source": "Email",
        "date_posted": "2024-10-18 09:04:07-05:00",
        "unique_id": "192a011d28b8d6d0",
        "emp_type": [
            "full-time",
            "third party"
        ],
        "tag": "Business Analyst"
    }
]