[
    {
        "company": "Tekinsiprations LLC",
        "job_title": "Full Stack .NET Developer",
        "location": "Raleigh, NC, USA",
        "full_location": {
            "city": "Raleigh",
            "state": "NC",
            "country": "USA"
        },
        "job_details": {
            "employment_type": [
                "third party"
            ],
            "job_code": "",
            "experience_required": "5+ years",
            "degree_required": "Not specified",
            "visa_sponsorship": "Not specified",
            "notice_period": "Not specified",
            "duration": "6+ Month",
            "rate": "Not specified"
        },
        "skills": {
            "core": [
                "VB6",
                "C#",
                "T-SQL",
                "ASP.NET",
                "Entity Framework",
                "ADO.NET"
            ],
            "primary": [
                "VBScript",
                "PL/SQL",
                "ETL processing",
                "SQL Server Integration Services",
                "BCP.exe",
                "T-SQL Bulk Load",
                "SQL Agent",
                "Windows Scheduled Tasks",
                "GIT",
                "HTML",
                "CSS",
                "JavaScript",
                "jQuery",
                "React"
            ],
            "secondary": [
                "Oracle APEX"
            ],
            "all": [
                "VB6",
                "C#",
                "T-SQL",
                "ASP.NET",
                "Entity Framework",
                "ADO.NET",
                "VBScript",
                "PL/SQL",
                "ETL processing",
                "SQL Server Integration Services",
                "BCP.exe",
                "T-SQL Bulk Load",
                "SQL Agent",
                "Windows Scheduled Tasks",
                "GIT",
                "HTML",
                "CSS",
                "JavaScript",
                "jQuery",
                "React",
                "Oracle APEX"
            ]
        },
        "job_type": [],
        "contact_person": "Shivansh Tiwari",
        "email": "shivansh.tiwari@tekinspirations.com",
        "jd": "From: Shivansh Tiwari, Tekinsiprations LLC shivansh.tiwari@tekinspirations.com Reply to: shivansh.tiwari@tekinspirations.com Job Title : Full Stack .NET Developer (F2F)Duration:6+ Month Location: Raleigh, NC (Local Candidates)Local Candidates with State Experience PreferredInterview Mode- F2FNeed DL And LinkedIn ID 5+ years of experience as a Full Stack .NET Developer to help Migrate legacy Applications. We need a developer that can pull business logic from a code base written in VB6, classic asp, and T-SQL. MANDATORY \u2013 MUST HAVE:Proficient in programming languages such as VB6, VBScript, C#, T-SQL, and PL/SQLExperienced in ASP.NET development (.NET Framework and .NET Core) with Entity Framework and/or ADO.NET.Proven experience with extract, transform, and load (ETL) processing and SQL Server tools such as Integration Services, BCP.exe, and T-SQL Bulk LoadWorking knowledge of scheduled jobs including SQL Agent and Windows Scheduled Tasks.Experienced with GIT source control management.Strong understanding of browser side development including HTML, CSS, JavaScriptFamiliar with JavaScript libraries for building user interface such as jQuery and ReactOracle APEX and PL/SQL experience is a plus.",
        "source": "Email",
        "date_posted": "2024-10-18 11:35:35-05:00",
        "unique_id": "192a09c7b0c3cf11",
        "emp_type": [
            "third party"
        ],
        "tag": ".net developer"
    }
]