[
    {
        "company": "Source Infotech",
        "job_title": "Data Engineer python with Spark",
        "location": "Columbus, OH, USA",
        "full_location": {
            "city": "Columbus",
            "state": "OH",
            "country": "USA"
        },
        "job_details": {
            "employment_type": [
                "third party"
            ],
            "job_code": "",
            "experience_required": "5+ years",
            "degree_required": "Bachelor\u2019s Degree in Computer Science/Programming or similar is preferred",
            "visa_sponsorship": "Not specified",
            "notice_period": "Not specified",
            "duration": "Not specified",
            "rate": "Not specified"
        },
        "skills": {
            "core": [
                "Python",
                "SQL",
                "Spark"
            ],
            "primary": [
                "AWS",
                "Data Engineering",
                "Data Pipelines",
                "Relational Datastores",
                "NoSQL Datastores",
                "Cloud Object Stores",
                "Analytical Skills",
                "Problem Solving"
            ],
            "secondary": [
                "Infrastructure as Code",
                "Terraform",
                "Cloud Certification",
                "ACID Compliant Formats",
                "Data Observability Solutions",
                "Data Governance Frameworks"
            ],
            "all": [
                "Python",
                "SQL",
                "Spark",
                "AWS",
                "Data Engineering",
                "Data Pipelines",
                "Relational Datastores",
                "NoSQL Datastores",
                "Cloud Object Stores",
                "Analytical Skills",
                "Problem Solving",
                "Infrastructure as Code",
                "Terraform",
                "Cloud Certification",
                "ACID Compliant Formats",
                "Data Observability Solutions",
                "Data Governance Frameworks"
            ]
        },
        "job_type": [],
        "contact_person": "Khushank Chauhan",
        "email": "khushank@sourceinfotech.com",
        "jd": "From: KhushankChauhan, Source Infotech khushank@sourceinfotech.com Reply to: khushank@sourceinfotech.com Data Engineer python with SparkLocation : Columbus, OHUSC or H4EADDuties and responsibilities \u25cf Collaborate with the team to build out features for the data platform and consolidate data assets\u25cf Build, maintain and optimize data pipelines built using Spark\u25cf Advise, consult, and coach other data professionals on standards and practices\u25cf Work with the team to define company data assets\u25cf Migrate CMS\u2019 data platform into Chase\u2019s environment\u25cf Partner with business analysts and solutions architects to develop technical architectures for strategic enterprise projects and initiatives\u25cf Build libraries to standardize how we process data\u25cf Loves to teach and learn, and knows that continuous learning is the cornerstone of every\u25cf solid understanding of AWS tools such as EMR or Glue, their pros and cons and\u25cf Implement automation on applicable processesMandatory Skills:\u25cf 5+ years of experience in a data engineering position\u25cf Proficiency is Python (or similar)and SQL\u25cf Strong experience building data pipelines with Spark\u25cf Strong verbal & written communication\u25cf Strong analytical and problem solving skills\u25cf Experience with relationaldatastores, NoSQL datastores and cloud object stores\u25cf Experience building data processing infrastructure in AWS\u25cf Bonus: Experience with infrastructure as code solutions, preferably Terraform\u25cf Bonus: Cloud certification\u25cf Bonus: Production experience with ACID compliant formats such as Hudi, Iceberg orDelta Lake\u25cf Bonus: Familiar with data observability solutions, data governance frameworksRequirementsBachelor\u2019s Degree in Computer Science/Programming or similar is preferred",
        "source": "Email",
        "date_posted": "2024-10-18 14:54:14-05:00",
        "unique_id": "192a15258c3a6b3e",
        "emp_type": [
            "third party"
        ],
        "tag": "AWS Data Engineer"
    }
]