[
    {
        "company": "Dia Softwares Solutions",
        "job_title": ".Net/ERP Developer",
        "location": "Richmond, VA, USA",
        "full_location": {
            "city": "Richmond",
            "state": "VA",
            "country": "USA"
        },
        "job_details": {
            "employment_type": [
                "contract",
                "third party"
            ],
            "job_code": "748487",
            "experience_required": "14 years",
            "degree_required": "Not specified",
            "visa_sponsorship": "Not specified",
            "notice_period": "Not specified",
            "duration": "8 Months",
            "rate": "Not specified"
        },
        "skills": {
            "core": [
                "C#",
                ".NET Development",
                "SQL Server",
                "Web API",
                "Angular",
                "Blazor"
            ],
            "primary": [
                "JavaScript",
                "jQuery",
                "CSS",
                "TFS",
                "Automated Builds",
                "Agile SDLC"
            ],
            "secondary": [
                "Oracle",
                "SOAP Services",
                "Azure Cloud Concepts",
                "PowerBI"
            ],
            "all": [
                "C#",
                ".NET Development",
                "SQL Server",
                "Web API",
                "Angular",
                "Blazor",
                "JavaScript",
                "jQuery",
                "CSS",
                "TFS",
                "Automated Builds",
                "Agile SDLC",
                "Oracle",
                "SOAP Services",
                "Azure Cloud Concepts",
                "PowerBI"
            ],
            "with_experience": [
                "C# (14 years)",
                "SQL Server (14 years)",
                "Web API (5 years)",
                "TFS (10 years)",
                "Automated Builds (5 years)",
                "Agile SDLC (5 years)"
            ]
        },
        "job_type": [
            "hybrid"
        ],
        "contact_person": "Jaya",
        "email": "jaya@diasoftwaresolutions.com",
        "jd": "From: Jaya, Dia Softwares solutions jaya@diasoftwaresolutions.com Reply to: jaya@diasoftwaresolutions.com Subject: State of VA - VDOT .Net/ERP Developer Job Id: 748487 Hi,Client : .Net/ERP Developer Work Arrangement: Hybrid/Local Work Location: Richmond, VA Agency Interview Type: In Person Only Duration of the Project: 8 Months Job Description: Ability to develop, program and code in .NET Core environment applications and backend services using C#, Web API, Java Script, JQuery, Angular or Blazor and CSS.Design, develop and program using appropriate software design patterns to attain high reusability and maintainability.Write effective unit tests and integration tests to ensure high quality software delivery.In-depth knowledge and skills in programming, system design patterns, tiered architecture, and testing practices.Understanding of key business processes and competitive strategies related to the IT function.Work with project architect, project manager, business owner and system analysts to clarify the requirements and then implement them. Participate in Agile SDLC. Skills:C#.NET Development experience Required 14 YearsAngular or Blazor Development experience Required 5 YearsStrong Database development experience using SQL Server Required 14 YearsExperience with Web API Required 5 YearsExperience with CSS3 and HTML5 Required 5 YearsExperience with Source Control using TFS Required 10 YearsExperience with Automated Builds using Microsoft Team Foundation Required 5 YearsExcellent Troubleshooting skills Required 12 YearsExperience with Agile SDLC best practices Required 5 YearsExperience working in Oracle Desired 2 YearsUnderstanding of SOAP Services Desired 5 YearsFamiliar with Azure Cloud Concepts Nice to have 1 YearsExperience with PowerBI Nice to have 1 Years",
        "source": "Email",
        "date_posted": "2024-10-18 11:44:10-05:00",
        "unique_id": "192a0a45811c2ba5",
        "emp_type": [
            "contract",
            "third party"
        ],
        "tag": ".net developer"
    }
]