[
    {
        "company": "Integrated Technology Strategies, Inc.",
        "job_title": "Project Manager with PMP",
        "location": "Richmond, VA, USA",
        "full_location": {
            "city": "Richmond",
            "state": "VA",
            "country": "USA"
        },
        "job_details": {
            "employment_type": [
                "full-time",
                "third party"
            ],
            "experience_required": "8 years",
            "degree_required": "Bachelor\u2019s degree in computer science, Systems Engineering, Management Information Systems, Project Management or Finance/Business",
            "visa_sponsorship": "Not specified",
            "notice_period": "Not specified",
            "duration": "12 months or more",
            "rate": "Not specified"
        },
        "skills": {
            "core": [
                "PMP Certification",
                "Scaled Agile",
                "Waterfall Project Management",
                "IT infrastructure delivery",
                "Microsoft Office Products"
            ],
            "primary": [
                "VITA Certification",
                "Agile Scrum Master Certification",
                "SAFe\u00ae Scrum Master Certification"
            ],
            "secondary": [],
            "all": [
                "PMP Certification",
                "Scaled Agile",
                "Waterfall Project Management",
                "IT infrastructure delivery",
                "Microsoft Office Products",
                "VITA Certification",
                "Agile Scrum Master Certification",
                "SAFe\u00ae Scrum Master Certification"
            ]
        },
        "job_type": [
            "hybrid"
        ],
        "contact_person": "Goutham",
        "email": "goutham@itstrategiesinc.com",
        "jd": "From: Goutham, Integrated Technology Strategies, Inc. goutham@itstrategiesinc.com Reply to: goutham@itstrategiesinc.com Client is State of VA Agency is VDOT Role PM 4 Work location is Richmond, VA Hybrid RoleInterview is In-PersonStart and End Dates: 10/29/24 To 06/30/25 Short DescriptionVDOT Project Manager - PMP Certified - Hybrid schedule with 3 days in the office at VDOT Richmond VA.Project Manager position will be for 12 months or more. Complete DescriptionPMP CERTIFICATION REQUIRED with experience in Scaled Agile environment, VITA certification is preferred. Virginia Department of Transportation (VDOT) Asset Management Division is seeking a senior technical Project Manager to manage and deliver complex IT Project(s) with multiple teams and work streams coordinated to an aggressive delivery schedule. Project Manager is responsible for the outcome of the assigned projects. The Project Manager leads the team through the Commonwealth Standard for Project Management for successful completion of the project phases:PreselectInitiation PlanningExecution and ControlCloseout. The selected candidate willServe as a hands-on technical project manager with development staff and business groupsCoordinate and communicate with Information Technology Division management and staff to coordinate work staff and resourcing.Communicate timelines and expectations to technical and business staffFacilitate multi-functional technical team collaboration.Collaborate with vendors, consultants, and contractors in the execution of projects, including contract management, and work with procurement office(s).Adhere to VDOT and VITA project management practices and governance requirements.Coordinate with VDOT and VITA project management offices.Maintain project budget, plans, tasks, schedules, risks, and status and disseminate information to team members and customers as defined in the communication plan.Ensure documentation of requirements and use cases, facilitate design workshops for assigned project.Ensure preparation of test objectives, test plans and test cases for assigned project.Provide the management of project milestones and deliverables for on-time and on-budget delivery.Define, measure, and clearly communicate progress with project metrics.Support system and application training efforts. REQUIRED YEARS OF EXPERIENCEExperience managing large MultiStream projects valued at $10M or greater each Required 8Experience in IT infrastructure delivery (Networking, physical plant, vendor management, site provisioning) Required 8PMP Certification RequiredExperience in both Scaled Agile and Waterfall Project Management Required 8VITA Certification Highly desiredAgile Scrum Master Certification DesiredSAFe\u00ae Scrum Master Certification DesiredMicrosoft Office Products (Word, Excel, Access, Outlook, Visio, PowerPoint, Project Server) Required 8Experience managing projects with high visibility and high stakes Required 8Experience managing projects that had to coordinate with at least one external team. Required 8Experience managing a project as part of a larger program and under PMO governance. Required 8Bachelor\u2019s degree in computer science, Systems Engineering, Management Information Systems, Project Management or Finance/Business Required 4",
        "source": "Email",
        "date_posted": "2024-10-15 07:25:52-05:00",
        "unique_id": "1929044ed25a66a4",
        "emp_type": [
            "full-time",
            "third party"
        ],
        "tag": "Project Manager"
    }
]