[
    {
        "company": "KK Software Associates",
        "job_title": "Development product owner",
        "location": "Dallas, TX, USA",
        "full_location": {
            "city": "Dallas",
            "state": "TX",
            "country": "USA"
        },
        "job_details": {
            "employment_type": [
                "third party"
            ],
            "job_code": "",
            "experience_required": "8-10 years",
            "degree_required": "Not specified",
            "visa_sponsorship": "Not specified",
            "notice_period": "Not specified",
            "duration": "Not specified",
            "rate": "Not specified"
        },
        "skills": {
            "core": [
                "Data Concepts & Data Modelling",
                "ORACLE SQL",
                "Agile Specialisation",
                "Insurance Domain"
            ],
            "primary": [
                "Agility",
                "Scrum Ceremonies"
            ],
            "secondary": [
                "SAFe",
                "SQL",
                "Data Model expertise",
                "Agile Scrum Master",
                "Insurance Domain Knowledge"
            ],
            "all": [
                "Data Concepts & Data Modelling",
                "ORACLE SQL",
                "Agile Specialisation",
                "Insurance Domain",
                "Agility",
                "Scrum Ceremonies",
                "SAFe",
                "SQL",
                "Data Model expertise",
                "Agile Scrum Master",
                "Insurance Domain Knowledge"
            ]
        },
        "job_type": [],
        "contact_person": "AJAY, KK",
        "email": "ajay.e@kksoftwareassociates.com",
        "jd": "From: AJAY, KK Software Associates ajay.e@kksoftwareassociates.com Reply to: ajay.e@kksoftwareassociates.com Role name:Scrum MasterRole Description:\u2022 Lead Technical and Functional Project management aspects as a Product Owner\u2022 Coordinate, collaborate, and track with various agile teams to make sure IT implementation happening on time as per Business Model.\u2022 Lead Agility, Scrum CeremoniesCompetencies:Data Concepts & Data Modelling, ORACLE SQL, Agile Specialisation, Insurance DomainExperience (Years):8-10Essential Skills:\u2022 8-10 Years of IT Experience, 2+ Years of experience as Product Owner\u2022 Understand P&C domain Knowledge (Business Perspective, IT Implementation)\u2022 Have an excellent communication and workmanship to manage Functional Teams\u2022 Lead Technical and Functional Project management aspects as a Product Owner\u2022 Strong Experience in Agility, Scrum CeremoniesDesirable Skills:SAFe, SQL, Data Model expertise, Agile Scrum Master, Insurance Domain KnowledgeCountry:United StatesBranch | City | Location:TCS - Dallas, TX~TCS - Dallas, TXSAN ANTONIO~PlanoSan Antonio,TX~Plano, TX Data Concepts & Data Modelling, ORACLE SQL, Agile Specialisation, Insurance Domain",
        "source": "Email",
        "date_posted": "2024-10-15 10:01:49-05:00",
        "unique_id": "19290f05e184ae80",
        "emp_type": [
            "third party"
        ],
        "tag": "Scrum Master"
    }
]