[
    {
        "company": "Convex Tech Inc.",
        "job_title": "Business Analyst",
        "location": "Atlanta, GA, USA",
        "full_location": {
            "city": "Atlanta",
            "state": "GA",
            "country": "USA"
        },
        "job_details": {
            "employment_type": [
                "contract",
                "third party"
            ],
            "job_code": "",
            "experience_required": "Minimum of 3 years",
            "degree_required": "Bachelor's degree in Business Administration, Information Systems, Logistics or similar",
            "visa_sponsorship": "No visa sponsorship",
            "notice_period": "Not specified",
            "duration": "Long Term Contract",
            "rate": "Not specified"
        },
        "skills": {
            "core": [
                "Business Analysis",
                "Agile methodologies",
                "Stakeholder Communication",
                "Business Process Analysis"
            ],
            "primary": [
                "Transportation Management",
                "Logistics Operations",
                "Data Analysis",
                "JIRA",
                "Trello"
            ],
            "secondary": [
                "Scrum",
                "Kanban",
                "API experience"
            ],
            "all": [
                "Business Analysis",
                "Agile methodologies",
                "Stakeholder Communication",
                "Business Process Analysis",
                "Transportation Management",
                "Logistics Operations",
                "Data Analysis",
                "JIRA",
                "Trello",
                "Scrum",
                "Kanban",
                "API experience"
            ],
            "with_experience": [
                "Business Analysis",
                "Agile methodologies"
            ]
        },
        "job_type": [
            "hybrid"
        ],
        "contact_person": "Sanjay Sunar",
        "email": "sanjay@convextech.com",
        "jd": "From: Sanjay Sunar, convextech sanjay@convextech.com Reply to: sanjay@convextech.com Position: Business Analyst Location: Hybrid - Atlanta, GA Duration: Long Term Contract Visa Restrictions: No H1b/CPT Interview: Video/Skype Job Description: Essential Duties and Responsibilities: Collaborate with clients and internal stakeholders to understand their transportation management needs and objectives.Conduct interviews, workshops, and surveys to gather detailed business requirements.Business Process Analysis: Analyze current business processes and workflows related to transportation and logistics.Identify gaps and areas for improvement to enhance efficiency and effectiveness.Agile Documentation: Prepare and maintain user stories, epics, and acceptance criteria in collaboration with stakeholders.Manage and prioritize the product backlog to ensure alignment with business goals.Solution Design: Work closely with the development team to translate business requirements into technical specifications.Assist in designing solutions that align with client needs and industry best practices.Stakeholder Communication: Serve as a liaison between clients, development teams, and other stakeholders.Facilitate Agile ceremonies such as sprint planning, daily stand-ups, sprint reviews, and retrospectives.Testing and Validation: Collaborate with the QA team to develop test plans and ensure features meet acceptance criteria.Coordinate user acceptance testing (UAT) and gather feedback for continuous improvement. Provide insights and recommendations to enhance our software offerings. QUALIFICATIONS AND EXPERIENCE Bachelor's degree in Business Administration, Information Systems, Logistics or similarMinimum of 3 years of experience as a Business Analyst in SW Development environmentIndustry experience in transportation (Truck, Rail and Ocean), logistics, or supply chain industry.Understanding of transportation management processes and logistics operations.Proficiency in Agile methodologies and tools (e.g., JIRA, Trello) and frameworks including Scrum and KanbanExperience with data analysis tools is a plusAPI experience is a plus Thanks and Regards Sanjay SunarUS IT Recruiter |Convex Tech Inc.Email: sanjay@convextech.comLinkedin: https://www.linkedin.com/in/santosh-kumar-sunar-419601178/",
        "source": "Email",
        "date_posted": "2024-10-15 12:09:28-05:00",
        "unique_id": "19291488dad48333",
        "emp_type": [
            "contract",
            "third party"
        ],
        "tag": "Business Analyst"
    }
]