[
    {
        "company": "Softcom Systems Inc",
        "job_title": "Avaya developer with .NET 6.0 framework",
        "location": "Charlotte, NC, USA",
        "full_location": {
            "city": "Charlotte",
            "state": "NC",
            "country": "USA"
        },
        "job_details": {
            "employment_type": [
                "full-time",
                "third party"
            ],
            "job_code": "",
            "experience_required": "6-9 years",
            "degree_required": "Not specified",
            "visa_sponsorship": "Not specified",
            "notice_period": "Not specified",
            "duration": "Long term",
            "rate": "Not specified"
        },
        "skills": {
            "core": [
                "Avaya",
                ".NET",
                "SQL"
            ],
            "primary": [
                ".NET full stack development",
                "Agile",
                "Jira"
            ],
            "secondary": [
                "Telecom",
                "Cable Domain Background",
                "onshore/offshore coordination"
            ],
            "all": [
                "Avaya",
                ".NET",
                "SQL",
                ".NET full stack development",
                "Agile",
                "Jira",
                "Telecom",
                "Cable Domain Background",
                "onshore/offshore coordination"
            ]
        },
        "job_type": [
            "onsite"
        ],
        "contact_person": "Saritha",
        "email": "saritha@softcomsystems.com",
        "jd": "From: saritha, softcom systems inc saritha@softcomsystems.com Reply to: saritha@softcomsystems.com We have below urgent requirements. Please find the below JD and share your interest,Job Title: Avaya developer with .NET 6.0 frameworkLocation: Charlotte, NC 28211Duration: Long termOnsite (Day-1)Must have skills:Software Developer with 6-9 years of experience in contact center Avaya and .Net legacy frameworks.Good in .Net full stack development.Detailed Job Description:6-9 years of IT Experience in contact center and .Net legacy frameworksGood in .Net full stack development.Good in SQL queriesHands-on experience in Avaya Telephony Infrastructure (Avaya Experience Portal)Experience in onshore/offshore coordination leading large onsite + offshore teamsGood understanding of Agile & Jira toolTelecom/Cable Domain Background",
        "source": "Email",
        "date_posted": "2024-10-15 16:31:19-05:00",
        "unique_id": "192923842896a5bd",
        "emp_type": [
            "full-time",
            "third party"
        ],
        "tag": ".net developer"
    }
]