[
    {
        "company": "Virtusa",
        "job_title": "Sr.Java Developer with AWS",
        "location": "New York, NY, USA",
        "full_location": {
            "city": "New York",
            "state": "NY",
            "country": "USA"
        },
        "job_details": {
            "employment_type": [
                "contract",
                "third party"
            ],
            "experience_required": "10+ years",
            "degree_required": "Not specified",
            "visa_sponsorship": "Not specified",
            "notice_period": "Not specified",
            "duration": "6-12+ Months",
            "rate": "Not specified"
        },
        "skills": {
            "core": [
                "Java",
                "J2EE",
                "Spring",
                "Microservice",
                "Webservices",
                "PL/SQL"
            ],
            "primary": [
                "Agile software development",
                "Object-Oriented Analysis",
                "Object Oriented Design",
                "GIT",
                "Jenkins",
                "MVC",
                "Java Design Patterns",
                "JUnit",
                "Oracle",
                "SQL Server",
                "SQL",
                "SOAP",
                "REST",
                "IntelliJ",
                "Maven",
                "Tomcat"
            ],
            "secondary": [
                "Collaboration",
                "Business processes",
                "Software improvement"
            ],
            "all": [
                "Java",
                "J2EE",
                "Spring",
                "Microservice",
                "Webservices",
                "PL/SQL",
                "Agile software development",
                "Object-Oriented Analysis",
                "Object Oriented Design",
                "GIT",
                "Jenkins",
                "MVC",
                "Java Design Patterns",
                "JUnit",
                "Oracle",
                "SQL Server",
                "SQL",
                "SOAP",
                "REST",
                "IntelliJ",
                "Maven",
                "Tomcat",
                "Collaboration",
                "Business processes",
                "Software improvement"
            ]
        },
        "job_type": [
            "hybrid"
        ],
        "contact_person": "Imran",
        "email": "imran@fwdatatech.com",
        "jd": "From: imran, Fwdatatech imran@fwdatatech.com Reply to: imran@fwdatatech.com Role: Sr Java with AWS 10+Years Locals Location: NYC,NY,NJ and Wilmington DE (Hybrid) only locals needed local ID proof must Client : Virtusa(dont share already submitted profiles Mode : Contract 6-12+MonthsExperince level : 10+Years Job Description :Experience in Agile software development methodology and practices with full development lifecycle from inception through implementation.Required: Java, J2EE, Spring, Microservice, Webservices, PL/SQLWorking knowledge of Object-Oriented Analysis/Object Oriented Design methodologies and life cycles.Demonstrated experience with SCM tools such as GIT, JenkinsExperience with application development on Java, J2EE, Spring, and MVC, Java Design Patterns and JUnit.Knowledge of Relational Databases like Oracle/SQL Server, SQLKnowledge of Web service technologies including SOAP/REST.Strong working knowledge of IntelliJ, Maven and Tomcat.Ability to work collaboratively in teams and develop meaningful relationships to achieve common goalsKnowledge of architecture, design and business processesProficiency in modern programming languagesExperience in design and build of complex application systems using the new banking architecture including Java/J2EE/Spring technologies. Proficiency in one or more general purpose programming languages including Java/J2EE/JSP based Web applications/Middleware and Batch systems.Experience in design, analysis, development, coding, unit testing, debug and documentation for Java/J2EE systems including Web applications, business services, batch applications, large/complex projects and utilizing Web Services and Java RMI technologies to improve interface/API and significantly enhance integration capability between front-end and back-end systemsA fundamental understanding of software skills and the different components of SDLC such as business analysis, development, and maintenance and software improvement is essential",
        "source": "Email",
        "date_posted": "2024-10-15 11:17:11-05:00",
        "unique_id": "1929118ac732e70b",
        "emp_type": [
            "contract",
            "third party"
        ],
        "tag": "Java developer"
    }
]