[
    {
        "company": "KK Software Associates",
        "job_title": "Azure Data & Analytics Solution Architect",
        "location": "Wilmington, DE, USA",
        "full_location": {
            "city": "Wilmington",
            "state": "DE",
            "country": "USA"
        },
        "job_details": {
            "employment_type": [
                "contract",
                "third party"
            ],
            "experience_required": "10 years",
            "degree_required": "Not specified",
            "visa_sponsorship": "Not specified",
            "notice_period": "Not specified",
            "duration": "Not specified",
            "rate": "Not specified"
        },
        "skills": {
            "core": [
                "Azure Data Lake Implementation",
                "ETL",
                "data modeling",
                "data warehouse architecture",
                "Informatica",
                "Power BI",
                "Tableau",
                "Azure Data Factory",
                "Azure Synapse",
                "Azure Data Lake Storage",
                "Azure Analysis Service",
                "DataBricks",
                "PySpark",
                "DeltaLake"
            ],
            "primary": [
                "communication",
                "presentation",
                "interpersonal skills"
            ],
            "secondary": [
                "SAP",
                "SAP BW",
                "SAP HANA"
            ],
            "all": [
                "Azure Data Lake Implementation",
                "ETL",
                "data modeling",
                "data warehouse architecture",
                "Informatica",
                "Power BI",
                "Tableau",
                "Azure Data Factory",
                "Azure Synapse",
                "Azure Data Lake Storage",
                "Azure Analysis Service",
                "DataBricks",
                "PySpark",
                "DeltaLake",
                "communication",
                "presentation",
                "interpersonal skills",
                "SAP",
                "SAP BW",
                "SAP HANA"
            ]
        },
        "job_type": [
            "onsite"
        ],
        "contact_person": "AJAY, KK",
        "email": "ajay.e@kksoftwareassociates.com",
        "jd": "From: AJAY, KK Software Associates ajay.e@kksoftwareassociates.com Reply to: ajay.e@kksoftwareassociates.com Role name:Platform ArchitectRole Description:\u2022 Conduct workshops with customer\u2019s business and IT teams and capture, document and summarize the business requirements.\u2022 Prioritize business use cases and define implementation roadmap.\u2022 Provide solutions for a variety of Data and Analytics requirements from customers, such as Greenfield EDW, Data Lake Implementation, Data Estate Modernization, Tools / Technology comparison and selection, etc.\u2022 Create Architecture and high-level design for data & analytics solutions.\u2022 Provide effort estimates for large EDW / Data Lake implementations.\u2022 Guide technical team of deliverables and get the solution implemented.\u2022 Conduct proof of concepts and create differentiating assets.\u2022 Conduct trainings and workshops on new technologies and trends.Competencies:Digital : Microsoft AzureExperience (Years):10 & AboveEssential Skills:\u2022 15+ years of overall experience in architecting and building data and analytics solutions, including atleast one Azure Data Lake Implementation\u2022 Deep understanding of ETL, reporting, data modeling concepts and data warehouse architecture\u2022 Experienced in analysis, design, data modelling and effort estimation.\u2022 Hands on experience of working in ETL tools like Informatica, etc. and reporting tools like Power BI, Tableau.\u2022 Experience in working with SAP, SAP BW, SAP HANA as sources and data extraction from SAP sources to EDW/Azure.\u2022 Deep understanding of Azure cloud components like Azure Data Factory, Azure Synapse (SQL Data Warehouse), Azure Data Lake Storage (ADLS) and Azure Analysis Service (AAS), DataBricks\u2022 Hands on experience of working with ADLS, ADF, DataBricks, PySpark, DeltaLake.\u2022 Excellent communication, presentation, and interpersonal skills\u2022 Experienced in working in a customer facing role Branch | City | Location:TCS - Philadelphia, PAWilmingtonWilmington, DE",
        "source": "Email",
        "date_posted": "2024-10-15 11:04:56-05:00",
        "unique_id": "192910d76280216d",
        "emp_type": [
            "contract",
            "third party"
        ],
        "tag": "Azure Data Engineer"
    }
]