[
    {
        "company": "ITECS",
        "job_title": "Java Developer with Golang",
        "location": "Phoenix, AZ, USA",
        "full_location": {
            "city": "Phoenix",
            "state": "AZ",
            "country": "USA"
        },
        "job_details": {
            "employment_type": [
                "third party"
            ],
            "job_code": "",
            "experience_required": "4+ years",
            "degree_required": "Not specified",
            "visa_sponsorship": "Not specified",
            "notice_period": "Not specified",
            "duration": "Not specified",
            "rate": "$_____/-Hrly-C2C"
        },
        "skills": {
            "core": [
                "Java",
                "Golang",
                "API programming"
            ],
            "primary": [
                "Kafka",
                "CI/CD",
                "Amex experience"
            ],
            "secondary": [
                "Communication Skills"
            ],
            "all": [
                "Java",
                "Golang",
                "API programming",
                "Kafka",
                "CI/CD",
                "Amex experience",
                "Communication Skills"
            ]
        },
        "job_type": [
            "onsite"
        ],
        "contact_person": "Pam",
        "email": "pam@itecsus.com",
        "jd": "From: Pam, ITECS pam@itecsus.com Reply to: pam@itecsus.com Java Developer with GolangStart date \u2013 11/04Location - Phoenix, AZ Onshore Java GO-Lang Hands on Engineer - 1Solid hands on Java & GOlang coding experience.4+ years of working experience, excluding MastersStrong backend API programming experience in JavaCoding experience and knowledge in GolangKafka, CI/CD experienceAmex experience on Java / one Data is highly preferredPreferred \u2013 HCAM onshore B7 Full Name Contact Phone No. E-mail Skype ID Linkdin ID Current Location Relocation Availability Rate$_____/-Hrly-C2CVisa Status Communication Skills out of 10 Last Four Digit of Social Validity of Visa DOB Education/University Year of Graduation REFERENCES FROM YOUR CURRENT OR PREVIOUS EMPLOYER:Reference #1Name: Job Title: Company:Phone:E-mail:Reference #2Name:Job Title: Company:Phone:E-mail: Thanks N' Regards,PAMIT & EBusiness Consulting Services Inc. Ph: (516) 515-7931 Fax: 866 515 6599 Email: Pam@itecsus.com Linkedin: https://www.linkedin.com/in/pam-itecs-b5758ab2/ Note: HEADPHONES, AIRPODS, EARPODS etc, will not be allowed during interview, kindly attend the interview using Laptop's microphone only.",
        "source": "Email",
        "date_posted": "2024-10-15 13:31:23-05:00",
        "unique_id": "192920daab289067",
        "emp_type": [
            "third party"
        ],
        "tag": "Java developer"
    }
]