[
    {
        "company": "TechRooted",
        "job_title": "Senior Business Analyst",
        "location": "Irving, TX, USA",
        "full_location": {
            "city": "Irving",
            "state": "TX",
            "country": "USA"
        },
        "job_details": {
            "employment_type": [
                "full-time",
                "third party"
            ],
            "experience_required": "8+ years",
            "degree_required": "Not specified",
            "visa_sponsorship": "Not specified",
            "notice_period": "Not specified",
            "duration": "6+ months",
            "rate": "Not specified"
        },
        "skills": {
            "core": [
                "analytical skills",
                "problem-solving skills",
                "data migration",
                "technical integration"
            ],
            "primary": [
                "stakeholder management",
                "leadership communication",
                "Agile methodologies"
            ],
            "secondary": [
                "retail experience",
                "store platform conversions"
            ],
            "all": [
                "analytical skills",
                "problem-solving skills",
                "data migration",
                "technical integration",
                "stakeholder management",
                "leadership communication",
                "Agile methodologies",
                "retail experience",
                "store platform conversions"
            ]
        },
        "job_type": [
            "onsite"
        ],
        "contact_person": "Zaman Wasi",
        "email": "zaman@techrooted.com",
        "jd": "Hello,I am hiring a consultant for one of my client's requirement. Job Description for the same is written below. If you find yourself comfortable with the requirement please reply back with your updated resume. Job Title Senior Business AnalystDuration 6+ monthsLocation Irving, TX - Onsite 5 days a weekUSC/GCNEED LOCALS NEED TO GO ONSITE FOR INTERVIEW RETAIL CLIENT EXP - MUSTNEED DOB ( MM/DD)NEED SSN ( LAST 4 DIGITS ) Job Summary:We are seeking an experienced Store Conversion - Sr Data and Application Analyst to help ensure the stability of production environments and support stores converted to the latest store platform. The ideal candidate will possess exceptional analytical and problem-solving skills, with a proven track record of resolving complex technical challenges. Requirements:8+ years of experience in related fields.Proven experience leading global teams and managing complex technical projects.Excellent analytical, problem-solving, and communication skills.Strong understanding of data migration and technical integration processes.Ability to work in a fast-paced environment and adapt to changing priorities.Effective stakeholder management and leadership communication skills.Preferred Qualifications:Experience with retail or store platform conversions. Familiarity with Agile methodologies Regards Zaman WasiSr. Technical RecruiterE: zaman@techrooted.comTechRooted.14 Wall Street 20th Floor | New York, NY 10005www.techrooted.com/",
        "source": "Email",
        "date_posted": "2024-10-15 12:10:40-05:00",
        "unique_id": "1929149a251a2a46",
        "emp_type": [
            "full-time",
            "third party"
        ],
        "tag": "Business Analyst"
    }
]