[
    {
        "company": "Synkriom",
        "job_title": "Pega Developer",
        "location": "Tampa, FL, USA",
        "full_location": {
            "city": "Tampa",
            "state": "FL",
            "country": "USA"
        },
        "job_details": {
            "employment_type": [
                "third party"
            ],
            "job_code": "",
            "experience_required": "5+ years",
            "degree_required": "Not specified",
            "visa_sponsorship": "Not specified",
            "notice_period": "Not specified",
            "duration": "Not specified",
            "rate": "Not specified"
        },
        "skills": {
            "core": [
                "Pega v8+ development",
                "Pega PRPC",
                "Pega BPM",
                "Java",
                "SQL",
                "REST",
                "SOAP"
            ],
            "primary": [
                "Pega rules",
                "data model",
                "application architecture",
                "Agile development methodologies"
            ],
            "secondary": [
                "Pega frameworks",
                "Customer Service",
                "Smart Dispute",
                "problem-solving",
                "attention to detail",
                "communication",
                "collaboration"
            ],
            "all": [
                "Pega v8+ development",
                "Pega PRPC",
                "Pega BPM",
                "Java",
                "SQL",
                "REST",
                "SOAP",
                "Pega rules",
                "data model",
                "application architecture",
                "Agile development methodologies",
                "Pega frameworks",
                "Customer Service",
                "Smart Dispute",
                "problem-solving",
                "attention to detail",
                "communication",
                "collaboration"
            ]
        },
        "job_type": [
            "onsite"
        ],
        "contact_person": "Shivendra",
        "email": "shivendra.singh@synkriom.com",
        "jd": "From: Shivendra, Synkriom shivendra.singh@synkriom.com Reply to: shivendra.singh@synkriom.com Title: Pega DeveloperLocation: Tampa, FL (Day 1 Onsite) Local only Passport is mandatory Description:5+ years Pega v8+ development experienceStrong individual contributorSelf-starter, can manage their work with minimal hand-holdingProven experience in Pega development, including Pega PRPC and Pega BPM.Strong understanding of Pega rules, data model, and application architecture.experience with Pega frameworks (e.g., Customer Service, Smart Dispute) is a plus.Proficient in Java, SQL, and web services (REST/SOAP).Familiarity with Agile development methodologies.Excellent problem-solving skills and attention to detail.Strong communication and collaboration skills.",
        "source": "Email",
        "date_posted": "2024-10-15 10:01:15-05:00",
        "unique_id": "19290d39af0e3585",
        "emp_type": [
            "third party"
        ],
        "tag": "PEGA Developer"
    }
]