[
    {
        "company": "Pivotal Technologies, Inc",
        "job_title": "Full-Stack Java Developer",
        "location": "New York, NY, USA",
        "full_location": {
            "city": "New York",
            "state": "NY",
            "country": "USA"
        },
        "job_details": {
            "employment_type": [
                "full-time",
                "third party"
            ],
            "experience_required": "4+ years",
            "degree_required": "Not specified",
            "visa_sponsorship": "Must have existing work authorization",
            "notice_period": "Not specified",
            "duration": "Not specified",
            "rate": "Not specified"
        },
        "skills": {
            "core": [
                "Angular",
                "Java",
                "MongoDB",
                "REST APIs",
                "HTML5"
            ],
            "primary": [
                "JavaScript",
                "CSS",
                "Spring Boot",
                "Open API",
                "Responsive designs"
            ],
            "secondary": [
                "Python",
                "BDD testing",
                "Cloud-native development",
                "Docker",
                "Kubernetes",
                "Micro services",
                "GitHub",
                "Jira",
                "Confluence",
                "Jenkins"
            ],
            "all": [
                "Angular",
                "Java",
                "MongoDB",
                "REST APIs",
                "HTML5",
                "JavaScript",
                "CSS",
                "Spring Boot",
                "Open API",
                "Responsive designs",
                "Python",
                "BDD testing",
                "Cloud-native development",
                "Docker",
                "Kubernetes",
                "Micro services",
                "GitHub",
                "Jira",
                "Confluence",
                "Jenkins"
            ],
            "with_experience": [
                "Angular (4+ years)",
                "Java (4+ years)",
                "REST APIs (Spring Boot 2.0)",
                "MongoDB"
            ]
        },
        "job_type": [
            "onsite"
        ],
        "contact_person": "Rajesh Kumar",
        "email": "rajesh.kumar@pivotal-technologies.com",
        "jd": "From: Rajesh Kumar, Pivotal Technologies, Inc rajesh.kumar@pivotal-technologies.com Reply to: rajesh.kumar@pivotal-technologies.com Position: Full-Stack Java DeveloperLocation: Seventh Ave- NYVisa: US citizens, Green Card , H4-EAD or OPT-EADMOI: Onsite Interview Only local candidates to NJ, NYC It is 50% front end with Angular, JavaScript, CSS, HTML5 and backend Java and MongoDB (or any other database programming); FULL-STACK DEVELOPER Backend and Angular/HTM5, JavaScript, CSS front-end UISite-USA | NY | New York | 750 Seventh Ave- NY 1st Round interviews through zoom2nd Round interviews onsiteCandidates who cannot come onsite for an interview will not be considered.Full-stackHybrid 3 days a week onsitePotential to ConvertThe Team:The Investment Banking and Global Capital Markets Technology is a globally distributed but close-knit team based in NY, LN, Mumbai, Bengaluru and Pune. We are a highly innovative team that works in small groups that learn, grow, and succeed together. We follow Agile development practices to deliver high quality solutions that delight our customers. As a member of the team, you will interact with others who are genuine and want you to succeed. Your talent, experience, and voice are valued and will make a difference.What you will do:Build time critical and revenue generating applications for investment banking and global capital marketing businessesCollaborate with your peers across the globe to build innovative user experiences which delight our usersUse design thinking to improve developer efficiencyApply your knowledge of APIs, components, security standards, testing tools, web browsers, mobile development, etc. to deliver outstanding outcomesWork closely with Product Management Team, UX, Development & QA Teams to deliver timely and quality deliveries.Successfully multi-task and thrive in a dynamic, fully engaged full-stack developer role.Skills Required:Full stack developer with Angular Web (HTML5/Angular 4+ years) UI and Strong Java skills.Understanding of functional and reactive programming in JavaExperience in developing REST APIs using Spring Boot 2.0 (reactive) and skilled in Open API (swagger) specification. UI Technologies - HTML5/Angular 2+ or other similar JavaScript based UI frameworksKnowledge of JavaScript, HTML, CSS, and Responsive designsExperience with MongoDB or other databasesExperience with unit testing of frontend componentsKnowledge of (and a passion for) current trends and best practices in architecture, including performance, accessibility, security, and usability.Excellent analytical & communication skillsNice to have:Scripting languages such as pythonExperience with BDD testing and toolsCloud-native development experience (Docker, Kubernetes, containerization, orchestration)Experience with distributed systems architecture concepts such as micro services and micro frontendsExperience with software development and collaboration tools (GitHub, Jira/Rally, Confluence, etc.)Experience in using GIT for source control management, and Automated Build Deployment tools (eg: Jenkins)Open source or other community contribution",
        "source": "Email",
        "date_posted": "2024-10-15 15:45:34-05:00",
        "unique_id": "192920e657758007",
        "emp_type": [
            "full-time",
            "third party"
        ],
        "tag": "Java developer"
    }
]