[
    {
        "company": "Vyzeinc",
        "job_title": "Business Analyst",
        "location": "Brooklyn Center, MN, USA",
        "full_location": {
            "city": "Brooklyn Center",
            "state": "MN",
            "country": "USA"
        },
        "job_details": {
            "employment_type": [
                "contract",
                "third party"
            ],
            "job_code": "",
            "experience_required": "3+ years",
            "degree_required": "Bachelor\u2019s Degree from a four-year college or university is required, practical experience in lieu of education is acceptable.",
            "visa_sponsorship": "Not specified",
            "notice_period": "Not specified",
            "duration": "6+ mo. Contract-to-hire",
            "rate": "Not specified"
        },
        "skills": {
            "core": [
                "business systems analysis",
                "communication",
                "interpersonal skills",
                "analytical skills",
                "ERP and CRM application systems experience"
            ],
            "primary": [
                "Scrum",
                "Agile methodologies",
                "basic SQL statements",
                "project management"
            ],
            "secondary": [
                "software integration initiatives",
                "MS operating systems and applications"
            ],
            "all": [
                "business systems analysis",
                "communication",
                "interpersonal skills",
                "analytical skills",
                "ERP and CRM application systems experience",
                "Scrum",
                "Agile methodologies",
                "basic SQL statements",
                "project management",
                "software integration initiatives",
                "MS operating systems and applications"
            ]
        },
        "job_type": [
            "hybrid"
        ],
        "contact_person": "Vyzeinc",
        "email": "sharma@vyzeinc.com",
        "jd": "From: Santosh, Vyzeinc ssharma@vyzeinc.com Reply to: ssharma@vyzeinc.com Job Description -Domain: ManufacturingTitle: Business AnalystDuration: 6+ mo. Contract-to-hire (GC or USC only)Location: Hybrid in Brooklyn Center, MN- primarily remote, but must work onsite every other Tuesday in addition to \u201cas needed\u201d to have discussions with other employees. MUST be local to MN and able to interview in-person to be considered.Job Summary: The Business Analyst will focus on understanding, organizing, prioritizing, and assessing work for the development team based on the needs of the company. This role is responsible for the analysis, requirements gathering, design, end user interaction, acceptance criteria definition, facilitating, and product releases on 3rd party vendor solutions, integrations, and existing applications. The Business Analyst will also serve as liaison between business stakeholders, IT staff, and offshore IT contractors supporting and improving our systems and applications. The Business Analyst will be facilitating and participating in cross functional teams, both onshore and offshore, in all phases of the development lifecycle, addressing software applications, workflows, data flows, mockups, and systems. Essential Functions:Essential functions as defined are ILLUSTRATIVE ONLY and not a comprehensive listing of all functions and duties performed by incumbents within this classification. To perform this job successfully, an individual must be able to perform each essential duty satisfactorily. The requirements listed below are representative of the knowledge, skill, and/or ability required. Reasonable accommodations may be made to enable individuals with disabilities to perform the essential functions of this position. Essential duties and responsibilities may include, but are not limited to, the following:Ability to communicate with and document 3rd party application requirements.Drive and facilitate the 3rd party application partner, product development team, with the proven ability to provide high level requirement documentation, functional requirements, workflow diagrams, user stories, and data mappings.Responsible for meeting with internal stakeholders to gain thorough understanding of current business process and define problem statements to effectively provide business context to the development team.Define, develop, and ensure functional requirements and acceptance criteria are ready for development to start work.Responsible for validating requirement functionality meets the acceptance criteria and definition of done.Ability to drive a variety of project types including but not limited to 3rd party software implementation, integrations, and hardware/software solutions.Ability to query and track transactional data through integrated systems.Assist in gaining buy-in from stakeholders on decisions regarding product functionality and process.Responsible for creating, maintaining, and prioritizing the list of backlog items, based on the overall strategy and business objectives. Work with business stakeholders and 3rd party application partner to ensure the product backlog has visibility, transparency, and clear understanding of functionality and timing.Ensures close collaboration with the development team, when applicable.Facilitate in daily standups, sprint meetings and retrospectives.Being a member of the team, you\u2019ll help drive the projects\u2019 success by completing it on time, within budget, meeting team members\u2019 expectations and meeting the projects\u2019 goals.Bachelor\u2019s Degree from a four-year college or university is required, practical experience in lieu of education is acceptable. 3+ years of business systems analysis experience.Strong communication, interpersonal and analytical skills.ERP and CRM application systems experience. Previous Scrum Experience preferred.Prior experience with Agile methodologies preferred. Ability to understand and build basic SQL statements.Project Management skills nice to have.Prior experience with software integration initiatives nice to have.Working knowledge of MS operating systems and applications.Ability to work in dynamic environment.Skills/Experience RequiredTravel may be required up to 10% for training or conferences",
        "source": "Email",
        "date_posted": "2024-10-15 10:36:20-05:00",
        "unique_id": "19290f53f4fb3f86",
        "emp_type": [
            "contract",
            "third party"
        ],
        "tag": "Business Analyst"
    }
]