[
    {
        "company": "Intellicept",
        "job_title": "Business Analyst - Data Warehouse",
        "location": "Austin, TX, USA",
        "full_location": {
            "city": "Austin",
            "state": "TX",
            "country": "USA"
        },
        "job_details": {
            "employment_type": [
                "full-time",
                "third party"
            ],
            "job_code": "",
            "experience_required": "12+ years",
            "degree_required": "Not specified",
            "visa_sponsorship": "Not specified",
            "notice_period": "Not specified",
            "duration": "Not specified",
            "rate": "Not specified"
        },
        "skills": {
            "core": [
                "Business Analyst experience",
                "SQL experience",
                "System Reporting (Oracle, SQL) experience",
                "Systems Testing (Unit, Integration, UAT) experience",
                "Agile Software Development Methodologies experience"
            ],
            "primary": [
                "Experience with data warehouse applications and/or database reporting features",
                "Experience Project and/or Product Management",
                "Jira experience"
            ],
            "secondary": [],
            "all": [
                "Business Analyst experience",
                "SQL experience",
                "System Reporting (Oracle, SQL) experience",
                "Systems Testing (Unit, Integration, UAT) experience",
                "Agile Software Development Methodologies experience",
                "Experience with data warehouse applications and/or database reporting features",
                "Experience Project and/or Product Management",
                "Jira experience"
            ]
        },
        "job_type": [
            "remote"
        ],
        "contact_person": "Simran Agrawal",
        "email": "sagarwal@intellicept.com",
        "jd": "From: Simran Agrawal, Intellicept sagarwal@intellicept.com Reply to: sagarwal@intellicept.com Business Analyst - Data Warehouse ( Minimum 12+ Years Must ) Location: Austin TexasThis is Remote in Texas ONLY Exp: Minimum 12+ Years MustNote : Candidates Must Previously Worked with Department of State Health Services (DSHS) or Any State Health and Human Services Projects - At least 3+ YearsServices are expected to start 11/25/2024Minimum Requirements:Business Analyst experienceSQL experienceSystem Reporting (Oracle, SQL) experienceSystems Testing (Unit, Integration, UAT) experienceAgile Software Development Methodologies experienceExperience with data warehouse applications and/or database reporting featuresExperience Project and/or Product ManagementJira experience",
        "source": "Email",
        "date_posted": "2024-10-15 16:45:00-05:00",
        "unique_id": "192928faf0bf7c39",
        "emp_type": [
            "full-time",
            "third party"
        ],
        "tag": "Business Analyst"
    }
]