[
    {
        "company": "Tek inspiration LLC",
        "job_title": "ServiceNow Project Manager",
        "location": "Sacramento, CA, USA",
        "full_location": {
            "city": "Sacramento",
            "state": "CA",
            "country": "USA"
        },
        "job_details": {
            "employment_type": [
                "contract",
                "third party"
            ],
            "job_code": "",
            "experience_required": "Minimum 4 years",
            "degree_required": "Bachelor's degree in IT, Computer Science, Business Administration, or related field",
            "visa_sponsorship": "Not specified",
            "notice_period": "Not specified",
            "duration": "6 Months",
            "rate": "$60/hour"
        },
        "skills": {
            "core": [
                "ServiceNow",
                "IT project management",
                "Agile project management",
                "Leadership",
                "Communication"
            ],
            "primary": [
                "Problem-solving",
                "Budget tracking",
                "Risk management",
                "ITIL practices"
            ],
            "secondary": [
                "ServiceNow certification(s)",
                "Collaboration",
                "Project post-mortems"
            ],
            "all": [
                "ServiceNow",
                "IT project management",
                "Agile project management",
                "Leadership",
                "Communication",
                "Problem-solving",
                "Budget tracking",
                "Risk management",
                "ITIL practices",
                "ServiceNow certification(s)",
                "Collaboration",
                "Project post-mortems"
            ]
        },
        "job_type": [
            "hybrid"
        ],
        "contact_person": "Akiv Khan",
        "email": "akiv.khan@tekinspirations.com",
        "jd": "From: Akiv Khan, Tek inspiration LLC akiv.khan@tekinspirations.com Reply to: akiv.khan@tekinspirations.com Job Description -Title: ServiceNow Project ManagerDuration: 6 Monthslocation: Sacramento, California (hybrid)Sacramento, California based clientVisa: GC/USC Target Rate \u2013 60/hr on C2CCandidate must have LinkedIn and must be local to CA. We are seeking a ServiceNow Project Manager for a hybrid role with our Sacramento, California based client. This position requires 2 days/week on-site as directed by the client.Responsibilities include:\u2022 Lead and manage ServiceNow projects from initiation to completion, ensuring all objectives are met within budget and on schedule\u2022 Collaborate with cross-functional teams, including developers, analysts, and client stakeholders, to define project scope, goals, deliverables, and timelines\u2022 Develop and maintain project plans, resource scheduling, budget tracking, and risk management strategies\u2022 Communicate effectively with clients to understand their requirements and expectations, and provide timely updates on project progress\u2022 Ensure project quality and compliance with ServiceNow best practices and standards\u2022 Identify and resolve project issues and risks, and escalate as needed to ensure project success\u2022 Conduct project post-mortems and identify areas for improvement for future projectsRequirements:\u2022 Bachelor's degree in IT, Computer Science, Business Administration, or related field\u2022 Minimum 4 years of experience in IT project management, specifically with ServiceNow projects\u2022 ServiceNow certification(s) preferred\u2022 Strong leadership, communication, and problem-solving skills\u2022 Proven ability to manage multiple projects concurrently and meet deadlines\u2022 Experience in Agile project management methodologies\u2022 Knowledge of ITIL practices and principles",
        "source": "Email",
        "date_posted": "2024-10-15 13:41:46-05:00",
        "unique_id": "1929204966552de2",
        "emp_type": [
            "contract",
            "third party"
        ],
        "tag": "Project Manager"
    }
]