[
    {
        "company": "Sonitalentcorp",
        "job_title": "Sr Business Analyst",
        "location": "USA",
        "full_location": {
            "city": "",
            "state": "",
            "country": "USA"
        },
        "job_details": {
            "employment_type": [
                "contract",
                "third party"
            ],
            "job_code": "",
            "experience_required": "Not specified",
            "degree_required": "Not specified",
            "visa_sponsorship": "Visa sponsorship available",
            "notice_period": "Not specified",
            "duration": "6+ month contract",
            "rate": "Not specified"
        },
        "skills": {
            "core": [
                "Documentation skills",
                "Data management",
                "HEDIS/Stars measures",
                "System/data architecture",
                "Process/data flows"
            ],
            "primary": [
                "Written communication skills",
                "Teams",
                "Visio",
                "GitHub"
            ],
            "secondary": [
                "Root Cause Analysis",
                "Communication across teams"
            ],
            "all": [
                "Documentation skills",
                "Data management",
                "HEDIS/Stars measures",
                "System/data architecture",
                "Process/data flows",
                "Written communication skills",
                "Teams",
                "Visio",
                "GitHub",
                "Root Cause Analysis",
                "Communication across teams"
            ]
        },
        "job_type": [
            "remote"
        ],
        "contact_person": "Uttam Barman",
        "email": "uttam.barman@sonitalentcorp.com",
        "jd": "From: UTTAM BARMAN, SONITALENTCORP uttam.barman@sonitalentcorp.com Reply to: uttam.barman@sonitalentcorp.com Role Title: Sr Business Analyst- 2 openingsWork Location: RemoteDuration: 6+ month contractVisa: USC, GC, H4-EAD Note: Need 5 Digit SSN with LinkedIn. Also Need Visa copy while holding in hand. Description:* Documentation and written communication skills using Teams, Visio, GitHub, etc.* Knowledge of data management and HEDIS/Stars measures* Ability to document system/data architecture and process/data flows* Ability to work creatively and flexibly, both independently and as part of a team Tasks Requirements documentation and interpretation from end users and analytic teams * Documentation for data architecture and key processes, Root Cause Analysis, Communication across teams LinkedIn: https://www.linkedin.com/in/uttam-barman-b494b1254/Email: uttam.barman@sonitalentcorp.comContact: 8599464061",
        "source": "Email",
        "date_posted": "2024-10-15 09:29:35-05:00",
        "unique_id": "19290e8c517d4aa7",
        "emp_type": [
            "contract",
            "third party"
        ],
        "tag": "Business Analyst"
    }
]