[
    {
        "company": "Tekgence",
        "job_title": "GCP Data Engineer",
        "location": "Phoenix, AZ, USA",
        "full_location": {
            "city": "Phoenix",
            "state": "AZ",
            "country": "USA"
        },
        "job_details": {
            "employment_type": [
                "full-time",
                "third party"
            ],
            "job_code": "",
            "experience_required": "Not specified",
            "degree_required": "Not specified",
            "visa_sponsorship": "Not specified",
            "notice_period": "Not specified",
            "duration": "Long term",
            "rate": "Not specified"
        },
        "skills": {
            "core": [
                "Data Engineering",
                "GCP",
                "Python",
                "Java",
                "SQL"
            ],
            "primary": [
                "Data modeling",
                "ETL processes",
                "Data warehousing",
                "GCP services",
                "Data governance",
                "Security best practices"
            ],
            "secondary": [],
            "all": [
                "Data Engineering",
                "GCP",
                "Python",
                "Java",
                "SQL",
                "Data modeling",
                "ETL processes",
                "Data warehousing",
                "GCP services",
                "Data governance",
                "Security best practices"
            ]
        },
        "job_type": [
            "onsite"
        ],
        "contact_person": "Prashanth B",
        "email": "prashanth.b@tekgence.com",
        "jd": "From: Prashanth B, Tekgence prashanth.b@tekgence.com Reply to: prashanth.b@tekgence.com Title: GCP Data Engineer Location: Phoenix, AZ Duration: Long term Need locals who can go F2F Required:Strong experience as a Data Engineer with GCPStrong programming skills in Python, Java, or SQL.Familiarity with data modeling, ETL processes, and data warehousing concepts.Experience with GCP services.Understanding of data governance and security best practices. --Regards,Prashanth B | Tekgence Inc.Talent Acquisition Specialist Email: prashanth.b@tekgence.com | Website: www.tekgence.com6655 Deseo Dr \u2022 Suite 104 \u2022 Irving, TX \u2022 75039",
        "source": "Email",
        "date_posted": "2024-10-15 10:43:37-05:00",
        "unique_id": "1929134d91c82121",
        "emp_type": [
            "full-time",
            "third party"
        ],
        "tag": "GCP Data Engineer"
    }
]