[
    {
        "company": "Tekgence",
        "job_title": "Azure Data Engineer",
        "location": "Chicago, IL, USA",
        "full_location": {
            "city": "Chicago",
            "state": "IL",
            "country": "USA"
        },
        "job_details": {
            "employment_type": [
                "full-time",
                "third party"
            ],
            "experience_required": "10+ years",
            "degree_required": "Not specified",
            "visa_sponsorship": "Not specified",
            "notice_period": "Not specified",
            "duration": "Long term",
            "rate": "Not specified"
        },
        "skills": {
            "core": [
                "Azure Data Engineer",
                "Data Warehousing",
                "SQL",
                "DataStage",
                "Data Modeling"
            ],
            "primary": [
                "Azure platform",
                "PowerBI",
                "Python",
                "Spark",
                "Airflow",
                "Kafka",
                "CDC tools",
                "Data Governance",
                "Collibra",
                "NoSQL technologies"
            ],
            "secondary": [
                "Financial industry experience",
                "Continuous integration tools",
                "Azure ADO",
                "GitHub",
                "Confluence"
            ],
            "all": [
                "Azure Data Engineer",
                "Data Warehousing",
                "SQL",
                "DataStage",
                "Data Modeling",
                "Azure platform",
                "PowerBI",
                "Python",
                "Spark",
                "Airflow",
                "Kafka",
                "CDC tools",
                "Data Governance",
                "Collibra",
                "NoSQL technologies",
                "Financial industry experience",
                "Continuous integration tools",
                "Azure ADO",
                "GitHub",
                "Confluence"
            ],
            "with_experience": [
                "Azure platform",
                "Data Warehousing",
                "SQL",
                "DataStage",
                "Data Modeling",
                "PowerBI"
            ]
        },
        "job_type": [
            "onsite"
        ],
        "contact_person": "Prashanth B",
        "email": "prashanth.b@tekgence.com",
        "jd": "From: Prashanth B, Tekgence prashanth.b@tekgence.com Reply to: prashanth.b@tekgence.com Title: Azure Data EngineerLocation: Chicago, IL (Need locals)Duration: Long term Required Skills\u2022 10+ years of experience building data platforms & application architectures.\u2022 Proven experience building & deploying data warehouses with Azure platform is required with AL/ML capabilities.\u2022 Azure certification is desirable.Azure Data Engineer with Datastage Experience\u2022 Strong hands-on expertise in database & query performance tuning SQL queries and database best practices with PowerBI Dashboard Exp.\u2022 Full understanding of ETL IBM DataStage concepts and Data Warehousing concepts\u2022 Strong experience with modern data engineering technologies such as python, Spark, Airflow.\u2022 You have experience with Kafka and CDC tools for real-time data synchronization.\u2022 Proven experience in Data modeling using Dimension modelling & Data vault methodologies with Power BI reporting integration experience.\u2022 Strong Data Governance Tooling experience with Collibra.\u2022 Hands-on experience working with relational and NoSQL technologies (such as Oracle, Postgres, Mongo DB, etc.)\u2022 You have experience with continuous integration and collaboration tools like Azure ADO, GitHub and Confluence.\u2022 Experience in financial industry or banking is a plus --Regards,Prashanth B | Tekgence Inc.Talent Acquisition Specialist Email: prashanth.b@tekgence.com | Website: www.tekgence.com6655 Deseo Dr \u2022 Suite 104 \u2022 Irving, TX \u2022 75039",
        "source": "Email",
        "date_posted": "2024-10-15 12:58:39-05:00",
        "unique_id": "19291afc1cbba9c9",
        "emp_type": [
            "full-time",
            "third party"
        ],
        "tag": "Azure Data Engineer"
    }
]