[
    {
        "company": "VSII",
        "job_title": "Software Development Senior Specialist",
        "location": "Rockville, MD, USA",
        "full_location": {
            "city": "Rockville",
            "state": "MD",
            "country": "USA"
        },
        "job_details": {
            "employment_type": [
                "full-time",
                "third party"
            ],
            "experience_required": "8+ years",
            "degree_required": "BS/MS degree in MIS, CS, or related discipline is required",
            "visa_sponsorship": "Not specified",
            "notice_period": "Not specified",
            "duration": "Not specified",
            "rate": "Not specified"
        },
        "skills": {
            "core": [
                "C#",
                ".NET MVC",
                ".NET CORE",
                "SQL Server",
                "JavaScript"
            ],
            "primary": [
                "ASP.NET",
                "TFS",
                "RDBMS",
                "Behavior Driven Development (BDD)",
                "Object-Oriented Programming",
                "N-Tier Architecture"
            ],
            "secondary": [
                "Software testing",
                "Design patterns",
                "Customer service",
                "Oral communication",
                "Written communication",
                "Windows Workflow Foundation (WF)",
                "Agile",
                "SCRUM",
                "MS ASP.NET Certification",
                "DevOps"
            ],
            "all": [
                "C#",
                ".NET MVC",
                ".NET CORE",
                "SQL Server",
                "JavaScript",
                "ASP.NET",
                "TFS",
                "RDBMS",
                "Behavior Driven Development (BDD)",
                "Object-Oriented Programming",
                "N-Tier Architecture",
                "Software testing",
                "Design patterns",
                "Customer service",
                "Oral communication",
                "Written communication",
                "Windows Workflow Foundation (WF)",
                "Agile",
                "SCRUM",
                "MS ASP.NET Certification",
                "DevOps"
            ]
        },
        "job_type": [
            "hybrid"
        ],
        "contact_person": "Raj",
        "email": "raj@vsiiusa.com",
        "jd": "From: Raj, VSII raj@vsiiusa.com Reply to: raj@vsiiusa.com Job Posting TitleSoftware Development Senior Specialist Description\u201cSoftware Development Senior Specialiste\u201d to join our team in \u201cRockville, MD\u201d. (Hybrid 1-2 days/week)Responsibilities:Design and develop new features and/or maintain existing applications developed on C# and ASP.NET MVC.Develop code and supporting documentation.Analyze business needs, develop requirements, design, develop and test custom software solutions.Provide technical leadership and take multiple systems and cross-system integration into account when designing and developing solutions.Provide maintenance for current software applications while developing new solutions.Work in a team environment to develop, test, and deploy software changes.Work with customers to understand and implement new requirements.Provide operational support when necessary.Work the product backlog of features and bugs.Provide input on new designs and architecture as needed.Develop a well-tested, high performance, scalable web application.Job Requirements:8+ years of experience designing, developing and deploying web-based applications in C#, .NET MVC, .NET CORE, SQL Server, JavaScript, TFS.8+ years of experience experience with RDBMS, databases, and Behavior Driven Development (BDD) is preferred.8+ years experience in software development.BS/MS degree in MIS, CS, or related discipline is required.Preferred Skills :Some experience with Object-Oriented Programming and working with N-Tier Architecture.Some experience with software testing and design patterns.Great customer service and interfacing with customers required.Excellent oral and written communication skills.Experience with Windows Workflow Foundation (WF) development experience, Agile/SCRUM experience, preferred.MS ASP.NET Certification is a plus.DevOps skills and experience a plus.Ability to change and have the ability to work in a fast-paced environment.",
        "source": "Email",
        "date_posted": "2024-10-15 11:39:04-05:00",
        "unique_id": "1929198bc4e559c4",
        "emp_type": [
            "full-time",
            "third party"
        ],
        "tag": ".net developer"
    }
]