[
    {
        "company": "TEK Inspirations Pvt. Ltd.",
        "job_title": "Data Architect (C. Advanced)",
        "location": "Tallahassee, FL, USA",
        "full_location": {
            "city": "Tallahassee",
            "state": "FL",
            "country": "USA"
        },
        "job_details": {
            "employment_type": [
                "full-time",
                "third party"
            ],
            "job_code": "",
            "experience_required": "4+ years",
            "degree_required": "Not specified",
            "visa_sponsorship": "Not specified",
            "notice_period": "Not specified",
            "duration": "12+ months",
            "rate": "Not specified"
        },
        "skills": {
            "core": [
                "Synapse Analytics",
                "Azure SQL Database",
                "Azure Managed Instance",
                "T-SQL",
                "Data Architecture Design"
            ],
            "primary": [
                "Data Governance",
                "ETL Processes",
                "Data Integration",
                "Cloud Computing",
                "Python",
                "Scala",
                "Salesforce",
                "MuleSoft"
            ],
            "secondary": [
                "Analytical Skills",
                "Problem-Solving Skills",
                "Customer Support",
                "Data Security",
                "Data Cataloging"
            ],
            "all": [
                "Synapse Analytics",
                "Azure SQL Database",
                "Azure Managed Instance",
                "T-SQL",
                "Data Architecture Design",
                "Data Governance",
                "ETL Processes",
                "Data Integration",
                "Cloud Computing",
                "Python",
                "Scala",
                "Salesforce",
                "MuleSoft",
                "Analytical Skills",
                "Problem-Solving Skills",
                "Customer Support",
                "Data Security",
                "Data Cataloging"
            ]
        },
        "job_type": [
            "onsite"
        ],
        "contact_person": "Anurag Singh",
        "email": "anurag.singh@tekinspirations.com",
        "jd": "HeyCheck this urgent role Position :Data Architect (C. Advanced)) Location :Tallahassee, FL OnsiteDuration: 12+ monthsMOI: SkypeNote :Need best local candidates. Kindly submiT DL,VISA. Exhibit E: -Please have candidate fill in name, sign, date, type of id, and #. -Insert your name, signature, and date for one witness. -Leave the second witness blank. I will sign. -Please send back as Word doc.-I will need copy of DL as well.-Please send max 4 page resume The activities these candidates will be tasked with include, but are not limited to the following: These positions are to provide technical guidance and expertise in supporting the department in developing, architecting, and maintaining data, data mappings, and monitoring high-volume complex data transfer processes. \u2022 Work with stakeholders and development team to determine project scope and vision, gather and prioritize collected requirements. \u2022 Designing and Implementing Data Architectures: Develop comprehensive data architectures that support the organization\u2019s business goals, using Azure Synapse Analytics, Azure SQL, and other Azure data services. \u2022 Managing Dedicated SQL Pools: Efficiently manage and optimize Dedicated SQL Pools in Synapse to handle large-scale data warehousing and analytics workloads. \u2022 Database Design and Management: Design, implement, and manage databases using Azure SQL and Azure Managed Instance, ensuring high performance, availability, and security. \u2022 Data Integration and ETL Processes: Develop and manage ETL (Extract, Transform, Load) processes using Synapse Pipelines, ensuring efficient data flow from various sources to the data warehouse. \u2022 Data Governance and Cataloging: Implement data governance practices and manage the data catalog to ensure data quality, consistency, and accessibility. \u2022 Building and Maintaining Data Models: Create and maintain data models that accurately represent the data landscape, ensuring they are scalable and optimized for performance. \u2022 Ensuring Data Security and Compliance: Implement and oversee data security measures, ensuring compliance with legal and regulatory standards. \u2022 Maintain procedures manuals and system documentation. \u2022 Research software solutions to support recommendations, analyzing current and future technology trends. Minimum Required KSAs: \u2022 4+ years of experience in Synapse Analytics, Dedicated SQL Pools, Azure SQL Database, and Azure Managed Instance. \u2022 5+ years of experience in DDL, DML T-SQL skills, advanced stored procedure writing skills, tables, primary keys, foreign keys, constraints, indexes, transactions, process logging, and error handling. \u2022 4+ years of experience in data architecture design principles, methodologies, and best practices. \u2022 3+ years of experience in data governance principles and compliance requirements related to data security and privacy. \u2022 3+ years of experience in integrating data from various sources and managing large data pipelines. \u2022 2+ years of experience in cloud computing concepts, particularly in Microsoft Azure, including storage solutions and compute capabilities. \u2022 1+ years of Experience with programming languages such as Python or Scala. \u2022 1+ years of experience in Salesforce, Message MQ, and MuleSoft \u2022 Strong analytical and problem-solving skills to address complex data challenges. \u2022 Ability to design and implement robust, scalable, and efficient data architectures. \u2022 Ability to provide excellent customer support; meticulous quality of work and work product.",
        "source": "Email",
        "date_posted": "2024-10-15 07:57:59-05:00",
        "unique_id": "1929062503101833",
        "emp_type": [
            "full-time",
            "third party"
        ],
        "tag": "Azure Data Engineer"
    }
]