[
    {
        "company": "MRTECHNOSOFT",
        "job_title": "Functional Business Analyst with Excel Expertise",
        "location": "Sunnyvale, CA, USA",
        "full_location": {
            "city": "Sunnyvale",
            "state": "CA",
            "country": "USA"
        },
        "job_details": {
            "employment_type": [
                "full-time",
                "contract",
                "third party"
            ],
            "experience_required": "4+ years",
            "degree_required": "Bachelor\u2019s degree in Business Administration, Information Systems, or a related field.",
            "visa_sponsorship": "Not specified",
            "notice_period": "Not specified",
            "duration": "Not specified",
            "rate": "Not specified"
        },
        "skills": {
            "core": [
                "Excel",
                "Business Analysis",
                "Data Management",
                "Problem-Solving",
                "Business Process Analysis"
            ],
            "primary": [
                "ERP systems",
                "Data Visualization Tools",
                "Communication",
                "Interpersonal Skills",
                "Project Management"
            ],
            "secondary": [
                "SQL",
                "Six Sigma",
                "Jira",
                "Trello"
            ],
            "all": [
                "Excel",
                "Business Analysis",
                "Data Management",
                "Problem-Solving",
                "Business Process Analysis",
                "ERP systems",
                "Data Visualization Tools",
                "Communication",
                "Interpersonal Skills",
                "Project Management",
                "SQL",
                "Six Sigma",
                "Jira",
                "Trello"
            ]
        },
        "job_type": [
            "onsite"
        ],
        "contact_person": "Debasish Pattnaik",
        "email": "d.pattanaik@mrtechnosoft.com",
        "jd": "From: Debasish Pattnaik, MRTECHNOSOFT d.pattanaik@mrtechnosoft.com Reply to: d.pattanaik@mrtechnosoft.com Job Description: Functional Business Analyst with Excel ExpertiseLocation: Sunnyvale, CaliforniaEmployment Type: Full-Time / ContractAbout the Role:We are looking for a Functional Business Analyst with advanced Excel skills to support business operations and decision-making processes. The ideal candidate will work closely with cross-functional teams to gather requirements, analyze data, and streamline business processes. If you have a knack for problem-solving, data management, and business process analysis, this role is perfect for you!Key Responsibilities:Collaborate with stakeholders to gather, analyze, and document business requirements.Develop and maintain Excel models using advanced functions (pivot tables, VLOOKUPs, macros, and complex formulas).Analyze and interpret large datasets to provide actionable insights and support decision-making.Identify gaps in business processes and suggest improvements to enhance efficiency.Coordinate with developers, project managers, and other stakeholders to ensure seamless implementation of business solutions.Create dashboards, reports, and KPIs to track business performance.Facilitate communication between technical teams and business units to ensure alignment.Required Skills & Qualifications:Bachelor\u2019s degree in Business Administration, Information Systems, or a related field.4+ years of experience as a Business Analyst or in a similar role.Advanced proficiency in Excel (pivot tables, macros, complex formulas, VBA).Strong analytical and problem-solving skills with attention to detail.Experience in gathering and documenting business requirements.Familiarity with ERP systems and data visualization tools is a plus.Excellent communication and interpersonal skills to work effectively with stakeholders.Ability to manage multiple projects and meet deadlines in a fast-paced environment.Preferred Skills:Experience with SQL or other data querying tools.Knowledge of business process improvement methodologies (e.g., Six Sigma).Familiarity with project management tools like Jira or Trello.ThanksDebasish Pattnaikd.pattanaik@mrtechnosoft.comwww.mrtechnosoft.com",
        "source": "Email",
        "date_posted": "2024-10-15 15:34:01-05:00",
        "unique_id": "1929203ccf65b007",
        "emp_type": [
            "full-time",
            "contract",
            "third party"
        ],
        "tag": "Business Analyst"
    }
]