[
    {
        "company": "Source Infotech Inc",
        "job_title": "Oracle Developer",
        "location": "Cleveland, OH, USA",
        "full_location": {
            "city": "Cleveland",
            "state": "OH",
            "country": "USA"
        },
        "job_details": {
            "employment_type": [
                "contract",
                "third party"
            ],
            "job_code": "",
            "experience_required": "3+ years",
            "degree_required": "Bachelor degree or foreign equivalent in a related field or equivalent experience",
            "visa_sponsorship": "Not specified",
            "notice_period": "Not specified",
            "duration": "6 months",
            "rate": "Not specified"
        },
        "skills": {
            "core": [
                "Oracle 11g",
                "PL/SQL",
                "SQL",
                "UNIX",
                "LINUX",
                "Exadata"
            ],
            "primary": [
                "JIRA",
                "GitHub",
                "ControlM",
                "Micro Services",
                "Bhoomi Services",
                "Performance Tuning"
            ],
            "secondary": [
                "JAVA",
                "J2EE",
                "XML",
                "Materialized view",
                "Triggers",
                "Complex SQL's",
                "SQL Reports",
                "LOBs",
                "Multilingual character conversion",
                "Unit Testing Methods",
                "UNIX scripts",
                "Oracle RAC clusters"
            ],
            "all": [
                "Oracle 11g",
                "PL/SQL",
                "SQL",
                "UNIX",
                "LINUX",
                "Exadata",
                "JIRA",
                "GitHub",
                "ControlM",
                "Micro Services",
                "Bhoomi Services",
                "Performance Tuning",
                "JAVA",
                "J2EE",
                "XML",
                "Materialized view",
                "Triggers",
                "Complex SQL's",
                "SQL Reports",
                "LOBs",
                "Multilingual character conversion",
                "Unit Testing Methods",
                "UNIX scripts",
                "Oracle RAC clusters"
            ]
        },
        "job_type": [
            "hybrid"
        ],
        "contact_person": "Bhavya Chaturvedi",
        "email": "bhavya.c@sourceinfotech.com",
        "jd": "From: Bhavya, Source infotec inc bhavya.c@sourceinfotech.com Reply to: bhavya.c@sourceinfotech.com Title: Oracle DeveloperLocation: Cleveland, OH (Hybrid Onsite)Duration: 6 months C2HIV: Phone and VideoVisa: USC and GC The Oracle Developer position is responsible for the requirement gathering, documentation, design, development, implementation and maintenance of Financial web application for the Credit / Customer centric project, with a focus on Oracle database development, batch process development and reporting. Maintain and troubleshoot existing applications following Industry standard coding and best practices. Develop and maintain solutions for new requests and enhancements for existing applications focusing on impact analysis and best code performance. Document requirements, develop design documentation, test cases and maintain in Confluence. Track issues and manage tasks with JIRA, Maintain version control with GIT. The position requires participation in the complete system development life cycle including post implementation support. The developer provides technical consulting to management, business users, and works closely with other developers as a supervisor and mentor. Position RequirementsFormal Education & CertificationBachelor degree or foreign equivalent in a related field or equivalent experience.Knowledge & Experience3+ years of IT experience.3+ years of experience developing OLTP database applications in Oracle 11g and UNIX/LINUX/Solaris environment within a multi-tier environment; building and formulating business requirements.Hands of experience in JIRA, GitHub, ControlM, Micro Services / Bhoomi Services3+ years of experience in development and performance tuning using Oracle Exadata.Work with PL/SQL Types, PL/SQL Collections, SQL Loader, PL/SQL Functions and Procedures, XML, Packages, and Materialized view, Triggers, Complex SQL's and SQL Reports;Work with PL/SQL techniques in LOBs, Multilingual character conversion; Optimize the applications using Exadata Oracle Performance Tuning Techniques; develop Unit Testing Methods for PL/SQL; develop UNIX scripts for batch processing and work with Oracle RAC clusters and Exadata systems; and Knowledge of Account Receivable systemStrong experience in handling large volume data movement and maintenance.Hands of experience in JIRA, GitHub, ControlM, Micro Services / Bhoomi ServicesOptionalKnowledgeable and willing to learn and work on JAVA & J2EE developmentTHANKS & REGARDS Bhavya Chaturvedi Source Infotech IncP.O Box 577, EDISON, NJ 08818-0577EMAIL: bhavya.c@sourceinfotech.comPhone: 6097335170 | | Hangout:bhavyachaturvedi389",
        "source": "Email",
        "date_posted": "2024-10-15 11:29:47-05:00",
        "unique_id": "19291252d7b0e178",
        "emp_type": [
            "contract",
            "third party"
        ],
        "tag": "Oracle DBA"
    }
]