[
    {
        "company": "CCIT INC",
        "job_title": "SR. Java Developer",
        "location": "Denver, CO, USA",
        "full_location": {
            "city": "Denver",
            "state": "CO",
            "country": "USA"
        },
        "job_details": {
            "employment_type": [
                "full-time",
                "third party"
            ],
            "job_code": "",
            "experience_required": "11 to 14 years",
            "degree_required": "Not specified",
            "visa_sponsorship": "No visa sponsorship",
            "notice_period": "Not specified",
            "duration": "Not specified",
            "rate": "Not specified"
        },
        "skills": {
            "core": [
                "Core Java",
                "Microservices",
                "Spring-Boot",
                "Spring Framework",
                "REST",
                "SOAP",
                "Relational Databases"
            ],
            "primary": [
                "OOPS concepts",
                "Design patterns",
                "Spring-MVC",
                "Spring-AOP",
                "Spring-Actuator",
                "Spring-Cloud",
                "Spring-Config",
                "Kafka",
                "Agile/Scrum"
            ],
            "secondary": [],
            "all": [
                "Core Java",
                "Microservices",
                "Spring-Boot",
                "Spring Framework",
                "REST",
                "SOAP",
                "Relational Databases",
                "OOPS concepts",
                "Design patterns",
                "Spring-MVC",
                "Spring-AOP",
                "Spring-Actuator",
                "Spring-Cloud",
                "Spring-Config",
                "Kafka",
                "Agile/Scrum"
            ]
        },
        "job_type": [
            "onsite"
        ],
        "contact_person": "Adeeb Khan",
        "email": "adeebk@ccitinc.com",
        "jd": "From: Adeeb, CCITINC adeebk@ccitinc.com Reply to: adeebk@ccitinc.com Job/Title - SR. Java DeveloperLocation - Denver CO & Charlotte, NC (Onsite) Only Local Candidate Denver CO OR Charlotte NC Only GC & USC NO H1BDescription:We are looking for a sr. Java Developer with upto 13 years of experience for a long term assignment with us located in Charlotte NC & Denver COThe candidate will participate in all aspects of the SDLC life cycle including solution design; implementation and deployment This hands-on technical role requires strong object-oriented and system design skills. Required:Years of Experience Required - 11 to 14 yearsStrong experience in Core JavaStrong understanding of OOPS concepts and design patterns.Strong hands-on experience in microservices development using Spring-Boot.Hands-on experience in Spring Framework hands-on, Spring-MVC, Spring-AOP, Spring-Actuator, Spring-Cloud, Spring-Config, etc.Development of web services must use REST or SOAP.Excellent knowledge of Relational Databases.Good experience in Kafka. An experience on agile/scrum will be a plus. Thanks & RegardsAdeeb khan858-282-0778CCIT INC |Empowering Enterprise eBusinessCompetitive Computer Information Technologies!www.ccitinc.com | 115 North Center, Suite#202, Northville, MI - 48167",
        "source": "Email",
        "date_posted": "2024-10-15 12:22:47-05:00",
        "unique_id": "1929154bc6918f34",
        "emp_type": [
            "full-time",
            "third party"
        ],
        "tag": "Java developer"
    }
]