[
    {
        "company": "VDart",
        "job_title": "ServiceNow Technical PM",
        "location": "Denver, CO, USA",
        "full_location": {
            "city": "Denver",
            "state": "CO",
            "country": "USA"
        },
        "job_details": {
            "employment_type": [
                "full-time",
                "third party"
            ],
            "experience_required": "10-12+ years",
            "degree_required": "Not specified",
            "visa_sponsorship": "Not specified",
            "notice_period": "Not specified",
            "duration": "6+ months",
            "rate": "Not specified"
        },
        "skills": {
            "core": [
                "ServiceNow",
                "Project Management",
                "IT Service Management (ITSM)"
            ],
            "primary": [
                "Communication Skills",
                "Leadership",
                "Risk Management",
                "Resource Management"
            ],
            "secondary": [
                "Business Processes related to ITSM",
                "ITAM",
                "ITOM",
                "CMDB",
                "Fit-Gap analysis"
            ],
            "all": [
                "ServiceNow",
                "Project Management",
                "IT Service Management (ITSM)",
                "Communication Skills",
                "Leadership",
                "Risk Management",
                "Resource Management",
                "Business Processes related to ITSM",
                "ITAM",
                "ITOM",
                "CMDB",
                "Fit-Gap analysis"
            ]
        },
        "job_type": [
            "hybrid"
        ],
        "contact_person": "Mohamed Idhirish M",
        "email": "idhirish.m@vdartinc.com",
        "jd": "From: Mohamed Idhirish M, VDart idhirish.m@vdartinc.com Reply to: idhirish.m@vdartinc.com ServiceNow Technical PMDuration: 6+ monthsStart date: ImmediateLocation: Denver, CO 80206 \u2013 Hybrid 1. ServiceNow Technical PMJob Summary: Seeking an experienced Project Manager with expertise in ServiceNow. The ideal candidate will have a strong background in project management, with a focus on implementing and optimizing ServiceNow solutions. The Project Manager will be responsible for overseeing the planning, execution, and delivery of ServiceNow project, ensuring they are completed on time, within scope, and within budget. This role requires effective communication skills, leadership abilities, and a deep understanding of ServiceNow best practices. Responsibilities: The Project Manager will be responsible for overseeing the planning, execution, and delivery of ServiceNow project, ensuring they are completed on time, within scope Develop comprehensive project plans outlining tasks, timelines, and resource requirementsLead project teams in the execution of ServiceNow implementations, upgrades, and enhancements Utilize in-depth knowledge of ServiceNow platform capabilities to drive the successful implementation of solutions Collaborate with technical teams to design and implement ServiceNow configurations, customizations, and integrations Communicate effectively with internal and external stakeholders to ensure a clear understanding of project objectives, status, and risks Facilitate regular project status meetings and provide timely updates to key stakeholders Risk Management: Identify potential risks and issues that may impact project delivery and develop mitigation strategies Proactively address and resolve challenges to keep projects on track Implement and enforce best practices for ServiceNow development and configuration Conduct thorough testing and quality assurance to ensure solutions meet the specified requirements Resource Management: Coordinate and allocate resources effectively to meet project demands Provide leadership and guidance to project team members Maintain comprehensive project documentation, including project plans, status reports, and change requests Ensure that all project documentation is up-to-date and accessible Qualifications: The ideal candidate will have a strong background in project management, with a focus on implementing and optimizing ServiceNow solutions 10-12+ years of proven experience as a Project Manager, with a focus on ServiceNow implementation/project management Strong understanding of IT Service Management (ITSM) processes and ServiceNow modules Excellent communication and interpersonal skills Update from the HM:Looking for the following experience in the candidate for ServiceNow. - Good understanding of Business Processes related to ITSM, ITAM,ITOM,CMDB- Ability to understand business challenges leading to implementation of ServiceNow Modules. Why customer chose NOW platform instead of what they are having- Ability to drive Fit-Gap analysis and drive solutions for the Gaps- Experience of taking over WIP projects and drive to Go-LiveWhat level of customer this PM was interacting with- need to know",
        "source": "Email",
        "date_posted": "2024-10-15 11:19:04-05:00",
        "unique_id": "192911a66ea1d999",
        "emp_type": [
            "full-time",
            "third party"
        ],
        "tag": "Project Manager"
    }
]