[
    {
        "company": "Vyze1 inc",
        "job_title": "ServiceNow Project Manager",
        "location": "Sacramento, CA, USA",
        "full_location": {
            "city": "Sacramento",
            "state": "CA",
            "country": "USA"
        },
        "job_details": {
            "employment_type": [
                "full-time",
                "third party"
            ],
            "job_code": "",
            "experience_required": "Minimum 4 years",
            "degree_required": "Bachelor's degree in IT, Computer Science, Business Administration, or related field",
            "visa_sponsorship": "No visa sponsorship",
            "notice_period": "Not specified",
            "duration": "Not specified",
            "rate": "Not specified"
        },
        "skills": {
            "core": [
                "ServiceNow",
                "IT project management",
                "Agile project management",
                "Leadership",
                "Communication"
            ],
            "primary": [
                "Problem-solving",
                "Budget tracking",
                "Risk management",
                "ITIL practices"
            ],
            "secondary": [
                "Collaboration",
                "Project scope definition",
                "Client communication",
                "Project post-mortems"
            ],
            "all": [
                "ServiceNow",
                "IT project management",
                "Agile project management",
                "Leadership",
                "Communication",
                "Problem-solving",
                "Budget tracking",
                "Risk management",
                "ITIL practices",
                "Collaboration",
                "Project scope definition",
                "Client communication",
                "Project post-mortems",
                "ServiceNow certification(s) preferred"
            ]
        },
        "job_type": [
            "hybrid"
        ],
        "contact_person": "Sam",
        "email": "slenka@vyzeinc.com",
        "jd": "From: Sam, Vyze1 inc slenka@vyzeinc.com Reply to: slenka@vyzeinc.com Job Title : ServiceNow Project Manager Work Mode : hybrid ( This position requires 2 days/week on-site as directed by the client. )Location : Sacramento, California Work Auth. : ONLY USC , GC Mode OF Interview : Skype Client : The client is a State of California AgencyResponsibilities include:\u2022 Lead and manage ServiceNow projects from initiation to completion, ensuring all objectives are met within budget and on schedule\u2022 Collaborate with cross-functional teams, including developers, analysts, and client stakeholders, to define project scope, goals, deliverables, and timelines\u2022 Develop and maintain project plans, resource scheduling, budget tracking, and risk management strategies\u2022 Communicate effectively with clients to understand their requirements and expectations, and provide timely updates on project progress\u2022 Ensure project quality and compliance with ServiceNow best practices and standards\u2022 Identify and resolve project issues and risks, and escalate as needed to ensure project success\u2022 Conduct project post-mortems and identify areas for improvement for future projectsRequirements:\u2022 Bachelor's degree in IT, Computer Science, Business Administration, or related field\u2022 Minimum 4 years of experience in IT project management, specifically with ServiceNow projects\u2022 ServiceNow certification(s) preferred\u2022 Strong leadership, communication, and problem-solving skills\u2022 Proven ability to manage multiple projects concurrently and meet deadlines\u2022 Experience in Agile project management methodologies\u2022 Knowledge of ITIL practices and principles If you have consultants meeting the requirements for this position, please carefully read below before you reply and attach their resumes with their availability PLEASE READ-before submitting any of your consultants so we can move forward with your resumes. Any resumes submitted must show that your candidate meets all the position requirements ALWAYS provide your consultants with full name-(What is on their Visa), resume, phone number, Skype address, rate, email address, and location. Without the information requested, we can not move forward. we will do a Skype interview with your consultants, before submitting them. Submit Candidates LinkedIn with Profile Photo Do not call or follow up emails as that will only slow down our ability to respond to you quickly. Once we have received your resumes we will contact you if there is a fit.",
        "source": "Email",
        "date_posted": "2024-10-15 08:32:12-05:00",
        "unique_id": "192909ce61b95cde",
        "emp_type": [
            "full-time",
            "third party"
        ],
        "tag": "Project Manager"
    }
]