[
    {
        "company": "Hanstaffing",
        "job_title": "Pega Developer",
        "location": "Tampa, FL, USA",
        "full_location": {
            "city": "Tampa",
            "state": "FL",
            "country": "USA"
        },
        "job_details": {
            "employment_type": [
                "full-time",
                "third party"
            ],
            "job_code": "",
            "experience_required": "5+ years",
            "degree_required": "Not specified",
            "visa_sponsorship": "Not specified",
            "notice_period": "Not specified",
            "duration": "Not specified",
            "rate": "Not specified"
        },
        "skills": {
            "core": [
                "Pega v8+",
                "Pega PRPC",
                "Pega BPM",
                "Java",
                "SQL"
            ],
            "primary": [
                "Pega rules",
                "data model",
                "application architecture",
                "web services (REST/SOAP)",
                "Agile development methodologies"
            ],
            "secondary": [
                "Pega frameworks (e.g., Customer Service, Smart Dispute)",
                "problem-solving skills",
                "attention to detail",
                "communication skills",
                "collaboration skills"
            ],
            "all": [
                "Pega v8+",
                "Pega PRPC",
                "Pega BPM",
                "Java",
                "SQL",
                "Pega rules",
                "data model",
                "application architecture",
                "web services (REST/SOAP)",
                "Agile development methodologies",
                "Pega frameworks (e.g., Customer Service, Smart Dispute)",
                "problem-solving skills",
                "attention to detail",
                "communication skills",
                "collaboration skills"
            ]
        },
        "job_type": [
            "onsite"
        ],
        "contact_person": "Lisa",
        "email": "lisaminent@hanstaffing.com",
        "jd": "From: Lisa, Hanstaffing lisaminent@hanstaffing.com Reply to: lisaminent@hanstaffing.com Title: Pega Developer Location: Tampa, FL (Day 1 Onsite) Job Description: 5+ years Pega v8+ development experience Strong individual contributor Self-starter, can manage their work with minimal hand-holding Proven experience in Pega development, including Pega PRPC and Pega BPM. Strong understanding of Pega rules, data model, and application architecture. experience with Pega frameworks (e.g., Customer Service, Smart Dispute) is a plus. Proficient in Java, SQL, and web services (REST/SOAP). Familiarity with Agile development methodologies. Excellent problem-solving skills and attention to detail. Strong communication and collaboration skills.",
        "source": "Email",
        "date_posted": "2024-10-15 18:30:05-05:00",
        "unique_id": "19292cef397e8f08",
        "emp_type": [
            "full-time",
            "third party"
        ],
        "tag": "PEGA Developer"
    }
]