[
    {
        "company": "Digital Dhara",
        "job_title": "IBM Sterling Developer with ITX or ITXA and Healthcare Domain",
        "location": "USA",
        "full_location": {
            "city": "",
            "state": "",
            "country": "USA"
        },
        "job_details": {
            "employment_type": [
                "contract",
                "full-time",
                "permanent",
                "third party"
            ],
            "experience_required": "8+ years",
            "degree_required": "Not specified",
            "visa_sponsorship": "Not specified",
            "notice_period": "Not specified",
            "duration": "Long Term",
            "rate": "Not specified"
        },
        "skills": {
            "core": [
                "IBM Sterling",
                "ITX",
                "ITXA",
                "Healthcare Domain"
            ],
            "primary": [
                "EDI 837",
                "RHEL",
                "Java",
                "JavaScript",
                "Spring",
                "Spring Boot",
                "Camel",
                "SOAP",
                "REST",
                "Log4J",
                "JSON",
                "XML",
                "HTML"
            ],
            "secondary": [],
            "all": [
                "IBM Sterling",
                "ITX",
                "ITXA",
                "Healthcare Domain",
                "EDI 837",
                "RHEL",
                "Java",
                "JavaScript",
                "Spring",
                "Spring Boot",
                "Camel",
                "SOAP",
                "REST",
                "Log4J",
                "JSON",
                "XML",
                "HTML"
            ]
        },
        "job_type": [
            "remote"
        ],
        "contact_person": "Khushboo",
        "email": "khushboo@digitaldhara.com",
        "jd": "From: khushboo, Digital Dhara khushboo@digitaldhara.com Reply to: khushboo@digitaldhara.com Position: IBM Sterling Developer with ITX or ITXA and Healthcare DomainTerm : Long Term Contract/Fulltime/Permanent Location: Remote Job Description: IBM Sterling, ITX, ITXAMMIS, EDI 837 RHEL, Java, JavaScript, Spring, Spring Boot, Camel, SOAP/REST, Log4J, JSON, XML, HTMResource should have Healthcare DomainResource should have 8+ years of experience Design and Develop, including code enhancements, bug fixes, implementation (possible production support), testing, performance tuning and ad-hoc reporting. Thanks & Regards,KhushbooKhushboo@digitaldhara.comPh: 609-791-0074 Ext 115",
        "source": "Email",
        "date_posted": "2024-10-15 11:15:13-05:00",
        "unique_id": "192915ac792496c4",
        "emp_type": [
            "contract",
            "full-time",
            "permanent",
            "third party"
        ],
        "tag": "Java developer"
    }
]