[
    {
        "company": "Adventa tech inc",
        "job_title": "Software Development Lead",
        "location": "Ashburn, VA, USA",
        "full_location": {
            "city": "Ashburn",
            "state": "VA",
            "country": "USA"
        },
        "job_details": {
            "employment_type": [
                "full-time",
                "third party"
            ],
            "job_code": "",
            "experience_required": "10 or more years",
            "degree_required": "Bachelor\u2019s degree in computer science/engineering or equivalent professional experience",
            "visa_sponsorship": "No visa sponsorship",
            "notice_period": "Not specified",
            "duration": "6 Months",
            "rate": "Not specified"
        },
        "skills": {
            "core": [
                "Java",
                "C#",
                "Python",
                "Golang"
            ],
            "primary": [
                "APIs",
                "system integration",
                "DevOps",
                "AWS",
                "CI/CD pipelines"
            ],
            "secondary": [
                "software development",
                "technical leadership",
                "production-ready systems",
                "mentoring"
            ],
            "all": [
                "Java",
                "C#",
                "Python",
                "Golang",
                "APIs",
                "system integration",
                "DevOps",
                "AWS",
                "CI/CD pipelines",
                "software development",
                "technical leadership",
                "production-ready systems",
                "mentoring"
            ]
        },
        "job_type": [
            "hybrid"
        ],
        "contact_person": "banani banojini das",
        "email": "banani@adventatech.com",
        "jd": "From: banani banojini das, Adventa tech inc banani@adventatech.com Reply to: banani@adventatech.com Title: Software Development LeadLocation: Ashburn, Virginia( Hybrid )Duration: 6 MonthsVisa: CITIZENMoi: SkypeJob Description -Need only 1 best candidateNeed Local or nearby candidates !Need senior profile for this role. Back end focused w/ java.No Amazon candidates in recent.The impact you will have:Lead software development process across several offshore software development teams to ensure high quality and predictable delivery of the software increments.Own several critical Service Delivery Platform modules: monitoring their health/performance/security, troubleshooting/resolution of production incidents, tracking dependencies and changes, driving software design improvements \u2013 target state and steps to achieve it. Primary reviewer/approver of all code changes for the owned modules.Work with the development team to translate functional and non-functional requirements into manageable and estimated tasks to plan upcoming sprints.Manage the software delivery plan and risks associated with the delivery.Along with Technical Program Manager manages dependencies on other teams.Help development teams with technical roadblocks/issues that teams may face.Mentor technical program managers and software developers to define measurable user stories and deliver better code: readable, secure, and performant. What you will need to be successful: (please read carefully at requirements)Bachelor\u2019s degree in computer science/engineering or equivalent professional experience.10 or more years of software development experience with a focus on APIs and system integration projects.3+ years of technical software team lead experience.Experience with modern programming languages: Java, C#, Python, Golang.DevOps experience: on-premises, AWS, CI/CD pipelines.Experience running and maintaining production-ready systems.US Citizenship is required",
        "source": "Email",
        "date_posted": "2024-10-15 09:14:15-05:00",
        "unique_id": "19290a821b6c9062",
        "emp_type": [
            "full-time",
            "third party"
        ],
        "tag": "Java developer"
    }
]