[
    {
        "company": "Intellicept Corporation",
        "job_title": "Software Engineer (Java + Python)",
        "location": "Austin, TX, USA",
        "full_location": {
            "city": "Austin",
            "state": "TX",
            "country": "USA"
        },
        "job_details": {
            "employment_type": [
                "third party"
            ],
            "job_code": "",
            "experience_required": "10+ years",
            "degree_required": "Bachelor\u2019s degree in Computer Science, Software Engineering, or a related field.",
            "visa_sponsorship": "No visa sponsorship",
            "notice_period": "Not specified",
            "duration": "Not specified",
            "rate": "Not specified"
        },
        "skills": {
            "core": [
                "Java",
                "Python",
                "Object-oriented programming",
                "RESTful API design",
                "Web frameworks"
            ],
            "primary": [
                "Google Technology Stack Experience",
                "HTML",
                "CSS",
                "JavaScript frameworks",
                "Agile methodologies"
            ],
            "secondary": [
                "Cloud platforms",
                "DevOps principles",
                "Customer contact center applications"
            ],
            "all": [
                "Java",
                "Python",
                "Object-oriented programming",
                "RESTful API design",
                "Web frameworks",
                "Google Technology Stack Experience",
                "HTML",
                "CSS",
                "JavaScript frameworks",
                "Agile methodologies",
                "Cloud platforms",
                "DevOps principles",
                "Customer contact center applications"
            ]
        },
        "job_type": [
            "onsite"
        ],
        "contact_person": "Pinki Kumari",
        "email": "pinki@intellicept.com",
        "jd": "From: Pinki Kumari, Intellicept Corporation pinki@intellicept.com Reply to: pinki@intellicept.com Software Engineer (Java + Python) With Prior Google Environment Work Experience)Location : Austin, TX / San Jose, CAC2CONSITEMust have Ex- Google candidateLocal Only (No relocation)10+ Years Experience Key Responsibilities:Design, develop, test, and deploy applications using Java/PythonCollaborate with cross-functional teams to gather requirements and implement solutions.Write clean, maintainable, and efficient code following best practices.Troubleshoot, debug, and optimize existing software applications.Participate in code reviews and contribute to team knowledge sharing.Stay updated with emerging technologies and trends in software development.Document development processes, code changes, and technical specifications. Required Skills and Qualifications:Bachelor\u2019s degree in Computer Science, Software Engineering, or a related field.5 + years of experience in software development using Java /Python.Strong understanding of object-oriented programming principles.Experience with web frameworks (e.g., Java, Python)Google Technology Stack Experience (Google3, Piper, Blaze, Git5/G4, Borg)Understanding of RESTful API design and development.Experience of frontend technologies such as HTML, CSS, and JavaScript frameworks (e.g., Angular, React, Vue.js). Nice to Have Skills and Qualifications:Familiarity with cloud platforms like AWS, Google Cloud, or Azure for deploying Java applications.Familiarity with Agile or Scrum methodologies and experience working in Agile teams.Understanding of DevOps principles and practices.Familiar with Customer contact center or similar application domain. Thanks & RegardsPinki KumariTalent AdvisorEmail: pinki@intellicept.comCell:- (848) 999-4581Intellicept Corporation",
        "source": "Email",
        "date_posted": "2024-10-15 17:36:24-05:00",
        "unique_id": "19292e869898d18f",
        "emp_type": [
            "third party"
        ],
        "tag": "Java developer"
    }
]