[
    {
        "company": "Sapphire Software Solutions inc",
        "job_title": "Senior Business Analyst",
        "location": "Winston-Salem, NC, USA",
        "full_location": {
            "city": "Winston-Salem",
            "state": "NC",
            "country": "USA"
        },
        "job_details": {
            "employment_type": [
                "full-time",
                "third party"
            ],
            "job_code": "",
            "experience_required": "Not specified",
            "degree_required": "Not specified",
            "visa_sponsorship": "Not specified",
            "notice_period": "Not specified",
            "duration": "12+ months minimum",
            "rate": "Not specified"
        },
        "skills": {
            "core": [
                "Business Analysis skills and experience",
                "Agile SDLC experience",
                "Prototyping/Mockup software skills"
            ],
            "primary": [
                "Mortgage experience",
                "MI experience",
                "Management skills"
            ],
            "secondary": [
                "Knowledge of documentation methodologies",
                "Knowledge of testing cycles and methodologies",
                "Knowledge of Microsoft Windows PC and software",
                "Knowledge of Agile and Waterfall System Development Lifecycles",
                "Knowledge of project management and time management principles",
                "Ability to provide written communication",
                "Ability to communicate effectively",
                "Ability to work with diverse teams",
                "Ability to estimate work required and manage time"
            ],
            "all": [
                "Business Analysis skills and experience",
                "Agile SDLC experience",
                "Prototyping/Mockup software skills",
                "Mortgage experience",
                "MI experience",
                "Management skills",
                "Knowledge of documentation methodologies",
                "Knowledge of testing cycles and methodologies",
                "Knowledge of Microsoft Windows PC and software",
                "Knowledge of Agile and Waterfall System Development Lifecycles",
                "Knowledge of project management and time management principles",
                "Ability to provide written communication",
                "Ability to communicate effectively",
                "Ability to work with diverse teams",
                "Ability to estimate work required and manage time"
            ]
        },
        "job_type": [
            "onsite"
        ],
        "contact_person": "karthik",
        "email": "karthik@sapphiresoftwaresolutions.com",
        "jd": "From: karthik, Sapphire Software Solutions inc karthik@sapphiresoftwaresolutions.com Reply to: karthik@sapphiresoftwaresolutions.com Senior Business Analyst | On-site in Winston-Salem, NCJob Duration: 12+ months minimumLocation: Onsite 5 days a week in Winston-Salem Office Job Summary:The BA\u2019s on this team work anywhere from 3-6 projects at a timeUser Stories, Prototyping, Mockups, Wireframes, User Sessions, Revies, Requirements GatheringDoing all of this work across projects, all mortgage insurance relatedAgile \u2013 Daily Stand Ups on each projectA lot of interaction with Business users, IT dev team, QA teamNeed to be willing to onsite in the Winston Salem office 5 days a weekRequired Skills: \u2022 Business Analysis skills and experience\u2022 Agile SDLC experience\u2022 Prototyping/Mockup software skills (ModernRequirementsforDevOps)\u2022 Mortgage experience preferred\u2022 MI experience preferred\u2022 Management skills required \u2013 project and people Other skills:\u2022 Knowledge of documentation methodologies, such as user stories, use cases and storyboarding.\u2022 Knowledge of testing cycles and methodologies.\u2022 Knowledge of Microsoft Windows PC and software (Word, Excel, Visio, PowerPoint, Project)\u2022 Knowledge of Agile and Waterfall System Development Lifecycles.\u2022 Knowledge of project management and time management principles\u2022 Ability to provide written communication at appropriate level of detail with clarity, appropriate formatting, grammar and spelling\u2022 Ability to communicate effectively to all technical levels\u2022 Ability to work with diverse teams, to mitigate differences and bring consensus\u2022 Ability to estimate work required and manage time to accomplish tasks",
        "source": "Email",
        "date_posted": "2024-10-15 15:02:07-05:00",
        "unique_id": "19291e6995a9fd1e",
        "emp_type": [
            "full-time",
            "third party"
        ],
        "tag": "Business Analyst"
    }
]