[
    {
        "company": "Avance",
        "job_title": "Azure Data Architect",
        "location": "USA",
        "full_location": {
            "city": "",
            "state": "",
            "country": "USA"
        },
        "job_details": {
            "employment_type": [
                "contract",
                "third party"
            ],
            "job_code": "",
            "experience_required": "15+ years",
            "degree_required": "Not specified",
            "visa_sponsorship": "Not specified",
            "notice_period": "Not specified",
            "duration": "Not specified",
            "rate": "Not specified"
        },
        "skills": {
            "core": [
                "Azure cloud platform environment",
                "Big data technologies",
                "Unstructured data management",
                "Container & Orchestration platforms",
                "Relational databases and structured query languages",
                "Microservices",
                "Integration and ETL/ELT technologies",
                "Data management and analytics",
                "Reference & Master Data Management",
                "Access control and security"
            ],
            "primary": [
                "Data architecture",
                "AI models and solutions",
                "Data mesh concepts",
                "Federated governance approaches",
                "Agile",
                "SCRUM",
                "Continuous Delivery"
            ],
            "secondary": [
                "Machine Learning",
                "AI",
                "LLM knowledge",
                "Message queues",
                "Streaming technologies",
                "Event driven architecture",
                "O365 environment",
                "Project Management",
                "Team Leadership",
                "Quality Assurance",
                "Budget Management",
                "Risk Management",
                "Reporting"
            ],
            "all": [
                "Azure cloud platform environment",
                "Big data technologies",
                "Unstructured data management",
                "Container & Orchestration platforms",
                "Relational databases and structured query languages",
                "Microservices",
                "Integration and ETL/ELT technologies",
                "Data management and analytics",
                "Reference & Master Data Management",
                "Access control and security",
                "Data architecture",
                "AI models and solutions",
                "Data mesh concepts",
                "Federated governance approaches",
                "Agile",
                "SCRUM",
                "Continuous Delivery",
                "Machine Learning",
                "AI",
                "LLM knowledge",
                "Message queues",
                "Streaming technologies",
                "Event driven architecture",
                "O365 environment",
                "Project Management",
                "Team Leadership",
                "Quality Assurance",
                "Budget Management",
                "Risk Management",
                "Reporting"
            ]
        },
        "job_type": [
            "remote"
        ],
        "contact_person": "Vinod",
        "email": "vinod.m@avanceservices.com",
        "jd": "From: Vinod, Avance vinod.m@avanceservices.com Reply to: vinod.m@avanceservices.com A quick brief of the Job:Azure Data Architect (15+ Years)ContractRemoteExtensive years of experience in relevant data architecture roles; possess broad and deep expertise in insurance data strategy and architecture.Working experience with organizations with multiple entities operated globally is preferred.Understanding of data mesh concepts and applicability to support multi entity architecture.Understanding of federated governance approaches to support multi entity modelDevelop AI models and solutions that address business needs and challenges.Continuously improve AI models' performance and scalability.Hands-on experience with architecture and design with:Azure cloud platform environmentBig data technologiesUnstructured data managementContainer & Orchestration platformsRelational databases and structured query languagesMicroservicesIntegration and ETL/ELT technologiesData management and analyticsReference & Master Data ManagementAccess control and securityEffective management and leadership skills with the ability to influence department\u2019s strategyOutstanding organizational skills with attention to detail and ability to handle changeExcellent presentation, communication (oral & written), and relationship building skills, across all levels of managementExcellent problem solving and analysis skillsKnowledge and active use of Agile, SCRUM and Continuous DeliveryExperience on below will be a big plusMachine Learning, AI, LLM knowledge, especially on how to apply the concepts and capabilities.Message queues, streaming technologies, and event driven architecture.O365 environmentWe seek an experienced architect with following responsibilities:Understand user requirements (desired output & outcome) and existing environments (current state), and translate these into an architecture roadmap.Guide the full lifecycle of a Solution, including:Understand the Business Capabilities that are required and translate this to Technical Capabilities and Solution ArchitectureAssist the customer (and business solutions analysts) to define and declare non-functional requirements for building out solution capabilities.Document solution interactions and relationships, along with basic infrastructure and application onboarding requirementsEnsure security by design to meet Information Security policies, Legal, Compliance, Risk, and Regulatory requirements, and industry best practice.Be hands on to demonstrate tools, patterns, security, performance, scalability, etc. in a lab environment when necessary.Participate in the definition of adoption and experience metrics for the solution to measure the success of the solutionPresent architecture decisions, explain the end-to-end solution, educate others how they can contribute, and provide guidance on tool usageAct as a strategic advisor to managementContribute to the development of the Strategic ArchitectureUnderstand & be able to communicate business problems & technical solutions in appropriate terminology and ability to influence across business linesKey Responsibilities will also include:Project Management: Plan, execute, and oversee the delivery of projects from inception to completion.Team Leadership: Lead and manage a team of delivery professionals, providing guidance, support, and performance feedback.Quality Assurance: Ensure that all deliveries meet the company's quality standards and client expectations.Budget Management: Monitor and manage the budget for delivery projects, ensuring cost-effectiveness.Risk Management: Identify potential risks and develop mitigation strategies to ensure successful project delivery.Reporting: Prepare and present regular reports on project status, delivery performance, and client satisfaction.",
        "source": "Email",
        "date_posted": "2024-10-15 08:10:34-05:00",
        "unique_id": "192906dd5300cfe1",
        "emp_type": [
            "contract",
            "third party"
        ],
        "tag": "Azure Data Engineer"
    }
]