[
    {
        "company": "1st-Recruit LLC",
        "job_title": "GenAI ML Project Manager",
        "location": "Houston, TX, USA",
        "full_location": {
            "city": "Houston",
            "state": "TX",
            "country": "USA"
        },
        "job_details": {
            "employment_type": [
                "contract",
                "third party"
            ],
            "experience_required": "8+ years",
            "degree_required": "Not specified",
            "visa_sponsorship": "Not specified",
            "notice_period": "Not specified",
            "duration": "Not specified",
            "rate": "Not specified"
        },
        "skills": {
            "core": [
                "Programming",
                "Project Management",
                "AI",
                "ML"
            ],
            "primary": [
                "Generative AI",
                "Data Analysis",
                "Innovation Strategy",
                "Collaboration",
                "Risk Management"
            ],
            "secondary": [
                "Emerging Technologies",
                "Performance Forecasting",
                "Technical Reports",
                "Documentation"
            ],
            "all": [
                "Programming",
                "Project Management",
                "AI",
                "ML",
                "Generative AI",
                "Data Analysis",
                "Innovation Strategy",
                "Collaboration",
                "Risk Management",
                "Emerging Technologies",
                "Performance Forecasting",
                "Technical Reports",
                "Documentation"
            ]
        },
        "job_type": [
            "onsite"
        ],
        "contact_person": "Sapna Saini",
        "email": "sapna@1st-recruit.com",
        "jd": "From: Sapna Saini, 1st-Recruit LLC sapna@1st-recruit.com Reply to: sapna@1st-recruit.com Looking for GenAI ML Project Manager with Programming Exp. - Houston, TX - Onsite - Contract Programming and project Management:Lead proof of concept projects to test and validate new ideas from ideation to implementation, including algorithm development, data analysis and experimentation with innovative generative AI and ML solutions.2. Contribute to projects: hands-on support to running programs of AI supported driver based performance forecasting, and Generative AI driving virtual assistant.3. Innovation Strategy: Develop and execute a digital innovation strategy aligned with the companys goals and objectives, keeping abreast of emerging technologies and industry trends, through AI/ML solutions4. Idea Generation: Foster a culture of innovation by collaborating with cross-functional teams to identify and prioritize innovative ideas, processes, and solutions, with a focus on solving complex problems and advancing the state-of-the-art in AI and ML technologies.5. Technology Assessment: Evaluate emerging technologies, platforms, and tools that can be leveraged for process optimization, product development, and sustainability initiatives. Prepare withe papers, technical reports, and documentation to communicate finding and progress6. Collaboration: Collaborate with internal and external stakeholders, including research and development teams, customers, and partners, to co-create innovative solutions.7. Risk Management: Identify potential risks and challenges associated with innovation initiatives and develop mitigation strategies.Metrics and Reporting: Establish KPIs to measure the success of innovation projects and provide regular progress reports to senior management Note: Programming and project Management : AI and ML solutions. Exp >8 Yrs. Houston, TX. Onsite",
        "source": "Email",
        "date_posted": "2024-10-15 12:37:33-05:00",
        "unique_id": "19291c20a1f8c06a",
        "emp_type": [
            "contract",
            "third party"
        ],
        "tag": "Project Manager"
    }
]