[
    {
        "company": "Micasaglobal",
        "job_title": "Lead .NET Developer",
        "location": "Chandler, AZ, USA",
        "full_location": {
            "city": "Chandler",
            "state": "AZ",
            "country": "USA"
        },
        "job_details": {
            "employment_type": [
                "third party",
                "contract"
            ],
            "job_code": "",
            "experience_required": "11+ years",
            "degree_required": "Not specified",
            "visa_sponsorship": "No visa sponsorship",
            "notice_period": "Not specified",
            "duration": "Not specified",
            "rate": "Not specified"
        },
        "skills": {
            "core": [
                "C#.NET",
                "Micro Services",
                "Angular",
                "Junit",
                "Selenium"
            ],
            "primary": [
                "Java Script",
                "SOAP",
                "MQ Series",
                "Visual Studio",
                "SQL",
                "Apigee",
                "PCF",
                "AES"
            ],
            "secondary": [
                "Data Modeling",
                "Agile",
                "Iterative",
                "Waterfall",
                "Autosys",
                "Linux Servers",
                "Financial Services"
            ],
            "all": [
                "C#.NET",
                "Micro Services",
                "Angular",
                "Junit",
                "Selenium",
                "Java Script",
                "SOAP",
                "MQ Series",
                "Visual Studio",
                "SQL",
                "Apigee",
                "PCF",
                "AES",
                "Data Modeling",
                "Agile",
                "Iterative",
                "Waterfall",
                "Autosys",
                "Linux Servers",
                "Financial Services"
            ]
        },
        "job_type": [
            "onsite"
        ],
        "contact_person": "Sanjay",
        "email": "sanjay@micasaglobal.com",
        "jd": "From: Sanjay, Micasaglobal sanjay@micasaglobal.com Reply to: sanjay@micasaglobal.com Need Lead .NET Full Stack Developer ProfileC2C positionLocation:: Chandler, AZ ( Relocation candidate will also work)Onsite from day 1pls share resume at Sanjay@micasaglobal.comTitle: Lead .Net Developer Location: Chandler AZ (Onsite from day 1)Job Description Summary: Auto Technology is seeking a Lead Software Engineer who thinks strategically, exhibits long-term vision and brings the highest technical thought leadership to the organization. This role will be accountable for assisting delivery leaders within the Auto Lending Technology group by developing target state architecture of the products offered, that help realize Customer First approach through modern design and technologies. Responsibilities: Provide engineering guidance to other LOBs, help mentor senior engineers, and keep abreast with industry trends and issues. Collaborate with key partners such as Auto Lending Product Strategy & Delivery, Architecture, Engineering and Platform and application development teams in articulating current and future state of the Auto Lending technology landscape. Need to have working experience in system development methodology. Ability to utilize a thorough understanding of applicable technology, tools and existing designs. Analyzes highly complex business requirements and has the ability to write a complex functional system design to meet business requirements. Leads a team of and provides direction to less experienced analysts and developers on projects. Develop new documentation for departmental procedures, training and user guides. Assures quality, security, business continuation plan and compliance requirements are met and documented for supported area Required Qualifications, 11+ years of Engineering experience, or equivalent demonstrated through one or a combination of the following: work experience, training, military experience, education 7+ years of Software Engineering experience with C#.NET, Kafka and other languages 3+ years of Data Modeling experience 3+ years of microservices development experience and API enablement 5+ years of experience with full Software Development Life Cycle using Agile, Iterative and/or Waterfall methodologies. Must be strong in: .Net, Micro Services, Angular, Junit, Selenium Must be competent in: Java Script, SOAP, MQ Series, Visual Studio, SQL, Apigee, PCF, AES Strong verbal, written, and interpersonal communication skills Ability to multi-task in a fast-paced environment. Excellent analytical, decision-making and troubleshooting skills. Experience creating sizing or work estimates. Strong analytical skills with high attention to detail and accuracy Excellent verbal, written, and interpersonal communication skills Experience with database data modeling Experience in using source control tools Experience in working for Financial Services Companies(nice to have) Desired Qualifications: An industry-standard technology certification in .Net Strong verbal, written, and interpersonal communication skills Ability to multi-task in a fast-paced environment. Excellent analytical, decision-making and troubleshooting skills. Experience creating sizing or work estimates. Strong analytical skills with high attention to detail and accuracy Excellent verbal, written, and interpersonal communication skills Experience with schedulars like Autosys Experience with database data modeling Experience working on Linux Servers Experience in using source control tools Experience in working for Financial Services Companies Job Expectations: Willingness to work on-site at stated location, telecommuting is permitted 2 days per week Ability to work additional hours as needed This position is not eligible for work visa sponsorship Ability to work effectively in a team environment",
        "source": "Email",
        "date_posted": "2024-10-15 08:45:24-05:00",
        "unique_id": "192908eec2a0008f",
        "emp_type": [
            "third party",
            "contract"
        ],
        "tag": ".net developer"
    }
]