[
    {
        "company": "NorthITe",
        "job_title": "Technical Project Manager with ServiceNow Experience",
        "location": "Denver, CO, USA",
        "full_location": {
            "city": "Denver",
            "state": "CO",
            "country": "USA"
        },
        "job_details": {
            "employment_type": [
                "contract",
                "third party"
            ],
            "experience_required": "10-12+ years",
            "degree_required": "Not specified",
            "visa_sponsorship": "Not specified",
            "notice_period": "Not specified",
            "duration": "Long Term Contract",
            "rate": "Not specified"
        },
        "skills": {
            "core": [
                "ServiceNow",
                "Project Management"
            ],
            "primary": [
                "IT Service Management (ITSM)",
                "Communication",
                "Interpersonal Skills"
            ],
            "secondary": [],
            "all": [
                "ServiceNow",
                "Project Management",
                "IT Service Management (ITSM)",
                "Communication",
                "Interpersonal Skills"
            ]
        },
        "job_type": [
            "hybrid"
        ],
        "contact_person": "Criz Salvin",
        "email": "criz@northite.com",
        "jd": "From: Criz Salvin, NorthITe criz@northite.com Reply to: criz@northite.com Technical Project Manager with ServiceNow ExperienceLocation: Denver, CO 80206 \u2013 HybridDuration: Long Term Contract We need a Project Manager with Strong experience in ServiceNow. Certification in ServiceNow Mandatory Job Summary:Seeking an experienced Project Manager with expertise in ServiceNow. The ideal candidate will have a strong background in project management, with a focus on implementing and optimizing ServiceNow solutions. Responsibilities:The Project Manager will be responsible for overseeing the planning, execution, and delivery of ServiceNow project, ensuring they are completed on time, within scope Develop comprehensive project plans outlining tasks, timelines, and resource requirements Lead project teams in the execution of ServiceNow implementations, upgrades, and enhancementsUtilize in-depth knowledge of ServiceNow platform capabilities to drive the successful implementation of solutionsCollaborate with technical teams to design and implement ServiceNow configurations, customizations, and integrationsCommunicate effectively with internal and external stakeholders to ensure a clear understanding of project objectives, status, and risks Facilitate regular project status meetings and provide timely updates to key stakeholders Risk Management: Identify potential risks and issues that may impact project delivery and develop mitigation strategies Proactively address and resolve challenges to keep projects on track Implement and enforce best practices for ServiceNow development and configurationConduct thorough testing and quality assurance to ensure solutions meet the specified requirements Resource Management: Coordinate and allocate resources effectively to meet project demandsProvide leadership and guidance to project team members Maintain comprehensive project documentation, including project plans, status reports, and change requests Ensure that all project documentation is up-to-date and accessible Qualifications:The ideal candidate will have a strong background in project management, with a focus on implementing and optimizing ServiceNow solutions10-12+ years of proven experience as a Project Manager, with a focus on ServiceNow implementation/project managementStrong understanding of IT Service Management (ITSM) processes and ServiceNow modules Excellent communication and interpersonal skills",
        "source": "Email",
        "date_posted": "2024-10-21 08:16:11-05:00",
        "unique_id": "192af58e25721365",
        "emp_type": [
            "contract",
            "third party"
        ],
        "tag": "Project Manager"
    }
]