[
    {
        "company": "Source Infotech Inc",
        "job_title": "Senior Java Programmer",
        "location": "Richmond, VA, USA",
        "full_location": {
            "city": "Richmond",
            "state": "VA",
            "country": "USA"
        },
        "job_details": {
            "employment_type": [
                "contract",
                "third party"
            ],
            "experience_required": "5 years",
            "degree_required": "Not specified",
            "visa_sponsorship": "No visa sponsorship",
            "notice_period": "Not specified",
            "duration": "6+ month contract",
            "rate": "Not specified"
        },
        "skills": {
            "core": [
                "Core Java",
                "Java EE",
                "OOP Design",
                "Multi-Threading",
                "Generics",
                "Exception Handling",
                "Collections",
                "Java Reflection",
                "Annotation",
                "Oracle"
            ],
            "primary": [
                "Git Workflows",
                "CI/CD pipelines",
                "Azure DevOps",
                "Selenium",
                "Cucumber",
                "Playwright",
                "JUnit",
                "IBM SOA products",
                "Node.js",
                "Angular"
            ],
            "secondary": [
                "Test Left approach"
            ],
            "all": [
                "Core Java",
                "Java EE",
                "OOP Design",
                "Multi-Threading",
                "Generics",
                "Exception Handling",
                "Collections",
                "Java Reflection",
                "Annotation",
                "Oracle",
                "Git Workflows",
                "CI/CD pipelines",
                "Azure DevOps",
                "Selenium",
                "Cucumber",
                "Playwright",
                "JUnit",
                "IBM SOA products",
                "Node.js",
                "Angular",
                "Test Left approach"
            ]
        },
        "job_type": [
            "hybrid"
        ],
        "contact_person": "Bhavya Chaturvedi",
        "email": "bhavya.c@sourceinfotech.com",
        "jd": "From: Bhavya, Source infotec inc bhavya.c@sourceinfotech.com Reply to: bhavya.c@sourceinfotech.com DMAS - Senior Java Programmer6+ month contractHybrid 2 days a week on site requiredMust be local to Richmond, VAIN PERSON INTERVIEWS ONLY! NO Exceptions!Hybrid 2 days a week on site required (parking is NOT provided for contractors)No H1b !ABOUT THE ROLEThis position will serve as a senior BACK-END application developer for the DMAS Information Management Division in the design, development, and maintenance of Java/ JEE based applications.Extensive practical experience in building enterprise applications using Java EE technologies.Expertise in Core Java concepts, such as OOP Design, Multi-Threading, Generics, Exception Handling, Collections, Java Reflection, Annotation.Understanding of relational database concepts with experience in Oracle.Experience developing with Git Workflows.Experience developing CI/CD pipelines and automation.Experience using Azure DevOps.Experience with Testing Frameworks such as Selenium, Cucumber, Playwright, JUnit, and an understanding of Test Left approach to development.Experience with IBM SOA products like IIB/ACE, ODM, WAS, MQ, and ITXExperience with Front End Development using Node.js and AngularExtensive practical experience in building enterprise applications using Java EE technologies.Required:5 Years Expertise in Core Java concepts, such as OOP Design, Multi-Threading, Generics, Exception Handling, Collections, Java Reflection, Annotation,Required 5 Years Understanding of relational database concepts with experience in OracleRequired 5 Years Experience developing with Git WorkflowsRequired 5 Years Experience developing CI/CD pipelines and automationRequired 3 Years Experience using Azure DevOpsHighly desired 2 Years Experience with Testing Frameworks such as Selenium, Cucumber, Playwright, JUnit and an understanding of Test Left approach to developmentHighly desired 2 Years Experience with IBM SOA products like IIB/ACE, ODM, WAS, MQ, and ITXHighly desired 2 Years Experience with Front End Development using Node.js and AngularTHANKS & REGARDS Bhavya Chaturvedi Source Infotech IncP.O Box 577, EDISON, NJ 08818-0577EMAIL: bhavya.c@sourceinfotech.comPhone: 6097335170 | | Hangout:bhavyachaturvedi389",
        "source": "Email",
        "date_posted": "2024-10-21 10:56:37-05:00",
        "unique_id": "192afee437bfae84",
        "emp_type": [
            "contract",
            "third party"
        ],
        "tag": "Java developer"
    }
]