[
    {
        "company": "Yochana IT Solutions Inc.",
        "job_title": "GCP Data Architecture",
        "location": "USA",
        "full_location": {
            "city": "Farmington Hills",
            "state": "MI",
            "country": "USA"
        },
        "job_details": {
            "employment_type": [
                "contract",
                "third party"
            ],
            "job_code": "JD- Data Architect",
            "experience_required": "Not specified",
            "degree_required": "Not specified",
            "visa_sponsorship": "Not specified",
            "notice_period": "Not specified",
            "duration": "Not specified",
            "rate": "Not specified"
        },
        "skills": {
            "core": [
                "Data Architecture Expertise",
                "GCP Expertise",
                "SQL",
                "ETL/ELT architecture",
                "Data Integration"
            ],
            "primary": [
                "Cloud architecture design",
                "BigQuery",
                "CloudSpanner",
                "Dataflow",
                "DataForm",
                "Dataprep",
                "Healthcare APIs",
                "Python"
            ],
            "secondary": [
                "Healthcare Domain Knowledge",
                "Cost Optimization",
                "Data flow diagrams",
                "Use case models",
                "Batch processing",
                "Real-time data integration",
                "Time-management",
                "Interpersonal skills"
            ],
            "all": [
                "Data Architecture Expertise",
                "GCP Expertise",
                "SQL",
                "ETL/ELT architecture",
                "Data Integration",
                "Cloud architecture design",
                "BigQuery",
                "CloudSpanner",
                "Dataflow",
                "DataForm",
                "Dataprep",
                "Healthcare APIs",
                "Python",
                "Healthcare Domain Knowledge",
                "Cost Optimization",
                "Data flow diagrams",
                "Use case models",
                "Batch processing",
                "Real-time data integration",
                "Time-management",
                "Interpersonal skills"
            ]
        },
        "job_type": [
            "remote"
        ],
        "contact_person": "Arun kumar",
        "email": "arun@yochana.com",
        "jd": "From: Arun kumar, yochana IT arun@yochana.com Reply to: arun@yochana.com GCP Data ArchitectureRemoteContract JD- Data Architect:\u2022 Data Architecture Expertise:Lead the design and implementation of robust, scalable and secure data platform architecture that meet business requirements and industry best practices.\u2022 Solution Design Expertise: Serve as a trusted advisor to our data architecture, data engineering teams, providing guidance on cloud architecture design, implementation strategies and best practices\u2022 GCP Expertise:Demonstrate proficiency in GCP tools and services, including BigQuery, CloudSpanner, Dataflow, DataForm, Dataprep, and Healthcare APIs. Stay abreast of GCP updates and incorporate new features into our architecture\u2022 Solution Implementation: Guide, mentor and work with the development team translating architectural design into scalable system(s). Enable Continuous Integration and Continuous Deployment of data model, data pipelines, etc\u2022 Healthcare Domain Knowledge\u2022 Cost Optimization: Analyze GCP Services and spending patterns to identify opportunities for cost optimization. Provide architecture recommendations on that selection and resource allocation\u2022 Arrive at data solution diagrams including data flow diagrams, use case models, etc.\u2022 Collaborate with Data Modelers, Data Engineers, QA team and stakeholders to ensure thorough understanding of requirements and delivery integrated solution\u2022 Expert using SQL\u2022 Advanced experience with ETL/ELT architecture, Data Integration, warehouse implementations and experience with enterprise level ETL/ELT tools.\u2022 Programming language proficiency in Python, etc\u2022 Advanced understanding of data normalization and denormalization techniques.\u2022 Exposure to batch, real-time, near real-time and various data integration patterns\u2022 Strong interpersonal skills including the ability to lead and facilitate discussions with business and technical stakeholders from executive level leadership to daily hands-on contributors.\u2022 Expert in time-management and self-directed activity. Thanks & Regards....Arun kumarYochana IT Solutions Inc.,23000 Commerce Drive, Farmington Hills, MI 48335 Email: arun@yochana.com",
        "source": "Email",
        "date_posted": "2024-10-21 16:31:59-05:00",
        "unique_id": "192b11ec8ced4ae9",
        "emp_type": [
            "contract",
            "third party"
        ],
        "tag": "GCP Data Engineer"
    }
]