[
    {
        "company": "applabsystems",
        "job_title": "Senior Database developer",
        "location": "Longmont, CO, USA",
        "full_location": {
            "city": "Longmont",
            "state": "CO",
            "country": "USA"
        },
        "job_details": {
            "employment_type": [
                "contract",
                "third party"
            ],
            "job_code": "",
            "experience_required": "13+ years",
            "degree_required": "Not specified",
            "visa_sponsorship": "Not specified",
            "notice_period": "Not specified",
            "duration": "Long Term",
            "rate": "Not specified"
        },
        "skills": {
            "core": [
                "SQL Server",
                "MSBI",
                "T-SQL",
                "Performance Tuning"
            ],
            "primary": [
                "SSIS",
                "Database activity automation",
                "Enterprise Reporting solutions",
                "Power BI",
                "MongoDB"
            ],
            "secondary": [
                "Excellent written and verbal communication skills"
            ],
            "all": [
                "SQL Server",
                "MSBI",
                "T-SQL",
                "Performance Tuning",
                "SSIS",
                "Database activity automation",
                "Enterprise Reporting solutions",
                "Power BI",
                "MongoDB",
                "Excellent written and verbal communication skills"
            ]
        },
        "job_type": [
            "onsite"
        ],
        "contact_person": "Saurav Kumar",
        "email": "saurav.kumar@applabsystems.com",
        "jd": "From: saurav kumar, applabsystems saurav.kumar@applabsystems.com Reply to: saurav.kumar@applabsystems.com Role : Senior Database developerLocation : Longmont, CO and Sacramento, CA - OnsiteMode:- Contract || Long Term JD :- \u2022 Minimum of 13+ years of hands-on experience in SQL Server and MSBI (SSIS/SSAS)\u2022 Strong knowledge on writing complex T-Sql queries, Stored procedures, Functions, Triggers and Database objects.\u2022 Expertise in Performance Tuning, Database activity automation and Enterprise Reporting solutions.\u2022 Write complex queries for applications and business intelligence reporting\u2022 Handle common database procedures such as upgrade, backup, recovery, migration, etc\u2022 Install and configure SQL server in a server\u2022 4 + years of hands-on experience in SSIS\u2022 Experience developing Power BI models and dashboards\u2022 Experience in MSSQL and MongoDB is plus\u2022 Excellent written and verbal communication skillsThanks and RegardsSaurav Kumar",
        "source": "Email",
        "date_posted": "2024-10-21 15:27:59-05:00",
        "unique_id": "192b0e6dd68a878a",
        "emp_type": [
            "contract",
            "third party"
        ],
        "tag": "DB Admin"
    }
]