[
    {
        "company": "InsourceTechsolutions",
        "job_title": "Technical Project Manager (Embedded systems background)",
        "location": "Dallas, TX, USA",
        "full_location": {
            "city": "Dallas",
            "state": "TX",
            "country": "USA"
        },
        "job_details": {
            "employment_type": [
                "full-time",
                "third party"
            ],
            "job_code": "",
            "experience_required": "5+ years",
            "degree_required": "Not specified",
            "visa_sponsorship": "Not specified",
            "notice_period": "Not specified",
            "duration": "12+ Months",
            "rate": "Not specified"
        },
        "skills": {
            "core": [
                "Project Management",
                "C++",
                "Linux",
                "Agile",
                "Scrum"
            ],
            "primary": [
                "Embedded system development",
                "Device drivers",
                "Memory management",
                "SDLC",
                "OS systems",
                "System architecture",
                "iOS",
                "Android"
            ],
            "secondary": [
                "Time management",
                "Organizational skills",
                "Interpersonal skills",
                "Teamwork mentality",
                "Waterfall"
            ],
            "all": [
                "Project Management",
                "C++",
                "Linux",
                "Agile",
                "Scrum",
                "Embedded system development",
                "Device drivers",
                "Memory management",
                "SDLC",
                "OS systems",
                "System architecture",
                "iOS",
                "Android",
                "Time management",
                "Organizational skills",
                "Interpersonal skills",
                "Teamwork mentality",
                "Waterfall"
            ]
        },
        "job_type": [
            "onsite"
        ],
        "contact_person": "venkat",
        "email": "venkatk@insourcetechsolutions.com",
        "jd": "From: venkat, InsourceTechsolutions venkatk@insourcetechsolutions.com Reply to: venkatk@insourcetechsolutions.com Job Title: Technical Project Manager (Embedded systems background) Location: Dallas, TX (Day 1 onsite) Duration: 12+ Months Responsibilities: \u00b7 Demonstrated understanding of Project Management processes, strategies, and methods \u00b7 Knowledge of operating system internals, embedded system development and bring-up, device drivers, and memory management for NPI programs. \u00b7 Familiarity of SDLC \u00b7 C++ and Linux experience \u00b7 Solid understanding of Agile, Scrum, and Kanban development methodologies. \u00b7 Good understanding of OS systems, media, and system architecture \u00b7 Understanding of iOS and Android platform \u00b7 Excellent time management and organizational skills \u00b7 Experience working in a high-level collaborative environment and promoting a teamwork mentality \u00b7 Strong interpersonal skills and the ability to work with many different personality types \u00b7 Experience in project management models including Agile, Waterfall, and Scrum \u00b7 5+ years demonstrate ability in engineering development and project management are required",
        "source": "Email",
        "date_posted": "2024-10-21 06:20:17-05:00",
        "unique_id": "192aeeec654f9322",
        "emp_type": [
            "full-time",
            "third party"
        ],
        "tag": "Project Manager"
    }
]