[
    {
        "company": "Webster Tech Solutions INC",
        "job_title": "Agile Scrum Master",
        "location": "Chicago, IL, USA",
        "full_location": {
            "city": "Chicago",
            "state": "IL",
            "country": "USA"
        },
        "job_details": {
            "employment_type": [
                "full-time",
                "third party"
            ],
            "experience_required": "15+ years",
            "degree_required": "Not specified",
            "visa_sponsorship": "Not specified",
            "notice_period": "Not specified",
            "duration": "12+ Months",
            "rate": "Not specified"
        },
        "skills": {
            "core": [
                "Agile Transformation",
                "Agile Portfolio Management",
                "Scrum",
                "Kanban",
                "Agile Delivery"
            ],
            "primary": [
                "Coaching",
                "Mentoring",
                "Agile Training",
                "Process Adherence",
                "Tool Adherence",
                "Agile Culture"
            ],
            "secondary": [
                "Communication Skills",
                "Organizational Design",
                "DevOps Practices",
                "Innovative Thinking",
                "Agile Thought Leadership"
            ],
            "all": [
                "Agile Transformation",
                "Agile Portfolio Management",
                "Scrum",
                "Kanban",
                "Agile Delivery",
                "Coaching",
                "Mentoring",
                "Agile Training",
                "Process Adherence",
                "Tool Adherence",
                "Agile Culture",
                "Communication Skills",
                "Organizational Design",
                "DevOps Practices",
                "Innovative Thinking",
                "Agile Thought Leadership"
            ],
            "with_experience": [
                "Agile Transformation",
                "Agile Portfolio Management",
                "Scrum",
                "Kanban",
                "Agile Delivery"
            ]
        },
        "job_type": [
            "hybrid"
        ],
        "contact_person": "Rahman, Webster",
        "email": "rahman@webstertechsolutions.com",
        "jd": "From: Rahman, Webster Tech Solutions INC rahman@webstertechsolutions.com Reply to: rahman@webstertechsolutions.com Role: Agile Scrum Master \u2013 (15+ Yrs Exp.)Location: Chicago, IL \u2013 Hybrid (Day 1 Onsite) Need Local candidates Duration: 12+ Months Note: Top 5 Skill setsHas been in some leadership role on Agile TransformationHas developed Agile Portfolio Management, Center of Excellence and Understands Agile Delivery (Scum, Kanban)Coach Role \u2013 Has great personality, can influence, Communicate and collaborate with different leaders and business stakeholders. Can influence business leaders on Agile way of workingHas been part of Agile Transformation, Where they have seen the transformation from a Waterfall to a Agile DeliveryThis person is a doer, brings to the table external perspective on challenges and pitfalls and is able to hit the ground running quickly. They have the leadership ability to work with different teams and enable the teams to align on the Agile transformation and Agile way of working.Great communication skills \u2013 verbal and Written( Narratives, Executive Decks). Is knowledgeable on organizational design and the role of culture to create high performing teams. Job Description: Seeking an Agile Trainer/Coach. In addition to the following responsibilities you will be responsible for working with teams and leadership on Agile adoption, facilitating workshops, removing impediments and obstacles programs and teams are experiencing, monitoring training and reporting on productivity improvement, creating standards and processes and training. The Agile Trainer/Coach will be engaged throughout the enterprise transformation to facilitate a smooth transformation into Agile processes. Responsibilities: Coaching: Working with teams to institute, practice, and adopt Scrum and Agile techniques. Identify and introduce opportunities for the team to improve through coaching and questioning. Mentoring: Serve as a mentor to Scrum Masters, Product Managers and other Agile leaders with an aim to make Agile techniques successful, resilient and permanent. Training: Collaborate to develop Agile training materials, newsletters, and support communities as they relate to Agile practices. Provide Agile and role-specific training (group and one-on-one) for management, team members, Product Owners, and Scrum Masters. Observing / Assessments: Observe program and team activities (e.g., sprint, release and roadmap planning) and provide constructive feedback to teams and leads. Critical impediments and non-adherence to the Agile core principles should be brought to leadership attention immediately. Process Adherence: Work with the teams to ensure adherence to the defined Scrum processes and framework (status reporting, compliance, estimation). Tool Adherence: Work with the teams to ensure the appropriate tools are being leveraged and enterprise practices are being followed to enable consistency and metrics where needed. Culture: Work with management and teams to strengthen our Agile culture. Skills/Requirements: Experience in delivering Agile training and coaching in a transforming organization 5+ years experience working in an Agile environment and experience with Agile development methodologies (i.e. Scrum, XP, Kanban, Lean, etc.) One or more Expert-level Agile certification(s) - PMI Agile Certified Practitioner (PMI-ACP), SAFe Program Consultant (SPC), Certified Scrum Professional (CSP), or other Agile related certifications a plus Knowledge and experience in Waterfall project management Experience implementing and continually improving Agile principles and practices, and coaching the customer on the recommended approach Strong written and verbal communications skills, including the ability to communicate solutions effectively to technical and non-technical audiences. Technical background with a deep understanding of modern DevOps practices preferred Innovative thinking \u2013 ability to learn new tools and techniques and apply them to the program Experienced in Agile Thought Leadership *** Manager would ideally like to review local candidates. Please focus on candidates local to Chicago area first ***",
        "source": "Email",
        "date_posted": "2024-10-21 10:55:04-05:00",
        "unique_id": "192afee6876273b8",
        "emp_type": [
            "full-time",
            "third party"
        ],
        "tag": "Scrum Master"
    }
]