[
    {
        "company": "Arthur Grand Technologies",
        "job_title": "AWS Data Engineer",
        "location": "Wilmington, DE, USA",
        "full_location": {
            "city": "Wilmington",
            "state": "DE",
            "country": "USA"
        },
        "job_details": {
            "employment_type": [
                "contract",
                "third party"
            ],
            "experience_required": "Not specified",
            "degree_required": "BS/BA degree or equivalent experience",
            "visa_sponsorship": "Not specified",
            "notice_period": "Not specified",
            "duration": "Contract",
            "rate": "Not specified"
        },
        "skills": {
            "core": [
                "Java",
                "Spark",
                "AWS Glue",
                "Terraform",
                "Lambda",
                "S3",
                "EMR"
            ],
            "primary": [
                "Lake formation",
                "Glue ETL",
                "Catalog",
                "Athena",
                "Kinesis",
                "MSK",
                "Airflow",
                "Step Functions",
                "Event Bridge"
            ],
            "secondary": [
                "Linux Scripting",
                "Jenkins",
                "Git",
                "CI/CD",
                "JIRA"
            ],
            "all": [
                "Java",
                "Spark",
                "AWS Glue",
                "Terraform",
                "Lambda",
                "S3",
                "EMR",
                "Lake formation",
                "Glue ETL",
                "Catalog",
                "Athena",
                "Kinesis",
                "MSK",
                "Airflow",
                "Step Functions",
                "Event Bridge",
                "Linux Scripting",
                "Jenkins",
                "Git",
                "CI/CD",
                "JIRA"
            ]
        },
        "job_type": [
            "onsite"
        ],
        "contact_person": "Sindhu",
        "email": "sindhu.c@arthurgrand.com",
        "jd": "From: Team Afrah, Arthur Grand Technologies teamafrah@arthurgrand.com Reply to: teamafrah@arthurgrand.com Arthur Grand Technologies is currently seeking a highly motivated of AWS Data Engineer one of our client. Position: AWS Data EngineerLocation: Wilmington, DE (Day 1 onsite)Duration: Contract Mandatory Skills: Java, Spark, AWS Glue, Terraform, Lambda, S3, EMR Must Have:BS/BA degree or equivalent experienceGeneral: Strong organizational, problem-solving, and critical thinking skills; Strong documentation skillsCoding: Proficiency in JavaCluster Computing frameworks: Proficiency in Spark and Spark SQLAWS Data Services: Proficiency in Lake formation, Glue ETL (or) EMR, S3, Catalog, Athena, Kinesis (or) MSK, Airflow (or) Lambda + Step Functions + Event BridgeData De/Serialization: Expertise in at least 2 of the formats: Parquet, Iceberg, AVRO, JSON-LDAWS Data Security: Good Understanding of security concepts such as: Lake formation, IAM, Service roles, Encryption, KMS, Secrets Manager Good to Have:Linux Scripting, JenkinsDevOps: Git, CI/CD, JIRA, TD About Arthur Grand Technologies: Arthur Grand Technologies is a leading provider of staffing and technology consulting services. Our company is managed by a team of professionals who have worked for big 5 consulting firms for 20+ years. We are a minority-owned staff augmentation and technology consulting company.At Arthur Grand Technologies, we value our employees & contractors and strive to provide them with challenging, interesting work, market-relevant benefits, and opportunities for professional growth. If you have the necessary qualifications, and are excited to join a dynamic team, please send your resume to sindhu.c@arthurgrand.com for immediate consideration.Thank you for considering Arthur Grand Technologies. We look forward to hearing from you soon. Best regards,Sindhusindhu.c@arthurgrand.comArthur Grand Technologies Incwww.arthurgrand.comArthur Grand Technologies is an Equal Opportunity Employer (including disability/vets)",
        "source": "Email",
        "date_posted": "2024-10-21 11:15:22-05:00",
        "unique_id": "192afffdbeb4f5d8",
        "emp_type": [
            "contract",
            "third party"
        ],
        "tag": "AWS Data Engineer"
    }
]