[
    {
        "company": "InfoLogitech, Inc",
        "job_title": "NC FAST Data Engineer",
        "location": "Durham, NC, USA",
        "full_location": {
            "city": "Durham",
            "state": "NC",
            "country": "USA"
        },
        "job_details": {
            "employment_type": [
                "contract",
                "third party"
            ],
            "job_code": "749832",
            "experience_required": "5 years",
            "degree_required": "Not specified",
            "visa_sponsorship": "Not specified",
            "notice_period": "Not specified",
            "duration": "10 Months",
            "rate": "Not specified"
        },
        "skills": {
            "core": [
                "Oracle",
                "PL/SQL",
                "SQL",
                "data migrations",
                "data cleansing"
            ],
            "primary": [
                "ETL processes",
                "Salesforce",
                "Talend",
                "GIT",
                "Jira"
            ],
            "secondary": [
                "Java",
                "Python",
                "cloud platforms",
                "Azure Synapse",
                "Azure Databricks",
                "Power BI"
            ],
            "all": [
                "Oracle",
                "PL/SQL",
                "SQL",
                "data migrations",
                "data cleansing",
                "DB2",
                "ETL processes",
                "Salesforce",
                "Talend",
                "GIT",
                "Jira",
                "Java",
                "Python",
                "cloud platforms",
                "AWS",
                "Azure",
                "Azure Synapse",
                "Azure Databricks",
                "Cloud Computing",
                "Power BI"
            ]
        },
        "job_type": [
            "onsite"
        ],
        "contact_person": "Megha",
        "email": "mveeranki@infologitech.com",
        "jd": "Hi Greetings from Info Logitech, IncHere is our open requirement which can be filled immediately Kindly respond to this requirement with your resume, contact and current location info to speed up the interview process Job Position: NC FAST Data Engineer \u2013 749832Job Location: Durham NCJob Duration: 10 Months Job Description : DHHS-ITD requires the services of Specialists in the roles of Data Engineers that will analyze, map, build, test, and maintain database pipeline architectures using Oracle and DB2 for Child Welfare Data Conversion effortsThe Department of Health and Human Services (DHHS) requires the assistance of contract resources to serve as Data Engineers. The primary purpose of these positions is to analyze, map, build, test, and maintain database pipeline architectures using Oracle and DB2 for Child Welfare Data Conversion efforts as the legacy system migrates to Salesforce. The work involves collaborating with various stakeholders to understand business requirements and translating them into efficient and scalable technical solutions for the Child Welfare program. The persons in this position will play a crucial role in designing, implementing, and optimizing data pipelines and ETL processes to support the extraction, transformation, and loading of data from various Child Welfare sources into Salesforce. They will collaborate with cross-functional teams to understand data requirements and translate them into technical solutions. The data engineers will need excellent problem-solving skills and the ability to work independently as well as part of a team. The work involves developing and maintaining data models, schemas, and databases to support data conversion needs. The work also involves monitoring and troubleshooting data pipelines to ensure data quality, completeness, integrity, and availability. This position will be implementing best practices for data governance, security, and compliance to ensure regulatory requirements are met. Responsibilities and Duties: Analyze, Map, Build, Test, and Maintain database pipeline architectures using Oracle and DB2Collaborate with SMEs to understand and execute data conversion objectives that transforms, masks, and loads data into Salesforce objectsCreate and maintain table schemasCreate new data validation methods to ensure data accuracy, completeness, and cleanlinessEnsure compliance with data governance and security policies Skills:Experience with Oracle Required 5 YearsExperience with PL/SQL Required 5 YearsExperience with SQL Required 7 YearsExperience with data migrations from legacy systems Required 5 YearsExperience with data cleansing Required 1 YearsExperience with DB2 Highly desired 1 YearsExperience with ETL processes involving Salesforce Highly desired 1 YearsExperience with Talend Highly desired 1 YearsExperience with GIT Highly desired 1 YearsExperience with Jira Highly desired 1 YearsExperience with Java Highly desired 5 YearsExperience with Python Highly desired 3 YearsExperience with cloud platforms (e.g. AWS and Azure) and associated services for data processing and storage Highly desired 1 YearsExperience with Azure Synapse Highly desired 2 YearsExperience with Azure Databricks Nice to have 1 YearsExperience with Cloud Computing Nice to have 1 YearsExperience with Power BI Nice to have 1 Years",
        "source": "Email",
        "date_posted": "2024-10-21 11:20:44-05:00",
        "unique_id": "192b00459855b765",
        "emp_type": [
            "contract",
            "third party"
        ],
        "tag": "AWS Data Engineer"
    }
]