[
    {
        "company": "Vyze Inc",
        "job_title": "Python Developer within Unix/LINUX",
        "location": "Dallas, TX, USA",
        "full_location": {
            "city": "Dallas",
            "state": "TX",
            "country": "USA"
        },
        "job_details": {
            "employment_type": [
                "full-time",
                "third party"
            ],
            "job_code": "",
            "experience_required": "5-10 years",
            "degree_required": "Bachelor's degree in Computer Science, Software Engineering, or a related field",
            "visa_sponsorship": "Must have existing work authorization",
            "notice_period": "Not specified",
            "duration": "Not specified",
            "rate": "Not specified"
        },
        "skills": {
            "core": [
                "Python",
                "Perl",
                "Unix",
                "Shell scripting"
            ],
            "primary": [
                "Agile",
                "Scrum",
                "Kanban",
                "Git",
                "Jenkins",
                "JIRA",
                "Confluence",
                "Cyber security"
            ],
            "secondary": [
                "Problem-solving",
                "Communication",
                "Team collaboration",
                "Financial services",
                "Capital markets"
            ],
            "all": [
                "Python",
                "Perl",
                "Unix",
                "Shell scripting",
                "Agile",
                "Scrum",
                "Kanban",
                "Git",
                "Jenkins",
                "JIRA",
                "Confluence",
                "Cyber security",
                "Problem-solving",
                "Communication",
                "Team collaboration",
                "Financial services",
                "Capital markets"
            ]
        },
        "job_type": [
            "hybrid"
        ],
        "contact_person": "Deepak Singh",
        "email": "deepak@vyzeinc.com",
        "jd": "From: Deepak Singh, Vyze Inc deepak@vyzeinc.com Reply to: deepak@vyzeinc.com Job Description -Note:- Resume must be in 3 pages. Candidate write-up (why she/he is best for this role). Please mention full details of education in resume. Dallas, Texas, HybridTitle:- Python Developer within Unix/LINUX Visa:- H4-EAD OR OPT EAD onlyLOCATION:-To work 5 days a week in Dallas, Texas. NoteSeeking an expert PERl and/or Python Developer within Unix/LINUX environment.To work 5 days a week in Dallas, Texas.Really need expert level with at least 5 years in USA and 8-10 years total is preferred.Candidate has to be OPT-EAD or H4-EAD. It is an investment bank..Job Description:We are seeking a talented and motivated Software Engineer to join our team at client. In this role, you will be responsible for designing, developing, testing, and deploying software solutions for various initiatives within the company. You will collaborate with cross-functional teams to ensure high-quality, efficient, and scalable software solutions.Responsibilities:Work on modernizing and reducing risks in Perl ecosystem by designing, developing and deploying appropriate changes including uplifts to modernized software stack and decommission.Collaborate with cross-functional teams to gather requirements, define project scope, and ensure timely delivery of software solutions.Write clean, efficient, and scalable code that follows industry standards and best practices.Conduct testing to ensure software quality and functionality.Participate in code reviews and provide feedback to peers to ensure code quality and maintainability.Troubleshoot and debug software issues in a timely and efficient manner.Stay up-to-date with emerging trends, technologies, and best practices in software development and contribute to the continuous improvement of our software engineering practices.Skills: Qualifications:Over 5 years of experience in software engineering or related fields.Strong programming skills in one or more of the following languages: Perl, PythonExperience working in a Unix operating system and shell scriptsExperience with software development methodologies such as Agile, Scrum, or Kanban.Experience with software development tools and technologies such as Git, Jenkins, JIRA, and Confluence.Experience working with certificates, encryption and cyber securityStrong problem-solving skills and ability to think creatively and critically.Strong written and verbal communication skills and ability to work collaboratively in a team environment.Familiarity with financial services and/or capital markets is a plus.Education: Bachelor's degree in Computer Science, Software Engineering, or a related field.",
        "source": "Email",
        "date_posted": "2024-10-21 17:20:34-05:00",
        "unique_id": "192b1d51a769d45a",
        "emp_type": [
            "full-time",
            "third party"
        ],
        "tag": "Python developer"
    }
]