[
    {
        "company": "Tek Inspirations LLC",
        "job_title": "Senior Java Developer",
        "location": "Lansing, MI, USA",
        "full_location": {
            "city": "Lansing",
            "state": "MI",
            "country": "USA"
        },
        "job_details": {
            "employment_type": [
                "contract",
                "third party"
            ],
            "experience_required": "12+ years",
            "degree_required": "Not specified",
            "visa_sponsorship": "Not specified",
            "notice_period": "Not specified",
            "duration": "12 month contract",
            "rate": "Not specified"
        },
        "skills": {
            "core": [
                "Java",
                "SQL",
                "Java JEE",
                "Spring/SpringBoot Framework",
                "Angular",
                "React JS"
            ],
            "primary": [
                "Eclipse",
                "STS",
                "PL/SQL",
                "JavaScript",
                "AWS",
                "Databricks",
                "Elastic search"
            ],
            "secondary": [],
            "all": [
                "Java",
                "SQL",
                "Java JEE",
                "Spring/SpringBoot Framework",
                "Angular",
                "React JS",
                "Eclipse",
                "STS",
                "PL/SQL",
                "JavaScript",
                "AWS",
                "Databricks",
                "Elastic search"
            ],
            "with_experience": [
                "Java (12+ years)",
                "SQL (12+ years)",
                "Java JEE (8+ years)",
                "Spring/SpringBoot Framework (8+ years)",
                "Angular/React JS (5+ years)",
                "AWS (5+ years)",
                "Databricks (5+ years)",
                "Elastic search (5+ years)"
            ]
        },
        "job_type": [
            "hybrid"
        ],
        "contact_person": "Nitin Tehriya",
        "email": "nitin.tehriya@tekinspirations.com",
        "jd": "From: Nitin Tehriya, Tek Inspirations LLC nitin.tehriya@tekinspirations.com Reply to: nitin.tehriya@tekinspirations.com Senior Java DeveloperLocation: Hybrid - onsite 2 days per week - Lansing, Michigan \u2013 Need Local with DL Duration: 12 month contract Top Skill & Years of Experience Required:\u2022 12+ years developing complex computer systems using Java.\u2022 12+ years developing complex computer systems using Java IDEs such as Eclipse, STS\u2022 12+ years programming in SQL and/or PL/SQL.\u2022 8+ years programming using Java JEE Struts and JEE Spring/SpringBoot Framework 3.0.\u2022 5+ years in projects development using Angular/React JS, JavaScript framework.\u2022 5+ years' experience with AWS, Databricks, and Elastic search.",
        "source": "Email",
        "date_posted": "2024-10-21 17:05:51-05:00",
        "unique_id": "192b13dca68f65bf",
        "emp_type": [
            "contract",
            "third party"
        ],
        "tag": "Java developer"
    }
]