[
    {
        "company": "Sibitalent",
        "job_title": "BI Data Engineer",
        "location": "USA",
        "full_location": {
            "city": "",
            "state": "",
            "country": "USA"
        },
        "job_details": {
            "employment_type": [
                "third party"
            ],
            "job_code": "",
            "experience_required": "5+ years",
            "degree_required": "BE/B.Tech in Computer Science or related field",
            "visa_sponsorship": "Not specified",
            "notice_period": "Not specified",
            "duration": "Not specified",
            "rate": "Not specified"
        },
        "skills": {
            "core": [
                "SQL",
                "Spark",
                "Scala",
                "Python",
                "Azure",
                "Big Data",
                "Apache Nifi",
                "Hadoop",
                "HDInsights",
                "ADF",
                "ADW"
            ],
            "primary": [
                "Power BI",
                "Tableau",
                "Powershell",
                "Bash",
                "Data Warehousing",
                "ETL",
                "Cloud Computing",
                "Data Analytics",
                "Test Driven Development",
                "Continuous Integration",
                "Continuous Deployment",
                "SCRUM",
                "Devops"
            ],
            "secondary": [
                "Automation tools",
                "Problem-solving",
                "Debugging",
                "Agile methodologies",
                "Communication skills"
            ],
            "all": [
                "SQL",
                "Spark",
                "Scala",
                "Python",
                "Azure",
                "Big Data",
                "Apache Nifi",
                "Hadoop",
                "HDInsights",
                "ADF",
                "ADW",
                "Power BI",
                "Tableau",
                "Powershell",
                "Bash",
                "Data Warehousing",
                "ETL",
                "Cloud Computing",
                "Data Analytics",
                "Test Driven Development",
                "Continuous Integration",
                "Continuous Deployment",
                "SCRUM",
                "Devops",
                "Automation tools",
                "Problem-solving",
                "Debugging",
                "Agile methodologies",
                "Communication skills"
            ]
        },
        "job_type": [
            "remote"
        ],
        "contact_person": "Saurabh Sharma",
        "email": "ssaurabh@sibitalent.com",
        "jd": "From: Saurabh sharma, Sibitalent ssaurabh@sibitalent.com Reply to: ssaurabh@sibitalent.com Hi this side saurabh From SibitalentI have a Job Opportunity For YouPosition:- BI Data EngineerLocation:- RemoteRequired Skills:- \u2022 BE/B.Tech in Computer Science or related field\u2022 5+ years of enterprise software design and development experience\u2022 Proficiency in SQL, with experience in writing and optimizing complex queries\u2022 Professional, practical programming using Spark, SQL, Scala/Python\u2022 Strong technical expertise in Azure, Big Data, Apache Nifi, Hadoop, HDInsights, ADF, ADW etc.\u2022 Experience working with reporting and visualization tools like Power BI, Tableau, or similar.\u2022 Hands-on experience with scripting languages like Powershell/Bash for automation and data manipulation tasks.\u2022 Extensive knowledge and experience in data warehousing, Streaming data processing (ETL), e-metrics/measurement, business intelligence, information retrieval, parallel and distributed computation\u2022 Experience in implementation of Cloud Computing concepts and platforms\u2022 Experience in analyzing very large real world datasets and hands-on approach in data analytics\u2022 Experience with Test Driven Development, Continuous Integration, Continuous Deployment, Telemetry etc.\u2022 Great design and problem-solving skills, with a strong bias for quality and engineering excellence\u2022 Excellent verbal and written communications skills\u2022 Excellent problem-solving and debugging skills with a solid understanding of testing practices\u2022 Proven sense of high accountability and self-drive to take on and see through big challenges\u2022 Experience working in a global delivery model\u2022 Experience with SCRUM, Devops or similar Agile development/implementation methodologies\u2022 Familiarity with automation tools \u2013 Visual Studio etc",
        "source": "Email",
        "date_posted": "2024-10-21 09:54:54-05:00",
        "unique_id": "192afee796a772af",
        "emp_type": [
            "third party"
        ],
        "tag": "Azure Data Engineer"
    }
]