[
    {
        "company": "Code Infotek Inc",
        "job_title": "Back-End Java Developer",
        "location": "Boston, MA, USA",
        "full_location": {
            "city": "Boston",
            "state": "MA",
            "country": "USA"
        },
        "job_details": {
            "employment_type": [
                "full-time",
                "third party"
            ],
            "job_code": "",
            "experience_required": "8+ years",
            "degree_required": "Not specified",
            "visa_sponsorship": "No visa sponsorship",
            "notice_period": "Not specified",
            "duration": "Not specified",
            "rate": "Not specified"
        },
        "skills": {
            "core": [
                "Java",
                "AWS",
                "Microservices",
                "Kafka",
                "CI/CD pipelines",
                "Spring Boot",
                "Spring Security"
            ],
            "primary": [],
            "secondary": [],
            "all": [
                "Java",
                "AWS",
                "Microservices",
                "Kafka",
                "CI/CD pipelines",
                "Spring Boot",
                "Spring Security"
            ]
        },
        "job_type": [
            "hybrid"
        ],
        "contact_person": "Rohit Yadav",
        "email": "rohit@codeinfotek.com",
        "jd": "From: Rohit Yadav, Code Infotek Inc rohit@codeinfotek.com Reply to: rohit@codeinfotek.com Back-End Java Developer Hybrid \u2013 Boston, MAMust have a LinkedIn profile to apply and provide manager references via LinkedIn.3rd-round interview will be conducted onsite in Boston-Local or nearby candidatesMust be able to work in a hybrid model (partially onsite)4 days onsiteNo h1b and cptWe are seeking an experienced Back-End Java Developer for a hybrid role based in Boston, MA. Must have 8+ years of experience and meet the following qualifications:\u2022 Java (including Multi-threading)\u2022 AWS\u2022 Microservices\u2022 Kafka or MQ\u2022 CI/CD pipelines\u2022 Spring Boot & Spring SecurityThanks & Regards...Rohit Yadav !! Code Infotek IncTechnical Recruiter 11350 Random Hills Rd. Suite 800 Fairfax, VA 22030Web: www.codeinfotek.com",
        "source": "Email",
        "date_posted": "2024-10-21 15:57:05-05:00",
        "unique_id": "192b0fed42a23f10",
        "emp_type": [
            "full-time",
            "third party"
        ],
        "tag": "Java developer"
    }
]