[
    {
        "company": "RCI",
        "job_title": "Azure Databricks Consultant",
        "location": "Jersey City, NJ, USA",
        "full_location": {
            "city": "Jersey City",
            "state": "NJ",
            "country": "USA"
        },
        "job_details": {
            "employment_type": [
                "full-time",
                "third party"
            ],
            "job_code": "",
            "experience_required": "5 years",
            "degree_required": "Not specified",
            "visa_sponsorship": "Visa sponsorship available",
            "notice_period": "Not specified",
            "duration": "Not specified",
            "rate": "Not specified"
        },
        "skills": {
            "core": [
                "Databricks",
                "Pyspark",
                "Azure Data Factory",
                "Azure SQL DB",
                "Datawarehouse"
            ],
            "primary": [
                "Azure cloud components",
                "Azure Data Analytics",
                "Azure Data Lake",
                "Azure Data Catalogue",
                "LogicApps",
                "FunctionApps",
                "SQL",
                "T-SQL",
                "PL/SQL"
            ],
            "secondary": [
                "Agile",
                "Jira",
                "Data Ingestion projects"
            ],
            "all": [
                "Databricks",
                "Pyspark",
                "Azure Data Factory",
                "Azure SQL DB",
                "Datawarehouse",
                "Azure cloud components",
                "Azure Data Analytics",
                "Azure Data Lake",
                "Azure Data Catalogue",
                "LogicApps",
                "FunctionApps",
                "SQL",
                "T-SQL",
                "PL/SQL",
                "Agile",
                "Jira",
                "Data Ingestion projects"
            ]
        },
        "job_type": [
            "onsite",
            "hybrid"
        ],
        "contact_person": "Prakash Singh",
        "email": "prakash@rconsultinginc.com",
        "jd": "From: Prakash Singh, RCI prakash@rconsultinginc.com Reply to: prakash@rconsultinginc.com Title: Azure Databricks ConsultantLocation: MUST BE ONSITE 2X WEEK (Jersey City, NJ, United States) (MUST LIVE LOCALLY TO NEW JERSEY)Must be able to interview onsite. First interview video and 2nd interview onsiteVISA H1B OR H4EAD ONLYMUST HAVE LINKEDIN PROFILE AT LEAST 5 YEARS OLDMust have Databricks and PysparkLocation: Jersey City, NJ, United StatesOnsite Flexibility: 60% Remote/2 days week onsite in Jersey City NJDescription: RESPONSIBILITIESBuild large-scale batch and real-time data pipelines with data processing frameworks in Azure cloud platform.Designing and implementing highly performant data ingestion pipelines from multiple sources using Azure Databricks.Direct experience of building data pipelines using Azure Data Factory and Databricks.Developing scalable and re-usable frameworks for ingesting of datasetsLead design of ETL, data integration and data migration.Partner with architects, engineers, information analysts, business, and technology stakeholders for developing and deploying enterprise grade platforms that enable data-driven solutions.Integrating the end to end data pipeline - to take data from source systems to target data repositories ensuring the quality and consistency of data is maintained at all timesWorking with event based / streaming technologies to ingest and process dataWorking with other members of the project team to support delivery of additional project components (API interfaces, Search)Evaluating the performance and applicability of multiple tools against customer requirementsREQUIREMENTSExperience on ADLS, Azure Databricks, Azure SQL DB and DatawarehouseStrong working experience in Implementation of Azure cloud components using Azure Data Factory , Azure Data Analytics, Azure Data Lake, Azure Data Catalogue, LogicApps and FunctionAppsHave knowledge in Azure Storage services (ADLS, Storage Accounts)Expertise in designing and deploying data applications on cloud solutions on AzureHands on experience in performance tuning and optimizing code running in Databricks environmentGood understanding of SQL, T-SQL and/or PL/SQLShould have experience working in Agile projects with knowledge in JiraGood to have handled Data Ingestion projects in Azure environment",
        "source": "Email",
        "date_posted": "2024-10-21 14:19:56-05:00",
        "unique_id": "192b0a611fda389a",
        "emp_type": [
            "full-time",
            "third party"
        ],
        "tag": "Azure Data Engineer"
    }
]