[
    {
        "company": "Gacsol",
        "job_title": "Full Stack Java Developer",
        "location": "Whippany, NJ, USA",
        "full_location": {
            "city": "Whippany",
            "state": "NJ",
            "country": "USA"
        },
        "job_details": {
            "employment_type": [
                "full-time",
                "third party"
            ],
            "experience_required": "12+ years",
            "degree_required": "Bachelor\u2019s degree in computer science, Engineering, or a related field.",
            "visa_sponsorship": "Not specified",
            "notice_period": "Not specified",
            "duration": "Not specified",
            "rate": "Not specified"
        },
        "skills": {
            "core": [
                "Java",
                "Spring",
                "REST Services",
                "AWS"
            ],
            "primary": [
                "React",
                "HTML",
                "CSS",
                "JavaScript",
                "Spring Boot",
                "MySQL",
                "PostgreSQL",
                "MongoDB",
                "Git",
                "Docker",
                "Kubernetes"
            ],
            "secondary": [
                "Angular",
                "Vue.js",
                "Microservices architecture",
                "DevOps practices",
                "Certification in Java development"
            ],
            "all": [
                "Java",
                "Spring",
                "REST Services",
                "AWS",
                "React",
                "HTML",
                "CSS",
                "JavaScript",
                "Spring Boot",
                "MySQL",
                "PostgreSQL",
                "MongoDB",
                "Git",
                "Docker",
                "Kubernetes",
                "Angular",
                "Vue.js",
                "Microservices architecture",
                "DevOps practices",
                "Certification in Java development"
            ]
        },
        "job_type": [
            "onsite"
        ],
        "contact_person": "Barla Santosh",
        "email": "sbarla@gacsol.com",
        "jd": "From: Barla Santosh, Gacsol sbarla@gacsol.com Reply to: sbarla@gacsol.com Title: Full Stack Java DeveloperLocation: WHIPPANY NJ (onsite)Client note:Looking overall 12+ years and 4+ years in reactExperience with cloud platforms (e.g., AWS, Azure, Google Cloud). 1. Full Stack Development:Spring, Spark, Java, REST Services, AWS\u2022 Design, develop, and maintain high-performance and scalable web applications using Java technologies.\u2022 Implement both front-end and back-end components to ensure seamless user experiences.2. Front-end Development:\u2022 Develop responsive and user-friendly interfaces using HTML, CSS, and JavaScript frameworks (e.g., Angular, React, or Vue.js).\u2022 Collaborate with UX/UI designers to implement visually appealing and intuitive user interfaces.3. Back-end Development:\u2022 Design and implement server-side logic using Java technologies (e.g., Spring Boot).\u2022 Develop RESTful APIs to facilitate seamless communication between front-end and back-end systems.4. Database Management:\u2022 Design and optimize database schemas.\u2022 Implement data storage solutions using relational databases (e.g., MySQL, PostgreSQL) or NoSQL databases (e.g., MongoDB).5. Code Optimization and Performance Tuning:\u2022 Identify and address performance bottlenecks in the application.\u2022 Optimize code for maximum speed and scalability.6. Testing and Debugging:\u2022 Write unit tests and conduct thorough debugging to ensure the reliability and stability of the application.\u2022 Collaborate with quality assurance teams to perform testing and ensure the delivery of high-quality software.7. Collaboration:\u2022 Work closely with cross-functional teams, including product managers, UX/UI designers, and other developers, to deliver quality software solutions.\u2022 Participate in code reviews to maintain code quality and ensure adherence to coding standards.8. Continuous Learning:\u2022 Stay updated on the latest industry trends, technologies, and best practices.\u2022 Share knowledge and mentor junior developers within the team.Requirements:\u2022 Bachelor\u2019s degree in computer science, Engineering, or a related field.\u2022 Proven experience as a Full Stack Java Developer or similar role.\u2022 Strong proficiency in Java programming language and related frameworks (e.g., Spring, Hibernate).\u2022 Experience with front-end technologies such as HTML, CSS, JavaScript, and popular frameworks (e.g., Angular, React, or Vue.js).\u2022 Proficient in database design and management using relational and/or NoSQL databases.\u2022 Experience with version control systems (e.g., Git).\u2022 Knowledge of RESTful API design and implementation.\u2022 Familiarity with containerization and deployment tools (e.g., Docker, Kubernetes).\u2022 Excellent problem-solving and communication skills.\u2022 Ability to work collaboratively in a team and independently.Preferred:Spring, Spark, Java, REST Services, AWS\u2022 Master's degree in a relevant field.\u2022 Experience with cloud platforms (e.g., AWS, Azure, Google Cloud).\u2022 Knowledge of microservices architecture.\u2022 Familiarity with DevOps practices and tools.\u2022 Certification in Java development is a plus. Thanks,Barla SantoshTechnical RecruiterE: Sbarla@gacsol.com www.gacsol.com\u2018Experts in Digitalization and Engineering - Enterprise 4.0\u2019",
        "source": "Email",
        "date_posted": "2024-10-21 18:50:17-05:00",
        "unique_id": "192b19d64d15c23b",
        "emp_type": [
            "full-time",
            "third party"
        ],
        "tag": "Java developer"
    }
]