[
    {
        "company": "Scalable Systems",
        "job_title": "Service Now Business Analyst",
        "location": "San Antonio, TX, USA",
        "full_location": {
            "city": "San Antonio",
            "state": "TX",
            "country": "USA"
        },
        "job_details": {
            "employment_type": [
                "third party"
            ],
            "job_code": "",
            "experience_required": "Not specified",
            "degree_required": "Not specified",
            "visa_sponsorship": "Not specified",
            "notice_period": "Not specified",
            "duration": "Not specified",
            "rate": "Not specified"
        },
        "skills": {
            "core": [
                "ServiceNow",
                "IT equipment solutions",
                "Catalog Management",
                "Database updates",
                "Technical writing"
            ],
            "primary": [
                "Dashboarding & Reporting",
                "Request analysis",
                "SharePoint updates",
                "Compliance process documentation"
            ],
            "secondary": [
                "Device Provisioning",
                "Imaging based on Lines of Business",
                "Break fix scenarios",
                "New Employee Orientation orders",
                "Training documents",
                "Resolving Knowledge Base flags",
                "Monitoring Knowledge Base owning group",
                "Incident queue"
            ],
            "all": [
                "ServiceNow",
                "IT equipment solutions",
                "Catalog Management",
                "Database updates",
                "Technical writing",
                "Dashboarding & Reporting",
                "Request analysis",
                "SharePoint updates",
                "Compliance process documentation",
                "Device Provisioning",
                "Imaging based on Lines of Business",
                "Break fix scenarios",
                "New Employee Orientation orders",
                "Training documents",
                "Resolving Knowledge Base flags",
                "Monitoring Knowledge Base owning group",
                "Incident queue"
            ]
        },
        "job_type": [],
        "contact_person": "Manish Kumar",
        "email": "manish.kumar@scalable-systems.com",
        "jd": "From: Manish Kumar, Scalable Systems manish.kumar@scalable-systems.com Reply to: manish.kumar@scalable-systems.com Position: Service Now Business Analyst Location: San Antonio,TX ServiceNow requests and provide IT equipment solutions, support computer refreshes, and assist in inquiries for information about solutions (Device Provisioning, Imaging based on Lines of Business)? ServiceNow Dashboarding & Reporting, Catalog Management ? Request analysis and processing? Database updates, Laptop / Desktop refresh injects, SharePoint updates, Rollout and refresh audits, technical writing, wiki, KB articles? Facilitates Break fix scenarios, New Employee Orientation orders (backend)? Compliance process documentation, training documents, resolving Knowledge Base flags in ServiceNow, Monitor Knowledge Base owning group and incident queue. Best Regards Manish Kumar Phone - +17327883626 Email ID: manish.kumar@scalable-systems.com Scalable Systems | Inspiring Innovation Big Data | Analytics | Integration | Intelligence www.scalable-systems.com",
        "source": "Email",
        "date_posted": "2024-10-21 12:28:55-05:00",
        "unique_id": "192b040654900d89",
        "emp_type": [
            "third party"
        ],
        "tag": "Business Analyst"
    }
]