[
    {
        "company": "VisionSoft International Inc",
        "job_title": "Sr ASP .Net Developer with Strong Azure exp",
        "location": "Rockville, MD, USA",
        "full_location": {
            "city": "Rockville",
            "state": "MD",
            "country": "USA"
        },
        "job_details": {
            "employment_type": [
                "full-time",
                "third party"
            ],
            "experience_required": "12+ years",
            "degree_required": "BS/MS degree in MIS, CS, or related discipline is required",
            "visa_sponsorship": "Not specified",
            "notice_period": "Not specified",
            "duration": "Not specified",
            "rate": "Not specified"
        },
        "skills": {
            "core": [
                "C#",
                ".NET MVC",
                ".NET CORE",
                "SQL Server",
                "JavaScript",
                "TFS"
            ],
            "primary": [
                "RDBMS",
                "Behavior Driven Development (BDD)",
                "Object-Oriented Programming",
                "N-Tier Architecture",
                "Agile/SCRUM"
            ],
            "secondary": [
                "Software testing",
                "Design patterns",
                "Customer service",
                "Excellent oral and written communication skills",
                "Windows Workflow Foundation (WF)",
                "MS ASP.NET Certification",
                "DevOps skills"
            ],
            "all": [
                "C#",
                ".NET MVC",
                ".NET CORE",
                "SQL Server",
                "JavaScript",
                "TFS",
                "RDBMS",
                "Behavior Driven Development (BDD)",
                "Object-Oriented Programming",
                "N-Tier Architecture",
                "Agile/SCRUM",
                "Software testing",
                "Design patterns",
                "Customer service",
                "Excellent oral and written communication skills",
                "Windows Workflow Foundation (WF)",
                "MS ASP.NET Certification",
                "DevOps skills"
            ],
            "with_experience": [
                "C# (12+ years)",
                ".NET MVC (12+ years)",
                ".NET CORE (12+ years)",
                "SQL Server (12+ years)",
                "JavaScript (12+ years)",
                "TFS (12+ years)"
            ]
        },
        "job_type": [
            "hybrid"
        ],
        "contact_person": "Prabhu",
        "email": "prabhu@vsiiusa.com",
        "jd": "From: Prabhu, VisionSoft International Inc prabhu@vsiiusa.com Reply to: prabhu@vsiiusa.com Position: Sr ASP .Net Developer with Strong Azure exp.Location: Rockville, MD. ( Hybrid)Hybrid environment from day 1Local or nearby candidates.12 years exp is plus.There will be f2f ( final round)Min 3 years exp in US is mandatory.Long term exp is mustResponsibilities:Design and develop new features and/or maintain existing applications developed on C# and ASP.NET MVC.Develop code and supporting documentation.Analyze business needs, develop requirements, design, develop and test custom software solutions.Provide technical leadership and take multiple systems and cross-system integration into account when designing and developing solutions.Provide maintenance for current software applications while developing new solutions.Work in a team environment to develop, test, and deploy software changes.Work with customers to understand and implement new requirements.Provide operational support when necessary.Work the product backlog of features and bugs.Provide input on new designs and architecture as needed.Develop a well-tested, high performance, scalable web application.Job Requirements:12+ years of experience designing, developing and deploying web-based applications in C#, .NET MVC, .NET CORE, SQL Server, JavaScript, TFS.10+ years of experience with RDBMS, databases, and Behavior Driven Development (BDD) is preferred.10+ years' experience in software development. BS/MS degree in MIS, CS, or related discipline is required.Preferred Skills:Some experience with Object-Oriented Programming and working with N-Tier Architecture.Some experience with software testing and design patterns.Great customer service and interfacing with customers required.Excellent oral and written communication skills.Experience with Windows Workflow Foundation (WF) development experience, Agile/SCRUM experience, preferred.MS ASP.NET Certification is a plus.DevOps skills and experience a plus.Ability to change and have the ability to work in a fast-paced environment.",
        "source": "Email",
        "date_posted": "2024-10-21 09:13:15-05:00",
        "unique_id": "192af9005cea25f7",
        "emp_type": [
            "full-time",
            "third party"
        ],
        "tag": ".net developer"
    }
]