[
    {
        "company": "Vyze Inc",
        "job_title": "SAP-ERP Program Manager",
        "location": "USA",
        "full_location": {
            "city": "",
            "state": "",
            "country": "USA"
        },
        "job_details": {
            "employment_type": [
                "third party"
            ],
            "job_code": "",
            "experience_required": "10+ years",
            "degree_required": "Bachelor's degree in Computer Science, Information Systems, or related field",
            "visa_sponsorship": "Not specified",
            "notice_period": "Not specified",
            "duration": "Not specified",
            "rate": "Not specified"
        },
        "skills": {
            "core": [
                "SAP ERP",
                "IT project/program management",
                "agile methodologies",
                "communication",
                "leadership"
            ],
            "primary": [
                "stakeholder management",
                "SAP modules",
                "implementation lifecycle",
                "Project Management Professional certification (PMP)",
                "Advanced Agile coaching certification (SAFe SPC, ICP-ENT, ICP-CAT, ICP-ACC)"
            ],
            "secondary": [
                "risk management",
                "program planning",
                "vendor management",
                "continuous improvement",
                "agile ceremonies"
            ],
            "all": [
                "SAP ERP",
                "IT project/program management",
                "agile methodologies",
                "communication",
                "leadership",
                "stakeholder management",
                "SAP modules",
                "implementation lifecycle",
                "Project Management Professional certification (PMP)",
                "Advanced Agile coaching certification (SAFe SPC, ICP-ENT, ICP-CAT, ICP-ACC)",
                "risk management",
                "program planning",
                "vendor management",
                "continuous improvement",
                "agile ceremonies"
            ],
            "with_experience": [
                "SAP ERP (10+ years)",
                "agile methodologies (5+ years)"
            ]
        },
        "job_type": [
            "remote"
        ],
        "contact_person": "Sanjay",
        "email": "sanjay@vyzeinc.com",
        "jd": "From: Sanjay, Vyze Inc sanjay@vyzeinc.com Reply to: sanjay@vyzeinc.com SAP-ERP Program Manager (Need LinkedIn)RemoteMOI: SkypeRequired Qualifications:- 10+ years of experience in IT project/program management- Proven track record of successfully leading large-scale SAP ERP implementations- Strong understanding of SAP modules, integration points, and implementation lifecycle- 5+ years of experience with agile methodologies and coaching- Excellent communication, leadership, and stakeholder management skills- Bachelor's degree in Computer Science, Information Systems, or related field- Project Management Professional certification (PMP)- Advanced Agile coaching certification (SAFe SPC, ICP-ENT, ICP-CAT, ICP-ACC)Key Responsibilities:- Lead and support the executive sponsor with an end-to-end SAP ERP implementation- Develop and maintain comprehensive program plans, timelines, and budgets- Manage stakeholder expectations and communicate program status effectively across all levels of the organization- Coordinate and lead cross-functional teams to ensure successful program delivery- Identify, assess, and mitigate risks throughout the implementation lifecycle- Ensure alignment between program objectives and overall business strategy- Drive continuous improvement in program delivery methodologies and processes- Manage implementation vendor relationships and provide transparency to executive sponsor- Apply agile principles and practices to enhance delivery efficiency- Guide teams in adopting and improving agile practices within the context of the SAP ERP implementation- Facilitate agile ceremonies as needed (e.g., sprint planning, retrospectives)- Mentor team members and stakeholders on agile principles and best practices- Collaborate with leadership to foster an agile mindset across the program and organization",
        "source": "Email",
        "date_posted": "2024-10-21 15:18:03-05:00",
        "unique_id": "192b13b39896d197",
        "emp_type": [
            "third party"
        ],
        "tag": "Project Manager"
    }
]