[
    {
        "company": "SS33 Business Services",
        "job_title": "Oracle SQL/ Oracle PL/SQL Backend Developer with .Net",
        "location": "Houston, TX, USA",
        "full_location": {
            "city": "Houston",
            "state": "TX",
            "country": "USA"
        },
        "job_details": {
            "employment_type": [
                "contract",
                "third party"
            ],
            "job_code": "",
            "experience_required": "4+ years",
            "degree_required": "Not specified",
            "visa_sponsorship": "Not specified",
            "notice_period": "Not specified",
            "duration": "1 year",
            "rate": "Not specified"
        },
        "skills": {
            "core": [
                "Oracle SQL",
                "Oracle PL/SQL",
                ".Net",
                "SQL queries",
                "web services"
            ],
            "primary": [
                "C#",
                "ASP.NET",
                "Web API",
                "SQL Developer",
                "SQL*Plus",
                "Toad",
                "REST",
                "SOAP"
            ],
            "secondary": [
                "troubleshooting",
                "debugging",
                "database-related issues"
            ],
            "all": [
                "Oracle SQL",
                "Oracle PL/SQL",
                ".Net",
                "SQL queries",
                "web services",
                "C#",
                "ASP.NET",
                "Web API",
                "SQL Developer",
                "SQL*Plus",
                "Toad",
                "REST",
                "SOAP",
                "troubleshooting",
                "debugging",
                "database-related issues"
            ],
            "with_experience": [
                "Oracle SQL (4+ years)",
                "Oracle PL/SQL (4+ years)",
                ".Net (Basic experience)"
            ]
        },
        "job_type": [
            "hybrid"
        ],
        "contact_person": "Syed Khalid Hussain",
        "email": "hsyed@ss33bs.com",
        "jd": "Hi, This is Syed Khalid from SS33 Business Services working as a Technical Recruiter, I have this present requirement with me given below are the details. Do respond back to this email with your updated resume. Title: Oracle SQL/ Oracle PL/SQL Backend Developer with .Net for Web Services Development Location: Houston, Texas (3 days onsite and 2 days remote) (This is a hybrid and not remote role)Type of Hire: CTH (Contract to Hire)Duration of the project : 1 yearCommunication skills: Good Skills:SkillsNo. Of years of ExperienceYear Last workedTotal No. of Years of Experience No. of Years of Experience as a Backend developer No. of Years of Experience 4+ years of experience in Oracle SQL and Oracle PL/SQL development. Strong experience in writing and optimizing complex SQL queries, stored procedures, functions, and packages. Must Have Basic experience with .Net (C#) for developing and maintaining web services. Must have Experience with web services frameworks (e.g., ASP.NET, Web API). Familiarity with Oracle database tools such as SQL Developer, SQL*Plus, or Toad. Good understanding of REST/SOAP web services and how they interact with back-end databases. Experience in troubleshooting, debugging, and resolving database-related issues.",
        "source": "Email",
        "date_posted": "2024-10-21 12:19:38-05:00",
        "unique_id": "192b0792f2285a2d",
        "emp_type": [
            "contract",
            "third party"
        ],
        "tag": ".net developer"
    }
]