[
    {
        "company": "TEK Inspirations LLC",
        "job_title": "SAP Conversion Project Manager",
        "location": "Wall, NJ, USA",
        "full_location": {
            "city": "Wall",
            "state": "NJ",
            "country": "USA"
        },
        "job_details": {
            "employment_type": [
                "contract",
                "third party"
            ],
            "experience_required": "5-10 years",
            "degree_required": "Bachelor's degree",
            "visa_sponsorship": "Not specified",
            "notice_period": "Not specified",
            "duration": "Not specified",
            "rate": "Not specified"
        },
        "skills": {
            "core": [
                "SAP S/4",
                "Project Management",
                "Leadership",
                "Communication",
                "Data Conversions"
            ],
            "primary": [
                "Agile Methodologies",
                "Waterfall Methodologies",
                "Software Development Life Cycle (SDLC)",
                "MS Project",
                "Office 365",
                "JIRA",
                "SharePoint"
            ],
            "secondary": [
                "Gas Industry Knowledge",
                "Regulated Utility Operations Experience",
                "Graduate Degree in Information Systems",
                "PMI Certification/Training"
            ],
            "all": [
                "SAP S/4",
                "Project Management",
                "Leadership",
                "Communication",
                "Data Conversions",
                "Agile Methodologies",
                "Waterfall Methodologies",
                "Software Development Life Cycle (SDLC)",
                "MS Project",
                "Office 365",
                "JIRA",
                "SharePoint",
                "Gas Industry Knowledge",
                "Regulated Utility Operations Experience",
                "Graduate Degree in Information Systems",
                "PMI Certification/Training"
            ]
        },
        "job_type": [
            "hybrid"
        ],
        "contact_person": "Karan Chaudhary",
        "email": "ckaran.chaudhary@tekinspirations.com",
        "jd": "Job Description -SAP Conversion Project Manager12+ mths in Wall NJ2 days a week on-siteThe experience is more focus on the data and conversion aspects of the deployment. It\u2019s a PM role, so the main thing we need is strong leadership, communication and organization skills. It\u2019s not a technical lead, but they need to have experience in a leadership role on large enterprise system deployments in order to lead discussions, proactively plan activities and understand how the various components fit together to identify risks and take steps to mitigate before they become issues. Position Type: ContractLocation: New JerseySchedule: Hybrid; Must be willing to come to Onsite at least 2 Days Per WeekMajor Responsibilities:Project Management:\u2022 Leads project team of both internal resources and third parties/vendors for the successful execution of conversions and related data validation activities.\u2022 Ensures that assigned project activities and deliverables are completed on-time, within scope and within budget\u2022 Proactively manages resource plan to ensure resource availability and allocation\u2022 Develops and maintains detailed conversion components of project plans to track activities and report progress\u2022 Produces regular status reports that are audience appropriate to communicate with the project team, PMO, sponsors and steering committee\u2022 Uses appropriate verification techniques to track, manage and communicate changes in project scope, schedule and costs on a timely basis\u2022 Identifies and manages project dependencies and critical paths\u2022 Works with business stakeholders, IT, and project team to prioritize activities and deliverables based on agreed scope and requirements\u2022 Measures and communicates project performance using appropriate systems, tools and techniques\u2022 Reviews and updates RAID log on a regular basis with focus on proactively mitigating integration and conversion risks, addressing issues and escalates to management as needed\u2022 Establishes and maintains relationships with third parties/vendors during project execution\u2022 Creates and maintains comprehensive project documentation as assigned by the CIS Project ManagerBasic Required Qualifications:\u2022 Bachelor's degree and 5-10 or years of experience working within a Business and Technical Environment or 10+ years working within a Business and Technical Environment\u2022 At least 5-10 years of demonstrated SAP S/4 project experience and in-depth understanding of data conversions, testing and reporting/analytics\u2022 At least 5-10 years of demonstrated experience working as an IT project manager in a matrix environment, working with clients and 3rd parties (internal or external)\u2022 Excellent project management, leadership and communication skills.\u2022 Demonstrated experience in organizing and initiating, planning, and executing large-scale projects from the envisioning stage through to implementation, involving internal cross-functional personnel, contractors, and vendors using waterfall, agile and hybrid methodologies\u2022 Strong knowledge of the Software Development Life Cycle (SDLC)Other Required Competencies, Skills, Experience:\u2022 Knowledge of the Gas Industry with demonstrated project management experience as part of an implementation is a plus\u2022 Experience collaborating, estimating, and maintaining a detailed project plan as part of a hybrid waterfall/agile project\u2022 Experience managing complex technical implementations requiring multiple integrations to cloud and legacy systems (point to point, middleware, real-time, batch, etc.)\u2022 Exceptional communication skills, both written and verbal as well as visualizations and associated tools.\u2022 Demonstrable ability to communicate appropriately at all levels of the organization and effectively with both business and technical team members.\u2022 Team player with the ability to work effectively at all levels of an organization with the ability to influence others to move toward consensus.\u2022 Strong situational analysis and decision-making abilities.\u2022 Ability to work with field employees and vendors as well as other disciplines.\u2022 Excellent leadership and consultative skills, including teamwork, facilitation, and negotiation\u2022 Must foster an inclusive work environment and respect all aspects of diversity. Must demonstrate and value differences in others' strengths, perspectives, approaches, and personal choices.\u2022 Demonstrated experience and expertise with MS Project, Office 365, JIRA, SharePointDesired Skills, Competencies, Education or Experience:\u2022 Graduate degree in Information Systems or related discipline is a plus\u2022 Bachelor's degree in Business, Computer Science, Information Systems, Engineering, or other related technical subject\u2022 PMI certification/training\u2022 Experience leading in a matrix environment\u2022 Regulated utility operations experience and knowledge a plus",
        "source": "Email",
        "date_posted": "2024-10-21 08:23:44-05:00",
        "unique_id": "192af5fcba1b741d",
        "emp_type": [
            "contract",
            "third party"
        ],
        "tag": "Project Manager"
    }
]