[
    {
        "company": "synkriom",
        "job_title": "Enterprise Architect",
        "location": "Grand rapids, MI, USA",
        "full_location": {
            "city": "Grand rapids",
            "state": "MI",
            "country": "USA"
        },
        "job_details": {
            "employment_type": [
                "third party"
            ],
            "experience_required": "8-10 years",
            "degree_required": "Not specified",
            "visa_sponsorship": "Not specified",
            "notice_period": "Not specified",
            "duration": "Not specified",
            "rate": "Not specified"
        },
        "skills": {
            "core": [
                "Azure - Data Factory",
                "Log Analytics",
                "Databricks",
                "Synapse",
                "Power BI",
                "ADLS Gen2",
                "GCP Cloud storage",
                "Big Query"
            ],
            "primary": [
                "Retail Media Data Movement experience",
                "Google Marketing platform",
                "Salesforce MCI",
                "The Trade Desk",
                "ADvendio",
                "Data Modeling",
                "Data Classification and zones",
                "Data architecture and reporting",
                "Python",
                "API architecture in Azure"
            ],
            "secondary": [
                "Agile"
            ],
            "all": [
                "Azure - Data Factory",
                "Log Analytics",
                "Databricks",
                "Synapse",
                "Power BI",
                "ADLS Gen2",
                "GCP Cloud storage",
                "Big Query",
                "Retail Media Data Movement experience",
                "Google Marketing platform",
                "Salesforce MCI",
                "The Trade Desk",
                "ADvendio",
                "Data Modeling",
                "Data Classification and zones",
                "Data architecture and reporting",
                "Python",
                "API architecture in Azure",
                "Agile"
            ],
            "with_experience": [
                "Azure - Data Factory",
                "Log Analytics",
                "Databricks",
                "Synapse",
                "Power BI",
                "ADLS Gen2",
                "GCP Cloud storage",
                "Big Query",
                "Python"
            ]
        },
        "job_type": [],
        "contact_person": "vikas kumar",
        "email": "vikas.kumar@synkriom.com",
        "jd": "From: vikas kumar, synkriom vikas.kumar@synkriom.com Reply to: vikas.kumar@synkriom.com Enterprise ArchitectRole Description:Designs, codes, tests, and implements data movement pipelines, dashboarding and analytical assets; develops system documentation according to SAFe Agile principles and industry standards.Design and hands-on development on either vendor or internal applications and interfaces including Azure - Data Factory, Log Analytics, Databricks, Synapse, Power BI, ADLS Gen2, GCP Cloud storage and Big QueryAssist in configuration and administration of marketing platforms (Google Marketing platform, Salesforce MCI, The Trade Desk etc., ADvendio) that the team supportsBuild data ingestion into and out of the above listed marketing platformsGathers and implements functional and nonfunctional requirements including performance monitoring, alerting and code management and ensuring alignment with technology best practices and SLAs.Partnering with all areas of the business to gather requirements for Data and Analytics and designing solutions.Participate in agile ceremonies and follow agile cadence to build, test and deliver solutionsDriving engagement with ITS Security and Infrastructure teams to ensure secure development and deployment of solutions.Interfaces with the Product Manager and IT partners at the Program level and within other Release Trains to define and estimate features for agile teams.Competencies:Digital : Microsoft Azure, Digital : Python, Data Concepts & Data Modelling, Digital : Microsoft Power BI, Digital : DatabricksExperience (Years):8-10Essential Skills:1. Azure - Data Factory, Log Analytics, Databricks, Synapse, Power BI, ADLS Gen2,2. GCP Cloud storage and Big Query3. Retail Media Data Movement experience4. Google Marketing platform, Salesforce MCI, The Trade Desk, ADvendio5. Power BI, Data Modeling, Data Classification and zones, data movement, Data architecture and reporting6. Python and API architecture in AzureDesirable Skills:Agile",
        "source": "Email",
        "date_posted": "2024-10-17 11:10:38-05:00",
        "unique_id": "1929b5f510e583c5",
        "emp_type": [
            "third party"
        ],
        "tag": "Azure Data Engineer"
    }
]