[
    {
        "company": "Tek Inspirations LLC",
        "job_title": "Senior Salesforce Business Analyst",
        "location": "Stillwater, MN, USA",
        "full_location": {
            "city": "Stillwater",
            "state": "MN",
            "country": "USA"
        },
        "job_details": {
            "employment_type": [
                "full-time",
                "third party"
            ],
            "experience_required": "3-5 years",
            "degree_required": "Not specified",
            "visa_sponsorship": "Not specified",
            "notice_period": "Not specified",
            "duration": "Not specified",
            "rate": "Not specified"
        },
        "skills": {
            "core": [
                "Salesforce Certified Administrator",
                "Salesforce BA Certification"
            ],
            "primary": [
                "Charisma and Communication Skills",
                "Detail-Oriented",
                "Analytical Problem Solver",
                "Self-Driven"
            ],
            "secondary": [
                "Building good relationships",
                "Planning and organizing",
                "Mentoring",
                "Collaboration with stakeholders"
            ],
            "all": [
                "Salesforce Certified Administrator",
                "Salesforce BA Certification",
                "Charisma and Communication Skills",
                "Detail-Oriented",
                "Analytical Problem Solver",
                "Self-Driven",
                "Building good relationships",
                "Planning and organizing",
                "Mentoring",
                "Collaboration with stakeholders"
            ],
            "with_experience": [
                "Salesforce Certified Administrator",
                "Salesforce BA Certification"
            ]
        },
        "job_type": [
            "hybrid"
        ],
        "contact_person": "Payal Shrivastava",
        "email": "payal.shrivastava@tekinspirations.com",
        "jd": "From: Payal Shrivastava, Tek Inspirations LLC payal.shrivastava@tekinspirations.com Reply to: payal.shrivastava@tekinspirations.com eed Local Candidates as Client can ask for F2F as well . - need Candidates withing 30 minutes to get the interview scheduled Senior Salesforce Business AnalystLocation: Stillwater, MN areaHybrid 3 days per week. Senior Salesforce Business AnalystThe team supports all aspects of the Sales Division which includes partnership and support with: Sales, Sales Operations, Marketing, Lead Management Teams that support both Homeowner and Trade Leads, Finance, Events & Experience, and Strategic Pricing Teams. The team has existed since Salesforce was implemented in 2007; however, experienced significant growth and change beginning with a large Sales Transformation effort in 2019. The roles on the team include: Scrum Master, Product Owner, Business Analysts, Salesforce Developers, Salesforce Admins, and Support Analysts. Most of the members of the Team live locally, and we enjoy three days a week in the office as a Team together.This team supports upwards of 1,000+ users that span across many areas of the Salesforce ecosystem. These areas include:Sales CloudLeads, Accounts, Contacts, Opportunities, and ActivitiesExperience CloudThere is heavy interaction with the Salesforce Dealer and Trade Teams as they largely support Marketing Programs the present to our Customers via Experience Cloud. Those clouds are largely based on data and logic within Sales Cloud. The ability to collaborate with this Team is necessary.Informatica & MuleSoft for all integrations in and out of SalesforceIntegrations to downstream systems, Legacy Customer Systems, Transportation Management, etc.Qualifications:Soft skills are an integral part of being successful as a Business Analyst. The person in this role should have the following qualities:Charisma and Communication SkillsBuilding good relationships is essential in a customer/business-facing role. Need to be comfortable speaking and working with othersSomeone that can develop into a reliable, go-to contact for business partnersSituation awareness to know what questions to ask to a certain audienceDetail-OrientedSomeone that cares about the little detailsGood at planning and organizing multiple things at onceAble to keep track of multiple deliverablesAnalytical Problem SolverKnows how to ask the right questionsCan find out where to dig (what to investigate, who to ask, etc)Someone that asks \u201cwhy\u201d or \u201ctell me more\u201dSelf-DrivenProactively seeks out training and knowledgeShows consistent improvements in their knowledge of our business and processesSalesforce Certified Administrator (Required)Salesforce BA Certification (Optional)Years of Experience: 3-5 years Administrative Details:Responsibilities:This role will specifically focus on the launch and support of new sales strategies. This means that there is both a \u201cproject\u201d and \u201cproduct\u201d element to this role. This role would be responsible for meeting with Business Partners to gather and write requirements, guide development, and advise QA. In addition, assist the Product Owner with prioritization and management of the work/roadmap. This role needs to be comfortable working with and talking with both Business and Technical Resources across our Salesforce Teams.Must Have Experience::Responsible for leading planning and requirements for functional business areas.Demonstrated ability to mentor and provide work direction to others.Assists less experienced business analysts with design and knowledge transfer.Responsible for collaboration with stakeholders to identify requirements and recommend solutions.Responsible for designing business processes for high complexity objectives.Responsible for communication of application capabilities, collaborates with Tech Lead for support.Responsible for complex business analysis and process design in functional areas.Responsible for specifying and validating high complexity business needs/requirements.Drives business relationships and integrates departmental activities.Responsible for defining application scope and solving complex business problems.",
        "source": "Email",
        "date_posted": "2024-10-17 09:01:03-05:00",
        "unique_id": "1929aeb5b80f4f23",
        "emp_type": [
            "full-time",
            "third party"
        ],
        "tag": "Business Analyst"
    }
]