[
    {
        "company": "Birlasoft",
        "job_title": "Senior Business Analyst With CPQ and Java",
        "location": "Austin, TX, USA",
        "full_location": {
            "city": "Austin",
            "state": "TX",
            "country": "USA"
        },
        "job_details": {
            "employment_type": [
                "full-time",
                "third party"
            ],
            "experience_required": "5-10 years",
            "degree_required": "Not specified",
            "visa_sponsorship": "Must have existing work authorization",
            "notice_period": "Not specified",
            "duration": "Not specified",
            "rate": "Not specified"
        },
        "skills": {
            "core": [
                "Business Analysis",
                "Java",
                "Enterprise Applications",
                "Design Documents",
                "Requirement Documentation"
            ],
            "primary": [
                "CPQ",
                "Analytics",
                "Process Flow Analysis",
                "Legacy-to-Modern Application Migrations"
            ],
            "secondary": [
                "Business Process Automation"
            ],
            "all": [
                "Business Analysis",
                "Java",
                "Enterprise Applications",
                "Design Documents",
                "Requirement Documentation",
                "CPQ",
                "Analytics",
                "Process Flow Analysis",
                "Legacy-to-Modern Application Migrations",
                "Business Process Automation"
            ],
            "with_experience": [
                "Business Analysis (5-10 years)",
                "Java"
            ]
        },
        "job_type": [
            "onsite"
        ],
        "contact_person": "Kranthi",
        "email": "kranthi@propelsys.com",
        "jd": "From: Kranthi, Propelsys kranthi@propelsys.com Reply to: kranthi@propelsys.com Full time role with Birlasoft (NO C2C) Position: Senior Business Analyst With CPQ and Java Location: Austin, TX / Houston, TX On Site From Day 1 Employment Type: Full-time Experience Level: 5-10 years Visa GC USC Required Skills & Experience: 5-10 years of Business Analysis experience, preferably with expertise in Java-based applications. Strong functional knowledge of enterprise applications, specifically within coding and deal management systems. Solid understanding of Java technologies and their role in supporting backend operations. Proficiency in creating and maintaining design documents and translating business needs into actionable technical requirements. Ability to work proactively, engage with business teams, and provide analytical insights. Experience in analytics, process flow analysis, and requirement documentation. Familiarity with legacy-to-modern application migrations is a plus. Preferred Skills: Experience with CPQ processes (Configure, Price, Quote) and related services. Knowledge of BPA (Business Process Automation).",
        "source": "Email",
        "date_posted": "2024-10-17 11:30:06-05:00",
        "unique_id": "1929b71d4d0ef608",
        "emp_type": [
            "full-time",
            "third party"
        ],
        "tag": "Business Analyst"
    }
]