[
    {
        "company": "Tek Inspiration",
        "job_title": "Sr Full Stack Developer",
        "location": "Charlotte, NC, USA",
        "full_location": {
            "city": "Charlotte",
            "state": "NC",
            "country": "USA"
        },
        "job_details": {
            "employment_type": [
                "full-time",
                "third party"
            ],
            "experience_required": "8-10 years",
            "degree_required": "Not specified",
            "visa_sponsorship": "Not specified",
            "notice_period": "Not specified",
            "duration": "Not specified",
            "rate": "Not specified"
        },
        "skills": {
            "core": [
                "Java 8",
                "Spring Boot",
                "Microservices",
                "React JS",
                "Mongo DB"
            ],
            "primary": [
                "Cloud",
                "API model",
                "Token model",
                "DynamoDB",
                "Domain-Driven Design",
                "Object-Oriented Design",
                "Dockers",
                "CI/CD Pipeline",
                "Agile Scrum methodology"
            ],
            "secondary": [
                "Stream API",
                "Micronaut",
                "Coding standards",
                "Efficient and readable code"
            ],
            "all": [
                "Java 8",
                "Spring Boot",
                "Microservices",
                "React JS",
                "Mongo DB",
                "Cloud",
                "API model",
                "Token model",
                "DynamoDB",
                "Domain-Driven Design",
                "Object-Oriented Design",
                "Dockers",
                "CI/CD Pipeline",
                "Agile Scrum methodology",
                "Stream API",
                "Micronaut",
                "Coding standards",
                "Efficient and readable code"
            ]
        },
        "job_type": [
            "hybrid"
        ],
        "contact_person": "Ambar Shukla",
        "email": "ambar.shukla@tekinspirations.com",
        "jd": "Job Description -Role: Sr Full Stack DeveloperLocation: Charlotte , NC Local For F2F interviewCITIZEN,E3,GC EAD,GREEN CARD,H4 EAD,J2 EAD,L2 EAD,TNDay 1 Hybrid Onsite LinkedIn id is must (Should not been created recently, at least 6 Years old in case of senior candidates)Job Summary: 8-10 years of Java 8, Spring Boot, Cloud, API model, Token model development experienceAt least 5-7 full-scale development projects with Microservices, Micronauts, Stream API, AWS Services, and DynamoDB. Token-based calling model.Must have good knowledge and expertise with Java 8 frameworks (Thread, Reflection API, Stream API), including Springboot/Micronaut, etc.Must have a good understanding of Domain-Driven Design principlesMust have on React JS with Mongo DBMust be passionate about design and development methodology, including coding standards and writing efficient and readable codeShould have experience with Object-Oriented Design (OOD)Should have experience in deploying cloud applications using Dockers/ ContainersShould have experience in integrating automation scripts with CI/CD PipelineMust have executed projects using Agile Scrum methodology and be aware of all processes involved in Scrum",
        "source": "Email",
        "date_posted": "2024-10-17 08:25:22-05:00",
        "unique_id": "1929ac9178ecceae",
        "emp_type": [
            "full-time",
            "third party"
        ],
        "tag": "Java developer"
    }
]