[
    {
        "company": "Systray Technologies",
        "job_title": "Product Analyst - Mid-Level",
        "location": "Framingham, MA, USA",
        "full_location": {
            "city": "Framingham",
            "state": "MA",
            "country": "USA"
        },
        "job_details": {
            "employment_type": [
                "third party"
            ],
            "job_code": "",
            "experience_required": "5-10 years",
            "degree_required": "Not specified",
            "visa_sponsorship": "Not specified",
            "notice_period": "Not specified",
            "duration": "Not specified",
            "rate": "Not specified"
        },
        "skills": {
            "core": [
                "Agile Methodology",
                "JIRA"
            ],
            "primary": [
                "Confluence",
                "Strong interpersonal skills",
                "Verbal communication skills",
                "Written communication skills",
                "Presentation skills",
                "Analytical skills"
            ],
            "secondary": [
                "SAFe framework",
                "Agile delivery method knowledge",
                "Experience in the Loss Prevention field",
                "Knowledge and experience with Loss Prevention applications",
                "Familiarity with the retail industry",
                "Experience working with vendors",
                "Experience working in a retail environment"
            ],
            "all": [
                "Agile Methodology",
                "JIRA",
                "Confluence",
                "Strong interpersonal skills",
                "Verbal communication skills",
                "Written communication skills",
                "Presentation skills",
                "Analytical skills",
                "SAFe framework",
                "Agile delivery method knowledge",
                "Experience in the Loss Prevention field",
                "Knowledge and experience with Loss Prevention applications",
                "Familiarity with the retail industry",
                "Experience working with vendors",
                "Experience working in a retail environment"
            ]
        },
        "job_type": [],
        "contact_person": "Rupali Sahoo",
        "email": "rupali.a@systraytechnologies.com",
        "jd": "From: Rupali Sahoo, Systray Technologies.com rupali.a@systraytechnologies.com Reply to: rupali.a@systraytechnologies.com Job TitleProduct Analyst - Mid-Level.. End Client - TJX Primary Skills - Agile Methodology,JIRA Required SkillsJob DescriptionWhat you\u2019ll discover\u2022 Inclusive culture and career growth opportunities\u2022 Global IT Organization which collaborates across U.S., Canada, Europe, and Australia\u2022 Challenging, collaborative, and team-based environmentWhat you\u2019ll doThe Loss Prevention (LP) Global Solution Delivery Team is responsible for managing solutions and technology that delivers capabilities to keep our associates and customers safe, preserve company assets, and provide business value.What you\u2019ll needOur team is looking for people with a passion for delivering solutions, intellectual curiosity, and willingness to try new things.? We are a collaborative culture and looking for somebody who enjoys meeting with and learning about how technology solves problems for our retail business.Key Responsibilities\u2022 Work to determine detailed requirements from key stakeholders for the team\u2022 Contribute to the Loss Prevention team\u2019s backlog refinement, including user story point estimation and testing considerations\u2022 Articulate context around requirements and solutions, and work to build consensus within a stakeholder group\u2022 Work with and support the product team to achieve iteration goals and objectives\u2022 Ensure the functional integrity of the product/solutionMinimum Qualifications (Requirements)\u2022 5-10 years\u2019 experience as a Product Analyst or Business Analyst\u2022 Jira and Confluence (required)\u2022 Strong interpersonal, verbal, and written communication skills\u2022 Presentation skills\u2022 Analytical skills\u2022 Ability to drive conversations with cross-functional teamsPreferred Qualifications\u2022 1-3 years\u2019 experience SAFe framework/Agile delivery method knowledge\u2022 Experience in the Loss Prevention field\u2022 Knowledge and experience with Loss Prevention applicationso Genetec, Appriss or other Loss prevention software platforms\u2022 Familiarity with the retail industry & best practices\u2022 Experience working with vendors and 3rd party solutions\u2022 Experience working in a retail environment is desirable",
        "source": "Email",
        "date_posted": "2024-10-17 10:01:32-05:00",
        "unique_id": "1929b67b952bb38d",
        "emp_type": [
            "third party"
        ],
        "tag": "Business Analyst"
    }
]