[
    {
        "company": "Pull Skill Technologies Inc.",
        "job_title": "Product Analyst",
        "location": "Marlborough, MA, USA",
        "full_location": {
            "city": "Marlborough",
            "state": "MA",
            "country": "USA"
        },
        "job_details": {
            "employment_type": [
                "contract",
                "third party"
            ],
            "job_code": "",
            "experience_required": "5-10 years",
            "degree_required": "Not specified",
            "visa_sponsorship": "No visa sponsorship",
            "notice_period": "Not specified",
            "duration": "11 months",
            "rate": "Not specified"
        },
        "skills": {
            "core": [
                "Jira",
                "Confluence",
                "Analytical skills",
                "Strong interpersonal skills",
                "Presentation skills"
            ],
            "primary": [
                "Business Analyst",
                "Loss Prevention",
                "Agile delivery method knowledge",
                "Experience working with vendors",
                "Experience working in a retail environment"
            ],
            "secondary": [
                "Knowledge of Loss Prevention applications",
                "Familiarity with the retail industry",
                "Experience in the Loss Prevention field",
                "3rd party solutions"
            ],
            "all": [
                "Jira",
                "Confluence",
                "Analytical skills",
                "Strong interpersonal skills",
                "Presentation skills",
                "Business Analyst",
                "Loss Prevention",
                "Agile delivery method knowledge",
                "Experience working with vendors",
                "Experience working in a retail environment",
                "Knowledge of Loss Prevention applications",
                "Familiarity with the retail industry",
                "Experience in the Loss Prevention field",
                "3rd party solutions"
            ]
        },
        "job_type": [
            "onsite"
        ],
        "contact_person": "Kim Price",
        "email": "kim@pullskill.com",
        "jd": "From: Kim Price, Pull Skill Technologies Inc. kim@pullskill.com Reply to: kim@pullskill.com ***Must be a USC/GC only***Job Title : Product Analyst Mid LevelDuration: 11 monthsLocation : Marlborough/MA - Local talent only (about 1.5 hour away); will need to go in office for ad hoc workshopsWhat you\u2019ll discover \u2022Inclusive culture and career growth opportunities\u2022Global IT Organization which collaborates across U.S., Canada, Europe, and Australia\u2022Challenging, collaborative, and team-based environmentWhat you\u2019ll do The Loss Prevention (LP) Global Solution Delivery Team is responsible for managing solutions and technology that delivers capabilities to keep our associates and customers safe, preserve company assets, and provide business value.What you\u2019ll need Our team is looking for people with a passion for delivering solutions, intellectual curiosity, and willingness to try new things.? We are a collaborative culture and looking for somebody who enjoys meeting with and learning about how technology solves problems for our retail business.Key Responsibilities\u2022Work to determine detailed requirements from key stakeholders for the team\u2022Contribute to the Loss Prevention team\u2019s backlog refinement, including user story point estimation and testing considerations\u2022Articulate context around requirements and solutions, and work to build consensus within a stakeholder group\u2022Work with and support the product team to achieve iteration goals and objectives\u2022Ensure the functional integrity of the product/solutionMinimum Qualifications (Requirements)\u20225-10 years\u2019 experience as a Product Analyst and Business Analyst (no more than 10 years overall experience out of college)\u2022Jira and Confluence (required)\u2022Strong interpersonal, verbal, and written communication skills\u2022Presentation skills\u2022Analytical skills\u2022Ability to drive conversations with cross-functional teamsPreferred Qualifications\u20221-3 years\u2019 experience SAFe framework/Agile delivery method knowledge\u2022Experience in the Loss Prevention field\u2022Knowledge and experience with Loss Prevention applicationsoGenetec, Appriss or other Loss prevention software platforms\u2022Familiarity with the retail industry & best practices\u2022Experience working with vendors and 3rd party solutions\u2022Experience working in a retail environment is desirable Thanks Kim Price Desk: 201-497-1010 EXT: 101",
        "source": "Email",
        "date_posted": "2024-10-17 07:46:28-05:00",
        "unique_id": "1929aa4672dd8c7e",
        "emp_type": [
            "contract",
            "third party"
        ],
        "tag": "Business Analyst"
    }
]