[
    {
        "company": "Innozatech LLC",
        "job_title": "Program Director",
        "location": "USA",
        "full_location": {
            "city": "",
            "state": "",
            "country": "USA"
        },
        "job_details": {
            "employment_type": [
                "third party"
            ],
            "job_code": "",
            "experience_required": "15+ years",
            "degree_required": "Bachelor's or master's degree in computer science, information systems, business administration or related field",
            "visa_sponsorship": "Not specified",
            "notice_period": "Not specified",
            "duration": "Not specified",
            "rate": "Not specified"
        },
        "skills": {
            "core": [
                "Project Management",
                "Agile Methodologies",
                "Leadership",
                "Communication Skills",
                "Program Management"
            ],
            "primary": [
                "Scrum",
                "Kanban",
                "SAFe",
                "Waterfall",
                "Productivity Tools"
            ],
            "secondary": [
                "Strategic Planning",
                "Analytical Skills",
                "Negotiation Skills",
                "Business Acumen",
                "Emerging Technologies"
            ],
            "all": [
                "Project Management",
                "Agile Methodologies",
                "Leadership",
                "Communication Skills",
                "Program Management",
                "Scrum",
                "Kanban",
                "SAFe",
                "Waterfall",
                "Productivity Tools",
                "Strategic Planning",
                "Analytical Skills",
                "Negotiation Skills",
                "Business Acumen",
                "Emerging Technologies"
            ]
        },
        "job_type": [
            "remote"
        ],
        "contact_person": "Irfan",
        "email": "irfan@innozatech.com",
        "jd": "From: Irfan, Innozatech LLC irfan@innozatech.com Reply to: irfan@innozatech.com NC DHHS is in need of EHR PMO Manager to provide oversight and management of project managers performance and day to day activities. Must have a Bachelor's degree and 15+ years IT and business/industry experience. Reference full job description. The EHR PMO Manager, under the direction of the EHR IT Program Executive and in collaboration with the EHR program director , for the oversight and management of project managers performance and day to day activities.The PMO manager's accountabilities are the following: Accountable for the oversight and management of project managers performance and day to day activitiesAccountable for ensuring that the project managers are on track to meet the needs of program director\u2019s required deliverables.Accountable for creating and maintaining the staffing plan, org chart, roles, and responsibilitiesAccountable for creating consistent, transparent, and meaningful standard program reporting template in partnership with the program director, executives, project managers, and Epic leadersAccountable for acting as an escalation path for the executives, leaders, program director, Epic leaders, project managers on the project management processes, relationship building, conflicts, and other needs.The PMO manager's responsibilities include:Responsible for people and performance management all the project managersHold daily/weekly communications with the project manager to understand and assist the project managers on project management (not program-level business or technical decisions).Ensures that there is a baseline schedule for the respective projects managed by the project managersEnsures that the project managers are keeping the project schedule, cost, and other components of DIT\u2019s touchdown tool every week by COB every Thursday Review and provide input on status reports and metrics project managers prepare before publishing.Ensures all PMs are providing status reports in the same format on time to meet the program reporting needsSetting clear expectations for team members, including project management deliverables and trackers associated with the respective workstreamPartners with the project director and Epic implementation director to provide specific assistance to the programManage, advise, and coach team members by providing guidance on project issues, key project success factors, and lessons learned.Reinforcing the importance of the project together with the executives and the program director and providing consistent communication to the project team.Manage capacity, demand, and utilization of resources needsBuild strong relationships with the executives, program directors, Project Managers, Analysts, Epic, DIT, and business to influence outcomes.Facilitates meetings (not regular project meetings) aligned toward critical escalation, conflicts, and resolutions to long-winding and pending challengesCreate job descriptions and responsibilities for new hires or backfillsParticipates in the interview panel to select project managers, analysts, and other critical rolesRecommend hiring and rolling off staff in collaboration with the program director, leaders, and staffing plan.Travel onsite for a week every month for team collaborations, celebrate victories, and team buildingBe on camera during meetings and one-on-one calls for effective collaborationsEducation:Bachelor\u2019s or master\u2019s degree in computer science, information systems, business administration or related field with seven or more years\u2019 experience in combined (waterfall and agile) environments along with applicable certifications such as (not all are required)Project Management Institute Certification (PMP, PgMP, PfMP, ACP, etc.)Scrum Alliance (CAL, CSP, CSM, CSPO, or advanced certs)Scaled Agile Framework Certification (SAFe \u2013 SA or SAFe \u2013 SPC)Kanban (KCP, AKT, TKP, Kanban-EXP) Experience:Fifteen or more years of overall experience in IT and business/industrySeven years of experience in combined (waterfall and agile) environmentsFive to seven years of leadership responsibilitiesKnowledge and SkillsExperience with one or more agile or traditional methodologies (Scrum, Kanban, SAFe, Waterfall etc.).Program management skills and experience, plus significant knowledge of productivity tools with evidence of practical application (which is highly desirable).Exceptional leadership skills with the ability to develop and communicate the strategic vision, and inspire and motivate staff.A distinctive blend of business, IT, financial and communication skills. (This is a highly visible position with substantial impact.)Effective influencing and negotiation skills in an environment where resources often do not directly control this role.Excellent analytical, strategic conceptual thinking, strategic planning and execution skills.Strong business acumen, including industry, domain-specific knowledge of the enterprise and its business units.Deep understanding of current and emerging technologies and how enterprises are employing themDemonstrated ability to develop and execute a strategic resource plan.Excellent verbal and written communication skills, including explaining IT concepts and technologies to business leaders, as well as business concepts to the PMO staff. Key Competencies:Leadership, Building Relationships, Business Acumen and Enterprise Knowledge, Change Advocate, Influencing Others, and Results Oriented SkillRequired / DesiredAmountof Experience Excellent verbal and written communication skills, including explaining IT concepts and technologies to business leaders, as well as business conceptsRequired15YearsA distinctive blend of business, IT, financial and communication skills. (This is a highly visible position with substantial impact.)Required15YearsExperience with one or more agile or traditional methodologies (Scrum, Kanban, SAFe, Waterfall etc.)Required7YearsProgram management skills and experience, plus significant knowledge of productivity tools with evidence of practical applicationRequired7YearsExceptional leadership skills with the ability to develop and communicate the strategic vision, and inspire and motivate staffRequired7YearsEffective influencing and negotiation skills in an environment where resources often do not directly control this roleRequired7YearsDemonstrated ability to develop and execute a strategic resource planRequired7Years",
        "source": "Email",
        "date_posted": "2024-10-17 09:12:48-05:00",
        "unique_id": "1929b0f5b4d653d9",
        "emp_type": [
            "third party"
        ],
        "tag": "Project Manager"
    }
]