[
    {
        "company": "KK Associates LLC",
        "job_title": "Salesforce Business Analyst",
        "location": "Pleasanton, CA, USA",
        "full_location": {
            "city": "Pleasanton",
            "state": "CA",
            "country": "USA"
        },
        "job_details": {
            "employment_type": [
                "full-time",
                "third party"
            ],
            "experience_required": "8 years",
            "degree_required": "Not specified",
            "visa_sponsorship": "Not specified",
            "notice_period": "Not specified",
            "duration": "6 plus months",
            "rate": "Not specified"
        },
        "skills": {
            "core": [
                "Salesforce",
                "Sales Cloud",
                "Service Cloud",
                "Agile",
                "Scrum"
            ],
            "primary": [
                "CPQ",
                "DPA",
                "RPA",
                "Jira"
            ],
            "secondary": [
                "written communication",
                "oral communication",
                "business analysis",
                "UAT",
                "stakeholder management",
                "journey mapping",
                "cost-benefit analysis"
            ],
            "all": [
                "Salesforce",
                "Sales Cloud",
                "Service Cloud",
                "Agile",
                "Scrum",
                "CPQ",
                "DPA",
                "RPA",
                "Jira",
                "written communication",
                "oral communication",
                "business analysis",
                "UAT",
                "stakeholder management",
                "journey mapping",
                "cost-benefit analysis"
            ]
        },
        "job_type": [
            "onsite"
        ],
        "contact_person": "K. Ramesh",
        "email": "ramesh.k@kksoftwareassociates.com",
        "jd": "From: Ramesh, KKSOFTWAREASSOCIATES ramesh.k@kksoftwareassociates.com Reply to: ramesh.k@kksoftwareassociates.com Job Role : Salesforce Business Analyst Location: Pleasanton CA onsiteDuration: 6 plus months Start Date : Immediately Job Description : At least 8 years of experience as a Salesforce BA. Experience with Sales Cloud and Service Cloud required with CPQ, DPA/RPA preferred Proficiency in Agile/Scrum and associated tools (Jira preferred) High level of written/oral communication skills. The Salesforce Business Analyst is responsible for discovering and documenting business processes and business objectives and converting them into requirements and user stories. Should have experience with Agile and Scrum The SFDC BA also works closely with the Solution Architect and Experience Owner (Product Owner) to refine stories, conduct UAT and execute other standard BA functions in an Agile environment. Collaborate with multiple stakeholders through a variety of mediums (workshops, discovery sessions, story grooming sessions, etc.) to define what the stakeholder(s) are looking to achieve and conduct detailed analysis on the requirement (e.g., persona definition, journey mapping cost-benefit analysis, pros/cons of solutions from the Solution Architect). Advise business on SFDC best practices for requirements and adoption of Salesforce features. Maintain detailed documentation on user stories/features/epics/initiatives in Jira. Work directly with Solution Architecture in an Agile fashion to refine stories for development. Conduct UAT testing and sign off in conjunction with the associated Experience (Product) Owner and business Stakeholder Champion(s). Become a subject matter expert in one or more of our functional areas (Sales, Service, Finance) K.RameshKK Associates LLC.Sr. IT RecruiterEmail:Ramesh.k@kksoftwareassociates.comWeb: www.kksoftwareassociates.com",
        "source": "Email",
        "date_posted": "2024-10-17 13:36:06-05:00",
        "unique_id": "1929be47c331edc8",
        "emp_type": [
            "full-time",
            "third party"
        ],
        "tag": "Business Analyst"
    }
]