[
    {
        "company": "Wiseq",
        "job_title": "Java Developer",
        "location": "Lansing, MI, USA",
        "full_location": {
            "city": "Lansing",
            "state": "MI",
            "country": "USA"
        },
        "job_details": {
            "employment_type": [
                "full-time",
                "third party"
            ],
            "experience_required": "12+ years",
            "degree_required": "Not specified",
            "visa_sponsorship": "Not specified",
            "notice_period": "Not specified",
            "duration": "1 year with possible extension",
            "rate": "Not specified"
        },
        "skills": {
            "core": [
                "Java",
                "Eclipse",
                "STS",
                "SQL",
                "PL/SQL"
            ],
            "primary": [],
            "secondary": [],
            "all": [
                "Java",
                "Eclipse",
                "STS",
                "SQL",
                "PL/SQL"
            ]
        },
        "job_type": [
            "onsite",
            "hybrid"
        ],
        "contact_person": "Austin",
        "email": "austin@wiseq.net",
        "jd": "From: Austin, Wiseq austin@wiseq.net Reply to: austin@wiseq.net Java Developer Location: Lansing, MI. (On-site: Hybrid position - Onsite 2 days per week - REQUIRED. CANDIDATES MUST BE LOCAL TO MID-MICHIGAN. Hiring manager is not currently interested in candidates who will need to relocate to accept offer. NO REMOTE ONLY OPTION.) - CANDIDATES MUST BE LOCAL TO MID-MICHIGAN.Duration: 1 year with possible extension. Top Skills & Years of Experience Required: \u2022 12+ years developing complex computer systems using Java.\u2022 12+ years developing complex computer systems using java IDEs such as Eclipse, STS\u2022 12+ years programming in SQL and/or PL/SQL.",
        "source": "Email",
        "date_posted": "2024-10-17 17:03:37-05:00",
        "unique_id": "1929d2136b0bac64",
        "emp_type": [
            "full-time",
            "third party"
        ],
        "tag": "Java developer"
    }
]