[
    {
        "company": "Vyze Inc.",
        "job_title": "Database Support Engineer (Sybase & DB2)",
        "location": "Salt Lake City, UT, USA",
        "full_location": {
            "city": "Salt Lake City",
            "state": "UT",
            "country": "USA"
        },
        "job_details": {
            "employment_type": [
                "full-time",
                "third party"
            ],
            "job_code": "",
            "experience_required": "3+ years",
            "degree_required": "High School Diploma",
            "visa_sponsorship": "No visa sponsorship",
            "notice_period": "Not specified",
            "duration": "Not specified",
            "rate": "Not specified"
        },
        "skills": {
            "core": [
                "DBA tasks",
                "troubleshooting",
                "analytical skills",
                "DB2 database administration",
                "Sybase database administration"
            ],
            "primary": [
                "High School Diploma",
                "3+ years of experience",
                "knowledge of Banking, Retail, healthcare and Insurance domains",
                "good communication skills",
                "performance tuning for databases"
            ],
            "secondary": [
                "flexible to work in weekend shifts",
                "good interpersonal skills",
                "knowledge in job scheduler bash",
                "Autosys",
                "cron jobs",
                "DB2 Replication",
                "DB2 HADR",
                "DB2 Version upgrades",
                "DB2 Builds",
                "DB2 Transportable Tablespaces",
                "Sybase ASE",
                "Sybase IQ",
                "Sybase Replication",
                "Distributed Database Management System"
            ],
            "all": [
                "DBA tasks",
                "troubleshooting",
                "analytical skills",
                "DB2 database administration",
                "Sybase database administration",
                "High School Diploma",
                "3+ years of experience",
                "knowledge of Banking, Retail, healthcare and Insurance domains",
                "good communication skills",
                "performance tuning for databases",
                "flexible to work in weekend shifts",
                "good interpersonal skills",
                "knowledge in job scheduler bash",
                "Autosys",
                "cron jobs",
                "DB2 Replication",
                "DB2 HADR",
                "DB2 Version upgrades",
                "DB2 Builds",
                "DB2 Transportable Tablespaces",
                "Sybase ASE",
                "Sybase IQ",
                "Sybase Replication",
                "Distributed Database Management System"
            ]
        },
        "job_type": [
            "onsite"
        ],
        "contact_person": "Rahul Mishra",
        "email": "rmishra@vyzeinc.com",
        "jd": "From: Rahul Mishra, Vyzeinc rmishra@vyzeinc.com Reply to: rmishra@vyzeinc.com Job Title : Database Support Engineer (Sybase & DB2)Job Location : ONSITE 5 days a week (Salt Lake City, UT)(Locals only)Visa: USC/GC only 24x7 support Tues - SaturdaySunday - Thursday - Full Weekend - Saturday and SundayRequired Skills: High School Diploma 3+ years of experience in the job offered or a related Database Administration role Strong working knowledge on DBA tasks, troubleshooting and analytical skills IT Experience with Solid understanding of Banking, Retail, healthcare and Insurance domains and its processes Flexible to work in weekend shifts. Good Interpersonal skills to interact with global Teams. Knowledge in job scheduler bash; Autosys, cron jobs etc... Ability to work and effectively prioritize in a highly dynamic work environment that includes a global focus. Strong team player, good communication and interpersonal skills. Results oriented and highly flexible. For DB2: Supporting the following platforms: Red Hat Enterprise Linux v3/4/5/6 and Sun Solaris 5.8/10 Strong experience in UDB/DB2 database administration, maintenance, and implementation in a complex system environment Extensive exposure to DB2 Replication including SQL Rep and Q replication. Strong knowledge DB2 HADR ( High Availability Disaster Recovery ) Strong knowledge of DB2 Version upgrades and DB2 Builds. Strong knowledge of DB2 Transportable Tablespaces. DB2 Database design, development, and maintenance. For Sybase: Supporting the following platforms: Red Hat Enterprise Linux v3/4/5/6 and Sun Solaris 5.8/10 Database Platform: Sybase ASE, Sybase IQ, Sybase Replication. Extensive exposure to Sybase ASE 16.x,15.x, ASE 12.x database administration under Linux platform. Strong experience in Sybase database administration, maintenance, and implementation in a complex system environment Strong Sybase Replication experience (Replication Server 15.x, 12.x) and knowledge on Distributed Database Management System Strong Knowledge in Performance Tuning for Databases. Preferred Skills: Bachelor's Degree preferred Best RegardsRahul Mishra US Technical Recruiter |Vyze Inc.E-Mail: rmishra@vyzeinc.com",
        "source": "Email",
        "date_posted": "2024-10-17 17:38:49-05:00",
        "unique_id": "1929d10abb58eb65",
        "emp_type": [
            "full-time",
            "third party"
        ],
        "tag": "DB Admin"
    }
]