[
    {
        "company": "HCL Global System",
        "job_title": "Java with AI (SME)",
        "location": "Alpharetta, GA, USA",
        "full_location": {
            "city": "Alpharetta",
            "state": "GA",
            "country": "USA"
        },
        "job_details": {
            "employment_type": [
                "full-time",
                "third party"
            ],
            "experience_required": "10+ years",
            "degree_required": "BS Engineering/Computer Science or equivalent experience required; advanced degree preferred",
            "visa_sponsorship": "Not specified",
            "notice_period": "Not specified",
            "duration": "Permanent",
            "rate": "Not specified"
        },
        "skills": {
            "core": [
                "Core Java",
                "Data Analysis",
                "Java Architecture",
                "AI tool"
            ],
            "primary": [
                "Software Engineering",
                "Problem-solving",
                "Data manipulation",
                "Azure"
            ],
            "secondary": [
                "Research skills",
                "Mathematical aptitude",
                "Communication skills"
            ],
            "all": [
                "Core Java",
                "Data Analysis",
                "Java Architecture",
                "AI tool",
                "Software Engineering",
                "Problem-solving",
                "Data manipulation",
                "Azure",
                "Research skills",
                "Mathematical aptitude",
                "Communication skills"
            ]
        },
        "job_type": [
            "onsite"
        ],
        "contact_person": "umamahesh",
        "email": "uma@hclglobal.com",
        "jd": "From: umamahesh, HCL Global System uma@hclglobal.com Reply to: uma@hclglobal.com Job Title \u2013 Java with AI (SME)Location: Alpharetta, GA.(Complete onsite) Mandatory AreasMust have Skills \u2013Skill 1 \u2013 10+ Yrs of Exp \u2013 Core JavaSkill 2 \u2013 10 Yrs of Exp \u2013 Data AnalysisSkill 3 \u2013 10 Yrs of Exp \u2013 Java ArchitectureSkill 4 \u2013 6 Yrs of Exp - AI tool10+ years of Software Engineering experience Key Skills : Core Java, Minimal AI skillsetConsulting Software EngineerThis is a senior level position to be a part of the team, serving as a leader and subject matter expert on the integration of AI tool. Responsibilities will include working with developers and architects as well as potentially being involved with internal users through proof-of-concept or project efforts.Experience (US only) and Education:\u2022 10+ years of Software Engineering experience\u2022 BS Engineering/Computer Science or equivalent experience required; advanced degree preferredRequired Skills:\u2022 Expert core Java knowledge and development experience, not limited to frameworks.\u2022 Advanced problem-solving skills involving identifying, researching, and coordinating the resources necessary to troubleshoot complex issues and find effective, strategic solutions.\u2022 Strong data manipulation and data analysis skills.\u2022 Considerable experience working with constructing and troubleshooting applications deployed in Azure\u2022 Ability to effectively prioritize tasks, manage time, and cope with change.\u2022 Strong research skills: ability to quickly learn and make use of new languages, tools, or technologies.\u2022 Aptitude for mathematical aspects of computer science.\u2022 Exceptional oral and written communication skills.Key Responsibilities:\u2022 Work effectively with team members or internal users to create or understand requirements, troubleshoot issues, and deliver solutions.\u2022 Follow architectural standards, required development processes, and coding best practices.\u2022 Participate in development and evolution of architecture.\u2022 Mentor other software developers, including but not limited to coding assistance, code reviews, and process guidance.\u2022 Design and/or work with complex data models.\u2022 Resolve complex technical issues.\u2022 Keep abreast of new technology developments, both internally and externally.\u2022 Create, maintain, and/or review technical documentation for internal users.\u2022 All other duties as assigned.Key Skills : Core Java, Minimal AI skillset",
        "source": "Email",
        "date_posted": "2024-10-17 14:25:01-05:00",
        "unique_id": "1929c1147ac3e7c5",
        "emp_type": [
            "full-time",
            "third party"
        ],
        "tag": "Java developer"
    }
]