[
    {
        "company": "Techgene Solutions, LLC",
        "job_title": "Agile Trainer/Coach",
        "location": "Chicago, IL, USA",
        "full_location": {
            "city": "Chicago",
            "state": "IL",
            "country": "USA"
        },
        "job_details": {
            "employment_type": [
                "contract",
                "third party"
            ],
            "experience_required": "15+ years",
            "degree_required": "Not specified",
            "visa_sponsorship": "Not specified",
            "notice_period": "Not specified",
            "duration": "6 months",
            "rate": "Not specified"
        },
        "skills": {
            "core": [
                "Agile Transformation",
                "Agile Portfolio Management",
                "Scrum",
                "Kanban",
                "Coaching"
            ],
            "primary": [
                "Leadership",
                "Communication",
                "Mentoring",
                "Agile Training",
                "Process Adherence"
            ],
            "secondary": [
                "Waterfall project management",
                "DevOps practices",
                "Agile Thought Leadership",
                "Innovative thinking",
                "Agile certifications"
            ],
            "all": [
                "Agile Transformation",
                "Agile Portfolio Management",
                "Scrum",
                "Kanban",
                "Coaching",
                "Leadership",
                "Communication",
                "Mentoring",
                "Agile Training",
                "Process Adherence",
                "Waterfall project management",
                "DevOps practices",
                "Agile Thought Leadership",
                "Innovative thinking",
                "Agile certifications"
            ]
        },
        "job_type": [
            "onsite"
        ],
        "contact_person": "Gyan Prakash Rai",
        "email": "gyanprakash.r@techgene.com",
        "jd": "Hello Vendors,I hope this email finds you well...We are currently seeking a Role- Agile Trainer/Coach Location: Chicago, IL6 month contract***Airlines experience highly preferred and this is a senior position, hence candidate should have 15+ years of Experience***Top 5 Skill sets1. Has been in some leadership role on Agile Transformation2. Has developed Agile Portfolio Management, Center of Excellence and Understands Agile Delivery (Scum, Kanban)3. Coach Role - Has great personality, can influence, Communicate, and collaborate with different leaders and business stakeholders. Can influence business leaders on Agile way of working.4. Has been part of Agile Transformation, where they have seen the transformation from a Waterfall to a Agile Delivery5. This person is a doer, brings to the table external perspective on challenges and pitfalls and can hit the ground running quickly. They have the leadership ability to work with different teams and enable the teams to align on the Agile transformation and Agile way of working.6. Great communication skills - verbal and Written( Narratives, Executive Decks). Is knowledgeable on organizational design and the role of culture to create high performing teams. Seeking an Agile Trainer/Coach.\u2022 In addition to the following responsibilities you will be responsible for working with teams and leadership on Agile adoption, facilitating workshops, removing impediments and obstacles programs and teams are experiencing, monitoring training and reporting on productivity improvement, creating standards and processes and training.\u2022 The Agile Trainer/Coach will be engaged throughout the enterprise transformation to facilitate a smooth transformation into Agile processes. Responsibilities:\u2022 Coaching: Working with teams to institute, practice, and adopt Scrum and Agile techniques. Identify and introduce opportunities for the team to improve through coaching and questioning.\u2022 Mentoring: Serve as a mentor to Scrum Masters, Product Managers and other Agile leaders with an aim to make Agile techniques successful, resilient and permanent.\u2022 Training: Collaborate to develop Agile training materials, newsletters, and support communities as they relate to Agile practices. Provide Agile and role-specific training (group and one-on-one) for management, team members, Product Owners, and Scrum Masters.\u2022 Observing / Assessments: Observe program and team activities (e.g., sprint, release and roadmap planning) and provide constructive feedback to teams and leads. Critical impediments and non-adherence to the Agile core principles should be brought to leadership attention immediately.\u2022 Process Adherence: Work with the teams to ensure adherence to the defined Scrum processes and framework (status reporting, compliance, estimation).\u2022 Tool Adherence: Work with the teams to ensure the appropriate tools are being leveraged and enterprise practices are being followed to enable consistency and metrics where needed.\u2022 Culture: Work with management and teams to strengthen our Agile culture. Skills/Requirements:\u2022 Experience in delivering Agile training and coaching in a transforming organization\u2022 5+ years experience working in an Agile environment and experience with Agile development methodologies (i.e. Scrum, XP, Kanban, Lean, etc.)\u2022 One or more Expert-level Agile certification(s) - PMI Agile Certified Practitioner (PMI-ACP), SAFe Program Consultant (SPC), Certified Scrum Professional (CSP), or other Agile related certifications a plus\u2022 Knowledge and experience in Waterfall project management\u2022 Experience implementing and continually improving Agile principles and practices, and coaching the customer on the recommended approach\u2022 Strong written and verbal communications skills, including the ability to communicate solutions effectively to technical and non-technical audiences.\u2022 Technical background with a deep understanding of modern DevOps practices preferred\u2022 Innovative thinking - ability to learn new tools and techniques and apply them to the program\u2022 Experienced in Agile Thought Leadership.",
        "source": "Email",
        "date_posted": "2024-10-17 16:30:30-05:00",
        "unique_id": "1929c8427520e3ab",
        "emp_type": [
            "contract",
            "third party"
        ],
        "tag": "Scrum Master"
    }
]