[
    {
        "company": "HCL",
        "job_title": "DB2/IDMS DBA",
        "location": "USA",
        "full_location": {
            "city": "",
            "state": "",
            "country": "USA"
        },
        "job_details": {
            "employment_type": [
                "third party"
            ],
            "job_code": "",
            "experience_required": "Not specified",
            "degree_required": "Not specified",
            "visa_sponsorship": "Not specified",
            "notice_period": "Not specified",
            "duration": "1 Year",
            "rate": "Not specified"
        },
        "skills": {
            "core": [
                "IDMS DBA",
                "DB2",
                "Application level DB experience",
                "record structure changes",
                "creating indexes",
                "planning and executing large installs",
                "DB monitoring",
                "backup/restores",
                "IDMS Programming",
                "ADS online code",
                "Dialogs",
                "Maps",
                "Applications",
                "ADSALIVE"
            ],
            "primary": [
                "CA Endevor",
                "ASG Replication Suite",
                "ASG Virtual Database",
                "CA-7",
                "CA-11"
            ],
            "secondary": [],
            "all": [
                "IDMS DBA",
                "DB2",
                "Application level DB experience",
                "record structure changes",
                "creating indexes",
                "planning and executing large installs",
                "DB monitoring",
                "backup/restores",
                "IDMS Programming",
                "ADS online code",
                "Dialogs",
                "Maps",
                "Applications",
                "ADSALIVE",
                "CA Endevor",
                "ASG Replication Suite",
                "ASG Virtual Database",
                "CA-7",
                "CA-11"
            ],
            "with_experience": []
        },
        "job_type": [
            "remote"
        ],
        "contact_person": "Danish Azeez",
        "email": "danish@inherenttech.com",
        "jd": "From: Danish Azeez, Inherent technologies danish@inherenttech.com Reply to: danish@inherenttech.com Position: DB2/IDMS DBA Location: RemoteDuration: 1 Years Phone & SkypeClient: HCLImmediate Interview Need Details in below format only else will not consider the resume. LinkedIn Profile link, Education details, Contact number has to be on Resume : Candidate Name Contact No. Email ID Current Location Visa Rate Ex-HCL Candidate Details:iTAP BR# NACandidate Reference No. NAFull Legal Name: First Name recorded in iTAP (Please share iTAP snippet) Middle Name recorded in iTAP (Please share iTAP snippet) Last Name recorded in iTAP(Please share iTAP snippet) Rate Consultant Location: Contact Number: Email ID: Interested to Relocate (Yes/NO): Highest Degree & Passing Year: Work Authorization (Must): Validity of Visa (If applicable): Availability for Onsite: Earliest Availability to Join: LinkedIn Profile: (Must) Current and Last few employers: Skill Rating \u2013Mandatory SkillsHands on experience in YearsLast used -YearSelf-Rating (Scale 1-10)1. 2. 3. 4. Required details: IDMS DBA - Application level DB experience - record structure changes; creating indexes; planning and executing large installs that include database, online, and batch changes; DB monitoring; building copying CVs, backup restoresIDMS Programming - IDMS internal security; heavy experience with ADS online code - Dialogs, Maps, and Applications, ADSALIVE and other debuggingOther helpful experience:CA Endevor - administration or at least heavy user experience including problem resolutionASG Replication Suite - probably will be difficult to find, fortunately we rarely perform updatesASG Virtual Database - basic understanding of how it worksCA-7 - CA-11 scheduling tools Description-IDMS DBA - Application level DB experience - record structure changes; creating indexes; planning and executing large installs that include database, online, and batch changes; DB monitoring; building copying CVs, backup restores IDMS Programming - IDMS internal security; heavy experience with ADS online code - Dialogs, Maps, and Applications, ADSALIVE and other debugging Other helpful experience: CA Endeavor - administration or at least heavy user experience including problem resolution ASG Replication Suite - probably will be difficult to find, fortunately we rarely perform updates ASG Virtual Database - basic understanding of how it worksCA-7 - CA-11 scheduling tools",
        "source": "Email",
        "date_posted": "2024-10-17 14:51:00-05:00",
        "unique_id": "1929cee9ccfecce3",
        "emp_type": [
            "third party"
        ],
        "tag": "DB Admin"
    }
]