[
    {
        "company": "Siriinfo",
        "job_title": "Data Engineer",
        "location": "San Francisco, CA, USA",
        "full_location": {
            "city": "San Francisco",
            "state": "CA",
            "country": "USA"
        },
        "job_details": {
            "employment_type": [
                "third party"
            ],
            "experience_required": "8-10 years",
            "degree_required": "Bachelor's degree in Computer Science, Engineering, or related fields",
            "visa_sponsorship": "Not specified",
            "notice_period": "Not specified",
            "duration": "Not specified",
            "rate": "Not specified"
        },
        "skills": {
            "core": [
                "AWS Glue",
                "EMR",
                "Athena",
                "Redshift",
                "Lake Formation",
                "Apache Spark",
                "Apache Hive",
                "Apache Airflow",
                "S3FS",
                "Apache Hudi",
                "Trino",
                "SQL",
                "NoSQL",
                "Tableau",
                "AWS QuickSight",
                "Git"
            ],
            "primary": [
                "Cloud Computing",
                "Data Engineering",
                "Full Stack Development",
                "AngularJS",
                "Python",
                "HTML",
                "CSS",
                "JavaScript",
                "RESTful APIs",
                "Microservices Architecture",
                "Agile Development"
            ],
            "secondary": [
                "Docker",
                "Kubernetes",
                "React",
                "Vue.js",
                "DevOps",
                "CI/CD",
                "Terraform",
                "API Development",
                "Security Best Practices",
                "SSO Integration",
                "Microsoft Azure AD",
                "oAuth",
                "OIDC",
                "SAML",
                "AWS Cognito"
            ],
            "all": [
                "AWS Glue",
                "EMR",
                "Athena",
                "Redshift",
                "Lake Formation",
                "Apache Spark",
                "Apache Hive",
                "Apache Airflow",
                "S3FS",
                "Apache Hudi",
                "Trino",
                "SQL",
                "NoSQL",
                "Tableau",
                "AWS QuickSight",
                "Git",
                "Cloud Computing",
                "Data Engineering",
                "Full Stack Development",
                "AngularJS",
                "Python",
                "HTML",
                "CSS",
                "JavaScript",
                "RESTful APIs",
                "Microservices Architecture",
                "Agile Development",
                "Docker",
                "Kubernetes",
                "React",
                "Vue.js",
                "DevOps",
                "CI/CD",
                "Terraform",
                "API Development",
                "Security Best Practices",
                "SSO Integration",
                "Microsoft Azure AD",
                "oAuth",
                "OIDC",
                "SAML",
                "AWS Cognito"
            ]
        },
        "job_type": [],
        "contact_person": "Dushyanth",
        "email": "dushyanth@siriinfo.com",
        "jd": "From: Dushyanth, Siriinfo dushyanth@siriinfo.com Reply to: dushyanth@siriinfo.com HiHiring for Data Engineer at San Francisco CA Competencies: Digital : Amazon Web Service(AWS) Cloud ComputingExperience (Years): 8-10Essential Skills: Hands on Experience with data engineering technologies such as AWS Glue, EMR, Athena, Redshift, Lake Formation, Apache Spark, Apache Hive, Apache Airflow, S3FS, Apache Hudi and Trino. \u2022 Extensive experience of building data pipelines using orchestration tool like Apache Airflow. Hands on experience on building cross cutting concerns like data catalog, data lineage, data quality, data profiling, data discovery, metadata management \u2022 Proven experience as a Full Stack Developer with AngularJS and Python. \u2022 Strong understanding of web development technologies including HTML, CSS, and JavaScript. \u2022 Experience working with RESTful APIs and JSON. Familiarity with microservices architecture. \u2022 Experience with core AWS technologies such as EC2, ELB, Auto Scaling, S3, EFS, Lambda, API Gateway, Step Functions, Cloudwatch, VPC, Route 53, ACM \u2022 Hands on experience with SQL and NoSQL databases. \u2022 Hands experience with BI tools like Tableau, AWS QuickSight \u2022 Experience with Git or other version control systems. \u2022 Understanding of agile development methodologies. \u2022 Strong problem-solving skills. \u2022 Excellent written and verbal communication skills. \u2022 Ability to work independently and collaboratively in a team environment. \u2022 Experience with cloud platforms such as AWS. \u2022 Bachelors degree in Computer Science, Engineering, or related fieldsDesirable Skills: Knowledge of containerization technologies like Docker or Kubernetes. \u2022 Experience with front-end frameworks like React or Vue.js. \u2022 Experience with DevOps and CI/CD best practices. \u2022 Experience with Terraform and the AWS provider. \u2022 Experience with API development, security, and best practices. \u2022 Experience with SSO integration with Microsoft Azure AD using oAuth, OIDC, and SAML. \u2022 Experience with integration with AWS Cognito for user authentication and authorization.Country: United States Thanks & regards Dushyanth | Sr. IT Recruiter| Email: dushyanth@siriinfo.com",
        "source": "Email",
        "date_posted": "2024-10-17 12:53:21-05:00",
        "unique_id": "1929bf7356e10763",
        "emp_type": [
            "third party"
        ],
        "tag": "AWS Data Engineer"
    }
]