[
    {
        "company": "O2finc",
        "job_title": "API Developer",
        "location": "Dallas, TX, USA",
        "full_location": {
            "city": "Dallas",
            "state": "TX",
            "country": "USA"
        },
        "job_details": {
            "employment_type": [
                "full-time",
                "third party"
            ],
            "experience_required": "Not specified",
            "degree_required": "Not specified",
            "visa_sponsorship": "Not specified",
            "notice_period": "Not specified",
            "duration": "Not specified",
            "rate": "Not specified"
        },
        "skills": {
            "core": [
                "Java",
                "Spring Framework",
                "REST",
                "SOAP",
                "Microservices Architecture"
            ],
            "primary": [
                "Node.js",
                "Express.js",
                "Swagger",
                "OpenAPI",
                "ReadyAPI",
                "SOAPUI",
                "Postman",
                "JMeter",
                "Python",
                "API Management Tools"
            ],
            "secondary": [
                "OAuth",
                "JWT",
                "AWS",
                "Azure",
                "Google Cloud"
            ],
            "all": [
                "Java",
                "Spring Framework",
                "REST",
                "SOAP",
                "Microservices Architecture",
                "Node.js",
                "Express.js",
                "Swagger",
                "OpenAPI",
                "ReadyAPI",
                "SOAPUI",
                "Postman",
                "JMeter",
                "Python",
                "API Management Tools",
                "OAuth",
                "JWT",
                "AWS",
                "Azure",
                "Google Cloud"
            ]
        },
        "job_type": [
            "remote"
        ],
        "contact_person": "Ayesha",
        "email": "ayesha@o2finc.com",
        "jd": "API Developer - Location- Dallas, TX(Remote Role)Experienced in designing, developing, integrating, and deploying web services (with REST/SOAP/JSON/XML) using micro services architectureExpert level of Java development experience, including newer versions Expert knowledge of Spring frameworks, including Spring BootExperience with node.js and express.jsExperience designing and documenting APIs with tools such as Swagger, OpenAPIExperience with Java and web services testing tools (ReadyAPI, SOAPUI, Postman, JMeter, etc.)Proficiency in programming languages such as Java, Python, Node.js, or similar.Experience with API management tools (e.g., Apigee, Postman, Swagger).Strong understanding of authentication and authorization mechanisms (e.g., OAuth, JWT). Familiarity with cloud platforms (e.g., AWS, Azure, Google Cloud) and microservices architecture.",
        "source": "Email",
        "date_posted": "2024-10-17 14:45:19-05:00",
        "unique_id": "1929c23dd97ae598",
        "emp_type": [
            "full-time",
            "third party"
        ],
        "tag": "Java developer"
    }
]