[
    {
        "company": "Han Staffing",
        "job_title": "Product owner (Life insurance exp)",
        "location": "Clinton, NJ, USA",
        "full_location": {
            "city": "Clinton",
            "state": "NJ",
            "country": "USA"
        },
        "job_details": {
            "employment_type": [
                "contract",
                "third party"
            ],
            "job_code": "",
            "experience_required": "10+ years",
            "degree_required": "Bachelor\u2019s degree in a related field and/or equivalent work experience",
            "visa_sponsorship": "Not specified",
            "notice_period": "Not specified",
            "duration": "Long Term Contract",
            "rate": "Not specified"
        },
        "skills": {
            "core": [
                "IT Business Analyst",
                "Product Owner",
                "Insurance domain knowledge",
                "Agile project execution",
                "Business Analysis Standards"
            ],
            "primary": [
                "Complex business problem solving",
                "Requirements management",
                "Stakeholder engagement",
                "Training and documentation",
                "Leadership and negotiation"
            ],
            "secondary": [
                "SAFe agile environment",
                "MS Word",
                "Excel",
                "Visio",
                "MS Project",
                "PowerPoint",
                "SharePoint",
                "Quality Center",
                "JIRA"
            ],
            "all": [
                "IT Business Analyst",
                "Product Owner",
                "Insurance domain knowledge",
                "Agile project execution",
                "Business Analysis Standards",
                "Complex business problem solving",
                "Requirements management",
                "Stakeholder engagement",
                "Training and documentation",
                "Leadership and negotiation",
                "SAFe agile environment",
                "MS Word",
                "Excel",
                "Visio",
                "MS Project",
                "PowerPoint",
                "SharePoint",
                "Quality Center",
                "JIRA"
            ],
            "with_experience": [
                "IT Business Analyst",
                "Product Owner",
                "Insurance domain knowledge",
                "Agile project execution"
            ]
        },
        "job_type": [
            "hybrid"
        ],
        "contact_person": "Danish Mujeeb",
        "email": "danish@hanstaffing.com",
        "jd": "From: Danish Mujeeb, Han Staffing danish@hanstaffing.com Reply to: danish@hanstaffing.com Job Title: Product owner (Life insurance exp) Location: Clinton NJ - Hybrid Duration: Long Term Contract Job Description: Functional Responsibilities: Experienced IT Business Analyst/Product Owner with a 10+ years experience Demonstrated experience solving complex business problems, working across multiple workstreams, and strong attention to detail Collaborate with business partners from multiple disciplines to elicit, document, prepare and manage business requirements / user stories Establish meaningful traceability between related requirements Act as a liaison between the business and IT design and delivery teams Utilize industry standard diagram techniques to enhance the clarity of definition, including process flows, context diagrams, use cases, wireframes, etc. Set requirement baselines upon obtaining requirements package sign-off Support requirements change management; analyze impact and obtain change sign-off throughout NYLs Technology Delivery Life Cycle (TDLC) framework Interface with Business Partners and Technical resources to translate and simplify requirements Ensure requirements are met and verify that the implemented solution meets the requirements Partner with QA team and SMEs to ensure adequate test coverage Work with stakeholders to conduct training sessions / demos, and to develop manuals / user guides Works within NYLs Operational Excellence COE business analysis standards and participates in continuous improvement efforts Experience & Skills: Applied experience with large scale, complex IT projects Insurance domain knowledge (specifically new business and underwriting) Experience in execution of agile projects, Experience working in SAFe agile environment, facilitating PI planning Experience projects with variable staffing including onsite/offshore execution model and distributed teams. Working knowledge of Business Analysis Standards (i.e. IIBA best practices) Proficient in MS Word, Excel, Visio, MS Project, and PowerPoint, Knowledge of SharePoint, Quality Center, and JIRA a plus, Quickly learns new businesses and complex processes Ability to work from objectives with minimal guidance or supervision Demonstrated ability to understand and work across multiple business domains in support of projects Ability to partner with development teams that support various technology platforms Proven leadership, negotiation and relationship management skills Strong critical thinking skills and attention to detail Education: Bachelor\u2019s degree in a related field and/or equivalent work experience Advanced degree encouraged",
        "source": "Email",
        "date_posted": "2024-10-17 09:09:08-05:00",
        "unique_id": "1929af231c78d92d",
        "emp_type": [
            "contract",
            "third party"
        ],
        "tag": "Business Analyst"
    }
]