[
    {
        "company": "RCI",
        "job_title": "Senior Java Developer",
        "location": "Lansing, MI, USA",
        "full_location": {
            "city": "Lansing",
            "state": "MI",
            "country": "USA"
        },
        "job_details": {
            "employment_type": [
                "full-time",
                "third party"
            ],
            "experience_required": "12+ years",
            "degree_required": "Bachelor\u2019s Degree",
            "visa_sponsorship": "Visa sponsorship available",
            "notice_period": "Not specified",
            "duration": "1 year with possible extension",
            "rate": "Not specified"
        },
        "skills": {
            "core": [
                "Java",
                "SQL",
                "Java JEE",
                "Spring/SpringBoot",
                "Angular",
                "AWS"
            ],
            "primary": [
                "Hibernate",
                "React JS",
                "Elastic search",
                "Apache Struts",
                "RESTful Web Services",
                "GIT",
                "Maven",
                "Apache Tomcat"
            ],
            "secondary": [
                "JMS",
                "CI/CD pipelines",
                "Business Objects",
                "Oracle Discoverer",
                "EHR HL7 solutions",
                "CMM/CMMI Level 3 methods",
                "Agile development processes"
            ],
            "all": [
                "Java",
                "SQL",
                "Java JEE",
                "Spring/SpringBoot",
                "Angular",
                "AWS",
                "Hibernate",
                "React JS",
                "Elastic search",
                "Apache Struts",
                "RESTful Web Services",
                "GIT",
                "Maven",
                "Apache Tomcat",
                "JMS",
                "CI/CD pipelines",
                "Business Objects",
                "Oracle Discoverer",
                "EHR HL7 solutions",
                "CMM/CMMI Level 3 methods",
                "Agile development processes"
            ]
        },
        "job_type": [
            "hybrid"
        ],
        "contact_person": "Nitu",
        "email": "nitu@rconsultinginc.com",
        "jd": "From: nitu, RCI nitu@rconsultinginc.com Reply to: nitu@rconsultinginc.com Role: Senior Java DeveloperLocation: Lansing, MI, 48933 \u2013 Hybrid Duration: 1 year with possible extension Visa: Any Local candidates onlyPrior state experience preferredMust be comfortable for onsite interview Repost of 134783, do not submit candidate who have been forwarded to the manager for 134783. Must Have: \u2022 12+ years developing complex computer systems using Java.\u2022 12+ years developing complex computer systems using java IDEs such as Eclipse, STS\u2022 12+ years programming in SQL and/or PL/SQL.\u2022 8+ years programming using Java JEE Struts and JEE Spring/SpringBoot Framework 3.0.\u2022 5+ years in projects development using Angular/React JS, JavaScript framework.\u2022 5+ years' experience with AWS, Databricks, and Elastic search. \u2022 Bachelor\u2019s Degree Position Summary: \u2022 Write well-designed, testable code using spring MVC, Hibernate framework for entity object mapping, JQuery/HTML5, JavaScript, HTML, XML, Angular\u2022 Develop business application components using Object Oriented java/JEE technologies, design principles .\u2022 Design and develop RESTful Web Services using Spring Web MVC framework.\u2022 Design, Develop and maintain applications using Apache Struts framework.\u2022 Ability to implement design patterns like Intercepting Filter, Front Controller, Session Fa\u00e7ade, DAO, Singleton, and Service Locator\u2022 Execute full software development life cycle (SDLC) including experience in gathering requirements and writing functional/technical specifications for complex projects.\u2022 Excellent knowledge in designing both logical and physical database model\u2022 Develop database objects including stored procedures, functions,\u2022 Troubleshoots issues using SQL, PL/SQL scripts\u2022 Experience tuning SQL queries and scripts\u2022 Hands on experience Integrating software components into a fully functional software system\u2022 Extensive knowledge on source control tools such as GIT\u2022 Experience on Build Frameworks like Maven, maintain source code using source control, and baseline software versions and build war files for deployments\u2022 Experience developing with application servers Apache Tomcat, JBOSS, Web Sphere,Openshift Container\u2022 Develop software design documents and work with stakeholders for review and approval.\u2022 Experience developing, prototypes, mockup for users review and approval.\u2022 Exposure to flowcharts, screen layouts and documentation to ensure logical flow of the system requirements\u2022 Experience working on large agile projects.\u2022 Experience with Java 8, SOAP Web-Services and Java Messaging Service (JMS) API.\u2022 Experience with Spring Boot Projects, Spring Data, Spring Batch, Spring Security frameworks.\u2022 Good to have knowledge of Apache Kafka, Apache Spark and ActiveMQ broker.\u2022 Experience in Database Design in Oracle and SQL server.\u2022 Experience or Knowledge on creating CI/CD pipelines using Azure Devops\u2022 Design, develop and maintain BI reporting solutions using Business Objects and Oracle Discoverer.\u2022 Extensive experience in Oracle database logical and physical design.\u2022 Develop PL/SQL Procedures, Functions, Packages and Job Scheduling.\u2022 Experience in Electronic Health Records(EHR) HL7 solutions.\u2022 Experience in 5010 EDI X12 healthcare claims processing solutions.\u2022 Experience in SIGMA payment processing type solutions.",
        "source": "Email",
        "date_posted": "2024-10-17 10:01:07-05:00",
        "unique_id": "1929b221d3ac8a20",
        "emp_type": [
            "full-time",
            "third party"
        ],
        "tag": "Java developer"
    }
]