[
    {
        "company": "Tata Elxsi",
        "job_title": "Java Full Stack Developer",
        "location": "Philadelphia, PA, USA",
        "full_location": {
            "city": "Philadelphia",
            "state": "PA",
            "country": "USA"
        },
        "job_details": {
            "employment_type": [
                "contract",
                "third party"
            ],
            "experience_required": "9+ years",
            "degree_required": "Not specified",
            "visa_sponsorship": "Not specified",
            "notice_period": "Not specified",
            "duration": "Not specified",
            "rate": "Not specified"
        },
        "skills": {
            "core": [
                "Java",
                "LDAP",
                "MySQL/MariaDB",
                "Spring Framework",
                "Maven"
            ],
            "primary": [
                "REST APIs",
                "Linux",
                "JavaScript"
            ],
            "secondary": [
                "Problem Solving",
                "Critical Thinking",
                "Communication",
                "Team Player"
            ],
            "all": [
                "Java",
                "LDAP",
                "MySQL/MariaDB",
                "Spring Framework",
                "Maven",
                "REST APIs",
                "Linux",
                "JavaScript",
                "Problem Solving",
                "Critical Thinking",
                "Communication",
                "Team Player"
            ]
        },
        "job_type": [
            "onsite"
        ],
        "contact_person": "vigneshwar",
        "email": "vigneshwar.jayakumar@exaways.com",
        "jd": "From: vigneshwar, exaways vigneshwar.jayakumar@exaways.com Reply to: vigneshwar.jayakumar@exaways.com Role: Full Stack Java Developer ( Candidate need to come for F2F interview, so look for local) \u2013 High PriorityClient: Tata Elxsi Location: Philadelphia, PAMandatory : LDAP and Java Technical Skills:Excellent Java skills and prior experience working with frameworks, building REST APIs and other backend/frontend componentsAbility to write well-documented, clean Java codeTechnical proficiency with MySQL/MariaDB database design/administrationExperience with Linux operating system. Including scripting and common tools and utilitiesExcellent problem solving and critical thinking skills.Proficient in spring framework and MavenProfessional Skills:Ability to take responsibility for completing projects with the least amount of oversight.Ability to apply judgment, implement solutions, and avoid conflicts in a multi-tasked environment.Excellent communication skills in all areas including procedural documentation, incident reporting and information relaying.Team player with the ability to maintain a pleasant personality and a professional demeanor in stressful situations.Experience:9+ years in a Full Stack Developer role9+ years in Java9+ years of experience developing multi-tier software applications7+ years and JavaScriptLDAP experienceExperience in the SDL (Secure Development Lifecycle) process with strong security focus",
        "source": "Email",
        "date_posted": "2024-10-17 11:40:59-05:00",
        "unique_id": "1929ba228296fccf",
        "emp_type": [
            "contract",
            "third party"
        ],
        "tag": "Java developer"
    }
]