[
    {
        "company": "ITech US Inc",
        "job_title": "Azure Enterprise Architect",
        "location": "Grand rapids, MI, USA",
        "full_location": {
            "city": "Grand rapids",
            "state": "MI",
            "country": "USA"
        },
        "job_details": {
            "employment_type": [
                "contract",
                "third party"
            ],
            "experience_required": "Not specified",
            "degree_required": "Not specified",
            "visa_sponsorship": "Not specified",
            "notice_period": "Not specified",
            "duration": "12+ months contract",
            "rate": "Not specified"
        },
        "skills": {
            "core": [
                "Azure - Data Factory",
                "Log Analytics",
                "Databricks",
                "Synapse",
                "Power BI",
                "ADLS Gen2"
            ],
            "primary": [
                "GCP Cloud storage",
                "Big Query",
                "Retail Media Data Movement experience",
                "Google Marketing platform",
                "Salesforce MCI",
                "The Trade Desk",
                "ADvendio",
                "Data Modeling",
                "Data Classification and zones",
                "Data architecture and reporting",
                "Python",
                "API architecture in Azure"
            ],
            "secondary": [],
            "all": [
                "Azure - Data Factory",
                "Log Analytics",
                "Databricks",
                "Synapse",
                "Power BI",
                "ADLS Gen2",
                "GCP Cloud storage",
                "Big Query",
                "Retail Media Data Movement experience",
                "Google Marketing platform",
                "Salesforce MCI",
                "The Trade Desk",
                "ADvendio",
                "Data Modeling",
                "Data Classification and zones",
                "Data architecture and reporting",
                "Python",
                "API architecture in Azure"
            ]
        },
        "job_type": [
            "onsite"
        ],
        "contact_person": "Manasa Salla",
        "email": "manasa.s@itechus.net",
        "jd": "From: Manasa Salla, ITech US INC manasa.s@itechus.net Reply to: manasa.s@itechus.net Hi..........Greetings, This is Manasa from ITech US Inc. Given below are the details of the position with one of our clients and was wondering if you would be interested or can recommend someone who would be interested in this job.Job Role: Azure Enterprise ArchitectJob Location: Grand rapids, Michigan Duration: 12+ months contractCompetencies: Digital : Microsoft Azure, Digital : Python, Data Concepts & Data Modelling, Digital : Microsoft Power BI, Digital : DatabricksEssential Skills: 1. Azure - Data Factory, Log Analytics, Databricks, Synapse, Power BI, ADLS Gen2,2. GCP Cloud storage and Big Query3. Retail Media Data Movement experience4. Google Marketing platform, Salesforce MCI, The Trade Desk, ADvendio5. Power BI, Data Modeling, Data Classification and zones, data movement, Data architecture and reporting6. Python and API architecture in AzureKeywords: 1. Azure - Data Factory, Log Analytics, Databricks, Synapse, Power BI, ADLS Gen2,2. GCP Cloud storage and Big Query3. Retail Media Data Movement experience4. Google Marketing platform, Salesforce MCI, The Trade Desk, ADvendio5. Power BI, Data Modeling, Data Classification and zones, data movement, Data architecture and reporting6. Python and API architecture in AzureRole Description: Designs, codes, tests, and implements data movement pipelines, dashboarding and analytical assets; develops system documentation according to SAFe Agile principles and industry standards.Design and hands-on development on either vendor or internal applications and interfaces including Azure - Data Factory, Log Analytics, Databricks, Synapse, Power BI, ADLS Gen2, GCP Cloud storage and Big Query Assist in configuration and administration of marketing platforms (Google Marketing platform, Salesforce MCI, The Trade Desk etc., ADvendio) that the team supports Build data ingestion into and out of the above listed marketing platforms Gathers and implements functional and non-functional requirements including performance monitoring, alerting and code management and ensuring alignment with technology best practices and SLAs.Partnering with all areas of the business to gather requirements for Data and Analytics and designing solutions.Participate in agile ceremonies and follow agile cadence to build, test and deliver solutions Driving engagement with ITS Security and Infrastructure teams to ensure secure development and deployment of solutions.Interfaces with the Product Manager and IT partners at the Program level and within other Release Trains to define and estimate features for agile teams. Thanks & RegardsManasa SallaSr Technical RecruiteriTech US, Incmanasa.s@itechus.netLinkedIn: https://www.linkedin.com/in/manasa-salla-0836711a8",
        "source": "Email",
        "date_posted": "2024-10-17 08:36:46-05:00",
        "unique_id": "1929ae69a7c69b25",
        "emp_type": [
            "contract",
            "third party"
        ],
        "tag": "Azure Data Engineer"
    }
]