[
    {
        "company": "Han Staffing",
        "job_title": "AWS Platform Developer",
        "location": "Hartford, CT, USA",
        "full_location": {
            "city": "Hartford",
            "state": "CT",
            "country": "USA"
        },
        "job_details": {
            "employment_type": [
                "contract",
                "third party"
            ],
            "job_code": "",
            "experience_required": "4+ years",
            "degree_required": "Bachelor's degree in Computer Science, Computer Engineering, or a technical field.",
            "visa_sponsorship": "Not specified",
            "notice_period": "Not specified",
            "duration": "4 to 6 months",
            "rate": "Not specified"
        },
        "skills": {
            "core": [
                "AWS",
                "Python",
                "Terraform"
            ],
            "primary": [
                "Infrastructure as Code",
                "CI/CD",
                "Automated Testing",
                "Agile methodologies"
            ],
            "secondary": [
                "Cloud Formation",
                "Jenkins",
                "CodePipeline",
                "uDeploy",
                "GitHub Actions",
                "Data ingestion pipeline",
                "HITL"
            ],
            "all": [
                "AWS",
                "Python",
                "Terraform",
                "Infrastructure as Code",
                "CI/CD",
                "Automated Testing",
                "Agile methodologies",
                "Cloud Formation",
                "Jenkins",
                "CodePipeline",
                "uDeploy",
                "GitHub Actions",
                "Data ingestion pipeline",
                "HITL"
            ]
        },
        "job_type": [
            "remote"
        ],
        "contact_person": "Deepak",
        "email": "dipak@hanstaffing.com",
        "jd": "From: Deepak, Han Staffing dipak@hanstaffing.com Reply to: dipak@hanstaffing.com Job Description: AWS Platform DeveloperLocation: / HARTFORD / RemoteDuration: 4 to 6 monthsWe are seeking a talented AWS Platform Developer to join our dynamic team. As an AWS Platform Developer, you will play a key role in designing, developing, and maintaining scalable infrastructure solutions on AWS cloud. You should have strong proficiency in Python programming, extensive experience with AWS services, and proficiency with infrastructure-as-code tools such as Terraform.Responsibilities:\u2022 Design, build, and maintain secure, reliable, and scalable AWS infrastructure using best practices.\u2022 Ensure code is delivered without vulnerabilities by enforcing engineering practices, code scanning, etc.\u2022 Build and maintain IAC (terraform/Cloud Formation), CICD (Jenkins) scripts, CodePipeline, uDeploy, & GitHub Actions.\u2022 Partner with our shared service teams like Architecture, Cloud, Security, etc to design and implement platform solutions.\u2022 Develop automation scripts and tools for provisioning and managing cloud resources.\u2022 Design and build the Data ingestion pipeline for Finetuning LLM Models.\u2022 Create templates (Architecture As Code) implementing Ref architecture application\u2019s topology.\u2022 Build a feedback system using HITL for Supervised finetuning.Qualifications:\u2022 Bachelor's degree in Computer Science, Computer Engineering, or a technical field.\u2022 4+ years of extensive experience with AWS cloud, Python and Terraform.\u2022 At least 8 years of experience designing and building data-intensive solutions using distributed computing.\u2022 8+ years building and shipping software and/or platform infrastructure solutions for enterprises.\u2022 Extensive programming experience with Python.\u2022 Experience with CI/CD pipelines, Automated Testing, Automated Deployments, Agile methodologies, Unit Testing and Integration Testing tools.\u2022 Excellent problem-solving and communication skills and the ability to work in a collaborative team environment.",
        "source": "Email",
        "date_posted": "2024-10-17 08:00:51-05:00",
        "unique_id": "1929ab19143e94d1",
        "emp_type": [
            "contract",
            "third party"
        ],
        "tag": "AWS Data Engineer"
    }
]