[
    {
        "company": "WISEEQUATION SOLUTION INC",
        "job_title": "Release Train Engineer PM 4",
        "location": "Richmond, VA, USA",
        "full_location": {
            "city": "Richmond",
            "state": "VA",
            "country": "USA"
        },
        "job_details": {
            "employment_type": [
                "full-time",
                "third party"
            ],
            "experience_required": "5 years",
            "degree_required": "Not specified",
            "visa_sponsorship": "Not specified",
            "notice_period": "Not specified",
            "duration": "Not specified",
            "rate": "Not specified"
        },
        "skills": {
            "core": [
                "Release Train Engineer",
                "Agile methodologies",
                "Power Platform",
                "Scrum Master",
                "Project Management"
            ],
            "primary": [
                "PMP Certification",
                "Scrum Master Certification",
                "SAFe SPC Certification",
                "5 years of RTE experience",
                "3 years of RTE experience managing Power Platform teams"
            ],
            "secondary": [
                "Microsoft Project",
                "Visio",
                "MS Office",
                "Team Foundation Server",
                "JIRA",
                "Version One",
                "Strong interpersonal skills",
                "Strong analytical skills",
                "Strong verbal/written communication skills"
            ],
            "all": [
                "Release Train Engineer",
                "Agile methodologies",
                "Power Platform",
                "Scrum Master",
                "Project Management",
                "PMP Certification",
                "Scrum Master Certification",
                "SAFe SPC Certification",
                "5 years of RTE experience",
                "3 years of RTE experience managing Power Platform teams",
                "Microsoft Project",
                "Visio",
                "MS Office",
                "Team Foundation Server",
                "JIRA",
                "Version One",
                "Strong interpersonal skills",
                "Strong analytical skills",
                "Strong verbal/written communication skills"
            ]
        },
        "job_type": [
            "onsite"
        ],
        "contact_person": "Shivani Rawat",
        "email": "shivani.r@wiseq.net",
        "jd": "From: Shivani Rawat, WISEEQUATION SOLUTION INC shivani.r@wiseq.net Reply to: shivani.r@wiseq.net State of VARole: Release Train Engineer PM 4Location: 1401 E. Broad St. Richmond, VAInterview Mode: Webcam LOCAL candidates required*Candidate should be able to work onsite up to 3 days/week*PLEASE DO NOT submit candidates who were submitted to previous VDOT Release Train Engineer reqs. VDOT ITD is looking for a passionate and result oriented individual who will take over a technical Scaled Agile train as Release Train Engineer (RTE) that supports Power Platform development. This RTE should have some understanding of Power Platform technology, be able to empower teams, facilitate the ART events, effectively communicate with stakeholders, coach teams to ensure Agile processes are being followed, support teams with self-organization, escalate and help resolve impediments, and continuously improve teams / train to maximize value delivery. Candidate should also be able to perform Scrum Master / Project Manager duties as needed. Ideal candidate should be well versed, have led technical projects using Agile methodologies, and be comfortable with autonomously leading in a matrixed environment. Responsibilities: \u2022Plan, lead, organize, and motivate agile and traditional project teams to achieve a high level of performance and quality in delivering projects that provide exceptional business value to the internal and external stakeholders.\u2022Drive consistent project delivery through the entire project lifecycle, including Project plans, Release plans, Resource allocation, and management of project risks, schedule, budget, and delivery of value.\u2022Provide leadership in the establishment and development of project base line budgets, resource allocation, and schedules.\u2022Track and communicate project's progress from a schedule, cost, and risk perspective to the project team, stakeholders, and management.\u2022Manage and optimize the flow of value through the ART using various tools, such as the Program Kanban and other information radiators.\u2022Establish and communicate the annual calendars for Iterations and Program Increments (PIs).\u2022Facilitate PI Planning readiness, PI Planning event, and PI execution e.g. Roadmap, Backlogs, Risks, Dependencies, and PI Objectives, etc.\u2022Assist feature prioritization, tracking the execution of features e.g. Train level metrics.\u2022Facilitate synchronization meetings e.g. Scrum of Scrums and Program Committee Meetings.\u2022Coach Managers, Teams, and Scrum Masters in Lean-Agile practices and mindsets.\u2022Escalate and track impediments, help identify and address critical bottlenecks.\u2022Encourage collaboration between teams, Engineering, and Enterprise Architects.\u2022Help ensure strategy and execution alignment (Product Management and Stakeholders).\u2022Assess practices with DevOps, etc. and help improve Continuous Delivery Pipeline.\u2022Conduct Inspect and Adapt workshops, facilitate System Demos, assess the agility level of the ART and help them improve.\u2022Ability to take on additional responsibilities such as Scrum Master, Community of Practice, etc. Knowledge, Skills, and Abilities: \u2022PMP and Scrum Master Certification is required.\u2022SAFe SPC or RTE Certification is required.\u20225 years of RTE experience is required. \u20223 years of RTE experience managing Power Platform teams is required.\u2022An understanding of creating and maintaining Program Increment Backlogs. \u2022Ability to lead and direct the software development teams through program increment and program iteration planning.\u2022Experience with agile software development for complex Information Technology systems.\u2022Strong interpersonal skills including mentoring, coaching, collaborating, and team building.\u2022Strong analytical, organizational and decision-making skills.\u2022Strong verbal/written communication skills with the ability to simplify and communicate complex issues to multiple audiences.\u2022Ability to work with customers, understand their business practices and manage their expectations.\u2022Expertise with Project Management tools such as Microsoft Project, Visio, and MS Office.\u2022Experience with Agile collaboration tools such as Team Foundation Server, JIRA, Version One, etc.",
        "source": "Email",
        "date_posted": "2024-10-17 09:04:35-05:00",
        "unique_id": "1929aee2ce1e4b51",
        "emp_type": [
            "full-time",
            "third party"
        ],
        "tag": "Scrum Master"
    }
]