[
    {
        "company": "Sydata Inc",
        "job_title": "Sr .Net Developer",
        "location": "Los Angeles, CA, USA",
        "full_location": {
            "city": "Los Angeles",
            "state": "CA",
            "country": "USA"
        },
        "job_details": {
            "employment_type": [
                "full-time",
                "third party"
            ],
            "job_code": "",
            "experience_required": "5 years",
            "degree_required": "BS/BA degree in computer science, information technology, or related field",
            "visa_sponsorship": "Not specified",
            "notice_period": "Not specified",
            "duration": "Long Term",
            "rate": "Not specified"
        },
        "skills": {
            "core": [
                ".NET",
                "C#",
                "ASP.NET/MVC",
                "Web services REST API or SOAP",
                "SQL Server",
                "Angular",
                ".NET Core"
            ],
            "primary": [
                "JavaScript",
                "JQuery",
                "Bootstrap",
                "HTML5",
                "CSS3",
                "Entity Framework",
                "T-SQL",
                "PL SQL",
                "Micro services architecture",
                "Cloud hosting and deployment (Azure or AWS)"
            ],
            "secondary": [
                "Oracle 11g",
                "PostgreSQL",
                "Typescript",
                "Node.js",
                "SQL Server Reporting Services (SSRS)",
                "SQL Server Integration Services (SSIS)"
            ],
            "all": [
                ".NET",
                "C#",
                "ASP.NET/MVC",
                "Web services REST API or SOAP",
                "SQL Server",
                "Angular",
                ".NET Core",
                "JavaScript",
                "JQuery",
                "Bootstrap",
                "HTML5",
                "CSS3",
                "Entity Framework",
                "T-SQL",
                "PL SQL",
                "Micro services architecture",
                "Cloud hosting and deployment (Azure or AWS)",
                "Oracle 11g",
                "PostgreSQL",
                "Typescript",
                "Node.js",
                "SQL Server Reporting Services (SSRS)",
                "SQL Server Integration Services (SSIS)"
            ]
        },
        "job_type": [
            "onsite"
        ],
        "contact_person": "Shobhana Kulhade",
        "email": "shobhana@sydatainc.com",
        "jd": "Immediate need Sr .Net Developer in Los Angeles, CA - Local Needed\n\nSr .Net Developer\nLos Angeles, CA - Local Needed\nLong Term\n\nREQUIREMENTS\nProposed candidate must have 5 years of experience building complex .NET web applications, functions, API Service, workflow, and SQL queries with T-SQL/PL SQL and stored procedures. Experience in the following area(s) is required: 5 years of ASP.NET/MVC 5 years of C# Programming 5 years of Web services REST API or SOAP 3 years of modern/mobile responsive front-end development using JavaScript, JQuery, Bootstrap, HTML5, and CSS3. 5 years of Angular 3 years of Entity Framework and SQL Server 2012 or higher database. 5 years of .NET Core 3 years in the following areas is preferred: Oracle 11g database or higher and PL SQL programming PostgreSQL database version 9 or higher Scripting Languages (Typescript, and Node.js) SQL Server Reporting and Integration Services (SSRS and SSIS) Micro services architecture Cloud hosting and deployment (Azure or AWS) Good verbal and written communication skills. Proposed candidate must have a BS/BA degree in computer science, information technology, or related field. Additional qualifying experience may be substituted for degree on a year-for year basis.\n\nDUTIES include: Effectively complete applications development by coordinating requirements, schedules and activities; troubleshooting development and production support issues across multiple environments and platforms. Lead the system design and development methodologies and toolset to deliver a modernized web based system application. Perform unit, integration, and load testing of complex websites, systems integration and applications interfaces. Lead role in the design and implementation of databases architecture, as well as expert management of data loads and data quality assurance. Gather customer software requirements and proposed best software solution and technologies to address business needs. Lead role in establishing and implementing consistent standards, practices, and procedures that will facilitate a high-quality application delivery to district users. Effectively work with project management, leadership and business users to provide time estimates, schedules for projects and any change revisions, communicating regularly with department management and functional users on project requirements, activities and status. Participate in application design strategy and team code review meetings. Provide mentoring as lead to other team members as needed. Ensure knowledge transfer and documentation of all facets of the system application for team members and develop user guide and assistance tools to end users.",
        "source": "Email",
        "date_posted": "2024-10-17 11:38:51-05:00",
        "unique_id": "1929ba278badd13a",
        "emp_type": [
            "full-time",
            "third party"
        ],
        "tag": ".net developer"
    }
]