[
    {
        "company": "Vyze Inc.",
        "job_title": "Senior Java BACK-END Programmer",
        "location": "Richmond, VA, USA",
        "full_location": {
            "city": "Richmond",
            "state": "VA",
            "country": "USA"
        },
        "job_details": {
            "employment_type": [
                "full-time",
                "third party"
            ],
            "experience_required": "9+ years",
            "degree_required": "Not specified",
            "visa_sponsorship": "Not specified",
            "notice_period": "Not specified",
            "duration": "12+ Months",
            "rate": "Not specified"
        },
        "skills": {
            "core": [
                "Core Java",
                "Java EE",
                "Oracle",
                "Git Workflows",
                "CI/CD"
            ],
            "primary": [
                "Multi-Threading",
                "OOP Design",
                "Generics",
                "Exception Handling",
                "Collections",
                "Java Reflection",
                "Annotation",
                "Azure DevOps",
                "Selenium",
                "Cucumber",
                "Playwright",
                "JUnit",
                "IBM SOA products",
                "Node.js",
                "Angular"
            ],
            "secondary": [],
            "all": [
                "Core Java",
                "Java EE",
                "Oracle",
                "Git Workflows",
                "CI/CD",
                "Multi-Threading",
                "OOP Design",
                "Generics",
                "Exception Handling",
                "Collections",
                "Java Reflection",
                "Annotation",
                "Azure DevOps",
                "Selenium",
                "Cucumber",
                "Playwright",
                "JUnit",
                "IBM SOA products",
                "Node.js",
                "Angular"
            ],
            "with_experience": [
                "Core Java",
                "Java EE",
                "Oracle",
                "Git Workflows",
                "CI/CD",
                "Selenium",
                "Cucumber",
                "Playwright",
                "JUnit",
                "IBM SOA products",
                "Node.js",
                "Angular"
            ]
        },
        "job_type": [
            "hybrid"
        ],
        "contact_person": "Vivek",
        "email": "vkumar@vyzeinc.com",
        "jd": "From: vivek, vyzeinc vkumar@vyzeinc.com Reply to: vkumar@vyzeinc.com Job Description -Job Details Senior Java BACK-END Programmer Duration: 12+ MonthsLocation: Richmond, VA (Hybrid) Need Very senior candidate, This is an in person interview. 9+ Experience RequiredAs a Senior Java BACK-END Programmer, you will: Understanding of relational database concepts with experience in OracleExpertise in Core Java concepts, such as OOP Design, Multi-Threading, Generics, Exception Handling, Collections, Java Reflection, Annotation,Extensive practical experience in building enterprise applications using Java EE technologies The ideal candidate will have: Experience developing with Git Workflows.Experience developing CI/CD pipelines and automation.Experience using Azure DevOps.Experience with Testing Frameworks such as Selenium, Cucumber, Playwright, JUnit, and an understanding of Test Left approach to development.Experience with IBM SOA products like IIB/ACE, ODM, WAS, MQ, and ITXExperience with Front End Development using Node.js and Angular",
        "source": "Email",
        "date_posted": "2024-10-17 17:03:26-05:00",
        "unique_id": "1929d254f8ec0b99",
        "emp_type": [
            "full-time",
            "third party"
        ],
        "tag": "Java developer"
    }
]