[
    {
        "company": "Vysystems",
        "job_title": "GCP Cloud Engineer",
        "location": "USA",
        "full_location": {
            "city": "",
            "state": "",
            "country": "USA"
        },
        "job_details": {
            "employment_type": [
                "third party"
            ],
            "job_code": "",
            "experience_required": "12+ years",
            "degree_required": "Not specified",
            "visa_sponsorship": "Not specified",
            "notice_period": "Not specified",
            "duration": "Not specified",
            "rate": "Not specified"
        },
        "skills": {
            "core": [
                "GCP",
                "API calls",
                "SaaS platforms",
                "Cloud Architecture",
                "Load balancing"
            ],
            "primary": [
                "GCP Cloud Solution Architect certification",
                "GCP Associate Cloud Engineer certification",
                "GCE",
                "GKE",
                "IAM",
                "GCS",
                "PUB SUB",
                "Service accounts"
            ],
            "secondary": [
                "Front end development",
                "Debugging techniques",
                "Deployment manager",
                "Terraform"
            ],
            "all": [
                "GCP",
                "API calls",
                "SaaS platforms",
                "Cloud Architecture",
                "Load balancing",
                "GCP Cloud Solution Architect certification",
                "GCP Associate Cloud Engineer certification",
                "GCE",
                "GKE",
                "IAM",
                "GCS",
                "PUB SUB",
                "Service accounts",
                "Front end development",
                "Debugging techniques",
                "Deployment manager",
                "Terraform"
            ]
        },
        "job_type": [
            "remote"
        ],
        "contact_person": "Balamurgan",
        "email": "balamurgan@vysystems.com",
        "jd": "From: balamurgan, vysystems balamurgan@vysystems.com Reply to: balamurgan@vysystems.com Role/Responsibilities:\u2022 SMEs need experience building apps for various API calls (usage reporting, Pub/Sub, etc.)\u2022 Knowledge of Front end development and debugging techniques\u2022 General understanding of SaaS platforms / architectures and deployment types to support partner queries\u2022 Preferably have a GCP Cloud Solution Architect certification\u2022 Understanding of core cloud concepts of Architecture and Best practices\u2022 Exposure to common services such as GCE, GKE, IAM, GCS, PUB SUB and Service accounts\u2022 Understanding of APIs and usage\u2022 Concepts of Load balancing, Deployment manager and TF will be helpful\u2022 Expertise level can be lower than L2 with a potential to groom\u2022 Preferably have GCP Associate Cloud Engineer certification",
        "source": "Email",
        "date_posted": "2024-10-17 12:48:11-05:00",
        "unique_id": "1929bb89e42a9579",
        "emp_type": [
            "third party"
        ],
        "tag": "GCP Data Engineer"
    }
]