[
    {
        "company": "sibitalent.com",
        "job_title": "Senior GCP cloud consultant",
        "location": "USA",
        "full_location": {
            "city": "",
            "state": "",
            "country": "USA"
        },
        "job_details": {
            "employment_type": [
                "third party"
            ],
            "job_code": "",
            "experience_required": "10+ years",
            "degree_required": "Not specified",
            "visa_sponsorship": "No visa sponsorship",
            "notice_period": "Not specified",
            "duration": "Not specified",
            "rate": "Not specified"
        },
        "skills": {
            "core": [
                "Google Cloud Platform",
                "Data Engineering",
                "Python",
                "PySpark",
                "BigQuery"
            ],
            "primary": [
                "Data Flow",
                "Data Proc",
                "Composer",
                "Pub/Sub",
                "GCS",
                "Cloud Function",
                "SQL",
                "NoSQL databases",
                "Kafka",
                "Databricks",
                "Docker",
                "GitHub",
                "Jenkins",
                "Unix/Linux shell scripts"
            ],
            "secondary": [
                "REST APIs",
                "Microservices architecture",
                "High-volume data processing",
                "Big Data ecosystems",
                "Enterprise Integration Patterns"
            ],
            "all": [
                "Google Cloud Platform",
                "Data Engineering",
                "Python",
                "PySpark",
                "BigQuery",
                "Data Flow",
                "Data Proc",
                "Composer",
                "Pub/Sub",
                "GCS",
                "Cloud Function",
                "SQL",
                "NoSQL databases",
                "Kafka",
                "Databricks",
                "Docker",
                "GitHub",
                "Jenkins",
                "Unix/Linux shell scripts",
                "REST APIs",
                "Microservices architecture",
                "High-volume data processing",
                "Big Data ecosystems",
                "Enterprise Integration Patterns"
            ]
        },
        "job_type": [
            "remote"
        ],
        "contact_person": "Gaurav Nain",
        "email": "g.nain@sibitalent.com",
        "jd": "From: Gaurav Nain, sibitalent.com g.nain@sibitalent.com Reply to: g.nain@sibitalent.com Job Title - Senior GCP cloud consultantVisa :: No H1B/CPT/OPTLocation :: RemoteExperience :: 10+ years Note:- Need very strong candidate Job Description:- REQUIREMENTS FOR CONSIDERATION: \u2022 8+ years of experience in data engineering, with a focus on GCP technologies. \u2022 Proficiency in Google Cloud Platform leveraging Google Data Flow, Data Proc, , Composer, Pub/Sub, BigQuery, GCS, Cloud function, define workflows, scheduled and event driven jobs. \u2022 Experience in building and maintaining data pipelines using Python and PySpark (GCP Dataproc). \u2022 Strong experience with BigQuery including SQL and Stored Procedures. \u2022 Experience with NoSQL databases and building apps using NoSQL databases. \u2022 Hands-on experience with end to end data Ingestion pipeline \u2013 realtime and batch, kafka and/or other tools, Databricks will be nice to have. - ALL NICE TO HAVE NOT NUST HAVE \u2022 Familiarity with REST APIs and microservices architecture (nice to have, not must have) \u2022 Experience with high-volume data processing (GB-level). \u2022 Previous experience working in a similar role with GCP stack technologies. \u2022 In-depth understanding of Big Data ecosystems underlying architectures to re-platform legacy systems and build integration solutions on Google Cloud platform. \u2022 Have a passion for new technologies, continuous improvement and actively involved with the team to design new data solutions, monitoring and alerting policies for data solutions. \u2022 Experience in data quality, continuous integrations build and deployment processes using Docker, GitHub, Jenkins and Unix/Linux shell scripts. \u2022 Hands on experience developing complex services/solutions based on Enterprise Integration Patterns and Coding best practices. \u2022 Proactive and able to catch issues before failures. \u2022 Possess a strong work ethic; takes pride in producing a quality product and a strong team player \u2022 Work with production support and project consultants in an onshore / offshore model",
        "source": "Email",
        "date_posted": "2024-10-17 09:32:22-05:00",
        "unique_id": "1929b1e88c3dcfd6",
        "emp_type": [
            "third party"
        ],
        "tag": "GCP Data Engineer"
    }
]