[
    {
        "company": "Involgix Inc",
        "job_title": "Lead Data Engineer",
        "location": "Denver, CO, USA",
        "full_location": {
            "city": "Denver",
            "state": "CO",
            "country": "USA"
        },
        "job_details": {
            "employment_type": [
                "full-time",
                "third party"
            ],
            "experience_required": "2+ years",
            "degree_required": "Not specified",
            "visa_sponsorship": "Not specified",
            "notice_period": "Not specified",
            "duration": "Not specified",
            "rate": "Not specified"
        },
        "skills": {
            "core": [
                "relational SQL",
                "NoSQL databases",
                "Postgres",
                "Cassandra",
                "in-memory processing",
                "data formats",
                "AWS cloud services",
                "EC2",
                "MSK",
                "S3",
                "RDS",
                "SNS",
                "SQS",
                "stream-processing systems",
                "Storm",
                "Spark-Structured-Streaming",
                "Kafka consumers",
                "object-oriented scripting languages",
                "Python",
                "Java",
                "Scala",
                "R",
                "data pipeline",
                "workflow management tools",
                "AWS Data Pipeline",
                "Apache Airflow",
                "Argo",
                "big data tools",
                "Hadoop",
                "Spark",
                "software engineering tools",
                "Github",
                "VSCode",
                "CI/CD",
                "data schema life-cycles"
            ],
            "primary": [],
            "secondary": [],
            "all": [
                "relational SQL",
                "NoSQL databases",
                "Postgres",
                "Cassandra",
                "in-memory processing",
                "data formats",
                "AWS cloud services",
                "EC2",
                "MSK",
                "S3",
                "RDS",
                "SNS",
                "SQS",
                "stream-processing systems",
                "Storm",
                "Spark-Structured-Streaming",
                "Kafka consumers",
                "object-oriented scripting languages",
                "Python",
                "Java",
                "Scala",
                "R",
                "data pipeline",
                "workflow management tools",
                "AWS Data Pipeline",
                "Apache Airflow",
                "Argo",
                "big data tools",
                "Hadoop",
                "Spark",
                "software engineering tools",
                "Github",
                "VSCode",
                "CI/CD",
                "data schema life-cycles"
            ]
        },
        "job_type": [
            "onsite"
        ],
        "contact_person": "Albert",
        "email": "albert@involgix.com",
        "jd": "From: Albert, Involgix Inc albert@involgix.com Reply to: albert@involgix.com Position: Lead Data EngineerLocation: Denver, CO (Day One Onsite)Job Description:Experience of relational SQL and NoSQL databases, including Postgres and Cassandra.Strong understanding of in-memory processing and data formats (Avro, Parquet, Json etc.)Experience or knowledge of AWS cloud services: EC2, MSK, S3, RDS, SNS, SQSExperience or knowledge of stream-processing systems: i.e., Storm, Spark-Structured-Streaming, Kafka consumers.Experience or knowledge of object-oriented/object function scripting languages: i.e., Python, Java, Scala, R, SQL.Experience or knowledge of data pipeline and workflow management tools: i.e., AWS Data Pipeline, Apache Airflow, Argo.Experience or knowledge of big data tools: i.e., Hadoop, Spark, Kafka.Experience or knowledge of software engineering tools/practices: i.e., Github, VSCode, CI/CDHands-on experience in designing and maintaining data schema life-cycles.The Data Engineer role will be responsible for not only understanding data pipelines but event streaming applicationsYou are an experienced engineering with 2+ years of experienceExperience in big data structuresStrong organizational and analytical skills related to working with structured and unstructured data operationsExperience implementing and maintaining high performance / high availability data structuresOperating within cloud based eco systemsLeading projects and mentoring other team members",
        "source": "Email",
        "date_posted": "2024-10-17 09:53:42-05:00",
        "unique_id": "1929b1ae80d9083a",
        "emp_type": [
            "full-time",
            "third party"
        ],
        "tag": "AWS Data Engineer"
    }
]