[
    {
        "company": "Sibitalent",
        "job_title": "Senior GCP Cloud Consultant",
        "location": "USA",
        "full_location": {
            "city": "",
            "state": "",
            "country": "USA"
        },
        "job_details": {
            "employment_type": [
                "third party"
            ],
            "job_code": "",
            "experience_required": "10+ years",
            "degree_required": "Not specified",
            "visa_sponsorship": "No visa sponsorship",
            "notice_period": "Not specified",
            "duration": "6+ months",
            "rate": "Not specified"
        },
        "skills": {
            "core": [
                "GCP technologies",
                "Google Data Flow",
                "Data Proc",
                "Python",
                "PySpark",
                "Big Query",
                "SQL",
                "NoSQL databases",
                "Kafka",
                "Docker",
                "GitHub",
                "Jenkins",
                "Unix/Linux shell scripts"
            ],
            "primary": [
                "Data pipelines",
                "REST APIs",
                "Microservices architecture",
                "High-volume data processing",
                "Big Data ecosystems"
            ],
            "secondary": [
                "Databricks",
                "Continuous integration",
                "Data quality",
                "Enterprise Integration Patterns"
            ],
            "all": [
                "GCP technologies",
                "Google Data Flow",
                "Data Proc",
                "Python",
                "PySpark",
                "Big Query",
                "SQL",
                "NoSQL databases",
                "Kafka",
                "Docker",
                "GitHub",
                "Jenkins",
                "Unix/Linux shell scripts",
                "Data pipelines",
                "REST APIs",
                "Microservices architecture",
                "High-volume data processing",
                "Big Data ecosystems",
                "Databricks",
                "Continuous integration",
                "Data quality",
                "Enterprise Integration Patterns"
            ],
            "with_experience": [
                "GCP technologies",
                "Python",
                "PySpark",
                "Big Query",
                "SQL",
                "NoSQL databases",
                "Kafka",
                "Docker",
                "GitHub",
                "Jenkins",
                "Unix/Linux shell scripts"
            ]
        },
        "job_type": [
            "remote"
        ],
        "contact_person": "Arun Kushwaha",
        "email": "arun.kushwaha@sibitalent.com",
        "jd": "Hello, My name is Arun Kushwaha and I am a Staffing Specialist at Sibitalent. I am reaching out to you on an exciting job opportunity with one of our clients. Job Title - Senior GCP cloud consultant Visa :: No H1B/CPT/OPT Location :: Remote Duration :: 6+ months Experience :: 10+ years Note:- Need very strong candidate Please screen the screen candidate well Description:- REQUIREMENTS FOR CONSIDERATION: \u2022 8+ years of experience in data engineering, with a focus on GCP technologies. \u2022 Proficiency in Google Cloud Platform leveraging Google Data Flow, Data Proc, , Composer, Pub/Sub, Big Query, GCS, Cloud function, define workflows, scheduled and event driven jobs. \u2022 Experience in building and maintaining data pipelines using Python and PySpark (GCP Data proc). \u2022 Strong experience with Big Query including SQL and Stored Procedures. \u2022 Experience with NoSQL databases and building apps using NoSQL databases. \u2022 Hands-on experience with end to end data Ingestion pipeline \u2013 real time and batch, Kafka and/or other tools, Databricks will be nice to have. - ALL NICE TO HAVE NOT MUST HAVE \u2022 Familiarity with REST APIs and microservices architecture (nice to have, not must have) \u2022 Experience with high-volume data processing (GB-level). \u2022 Previous experience working in a similar role with GCP stack technologies. \u2022 In-depth understanding of Big Data ecosystems underlying architectures to re-platform legacy systems and build integration solutions on Google Cloud platform. \u2022 Have a passion for new technologies, continuous improvement and actively involved with the team to design new data solutions, monitoring and alerting policies for data solutions. \u2022 Experience in data quality, continuous integrations build and deployment processes using Docker, GitHub, Jenkins and Unix/Linux shell scripts. \u2022 Hands on experience developing complex services/solutions based on Enterprise Integration Patterns and Coding best practices. \u2022 Proactive and able to catch issues before failures. \u2022 Possess a strong work ethic; takes pride in producing a quality product and a strong team player \u2022 Work with production support and project consultants in an onshore / offshore model.",
        "source": "Email",
        "date_posted": "2024-10-17 11:05:13-05:00",
        "unique_id": "1929be808216a3ac",
        "emp_type": [
            "third party"
        ],
        "tag": "GCP Data Engineer"
    }
]