[
    {
        "company": "Virginia Department of Transportation (VDOT)",
        "job_title": "Technical Project Manager (Local Only)",
        "location": "Richmond, VA, USA",
        "full_location": {
            "city": "Richmond",
            "state": "VA",
            "country": "USA"
        },
        "job_details": {
            "employment_type": [
                "contract",
                "third party"
            ],
            "job_code": "VA-748480",
            "experience_required": "8 Years",
            "degree_required": "Bachelor\u2019s degree in computer science, Systems Engineering, Management Information Systems, Project Management or Finance/Business",
            "visa_sponsorship": "Not specified",
            "notice_period": "Not specified",
            "duration": "12 Months",
            "rate": "Not specified"
        },
        "skills": {
            "core": [
                "PMP Certification",
                "Experience managing large MultiStream projects valued at $10M or greater",
                "Experience in IT infrastructure delivery",
                "Experience in both Scaled Agile and Waterfall Project Management",
                "Experience managing projects with high visibility and high stakes",
                "Experience managing projects that had to coordinate with at least one external team",
                "Experience managing a project as part of a larger program and under PMO governance"
            ],
            "primary": [
                "VITA Certification",
                "Agile Scrum Master Certification",
                "SAFe Scrum Master Certification",
                "Microsoft Office Products (Word, Excel, Access, Outlook, Visio, PowerPoint, Project Server)"
            ],
            "secondary": [],
            "all": [
                "PMP Certification",
                "Experience managing large MultiStream projects valued at $10M or greater",
                "Experience in IT infrastructure delivery",
                "Experience in both Scaled Agile and Waterfall Project Management",
                "Experience managing projects with high visibility and high stakes",
                "Experience managing projects that had to coordinate with at least one external team",
                "Experience managing a project as part of a larger program and under PMO governance",
                "VITA Certification",
                "Agile Scrum Master Certification",
                "SAFe Scrum Master Certification",
                "Microsoft Office Products (Word, Excel, Access, Outlook, Visio, PowerPoint, Project Server)"
            ],
            "with_experience": [
                "PMP Certification",
                "Experience managing large MultiStream projects valued at $10M or greater",
                "Experience in IT infrastructure delivery",
                "Experience in both Scaled Agile and Waterfall Project Management",
                "Experience managing projects with high visibility and high stakes",
                "Experience managing projects that had to coordinate with at least one external team",
                "Experience managing a project as part of a larger program and under PMO governance"
            ]
        },
        "job_type": [
            "hybrid"
        ],
        "contact_person": "Harsh Tiwari",
        "email": "harsh.tiwari@technocraftsol.com",
        "jd": "From: Harsh Tiwari, Technocraft solutions harsh.tiwari@technocraftsol.com Reply to: harsh.tiwari@technocraftsol.com Job Title: Technical Project Manager (Local Only)Job ID: VA-748480 (Hybrid)Location: Richmond, VA (VDOT)Duration: 12 MonthsInterview Type: In Person Only mandatory Skills:Experience managing large MultiStream projects valued at $10M or greater each Required 8 YearsExperience in IT infrastructure delivery (Networking, physical plant, vendor management, site provisioning) Required 8 YearsPMP Certification RequiredExperience in both Scaled Agile and Waterfall Project Management Required 8 YearsVITA Certification Highly desiredAgile Scrum Master Certification DesiredSAFe\u5e90 Scrum Master Certification DesiredMicrosoft Office Products (Word, Excel, Access, Outlook, Visio, PowerPoint, Project Server) Required 8 YearsExperience managing projects with high visibility and high stakes Required 8 YearsExperience managing projects that had to coordinate with at least one external team. Required 8 YearsExperience managing a project as part of a larger program and under PMO governance. Required 8 YearsBachelor\u9225\u6a9a degree in computer science, Systems Engineering, Management Information Systems, Project Management or Finance/Business Required 4 Years PMP CERTIFICATION REQUIRED with experience in Scaled Agile environment, VITA certification is preferred.Virginia Department of Transportation (VDOT) Asset Management Division is seeking a senior technical Project Manager to manage and deliver complex IT Project(s) with multiple teams and work streams coordinated to an aggressive delivery schedule.Project Manager is responsible for the outcome of the assigned projects. The Project Manager leads the team through the Commonwealth Standard for Project Management for successful completion of the project phases:PreselectInitiationPlanningExecution and ControlCloseout.The selected candidate willServe as a hands-on technical project manager with development staff and business groupsCoordinate and communicate with Information Technology Division management and staff to coordinate work staff and resourcing.Communicate timelines and expectations to technical and business staffFacilitate multi-functional technical team collaboration.Collaborate with vendors, consultants, and contractors in the execution of projects, including contract management, and work with procurement office(s).Adhere to VDOT and VITA project management practices and governance requirements.Coordinate with VDOT and VITA project management offices.Maintain project budget, plans, tasks, schedules, risks, and status and disseminate information to team members and customers as defined in the communication plan.Ensure documentation of requirements and use cases, facilitate design workshops for assigned project.Ensure preparation of test objectives, test plans and test cases for assigned project.Provide the management of project milestones and deliverables for on-time and on-budget delivery.Define, measure, and clearly communicate progress with project metrics.Support system and application training efforts.",
        "source": "Email",
        "date_posted": "2024-10-14 09:42:02-05:00",
        "unique_id": "1928bb5de0915042",
        "emp_type": [
            "contract",
            "third party"
        ],
        "tag": "Project Manager"
    }
]