[
    {
        "company": "StellentIT",
        "job_title": "Business Analyst",
        "location": "Plano, TX, USA",
        "full_location": {
            "city": "Plano",
            "state": "TX",
            "country": "USA"
        },
        "job_details": {
            "employment_type": [
                "full-time",
                "third party"
            ],
            "experience_required": "3 years",
            "degree_required": "Bachelor's or Skill Cert",
            "visa_sponsorship": "Not specified",
            "notice_period": "Not specified",
            "duration": "Not specified",
            "rate": "Not specified"
        },
        "skills": {
            "core": [
                "Statistics",
                "Programming",
                "Business Acumen"
            ],
            "primary": [
                "Verbal and written communication skills",
                "Attention to detail",
                "Customer service",
                "Interpersonal skills",
                "Ability to work independently",
                "Knowledge of business and management principles",
                "Ability to apply accounting and mathematical principles",
                "Ability to analyze business trends"
            ],
            "secondary": [
                "Previous experience with Microsoft Word",
                "Previous experience with Microsoft Excel",
                "Enterprise Application experience"
            ],
            "all": [
                "Statistics",
                "Programming",
                "Business Acumen",
                "Verbal and written communication skills",
                "Attention to detail",
                "Customer service",
                "Interpersonal skills",
                "Ability to work independently",
                "Knowledge of business and management principles",
                "Ability to apply accounting and mathematical principles",
                "Ability to analyze business trends",
                "Previous experience with Microsoft Word",
                "Previous experience with Microsoft Excel",
                "Enterprise Application experience"
            ]
        },
        "job_type": [
            "onsite"
        ],
        "contact_person": "Yogesh Sharma",
        "email": "yogesh@stellentit.com",
        "jd": "From: Yogesh Sharma, StellentIT yogesh@stellentit.com Reply to: yogesh@stellentit.com Business AnalystPlano, Texas Plano, Texas (Onsite) Phone + SkyeJob description: Top 3 Skills:Statistics / Programming / Business AcumeThe main function of a business operations specialist is to maintain vendor relationships, acting as a business analyst for non-IT projects or filling organizational roles above an administrative level, but below a management level. Other responsibilities may include maintaining all project management processes, including project goals, deadlines, metrics and budget. The business operations specialist usually reports to a project manager or director.Job Responsibilities:Establish and maintain communication services across business units or from the project team to the organization.Maintain the storage and retrieval of all project communications data and business metrics.Review contracts, cost proposals and contract supplements.Set up project and work breakdown structures.Establish and document business processes.Track project budgets and expenditures, monitor transaction controls and costs against budgets.Predict potential budget overruns and offer solutions.Skills:Verbal and written communication skills, attention to detail, customer service and interpersonal skills.Ability to work independently and manage ones time.Knowledge of business and management principles involved in strategic planning, resource allocation, and production methods.Ability to apply accounting and mathematical principles to work as needed.Ability to analyze business trends and project future revenues and expenses.Previous experience with computer applications, such as Microsoft Word and Excel; Enterprise Application experience a plus.Education/Experience:Bachelors or Skill Cert or 3 Years Work Experience",
        "source": "Email",
        "date_posted": "2024-10-14 13:09:16-05:00",
        "unique_id": "1928cb6a9df9264a",
        "emp_type": [
            "full-time",
            "third party"
        ],
        "tag": "Business Analyst"
    }
]