[
    {
        "company": "KPG99, INC",
        "job_title": "Java Developer with Angular",
        "location": "Gilbert, AZ, USA",
        "full_location": {
            "city": "Gilbert",
            "state": "AZ",
            "country": "USA"
        },
        "job_details": {
            "employment_type": [
                "contract",
                "third party"
            ],
            "job_code": "",
            "experience_required": "5-8 years",
            "degree_required": "Not specified",
            "visa_sponsorship": "Visa sponsorship available",
            "notice_period": "Not specified",
            "duration": "6+ months",
            "rate": "Not specified"
        },
        "skills": {
            "core": [
                "Java",
                "Angular",
                "J2EE",
                "Spring",
                "Hibernate"
            ],
            "primary": [
                "Micro Services architecture"
            ],
            "secondary": [],
            "all": [
                "Java",
                "Angular",
                "J2EE",
                "Spring",
                "Hibernate",
                "Micro Services architecture"
            ]
        },
        "job_type": [
            "hybrid"
        ],
        "contact_person": "Sonali Kumari",
        "email": "spandit@kpgtech.com",
        "jd": "From: Sonali, kpg99 inc spandit@kpgtech.com Reply to: spandit@kpgtech.com Job Title: Java Developer with Angular Visa: GC/USC Duration: 6+ months Location : Hybrid, Must be local to Gilbert, AZ (close to Phoenix) Onsite Interview Requirements: 5-8 years' experience working as an Angular Developer Proficiency in Java and J2EE in Java Development Must be responsible for developing full stack application using Angular and Spring based REST-API. Solid understanding of Hibernate. Experience with Spring framework, particularly Spring REST if possible. Experience with Micro Services architecture. Thanks & Regards Sonali Kumari Technical Recruiter KPG99, INC",
        "source": "Email",
        "date_posted": "2024-10-14 13:24:11-05:00",
        "unique_id": "1928c669f5636ff9",
        "emp_type": [
            "contract",
            "third party"
        ],
        "tag": "Java developer"
    }
]