[
    {
        "company": "Resource Consulting Services Inc",
        "job_title": "LEAD Project Manager with Scrum Master",
        "location": "Salt Lake City, UT, USA",
        "full_location": {
            "city": "Salt Lake City",
            "state": "UT",
            "country": "USA"
        },
        "job_details": {
            "employment_type": [
                "contract",
                "third party"
            ],
            "job_code": "",
            "experience_required": "8+ years",
            "degree_required": "Not specified",
            "visa_sponsorship": "Not specified",
            "notice_period": "Not specified",
            "duration": "3+ months",
            "rate": "Not specified"
        },
        "skills": {
            "core": [
                "Project management",
                "Scrum master experience",
                "Rally ALM",
                "Jira",
                "PMP",
                "Certified Scrum Master"
            ],
            "primary": [
                "IT Project Management",
                "Software Development",
                "Business analysis",
                "Technical documentation",
                "User story documentation",
                "Software integrations",
                "Test-Driven Development (TDD)"
            ],
            "secondary": [
                "Architect Background",
                "Able to read SQL"
            ],
            "all": [
                "Project management",
                "Scrum master experience",
                "Rally ALM",
                "Jira",
                "PMP",
                "Certified Scrum Master",
                "IT Project Management",
                "Software Development",
                "Business analysis",
                "Technical documentation",
                "User story documentation",
                "Software integrations",
                "Test-Driven Development (TDD)",
                "Architect Background",
                "Able to read SQL"
            ]
        },
        "job_type": [
            "hybrid"
        ],
        "contact_person": "Ansar Alam",
        "email": "ansar@rconsultinginc.com",
        "jd": "From: Ansar Alam, Resource Consulting Services Inc ansar@rconsultinginc.com Reply to: ansar@rconsultinginc.com Role: LEAD Project Manager with Scrum MasterLocation: Salt Lake City, UT \u2013 Hybrid Duration: 3+ monthsVisa: USC, GC Please share local proof And Resume togetherLocal candidates only with local DL or State ID of UTAH state.Need LinkedIn IDMust be comfortable to take Glider Assessment Description:8+ years of IT Project Management with Software Development experience. Experience with business analysis and elicitation methods. Experience with creating technical and user story documentation. Previous experience with software integrations projects. Experience with Test-Driven Development (TDD) concepts. MUST have PMP &/or Certified Scrum Master certification. Must Have Skills:Project management/scrum master experience, Rally ALM &/or Jira Nice to Have Skills:Architect Background,Able to read SQL",
        "source": "Email",
        "date_posted": "2024-10-14 11:03:46-05:00",
        "unique_id": "1928c1d3c0121993",
        "emp_type": [
            "contract",
            "third party"
        ],
        "tag": "Project Manager"
    }
]