[
    {
        "company": "HCL Global",
        "job_title": "Business System Analyst",
        "location": "Pennsylvania, USA",
        "full_location": {
            "city": "",
            "state": "PA",
            "country": "USA"
        },
        "job_details": {
            "employment_type": [
                "third party"
            ],
            "experience_required": "8 years",
            "degree_required": "Not specified",
            "visa_sponsorship": "Not specified",
            "notice_period": "Not specified",
            "duration": "Not specified",
            "rate": "Not specified"
        },
        "skills": {
            "core": [
                "Data Warehouse",
                "SQL",
                "BSA",
                "Healthcare Domain Knowledge"
            ],
            "primary": [
                "Data Profiling",
                "Gap Analysis",
                "Functional Specifications",
                "Source to Target Mapping",
                "RDBMS concepts"
            ],
            "secondary": [
                "Good Communication Skills",
                "Good Analytical skills"
            ],
            "all": [
                "Data Warehouse",
                "SQL",
                "BSA",
                "Healthcare Domain Knowledge",
                "Data Profiling",
                "Gap Analysis",
                "Functional Specifications",
                "Source to Target Mapping",
                "RDBMS concepts",
                "Good Communication Skills",
                "Good Analytical skills"
            ]
        },
        "job_type": [
            "onsite"
        ],
        "contact_person": "Ashok",
        "email": "ashok@hclglobal.com",
        "jd": "From: ashok, hclglobal ashok@hclglobal.com Reply to: ashok@hclglobal.com Role - Business System AnalystOnsite to PennsylvaniaSkills Required:\u2022 At least 3 years with Data Warehouse, 5 years with SQL and 8 years on a BSA / Technical role\u2022 Solid Healthcare Domain Knowledge\u2022 BSA Experience in Data Warehouse projects (Preferably in Sourcing or Outbound Extracts)\u2022 Good Communication Skills\u2022 Good Analytical skills\u2022 Prepared Source to Target Mapping\u2022 Performed Gap Analysis / Data Profiling\u2022 Prepared Functional Specifications working with BusinessResponsibility:\u2022 Perform Data Profiling (Identify all data issues before getting the data to DW)\u2022 Prepare Functional Specification based on the interaction with Business and Technical teams\u2022 Prepare Mapping Document to be used by Dev and QA team (Detailed level required. Provide Joins, Filters and Ranking (if required) to get UNIQUE records)\u2022 Good understanding of RDBMS concepts\u2022 Present the draft version of Data Model\u2022 Perform UAT / Business Checkout using SQL Scripts",
        "source": "Email",
        "date_posted": "2024-10-14 10:00:57-05:00",
        "unique_id": "1928bac92e57d378",
        "emp_type": [
            "third party"
        ],
        "tag": "Business Analyst"
    }
]