[
    {
        "company": "TTDATA LLC",
        "job_title": ".NET Solutions Architect",
        "location": "New York, NY, USA",
        "full_location": {
            "city": "New York",
            "state": "NY",
            "country": "USA"
        },
        "job_details": {
            "employment_type": [
                "contract",
                "third party"
            ],
            "experience_required": "12+ years",
            "degree_required": "Bachelor\u2019s degree in Computer Science/Engineering/MIS, Math or related field, or equivalent experience",
            "visa_sponsorship": "No visa sponsorship",
            "notice_period": "Not specified",
            "duration": "6 Months CTH",
            "rate": "Not specified"
        },
        "skills": {
            "core": [
                ".NET 3.5/4",
                "C#",
                "ASP.NET",
                "SQL Server",
                "Entity Framework",
                "MVC"
            ],
            "primary": [
                "WCF RIA services",
                "Unit testing using nUnit",
                "UML",
                "CSS",
                "JavaScript",
                "REST web services",
                "Windows Workflow Foundation",
                "Test-driven development"
            ],
            "secondary": [
                "Integrating websites with 3rd party APIs",
                "TDD / BDD",
                "Testing frameworks",
                "Source Control (SVN, TFS)",
                "Release Management",
                "Power BI and Analytics",
                "AWS CI/CD"
            ],
            "all": [
                ".NET 3.5/4",
                "C#",
                "ASP.NET",
                "SQL Server",
                "Entity Framework",
                "MVC",
                "WCF RIA services",
                "Unit testing using nUnit",
                "UML",
                "CSS",
                "JavaScript",
                "REST web services",
                "Windows Workflow Foundation",
                "Test-driven development",
                "Integrating websites with 3rd party APIs",
                "TDD / BDD",
                "Testing frameworks",
                "Source Control (SVN, TFS)",
                "Release Management",
                "Power BI and Analytics",
                "AWS CI/CD"
            ]
        },
        "job_type": [
            "onsite"
        ],
        "contact_person": "Manikandan R",
        "email": "mani@ttdatas.com",
        "jd": "From: Manikandan, TTDATA LLC mani@ttdatas.com Reply to: mani@ttdatas.com Please find below 2 openings and share some suitable profiles to mani@ttdatas.com Title: .NET Solutions ArchitectLocation: NYC, NY(Onsite)Duration: 6 Months CTHKey Competencies: \u00a7 Hands on experience in Object Oriented analysis and design using common design patterns \u00a7 Hands on experience in designing and developing applications using .NET 3.5/4 development using C# and ASP.NET \u00a7 Competence in SQL Server \u00a7 Competence in Object Oriented design and development techniques \u00a7 Working knowledge in Entity Framework, MVC \u00a7 Working knowledge in Microsoft WCF RIA services \u00a7 Knowledge in Unit testing using nUnit or similar \u00a7 Competence in UML \u2013 Sequence diagrams, Class diagrams, etc \u00a7 Working Knowledge in requirements analysis or business analysis techniques \u00a7 Working knowledge in CSS, Java scripting \u00a7 Experience in REST web services \u00a7 Experience in Microsoft windows workflow foundations \u00a7 Experience with test-driven development \u00a7 Client-focused, working independently and simultaneously across multiple projects \u00a7 Capture and documentation of customer requirements and transformation into software design specifications / user stories \u00a7 Writes structured well-documented code to deliver scalable software solutions \u00a7 Good communication, able to write clear and concise documentation for technical and nontechnical audiences \u00a7 Team player with effective time management \u00a7 Strong problem-solving skills and attention to detail \u00a7 Ability to peer review and provide feedback on others work \u00a7 Consistently technically abreast of existing, new and emerging technologies to complement solutions \u00a7 Willing to be flexible with shift Key Activities \u00a7 Creating detailed technical design documentation & estimates \u00a7 Implementing unit tests \u00a7 Develop code as per the specifications and coding standards \u00a7 Ensure all code passes unit testing with appropriate code coverage \u00a7 Peer reviews of other team members\u2019 code \u00a7 Provide feedback on process to refine where necessary \u00a7 Liaise with Architects, Testers and any other project stakeholders both verbally and in writing \u00a7 Technical support Key Technologies Experience in the following technologies is required: \u00a7 Microsoft .NET 3.5/4 \u00a7 C# \u00a7 ASP.NET \u00a7 VB .NET \u00a7 Relational Databases like MS SQL Server \u00a7 Web frameworks like MVC \u00a7 ASP.NET Core and Web API Experience in the following technologies is desirable: \u00a7 Integrating websites with 3rd party APIs (REST/SOAP) \u00a7 TDD / BDD (e.g. Cucumber) \u00a7 Testing frameworks \u00a7 Source Control (SVN, TFS) \u00a7 Release Management \u00a7 Power BI and Analytics \u00a7 AWS continuous integration and continuous delivery (CI/CD) ================================================================================================== Role: .Net Solution ArchitectLocation: Alpharetta, GA (Onsite)Duration: 6 months Contract to Hire Job Description:: Client is looking for a Solutions Architect to join our elite Solutions Architecture team, which is at the forefront of cutting-edge technology and architecture and provides technical leadership to the entire organization. Responsibilities\u00b7 Lead pre-sales engagements as the .NET/Microsoft Azure or Java/AWS subject matter expert to solve business problems and translate business requirements into deliverable services\u00b7 Create blueprints for cloud infrastructures centered around Azure/AWS (network, server, storage, and management software topologies)\u00b7 Taking complete ownership on implementation of proposed solution by ensuring successful transition of designed solutions to the delivery team and remain engaged with the client while becoming a \u201cthought leader\u201d for the next opportunity\u00b7 Lead the design and deployment of the solution architecture, ensuring the appropriate expectations, principles, structures, tools and responsibilities are in place to deliver excellence and ensuring risks are identified, managed and mitigated\u00b7 Ensure that a quality solution is delivered in a timely manner, within budget, and to our clients\u2019 satisfaction\u00b7 Communicate value proposition to varying technical and non-technical clients, including executive ''C'' level management, VP and Director levels, and end users\u00b7 Establish strong and lasting relationships with key stakeholders and decision makers in client organizationsBasic Qualifications\u00b7 12+ years enterprise IT application experience that includes 2+ years of hands-on software development, solutions architecture, DevOps engineering, or systems architecture\u00b7 2+ years design/implementation/consulting experience with distributed applications\u00b7 Bachelor\u2019s degree in Computer Science/Engineering/MIS, Math or related field, or equivalent experience Preferred Qualifications\u00b7 Strong verbal and written communication skills\u00b7 Experience developing high quality enterprise-scale software products, with deep understanding of microservices and event driven architectures\u00b7 Knowledge of cloud services, cloud native design and/or cloud implementation experience\u00b7 High-level knowledge of automation platforms and tools (Terraform, Infrastructure as Code, Azure Resource Manager, Bicep, Ansible, Chef, etc.)\u00b7 Experience with Azure or AWS foundational services: (Virtual Networks, ExpressRoute, Virtual Machines, Storage, Load Balancer, Azure Active Directory, App Service, Azure Database, etc.)\u00b7 Expertise in .NET Programming (C#), .NET Core, ASP.NET Core MVC, WebAPI, Microsoft Identity Platform\u00b7 Knowledge of CI/CD including common technologies like DevOps, Git and Jenkins\u00b7 Expertise in designing and developing REST API and API economy concepts\u00b7 Experience with SQL and/or NoSQL databases\u00b7 Experience with container technology such as Kubernetes and Docker\u00b7 High-level knowledge of JavaScript frameworks like Angular and React\u00b7 Azure or AWS Solution Architect certification E-Commerce Domain Expertise \u00b7 Experience with eCommerce Platforms: Extensive experience with popular eCommerce platforms such as Magento, Shopify, SAP Hybris, Adobe Commerce, and other leading solutions.\u00b7 Payment Processing Integration: Expertise in integrating payment gateways and processing systems, ensuring secure and seamless transactions across different payment methods.\u00b7 ERP and Pricing Integrations: Proficient in integrating eCommerce platforms with Enterprise Resource Planning (ERP) systems and dynamic pricing engines to optimize inventory management, pricing strategies, and order fulfillment.\u00b7 Digital Marketing and SEO: Strong understanding of digital marketing strategies, Search Engine Optimization (SEO) best practices, and experience in capturing and analyzing user metrics using tools like Google Analytics.\u00b7 Performance Testing and Optimization: Skilled in conducting performance testing and optimizing eCommerce platforms to ensure they can handle high traffic loads and deliver fast, reliable user experiences.Recommendation Systems: Knowledgeable in designing and implementing recommendation systems, including upselling and cross-selling features, to enhance customer engagement and increase sales.",
        "source": "Email",
        "date_posted": "2024-10-14 15:23:41-05:00",
        "unique_id": "1928cd40610293a7",
        "emp_type": [
            "contract",
            "third party"
        ],
        "tag": ".net developer"
    }
]