[
    {
        "company": "Softcom Systems",
        "job_title": ".NET Senior Developer Lead",
        "location": "Newark, NJ, USA",
        "full_location": {
            "city": "Newark",
            "state": "NJ",
            "country": "USA"
        },
        "job_details": {
            "employment_type": [
                "contract",
                "third party"
            ],
            "experience_required": "12+ years",
            "degree_required": "BS degree in Computer Science, a related technical field, or equivalent practical experience required",
            "visa_sponsorship": "Not specified",
            "notice_period": "Not specified",
            "duration": "6 months+ (could go longer)",
            "rate": "Not specified"
        },
        "skills": {
            "core": [
                ".NET",
                "C#",
                "SQL Server",
                "API"
            ],
            "primary": [
                "Object-oriented programming",
                "Oracle",
                "ETL",
                "PL/SQL",
                "Stored procedures",
                "Microsoft Fabric",
                "Agile methodologies",
                "Test Driven Development",
                "Entity Framework",
                "MVC",
                "CICD tools",
                "API management software"
            ],
            "secondary": [
                "Strong analytical skills",
                "Excellent verbal and written communication skills",
                "Ability to develop effective internal/external working relationships",
                "Application Lifecycle Management techniques",
                "Experience with investments or securities",
                "TFS/Bit bucket source control tool",
                "Autosys job management experience",
                "JIRA experience for Agile Projects"
            ],
            "all": [
                ".NET",
                "C#",
                "SQL Server",
                "API",
                "Object-oriented programming",
                "Oracle",
                "ETL",
                "PL/SQL",
                "Stored procedures",
                "Microsoft Fabric",
                "Agile methodologies",
                "Test Driven Development",
                "Entity Framework",
                "MVC",
                "CICD tools",
                "API management software",
                "Strong analytical skills",
                "Excellent verbal and written communication skills",
                "Ability to develop effective internal/external working relationships",
                "Application Lifecycle Management techniques",
                "Experience with investments or securities",
                "TFS/Bit bucket source control tool",
                "Autosys job management experience",
                "JIRA experience for Agile Projects"
            ]
        },
        "job_type": [
            "hybrid"
        ],
        "contact_person": "Vinod",
        "email": "vinod@softcomsystems.com",
        "jd": "From: Vinod, Softcom Systems vinod@softcomsystems.com Reply to: vinod@softcomsystems.com .NET Senior Developer/LeadNewark, NJHybrid (3 days onsite)6 months+ (could go longer)Exp 12+ years required Interview Process:Initial Phone/Video interviews followed by an in person interview. SO LOCAL CANDIDATES ONLY. JD: NET and C# - API/SQL Server DB - Senior Developer , Newark, NJ - HybridQualificationsBS degree in Computer Science, a related technical field, or equivalent practical experience required12+ years of current experience in Software DevelopmentExperience with one or more object-oriented programming language, e.g. C#, .NET Core, SQL, etc.Knowledge of database systems including Oracle, SQL Server & also ETL.Strong PL\\SQL or stored procedure experienceStrong analytical skills, including a thorough understanding of how to interpret business needs and translate them into application requirementsExcellent verbal and written communication skills to effectively and confidently communicate with users, team members, and managementAbility to develop effective internal/external working relationships with both business units and vendors Familiarity with Microsoft Fabric Experience with the following would be a plus:Microsoft Fabric experience is plusApplication Lifecycle Management techniques and conceptsExperience with investments or securitiesAbility to work with Agile methodologies in a fast paced environmentExperience with one or more object-oriented programming language C#Test Driven Development, Entity Framework, MVCTFS/Bit bucket source control toolAutosys job management experienceJIRA experience for Agile ProjectsContinuous Integration Continuous Delivery (CICD) tools such as Jenkins and automated processesAPI management software like Apigee or equivalent",
        "source": "Email",
        "date_posted": "2024-10-14 06:27:57-05:00",
        "unique_id": "1928ae993544b4cb",
        "emp_type": [
            "contract",
            "third party"
        ],
        "tag": ".net developer"
    }
]