[
    {
        "company": "Source Infotech Inc",
        "job_title": "Full-stack .NET developer",
        "location": "Orlando, FL, USA",
        "full_location": {
            "city": "Orlando",
            "state": "FL",
            "country": "USA"
        },
        "job_details": {
            "employment_type": [
                "contract",
                "third party"
            ],
            "job_code": "",
            "experience_required": "4+ years",
            "degree_required": "Not specified",
            "visa_sponsorship": "No visa sponsorship",
            "notice_period": "Not specified",
            "duration": "4+ months",
            "rate": "Not specified"
        },
        "skills": {
            "core": [
                ".NET Core",
                ".NET Framework",
                "ASP.NET",
                "C#",
                "Rest API",
                "Web API"
            ],
            "primary": [
                "Node JS",
                "HTML 5",
                "CSS",
                "jQuery",
                "Public Cloud architectures",
                "Agile methodologies",
                "CI/CD pipelines"
            ],
            "secondary": [
                "AWS",
                "Lambda\u2019s",
                "RDS/MySQL",
                "API Gateways",
                "Cognito",
                "Aurora",
                "S3",
                "Micro services",
                "MySQL (Aurora)"
            ],
            "all": [
                ".NET Core",
                ".NET Framework",
                "ASP.NET",
                "C#",
                "Rest API",
                "Web API",
                "Node JS",
                "HTML 5",
                "CSS",
                "jQuery",
                "Public Cloud architectures",
                "Agile methodologies",
                "CI/CD pipelines",
                "AWS",
                "Lambda\u2019s",
                "RDS/MySQL",
                "API Gateways",
                "Cognito",
                "Aurora",
                "S3",
                "Micro services",
                "MySQL (Aurora)"
            ],
            "with_experience": [
                ".NET Core",
                ".NET Framework",
                "ASP.NET",
                "C#",
                "Rest API",
                "Web API"
            ]
        },
        "job_type": [
            "onsite"
        ],
        "contact_person": "Bhavya Chaturvedi",
        "email": "bhavya.c@sourceinfotech.com",
        "jd": "From: Bhavya, Source infotec inc bhavya.c@sourceinfotech.com Reply to: bhavya.c@sourceinfotech.com Position: Full-stack .NET developerLocation: Orlando, FL (Locals only)Duration: 4+ months CTH Visa: No H1B/CPT/OPTMOI: In person C2C Required Skills: 4+ years\u2019 experience as a Software Developer2 + years\u2019 experience with .NET Core, .NET Framework, ASP.NET and C#4+ years\u2019 experience with Rest API and Web API servicesTechnical skills and familiarity with Node JS, HTML 5, CSS, jQueryDeep understanding of Public Cloud architectures and Agile methodologiesUnderstanding of CI/CD pipelines Desired Skills: AWS skills including Lambda\u2019s, RDS/MySQL, API Gateways, Cognito, Aurora and S3Micro services Experience MySQL (Aurora) Experience THANKS & REGARDS Bhavya Chaturvedi Source Infotech IncP.O Box 577, EDISON, NJ 08818-0577EMAIL: bhavya.c@sourceinfotech.comPhone: 6097335170 | | Hangout:bhavyachaturvedi389",
        "source": "Email",
        "date_posted": "2024-10-14 14:48:17-05:00",
        "unique_id": "1928cb39f23b5537",
        "emp_type": [
            "contract",
            "third party"
        ],
        "tag": ".net developer"
    }
]