[
    {
        "company": "Tek Inspirations LLC",
        "job_title": "Sr. Business Analyst",
        "location": "Minnesota, USA",
        "full_location": {
            "city": "Minnesota",
            "state": "",
            "country": "USA"
        },
        "job_details": {
            "employment_type": [
                "contract",
                "third party"
            ],
            "job_code": "",
            "experience_required": "7+ years",
            "degree_required": "Not specified",
            "visa_sponsorship": "Not specified",
            "notice_period": "Not specified",
            "duration": "6 months",
            "rate": "Not specified"
        },
        "skills": {
            "core": [
                "Business Systems Analyst",
                "Change Management",
                "Risk Management",
                "Stakeholder Engagement",
                "Power BI"
            ],
            "primary": [
                "Communication",
                "Organizational Skills",
                "Budget Reporting",
                "Data Visualization",
                "User Stories"
            ],
            "secondary": [
                "PowerPoint",
                "LeanIX",
                "Apptio",
                "IT Methodologies",
                "Safety Policies"
            ],
            "all": [
                "Business Systems Analyst",
                "Change Management",
                "Risk Management",
                "Stakeholder Engagement",
                "Power BI",
                "Communication",
                "Organizational Skills",
                "Budget Reporting",
                "Data Visualization",
                "User Stories",
                "PowerPoint",
                "LeanIX",
                "Apptio",
                "IT Methodologies",
                "Safety Policies"
            ]
        },
        "job_type": [
            "hybrid"
        ],
        "contact_person": "Anju Pathak",
        "email": "anju.pathak@tekinspirations.com",
        "jd": "From: Anju Pathak, Tek Inspirations LLC anju.pathak@tekinspirations.com Reply to: anju.pathak@tekinspirations.com PLEASE SEND ME YOUR DETAILS WHO ARE LOCAL TO MINNESOTAJob Description -Sr. Business AnalystHybridLocation: Minnesota only, They must be in Minnesota, not relocation candidatesDuration: 6 monthsSKYPESummaryWe are seeking a Sr. Business Systems Analyst/IT Business Partner Administrator to join our IT Department and support our IT Business Partner (BRM) Team. If you excel in communication, are detail-oriented, and can thrive both in team settings and independently, this role is for you!ResponsibilitiesCapture and coordinate cross-functional and end-to-end business requirements, particularly in the Mergers & Acquisitions space.Design complex cross-functional data integration plans, identifying and addressing intricate systems and processes.Collaborate with IT teams and project managers to design cutover scenarios, evaluating and communicating the pros and cons to the business.Define and manage system scope and objectives through front-end analysis and research, leveraging a strong understanding of business systems and IT solutions.Analyze business strategies and user needs, document specifications, and translate business objectives into system requirements.Champion IT processes and standardization including the facilitation of work intake and business capability alignment.Support the IT Business Partner organization in their goal to standardize and simplify business and function roadmaps, coordination, reporting, and data visualization; collaborating with multiple teams and their needs.Support the annual budget cycle, collecting and documenting detailed budget needs.Adhere to IT methodologies and best practices.Collaborate effectively with other business analysts, technical staff, and Management.Maintain a strong safety culture by following all safety policies, procedures, and regulations.Must Have Requirements-7+ years of experience as Business Systems Analyst including:Defining and managing system scope and objectives for projects;Gathering and preparing detailed user stories;Creating and modifying procedures to address complex issues.Experience with management reports and roadmaps using tools including Power BI, PowerPoint, LeanIX, or similar.Experience in budget reporting and management, ideally using Apptio or a similar tool.Proficiency in change management, risk management, and stakeholder engagement.Strong communication and organizational skills.Ability to create structure in ambiguous environments.",
        "source": "Email",
        "date_posted": "2024-10-14 13:41:06-05:00",
        "unique_id": "1928c761de06b5da",
        "emp_type": [
            "contract",
            "third party"
        ],
        "tag": "Business Analyst"
    }
]