[
    {
        "company": "Vyze",
        "job_title": "LEAD PM w/ Scrum Master",
        "location": "Salt Lake City, UT, USA",
        "full_location": {
            "city": "Salt Lake City",
            "state": "UT",
            "country": "USA"
        },
        "job_details": {
            "employment_type": [
                "contract",
                "third party"
            ],
            "job_code": "",
            "experience_required": "8+ years",
            "degree_required": "Not specified",
            "visa_sponsorship": "Must have existing work authorization",
            "notice_period": "Not specified",
            "duration": "4 Mos (likely XT)",
            "rate": "Not specified"
        },
        "skills": {
            "core": [
                "Project management",
                "Scrum Master",
                "Rally ALM",
                "Jira"
            ],
            "primary": [
                "IT Project Management",
                "Software Development",
                "Business analysis",
                "Technical documentation",
                "Software integrations",
                "Test-Driven Development (TDD)"
            ],
            "secondary": [
                "Architect Background",
                "Able to read SQL"
            ],
            "all": [
                "Project management",
                "Scrum Master",
                "Rally ALM",
                "Jira",
                "IT Project Management",
                "Software Development",
                "Business analysis",
                "Technical documentation",
                "Software integrations",
                "Test-Driven Development (TDD)",
                "Architect Background",
                "Able to read SQL"
            ]
        },
        "job_type": [
            "hybrid"
        ],
        "contact_person": "Abhiram Rout",
        "email": "arout@vyzeinc.com",
        "jd": "From: Abhiram Rout, Vyze arout@vyzeinc.com Reply to: arout@vyzeinc.com Job title: LEAD PM w/ Scrum MasterLocation: HYBRID/ Salt Lake City, UTDuration: 4 Mos (likely XT)MOI: SkypeVisa: USC or GC (client would highly prefer local candidates in SLC, UT) LinkedIn required Job Summary: 8+ years of IT Project Management with Software Development experience. Experience with business analysis and elicitation methods. Experience with creating technical and user story documentation. Previous experience with software integrations projects. Experience with Test-Driven Development (TDD) concepts. MUST have PMP &/or Certified Scrum Master certification. Must Have Skills:Project management/scrum master experience, Rally ALM &/or Jira Skills:Architect Background,Able to read SQL",
        "source": "Email",
        "date_posted": "2024-10-14 10:16:10-05:00",
        "unique_id": "1928bba81082de08",
        "emp_type": [
            "contract",
            "third party"
        ],
        "tag": "Project Manager"
    }
]