[
    {
        "company": "Blue Ocean Ventures",
        "job_title": "GCP Engineer with .Net OR Java",
        "location": "Denver, CO, USA",
        "full_location": {
            "city": "Denver",
            "state": "CO",
            "country": "USA"
        },
        "job_details": {
            "employment_type": [
                "onsite",
                "third party"
            ],
            "experience_required": "8+ Years",
            "degree_required": "Engineering Degree \u2013 BE/ME/BTech/MTech/BSc/MSc",
            "visa_sponsorship": "Not specified",
            "notice_period": "Not specified",
            "duration": "Not specified",
            "rate": "Not specified"
        },
        "skills": {
            "core": [
                "Google BigQuery",
                "Google Cloud Platform",
                "Advanced SQL",
                "Scripting language (Python/R)",
                "Terraform",
                "Kubernetes"
            ],
            "primary": [
                "ETL framework design and development",
                "BI tools (Tableau, Power BI)",
                "Agile/Scrum experience",
                "Cloud solution environment management",
                "Cloud deployments monitoring"
            ],
            "secondary": [
                "Clickstream database",
                "Google Analytics",
                "Adobe Analytics",
                "API Wrapper",
                "Model setup with GCP",
                "Automated unit testing",
                "Security of cloud resources",
                "Process improvement",
                "Emerging technologies understanding"
            ],
            "all": [
                "Google BigQuery",
                "Google Cloud Platform",
                "Advanced SQL",
                "Scripting language (Python/R)",
                "Terraform",
                "Kubernetes",
                "ETL framework design and development",
                "BI tools (Tableau, Power BI)",
                "Agile/Scrum experience",
                "Cloud solution environment management",
                "Cloud deployments monitoring",
                "Clickstream database",
                "Google Analytics",
                "Adobe Analytics",
                "API Wrapper",
                "Model setup with GCP",
                "Automated unit testing",
                "Security of cloud resources",
                "Process improvement",
                "Emerging technologies understanding"
            ]
        },
        "job_type": [
            "onsite"
        ],
        "contact_person": "Abhilash SH",
        "email": "abhilash.sh@blue-oceanventures.com",
        "jd": "From: Abhilash s h, Blue ocean ventures abhilash.sh@blue-oceanventures.com Reply to: abhilash.sh@blue-oceanventures.com Role: GCP Engineer with .Net OR JavaLocation: Denver, COAs an GCP Engineer with .Net/Java, you will be a part of an Agile team to build healthcare applications and implement new features while adhering to the best coding development standards. Responsibilities: -Candidate has mandatory experience on GCP, and GCP Services is good to have. Google BigQuery Experience and Google Cloud Platform. Design and develop the ETL framework using BigQuery.Expertise in Big Query concepts like Nested Queries, Clustering, Partitioning, etc. Working Experience of Clickstream database, Google Analytics/ Adobe Analytics. Should be able to automate the data load from Big Query using APIs or scripting language. Good experience in Advanced SQL concepts. Expertise in Google Big Query & Google Cloud Platform. Experience in Advanced SQL, Scripting language (Python/R).Hands-on experience in BI tools (Tableau, Power BI) Excellent analytical thinking, analysis, and problem-solving skills. Knowledge of other GCP services is a plus Candidate should be familiar with GCP services, API Wrapper, Model setup with GCP Hands on experience with Terraform and Kubernetes is good to have. Strong Object- Oriented Programming Skills - Proficiency writing automated unit testing code - Good Should have experience of working in Agile /Scrum team Should have experience in demonstrating the user stories to client during Sprint Review Design, implement, manage and maintain cloud-based systems Support the design and migration of existing applications to GCP Plan, provision, deploy and maintain a Cloud solution environment Proactively monitor security, performance, and costs while responding to alerts, working with development and service delivery teams to resolve Support Cloud deployments, monitoring the health of environments, providing maximum system performance to users and sustaining system uptime standards. Ensures the security of cloud resources by implementing access controls, encryption, and monitoring Collaborates with cross-functional teams to support application and infrastructure requirements Troubleshoot incidents, identify root causes, fix, and document problems, and implement preventive measures Apply an understanding of emerging technologies, industry best practices, and system requirements to recommend and document specific elements of architecture including compute and storage components, networking and related appliances, and third-party software and programs Support opportunities for process improvement, re-imagining, and automation in cloud, and employ practices intended to improve customer satisfaction and reduce costs Prioritize and complete assigned duties expeditiously and within approved windows Deploys, implements and configures cloud environments in accordance with best practices and security guidelines by applying knowledge of programming languages. Stay abreast of latest GCP offerings and make recommendations to leadership. Understanding of and experience with the six pillars of a well-architected framework Experience with or conceptual understanding of the analysis, deployment, integration, optimization, troubleshooting, and consultation of the following disciplines or technologies is required: GCP, GKE, Cloud Storage, Cloud SQL, Cloud DNS, Load Balancing, Cloud Functions, Spanner, BQ, PubSub, Cloud Run, Anthos, Compute Engine, GKE, GCP storage options Ability to inspire and instill confidence in peers and colleagues by fulfilling service demand with a high degree of quality and intentionality Ability to convey information and ideas clearly, concisely, and persuasively using terminology and jargon appropriate for the intended audience. Experience: -8+ Years Location: -Denver, CO Educational Qualifications: -Engineering Degree \u2013 BE/ME/BTech/MTech/BSc/MSc.Technical certification in multiple technologies is desirable. Skills: - Mandatory skillsGoogle BigQuery Experience and Google Cloud Platform Regards, Abhilash SHhttps://www.linkedin.com/in/abhilash-s-h-ab07a5231/Blue Ocean Ventures5555 Glenridge Connector Suite 200 Atlanta, GA 30342Email:Abhilash.sh@blue-oceanventures.comWill To Serve Will To Win Will To Lead",
        "source": "Email",
        "date_posted": "2024-10-14 11:57:16-05:00",
        "unique_id": "1928c170ffde084f",
        "emp_type": [
            "onsite",
            "third party"
        ],
        "tag": "GCP Data Engineer"
    }
]