[
    {
        "company": "Capital Group",
        "job_title": ".NET Application Developer",
        "location": "San Antonio, TX, USA",
        "full_location": {
            "city": "San Antonio",
            "state": "TX",
            "country": "USA"
        },
        "job_details": {
            "employment_type": [
                "full-time",
                "third party"
            ],
            "job_code": "",
            "experience_required": "13+ years",
            "degree_required": "Not specified",
            "visa_sponsorship": "Not specified",
            "notice_period": "Not specified",
            "duration": "12+ months",
            "rate": "$62 - $65 (Max)"
        },
        "skills": {
            "core": [
                "C#",
                ".NET Framework 4.8",
                ".NET 6 (Standard)",
                "Windows Presentation Foundation (WPF)",
                "Production Support"
            ],
            "primary": [
                "WPF experience",
                "Prior Lead experience",
                "Strong with .NET full stack experience",
                "3 years US experience"
            ],
            "secondary": [
                "ServiceNow",
                "Jira",
                "Bitbucket",
                "Visual Studio",
                "qTest",
                "Jenkins",
                "Confluence",
                "Bamboo"
            ],
            "all": [
                "C#",
                ".NET Framework 4.8",
                ".NET 6 (Standard)",
                "Windows Presentation Foundation (WPF)",
                "Production Support",
                "WPF experience",
                "Prior Lead experience",
                "Strong with .NET full stack experience",
                "3 years US experience",
                "ServiceNow",
                "Jira",
                "Bitbucket",
                "Visual Studio",
                "qTest",
                "Jenkins",
                "Confluence",
                "Bamboo"
            ]
        },
        "job_type": [
            "onsite"
        ],
        "contact_person": "Ben Clark",
        "email": "ben@techtalentconnect.com",
        "jd": "From: Ben Clark, Tech Talent Connect LLC ben@techtalentconnect.com Reply to: ben@techtalentconnect.com Please don't submit profiles below 13 years. client is looking for senior profiles with prior lead experience. Job Title: .NET Application Developer Location: San Antonio, TX (Onsite)Duration: 12+ monthsClient: Capital GroupExp: 13+ Rate: $62 - $65 (Max)Need profiles matching with the below criteria:(Mandatory*)1. WPF experience2. Prior Lead experience3. Strong with.NET full stack experience4. at least 3 years US experience Qualifications:* Minimum 13 years of experience in business systems analysis, application development, and testing.* Experience developing web-based applications in C#, HTML, JavaScript, ASP.NET MVC, and ASP.NET Core.* Expert full-stack development skills with n-tier applications utilizing the following technologies: C#,.Net, MVVM, Microsoft WPF, IIS, SQL Server, LINQ, and Web API.* Design, Develop, and Maintain High-Quality Software Applications Using C#,.NET Core, and Azure Services.* Strong experience leveraging design patterns, including MVVM.* Strong experience in Production Support L3 role, Handling incidents, Tasks, and Problem management.* Experience in using Monitoring and log-capturing tools like Dynatrace, Zabbix, Splunk, etc.Responsibilities:* Leads and personally contributes to solution delivery through SDLC activities (analysis, development, testing, deployment, support, etc.) for one or more medium- to high-complexity business capabilities and/or products.* Demonstrates thought leadership and deep understanding through analysis and improvement recommendations to multifaceted business processes, application features, and data change to resolve defects or enhance business capabilities.Required Skills:C#,.NET Framework 4.8,.NET 6 (Standard), Windows Presentation Foundation (WPF), Production Support. Tools & Technology:ServiceNow, Jira, Bitbucket, Visual Studio, qTest, Jenkins, Confluence, Bamboo.",
        "source": "Email",
        "date_posted": "2024-10-14 09:02:41-05:00",
        "unique_id": "1928b94b13c5d994",
        "emp_type": [
            "full-time",
            "third party"
        ],
        "tag": ".net developer"
    }
]