[
    {
        "company": "TEK Inspirations LLC",
        "job_title": "Google Cloud Platform Support Lead",
        "location": "Madison, WI, USA",
        "full_location": {
            "city": "Madison",
            "state": "WI",
            "country": "USA"
        },
        "job_details": {
            "employment_type": [
                "full-time",
                "third party"
            ],
            "job_code": "",
            "experience_required": "10+ years",
            "degree_required": "Bachelor's degree or foreign equivalent",
            "visa_sponsorship": "Not specified",
            "notice_period": "Not specified",
            "duration": "12+ Months",
            "rate": "Not specified"
        },
        "skills": {
            "core": [
                "Google Cloud Platform",
                "Python",
                "SQL",
                "Terraform",
                "CI/CD"
            ],
            "primary": [
                "BigQuery",
                "CloudRun",
                "Cloud Storage",
                "Pub/Sub",
                "Cloud Composer",
                "Containers",
                "Workflows",
                "IAM",
                "Debugging",
                "Performance tuning"
            ],
            "secondary": [
                "Data integration",
                "Data quality",
                "Data architecture",
                "Relational Modeling",
                "Dimensional Modeling",
                "Modeling of Unstructured Data",
                "Agile software development frameworks",
                "Effective communication skills"
            ],
            "all": [
                "Google Cloud Platform",
                "Python",
                "SQL",
                "Terraform",
                "CI/CD",
                "BigQuery",
                "CloudRun",
                "Cloud Storage",
                "Pub/Sub",
                "Cloud Composer",
                "Containers",
                "Workflows",
                "IAM",
                "Debugging",
                "Performance tuning",
                "Data integration",
                "Data quality",
                "Data architecture",
                "Relational Modeling",
                "Dimensional Modeling",
                "Modeling of Unstructured Data",
                "Agile software development frameworks",
                "Effective communication skills"
            ]
        },
        "job_type": [
            "hybrid"
        ],
        "contact_person": "Satyajit Nayak",
        "email": "satyajit@tekinspirations.com",
        "jd": "Job Description -Role: Google Cloud Platform Support LeadLocation: Madison, WI (Hybrid)Duration: 12+ MonthsDetailed Job Description:Candidate must be located within commuting distance of Madison, Wisconsin or be willing to relocate to the area.Hands on Google Cloud Platform experience with very good communication skill.Bachelor's degree or foreign equivalent required from an accredited institution.At least 10+ years of experience with Information Technology5+ years of experience in Google Cloud Platform (Google Cloud Platform) services, such as BigQuery, CloudRun, Cloud Storage, Pub/Sub, Cloud Composer, Containers, Workflows, IAM, Etc. Understanding of cloud-native solutions and architecture is criticalStrong knowledge and hands-on experience in as Python, SQL, Terraform, CI/CD, Git flows, Attunity, AutoSys, Airflow Dag creation, execution, and monitoringStrong knowledge on Production support, Debugging and performance tuningEffective communication skills for collaborating with global teams, including clear documentation practices and the ability to convey technical details to non-technical stakeholders.Preferred Qualifications:Experience in Insurance domain preferableGood understanding of data integration, data quality and data architecture Experience in Relational Modeling, Dimensional Modeling and Modeling of Unstructured DataGood understanding of Agile software development frameworksAbility to work in teams in a diverse, multi-stakeholder environment comprising of Business and Technology teams.",
        "source": "Email",
        "date_posted": "2024-10-14 16:41:53-05:00",
        "unique_id": "1928d1b9e76eb183",
        "emp_type": [
            "full-time",
            "third party"
        ],
        "tag": "GCP Data Engineer"
    }
]