[
    {
        "company": "Stacknexus",
        "job_title": "Senior .NET Developer",
        "location": "Indianapolis, IN, USA",
        "full_location": {
            "city": "Indianapolis",
            "state": "IN",
            "country": "USA"
        },
        "job_details": {
            "employment_type": [
                "full-time",
                "third party"
            ],
            "job_code": "",
            "experience_required": "10 years",
            "degree_required": "Bachelor\u2019s Degree in Computer Science or related fields with IT experience",
            "visa_sponsorship": "Not specified",
            "notice_period": "Not specified",
            "duration": "Not specified",
            "rate": "Not specified"
        },
        "skills": {
            "core": [
                "ASP.NET",
                "C#",
                "MVC",
                "Web Services",
                "SDLC"
            ],
            "primary": [
                "Strong verbal and written communication skills",
                "Ability to solve complex programming issues"
            ],
            "secondary": [
                "Work experience in analysis and addressing security-related issues for applications built in multiple languages",
                "Experience in Healthcare Industry"
            ],
            "all": [
                "ASP.NET",
                "C#",
                "MVC",
                "Web Services",
                "SDLC",
                "Strong verbal and written communication skills",
                "Ability to solve complex programming issues",
                "Work experience in analysis and addressing security-related issues for applications built in multiple languages",
                "Experience in Healthcare Industry"
            ]
        },
        "job_type": [
            "hybrid"
        ],
        "contact_person": "Roopendra Reddy",
        "email": "roopendra.padala@stacknexus.io",
        "jd": "From: Roopendra Reddy, Stacknexus roopendra.padala@stacknexus.io Reply to: roopendra.padala@stacknexus.io Job Title: Senior .NET DeveloperClient location - Local candidates only (2 N. Meridian St. Indianapolis IN 46204)Interview Type - Webcam onlyWork Arrangement - HybridLocal candidates only ( Indianapolis IN ) Skills Matrix -ASP.NET Required 10 YearsC#, MVCRequired 5 YearsWork experience in analysis and addressing security-related issues for applicationsbuilt in multiple languagesRequired 5 YearsWeb ServicesRequired 5 YearsExpert understanding of SDLCRequiredStrong verbal and written communication skillsRequiredAbility to solve complex programming issuesRequiredBachelor\u2019s Degree in Computer Science or related fields with IT experienceRequired Experience in Healthcare Industry",
        "source": "Email",
        "date_posted": "2024-10-14 11:32:21-05:00",
        "unique_id": "1928c003e9986292",
        "emp_type": [
            "full-time",
            "third party"
        ],
        "tag": ".net developer"
    }
]