[
    {
        "company": "Shrive Technologies LLC",
        "job_title": "Database Administrator",
        "location": "Austin, TX, USA",
        "full_location": {
            "city": "Austin",
            "state": "TX",
            "country": "USA"
        },
        "job_details": {
            "employment_type": [
                "third party"
            ],
            "job_code": "",
            "experience_required": "Not specified",
            "degree_required": "Not specified",
            "visa_sponsorship": "Not specified",
            "notice_period": "Not specified",
            "duration": "Not specified",
            "rate": "Not specified"
        },
        "skills": {
            "core": [
                "Database Management",
                "Performance Tuning",
                "Data Modeling",
                "Database Security",
                "Data Integrity"
            ],
            "primary": [
                "Database Programming",
                "Systems Analysis",
                "Database Software Installation",
                "Technical Assistance",
                "Accessibility Standards"
            ],
            "secondary": [
                "Project Control",
                "Cost Estimating",
                "Data Processing Flowcharting",
                "Current Database Technologies",
                "Assistive Technologies"
            ],
            "all": [
                "Database Management",
                "Performance Tuning",
                "Data Modeling",
                "Database Security",
                "Data Integrity",
                "Database Programming",
                "Systems Analysis",
                "Database Software Installation",
                "Technical Assistance",
                "Accessibility Standards",
                "Project Control",
                "Cost Estimating",
                "Data Processing Flowcharting",
                "Current Database Technologies",
                "Assistive Technologies"
            ]
        },
        "job_type": [],
        "contact_person": "Thanusha",
        "email": "thanusha@shrivetechnologies.com",
        "jd": "From: Thanusha, Shrive Technologies thanusha@shrivetechnologies.com Reply to: thanusha@shrivetechnologies.com Location : Austin, TX Position : Database AdministratorJob Description :Enters codes to create production data base. Selects and enters codes of utility program to monitor database performance, such as distribution of records and amount of available memory. Directs programmers and analysts to make changes to data base management system. Reviews and corrects programs. Answers user questions. Confers with coworkers to determine impact of data base changes on other systems and staff cost for making changes to data base. Modifies data base programs to increase processing performance, referred to as performance tuning. Workers typically specialize in one or more types of data base management systems. Providing assistance in the planning, development, maintenance, and monitoring of integrated database systems, and ensuring that the conceptual and design phases of new applications are consistent with the structural parameters within the database environment. Evaluates users' requests for new data elements and systems, incorporates them into the existing shared data environment, and provides technical assistance. Coordinates the use of data to ensure data integrity and control redundancy, loads databases, and reorganizes as needed. Performs data modeling and prototyping. Performs logical and physical data modeling, designs relational database models, and creates physical data models from logical data models. Performs security recovery procedures. Determines and implements database search strategies and storage requirements. Maintains data dictionary ensuring uniformity of definitions and sets standards for use of data dictionary. Monitors database performance and recommends efficiency improvements. Creates test database environment for applications section, including the creation of necessary libraries and procedures. Executes the procedures necessary to save, retrieve, and recover databases from hardware and software failures within established procedures. Assists with determining, implementing, and enhancing standards on database security and with monitoring agency disaster recovery procedures and systems. Assists with the installation of database software and with analyzing, designing, and implementing databases. Assists in benchmarking and threshold testing of databases and with establishing and controlling necessary database security. Assists in the selection of database management software. Experience in computer systems analysis or computer programming work. Knowledge of the principles, practices, and techniques of computer programming and systems design; of computer operations, systems, and procedures; of project control and cost estimating techniques; of computer programming languages; of data processing flowcharting techniques; of database structures and theories; and of current database technologies. Has working knowledge of EIR Accessibility standards and assistive technologies. Ensures that user interfaces for database administration and inputting, viewing, outputting data(via reports) are compliant with accessibility standards. Provides support to users in obtaining data / information when EIR Accessibility issues arise.",
        "source": "Email",
        "date_posted": "2024-10-14 09:54:50-05:00",
        "unique_id": "1928ba6f9004dca3",
        "emp_type": [
            "third party"
        ],
        "tag": "DB Admin"
    }
]