[
    {
        "company": "Source Infotech",
        "job_title": "Pega developer",
        "location": "Austin, TX, USA",
        "full_location": {
            "city": "Austin",
            "state": "TX",
            "country": "USA"
        },
        "job_details": {
            "employment_type": [
                "third party",
                "contract"
            ],
            "job_code": "",
            "experience_required": "More than 10 years",
            "degree_required": "Not specified",
            "visa_sponsorship": "No visa sponsorship",
            "notice_period": "Not specified",
            "duration": "Not specified",
            "rate": "Not specified"
        },
        "skills": {
            "core": [
                "PEGA LSA",
                "PRPC 5.x+",
                "Java"
            ],
            "primary": [
                "J2EE",
                "XML",
                "Java",
                "JSP",
                "EJB",
                "Scrum",
                "Agile",
                "Angular JS",
                "JQuery",
                "JavaScript",
                "CSS",
                "HTML5"
            ],
            "secondary": [
                "Project management",
                "Troubleshooting",
                "Application design",
                "Software development",
                "Testing",
                "Object-oriented analysis"
            ],
            "all": [
                "PEGA LSA",
                "PRPC 5.x+",
                "Java",
                "J2EE",
                "XML",
                "Java",
                "JSP",
                "EJB",
                "Scrum",
                "Agile",
                "Angular JS",
                "JQuery",
                "JavaScript",
                "CSS",
                "HTML5",
                "Project management",
                "Troubleshooting",
                "Application design",
                "Software development",
                "Testing",
                "Object-oriented analysis"
            ],
            "with_experience": [
                "PEGA LSA",
                "PRPC 5.x+",
                "Java (10+ years)"
            ]
        },
        "job_type": [
            "hybrid"
        ],
        "contact_person": "Khushank Chauhan",
        "email": "khushank@sourceinfotech.com",
        "jd": "From: KhushankChauhan, Source Infotech khushank@sourceinfotech.com Reply to: khushank@sourceinfotech.com Pega developerPEGA Certified LSA - Must have DL LOCAL to one of these cities:Open on C2CJob Location: Austin TX (Preferred), Memphis TN, St. Louis MO, or Morris Plains, NJ (Hybrid - 3 days/week onsite)Share resume, work auth copy and DLWork Eligibility: All Work Authorizations are Permitted - No H1Key Technology: PEGA LSA, PRPC 5.x+, JavaJob Responsibilities:Design class structures, application frameworks, and data modelsBe responsible for building patient Profile Pega Application.Perform object-oriented analysis and design across a variety of platformsTroubleshoot application issues, coding bugs, and bottlenecks.Maintain the security of all system applications.Coordinate with the project team to ensure the business architecture matches the needs of the customer.Perform solution architecture within the Pega PRPC environment.Integrate business databases, legacy systems, and web services. Skills and Experience Required:Required:More than 10 years of relevant experience in Pega developmentAdvanced knowledge of Pega PRPC 5.x/6.x/7.x.Familiarity with J2EE, XML, Java, JSP, and EJB.Familiarity with Scrum and Agile methodology.Knowledge of coding languages including Angular JS, Java, and JQuery.Knowledge of web technologies including JavaScript, CSS, HTML5, and XML.Excellent project management skills.Ability to troubleshoot complex software issues.Demonstrated experience in Agile development, application design, software development, and testingExpertise in object-oriented analysis and design across a variety of platformsExperience and thorough understanding of Pega RULES Process Commander System or other Business Process Management (BPM) systemAbility to effectively communicate to internal and external business partners on solution design",
        "source": "Email",
        "date_posted": "2024-10-14 12:21:54-05:00",
        "unique_id": "1928c2d9a6d2b3f9",
        "emp_type": [
            "third party",
            "contract"
        ],
        "tag": "PEGA Developer"
    }
]