[
    {
        "company": "3K Technologies",
        "job_title": "Java Developer",
        "location": "Tallahassee, FL, USA",
        "full_location": {
            "city": "Tallahassee",
            "state": "FL",
            "country": "USA"
        },
        "job_details": {
            "employment_type": [
                "full-time",
                "third party"
            ],
            "experience_required": "12:00 Years",
            "degree_required": "Any related field or equivalent work experience",
            "visa_sponsorship": "Not specified",
            "notice_period": "Not specified",
            "duration": "Long Term",
            "rate": "Not specified"
        },
        "skills": {
            "core": [
                "Java 8.0 and higher",
                "J2EE (JSP, EJB, JPA/Hibernate)",
                "Oracle 12c and higher",
                "SQL stored procedures, triggers, views, etc.",
                "Java Frameworks like JSF or Primefaces"
            ],
            "primary": [
                "JBoss EAP 7.0 and higher",
                "JavaScript",
                "VBScript",
                "XML, XHTML, HTML5",
                "CSS",
                "JSON file format",
                "REST APIs and Web Services"
            ],
            "secondary": [
                "Excellent oral and written communication skills",
                "Experience in business analysis",
                "Experience creating test plans, test cases, and performance testing",
                "Ability to code according to specifications with minimal defects",
                "Experience in delivering projects on schedule and within budget",
                "Experience in programming to adhere to ADA compliance in web applications"
            ],
            "all": [
                "Java 8.0 and higher",
                "J2EE (JSP, EJB, JPA/Hibernate)",
                "Oracle 12c and higher",
                "SQL stored procedures, triggers, views, etc.",
                "Java Frameworks like JSF or Primefaces",
                "JBoss EAP 7.0 and higher",
                "JavaScript",
                "VBScript",
                "XML, XHTML, HTML5",
                "CSS",
                "JSON file format",
                "REST APIs and Web Services",
                "Excellent oral and written communication skills",
                "Experience in business analysis",
                "Experience creating test plans, test cases, and performance testing",
                "Ability to code according to specifications with minimal defects",
                "Experience in delivering projects on schedule and within budget",
                "Experience in programming to adhere to ADA compliance in web applications"
            ]
        },
        "job_type": [
            "onsite"
        ],
        "contact_person": "Sanjay",
        "email": "sanjay@3ktechnologies.com",
        "jd": "From: sanjay, 3ktechnologies sanjay@3ktechnologies.com Reply to: sanjay@3ktechnologies.com Hi ALL,Job Title: Java DeveloperLocation:Tallahassee,FL(Onsite)Duration: Long TermExperience:12:00 YearsDescription:other related field or equivalent work experience\u2022 Minimum of five (5) years of experience as a systems analyst on successful, enterprise level information technology projects\u2022 Work independently or cooperatively with other software developers and/or lead developer\u2022 Model and apply software engineering methods and techniques to the design, definition, development, evaluation, integration, and/or support of IT solutions\u2022 Perform analysis and successful troubleshooting of system defects and issues\u2022 Experience with business analysis to gather and document requirements\u2022 Experience creating test plans, test cases, and performance testing\u2022 Ability to code according to specifications with minimal defects to ensure quality results\u2022 Use defined procedures to configure, test and debug software\u2022 Assist with technology solution architecture design and installation\u2022 Experience in programming to adhere to ADA compliance in web applications\u2022 Experience in delivering projects in the agreed upon schedule, to the correct technical specifications, and within the approved budget\u2022 Excellent oral and written communication skills\u2022 Experience developing with: o JBoss EAP 7.0 and highero Java 8.0 and highero J2EE (JSP, EJB, JPA/Hibernate)o Java Frameworks like JSFo Primefaceso Oracle 12c and highero SQL stored procedures, triggers, views, etc.o JavaScripto VBScripto XML, XHTML, HTML5o CSSo JSON file formato REST API\u2019s and Web ServicesThanks & RegardsSanjaySenior Technical Recruiter1114 Cadillac Ct, Milpitas, CA 95035www.3ktechnologies.com|sanjay@3ktechnologies.com",
        "source": "Email",
        "date_posted": "2024-10-14 14:37:21-05:00",
        "unique_id": "1928ca99de0a2e7e",
        "emp_type": [
            "full-time",
            "third party"
        ],
        "tag": "Java developer"
    }
]