[
    {
        "company": "Vyze Inc",
        "job_title": "Senior Database Engineer",
        "location": "USA",
        "full_location": {
            "city": "",
            "state": "",
            "country": "USA"
        },
        "job_details": {
            "employment_type": [
                "contract",
                "third party"
            ],
            "job_code": "",
            "experience_required": "15 years",
            "degree_required": "Not specified",
            "visa_sponsorship": "Not specified",
            "notice_period": "Not specified",
            "duration": "6 Month contract",
            "rate": "Not specified"
        },
        "skills": {
            "core": [
                "PostgreSQL",
                "SQL Server",
                "Hasura",
                "AWS"
            ],
            "primary": [
                "GIT",
                "Database Design",
                "Performance Optimization",
                "Data Security",
                "Backup and Recovery"
            ],
            "secondary": [
                "NoSQL databases",
                "ETL",
                "AWS Aurora"
            ],
            "all": [
                "PostgreSQL",
                "SQL Server",
                "Hasura",
                "AWS",
                "GIT",
                "Database Design",
                "Performance Optimization",
                "Data Security",
                "Backup and Recovery",
                "NoSQL databases",
                "ETL",
                "AWS Aurora"
            ]
        },
        "job_type": [
            "remote"
        ],
        "contact_person": "Ravina",
        "email": "ravina@vyzeinc.com",
        "jd": "From: Ravina, Vyze Inc ravina@vyzeinc.com Reply to: ravina@vyzeinc.com Job Description -Title: Senior Database EngineerDuration: 6 Month contract Location: Remote ( Candidate should be local to Texas)Visa: USC/GCMOI: Phone then video Resume should be short not more than 5 pages.Need 15 years of experienced candidate.Needing someone with experience working with Postgres, SQL Server, Hasura, and AWS.Essential Responsibilities: Manage and optimize PostgreSQL and SQL Server databases for performance and efficiency.Creating Hasura API\u2019s to be used as the DAL (Data Access Layer).GIT Experience including GIT Actions/AutomationImplement and maintain cloud-based database solutions, primarily on AWS.Develop and optimize SQL queries, stored procedures and functions.Ensure database securityCollaborate with cross-functional teams to integrate database technology within our infrastructure.Provide technical support and guidance on database design and architecture.Qualifications:Minimum of 10 years of experience as a Database Engineer or a similar role.Strong experience with PostgreSQLProven experience with AWS cloud services related to database management.In-depth understanding of SQL and database programming.Experience with GIT automation.Experience using Hasura and creating API\u2019s.Experience with database design, tuning, and performance optimization.Familiarity with data security, backup, and recovery methods.Other areas of expertise would be Data Warehouse and Data Lake for reporting and experience with Migrations from on Prem to AWS.Excellent problem-solving and analytical skills.Strong communication and collaboration abilities.Preferred Skills:Experience with other database technologies and NoSQL databases.ETL Experience in AWS.AWS Aurora highly preferred.If the candidate is strong enough on Postgres, organization, teamwork, the team can teach a good candidate Hasura.Nice to have skills:SQL Server is a nice to have.AWS ETL tools are also a great to have but not required.",
        "source": "Email",
        "date_posted": "2024-10-14 16:17:42-05:00",
        "unique_id": "1928d057c5f40353",
        "emp_type": [
            "contract",
            "third party"
        ],
        "tag": "DB Admin"
    }
]