[
    {
        "company": "Blue Ocean Ventures",
        "job_title": "Java FS Developer With React",
        "location": "Morrisplains, NJ, USA",
        "full_location": {
            "city": "Morrisplains",
            "state": "NJ",
            "country": "USA"
        },
        "job_details": {
            "employment_type": [
                "full-time",
                "third party"
            ],
            "experience_required": "12 to 14 years",
            "degree_required": "Not specified",
            "visa_sponsorship": "Not specified",
            "notice_period": "Not specified",
            "duration": "Not specified",
            "rate": "Not specified"
        },
        "skills": {
            "core": [
                "Java",
                "React",
                "Spring",
                "Hibernate",
                "HTML",
                "CSS",
                "JavaScript"
            ],
            "primary": [
                "RESTful APIs",
                "Microservices",
                "Git",
                "Problem-solving",
                "Communication",
                "Teamwork"
            ],
            "secondary": [
                "AWS",
                "Azure",
                "Google Cloud",
                "Docker",
                "Kubernetes",
                "CI/CD"
            ],
            "all": [
                "Java",
                "React",
                "Spring",
                "Hibernate",
                "HTML",
                "CSS",
                "JavaScript",
                "RESTful APIs",
                "Microservices",
                "Git",
                "Problem-solving",
                "Communication",
                "Teamwork",
                "AWS",
                "Azure",
                "Google Cloud",
                "Docker",
                "Kubernetes",
                "CI/CD"
            ]
        },
        "job_type": [
            "hybrid"
        ],
        "contact_person": "Abhilash SH",
        "email": "abhilash.sh@blue-oceanventures.com",
        "jd": "From: Abhilash s h, Blue ocean ventures abhilash.sh@blue-oceanventures.com Reply to: abhilash.sh@blue-oceanventures.com Role: Java FS Developer With ReactLocation : Morrisplains NJJava Full-stack DeveloperExperience: 12 to 14 years in software development. Key Responsibilities:Design, develop, and maintain web applications using Java and modern web technologies.Implement responsive user interfaces with HTML, CSS, and JavaScript frameworks (React).Develop and integrate RESTful APIs and microservices using Java frameworks (e.g., Spring Boot).Collaborate with product owners and designers to understand user requirements and translate them into technical specifications.Write clean, maintainable, and efficient code while adhering to coding standards and best practices.Conduct code reviews and provide constructive feedback to team members.Optimize applications for maximum speed and scalability.Troubleshoot and debug applications, identifying and resolving issues promptly. Qualifications:Proven experience as a Full Stack Developer, with a strong focus on Java development.Proficiency in Java and familiarity with Java frameworks (e.g., Spring, Hibernate).Experience with front-end technologies: HTML, CSS, JavaScript, and popular frameworks (Angular, React, or Vue.js).Familiarity with version control systems (e.g., Git).Strong problem-solving skills and attention to detail.Excellent communication and teamwork skills. Preferred Qualifications:Experience with cloud platforms (e.g., AWS, Azure, Google Cloud).Familiarity with containerization technologies (e.g., Docker, Kubernetes).Knowledge of CI/CD tools and practicesRegards, Abhilash SHhttps://www.linkedin.com/in/abhilash-s-h-ab07a5231/Blue Ocean Ventures5555 Glenridge Connector Suite 200 Atlanta, GA 30342Email:Abhilash.sh@blue-oceanventures.comWill To Serve Will To Win Will To Lead",
        "source": "Email",
        "date_posted": "2024-10-14 13:04:28-05:00",
        "unique_id": "1928cbb891c37476",
        "emp_type": [
            "full-time",
            "third party"
        ],
        "tag": "Java developer"
    }
]