[
    {
        "company": "Vyze Inc",
        "job_title": "PEGA Certified LSA",
        "location": "Austin, TX, USA",
        "full_location": {
            "city": "Austin",
            "state": "TX",
            "country": "USA"
        },
        "job_details": {
            "employment_type": [
                "full-time",
                "third party"
            ],
            "experience_required": "More than 10 years",
            "degree_required": "Not specified",
            "visa_sponsorship": "Not specified",
            "notice_period": "Not specified",
            "duration": "12 Months",
            "rate": "Not specified"
        },
        "skills": {
            "core": [
                "PEGA LSA",
                "Pega PRPC 5.x/6.x/7.x",
                "Java"
            ],
            "primary": [
                "J2EE",
                "XML",
                "JSP",
                "EJB",
                "Scrum",
                "Agile",
                "Angular JS",
                "JQuery",
                "JavaScript",
                "CSS",
                "HTML5"
            ],
            "secondary": [
                "Project management",
                "Troubleshooting",
                "Application design",
                "Software development",
                "Testing",
                "Communication"
            ],
            "all": [
                "PEGA LSA",
                "Pega PRPC 5.x/6.x/7.x",
                "Java",
                "J2EE",
                "XML",
                "JSP",
                "EJB",
                "Scrum",
                "Agile",
                "Angular JS",
                "JQuery",
                "JavaScript",
                "CSS",
                "HTML5",
                "Project management",
                "Troubleshooting",
                "Application design",
                "Software development",
                "Testing",
                "Communication"
            ]
        },
        "job_type": [
            "hybrid"
        ],
        "contact_person": "Shrasti Singh",
        "email": "shrasti@vyzeinc.com",
        "jd": "Job Description -Job Title - PEGA Certified LSAJob Location - Austin TX (Preferred), Memphis TN, St. Louis MO, or Morris Plains, NJ (Hybrid - 3 days/week onsite)Must have DL LOCAL to one of these citiesMOI - Skype Duration - 12 Months Key Technology: PEGA LSA, PRPC 5.x+, Java Job Responsibilities:Design class structures, application frameworks, and data modelsBe responsible for building patient Profile Pega Application.Perform object-oriented analysis and design across a variety of platformsTroubleshoot application issues, coding bugs, and bottlenecks.Maintain the security of all system applications.Coordinate with the project team to ensure the business architecture matches the needs of the customer.Perform solution architecture within the Pega PRPC environment.Integrate business databases, legacy systems, and web services.Skills and Experience Required:Required:More than 10 years of relevant experience in Pega developmentAdvanced knowledge of Pega PRPC 5.x/6.x/7.x.Familiarity with J2EE, XML, Java, JSP, and EJB.Familiarity with Scrum and Agile methodology.Knowledge of coding languages including Angular JS, Java, and JQuery.Knowledge of web technologies including JavaScript, CSS, HTML5, and XML.Excellent project management skills.Ability to troubleshoot complex software issues.Demonstrated experience in Agile development, application design, software development, and testingExpertise in object-oriented analysis and design across a variety of platformsExperience and thorough understanding of Pega RULES Process Commander System or other Business Process Management (BPM) systemAbility to effectively communicate to internal and external business partners on solution design",
        "source": "Email",
        "date_posted": "2024-10-14 16:08:08-05:00",
        "unique_id": "1928cfcb63637655",
        "emp_type": [
            "full-time",
            "third party"
        ],
        "tag": "PEGA Developer"
    }
]