[
    {
        "company": "Vyze Inc",
        "job_title": "Mongo Database Administrator",
        "location": "USA",
        "full_location": {
            "city": "",
            "state": "",
            "country": "USA"
        },
        "job_details": {
            "employment_type": [
                "full-time",
                "third party"
            ],
            "job_code": "",
            "experience_required": "3+ years",
            "degree_required": "Bachelor's degree in IT or a related field",
            "visa_sponsorship": "Not specified",
            "notice_period": "Not specified",
            "duration": "Not specified",
            "rate": "Not specified"
        },
        "skills": {
            "core": [
                "Mongo Db Atlas",
                "Vector database technologies",
                "cloud databases",
                "SQL",
                "PowerShell",
                "Unix shell scripting"
            ],
            "primary": [
                "AWS",
                "Microsoft Azure",
                "database security",
                "backup and recovery",
                "performance monitoring",
                "relational data modeling",
                "dimensional data modeling",
                "database migrations",
                "schema design",
                "data modeling"
            ],
            "secondary": [
                "PostgreSQL",
                "DynamoDB",
                "Aurora",
                "MYSQL",
                "Snowflake",
                "DocumentDB",
                "SOX/SOC1/SOC2 compliance",
                "SAS model",
                "VPC Pairing",
                "network connectivity",
                "SSO/SAML integration",
                "mentoring"
            ],
            "all": [
                "Mongo Db Atlas",
                "Vector database technologies",
                "cloud databases",
                "SQL",
                "PowerShell",
                "Unix shell scripting",
                "AWS",
                "Microsoft Azure",
                "database security",
                "backup and recovery",
                "performance monitoring",
                "relational data modeling",
                "dimensional data modeling",
                "database migrations",
                "schema design",
                "data modeling",
                "PostgreSQL",
                "DynamoDB",
                "Aurora",
                "MYSQL",
                "Snowflake",
                "DocumentDB",
                "SOX/SOC1/SOC2 compliance",
                "SAS model",
                "VPC Pairing",
                "network connectivity",
                "SSO/SAML integration",
                "mentoring"
            ]
        },
        "job_type": [
            "remote"
        ],
        "contact_person": "Ravina",
        "email": "ravina@vyzeinc.com",
        "jd": "From: Ravina, Vyze Inc ravina@vyzeinc.com Reply to: ravina@vyzeinc.com Job Description -PV will take 30 min video screening callMongo Database AdministratorRemote + Some Travel to Reading, Pennsylvania and If not local to Reading, Pennsylvania, the consultant will be required to travel onsite roughly 30% of the time. Requirements: \u2022 Bachelor's degree in and IT or a related field.\u2022 3+ years' experience designing business solutions in a hybrid cloud environment (AWS and/or Azure)\u2022 10+ years Progressive years of experience in database technologies.\u2022 5+ years extensive experience with Mongo Db Atlas and Vector database technologies\u2022 5+ years' Experience with cloud databases and cloud services (AWS, Microsoft Azure).\u2022 Strong command of SQL, PowerShell, and Unix shell scripting skills.\u2022 Strong experience in SQL tools such as TOAD, SQL Developer, PGADMIN, Mongo CLI, Mongo DB Compass etc.\u2022 Advanced knowledge of database security, backup and recovery, and performance monitoring standards.\u2022 Understanding relational and dimensional data modeling\u2022 Experience in database migrations, upgrades.\u2022 An ideal candidate should have experience in modern ways of designing, building, optimizing and deployment of database workloads in public cloud, preferably Mongo Db Atlas and Vector database technologies.\u2022 Should be experienced in schema design and data modeling.\u2022 Should be a driver in determining, implementing, and continuously improving the architecture and the security aspect throughout the systems, tools and workflows.\u2022 Always striving for automation with distinctly unique mindset for optimization of database infrastructure working with an international (onsite and offshore) team.\u2022 Strong written and verbal communication skills with the ability to create and present concepts and recommendations to the management.\u2022 Experience with database technologies (MongoDB, PostgreSQL, DynamoDB, Aurora, MYSQL, Snowflake & DocumentDB & Vector DBs).Must Have Requirements:\u2022 5+ years extensive experience with Mongo Db Atlas and Vector database technologies\u2022 5+ years' experience with cloud databases and cloud services, and Hybrid environments (AWS, Microsoft Azure).\u2022 Strong command of SQL, PowerShell, and Unix shell scripting skills.\u2022 Strong experience in SQL tools such as TOAD, SQL Developer, PGADMIN, Mongo CLI, Mongo DB Compass etc.\u2022 Advanced knowledge of database security, backup and recovery, and performance monitoring standards.\u2022 Understanding relational and dimensional data modeling\u2022 Experience in database migrations, upgrades.\u2022 Should be experienced in schema design and data modeling.Added Bonus If Candidates Have\u2022 Master's degree in an IT or related field\u2022 MongoDb/Cloud Architecture certifications\u2022 Experience with SOX/SOC1/SOC2 and other Compliance Audits\u2022 Knowledge of SAS model\u2022 VPC Pairing, Private/Public Links, network connectivity & security\u2022 SSO/SAML integration\u2022 Mentoring Client Team",
        "source": "Email",
        "date_posted": "2024-10-14 16:37:05-05:00",
        "unique_id": "1928d173a2de6e2e",
        "emp_type": [
            "full-time",
            "third party"
        ],
        "tag": "DB Admin"
    }
]