[
    {
        "company": "Technocraft solutions",
        "job_title": "Certified Power Platform & .NET Developer",
        "location": "Hartford, CT, USA",
        "full_location": {
            "city": "Hartford",
            "state": "CT",
            "country": "USA"
        },
        "job_details": {
            "employment_type": [
                "contract",
                "third party"
            ],
            "job_code": "CT-DSSAppDev1",
            "experience_required": "Not specified",
            "degree_required": "Not specified",
            "visa_sponsorship": "Not specified",
            "notice_period": "Not specified",
            "duration": "12 Months",
            "rate": "Not specified"
        },
        "skills": {
            "core": [
                "Microsoft .NET Certification",
                "Power Platform Development Certification",
                "API Integration",
                "SDLC Proficiency"
            ],
            "primary": [
                "VB.NET",
                "Java/J2EE",
                "Microsoft Power Platform",
                "SQL"
            ],
            "secondary": [
                "Legacy System Conversion",
                "Legacy Application Support",
                "Data Model Design",
                "Development Standards",
                "Best Practices & Operational Knowledge",
                "Communication & Leadership",
                "Operating systems",
                "Databases",
                "Application servers",
                "Network protocols"
            ],
            "all": [
                "Microsoft .NET Certification",
                "Power Platform Development Certification",
                "API Integration",
                "SDLC Proficiency",
                "VB.NET",
                "Java/J2EE",
                "Microsoft Power Platform",
                "SQL",
                "Legacy System Conversion",
                "Legacy Application Support",
                "Data Model Design",
                "Development Standards",
                "Best Practices & Operational Knowledge",
                "Communication & Leadership",
                "Operating systems",
                "Databases",
                "Application servers",
                "Network protocols"
            ]
        },
        "job_type": [
            "hybrid"
        ],
        "contact_person": "Jitendra Upreity",
        "email": "jitendra@technocraftsol.com",
        "jd": "From: Jitendra Upreity, Technocraft solutions jitendra@technocraftsol.com Reply to: jitendra@technocraftsol.com Job Title: Certified Power Platform & .NET Developer (Locals Only)Location: Hartford, CT (Hybrid)Duration: 12 Months Contract Note: **Hybrid Schedule: The client has agreed to allow the selected local candidate to work a hybrid situation with on-site work to be determined by the manager.***Local candidates only!! Responsibilities and Skills:Job ID: CT-DSSAppDev1 Location: Hartford, CT (CT DSS)Duration: 12 Months Description:\u00b7 Microsoft .NET Certification: Candidates must possess a valid certification in Microsoft .NET development, demonstrating expertise in building, deploying, and maintaining applications using the .NET framework. This certification ensures proficiency in various .NET technologies and best practices for software development.\u00b7 Power Platform Development Certification: A certification in Microsoft Power Platform development is required, verifying the candidate\u2019s ability to create custom business solutions using Power Apps, Power Automate, Power BI, and Power Virtual Agents. This certification reflects the ability to develop and integrate low-code/no-code solutions that enhance organizational workflows.\u00b7 Legacy System Conversion: Assist in converting legacy .NET applications to the Microsoft Power Platform, ensuring smooth integration with Power Apps, Power Pages, and portals while maintaining full functionality and performance.\u00b7 Legacy Application Support: Provide ongoing maintenance and support for existing .NET legacy applications, addressing technical issues, performing updates, and ensuring continued operation and performance.\u00b7 API Integration: Develop and implement robust API integration solutions to connect external applications and systems, ensuring secure and efficient data exchange across platforms.\u00b7 Data Model Design: Collaborate with database administrators (DBAs) to design efficient data models, optimize queries, and maintain data integrity across both legacy systems and new Power Platform applications.\u00b7 SDLC Proficiency: Exhibit expertise in the Software Development Life Cycle (SDLC), with experience in both waterfall and agile methodologies, ensuring timely project delivery and alignment with project goals.\u00b7 Development Standards: Follow established development practices, proactively identifying opportunities for process improvements to enhance overall development quality and efficiency. Technical Expertise:Proficiency in programming languages such as VB.NET, Java/J2EE, and API development.Strong experience with Microsoft Power Platform (Power Apps, Power Pages, Portals).Hands-on experience in setting up Integrated Development Environments (IDEs) and writing unit and feature tests.Ability to run and optimize SQL queries, contributing to both development and testing efforts.Best Practices & Operational Knowledge: Demonstrated knowledge of best practices in systems deployment, testing, operations, administration, and disaster recovery.Communication & Leadership: Strong verbal and written communication skills, with the ability to manage tasks proactively and work independently.Additional Qualifications: Experience in operating systems, databases, application servers, programming languages, and network protocols is a plus. Relevant technical certifications or additional training in these areas is highly desirable.",
        "source": "Email",
        "date_posted": "2024-10-14 12:17:32-05:00",
        "unique_id": "1928c299d7719f65",
        "emp_type": [
            "contract",
            "third party"
        ],
        "tag": ".net developer"
    }
]