[
    {
        "company": "Source Infotech Inc",
        "job_title": "Sr. Product/Technical Program Manager",
        "location": "USA",
        "full_location": {
            "city": "",
            "state": "",
            "country": "USA"
        },
        "job_details": {
            "employment_type": [
                "contract",
                "third party"
            ],
            "job_code": "",
            "experience_required": "5+ years",
            "degree_required": "Bachelor's Degree required, and product management certifications such as Lean, Six Sigma or PMP are preferred",
            "visa_sponsorship": "Not specified",
            "notice_period": "Not specified",
            "duration": "12+ months contract",
            "rate": "Not specified"
        },
        "skills": {
            "core": [
                "Managing cross-functional projects and teams",
                "Working with engineering teams to understand and document requirements",
                "Data analysis techniques to prioritize conflicting priorities",
                "Expertise in Azure DevOps",
                "Expertise in Dynamics D365"
            ],
            "primary": [
                "Excellent communication skills",
                "Collaboration skills",
                "Ability to adapt to rapidly changing conditions",
                "Strong negotiation skills",
                "Ability to influence others"
            ],
            "secondary": [
                "Lean Six Sigma",
                "PMP",
                "Product Owner Certifications",
                "Design skills",
                "Understanding of basic AI concepts",
                "Experience with developing and implementing organizational frameworks"
            ],
            "all": [
                "Managing cross-functional projects and teams",
                "Working with engineering teams to understand and document requirements",
                "Data analysis techniques to prioritize conflicting priorities",
                "Expertise in Azure DevOps",
                "Expertise in Dynamics D365",
                "Excellent communication skills",
                "Collaboration skills",
                "Ability to adapt to rapidly changing conditions",
                "Strong negotiation skills",
                "Ability to influence others",
                "Lean Six Sigma",
                "PMP",
                "Product Owner Certifications",
                "Design skills",
                "Understanding of basic AI concepts",
                "Experience with developing and implementing organizational frameworks"
            ]
        },
        "job_type": [
            "remote"
        ],
        "contact_person": "Abhisek Kumar",
        "email": "abhisek.k@sourceinfotech.com",
        "jd": "From: abhisek, source infotech inc abhisek.k@sourceinfotech.com Reply to: abhisek.k@sourceinfotech.com Title: Sr. Product/Technical Program ManagerLocation: 100% RemoteDuration: 12+ months contractIV: Phone and VideoVisa: USC and GC Need Sr. Product/Technical Program Manager - Customer Support & Technology Engineering, CELA Keywords: Azure DevOps, AI, UX, Figma, Dynamics 365 Typical Day in the Role * Purpose of the Team: This team is responsible for 1) identifying and prioritizing various requests from the law enforcement and national security team during semester planning 2)Continuously collaborating to gather new business and legal requirements and ensuring these are incorporated into their tools and products 3) Modernizing legacy infrastructure and tools used by the law enforcement and national security team 4) Working on UI/UX updates and introducing AI capabilities in Dynamics D365 to improve end-to-end processes. 5)Engaging with other Microsoft Teams to fulfill legal obligations and ensure planning cycles are aligned * Key projects:o This role requires excellent communication and collaboration skills with an ability to adapt to rapidly changing conditions and priorities. You will be working with people from many different teams from across Microsoft and backgrounds requiring an open mindset and strong negotiation skills. You must be able to identify and partner with other groups to achieve joint or complementary goals. You will create, maintain, and track project level information and be responsible for status updates, tracking action items and deliverables, create timelines and initiative milestones and strive for cross-team alignment toward them. You will support product management with actions leading to clarity, decisions across teams, as well as help establish and implement best practices for high quality execution and product delivery. A proven track record of successfully managing enterprise-wide projects and shipping high quality products and delivering on time providing measurable impact to be successful in this role. * Typical task breakdown and operating rhythm: 60% meetings, 20% of heads-down work, and 20% of ad hoc tasks including troubleshooting sessions, design sessions with architects, and other open-ended tasks.o Build, develop and maintain highly collaborative and effective working relationships with key stakeholders to facilitate proactive planning and flawless execution against stakeholders' business objectives and product team goals.o Support planning across multiple product organizations, including, but not limited to both semester and long-term aspects, ensuring roadmaps and timelines are aligned across multiple product groups and across multiple work streams.o Support and execute rhythm of the business activities that support cross-product org alignment; includes overall cadence, preparation of materials and presents, developing status updates and scorecards and talk track for presenters; follow up with post-meeting or offsite/event with follow-up notes, actions and support implementation of agreed upon goals.o Establish or enhance project processes, routines, and reporting to be well managed.o At times may need to document business requirements and / or help translate into product requirements, do traceability between business, product and tech specs and ensure gaps and issues are tracked for new features or project creation.o Manage, track, and drive alignment with partner teams on critical project deliverables.o Identify, evaluate, and implement knowledge management tools and sites (Teams, SharePoint, etc.) to ensure effective cultivating, maintaining and sharing of team knowledge.o Own acceptance and criteria needed to build out and/or create Dashboards and Reports.o Additional projects as needed. Candidate Requirements* Years of Experience Required:o 5+ years of experience in Product Management. * Degrees or certifications required:o Bachelor's Degree required, and product management certifications such as Lean, Six Sigma or PMP are preferred * Disqualifiers:o No relevant experience, frequent job hopping with short durations for each job without any long-term positions * Best vs. Average: * Best:- extensive product management and expertise- prior Microsoft experience * Preferred:o Lean Six Sigma, PMP, or Product Owner Certifications o Design skills: creating beautiful layouts, UX designs, UX tools such as Figma o Understanding of basic AI concepts (LLM's, ML, prompt Engineering, etc.) o Experience with developing and implementing organizational frameworks, standards, and processes o Ability to influence others inside and outside of direct team Top 3 Hard Skills Required + Years of Experience 1. Managing cross-functional projects and teams. (5+) 2. Working with engineering teams to understand and document requirements (5+) 3. Data analysis techniques to prioritize conflicting priorities (5+) 4. Expertise in Azure DevOps and Dynamics D365 (5+) Sr. Product/Technical Program Manager Contract Role - Customer Support & Technology Engineering, CELA This role requires excellent communication and collaboration skills with an ability to adapt to rapidly changing conditions and priorities. You will be working with people from many different teams from across Microsoft and backgrounds requiring an open mindset and strong negotiation skills. You must be able to identify and partner with other groups to achieve joint or complementary goals. You will create, maintain, and track project level information and be responsible for status updates, tracking action items and deliverables, create timelines and initiative milestones and strive for cross-team alignment toward them. You will support product management with actions leading to clarity, decisions across teams, as well as help establish and implement best practices for high quality execution and product delivery. A proven track record of successfully managing enterprise-wide projects and shipping high quality products and delivering on time providing measurable impact to be successful in this role.",
        "source": "Email",
        "date_posted": "2024-10-14 11:33:20-05:00",
        "unique_id": "1928c0124b215568",
        "emp_type": [
            "contract",
            "third party"
        ],
        "tag": "Project Manager"
    }
]