[
    {
        "company": "Stellent It",
        "job_title": "Java Applications Architect",
        "location": "Madison, WI, USA",
        "full_location": {
            "city": "Madison",
            "state": "WI",
            "country": "USA"
        },
        "job_details": {
            "employment_type": [
                "full-time",
                "third party"
            ],
            "job_code": "",
            "experience_required": "4+ years",
            "degree_required": "Associate\u2019s Degree or some college",
            "visa_sponsorship": "Not specified",
            "notice_period": "Not specified",
            "duration": "long term",
            "rate": "Not specified"
        },
        "skills": {
            "core": [
                "Java software development tools",
                "Version control system support",
                "JavaScript software development tools",
                "Continuous Integration Systems"
            ],
            "primary": [],
            "secondary": [
                "Strong communication skills",
                "Ability to work independently",
                "Ability to prioritize tasks",
                "Experience creating and maintaining documentation",
                "Experience working with team members to create standards",
                "Experience supporting development tools",
                "Help desk experience",
                "Team lead experience",
                "Experience utilizing ticketing software"
            ],
            "all": [
                "Java software development tools",
                "Version control system support",
                "JavaScript software development tools",
                "Continuous Integration Systems",
                "Strong communication skills",
                "Ability to work independently",
                "Ability to prioritize tasks",
                "Experience creating and maintaining documentation",
                "Experience working with team members to create standards",
                "Experience supporting development tools",
                "Help desk experience",
                "Team lead experience",
                "Experience utilizing ticketing software"
            ],
            "with_experience": [
                "Java software development tools (4+ years)",
                "Version control system support (4+ years)",
                "JavaScript software development tools (4+ years)",
                "Continuous Integration Systems (4+ years)"
            ]
        },
        "job_type": [
            "hybrid"
        ],
        "contact_person": "Aditya Kumar",
        "email": "aditya@stellentit.com",
        "jd": "From: Aditya Kumar, Stellent It aditya@stellentit.com Reply to: aditya@stellentit.com Job Title Java Applications ArchitectLocation Madison, Wisconsin(Hybrid)Duration long term Job Description About the jobOur client is seeking a Java Applications Architect. The role will provide development tool support for development processes used in software product lifecycles. The Java Applications Architect will also be responsible for ensuring quality and consistency of the support of software development tools across the system and providing day-to-day technical guidance to the development teams. TasksSolve complex technical problems for developers when utilizing the organization\u2019s application development tools.Create and maintain documentation for installation and setup of supported application development tools.Work with team members to create standards, policies, and procedures for the organization\u2019s use of software development tools and frameworks.Provide consultation and recommend course of action to maintain cost effectiveness and quality of application development tools and systems.Stay up to date on industry best practices and objectives, particularly as these relate to application development.Research and implement best practices that will control costs, provide higher quality, and/or increase predictability of service delivery.Research new technology and development tools to remain abreast of current and emerging technology. Knowledge, Skills and Abilities Required:Strong communication skillsAbility to work independentlyAbility to prioritize tasks and juggle competing demands for supporting application development tools Skills Required: 4+ years - Java software development tools experience.4+ years - Version control system support (e.g. GitHub.com) experience4+ years - JavaScript software development tools experience4+ years - Continuous Integration Systems experienceAssociate\u2019s Degree or some college Skills Desired \u2013 A plus to have: Experience creating and maintaining documentation for installation and setup of supported application development tools.Experience working with team members to create standards, policies, and procedures for the organization\u2019s use of software development tools and frameworks.Experience supporting development tools and/or help desk experience, as well as team lead experience.Experience utilizing ticketing software to handle customer requests.",
        "source": "Email",
        "date_posted": "2024-10-14 10:11:46-05:00",
        "unique_id": "1928be28220de399",
        "emp_type": [
            "full-time",
            "third party"
        ],
        "tag": "Java developer"
    }
]