[
    {
        "company": "iTech US INC",
        "job_title": ".Net Developer",
        "location": "Tampa, FL, USA",
        "full_location": {
            "city": "Tampa",
            "state": "FL",
            "country": "USA"
        },
        "job_details": {
            "employment_type": [
                "contract",
                "third party"
            ],
            "job_code": "",
            "experience_required": "9+ years",
            "degree_required": "Not specified",
            "visa_sponsorship": "No visa sponsorship",
            "notice_period": "Not specified",
            "duration": "12+ months",
            "rate": "$50/hr on C2C"
        },
        "skills": {
            "core": [
                "ASP .NET",
                "C#",
                "SQL",
                "Mongo DB"
            ],
            "primary": [
                "Reactor Angular",
                "Leading and managing a team",
                "Collaborating with stakeholders",
                "Designing and architecting software solutions",
                "Conducting code reviews",
                "Troubleshooting and debugging"
            ],
            "secondary": [
                "ReactJS",
                "Angular 2",
                "PL/SQL",
                "ASP.NET 4.5"
            ],
            "all": [
                "ASP .NET",
                "C#",
                "SQL",
                "Mongo DB",
                "Reactor Angular",
                "Leading and managing a team",
                "Collaborating with stakeholders",
                "Designing and architecting software solutions",
                "Conducting code reviews",
                "Troubleshooting and debugging",
                "ReactJS",
                "Angular 2",
                "PL/SQL",
                "ASP.NET 4.5"
            ]
        },
        "job_type": [
            "onsite"
        ],
        "contact_person": "Manasa Salla",
        "email": "manasa.s@itechus.net",
        "jd": "From: Manasa S, iTech US INC manasa.s@itechus.net Reply to: manasa.s@itechus.net Job Role: .Net Developer Job Location: Tampa, Florida Duration: 12+ months contract We are looking for H1 B candidates from Third-party Vendors Looking only local to Florida Consultant Rate : $50/hr on C2C with TCS without any VMS Charges Role Description: Must Have Technical/Functional Skills \u2022 9+ years experience, ASP .NET, Reactor Angular(preferred), SQL, Mongo DB \u2022 Leading and managing a team of .NET developers, assigning tasks and providing guidance and support. \u2022 Collaborating with stakeholders to gather and analyze requirements, and translating them into technical specifications. \u2022 Designing and architecting scalable and robust software solutions using the .NET framework. \u2022 Developing and coding software applications using C#, ASP.NET, and other .NET technologies. \u2022 Conducting code reviews and ensuring adherence to coding standards and best practices. \u2022 Troubleshooting and debugging complex software issues, and implementing effective solutions. \u2022 Collaborating with cross-functional teams, such as quality assurance, to ensure software quality and performance. \u2022 Keeping up-to-date with the latest .NET technologies, trends, and best practices, and recommending their adoption where applicable. \u2022 Mentoring and coaching junior developers, providing technical guidance and fostering their professional growth. \u2022 Assisting in project planning, estimation, and risk management activities. Competencies: Digital : ReactJS, Digital : Angular 2, PL/SQL, ASP.NET 4.5 Thanks & Regards Manasa Salla Sr Technical Recruiter iTech US, Inc manasa.s@itechus.net LinkedIn: https://www.linkedin.com/in/manasa-salla-0836711a8",
        "source": "Email",
        "date_posted": "2024-10-28 13:29:12-05:00",
        "unique_id": "192d483ac208af53",
        "emp_type": [
            "contract",
            "third party"
        ],
        "tag": ".net developer"
    }
]