[
    {
        "company": "SIRI INFO",
        "job_title": "Business Analyst (Performance Measurement & Attribution) Public",
        "location": "Quincy, MA, USA",
        "full_location": {
            "city": "Quincy",
            "state": "MA",
            "country": "USA"
        },
        "job_details": {
            "employment_type": [
                "contract",
                "third party"
            ],
            "job_code": "",
            "experience_required": "Not specified",
            "degree_required": "Not specified",
            "visa_sponsorship": "Not specified",
            "notice_period": "Not specified",
            "duration": "Contract",
            "rate": "Not specified"
        },
        "skills": {
            "core": [
                "Investment Performance Measurement",
                "Business Analyst",
                "Product roles",
                "Accounting data ingestion",
                "Calculations",
                "Reporting"
            ],
            "primary": [
                "Gap analysis",
                "Effective communication",
                "Team oriented",
                "Detail oriented",
                "Critical thinking",
                "Problem-solving"
            ],
            "secondary": [
                "Performance Measurement and Attribution",
                "Investment Accounting Data",
                "Fund Accounting Data",
                "Core securities data entities",
                "Pricing methodologies",
                "Pricing sources",
                "Vendor Performance Calculation Engines",
                "Performance Calculation methodologies"
            ],
            "all": [
                "Investment Performance Measurement",
                "Business Analyst",
                "Product roles",
                "Accounting data ingestion",
                "Calculations",
                "Reporting",
                "Gap analysis",
                "Effective communication",
                "Team oriented",
                "Detail oriented",
                "Critical thinking",
                "Problem-solving",
                "Performance Measurement and Attribution",
                "Investment Accounting Data",
                "Fund Accounting Data",
                "Core securities data entities",
                "Pricing methodologies",
                "Pricing sources",
                "Vendor Performance Calculation Engines",
                "Performance Calculation methodologies"
            ]
        },
        "job_type": [
            "hybrid"
        ],
        "contact_person": "Danish Iqbal",
        "email": "danish.iqbal@siriinfo.com",
        "jd": "Hello Dear,Hope You\u2019re Doing Well!!My name is Danish Iqbal and I am a Staffing Specialist at SIRI INFO. I am reaching out to you on an exciting job opportunity with one of our clients.Job Title: Business Analyst (Performance Measurement & Attribution) PublicJob Location: Quincy, MA (Hybrid)Job Duration: Contract Job Description:-Investment Performance Measurement domain knowledge; Business Analyst or Product roles, fairly standard set of skills - accounting data ingestion, calculations, reporting etc. if possible with existing STT PnA / FLX / GPA experience.Apply functional business knowledge when building platform requirements.Ability to perform gap analysis between source of data and existing data model to determine model additions.Effective communicator \u2013 can summarize succinctly and can provide details when needed.Team oriented \u2013 capable of working in a global setting.Detail oriented and strong sense of responsibility.Flexible and can adapt easily to changing/evolving role requirements.Strong critical thinking and problem-solving skills Additional details Familiar with Performance Measurement and Attribution function. Familiar with Investment Accounting Data and/or Fund Accounting Data experience Familiar with core securities data entities including: Positions, Transactions, Holdings and Income Familiar with pricing methodologies: Mark-to-Market Pricing, Fair Value Pricing Familiar with pricing sources: NYSE, NASDAQ, LSE, Reuters, Bloomberg, FactSet, MSCI Familiar with Vendor Performance Calculation Engines: e.g., Solovis, eVestment, FactSet Familiar with Performance Calculation methodologies: e.g., Time Weighted Return, Internal Rate of Return, Benchmark Comparison",
        "source": "Email",
        "date_posted": "2024-10-28 13:36:39-05:00",
        "unique_id": "192d48a7f29e0be4",
        "emp_type": [
            "contract",
            "third party"
        ],
        "tag": "Business Analyst"
    }
]