[
    {
        "company": "Concord IT Systems",
        "job_title": "Project Management",
        "location": "Minneapolis, MN, USA",
        "full_location": {
            "city": "Minneapolis",
            "state": "MN",
            "country": "USA"
        },
        "job_details": {
            "employment_type": [
                "third party"
            ],
            "job_code": "",
            "experience_required": "3-5 years",
            "degree_required": "Bachelor\u2019s Degree in project management, business administration, engineering, or a related field",
            "visa_sponsorship": "Not specified",
            "notice_period": "Not specified",
            "duration": "Not specified",
            "rate": "Not specified"
        },
        "skills": {
            "core": [
                "Project Management",
                "Communication",
                "Leadership",
                "Organizational Skills",
                "Problem-Solving",
                "Decision-Making",
                "Technical Skills"
            ],
            "primary": [
                "MS Project",
                "JIRA",
                "Trello"
            ],
            "secondary": [
                "Project Management Professional (PMP)",
                "Certified ScrumMaster (CSM)",
                "Certified Associate in Project Management (CAPM)",
                "Lean Six Sigma Certification"
            ],
            "all": [
                "Project Management",
                "Communication",
                "Leadership",
                "Organizational Skills",
                "Problem-Solving",
                "Decision-Making",
                "Technical Skills",
                "MS Project",
                "JIRA",
                "Trello",
                "Project Management Professional (PMP)",
                "Certified ScrumMaster (CSM)",
                "Certified Associate in Project Management (CAPM)",
                "Lean Six Sigma Certification"
            ]
        },
        "job_type": [],
        "contact_person": "David Johnson",
        "email": "david.johnson@concorditsystems.com",
        "jd": "From: David Johnson, concord it systems david.johnson@concorditsystems.com Reply to: david.johnson@concorditsystems.com Title : Project Management JD: Provide technical leadership and take ownership of critical technical tasks in the execution of new product development catheter projects.\u2022 Liaise with key opinion leaders to develop a deep understanding of the diseasestate, gather user needs; and articulate throughout the team.\u2022 Translate needs requirements into technical specifications.\u2022 Foster a culture of creativity; generate creative product solutions to addressunmet needs.\u2022 Provide leadership to the team in the development of test models for prototypeperformance evaluations, building and testing of prototypes, test data analysisand interpretation, component and finished device assemblydrawings/specifications, product materials selection, and process development.Hands-on approach where appropriate, leading critical activities by example.\u2022 Identify and manage key technical risks and appropriate mitigations throughoutthe product lifecycle.\u2022 Write and/or review procedures, protocols, specifications, and reports.\u2022 Identify and recommend optimal solution(s) for commercialization.\u2022 Interface with physicians; evaluate and assess user techniques and developproduct training materials.\u2022 Identify and support development of processes for new catheter developments.\u2022 Support generation of Intellectual Property by filing new ideas and draftingpatents as required. Encourage and support idea generation and filing across theengineering groups on site.Develop detailed technical project goals, plans and budget.\u2022 Identify critical project tasks, define project strategy, and set team priorities.\u2022 Identify and manage key program risks.\u2022 Manage direct team and across functions to deliver on performance, time and costtargets.\u2022 Report progress across the organisation.\u2022 Leverage and liaise with external resources to achieve project goals.\u2022 Manage project in accordance with quality system \u2013 take ownership of designhistory file and lead design reviews.\u2022 Develop marketing materials (presentations/videos/demos).\u2022 Attend external meetings with key opinion leaders to present the client product portfolio and gain feedback on new product development.\u2022 Perform other duties as assigned or required. Educational BackgroundBachelor\u2019s Degree: Typically in project management, business administration, engineering, or a related field , Lifesciences.Master\u2019s Degree: Can be advantageous, especially for senior positions.ExperienceProject Management Experience: At least 3-5 years of experience in managing projects.Industry-Specific Experience: Relevant experience in the specific industry or field.SkillsCommunication: Excellent verbal and written communication skills.Leadership: Strong leadership and motivational skills.Organizational Skills: Ability to manage time and resources efficiently.Problem-Solving: Strong analytical and problem-solving abilities.Decision-Making: Effective decision-making skills.Technical Skills: Proficiency in project management software and tools, such as MS Project, JIRA, or Trello.CertificationsProject Management Professional (PMP)Certified ScrumMaster (CSM)Certified Associate in Project Management (CAPM)Lean Six Sigma CertificationDavid JohnsonTechnical RecruiterDesk: 209-706-0814Concord Id: david.johnson@concorditsystems.com",
        "source": "Email",
        "date_posted": "2024-10-28 12:50:31-05:00",
        "unique_id": "192d460457bf64b9",
        "emp_type": [
            "third party"
        ],
        "tag": "Project Manager"
    }
]