[
    {
        "company": "Veridian",
        "job_title": "DevOps",
        "location": "New York, NY, USA",
        "full_location": {
            "city": "New York",
            "state": "NY",
            "country": "USA"
        },
        "job_details": {
            "employment_type": [
                "third party"
            ],
            "job_code": "",
            "experience_required": "Not specified",
            "degree_required": "Not specified",
            "visa_sponsorship": "Not specified",
            "notice_period": "Not specified",
            "duration": "Not specified",
            "rate": "Not specified"
        },
        "skills": {
            "core": [
                "C#",
                ".Net",
                "Docker",
                "Gitlab",
                "Kubernetes",
                "Helm Charts",
                "Containerization"
            ],
            "primary": [
                "CI/CD",
                "Build automation",
                "Development",
                "Testing",
                "Deployment"
            ],
            "secondary": [
                "Excellent written and oral communications skills",
                "Investigating issues",
                "Project tracking software",
                "Jira"
            ],
            "all": [
                "C#",
                ".Net",
                "Docker",
                "Gitlab",
                "Kubernetes",
                "Helm Charts",
                "Containerization",
                "CI/CD",
                "Build automation",
                "Development",
                "Testing",
                "Deployment",
                "Excellent written and oral communications skills",
                "Investigating issues",
                "Project tracking software",
                "Jira"
            ]
        },
        "job_type": [],
        "contact_person": "Madhavi",
        "email": "madhavi@veridiants.com",
        "jd": "From: madhavi, veridian madhavi@veridiants.com Reply to: madhavi@veridiants.com Good in development and DevOpsExperience with programming. Should be able to work on an existing code\u2022 C#, .Net, Docker, Gitlab, Kubernetes, Helm Charts, Containerization\u2022 End to end design ,development, testing and deployment of an app.\u2022 Build automation, CI/CD and DevOps.\u2022 A good balance of someone who can independently spear head implementations and a team member\u2022 Must be good with investigating an issue and responding to the customer\u2022 Excellent written and oral communications skills\u2022 Demonstrate ability to communicate to nontechnical audience on technical issues.\u2022 In-depth knowledge of programming for diverse operating systems and platforms using development tools\u2022 Proficiency with project tracking software, such as Jira\u2022 Experience working as part of a development team",
        "source": "Email",
        "date_posted": "2024-10-28 12:04:21-05:00",
        "unique_id": "192d435ff909d360",
        "emp_type": [
            "third party"
        ],
        "tag": ".net developer"
    }
]