[
    {
        "company": "KK Software Associates",
        "job_title": "Sr. Java Tech Lead & Sr. Java Developer",
        "location": "Austin, TX, USA",
        "full_location": {
            "city": "Austin",
            "state": "TX",
            "country": "USA"
        },
        "job_details": {
            "employment_type": [
                "contract",
                "third party"
            ],
            "job_code": "",
            "experience_required": "10 years",
            "degree_required": "Not specified",
            "visa_sponsorship": "Not specified",
            "notice_period": "Not specified",
            "duration": "Long-term",
            "rate": "Not specified"
        },
        "skills": {
            "core": [
                "Java",
                "J2EE",
                "Spring Framework",
                "Spring Data",
                "Spring Boot",
                "RESTful Services",
                "JUnit",
                "TestNG"
            ],
            "primary": [
                "Web Services",
                "REST API",
                "XML",
                "JSON",
                "HTTP",
                "SSL",
                "TCP/IP",
                "Caching solutions",
                "application performance tuning",
                "AWS"
            ],
            "secondary": [
                "Computer Science fundamentals",
                "data structures",
                "algorithms",
                "troubleshooting",
                "problem-solving",
                "Object Oriented concepts",
                "relational databases",
                "Oracle",
                "NoSQL"
            ],
            "all": [
                "Java",
                "J2EE",
                "Spring Framework",
                "Spring Data",
                "Spring Boot",
                "RESTful Services",
                "JUnit",
                "TestNG",
                "Web Services",
                "REST API",
                "XML",
                "JSON",
                "HTTP",
                "SSL",
                "TCP/IP",
                "Caching solutions",
                "application performance tuning",
                "AWS",
                "Computer Science fundamentals",
                "data structures",
                "algorithms",
                "troubleshooting",
                "problem-solving",
                "Object Oriented concepts",
                "relational databases",
                "Oracle",
                "NoSQL"
            ]
        },
        "job_type": [
            "onsite"
        ],
        "contact_person": "jayaprakash",
        "email": "jayaprakash.b@kksoftwareassociates.com",
        "jd": "From: jayaprakash, kksoftwareassociates.com jayaprakash.b@kksoftwareassociates.com Reply to: jayaprakash.b@kksoftwareassociates.com Title:Sr. Java Tech Lead & Sr. Java DeveloperLocation:Austin, TX - OnsiteDuration:Long-term Contract Job Description:Key Qualifications: \u2022 Minimum 10 years of experience in enterprise Java development \u2022 Strong foundation in Computer Science fundamentals such as data structures and algorithms \u2022 Hands-on programming experience with Java and J2EE, Java11 related technologies: Spring Framework, Spring Data, spring-boot, RESTful Services, JUnit/TestNG\u2022 Solid understanding of technologies such as Web Services, REST API, XML, JSON, HTTP, SSL, TCP/IP, Caching solutions, application performance tuning\u2022 Lead discussions and decisions regarding resolution of issues\u2022 Work collaboratively to contribute to achieving business outcomes\u2022 Excellent troubleshooting, problem-solving skills and the ability to design scalable, and maintainable software solutions.\u2022 Ability to communicate effectively-Self driven, have good communication skills, to take ownership on the project / deliverables\u2022 Experienced in delivering advanced solutions for a multi-tier, distributed web application with AWS knowledge and experience \u2022 Knowledge in the Object Oriented concepts, Java programming language, including understanding of its syntax, core libraries, and features\u2022 Experience in developing applications that utilize relational databases (e.g. Oracle) and other less structured data stores (NoSQL) \u2022 Have keen eye for quality and have great attitude towards work and ability to work collaboratively in a team environment",
        "source": "Email",
        "date_posted": "2024-10-28 12:49:06-05:00",
        "unique_id": "192d45ef817dc891",
        "emp_type": [
            "contract",
            "third party"
        ],
        "tag": "Java developer"
    }
]