[
    {
        "company": "Xforia",
        "job_title": "Pega SSA",
        "location": "Sunrise, FL, USA",
        "full_location": {
            "city": "Sunrise",
            "state": "FL",
            "country": "USA"
        },
        "job_details": {
            "employment_type": [
                "third party"
            ],
            "job_code": "",
            "experience_required": "10+ years",
            "degree_required": "Not specified",
            "visa_sponsorship": "Not specified",
            "notice_period": "Not specified",
            "duration": "Not specified",
            "rate": "Not specified"
        },
        "skills": {
            "core": [
                "Pega SSA Certification",
                "Smart Disputes",
                "Case Management",
                "Data Management",
                "Integration",
                "Agents/Job scheduler & processor",
                "Flows",
                "Functions",
                "UI rules",
                "Security",
                "Performance Optimization",
                "Debugging tools"
            ],
            "primary": [
                "Java/Coding experience"
            ],
            "secondary": [],
            "all": [
                "Pega SSA Certification",
                "Smart Disputes",
                "Case Management",
                "Data Management",
                "Integration",
                "Agents/Job scheduler & processor",
                "Flows",
                "Functions",
                "UI rules",
                "Security",
                "Performance Optimization",
                "Debugging tools",
                "Java/Coding experience"
            ]
        },
        "job_type": [
            "onsite"
        ],
        "contact_person": "Annu Joseph",
        "email": "annu.j@xforia.com",
        "jd": "From: Xforia, Xforia annu.j@xforia.com Reply to: annu.j@xforia.com Mandatory skills: Pega SSA Certification, Smart Disputes. Required Skills:10+ years experience with Pega SSA certification is mandatory. Should have extensive hands-on experience in the Pega concepts of: Case Management, Data Management, Integration, Agents/Job scheduler & processor, Flows, Functions, UI rules, Security, Performance Optimization and Debugging tools.Hands-on experience in Smart Disputes.Should have experience in providing scalable solutions.Ability to work with other interfacing teams for Designing and Solutioning Complex problems.Help other team members in the team wherever support is required.Java/Coding experience is an added value.",
        "source": "Email",
        "date_posted": "2024-10-28 15:14:59-05:00",
        "unique_id": "192d4fcfec1c71ee",
        "emp_type": [
            "third party"
        ],
        "tag": "PEGA Developer"
    }
]