[
    {
        "company": "Code Infotek",
        "job_title": "Senior Agile Delivery Lead",
        "location": "USA",
        "full_location": {
            "city": "Dallas",
            "state": "TX",
            "country": "USA"
        },
        "job_details": {
            "employment_type": [
                "third party"
            ],
            "job_code": "",
            "experience_required": "5-8+ years",
            "degree_required": "Not specified",
            "visa_sponsorship": "No visa sponsorship",
            "notice_period": "Not specified",
            "duration": "6+ Months",
            "rate": "Not specified"
        },
        "skills": {
            "core": [
                "Lean-Agile principles",
                "cloud-native systems",
                "MongoDB",
                "Tableau",
                "Python",
                "BI-Analytics",
                "Kanban",
                "Scrumban",
                "JIRA",
                "JIRA Align",
                "Confluence"
            ],
            "primary": [
                "coaching teams",
                "metrics",
                "KPI establishment"
            ],
            "secondary": [],
            "all": [
                "Lean-Agile principles",
                "cloud-native systems",
                "MongoDB",
                "Tableau",
                "Python",
                "BI-Analytics",
                "Kanban",
                "Scrumban",
                "JIRA",
                "JIRA Align",
                "Confluence",
                "coaching teams",
                "metrics",
                "KPI establishment"
            ]
        },
        "job_type": [
            "remote"
        ],
        "contact_person": "Gagan Deshwal",
        "email": "gagan@codeinfotek.com",
        "jd": "From: Gagan Deshwal, Code Infotek gagan@codeinfotek.com Reply to: gagan@codeinfotek.com Senior Agile Delivery Lead RemoteVisa- NO H1B AND CPT 6+ Mths DurationNeed LinkedIn currently seeking a Senior Agile Delivery Lead to join their team in Dallas, Texas (US-TX), United States (US).Job Description:Required Qualifications:5-8+ years of experience coaching Lean-Agile principles for development teams.Experience coaching teams developing cloud-native, scalable, and highly available distributed systems.Advanced knowledge of Lean-Agile practices, metrics, and KPIs.MongoDB, Tableau, Python, & BI-AnalyticsAdvanced knowledge of Kanban or Scrumban processes.Advanced ability and experience with tools such as JIRA, JIRA Align, Confluence, etc.Drive the creation of information radiators and promote metric establishment and visibility. Thanks & Regards...Gagan DeshwalTechnical RecruiterEmail: Gagan@codeinfotek.com",
        "source": "Email",
        "date_posted": "2024-10-28 13:36:28-05:00",
        "unique_id": "192d48a549be6b62",
        "emp_type": [
            "third party"
        ],
        "tag": "Scrum Master"
    }
]