[
    {
        "company": "Blue Ocean Ventures",
        "job_title": "Pega SSA",
        "location": "Sunrise, FL, USA",
        "full_location": {
            "city": "Sunrise",
            "state": "FL",
            "country": "USA"
        },
        "job_details": {
            "employment_type": [
                "contract",
                "third party"
            ],
            "experience_required": "9+ Years",
            "degree_required": "Not specified",
            "visa_sponsorship": "Not specified",
            "notice_period": "Not specified",
            "duration": "Not specified",
            "rate": "Not specified"
        },
        "skills": {
            "core": [
                "Pega SSA Certification",
                "Smart Disputes"
            ],
            "primary": [
                "Case Management",
                "Data Management",
                "Integration",
                "Agents/Job scheduler & processor",
                "Flows",
                "Functions",
                "UI rules",
                "Security",
                "Performance Optimization",
                "Debugging tools"
            ],
            "secondary": [
                "Java/Coding experience"
            ],
            "all": [
                "Pega SSA Certification",
                "Smart Disputes",
                "Case Management",
                "Data Management",
                "Integration",
                "Agents/Job scheduler & processor",
                "Flows",
                "Functions",
                "UI rules",
                "Security",
                "Performance Optimization",
                "Debugging tools",
                "Java/Coding experience"
            ],
            "with_experience": [
                "Pega SSA Certification",
                "Smart Disputes",
                "Case Management",
                "Data Management",
                "Integration",
                "Agents/Job scheduler & processor",
                "Flows",
                "Functions",
                "UI rules",
                "Security",
                "Performance Optimization",
                "Debugging tools"
            ]
        },
        "job_type": [
            "onsite"
        ],
        "contact_person": "Abhilash SH",
        "email": "abhilash.sh@blue-oceanventures.com",
        "jd": "From: Abhilash s h, Blue ocean ventures abhilash.sh@blue-oceanventures.com Reply to: abhilash.sh@blue-oceanventures.com Role: Pega SSA Location: Sunrise, FL (Locals only)Relevant Experience: 9+ Years Mandatory skills: Pega SSA Certification, Smart Disputes. Required Skills: 10+ years experience with Pega SSA certification is mandatory. Should have extensive hands-on experience in the Pega concepts of: Case Management, Data Management, Integration, Agents/Job scheduler & processor, Flows, Functions, UI rules, Security, Performance Optimization and Debugging tools.Hands on experience in Smart Disputes. Should have experience in providing scalable solutions.Ability to work with other interfacing teams for Designing and Solutioning Complex problems.Help other team members in the team wherever support is required.Java/Coding experience is an added value.Regards, Abhilash SHhttps://www.linkedin.com/in/abhilash-s-h-ab07a5231/Blue Ocean Ventures5555 Glenridge Connector Suite 200 Atlanta, GA 30342Email:Abhilash.sh@blue-oceanventures.comWill To Serve Will To Win Will To Lead",
        "source": "Email",
        "date_posted": "2024-10-28 13:41:29-05:00",
        "unique_id": "192d48eed502988d",
        "emp_type": [
            "contract",
            "third party"
        ],
        "tag": "PEGA Developer"
    }
]