[
    {
        "company": "VizonInc",
        "job_title": "Senior Cloud Developer",
        "location": "Atlanta, GA, USA",
        "full_location": {
            "city": "Atlanta",
            "state": "GA",
            "country": "USA"
        },
        "job_details": {
            "employment_type": [
                "full-time",
                "third party"
            ],
            "experience_required": "Not specified",
            "degree_required": "Degree in Information Systems, Computer Science or equivalent experience",
            "visa_sponsorship": "Not specified",
            "notice_period": "Not specified",
            "duration": "Permanent",
            "rate": "Not specified"
        },
        "skills": {
            "core": [
                "Cloud Technologies (AWS / Azure / Google)",
                "Python",
                "Java",
                "shell scripting (Bash and Poweshell)",
                "SQL"
            ],
            "primary": [
                "Kafka",
                "AWS Glue",
                "Aurora",
                "Data APIs",
                "Data extraction"
            ],
            "secondary": [
                "Docker",
                "Kubernetes",
                "OpenShift",
                "Redshift",
                "Business Intelligence/Analytics"
            ],
            "all": [
                "Cloud Technologies (AWS / Azure / Google)",
                "Python",
                "Java",
                "shell scripting (Bash and Poweshell)",
                "SQL",
                "Kafka",
                "AWS Glue",
                "Aurora",
                "Data APIs",
                "Data extraction",
                "Docker",
                "Kubernetes",
                "OpenShift",
                "Redshift",
                "Business Intelligence/Analytics",
                "Debugging & troubleshooting skills",
                "Continuous delivery",
                "Continuous integration (Jenkins, Ansible)"
            ]
        },
        "job_type": [
            "onsite",
            "hybrid"
        ],
        "contact_person": "Kuldeep Sharma",
        "email": "kuldeep@vizoninc.com",
        "jd": "From: Kuldeep Sharma, VizonInc kuldeep@vizoninc.com Reply to: kuldeep@vizoninc.com Job Description -Please read the job description and please pay attention to the bolded red . Make sure each candidate\u2019s top skill graph has been filled out. I want local candidates if possible but for this one will consider out of state candidates close to GA willing to relocate. Also you know make sure the candidates are sending the correct e-mail and not just a work related e-mail. Send me your top candidate and if they do not have all of the red do not send. Please share personal contact details!Please fill out the below with the candidate skills and send in addition to the bullets : Must have active LinkedIN & bullet points SkillsExperienceCloud Technologies AWSYears Kafka,YearsAWS Glue Years Aurora Years Develop data APIsYearsData extraction exp Years Additional Job Information:Title: Job Description -Please read the job description and please pay attention to the bolded red . Make sure each candidate\u2019s top skill graph has been filled out. I want local candidates if possible but for this one will consider out of state candidates close to GA willing to relocate. Also you know make sure the candidates are sending the correct e-mail and not just a work related e-mail. Send me your top candidate and if they do not have all of the red do not send. Please share personal contact details!Please fill out the below with the candidate skills and send in addition to the bullets : Must have active LinkedIN & bullet points SkillsExperienceCloud Technologies AWSYears Kafka,YearsAWS Glue Years Aurora Years Develop data APIsYearsData extraction exp Years Additional Job Information:Title: Senior Cloud DeveloperStart Date: 11/18/2024Location: Atlanta GA Onsite Flexibility: Hybrid 1 week on 1 week offsite Qualifications:**Verify Persona under EDUCATION / PERSONA section below.** WHAT YOU NEED TO SUCCEED (MINIMUM QUALIFICATIONS) \u2022 Good verbal and Written communication skills. \u2022 Experience working with multiple disparate systems. \u2022 Experience in Cloud Technologies (AWS / Azure / Google). AWS is preferred. \u2022 Proficiency with Python, Java, shell scripting (Bash and Poweshell) & SQL \u2022 Experience working with streaming data and data extraction from different databases (Oracle, DB2, MySQL etc) \u2022 Experienced with deploying and managing infrastructures based on Docker, Kubernetes, or OpenShift \u2022 Experience with scalable data extraction tools is a plus \u2022 Experience working with Kafka, Aurora, AWS Glue, Redshift is a plus \u2022 Understanding of data engineering, real time streaming and/or eventing, and json parsing \u2022 Experience with automating application deployment, continuous delivery, and continuous integration (Jenkins, Ansible etc.) \u2022 Experience building micro services and API architecture \u2022 Debugging & troubleshooting skills \u2022 Must be flexible and have a passion to learn and collaborate with colleagues \u2022 Must have strong oral and written communication skills \u2022 Business Intelligence/Analytics experience a plus \u2022 Embraces diverse people, thinking and styles. \u2022 Consistently makes safety and security, of self and others, the priority. WHAT WILL GIVE YOU A COMPETITIVE EDGE (PREFERRED QUALIFICATIONS) \u2022 Degree in Information Systems, Computer Science or equivalent experience \u2022 Airline Industry experience is a plus Responsibilities:\u2022 Develop solid and supportable modular designs for data streaming, Cloud transformation/migration, and API product development in support of critical applications\u2022 Develop data APIs and data delivery services that support operational and analytical applications for Delta\u2019s internal business operations, customers and partners\u2022 Creation and support of data-centric products that encompass multiple specializations, platforms, and technologies\u2022 Analyze technical information and produce quality software\u2022 Initiate collaboration with teammates\u2022 Offer creative solutions to overcome obstacles\u2022 Work within automated testing and CICD processes\u2022 Be an expert on the products we built\u2022 Document solutions in written and diagram form, and communicate across teams\u2022 Leverage developer coding standards to ensure it meets design goals and business needs\u2022 Identify technical issues, articulate impact and need for prioritization\u2022 Proactive communication to both team and leadership\u2022 Work collaboratively with vendor(s) andStart Date: 11/18/2024Location: Atlanta GA Onsite Flexibility: Hybrid 1 week on 1 week offsite Qualifications:**Verify Persona under EDUCATION / PERSONA section below.** WHAT YOU NEED TO SUCCEED (MINIMUM QUALIFICATIONS) \u2022 Good verbal and Written communication skills. \u2022 Experience working with multiple disparate systems. \u2022 Experience in Cloud Technologies (AWS / Azure / Google). AWS is preferred. \u2022 Proficiency with Python, Java, shell scripting (Bash and Poweshell) & SQL \u2022 Experience working with streaming data and data extraction from different databases (Oracle, DB2, MySQL etc) \u2022 Experienced with deploying and managing infrastructures based on Docker, Kubernetes, or OpenShift \u2022 Experience with scalable data extraction tools is a plus \u2022 Experience working with Kafka, Aurora, AWS Glue, Redshift is a plus \u2022 Understanding of data engineering, real time streaming and/or eventing, and json parsing \u2022 Experience with automating application deployment, continuous delivery, and continuous integration (Jenkins, Ansible etc.) \u2022 Experience building micro services and API architecture \u2022 Debugging & troubleshooting skills \u2022 Must be flexible and have a passion to learn and collaborate with colleagues \u2022 Must have strong oral and written communication skills \u2022 Business Intelligence/Analytics experience a plus \u2022 Embraces diverse people, thinking and styles. \u2022 Consistently makes safety and security, of self and others, the priority. WHAT WILL GIVE YOU A COMPETITIVE EDGE (PREFERRED QUALIFICATIONS) \u2022 Degree in Information Systems, Computer Science or equivalent experience \u2022 Airline Industry experience is a plus Responsibilities:\u2022 Develop solid and supportable modular designs for data streaming, Cloud transformation/migration, and API product development in support of critical applications\u2022 Develop data APIs and data delivery services that support operational and analytical applications for Delta\u2019s internal business operations, customers and partners\u2022 Creation and support of data-centric products that encompass multiple specializations, platforms, and technologies\u2022 Analyze technical information and produce quality software\u2022 Initiate collaboration with teammates\u2022 Offer creative solutions to overcome obstacles\u2022 Work within automated testing and CICD processes\u2022 Be an expert on the products we built\u2022 Document solutions in written and diagram form, and communicate across teams\u2022 Leverage developer coding standards to ensure it meets design goals and business needs\u2022 Identify technical issues, articulate impact and need for prioritization\u2022 Proactive communication to both team and leadership\u2022 Work collaboratively with vendor(s) and",
        "source": "Email",
        "date_posted": "2024-10-28 16:45:15-05:00",
        "unique_id": "192d5372b6b17009",
        "emp_type": [
            "full-time",
            "third party"
        ],
        "tag": "AWS Data Engineer"
    }
]