[
    {
        "company": "Tek Inspirations",
        "job_title": ".Net Architect",
        "location": "Columbus, OH, USA",
        "full_location": {
            "city": "Columbus",
            "state": "OH",
            "country": "USA"
        },
        "job_details": {
            "employment_type": [
                "full-time",
                "third party"
            ],
            "experience_required": "12+ years",
            "degree_required": "Not specified",
            "visa_sponsorship": "No visa sponsorship",
            "notice_period": "Not specified",
            "duration": "Not specified",
            "rate": "Not specified"
        },
        "skills": {
            "core": [
                ".NET Framework (4.7.2 and higher)",
                ".net core 2.2 and higher",
                "Visual Studio (2022/2019)",
                "SQL Server 2016",
                "Asp.net MVC 5",
                "MVC Core",
                "Entity Framework 6.2 including LINQ to SQL",
                "Entity framework core",
                "Kendo UI Controls for ASP.NET MVC",
                "Java Script",
                "jQuery",
                "CSS 3.0",
                "C# 7.0 and higher",
                "WCF/Web API",
                "Visual Studio Unit Testing",
                "Azure DevOps",
                "Git source code repository",
                "Azure App Service",
                "Azure blob storage"
            ],
            "primary": [],
            "secondary": [],
            "all": [
                ".NET Framework (4.7.2 and higher)",
                ".net core 2.2 and higher",
                "Visual Studio (2022/2019)",
                "SQL Server 2016",
                "Asp.net MVC 5",
                "MVC Core",
                "Entity Framework 6.2 including LINQ to SQL",
                "Entity framework core",
                "Kendo UI Controls for ASP.NET MVC",
                "Java Script",
                "jQuery",
                "CSS 3.0",
                "C# 7.0 and higher",
                "WCF/Web API",
                "Visual Studio Unit Testing",
                "Azure DevOps",
                "Git source code repository",
                "Azure App Service",
                "Azure blob storage"
            ]
        },
        "job_type": [
            "hybrid"
        ],
        "contact_person": "Ankit Kumar",
        "email": "ankit.k@tekinspirations.com",
        "jd": "Job Description -Role: .Net ArchitectLocation: Columbus, OH (hybrid) Need Local candidates Visa- NO opt/cpt/h1bNeed LinkedInNeed at least 12+ Years of profile Primary work objectives: MHAS is looking for a skilled IT Consultant to refactor an existing custom .net/C# Human Resources software suite hosted on Azure to meet the needs of our Agency and constituents. In addition to the attached technical proficiencies the selected candidate will demonstrate the ability to work directly with our Human Resource professionals, understand the basic terminology and business functions of HR, and have the ability to communicate verbally and in writing to the project sponsors. Prior experience with HR applications or processes is not mandatory but preferred. Having worked on an interface with Ohio\u2019s ERP (OAKS) is also advantageous. Mandatory skills: .NET Framework (4.7.2 and higher), .net core 2.2 and higher Visual Studio (2022/2019) SQL Server 2016 Asp.net MVC 5, MVC Core Entity Framework 6.2 including LINQ to SQL, Entity framework core Kendo UI Controls for ASP.NET MVC Java Script, jQuery and CSS 3.0 C# 7.0 and higher WCF/Web API Visual Studio Unit Testing Azure DevOps Build and release using DevOps pipelines Git source code repository ( 2 +) Azure App Service (2 years) Azure blob storage (< 1year) SkillRequired / DesiredAmountof Experience.NET Framework (4.7.2 and higher), .net core 2.2 and higheRequired5Years Visual Studio (2022/2019Required5YearsSQL Server 2015Required5Years Asp.net MVC 5, MVC CoreRequired5YearsEntity Framework 6.2 including LINQ to SQL, Entity framework coreRequired5YearsKendo UI Controls for ASP.NET MVCRequired5YearsJava Script, jQuery and CSS 3.0Required5Years C# 7.0 and higherRequired5YearsWCF/Web APIRequired5Years Visual Studio Unit TestingRequired5YearsAzure DevOpsRequired5Years Build and release using DevOps pipelineRequired5YearsAzure App ServiceRequired5Years Azure blob storageRequired5Years",
        "source": "Email",
        "date_posted": "2024-10-28 11:45:49-05:00",
        "unique_id": "192d425085bbca41",
        "emp_type": [
            "full-time",
            "third party"
        ],
        "tag": ".net developer"
    }
]