[
    {
        "company": "Sourcemantra",
        "job_title": "Java Backend Developer",
        "location": "Austin, TX, USA",
        "full_location": {
            "city": "Austin",
            "state": "TX",
            "country": "USA"
        },
        "job_details": {
            "employment_type": [
                "full-time",
                "third party"
            ],
            "experience_required": "7+ years",
            "degree_required": "Not specified",
            "visa_sponsorship": "Visa sponsorship available",
            "notice_period": "Not specified",
            "duration": "Not specified",
            "rate": "Not specified"
        },
        "skills": {
            "core": [
                "Java",
                "Spring MVC",
                "Spring Boot",
                "Spring Data",
                "Spring-Core",
                "Spring transactions",
                "REST",
                "SOAP",
                "JAX-WS",
                "JAX-RS",
                "SQL"
            ],
            "primary": [
                "J2EE",
                "JSP",
                "EJB",
                "servlets",
                "JNDI",
                "JDBC",
                "JMS",
                "JTA",
                "Log4J",
                "Unit Testing",
                "Oracle"
            ],
            "secondary": [
                "React",
                "Angular",
                "Node.js",
                "Agile",
                "JIRA",
                "Data Power",
                "Mule",
                "ESBs",
                "Profiling tools"
            ],
            "all": [
                "Java",
                "Spring MVC",
                "Spring Boot",
                "Spring Data",
                "Spring-Core",
                "Spring transactions",
                "REST",
                "SOAP",
                "JAX-WS",
                "JAX-RS",
                "SQL",
                "J2EE",
                "JSP",
                "EJB",
                "servlets",
                "JNDI",
                "JDBC",
                "JMS",
                "JTA",
                "Log4J",
                "Unit Testing",
                "Oracle",
                "React",
                "Angular",
                "Node.js",
                "Agile",
                "JIRA",
                "Data Power",
                "Mule",
                "ESBs",
                "Profiling tools"
            ]
        },
        "job_type": [
            "onsite"
        ],
        "contact_person": "Mallikarjuna",
        "email": "arjun@sourcemantra.com",
        "jd": "From: Mallikarjuna, Sourcemantra arjun@sourcemantra.com Reply to: arjun@sourcemantra.com Role Title: Java Backend Developer -F2F-locals -Austin, TX Location: Austin, TX - Onsite from day one(100% onsite )Interview mode: In-person interview at - Dallas, TX 75201/Austin, TX. Visa: USC , OPT, H4, L2 only (Only Locals ) Description:We are looking to hire a backend Java developer with 7+years of hands-on development experience. The developer will be working in a dynamic, fast-paced and mission-driven project, providing them an opportunity to further learn and enhance their skills while feel proud of the social mission they support. An eligible candidate must have the following skills:In-depth experience designing and working with n-tier architectures (UI, business logic layer, data access layer) as well as experience in distributed architectures using integration hubs such as Data Power, Mule or any ESBsStrong skills (Spring MVC, Spring Boot, Spring Data, Spring-Core, Spring transactions etc.,) on J2EE Framework and internals of the architecture, including JSP, EJB, servlets, JNDI, JDBC, JMS, JTA transaction services, logging (Log4J), thread management and development of asynchronous java processesExperience in developing REST and SOAP services using JAX-WS/RS and/or Spring framework.Experience in building multi-module projects, compiling, building, and packaging the source code into Jars, Wars & EARs and deploying them in Application Servers (WebSphere, Jboss etc.,)Experience in Writing Unit Test Cases with Jest, Enzyme or MochaDemonstrates hands-on experience with relational databases (such as Oracle or similar) and displays a good understanding of database principles/SQL beyond just data accessAbility to quickly learn new concepts and/or technologyMust have done hands-on development in most recent projects.Strong communication skills, both written and oral and ability to smoothly interact with development team leadership and clientsStrong analytical and problem-solving skillsCandidate should be self-motivated, independent, detail-oriented and a team player A strong candidate would also be able to demonstrate their competency in the following areas:Optimize SQL queries for performance including use of indexes, partitioning, and other techniques to improve the performance of queries.Write complex SQL queries including using joins, subqueries, and other techniques to create queries that extract the desired data from databases.Troubleshoot and debug SQL problems including using profiling tools to identify performance bottlenecks and using error messages to identify errors in queries.Frontend development experience \u2013 preference to candidates with React or Angular and Node.jsMentor junior staff and lead technical designsAbility to perform code reviews and recommend automated review tools for the projectAbility to collaborate with the product, engineering, and business teams to understand the requirements that will form the core foundation for all the future productsAbility to adapt quickly to an existing, complex environmentPassionate about building high-quality systems with software implementation best practicesProject experience in working with Agile processesKnowledge of SDLC processes and use of application lifecycle management tools such as JIRA, etc.",
        "source": "Email",
        "date_posted": "2024-10-28 11:41:27-05:00",
        "unique_id": "192d4210b593afcd",
        "emp_type": [
            "full-time",
            "third party"
        ],
        "tag": "Java developer"
    }
]