[
    {
        "company": "Aspire",
        "job_title": "Infrastructure Automation Engineer(HYBRID)",
        "location": "Washington, DC, USA",
        "full_location": {
            "city": "Washington",
            "state": "DC",
            "country": "USA"
        },
        "job_details": {
            "employment_type": [
                "full-time",
                "third party"
            ],
            "job_code": "",
            "experience_required": "10 years",
            "degree_required": "Bachelor's degree in science, Technology or Mathematics or Equivalent experience",
            "visa_sponsorship": "Not specified",
            "notice_period": "Not specified",
            "duration": "12 Months",
            "rate": "Not specified"
        },
        "skills": {
            "core": [
                "COTS IT Infrastructure Automation Solutions",
                "System Development Life Cycle (SDLC) Management",
                "Agile methodologies",
                "Project Management Professional (PMP) Certification",
                "Certified Scrum Master (CSM) Certification"
            ],
            "primary": [
                "Project Leadership",
                "Stakeholder Management",
                "Communication and Documentation",
                "Risk and Issue Management",
                "Technical Team Collaboration and Leadership",
                "Compliance and Standards Adherence",
                "Process Optimization and Continuous Improvement"
            ],
            "secondary": [
                "Microsoft Power Automate",
                "Project Manager experience with large project initiatives",
                "Experience with full system development lifecycle"
            ],
            "all": [
                "COTS IT Infrastructure Automation Solutions",
                "System Development Life Cycle (SDLC) Management",
                "Agile methodologies",
                "Project Management Professional (PMP) Certification",
                "Certified Scrum Master (CSM) Certification",
                "Project Leadership",
                "Stakeholder Management",
                "Communication and Documentation",
                "Risk and Issue Management",
                "Technical Team Collaboration and Leadership",
                "Compliance and Standards Adherence",
                "Process Optimization and Continuous Improvement",
                "Microsoft Power Automate",
                "Project Manager experience with large project initiatives",
                "Experience with full system development lifecycle"
            ]
        },
        "job_type": [
            "hybrid"
        ],
        "contact_person": "ATI Team",
        "email": "recruiterpro@aspiretechus.com",
        "jd": "From: ATI Team, Aspire recruiterpro@aspiretechus.com Reply to: recruiterpro@aspiretechus.com POSITION: :Infrastructure Automation Engineer(HYBRID) Min 10yrs Exp (Locals to DMV Area)DURATION:12 MonthsADDRESS:Washington DC 20004Q003 - IAE*40 Hrs per week, hybrid role - must be willing to come on-site at least 1x every 2 weeks although schedule is subject to change*Responsibilities\u200b1.\u200b COTS IT Infrastructure Automation Solutions Implementation:\u200bLead the implementation of Commercial off-the-Shelf (COTS) IT infrastructure automations solutions, ensuring they meet project requirements and deliver business value. \u200bManage vendor coordination to ensure seamless integration and alignment with project goals.\u200b2.\u200b System Development Life Cycle (SDLC) Management:\u200bBuilding one-click, self-service infrastructure and data resource provisioning and decommissioning solutions and dashboards.\u200b\u200bOversee all phases of the SDLC, including planning, design, development, testing, deployment, and maintenance, with a strong focus on automation and process optimization.\u200b\u200bDevelop and maintain comprehensive project plans, resource allocations, and timelines, ensuring adherence to best practices and the Agile framework.\u200b3.\u200b Project Leadership:\u200b\u200bLead the planning, execution, and successful delivery of hybrid cloud projects, ensuring alignment with strategic objectives and on-time completion.\u200b\u200bUtilize Agile methodologies to manage project scope, objectives, and deliverables, coordinating cross-functional teams to ensure project success.\u200b4.\u200b Stakeholder Management:\u200b\u200bEngage with internal and external stakeholders to align project goals, manage expectations, and ensure clear, consistent communication of progress, risks, and issues.\u200b\u200bLead regular updates, sprint planning, and retrospectives to keep stakeholders informed and ensure their involvement throughout the project lifecycle.\u200b5.\u200b Communication and Documentation:\u200b\u200bEstablish and implement effective communication plans, facilitating collaboration across global teams and ensuring stakeholders are well-informed.\u200b\u200bDocument project activities, decisions, risks, and issues, ensuring accurate and timely updates are available for project teams and stakeholders.\u200b6. \u200bRisk and Issue Management:\u200b\u200bIdentify, assess, and manage project risks and issues, employing proactive strategies to mitigate potential impacts.\u200b\u200bResolve technical challenges by leveraging automation tools such as Microsoft Power Automate, reducing manual effort, and enhancing operational efficiency.\u200b7.\u200bTechnical Team Collaboration and Leadership:\u200b\u200bLead a team, including engineering, quality assurance, and infrastructure, providing clear guidance and support to ensure successful project delivery.\u200b\u200bFoster a collaborative environment, to encourage innovation, efficiency, and effectiveness.\u200b8.\u200b Compliance and Standards Adherence:\u200b\u200bEnsure all projects comply with established governance frameworks, including Capability Maturity Model (CMM) Level 3 standards, and adhere to industry best practices.\u200b\u200bDrive compliance efforts, including managing critical projects with regulatory bodies, to safeguard against potential business risks.\u200b9. \u200bProcess Optimization and Continuous Improvement:\u200b\u200bImplement process optimization strategies, such as enhancing workflows and automating processes, to drive operational efficiency and cost savings.\u200b\u200bStay current with industry trends and advancements, integrating relevant innovations into project practices to continuously improve project outcomes.Qualifications:Managing the full system development lifecycle from inception through deployment and the support of maintenance activities experience (Ten (10) years).Project Manager leading large project initiatives experience (Eight (8) years).Agile /Hybrid methodology experience (Eight (8) years).Ability to work independently.Project Management Professional (PMP) CertificationCertified Scrum Master (CSM) CertificationEducation: A bachelor\u2019s degree in science, Technology or Mathematics or Equivalent experience and certifications such as Project ManagementProfessional, certified Scrum Master, Professional Scrum Master in the field of Computer and IT TechnologyRequired/Desired SkillsExperience with full system development lifecycleProject Manager experience with large project initiativesAgile/Hybrid methodology experiencePMP or CSM certificationBachelor's degree in STEM related field",
        "source": "Email",
        "date_posted": "2024-10-28 15:19:13-05:00",
        "unique_id": "192d505a956a9eb8",
        "emp_type": [
            "full-time",
            "third party"
        ],
        "tag": "Project Manager"
    }
]