[
    {
        "company": "Datum Technologies Group",
        "job_title": ".Net Developer with AWS",
        "location": "Atlanta, GA, USA",
        "full_location": {
            "city": "Atlanta",
            "state": "GA",
            "country": "USA"
        },
        "job_details": {
            "employment_type": [
                "full-time",
                "third party"
            ],
            "experience_required": "10+ years",
            "degree_required": "Not specified",
            "visa_sponsorship": "Not specified",
            "notice_period": "Not specified",
            "duration": "Long Term",
            "rate": "Not specified"
        },
        "skills": {
            "core": [
                ".Net",
                "AWS",
                "API",
                "Microservices",
                "Java"
            ],
            "primary": [
                "Node.js",
                "Python",
                "Golang",
                "GIT",
                "Hibernate",
                "Apache",
                "Tomcat",
                "Oracle",
                "UML",
                "JUnit",
                "Mockito",
                "Wire Mock",
                "REST APIs",
                "Responsive Design",
                "Bootstrap",
                "Foundation",
                "Unit Testing Frameworks"
            ],
            "secondary": [
                "MVC",
                "Singleton",
                "Facade",
                "Factory",
                "OOD",
                "Design Patterns",
                "Cloudwatch",
                "DynamoDB",
                "S3",
                "API Gateway",
                "OAuth",
                "JWT",
                "Spring Security",
                "MVVM",
                "Database Design",
                "Multi-tier Architecture",
                "Rational/Visio modeling"
            ],
            "all": [
                ".Net",
                "AWS",
                "API",
                "Microservices",
                "Java",
                "Node.js",
                "Python",
                "Golang",
                "GIT",
                "Hibernate",
                "Apache",
                "Tomcat",
                "Oracle",
                "UML",
                "JUnit",
                "Mockito",
                "Wire Mock",
                "REST APIs",
                "Responsive Design",
                "Bootstrap",
                "Foundation",
                "Unit Testing Frameworks",
                "MVC",
                "Singleton",
                "Facade",
                "Factory",
                "OOD",
                "Design Patterns",
                "Cloudwatch",
                "DynamoDB",
                "S3",
                "API Gateway",
                "OAuth",
                "JWT",
                "Spring Security",
                "MVVM",
                "Database Design",
                "Multi-tier Architecture",
                "Rational/Visio modeling"
            ],
            "with_experience": [
                ".Net",
                "AWS",
                "API",
                "Microservices",
                "Java",
                "Node.js",
                "GIT",
                "Hibernate",
                "Apache",
                "Tomcat",
                "Oracle",
                "UML",
                "JUnit",
                "Mockito",
                "Wire Mock",
                "REST APIs",
                "Responsive Design",
                "Bootstrap",
                "Foundation",
                "Unit Testing Frameworks"
            ]
        },
        "job_type": [
            "hybrid"
        ],
        "contact_person": "Abhishek Pandey",
        "email": "abhishekp@datumtg.com",
        "jd": "From: Abhishek Pandey, Datum Technologies Group abhishekp@datumtg.com Reply to: abhishekp@datumtg.com Role: .Net with AWSLocation: Atlanta, GADuration: Long TermInterview Mode: ASAP In-PersonShare only Local Profiles Top Skills.net and AWS, API. Hybrid Schedule and in person interview\u2022 10+ years of overall Experience in software development- Extensive experience implementing API's (REST) via microservices in Java / Node Js ( Required)\u2022 3+ years of experience AWS - Lamda, DynamoDB, S3, API Gateway, Cloudwatch ( Required)\u2022 Experience using various design patterns preferably MVC, Singleton, Facade and Factory - Proficient in OOD and Implementation, Design Patterns\u2022 Experience in other Backend programming languages like Python, Node.js, Golang, is a plus\u2022 Mut have experience working in GIT, Hibernate, Apache, Tomcat, Oracle, UML, JUnit, Mockito, Wire Mock , and REST APIs\u2022 Solid understanding of web/mobile application architecture and security (OAuth, JWT, Spring Security)\u2022 Hands-on UI development experience utilizing Responsive Design\u2022 Proficient in Bootstrap or Foundation frameworks\u2022 2 + years' experience with unit testing frameworks (e.g., Jasmine, Protractor)\u2022 Proficient in OOD and Implementation, Design Patterns (MVVM etc.)\u2022 Must have diverse experience utilizing Java tools in business, Web and client-server environments including Java Platform, J2EE, JDBC technologies and Apigee gateway platform\u2022 Experience or exposure to Database Design and Implementation\u2022 Knowledge of Multi-tier Architecture, Rational/Visio modeling",
        "source": "Email",
        "date_posted": "2024-10-28 13:27:53-05:00",
        "unique_id": "192d4827b7f92a3c",
        "emp_type": [
            "full-time",
            "third party"
        ],
        "tag": ".net developer"
    }
]