[
    {
        "company": "Gacsol",
        "job_title": "Snowflake Data Engineer",
        "location": "Alpharetta, GA, USA",
        "full_location": {
            "city": "Alpharetta",
            "state": "GA",
            "country": "USA"
        },
        "job_details": {
            "employment_type": [
                "full-time",
                "third party"
            ],
            "experience_required": "12+ years",
            "degree_required": "Not specified",
            "visa_sponsorship": "Not specified",
            "notice_period": "Not specified",
            "duration": "Not specified",
            "rate": "Not specified"
        },
        "skills": {
            "core": [
                "Snowflake",
                "Hadoop",
                "Python",
                "data integration",
                "performance tuning"
            ],
            "primary": [
                "data warehouse",
                "scripting",
                "troubleshooting",
                "communication",
                "presentation"
            ],
            "secondary": [
                "Spark",
                "problem solving",
                "design"
            ],
            "all": [
                "Snowflake",
                "Hadoop",
                "Python",
                "data integration",
                "performance tuning",
                "data warehouse",
                "scripting",
                "troubleshooting",
                "communication",
                "presentation",
                "Spark",
                "problem solving",
                "design"
            ]
        },
        "job_type": [
            "hybrid"
        ],
        "contact_person": "Barla Santosh",
        "email": "sbarla@gacsol.com",
        "jd": "From: Barla Santosh, Gacsol sbarla@gacsol.com Reply to: sbarla@gacsol.com Title : Snowflake Data EngineerLocation: ALPHARETTA GA (Hybrid)Exp ; 12+ yearsResponsibilities:Experience in data integration activities including architecting, designing, coding, and testing phasesArchitect the data warehouse and provide guidance to the team in implementation using Snowflake or Hadoop or other big data technologiesGood scripting knowledge techniques using PythonExperience in performance tuning of the snow pipelines and should be able to trouble shoot the issueShould be able to demonstrate the proposed solution, with excellent communication and presentation skill Qualifications:Minimum 3+ years of experience in designing and implementing a fully operational solution on Snowflake Data Warehouse or HadoopExperience with Python and a major relational database.Should be having good presentation and communication skills, both written and verbal Ability to problem solve and able to convert the requirements to designWork Experience on optimizing the performance of the Spark jobs Thanks,Barla SantoshTechnical RecruiterE: Sbarla@gacsol.com www.gacsol.com\u2018Experts in Digitalization and Engineering - Enterprise 4.0\u2019",
        "source": "Email",
        "date_posted": "2024-10-28 15:11:37-05:00",
        "unique_id": "192d4e17062603a9",
        "emp_type": [
            "full-time",
            "third party"
        ],
        "tag": "AWS Data Engineer"
    }
]