[
    {
        "company": "KPG Technologies",
        "job_title": "Business System Analyst",
        "location": "Phoenix, AZ, USA",
        "full_location": {
            "city": "Phoenix",
            "state": "AZ",
            "country": "USA"
        },
        "job_details": {
            "employment_type": [
                "contract",
                "third party"
            ],
            "job_code": "",
            "experience_required": "Not specified",
            "degree_required": "Bachelor\u2019s degree in computer science, Information Systems, or a related field.",
            "visa_sponsorship": "No visa sponsorship",
            "notice_period": "Not specified",
            "duration": "6+ months contract",
            "rate": "Not specified"
        },
        "skills": {
            "core": [
                "Business System Analyst",
                "Postman",
                "MongoDB",
                "automation tools",
                "system monitoring tools"
            ],
            "primary": [
                "creating mock-ups",
                "testing complex workflows",
                "review and execute tests",
                "collaborate with stakeholders",
                "analyze complex business requirements"
            ],
            "secondary": [
                "experience in the airline industry",
                "Mezmo",
                "Dynatrace",
                "ADO",
                "Lens"
            ],
            "all": [
                "Business System Analyst",
                "Postman",
                "MongoDB",
                "automation tools",
                "system monitoring tools",
                "creating mock-ups",
                "testing complex workflows",
                "review and execute tests",
                "collaborate with stakeholders",
                "analyze complex business requirements",
                "experience in the airline industry",
                "Mezmo",
                "Dynatrace",
                "ADO",
                "Lens"
            ]
        },
        "job_type": [
            "hybrid"
        ],
        "contact_person": "Manmeet Singh",
        "email": "manmeet@kpgtech.com",
        "jd": "From: Manmeet Singh, kpg99 manmeet@kpgtech.com Reply to: manmeet@kpgtech.com Hello, Job Title: Business System Analyst Job Location: Hybrid Phoenix AzDuration: 6+ months contract Visa: USC or GC only Job DescriptionInterview: There will be 2 rounds of interviews - 1st will be video, 2nd will be onsite in Tempe (Candidates are required to interview onsite for the 2nd round and there will be no exceptions to this expectation.) CALL NOTES:Must Haves:Bachelor\u2019s degree in computer science, Information Systems, or a related field.Proven experience as a Business System Analyst or similar role.Proficiency with Postman and MongoDB.Experience in creating mock-ups and testing complex workflows.Familiarity with automation tools and frameworks, with the ability to review and execute tests.Experience with system monitoring tools such as Mezmo, Dynatrace, ADO, and Lens. Key Responsibilities:Collaborate with stakeholders to gather and analyse complex business requirements and rules.Utilize Postman for API testing.Query MongoDB databases to extract and analyse data.Create detailed mock-ups and wireframes to communicate design concepts.Test complex workflows and identify areas for improvement.Review and execute automation tests, collaborating with QA engineers to ensure quality.Develop clear, detailed, and precise user stories with well-defined acceptance criteria.Ask questions and seek clarifications to fully understand complex business rules and processes.Monitor and analyse system performance by reading logs using tools such as Mezmo, Dynatrace, ADO, and Lens.Multitask and manage multiple projects simultaneously, ensuring timely delivery of high-quality work. Preferred Qualifications:Experience in the airline industry. Thanks and Regards,Manmeet Singh",
        "source": "Email",
        "date_posted": "2024-10-28 16:00:58-05:00",
        "unique_id": "192d50e9c7f4b250",
        "emp_type": [
            "contract",
            "third party"
        ],
        "tag": "Business Analyst"
    }
]