[
    {
        "company": "Vkore",
        "job_title": "Lead Databricks Engineer",
        "location": "New York, NY, USA",
        "full_location": {
            "city": "New York",
            "state": "NY",
            "country": "USA"
        },
        "job_details": {
            "employment_type": [
                "third party"
            ],
            "job_code": "",
            "experience_required": "5+ years",
            "degree_required": "Bachelor's degree in Computer Science, Engineering, or related field, or equivalent work experience",
            "visa_sponsorship": "Not specified",
            "notice_period": "Not specified",
            "duration": "Not specified",
            "rate": "Not specified"
        },
        "skills": {
            "core": [
                "Databricks",
                "Spark",
                "SQL",
                "Python",
                "Pyspark"
            ],
            "primary": [
                "Azure Databricks Medallion Architecture",
                "Data Integration",
                "ETL tools",
                "Azure Data Factory",
                "Data Warehouse",
                "Data Lake"
            ],
            "secondary": [
                "Kafka",
                "Hadoop",
                "Hive",
                "Data Governance",
                "Data Security"
            ],
            "all": [
                "Databricks",
                "Spark",
                "SQL",
                "Python",
                "Pyspark",
                "Azure Databricks Medallion Architecture",
                "Data Integration",
                "ETL tools",
                "Azure Data Factory",
                "Data Warehouse",
                "Data Lake",
                "Kafka",
                "Hadoop",
                "Hive",
                "Data Governance",
                "Data Security"
            ],
            "with_experience": [
                "Databricks (5+ years)",
                "Spark (5+ years)",
                "SQL (5+ years)",
                "Pyspark (5+ years)"
            ]
        },
        "job_type": [],
        "contact_person": "Sonu",
        "email": "sonu@vkoresolutions.com",
        "jd": "From: Sonu, Vkore sonu@vkoresolutions.com Reply to: sonu@vkoresolutions.com Hi, Please find the job description below: Job Title: Lead Databricks EngineerLocation: Ny/NJMust: preferred local candidates ResponsibilitiesDesign, develop, and maintain data pipelines using Databricks and Spark, and other cloud technologies as neededOptimize data pipelines for performance, scalability, and reliabilityEnsure data quality and integrity throughout the data lifecycleCollaborate with data scientists, analysts, and other stakeholders to understand and meet their data needsTroubleshoot and resolve data-related issues, and provide root cause analysis and recommendationsDocument data pipeline specifications, requirements, and enhancements, and communicate them effectively to the team and managementCreate new data validation methods and data analysis tools, and share best practices and learnings with the data engineering communityImplement ETL processes and data warehouse solutions, and ensure compliance with data governance and security policies Qualifications Bachelor's degree in Computer Science, Engineering, or related field, or equivalent work experience 5+ years of experience in data engineering with Databricks and Spark Proficient in SQL and Python and Pyspark Experience with Azure Databricks Medallion Architecture with DLT, Iceberg Financial/Corporate Banking context would be a plus Experience with data integration and ETL tools, such as Azure Data Factory Experience with Azure cloud platform and services Experience with data warehouse and data lake concepts and architectures Good to have experience with big data technologies, such as Kafka, Hadoop, Hive, etc Strong analytical and problem-solving skills Excellent communication and teamwork skills Requirements: Strong knowledge on data bricks architecture and tools.Have experience of task and wf jobs creations in data bricks.Deep understanding of distributed computing and how to use spark for data processing.SQL and Pyspark - strong command over querying databases and proficiency in Pyspark.Cloud platform: Preferred Azure for data bricks deployment.",
        "source": "Email",
        "date_posted": "2024-10-28 14:07:13-05:00",
        "unique_id": "192d4a67d9c2e0d5",
        "emp_type": [
            "third party"
        ],
        "tag": "Azure Data Engineer"
    }
]