[
    {
        "company": "Vyze Inc",
        "job_title": "Java Programmer",
        "location": "Weehawken, NJ, USA",
        "full_location": {
            "city": "Weehawken",
            "state": "NJ",
            "country": "USA"
        },
        "job_details": {
            "employment_type": [
                "onsite",
                "third party"
            ],
            "job_code": "",
            "experience_required": "Not specified",
            "degree_required": "BS in computer science or engineering degree or a related field or equivalent work experience required.",
            "visa_sponsorship": "Not specified",
            "notice_period": "Not specified",
            "duration": "6+ months",
            "rate": "Not specified"
        },
        "skills": {
            "core": [
                "Java",
                "TSQL",
                "ETL"
            ],
            "primary": [
                "Requirement Analysis",
                "Strategic Analysis",
                "Software Development Fundamentals",
                "Design",
                "Development",
                "Maintenance",
                "Testing",
                "Implementation"
            ],
            "secondary": [
                "Banking Finance domain knowledge",
                "Shell scripting"
            ],
            "all": [
                "Java",
                "TSQL",
                "ETL",
                "Requirement Analysis",
                "Strategic Analysis",
                "Software Development Fundamentals",
                "Design",
                "Development",
                "Maintenance",
                "Testing",
                "Implementation",
                "Banking Finance domain knowledge",
                "Shell scripting"
            ]
        },
        "job_type": [
            "onsite"
        ],
        "contact_person": "Vivek",
        "email": "vkumar@vyzeinc.com",
        "jd": "From: vivek, vyzeinc vkumar@vyzeinc.com Reply to: vkumar@vyzeinc.com Job Description -Title: Java Programmer with good knowledge on TSQL (Sybase/MSSQL)Duration: 6+ monthsLocation: Weehawken, NJ| Onsite |Need Local only MOI: Skype Need LinkedIn, VISA, DL also should be able to answer technical questions, as PV will ask questions. Need Banking Finance domain candidate. only best 3 profiles needed.Key Skills:\u2022 BS in computer science or engineering degree or a related field or equivalent work experience required.\u2022 Experience in Requirement Analysis, Strategic Analysis, Software Development Fundamentals, Design, Development, Maintenance, Testing and Implementation of efficient data flow and batch processes in applications.\u2022 Experience in JAVA programming with good knowledge on TSQL programming.\u2022 Good understanding of red MSSQ;.\u2022 Strong knowledge of Extraction Transformation and Loading lation transactional databases like Sybase an(ETL) processes using TSQL with Java/Shell scripting.",
        "source": "Email",
        "date_posted": "2024-10-28 10:07:53-05:00",
        "unique_id": "192d3cb5eb6959e1",
        "emp_type": [
            "onsite",
            "third party"
        ],
        "tag": "Java developer"
    }
]