[
    {
        "company": "INNOZA TECH LLC",
        "job_title": "Java Fullstack Transformation Lead",
        "location": "Raleigh, NC, USA",
        "full_location": {
            "city": "Raleigh",
            "state": "NC",
            "country": "USA"
        },
        "job_details": {
            "employment_type": [
                "contract",
                "third party"
            ],
            "job_code": "746396",
            "experience_required": "10+ years",
            "degree_required": "Not specified",
            "visa_sponsorship": "Not specified",
            "notice_period": "Not specified",
            "duration": "12 Months",
            "rate": "Not specified"
        },
        "skills": {
            "core": [
                "Java",
                "Angular",
                "Spring Framework",
                "REST API",
                "JEE"
            ],
            "primary": [
                "JUnit4",
                "HTML",
                "XML",
                "JSON",
                "JavaScript",
                "CSS",
                "Gradle",
                "AWS Cloud",
                "GitHub",
                "Web Services"
            ],
            "secondary": [
                "WebSphere",
                "Tomcat",
                "Oracle",
                "DB2",
                "MS SQL Server",
                "Agile methodology",
                "IBM ODM",
                "IBM Integration Bus",
                "IBM MQ",
                "JPA",
                "Hibernate",
                "MyBatis",
                "SOAP",
                "ETL Concepts",
                "client-server application architecture",
                "telecommunications"
            ],
            "all": [
                "Java",
                "Angular",
                "Spring Framework",
                "REST API",
                "JEE",
                "JUnit4",
                "HTML",
                "XML",
                "JSON",
                "JavaScript",
                "CSS",
                "Gradle",
                "AWS Cloud",
                "GitHub",
                "Web Services",
                "WebSphere",
                "Tomcat",
                "Oracle",
                "DB2",
                "MS SQL Server",
                "Agile methodology",
                "IBM ODM",
                "IBM Integration Bus",
                "IBM MQ",
                "JPA",
                "Hibernate",
                "MyBatis",
                "SOAP",
                "ETL Concepts",
                "client-server application architecture",
                "telecommunications"
            ],
            "with_experience": [
                "Java (10+ years)",
                "Angular",
                "Spring Framework",
                "REST API",
                "JEE"
            ]
        },
        "job_type": [
            "onsite"
        ],
        "contact_person": "Nagajyoti",
        "email": "njyoti@innozatech.com",
        "jd": "From: Nagajyoti, INNOZA TECH LLC. njyoti@innozatech.com Reply to: njyoti@innozatech.com Position: Java Fullstack Transformation Lead (746396) Location: Raleigh NCDuration: 12 MonthsClient: NC-DHHSNeed 10+ years candidateNeed Local CandidateNNC Department of Health and Human Services is seeking a Technical fullstack Lead for managing the Transformation and Upgrades to Encounter Processing System.This full stack developer is to serve as an application developer for the NCDHHS in the design, development, maintenance of Web Portal with Angular JEE based applications. Practical experience in building enterprise applications is required. Must have extensive experience in Angular framework in Spring Framework, JUnit4, HTML, XML, JSON, JavaScript, CSS and Gradle is required. Experience in Web Services (REST, SOAP) development is required. Must have back-end REST API development experience. Must have implemented SAML SSO using React and REST API. Must have AWS Cloud experience. Must have GitHub experience.Should have experience using one or more application servers like WebSphere, Tomcat. Good understanding of enterprise architectural patterns including JEEdesign patterns is required. Good understanding of relational databaseconcepts, specifically Oracle, and software development life cycle is required.Experience in MMIS subsystems is preferred. Individual in this Position isresponsible for the design, development and maintenance of mission criticalapplications. This position involves working with the project manager, projectmanagement staff, other members of the project team, and stakeholders.Exhaustive Working knowledge of:Design, develop and maintain web-based solutions using common standards and frameworks such as Angular, React.js, Spring Boot, JAXB, JAX-WS, JAX-RS, JPA,Java EE, Spring framework, Hibernate and MyBatis. Creation and validation ofSOAP and REST based clients and web services are desired. Excellent knowledge of web client-side technologies (HTML, JavaScript, and CSS), Java development and build tools is required. Experience in using application servers like WebSphere, Tomcat is a must. Strong understanding of relational database concepts and experience interfacing with and working with databases like Oracle, DB2 and/or MS SQL Server is required. Strong debugging and problem-solving skills and Knowledge of enterprise architectural patterns including JEE design patterns is required. and flowcharts. Cloud deployment is a plus.SkillShould have the capability to translate business requirements into technical solutionsDemonstrated proficiency working with databases - Oracle and TOAD for Oracle.Strong debugging and problem-solving skills and Knowledge of enterprise architectural patterns including JEE design patternsExperience in development of JEE design patterns , XML parsingExperience in Java/J2EE, Sprint BootExperience in IBM ODM; IBM Integration Bus, IBM MQ ,any rules engineExperience in IBM SOA, WebSphere Application ServerExcellent verbal and written communication skills with the ability present to both technical and business audiences.Experience in the transition and transformation of large complex software solutions.Experience participating or leading projects using an Agile methodology.Understanding of Medicaid SystemsExpert in REST API and Web ServicesExperience in Spring Framework, JUnit4, HTML, XML, JSON, JavaScript, CSS and GradleExperience with Basic understanding of database maintenance, ETL Concepts, client-server application architecture, telecommunicationsExperience with cloud deployment ; security model;Experience with new Version of AngularExperience with GITHUB",
        "source": "Email",
        "date_posted": "2024-10-28 09:05:55-05:00",
        "unique_id": "192d392a5c66c986",
        "emp_type": [
            "contract",
            "third party"
        ],
        "tag": "Java developer"
    }
]