[
    {
        "company": "Code Infotek Inc",
        "job_title": ".NET Developer with React",
        "location": "Denver, CO, USA",
        "full_location": {
            "city": "Denver",
            "state": "CO",
            "country": "USA"
        },
        "job_details": {
            "employment_type": [
                "third party"
            ],
            "job_code": "",
            "experience_required": "10+ Years",
            "degree_required": "Not specified",
            "visa_sponsorship": "Not specified",
            "notice_period": "Not specified",
            "duration": "Not specified",
            "rate": "Negotiable based on experience"
        },
        "skills": {
            "core": [
                ".NET Core",
                "React",
                "APIs",
                "Azure"
            ],
            "primary": [
                "C#",
                "SQL",
                "Test Driven Development"
            ],
            "secondary": [
                "Cloud",
                "Willingness to learn"
            ],
            "all": [
                ".NET Core",
                "React",
                "APIs",
                "Azure",
                "C#",
                "SQL",
                "Test Driven Development",
                "Cloud",
                "Willingness to learn"
            ],
            "with_experience": [
                ".NET Core",
                "React",
                "APIs",
                "Azure"
            ]
        },
        "job_type": [
            "hybrid"
        ],
        "contact_person": "Rohit Yadav",
        "email": "rohit@codeinfotek.com",
        "jd": "From: Rohit Yadav, Code Infotek Inc rohit@codeinfotek.com Reply to: rohit@codeinfotek.com .NET Developer with ReactHybrid role in Denver, CO (Lone Tree, CO)-Locals are nearby candidates highly preferred GC and USC10+ Years of experience Ideally looking for applicants with a solid background in .NET Core, React, APIs, and Azure. The rate may be negotiable based on experience, education, geographic location, and other factors. ABOUT THE ROLE:This is an application meant to help with the Commodity Management project. They are streamlining/modernizing how they track tickets for when materials are purchased for a construction project. Standard Tech stack:C#/.NET Core 8ReactSQLAPI \u2013 experience working with them, but it doesn\u2019t sound like they will have to develop any as they have their own as well as the vendor APIsCloud/Azure experienceTest Driven Development experience - If no experience, must be willing and excited to learn this and work in this environment. Thanks & Regards...Rohit Yadav !! Code Infotek IncTechnical Recruiter 11350 Random Hills Rd. Suite 800 Fairfax, VA 22030Web: www.codeinfotek.com",
        "source": "Email",
        "date_posted": "2024-10-28 10:04:15-05:00",
        "unique_id": "192d3c814e293a45",
        "emp_type": [
            "third party"
        ],
        "tag": ".net developer"
    }
]