[
    {
        "company": "Pivotal Technologies, Inc",
        "job_title": "Full Stack Developer with JAVA/AWS/REACT",
        "location": "Baltimore, MD, USA",
        "full_location": {
            "city": "Baltimore",
            "state": "MD",
            "country": "USA"
        },
        "job_details": {
            "employment_type": [
                "contract",
                "third party"
            ],
            "job_code": "",
            "experience_required": "Minimum 9 years",
            "degree_required": "Not specified",
            "visa_sponsorship": "No visa sponsorship",
            "notice_period": "Not specified",
            "duration": "6 months+",
            "rate": "Not specified"
        },
        "skills": {
            "core": [
                "Java",
                "AWS",
                "SQL",
                "React JS"
            ],
            "primary": [
                "Python",
                "Microservices",
                "GitLab CI",
                "Containerized applications",
                "Database technologies"
            ],
            "secondary": [
                "Good communication skills",
                "Debugging",
                "Understanding complex workflow",
                "Async design",
                "Data migration",
                "Application enhancements"
            ],
            "all": [
                "Java",
                "AWS",
                "SQL",
                "React JS",
                "Python",
                "Microservices",
                "GitLab CI",
                "Containerized applications",
                "Database technologies",
                "Good communication skills",
                "Debugging",
                "Understanding complex workflow",
                "Async design",
                "Data migration",
                "Application enhancements"
            ]
        },
        "job_type": [
            "onsite"
        ],
        "contact_person": "Rajesh Kumar",
        "email": "rajesh.kumar@pivotal-technologies.com",
        "jd": "From: Rajesh Kumar, Pivotal Technologies, Inc rajesh.kumar@pivotal-technologies.com Reply to: rajesh.kumar@pivotal-technologies.com Baltimore MD!!! LOCAL ONLY PLEASE!! Position: Full Stack Developer with JAVA/AWS/REACTLocation: Baltimore MD (Candidate must be Local to Baltimore MD)Duration: 6 months+ Interview: Video!!Minimum 9 years of experience required!!Shift: 2 days onsite every week (This is a mandatory requirement)Not H1B Please Note: If the candidate is hired, candidate will need their own device to connect via citrx. Title: Full Stack Java Developer In addition to the top skills, they need to have good communication skills since they will work directly with the business on the trading floor.- Java development (Absolute Must Have)- AWS (Absolute Must Have)-SQL (Absolute Must Have)-front end using React JS (Absolute Must Have)Candidate will be working on various tech initiatives and trading related application, which includes data migration, application enhancements using java micro services or python fast api and front end using react JS. Team is in process of creating new applications as part of decommissioning the existing applications, candidate should be good in debugging the code, understand complex workflow and async design using SQS and SNS. Candicate must be aware of gitlab ci pipeline, containerized applications, unit test cases and test coverage. Here are the technical requirements.\u2022 A solid foundation in programming, with 5+ years of professional experience.\u2022 Proficiency in Java 11+, Python with 5+ years of professional experience.\u2022 A good understanding of modern AWS architectures and corresponding technologies, such as SNS, SQS, ECS, Lambdas, Postgres, Micro Services\u2022 Hands on experience in building and deploying microservices using Java or Python.\u2022 Hands on with gitlab ci pipelines as wells as containerized applications.\u2022 Hands on experience with application architecture and design\u2022 Extensive experience with database technologies (SQL / NoSQL), can create and debug stored procedures, complex SQL queries.\u2022 Proven ability to work collaboratively with both business and technical stakeholders, demonstrating responsibility for the end-to-end delivery of high-quality solutions to complex business problems.",
        "source": "Email",
        "date_posted": "2024-10-28 16:01:20-05:00",
        "unique_id": "192d50ef2bf65fd5",
        "emp_type": [
            "contract",
            "third party"
        ],
        "tag": "Java developer"
    }
]