[
    {
        "company": "Comtech Global",
        "job_title": "Application Architect C#, .NET",
        "location": "Dauphin County, PA, USA",
        "full_location": {
            "city": "Dauphin County",
            "state": "PA",
            "country": "USA"
        },
        "job_details": {
            "employment_type": [
                "third party"
            ],
            "job_code": "",
            "experience_required": "7+ years",
            "degree_required": "Not specified",
            "visa_sponsorship": "Not specified",
            "notice_period": "Not specified",
            "duration": "Not specified",
            "rate": "Not specified"
        },
        "skills": {
            "core": [
                ".NET",
                "C#",
                "Azure",
                "JavaScript",
                "SQL"
            ],
            "primary": [
                "Webservice design & development",
                "HTML5",
                "CSS3",
                "Angular",
                "React",
                "DevOps",
                "Unit test development"
            ],
            "secondary": [
                "Digital accessibility",
                "SOAP/XML",
                "REST/JSON",
                "Authentication protocols",
                "Mentoring",
                "Technical leadership"
            ],
            "all": [
                ".NET",
                "C#",
                "Azure",
                "JavaScript",
                "SQL",
                "Webservice design & development",
                "HTML5",
                "CSS3",
                "Angular",
                "React",
                "DevOps",
                "Unit test development",
                "Digital accessibility",
                "SOAP/XML",
                "REST/JSON",
                "Authentication protocols",
                "Mentoring",
                "Technical leadership"
            ]
        },
        "job_type": [],
        "contact_person": "Pradeep Kumar",
        "email": "bpk@comtechglobal.com",
        "jd": "From: Pradeep Kumar, Comtech Global bpk@comtechglobal.com Reply to: bpk@comtechglobal.com Hi Vendor Partners,We are excited to announce a fantastic opportunity for a Application Architect .Net and C# .you will find all the details about this position and how you can join our team. We look forward to your applicationRole: - Application Architect C#, .NETLocation: Dauphin County only Locals Specific Duties: All work products would meet industry, .Net, and Azure, best practices and standards and as further defined by the Commonwealth of PA\u2019s Office of Administration \u2013 Office of Information Technology. Work will include developing digital artifacts to support communication to the development team. Documentation will include strategy and roadmaps, design plans, hosting pattern and implementation documents, system to system integration requirements using enterprise frameworks and services, implementation plans, and support plans. This position is responsible for communicating constraints including, risks, time, resources, and scope to BSM management as it impacts delivery of work products. This team lead position is responsible for mentoring all levels of applications developers in the design, development, assembly, testing, and deployment of highly complex software. The ideal candidate would have experience in cloud technologies with a focus on Azure. \u00b7Direct resources to develop, test, implement and document software solutions to meet IT and business requirements specifically in support of application development \u2022Direct resources to design and create database schemas, integrations, and service end points to be implemented in a range of databases for support of application development \u00b7Develop and participate in creating detailed project documentation, including plans, design specifications, roadmaps, models, and technical interfaces \u00b7Collaborate with other technical teams to define and support successful delivery of application services \u00b7Develop and implement data migration plans \u00b7Develop performance KPIs that meet application and business needs \u00b7Analyze and write .NET C#, JavaScript, SQL, and other full-stack technologies that are recommended to implement application solution \u00b7Deliver web services and application solutions via standard server instances and microservices architecture hosted on Azure \u00b7Design and implement configurations and analytical logging standards to support operational reporting needs for software products hosted in the cloud and on virtual servers \u00b7Support enterprise product deployment and enterprise product validation activities \u00b7Provide estimates in resource and time to support project planning and product timelines \u00b7Mentor OA-OIT team members on agency specific and industry best practices for processes and standards \u00b7Participate and provide feedback in meetings, including daily standup meetings \u00b7Develop capacity plans to implement technical solutions for project deliverables \u00b7Advise and participate in selection criteria development and candidate interviews for proposed team buildouts \u00b7Manage and direct application team tasking to complete project and work deliverables \u00b7Conduct code reviews \u00b7Research and provide mentoring resources to project team on technologies to meet project needs \u2022Ensure compliance with digital accessibility regulations and requirements by performing the following duties and responsibilities: In corporate accessibility features into digital content and resources Partner with colleagues and team members to prioritize accessibility in digital content and resources See 'Qualifications\u2019 section below for details on digital accessibility Skills and Experience: Required \u2013 7+ years Experience with object-oriented development Experience with .Net applications development. Experience with relational database development Strong oral and written communication skills Required \u2013 5+ years Experience in webservice design & development (SOAP/XML and REST/JSON) for enterprise Experience in JavaScript, HTML5, CSS3, front end JavaScript technologies such as Angular, React, etc. Experience developing web services, especially secured web services and web services with attachments Experience with unit test development, testing, and implementation in SDLC Required \u2013 5+ years Experience in deploying applications to Azure cloud Experience with various authentication protocols Experience architecting, developing, & designing web applications to meet business requirements Experience in DevOps products, specifically Azure DevOps Experience mentoring and leading technical teams Qualifications Required: Applicants are required to have these qualifications: Knowledge of digital accessibility and disability inclusionKnowledge of regulations related to digital accessibility (e.g., Section 508, ADA)Knowledge of WCAG 2.1 AA requirementsExperience developing digital products that comply with accessibility standards",
        "source": "Email",
        "date_posted": "2024-10-28 09:58:33-05:00",
        "unique_id": "192d3c2d64894bfb",
        "emp_type": [
            "third party"
        ],
        "tag": ".net developer"
    }
]