[
    {
        "company": "Vyzeinc",
        "job_title": "Senior Business Analyst",
        "location": "Memphis, TN, USA",
        "full_location": {
            "city": "Memphis",
            "state": "TN",
            "country": "USA"
        },
        "job_details": {
            "employment_type": [
                "contract",
                "third party"
            ],
            "job_code": "",
            "experience_required": "3-5 years",
            "degree_required": "Bachelor\u2019s degree in Information Systems, Engineering, or Mathematics",
            "visa_sponsorship": "Not specified",
            "notice_period": "Not specified",
            "duration": "6 months (should be extended)",
            "rate": "Not specified"
        },
        "skills": {
            "core": [
                "Business Analysis",
                "SQL",
                "Microsoft Office",
                "Agile",
                "Oracle Fusion ERP"
            ],
            "primary": [
                "Financial Management Systems",
                "Cross Team Collaboration",
                "Analytical Skills"
            ],
            "secondary": [
                "Jira",
                "Tableau",
                "Power BI",
                "Visio",
                "Programming Languages"
            ],
            "all": [
                "Business Analysis",
                "SQL",
                "Microsoft Office",
                "Agile",
                "Oracle Fusion ERP",
                "Financial Management Systems",
                "Cross Team Collaboration",
                "Analytical Skills",
                "Jira",
                "Tableau",
                "Power BI",
                "Visio",
                "Programming Languages"
            ]
        },
        "job_type": [
            "hybrid"
        ],
        "contact_person": "Jayashree Biswal",
        "email": "jbiswal@vyzeinc.com",
        "jd": "From: Jayashree Biswal, Vyzeinc jbiswal@vyzeinc.com Reply to: jbiswal@vyzeinc.com Job Title: Senior Business AnalystLocation: Memphis, TN (hybrid/3 days onsite)Duration: 6 months (should be extended, work orders are issued in six-month increments) IDEAL CANDIDATE: LOCAL TO TN , close to MemphisJob Description:Business Analyst for Oracle Cloud the business analyst will analyze business needs, document requirements, and translate them into system specifications that IT teams can implement. This role is critical to ensuring technology initiatives align with business strategies and add value by enhancing performance and productivity. Responsible for cross team collaboration.A strong work ethic, adaptability, great communication, and attention to detail will be essential for this role to be successful.Working knowledge of financial management systems as a part of ERP, including accounts payable, accounts receivable, general ledger, and cash management.Outstanding analytical skills in identifying, documenting, and analyzing business solutions.Serve as the liaison between the business and technical team members.Advanced knowledge of SQL and Microsoft Office (Excel, Word, Teams, PowerPoint).Experience working in an Agile/Scrum environment.Bachelor\u2019s degree in Information Systems, Engineering, or Mathematics with 3 \u2013 5 years in business or technical analysis.Oracle Certification(s) in financial management modules of Oracle Fusion ERP. General knowledge using tools or systems such as Oracle Fusion, Workday, Concur, Jira, Tableau, Power BI, and Visio would be a plus.Some experience with programming languages would be advantageous.",
        "source": "Email",
        "date_posted": "2024-10-28 13:34:26-05:00",
        "unique_id": "192d4887bdf4b535",
        "emp_type": [
            "contract",
            "third party"
        ],
        "tag": "Business Analyst"
    }
]