[
    {
        "company": "Tek Inspirations",
        "job_title": "Technical Product/Program Manager",
        "location": "Englewood, CO, USA",
        "full_location": {
            "city": "Englewood",
            "state": "CO",
            "country": "USA"
        },
        "job_details": {
            "employment_type": [
                "full-time",
                "third party"
            ],
            "experience_required": "5+ years",
            "degree_required": "Bachelor's Degree in Electrical Engineering, Computer Science, Telecommunications Engineering, Networking, or a similar discipline",
            "visa_sponsorship": "Not specified",
            "notice_period": "Not specified",
            "duration": "Not specified",
            "rate": "Not specified"
        },
        "skills": {
            "core": [
                "Technical Program Management",
                "WiFi Technologies",
                "Product Strategy",
                "Data Analytics",
                "Customer Experience"
            ],
            "primary": [
                "2.4GHz and 5GHz WiFi frequencies",
                "WiFi protocols (802.11a/b/g/n/ac/ax, WiFi 6/6E, and emerging WiFi 7)",
                "Wireless security standards (WPA2, WPA3)",
                "RF Fundamentals",
                "Performance monitoring tools"
            ],
            "secondary": [
                "JIRA",
                "Sharepoint",
                "MS Office",
                "Agile environment",
                "Certifications (CWNP, CWNA, CWAP, CCNA, CCNP, PMP)"
            ],
            "all": [
                "Technical Program Management",
                "WiFi Technologies",
                "Product Strategy",
                "Data Analytics",
                "Customer Experience",
                "2.4GHz and 5GHz WiFi frequencies",
                "WiFi protocols (802.11a/b/g/n/ac/ax, WiFi 6/6E, and emerging WiFi 7)",
                "Wireless security standards (WPA2, WPA3)",
                "RF Fundamentals",
                "Performance monitoring tools",
                "JIRA",
                "Sharepoint",
                "MS Office",
                "Agile environment",
                "Certifications (CWNP, CWNA, CWAP, CCNA, CCNP, PMP)"
            ]
        },
        "job_type": [
            "hybrid"
        ],
        "contact_person": "Mohit Kumar",
        "email": "kumar.mohit@tekinspirations.com",
        "jd": "From: Mohit Kumar, Tek Inspirations kumar.mohit@tekinspirations.com Reply to: kumar.mohit@tekinspirations.com Title: Technical Product/Program ManagerLocation: Englewood CO 80111Workstyle: Hybrid (4 days per week on-site, non-negotiable) Technical Program Manager Key Responsibilities:Product Strategy & Roadmap Development:Define and execute the WiFi product roadmap, focusing on next-generation WiFi standards (802.11ax, 802.11be) and emerging technologies (6 GHz WiFi, mesh networking).Conduct market research and competitive analysis to identify customer needs and emerging trends in WiFi and wireless connectivity.Partner with business stakeholders to align WiFi product strategy with the organization's broader goals, customer expectations, and technology roadmap.Technical Oversight:Oversee the technical design, testing, and implementation of WiFi products, including radios operating in the 2.4 GHz, 5 GHz, and 6 GHz bands.Collaborate with engineering teams to integrate advanced features (e.g., MU-MIMO, OFDMA, beamforming) and ensure seamless interoperability across various devices and platforms.Ensure products meet industry standards and regulatory requirements, focusing on performance, security, and reliability.Cross-Functional Program Management:Lead cross-functional teams, including Engineering, Marketing, Customer Support, and Operations, to ensure timely product launches.Create and manage project timelines, deliverables, and resources to drive projects through the product lifecycle stages (concept, design, development, testing, deployment).Act as the main point of contact between technical teams and non-technical stakeholders, translating complex technical information into clear, actionable business insights.Customer Experience & Performance Optimization:Use data analytics to monitor product performance, customer feedback, and network metrics to identify areas for improvement.Define KPIs and analyze WiFi usage data to ensure products meet performance standards and deliver a best-in-class customer experience.Manage troubleshooting, customer support, and continuous improvement processes to maintain high product quality.Vendor & Partner Management:Collaborate with vendors and technology partners to integrate new features, hardware components, and software updates.Oversee third-party partnerships, ensuring all integrations and developments align with Charter\u2019s quality and performance standards.Qualifications :Bachelor's Degree in Electrical Engineering, Computer Science, Telecommunications Engineering, Networking, or a similar discipline5+ years as a technical program manager or product manager within telecommunications, WiFi technologies, or network servicesExtensive knowledge of 2.4GHz and 5GHz WiFi frequenciesHands-on experience with WiFi protocols (802.11a/b/g/n/ac/ax, WiFi 6/6E, and emerging WiFi 7), radio frequencies, and wireless security standards (WPA2, WPA3).Deep understanding of RF Fundamentals, WiFi standards, and wireless networking technologiesFamiliarity with data analytics, performance monitoring tools, and customer experience metricsProficiency in JIRA, Sharepoint, and MS Office Excellent Communication skills and the ability to explain technical information to a non-technical audienceMust be able to fluently read, write, and speak in EnglishExperience in an Agile environment is desiredCertifications such as a CWNP, CWNA, CWAP, CCNA, CCNP, and/or PMP are desired.",
        "source": "Email",
        "date_posted": "2024-10-28 08:26:00-05:00",
        "unique_id": "192d36e4b7087b47",
        "emp_type": [
            "full-time",
            "third party"
        ],
        "tag": "Project Manager"
    }
]