[
    {
        "company": "Tek Inspirations LLC",
        "job_title": "PMP Certified Project Manager",
        "location": "Richmond, VA, USA",
        "full_location": {
            "city": "Richmond",
            "state": "VA",
            "country": "USA"
        },
        "job_details": {
            "employment_type": [
                "contract",
                "third party"
            ],
            "job_code": "",
            "experience_required": "10 years",
            "degree_required": "Bachelor's degree",
            "visa_sponsorship": "Not specified",
            "notice_period": "Not specified",
            "duration": "6+ Month Contract",
            "rate": "Not specified"
        },
        "skills": {
            "core": [
                "PMP certification",
                "Project Management",
                "Cloud hosted SaaS implementation",
                "Agile project management",
                "Waterfall project management"
            ],
            "primary": [
                "Microsoft Project",
                "Visio",
                "Office",
                "Analytical skills",
                "Organizational skills",
                "Decision-making skills",
                "Interpersonal skills",
                "Communication skills"
            ],
            "secondary": [
                "Process engineering",
                "Re-engineering techniques",
                "VITA\u2019s Commonwealth Technology Portfolio (CTP)",
                "Project Management Office methodologies",
                "Commonwealth IT procurement processes"
            ],
            "all": [
                "PMP certification",
                "Project Management",
                "Cloud hosted SaaS implementation",
                "Agile project management",
                "Waterfall project management",
                "Microsoft Project",
                "Visio",
                "Office",
                "Analytical skills",
                "Organizational skills",
                "Decision-making skills",
                "Interpersonal skills",
                "Communication skills",
                "Process engineering",
                "Re-engineering techniques",
                "VITA\u2019s Commonwealth Technology Portfolio (CTP)",
                "Project Management Office methodologies",
                "Commonwealth IT procurement processes"
            ]
        },
        "job_type": [
            "hybrid"
        ],
        "contact_person": "Muskan Yadav",
        "email": "muskan.yadav@tekinspirations.com",
        "jd": "Urgent Hiring-PMP Certified Project Manager( Fast moving)Duration: 6+ Month ContractLocation: Richmond, VA (hybrid onsite: onsite 2-3day/week) ( Must be local Candidate)Visa: USC/GC/GC-EAD/H4-EADMOI: Phone then video Local Richmond, VA candidates Only *Candidate MUST possess PMP certification through PMI. No other certifications qualify.Job Description \u2013 RESPONSIBILITIES:Coordinate vendors and consultants, and VDOT IT and business staff as assigned, in the execution of IT projects and related procurements.Coordinate and oversee the development of proposals, statement of work, statement of requirements and RFP responses.Assist in team development while holding teams accountable for their commitments and removing roadblocks to their work.Facilitate multi-disciplinary teams in the development of plans, goals, objectives, policies, and procedures for completion of a project.Oversee and manage execution and/or coordination of day-to-day project activities as required.Manage working relationships with key stakeholders, including executive management, business management, vendors, project sponsors, suppliers, and technology management.Set project goals that are consistent with technical objectives and the agency\u2019s overall technology strategy.Track and communicate a project's progress from a schedule, cost, and risk perspective to the project team, customers, and project stakeholders.Collaborate with technology leads and solution architects to incorporate agency best practices into project plans.Drive consistent project delivery through the entire project lifecycle, including, execution of procurements, definition of project plans, resource allocation, management of project risks, scope, and schedule, delivery of value, and well-ordered transitions to operations.Monitor progress by third-party vendors and define and measure their progress with metrics.Develop and maintain project budget, plans, task lists, schedules, risks, and status, to include resource allocation and schedules.Adhere to VDOT and VITA project management practices and governance requirements.Exhibit significant emotional quotient (EQ) in handling project challenges and maintain a positive project culture in line with VDOT\u2019s mission and shared values.Additional responsibilities as assigned. Knowledge Skills & Abilities-Strong experience in developing, executing, and managing cloud hosted SaaS implementation projects.Strong experience leading the business and IT resources through the discovery and documentation of business and technical requirements in request for proposal and statement of requirement formats.Strong analytical, organizational, and decision-making skills.Exceptional interpersonal skills for collaborating and team building.Exceptional verbal and written communication skills with the demonstrated ability to simplify and briefly, succinctly communicate complex issues to multiple audiences.Ability to lead others to implement new approaches, systems, structures, and methods.Ability to define and balance the competing demands for quality, scope, schedule, and cost.Communicate timelines and expectations to technical and business staff.Ability to analyze and document system processes.Solid understanding of software development lifecycle models.Exceptional knowledge of both Agile and Waterfall project management principles and practices. In addition, the ability to blend them together in the right proportions to fit a particular project and business environment.Knowledge of process engineering and re-engineering techniques and practices. Qualification-\u2022 The candidate must have a minimum of 10 years of experience managing large projects and a bachelor's degree.\u2022 Fluency in Project Management tools such as Microsoft Project, Visio, and Office required.\u2022 PMP Certification through PMI\u2022 Experience with VITA\u2019s Commonwealth Technology Portfolio (CTP) system and ECOS process is strongly preferred.\u2022 Experience with Project Management Office methodologies and practices is strongly preferred.\u2022 Experience with the core Commonwealth IT procurement processes (RFP, VITA Statewide Contract, and CAI SOW) is preferred.",
        "source": "Email",
        "date_posted": "2024-10-28 11:15:02-05:00",
        "unique_id": "192d408d834f7a4c",
        "emp_type": [
            "contract",
            "third party"
        ],
        "tag": "Project Manager"
    }
]