[
    {
        "company": "Pivotal Technologies, Inc",
        "job_title": "Java Developer with ACTONE_ RCM Experience",
        "location": "San Antonio, TX, USA",
        "full_location": {
            "city": "San Antonio",
            "state": "TX",
            "country": "USA"
        },
        "job_details": {
            "employment_type": [
                "third party"
            ],
            "experience_required": "5+ years",
            "degree_required": "Not specified",
            "visa_sponsorship": "Must have existing work authorization",
            "notice_period": "Not specified",
            "duration": "Not specified",
            "rate": "Not specified"
        },
        "skills": {
            "core": [
                "Actimize AIS",
                "ACTONE/RCM",
                "Java"
            ],
            "primary": [
                "SQL Scripting"
            ],
            "secondary": [
                "Java custom plugin",
                "javascript",
                "XSL customizations in ACTONE",
                "Actimize Modeler & Monitor",
                "RCM/ACTONE Designer",
                "Spring",
                "Spring Boot",
                "Actimize schemas RCM",
                "UDM",
                "APP",
                "RCM Webservices",
                "generic installer",
                "custom development",
                "product support in Actimize"
            ],
            "all": [
                "Actimize AIS",
                "ACTONE/RCM",
                "Java",
                "SQL Scripting",
                "Java custom plugin",
                "javascript",
                "XSL customizations in ACTONE",
                "Actimize Modeler & Monitor",
                "RCM/ACTONE Designer",
                "Spring",
                "Spring Boot",
                "Actimize schemas RCM",
                "UDM",
                "APP",
                "RCM Webservices",
                "generic installer",
                "custom development",
                "product support in Actimize"
            ]
        },
        "job_type": [],
        "contact_person": "Rajesh Kumar",
        "email": "rajesh.kumar@pivotal-technologies.com",
        "jd": "From: Rajesh Kumar, Pivotal Technologies, Inc rajesh.kumar@pivotal-technologies.com Reply to: rajesh.kumar@pivotal-technologies.com Work Location (with City, State & Zip Code)Must be in San Antonio/Need DL TXVISAUSCJob Title/RoleACTONE/RCM, Java DeveloperExperience level required (Years)5+ years of experienceMandatory required skillsActimize AIS, ACTONE/RCM, JavaPreferred/Desired skillsSQL ScriptingPlease share the Detailed Job DescriptionMandatory skills ACTONEMinimum 3+ years of demonstrable development experience in Actimize (Java custom plugin, javascript, XSL customizations in ACTONE).Implementation and development experience in Actimize Modeler & Monitor and RCM/ACTONE DesignerAt least 2+ years in Java (using spring or spring boot preferable).Good in SQL candidate must demonstrate good skills in writing SQL scripts, good understanding on Actimize schemas RCM, UDM and APPExperience in at least one domain of Fraud, AML, Bank is desired.Optional skills:Experience with RCM Webservices, generic installer, custom development, and product support in Actimize.",
        "source": "Email",
        "date_posted": "2024-10-28 12:01:30-05:00",
        "unique_id": "192d4336328b699c",
        "emp_type": [
            "third party"
        ],
        "tag": "Java developer"
    }
]