[
    {
        "company": "Hanstaffing",
        "job_title": "Pega CSSA developer",
        "location": "NJ, USA",
        "full_location": {
            "city": "",
            "state": "NJ",
            "country": "USA"
        },
        "job_details": {
            "employment_type": [
                "third party"
            ],
            "experience_required": "Not specified",
            "degree_required": "Not specified",
            "visa_sponsorship": "Not specified",
            "notice_period": "Not specified",
            "duration": "Not specified",
            "rate": "Not specified"
        },
        "skills": {
            "core": [
                "CSSA Certification",
                "Pega Smart Dispute framework",
                "Activities",
                "Flows",
                "UIs rules",
                "Harness",
                "Sections",
                "Portals",
                "Local Action",
                "Flow Action",
                "Data Transform",
                "Correspondence",
                "Rule Inspector",
                "properties types",
                "validation rules",
                "decision rules",
                "Pega OOTB integration",
                "Pega construction and debugging tools",
                "Pega flows"
            ],
            "primary": [
                "Pega 8.x",
                "Good Communication Skills"
            ],
            "secondary": [],
            "all": [
                "CSSA Certification",
                "Pega Smart Dispute framework",
                "Activities",
                "Flows",
                "UIs rules",
                "Harness",
                "Sections",
                "Portals",
                "Local Action",
                "Flow Action",
                "Data Transform",
                "Correspondence",
                "Rule Inspector",
                "properties types",
                "validation rules",
                "decision rules",
                "Pega OOTB integration",
                "Pega construction and debugging tools",
                "Pega flows",
                "PPRC properties",
                "decision types",
                "tracer utility",
                "clipboard",
                "app accelerators",
                "documentation tools",
                "expression builders",
                "form builders",
                "Good Communication Skills"
            ]
        },
        "job_type": [
            "hybrid"
        ],
        "contact_person": "Lisa",
        "email": "lisaminent@hanstaffing.com",
        "jd": "From: Lisa, Hanstaffing lisaminent@hanstaffing.com Reply to: lisaminent@hanstaffing.com Pega CSSA developer (Smart Dispute)NJ - HybridMust have: CSSA Certification\u00d8 Must have relevant project experience implementing the Pega Smart Dispute framework.\u00d8 Should have working knowledge on Activities, Flows (Screen Flow, Tab Flow, Adding decision, sub flows & integration to Flow ), UIs rules, Harness, Sections, Portals, Local Action, Flow Action, Data Transform, Correspondence, Rule Inspector, properties types, validation rules\u00d8 Must have knowledge on decision and declarative rules.\u00d8 Must have working knowledge on at least one or two Pega OOTB integration (SOAP, MQ, SQL, File etc.)\u00d8 Good understanding PPRC properties, types and relevance, Understand the decision types and decision rules in Pega.\u00d8 Possesses good knowledge on Pega construction and debugging tools such as tracer utility, clipboard, app accelerators, documentation tools, expression builders and form builders.\u00d8 Sound understanding of user interface both Pega out of the box and generic.\u00d8 Good understating of Pega flows, interpretation of flow shapes, SLAs, tickets, interpretation of complex flow shapes for business scenarios, activities, activity step methods, OOTB activities\u00d8 Experience or knowledge in Pega 8.x is preferable.\u00d8 Should have Good Communication Skills.",
        "source": "Email",
        "date_posted": "2024-10-28 14:58:16-05:00",
        "unique_id": "192d4dd6d5f974d9",
        "emp_type": [
            "third party"
        ],
        "tag": "PEGA Developer"
    }
]