[
    {
        "company": "TCS",
        "job_title": "Pega Business Analyst Lead",
        "location": "Groton, CT, USA",
        "full_location": {
            "city": "Groton",
            "state": "CT",
            "country": "USA"
        },
        "job_details": {
            "employment_type": [
                "third party"
            ],
            "experience_required": "5+ years",
            "degree_required": "Degree or equivalent in Business, Information Systems, or Computer Science",
            "visa_sponsorship": "Not specified",
            "notice_period": "Not specified",
            "duration": "Not specified",
            "rate": "Not specified"
        },
        "skills": {
            "core": [
                "Pega Business Architect",
                "business analysis",
                "Agile",
                "Scrum",
                "communication"
            ],
            "primary": [
                "problem solving",
                "analytical skills",
                "business processes",
                "technical specifications",
                "interpersonal skills"
            ],
            "secondary": [
                "system development life cycle"
            ],
            "all": [
                "Pega Business Architect",
                "business analysis",
                "Agile",
                "Scrum",
                "communication",
                "problem solving",
                "analytical skills",
                "business processes",
                "technical specifications",
                "interpersonal skills",
                "system development life cycle"
            ]
        },
        "job_type": [],
        "contact_person": "Harish",
        "email": "harishprathap.m@kksoftwareassociates.com",
        "jd": "From: Harish, KKSOFT harishprathap.m@kksoftwareassociates.com Reply to: harishprathap.m@kksoftwareassociates.com Pega Business Analyst Lead TCS - Hartford, CTGROTONGroton, CTCertified Pega Business Architect5+ years of business analysis experienceDegree or equivalent in Business, Information Systems, or Computer ScienceExtensive experience with Agile/Scrum requiredExcellent written and verbal communication skillsAbility to understand business processes and translate into technical specificationsSolid problem solving and analytical skillsAbility to work effectively with people at all levels of the organizationClient\u2010focused approach with outstanding interpersonal skillsWorking knowledge of system development life cycle concepts",
        "source": "Email",
        "date_posted": "2024-10-28 11:28:10-05:00",
        "unique_id": "192d44e1db971967",
        "emp_type": [
            "third party"
        ],
        "tag": "Business Analyst"
    }
]