[
    {
        "company": "TechRakers",
        "job_title": "Python Test Architect",
        "location": "USA",
        "full_location": {
            "city": "",
            "state": "",
            "country": "USA"
        },
        "job_details": {
            "employment_type": [
                "third party"
            ],
            "job_code": "",
            "experience_required": "7+ years",
            "degree_required": "Bachelor's or Master's degree in Computer Science, Information Technology, or a related field.",
            "visa_sponsorship": "Not specified",
            "notice_period": "Not specified",
            "duration": "Not specified",
            "rate": "Not specified"
        },
        "skills": {
            "core": [
                "Python",
                "AWS",
                "Azure",
                "Google Cloud",
                "Docker",
                "Kafka",
                "MongoDB",
                "Terraform",
                "CloudFormation",
                "Ansible",
                "Apache Airflow",
                "Jenkins"
            ],
            "primary": [
                "PySpark",
                "PyTest",
                "CI/CD",
                "Hadoop",
                "Spark",
                "Kubernetes"
            ],
            "secondary": [
                "Bash",
                "Java",
                "Data Security",
                "Data Privacy",
                "Compliance",
                "Problem-solving",
                "Communication"
            ],
            "all": [
                "Python",
                "AWS",
                "Azure",
                "Google Cloud",
                "Docker",
                "Kafka",
                "MongoDB",
                "Terraform",
                "CloudFormation",
                "Ansible",
                "Apache Airflow",
                "Jenkins",
                "PySpark",
                "PyTest",
                "CI/CD",
                "Hadoop",
                "Spark",
                "Kubernetes",
                "Bash",
                "Java",
                "Data Security",
                "Data Privacy",
                "Compliance",
                "Problem-solving",
                "Communication"
            ]
        },
        "job_type": [],
        "contact_person": "Zara",
        "email": "zararaza@techrakers.com",
        "jd": "From: Zara, TechRakers zararaza@techrakers.com Reply to: zararaza@techrakers.com Python Test Architect Key Responsibilities:Design, build, and maintain scalable cloud data architectures and automated solutions that support data ingestion, processing, and storage.Develop automation frameworks and tools for deploying and managing cloud infrastructure and data services.Collaborate with data engineers, DevOps teams, and data scientists to implement end-to-end data pipelines and workflows.Ensure automation of data quality, security, and governance processes, enabling seamless integration across cloud environments.Drive the implementation of cloud best practices, including monitoring, disaster recovery, security, and cost optimization.Lead efforts in automating testing, deployment, and monitoring of data infrastructure.Evaluate and recommend tools and technologies to improve automation processes for cloud data platforms.Provide technical leadership, mentoring, and knowledge sharing within the team.Qualifications:Bachelor's or Master's degree in Computer Science, Information Technology, or a related field.7+ years of experience in data architecture, cloud infrastructure, and automation.Hands-on experience with cloud platforms like AWS, Azure, or Google Cloud, with deep expertise in services such as AWS Lambda, S3, RDS, EMR, Azure Data Factory, Databricks, etc.Hands-on experience in Python, PySpark, PyTest, DockerStrong knowledge in Kafka and MongoDBStrong knowledge of infrastructure-as-code (IaC) tools such as Terraform, CloudFormation, or Ansible.Proven expertise in automating data pipelines using tools like Apache Airflow, Jenkins, or similar CI/CD tools.Proficiency in scripting and programming languages (e.g., Python, Bash, Java).Experience with big data technologies such as Hadoop, Spark, or Kafka.Strong knowledge of DevOps methodologies and containerization tools (e.g., Docker, Kubernetes).Deep understanding of data security, privacy, and compliance in cloud environments.Excellent problem-solving and communication skills.",
        "source": "Email",
        "date_posted": "2024-10-28 08:59:11-05:00",
        "unique_id": "192d38c7bcb969c8",
        "emp_type": [
            "third party"
        ],
        "tag": "AWS Data Engineer"
    }
]