[
    {
        "company": "Smart Source Technologies",
        "job_title": "Web Applications Developer",
        "location": "Tallahassee, FL, USA",
        "full_location": {
            "city": "Tallahassee",
            "state": "FL",
            "country": "USA"
        },
        "job_details": {
            "employment_type": [
                "contract",
                "third party"
            ],
            "job_code": "",
            "experience_required": "2+ years",
            "degree_required": "Not specified",
            "visa_sponsorship": "Must have existing work authorization",
            "notice_period": "Not specified",
            "duration": "6 months with possible extension(s)",
            "rate": "Not specified"
        },
        "skills": {
            "core": [
                "ASP.NET",
                "Angular",
                "React",
                "SQL Server",
                "Oracle"
            ],
            "primary": [
                "ETL",
                "Data Warehousing",
                "Operational Data Stores",
                "Data Lakes",
                "Master Data Management"
            ],
            "secondary": [
                "Javascript UI libraries",
                "Azure",
                "Agile best practices",
                "SCRUM Framework",
                "financial systems",
                "ERP"
            ],
            "all": [
                "ASP.NET",
                "Angular",
                "React",
                "SQL Server",
                "Oracle",
                "ETL",
                "Data Warehousing",
                "Operational Data Stores",
                "Data Lakes",
                "Master Data Management",
                "Javascript UI libraries",
                "Azure",
                "Agile best practices",
                "SCRUM Framework",
                "financial systems",
                "ERP"
            ]
        },
        "job_type": [
            "onsite",
            "remote"
        ],
        "contact_person": "Salil",
        "email": "salil.s@smartsourcetec.com",
        "jd": "From: Salil, Smart Source Technologies salil.s@smartsourcetec.com Reply to: salil.s@smartsourcetec.com Title: Web Applications Developer (remote option)Work authorization: any (candidate must be authorized to work in US)Must-have skills: 2+ y ASP.NET; Angular or React; SQL Server or Oracle; ETL, Data Warehousing, Operational Data Stores, Data Lakes, and Master Data ManagementLocation: Tallahassee, FLPLEASE SEND LOCAL CANDIDATES ONLY (registered and currently located in Tallahassee, FL).Candidates from other locations won\u2019t be considered. Relocation is not acceptableEstimated Duration: 6 months with possible extension\u200b(s)Additional information: The candidate should be able to provide an ID if the interview is requested. The candidate interviewing must be the same individual who will be assigned to work with our client. Requirements:\u2022 Availability to work 3 days per week at the Client\u2019s site in Tallahassee, FL (required);\u2022 Experience in ASP.NET, Javascript UI libraries such as Angular and React, Backend databases such as SQL Server and Oracle, and on-premises and cloud based (Azure) platforms (2+ years);\u2022 Experience in software development and agile best practices.Preferred:\u2022 Experience in various development platforms and full stack development;\u2022 Experience in the SCRUM Framework;\u2022 Experience in the financial systems such as an ERP;\u2022 Experience with data management concepts such as ETL, Data Warehousing, Operational Data Stores, Data Lakes, and Master Data Management.",
        "source": "Email",
        "date_posted": "2024-10-28 10:39:34-05:00",
        "unique_id": "192d3e92840da508",
        "emp_type": [
            "contract",
            "third party"
        ],
        "tag": ".net developer"
    }
]