[
    {
        "company": "KK Software Associates",
        "job_title": "Project Management with Data Quality management (DQM) & Data Governance",
        "location": "Raleigh, NC, USA",
        "full_location": {
            "city": "Raleigh",
            "state": "NC",
            "country": "USA"
        },
        "job_details": {
            "employment_type": [
                "third party"
            ],
            "job_code": "",
            "experience_required": "Not specified",
            "degree_required": "Not specified",
            "visa_sponsorship": "No visa sponsorship",
            "notice_period": "Not specified",
            "duration": "Not specified",
            "rate": "Not specified"
        },
        "skills": {
            "core": [
                "Data Governance",
                "Data Quality",
                "Data Management",
                "MS Excel",
                "SQL"
            ],
            "primary": [
                "Data Analytical Tools",
                "Data Visualization Tools",
                "Data Quality Rules",
                "Data Quality Scorecards",
                "Project Management"
            ],
            "secondary": [
                "Access",
                "Spotfire",
                "Qlikview",
                "Tableau",
                "PowerBI",
                "BSA Regulation",
                "Bank Operations",
                "Financial Services"
            ],
            "all": [
                "Data Governance",
                "Data Quality",
                "Data Management",
                "MS Excel",
                "SQL",
                "Data Analytical Tools",
                "Data Visualization Tools",
                "Data Quality Rules",
                "Data Quality Scorecards",
                "Project Management",
                "Access",
                "Spotfire",
                "Qlikview",
                "Tableau",
                "PowerBI",
                "BSA Regulation",
                "Bank Operations",
                "Financial Services"
            ]
        },
        "job_type": [],
        "contact_person": "Venkat",
        "email": "venkat@kksoftwareassociates.com",
        "jd": "From: Venkat, KK Software Associates venkat@kksoftwareassociates.com Reply to: venkat@kksoftwareassociates.com We are hiring Project Management with Data Quality management (DQM) & Data Governance for one of my Client in Location: Raleigh, NC interesting candidates please send resumes to venkat@kksoftwareassociates.com (614) 335-4419 Position: Project Management with Data Quality management (DQM) & Data GovernanceLocation: Raleigh, NCVisa status: : Strictly Don\u2019t share F1, OPT, OPT EAD, L2 EAD and H4 EAD work permit Strong Knowledge of Data Governance, Data Quality and Data Management principles and conceptsExpert at analyzing and modeling data using MS Excel, Access, SQL, and/or other data analytical and visualization tools (Spotfire, Qlikview, Tableau, PowerBI).Skilled at turning business data requirements into robust data quality rules.Adept at developing robust data quality scorecards for senior management.Ability to manage projects, partner, and collaborate with cross functional stakeholders.Ability to assist and support detailed analysis and propose decisions.Understanding of data warehousing and transformation methods, lineage documentation, and ETL processes.Subject matter knowledge of BSA regulation, bank operations/systems and/or financial services",
        "source": "Email",
        "date_posted": "2024-10-28 13:28:18-05:00",
        "unique_id": "192d482ddf1f9a1d",
        "emp_type": [
            "third party"
        ],
        "tag": "Project Manager"
    }
]