[
    {
        "company": "KPG99 .INC",
        "job_title": "Java Developer",
        "location": "Phoenix, AZ, USA",
        "full_location": {
            "city": "Phoenix",
            "state": "AZ",
            "country": "USA"
        },
        "job_details": {
            "employment_type": [
                "contract",
                "third party"
            ],
            "job_code": "",
            "experience_required": "3-5 years",
            "degree_required": "Bachelor's degree in Computer Science, Computer Engineering, Technology, Information Systems (CIS/MIS), Engineering or related technical discipline, or equivalent experience/training",
            "visa_sponsorship": "Not specified",
            "notice_period": "Not specified",
            "duration": "12+ months contract",
            "rate": "Not specified"
        },
        "skills": {
            "core": [
                "Java",
                "Angular",
                "Javascript",
                "HTML",
                "CSS"
            ],
            "primary": [
                "Cloud development"
            ],
            "secondary": [],
            "all": [
                "Java",
                "Angular",
                "Javascript",
                "HTML",
                "CSS",
                "Cloud development"
            ]
        },
        "job_type": [
            "hybrid"
        ],
        "contact_person": "Manmeet Singh",
        "email": "manmeet@kpgtech.com",
        "jd": "From: Manmeet Singh, kpg99 manmeet@kpgtech.com Reply to: manmeet@kpgtech.com Hello, Job Title: Java Developer Job Location: Hybird Phoenix AZ Duration: 12+ months contract Visa: Any Visa Interview Process: First Round Virtual Second Round Onsite F2F interview Job Description ONLY CONSIDER US EXPERIENCE What you'll do \u2022 Collaborates with leaders, IT architects, technical leads and other developers, along with internal customers, to understand requirements and develop needs according to business requirements \u2022 Maintains and enhances existing enterprise services, applications, and platforms using domain driven design and test-driven development \u2022 Troubleshoots and debugs complex issues; identify and implement solutions \u2022 Creates detailed project specifications, requirements, and estimates \u2022 Research and implement new technologies to enhance current processes, security, and performance \u2022 Support the development of coding standards and adheres to best practices and security guidelines \u2022 Work closely with software architects and technical leads to ensure decisions meet long-term enterprise growth needs Qualifications: \u2022 Minimum Qualifications- Education & Prior Job Experience \u2022 Bachelor's degree in Computer Science, Computer Engineering, Technology, Information Systems (CIS/MIS), Engineering or related technical discipline, or equivalent experience/training \u2022 3-5 years of full Software Development Life Cycle (SDLC) experience designing, developing, and implementing large-scale applications in hosted production environments \u2022 Proficient in Java, Angular, Javascript, HTML, CSS \u2022 Cloud development experience a plus Thanks and Regards, Manmeet Singh Technical Recruiter | KPG99 .INC",
        "source": "Email",
        "date_posted": "2024-10-28 12:22:55-05:00",
        "unique_id": "192d447009f9e8b6",
        "emp_type": [
            "contract",
            "third party"
        ],
        "tag": "Java developer"
    }
]